id,name,published,outlet,title,authors,category,market,categoryorder,articleorder,url,description,text,image,error,sentiment,firstEyes
,Maine,2025-07-21 16:12:24+00:00,The Sabetha Herald,Governors demand Trump administration release withheld education funding - The Sabetha Herald,,,,,,https://www.sabethaherald.com/2025/07/21/governors-demand-trump-administration-release-withheld-education-funding/,Submitted Governor Laura Kelly joined a coalition of 17 governors in sending a letter to United States Secretary of Education Linda McMahon demanding the immediate release of approximately $6.8 billion...,,https://www.sabethaherald.com/wp-content/uploads/2019/06/News-5-600x350.jpg,,,2025-07-21 13:56:46.480593
,Alabama,2025-07-21 16:10:46+00:00,https://www.wibw.com,Judd Davis,,,,,,https://www.wibw.com/authors/judd-davis/,Judd Davis started at WSFA 12 News in June 2004. He anchors Today in Alabama. ,,https://gray-wibw-prod.gtv-cdn.com/resizer/v2/https%3A%2F%2Fs3.amazonaws.com%2Farc-authors%2Fgray%2F9f596694-169e-4497-832b-efdc94a5a40f.png?auth=fa46cb2de8f7375441dbc601fa421d908c8a44b26237000306b6fefcc6e7f895&width=1200&height=600&smart=true,,,2025-07-21 15:44:55.248005
,California,2025-07-21 15:49:09+00:00,GV Wire,How Will KVPR and Valley PBS Deal With Loss of Federal Funding?,,,,,,https://gvwire.com/2025/07/21/how-will-kvpr-and-valley-pbs-deal-with-loss-of-federal-funding/,"The U.S. House approved cuts impacting KVPR, leading to a $175,000 shortfall. Learn about the implications for local stations.",,https://static.gvwire.com/wp-content/uploads/2025/07/18115958/KVPR-Valley-PBS-and-money-cuts_1280X720.jpg,,,2025-07-21 12:57:06.800244
,Education Funding,2025-07-21 15:44:58+00:00,CT Mirror,Trump White House to release some after-school money,,,,,,https://ctmirror.org/2025/07/21/trump-white-house-to-release-some-after-school-money/,Federal funds for before- and after-school programs that were frozen for weeks will start flowing to states.,,https://ctmirror.org/wp-content/uploads/2025/03/IMG_4511-scaled.jpg,,,2025-07-21 11:56:49.843717
,Education Funding,2025-07-21 15:16:26+00:00,Yahoo News,NC fights to secure $165M in education funding amidst federal review,,,,,,https://www.yahoo.com/news/nc-fights-secure-165m-education-144859193.html,North Carolina is involved in a legal battle to secure $165 million in education funding that is currently frozen as part of a federal review.,,https://media.zenfs.com/en/wsoc_cox_articles_386/cc290c9653950e95e8b06628369aee1b,,,2025-07-21 11:56:49.843717
,Education Funding,2025-07-21 14:37:17+00:00,JC Post,Federal Funding Impact on USD 475,,,,,,https://jcpost.com/posts/9474d9e9-3025-4371-adec-b4bf2706e91e,"By Matt HooverUSD 475 Communications Coordinator&nbsp;JUNCTION CITY, Kan.&nbsp;– Geary County Schools USD 475 was recently informed by the K",,https://media.eaglewebservices.com/public/2022/2/1645750351762.png,,,2025-07-21 10:57:45.117306
,Oklahoma,2025-07-21 14:13:16+00:00,"Oklahoma City Free Press | Oklahoma City's locally owned, fiercely independent news source",Oklahoma Education Dept keeps staff resignations secret,,,,,,https://freepressokc.com/oklahoma-education-dept-keeps-staff-resignations-secret/,Oklahoma’s Education Dept. under Ryan Walters won’t release staff resignation letters after top officials exit. Experts say it may violate open records law.,,https://freepressokc.com/wp-content/uploads/2023/09/Oliver-Hodge-Bldg-at-Okla-Capitol-2023-2.jpg,,,2025-07-21 10:57:45.117306
,Education Funding,2025-07-21 14:03:35+00:00,www.newsfromthestates.com,Mississippi schools face $68M Trump federal funding freeze just days before classes start,,,,,,https://www.newsfromthestates.com/article/mississippi-schools-face-68m-trump-federal-funding-freeze-just-days-classes-start,The state education department hosted a virtual meeting about the funding two weeks ago for Mississippi school superintendents and federal programming ...,,,,,2025-07-21 10:57:45.117306
,Education Funding,2025-07-21 14:00:58+00:00,www.wsj.com,New Federal Tax Credit Boosts School Choice—but Blue States Face Big Decision - WSJ,,,,,,https://www.wsj.com/us-news/education/school-choice-tax-credit-private-tuition-democrats-31bf9710,Now comes a protracted debate at the state level. Progressives and public-school groups object to funding private schools and say the new program will ...,,,,,2025-07-21 10:57:45.117306
,Education Funding,2025-07-21 13:41:29+00:00,www.edchoice.org,Introducing the Fiscal Factbook: Understanding K–12 Education Spending - EdChoice,,,,,,https://www.edchoice.org/2025-introducing-the-fiscal-factbook-understanding-k12-education-spending/,"Because vouchers, ESAs, and tax-credit scholarships typically use only a portion of state education funding, and leave local and federal dollars ...",,,,,2025-07-21 12:57:06.800244
,Education Funding,2025-07-21 13:38:39+00:00,Tampa Bay Times,Trump administration set to release frozen after-school funds,,,,,,https://www.tampabay.com/news/education/2025/07/21/trump-administration-set-release-frozen-after-school-funds/,A roundup of Florida education news from around the state,,https://www.tampabay.com/resizer/v2/ZQGARTFEYFAERE4WZGXYAISXP4.jpg?auth=7f72bf4508e6d918588c39747d1a10c532fa97f6ef2627125c16e11fdac5b37a&height=675&width=1200&smart=true,,,2025-07-21 10:57:45.117306
,Education Funding,2025-07-21 13:32:34+00:00,Valley News,Vermont Agency of Education announces hiring freeze amid federal funding pause,,,,,,https://www.vnews.com/Vermont-Agency-of-Education-announces-hiring-freeze-amid-federal-funding-pause-62457518,"The Vermont Agency of Education announced Thursday it was implementing a temporary hiring freeze, citing difficulties created by the Trump administration’s recent federal funding pause.",,https://www.vnews.com/static/images/VN/square-big-logo.png,,,2025-07-21 10:57:45.117306
,Education Funding,2025-07-21 13:24:43+00:00,www.axios.com,"New federal vouchers could be ""stacked"" onto Arizona school choice programs - Axios",,,,,,https://www.axios.com/local/phoenix/2025/07/21/federal-voucher-arizona-school-choice,New federal voucher law could add to Arizona school choice programs · Those organizations use the money to award scholarships for expenses like private ...,,,,,2025-07-21 10:57:45.117306
,Kentucky,2025-07-21 12:37:28+00:00,Richmond Register,"KET, public radio stations slammed by end of federal funding",,,,,,https://www.richmondregister.com/kentucky/ket-public-radio-stations-slammed-by-end-of-federal-funding/article_76e6e91c-695c-54fd-afdd-cfafa3dbf525.html,"Cuts to public broadcasting that cleared Congress early Friday morning will cost KET funding for most of its original programming and a fourth of its workforce, said the head of",,https://bloximages.chicago2.vip.townnews.com/richmondregister.com/content/tncms/custom/image/1a0e233c-2e14-11e9-a163-a3b96a3467d3.jpg?resize=600%2C315,,,2025-07-21 10:57:45.117306
,Education Funding,2025-07-21 12:33:34+00:00,FOX 5 Atlanta,Federal funds restored for Georgia after-school programs,,,,,,https://www.fox5atlanta.com/news/federal-funds-restored-georgia-after-school-programs,The U.S. Department of Education is expected to release long-awaited federal funding for the 21st Century Community Learning Centers program.,,https://images.foxtv.com/static.fox5atlanta.com/www.fox5atlanta.com/content/uploads/2020/06/1280/720/SCHOOLS.jpg?ve=1&tl=1,,,2025-07-21 10:57:45.117306
,Arizona,2025-07-21 12:14:03+00:00,KTAR.com,Phoenix vice mayor takes new position to boost school equity,,,,,,https://ktar.com/arizona-education/phoenix-vice-mayor-equity/5729775/,Phoenix Vice Mayor Ann O'Brien is passionate about school equity. That's why she recently took on a new position with WestEd.,,https://ktar.com/wp-content/uploads/2025/07/WestEd-Ann-Obrien-Phoenix-vice-mayor-image.jpg,,,2025-07-21 11:56:49.843717
,Education Funding,2025-07-21 12:11:35+00:00,WVTF,Roanoke schools navigate federal funding freeze,,,,,,https://www.wvtf.org/news/2025-07-21/roanoke-schools-navigate-federal-funding-freeze,The Trump administration has frozen $6 billion in Department of Education funding that affects a wide swath of programs. Roanoke's public school system will be especially hard hit because of its high rates of economically disadvantaged students and English learners.,,https://npr.brightspotcdn.com/dims4/default/42f9f4f/2147483647/strip/true/crop/4032x2117+0+454/resize/1200x630!/quality/90/?url=http%3A%2F%2Fnpr-brightspot.s3.amazonaws.com%2Flegacy%2Fsites%2Fwvtf%2Ffiles%2F202107%2Fschool_buses_hopewell.jpeg,,,2025-07-21 10:57:45.117306
,New York City,2025-07-21 11:35:53+00:00,The Hill,The exodus from New York City will only get worse under Mamdani,,,,,,https://thehill.com/opinion/campaign/5408703-the-exodus-from-new-york-city-will-only-get-worse/,"Much has been written about America’s largest city edging closer to electing a socialist mayor. Zohran Mamdani recently won the Democratic primary, which is likely enough to secure the mayoralty of…",,https://thehill.com/wp-content/uploads/sites/2/2025/07/AP25183592584242-e1751556884344.jpg?w=1280,,,2025-07-21 07:56:35.926936
,California,2025-07-21 11:33:52+00:00,lakeconews.com,"Administrators, students, lawmakers cheer $10 million state check for school seeking to ...",,,,,,https://lakeconews.com/news/education/82167-administrators-students-lawmakers-cheer-10-million-state-check-for-school-seeking-to-become-only-accredited-tribal-college-in-california,"PALM SPRINGS, Calif. — California Indian Nations College, or CINC, students ... federal student financial aid grants and loans. California, with ...",,,,,2025-07-21 11:56:49.843717
,Education Funding,2025-07-21 10:47:53+00:00,ABC11 Raleigh-Durham,"Durham year-round students return to the classroom, federal funding remains a concern",,,,,,https://abc11.com/post/durham-year-round-students-return-classroom-federal-funding-withheldl-remains-concern/17224363/,There are concerns regarding the federal funding freeze.,,https://cdn.abcotvs.com/dip/images/17226782_072125-wtvd-year-round-school-first-day-10a-vid.jpg?w=1600,,,2025-07-21 10:57:45.117306
,Pennsylvania,2025-07-21 10:35:55+00:00,Gettysburg Connection,Some frozen federal funds for schools released to states by Trump administration - Gettysburg Connection,,,,,,https://gettysburgconnection.org/some-frozen-federal-funds-for-schools-released-to-states-by-trump-administration/,WASHINGTON — President Donald Trump’s administration confirmed Friday that it’s releasing funds that support before- and after-school programs as well as,,https://i0.wp.com/gettysburgconnection.org/wp-content/uploads/2023/12/logo_unsquooshed.jpg,,,2025-07-21 10:57:45.117306
,Education Funding,2025-07-21 10:13:14+00:00,Los Angeles Times,Summer school for migrant students takes a double hit from Trump. Fewer kids go to the zoo,,,,,,https://www.latimes.com/california/story/2025-07-21/migrant-student-program-hit-by-trump-funding-freeze-cuts,A look inside Los Angeles Unified's migrant student summer programs offers a window into how Trump administration policies are affecting the classroom.,,https://ca-times.brightspotcdn.com/dims4/default/d75a804/2147483647/strip/true/crop/5088x2671+0+360/resize/1200x630!/quality/75/?url=https%3A%2F%2Fcalifornia-times-brightspot.s3.amazonaws.com%2F89%2F67%2F6abce8194a09bd141c4f395df525%2F1514389-me-0716-zoo-migrant-ed-program-gem-005.jpg,,,2025-07-21 06:56:08.438114
,Education Funding,2025-07-21 10:11:25+00:00,mississippitoday.org,Mississippi schools face $68M Trump federal funding freeze just days before classes start,,,,,,https://mississippitoday.org/2025/07/21/trump-education-cuts-mississippi-schools-federal-funding-freeze/,"Across the country, nearly $7 billion in federal education money is on hold by the Trump administration.",,,,,2025-07-21 06:56:08.438114
,Education Funding,2025-07-21 10:07:37+00:00,The Hill,Trump backtracks on after-school funding after bipartisan push,,,,,,https://thehill.com/homenews/education/5409000-trump-backtracks-after-school-funding-summer-school/,Stakeholders and lawmakers are cheering after the Trump administration ended a pause on $6 billion in federal after-school and summer school funding following rare bipartisan pushback.  Advoca…,,https://thehill.com/wp-content/uploads/sites/2/2025/07/SummerSchool_Lonas_AP_SophiePark.jpg?w=1280,,,2025-07-21 06:56:08.438114
,Arizona,2025-07-21 09:34:18+00:00,Fox News,Arizona's voucher program costs struggling district $20M as parents flee public schools,,,,,,https://www.foxnews.com/media/arizona-public-school-district-struggles-parents-seek-alternative-options-report,"Arizona's universal school choice program caused enrollment decline at Tucson Unified while nearby Vail district grows, highlighting contrasting impacts of vouchers.",,https://static.foxnews.com/foxnews.com/content/uploads/2021/12/class.jpg,,,2025-07-21 07:56:35.926936
,West Virginia,2025-07-21 09:18:13+00:00,www.msn.com,"Port Washington Board of Education reelects leadership, eyes impact of federal fund freeze",,,,,,http://www.msn.com/en-us/news/us/port-washington-board-of-education-reelects-leadership-eyes-impact-of-federal-fund-freeze/ar-AA1IgT7s%3Fapiversion%3Dv2%26noservercache%3D1%26domshim%3D1%26renderwebcomponents%3D1%26wcseo%3D1%26batchservertelemetry%3D1%26noservertelemetry%3D1,"Port Washington Board of Education reelects leadership, eyes impact of federal fund freeze ... Detained on the way to work: A beloved West Virginia ...",,,,,2025-07-21 18:56:37.566617
,Education Funding,2025-07-21 09:03:29+00:00,K-12 Dive,Week In Review: Education Department cuts move forward and principals convene in Seattle,,,,,,https://www.k12dive.com/news/week-in-review-july-21-2025/753484/,"We’re rounding up last week’s news, from changes to federal oversight to a set of delayed Energy Department rules.",,https://imgproxy.divecdn.com/CfEZL_hFi1UbM3-htBcAMc5nx0K1BZSiyscKyjzBqaA/g:nowe:0:17/c:1024:578/rs:fit:770:435/Z3M6Ly9kaXZlc2l0ZS1zdG9yYWdlL2RpdmVpbWFnZS9HZXR0eUltYWdlcy0yMjA5NjI1NDE2LmpwZw==.webp,,,2025-07-21 06:56:08.438114
,Kentucky,2025-07-21 08:23:57+00:00,WVXU,"Trump administration unfreezes millions for after-school programs in Ohio, Kentucky, and Indiana ",,,,,,https://www.wvxu.org/education/2025-07-21/trump-administration-unfreezes-millions-after-school-programs-ohio-kentucky-indiana,"Early Friday afternoon, the White House's Office of Management and Budget told WVXU it had completed its programmatic review for grants used to fund 21st Century Community Learning Centers and will be releasing funds to states.",,https://npr.brightspotcdn.com/dims4/default/a38d4ff/2147483647/strip/true/crop/6016x3158+0+421/resize/1200x630!/quality/90/?url=http%3A%2F%2Fnpr-brightspot.s3.amazonaws.com%2F3e%2Ff7%2F125df49a4ffe9d5d9dbd604cca97%2Fkimberly-farmer-luaakcuanvi-unsplash.jpg,,,2025-07-21 05:56:06.724684
,Education Funding,2025-07-21 08:02:05+00:00,Spokesman.com,"Trump administration restores grants for after-school programs, while billions in K-12 funding remains frozen",,,,,,https://www.spokesman.com/stories/2025/jul/21/trump-administration-restores-grants-for-after-sch/,"“I was so excited I almost cried, just because of the state of our staff. They were freaking out, like ‘Am I going to have a job?,’” said Debra Raub, executive director of Communities in Schools of Northeast Washington, a recipient of millions in grant funding for programs at six schools in Spokane County.",,https://thumb.spokesman.com/g9CbFbgd9QzBBGT7-ALNvkCQC6k=/1200x630/smart/media.spokesman.com/photos/2025/07/20/6577b7bbcaf6e.hires.jpg,,,2025-07-21 06:56:08.438114
,Kentucky,2025-07-21 04:51:00+00:00,NKyTribune,"Because of cuts in federal funding, KET won't be covering annual Fancy Farm event this year - NKyTribune",,,,,,https://nkytribune.com/2025/07/because-of-cuts-in-federal-funding-ket-wont-be-covering-annual-fancy-farm-event-this-year/,The passage of the Rescissions Act that eliminates federal funding for the Corporation for Public Broadcasting (CPB) has prompted KET to eliminate this year’s coverage of the annual Fancy Farm political event. CPB funding was the primary source of support for KET’s local productions and related services. “We are extremely disappointed to not be at...,,https://nkytribune.com/wp-content/uploads/2025/07/KET-Fancy-Farm.jpg,,,2025-07-21 01:56:25.578819
,West Virginia,2025-07-21 04:11:33+00:00,WV News,"Public education needs help, not more harm",,,,,,https://www.wvnews.com/statejournal/opinion/public-education-needs-help-not-more-harm/article_69fcccbe-4699-4324-8e75-7fb58e217d49.html,There is little question that public education needs some degree of reform — as is the case across much of the country. But efforts to decrease funding at both the,,https://bloximages.chicago2.vip.townnews.com/wvnews.com/content/tncms/custom/image/ce41cdc0-c856-11e6-8271-133d1e3251c0.png?resize=600%2C320,,,2025-07-21 01:16:00.433968
,Education Funding,2025-07-21 00:20:50+00:00,NBC4 Washington,Arlington after-school raises money with lemonade stand after funding cuts,,,,,,https://www.nbcwashington.com/video/news/local/northern-virginia/arlington-afterschool-program-fundraises-with-lemonade-stand-after-funding-cuts/3960820/,An Arlington after-school hit hard by federal funding cuts opened a lemonade stand to raise money for its programs. News4’s Megan McGrath reports.,,https://media.nbcwashington.com/2025/07/40899561942-1080pnbcstations.jpg?quality=85&strip=all&resize=1200%2C675,,,2025-07-21 01:16:00.433968
,Education Funding,2025-07-20 23:14:19+00:00,Columbia Daily Spectator,Columbia meets with Trump administration in talks to restore federal funding,,,,,,https://www.columbiaspectator.com/news/2025/07/20/columbia-meets-with-trump-administration-in-talks-to-restore-federal-funding/,"Officials from Columbia and the White House met in Washington, D.C., on Thursday to discuss the terms of a deal that would restore most of the $400 million in canceled federal funding to the University, a person with knowledge of the meeting told Spectator.",,https://cloudfront-us-east-1.images.arcpublishing.com/spectator/VFQQKO2OQ5D4ZEECVI6PK3UHMQ.jpg,,,2025-07-21 01:16:00.433968
,Education Funding,2025-07-20 23:06:07+00:00,ABC13 Houston,"This Week in Texas: Redistricting, crime concerns, AG race, and early ed funding take center stage",,,,,,https://abc13.com/post/week-texas-redistricting-crime-concerns-ag-race-early-education-funding-take-center-stage/17201494/,"This Week in Texas dives into redistricting battles, early education funding, the Texas Attorney General race, and new crime data from Harris County.",,https://cdn.abcotvs.com/dip/images/17215596_072025-ktrk-this-week-tx-sw-SUN-vid.jpg?w=1600,,,2025-07-20 19:57:00.168974
,Arizona,2025-07-20 21:02:53+00:00,TucsonSentinel.com,Some frozen federal funds for schools released to states by Trump administration ,,,,,,https://www.tucsonsentinel.com/nationworld/report/072025_doe_school_funds/some-frozen-federal-funds-schools-released-states-by-trump-administration/,"President Trump’s administration confirmed Friday that it’s releasing funds that support before- and after-school programs as well as summer programs, a portion of the $6.8 billion in withheld funds for K-12 schools that were supposed to be sent out two weeks ago.",,https://www.tucsonsentinel.com/phpthumb/phpThumb.php?src=/files/entryimages/education_department_1.jpg&fltr[]=wmi|/gfx/shareoverlays/sentinellogo4color_nobackbig.png|BR|77|4|4|0]&w=1200&h=630&zc=C&f=jpg,,,2025-07-20 17:56:13.011049
,Education Funding,2025-07-20 21:02:09+00:00,TucsonSentinel.com,Flowing Wells to discuss fed grant freezes; TUSD has new teacher performance gauge | The Tucson Agenda,,,,,,https://www.tucsonsentinel.com/opinion/report/072025_agenda_schools_op/flowing-wells-discuss-fed-grant-freezes-tusd-has-new-teacher-performance-gauge/,"The Flowing Wells Unified School District is taking a good look at how to handle federal education cuts, while rules and regs force more administrative work to comply; plus more from local government meetings around Tucson this week",,https://www.tucsonsentinel.com/phpthumb/phpThumb.php?src=/files/entryimages/032703_school_1.jpeg&fltr[]=wmi|/gfx/shareoverlays/sentinellogo4color_nobackbig.png|BR|77|4|4|0]&w=1200&h=630&zc=C&f=jpg,,,2025-07-20 17:56:13.011049
,Kentucky,2025-07-20 20:14:14+00:00,The Independent Online,"Federal fund cuts slam KET, public radio",,,,,,https://www.dailyindependent.com/news/federal-fund-cuts-slam-ket-public-radio/article_b78a53bf-e83e-4f8c-a65e-53f38ba6dfb6.html,"Cuts to public broadcasting that cleared Congress early Friday morning will cost KET funding for most of its original programming and a fourth of its workforce, said the head of",,https://bloximages.chicago2.vip.townnews.com/dailyindependent.com/content/tncms/assets/v3/editorial/c/d3/cd3ed6ba-dce4-4124-a445-9c943dd55bf3/687d4c9ab134c.image.png?crop=1930%2C1013%2C0%2C29&resize=1200%2C630&order=crop%2Cresize,,,2025-07-20 16:56:11.973947
,West Virginia,2025-07-20 19:29:59+00:00,WVXU,"In the West Virginia mountains, a radio station is caught in the funding cut crossfire",,,,,,https://www.wvxu.org/2025-07-20/in-the-west-virginia-mountains-a-radio-station-is-caught-in-the-funding-cut-crossfire,"Allegheny Mountain Radio, a network of three community stations, is not an NPR member station. But it will get caught in the crossfire of funding cuts.",,,,,2025-07-20 15:56:43.741068
,West Virginia,2025-07-20 17:34:49+00:00,hsjchronicle.com,Education Department will release some frozen grants supporting after-school and summer programs,,,,,,https://hsjchronicle.com/education-department-will-release-some-frozen-grants-supporting-after-school-and-summer-programs/,"Shelley Moore Capito, R-West Virginia, who chairs the Senate ... federal education grants · Trump administration. Previous article. Hemet ...",,,,,2025-07-20 16:56:11.973947
,Arizona,2025-07-20 17:30:54+00:00,The Daily Independent at YourValley.net,Arizona schools braces for food insecurity surge - Daily Independent,,,,,,"https://yourvalley.net/stories/arizona-schools-braces-for-food-insecurity-surge,600301","In Arizona’s classrooms, hunger is a daily barrier to learning — and it may be about to get worse.   The sweeping tax and spending package signed by President Trump — formally  …",,https://gamma.creativecirclecdn.com/yourvalley/original/20250718-110354-612-DSC0112DZEYD.jpg,,,2025-07-20 14:56:19.638403
,Salt Lake City,2025-07-20 16:47:28+00:00,www.ksl.com,"Over $1M in school funding hangs in limbo, Washington County official says",,,,,,https://www.ksl.com/article/51348342/over-1m-in-school-funding-hangs-in-limbo-washington-county-official-says,Washington County School District official Brent Bills said Monday the district lost access to over $1 million as a result of President Trump's decision to freeze federal education funding.,,https://img.ksl.com/slc/3101/310129/31012958.jpeg?filter=kslv2/responsive_story_lg,,,2025-07-20 12:56:24.203244
,Education Funding,2025-07-20 16:19:35+00:00,KJZZ,Federal school vouchers will start in 2027. Arizona hasn't said if it will opt in,,,,,,https://www.kjzz.org/politics/2025-07-20/federal-school-vouchers-will-start-in-2027-arizona-hasnt-said-if-it-will-opt-in,"Arizona Gov. Katie Hobbs, a Democrat who has blasted the state’s voucher program as a colossal drain on the budget, hasn’t said whether Arizona will opt into the federal vouchers. Her office did not respond to numerous requests for comment.",,https://npr.brightspotcdn.com/dims4/default/9437b60/2147483647/strip/true/crop/2048x1075+0+0/resize/1200x630!/quality/90/?url=http%3A%2F%2Fnpr-brightspot.s3.amazonaws.com%2Ffd%2F0b%2F9362672849aab0da8f8fee0cb1a1%2F54641418076-ef41c05d3e-k.jpg,,,2025-07-20 12:56:24.203244
,Education Funding,2025-07-20 16:00:48+00:00,www.presidentialprayerteam.org,Supreme Court Lift Injunction Against Education Department Layoffs,,,,,,https://www.presidentialprayerteam.org/2025/07/20/supreme-court-lift-injunction-against-education-department-layoffs/,"... federal workforce that the Constitution reserves to the Executive Branch alone. ... President Trump Enforces Solar, Wind Funding Cuts in Executive Order.",,,,,2025-07-20 17:56:13.011049
,Education Funding,2025-07-20 15:37:11+00:00,DailyRidge.com - Fast-Factual-Free,Polk Schools Superintendent Warns of Potential $67 Million Funding Gap; Losses Represent Potential 3% of $2.26 Billion Budget - DailyRidge.com,,,,,,https://dailyridge.com/2025/07/20/polk-schools-superintendent-warn-of-potential-67-million-funding-gap-losses-represent-3-of-2-26-billion-budget/,"By Carl Fish | Daily Ridge News BARTOW, FL | July 20, 2025 Polk County Public Schools (PCPS) recently notified families and staff of more than $67 million in anticipated funding losses and delays for the upcoming 2025–26 school year. The number, shared in a district-wide message from Superintendent Fred Heid, raised immediate concerns about",,https://dailyridge.com/file/2024/05/DailyRidge-300x98-3577160527.png,,,2025-07-20 12:56:24.203244
,Education Funding,2025-07-20 15:24:20+00:00,Community College Daily - American Association of Community Colleges,House sets top-line number for FY 26 funding - Community College Daily,,,,,,https://www.ccdaily.com/2025/07/house-sets-top-line-number-for-fy-26-funding/,"While congressional Republicans will press down on spending for domestic programs, the chair of the House Appropriations Committee has indicated that his panel will not make dramatic cuts to align with the president’s budget request. Rep. Tom Cole (R-Oklahoma) announced on Thursday that the House will allocate $705.6 billion for discretionary, non-defense programs for fiscal",,https://www.ccdaily.com/wp-content/uploads/2024/06/tighten.jpg,,,2025-07-20 12:56:24.203244
