id,name,published,outlet,title,authors,category,market,categoryorder,articleorder,url,description,text,image,error,sentiment,firstEyes
,Education Funding,2025-07-22 01:00:29+00:00,www.youtube.com,Federal education funding freeze impacts Las Vegas valley non-profits - YouTube,,,,,,https://www.youtube.com/watch%3Fv%3D9YQ4P8jewRE,Several non-profits in the Las Vegas valley are adjusting to losing hundreds of thousands of dollars in education funding after the Trump ...,,,,,2025-07-21 21:56:29.926395
,Education Funding,2025-07-22 00:56:38+00:00,KLAS,Federal education funding freeze impacts Las Vegas valley non-profits,,,,,,https://www.8newsnow.com/news/local-news/federal-education-funding-freeze-impacts-las-vegas-valley-non-profits/,Several non-profits in the Las Vegas valley are adjusting to losing hundreds of thousands of dollars in education funding after the Trump Administration put a freeze on some money.,,https://www.8newsnow.com/wp-content/uploads/sites/59/2025/07/boys-and-girls-club-photo-1.jpg?w=1280,,,2025-07-21 21:56:29.926395
,Oklahoma,2025-07-22 00:45:19+00:00,Bartlesville Radio,Bartlesville Radio » News » Federal Education Department Withholds $500K From Bartlesville Schools,,,,,,https://www.bartlesvilleradio.com/pages/news/460832025/federal-education-department-withholds500k-from-bartlesville-schools,"
	The Trump administration is withholding approximately $6.2 billion in federal education funds, in ..",,http://www.bartlesvilleradio.com/caffeine/uploads/news/img_0416.jpg,,,2025-07-21 21:56:29.926395
,Education Funding,2025-07-22 00:34:39+00:00,CalMatters,Trump administration releases after school grant money — with a catch,,,,,,https://calmatters.org/education/2025/07/after-school-california/,"California will get the federal money withheld for after-school programs, but spending must comply with Trump’s priorities",,https://calmatters.org/wp-content/uploads/2025/07/031925_Resource-Fair_AH_CM_04.jpg,,,2025-07-21 21:56:29.926395
,Education Funding,2025-07-22 00:14:56+00:00,Colorado Public Radio,"Colorado school districts wait for millions in missing funds, plan contingencies for next school year",,,,,,https://www.cpr.org/2025/07/21/colorado-school-districts-still-waiting-federal-funds/,"The Trump administration was expected to release nearly $13 million to Colorado schools Monday, but the state is still waiting.",,https://wp-cpr.s3.amazonaws.com/uploads/2025/03/250308-ALAMEDA-INTERNATIONAL-MIDDLE-HIGH-SCHOOL-LIBRARY-BOOKS-JEFFERSON-COUNTY-LAKEWOOD-EDUCATION-KEVINJBEATY-01.jpg,,,2025-07-21 21:56:29.926395
,Alabama,2025-07-22 00:06:27+00:00,WV News,"Support students, end waste — a balanced, sensible approach to federal education funding",,,,,,https://www.wvnews.com/theet/opinion/editorials/support-students-end-waste-a-balanced-sensible-approach-to-federal-education-funding/article_e344c76d-30e5-4459-8611-bd13603bf0c9.html,"We applaud the efforts of Sen. Shelley Moore Capito, R-W.Va., and her fellow senators whose actions have led to the release of key educational funding that provides for summer feeding",,https://bloximages.chicago2.vip.townnews.com/wvnews.com/content/tncms/custom/image/abc838b8-6406-11e8-a6ee-076b8a0fc924.png?resize=600%2C185,,,2025-07-21 20:56:42.011512
,Pennsylvania,2025-07-22 00:03:04+00:00,www.nysut.org,NYSUT joins coalition suing over billions in blocked federal funding,,,,,,https://www.nysut.org/news/2025/july/media-release-esea,"NYSUT has joined a coalition of school districts, parents, teachers’ unions, and nonprofit organizations in a lawsuit against the federal administration for withholding nearly $6 billion in education funding that Congress directed to support students for the 2025–2026 school year. ",,https://www.nysut.org/-/media/images/nysut/news/2025/july/news_072125_esea.jpg,,,2025-07-21 20:56:42.011512
,Education Funding,2025-07-21 23:49:54+00:00,WPBF,Federal funds restored for after-school programs in Palm Beach County,,,,,,https://www.wpbf.com/article/federal-funds-restored-for-after-school-programs-in-palm-beach-county/65468278,"With $1.4 billion in federal grants restored, the Boys & Girls Club and local schools resume after-school programs, hire teachers, and reach out to families.",,"https://kubrick.htvapps.com/vidthumb/c806ec81-ff85-4caa-bee7-00bd649dac25/9d772246-7a34-4682-ac5f-91afd2a7b8c0.jpg?crop=0.602xw:0.601xh;0.358xw,0.133xh&resize=1200:*",,,2025-07-21 21:56:29.926395
,Education Funding,2025-07-21 23:44:02+00:00,https://www.wibw.com,Geary County Schools lose approximately $1 million following federal education funding freeze ,,,,,,https://www.wibw.com/2025/07/21/geary-county-schools-lose-approximately-1-million-following-federal-education-funding-freeze/,The Trump administration’s federal freeze of 6.8 billion dollars in education funding has left some Kansas schools with hard decisions.,,https://gray-wibw-prod.gtv-cdn.com/resizer/v2/S6NJIP6MOBCBNC3SGKPP2LTPQA.jpg?auth=e06b5fe19b6725ceb91dcda18f23389828109d74308d61e16c4795d9a79e3b7f&width=1200&height=600&smart=true,,,2025-07-21 21:56:29.926395
,Oklahoma,2025-07-21 23:40:47+00:00,KOCO,Oklahoma adult education programs face closure amid federal funding freeze,,,,,,https://www.koco.com/article/oklahoma-careertech-adult-education-programs-federal-funding-freeze/65468321,"Oklahoma's adult education programs are at risk of shutting down due to a federal freeze on $7.5 million in grants, potentially affecting thousands of students and hundreds of employees.",,"https://kubrick.htvapps.com/vidthumb/87c3e9fc-3898-46c5-b3f6-4c1372c0ebd7/5932376f-4312-4e20-b490-8369c1804546.jpg?crop=1xw:1.0xh;center,top&resize=1200:*",,,2025-07-21 19:57:35.811275
,West Virginia,2025-07-21 22:50:42+00:00,Dailyfly News,U.S. government gives some education money back to states,,,,,,https://www.dailyfly.com/2025/07/21/u-s-government-gives-some-education-money-back-to-states/,"WASHINGTON, D.C. – The Trump administration released $1.3 billion in education funding back to the states after bipartisan pushback. After the U.S. Department of Education announced it would withhold $6.8 billion in federal education funding, lawmakers and education",,https://dehayf5mhw1h7.cloudfront.net/wp-content/uploads/sites/2472/2025/06/16071404/496128365_122132886392723345_7477768731640792417_n-1024x576.jpg,,,2025-07-21 21:56:29.926395
,Education Funding,2025-07-21 22:33:18+00:00,WKOW,Federal cuts to English language learning affecting program at Literacy Network,,,,,,https://www.wkow.com/news/education/federal-cuts-to-english-language-learning-affecting-program-at-literacy-network/article_64f55410-3f04-4ae5-9dbd-8b6a0ec325c7.html,"MADISON (WKOW) -- The Trump administration is releasing some federal grants for after school and summer programs, but money that's already been approved for adult education programs is still frozen",,https://bloximages.newyork1.vip.townnews.com/wkow.com/content/tncms/assets/v3/editorial/9/85/98511d63-8ba0-45c2-b22e-3bff73462628/687ebba839ab6.image.png?crop=1920%2C1008%2C0%2C35&resize=1200%2C630&order=crop%2Cresize,,,2025-07-21 19:57:35.811275
,Education Funding,2025-07-21 22:23:37+00:00,VTDigger,"Trump administration partially lifts funding freeze, sends $6.5 million to Vermont schools for afterschool programs - VTDigger",,,,,,https://vtdigger.org/2025/07/21/trump-administration-partially-lifts-funding-freeze-sends-6-5-million-to-vermont-schools-for-afterschool-programs/,"More than $18 million in federal funds remains withheld, state officials said, including money for English language learning programs and adult learning centers.",,https://vtdigger.org/wp-content/uploads/2025/07/Linda-McMahon-Department-Education-scaled.jpg,,,2025-07-21 18:56:37.566617
,West Virginia,2025-07-21 22:23:26+00:00,WV News,U.S. government gives some education money back to states,,,,,,https://www.wvnews.com/news/around_the_web/collegefootballwarehouse/u-s-government-gives-some-education-money-back-to-states/article_243c8a44-1021-59c3-89b2-0dce26106674.html,(The Center Square) — The Trump administration released $1.3 billion in education funding back to the states after bipartisan pushback.,,https://bloximages.chicago2.vip.townnews.com/wvnews.com/content/tncms/custom/image/dd23b0fa-a76a-11ea-b298-6f7943d03f88.jpg,,,2025-07-21 19:57:35.811275
,West Virginia,2025-07-21 22:20:42+00:00,CBS 19 News,U.S. government gives some education money back to states,,,,,,https://www.cbs19news.com/u-s-government-gives-some-education-money-back-to-states/article_7909cbe2-ee07-5ab2-bcdf-ed8062cbd509.html,(The Center Square) — The Trump administration released $1.3 billion in education funding back to the states after bipartisan pushback.,,https://bloximages.chicago2.vip.townnews.com/cbs19news.com/content/tncms/custom/image/ee346db2-ba0d-11ee-9099-9ffc4dd1ed7d.png?resize=600%2C315,,,2025-07-21 18:56:37.566617
,Education Funding,2025-07-21 22:13:16+00:00,WPTZ,"Bernie Sanders says Vermont needs more federal education aid, speaks out against funding cuts",,,,,,https://www.mynbc5.com/article/bernie-sanders-federal-education-funding-cuts/65467778,"Sanders addressed what he called the trickle-down effects of the big, beautiful bill on people across our region and celebrated the progress he has made for education across Vermont despite those federal cuts.",,"https://kubrick.htvapps.com/vidthumb/c9a3ea0f-df51-48dc-becc-d4852b39d921/32d2e278-a517-4136-9b73-c3433b662b2e.jpg?crop=1xw:1.0xh;center,top&resize=1200:*",,,2025-07-21 18:56:37.566617
,New York City,2025-07-21 21:29:40+00:00,90.5 WESA,"What massive Education Department layoffs mean for students, teachers and schools",,,,,,https://www.wesa.fm/2025-07-21/what-massive-education-department-layoffs-mean-for-students-teachers-and-schools,The Supreme Court decided last week that massive layoffs at the Department of Education can go forward.,,,,,2025-07-21 17:56:44.938853
,Kentucky,2025-07-21 21:23:59+00:00,Forward Kentucky,KDP weekly messaging for 7/21/25,,,,,,https://forwardky.com/kdp-weekly-messaging-for-7-21-25/,With posts to share on your own social media channels,,https://images.unsplash.com/photo-1530811761207-8d9d22f0a141?crop=entropy&cs=tinysrgb&fit=max&fm=jpg&ixid=M3wxMTc3M3wwfDF8c2VhcmNofDN8fG1lc3NhZ2V8ZW58MHx8fHwxNzUzMTMyODc0fDA&ixlib=rb-4.1.0&q=80&w=2000,,,2025-07-21 17:56:44.938853
,Pennsylvania,2025-07-21 21:20:08+00:00,The Black Chronicle,Woods says all federal education funds should be released - Georgia - The Black Chronicle,,,,,,https://blackchronicle.com/southeast/georgia/woods-says-all-federal-education-funds-should-be-released/,Woods says all federal education funds should be released - The Black Chronicle,,https://bloximages.newyork1.vip.townnews.com/thecentersquare.com/content/tncms/assets/v3/editorial/4/9c/49c16c50-7ab8-11ef-9b22-c7deedf2f19f/66f32918c7ac8.image.jpg,,,2025-07-21 17:56:44.938853
,Arizona,2025-07-21 21:08:45+00:00,NextSteps: Step Up For Students,"$1.3B in federal funds unfrozen for schools, Broward cities consider charters, and more - NextSteps: Step Up For Students",,,,,,https://nextstepsblog.org/2025/07/1-3b-in-federal-funds-unfrozen-for-schools-broward-cities-consider-charters-and-more/,"Around the state: About $1.3 billion in federal funds for school before- and after-school programs that had been frozen by the Trump administration is Stories about $1.3 billion in federal funds for school before- and after-school programs that had been frozen by the Trump administration being released today, several Broward cities considering starting charter schools, school closures becoming an option in Leon County, home-schooling among black families growing from 3.3% of their households to 16.1% during the pandemic but many have had to search out culturing affirming material, and more in today's roundup of education news in Florida.",,https://nextstepsblog.org/wp-content/uploads/2024/08/florida-roundup-logo-300x115-1.webp,,,2025-07-21 19:57:35.811275
,Maine,2025-07-21 20:58:43+00:00,Maine Public,Maine will receive $6.5 million originally withheld by the federal Department of Education,,,,,,https://www.mainepublic.org/education-news/2025-07-21/maine-will-receive-6-5-million-originally-withheld-by-the-federal-department-of-education,"The funding is for the 21st Century Community Learning Centers program, which supports low-income families and rural communities with after-school programs and summer learning opportunities.",,https://npr.brightspotcdn.com/dims4/default/5711b45/2147483647/strip/true/crop/2400x1260+0+582/resize/1200x630!/quality/90/?url=http%3A%2F%2Fnpr-brightspot.s3.amazonaws.com%2F3a%2Fda%2Fbc4e02f34a67b3ba2663994a4f8f%2Fmainepublic-icon-rgb.jpg,,,2025-07-21 17:56:44.938853
,Kentucky,2025-07-21 20:44:03+00:00,WVXU,"Uncertainty remains for Northeast Ohio after-school programs, even after federal funding is restored",,,,,,https://www.wvxu.org/2025-07-21/uncertainty-remains-for-northeast-ohio-after-school-programs-even-after-federal-funding-is-restored,The federal freeze on more than $1 billion in education money threw local after-school program providers into chaos. Some are still unsure of restarting programs for the fall despite the freeze ending.,,https://npr.brightspotcdn.com/dims4/default/073cf39/2147483647/strip/true/crop/1755x921+0+109/resize/1200x630!/quality/90/?url=http%3A%2F%2Fnpr-brightspot.s3.amazonaws.com%2Flegacy%2Fimages%2Fnews%2Fnpr%2F2019%2F07%2F737845374_1687135505.jpg,,,2025-07-21 16:56:48.039716
,Education Funding,2025-07-21 20:43:14+00:00,Ideastream Public Media,"Uncertainty remains for Northeast Ohio after-school programs, even after federal funding is restored",,,,,,https://www.ideastream.org/education/2025-07-21/uncertainty-remains-for-northeast-ohio-after-school-programs-even-after-federal-funding-is-restored,The federal freeze on more than $1 billion in education money threw local after-school program providers into chaos. Some are still unsure of restarting programs for the fall despite the freeze ending.,,https://npr.brightspotcdn.com/dims4/default/073cf39/2147483647/strip/true/crop/1755x921+0+109/resize/1200x630!/quality/90/?url=http%3A%2F%2Fnpr-brightspot.s3.amazonaws.com%2Flegacy%2Fimages%2Fnews%2Fnpr%2F2019%2F07%2F737845374_1687135505.jpg,,,2025-07-21 17:56:44.938853
,West Virginia,2025-07-21 20:05:15+00:00,West Virginia Public Broadcasting,County School Districts Rank Nationally For Improving Student Literacy  - West Virginia Public Broadcasting,,,,,,https://wvpublic.org/story/education/county-school-districts-rank-nationally-for-improving-student-literacy/,State education leaders are drawing attention to nine counties that have improved literacy assessments by more than 3% since the COVID-19 pandemic.,,https://wvpublic.org/wp-content/uploads/2023/11/Books-with-Buddies-Final.png,,,2025-07-21 18:56:37.566617
,Salt Lake City,2025-07-21 20:04:16+00:00,"TownLift, Park City News","How dismantling the U.S. Department of Education will affect Park City School district - TownLift, Park City News",,,,,,https://townlift.com/2025/07/supreme-court-education-ruling-what-it-means-for-park-city-school-districts-budget/,"PARK CITY, Utah — Park City School District officials say the Supreme Court’s decision that lets President Donald Trump resume plans to dismantle the",,https://townlift.com/wp-content/uploads/2020/11/20201117_Stock-Images_Edelstein-25.jpg,,,2025-07-21 16:56:48.039716
,Education Funding,2025-07-21 19:50:16+00:00,www.youtube.com,Colorado schools expecting to receive previously withheld federal funding - YouTube,,,,,,https://www.youtube.com/watch%3Fv%3D0rbRBVgH1YY,Colorado is expecting to receive federal funding for schools previously ... Schools scramble amid Trump administration education funding freeze.,,,,,2025-07-21 16:56:48.039716
,Education Funding,2025-07-21 19:46:12+00:00,The Center Square,Woods says all federal education funds should be released,,,,,,https://www.thecentersquare.com/georgia/article_1069d313-6a03-494a-90af-b73635520815.html,"(The Center Square) – Georgia State School Superintendent Richard Woods said he appreciated the release of federal funding for after-school and summer learning programs, but he called on the Trump",,https://bloximages.newyork1.vip.townnews.com/thecentersquare.com/content/tncms/assets/v3/editorial/4/e8/4e8c6c7d-db20-41ff-8202-a752468fe0a5/687d7601ba02d.image.jpg?crop=1568%2C823%2C0%2C29&resize=1200%2C630&order=crop%2Cresize,,,2025-07-21 16:56:48.039716
,Arizona,2025-07-21 19:29:45+00:00,https://www.kold.com,"NPR, PBS funding cuts could threaten local childhood education resources",,,,,,https://www.kold.com/2025/07/21/npr-pbs-funding-cuts-could-threaten-local-childhood-education-resources/,Congress approved a Trump Administration plan to roll back on more than $1 billion in funds to the Corporation for Public Broadcasting.,,https://gray-kold-prod.gtv-cdn.com/resizer/v2/JQUUEGNYTZGNTOMEFM2W4YGVQM.jpg?auth=9e2ec4988956e3766e72757f3e2ab21f9d390953fe750518977849ec712abfb1&width=1200&height=600&smart=true,,,2025-07-21 17:56:44.938853
,West Virginia,2025-07-21 19:14:58+00:00,www.tucsonsentinel.com,Public school enrollment continues to fall - Tucson Sentinel,,,,,,https://www.tucsonsentinel.com/nationworld/report/072125_school_enrollment/public-school-enrollment-continues-fall/,... West Virginia declined more than 5%. A new study from Boston University ... Some frozen federal funds for schools released to states by Trump ...,,,,,2025-07-21 15:44:55.248005
,Louisiana,2025-07-21 19:14:16+00:00,www.louisianaweekly.com,The theft of public education dollars | New Orleans' Multicultural News Source,,,,,,http://www.louisianaweekly.com/the-theft-of-public-education-dollars/,"... federal funds, robbing the poor to help the rich. ... Ranking 46th in education on a list of 50 states isn't good, contrary to the Louisiana Department ...",,,,,2025-07-21 17:56:44.938853
,Oklahoma,2025-07-21 18:43:29+00:00,Duncan Banner,Some frozen federal funds for schools released to states by Trump administration,,,,,,https://www.duncanbanner.com/news/some-frozen-federal-funds-for-schools-released-to-states-by-trump-administration/article_959ea391-2b9e-466c-95f2-4d5e92652e3f.html,"WASHINGTON — President Donald Trump’s administration confirmed Friday that it’s releasing funds that support before- and after-school programs as well as summer programs, a portion of the $6.8 billion in",,https://bloximages.chicago2.vip.townnews.com/duncanbanner.com/content/tncms/assets/v3/editorial/8/72/872fc20a-8b4b-4b18-8505-44c4312303d9/687e879f4c303.image.jpg?crop=1536%2C806%2C0%2C172&resize=1200%2C630&order=crop%2Cresize,,,2025-07-21 15:44:55.248005
,Connecticut,2025-07-21 18:41:53+00:00,FOX 5 San Diego & KUSI News,Study shows California has 30th-best public school system in America ,,,,,,https://fox5sandiego.com/news/california-news/study-shows-california-has-30th-best-public-school-system-in-america/amp/,"The quality of public school systems varies widely from state to state, and California falls within the middle of the pack when it comes to the best in the nation, according to a recent study.&nbsp…",,https://fox5sandiego.com/wp-content/uploads/sites/15/2025/07/GettyImages-2175461282.jpg?w=1280,,,2025-07-21 17:56:44.938853
,Maine,2025-07-21 18:38:37+00:00,spectrumlocalnews.com,Maine governor joins multi-state call for release of federal education funds,,,,,,https://spectrumlocalnews.com/me/maine/education/2025/07/21/maine-governor-joins-multi-state-call-for-release-of-federal-education-funds,"More than $27 million for Maine schools and educators is being held, according to the Maine Department of Education.",,https://s7d2.scene7.com/is/image/TWCNews/mills_0720,,,2025-07-21 15:44:55.248005
,Kentucky,2025-07-21 18:35:22+00:00,Glasgow News 1,$1.3 billion in education funds released by federal government,,,,,,https://glasgownews1.com/2025/07/21/1-3-billion-in-education-funds-released-by-federal-government/,By MICHAEL CRIMMINS Glasgow News 1 Some federal education funds are slowly trickling to the states. President ...,,https://media-cdn.socastsrm.com/wordpress/wp-content/blogs.dir/3038/files/2025/07/educationdepartment-1536x1152-1-1200x675.jpg,,,2025-07-21 16:56:48.039716
,Education Funding,2025-07-21 18:15:52+00:00,WATE 6 On Your Side,‘Deeply concerned’ Jefferson County Schools losing $464k in federal funding,,,,,,https://www.wate.com/news/jefferson-county-news/deeply-concerned-jefferson-county-schools-losing-464k-in-federal-funding/,"DANDRIDGE, Tenn. (WATE) — Jefferson County Schools is losing $464,799 in federal funds, which the superintendent says has significantly disrupted the district’s ability to plan for the upcomi…",,https://www.wate.com/wp-content/uploads/sites/42/2023/09/classroom_1542034403442_61914801_ver1.0.jpg?w=1280,,,2025-07-21 15:44:55.248005
,Alabama,2025-07-21 18:10:25+00:00,https://www.wsfa.com,Alabama Public Television reacts to federal spending cuts ,,,,,,https://www.wsfa.com/2025/07/21/alabama-public-television-reacts-federal-spending-cuts/,Alabama Public Television is responding after the U.S. House passed a spending cut package that will take $1 billion away from the Corporation for Public Broadcasting.,,https://gray-wsfa-prod.gtv-cdn.com/resizer/v2/RTP7NK4MBRAU5PW57AJ5EVIIUU.png?auth=645371e3ff1314260b749f8bfbd746dff4e8781632f1a1995b75c57281ffa76c&width=1200&height=600&smart=true,,,2025-07-21 14:56:11.375095
,Education Funding,2025-07-21 17:58:41+00:00,nj,New policy is forcing thousands of N.J. children out of Head Start programs,,,,,,https://www.nj.com/mosaic/2025/07/new-policy-is-forcing-thousands-of-nj-children-out-of-head-start-programs.html,"Newark provider calls it ""literally just targeting babies"" as families scramble to find alternatives with September approaching.",,https://www.nj.com/resizer/v2/4R3VF7S2PZEE5CUHHGYNV62JE4.jpg?auth=34f5b029f67670d0a7684ce9e288f870e070a5d9276914e13868fb06b0b6e1db&width=1280&quality=90,,,2025-07-21 14:56:11.375095
,Education Funding,2025-07-21 17:47:46+00:00,https://www.wowt.com,Nebraska Rep. Bacon shares concern with Department of Education over funding delay,,,,,,https://www.wowt.com/2025/07/21/nebraska-rep-bacon-shares-concern-with-department-education-over-funding-delay/,"A release from Rep. Bacon’s office says he sent a letter to the Director of the Office of Management and Budget, Russell Vought.",,https://gray-wowt-prod.gtv-cdn.com/resizer/v2/XCYG5J7IQBGRBKUQBLA5GSGTKE.jpg?auth=e916c26e586aef6b2ad3b342727948883c29a9b83cf28d7d9138251e7cdf889c&width=1200&height=600&smart=true,,,2025-07-21 14:56:11.375095
,Arizona,2025-07-21 17:35:19+00:00,The Miami Times,Some frozen federal funds for schools released to states by Trump administration,,,,,,https://www.miamitimesonline.com/education/some-frozen-federal-funds-for-schools-released-to-states-by-trump-administration/article_7d544e84-460d-4290-9114-658e4774dcd8.html,"President Donald Trump’s administration confirmed Friday that it’s releasing funds that support before- and after-school programs as well as summer programs, a portion of the $6.8 billion in withheld funds",,https://bloximages.newyork1.vip.townnews.com/miamitimesonline.com/content/tncms/assets/v3/editorial/9/df/9df731f7-48f8-4902-97b5-5e784fa3c29d/684305295b37e.image.jpg?crop=1024%2C538%2C0%2C115,,,2025-07-21 15:44:55.248005
,Arizona,2025-07-21 17:00:57+00:00,Yahoo News,Federal funds restored for Georgia after-school programs,,,,,,https://www.yahoo.com/news/federal-funds-restored-georgia-school-123159095.html,The U.S. Department of Education is expected to release long-awaited federal funding for the 21st Century Community Learning Centers program.,,https://s.yimg.com/ny/api/res/1.2/hyCjzze_l3QYGybSS5dQpA--/YXBwaWQ9aGlnaGxhbmRlcjt3PTEyMDA7aD02NzU7Y2Y9d2VicA--/https://media.zenfs.com/en/waga_fox_local_articles_107/7697b68f9b592ba441a3766b7f60d8ff,,,2025-07-21 17:56:44.938853
,Education Funding,2025-07-21 16:46:10+00:00,www.quiverquant.com,Press Release: Rep. Jimmy Panetta Joins Call to Release $7 Billion in Federal Education ...,,,,,,https://www.quiverquant.com/news/Press%2BRelease%253A%2BRep.%2BJimmy%2BPanetta%2BJoins%2BCall%2Bto%2BRelease%2B%25247%2BBillion%2Bin%2BFederal%2BEducation%2BFunding%2Bfor%2BCalifornia%2BSchools,Rep. Jimmy Panetta and colleagues call for immediate release of $7 billion in withheld federal education funding for schools. Quiver AI Summary. US ...,,,,,2025-07-21 14:56:11.375095
,Education Funding,2025-07-21 16:45:39+00:00,fsapartners.ed.gov,(CB-25-12) Information and Reporting Reminders for the Fiscal Operations Report for 2024 ...,,,,,,https://fsapartners.ed.gov/knowledge-center/library/electronic-announcements/2025-07-21/information-and-reporting-reminders-fiscal-operations-report-2024-25-and-application-participate-2026-27-fisap,... funding under the Campus-Based programs for the 2026–27 award year are ... Report the federal share of Perkins Loan funds that your school ...,,,,,2025-07-21 16:56:48.039716
,Education Funding,2025-07-21 16:29:05+00:00,Chicago Tribune,"Gov. JB Pritzker joins letter demanding release of federal education funding, with billions still in limbo",,,,,,https://www.chicagotribune.com/2025/07/21/governor-jb-pritzker-federal-education-funding/,Gov. JB Pritzker signed a letter with other Democratic governors calling on the Trump administration to release withheld federal education grants.,,https://www.chicagotribune.com/wp-content/uploads/2025/07/CTC-L-anti-violence-programs14_226719762-e1753115057831.jpg?w=1024&h=702,,,2025-07-21 12:57:06.800244
,Kentucky,2025-07-21 16:26:56+00:00,whopam.com,"CCPS Superintendent discusses SB 181, federal funding freeze - Hopkinsville, Kentucky",,,,,,https://whopam.com/2025/07/21/ccps-superintendent-discusses-sb-181-federal-funding-freeze/,... federal funding freeze. Senate Bill 181 was passed during the 2025 Kentucky General Assembly and requires all school employees and volunteers to ...,,,,,2025-07-21 12:57:06.800244
