id,name,published,outlet,title,authors,category,market,categoryorder,articleorder,url,description,text,image,error,sentiment,firstEyes
,Oklahoma,2025-10-01 05:28:32+00:00,KFOR.com Oklahoma City,Kajeet Reaffirms Commitment to K-12 and Library Connectivity as FCC Votes to Cut Wi-Fi Funding through E-Rate,,,,,,https://kfor.com/business/press-releases/globenewswire/9537987/kajeet-reaffirms-commitment-to-k-12-and-library-connectivity-as-fcc-votes-to-cut-wi-fi-funding-through-e-rate,"MCLEAN, Va., Sept. 30, 2025 (GLOBE NEWSWIRE) -- Kajeet®, a leader in managed, education-grade connectivity solutions, today reaffirmed its commitment to America’s school districts and libraries as the FCC ends E-Rate support for school bus Wi-Fi and hotspots. Districts and libraries that applied for funding for fiscal year 2025 requested $42.6 million to use E-Rate funds for hotspots and $15.3 million for school bus Wi-Fi, according to federal data. “Our mission hasn’t changed ...",,https://ml.globenewswire.com/media/012137da-28e9-47c3-99c2-c7ea5b0603a7/small/kajeet-logo-fullcolor-png.png,,,2025-10-01 16:59:11.196957
,Pennsylvania,2025-10-01 05:21:25+00:00,ABC27,"How the government shutdown will affect student loans, FAFSA and the Education Dept.",,,,,,https://www.abc27.com/news/us-world/ap-the-government-shutdown-will-halt-some-work-at-a-diminished-education-department/,"WASHINGTON (AP) — Already diminished by cuts by the Trump administration, the U.S. Education Department will see more of its work come to a halt due to the government shutdown. The department says …",,https://www.abc27.com/wp-content/uploads/sites/55/2025/10/68dcbd6d604ce1.49954733.jpeg?w=1280,,,2025-10-01 01:57:06.190986
,Education Funding,2025-10-01 05:18:00+00:00,mauinow.com,Hirono recognizes Impact Aid as vital funding source for Hawaiʻi education - Maui Now,,,,,,https://mauinow.com/2025/09/30/hirono-recognizes-impact-aid-as-vital-funding-source-for-hawai%25CA%25BBi-education/,"The program reimburses school districts across the country that lose local tax revenue due to the tax-exempt status of federal lands, including ...",,,,,2025-10-01 03:56:43.821619
,Maine,2025-10-01 05:01:55+00:00,Bangor Daily News,The government shutdown will halt some work at a diminished Education Department,,,,,,https://www.bangordailynews.com/2025/10/01/nation/the-government-shutdown-will-halt-some-work-at-a-diminished-education-department/,"WASHINGTON (AP) — Already diminished by cuts by the Trump administration, the U.S. Education Department will see more of its work come to a halt due to",,https://i0.wp.com/bdn-data.s3.amazonaws.com/uploads/2025/10/preview.jpg?fit=1024%2C683&ssl=1,,,2025-10-01 05:57:06.929797
,Education Funding,2025-10-01 05:01:00+00:00,www.wthr.com,U.S. Dept of Education cuts federal funding for grant program in Indiana schools - WTHR,,,,,,https://www.wthr.com/article/news/education/us-dept-of-education-cuts-federal-funding-for-grant-program-in-indiana-schools-gear-up-students/531-ce01491d-f85e-4efd-8c74-894e5e011f54,The U.S. Department of Education has cut money for a program that was helping thousands of students across Indiana.,,,,,2025-10-01 03:56:43.821619
,West Virginia,2025-10-01 04:24:16+00:00,WBOY.com,"How the government shutdown will affect student loans, FAFSA and the Education Dept.",,,,,,https://www.wboy.com/news/national/ap-the-government-shutdown-will-halt-some-work-at-a-diminished-education-department/,"WASHINGTON (AP) — Already diminished by cuts by the Trump administration, the U.S. Education Department will see more of its work come to a halt due to the government shutdown. The department says …",,https://www.wboy.com/wp-content/uploads/sites/43/2025/10/68dcbd6d255648.35699517.jpeg?w=1280,,,2025-10-01 05:57:06.929797
,West Virginia,2025-10-01 04:16:56+00:00,WOWK 13 News,The government shutdown will halt some work at a diminished Education Department,,,,,,https://www.wowktv.com/news/ap-the-government-shutdown-will-halt-some-work-at-a-diminished-education-department/,"WASHINGTON (AP) — Already diminished by cuts by the Trump administration, the U.S. Education Department will see more of its work come to a halt due to the government shutdown. The department says …",,https://www.wowktv.com/wp-content/uploads/sites/52/2025/10/68dca98eaf6de3.76417466.jpeg?w=1280,,,2025-10-01 03:56:43.821619
,West Virginia,2025-10-01 04:12:54+00:00,theintelligencer.net,"West Virginia Senators Capito, Justice Voted in Favor of ‘Clean’ Continuing Resolution To Fund Government",,,,,,https://www.theintelligencer.net/news/top-headlines/2025/10/us-government-on-brink-of-first-shutdown-in-almost-7-years-amid-partisan-standoff/,"CHARLESTON – With no short-term deal in place to keep the federal government funded over the next several weeks, non-essential services will begin to shut down Wednesday, affecting thousands of federal employees in West Virginia. In two votes Tuesday night, the U.S. Senate could not reach the 60-vote threshold needed to move forward on either […]",,https://ogden_images.s3.amazonaws.com/www.theintelligencer.net/images/2025/09/30234551/AP25274003537859-750x500.jpg,,,2025-10-01 01:57:06.190986
,California,2025-10-01 04:12:05+00:00,KGET 17 News,"How the government shutdown will affect student loans, FAFSA and the Education Dept.",,,,,,https://www.kget.com/national-news/ap-the-government-shutdown-will-halt-some-work-at-a-diminished-education-department/,"WASHINGTON (AP) — Already diminished by cuts by the Trump administration, the U.S. Education Department will see more of its work come to a halt due to the government shutdown. The department says …",,https://www.kget.com/wp-content/uploads/sites/2/2025/09/68dcbd6374d298.99774089.jpeg?w=1280,,,2025-10-01 02:56:16.006797
,Salt Lake City,2025-10-01 04:10:50+00:00,ABC4 Utah,"How the government shutdown will affect student loans, FAFSA and the Education Dept.",,,,,,https://www.abc4.com/news/national/ap-the-government-shutdown-will-halt-some-work-at-a-diminished-education-department/,"WASHINGTON (AP) — Already diminished by cuts by the Trump administration, the U.S. Education Department will see more of its work come to a halt due to the government shutdown. The department says …",,https://www.abc4.com/wp-content/uploads/sites/4/2025/09/68dcbd6d48dfb2.58088501.jpeg?w=1280,,,2025-10-01 03:56:43.821619
,Education Funding,2025-10-01 02:39:17+00:00,U.S. Representative Ami Bera,Government Shutdown FAQ,,,,,,https://bera.house.gov/about/government-shutdown-faq,"The federal government has entered a shut down as of 12:01 AM ET on Wednesday, October 1, 2025. A government shutdown can have wide-ranging impacts on our communities—from delays in federal services to uncertainty for federal workers, small businesses, and military families.As your representative in Congress, my top priority is making sure you and your family have the resources and information you need to navigate this moment.",,,,,2025-10-01 03:56:43.821619
,Pennsylvania,2025-10-01 01:03:27+00:00,The Keystone Newsroom,"With no end to budget impasse in sight, Pa. school districts and counties warn of program cuts",,,,,,https://keystonenewsroom.com/2025/09/30/with-no-end-to-budget-impasse-in-sight-pa-school-districts-and-counties-warn-of-program-cuts/,The 2025-2026 state budget is overdue by three months as partisan gridlock drags on.,,https://keystonenewsroom.com/wp-content/uploads/sites/10/2025/04/harrisburg-capitol.jpg,,,2025-09-30 22:56:17.805229
,Kentucky,2025-10-01 00:47:28+00:00,The Times of India,Nebraska governor taps Trump’s programme to expand private school funding despite voter repeal - The Times of India,,,,,,https://timesofindia.indiatimes.com/education/news/nebraska-governor-taps-trumps-programme-to-expand-private-school-funding-despite-voter-repeal/articleshow/124245437.cms,"News News: Nebraska Gov. Jim Pillen has signed an executive order opting into Donald Trump’s new federal school choice tax credit programme, allowing families to",,"https://static.toiimg.com/thumb/msid-124245467,width-1070,height-580,imgsize-148596,resizemode-75,overlay-toi_sw,pt-32,y_pad-40/photo.jpg",,,2025-10-01 00:56:06.900984
,Maine,2025-10-01 00:16:07+00:00,www.newscentermaine.com,These Maine programs face major cutbacks as federal funding ends | newscentermaine.com,,,,,,https://www.newscentermaine.com/video/news/local/outreach/these-maine-programs-face-major-cutbacks-as-federal-funding-ends/97-dec0e668-5a58-43a8-a2e6-7c253357ba7b,"Several Maine programs, including nutrition education and transportation services, face closure due to funding cuts. Author: newscentermaine.com.",,,,,2025-09-30 21:56:13.914805
,Maine,2025-10-01 00:12:43+00:00,www.youtube.com,These Maine programs face major cutbacks as federal funding ends - YouTube,,,,,,https://www.youtube.com/watch%3Fv%3DmwIVqZfkDck,"Several Maine programs, including nutrition education and transportation services, face closure due to funding cuts.",,,,,2025-09-30 21:56:13.914805
,West Virginia,2025-09-30 23:05:27+00:00,WBOY.com,WVU Upward Bound program officially loses federal funding,,,,,,https://www.wboy.com/news/education/wvu-upward-bound-program-officially-loses-federal-funding/amp/,West Virginia University Upward Bound faced its last day of federal funding on Tuesday after the Department of Education elected not to continue it.,,https://www.wboy.com/wp-content/uploads/sites/43/2025/09/ub-oc.00_00_08_08.Still001.jpg?w=1280,,,2025-09-30 21:56:13.914805
,Maine,2025-09-30 22:59:39+00:00,www.newscentermaine.com,Programs across Maine lose funding as of Sept. 30,,,,,,https://www.newscentermaine.com/article/news/local/outreach/outreach-programs-maine-lose-funding-september-2025/97-558c2660-0e0e-48de-9d8f-3493f8fe20bd,The U.S. Department of Education is discontinuing federal funding for the University of Southern Maine's Veterans Upward Bound program and the ...,,,,,2025-09-30 19:56:53.320052
,New York City,2025-09-30 22:47:56+00:00,HuffPost,Zohran Mamdani Issues Defiant Response To Donald Trump’s Funding Threat,,,,,,https://www.huffpost.com/entry/mamdami-trump-threat_n_68db8d20e4b0d2dd3157c3e2,The New York City mayoral candidate promised to do one thing.,,https://img.huffingtonpost.com/asset/68dba07a140000f1705c66fb.jpeg?cache=Ubk5R4twKx&ops=500_281%2Cscalefit_1200_630,,,2025-10-01 03:56:43.821619
,Education Funding,2025-09-30 22:30:57+00:00,WBFF,Feds warn Maryland schools could lose funding over gender identity policies,,,,,,https://foxbaltimore.com/spotlight-on-maryland/feds-warn-maryland-schools-could-lose-funding-over-gender-identity-policies,"Maryland public schools could lose federal funding over gender identity policies, as a clash escalates between the U.S. Department of Education and the Maryland",,https://foxbaltimore.com/resources/media2/16x9/1920/986/center/90/e7bafdc8-dfa0-40f4-92de-49292208b357-Sequence07.00_00_00_00.Still001.jpg,,,2025-09-30 22:56:17.805229
,Education Funding,2025-09-30 22:29:10+00:00,K-12 Dive,"FCC removes school bus Wi-Fi, hotspots from E-rate",,,,,,https://www.k12dive.com/news/fcc-removes-school-bus-wi-fi-hotspots-from-e-rate/761481/,The Federal Communications Commission vote reverses a Biden administration expansion of federal discounts for internet services for schools and libraries.,,https://imgproxy.divecdn.com/i30LQ9uL7T4ipySGYgVPjJAEP5CaXzYxOWY77APtVJM/g:ce/rs:fit:770:435/Z3M6Ly9kaXZlc2l0ZS1zdG9yYWdlL2RpdmVpbWFnZS9HZXR0eUltYWdlcy0xMTY4OTM0MTYxLmpwZw==.webp,,,2025-09-30 22:56:17.805229
,Education Funding,2025-09-30 22:08:44+00:00,Chalkbeat,CTU president: Chicago Public Schools should “absolutely” sue Trump administration over magnet school grant cuts,,,,,,https://www.chalkbeat.org/chicago/2025/09/30/ctu-president-stacy-davis-gates-said-cps-should-sue-feds-over-magnet-grants/,Chicago Public Schools and Mayor Brandon Johnson’s office said they are “considering all legal options” when it comes to responding to the federal government’s decision to cut off some magnet school funding.,,https://www.chalkbeat.org/resizer/v2/N4V6EJDJ7JESLD2T2BTWXMS7JI.jpg?smart=true&auth=c28e5ea24f877e51aed977800ea830bfa2f4c59c32b11808f116a6ef652c53e4&width=1200&height=630,,,2025-09-30 18:57:08.734339
,Pennsylvania,2025-09-30 21:52:23+00:00,Union-Bulletin,Pennsylvania could be on the cusp of a ‘double-whammy’ of government dysfunction,,,,,,https://www.union-bulletin.com/news/national/pennsylvania-could-be-on-the-cusp-of-a-double-whammy-of-government-dysfunction/article_7e45662f-cef1-5be2-9023-471ab58b0c76.html,"Pennsylvania school districts are taking out loans to keep schools running. Counties have had to furlough staff. Now, add to the ongoing state budget impasse a federal government shutdown threatening",,https://bloximages.newyork1.vip.townnews.com/union-bulletin.com/content/tncms/custom/image/742560ca-072e-11eb-8f70-07c5f8794a75.jpg?resize=600%2C403,,,2025-09-30 17:56:45.633148
,Maine,2025-09-30 21:33:46+00:00,www.newscentermaine.com,Slew of Maine organizations lose federal funding Sept. 30 | newscentermaine.com,,,,,,https://www.newscentermaine.com/video/news/local/outreach/slew-of-maine-organizations-lose-federal-funding-sept-30/97-0951ad4f-9bcd-4f68-b1a7-908c6c3cebc3,There are a slew of organizations in Maine that are losing federal funding starting Sept. 30. Here's a closer look at a few programs that are ...,,,,,2025-09-30 17:56:45.633148
,Kentucky,2025-09-30 21:12:59+00:00,WUKY,"In its latest bid to unfreeze federal dollars, Kentucky has regained millions in federal EV funds ",,,,,,https://www.wuky.org/wuky-news/2025-09-30/in-its-latest-bid-to-unfreeze-federal-dollars-kentucky-has-regained-millions-in-federal-ev-funds,Kentucky has seen $17.8 million in federal funding for electric vehicle charging stations restored.,,https://npr.brightspotcdn.com/dims4/default/88b31ba/2147483647/strip/true/crop/1024x538+0+85/resize/1200x630!/quality/90/?url=http%3A%2F%2Fnpr-brightspot.s3.amazonaws.com%2F0d%2Fc1%2F951b01444faea61882b78a545ab2%2Fclimate-indicators-23317792191238.jpg,,,2025-09-30 18:57:08.734339
,Alabama,2025-09-30 20:16:15+00:00,blackpressusa.com,Alabama’s CHOOSE Act: A Promise and a Responsibility,,,,,,https://blackpressusa.com/alabamas-choose-act-a-promise-and-a-responsibility/,"BLACKPRESSUSA NEWSWIRE — Alabama’s CHOOSE Act expands education savings accounts to homeschooling families, offering up to $7,000 for approved educational expenses. The opportunity is significant, but lawmakers must ensure accountability without imposing one-size-fits-all rules that could undermine educational freedom.",,https://blackpressusa.com/wp-content/uploads/2025/09/Alabamas-CHOOSE-Act-A-Promise-and-a-Responsibility-1000x600.jpg,,,2025-09-30 16:57:23.757383
,Maine,2025-09-30 19:27:06+00:00,The Portland Press Herald,Why this federal shutdown could be different for Maine,,,,,,https://www.pressherald.com/2025/09/30/why-this-federal-shutdown-could-be-different-for-maine/,"Gov. Janet Mills said, unlike in the past, the state has not received any details about which departments or services would be affected. ",,https://www.pressherald.com/wp-content/uploads/sites/4/2025/09/43050308_M-Acadia-beehive.jpg,,,2025-09-30 15:58:01.713098
,Kentucky,2025-09-30 19:11:49+00:00,spectrumnews1.com,Pair of universities awarded million dollar grants to boost student success,,,,,,https://spectrumnews1.com/ky/northern-ky/news/2025/09/30/trio-grants-bellarmine-spalding,Bellarmine and Spalding both received the highly competitive TRIO Student Support Services grant from the U.S. Department of Education.,,https://s7d2.scene7.com/is/image/TWCNews/bellarmine_university_ky_0725,,,2025-09-30 16:57:23.757383
,Education Funding,2025-09-30 19:05:09+00:00,Education Week,Federal Changes Have Some Educators Rethinking Whether to Stay in Their Jobs,,,,,,https://www.edweek.org/leadership/federal-changes-have-some-educators-rethinking-whether-to-stay-in-their-jobs/2025/09,A new survey shows potential spillover effects in school districts from a uniquely volatile federal policy environment.,,https://epe.brightspotcdn.com/dims4/default/12460ad/2147483647/strip/true/crop/5364x3577+0+0/resize/945x630!/quality/90/?url=https%3A%2F%2Fepe-brightspot.s3.us-east-1.amazonaws.com%2F09%2Fb7%2F70637f2c48e4bfd5c1bf89dabeaf%2F8w3a2500.jpg,,,2025-09-30 15:58:01.713098
,New York City,2025-09-30 18:17:56+00:00,Chalkbeat,"Budget drama, new curriculums, scandals: what to know about Adams’ education record",,,,,,https://www.chalkbeat.org/newyork/2025/09/30/eric-adams-nyc-education-record-public-schools-budget-curriculum-mandate/,"Eric Adams is known for threatening to slash the Education Department’s budget. But after fierce pushback, many of those cuts were reversed.",,https://www.chalkbeat.org/resizer/v2/JK3L2Y2OPFEEDEFMFDOOSPFZE4.jpg?smart=true&auth=79cdaff8cb5139e335077b36f063c42cc4bc040aec68330f1b34bf6671f1ef8f&width=1200&height=630,,,2025-09-30 14:57:26.325218
,Education Funding,2025-09-30 16:50:30+00:00,education.ohio.gov,Ohio awarded nearly $105 million to expand high-performing community schools,,,,,,https://education.ohio.gov/Media/Ed-Connection/Sept-30-2025/Ohio-awarded-nearly-%24105-million-to-expand-high-pe,Federal funding awarded to Ohio to support growth of high-performing community schools. Ohio Department of Education and Workforce Director Stephen D.,,,,,2025-09-30 14:57:26.325218
,Education Funding,2025-09-30 16:47:04+00:00,www.reuters.com,States to end nutrition education programs after Trump cuts - Reuters,,,,,,https://www.reuters.com/world/us/states-end-nutrition-education-programs-after-trump-cuts-2025-09-30/,Land-grant universities and public health departments typically funnel the federal dollars to organizations serving low-income communities with ...,,,,,2025-09-30 16:57:23.757383
,Education Funding,2025-09-30 15:10:54+00:00,U.S. Department of Education,U.S. Department of Education and U.S. Department of Health and Human Services Find that Minnesota Violated Title IX,,,,,,https://www.ed.gov/about/news/press-release/us-department-of-education-and-us-department-of-health-and-human-services-find-minnesota-violated-title-ix,"Today, the U.S. Department of Education’s OCR and the U.S. Department of Health and Human Services’ OCR announced that the Minnesota Department of Education and the Minnesota State High School League violated Title IX.",,http://www.ed.gov/themes/custom/edgov/images/ed-og.png,,,2025-09-30 11:57:53.945155
,Maine,2025-09-30 15:09:22+00:00,spectrumlocalnews.com,Augusta parents learn more about proposal to close Hussey school,,,,,,https://spectrumlocalnews.com/me/maine/education/2025/09/30/augusta-parents-learn-more-about-proposal-to-close-hussey-school,"Parents asked about whether the funding is secure, and Cogan said state funded projects do not rely on federal money. They said the new design would include safety measures and updated designs to accommodate more hands-on learning and flexible spaces.",,https://s7d2.scene7.com/is/image/TWCNews/Hussey_parents_horizontal_ME_0930,,,2025-09-30 11:57:53.945155
,Education Funding,2025-09-30 14:53:22+00:00,fsapartners.ed.gov,2025–26 Supplemental Campus-Based Funds | Knowledge Center - FSA Partner Connect,,,,,,https://fsapartners.ed.gov/knowledge-center/library/electronic-announcements/2025-09-30/2025-26-supplemental-campus-based-funds,"20, 2025) to reallocate unexpended Federal Supplemental Educational Opportunity Grant (FSEOG) and the Federal Work-Study (FWS) program funds from ...",,,,,2025-09-30 11:57:53.945155
,New York City,2025-09-30 14:33:49+00:00,Becker’s Behavioral Health,Federal cuts slash $168M in school mental health funding - Becker’s Behavioral Health,,,,,,https://www.beckersbehavioralhealth.com/behavioral-health-capital-investment/federal-cuts-slash-168m-in-school-mental-health-funding/,"As students return to school this fall, mental health resources may look different, with some school districts preparing to lay off behavioral health providers. Nearly $168 million in school-based mental health grants were cancelled by the federal government mid-cycle, and now schools are scrambling to respond, according to a Sept. 4 report from the Milwaukee […]",,https://www.beckersbehavioralhealth.com/wp-content/uploads/sites/3/2025/03/BeckersBehavioralHealth.jpeg,,,2025-09-30 11:57:53.945155
,Oklahoma,2025-09-30 14:26:57+00:00,KGOU - Oklahoma's NPR Source,Oklahoma’s polarizing education chief to formally resign Tuesday,,,,,,https://www.kgou.org/education/2025-09-30/oklahomas-polarizing-education-chief-to-formally-resign-tuesday,"State Superintendent Ryan Walters will submit his letter of resignation from elected office on Tuesday, his senior adviser confirmed, bringing to an end a short but highly scrutinized tenure that divided even his fellow Republicans.",,https://npr.brightspotcdn.com/dims4/default/e0c774f/2147483647/strip/true/crop/1536x806+0+194/resize/1200x630!/quality/90/?url=http%3A%2F%2Fnpr-brightspot.s3.amazonaws.com%2F82%2F6e%2F3fe0f96c40c9a7f5883859faa7c0%2Fp4253034-1536x1152.jpg,,,2025-09-30 10:56:39.866937
,Education Funding,2025-09-30 14:13:14+00:00,www.acenet.edu,"Government Shutdown Could Set Off Uncertainty for Research, Oversight, Some Student Benefits and Services ",,,,,,https://www.acenet.edu/News-Room/Pages/Shutdown-Uncertainty-Research-Oversight-Student-Services.aspx,"While shutdowns historically have limited effects on colleges and universities, this one would arrive amid broader uncertainty about federal education programs, research funding, and the role of executive authority in determining spending priorities. ",,https://www.acenet.edu/PublishingImages/Photo-Library/us_capitolbuilding.jpg?RenditionID=14,,,2025-09-30 10:56:39.866937
,Education Funding,2025-09-30 13:59:57+00:00,www.thestate.com,"Without federal education funding, SC would need $680M to cover school costs - The State",,,,,,https://www.thestate.com/news/local/education/article312307190.html,"If South Carolina refused education funding from the federal government, it may need $680 million to cover education department and public school ...",,,,,2025-09-30 10:56:39.866937
,Education Funding,2025-09-30 13:48:21+00:00,aldailynews.com,Two Alabama charter school groups awarded $45 million in federal grants,,,,,,https://aldailynews.com/two-alabama-charter-school-groups-awarded-45-million-in-federal-grants/,This is a significant boost for the charter school sector and a new wave of educational opportunities for students and families.,,,,,2025-09-30 10:56:39.866937
,New York City,2025-09-30 13:43:25+00:00,Resistbot,Demand Action Against Trump's Illegal Threats to NYC Funding,,,,,,https://resist.bot/petitions/PZCJPE,Text SIGN PZCJPE to 50409 to send this to your officials.,,https://resist.bot/api/og/petition/petition?title=Demand+Action+Against+Trump%27s+Illegal+Threats+to+NYC+Funding&shareCode=PZCJPE&target=CONGRESS&city=&state=,,,2025-09-30 09:56:17.445561
,New York City,2025-09-30 13:29:17+00:00,www.nyc.gov,Mayor Adams Announces Release of $93 Billion Fiscal Year 2026 September Capital ... - NYC.gov,,,,,,https://www.nyc.gov/mayors-office/news/2025/09/mayor-adams-announces-release-of--93-billion-fiscal-year-2026-se,"“Building off our 'Best Budget Ever,' we are proud to unveil the largest September Capital Commitment Plan in New York City history that invests ...",,,,,2025-09-30 11:57:53.945155
,California,2025-09-30 12:50:14+00:00,CBS47 and KSEE24 | News from YourCentralValley.com,What happens now that a government shutdown is underway,,,,,,https://www.yourcentralvalley.com/news/u-s-world/ap-what-will-happen-if-theres-a-government-shutdown-at-days-end/,WASHINGTON (AP) — Washington is bracing for what could be a prolonged federal shutdown after lawmakers deadlocked and missed the deadline for funding the government. Republicans supported a short-t…,,https://www.yourcentralvalley.com/wp-content/uploads/sites/54/2025/10/68dd0be6dd5ac2.95512200.jpeg?w=1280,,,2025-10-01 07:56:58.524061
