id,name,published,outlet,title,authors,category,market,categoryorder,articleorder,url,description,text,image,error,sentiment,firstEyes
,West Virginia,2025-07-19 11:01:37+00:00,The Times of India,US Education Department releases $1.3 billion for after-school programs after legal and political pressure - Times of India,,,,,,https://timesofindia.indiatimes.com/education/news/us-education-department-releases-1-3-billion-for-after-school-programs-after-legal-and-political-pressure/articleshow/122779040.cms,"News News: The US Department of Education has released $1.3 billion for after-school and summer programs, offering relief after a funding freeze. This decision f",,"https://static.toiimg.com/thumb/msid-122779051,width-1070,height-580,imgsize-2242810,resizemode-75,overlay-toi_sw,pt-32,y_pad-40/photo.jpg",,,2025-07-19 23:04:55.068650
,Connecticut,2025-07-19 10:54:21+00:00,www.pressreader.com,"State braces for 'Big, Beautiful Bill' - PressReader",,,,,,https://www.pressreader.com/usa/the-middletown-press-middletown-ct/20250719/281479282449036,"... education system, from school meals to student loans. At a time when large chunks of federal funding are already in jeopardy at Connecticut schools ...",,,,,2025-07-19 23:04:55.068650
,Oklahoma,2025-07-19 10:44:05+00:00,www.msn.com,Oklahoma PBS and NPR stations face funding cuts after congressional decision - MSN,,,,,,https://www.msn.com/en-us/news/us/oklahoma-pbs-and-npr-stations-face-funding-cuts-after-congressional-decision/ar-AA1ISjOD,"Oklahoma's PBS and NPR stations will no longer receive financial support from the federal government. Sen. James Lankford, who voted in favor of the ...",,,,,2025-07-19 23:04:55.068650
,West Virginia,2025-07-19 09:58:30+00:00,therealwv.com,Capito announces release of federal funding for 21st Century Community Learning Centers,,,,,,https://therealwv.com/2025/07/19/capito-announces-release-of-federal-funding-for-21st-century-community-learning-centers/,"By RealWV Staff,



WASHINGTON, D.C. — On July 18, U.S. Senator Shelley Moore Capito (R-W.Va.), chairman of the Senate Appropriations Subcommittee on Labor, H",,https://therealwv.com/wp-content/uploads/2024/11/IMG_5365-scaled.jpg,,,2025-07-19 23:04:55.068650
,Connecticut,2025-07-19 09:53:07+00:00,Hartford Courant,What CT school districts would feel federal cuts the most?,,,,,,https://www.courant.com/2025/07/19/what-ct-school-districts-would-feel-federal-cuts-the-most/,"“Districts will have to cut or stop programs or let individuals go because this grant funding is not there, and they don’t know when it will be there,” said Michael Morton of the School + Sta…",,https://www.courant.com/wp-content/uploads/migration/2022/07/13/MZFEZTCJXDNSH3KDNOC2DN2DXI.jpg?w=1024&h=670,,,2025-07-19 23:04:55.068650
,West Virginia,2025-07-19 09:43:43+00:00,Yahoo News,Beshear calls for rest of federal education funds to be unfrozen after partial release,,,,,,https://www.yahoo.com/news/beshear-calls-rest-federal-education-090555842.html,"The initial funding freeze left Kentucky shorted $96 million, but it is unclear how much of the released funding will go to Kentucky.",,https://s.yimg.com/ny/api/res/1.2/v_rRIaCCqp7qRuHu0F3dqQ--/YXBwaWQ9aGlnaGxhbmRlcjt3PTEyMDA7aD04MDA7Y2Y9d2VicA--/https://media.zenfs.com/en/the-courier-journal/46b753a9644799d578a362cc00a87d37,,,2025-07-19 23:04:55.068650
,Arizona,2025-07-19 09:34:01+00:00,Straight Arrow News,"Trump administration to release funds for after-school, summer programming",,,,,,https://san.com/media-miss/trump-administration-to-release-funds-for-after-school-summer-programming/,"The Trump administration will release $1.3 billion in previously withheld grant money for after-school programs after pressure from Republican senators. Funding will support programs like the 21st Century Community Learning Centers, which assist low-income families and children across the nation. Advocates, including Jodi Grant from the Afterschool Alliance, noted that delays caused significant disruptions, with...",,https://san.com/wp-content/uploads/2025/07/CLEAN-School-funding_Getty-Images_featuredImage_Fri-Jul-18-2025.jpg,,,2025-07-19 23:04:55.068650
,Arizona,2025-07-19 09:09:55+00:00,azfreenews.com,Desert Sage High School - AZ FREE NEWS,,,,,,https://azfreenews.com/tag/desert-sage-high-school/,"Alhambra Elementary School District in Phoenix has a subcommittee ... In an application for federal charter school start-up grants for 2024-2028, Desert ...",,,,,2025-07-19 23:04:55.068650
,Kentucky,2025-07-19 09:07:04+00:00,The Courier-Journal,Beshear calls for rest of federal education funds to be unfrozen after partial release,,,,,,https://www.courier-journal.com/story/news/education/2025/07/19/kentucky-gov-beshear-calls-for-entirety-of-frozen-education-funding/85281353007/,"The initial funding freeze left Kentucky shorted $96 million, but it is unclear how much of the released funding will go to Kentucky.",,"https://www.courier-journal.com/gcdn/authoring/authoring-images/2025/05/16/PLOU/83680207007-usatsi-24033742.jpg?crop=1399,788,x0,y72&width=1399&height=788&format=pjpg&auto=webp",,,2025-07-19 23:04:55.068650
,Kentucky,2025-07-19 09:06:24+00:00,lexingtonky.news,"'Difficult process': KET, public radio stations slammed by end of federal funding",,,,,,https://lexingtonky.news/2025/07/18/difficult-process-ket-public-radio-stations-slammed-by-end-of-federal-funding/,"... Kentucky and providing trusted, educational programs and services.” come. The federal funding cuts will also affect public radio stations across ...",,,,,2025-07-19 23:04:55.068650
,Louisiana,2025-07-19 09:03:51+00:00,NOLA.com,Louisiana schools will get after-school grants that were withheld by the Trump administration,,,,,,https://www.nola.com/news/louisiana-trump-afterschool-program-grants/article_2dcdcd04-806a-48a1-9c63-9200593a12fb.html,"Louisiana is set to receive nearly $28 million for after-school programs that had been held up by the Trump administration, thought other education grants remain paused.",,https://bloximages.newyork1.vip.townnews.com/nola.com/content/tncms/assets/v3/editorial/6/08/608bdc43-e300-50e8-a971-f3c271566861/6866e3c27c875.image.jpg?crop=1781%2C935%2C0%2C114&resize=1200%2C630&order=crop%2Cresize,,,2025-07-19 23:04:55.068650
,West Virginia,2025-07-19 08:39:48+00:00,www.msn.com,County officials raise alarms over federal education cuts impacting Clark County schools,,,,,,http://www.msn.com/en-us/news/us/county-officials-raise-alarms-over-federal-education-cuts-impacting-clark-county-schools/ar-AA1IG81K%3Fapiversion%3Dv2%26noservercache%3D1%26domshim%3D1%26renderwebcomponents%3D1%26wcseo%3D1%26batchservertelemetry%3D1%26noservertelemetry%3D1,MAP: Here's when kids go back to school in West Virginia. DC News Now. MAP: Here's when kids go back to school in West Virginia. 7 of the Biggest RMD ...,,,,,2025-07-19 23:04:55.068650
,Connecticut,2025-07-19 07:03:15+00:00,India Today,Trump freezes $6 billion in public school funds right before school year begins,,,,,,https://www.indiatoday.in/education-today/news/story/trump-freezes-6-billion-in-public-school-funds-right-before-school-year-begins-2758051-2025-07-19,"The Trump administration has delayed and reduced billions in K–12 funding before the term begins. These federal funds, critical for after‑school programmes, teacher training, English-language learning and student support, are now under review by the Office of Management and Budget. ",,https://akm-img-a-in.tosshub.com/indiatoday/images/story/202507/us-president-donald-trump-19103340-16x9_0.png?VersionId=jaJ1RkiSye2_mF6YWVF4vQcSRWziaQ53,,,2025-07-19 23:04:55.068650
,Alabama,2025-07-19 06:01:39+00:00,www.msn.com,GOP senators demand Trump release $6.8 billion in key education funds - MSN,,,,,,https://www.msn.com/en-us/news/politics/gop-senators-demand-trump-release-68-billion-in-key-education-funds/ar-AA1INHc1,"... federal education funds. These funds, initially approved by ... For instance, Alabama's Superintendent of Education, Eric Mackey, has ...",,,,,2025-07-20 01:54:48.071160
,Alabama,2025-07-19 05:40:04+00:00,WVTM,Alabama Public Television's future uncertain after House passes federal bill to cut funding,,,,,,https://www.wvtm13.com/article/alabama-public-television-funding-cuts/65453002,"APT could lose $2.8 million if the bill is signed. That would affect operations and programming like ""Sesame Street.""",,"https://kubrick.htvapps.com/htv-prod-media.s3.amazonaws.com/images/gettyimages-1817241312-1-687b0a177b727.jpg?crop=1.00xw:0.847xh;0,0&resize=1200:*",,,2025-07-19 23:04:55.068650
,Alabama,2025-07-19 05:36:22+00:00,TimesDaily,Britt: Federal funds for summer learning programs to be released,,,,,,https://www.timesdaily.com/news/education/britt-federal-funds-for-summer-learning-programs-to-be-released/article_bcf0f9fc-d64b-4958-ae84-a936a824c9c0.html,BIRMINGHAM — U.S. Sen. Katie Britt announced Friday morning that some of Alabama’s previously frozen federal educational funding – funds that support after-school and summer learning – will be released.,,https://bloximages.newyork1.vip.townnews.com/timesdaily.com/content/tncms/assets/v3/editorial/2/3f/23f52d2e-dd5a-4c03-ba43-6a626c5b18ea/687ab5cfc7b0a.image.jpg?crop=1158%2C608%2C0%2C443,,,2025-07-19 23:04:55.068650
,Connecticut,2025-07-19 05:22:16+00:00,New Haven Register,Education Department will release some frozen grants supporting after-school and summer programs,,,,,,https://www.nhregister.com/news/education/article/education-department-will-release-some-frozen-20775698.php,The Education Department plans to release previously withheld grant money for after-school programs. This decision comes days after 10 Republican senators urged the Office of Management and Budget to...,,https://s.hdnux.com/photos/01/53/56/01/28237947/3/rawImage.jpg,,,2025-07-19 23:04:55.068650
,Alabama,2025-07-19 05:12:33+00:00,Decatur Daily,Britt: Federal funds for Alabama summer learning programs to be released,,,,,,https://www.decaturdaily.com/news/other_news/state/britt-federal-funds-for-alabama-summer-learning-programs-to-be-released/article_f1a4cba2-27f6-49bf-a7d3-d72ac55af526.html,"U.S. Sen. Katie Britt announced Friday morning that some of Alabama’s $68 million in frozen federal educational funding — funds that support after-school and summer learning, including two Decatur Boys",,https://bloximages.newyork1.vip.townnews.com/decaturdaily.com/content/tncms/assets/v3/editorial/6/bb/6bbffe30-e970-11ef-900e-272303073d32/67acea6c7d6f3.image.jpg?crop=635%2C333%2C0%2C256,,,2025-07-19 23:04:55.068650
,Arizona,2025-07-19 04:50:32+00:00,NewsBreak,Local before and after-school programs are saved for next school year after feds release some education grant money - NewsBreak,,,,,,https://www.newsbreak.com/arizona-luminaria-1707246/4117457842813-local-before-and-after-school-programs-are-saved-for-next-school-year-after-feds-release-some-education-grant-money,The Tucson Unified School District learned Friday it can now provide before and after-school programs for its students — just 17 days before the new school,,https://img.particlenews.com/img/id/37voEf_12rqldNS00,,,2025-07-19 23:04:55.068650
,Maine,2025-07-19 04:41:47+00:00,The Missoula Current News - Daily News in Missoula Montana,Montana waiting for $6.8B in ed funding held by Trump administrat,,,,,,https://missoulacurrent.com/montana-education-funding/,The Trump administration is still sitting on $6.8 billion in authorized and approved Congressional funding for public education.,,https://townsquare.media/site/1098/files/2022/10/attachment-Money.jpg?w=1200&q=75&format=natural,,,2025-07-19 23:04:55.068650
,Kentucky,2025-07-19 04:17:40+00:00,Kentucky Today,Education Department will release some frozen grants supporting after-school and summer programs,,,,,,https://www.kentuckytoday.com/news/education-department-will-release-some-frozen-grants-supporting-after-school-and-summer-programs/article_8d5dd47d-4b5f-5920-af65-ca11afe5cab4.html,The Education Department plans to release previously withheld grant money for after-school programs. This decision comes days after 10 Republican senators urged the Office of Management and Budget to release,,https://bloximages.newyork1.vip.townnews.com/kentuckytoday.com/content/tncms/assets/v3/editorial/d/cb/dcb34887-9960-5536-b227-afdc41429605/687b18adef44d.image.jpg?crop=1763%2C926%2C0%2C124&resize=1200%2C630&order=crop%2Cresize,,,2025-07-19 23:04:55.068650
,West Virginia,2025-07-19 04:16:37+00:00,Yahoo News,MAP: Here’s when kids go back to school in West Virginia,,,,,,https://www.yahoo.com/news/map-kids-back-school-west-020802580.html,"Kids might not want to hear it, but back-to-school season is quickly approaching",,https://media.zenfs.com/en/wboy_clarksburg_articles_885/b3d397503420c1d8b0df858d499e7558,,,2025-07-19 23:04:55.068650
,Pennsylvania,2025-07-19 04:15:27+00:00,lewistownsentinel.com,More than $500K in missing federal funds discussed,,,,,,https://www.lewistownsentinel.com/news/local-news/2025/07/more-than-500k-in-missing-federal-funds-discussed/,"LEWISTOWN — The Mifflin County School District’s Board of Directors met Thursday to discuss $524,298 in missing federal funds, potential Academy improvements, and other business at the Committee of the Whole meeting. Superintendent Vance Varner addressed the Board at the start of the meeting stating that discussion about missing federal funds from the previously approved […]",,http://d14e0irai0gcaa.cloudfront.net/www.lewistownsentinel.com/images/2017/01/31093349/fb1.jpg,,,2025-07-19 23:04:55.068650
,West Virginia,2025-07-19 03:23:26+00:00,The Center Square,"Literacy grants of $45M going to 33 Ohio schools, districts",,,,,,https://www.thecentersquare.com/ohio/article_5f90cc18-389a-460c-8c78-1f4673340ddb.html,"(The Center Square) – At a time when the U.S. Department of Education is pausing federal funding allocations to states, Ohio announced it’s sending more than $45 million in federal",,https://bloximages.newyork1.vip.townnews.com/thecentersquare.com/content/tncms/assets/v3/editorial/b/2f/b2fd1598-bd6b-11ef-ba33-cb72e09b2b94/676310ce73171.image.jpg?crop=1096%2C575%2C0%2C101,,,2025-07-19 23:04:55.068650
,Arizona,2025-07-19 03:06:15+00:00,The Bradenton Times,Some frozen federal funds for schools released to states by Trump administration - The Bradenton Times,,,,,,"https://thebradentontimes.com/stories/some-frozen-federal-funds-for-schools-released-to-states-by-trump-administration,152057","WASHINGTON — President Donald Trump’s administration confirmed Friday that it’s releasing funds that support before- and after-school programs as well as summer programs, a portion of the $6.8  &hellip;",,,,,2025-07-19 23:04:55.068650
,Arizona,2025-07-19 02:41:06+00:00,https://www.kold.com,$1.3 billion in funding released by U.S. Department of Education,,,,,,https://www.kold.com/2025/07/19/13-billion-funding-released-by-us-department-education/,"About two weeks since the U.S. Department of Education withheld over $6 billion in federal funding for schools nationwide – a little over $1 billion has been released for after-school programs. According to state superintendent Tom Horne, in the current fiscal year, Arizona receives around $24 million in after-school funds. And while this is a big deal – there’s still over $5 billion being withheld.",,https://gray-kold-prod.gtv-cdn.com/resizer/v2/MYETISRDQBH4BAROAIGCBXPMXM.jpg?auth=608ccf7f84446dc408d78bc40d9a297b537c6757f111a19650a0a6941104acac&width=1200&height=600&smart=true,,,2025-07-19 23:04:55.068650
,New York City,2025-07-19 02:39:50+00:00,New Jersey Globe,D.C. Dispatch: What N.J.’s members of Congress did in Washington this week - New Jersey Globe,,,,,,https://newjerseyglobe.com/congress/d-c-dispatch-what-n-j-s-members-of-congress-did-in-washington-this-week-54/,"With the One Big Beautiful Bill in the rearview mirror, Congress returned this week to more standard business – which, of course, means that it was still",,https://newjerseyglobe.com/wp-content/uploads/2025/07/Norcross-Sherrill-NDAA.jpg,,,2025-07-19 23:04:55.068650
