id,name,published,outlet,title,authors,category,market,categoryorder,articleorder,url,description,text,image,error,sentiment,firstEyes
,West Virginia,2025-07-20 14:15:11+00:00,NPR,"In the West Virginia mountains, a radio station is caught in the funding cut crossfire",,,,,,https://www.npr.org/2025/07/20/nx-s1-5470216/in-the-west-virginia-mountains-a-radio-station-is-caught-in-the-funding-cut-crossfire,"Allegheny Mountain Radio, a network of three community stations, is not an NPR member station. But it will get caught in the crossfire of funding cuts.",,https://media.npr.org/include/images/facebook-default-wide-s1400-c100.jpg,,,2025-07-20 11:56:15.175885
,Alabama,2025-07-20 13:59:06+00:00,aldailynews.com,"Capitol Journal - July 18, 2025 - Alabama Daily News",,,,,,https://aldailynews.com/capitol-journal-july-18-2025/,"Britt: Federal funds for Alabama summer learning programs to be released 7/18/25; In the Weeds: Federal funding. Boy, I don't know. 7/18/25; House ...",,,,,2025-07-20 10:57:49.143080
,Oklahoma,2025-07-20 13:41:34+00:00,www.msn.com,Why the Trump administration froze $7.5M in funding for Oklahoma CareerTech - MSN,,,,,,https://www.msn.com/en-us/news/us/why-the-trump-administration-froze-75m-in-funding-for-oklahoma-careertech/ar-AA1IU0v3,Over $7.5 million in federal grants were not distributed to Oklahoma CareerTech at the beginning of the fiscal year to fund adult education ...,,,,,2025-07-20 11:56:15.175885
,Salt Lake City,2025-07-20 13:17:48+00:00,www.ksl.com,"Federal budget cuts could impact Utah after-school, summer programs",,,,,,https://www.ksl.com/article/51345852/federal-budget-cuts-could-impact-utah-after-school-summer-programs,Many South Salt Lake after-school and summer programs — and similar programs across the state and nation — could be in jeopardy because of recent federal cash freezes.,,https://img.ksl.com/slc/3100/310055/31005523.jpg?filter=kslv2/responsive_story_lg,,,2025-07-20 10:57:49.143080
,Alabama,2025-07-20 11:45:13+00:00,BirminghamWatch,"BW Recommends | July 20, 2025 - BirminghamWatch",,,,,,https://birminghamwatch.org/2025/07/20/bw-recommends-july-20-2025/,"BW Recommends is a rundown of stories you might have missed this week. It offers insight into issues important to our area and sometimes tickles your curiosity. Soon we’ll be offering Recommends via email. Sign up here to receive it. You can also sign up for The WeeklyWatch, the stories we’ve pub",,https://birminghamwatch.org/wp-content/uploads/2025/06/BirminghamWatch-graphic.jpeg,,,2025-07-20 10:57:49.143080
,Education Funding,2025-07-20 11:20:35+00:00,Raccoon Valley Radio - The One to Count On,Perry Superintendent Clark Wicks Responds to Title Funds Freeze Affecting the United States,,,,,,https://www.raccoonvalleyradio.com/2025/07/20/perry-superintendent-clark-wicks-responds-to-title-funds-freeze-affecting-the-united-states-2/,"A decision at the federal level is impacting school districts in the United States, including Iowa, as the leader from the Perry Community School District offers his stance. On June 30th, the U.S. Department of Education as",,https://dehayf5mhw1h7.cloudfront.net/wp-content/uploads/sites/1074/2025/01/11113507/perry-schools-1024x488.jpg,,,2025-07-20 07:56:26.896692
,Education Funding,2025-07-20 11:07:27+00:00,kiowacountypress.net,Some frozen federal funds for schools released to states by Trump administration,,,,,,https://kiowacountypress.net/content/some-frozen-federal-funds-schools-released-states-trump-administration,President Donald Trump's administration is releasing funds that support before- and after-school programs as well as summer programs.,,,,,2025-07-20 07:56:26.896692
,Education Funding,2025-07-20 11:01:08+00:00,St. Cloud Live,"St. Cloud schools waiting on $1M in federal grants, adding to budget challenges",,,,,,https://www.stcloudlive.com/news/local/st-cloud-schools-waiting-on-1m-in-federal-grants-adding-to-budget-challenges,"As of July 17, school districts across the state are waiting a total of more than $74 million in federal education funding, according to the Minnesota Office of Management and Budget. The U.S. Department of Education did not provide states with information about their grant awards by a July 1…",,https://cdn.forumcomm.com/dims4/default/f9a6207/2147483647/strip/true/crop/4000x3000+0+0/resize/1421x1066!/quality/90/?url=https%3A%2F%2Fforum-communications-production-web.s3.us-west-2.amazonaws.com%2Fbrightspot%2Fb9%2F34%2Fba663a3e4c48845b86f5c24a2fb2%2F20250409-081624.jpg,,,2025-07-20 07:56:26.896692
,Education Funding,2025-07-20 10:09:48+00:00,The Maine Monitor,What happens to school budgets when Mainers vote ‘no’?,,,,,,https://themainemonitor.org/rejected-school-budget-process/,At least a dozen school districts saw budget rejections this year. Here’s how they’re trying to move forward.,,https://themainemonitor.org/wp-content/uploads/2025/07/Gray-New-Gloucester-High-School.jpg,,,2025-07-20 06:57:09.633442
,Education Funding,2025-07-20 07:58:08+00:00,"WSVN 7News | Miami News, Weather, Sports | Fort Lauderdale","Education Department funding freeze targets summer school and language programs that are lifelines for families - WSVN 7News | Miami News, Weather, Sports | Fort Lauderdale",,,,,,https://wsvn.com/news/politics/education-department-funding-freeze-targets-summer-school-and-language-programs-that-are-lifelines-for-families/,"Arlington, VA (CNN) — Desperation crept into Sylvia’s voice as she rattled off all the ways her life would become more difficult if a free<a class=""excerpt-read-more"" href=""https://wsvn.com/news/politics/education-department-funding-freeze-targets-summer-school-and-language-programs-that-are-lifelines-for-families/"">Read More</a>",,https://wsvn.com/wp-content/uploads/sites/2/2025/07/cnn-L19jb21wb25lbnRzL2ltYWdlL2luc3RhbmNlcy9jbWQ2M2dkeWEwMDA1M2I2bjM4OGwybmRv-L19jb21wb25lbnRzL2FydGljbGUvaW5zdGFuY2VzL2NtZDYzZjc5ejAwMnUyN3FnM20yMzMzcnk.jpg?quality=60&strip=color,,,2025-07-20 07:56:26.896692
,Education Funding,2025-07-20 07:34:41+00:00,Iredell Free News,"I-SS, MGSD forced to make budget adjustments after Trump administration withholds $1.2 million, Iredell Free News",,,,,,https://www.iredellfreenews.com/news-features/2025/i-ss-mgsd-making-budget-adjustments-after-trump-administration-withholds-1-2-million-in-funding/,"BY KARISSA MILLER Almost $7 billion in federal education funding, which is distributed to local school systems through various programs and grants, has...",,https://www.iredellfreenews.com/wp-content/uploads/2022/05/iss-and-mgsd-logos.png,,,2025-07-20 06:57:09.633442
,Education Funding,2025-07-20 06:51:01+00:00,The Norfolk Daily News ,"Federal funding delays threaten student programs at NPS, Northeast",,,,,,https://norfolkdailynews.com/select/federal-funding-delays-threaten-student-programs-at-nps-northeast/article_2280b6ee-d235-4ffa-9ab3-935ea9e1a881.html,Lee Embley knows what it’s like to feel lost in a classroom.,,https://bloximages.newyork1.vip.townnews.com/norfolkdailynews.com/content/tncms/assets/v3/editorial/7/a2/7a25ec30-3d97-4d9c-a014-c4a19e797da2/687bbf453d410.image.jpg?crop=700%2C368%2C0%2C22,,,2025-07-20 03:56:27.002917
,Education Funding,2025-07-20 06:38:23+00:00,Roswell Daily Record,Local school districts preparing for federal cuts,,,,,,https://www.rdrnews.com/news/local/local-school-districts-preparing-for-federal-cuts/article_e5ec986b-c28a-4b98-aad2-646639efd5c5.html,The New Mexico Department of Justice (NMDOJ) this week joined about two dozen other states in legal action to stop the U.S. Department of Education from holding back more than,,https://bloximages.newyork1.vip.townnews.com/rdrnews.com/content/tncms/assets/v3/editorial/d/97/d974c966-8fc0-11ee-b4f9-8f782762fcee/687bd5bc8f859.image.jpg?crop=1744%2C916%2C0%2C136&resize=1200%2C630&order=crop%2Cresize,,,2025-07-20 03:56:27.002917
,West Virginia,2025-07-20 06:01:13+00:00,Scripps News,Trump administration will release some frozen grants supporting after-school and summer programs,,,,,,https://www.scrippsnews.com/us-news/education/trump-administration-will-release-some-frozen-grants-supporting-after-school-and-summer-programs,"After a bipartisan coalition of lawmakers complained about the funds being frozen, the Trump administration had decided to release funds for after-school programs.",,https://ewscripps.brightspotcdn.com/dims4/default/470fd7d/2147483647/strip/true/crop/5293x2779+0+0/resize/1200x630!/quality/90/?url=http%3A%2F%2Fewscripps-brightspot.s3.amazonaws.com%2F6c%2Fa8%2F674ed8f34cc8b114d0b5262e4f34%2Fap25196582860980.jpg,,,2025-07-20 14:56:19.638403
,Louisiana,2025-07-20 03:32:51+00:00,www.youtube.com,Louisiana schools to receive $28M in federal funding towards after-school programs,,,,,,https://www.youtube.com/watch%3Fv%3DzJCIhhDaxhc,Louisiana schools will receive $28 million in federal funding for summer school and after school programs.,,,,,2025-07-20 02:56:19.038258
,Education Funding,2025-07-20 02:13:57+00:00,www.facebook.com,The Trump administration's withholding of $165.6 million in federal grant funds that had ... - Facebook,,,,,,https://www.facebook.com/thepapermedia/posts/the-trump-administrations-withholding-of-1656-million-in-federal-grant-funds-tha/747816588210062/,"If 92% of school funding comes from state and local funding, why is a federal withholding attempt so frightening- because most are so enraged over ...",,,,,2025-07-20 03:56:27.002917
,Education Funding,2025-07-20 01:54:26+00:00,WFTV,"Federal government releases frozen funding for after-school programs, Boys & Girls Club",,,,,,https://www.wftv.com/news/local/federal-government-releases-frozen-funding-after-school-programs-boys-girls-club/ZF5MJITQSFE7ZLKBJB5SWXB3VM/,This funding will enable ongoing youth programs to operate smoothly,,https://cmg-cmg-tv-10070-prod.cdn.arcpublishing.com/resizer/v2/https%3A%2F%2Fcloudfront-us-east-1.images.arcpublishing.com%2Fcmg%2FPT25ZFGYZFUX75FN6D6WWPUDTY.jpg?auth=987f3c7d9b5171c577fb15f602624ae10d90af41c880d27ee9908c40bde13bf5&width=1200&height=630&smart=true,,,2025-07-20 03:56:27.002917
,Education Funding,2025-07-20 00:40:36+00:00,NPR,An NPR member station manager assesses the future after Congress cuts federal funding,,,,,,https://www.npr.org/2025/07/19/nx-s1-5472395/an-npr-member-station-manager-assesses-the-future-after-congress-cuts-federal-funding,NPR's Scott Simon talks to North Country Public Radio General Manager Mitch Teich about the recently approved federal funding cuts to public media and what they mean for his station.,,https://media.npr.org/include/images/facebook-default-wide-s1400-c100.jpg,,,2025-07-19 23:04:55.068650
,Education Funding,2025-07-20 00:32:05+00:00,thewilkesrecord.com,Letter: Reader Supports Federal Education Cuts - The Wilkes Record,,,,,,https://thewilkesrecord.com/letter-reader-supports-federal-education-cuts-p10616-149.htm,"This is not a surprise—he was clear during his campaign that his administration would eliminate bloated and misused federal spending, including money ...",,,,,2025-07-19 23:04:55.068650
,California,2025-07-19 22:20:31+00:00,KERO 23 ABC News Bakersfield,Trump administration will release some frozen grants supporting after-school and summer programs,,,,,,https://www.turnto23.com/us-news/education/trump-administration-will-release-some-frozen-grants-supporting-after-school-and-summer-programs,"After a bipartisan coalition of lawmakers complained about the funds being frozen, the Trump administration had decided to release funds for after-school programs.",,https://ewscripps.brightspotcdn.com/dims4/default/99d3f7c/2147483647/strip/true/crop/5293x2779+0+375/resize/1200x630!/quality/90/?url=https%3A%2F%2Fewscripps.brightspotcdn.com%2F6c%2Fa8%2F674ed8f34cc8b114d0b5262e4f34%2Fap25196582860980.jpg,,,2025-07-19 23:04:55.068650
,Education Funding,2025-07-19 22:02:55+00:00,Mankato Free Press,Governor should approve fed tax credit,,,,,,https://www.mankatofreepress.com/opinion/letters_to_the_editor/governor-should-approve-fed-tax-credit/article_02da3662-e7e0-4cd7-a8f0-567783a83b97.html,Governor should approve fed tax credit,,https://bloximages.chicago2.vip.townnews.com/mankatofreepress.com/content/tncms/custom/image/5e42277e-6153-11e5-b349-8f12bc751eed.jpg?resize=600%2C315,,,2025-07-20 03:56:27.002917
,Education Funding,2025-07-19 21:35:04+00:00,The Denver Post,Colorado set to receive nearly $13 million after Trump administration releases some frozen K-12 funding,,,,,,https://www.denverpost.com/2025/07/18/colorado-trump-administration-education-funding-release-after-school/,"“What this preserves is a safe and warm place for kids, and it also preserves what we view as a key plank in economic stability for the community that allows parents to keep working a full da…",,https://www.denverpost.com/wp-content/uploads/2024/10/TDP-L-ponderosaelementary102424-cha-406.jpg?w=1024&h=681,,,2025-07-19 23:04:55.068650
,Salt Lake City,2025-07-19 21:04:29+00:00,www.youtube.com,U.S. Department of Education allocates $1.3B for after-school programs amid freeze,,,,,,https://www.youtube.com/watch%3Fv%3DY2WSKvkcvFE,Utah educators weigh options as federal funding pause raises concerns over school programs. KUTV 2 News Salt Lake City New 1.2K views · 2:31.,,,,,2025-07-19 23:04:55.068650
,Education Funding,2025-07-19 20:07:29+00:00,WFSU News,A freeze on federal funds used to support after-school programs in Florida could soon be lifted,,,,,,https://news.wfsu.org/state-news/2025-07-19/a-freeze-on-federal-funds-used-to-support-after-school-programs-in-florida-could-soon-be-lifted,Republican U.S. senators and Democratic-backed teachers groups are both pushing back on the freeze,,https://npr.brightspotcdn.com/dims4/default/22b9baf/2147483647/strip/true/crop/4896x2570+0+259/resize/1200x630!/quality/90/?url=http%3A%2F%2Fnpr-brightspot.s3.amazonaws.com%2F2e%2F9d%2F3f4ed4494558bd692b84a7f1aa5b%2Fschool-1.jpeg,,,2025-07-19 23:04:55.068650
,Education Funding,2025-07-19 20:04:26+00:00,USA TODAY,What if we give states total control over education? That's the America I want. | Opinion,,,,,,https://www.usatoday.com/story/opinion/columnist/2025/07/19/trump-education-department-cuts-school-funding/85259833007/,"The U.S. Department of Education should be shuttered, and essential functions should be woven into other existing government departments.",,"https://www.usatoday.com/gcdn/authoring/authoring-images/2025/03/21/USAT/82592424007-gty-2206239141.jpg?crop=8191,4608,x0,y546&width=3200&height=1801&format=pjpg&auto=webp",,,2025-07-19 23:04:55.068650
,Education Funding,2025-07-19 19:49:28+00:00,www.youtube.com,Manchester school leaders react to the release of federal funding grant money by Dept. of Education,,,,,,https://www.youtube.com/watch%3Fv%3DjoEaxD3L_cc,Manchester school leaders react to the release of federal funding grant money by Dept. of Education Subscribe to WMUR on YouTube now for more: ...,,,,,2025-07-19 23:04:55.068650
,Oklahoma,2025-07-19 19:40:38+00:00,The Oklahoman,Why the Trump administration froze $7.5M in funding for Oklahoma CareerTech,,,,,,https://www.oklahoman.com/story/news/politics/2025/07/19/trump-administration-freezes-7-5m-in-funding-for-ok-careertech/85288542007/,The Trump administration froze the funding amid concerns that it was going toward educating undocumented immigrants.,,"https://www.oklahoman.com/gcdn/authoring/authoring-images/2025/07/19/NOKL/85288552007-eb-13-abc-26-d-8349-f-3-aed-0-f-487-d-4-e-9-b-60-f-1-201-a.jpeg?crop=4840,2724,x0,y54&width=3200&height=1801&format=pjpg&auto=webp",,,2025-07-19 23:04:55.068650
,Education Funding,2025-07-19 19:20:03+00:00,Senator Sam Singh,Standing Against Federal Cuts & Chaos ,,,,,,https://senatedems.com/singh/2025/07/19/standing-against-federal-cuts-chaos/,"... funding for literacy supports, career and technical education, early childhood education, and the free school meals program. My colleagues and I ...",,,,,2025-07-19 23:04:55.068650
,Education Funding,2025-07-19 19:10:20+00:00,INSIDENOVA.COM,The 'Grand Challenge': George Mason prepares for a future with less federal funding,,,,,,https://www.insidenova.com/headlines/the-grand-challenge-george-mason-prepares-for-a-future-with-less-federal-funding/article_52c41cf3-22a7-4f93-88e2-de0f75e3c290.html,"The Grand Challenge Initiative was developed through a task force of more than 20 faculty, staff and administrators. Rather than dictating specific topics, the initiative lays out six “grand solutions” that reflect the university’s strengths and values.",,https://bloximages.chicago2.vip.townnews.com/insidenova.com/content/tncms/assets/v3/editorial/e/bc/ebc43bfa-5a61-5f49-ac43-7bdbcee3fce3/663955fe99b38.image.jpg?crop=1763%2C926%2C0%2C124&resize=1200%2C630&order=crop%2Cresize,,,2025-07-19 23:04:55.068650
,West Virginia,2025-07-19 19:06:12+00:00,WV News,Letter to the editor: Promised adult education funds must be released,,,,,,https://www.wvnews.com/news/around_the_web/states/letter-to-the-editor-promised-adult-education-funds-must-be-released/article_b1b09d73-81c6-5ee2-abc8-370543472524.html,"On July 1, adult education programs nationwide were expecting the release of long-promised federal funds — vital resources that support adults working to earn a diploma, learn English, or gain",,https://bloximages.chicago2.vip.townnews.com/wvnews.com/content/tncms/assets/v3/editorial/b/1b/b1b09d73-81c6-5ee2-abc8-370543472524/6879537eb1807.preview.jpg?crop=847%2C445%2C0%2C13,,,2025-07-19 23:04:55.068650
,Connecticut,2025-07-19 18:52:16+00:00,New England News Collaborative,Vermont schools will receive $6.5M in afterschool funds after Trump partially lifts freeze,,,,,,https://www.nenc.news/2025-07-18/vermont-schools-will-receive-6-5m-in-afterschool-funds-after-trump-partially-lifts-freeze,The latest news leaves over $18 million in congressionally-approved federal funding for Vermont school districts still in limbo.,,https://npr.brightspotcdn.com/dims4/default/1515600/2147483647/strip/true/crop/5233x2747+0+373/resize/1200x630!/quality/90/?url=http%3A%2F%2Fnpr-brightspot.s3.amazonaws.com%2F21%2F21%2F27f8383f4077905c63418a770bc9%2Fschool-bus-champlain-valley-school-district-vermontpublic-zmcdonald-20250202.jpg,,,2025-07-19 23:04:55.068650
,Education Funding,2025-07-19 18:51:52+00:00,www.fresnobee.com,Trump reverses federal grants freeze. Fresno area schools to receive partial funds,,,,,,https://www.fresnobee.com/news/local/article310967355.html,"After a $6.2 billion grant freeze threatened to impact school districts across the country, $1.3 billion has been approved to be released.",,,,,2025-07-19 23:04:55.068650
,West Virginia,2025-07-19 17:55:38+00:00,WGBA NBC 26 in Green Bay,Trump administration will release some frozen grants supporting after-school and summer programs,,,,,,https://www.nbc26.com/us-news/education/trump-administration-will-release-some-frozen-grants-supporting-after-school-and-summer-programs,"After a bipartisan coalition of lawmakers complained about the funds being frozen, the Trump administration had decided to release funds for after-school programs.",,https://ewscripps.brightspotcdn.com/dims4/default/99d3f7c/2147483647/strip/true/crop/5293x2779+0+375/resize/1200x630!/quality/90/?url=https%3A%2F%2Fewscripps.brightspotcdn.com%2F6c%2Fa8%2F674ed8f34cc8b114d0b5262e4f34%2Fap25196582860980.jpg,,,2025-07-20 01:54:48.071160
,Salt Lake City,2025-07-19 17:54:06+00:00,FOX 13 News Utah (KSTU),Trump administration will release some frozen grants supporting after-school and summer programs,,,,,,https://www.fox13now.com/us-news/education/trump-administration-will-release-some-frozen-grants-supporting-after-school-and-summer-programs,"After a bipartisan coalition of lawmakers complained about the funds being frozen, the Trump administration had decided to release funds for after-school programs.",,https://ewscripps.brightspotcdn.com/dims4/default/99d3f7c/2147483647/strip/true/crop/5293x2779+0+375/resize/1200x630!/quality/90/?url=https%3A%2F%2Fewscripps.brightspotcdn.com%2F6c%2Fa8%2F674ed8f34cc8b114d0b5262e4f34%2Fap25196582860980.jpg,,,2025-07-19 23:04:55.068650
,Education Funding,2025-07-19 17:38:56+00:00,AP News,Education Department will release some frozen grants supporting after-school and summer programs,,,,,,https://apnews.com/article/education-grants-after-school-summer-211451212c377321fad4c751da3eb9df,The Education Department plans to release previously withheld grant money for after-school programs.,,https://dims.apnews.com/dims4/default/2ecd92c/2147483647/strip/true/crop/4032x2268+0+210/resize/1440x810!/quality/90/?url=https%3A%2F%2Fassets.apnews.com%2Fc1%2F39%2F0696b2680cf7a7dc82e21868548b%2Ffe7e81bed0b54cd08794432b62d7437a,,,2025-07-19 23:04:55.068650
,West Virginia,2025-07-19 17:02:40+00:00,NewsBreak,Lunenburg County schools hit by federal freeze - NewsBreak,,,,,,https://www.newsbreak.com/the-kenbridge-victoria-dispatch-1672983/4118955121569-lunenburg-county-schools-hit-by-federal-freeze,"Classes may not have started yet, but school districts both in Lunenburg and around the country find themselves facing some potentially uncomfortable decis",,https://img.particlenews.com/img/id/4asTQh_12tLochv00,,,2025-07-20 06:57:09.633442
,West Virginia,2025-07-19 16:18:28+00:00,Times West Virginian,Education Department will release some frozen grants supporting after-school and summer programs,,,,,,https://www.timeswv.com/news/national_news/education-department-will-release-some-frozen-grants-supporting-after-school-and-summer-programs/article_85291587-2b68-549b-aa27-ed69db875ef8.html,The Education Department plans to release previously withheld grant money for after-school programs. This decision comes days after 10 Republican senators urged the Office of Management and Budget to release,,https://bloximages.chicago2.vip.townnews.com/timeswv.com/content/tncms/assets/v3/editorial/3/9c/39c221c3-f0b6-5ea2-b19a-d2311cd61274/687ae53a11779.image.jpg?crop=1763%2C926%2C0%2C124&resize=1200%2C630&order=crop%2Cresize,,,2025-07-19 23:04:55.068650
,Oklahoma,2025-07-19 14:21:38+00:00,Yahoo News,Why the Trump administration froze $7.5M in funding for Oklahoma CareerTech,,,,,,https://www.yahoo.com/news/why-trump-administration-froze-7-133737083.html,The Trump administration froze the funding amid concerns that it was going toward educating undocumented immigrants.,,https://s.yimg.com/ny/api/res/1.2/hM2pcr2I8F9HMbEObvIUEg--/YXBwaWQ9aGlnaGxhbmRlcjt3PTEyMDA7aD03MDI7Y2Y9d2VicA--/https://media.zenfs.com/en/the_oklahoman_natl_articles_469/572f531d5b79d30af3796f02a037a622,,,2025-07-19 23:04:55.068650
,Salt Lake City,2025-07-19 13:57:30+00:00,www.youtube.com,Many Utah after-school programs to end due to federal funding cuts - YouTube,,,,,,https://www.youtube.com/watch%3Fv%3DkagoRWon9hM%26vl%3Den-US,Read more: https://ksltv.com/education-schools/many-utah-after-school-programs-to-end-due-to-federal-funding ... KUTV 2 News Salt Lake City New 73K ...,,,,,2025-07-19 23:04:55.068650
,Connecticut,2025-07-19 13:35:17+00:00,www.msn.com,"Some CT organizations prep to close after-school programs, lay off staff after Trump funding freeze",,,,,,https://www.msn.com/en-us/news/us/some-ct-organizations-prep-to-close-after-school-programs-lay-off-staff-after-trump-funding-freeze/ar-AA1ITnoW%3Focid%3DBingNewsVerp%26cvid%3D885392f84b364700e00514b6aea4c0db%26ei%3D29,"... school year,"" Mattaboni said. ""So this is imminent. They just will not exist in the coming school year."" In addition, some Connecticut public school ...",,,,,2025-07-19 23:04:55.068650
,Connecticut,2025-07-19 12:43:08+00:00,CT Insider,"Some CT organizations prep to close after-school programs, lay off staff after Trump funding freeze",,,,,,https://www.ctinsider.com/recordjournal/news/education/article/trump-funding-freeze-ct-after-school-programs-20772334.php,"At one organization, after-school programs that serve hundreds of Stamford middle schoolers will be shuttered.",,https://s.hdnux.com/photos/01/36/21/60/24714303/5/rawImage.jpg,,,2025-07-19 23:04:55.068650
,Connecticut,2025-07-19 12:41:43+00:00,CT Insider,Greenwich superintendent says staffing cuts will hit school media centers the hardest,,,,,,https://www.ctinsider.com/news/education/article/greenwich-ct-school-budget-cuts-2025-media-center-20769386.php,Physical education positions and administrative assistants are among the other staffing cuts.,,https://s.hdnux.com/photos/01/42/24/03/25772239/5/rawImage.jpg,,,2025-07-19 23:04:55.068650
,West Virginia,2025-07-19 11:57:19+00:00,www.thenationalherald.com,Education Department will Release some Frozen Grants Supporting after-school and ...,,,,,,https://www.thenationalherald.com/education-department-will-release-some-frozen-grants-supporting-after-school-and-summer-programs/,"Shelley Moore Capito, R-West Virginia who chairs the Senate Appropriations subcommittee that oversees education spending, led the letter sent this ...",,,,,2025-07-19 23:04:55.068650
,West Virginia,2025-07-19 11:19:36+00:00,CT Insider,Education Department will release some frozen grants supporting after-school and summer programs,,,,,,https://www.ctinsider.com/news/education/article/education-department-will-release-some-frozen-20775698.php,The Education Department plans to release previously withheld grant money for after-school programs. This decision comes days after 10 Republican senators urged the Office of Management and Budget to...,,https://s.hdnux.com/photos/01/53/56/01/28237947/3/rawImage.jpg,,,2025-07-19 23:04:55.068650
,Kentucky,2025-07-19 11:12:10+00:00,www.pressreader.com,McConnell joins demand for release of education funds - PressReader,,,,,,https://www.pressreader.com/usa/rome-news-tribune/20250719/281848649636557,"... federal education funding. In a Wednesday letter to Russell Vought ... In addition to money for K-12 education, Kentucky also lost $9 million ...",,,,,2025-07-19 23:04:55.068650
