id,name,published,outlet,title,authors,category,market,categoryorder,articleorder,url,description,text,image,error,sentiment,firstEyes
,West Virginia,2025-06-14 04:07:12+00:00,WV News,West Virginia law expands school counselor requirements amid concerns over staffing and funding,,,,,,https://www.wvnews.com/news/wvnews/west-virginia-law-expands-school-counselor-requirements-amid-concerns-over-staffing-and-funding/article_b10d64e7-3a41-4482-848c-0457ae0b60f5.html,"CHARLESTON, W.Va. (WV News) — Gov. Patrick Morrisey recently approved House Bill 3209, a bill that will require public and charter schools in the state to provide two counselors for",,https://bloximages.chicago2.vip.townnews.com/wvnews.com/content/tncms/assets/v3/editorial/7/06/706de753-15a0-4a1c-a1da-79c34ab0406c/62d8642388262.image.jpg?crop=1762%2C925%2C0%2C0&resize=1200%2C630&order=crop%2Cresize,,,2025-06-14 00:57:50.733483
,Education Funding,2025-06-14 03:03:23+00:00,https://www.alaskasnewssource.com,Interior leaders react to Governor Dunleavy's education funding veto,,,,,,https://www.alaskasnewssource.com/video/2025/06/14/interior-leaders-react-governor-dunleavys-education-funding-veto/,The vetoes leave the Fairbanks school district with a $2.5 million budget shortfall.,,https://gray-ktuu-prod.gtv-cdn.com/resizer/v2/https%3A%2F%2Fdo0bihdskp9dy.cloudfront.net%2F06-14-2025%2Ft_dcdc2e7964d944a29a788b54f173d743_name_file_1280x720_2000_v3_1_.jpg?auth=c4dd36d93a756b504cbc2f7a3feabf72798f95810e3db787ee8f3986eaf1cfb7&width=1200&height=600&smart=true,,,2025-06-14 15:02:19.550803
,Education Funding,2025-06-14 02:39:08+00:00,Tennessee Conservative,Tennessee Attorney General Says Federal Education Grant Program Is ‘Discriminatory’,,,,,,https://tennesseeconservativenews.com/tennessee-attorney-general-says-federal-education-grant-program-is-discriminatory/,Tennessee Attorney General Jonathan Skrmetti Filed A Lawsuit Against The Department Of Education Challenging A Grant Program For Hispanics That He Said Is Discriminatory.,,https://tennesseeconservativenews.com/wp-content/uploads/2025/06/Tennessee-Attorney-General-Says-Federal-Education-Grant-Program-Is-‘Discriminatory.jpg,,,2025-06-14 06:58:48.167530
,Education Funding,2025-06-14 01:09:34+00:00,The Press Democrat,‘Wacky times’: Napa schools warn of budget shortfalls and shrinking reserves,,,,,,https://www.pressdemocrat.com/article/napa/napa-valley-unified-school-budget/,"Recent enrollment losses dashed hopes of continued stabilization in Napa Valley Unified, as district leaders now warn of longer-term financial pressures and potential risks from federal funding cuts.",,https://imengine.prod.srp.navigacloud.com/?uuid=5bebc51f-fed1-5650-9c87-6bc10e069fbe&type=primary&q=75&width=1600,,,2025-06-13 22:00:15.218361
,Education Funding,2025-06-13 22:24:22+00:00,www.bridgemi.com,Opinion | Every dollar counts: Ensuring accountability in education funding | Bridge Michigan,,,,,,https://www.bridgemi.com/guest-commentary/opinion-every-dollar-counts-ensuring-accountability-education-funding,"Too often, Lansing has micromanaged school budgets, limiting the ability of local schools to respond effectively to the unique challenges they face. Our budget fundamentally changes this approach.",,https://www.bridgemi.com/sites/default/files/styles/large/public/2025-06/HS_KELLY_0125-scaledwe.jpg?itok=xjMxXBeF,,,2025-06-14 12:05:15.483684
,Education Funding,2025-06-13 20:33:25+00:00,WisPolitics,"Rep. Hong: GOP lawmakers block public school funding, push burden onto local taxpayers",,,,,,https://www.wispolitics.com/2025/rep-hong-gop-lawmakers-block-public-school-funding-push-burden-onto-local-taxpayers/,"MADISON, WI – Yesterday, the Republican controlled Joint Finance Committee voted to block critical funding for K-12 public education, all while raising property taxes.  Representative Hong released the following statement:  “Legislative Republicans have once again betrayed our students, educators, families, and...",,https://www.wispolitics.com/wp-content/uploads/2023/10/WisPoliticsIconSocial.png,,,2025-06-13 22:00:15.218361
,Education Funding,2025-06-13 20:03:34+00:00,Education Week,Principals Urge Ed. Department: Leave School Safety Funding Alone,,,,,,https://www.edweek.org/leadership/principals-urge-ed-department-leave-school-safety-funding-alone/2025/06,"Schools need access to funds for mental health professionals and other student services, say principals who've experienced school shootings.",,https://epe.brightspotcdn.com/dims4/default/2fc516f/2147483647/strip/true/crop/1720x1150+0+0/resize/942x630!/quality/90/?url=https%3A%2F%2Fepe-brightspot.s3.us-east-1.amazonaws.com%2F5e%2Fc0%2Fe02cde684f5bbcb31e736423845e%2F061225-prn-mcmahon-1-bs.jpg,,,2025-06-13 17:02:18.150896
