id,name,published,outlet,title,authors,category,market,categoryorder,articleorder,url,description,text,image,error,sentiment,firstEyes
,Education Funding,2025-10-01 20:38:07+00:00,OCDE Newsroom,Shutdown won’t immediately disrupt most federal school funding in Orange County,,,,,,https://newsroom.ocde.us/shutdown-wont-immediately-disrupt-most-federal-school-funding-in-orange-county/,Education news from Orange County and beyond,,https://newsroom.ocde.us/wp-content/uploads/2021/09/shutterstock_2645778905.jpg,,,2025-10-01 17:56:48.077779
,Education Funding,2025-10-01 20:32:05+00:00,WRAL.com,"Federal shutdown will affect some NC schools, officials monitoring possible impact on meals",,,,,,https://www.wral.com/news/education/fed-shutdown-affects-some-nc-schools-october-2025/,"The department and the state's schools are set to receive nearly $2 billion in federal funding this year, largely for special education services and assistance to schools enrolling higher shares of lower-income students.",,https://images.wral.com/ac8565d3-61da-4f30-8f82-3550cd04b1dd?w=1200&h=630,,,2025-10-01 17:56:48.077779
,Arizona,2025-10-01 19:20:06+00:00,KNXV - Phoenix Scripps via Yahoo News,Kyrene Elementary School District revises closure plan after community feedback,,,,,,https://ca.news.yahoo.com/kyrene-elementary-school-district-revises-135316451.html,"The Kyrene Elementary School District has revised its school closure plan after listening to community feedback, with two schools previously marked for closure now remaining open.",,https://s.yimg.com/ny/api/res/1.2/lCAVfguzsgzKi0TZ.xWDmg--/YXBwaWQ9aGlnaGxhbmRlcjt3PTEyMDA7aD02Mjg7Y2Y9d2VicA--/https://media.zenfs.com/en/video.knxv.scripps.com/9260045e7531e681c2d12e8f7c74961e,,,2025-10-01 18:56:47.310080
,Connecticut,2025-10-01 19:05:50+00:00,CT Mirror,"CT will keep programs hurt by federal shutdown afloat, for now",,,,,,https://ctmirror.org/2025/10/01/ct-federal-shutdown-programs-afloat/,Gov. Ned Lamont said it’s premature to commit any of last year’s $2.5 billion surplus to plug holes in federal funding over the long term.,,https://ctmirror.org/wp-content/uploads/2025/10/2025_1001_SR_LamontGovShutdown_124.jpg,,,2025-10-01 15:56:19.011396
,Arizona,2025-10-01 18:58:38+00:00,www.bizjournals.com,K-12 education funding cuts spark debate amid student achievement declines,,,,,,https://www.bizjournals.com/triad/news/2025/10/01/triad-educators-nc-test-scores-k-12-funding.html,"Local school officials talk federal education cuts, test scores - Triad Business Journal ... Phoenix · Pittsburgh · Portland · Providence · Raleigh/ ...",,,,,2025-10-01 19:56:17.748201
,West Virginia,2025-10-01 18:52:58+00:00,West Virginia Department of Education,County Accountability Report Shows Continued Progress,,,,,,https://wvde.us/articles/county-accountability-report-shows-continued-progress,"Charleston, W.Va. - The West Virginia Board of Education (WVBE) approved the 2025 County Approval Status Accreditation Report during its October meeting in Charleston. The annual report serves as an overview of each school district’s operational efficiency and performance indicators, providing the public with a better understanding of their local schools’ strengths and challenges. The report includes 11 operational efficiency standards and indicators from the Balanced Scorecard.Advanced PlacementWest Virginia’s Advanced Placement® passage rate increased by 6.4% to 63.77%, up from 58.07% last year, according to the College Board. Last year, 6,066 students took 9,395 exams in West Virginia. AP allows students to take college-level courses in high school and receive college credit or advanced placement in college. Students earning a passing score on AP exams can receive college credit at colleges and universities in West Virginia and nationwide.Balance in RegulationsWVBE President L. Paul Hardesty highlighted the inconsistencies between regulations, requirements and oversight of public schools, charter schools and homeschools. He compared the 1,300-page 2025 West Virginia School Laws Code Book that contains laws passed by the West Virginia Legislature that govern public schools, to a single sheet of paper that outlines all of the legislative requirements for charters schools, and to an index card that shows all the legislative requirements for homeschooling. “There is a real misconception among the public about the author of the West Virginia Code Book. Every law in the book was passed by the Legislature - not this State Board and not the Department of Education,” Hardesty said. “I am not against school choice, but let’s be equitable and let’s be fair. The rules and oversight of public education and the rules for other school choice options sets one system up for success and the other to fail. I don’t think the public understands the way the game is played and the hand that they’ve been dealt.” The decrease in county school funding leads many county school boards to close and consolidate schools. The WVBE believes that there needs to be a better public understanding of West Virginia’s funding formula and education laws to understand the impact on local schools. Board members say they remain committed to open communication and are willing to sit down with members of the Legislature to address the challenges outlined during the meeting. To view the presentation, visit the WVBE October 2025 Meeting page. Sullivan Retirement from WVBEOctober marked the final meeting for WVBE Member Debra Sullivan. She completed her term as the longest-serving member on the current board. She was appointed by Governor Jim Justice and was known for her attention to detail and deep-rooted connection to students from across the state. Mrs. Sullivan often visited students in schools as well as  juvenile facilities where she would lead baking classes and engage in discussions about a number of meaningful topics. Mrs. Sullivan has been a policy expert spurred by her own administrative expertise and curiosity to learn. She poured over state code, legislation and important documents to ensure the State Board continued to serve children at the core of its priorities. Documents from and a recording of today’s meeting are available on the WVBE information page, and photos are available in the WVDE Flickr album. The next regularly scheduled WVBE meeting is 9 a.m., Wednesday, Nov. 12, 2025, in Building 6, Suite 600, 1900 Kanawha Boulevard, East, Charleston, West Virginia.",,https://wvde.us/sites/default/files/styles/wide/public/2025-10/Debra_Sullivan%20Certification%20copy.jpg?itok=D5dHwOMV,,,2025-10-01 15:56:19.011396
,Pennsylvania,2025-10-01 18:12:34+00:00,York Dispatch,Schools brace for more cuts as state and federal budgets remain stalled,,,,,,https://www.yorkdispatch.com/story/news/education/2025/10/01/schools-brace-for-more-cuts-as-state-and-federal-budgets-remain-stalled/86460017007/,York County schools are waiting on $144 million from the state. The federal shutdown may exacerbate their problems.,,"https://www.yorkdispatch.com/gcdn/authoring/authoring-images/2025/03/11/PPYD/82283325007-ap-25070719589773.jpg?crop=4995,2811,x0,y420&width=3200&height=1801&format=pjpg&auto=webp",,,2025-10-01 14:58:09.994049
,Education Funding,2025-10-01 17:47:18+00:00,barr.house.gov,Barr Announces over $20M Federal Grant to Kentucky Education Development Corporation,,,,,,https://barr.house.gov/press-releases%3Fid%3DA64AB9FA-B2B9-413B-A754-25CD5F5ED64F,"This grant was awarded through the U.S. Department of Education's GEAR UP Elevate grant, a seven-year federal initiative designed to expand ...",,,,,2025-10-01 14:58:09.994049
,Kentucky,2025-10-01 17:29:06+00:00,NKyTribune,"Opinion - Jaqueline Coleman: With state's economic future at stake, KY kids deserve Pre-K education - NKyTribune",,,,,,https://nkytribune.com/2025/10/opinion-jaqueline-coleman-with-states-economic-future-at-stake-ky-kids-deserve-pre-k-education/,"At a time when the federal government in Washington, D.C. is dismantling public education, Kentucky has made it the cornerstone of our record economic era. The U.S. Secretary of Education was sworn in with one stated goal: to be the last U.S. Secretary of Education. Linda McMahon’s top priority is dismantling billion-dollar initiatives that are...",,https://nkytribune.com/wp-content/uploads/2023/01/Jaqueline-Coleman.jpeg,,,2025-10-01 14:58:09.994049
,Pennsylvania,2025-10-01 17:00:33+00:00,90.5 WESA,Dual budget crises threaten $40B in federal funding for Pennsylvania,,,,,,https://www.wesa.fm/politics-government/2025-10-01/pennsylvania-budget-impasse-federal-government-shutdown-dual-crisis,The collision of a state budget impasse with a federal government shutdown is unprecedented in the commonwealth.,,https://npr.brightspotcdn.com/dims4/default/3111845/2147483647/strip/true/crop/6000x3150+0+274/resize/1200x630!/quality/90/?url=http%3A%2F%2Fnpr-brightspot.s3.amazonaws.com%2F42%2F0a%2F3abcd9914f7fb3c1dc2de9912d0c%2Fap24037589846213.jpg,,,2025-10-01 13:57:41.173381
,Education Funding,2025-10-01 16:40:35+00:00,edsource.org,Uncertain future of IDEA law puts students with disabilities at risk - EdSource,,,,,,https://edsource.org/%3Fpost_type%3Dpost%26p%3D741821,"For example, Project 2025 urges the use of federal special education funding for private education alternatives that parents would choose. There ...",,,,,2025-10-01 13:57:41.173381
,Louisiana,2025-10-01 16:39:24+00:00,KTVE - myarklamiss.com,"The longer the shutdown, the worse for schools, education experts say",,,,,,https://www.myarklamiss.com/hill-politics/the-longer-the-shutdown-the-worse-for-schools-education-experts-say/,"Education advocates are biting their nails as the government shutdown begins.  A contingency plan for the Education Department has been put in place, with 95 percent of its staffers furloughed, apa…",,https://www.myarklamiss.com/wp-content/uploads/sites/15/2025/10/AP25044139880669-e1754402053551.jpg?w=1280,,,2025-10-01 15:56:19.011396
,Education Funding,2025-10-01 16:36:45+00:00,Default,Investing in Every Beginning: A Call for Federally Funded Early Childhood Education,,,,,,https://www.aasa.org/resources/blog/investing-in-every-beginning-a-call-for-federally-funded-early-childhood-education,"The U.S. must invest in early learning to close gaps before they begin and give every child a fair start.
",,https://www.aasa.org/images/default-source/schools-of-thought-blog/early-learning.png?sfvrsn=f3c6ba3d_1,,,2025-10-01 15:56:19.011396
,West Virginia,2025-10-01 16:35:59+00:00,WV News,The government shutdown will halt some work at a diminished Education Department,,,,,,https://www.wvnews.com/newsfeed/politics/the-government-shutdown-will-halt-some-work-at-a-diminished-education-department/article_31cca143-9bb5-509c-b119-fc8041664580.html,"The government shutdown means further disruption for the U.S. Education Department, which has seen half of its employees laid off by the Trump administration. The department says many core operations",,https://bloximages.chicago2.vip.townnews.com/wvnews.com/content/tncms/assets/v3/editorial/f/3f/f3f17cc7-37e3-5c5f-a4bf-711e2ee7996a/68dc4e2ad2c75.image.jpg?crop=6000%2C3150%2C0%2C425&resize=1200%2C630&order=crop%2Cresize,,,2025-10-01 21:56:20.061504
,Education Funding,2025-10-01 16:34:54+00:00,Concord Monitor,"After weeks of no word, federal government confirms Concord schools will receive pair of mental health grants - Concord Monitor",,,,,,https://www.concordmonitor.com/2025/10/01/after-weeks-of-no-word-federal-government-confirms-concord-schools-will-receive-pair-of-mental-health-grants/,"Concord’s school district received confirmation this week that a $1.6 million grant it previously won to fund mental health initiatives would be paid, putting to rest concerns that arose over the course of September as weeks passed with no word from the federal government. The news came Monday night, on the brink of the federal […]",,https://i0.wp.com/www.concordmonitor.com/wp-content/uploads/2025/07/138c06f9-d8e0-470c-88eb-8cf2babb5a81.jpg?fit=1111%2C500&quality=89&ssl=1,,,2025-10-01 13:57:41.173381
,Education Funding,2025-10-01 16:12:03+00:00,thehill.com,Where will the federal shutdown impact education? - The Hill,,,,,,https://thehill.com/homenews/education/5531107-federal-shutdown-education-impact/,"Student loan borrowers. Student loans and Pell Grants mostly remain unaffected at the beginning of the shutdown, according to the department, as ...",,,,,2025-10-01 16:59:11.196957
,West Virginia,2025-10-01 15:45:54+00:00,WBOY.com,"The longer the shutdown, the worse for schools, education experts say",,,,,,https://www.wboy.com/hill-politics/the-longer-the-shutdown-the-worse-for-schools-education-experts-say/,"Education advocates are biting their nails as the government shutdown begins.  A contingency plan for the Education Department has been put in place, with 95 percent of its staffers furloughed…",,https://www.wboy.com/wp-content/uploads/sites/43/2025/10/AP25044139880669-e1754402053551.jpg?w=1280,,,2025-10-01 11:58:01.905635
,Education Funding,2025-10-01 15:44:02+00:00,www.acenet.edu,"ACE, Higher Ed Groups Urge Congress to Safeguard FY 2026 Education Funding",,,,,,https://www.acenet.edu/News-Room/Pages/Safeguard-FY-2026-Education-Funding.aspx,​ACE and more than 60 other higher education associations sent a letter to congressional leaders today urging them to ensure that all funds allocated in the FY 2026 appropriations process are fully spent by the administration as intended by law.,,https://www.acenet.edu/PublishingImages/Photo-Library/us_capitolbuilding.jpg?RenditionID=14,,,2025-10-01 12:56:16.436241
,Pennsylvania,2025-10-01 15:28:14+00:00,WOLF,Pennsylvania educators sound alarm over Federal shutdown’s impact on schools,,,,,,https://fox56.com/news/local/pennsylvania-educators-sound-alarm-over-federal-shutdowns-impact-on-schools,"The Pennsylvania State Education Association (PSEA) is warning that the federal government shutdown, which began early Wednesday after budget negotiations colla",,https://fox56.com/resources/media2/16x9/1120/986/40x0/90/088ec37b-8b11-4786-a124-e27ddcdf5800-PSEAPresidentAaronChapin.jpg,,,2025-10-01 12:56:16.436241
,Maine,2025-10-01 15:24:31+00:00,www.newscentermaine.com,Several Maine organizations set to lose federal funding | newscentermaine.com,,,,,,https://www.newscentermaine.com/video/news/fed-funding-cuts/97-872736fe-efac-4e22-b5d3-ed767336f96f,Education · Maine Politics · Politics · Nation World · Entertainment ... Several Maine ...,,,,,2025-10-01 21:56:20.061504
,Kentucky,2025-10-01 15:00:03+00:00,The Courier-Journal,How did Kentucky senators vote ahead of government shutdown?,,,,,,https://www.courier-journal.com/story/news/politics/2025/10/01/kentucky-senators-support-oppose-funding-proposal-government-shutdown-2025-rand-paul-mitch-mcconnell/86454532007/,One Kentucky senator was the only Republican to oppose the funding proposal to avoid the current 2025 government shutdown. What we know about Tuesday's vote.,,"https://www.courier-journal.com/gcdn/authoring/authoring-images/2025/09/25/PLOU/86350000007-senator-rand-paul-oldham-county-kentucky-6.JPG?crop=3362,1892,x0,y203&width=3200&height=1801&format=pjpg&auto=webp",,,2025-10-01 11:58:01.905635
,New York City,2025-10-01 14:54:48+00:00,www.nytimes.com,Live Updates: Shutdown Grinds Many Government Services to a Halt - The New York Times,,,,,,https://www.nytimes.com/live/2025/10/01/us/government-shutdown-trump-news,"At the three major airports in the New York City area, wait times at T.S.A. ... federal funding runs out. During a prior government shutdown, in ...",,,,,2025-10-01 11:58:01.905635
,Education Funding,2025-10-01 14:45:33+00:00,PBS News,How the government shutdown will affect the already shrunken Education Department,,,,,,https://www.pbs.org/newshour/politics/how-the-government-shutdown-will-affect-the-already-shrunken-education-department,"Investigations into civil rights complaints will stop, the department will not issue new federal grants and about 87% of its workforce will be furloughed, according to a department contingency plan.",,https://d3i6fh83elv35t.cloudfront.net/static/2025/03/2025-03-12T164805Z_838353484_RC2RBDAA20L2_RTRMADP_3_USA-EDUCATION-LAYOFFS-1024x683.jpg,,,2025-10-01 11:58:01.905635
,Pennsylvania,2025-10-01 14:16:33+00:00,www.wfmj.com,The government shutdown will halt some work at a diminished Education Department,,,,,,https://www.wfmj.com/story/53128839/the-government-shutdown-will-halt-some-work-at-a-diminished-education-department,By ANNIE MAAP Education Writer,,https://APPREMIUM.images.worldnow.com/images/26764970_G.jpg?lastEditedDate=1759313632000,,,2025-10-01 10:56:30.222440
,Pennsylvania,2025-10-01 13:47:54+00:00,www.34st.com,Pennsylvania Charters Face A Difficult Road,,,,,,https://www.34st.com/article/2025/10/pennsylvania-charter-school-finance,"With public education increasingly under threat, do charter schools still make the grade?",,https://snworksceo.imgix.net/dpn-34s/75b336e6-351b-4477-86c9-2fc154772c51.sized-1000x1000.jpeg?w=800,,,2025-10-01 12:56:16.436241
,California,2025-10-01 13:25:29+00:00,KGET 17 News,"The longer the shutdown, the worse for schools, education experts say",,,,,,https://www.kget.com/national-news/the-longer-the-shutdown-the-worse-for-schools-education-experts-say/,"Education advocates are biting their nails as the government shutdown begins.  A contingency plan for the Education Department has been put in place, with 95 percent of its staffers furloughed…",,https://www.kget.com/wp-content/uploads/sites/2/2025/10/AP25044139880669-e1754402053551.jpg?w=1280,,,2025-10-01 11:58:01.905635
,Arizona,2025-10-01 12:18:59+00:00,KTAR.com,Report: 34% of Arizona high schoolers chronically absent,,,,,,https://ktar.com/arizona-education/high-school-chronic-absence/5756482/,34% of Arizona high school students were chronically absent in the 2023-24 school year. Officials are now working on ways to reduce that rate.,,https://ktar.com/wp-content/uploads/2025/09/pexels-pixabay-256395-e1759271073209.jpg,,,2025-10-01 10:56:30.222440
,Education Funding,2025-10-01 12:01:40+00:00,Current,GBH launches $225M fundraising campaign in the wake of federal funding cuts,,,,,,https://current.org/2025/10/gbh-launches-225m-fundraising-campaign-in-the-wake-of-federal-funding-cuts/,The station is looking to raise the funds over the next three years.,,https://current.org/wp-content/uploads/2025/09/GBH-Go-Fund-Yourself-Digital-Mural.jpg,,,2025-10-01 13:57:41.173381
,Pennsylvania,2025-10-01 11:05:59+00:00,ABC27,"The longer the shutdown, the worse for schools, education experts say",,,,,,https://www.abc27.com/news/top-stories/the-longer-the-shutdown-the-worse-for-schools-education-experts-say/,"Education advocates are biting their nails as the government shutdown begins.  A contingency plan for the Education Department has been put in place, with 95 percent of its staffers furloughed…",,https://www.abc27.com/wp-content/uploads/sites/55/2025/10/AP25044139880669-e1754402053551.jpg?w=1280,,,2025-10-01 10:56:30.222440
,Education Funding,2025-10-01 10:55:02+00:00,Conduit Street,Shutdown Countdown: State Leaders Outline Risks and Response,,,,,,https://conduitstreet.mdcounties.org/2025/09/30/shutdown-countdown-state-leaders-outline-risks-and-response/,"Maryland leaders outlined on Tuesday both the serious risks of a federal shutdown and the steps they are taking to manage its impact on workers, revenues,",,https://conduitstreet.mdcounties.org/wp-content/uploads/Screenshot-2025-09-30-at-4.57.51-PM.png,,,2025-10-01 07:56:58.524061
,Pennsylvania,2025-10-01 10:44:44+00:00,www.abc27.com,"The longer the shutdown, the worse for schools, education experts say - ABC27",,,,,,https://www.abc27.com/news/top-stories/the-longer-the-shutdown-the-worse-for-schools-education-experts-say/%3Fnxsparam%3D4,... funding comes mostly from the federal government instead of state or local taxes. ... Pennsylvania News · Your Local Election HQ · Harrisburg Weather ...,,,,,2025-10-02 03:56:25.699449
,Alabama,2025-10-01 10:43:31+00:00,WRBL,"The longer the shutdown, the worse for schools, education experts say",,,,,,https://www.wrbl.com/hill-politics/the-longer-the-shutdown-the-worse-for-schools-education-experts-say/,"Education advocates are biting their nails as the government shutdown begins.  A contingency plan for the Education Department has been put in place, with 95 percent of its staffers furloughed…",,https://www.wrbl.com/wp-content/uploads/sites/24/2025/10/AP25044139880669-e1754402053551.jpg?w=1280,,,2025-10-01 07:56:58.524061
,Education Funding,2025-10-01 10:39:46+00:00,thehill.com,"The longer the shutdown, the worse for schools, education experts say",,,,,,https://thehill.com/homenews/education/5529410-government-shutdown-education-funding-schools/,... funding comes mostly from the federal government instead of state or local taxes. ... This isn't the first time K-12 and higher education funding ...,,,,,2025-10-01 07:56:58.524061
,Connecticut,2025-10-01 10:21:54+00:00,WTNH.com,"The longer the shutdown, the worse for schools, education experts say",,,,,,https://www.wtnh.com/hill-politics/the-longer-the-shutdown-the-worse-for-schools-education-experts-say/,"Education advocates are biting their nails as the government shutdown begins.  A contingency plan for the Education Department has been put in place, with 95 percent of its staffers furloughed…",,https://www.wtnh.com/wp-content/uploads/sites/100/2025/10/AP25044139880669-e1754402053551.jpg?w=1280,,,2025-10-01 11:58:01.905635
,Oklahoma,2025-10-01 10:18:00+00:00,www.kosu.org,"Board asks for millions more to increase access to Oklahoma career, technical education",,,,,,https://www.kosu.org/local-news/2025-10-01/board-asks-for-millions-more-to-increase-access-to-oklahoma-career-technical-education,"Oklahoma CareerTech plans to ask state lawmakers for an additional $68 million in its budget to expand workforce training, technology centers and ...",,,,,2025-10-01 09:57:17.419580
,Pennsylvania,2025-10-01 10:12:14+00:00,ABC27,"The longer the shutdown, the worse for schools, education experts say",,,,,,https://www.abc27.com/news/the-longer-the-shutdown-the-worse-for-schools-education-experts-say/,"Education advocates are biting their nails as the government shutdown begins.  A contingency plan for the Education Department has been put in place, with 95 percent of its staffers furloughed…",,https://www.abc27.com/wp-content/uploads/sites/55/2025/10/AP25044139880669-e1754402053551.jpg?w=1280,,,2025-10-01 15:56:19.011396
,Kentucky,2025-10-01 10:09:32+00:00,FOX 56 News,"The longer the shutdown, the worse for schools, education experts say",,,,,,https://fox56news.com/hill-politics/the-longer-the-shutdown-the-worse-for-schools-education-experts-say/,"Education advocates are biting their nails as the government shutdown begins.  A contingency plan for the Education Department has been put in place, with 95 percent of its staffers furloughed…",,https://fox56news.com/wp-content/uploads/sites/24/2025/10/AP25044139880669-e1754402053551.jpg?w=1280,,,2025-10-01 08:56:48.295957
,Salt Lake City,2025-10-01 10:07:32+00:00,ABC4 Utah,"The longer the shutdown, the worse for schools, education experts say",,,,,,https://www.abc4.com/news/hill-politics/the-longer-the-shutdown-the-worse-for-schools-education-experts-say/,"Education advocates are biting their nails as the government shutdown begins.  A contingency plan for the Education Department has been put in place, with 95 percent of its staffers furloughed…",,https://www.abc4.com/wp-content/uploads/sites/4/2025/10/AP25044139880669-e1754402053551.jpg?w=1280,,,2025-10-01 10:56:30.222440
,Pennsylvania,2025-10-01 09:32:34+00:00,90.5 WESA,"With no end to state budget impasse in sight, Pa. school districts and counties warn of program cuts",,,,,,https://www.wesa.fm/politics-government/2025-10-01/pennsylvania-budget-impasse-school-districts-counties-program-cuts,The 2025-2026 state budget is overdue by three months as partisan gridlock drags on.,,https://npr.brightspotcdn.com/dims4/default/c22f4da/2147483647/strip/true/crop/1536x806+0+15/resize/1200x630!/quality/90/?url=http%3A%2F%2Fnpr-brightspot.s3.amazonaws.com%2Fba%2F1c%2F5101305c40d299cfece1ba8fb462%2Fimg-5507-1536x1152.jpg,,,2025-10-01 10:56:30.222440
,Connecticut,2025-10-01 09:26:47+00:00,Hartford Courant,A CT special session is approaching but the agenda’s still uncertain,,,,,,https://www.courant.com/2025/10/01/a-ct-special-session-is-approaching-but-the-agendas-still-uncertain/,"State legislators are preparing for a special session before Halloween as advocates and lawmakers are battling over state spending, affordable housing, and setting aside money to cover federal budg…",,https://www.courant.com/wp-content/uploads/2025/01/IMG_8098.jpeg?w=1024&h=768,,,2025-10-01 06:57:49.460543
,Education Funding,2025-10-01 08:17:26+00:00,CNN,"September 30, 2025: US federal government shuts down after Senate fails to pass funding plans | CNN Politics",,,,,,https://www.cnn.com/politics/live-news/government-shutdown-trump-09-30-25,The federal government has officially shut down for the first time in six years after a deadlocked Congress failed to pass a funding measure to keep the lights on.,,"https://media.cnn.com/api/v1/images/stellar/prod/2025-09-24t154801z-1084685122-rc2fygaan7y7-rtrmadp-3-usa-congress-shutdown.jpg?c=16x9&q=w_800,c_fill",,,2025-10-01 07:56:58.524061
