id,name,published,outlet,title,authors,category,market,categoryorder,articleorder,url,description,text,image,error,sentiment,firstEyes
,Kentucky,2025-06-16 18:16:34+00:00,www.therepublic.com,"Federal funding uncertainty eliminates Indiana programs, threatens others",,,,,,https://www.therepublic.com/2025/06/16/federal-funding-uncertainty-eliminates-indiana-programs-threatens-others/,"Hurricanes Sandy, Helene and Milton. The Surfside condo collapse in Florida. Maui's wildfires. Floods in Kentucky. All of these disasters had Hoosiers ...",,,,,2025-06-16 15:04:54.776824
,Pennsylvania,2025-06-16 17:42:11+00:00,www.bradfordera.com,What’s ahead in Pennsylvania’s state budget fight - The Bradford Era,,,,,,https://www.bradfordera.com/2025/06/16/whats-ahead-pennsylvanias-state-budget-fight/,"Pennsylvania&amp;#039;s budget process is a byzantine effort that is critical to the functioning of the commonwealth but largely ignored by the public. The news that does slip out ranges from depressing to infuriating as legislators and the administration often struggle to find consensus on issues with high public agreement. We all agree that we need strong schools, but there are knock-down, drag-out fights year after year about how to spend...",,https://www.bradfordera.com/bradfordera/news/wp-content/uploads/sites/4/2025/06/MarkNicastreHeadshot.jpg,,,2025-06-16 14:05:48.100927
,New York City,2025-06-16 17:00:08+00:00,spectrumlocalnews.com,Revised school budget votes to take place Tuesday for 2 Western N.Y. districts,,,,,,https://spectrumlocalnews.com/nys/buffalo/education/2025/06/16/revised-school-budget-votes-to-take-place-tuesday-for-2-western-new-york-districts,Both school districts have since developed altered budgets that will be back up for a vote Tuesday.  ,,https://s7d2.scene7.com/is/image/TWCNews/californiaclassroomapimage_10132022,,,2025-06-16 15:04:54.776824
,Salt Lake City,2025-06-16 16:50:34+00:00,Yahoo News,"Opinion - It’s not just taxes: Trump’s bill will have ‘big beautiful’ effects on education, too",,,,,,https://www.yahoo.com/news/opinion-not-just-taxes-trump-150000775.html,Trump’s bill seeks to disrupt an underperforming education system without imposing federal mandates or siphoning funds from public education.,,https://media.zenfs.com/en/the_hill_articles_341/66b97d03f52f9da7e4f1942d8ee22cfe,,,2025-06-16 14:05:48.100927
,Education Funding,2025-06-16 16:31:29+00:00,The Montpelier Bridge,"Stalled Education Reform Bill Would Raise Taxes and Spending for Some Districts, Cut Them for Others - The Montpelier Bridge",,,,,,https://montpelierbridge.org/2025/06/stalled-education-reform-bill-would-raise-taxes-and-spending-for-some-districts-cut-them-for-others/,"H.454, a state bill that has held up adjournment of the Legislature until at least June 16, would — if it passes — lead to significant school spending and tax changes later this decade for residents of many school districts, including those in central Vermont. In an attempt to control school property taxes in an era when student numbers are declining, the bill proposes to radically change the ways schools are funded in Vermont. It would also alter the size and number of school districts in the state.  As of press time, H.454 was stuck in a House-Senate conference committee.",,https://montpelierbridge.org/wp-content/uploads/2025/06/iStock-2208280903-scaled.jpg,,,2025-06-16 13:10:28.601581
,Pennsylvania,2025-06-16 16:27:34+00:00,Yahoo News,"Talks in Pennsylvania are at crunch time over a budget, legalizing marijuana and taxing skill games",,,,,,https://ca.news.yahoo.com/talks-pennsylvania-crunch-time-over-161836325.html,"HARRISBURG, Pa. (AP) — Pennsylvania Gov. Josh Shapiro and state lawmakers are getting down to crunch time, with big questions still outstanding about how to balance the Democrat's spending request.",,https://s.yimg.com/ny/api/res/1.2/GjHuTos5eUtYIaEMDS5Jrg--/YXBwaWQ9aGlnaGxhbmRlcjt3PTEyMDA7aD04MDA-/https://media.zenfs.com/en/cp_news_842/6456cd0fb3b88326ef151d0e2464bb3c,,,2025-06-16 13:10:28.601581
,Pennsylvania,2025-06-16 16:26:27+00:00,www.wfmj.com,"Talks in Pennsylvania are at crunch time over a budget, legalizing marijuana and taxing skill games",,,,,,https://www.wfmj.com/story/52854578/talks-in-pennsylvania-are-at-crunch-time-over-a-budget-legalizing-marijuana-and-taxing-skill-games,By MARC LEVY Associated Press,,https://wfmj.images.worldnow.com/images/13278531_G.jpg,,,2025-06-16 13:10:28.601581
,Education Funding,2025-06-16 16:02:02+00:00,The Seattle Times,Proposed federal cuts strike at heart of small towns - their schools,,,,,,https://www.seattletimes.com/education-lab/proposed-federal-cuts-horrific-says-washingtons-schools-chief/,Washington's state school superintendent says proposed federal cuts would devastate small rural districts that are the heart of their communities.,,https://images.seattletimes.com/wp-content/uploads/2025/06/06132025_tzr_tzr_113831.jpg?d=1200x630,,,2025-06-16 12:17:40.823109
,Education Funding,2025-06-16 15:51:16+00:00,Queens Daily Eagle,Opinion: One reckless budget cut. Thousands of students at risk — Queens Daily Eagle,,,,,,https://queenseagle.com/all/2025/6/16/opinion-one-reckless-budget-cut-thousands-of-students-at-risk,A LaGuardia Community College STEM grant program was cut by the Trump Administration and the professor is calling for it to be reinstated.,,http://static1.squarespace.com/static/5b9ffe0f1137a680c2c08250/5ba02661cd8366eb6ec50772/685038f85f4c350a4aa890fd/1750088031273/OP-ED+1.jpeg?format=1500w,,,2025-06-16 12:17:40.823109
,Education Funding,2025-06-16 15:42:05+00:00,indianacapitalchronicle.com,"Federal funding uncertainty eliminates Indiana programs, threatens others",,,,,,https://indianacapitalchronicle.com/2025/06/16/federal-funding-uncertainty-eliminates-indiana-programs-threatens-others/,Other categories include $1.2 billion for public higher education; $1.1 billion to nonprofits and $558 million for city governments. Story continues ...,,,,,2025-06-16 12:17:40.823109
,Maine,2025-06-16 15:30:46+00:00,www.pressherald.com,"Across Maine, towns continue to grapple with school district reorganization",,,,,,https://www.pressherald.com/2025/06/16/across-maine-towns-continue-to-grapple-with-school-district-reorganization/,"... schools per student than the national average, according to federal data. ... In Maine as elsewhere, school funding trend is unsustainable. Business ...",,,,,2025-06-16 12:17:40.823109
,Education Funding,2025-06-16 15:21:17+00:00,virginiamercury.com,Appeals for federal relief funds for Virginia schools remain uncertain,,,,,,https://virginiamercury.com/2025/06/16/appeals-for-federal-relief-funds-for-virginia-schools-remain-uncertain/,"After the U.S. education secretary set a March deadline to use unspent pandemic relief funds, Virginia school officials are still awaiting a ...",,,,,2025-06-16 12:17:40.823109
,Education Funding,2025-06-16 15:10:28+00:00,The Hill,"It’s not just taxes: Trump’s bill will have ‘big beautiful’ effects on education, too",,,,,,https://thehill.com/opinion/education/5348707-its-not-just-taxes-trumps-bill-will-have-big-beautiful-effects-on-education-too/,Trump’s bill seeks to disrupt an underperforming education system without imposing federal mandates or siphoning funds from public education.,,https://thehill.com/wp-content/uploads/sites/2/2024/10/AP23291654877474.jpg?w=1280,,,2025-06-16 12:17:40.823109
,Education Funding,2025-06-16 15:04:13+00:00,Green Bay Press-Gazette,What will Green Bay-area schools look like if funding doesn't increase?,,,,,,https://www.greenbaypressgazette.com/story/news/education/2025/06/16/green-bay-area-schools-discuss-cost-cutting-efforts-if-funding-dries-up/83882611007/,"After 30 years of cuts, Wisconsin school districts are looking at hard decisions if things don't change. What do those choices look like?",,"https://www.greenbaypressgazette.com/gcdn/presto/2023/04/14/PAPN/02cd29d4-1382-4645-81e7-e9fa049ea0f7-APC_Day_in_the_life__teacher_19930_041323_wag.jpg?crop=4555,2563,x0,y212&width=3200&height=1801&format=pjpg&auto=webp",,,2025-06-16 12:17:40.823109
,Education Funding,2025-06-16 14:32:04+00:00,PBS News,Researchers warn U.S. is on the ‘precipice’ of brain drain as Trump cuts federal grants,,,,,,https://www.pbs.org/newshour/health/researchers-warn-u-s-is-on-the-precipice-of-brain-drain-as-trump-cuts-federal-grants,"The Trump administration’s cuts to federal funding and hiring freezes at colleges and universities come at a crucial time, destabilizing the nation's research infrastructure and prompting many scientists to continue their work abroad if its future remains uncertain in the U.S.",,https://d3i6fh83elv35t.cloudfront.net/static/2025/06/GettyImages-127871303-1024x683.jpg,,,2025-06-16 12:17:40.823109
,New York City,2025-06-16 14:12:45+00:00,Representative Ocasio-Cortez,"Ocasio-Cortez Requests $31,989,527 in FY26 Federal Community Project Funding for Fifteen Projects in The Bronx and Queens",,,,,,http://ocasio-cortez.house.gov/media/press-releases/ocasio-cortez-requests-31989527-fy26-federal-community-project-funding-fifteen,"Washington, D.C. - Today, Representative Alexandria Ocasio-Cortez (NY-14) announced that she has requested federal funding for 15 community projects that would serve New York’s 14th Congressional District.",,https://ocasio-cortez.house.gov/sites/evo-subsites/ocasio-cortez.house.gov/files/evo-media-image/aoc-social.jpeg,,,2025-06-16 11:09:59.887602
,Education Funding,2025-06-16 14:12:45+00:00,Representative Ocasio-Cortez,"Ocasio-Cortez Requests $31,989,527 in FY26 Federal Community Project Funding for Fifteen Projects in The Bronx and Queens",,,,,,https://ocasio-cortez.house.gov/media/press-releases/ocasio-cortez-requests-31989527-fy26-federal-community-project-funding-fifteen,"Washington, D.C. - Today, Representative Alexandria Ocasio-Cortez (NY-14) announced that she has requested federal funding for 15 community projects that would serve New York’s 14th Congressional District.",,https://ocasio-cortez.house.gov/sites/evo-subsites/ocasio-cortez.house.gov/files/evo-media-image/aoc-social.jpeg,,,2025-06-16 12:17:40.823109
,Education Funding,2025-06-16 13:59:33+00:00,WTHI-TV,"Federal funding uncertainty eliminates Indiana programs, threatens others",,,,,,http://www.wthitv.com/news/federal-funding-uncertainty-eliminates-indiana-programs-threatens-others/article_b3e7a53c-fc4c-4f60-988b-e105804b6eaa.html,"Hurricanes Sandy, Helene and Milton. The Surfside condo collapse in Florida. Maui’s wildfires. Floods in Kentucky.All of these disasters had Hoosiers on the ground rescuing victims as part of Indiana",,https://bloximages.newyork1.vip.townnews.com/wthitv.com/content/tncms/assets/v3/editorial/2/d7/2d78aab6-29e2-49bf-a0ee-fbf93d941766/68501c427414c.image.png?crop=1930%2C1013%2C0%2C29&resize=1200%2C630&order=crop%2Cresize,,,2025-06-16 13:10:28.601581
,Education Funding,2025-06-16 13:51:43+00:00,School News Network | A Window into Your Public Schools,Massive federal spending bill includes nationwide school voucher program - School News Network | A Window into Your Public Schools,,,,,,https://www.schoolnewsnetwork.org/2025/06/16/massive-federal-spending-bill-includes-nationwide-school-voucher-program/,A first-of-its kind federal school voucher program would allow 100% tax credit for contributions to scholarship granting organizations.,,https://snn-images.schoolnewsnetwork.org/wp-content/uploads/2025/06/13151643/ALL-Kent-ISD-federal-voucher-program-MAIN.jpg,,,2025-06-16 12:17:40.823109
,Louisiana,2025-06-16 13:20:52+00:00,Pelican Post - Online Newspaper | Ascension Parish Online Newspaper,LPB Statement on Proposed Rescissions Package | Pelican Post - Online Newspaper,,,,,,https://pelicanpostonline.com/lpb-statement-on-proposed-rescissions-package/,"National funding challenges affecting PBS would have a ripple effect in Louisiana, negatively impacting the mission of Louisiana Public Broadcasting (LPB), according to LPB President and CEO, Clarence Copeland. Copeland spoke after a rescissions package was presented to Congress on Tuesday, June 3. The proposal would eliminate all previously appropriated funding for the Corporation for […]",,,,,2025-06-16 12:17:40.823109
,New York City,2025-06-16 10:39:23+00:00,Non Profit News | Nonprofit Quarterly,Advocates Seek to Protect Children with Disabilities from Federal Cuts - Non Profit News | Nonprofit Quarterly,,,,,,https://nonprofitquarterly.org/advocates-seek-to-protect-children-with-disabilities-from-federal-cuts/,Advocates warn that efforts to eliminate the US Department of Education could undo decades of progress in education for students with disabilities.,,https://nonprofitquarterly.org/wp-content/uploads/2025/06/REC-VA-public-schools.jpg,,,2025-06-16 11:09:59.887602
,Salt Lake City,2025-06-16 10:14:33+00:00,Yahoo News,Appeals for federal relief funds for Virginia schools remain uncertain,,,,,,https://www.yahoo.com/news/appeals-federal-relief-funds-virginia-091559484.html,"After the U.S. education secretary set a March deadline to use unspent pandemic relief funds, Virginia school officials are still awaiting a decision on their appeal whether the federal government will rescind the cutoff allowing them to use $33 million. Across the commonwealth, 14 school divisions, including Portsmouth, Chesapeake and Symth County, and the Department […]",,https://media.zenfs.com/en/virginia_mercury_articles_394/8112f80ae4a1676c5fddfadf1690d514,,,2025-06-16 11:09:59.887602
,Maine,2025-06-16 09:40:56+00:00,www.sunjournal.com,"Mt. Blue board reviews summer plans, student needs - Sun Journal",,,,,,https://www.sunjournal.com/2025/06/16/mt-blue-board-reviews-summer-plans-student-needs/,Elkington also shared positive news about federal education funding ... Maine's Office for Family Independence before June 15. “This is ...,,,,,2025-06-16 11:09:59.887602
,West Virginia,2025-06-16 09:35:57+00:00,www.newsfromthestates.com,Appeals for federal relief funds for Virginia schools remain uncertain | News From The States,,,,,,https://www.newsfromthestates.com/article/appeals-federal-relief-funds-virginia-schools-remain-uncertain,West Virginia · Wisconsin · Wyoming · D.C. Bureau · Health Care · Education · Gov ... Appeals for federal relief funds for Virginia schools remain ...,,,,,2025-06-16 11:09:59.887602
,Connecticut,2025-06-16 01:42:41+00:00,CT Examiner,School Budget Deal Appears Back on in Norwalk,,,,,,https://ctexaminer.com/2025/06/15/school-budget-deal-appears-back-on-in-norwalk/,"NORWALK – An on-again, off-again $8 million proposal from Mayor Harry Rilling and State Sen. Bob Duff to shrink a gaping $13.2 million hole in the school budget – and […]",,https://ctexaminer.com/wp-content/uploads/2023/07/schoolday1b.jpg,,,2025-06-15 22:59:12.085173
,Louisiana,2025-06-16 01:28:15+00:00,KPEL 96.5,"LA GATOR Funding REJECTED—40,000 Families Caught in Budget Battle",,,,,,http://kpel965.com/la-gator-funding-rejected-louisiana-families/,"Louisiana families hoped for LA GATOR scholarships, but lawmakers prioritized teacher stipends.",,https://townsquare.media/site/36/files/2025/06/attachment-GettyImages-2206712014.jpg?w=1200&q=75&format=natural,,,2025-06-15 21:58:13.366864
,Education Funding,2025-06-15 22:08:10+00:00,The Guam Daily Post,'Substantially approvable’: Grant might bring in $35.8M for GDOE,,,,,,https://www.postguam.com/news/local/substantially-approvable-grant-might-bring-in-35-8m-for-gdoe/article_72c7e93d-3dc2-4c1e-a05e-f545a65ed4cb.html,"Deemed ""substantially approvable by the U.S. Department of Education,"" a grant application by the Guam Department of Education has taken a “critical step forward” in securing Consolidated Grant funds to",,https://bloximages.newyork1.vip.townnews.com/postguam.com/content/tncms/assets/v3/editorial/5/30/5304e16c-ce90-11ef-97aa-8314fc330bd6/677fd38980df7.image.jpg?crop=1817%2C954%2C0%2C93&resize=1200%2C630&order=crop%2Cresize,,,2025-06-15 21:58:13.366864
,Education Funding,2025-06-15 17:30:54+00:00,The N'West Iowa REVIEW,Dordt unaffected so far by federal grant cuts,,,,,,https://www.nwestiowa.com/scnews/dordt-unaffected-so-far-by-federal-grant-cuts/article_b9be967b-23b7-47a2-868a-92599ec62c8a.html,"SIOUX CENTER—Higher education and federal funding are big headlines right now, with the dispute between President Donald Trump and Harvard University at the forefront. Amid the funding cuts and political",,https://bloximages.newyork1.vip.townnews.com/nwestiowa.com/content/tncms/custom/image/3774426a-1a4a-11e7-96f4-e71ec6fa575e.jpg,,,2025-06-15 14:59:10.280124
,Maine,2025-06-15 13:21:36+00:00,https://www.wabi.tv,Maine legislature advances second state budget,,,,,,https://www.wabi.tv/2025/06/15/maine-legislature-advances-second-state-budget/,The proposed budget comes amid a tight fiscal year and ongoing uncertainty about federal funding.,,https://gray-wabi-prod.gtv-cdn.com/resizer/v2/S7KLXHICNZFVVGGRT6UCUUANHQ.png?auth=43dad2bdead45a25b45515bfbb405dddc00598cc24c1d03949d2f700d9dc651b&width=1200&height=600&smart=true,,,2025-06-15 12:05:47.589965
,Education Funding,2025-06-15 12:09:35+00:00,guampdn.com,Feds deem GDOE's $35.8M grant application 'substantially approvable',,,,,,https://www.guampdn.com/news/feds-deem-gdoes-35-8m-grant-application-substantially-approvable/article_41c44852-e2ff-4779-91e1-0877167f7ce1.html,The Guam Department of Education said its fiscal 2025 Consolidated Grant Application for $35.8 million has been officially deemed “substantially approvable” by the U.S. Department of Education.,,https://bloximages.newyork1.vip.townnews.com/guampdn.com/content/tncms/assets/v3/editorial/d/a9/da95f8dc-997b-11ee-be40-33c8b571d9be/657946b43a555.image.jpg?crop=1263%2C663%2C0%2C488&resize=1200%2C630&order=crop%2Cresize,,,2025-06-15 13:02:28.049851
,Maine,2025-06-15 11:39:53+00:00,The Maine Monitor,Maine towns continue to grapple with school district reorganization,,,,,,https://themainemonitor.org/towns-grapple-school-district-reorganization/,More than 40 towns have withdrawn from their school districts since the state’s 2007 consolidation push.,,https://themainemonitor.org/wp-content/uploads/2025/06/York-school-buses-AP.jpg,,,2025-06-15 12:05:47.589965
,Kentucky,2025-06-15 07:22:19+00:00,www.msn.com,"KET, KY public radio say future in doubt as House votes to ax funding - MSN",,,,,,https://www.msn.com/en-us/news/politics/ket-ky-public-radio-say-future-in-doubt-as-house-votes-to-ax-funding/ar-AA1GF8A4,"Kentucky Education Television, KET, receives 14% of its approximately $30.4 million budget from federal funding, KET officials have previously said. "" ...",,,,,2025-06-15 06:00:11.341928
,Education Funding,2025-06-14 22:42:50+00:00,Taylor News,‘School choice’ pitfalls and why voters must act in 2026,,,,,,"https://www.taylorpress.net/article/10176,school-choice-pitfalls-and-why-voters-must-act-in-2026",Taylor Press - Serving Taylor and Williamson County since 1914,,https://static2.taylorpress.net/data/wysiwig/logo/social%20media%20image.jpg,,,2025-06-14 21:01:05.725480
,Education Funding,2025-06-14 18:39:53+00:00,pasadenanow.com,Pasadena School District Faces Very Tough Choices to Cope With Budget Shortfall,,,,,,https://pasadenanow.com/main/pasadena-school-district-faces-very-tough-choices-to-cope-with-budget-shortfall,"Positive factors include discretionary block grant one-time funds, additional learning recovery funding ... Hall Lee asked how full federal funding of ...",,,,,2025-06-14 21:01:05.725480
,Education Funding,2025-06-14 16:04:57+00:00,www.bnd.com,Eight pressing headlines highlighting education in metro-east schools - Belleville News-Democrat,,,,,,https://www.bnd.com/news/local/article308220510.html,... federal funding for full-service community school models in neighboring East St. Louis. Read the stories below. Avant Elementary School Principal ...,,,,,2025-06-14 18:01:05.675028
,Maine,2025-06-14 14:41:50+00:00,WMTW,Maine legislature advances supplemental budget,,,,,,https://www.wmtw.com/article/maine-legislature-advances-supplemental-budget/65063983,The budget was passed after weeks of debate and will see further debate in both chambers ,,"https://kubrick.htvapps.com/htv-prod-media.s3.amazonaws.com/images/augusta-snow-67c8d46a5b589.jpg?crop=1.00xw:0.423xh;0,0&resize=1200:*",,,2025-06-14 12:05:15.483684
,Education Funding,2025-06-14 14:31:10+00:00,www.eldoradonews.com,Boys and Girls Club in Union County concerned about proposed federal budget cut | Eldorado News,,,,,,https://www.eldoradonews.com/news/2025/jun/14/boys-and-girls-club-in-union-county-concerned/,The Boys and Girls Club CEO of Union County sent out an email on the concern of the recent budget cut proposal for the 21st Century Community learning Centers.,,https://wehco.media.clients.ellingtoncms.com/static-4/teaser_images/www.eldoradonews.com_default.webp,,,2025-06-14 12:05:15.483684
,Maine,2025-06-14 13:39:32+00:00,mainemorningstar.com,Committee sets budget plan with party-line vote - Maine Morning Star,,,,,,https://mainemorningstar.com/2025/06/14/catch-up-on-the-latest-state-budget-decisions-in-the-maine-legislature/,Maine is one of five states that provide a state-funded benefit to noncitizens not eligible for federally funded SNAP. Mills proposed eliminating what ...,,,,,2025-06-14 13:01:56.875199
,California,2025-06-14 12:44:04+00:00,www.fresnobee.com,Clovis Unified faces a budget deficit despite growing enrollment. Here's why - Fresno Bee,,,,,,https://www.fresnobee.com/news/local/education-lab/article308596450.html,Clovis Unified is the only district in Fresno County that does not qualify for additional funding from the state's Local Control Funding Formula ...,,,,,2025-06-14 09:00:19.190582
,Salt Lake City,2025-06-14 12:05:31+00:00,WSGW 790 AM & 100.5 FM,Federal Child Care and Education Funding to Be Announced at Hemlock Elementary - WSGW 790 AM & 100.5 FM,,,,,,https://www.wsgw.com/federal-child-care-and-education-funding-to-be-announced-at-hemlock-elementary/,Congresswoman McDonald Rivet will announce federal funding to support education and community programs in mid-Michigan.,,https://www.wsgw.com/wp-content/uploads/2023/06/hemlock-schools-logo-local-e1694799753640.jpg?icb=1749902622,,,2025-06-14 09:00:19.190582
,Education Funding,2025-06-14 09:45:58+00:00,Education Week,The Number of Students Getting Free School Meals Is in Flux. Why?,,,,,,https://www.edweek.org/leadership/the-number-of-students-getting-free-school-meals-is-in-flux-why/2025/06,New York has become the latest state to make school meals free to all students regardless of income.,,https://epe.brightspotcdn.com/dims4/default/b6de08f/2147483647/strip/true/crop/1720x1150+0+0/resize/942x630!/quality/90/?url=https%3A%2F%2Fepe-brightspot.s3.us-east-1.amazonaws.com%2Fcc%2F27%2Fb0cd291d47deafaab5f0dbe1e419%2F061325-school-lunch-2-ap-bs.jpg,,,2025-06-14 15:02:19.550803
,New York City,2025-06-14 09:42:22+00:00,The American Prospect,New York Democrats are Wasting an Opportunity to Reverse COVID Learning Loss,,,,,,https://prospect.org/education/2025-06-14-covid-learning-loss-tutoring-new-york-democrats/,Pilot programs have shown success tutoring students. The state government has yet to follow suit.,,https://prospect.org/downloads/23064/download/AP23005644131140.jpg?cb=14de8923d283281c96d9ceadb5a3849a&w=1200,,,2025-06-14 06:58:48.167530
,Education Funding,2025-06-14 08:07:03+00:00,okcfriday.com,"Guest Column: 'Big Beautiful Bill' makes significant, drastic changes to education policy",,,,,,https://okcfriday.com/guest-column-big-beautiful-bill-makes-significant-drastic-changes-to-ed-p19881-126.htm,"As you can see from the analysis below, the federal funding and policy changes will be a tremendous change in how Kindergarten through twelfth grade ( ...",,,,,2025-06-14 16:02:54.361727
,Education Funding,2025-06-14 04:50:02+00:00,https://www.alaskasnewssource.com,"School closures possible, mayors say, as leaders gauge impact of education funding veto",,,,,,https://www.alaskasnewssource.com/2025/06/14/school-closures-possible-mayors-say-leaders-gauge-impact-education-funding-veto/,"As the impact of Gov. Mike Dunleavy’s budget vetoes begins to sink in, education and political leaders met on a Zoom call Friday afternoon to assess the damage. ",,https://gray-ktuu-prod.gtv-cdn.com/resizer/v2/4AED4GZEM5FOPORKSJ56K6VHJE.jpg?auth=a1ab5ea37325a25665eadd7e42f566037d18daced843127680a8172df31ba396&width=1200&height=600&smart=true,,,2025-06-14 02:58:49.064381
,Education Funding,2025-06-14 04:50:01+00:00,https://www.alaskasnewssource.com,$2.5 million Fairbanks shortfall: Interior leaders react to Dunleavy’s education funding veto,,,,,,https://www.alaskasnewssource.com/2025/06/14/25-million-fairbanks-shortfall-interior-leaders-react-dunleavys-education-funding-veto/,The veto lowers education funding from last year by $180 per student.,,https://gray-ktuu-prod.gtv-cdn.com/resizer/v2/RNUFKVUGYJDVTF27R6OUXZKPYU.jpg?auth=67ceabdb63c3bf9af707d0bb85d83a10a27bc937dd5b070da308e4b56fd77ec5&width=1200&height=600&smart=true,,,2025-06-14 18:01:05.675028
,New York City,2025-06-14 04:48:57+00:00,Fergus Now,"West Central Initiative Awarding $570,000 in Grants to Local Organizations",,,,,,https://fergusnow.com/2025/06/13/west-central-initiative-awarding-570000-in-grants-to-local-organizations/,"Fergus Falls, MN - West Central Initiative awarded grants totaling $570,000 to 55 organizations working across...",,https://media-cdn.socastsrm.com/wordpress/wp-content/blogs.dir/2396/files/2023/04/west-central-initiative-logo-no-tag-1200x675.jpg,,,2025-06-14 03:58:40.848590
