id,name,published,outlet,title,authors,category,market,categoryorder,articleorder,url,description,text,image,error,sentiment,firstEyes
,Costs & Impacts,2025-09-30 17:38:27+00:00,WAPT,Lawmakers want $54 million in EPA funds to go to JXN Water,,,,,,https://www.wapt.com/article/lawmakers-want-54-million-in-epa-funds-to-go-to-jxn-water/68135631,"The utility company will soon face a funding shortfall, Rep. Guest says.",,"https://kubrick.htvapps.com/htv-prod-media.s3.amazonaws.com/images/ob-curtis-1668518772.jpg?crop=1.00xw:1.00xh;0,0&resize=1200:*",,,2025-09-30 18:03:38.653795
,Costs & Impacts,2025-09-30 17:37:22+00:00,JD Supra,EPA Walks the Tightrope with Proposal to Reallocate Exempted Renewable Fuel Volumes | JD Supra,,,,,,https://www.jdsupra.com/legalnews/epa-walks-the-tightrope-with-proposal-3153240/,"On September 18, 2025, the United States Environmental Protection Agency (“EPA”) published its latest proposed policy in an active year for the Clean...",,https://jdsupra-static.s3.amazonaws.com/profile-images/og.16004_4824.jpg,,,2025-09-30 14:03:18.899961
,Costs & Impacts,2025-09-30 17:35:46+00:00,PEER.org,Court Blocks Action on PFAS in Sewage Sludge Fertilizers,,,,,,https://peer.org/court-blocks-action-on-pfas-in-sewage-sludge-fertilizers/,Decision Leaves Communities Vulnerable to Toxic Pollution,,https://peer.org/wp-content/uploads/2025/09/Featured-Releases-2025-1-9-30-25-biosolids-court-action.png,,,2025-09-30 14:03:18.899961
,Opposition & Allies,2025-09-30 17:35:07+00:00,Los Angeles Times,Tesla 'respectfully encourages' the Trump administration to preserve key climate finding,,,,,,https://www.latimes.com/environment/story/2025-09-29/tesla-respectfully-encourages-the-trump-administration-to-preserve-key-climate-finding,Tesla asked the Trump administration EPA to preserve the so-called endangerment finding which is at the heart of some U.S.  greenhouse gas rules,,https://ca-times.brightspotcdn.com/dims4/default/dcae16b/2147483647/strip/true/crop/7958x4178+0+564/resize/1200x630!/quality/75/?url=https%3A%2F%2Fcalifornia-times-brightspot.s3.amazonaws.com%2Fb4%2F33%2F10f3320f4248a12354e792bc1905%2Fap25070731249618.jpg,,,2025-09-30 16:04:32.414850
,,2025-09-30 17:25:50+00:00,www.nrc.gov,§ 76.53 Consultation with Environmental Protection Agency. | Nuclear Regulatory Commission,,,,,,https://www.nrc.gov/reading-rm/doc-collections/cfr/part076/part076-0053,"§ 76.53 Consultation with Environmental Protection Agency. ... In reviewing an application for a certificate, including the provisions of any compliance ...",,,,,2025-09-30 16:04:32.414850
,Opposition & Allies,2025-09-30 17:19:19+00:00,penncapital-star.com,The Chesapeake Bay program reaches a crossroads - Pennsylvania Capital-Star,,,,,,https://penncapital-star.com/energy-environment/the-chesapeake-bay-program-reaches-a-crossroads/,"... organization that covers climate, energy and the environment. ... Environmental Protection Agency that is already pushing for less ambitious goals.",,,,,2025-09-30 14:03:18.899961
,Costs & Impacts,2025-09-30 16:46:42+00:00,www.mitchellwilliamslaw.com,Regional Haze/Advance Notice of Proposed Rulemaking: U.S. Environmental Protection Agency Solicits Comments for Development of Regulatory Changes to Implementation/Structure,,,,,,https://www.mitchellwilliamslaw.com/regional-haze/advance-notice-of-proposed-rulemaking-us-environmental-protection-agency-solicits-comments-for-development-of-regulatory-changes-to-implementation/structure,renewed commitment to cooperative federalism and recognizes the important responsibility EPA shares with our air agency partners to ensure clean air ...,,https://www.mitchellwilliamslaw.com/images/site/Social_Logo.jpg,,,2025-09-30 16:04:32.414850
,Costs & Impacts,2025-09-30 16:45:55+00:00,The Detroit News,"Lack of disposal space hampers dredging of toxic sediment in Detroit, Rouge rivers",,,,,,https://www.detroitnews.com/story/news/local/wayne-county/2025/09/29/army-corps-engineers-epa-pointe-mouillee-great-lakes-disposal-facilities-dredging-roug/86168506007/,The landfill designed to hold the dredged sediment — a small banana-shaped island called Pointe Mouillee — will run out of space in four years.,,"https://www.detroitnews.com/gcdn/authoring/authoring-images/2025/09/12/PDTN/86117091007-dji-20250911145052-0009-d-djiam.jpg?crop=5271,2965,x0,y491&width=3200&height=1801&format=pjpg&auto=webp",,,2025-09-30 14:03:18.899961
,,2025-09-30 16:31:10+00:00,https://www.1011now.com,EPA awards $1.2 Million Brownfields Grant to Southeast Nebraska Development District,,,,,,https://www.1011now.com/2025/09/30/epa-awards-12-million-brownfields-grant-southeast-nebraska-development-district/,"EPA Region 7 is awarding a $1.2 million Brownfields Assessment Grant to the Southeast Nebraska Development District (SENDD). The grant will fund environmental site assessments, cleanup planning, and community engagement to support redevelopment in Lincoln, Crete, Fairbury, and Nebraska City.",,https://gray-koln-prod.gtv-cdn.com/resizer/v2/PBHSSIFJMRGJRIX65MJW5ETMUA.jpg?auth=b5b06d81e89e97ba0c9570be390858034bce61c4d8db7f06c2d799d92d344c4c&width=1200&height=600&smart=true,,,2025-09-30 13:07:29.476685
,Opposition & Allies,2025-09-30 16:28:18+00:00,Land Line Media,EPA proposal would limit California’s Clean Truck Check program,,,,,,https://landline.media/epa-proposal-would-limit-californias-clean-truck-check-program/,"Under the EPA proposal, California’s Clean Truck Check program would not apply to vehicles registered in another state or country.",,https://landline.media/wp-content/uploads/2025/09/09-30-25-EPA-comments-OOIDA-pic.jpg,,,2025-09-30 13:07:29.476685
,,2025-09-30 16:25:42+00:00,KHGI,EPA awards $1.2M grant to Southeast NE Development District for brownfields,,,,,,https://nebraska.tv/news/local/epa-awards-12m-grant-to-southeast-ne-development-district-for-brownfields,The U.S. Environmental Protection Agency (EPA) Region 7 has awarded a $1.2 million Brownfields Assessment Grant to the Southeast Nebraska Development District (,,https://nebraska.tv/resources/media/406dcf92-4dfe-4cdf-9b0a-73e0b92c5e2c-GettyImages2167038892.jpg,,,2025-09-30 13:07:29.476685
,,2025-09-30 15:47:40+00:00,www.safetyandhealthmagazine.com,EPA seeks to revise how it evaluates chemical risks,,,,,,https://www.safetyandhealthmagazine.com/articles/27389-epa-seeks-to-revise-how-it-evaluates-chemical-risks,Washington — The Environmental Protection Agency is accepting comment on a proposal that would scale back rulemaking related to how the agency evaluates a chemical’s risk to workers.,,https://www.safetyandhealthmagazine.com/ext/resources/images/news/government/US-Environmental-Protection-Agency.jpg?height=635&t=1671649945&width=1200,,,2025-09-30 12:08:34.004414
,,2025-09-30 15:47:04+00:00,Legal Planet,Webinar: Climate Policy without the Endangerment Finding - Legal Planet,,,,,,https://legal-planet.org/2025/09/30/epa-is-trying-to-kneecap-future-climate-policies/,"UCLA Law's ""Up in the Air"" webinar explores the future of U.S. climate policy if the endangerment finding is repealed.",,https://legal-planet.org/wp-content/uploads/2025/09/Up-in-the-Air-Background-1.png,,,2025-09-30 14:03:18.899961
,Costs & Impacts,2025-09-30 15:45:29+00:00,USA TODAY,"Environmental enforcement drops to a new low in Trump administration, data shows",,,,,,https://www.usatoday.com/story/news/investigations/2025/09/30/trump-administration-environmental-enforcement-new-low/86327009007/,"Trump EPA started 14 lawsuits against companies for environmental violations, the fewest in any six-month period this century and below Biden numbers",,"https://www.usatoday.com/gcdn/authoring/authoring-images/2025/09/24/USAT/86328867007-2209243682.jpg?crop=5999,3375,x0,y0&width=3200&height=1801&format=pjpg&auto=webp",,,2025-09-30 12:08:34.004414
,Costs & Impacts,2025-09-30 15:37:32+00:00,Utility Dive,"EPA mulls postponing coal plant wastewater compliance, changes to Regional Haze Rule",,,,,,https://www.utilitydive.com/news/epa-mulls-postponing-coal-plant-wastewater-compliance-changes-to-regional/761464/,"Extending compliance timelines for EPA’s effluent limitations rules would save between $30 million and $200 million annually, the agency said. Coal waste contains contaminants including mercury, cadmium and arsenic. ",,https://imgproxy.divecdn.com/JdK9U6DiFNv60E2hgAskDO3v1pdbu3b1g8hkcxTvEoQ/g:nowe:123:556/c:2272:1515/rs:fit:770:435/Z3M6Ly9kaXZlc2l0ZS1zdG9yYWdlL2RpdmVpbWFnZS9LaW5nc3Rvbl9jb2FsX2FzaF9zcGlsbC5qcGc=.webp,,,2025-09-30 12:08:34.004414
,Costs & Impacts,2025-09-30 15:35:19+00:00,The Banner,"With an email, Salisbury plant gets a pass on EPA rules for toxic gas ",,,,,,https://www.thebanner.com/community/climate-environment/trinity-sterile-salisbury-ethylene-oxide-epa-WLD3IJFWK5AZVAMWDZI73K3Y7U/,"In July, Trinity Sterile got a waiver from the EPA to keep releasing the same amount of toxic chemical ethylene oxide until at least 2028.",,"https://www.thebanner.com/resizer/v2/ZLL4FC3WLNHGZOP2HZ2ID7TQGY.JPG?auth=0bf0cb8851ebb19ea2b67a42ee24dd6d00937b2837f1796cf29067f84823ba77&width=900&focal=1581,1256&quality=85",,,2025-09-30 13:07:29.476685
,,2025-09-30 15:34:31+00:00,www.agweb.com,EPA Updates A/C Rules: What Farmers Need to Know - AgWeb,,,,,,https://www.agweb.com/news/machinery/epa-updates-c-rules-what-farmers-need-know,"EPA refrigerant rules are changing. Learn how the shift to R-1234yf affects tractor and farm vehicle A/C systems, tools and maintenance.",,,,,2025-09-30 12:08:34.004414
,Costs & Impacts,2025-09-30 15:30:53+00:00,Bay Journal,EPA names new Bay Program director,,,,,,https://www.bayjournal.com/news/people/epa-names-new-bay-program-director/article_54368cac-4e8b-4519-870a-6bcfea487c2e.html,The U.S. Environmental Protection Agency has selected a career employee with two decades of experience at the agency as the new head of its Chesapeake Bay Program Office in Annapolis.,,https://bloximages.newyork1.vip.townnews.com/bayjournal.com/content/tncms/assets/v3/editorial/5/43/54368cac-4e8b-4519-870a-6bcfea487c2e/68dbf4f6e234f.preview.jpg?crop=653%2C343%2C0%2C41,,,2025-09-30 12:08:34.004414
,,2025-09-30 15:28:28+00:00,US EPA,"EPA Finalizes Groundwater Cleanup Plan at Former Sherwin-Williams Site in Gibbsboro, NJ | US EPA",,,,,,https://www.epa.gov/newsreleases/epa-finalizes-groundwater-cleanup-plan-former-sherwin-williams-site-gibbsboro-nj,"U.S. Environmental Protection Agency (EPA) has finalized its plan to clean up contaminated groundwater associated with the Former Manufacturing Plant area of the Sherwin-Williams/Hilliards Creek Superfund Site in Gibbsboro, Camden County, New Jersey.",,https://www.epa.gov/sites/all/themes/epa/img/epa-news-releases-og.jpg,,,2025-09-30 13:07:29.476685
,Costs & Impacts,2025-09-30 15:12:31+00:00,The Topeka Capital-Journal,"Topeka gets $500,000 grant to test for pollution at abandoned sites",,,,,,https://www.cjonline.com/story/news/local/2025/09/30/topeka-to-test-sites-for-environmental-contamination-with-grant-funds/86345917007/,"Candidates for the grant include the site of the former White Lakes Mall, the abandoned Van Buren School and East Topeka Junior High School.",,"https://www.cjonline.com/gcdn/authoring/authoring-images/2023/12/08/NTCJ/71856643007-20231208-van-buren-school-en-1.jpg?crop=5764,3242,x0,y300&width=3200&height=1800&format=pjpg&auto=webp",,,2025-09-30 12:08:34.004414
,Costs & Impacts,2025-09-30 14:51:41+00:00,pipeline-journal.net,"U.S. Pipeline Company Fined for Massive Gasoline Spill in Walnut Creek, California",,,,,,https://pipeline-journal.net/news/us-pipeline-company-fined-massive-gasoline-spill-walnut-creek-california,"Closeup of the sign at the entrance to the U.S. Environmental Protection Agency (EPA) Headquarters in Washington, DC (© Shutterstock/Tada Images).",,,,,2025-09-30 14:03:18.899961
,,2025-09-30 14:31:41+00:00,www.epa.gov,US ENVIRONMENTAL PROTECTION AGENCY CONTINGENCY PLAN FOR SHUTDOWN,,,,,,https://www.epa.gov/system/files/documents/2025-09/epa-contingency-plan-9_29_25.pdf,"Exempted: An agency may ""exempt"" activities from the shutdown if the activities have funds available. The two main types of exempted activities at EPA ...",,,,,2025-09-30 13:07:29.476685
,,2025-09-30 14:23:29+00:00,KSBW,Moss Landing facility begins removal of damaged batteries from fire ,,,,,,https://www.ksbw.com/article/moss-landing-facility-removal-batteries-fire/68123828,"Crews are removing lithium-ion battery modules from the Moss Landing facility to minimize fire risk, following damage from the battery fire in January. ",,"https://kubrick.htvapps.com/vidthumb/632d33a9-6653-40f8-84a3-9074a6fdd2d3/551a8c38-3361-47de-854e-72d47ebf3b06.jpg?crop=1xw:1.0xh;center,top&resize=1200:*",,,2025-09-30 12:08:34.004414
,Costs & Impacts,2025-09-30 14:06:34+00:00,subscriber.politicopro.com,E&E News: Shutdown threatens to delay Zeldin’s climate rule rollback,,,,,,https://subscriber.politicopro.com/article/eenews/2025/09/30/shutdown-threatens-to-delay-zeldins-climate-rule-rollback-00585889,The EPA administrator's aggressive timeline would be undermined by the agency shuttering for a prolonged period. ,,https://static.politico.com/4e/f0/bebb61c54c918801c480a926a9f2/trump-sept-11-anniversary-84374.jpg,,,2025-09-30 13:07:29.476685
,,2025-09-30 13:54:23+00:00,www.bdlaw.com,EPA Proposes Changes to TSCA Risk Evaluation Framework Rule – Again,,,,,,https://www.bdlaw.com/chemicals-regulation/publications/epa-proposes-changes-to-tsca-risk-evaluation-framework-rule-again/,The U.S. Environmental Protection Agency (EPA) published proposed revisions to the procedural framework rule for conducting risk evaluations under ...,,,,,2025-09-30 13:07:29.476685
,,2025-09-30 13:41:57+00:00,EBSCO,Environmental law and the Supreme Court | Research Starters | EBSCO Research,,,,,,https://www.ebsco.com/research-starters/environmental-sciences/environmental-law-and-supreme-court,"<p>Environmental law encompasses regulations aimed at protecting the natural environment, including air, water, and land, as well as public health and the welfare of wildlife. The Supreme Court plays a crucial role in interpreting these laws, often determining how they are implemented and enforced. Historically, the Court has tackled significant cases that shaped federal authority over environmental regulations, starting from the 1960s when the federal government began to take a more active role in environmental protection.</p>
<p>Through landmark rulings, the Court has balanced the interests of industry, state, and federal agencies while establishing precedents that govern the scope of environmental legislation. For instance, in cases like Massachusetts v. EPA, the Court affirmed the Environmental Protection Agency&#039;s authority to regulate greenhouse gases. However, subsequent rulings, such as West Virginia v. EPA, have curtailed this power, illustrating the ongoing tension between environmental protection and regulatory authority.</p>
<p>Additionally, the Court&#039;s decisions have influenced citizen involvement in environmental issues, often determining who has the standing to sue and how regulations are applied. The evolving landscape of environmental law reflects broader societal concerns about climate change and the role of government in regulating industries, making the judiciary&#039;s engagement with these laws a pivotal aspect of environmental governance in the United States.</p>
",,https://www.ebsco.com/ebsco-default-og-image.png,,,2025-09-30 12:08:34.004414
,EPA Rollbacks,2025-09-30 13:03:20+00:00,Government Executive,Trump administration is on track to cut 1 in 3 EPA staffers by the end of 2025,,,,,,https://www.govexec.com/workforce/2025/09/trump-administration-track-cut-1-3-epa-staffers-end-2025/408455/%3Foref%3Dge-featured-river-top,Critics say the staffing cuts hinder the agency’s ability to keep pollution out of air and water.,,https://cdn.govexec.com/media/img/cd/2025/09/29/09292025EPA/open-graph.jpg,,,2025-09-30 12:08:34.004414
,,2025-09-30 11:01:21+00:00,www.clu-in.org,Search - CLU-IN | In The News > Technology Innovation News Survey > Search Result,,,,,,https://www.clu-in.org/products/tins/tinsone.cfm%3Fid%3D4488285%26query%3D%2528thermal%252A%2520and%2520enhanc%252A%2529%2520or%2520steam%26numresults%3D25%26startrow%3D2576,ETC2 is the technology transfer and commercialization agent for the U.S. EPA and operates through the auspices of EPA's Federal Technology Transfer ...,,,,,2025-09-30 11:00:29.851537
,EPA Rollbacks,2025-09-30 09:18:40+00:00,Hanson Bridgett,"While Vacating Drinking Water Standards for Some PFAS, the EPA Retains Other Biden-Era PFAS Regulations",,,,,,https://www.hansonbridgett.com/publications/250929-2022-pfas-regulations,The U.S. Environmental Protection Agency maintains its regulatory stance on PFOA and PFOS even as it moves to scale back its drinking water standards for four other PFAS compounds.,,https://www.hansonbridgett.com/sites/default/files/2025-09/shutterstock_2329210219.jpg,,,2025-09-30 08:01:41.961375
,,2025-09-30 08:03:46+00:00,www.specialchem.com,EPA proposes rule to revise chemical risk evaluations process under TSCA - SpecialChem,,,,,,https://www.specialchem.com/coatings/news/epa-proposes-rule-to-revise-chemical-risk-evaluations-process-under-tsca,U.S. Environmental Protection Agency (EPA) released a proposed rule to revise the process for conducting risk evaluations for chemicals already in ...,,,,,2025-09-30 08:01:41.961375
,,2025-09-30 05:36:33+00:00,www.govinfo.gov,Environmental Protection Agency § 35.245 - GovInfo,,,,,,https://www.govinfo.gov/content/pkg/CFR-2020-title40-vol1/pdf/CFR-2020-title40-vol1-sec35-212.pdf,"Environmental Protection Agency. § 35.245. CFR part 124, subparts B, E, and F; 40. CFR parts 260 through 266; 40 CFR parts 268 through 273; and 40 ...",,,,,2025-09-30 08:01:41.961375
,Costs & Impacts,2025-09-30 03:32:02+00:00,Yahoo Finance,"Trump administration opens more land for coal mining, offers $625M to boost coal-fired power plants",,,,,,https://finance.yahoo.com/news/trump-administration-opens-more-land-182209711.html,"The Trump administration said Monday it will open 13 million acres of federal lands for coal mining and provide $625 million to recommission or modernize coal-fired power plants as President Donald Trump continues his efforts to reverse the years-long decline in the U.S. coal industry.  Actions by the Energy and Interior departments and the Environmental Protection Agency follow executive orders Trump issued in April to revive coal, a reliable but polluting energy source that’s long been shrinking amid environmental regulations and competition from cheaper natural gas.  Environmental groups denounced the actions, which come as the Trump administration has clamped down on renewable energy, including freezing permits for offshore wind projects, ending clean energy tax credits and blocking wind and solar projects on federal lands.",,https://s.yimg.com/ny/api/res/1.2/0FSCRhqwn4NTcucrjFmMjQ--/YXBwaWQ9aGlnaGxhbmRlcjt3PTEyMDA7aD03OTU-/https://media.zenfs.com/en/ap_finance_articles_694/28c2da620ceeb9a070850bdde9b7ed4d,,,2025-09-30 01:58:49.930663
,Costs & Impacts,2025-09-30 02:31:57+00:00,Inside Climate News,"Citing ‘AI Arms Race,’ Trump Administration Announces Efforts to Rekindle US Coal Industry - Inside Climate News",,,,,,https://insideclimatenews.org/news/29092025/trump-administration-announces-coal-industry-efforts/,"The administration is opening millions of additional acres of public land to mining while slashing royalty rates and environmental regulations for coal. Environmentalists warn of skyrocketing costs and threats to land, water and air.",,https://insideclimatenews.org/wp-content/uploads/2025/09/29721784502_5b77d39dfb_o-1024x683.jpg,,,2025-09-29 23:00:49.523894
,,2025-09-30 02:26:52+00:00,www.climatecasechart.com,American Petroleum Institute v. EPA - The Climate Litigation Database,,,,,,https://www.climatecasechart.com/collections/american-petroleum-institute-v-epa_1c7ed7,"Challenge to new source performance standards for oil and gas sector.
",,,,,2025-09-30 11:00:29.851537
,,2025-09-30 02:00:58+00:00,The White House,Continuance of Certain Federal Advisory Committees,,,,,,https://www.whitehouse.gov/presidential-actions/2025/09/continuance-of-certain-federal-advisory-committees/,"By the authority vested in me as President by the Constitution and the laws of the United States of America, and consistent with chapter 10 of title 5,",,https://www.whitehouse.gov/wp-content/uploads/2025/03/WH47-Presidential-Actions-Social-Share-Card.jpg,,,2025-09-29 23:00:49.523894
,Costs & Impacts,2025-09-30 01:32:30+00:00,www.pa.gov,Permit status,,,,,,https://www.pa.gov/agencies/dep/data-and-tools/track-permits/search/details.id1524077.html,Permit status,,https://www.pa.gov/content/dam/copapwp-pagov/en/global/images/thumbnail.png,,,2025-09-29 23:00:49.523894
,,2025-09-30 00:09:25+00:00,www.mn-net.com,PFAS Analysis According to EPA 533 - MACHEREY-NAGEL,,,,,,https://www.mn-net.com/media/pdf/21/26/5a/ApplicationNote-02-2021-PFAS-EPA533.pdf%3Futm_source%3DBenchmarkEmail%26utm_campaign%3D%25E6%25B0%25B8%25E9%2581%25A0%25E7%259A%2584%25E5%258C%2596%25E5%25AD%25B8%25E7%2589%25A9%25E8%25B3%25AA_(PFAS)_%25E6%25A8%25A3%25E5%2593%2581%25E8%25A3%25BD%25E5%2582%2599%25E5%258F%258A%25E5%2588%2586%25E6%259E%2590%25E5%25AE%258C%25E5%2585%25A8%25E6%2594%25BB%25E7%2595%25A5%26utm_medium%3Demail,"Therefore, EPA recommends two methods to detect PFAS from drinking water by solid phase extraction (SPE) and liquid chromatography/tandem mass spec‑.",,,,,2025-09-29 23:00:49.523894
,,2025-09-30 00:05:44+00:00,US EPA,EPA Oversees Largest Lithium-Ion Battery Cleanup in Agency History at Moss Landing | US EPA,,,,,,https://www.epa.gov/newsreleases/epa-oversees-largest-lithium-ion-battery-cleanup-agency-history-moss-landing,"Today, EPA began oversight of the removal of lithium-ion batteries from the Moss Landing, California battery energy storage facility impacted in a January 2025 fire, marking the start of an unprecedented battery cleanup effort.",,https://www.epa.gov/sites/all/themes/epa/img/epa-news-releases-og.jpg,,,2025-09-29 22:01:41.742372
,Costs & Impacts,2025-09-29 23:53:44+00:00,ein.az.gov,Gila County Flooding - Arizona Emergency Information Network (AzEIN),,,,,,https://ein.az.gov/node/831,Centers for Disease Control and Prevention (CDC): ... Environmental Protection Agency (EPA):. Septic Systems - What to Do after the Flood: ...,,,,,2025-09-29 23:00:49.523894
,,2025-09-29 23:38:57+00:00,US EPA,Cybersecurity Assessments | US EPA,,,,,,https://www.epa.gov/cyberwater/cybersecurity-assessments,The Cybersecurity Risk Assessments webpage contains cybersecurity assessment resources available for drinking water and wastewater systems.,,https://www.epa.gov/sites/all/themes/epa/img/epa-standard-og.jpg,,,2025-09-30 08:01:41.961375
,Costs & Impacts,2025-09-29 23:17:47+00:00,John Barrasso,"Barrasso, Lummis Join Wyoming Miners at Event Announcing New Policies to Unleash Wyoming Coal - John Barrasso",,,,,,https://www.barrasso.senate.gov/barrasso-lummis-join-wyoming-miners-at-event-announcing-new-policies-to-unleash-wyoming-coal/,"WASHINGTON, D.C. – U.S. Senators John Barrasso and Cynthia Lummis, both R-Wyo., released the following statements after attending a joint Department of the Interior (DOI), Environmental Protection Agency (EPA) and Department of Energy (DOE) event on unleashing America’s coal production.",,https://www.barrasso.senate.gov/wp-content/uploads/2025/09/DSC04597-scaled.jpg,,,2025-09-29 22:01:41.742372
,Costs & Impacts,2025-09-29 23:14:26+00:00,West Virginia Public Broadcasting,McCuskey Joins Investigation Of Tech Companies Renewable Claims - West Virginia Public Broadcasting,,,,,,https://wvpublic.org/story/government/mccuskey-joins-investigation-of-tech-companies-renewable-claims/,"The letter states that claims of fully renewable energy use are not only false, but also pressures energy providers to move away from fossil-fuel-generated energy.",,https://wvpublic.org/wp-content/uploads/2023/08/Solar-Panels-scaled.jpg,,,2025-09-29 20:02:31.211394
,Costs & Impacts,2025-09-29 23:13:19+00:00,JD Supra,EPA Retains CERCLA Hazardous Substance Designations for PFOA and PFOS | JD Supra,,,,,,https://www.jdsupra.com/legalnews/epa-retains-cercla-hazardous-substance-4260230/,"On September 17, 2025, the U.S. Environmental Protection Agency (EPA) announced that it will continue to defend the agency's decision to list two per-...",,https://jdsupra-static.s3.amazonaws.com/profile-images/og.13376_2834.jpg,,,2025-09-29 20:02:31.211394
,,2025-09-29 22:33:59+00:00,www.climatecasechart.com,Sierra Club v. EPA - The Climate Litigation Database,,,,,,https://www.climatecasechart.com/collections/sierra-club-v-epa_04eb03,"Freedom of Information lawsuit seeking external communications and meeting records for EPA staff that Sierra Club alleged had ""troubling ties to polluting industries.""",,,,,2025-09-29 22:01:41.742372
,,2025-09-29 22:28:45+00:00,cluin.org,Search - CLU-IN | In The News > Technology Innovation News Survey > Search Result,,,,,,https://cluin.org/products/tins/tinsone.cfm%3Fid%3D16483%26query%3DCHARACTERIZATION%2520AND%2520REMEDIATION%2520OF%2520A%2520TCE%2520SOURCE%2520AREA%2520USING%2520ELECTRICAL%2520RESISTANCE%2520HEATING%2520%26numresults%3D25%26startrow%3D276,U.S. Environmental Protection Agency. U.S. EPA Technology Innovation and ... REGION 3 CERCLA ENVIRONMENTAL SERVICES (COMBINE) U.S. Department ...,,,,,2025-09-29 22:01:41.742372
,Costs & Impacts,2025-09-29 22:10:24+00:00,spectrumlocalnews.com,"Trump administration dramatically expands coal mining, use for electricity",,,,,,https://spectrumlocalnews.com/us/snplus/environment/2025/09/29/coal-mining-federal-lands-coal-powered-electricity-department-of-interior-department-of-energy-epa,The Interior Department opened 13.1 million acres of federal lands for coal mining,,https://s7d2.scene7.com/is/image/TWCNews/coal_mine_expansion,,,2025-09-29 19:02:37.807960
