id,name,published,outlet,title,authors,category,market,categoryorder,articleorder,url,description,text,image,error,sentiment,firstEyes
,,2026-01-16 22:28:09+00:00,JD Supra,EPA Risk Evaluations Offer Clues for Next Direction for TSCA | JD Supra,,,,,,https://www.jdsupra.com/legalnews/epa-risk-evaluations-offer-clues-for-5366678/,"The Environment Protection Agency (EPA) closed out 2025 with a flurry of actions involving the Toxic Substances Control Act (TSCA), including final...",,https://jdsupra-static.s3.amazonaws.com/profile-images/og.15546_5043.jpg,,,2026-01-16 18:02:00.418412
,,2026-01-16 22:25:10+00:00,Energy Intelligence,Industry Upbeat on Permitting Reform After US EPA Proposal ,,,,,,https://www.energyintel.com/0000019b-c7a5-dddd-a5df-dfbf1b5a0000,"Despite continued partisan wrangling in Washington, the gas industry remains cautiously optimistic that a broad permitting reform bill can pass Congress this year.",,https://energyintel.brightspotcdn.com/dims4/default/e34e38b/2147483647/strip/true/crop/1000x525+0+0/resize/1200x630!/quality/90/?url=http%3A%2F%2Fenergy-intelligence-brightspot.s3.us-east-2.amazonaws.com%2F96%2F9a%2F103f39a74a0dbd7b76bfd7b72b51%2Fshutterstock-2057392214.jpg,,,2026-01-16 18:02:00.418412
,Costs & Impacts,2026-01-16 22:20:02+00:00,TechCrunch,EPA rules that xAI’s natural gas generators were illegally used | TechCrunch,,,,,,https://techcrunch.com/2026/01/16/epa-rules-that-xais-natural-gas-generators-were-illegally-used/,"Elon Musk's AI company had installed and operated 35 natural gas turbines without permits, something the EPA now says was illegal.",,"https://techcrunch.com/wp-content/uploads/2025/06/GettyImages-2217198328.jpeg?resize=1200,800",,,2026-01-16 18:02:00.418412
,Costs & Impacts,2026-01-16 21:58:32+00:00,www.msn.com,EPA response to 'disgusting' sewage runoff leaking into CT river yearly 'is underwhelming',,,,,,https://www.msn.com/en-us/news/us/lawmaker-epa-response-to-disgusting-sewage-runoff-leaking-into-ct-river-yearly-is-underwhelming/ar-AA1Ulj1S%3Focid%3DBingNewsVerp%26cvid%3Da3a2cfcb3519415cb2b27a99c1000155%26cvpid%3Da24fb77b62f84895d925d91152b49a61%26ei%3D13,... Environmental Protection Agency after demanding more be done to address the issue. Lawmakers claimed that several Massachusetts cities including ...,,,,,2026-01-16 18:02:00.418412
,,2026-01-16 21:43:23+00:00,TIME,The Women Saving America’s Climate Data,,,,,,https://time.com/7344773/women-saving-federal-climate-data/,"Meet the network saving federal environmental data. But, as Trump enters his second year, how long can this effort last?",,https://api.time.com/wp-content/uploads/2026/01/WomenClimateData.png?w=1200&h=628&crop=1,,,2026-01-16 17:03:13.882107
,Costs & Impacts,2026-01-16 20:30:16+00:00,USA TODAY,A popular weedkiller is part of Supreme Court's latest case. Here's why.,,,,,,https://www.usatoday.com/story/news/politics/2026/01/16/supreme-court-roundup-weedkiller-monsanto/88090923007/,The Supreme Court will decide whether to block thousands of lawsuits alleging Monsanto failed to warn people that its popular weedkiller could cause cancer.,,"https://www.usatoday.com/gcdn/authoring/authoring-images/2026/01/08/USAT/88090955007-20180506-t-173758-z-857566983-rc-15-c-48-d-8560-rtrmadp-3-monsantomabayer.JPG?crop=3499,1968,x0,y182&width=3200&height=1800&format=pjpg&auto=webp",,,2026-01-16 18:02:00.418412
,Costs & Impacts,2026-01-16 20:03:16+00:00,The New Lede,House Republicans move to roll back key protections in US chemical safety law,,,,,,https://www.thenewlede.org/2026/01/tsca-chemical-regulation-amendment-house-gop/,"In a widely anticipated move, House Republicans released a draft bill that would roll back several provisions in the nation’s premier chemical safety law with the stated goal of bolstering manufacturing and innovation. ",,https://www.thenewlede.org/wp-content/uploads/2026/01/0020cff8-c619-44a5-bea0-70c7ef4f65ed.jpg,,,2026-01-16 16:01:13.824176
,,2026-01-16 19:37:47+00:00,www.facebook.com,Two former heads of the Environmental Protection Agency—under a Democratic and a ... - Facebook,,,,,,https://www.facebook.com/EnvDefenseFund/posts/two-former-heads-of-the-environmental-protection-agencyunder-a-democratic-and-a-/1340296164801999/,"But beyond that, Lee Zeldin, the administrator of the Environmental Protection Agency, reframed the purpose of the E.P.A. In a two-minute-and-18- ...",,,,,2026-01-16 18:02:00.418412
,Costs & Impacts,2026-01-16 19:37:47+00:00,Natural Resources Council of Maine,Congress Passes Environmental Budget that Largely Avoids Drastic Cuts,,,,,,https://www.nrcm.org/news/congress-passes-environmental-budget-that-largely-avoids-drastic-cuts/,"January 16, 2026 (Augusta, ME) – The U.S. House and Senate have passed a bipartisan budget for the Environmental Protection Agency (EPA) and other environmental agencies that largely avoids drastic cuts proposed by the Trump Administration and its allies in Congress.      Environmental advocates in Maine said they",,https://www.nrcm.org/wp-content/uploads/2025/06/Tomhegan-wilderness-Moosehead-Lake-Michelle-Dellascio.jpg,,,2026-01-16 15:01:32.816101
,Costs & Impacts,2026-01-16 19:35:11+00:00,Congresswoman Haley Stevens,ICYMI: Congresswoman Haley Stevens Leads Fight to Protect Michigan Communities from PFAS Pollution,,,,,,https://stevens.house.gov/media/in-the-news/icymi-congresswoman-haley-stevens-leads-fight-protect-michigan-communities-pfas,"WASHINGTON, D.C. – ICYMI: Michigan Congresswoman Haley Stevens has been reaching Michiganders all across the state about her bipartisan legislation to close dangerous regulatory loopholes and strengthen federal oversight of PFAS air pollution, building on her ongoing effort to protect Michigan communities from toxic contamination. Here's what Michiganders are hearing about the bill:",,,,,2026-01-16 16:01:13.824176
,Opposition & Allies,2026-01-16 19:20:00+00:00,www.mitchellwilliamslaw.com,"Summer Effluent Limit/Clean Water Act: Medway, POTW Challenges NPDES Permit Before U.S. EPA Environmental Appeals Board",,,,,,https://www.mitchellwilliamslaw.com/summer-effluent-limit/clean-water-act-medway-potw-challenges-npdes-permit-before-us-epa-environmental-appeals-board,... Environmental Protection Agency (“EPA”) Environmental Appeals Board (“EAB”) styled: Petition for Review of Charles River Pollution Control ...,,https://www.mitchellwilliamslaw.com/images/site/Social_Logo.jpg,,,2026-01-16 18:02:00.418412
,,2026-01-16 19:19:01+00:00,www.kenner.la.us,Kenner Secures $8.09M in Federal Funding for Sewer Infrastructure Upgrades,,,,,,https://www.kenner.la.us/CivicAlerts.aspx%3FAID%3D233,"... Environmental Protection Agency's STAG–Clean Water State Revolving Fund, a key component of the Interior and Environment Appropriations bill's ...",,,,,2026-01-16 18:02:00.418412
,Costs & Impacts,2026-01-16 18:57:20+00:00,Environmental Working Group,House proposal would weaken EPA safeguards and fast-track toxic chemicals into American homes and workplaces,,,,,,https://www.ewg.org/news-insights/statement/2026/01/house-proposal-would-weaken-epa-safeguards-and-fast-track-toxic,"WASHINGTON – In a move that could dramatically increase Americans’ exposure to hazardous chemicals, House Republicans have released",,,,,2026-01-16 16:01:13.824176
,,2026-01-16 18:50:35+00:00,Chemical & Engineering News,Jan. 16 Policy Watch: NASA and DOE plan reactor on the moon,,,,,,https://cen.acs.org/policy/policy-watch-lunar-reactor-nasa-doe-paraquat-pfas-venezuela/104/web/2026/01,"In other developments, the EPA will reassess the safety of paraquat and New Jersey enacted a law banning PFAS in various consumer products",,"https://s7d1.scene7.com/is/image/CENODS/Jan--16-Policy-Watch---321142:Widescreen?$responsive$&qlt=90,0&resMode=sharp2&fmt=webp",,,2026-01-16 15:01:32.816101
,Costs & Impacts,2026-01-16 18:46:53+00:00,www.nrdc.org,Trump's Actions Will Raise Drivers' Costs - NRDC,,,,,,https://www.nrdc.org/press-releases/nrdc-trumps-actions-will-raise-drivers-costs,"Separately, the Environmental Protection Agency is poised to repeal standards that limit tailpipe carbon pollution. But, again, the existing EPA ...",,,,,2026-01-16 14:02:00.598955
,Costs & Impacts,2026-01-16 18:45:23+00:00,The Environmental Council of the States (ECOS),Ohio Launches Chloride Grants to Reduce Road Salt Runoff - The Environmental Council of the States (ECOS),,,,,,https://www.ecos.org/news-and-updates/ohio-launches-chloride-grants-to-reduce-road-salt-runoff/,Ohio EPA has opened applications for Chloride Reduction Grants under the statewide H2Ohio water quality initiative.,,,,,2026-01-16 16:01:13.824176
,Costs & Impacts,2026-01-16 18:40:10+00:00,The Breakthrough Institute,The Clock Is Ticking for Glyphosate,,,,,,https://thebreakthrough.org/issues/food-agriculture-environment/the-clock-is-ticking-for-glyphosate,"The Environmental Protection Agency (EPA), which reviews pesticide registrations every 15 years, is due to complete an updated human health risk ...",,https://thebreakthrough.imgix.net/articles/the-clock-is-ticking-for-glyphosate/_1200x630_crop_center-center_82_none/Glyphosate_2.jpeg?mtime=1768514299,,,2026-01-16 16:01:13.824176
,Opposition & Allies,2026-01-16 18:21:15+00:00,The New Lede,EPA chief ’s MAHA tweet - PR stunt or real progress?,,,,,,https://www.thenewlede.org/2026/01/epa-chief-s-maha-tweet-pr-stunt-or-real-progress/,"Environmental Protection Agency (EPA) Administrator Lee Zeldin sparked news stories around the US last week when he tweeted that the agency had made the “proactive decision to freshly reassess” the safety of the weed killer paraquat, a controversial pesticide widely used by farmers that is linked to Parkinson’s disease.",,https://www.thenewlede.org/wp-content/uploads/2026/01/lee-zeldin-in-video.png,,,2026-01-16 16:01:13.824176
,,2026-01-16 18:09:29+00:00,Florida Department of Health,Environmental Public Health Preparedness - Florida Department of Health,,,,,,https://www.floridahealth.gov/community-environmental-public-health/environmental-public-health/environmental-public-health-preparedness/,"During emergencies, we provide guidance to both incident command and county health departments regarding possible human health risks from environmental",,,,,2026-01-16 14:02:00.598955
,Costs & Impacts,2026-01-16 18:02:17+00:00,Nashville Banner,"Metro Water Services works to identify, reduce lead water lines - Nashville Banner",,,,,,https://nashvillebanner.com/2026/01/16/nashville-metro-water-services-lead-water-lines/,Metro Water Services in Nashville continues to identify and replace lead water lines to ensure safe drinking water for residents.,,https://i0.wp.com/nashvillebanner.com/wp-content/uploads/2026/01/IMG_1620-scaled.jpg?fit=2560%2C1843&quality=89&ssl=1,,,2026-01-16 14:02:00.598955
,Costs & Impacts,2026-01-16 17:51:25+00:00,Waste Dive,Senate passes $8.8B EPA budget,,,,,,https://www.wastedive.com/news/senate-passes-epa-budget-cercla-landfill-pfas/809855/,The funding is about 4% less than last year but over 50% more than a previous White House proposal. It cuts funding for Superfund activities but maintains other research funding for landfill methane and PFAS.,,https://imgproxy.divecdn.com/2NaNHQq4P_0rfrWwTNMScS6Sxngs0vE2mnG-ywXO9_E/g:ce/rs:fit:770:435/Z3M6Ly9kaXZlc2l0ZS1zdG9yYWdlL2RpdmVpbWFnZS9UMllUNDQuanBn.webp,,,2026-01-16 13:01:57.158845
,,2026-01-16 17:36:09+00:00,the.ink,How to win the fight against plastic - by The Ink,,,,,,https://the.ink/p/how-to-win-the-fight-against-plastic%3Futm_source%3Dsubstack%26utm_medium%3Demail%26utm_content%3Dshare%26action%3Dshare,Former E.P.A. administrator Judith Enck on the crisis of federal regulation and how Americans can win environmental victories.,,,,,2026-01-16 16:01:13.824176
,,2026-01-16 17:32:23+00:00,www.mass.gov,Department of Environmental Protection - Mass.gov,,,,,,https://www.mass.gov/doc/masspower-notice-english/download,This action is required by the U.S. Environmental Protection Agency as stated in its final rule approving the Department's Operating Permit ...,,,,,2026-01-16 15:01:32.816101
,Costs & Impacts,2026-01-16 17:26:45+00:00,www.instagram.com,The United States Senate should restore the $125 million cut from the effort to replace lead ...,,,,,,https://www.instagram.com/reel/DTlHAnXDN8H/,"... Environmental Protection Agency clawed back an unspent portion of the ... agency's “exorbitant $2 billion slush fund,” Duckworth said. An ...",,,,,2026-01-16 13:01:57.158845
,,2026-01-16 17:02:57+00:00,www.des.nh.gov,EPA grant will help NHDES continue its work with craft beverage producers,,,,,,https://www.des.nh.gov/news-and-media/blog/epa-grant-will-help-nhdes-continue-its-work-craft-beverage-producers,... Environmental Protection Agency (EPA). Grant work will focus on helping craft beverage producers implement pollution prevention (P2) practices ...,,,,,2026-01-16 16:01:13.824176
,,2026-01-16 17:02:57+00:00,www.des.nh.gov,EPA grant goes to reducing toxic industrial solvent TCE | NH Department of Environmental Services,,,,,,https://www.des.nh.gov/news-and-media/blog/epa-grant-goes-reducing-toxic-industrial-solvent-tce,"Pictured: A large vapor degreaser. (Photo credit: TURI.) To better protect the environment and public health, the U.S. Environmental Protection ...",,,,,2026-01-16 15:01:32.816101
,Costs & Impacts,2026-01-16 16:52:23+00:00,Impakter,"Why Glyphosate, the World's Most Widely Used and Sued Herbicide, Is Under New Scrutiny - Impakter",,,,,,https://impakter.com/why-glyphosate-the-worlds-most-widely-used-and-sued-herbicide-is-it-under-new-scrutiny/,"Health expert Richard Seifman explores the latest scrutiny and controversies around Glyphosate, the active ingredient in Roundup.",,https://fastcdn.impakter.com/wp-content/uploads/2026/01/image-from-rawpixel-id-5961462-original-1.jpg,,,2026-01-16 13:01:57.158845
,Costs & Impacts,2026-01-16 16:48:51+00:00,www.nationalacademies.org,Addressing the Impact of Tobacco and Alcohol Use on Cancer-Related Health Outcomes,,,,,,https://www.nationalacademies.org/publications/29264%3Fpage%3D704,Manpower for Environmental Pollution Control: A Report to the U.S. Environmental Protection Agency From the Committee for Study of Environmental ...,,,,,2026-01-16 13:01:57.158845
,,2026-01-16 16:33:22+00:00,The Waterways Journal,Washington Waves: Waterway News From D.C. - The Waterways Journal,,,,,,https://www.waterwaysjournal.net/2026/01/16/washington-waves-waterway-news-from-d-c-20/,The Environmental Protection Agency has announced a proposed rule on Clean Water Act Section 401...,,https://www.waterwaysjournal.net/wp-content/uploads/2024/06/washwaves-color.jpg,,,2026-01-16 13:01:57.158845
,Costs & Impacts,2026-01-16 16:32:01+00:00,The Portland Press Herald,Maine approves new pesticides with forever chemicals,,,,,,https://www.pressherald.com/2026/01/15/maine-approves-new-pesticides-with-forever-chemicals/," The Board of Pesticide Control approved products that contain ingredients Maine will ban in 2032, arguing federal regulators consider them to be safe.",,https://www.pressherald.com/wp-content/uploads/sites/4/2026/01/US_Pesticides_Liability_Protection_05552.jpg?w=780,,,2026-01-16 13:01:57.158845
,,2026-01-16 16:25:44+00:00,www.gao.gov,Effluent Limitations Guidelines and Standards for the Steam Electric Power Generating - GAO,,,,,,https://www.gao.gov/assets/890/883329.pdf,"The Environmental Protection Agency (EPA) prepared an analysis of the costs and benefits of this rule. See 90 Fed. Reg. 61328, 61351 (Dec. 31 ...",,,,,2026-01-16 15:01:32.816101
,,2026-01-16 16:13:20+00:00,dep.nj.gov,NJDEP| News Releases | Murphy Administration Marks Resilience Accomplishments With ... - NJ.gov,,,,,,https://dep.nj.gov/newsrel/26_0004/,"... © State of New Jersey, 1996-2026. Department of Environmental Protection P. O. Box 420. Trenton, NJ 08625 609-777-3373. Created: January 16th, 2026.",,,,,2026-01-16 12:03:22.762219
,,2026-01-16 16:03:24+00:00,College of Natural Resources News,Expert Warns EPA Shift Could Undermine Benefits of Clean Air Rules,,,,,,https://cnr.ncsu.edu/news/2026/01/expert-warns-epa-shift-could-undermine-benefits-of-clean-air-rules/,"NC State professor Jennifer Richmond-Bryant warns that the EPA’s new policy downplays the health and economic benefits of air pollution regulations, potentially weakening public support and harming vulnerable communities.",,https://cnr.ncsu.edu/news/wp-content/uploads/sites/10/2026/01/kyger-creek-power-plant-halbergman-istock-1146x600-1.jpeg,,,2026-01-16 12:03:22.762219
,Costs & Impacts,2026-01-16 15:42:34+00:00,www.wtol.com,Delta residents turn out for lead testing clinic after EPA findings | wtol.com,,,,,,https://www.wtol.com/article/news/local/delta-residents-lead-testing-clinic-ohio-epa-findings/512-ec3078f8-3e59-48c4-8555-2bbf0eebf878,The clinic was started a week after the Ohio EPA shared results of high lead levels in the air near the Bunting Bearings facility under demolition.,,,,,2026-01-16 13:01:57.158845
,,2026-01-16 15:12:47+00:00,Carbon Brief,Prof Ben Santer: Trump administration is ‘embracing ignorance’ on climate science - Carbon Brief,,,,,,https://www.carbonbrief.org/prof-ben-santer-trump-administration-is-embracing-ignorance-on-climate-science/,"In an interview with Carbon Brief, Santer says the Trump administration is “engaged in a systematic attempt to dismantle climate science”",,https://www.carbonbrief.org/wp-content/uploads/2026/01/IMG_9736.jpg,,,2026-01-16 11:03:18.762886
,,2026-01-16 15:08:34+00:00,www.cbsnews.com,"Senate passes 3-bill package to fund parts of government, sending it to Trump",,,,,,https://www.cbsnews.com/news/senate-funding-package-commerce-justice-interior/,"When the Senate returns from a weeklong recess, it will have six remaining appropriations bills to get across the finish line before the Jan. 30 shutdown deadline.",,https://assets1.cbsnewsstatic.com/hub/i/r/2026/01/15/2a285944-bf49-41ed-ab0e-4cf9a1fc4c9e/thumbnail/1200x630g2/7f1097700438521d905a0e3cde69b1a0/gettyimages-2255802582.jpg,,,2026-01-16 13:01:57.158845
,,2026-01-16 15:02:48+00:00,JD Supra,Section 401/Clean Water Act: U.S. EPA Issues Proposed Rule Addressing Certification | JD Supra,,,,,,https://www.jdsupra.com/legalnews/section-401-clean-water-act-u-s-epa-7469504/,The United States Environmental Protection Agency (“EPA”) announced on January 13th a proposed rule addressing the certification process under Section...,,https://jdsupra-static.s3.amazonaws.com/profile-images/og.15833_1120.jpg,,,2026-01-16 12:03:22.762219
,,2026-01-16 15:01:47+00:00,www.appropriations.senate.gov,Congress Approves FY 2026 Interior and Environment Appropriations Bill | United States Senate Committee on Appropriations,,,,,,https://www.appropriations.senate.gov/news/majority/congress-approves-fy-2026-interior-and-environment-appropriations-bill,United States Senate Committee on Appropriations,,https://www.appropriations.senate.gov/themes/appropriations/images/sharelogo.jpg,,,2026-01-16 11:03:18.762886
,North Carolina,2026-01-16 14:45:32+00:00,www.nytimes.com,N.S.A. Nominee Promises to Protect Elections From Foreign Interference - The New York Times,,,,,,https://www.nytimes.com/2026/01/15/us/politics/trump-nsa-cyber-command-nominee.html,... administration eliminated nearly all of the government's fortifications to protect ... Environmental Protection Agency: The agency moved to limit the ...,,,,,2026-01-16 12:03:22.762219
,Costs & Impacts,2026-01-16 14:37:30+00:00,www.planetizen.com,EPA to Stop Considering the Cost of Lives Saved in Setting Pollution Limits - Planetizen,,,,,,https://www.planetizen.com/news/2026/01/136759-epa-stop-considering-cost-lives-saved-setting-pollution-limits,The Environmental Protection Agency will no longer calculate the health benefits of reducing air pollution when justifying clean air rules ...,,,,,2026-01-16 11:03:18.762886
,,2026-01-16 14:34:17+00:00,Friends Committee On National Legislation,January 2026: Inside the Greenhouse | Friends Committee On National Legislation,,,,,,https://www.fcnl.org/updates/2026-01/january-2026-inside-greenhouse,Inside the Greenhouse is a monthly update on FCNL’s environmental advocacy and the climate crisis.,,https://www.fcnl.org/sites/default/files/2024-11/Love%20Thy%20Neighbor%20at%20U.S.%20Capitol.jpg,,,2026-01-16 11:03:18.762886
,Costs & Impacts,2026-01-16 14:31:46+00:00,www.nytimes.com,Trump Wants to Halt Almost All Coal Plant Shutdowns. It Could Get Messy.,,,,,,https://www.nytimes.com/2026/01/16/climate/trump-coal-plants.html,"... administration's effort to halt work on an offshore wind project off Rhode Island. Environmental Protection Agency: In a reversal, the agency ...",,,,,2026-01-16 11:03:18.762886
,Costs & Impacts,2026-01-16 14:30:49+00:00,ProPublica,Trump Administration Orders USDA Employees to Investigate Foreign Researchers They Work With,,,,,,https://www.propublica.org/article/trump-usda-foreign-scientists,The new directive asks workers to check the backgrounds of foreign nationals collaborating with the department’s scientists for evidence of “subversive or criminal activity.” Their names are being sent to national security experts at the agency.,,"https://www.propublica.org/wp-content/uploads/2026/01/usda-foreign-scientists-3x2-feature-1.jpg?resize=2000,1333",,,2026-01-16 11:03:18.762886
,Costs & Impacts,2026-01-16 14:23:18+00:00,KCRA,Pollution is impacting air quality in Northern California. See conditions where you live ,,,,,,https://www.kcra.com/article/northern-california-air-quality-sacramento-haze/70013611,A layer of haze continues to hang over the Valley.,,"https://kubrick.htvapps.com/vidthumb/73c67a5a-4960-40f8-9f54-7c300cd2018d/14d90f79-bcba-48a1-86d5-f2aa55f556d4.jpg?crop=0.839xw:0.838xh;0.125xw,0&resize=1200:*",,,2026-01-16 11:03:18.762886
,Costs & Impacts,2026-01-16 14:00:44+00:00,Los Angeles Times,Leaked memo reveals California debated cutting wildfire soil testing before disaster chief’s exit,,,,,,https://www.latimes.com/environment/story/2026-01-16/leaked-memo-reveals-california-debated-cutting-wildfire-soil-testing-before-disaster-chiefs-exit,"Nancy Ward, the head of CalOES, left office on Dec. 30. She had publicly begged FEMA to test for toxic substances after the fires — then, according to an internal memo obtained by the L.A. Times, privately advocated against it.",,https://ca-times.brightspotcdn.com/dims4/default/c23a1d8/2147483647/strip/true/crop/8192x4301+0+582/resize/1200x630!/quality/75/?url=https%3A%2F%2Fcalifornia-times-brightspot.s3.amazonaws.com%2F55%2F2e%2F9461656a40bc96ec1c143b1c74c9%2F1494439-me-newsom-debris-removal-altadena-jey-458.jpg,,,2026-01-16 11:03:18.762886
,Costs & Impacts,2026-01-16 12:53:22+00:00,www.localmemphis.com,"Gas turbines need permits, according to new EPA ruling | localmemphis.com",,,,,,https://www.localmemphis.com/article/news/local/gas-turbines-need-permits-according-to-new-epa-ruling/522-0143c1b8-7e86-4455-9d93-477538326394,"MEMPHIS, Tenn. — The Environmental Protection Agency (EPA) ruled in January that methane gas turbines need construction and air permits.",,,,,2026-01-16 11:03:18.762886
,Costs & Impacts,2026-01-16 11:11:42+00:00,The Detroit News,"Trump trio making Michigan, Ohio auto stops as climate rollback looms",,,,,,https://www.detroitnews.com/story/business/autos/2026/01/16/trump-trio-making-mich-ohio-auto-stops-with-climate-rollback-looming-ford-stellantis-auto-show/88179868007/,"Trump's top officials on transportation, the environment and international trade are visiting auto plants and visiting the Detroit Auto Show.",,"https://www.detroitnews.com/gcdn/authoring/authoring-images/2025/09/22/PDTN/86292805007-getty-images-2232402260.jpg?crop=5999,3375,x0,y0&width=3200&height=1801&format=pjpg&auto=webp",,,2026-01-16 11:03:18.762886
,,2026-01-16 11:04:23+00:00,www.argusmedia.com,US imported biofuel credit cut unlikely in 2026 | Latest Market News,,,,,,https://www.argusmedia.com/en/news-and-insights/latest-market-news/2776451-us-imported-biofuel-credit-cut-unlikely-in-2026,"President Donald Trump's administration is unlikely to immediately slash blending credits for foreign biofuels and feedstocks brought into the US, but the idea remains under consideration, people familiar with the matter said.",,https://www.argusmedia.com/-/media/project/argusmedia/mainsite/images/14-generic-hero-banners/herobanner_1600x530_generic-c.jpg?h=530&iar=0&w=1600&rev=2cf023b4e0484c1bb091b9f72dbf7771&hash=72DBDFEBEF6EE62E751AB5DD2221C77E,,,2026-01-16 12:03:22.762219
,EPA Rollbacks,2026-01-16 10:31:51+00:00,Grist,Trump’s EPA is taking itself out of the regulation game,,,,,,https://grist.org/politics/trump-lee-zeldin-epa-endangerment-finding-emissions-human-health/,The agency has long tried to curb carbon emissions and protect human health. Critics say that under Trump it is giving up on both.,,https://grist.org/wp-content/uploads/2025/06/GettyImages-2200431267-e1749764769732.jpg?quality=75&strip=all,,,2026-01-16 11:03:18.762886
,Costs & Impacts,2026-01-16 09:30:25+00:00,www.bmj.com,Air pollution: EPA to stop putting price on human health benefits and focus on cost to industry,,,,,,https://www.bmj.com/content/392/bmj.s99,"... Environmental Protection Agency (EPA) cost-benefit calculations of air pollution. Instead, costs to industry will be the EPA's focus when ...",,,,,2026-01-16 11:03:18.762886
