id,name,published,outlet,title,authors,category,market,categoryorder,articleorder,url,description,text,image,error,sentiment,firstEyes
,North Carolina,2025-10-01 19:18:44+00:00,raleighnc.gov,Raleigh Water Meets EPA Standards on Lead,,,,,,https://raleighnc.gov/water-and-sewer/news/raleigh-water-meets-epa-standards-lead,"Raleigh Water customers can trust that their tap water meets rigorous Environmental Protection Agency standards, including regulations aimed at ...",,https://raleighnc.govFaucet,,,2025-10-01 16:02:49.850162
,,2025-10-01 18:52:43+00:00,Baltimore City Department of Public Works,DPW Extends Public Comment on Revised Phase II Plan for the Modified Sanitary Sewer Consent Decree,,,,,,https://publicworks.baltimorecity.gov/news/press-releases/2025-10-01-dpw-extends-public-comment-revised-phase-ii-plan-modified-sanitary,"The Baltimore City Department of Public Works (DPW) is extending the public comment period for the Revised Phase II Plan of the Modified Sanitary Sewer Consent Decree (MCD) to December 1, 2025. The December 1 extension is being provided to ensure productive feedback from residents and community stakeholders, and to support transparency as the City of Baltimore enters the second phase of its agreement with the Maryland Department of the Environment (MDE) and the U.S. Environmental Protection Agency (EPA).",,,,,2025-10-01 16:02:49.850162
,Costs & Impacts,2025-10-01 18:47:29+00:00,"Camden County, NJ","First case of West Nile Virus of the year detected in Camden County | Camden County, NJ",,,,,,https://www.camdencounty.com/first-case-of-west-nile-virus-of-the-year-detected-in-camden-county-2/,"(Gloucester Township, NJ) – The Camden County Department of Health and Human Services has detected the year’s first case of West Nile Virus in a Camden County resident.   On ... More",,https://www.camdencounty.com/wp-content/uploads/2020/02/virus.jpg,,,2025-10-01 16:02:49.850162
,,2025-10-01 18:40:05+00:00,National Conference of State Legislatures,"Capitol to Capitol | Oct. 1, 2025",,,,,,https://www.ncsl.org/newsletter/details/capitol-to-capitol-oct-1-2025,"Questions? Please use the email icon at left to contact NCSL’s State-Federal Affairs Division.  Congressional Updates  Federal Government Shutdown Resources  The federal government shutdown creates uncertainty across many government programs and services, including resources for states and federal participation in state-federal partnerships. The unpredictable length of the shutdown adds another layer of complexity as states make contingency plans.   Recognizing the importance of...",,,,,2025-10-01 15:05:58.329246
,,2025-10-01 18:24:01+00:00,www.publicnow.com,"EPA Settles with Four Companies to Improve Community Safety, Chemical Reporting",,,,,,https://www.publicnow.com/view/9BE7AD5C1B1D805E3728184F950467C759A93E21%3F1759340860,"New York, N.Y. - U.S. Environmental Protection Agency (EPA) has taken action against four companies in New York, New Jersey and Puerto Rico for ...",,,,,2025-10-01 15:05:58.329246
,,2025-10-01 18:19:50+00:00,www.nytimes.com,Environmental Protection Agency Employees Working Despite Furloughs Plan,,,,,,https://www.nytimes.com/2025/10/01/us/politics/government-shutdown-epa-working.html,"Lee Zeldin, the administrator of the Environmental Protection Agency, claps as he stands with. Lee Zeldin, the Environmental Protection Agency ...",,,,,2025-10-01 15:05:58.329246
,Costs & Impacts,2025-10-01 18:08:19+00:00,E&E News by POLITICO,Shutdown is on — but EPA is still working,,,,,,https://www.eenews.net/articles/shutdown-is-on-but-epa-is-still-working/,"Several employees discussed their fears about the funding lapse. “It feels very different this time. It feels much more chaotic,” one said.",,https://static.politico.com/dims4/default/55a1666/2147483647/resize/1200/quality/100/?url=https://static.politico.com/02/57/b3df0029471b82aed4b78c780a0e/epa-44972.jpg,,,2025-10-01 15:05:58.329246
,Costs & Impacts,2025-10-01 18:08:11+00:00,subscriber.politicopro.com,E&E News: Government shuts down,,,,,,https://subscriber.politicopro.com/article/eenews/2025/10/01/government-shuts-down-00588312,Many energy and environmental programs will come to a halt. Flood insurance will lapse. Parks will remain open.  ,,https://static.politico.com/7b/e5/a99028084345b2cd92e5d44b0c37/congress-shutdown-22383.jpg,,,2025-10-01 16:02:49.850162
,Costs & Impacts,2025-10-01 17:58:10+00:00,thehill.com,Nearly 90 percent of EPA furloughed as government shuts down,,,,,,https://thehill.com/policy/energy-environment/5531546-government-shutdown-epa-furloughs/,"The EPA will still continue emergency and disaster assistance, hazardous waste cleanup where there is an “imminent threat to human life” and criminal ...",,,,,2025-10-01 15:05:58.329246
,,2025-10-01 17:25:49+00:00,US EPA,"EPA Settles with Four Companies to Improve Community Safety, Chemical Reporting | US EPA",,,,,,https://www.epa.gov/newsreleases/epa-settles-four-companies-improve-community-safety-chemical-reporting,"U.S. Environmental Protection Agency (EPA) has taken action against four companies in New York, New Jersey and Puerto Rico for failing to report the use of hazardous chemicals, as required by Emergency Planning and Community Right-to-Know Act (EPCRA).",,https://www.epa.gov/sites/all/themes/epa/img/epa-news-releases-og.jpg,,,2025-10-01 14:05:38.873088
,Costs & Impacts,2025-10-01 17:23:21+00:00,www.wwltv.com,"Gov. Landry, EPA to give update on Smitty's Supply cleanup after Roseland explosion",,,,,,https://www.wwltv.com/article/news/local/roseland-explosion/gov-landry-epa-to-give-update-on-smittys-supply-cleanup-after-roseland-explosion-tangipahoa-parish/289-edbb548c-7c62-4a0a-b479-bb0ee579cc12,"— Governor Jeff Landry, U.S. Environmental Protection Agency officials, the Louisiana Department of Environmental Quality, and Tangipahoa Parish ...",,,,,2025-10-01 14:05:38.873088
,North Carolina,2025-10-01 16:41:25+00:00,www.deq.nc.gov,DEQ awards $1.1 million for clean vehicle projects that will reduce air pollution,,,,,,https://www.deq.nc.gov/news/press-releases/2025/10/01/deq-awards-11-million-clean-vehicle-projects-will-reduce-air-pollution,The Division of Air Quality is awarding $1.14 million in DERA grants for projects that will reduce air pollution from diesel-powered mobile sources.,,,,,2025-10-01 14:05:38.873088
,Costs & Impacts,2025-10-01 16:34:19+00:00,www.nahb.org,How the Government Shutdown Will Affect Housing,,,,,,https://www.nahb.org/blog/2025/10/government-shutdown,"The White House and Republican and Democratic congressional leaders failed to reach an agreement to extend government funding on Tuesday, resulting in a shutdown of most federal government functions at 12:01 a.m. on Wednesday, Oct. 1 that will affect housing and home builders. ",,https://www.nahb.org/-/media/NAHB/blog/1600x900-images/government-shutdown-funding-1600x900.jpg?rev=b786e64aa2f0440eb1a24e1b9aceb52c,,,2025-10-01 16:02:49.850162
,,2025-10-01 16:31:51+00:00,www.mitchellwilliamslaw.com,Biosolids/Clean Water Act: Federal Court Addresses Citizen Suit Action Against U.S. Environmental Protection Agency Alleging Failure to Address PFAS,,,,,,https://www.mitchellwilliamslaw.com/biosolids/clean-water-act-federal-court-addresses-citizen-suit-action-against-us-environmental-protection-agency-alleging-failure-to-address-pfas,"UNITED STATES ENVIRONMENTAL PROTECTION AGENCY, et al., No. 24-cv-1654 (DLF). The Public Employees for Environmental Responsibility (collectively ...",,https://www.mitchellwilliamslaw.com/images/site/Social_Logo.jpg,,,2025-10-01 14:05:38.873088
,,2025-10-01 15:56:32+00:00,www.psu.edu,Penn State student hones passion for environmental policy as state agency intern | Penn State University,,,,,,https://www.psu.edu/news/agricultural-sciences/story/penn-state-student-hones-passion-environmental-policy-state-agency,"Caroline Hunter, a senior majoring in environmental resource management in Penn State’s College of Agricultural Sciences, had the opportunity to grow her knowledge of environmental policy during a summer internship with the Pennsylvania Department of Environmental Protection.",,https://psu-gatsby-files-prod.s3.amazonaws.com/s3fs-public/styles/16_9_1000w/public/2025/10/caroline-hunter_josh-shapiro_resized.jpg?h=3a5ebb29&itok=QyjzFBam,,,2025-10-01 16:02:49.850162
,,2025-10-01 15:14:14+00:00,www.regulations.gov,Oregon Vehicle Inspection Plan Rule Updates - Regulations.gov,,,,,,https://www.regulations.gov/docket/EPA-R10-OAR-2025-0181/document%3FdocumentTypes%3DSupporting%2520%2526%2520Related%2520Material,"Agency Environmental Protection Agency; Posted Sep 25, 2025; ID EPA-R10-OAR-2025-0181-0004. Supporting & Related Material. 2024VIP ...",,,,,2025-10-01 13:04:12.000744
,,2025-10-01 15:10:54+00:00,dnr.mo.gov,Department of Natural Resources awards $20800 grant to the Bates County Public Water ...,,,,,,https://dnr.mo.gov/communications/news/department-natural-resources-awards-20800-grant-bates-county-public-water-supply-district-no-6,This project will be funded wholly or in part with monies received from the Environmental Protection Agency. For more information on wastewater ...,,,,,2025-10-01 12:09:10.888936
,Costs & Impacts,2025-10-01 14:55:55+00:00,ethanolrfa.org,"RFA Opposes Granting of SREs, Calls for 100 Percent Reallocation",,,,,,https://ethanolrfa.org/media-and-news/category/news-releases/article/2025/10/rfa-opposes-granting-of-sres-calls-for-100-percent-reallocation,"In testimony today to the U.S. Environmental Protection Agency, the Renewable Fuels Association expressed strong disagreement with the agency's ...",,,,,2025-10-01 12:09:10.888936
,,2025-10-01 14:33:01+00:00,WIRED,The EPA Is Ending Greenhouse Gas Data Collection. Who Will Step Up to Fill the Gap?,,,,,,https://www.wired.com/story/the-epa-is-ending-greenhouse-gas-data-collection-who-will-step-up-to-fill-the-gap/,"With the agency no longer collecting emissions data from polluting companies, attention is turning to whether climate NGOs have the tools—and legal right—to fulfill this EPA function.",,"https://media.wired.com/photos/68db9f4e0174ce774ca88052/191:100/w_1280,c_limit/092925_Science-US-Gov-Emissions%202.jpg",,,2025-10-01 11:02:18.968668
,,2025-10-01 14:22:26+00:00,Representative Jared Golden,Federal Government Shutdown FAQs,,,,,,https://golden.house.gov/emergency-resources/federal-government-shutdown-faqs,"The federal government shut down on Wednesday, October 1 due to a lapse in federal appropriations.",,,,,2025-10-01 14:05:38.873088
,Costs & Impacts,2025-10-01 14:12:29+00:00,ABC7 Chicago,"Eastwood Manor residents finally free of yellow water problem that stained home fixtures, clothing",,,,,,https://abc7chicago.com/post/eastwood-manor-community-unincorporated-mchenry-county-illinois-is-finally-free-yellow-water-problem/17913835/,Residents told ABC7 last year that they were paying for water that had high levels of iron.,,https://cdn.abcotvs.com/dip/images/17914245_093025-wls-iteam-jason-yellow-water-gone-10p-vid.jpg?w=1600,,,2025-10-01 13:04:12.000744
,,2025-10-01 14:09:41+00:00,www.climatecasechart.com,Environmental Law & Policy Center v. EPA - The Climate Litigation Database,,,,,,https://www.climatecasechart.com/collections/environmental-law-policy-center-v-epa_b38b6b,Citizen suit challenging EPA's alleged inaction regarding Ohio Environmental Protection Agency's failure to develop a Total Maximum Daily Load for western Lake Erie or otherwise address western Lake Erie's impairment.,,,,,2025-10-01 14:05:38.873088
,Costs & Impacts,2025-10-01 14:04:44+00:00,NYSenate.gov,Assemblymember Grace Lee and Senator Brian Kavanagh Urge Passage of PFAS Bill (A8634 / S3207) to Protect New Yorkers’ Drinking Water,,,,,,https://www.nysenate.gov/newsroom/press-releases/2025/brian-kavanagh/assemblymember-grace-lee-and-senator-brian-kavanagh-0,"FOR IMMEDIATE RELEASESeptember 18, 2025Jack Friedman (AM Lee) | friedmanj@nyassembly.gov | 917-213-5378Emily Leng (Sen. Kavanagh) | eleng@nysenate.gov| 212-298-5565Assemblymember Grace Lee and Senator Brian Kavanagh Urge Passage of PFAS Bill (A8634 / S3207) to Protect New Yorkers’ Drinking Water",,,,,2025-10-01 11:02:18.968668
,Costs & Impacts,2025-10-01 14:02:52+00:00,CT.gov - Connecticut's Official State Website,DEEP Reminds Boaters that Paddlers are Required to Wear Life Jackets Starting October 1,,,,,,https://portal.ct.gov/deep/news-releases/news-releases---2025/deep-reminds-boaters-that-paddlers-are-required-to-wear-life-jackets-starting-october-1,DEEP Reminds Boaters that Paddlers are Required to Wear Life Jackets Starting October 1,,https://portal.ct.gov/Assets/Images/facebook-default_01.png,,,2025-10-01 12:09:10.888936
,,2025-10-01 13:57:00+00:00,Growth Energy,"Growth Energy Calls on EPA to Follow Through on RVO, Reallocation Proposals",,,,,,https://growthenergy.org/2025/10/01/reallocation-proposal-rvos/,Growth Energy CEO Emily Skor called on EPA to stand strong on its renewable volume obligation (RVO) and reallocation proposals.,,https://growthenergy.org/wp-content/uploads/2025/10/iStock-2200850898-scaled.jpg,,,2025-10-01 11:02:18.968668
,,2025-10-01 13:19:02+00:00,public-inspection.federalregister.gov,6560-50-P ENVIRONMENTAL PROTECTION AGENCY 40 CFR Part 423 [EPA–HQ–OW–2009–0819,,,,,,https://public-inspection.federalregister.gov/2025-19269.pdf,SUMMARY: The U.S. Environmental Protection Agency (the EPA or Agency) is taking direct final action to extend the date for existing steam electric ...,,,,,2025-10-01 12:09:10.888936
,,2025-10-01 13:18:05+00:00,www.trentonmi.org,"EPA Frequently Asked Questions McLouth Steel Cleanup - Trenton, MI",,,,,,https://www.trentonmi.org/m/newsflash/Home/Detail/350,"The U.S. Environmental Protection Agency and the Michigan Department of the Environment, Great Lakes, and Energy have answers to questions you may ...",,,,,2025-10-01 12:09:10.888936
,,2025-10-01 13:15:42+00:00,www.youtube.com,Cleanup begins at Vistra Moss Landing battery plant after fire - YouTube,,,,,,https://www.youtube.com/watch%3Fv%3Djbm22fYRZuw,"Vistra contractors, under the oversight of the U.S. Environmental Protection Agency, have started removing damaged batteries from the Moss Landing ...",,,,,2025-10-01 14:05:38.873088
,Costs & Impacts,2025-10-01 12:41:57+00:00,Al Jazeera,President Trump threatens mass layoffs as US government shuts down,,,,,,https://www.aljazeera.com/news/liveblog/2025/10/1/live-us-government-shuts-down-starts-as-trump-threatens-mass-layoffs,The shutdown comes as Republicans fail to reach deal with Democrats concerned by steep hikes in health insurance costs.,,https://www.aljazeera.com/wp-content/uploads/2025/10/Gaza-1759318876.jpg?resize=1920%2C1440,,,2025-10-01 09:02:28.759741
,,2025-10-01 12:27:42+00:00,www.michigan.gov,EGLE announces the publication of the new and improved E coli Pollution and Solution Mapper,,,,,,https://www.michigan.gov/egle/newsroom/mi-environment/2025/10/01/e-coli-pollution-solution-mapper,"The new mapper provides improved performance, adds new layers, and achieves compliance with the American Disability Act. ",,https://www.michigan.gov/egle/-/media/Project/Websites/egle/Images/Staff/WRD/Sampling-River-Raisin.jpg?rev=9387c5ef3e6a44359e61fc87d6d0f8b5,,,2025-10-01 09:02:28.759741
,,2025-10-01 12:24:09+00:00,ABC News,"EPA's job is to protect America's air, water and land. Here's how a shutdown affects that effort",,,,,,https://abcnews.go.com/Health/wireStory/epas-job-protect-americas-air-water-land-shutdown-126104888,The Environmental Protection Agency faces challenges during a government shutdown,,https://i.abcnewsfe.com/a/f0a6a1ad-2fe2-45d9-8a43-809fac94b4e1/wirestory_70674e403e47520f0dc22b9b95df9eda_16x9.jpg?w=1600,,,2025-10-01 09:02:28.759741
,,2025-10-01 12:20:52+00:00,X (formerly Twitter),"Environmental Protection Agency, Punjab - X",,,,,,https://x.com/EPCCDpunjab/status/1973354114894668136,"Imran Hamid Sheikh, Director General, Environmental Protection Agency (EPA) Punjab, #EpaPunjab #MaryamNawaz4Climate #IM4Climate #SmogFreePunjab.",,,,,2025-10-01 12:09:10.888936
,Costs & Impacts,2025-10-01 12:18:50+00:00,subscriber.politicopro.com,E&E News: Shutdown forces EPA to send thousands of staffers home,,,,,,https://subscriber.politicopro.com/article/eenews/2025/10/01/shutdown-forces-epa-to-send-thousands-of-people-home-00588748,The agency's efforts to undo a series of environmental rules have come to a halt.,,https://static.politico.com/37/41/831d7c2d4bc98d5a2ff3b3bc5e2c/https-delivery-gettyimages.com/downloads/2231529607,,,2025-10-01 12:09:10.888936
,Costs & Impacts,2025-10-01 12:16:48+00:00,Carrier Management,U.S. Government Shutdown Curtails Key Weather and Climate Programs - Carrier Management,,,,,,https://www.carriermanagement.com/news/2025/10/01/279981.htm,"The closure of the federal government will curtail or halt some US climate disaster preparedness and environmental programs — and even potentially delay real estate transactions within the nation’s flood zones. That’s because the major source of flood insurance for millions of homeowners is among the non-essential government services caught up in the shutdown, and … Continued",,https://www.carriermanagement.com/assets/capitol-bloomberg-scaled.jpg,,,2025-10-01 13:04:12.000744
,EPA Rollbacks,2025-10-01 12:04:00+00:00,Wrangell Sentinel,"EPA cancels grants totaling $280 million for Alaska villages, communities - Wrangell Sentinel",,,,,,"http://www.wrangellsentinel.com/stories/epa-cancels-grants-totaling-280-million-for-alaska-villages-communities,29624","Residents of a Cook Inlet village were devastated in May after getting news that the Trump administration had canceled a $20 million grant to upgrade homes and build new ones, residents said. Tyonek  &hellip;",,https://gamma.creativecirclecdn.com/wrangell/original/20250609-112412-0b8-WrangeSentOnlyColor.png.jpg,,,2025-10-01 09:02:28.759741
,Costs & Impacts,2025-10-01 11:52:25+00:00,Honolulu Star-Advertiser,"EPA fines Grove Farm, Hawaii Gas for illegal cesspools on Kauai | Honolulu Star-Advertiser",,,,,,https://www.staradvertiser.com/2025/09/30/breaking-news/epa-fines-grove-farm-hawaii-gas-for-illegal-cesspools-on-kauai/,"The U.S. Environmental Protection Agency has fined the Grove Farm Company Inc. and The Gas Company more than $104,500 for operating illegal large-capacity cesspools in Lihue, Kauai.",,https://www.staradvertiser.com/wp-content/uploads/2025/09/web1_20190515_brk_kau01.jpg,,,2025-10-01 13:04:12.000744
,Costs & Impacts,2025-10-01 11:13:06+00:00,WTOP News,"EPA’s job is to protect America’s air, water and land. Here’s how a shutdown affects that effort - WTOP News",,,,,,https://wtop.com/science/2025/10/epas-job-is-to-protect-americas-air-water-and-land-heres-how-a-shutdown-affects-that-effort/,WASHINGTON (AP) — The Environmental Protection Agency was already reeling from massive stuff cuts and dramatic shifts in priority and policy. A government shutdown raises new questions about how it…,,https://wtop.com/wp-content/uploads/2025/10/Climate_Shutdown_EPA_Explainer_08492-scaled.jpg,,,2025-10-01 11:02:18.968668
,Costs & Impacts,2025-10-01 11:01:25+00:00,Sahan Journal,EPA settlement — minus fines — leaves St. Paul Brass Foundry neighbors with more questions,,,,,,https://sahanjournal.com/climate-environment/st-paul-brass-foundry-epa-settlement-questions/,The Environmental Protection Agency settled a pollution violation case with the St. Paul Brass Foundry earlier this month without imposing a fine. Neighbors are trying to understand the risks the facility may pose.,,https://i0.wp.com/sahanjournal.com/wp-content/uploads/2025/09/Frogtown-01.png?fit=1800%2C1200&ssl=1,,,2025-10-01 09:02:28.759741
,Costs & Impacts,2025-10-01 11:00:43+00:00,Capital B News,An Explosion Left a Black Town Contaminated. Politics Are Stunting the Cleanup.,,,,,,https://capitalbnews.org/roseland-louisiana-oil-explosion-cleanup/,"For Black Louisianans, health fears mount as federal crews face delays, threats, and funding shortfalls at the oil disaster site.",,https://i0.wp.com/capitalbnews.org/wp-content/uploads/2025/09/1757716340048-scaled.jpg?fit=2560%2C1920&ssl=1,,,2025-10-01 09:02:28.759741
,Costs & Impacts,2025-10-01 10:14:26+00:00,subscriber.politicopro.com,"POLITICO Pro: EPA shutdown plan would halt new permits, enforcement, state work",,,,,,https://subscriber.politicopro.com/article/2025/09/epa-shutdown-plan-would-halt-new-permits-enforcement-state-work-00586966,"The lion’s share of the agency would go dark if funding runs out at midnight, but work would continue for emergency response, litigation and programs with alternative funding sources.",,https://static.politico.com/02/57/b3df0029471b82aed4b78c780a0e/epa-44972.jpg,,,2025-10-01 09:02:28.759741
,Costs & Impacts,2025-10-01 10:14:08+00:00,Los Angeles Times,Government shutdown means 90% of EPA staff won't be working,,,,,,https://www.latimes.com/environment/story/2025-10-01/government-shutdown-will-furlough-nearly-all-epa-staff,"The EPA will pause research work, grants, permits and inspections while the government is shut down. Nearly all staff will stop working. Some may not be rehired.",,https://ca-times.brightspotcdn.com/dims4/default/e018c5d/2147483647/strip/true/crop/4000x2100+0+284/resize/1200x630!/quality/75/?url=https%3A%2F%2Fcalifornia-times-brightspot.s3.amazonaws.com%2F1a%2Faf%2F3408d51142c498a8da563bb26d5c%2Fap20056787650103.jpg,,,2025-10-01 09:02:28.759741
,EPA Rollbacks,2025-10-01 10:08:36+00:00,Honolulu Civil Beat,Trump Administration Is Set To Cut 1 In 3 EPA Staffers By Year's End,,,,,,https://www.civilbeat.org/2025/10/trump-administration-is-on-track-to-cut-1-in-3-epa-staffers-by-years-end/,The move will slash the agency’s ability to keep pollution out of air and water.,,https://d1l18ops95qbzp.cloudfront.net/wp-content/2025/09/30182525/iStock-1174209350-1024x683.jpg,,,2025-10-01 11:02:18.968668
,,2025-10-01 09:40:28+00:00,penncapital-star.com,Is the sun setting on Pennsylvania's solar future?,,,,,,https://penncapital-star.com/energy-environment/is-the-sun-setting-on-pennsylvanias-solar-future/,"The agency was far from alone. The Pennsylvania Energy ... Department of Environmental Protection, which sent a letter to the EPA on Aug.",,,,,2025-10-01 09:02:28.759741
,,2025-10-01 08:13:43+00:00,www.climatecasechart.com,Center for Biological Diversity v. EPA - The Climate Litigation Database,,,,,,https://www.climatecasechart.com/collections/center-for-biological-diversity-v-epa_739741,"Challenge to the U.S. Environmental Protection Agency’s (EPA’s) final rule establishing annual renewable fuel standards for 2020, 2021, and 2022.",,,,,2025-10-01 05:02:23.492000
,,2025-10-01 08:04:45+00:00,Federal Register,National Emission Standards for Hazardous Air Pollutants From Secondary Lead Smelting Technology Review,,,,,,https://www.federalregister.gov/documents/2025/10/01/2025-19155/national-emission-standards-for-hazardous-air-pollutants-from-secondary-lead-smelting-technology,"The U.S. Environmental Protection Agency (EPA) is proposing amendments to the National Emission Standards for Hazardous Air Pollutants (NESHAP) for the Secondary Lead Smelting source category (""Secondary Lead Smelting NESHAP"") under Clean Air Act (CAA) section 112. The EPA did not identify any...",,https://www.federalregister.gov/assets/open_graph_site_banner.png,,,2025-10-01 05:02:23.492000
,,2025-10-01 08:04:45+00:00,Federal Register,Amicarbazone; Pesticide Tolerances,,,,,,https://www.federalregister.gov/documents/2025/10/01/2025-19144/amicarbazone-pesticide-tolerances,"This regulation establishes tolerances for residues of amicarbazone (CASRN 129909-90-6) in or on sugarcane, cane; and sugarcane, molasses. Under the Federal Food, Drug, and Cosmetic Act (FFDCA), UPL Delaware, Inc. submitted a petition to EPA requesting that EPA establish a maximum permissible...",,https://www.federalregister.gov/assets/open_graph_site_banner.png,,,2025-10-01 05:02:23.492000
,Costs & Impacts,2025-10-01 07:01:03+00:00,San Diego County News Center,Board Approves Next Steps in Tijuana River Valley Soil Contamination Study ,,,,,,https://www.countynewscenter.com/board-approves-next-steps-in-tijuana-river-valley-soil-contamination-study/,The County Board of Supervisors today voted to ask the State Water Resources Control Board to fund a $1.4 million study to test the ground and water within the Tijuana River Valley for contamination. ,,https://www.countynewscenter.com/wp-content/uploads/IMG_8663-1.jpg,,,2025-10-01 05:02:23.492000
,Costs & Impacts,2025-10-01 06:45:59+00:00,AP News,"EPA, EES Coke Battery are $135 million apart on Clean Air Act penalties as pollution trial ends",,,,,,https://apnews.com/article/engineering-general-news-pollution-air-quality-u-s-environmental-protection-agency-772112aa4f231cd921a8617ebbc806eb,"When faced with testimony that Zug Island’s EES Coke Battery is one of Michigan’s worst sulfur dioxide polluters, an attorney for the facility said Monday: “So what?”",,https://dims.apnews.com/dims4/default/7b3c6e1/2147483647/strip/true/crop/4260x2396+0+222/resize/1440x810!/quality/90/?url=https%3A%2F%2Fassets.apnews.com%2Fe0%2F14%2F9f3e29614c32cf57150a24e655ef%2Fdc496b33b0ab465caf1838dbd18a221c,,,2025-10-01 09:02:28.759741
,Costs & Impacts,2025-10-01 05:57:14+00:00,US EPA,"EPA Proposes Reforming Biden Technology Transitions Rule to Lower Costs for American Families at the Grocery Store, Make Refrigerants Affordable, Safe and Accessible Again | US EPA",,,,,,https://www.epa.gov/newsreleases/epa-proposes-reforming-biden-technology-transitions-rule-lower-costs-american-families,EPA Administrator Lee Zeldin issued a Notice of Proposed Rulemaking to reform the Biden-Harris 2023 Technology Transitions Rule.,,https://www.epa.gov/sites/all/themes/epa/img/epa-news-releases-og.jpg,,,2025-10-01 11:02:18.968668
