id,name,published,outlet,title,authors,category,market,categoryorder,articleorder,url,description,text,image,error,sentiment,firstEyes
,Costs & Impacts,2026-01-15 18:57:00+00:00,www.ksnt.com,EPA drops dollar value on health impacts from air pollution – KSNT 27 News,,,,,,https://www.ksnt.com/video/epa-drops-dollar-value-on-health-impacts-from-air-pollution/11430229/,EPA drops dollar value on health impacts from air pollution. Toggle header content. News. TOPEKA (KSNT) – The Environmental Protection Agency is ...,,,,,2026-01-15 15:01:11.087909
,,2026-01-15 18:52:37+00:00,https://www.fox8live.com,PHOTOS: An inside look at what EPA inspectors found at Smitty’s Supply ,,,,,,https://www.fox8live.com/2026/01/15/photos-an-inside-look-what-epa-inspectors-found-smittys-supply/,"An EPA inspection of Smitty’s Supply in Tangipahoa Parish uncovered hundreds of chemical spills, damaged containers, and hazardous storage conditions",,https://gray-wvue-prod.gtv-cdn.com/resizer/v2/3JV7P3JHYRAATDYWOAYF4INK3E.png?auth=a875ea41d41a2321052ded44c55d284cfd375d5de1b20a3fdb13be82e65e0227&width=1200&height=600&smart=true,,,2026-01-15 14:02:29.762031
,EPA Rollbacks,2026-01-15 18:25:23+00:00,www.facebook.com,"The EPA has announced a new rule that aims to weaken the bedrock environmental law, the ...",,,,,,https://www.facebook.com/nrdc.org/posts/the-epa-has-announced-a-new-rule-that-aims-to-weaken-the-bedrock-environmental-l/1348939357277255/,"The EPA has announced a new rule that aims to weaken the bedrock environmental law, the Clean Water Act, further by limiting the authority of ...",,,,,2026-01-15 17:01:19.326096
,,2026-01-15 18:18:40+00:00,www.epa.ie,Hydrology Summary Bulletin - December 2025,,,,,,https://www.epa.ie/publications/monitoring--assessment/freshwater--marine/hydrology-bulletin/hydrology-bulletin/hydrology-summary-bulletin---december-2025.php,"Hydrology Summary Bulletin outlining the flows in rivers, rainfall, lake and turlough levels, groundwater levels and spring outflows of over 300 stations across Ireland for the month",,,,,2026-01-15 17:01:19.326096
,,2026-01-15 18:14:45+00:00,www.nyc.gov,Executive Order 11 - NYC Mayor's Office,,,,,,https://www.nyc.gov/mayors-office/news/2026/01/executive-order-11,"... Environmental Protection, the Fire Department, the Department of Health ... agency so instructed by the Deputy Mayor for Economic Justice ...",,,,,2026-01-15 17:01:19.326096
,EPA Rollbacks,2026-01-15 18:11:13+00:00,X (formerly Twitter),The U.S. Environmental Protection Agency's decision to no longer put a dollar value on ...,,,,,,https://x.com/Law360/status/2011853492256682403/photo/1,Law360 (@Law360). 249 views. The U.S. Environmental Protection Agency's decision to no longer put a dollar value on health benefits when crafting ...,,,,,2026-01-15 14:02:29.762031
,Clean Air & Water,2026-01-15 18:09:31+00:00,Southern Environmental Law Center,EPA confirms that large methane gas turbines require permits - Southern Environmental Law Center,,,,,,https://www.selc.org/press-release/epa-confirms-that-large-methane-gas-turbines-require-permits/,"WASHINGTON D.C. — This week, the federal Environmental Protection Agency announced that methane gas turbines, even temporary ones that will operate for less than a year, require construction permits and air permits. The announcement came as the agency revised its New Source Performance Standard, which regulates air pollution from gas turbines. The revised rule confirms […]",,https://www.selc.org/wp-content/uploads/2022/05/SELC_Logo_Horizontal_Social.jpg,,,2026-01-15 14:02:29.762031
,Costs & Impacts,2026-01-15 18:05:24+00:00,ecology.wa.gov,A nuclear year in review,,,,,,https://ecology.wa.gov/blog/january-2026/a-year-in-review-projects-that-shaped-2025,"<p>2025 was a historic year in our Nuclear Waste Program&#39;s efforts to oversee cleanup of one of the world&#39;s most complex nuclear sites. Join us as we look back on a year of progress.</p>
",,https://ecology.wa.gov/Ecology/media/BlogMedia/NWP/2025_04_18-Leona-Libby-Middle-BrittneyBen1-ECY-resized.jpg?width=630 ,,,2026-01-15 14:02:29.762031
,EPA Rollbacks,2026-01-15 17:55:40+00:00,JD Supra,The Trump Administration's EPA: Deregulation in 2026 | JD Supra,,,,,,https://www.jdsupra.com/legalnews/the-trump-administration-s-epa-2716000/,Two recent actions by the United States Environmental Protection Agency (USEPA) show the Trump administration’s commitment to the coal industry and to...,,https://jdsupra-static.s3.amazonaws.com/profile-images/og.13138_0636.jpg,,,2026-01-15 14:02:29.762031
,,2026-01-15 17:32:18+00:00,SCOTUSblog,Dockets on maximum overdrive: seventeen new relists involving ten issues,,,,,,https://www.scotusblog.com/2026/01/dockets-on-maximum-overdrive-seventeen-new-relists-involving-ten-issues/,The Relist Watch column examines cert petitions that the Supreme Court has “relisted” for its upcoming conference. A short explanation of relists is available here. This Friday’s conference marks the Supreme […],,https://www.scotusblog.com/wp-content/uploads/2022/03/cameras-banner.jpg,,,2026-01-15 14:02:29.762031
,Costs & Impacts,2026-01-15 17:23:41+00:00,"Bergeson & Campbell, P.C.","EPA Completes Risk Evaluation for Five Phthalates, Intends to Regulate “Dozens” of COUs - Bergeson & Campbell, P.C.",,,,,,https://www.lawbc.com/epa-completes-risk-evaluation-for-five-phthalates-intends-to-regulate-dozens-of-cous/,"The U.S. Environmental Protection Agency (EPA) announced on January 6, 2026, the availability of the final risk evaluations under the Toxic Substances",,https://www.lawbc.com/wp-content/uploads/Feature_EPA.png,,,2026-01-15 13:01:47.079128
,,2026-01-15 17:08:39+00:00,"Bergeson & Campbell, P.C.","Deadline for Filing Annual Pesticide Production Reports - March 1, 2026 - Bergeson & Campbell, P.C.",,,,,,https://www.lawbc.com/deadline-for-filing-annual-pesticide-production-reports-march-1-2026/,"The March 1, 2026, deadline for all establishments, foreign and domestic, that produce pesticides, devices, or active ingredients to file their annual",,https://www.lawbc.com/wp-content/uploads/iStock-928307424-modified-f5fe548f-6772-47e2-9337-b50e85f770d3.jpg,,,2026-01-15 13:01:47.079128
,,2026-01-15 17:04:24+00:00,www.epa.ie,2026 EPA Summer Student Programme,,,,,,https://www.epa.ie/publications/corporate/careers/2026-epa-summer-student-programme.php,"2026 Summer Student Programme is now open. 
",,,,,2026-01-15 16:01:08.609020
,EPA Rollbacks,2026-01-15 17:00:17+00:00,www.facebook.com,"The Trump EPA will no longer consider the amount of lives saved by pollution rules, only the ...",,,,,,https://www.facebook.com/LCVoters/posts/the-trump-epa-will-no-longer-consider-the-amount-of-lives-saved-by-pollution-rul/1289889499841182/,"EPA under trump means ""Every Pollutant Acceptable"". 1 hr.",,,,,2026-01-15 16:01:08.609020
,EPA Rollbacks,2026-01-15 16:40:03+00:00,Harvard T.H. Chan School of Public Health,EPA will no longer consider health-related monetary benefits of reducing air pollution | Harvard T.H. Chan School of Public Health,,,,,,https://hsph.harvard.edu/news/epa-will-no-longer-consider-health-related-monetary-benefits-of-reducing-air-pollution/,The EPA will scrap its longstanding practice of calculating the economic benefits related to human health when it sets air pollution limits. Pulmonologist Mary Rice is worried about the health impacts.,,https://hsph.harvard.edu/wp-content/uploads/2026/01/power-station-2000x1125-1.jpg,,,2026-01-15 12:02:04.761631
,EPA Rollbacks,2026-01-15 16:36:56+00:00,Carrier Management,EPA to Stop Calculating Health Care Savings From Key Air Pollution Rules - Carrier Management,,,,,,https://www.carriermanagement.com/news/2026/01/15/283523.htm,"The Environmental Protection Agency says it will stop calculating how much money is saved in health care costs avoided and deaths prevented from air pollution rules that curb two deadly pollutants. The change means the EPA will focus rules for fine particulate matter and ozone only on the cost to industry, part of a broader … Continued",,https://www.carriermanagement.com/assets/AP26013584786732-Emissions-Pollution-scaled.jpg,,,2026-01-15 15:01:11.087909
,,2026-01-15 16:27:45+00:00,Oceanographic,"Ocean damage nearly doubles the 'true cost' of carbon, study finds - Oceanographic",,,,,,https://oceanographicmagazine.com/news/ocean-damage-nearly-doubles-the-true-cost-of-carbon-study-finds/,"A new study shows that including ocean damage nearly doubles the true social cost of carbon, revealing trillions in hidden climate impacts.",,https://cdn.oceanographicmagazine.com/wp-content/uploads/2026/01/15130113/Kim-Cuong-Nguyen-Trang-1920x1279.jpg,,,2026-01-15 13:01:47.079128
,,2026-01-15 16:26:02+00:00,Clinical Advisor,EPA May Stop Assessing Health Benefits When Setting Air Pollution Rules,,,,,,https://www.clinicaladvisor.com/news/epa-may-stop-assessing-health-benefits-when-setting-air-pollution-rules/,Experts warn the move could lead to weaker air quality protections.,,https://www.clinicaladvisor.com/wp-content/uploads/sites/11/2024/01/CA_1200x675.png,,,2026-01-15 12:02:04.761631
,EPA Rollbacks,2026-01-15 16:24:50+00:00,Center for Western Priorities,EPA proposes to limit states' ability to block oil and gas pipelines - Center for Western Priorities,,,,,,https://westernpriorities.org/2026/01/epa-proposes-to-limit-states-ability-to-block-oil-and-gas-pipelines/,The Trump administration is proposing to strip states and Tribes of their ability to block oil and gas pipelines and other infrastructure. The Environmental Protection Agency (EPA) issued a proposed rule that would narrow the scope of the section of the Clean Water Act that allows states and Tribes to review federal permits for projects […],,https://westernpriorities.org/wp-content/uploads/2026/01/Oil_and_gas_pipeline.jpg,,,2026-01-15 12:02:04.761631
,Costs & Impacts,2026-01-15 16:08:18+00:00,Earthjustice,Lawsuit Challenges Trump EPA’s Latest Approval of ‘Forever Chemical’ Pesticide,,,,,,https://earthjustice.org/press/2026/lawsuit-challenges-trump-epas-latest-approval-of-forever-chemical-pesticide,"Isocycloseram was approved for use on golf courses, lawns, and a host of food crops",,https://earthjustice.org/wp-content/uploads/2026/01/tomatoes_colby-winfield-unsplash.jpg,,,2026-01-15 12:02:04.761631
,Costs & Impacts,2026-01-15 15:51:15+00:00,mlive,Letter from the Editor: EPA pivot on powerful weed killer highlights impact of investigative journalism,,,,,,https://www.mlive.com/news/2026/01/letter-from-the-editor-epa-pivot-on-powerful-weed-killer-highlights-impact-of-investigative-journalism.html,Paraquat to be assessed for health and safety risks amid national scrutiny,,https://www.mlive.com/resizer/v2/PP2TA2LSJZENZKFYBSJSMFASCI.png?auth=d10cc116d7ca3a6c468e20cf8469e835615c7e1141ffd74a97ceb5c1faa0f7cb&width=1280&smart=true&quality=90,,,2026-01-15 13:01:47.079128
,,2026-01-15 15:31:57+00:00,Mansfield Hospital Earns Third ENERGY STAR Certification ,Mansfield Hospital Earns Third ENERGY STAR Certification,,,,,,https://newsroom.ohiohealth.com/mansfield-hospital-earns-third-energy-star-certification/,"OhioHealth Mansfield Hospital has earned the U.S. Environmental Protection Agency’s ENERGY STAR© certification once again for superior energy performance. This is the third year the hospital has earned the ENERGY STAR®, reflecting a legacy of continued energy savings.“Improving the energy efficiency of our nation’s buildings is critical ...",,https://content.presspage.com/uploads/1460/00cfa979-23b7-4868-83e8-f83177a6314a/1920_mansfieldhospital.jpeg?10000,,,2026-01-15 11:04:21.839842
,,2026-01-15 15:30:32+00:00,www.reuters.com,"Exclusive: US to finalize 2026 biofuel quotas by early March, drop import penalties, sources say",,,,,,https://www.reuters.com/sustainability/climate-energy/us-finalize-2026-biofuel-quotas-by-early-march-drop-import-penalties-sources-say-2026-01-15/,"The U.S. Environmental Protection Agency, which oversees U.S. biofuel ... The EPA told Reuters the agency is still reviewing comments on the proposed ...",,,,,2026-01-15 11:04:21.839842
,,2026-01-15 15:05:41+00:00,Pulmonology Advisor,EPA May Stop Assessing Health Benefits When Setting Air Pollution Rules,,,,,,https://www.pulmonologyadvisor.com/news/epa-may-stop-assessing-health-benefits-when-setting-air-pollution-rules/,"The EPA may soon stop assessing health benefits of cleaner air, which could lead to weaker protections against some of the most dangerous pollutants.",,https://www.pulmonologyadvisor.com/wp-content/uploads/sites/21/2024/12/Pulmonology.png,,,2026-01-15 11:04:21.839842
,Costs & Impacts,2026-01-15 14:59:58+00:00,WUKY,Experts: EPA’s delay of wastewater standards a setback for Ohio River,,,,,,https://www.wuky.org/wuky-news/2026-01-15/experts-epas-delay-of-wastewater-standards-a-setback-for-ohio-river,Conservation experts say the Environmental Protection Agency’s decision to delay new wastewater treatment standards for coal plants by five years will damage cleanup efforts at the Ohio River.,,https://npr.brightspotcdn.com/dims4/default/9d15923/2147483647/strip/true/crop/900x473+0+22/resize/1200x630!/quality/90/?url=http%3A%2F%2Fnpr-brightspot.s3.amazonaws.com%2Fb4%2F33%2F8e7c2ad7430caa3f67ebfb5f3ed6%2Fohio-river-basin.jpeg,,,2026-01-15 11:04:21.839842
,Opposition & Allies,2026-01-15 14:41:43+00:00,Northern Public Radio: WNIJ and WNIU,Dozens of organizations filed objections to the EPA's new water and wetlands definition,,,,,,https://www.northernpublicradio.org/wnij-news/2026-01-15/dozens-of-organizations-filed-objections-to-the-epas-new-water-and-wetlands-definition,The objection was drafted by Prairie Rivers Network. WNIJ’s Jess Savage sat down with Director of Water Policy Robert Hirschfeld to learn more about why they wrote to the EPA about the ruling.,,https://npr.brightspotcdn.com/dims4/default/4548eb2/2147483647/strip/true/crop/2048x1075+0+278/resize/1200x630!/quality/90/?url=http%3A%2F%2Fnpr-brightspot.s3.amazonaws.com%2Fc9%2F02%2F9cb62c544f729ce6964763a37494%2F250724-wnij-volostock-img-16.jpg,,,2026-01-15 10:02:44.108191
,Costs & Impacts,2026-01-15 14:31:24+00:00,KIMT News 3,Mason City staff expect the demolition of Mohawk Square to happen in the next two years,,,,,,https://www.kimt.com/news/mason-city-staff-expect-the-demolition-of-mohawk-square-to-happen-in-the-next-two/article_49125272-ec5b-43bd-8d76-ca5edbbc53cf.html,"The city of Mason City is seeking around $700,000 in grant funding from the Environmental Protection Agency (EPA) for asbestos abatement and the demolition of Mohawk Square.",,https://bloximages.newyork1.vip.townnews.com/kimt.com/content/tncms/assets/v3/editorial/f/b2/fb21efea-6192-4067-837e-aaa8dffe0c23/69682a9d7d02e.image.jpg?crop=1920%2C1008%2C0%2C35&resize=1200%2C630&order=crop%2Cresize,,,2026-01-15 13:01:47.079128
,,2026-01-15 13:12:07+00:00,Federal News Network - Helping feds meet their mission.,HHS reinstates all laid-off employees at workplace safety agency NIOSH,,,,,,https://federalnewsnetwork.com/workforce/2026/01/hhs-reinstates-all-laid-off-employees-at-workplace-safety-agency-niosh/,"HHS walked back about a third of NIOSH layoffs last spring, but is now reinstating all NIOSH employees who received reduction-in-force notices.",,https://federalnewsnetwork.com/wp-content/uploads/2025/03/HHS_Inspector_General_66443-scaled.jpg,,,2026-01-15 08:58:27.691738
,Costs & Impacts,2026-01-15 13:12:06+00:00,Mother Jones,"In the eyes of Trump’s EPA, human health is now literally worthless",,,,,,https://www.motherjones.com/politics/2026/01/trumps-epa-human-health-pm2-ozone-air-pollution-regulation-cost-benefit-analysis/,How the agency’s new math favors polluters over people.,,https://www.motherjones.com/wp-content/uploads/2026/01/AirQualityCropped.png?w=1200&h=630&crop=1,,,2026-01-15 08:58:27.691738
,Costs & Impacts,2026-01-15 13:01:54+00:00,cleveland,Trump cabinet members visiting Ohio to promote vehicle fuel efficiency rollback,,,,,,https://www.cleveland.com/news/2026/01/trump-cabinet-members-visiting-ohio-to-promote-vehicle-fuel-efficiency-rollback.html,Three Trump administration officials will visit Ford and Stellantis manufacturing facilities in Avon Lake and Toledo as part of two-day promotion of controversial CAFE standards changes.,,https://www.cleveland.com/resizer/v2/RRRBDY46SRALFFWFWH6SYVNSKE.jpg?auth=031c5bbc12f52fefe830dfc1c6745750fdd9f6db3b365f2cab9facbd09cd3467&width=1280&smart=true&quality=90,,,2026-01-15 10:02:44.108191
,,2026-01-15 13:00:21+00:00,The Colorado Sun,"Colorado PUC moves to give extra financial help to towns losing coal-fired power plants, but there’s a catch",,,,,,https://coloradosun.com/2026/01/15/coal-power-plants-colorado-just-transitions-trump/,"There’s a catch. The plants must close as planned, which is complicated by Trump administration orders bolstering the coal industry.",,https://newspack-coloradosun.s3.amazonaws.com/wp-content/uploads/2025/12/HaydenJustTransition7_121625-scaled.jpg,,,2026-01-15 12:02:04.761631
,,2026-01-15 12:52:31+00:00,Akron Beacon Journal,It's Electric. Cuyahoga Valley Scenic Railroad electrifies train engines,,,,,,https://www.beaconjournal.com/story/news/2026/01/14/cuyahoga-valley-scenic-railroad-switches-to-electric-train-engines/88181173007/,The funds come from a pool of money created from a national settlement over emission standards with a vehicle manufacturer.,,"https://www.beaconjournal.com/gcdn/authoring/authoring-images/2026/01/14/NABJ/88181442007-img-trains-2-1-1-r-0-t-6-jdfk-l.JPG?crop=4646,2614,x0,y182&width=3200&height=1801&format=pjpg&auto=webp",,,2026-01-15 10:02:44.108191
,Costs & Impacts,2026-01-15 12:33:42+00:00,The Lens,EPA blind spots leave workers unprotected from ethylene oxide’s cancer risks | The Lens,,,,,,https://thelensnola.org/2026/01/15/epa-blind-spots-leave-workers-unprotected-from-ethylene-oxides-cancer-risks/,"Frequent contact with the carcinogen ethylene oxide can boost the odds of developing cancer up to 60 times — risk levels that should raise red flags in Louisiana, which produces 20% of the nation’s ethylene oxide emissions within its 85-mile industrial corridor, known as Cancer Alley.",,https://i0.wp.com/thelensnola.org/wp-content/uploads/2026/01/smoke-smoking-chimney-fireplace-60575.jpeg?fit=1880%2C1217,,,2026-01-15 08:58:27.691738
,Costs & Impacts,2026-01-15 12:30:58+00:00,The Equation,One Year of the Trump Administration’s All-Out Assault on Climate and Clean Energy ,,,,,,https://blog.ucs.org/rachel-cleetus/one-year-of-the-trump-administrations-all-out-assault-on-climate-and-clean-energy/,"Documenting the harms and injustices perpetuated by this administration now, as they occur, ensures we bear witness and that the hard work that made prior progress possible is not erased.",,https://blog.ucs.org/wp-content/uploads/2026/01/Blog-Thumbnail-Trump-at-desk-in-oval-office.jpg,,,2026-01-15 08:58:27.691738
,,2026-01-15 11:04:44+00:00,lailluminator.com,An inside look at what EPA inspectors found at Smitty's Supply - Louisiana Illuminator,,,,,,https://lailluminator.com/2026/01/15/inside-look-smittys-supply/,An EPA inspection of the Smitty's Supply facility found hundreds of other chemical spills and hazards in areas unaffected by the August fire.,,,,,2026-01-15 08:58:27.691738
,Costs & Impacts,2026-01-15 10:10:38+00:00,Foster's Daily Democrat,Somersworth seeks EPA grant to clean up Main Street site and sell it,,,,,,https://www.fosters.com/story/news/local/2026/01/15/somersworth-nh-epa-grant-261-main-street-prince-garage/88141826007/,Somersworth would like to see a new development at 261 Main St. An EPA grant to remove contaminants is sought to make that possible.,,"https://www.fosters.com/gcdn/authoring/authoring-images/2026/01/12/NFDD/88148570007-11226-s-property-2.jpg?crop=1999,1125,x0,y187&width=1999&height=1125&format=pjpg&auto=webp",,,2026-01-15 08:58:27.691738
,Costs & Impacts,2026-01-15 10:02:57+00:00,today.ucsd.edu,Study Finds Ocean Impacts Nearly Double Economic Cost of Climate Change,,,,,,https://today.ucsd.edu/story/study-finds-ocean-impacts-nearly-double-economic-cost-of-climate-change,"For the first time, a study from researchers at Scripps Institution of Oceanography at the University of California San Diego integrates climate-related damages to the ocean into the social cost of carbon— a measure of economic harm caused by greenhouse gas emissions.",,https://today.ucsd.edu/teaser_uploads/_social/Octavio_AburtoDJI_0966_DxO_%283%29.jpeg,,,2026-01-15 08:58:27.691738
,Costs & Impacts,2026-01-15 09:37:20+00:00,www.ksnt.com,EPA Drops Dollar Value on Health Impacts from Air Pollution | KSNT 27 News,,,,,,https://www.ksnt.com/news/top-stories/epa-drops-dollar-value-on-health-impacts-from-air-pollution/,TOPEKA (KSNT) – The Environmental Protection Agency is no longer considering the economic costs of harm to human health from air pollutants.,,,,,2026-01-15 08:58:27.691738
,,2026-01-15 07:53:05+00:00,X (formerly Twitter),A new rule by the Environmental Protection Agency on how it calculates curbing air pollution ...,,,,,,https://x.com/ABC/status/2011601339139146238,ABC News (@ABC). 13 likes 19 replies. A new rule by the Environmental Protection Agency on how it calculates curbing air pollution could have ...,,,,,2026-01-15 08:00:39.031716
,Costs & Impacts,2026-01-15 07:45:03+00:00,WVXU,"NIOSH workers put on leave by Trump administration have been asked to go back on the job, union says",,,,,,https://www.wvxu.org/local-news/2026-01-14/niosh-workers-on-leave-trump-back-union,"A Cincinnati union steward for AFGE, the union that represents National Institute for Occupational Safety and Health workers, says employees who received reduction in force notices last year were notified Wednesday they should return to work the next day.",,https://npr.brightspotcdn.com/dims4/default/164eee6/2147483647/strip/true/crop/3695x1940+0+373/resize/1200x630!/quality/90/?url=http%3A%2F%2Fnpr-brightspot.s3.amazonaws.com%2Fd6%2Fea%2F7430457a431c96ae7dd4980e84ad%2Fniosh-4-1-25.jpg,,,2026-01-15 08:58:27.691738
,,2026-01-15 04:51:53+00:00,www.research.utah.edu,U of U Startup Tackles Electronic Waste with Degradable Materials - Office of the Vice President for Research,,,,,,https://www.research.utah.edu/research-impact/u-of-u-startup-tackles-electronic-waste-with-degradable-materials-2/,"Written by: Samantha Everton, Innovation & Research Communications Contributor When single-use electronics are discarded, they often end up in U.S. landfills or are exported overseas for...",,https://www.research.utah.edu/wp-content/uploads/sites/44/2026/01/electronic-waste-01.jpg,,,2026-01-14 23:59:25.402223
,,2026-01-15 04:38:05+00:00,WHRO Public Media,Virginia launches website to make wetland credits more transparent ,,,,,,https://www.whro.org/environment/2026-01-14/virginia-launches-website-to-make-wetland-credits-more-transparent,"The new platform does not change how mitigation banks are permitted or operated in Virginia, but could make it easier to move through the process.",,https://npr.brightspotcdn.com/dims4/default/47ca662/2147483647/strip/true/crop/5472x2873+0+0/resize/1200x630!/quality/90/?url=http%3A%2F%2Fnpr-brightspot.s3.amazonaws.com%2F82%2Fae%2F13ca7b814546b45ecb1085fa5904%2Fsurry-county-3i8a9093.JPG,,,2026-01-15 08:58:27.691738
,Costs & Impacts,2026-01-15 02:47:31+00:00,www.law360.com,EPA's Cost Analysis U-Turn May Invite Courtroom Inquiries - Law360,,,,,,https://www.law360.com/compliance/articles/2430243/epa-s-cost-analysis-u-turn-may-invite-courtroom-inquiries,"The U.S. Environmental Protection Agency's decision to no longer put a dollar value on health benefits when crafting certain air pollution rules could be scrutinized in lawsuits, which could force the agency to justify departing from its long-standing practice.",,https://www.law360.com/images/law360-stacked.png,,,2026-01-15 02:57:49.683821
,,2026-01-15 02:40:05+00:00,www.instagram.com,"Since the 1980s, the Environmental Protection Agency (EPA) has used a metric called ... - Instagram",,,,,,https://www.instagram.com/p/DTgXdGrEVIn/,"As TechCrunch simplified, “lowering pollution can prolong human life, so if the health benefits of reducing pollution outweighed the costs, then there ...",,,,,2026-01-14 23:59:25.402223
,Costs & Impacts,2026-01-15 02:37:56+00:00,www.cbsnews.com,House passes 2-bill funding package ahead of shutdown deadline,,,,,,https://www.cbsnews.com/news/house-vote-funding-package-ahead-of-shutdown-deadline/,The Senate now has two funding packages on its plate ahead of its weeklong recess.,,https://assets1.cbsnewsstatic.com/hub/i/r/2026/01/08/1fe9b272-8c58-4164-ae7e-4c7c721f6a4c/thumbnail/1200x630g2/5bace918166d731eb22dd91665528dff/gettyimages-2254819076.jpg,,,2026-01-14 23:59:25.402223
,Costs & Impacts,2026-01-15 02:15:26+00:00,mwrd.org,"""Nearly a year after asphalt spill in Chicago Sanitary and Ship Canal, EPA criticized for ...",,,,,,https://mwrd.org/news/nearly-year-after-asphalt-spill-chicago-sanitary-and-ship-canal-epa-criticized-leaving-cleanup-unfinished-chicago-tribune,... environmental advocates say the U.S. Environmental Protection Agency ended the cleanup effort before it was completed.,,,,,2026-01-14 23:59:25.402223
,Clean Air & Water,2026-01-15 02:04:18+00:00,www.illinois.gov,Illinois EPA Notifies Village of Dupo and Connected Water Systems of Right-to-Know ...,,,,,,https://www.illinois.gov/content/dam/soi/en/web/illinois/iisnewsattachments/32096-011426-iepa-rtk-dupo-final.pdf.pdf,Springfield – The Illinois Environmental Protection Agency (Illinois EPA) is notifying the owners and operators of the Dupo Community Water System ...,,,,,2026-01-14 23:59:25.402223
