id,name,published,outlet,title,authors,category,market,categoryorder,articleorder,url,description,text,image,error,sentiment,firstEyes
,EPA Rollbacks,2025-09-29 15:36:54+00:00,subscriber.politicopro.com,E&E News: EPA is about to alter Biden-era HFC rules,,,,,,https://subscriber.politicopro.com/article/eenews/2025/09/29/epa-is-about-to-alter-biden-era-hfc-rules-00582896,The biggest change is a yearslong deadline extension for converting air conditioning to use newer chemicals that do less climate damage.,,https://static.politico.com/9c/b3/dbc614ca493f9815e9dd7ef6b8ba/ike-texas.JPEG,,,2025-09-29 13:03:23.726831
,Costs & Impacts,2025-09-29 15:25:22+00:00,The Panhandle News Network | WEPM & WCST,WVDEP Looking For Public Input This Week for PFAS Action Plans in Eastern Panhandle,,,,,,https://panhandlenewsnetwork.com/2025/09/29/wvdep-looking-for-public-input-this-week-for-pfas-action-plans-in-eastern-panhandle/,"CHARLESTON, W.Va. – The West Virginia Department of Environmental Protection (WVDEP), in partnership with the West Virginia Rivers Coalition, Fair Shake Environmental Legal Services, and other local organizations, will host a series of community meetings in the Eastern Panhandle to help identify potential sources of PFAS contamination in public drinking water systems. PFAS, often referred…",,https://panhandlenewsnetwork.com/wp-content/uploads/2025/09/rivers.png,,,2025-09-29 12:10:58.445102
,Costs & Impacts,2025-09-29 15:19:58+00:00,Senator Sheldon Whitehouse,"As Trump Tries to Blame Clean Energy for World’s Problems, Whitehouse Spotlights Climate Denial Fraud Operation Inside Trump Administration - Senator Sheldon Whitehouse",,,,,,https://www.whitehouse.senate.gov/news/release/as-trump-tries-to-blame-clean-energy-for-worlds-problems-whitehouse-spotlights-climate-denial-fraud-operation-inside-trump-administration/,"In public comment on EPA’s proposed rollback of the endangerment finding, Whitehouse blasts EPA’s “fraud-by-government” and “embrace of fake science” to protect fossil fuel industry’s “free-to-pollute business model” Washington, DC – U.S. Senator Sheldon Whitehouse (D-RI), Ranking Member of the Senate Environment and Public Works Committee, this week exposed the malign influence of the fossil fuel […]",,https://www.whitehouse.senate.gov/wp-content/uploads/2024/01/Whitehouse_Logo_Social_Option1.jpg,,,2025-09-29 12:10:58.445102
,Costs & Impacts,2025-09-29 15:17:02+00:00,TIME,Republicans Have a MAHA Problem. Democrats See an Opportunity ,,,,,,https://time.com/7321128/republican-maha-movement-plan-democrats/,The MAHA movement that helped propel Trump to victory is now at odds with Republican lawmakers over pesticide regulation and food-system reform.,,https://api.time.com/wp-content/uploads/2025/09/trump-kennedy.jpg?quality=85&w=1024&h=628&crop=1,,,2025-09-29 12:10:58.445102
,,2025-09-29 15:09:21+00:00,"Morningstar, Inc.",American Water Participates in Source Water Protection Week,,,,,,https://www.morningstar.com/news/business-wire/20250929543899/american-water-participates-in-source-water-protection-week,,,https://images.contentstack.io/v3/assets/blt4eb669caa7dc65b2/blta7dd42ebdd7b93b8/61899b34a3c7df383578294c/morningstar-og.png,,,2025-09-29 12:10:58.445102
,Costs & Impacts,2025-09-29 15:05:01+00:00,U.S. Department of the Interior,Interior Unleashes American Coal Power in Bold Move to Advance Trump Administration Priorities | U.S. Department of the Interior,,,,,,https://www.doi.gov/pressreleases/interior-unleashes-american-coal-power-bold-move-advance-trump-administration,"The Department of the Interior today announced the opening of 13.1 million acres of federal land for coal leasing, tripling the benchmarks set by the landmark One Big Beautiful Bill Act and delivering on President Donald J. Trump’s directive to restore American Energy Dominance",,https://www.doi.gov/sites/default/files/styles/social_media_2_1/public/images/2025-09/29752159981_518fc2ef1a_b.jpg?itok=i__-Xwjf,,,2025-09-29 12:10:58.445102
,Costs & Impacts,2025-09-29 15:04:33+00:00,www.hklaw.com,Government Shutdown Advisory: Summary of Possible Lapse in Appropriations | Insights | Holland & Knight,,,,,,https://www.hklaw.com/en/insights/publications/2025/09/government-shutdown-advisory,,,https://www.hklaw.com/-/media/images/twittercards/hk_opengraph.png?rev=ec0d75523b1f4e68920e3e1b42304866&sc_lang=en&hash=3345DDE33F8D43A99B42BABA11D22AF8,,,2025-09-29 12:10:58.445102
,,2025-09-29 14:59:00+00:00,STAT,Lilly executives: How the FDA’s new PreCheck program can unleash the future of U.S. medicine manufacturing,,,,,,https://www.statnews.com/2025/09/29/fda-precheck-eli-lilly-domestic-medicine-manufacturing/,The FDA should make changes to further expand biopharmaceutical manufacturing in the United States.,,https://www.statnews.com/wp-content/uploads/2025/09/AdobeStock_62503059-1024x576.jpeg,,,2025-09-29 12:10:58.445102
,Costs & Impacts,2025-09-29 14:37:18+00:00,www.wwltv.com,EPA Responds to Oily Waste Spill Near Tangipahoa River | wwltv.com,,,,,,https://www.wwltv.com/article/news/local/roseland-explosion/epa-deploys-dams-cleanup-mats-to-prevent-smittys-supply-oily-waste-from-reaching-tangipahoa-river-roseland-explosion-enviroment/289-0585e28d-ebef-4f31-b294-7fe3ebf78db9,"EPA works 24/7 with dams, pads, and marsh mats to contain and remove oily waste from ponds near the Tangipahoa River.",,,,,2025-09-29 12:10:58.445102
,,2025-09-29 14:36:19+00:00,Yahoo Finance,Trump Opens 13 Million Acres for Coal Mines to Aid Ailing Sector,,,,,,https://finance.yahoo.com/news/trump-opens-13-million-acres-140015901.html,"The measures, paired with announcements by the Environmental Protection Agency, come as the president and administration officials have made boosting coal-fired power a priority amid surging electricity demand from data centers, new factories and the broader electrification of the economy.  In addition to expanding coal-leasing in the US to more than triple the requirement set in President Donald Trump’s One Big Beautiful Bill Act, the agency announced it was reducing the royalty rate paid for coal and would be streamlining approvals for projects in Wyoming, Tennessee and elsewhere.  The Department of Energy announced it would be providing the $625 million to recommission or modernize coal plants and funds for new coal projects.",,https://s.yimg.com/ny/api/res/1.2/DBhTpe4FtTSU7gRG.eXyBQ--/YXBwaWQ9aGlnaGxhbmRlcjt3PTEyMDA7aD03NjU-/https://s.yimg.com/os/creatr-uploaded-images/2025-09/43278070-9d42-11f0-bfff-bf6fc6bc7f2b,,,2025-09-29 12:10:58.445102
,,2025-09-29 14:31:42+00:00,Unfiltered with Kiran,EPA Releases Inventory List from Smitty’s Supply Roseland Fire,,,,,,https://unfilteredwithkiran.com/epa-releases-list-of-hazardous-inventory-at-smittys-supply-after-delay/,EPA releases a 305-page inventory list revealing millions of gallons of petrochemicals stored at Smitty’s Supply in Roseland.,,https://unfilteredwithkiran.com/wp-content/uploads/2025/09/Smittys-Supply-Roseland-fire-EPA-inventory-list.png,,,2025-09-29 12:10:58.445102
,,2025-09-29 13:42:25+00:00,www.washingtonpost.com,A new generation rallies to preserve the Boundary Waters wilderness,,,,,,https://www.washingtonpost.com/climate-environment/2025/09/29/boundary-waters-mining-threat/,"Jake Spring covers the Environmental Protection Agency, Department of Interior and Congressional energy and environmental policy. Send him secure ...",,,,,2025-09-29 10:05:34.980135
,Costs & Impacts,2025-09-29 13:29:17+00:00,Newsweek,Millions in Texas Told to Share Rides,,,,,,https://www.newsweek.com/millions-texas-told-share-rides-10796412,"Air quality alerts were in force for San Antonio, as well as for the Houston area, on Monday.",,https://assets.newsweek.com/wp-content/uploads/2025/09/GettyImages-2208599547-1.jpg?w=1200crop=1,,,2025-09-29 10:05:34.980135
,Costs & Impacts,2025-09-29 13:28:49+00:00,Johnson County Post,What we're asking WaterOne board candidates,,,,,,https://johnsoncountypost.com/2025/09/29/waterone-board-candidates-questions-269459/,"The Post will publish candidates' answers to our five-item questionnaire the week of Oct. 20, before early voting begins.",,https://images.johnsoncountypost.com/wp-content/uploads/2025/04/WaterOne-water-tower.jpg,,,2025-09-29 10:05:34.980135
,,2025-09-29 13:21:12+00:00,ladailypost.com,FBI: Shiprock Man Pleads Guilty To Leading Massive Illegal Marijuana Operation,,,,,,https://ladailypost.com/fbi-shiprock-man-pleads-guilty-to-leading-massive-illegal-marijuana-operation/,"... Environmental Protection Agency investigated this case with the ... Administration, Internal Revenue Service, and the Navajo Nation Police Department.",,,,,2025-09-29 10:05:34.980135
,,2025-09-29 13:11:47+00:00,www.nytimes.com,Which Federal Benefits and Services Continue During a Government Shutdown?,,,,,,https://www.nytimes.com/2025/09/29/us/politics/government-shutdown-federal-services-mail-parks.html,... Environmental Protection Agency furloughed most of its employees in charge of monitoring pollution and compliance. Some routine food safety ...,,,,,2025-09-29 10:05:34.980135
,,2025-09-29 13:10:32+00:00,subscriber.politicopro.com,E&E News: How a major DOE report hides the whole truth on climate change,,,,,,https://subscriber.politicopro.com/article/eenews/2025/09/29/how-a-major-doe-report-hides-the-whole-truth-on-climate-change-ew-00581057,POLITICO's E&E News conducted a detailed examination of the agency's effort to obscure key facts on global warming. ,,https://static.politico.com/3f/4a/f3fc8cd24b1893402c07f6e10250/senate-energy-60313.jpg,,,2025-09-29 10:05:34.980135
,,2025-09-29 13:00:49+00:00,Spencer Fane,"Founding Member of Consumer Financial Protection Bureau Office of Regulations Bolsters Spencer Fane Financial Services, Regulatory Practices in D.C. - Spencer Fane",,,,,,https://www.spencerfane.com/insight/founding-member-of-consumer-financial-protection-bureau-office-of-regulations-bolsters-spencer-fane-financial-services-regulatory-practices-in-d-c/,"Spencer Fane LLP is pleased to welcome Mike G. Silver to the firm’s Washington, D.C., office as a partner in the Banking and Financial Services practice",,https://www.spencerfane.com/wp-content/uploads/2025/09/9-29-25_Founding-Member-of-Consumer-Financial-Protection-Bureau-Office-of-Regulations-Bolsters-Spencer-Fane.jpg,,,2025-09-29 10:05:34.980135
,,2025-09-29 12:57:46+00:00,www.kingsresearch.com,How Sustainability Laws Shape Green Surfactants?,,,,,,https://www.kingsresearch.com/blog/sustainability-green-surfactants,"Explore how global sustainability laws, biodegradability standards, and chemical safety regulations are shaping the green surfactants industry.",,https://app.kingsresearch.com/uploads/blogs/img_path-1759149544069-Green%20Surfactants.webp,,,2025-09-29 10:05:34.980135
,Costs & Impacts,2025-09-29 12:56:43+00:00,pagosadailypost.com,New Report Ranks States on Climate-Related Health Risks - Pagosa Daily Post,,,,,,https://pagosadailypost.com/2025/09/29/new-report-ranks-states-on-climate-related-health-risks/,The Trump administration has fired numerous officials and scientists at the Environmental Protection Agency and has rescinded environmental ...,,,,,2025-09-29 10:05:34.980135
,Costs & Impacts,2025-09-29 12:54:15+00:00,JD Supra,Persistent Chemicals/U.S. Department of Energy Should Complete Efforts to Review PFAS Use: U.S. Government Accountability Office Report | JD Supra,,,,,,https://www.jdsupra.com/legalnews/persistent-chemicals-u-s-department-of-3037780/,The United States Government Accountability Office (“GAO”) issued a September 10th report titled:                PERSISTENT CHEMICALS: DOE Should...,,https://jdsupra-static.s3.amazonaws.com/profile-images/og.15833_1120.jpg,,,2025-09-29 10:05:34.980135
,Costs & Impacts,2025-09-29 12:48:21+00:00,CNBC,Trump officials to announce plan to boost coal output,,,,,,https://www.cnbc.com/2025/09/29/trump-officials-to-announce-plan-to-boost-coal-output.html,"The U.S. will announce policies to encourage coal output, as the Trump administration seeks to reverse the decline of the fuel's use.",,https://image.cnbcfm.com/api/v1/image/108121078-17429277372025-03-25t145652z_1723743288_rc2vjdavojwn_rtrmadp_0_usa-trump-economy.jpeg?v=1742927756&w=1920&h=1080,,,2025-09-29 10:05:34.980135
,,2025-09-29 12:33:07+00:00,www.environment.gov.pk,A Public Hearing on the EIA Report of Infrastructure Development of New Down Town ...,,,,,,https://www.environment.gov.pk/NewsDetail/NzFhNmU1YzQtYmY1ZC00YzZiLThkNGEtMWVjMjU4NTQ0MjQz,Pakistan Environmental Protection Agency.,,,,,2025-09-29 11:04:49.305418
,Costs & Impacts,2025-09-29 12:06:37+00:00,marylandmatters.org,Maryland redrew an environmental justice map; polluted communities feel left out,,,,,,https://marylandmatters.org/2025/09/29/maryland-ej-map-brandywine-cherish-act/,She said the previous EPA environmental justice map put Brandywine in the 97th percentile. Gray was among the advocates who filed a 2016 federal civil ...,,,,,2025-09-29 10:05:34.980135
,,2025-09-29 12:03:41+00:00,Al Jazeera,How much extra power would a government shutdown give Trump?,,,,,,https://www.aljazeera.com/news/2025/9/29/how-much-extra-power-would-a-government-shutdown-give-trump,"Trump could use executive power to reshape federal agencies and force layoffs during a shutdown, experts say.",,https://www.aljazeera.com/wp-content/uploads/2025/08/AP25240548052490-1756478286.jpg?resize=1920%2C1440,,,2025-09-29 10:05:34.980135
,Costs & Impacts,2025-09-29 11:40:16+00:00,Social Democrats,Ireland entering critical moment as hopes of meeting environment targets fade - Social Democrats,,,,,,https://www.socialdemocrats.ie/ireland-entering-critical-moment-as-hopes-of-meeting-environment-targets-fade/,"We’re well into the 11th hour when it comes to meeting our EU environment targets, yet the government remains asleep at the wheel, according to Social Democrats environment spokesperson Jennifer Whitmore. Deputy Whitmore said: “It is now all but inevitable that Ireland will face billions in EU fines for not meeting its legally binding environmental […]",,https://www.socialdemocrats.ie/wp-content/uploads/2025/02/Jennifer-new.jpg,,,2025-09-29 10:05:34.980135
,,2025-09-29 11:34:20+00:00,www.abladvisor.com,Greenberg Traurig Adds Former DOJ Assistant Section Chief to Environmental Practice in ...,,,,,,https://www.abladvisor.com/news/41578/greenberg-traurig-adds-former-doj-assistant-section-chief-to-environmental-practi,"The firm recently added environmental attorney Lauren Hammond in Denver from the Environmental Protection Agency, as well as a group of Environmental ...",,,,,2025-09-29 10:05:34.980135
,Costs & Impacts,2025-09-29 11:17:51+00:00,waterfm.com,AWWA files opening brief in Lead and Copper Rule Improvement petition,,,,,,https://waterfm.com/awwa-files-opening-brief-in-lead-and-copper-rule-improvement-petition/,"... Environmental Protection Agency's (EPA) desire to replace lead service lines on both public and private property as quickly as feasible, it said ...",,,,,2025-09-29 10:05:34.980135
,,2025-09-29 11:15:30+00:00,The Texas Tribune,About $675 million earmarked for Texas projects is in limbo as Congress careens toward shutdown,,,,,,https://www.texastribune.org/2025/09/29/texas-earmarks-congress-budget-negotiations-shutdown/,"Texas’ congressional delegation obtained tentative funding for infrastructure improvements, university research and other initiatives, but the nearly 350 earmarks are all in jeopardy.",,https://thumbnails.texastribune.org/XiT3UKtUiw7kuHVp4Y5y1f5nsE0=/1200x630/filters:quality(95):focal(0x0:5000x3331)/static.texastribune.org/media/files/4b9091f6bdb24dd50bd05bf606294436/1002%20ATX%20Urban%20Sprawl%20JV%2023.jpg,,,2025-09-29 10:05:34.980135
,,2025-09-29 10:05:57+00:00,www.sciencedirect.com,Paying as you fly: Investigating air passengers' preferences for voluntary carbon offset in ...,,,,,,https://www.sciencedirect.com/science/article/pii/S096585642500326X,Environmental Protection Administration of Taiwan (2023). Taiwan Climate Change Response Act. https://law.moj.gov.tw/LawClass/LawAll.aspx?pcode ...,,,,,2025-09-29 10:05:34.980135
,Costs & Impacts,2025-09-29 10:04:16+00:00,The Columbus Dispatch,City construction project leaves some South Side residents fuming over property damage,,,,,,https://www.thisweeknews.com/story/news/local/2025/09/29/some-south-side-residents-say-columbus-stormwater-construction-project-damaged-their-properties/86315439007/,Residents of Columbus' Edgewood neighborhood are unhappy with property damage they say was caused by a Columbus stormwater separation project,,"https://www.dispatch.com/gcdn/authoring/authoring-images/2025/09/24/NCOD/86331600007-linwood-avenue-09242025-1.JPG?crop=5216,2934,x0,y0&width=3200&height=1800&format=pjpg&auto=webp",,,2025-09-29 10:05:34.980135
,,2025-09-29 09:59:57+00:00,Frontiers,Frontiers | Phenotypically Anchored Transcriptomics Across Diverse Agrichemicals Reveals Conserved Pathways and Unique Gene Expression Signatures in Zebrafish,,,,,,https://www.frontiersin.org/journals/toxicology/articles/10.3389/ftox.2025.1675060/full,"Agrichemicals such as herbicides, fungicides, insecticides, and biocides are widely used in agriculture, yet some are associated with adverse effects in huma...",,https://d2csxpduxe849s.cloudfront.net/media/E32629C6-9347-4F84-81FEAEF7BFA342B3/526C9CF2-ED7B-4889-96A9E5009616E054/30DE3BB4-A29A-4CF8-B35321D57079CE08/WebsiteWebP_XL-FTOX_Main Visual_Cyan_Website.webp,,,2025-09-29 10:05:34.980135
,Costs & Impacts,2025-09-29 09:32:56+00:00,The Banner,"Fixing Baltimore‚Äôs sewage overflows could drain $674M, 20 more years",,,,,,https://www.thebaltimorebanner.com/community/climate-environment/baltimore-sewage-overflows-consent-decree-dpw-KFTNZHZ2GVEE5HT362M7PVWIEE/,The city entered its sewage consent decree in 2002 and now wants to punt its completion to 2046.,,"https://www.thebanner.com/resizer/v2/3OJZ4PZRARAO3A5BBV6CUGE7V4.jpg?auth=070682c878edef6fcb99fa21353b25f694d16402456881e175d413a1270c91f9&width=900&focal=3138,2888&quality=85",,,2025-09-29 05:59:25.899163
,Costs & Impacts,2025-09-29 09:20:20+00:00,www.ctinsider.com,Why millions of gallons of untreated sewage finds its way into the Connecticut River,,,,,,https://www.ctinsider.com/connecticut/article/ct-river-massachusetts-wastewater-sewage-dump-21060780.php,The incident spurred two other Connecticut lawmakers to ask the federal Environmental Protection Agency ... Department of Environmental Protection.,,,,,2025-09-29 05:59:25.899163
,Costs & Impacts,2025-09-29 09:05:04+00:00,www.marketwatch.com,Feds delay new car safety rules meant to reduce pedestrian accidents - MarketWatch,,,,,,https://www.marketwatch.com/story/feds-delay-new-car-safety-rules-meant-to-reduce-pedestrian-accidents-d1b6c04c,"The Department of Transportation stopped enforcing longstanding fuel economy rules, and the Environmental Protection Agency dropped the policy that ...",,,,,2025-09-29 05:59:25.899163
,,2025-09-29 09:00:41+00:00,Smart Cities Dive,Beyond CJIS compliance: Reducing access friction while strengthening security,,,,,,https://www.smartcitiesdive.com/spons/beyond-cjis-compliance-reducing-access-friction-while-strengthening-securi/760812/,Already CJIS compliant? Here’s how to make secure access faster and more sustainable.,,https://imgproxy.divecdn.com/QJof7x0a_HiLY47ySshZzmGb7mRip44YtVbWkWPhvAo/g:ce/rs:fit:770:435/Z3M6Ly9kaXZlc2l0ZS1zdG9yYWdlL2RpdmVpbWFnZS9DSklTSW1hZ2UucG5n.webp,,,2025-09-29 05:59:25.899163
,,2025-09-29 08:51:06+00:00,www.windpowermonthly.com,Analysis: Can US offshore wind survive Trump?,,,,,,https://www.windpowermonthly.com/article/1933899/analysis-us-offshore-wind-survive-trump,Read Analysis: Can US offshore wind survive Trump? and other wind energy news & analysis on Windpower Monthly,,https://cached.imagescaler.hbpl.co.uk/resize/scaleHeight/150/cached.offlinehbpl.hbpl.co.uk/news/OPW/Southfork-Construction-Analysis.jpg,,,2025-09-29 05:59:25.899163
,,2025-09-29 08:33:51+00:00,TheJournal.ie,Majority of Irish young people buy clothes several times a month,,,,,,https://www.thejournal.ie/ireland-fast-fashion-clothes-6827250-Sep2025/,"Irish people like cheap clothes, and we mostly buy new, not second-hand.",,https://img2.thejournal.ie/article/6827250/river/?height=400&version=6828007,,,2025-09-29 04:58:45.413061
,Costs & Impacts,2025-09-29 08:29:31+00:00,www.wired-gov.net,Group fined £71000 over huge waste piles in Suffolk | Environment Agency - WiredGov,,,,,,https://www.wired-gov.net/wg/news.nsf/articles/Group%2Bfined%2B71000%2Bover%2Bhuge%2Bwaste%2Bpiles%2Bin%2BSuffolk%2B29092025092500%3Fopen,Waste was imported on a huge scale over a long period without the benefit of appropriate permits meant to protect the public and the environment. The ...,,,,,2025-09-29 05:59:25.899163
,Costs & Impacts,2025-09-29 08:23:38+00:00,www.mondaq.com,Government Shutdown Update,,,,,,https://www.mondaq.com/unitedstates/constitutional-administrative-law/1684026/government-shutdown-update,"Given the cancellation of an expected meeting between President Trump and the congressional Democratic leadership, it appears there will not be any agreement about appropriations for fiscal year (FY) 2026...",,http://www.mondaq.com/images/MondaqThumb.png,,,2025-09-29 04:58:45.413061
,Costs & Impacts,2025-09-29 08:18:32+00:00,Fall River Herald News,Fall River eyes Somerset for network of shared utility costs. What this means for the city,,,,,,https://www.heraldnews.com/story/news/regional/2025/09/29/fall-river-regionalization-of-wastewater-treatment-services-somerset-shared-utility-costs/86333964007/,"Three decades have come and gone since Fall River serviced Somerset's water, but brokering a deal of sharing utility costs could save money.",,"https://www.heraldnews.com/gcdn/authoring/authoring-images/2025/09/25/NHER/86348372007-wastewater.jpg?crop=4031,2269,x0,y377&width=3200&height=1802&format=pjpg&auto=webp",,,2025-09-29 04:58:45.413061
,Costs & Impacts,2025-09-29 07:08:01+00:00,www.iom3.org,"Artisanal mining releases heavy metals, work to protect health and income starts",,,,,,https://www.iom3.org/resource/artisanal-mining-releases-heavy-metals-work-to-protect-health-and-income-starts.html,"Communities in Ghana face risk of harm from artisanal mining practices, study shows.",,https://www.iom3.org/static/8b84cdb6-2fbe-488d-8ea7f11a0b5bc359/opengraphimage_83f4e8796336604b59d7216d0ecd81a5_4a7c7e45a350/shutterstock2161705477-copy.jpg,,,2025-09-29 05:59:25.899163
,Opposition & Allies,2025-09-29 06:19:57+00:00,theferret.scot,It takes a village: a new approach to living with flooding - The Ferret,,,,,,https://theferret.scot/new-approaches-flood/,The actions they took saved the village from flooding and the group has been featured by the Scottish Environmental Protection Agency (Sepa) and the ...,,,,,2025-09-29 02:59:04.132693
,Costs & Impacts,2025-09-29 06:18:50+00:00,thealpenanews.com,"It’s time to confront the climate change crisis driving wildfires, extreme weather",,,,,,https://www.thealpenanews.com/opinion/2025/09/its-time-to-confront-the-climate-change-crisis-driving-wildfires-extreme-weather/,"A few weeks ago, a 27-year-old had to postpone running outdoors because wildfire smoke was exacerbating his asthma. The cloudy mix of fine particles obscuring the view across the lake is approximately 10 times more toxic than usual air pollution derived from burning fossil fuels. The data is clear: when wildfire smoke increases, so do […]",,https://ogden_images.s3.amazonaws.com/www.thealpenanews.com/images/2025/09/28163706/Dr.-Elizabeth-Del-Buono.png,,,2025-09-29 02:59:04.132693
,,2025-09-29 05:55:06+00:00,www.pa.gov,Permit status,,,,,,https://www.pa.gov/agencies/dep/data-and-tools/track-permits/search/details.id1540728.html,Permit status,,https://www.pa.gov/content/dam/copapwp-pagov/en/global/images/thumbnail.png,,,2025-09-29 04:58:45.413061
,,2025-09-29 05:45:56+00:00,www.instagram.com,"On this #WorldRiversDay, we celebrate the beauty of our nation's waterways. We are ... - Instagram",,,,,,https://www.instagram.com/p/DPJZrW3FFNa/,"Our staff are professional scientists, biologists, environmental ... The U.S. Environmental Protection Agency's Region 6 office is now on Instagram!",,,,,2025-09-29 04:58:45.413061
,,2025-09-29 05:36:23+00:00,www.marketdataforecast.com,"Global Paper Bags Market Size, Share, Growth & Trends, 2033",,,,,,https://www.marketdataforecast.com/market-reports/paper-bags-market,"As per the United States Environmental Protection Agency, over 120 billion plastic bags are used annually in the U.S., prompting cities like New ...",,,,,2025-09-29 02:59:04.132693
,,2025-09-29 05:23:10+00:00,BBC News,Earlston pupils help to monitor River Tweed's health - BBC News,,,,,,https://www.bbc.com/news/articles/cddm5vzp0gzo.amp,Children in the Borders check on a tributary of the River Tweed after a summer of water scarcity.,,https://ichef.bbci.co.uk/news/1024/branded_news/792f/live/77aea3a0-99f0-11f0-8075-a1f3b14172f9.jpg,,,2025-09-29 03:59:04.414627
,,2025-09-29 05:21:40+00:00,The Michigan Daily,Researchers warn federal grant cuts threaten nuclear energy progress,,,,,,https://www.michigandaily.com/news/research/researchers-warn-federal-grant-cuts-threaten-nuclear-energy-progress-at-umich/,"This April, the University of Michigan and other leading research institutions filed a lawsuit against the U.S. Department of Energy.",,https://www.michigandaily.com/wp-content/uploads/2025/09/Federal-funding-cuts-to-nuclear-energy-research-general-topic.png,,,2025-09-29 02:59:04.132693
