id,name,published,outlet,title,authors,category,market,categoryorder,articleorder,url,description,text,image,error,sentiment,firstEyes
,Costs & Impacts,2026-02-06 13:24:54+00:00,www.linkedin.com,Carbon Border Adjustment Mechanism (CBAM) ‚Äì Action needed for importers of goods into Ireland | Environmental Protection Agency (EPA) Ireland,,,,,,https://www.linkedin.com/posts/environmental-protection-agency-ireland_carbon-border-adjustment-mechanism-cbam-activity-7425508585779904515-9G9j,"An important reminder for companies who import¬†CBAM¬†goods from outside the European Union into Ireland!¬†You have legal obligations under the Carbon Border Adjustment Mechanism (CBAM), the EU's tool to put a fair price on¬†the carbon emitted during the production of¬†carbon intensive goods.¬†If your company expects to import more than 50 tonnes of CBAM goods in a year, please note you must apply for the status of Authorised CBAM Declarant now.
¬†
To help importers estimate their liabilities under CBAM for imports in 2026, we've published a calculator on our website: https://lnkd.in/dDXfc5qX
¬†
This is intended to provide a high-level estimate and Authorised CBAM Declarants will be responsible for managing and tracking their own liability. Declarants will be required to purchase and surrender CBAM certificates in 2027 relating to the embedded emissions associated with the production of the goods imported in 2026.
¬†
Read more about CBAM at the article below.¬†",,https://media.licdn.com/dms/image/v2/D4D12AQFWgF8UpXheQw/article-cover_image-shrink_720_1280/B4DZnIK.2IGsAM-/0/1759999948047?e=2147483647&v=beta&t=AfIkJTJpWwjuknDI6V2zckI3lZbjuT1FOWopCA2fwwM,,,2026-02-06 13:02:13.150521
,,2026-02-06 13:07:14+00:00,US EPA,Petitions for Reconsideration and Judicial Review Under the AIM Act | US EPA,,,,,,https://www.epa.gov/climate-hfcs-reduction/petitions-reconsideration-and-judicial-review-under-aim-act,This page lists petitions for reconsideration of specific provisions of the final rule titled “Restrictions on the Use of Certain Hydrofluorocarbons Under the America Innovation and Manufacturing Act of 2020.”,,https://www.epa.gov/sites/all/themes/epa/img/epa-standard-og.jpg,,,2026-02-06 12:04:58.193340
,Costs & Impacts,2026-02-06 12:00:44+00:00,Duluth News Tribune,"Groups sue Trump, EPA over delaying reduction of mercury emissions",,,,,,https://www.duluthnewstribune.com/news/local/groups-sue-trump-epa-over-delaying-reduction-of-mercury-emissions,"The limits, set in 2024 by the Biden administration, would reduce the taconite industry's mercury emissions by 33%. The industry missed Minnesota's 2025 reduction target of 72%.",,https://cdn.forumcomm.com/dims4/default/19b0782/2147483647/strip/true/crop/8192x5464+0+0/resize/1598x1066!/quality/90/?url=https%3A%2F%2Fforum-communications-production-web.s3.us-west-2.amazonaws.com%2Fbrightspot%2F1e%2Fc6%2Faa87fcfa40c2a47d02d635e196b4%2F052424-n-dnt-keetac-c07.jpg,,,2026-02-06 13:02:13.150521
,Costs & Impacts,2026-02-06 11:13:16+00:00,www.wlrn.org,"Living near hazardous waste sites may raise risk of more aggressive breast cancer, UM studies find",,,,,,https://www.wlrn.org/light/health/2026-02-06/breast-cancer-hazardous-waste-superfund-study-um,"The term “Superfund” originates from federal legislation passed in 1980, which established the Environmental Protection Agency's (EPA) Superfund ...",,,,,2026-02-06 13:02:13.150521
,,2026-02-06 09:12:11+00:00,Federal Register,Environmental Impact Statements; Notice of Availability,,,,,,https://www.federalregister.gov/documents/2026/02/06/2026-02362/environmental-impact-statements-notice-of-availability,"Search, browse and learn about the Federal Register. Federal Register 2.0 is the unofficial daily publication for rules, proposed rules, and notices of Federal agencies and organizations, as well as executive orders and other presidential documents.",,https://www.federalregister.gov/assets/open_graph_site_banner.png,,,2026-02-06 12:04:58.193340
,Costs & Impacts,2026-02-06 09:12:05+00:00,Federal Register,The Hazardous Waste Electronic Manifest System (“e-Manifest”) Advisory Board: Request for Nominations,,,,,,https://www.federalregister.gov/documents/2026/02/06/2026-02342/the-hazardous-waste-electronic-manifest-system-e-manifest-advisory-board-request-for-nominations,"The U.S. Environmental Protection Agency (EPA) invites the public to nominate experts in Information Technology (IT) to be considered for a three-year membership appointment to the Hazardous Waste Electronic Manifest System (""e-Manifest"") Advisory Board (the ""Board""). Pursuant to the Hazardous...",,https://www.federalregister.gov/assets/open_graph_site_banner.png,,,2026-02-06 12:04:58.193340
,,2026-02-06 08:05:32+00:00,usepa.servicenowservices.com,%kb_name - ICIS Modernization Board Charter - OECA ICIS,,,,,,https://usepa.servicenowservices.com/oeca_icis/en/icis-modernization-board-charter%3Fid%3Dkb_article_view%26sys_kb_id%3D1ba3fae297bf5ed0ef92fd9ad053af62,An official website of the United States government. Portal Logo. United States Environmental Protection Agency. Toggle navigation.,,,,,2026-02-06 12:04:58.193340
,,2026-02-06 07:53:27+00:00,www.lexology.com,2026 Forecast: TSCA Reform Developments - Lexology,,,,,,https://www.lexology.com/library/detail.aspx%3Fg%3D97bd7151-d9c8-46fb-be0e-3089335112ff,"As listeners know, Rich Engler has long been an advocate for change in the U.S. Environmental Protection Agency's (EPA) interpretation of Section 5 ...",,,,,2026-02-06 12:04:58.193340
,,2026-02-06 07:01:10+00:00,www.tn.gov,Tennessee Division of Radioloical Health Healpful Documents and Links Page - TN.gov,,,,,,https://www.tn.gov/environment/program-areas/rh-radiological-health1/helpful-links.html,"... Department of Energy, the U. S. Department of Transportation, and the U.S. Environmental Protection Agency, Office of Radiation and Indoor Air.",,,,,2026-02-06 12:04:58.193340
,Costs & Impacts,2026-02-06 05:33:06+00:00,https://www.wsaz.com,"Town of Wayne amends “Do Not Consume” order, recommends residential flushing",,,,,,https://www.wsaz.com/2026/02/05/town-wayne-modifies-do-not-consume-order/,Mayor Danny Grace says he has changed the town’s “Do Not Consume” order to a “Do Not Drink” order.,,https://gray-wsaz-prod.gtv-cdn.com/resizer/v2/F4LB4555YRCEXANYRXPACAIJK4.jpg?auth=ff03f05791b227fa04dcb5209d7e43498a5e175e7d5dac71f43287b73903a5a7&width=1200&height=600&smart=true,,,2026-02-06 01:58:16.803829
,,2026-02-06 05:09:47+00:00,JD Supra,Allison Macdougall Davidson on Environmental Protection Agency (EPA) | JD Supra,,,,,,https://www.jdsupra.com/authors/allison-macdougall-davidson/environmental-protection-agency-epa/,"Latest environmental protection agency (epa) publications by attorney Allison Macdougall Davidson at Bergeson & Campbell, P.C. via law news provider JD Supra.",,https://jdsupra-static.s3.amazonaws.com/profile-images/og.15432_3114.jpg,,,2026-02-06 12:04:58.193340
,Costs & Impacts,2026-02-06 05:07:54+00:00,X (formerly Twitter),The Ohio Environmental Protection Agency reported elevated lead levels in the air near the ...,,,,,,https://x.com/WTOL11Toledo/status/2019628886183588010,WTOL 11 (@WTOL11Toledo). 129 views. The Ohio Environmental Protection Agency reported elevated lead levels in the air near the Bunting Bearings ...,,,,,2026-02-06 12:04:58.193340
,,2026-02-06 04:26:53+00:00,Bay Journal,"Anglers, riverkeeper keep pressure on Maryland landfill",,,,,,https://www.bayjournal.com/news/fisheries/anglers-riverkeeper-keep-pressure-on-maryland-landfill/article_350d7532-bd57-46ed-a98a-8fdbb04cec8d.html,"The days of dumping construction rubble beside Days Cove appear to be numbered. For many who live or fish on the lower Gunpowder River, the end can’t come soon enough.",,https://bloximages.newyork1.vip.townnews.com/bayjournal.com/content/tncms/assets/v3/editorial/2/57/257f761d-1200-40e0-9869-0c68570fe8fa/68d593143cb0d.image.jpg?crop=1200%2C630%2C0%2C76,,,2026-02-06 01:58:16.803829
,Costs & Impacts,2026-02-06 03:40:45+00:00,US EPA,March 5 Tar Creek Superfund Site Open House | US EPA,,,,,,https://www.epa.gov/publicnotices/march-5-tar-creek-superfund-site-open-house,"Information about the Tar Creek Open House and Healthy Communities event in Miami, OK, on March 5, 2026.",,https://www.epa.gov/system/files/images/2022-03/epa-standard-twitter.jpg,,,2026-02-06 12:04:58.193340
,Costs & Impacts,2026-02-06 02:57:50+00:00,www.wtol.com,Delta mother says two of her children tested positive for lead months before EPA findings,,,,,,https://www.wtol.com/article/news/local/delta-mother-says-children-tested-positive-for-lead-months-before-epa-findings/512-bd660af3-92f0-4008-b17c-4b609c09090e,"The facility, which is being demolished as part of a relocation, was flagged by the Ohio EPA in January after testing revealed elevated lead levels in ...",,,,,2026-02-05 23:58:16.538371
,,2026-02-06 02:43:49+00:00,www.fox23.com,"In Depth: FOX23 speaks with EPA Regional Administrator over Oklahoma, Texas",,,,,,https://www.fox23.com/news/in-depth-fox23-speaks-with-epa-regional-administrator-over-oklahoma-texas/video_c0c56589-57bc-5621-85b2-4d7f73ae308b.html,FOX23 speaks with the Environmental Protection Agency (EPA) Regional Administrator over Oklahoma and Texas about how the Trump administration is dealing with pollution and focusing less on green energy and,,https://bloximages.chicago2.vip.townnews.com/fox23.com/content/tncms/assets/v3/editorial/c/0c/c0c56589-57bc-5621-85b2-4d7f73ae308b/6985724040d11.image.jpg?crop=1280%2C672%2C0%2C23&resize=1200%2C630&order=crop%2Cresize,,,2026-02-05 23:58:16.538371
,,2026-02-06 01:57:13+00:00,DVIDS,"NCTF-RH continues community outreach, joined by University of Hawaii, EPA at December open house",,,,,,https://www.dvidshub.net/news/557573/nctf-rh-continues-community-outreach-joined-university-hawaii-epa-december-open-house,"HONOLULU – Navy Closure Task Force – Red Hill (NCTF-RH) continued proactive community engagement efforts in December and was joined by the University of Hawaii (UH) and Environmental Protection Agency (EPA) for its final open house of 2025. In accordance with the EPA-approved community engagement plan, NCTF-RH held its quarterly open house at the Oahu Veterans Center, Dec. 11.",,https://cdn.dvidshub.net/images/dvids_logo.svg,,,2026-02-05 21:59:32.745061
,,2026-02-06 01:36:27+00:00,www.youtube.com,"In Depth: FOX23 talks unedited with EPA Regional Administrator over Oklahoma, Texas",,,,,,https://www.youtube.com/watch%3Fv%3DUDjE_hDe5PE,FOX23 talks unedited with the Environmental Protection Agency (EPA) Regional Administrator over Oklahoma and Texas about how the Trump ...,,,,,2026-02-05 21:59:32.745061
,Costs & Impacts,2026-02-06 01:35:39+00:00,www.youtube.com,"EPA takes aim at Tijuana sewage crisis, Zeldin returns to San Diego County - YouTube",,,,,,https://www.youtube.com/watch%3Fv%3D76_rOFfLa58,EPA Administrator Lee Zeldin spoke on Thursday from San Diego County. He discussed the decades-old Tijuana sewage crisis that has remained a ...,,,,,2026-02-06 01:58:16.803829
,,2026-02-06 01:35:38+00:00,hptx.org,"Backflow Prevention Program | Highland Park, TX - Official Website",,,,,,https://hptx.org/1043/Backflow-Prevention-Program,... protect against the contamination of the public water supply. This is in accordance with the U.S. Environmental Protection Agency Federal Clean ...,,,,,2026-02-06 12:04:58.193340
,,2026-02-06 00:38:05+00:00,www.instagram.com,"In an interview with the General Manager, Lagos State Environmental Protection ... - Instagram",,,,,,https://www.instagram.com/reel/DUY3r8qjHzQ/,"lagosgisttv on February 5, 2026: ""In an interview with the General Manager, Lagos State Environmental Protection Agency (LASEPA), Dr. Babajide ...",,,,,2026-02-05 20:59:44.100594
,,2026-02-06 00:38:04+00:00,www.instagram.com,"The Lagos State Environmental Protection Agency (LASEPA), in collaboration with ... - Instagram",,,,,,https://www.instagram.com/reel/DUYz8-jjI5B/,"lagosgist_ on February 5, 2026: ""The Lagos State Environmental Protection Agency (LASEPA), in collaboration with Ororo Waste Management and Shell ...",,,,,2026-02-05 20:59:44.100594
,Costs & Impacts,2026-02-06 00:13:47+00:00,inewsource,EPA's Lee Zeldin visits Coronado to discuss Tijuana River sewage,,,,,,https://inewsource.org/2026/02/05/zeldin-epa-coronado-tijuana-sewage/,EPA Administrator Lee Zeldin visited San Diego County Thursday to talk to politicians and business owners about the Tijuana sewage crisis.,,https://inewsource.org/wp-content/uploads/2026/02/Lee-Zeldin.jpg,,,2026-02-05 21:59:32.745061
,Costs & Impacts,2026-02-05 23:38:31+00:00,Inside Climate News,"Under Trump, EPA’s Enforcement of Environmental Laws Collapses, Report Finds - Inside Climate News",,,,,,https://insideclimatenews.org/news/05022026/trump-epa-polluter-enforcement-collapses/,Analysis of federal data by a nonprofit watchdog group found that the U.S. Environmental Protection Agency has drastically pulled back on holding polluters accountable.,,https://insideclimatenews.org/wp-content/uploads/2026/02/GettyImages-2258531108.jpg,,,2026-02-05 20:59:44.100594
,Opposition & Allies,2026-02-05 23:31:47+00:00,subscriber.politicopro.com,"E&E News: Zeldin to LA: If you want wildfire recovery money, ditch Newsom",,,,,,https://subscriber.politicopro.com/article/eenews/2026/02/05/zeldin-to-la-if-you-want-wildfire-recovery-money-ditch-newsom-ee-00766528,The EPA administrator said that wildfire-scarred local governments might have better success in unlocking federal dollars if they abandoned the governor's $33 billion aid request.,,https://static.politico.com/37/41/831d7c2d4bc98d5a2ff3b3bc5e2c/https-delivery-gettyimages.com/downloads/2231529607,,,2026-02-05 19:01:29.116864
,,2026-02-05 23:16:56+00:00,Department of Environmental Conservation,Governor Hochul and DEC Announce 2026 Free Freshwater Fishing Days in New York,,,,,,https://dec.ny.gov/news/press-releases/2026/2/governor-hochul-and-dec-announce-2026-free-freshwater-fishing-days-in-new-york,"Department of Environmental Conservation Commissioner Amanda Lefton said, “A wide variety of sport fish are thriving in thousands of freshwater lakes, ...",,,,,2026-02-05 21:59:32.745061
,Costs & Impacts,2026-02-05 23:06:46+00:00,lailluminator.com,"Cameron pipeline blast shows why local air monitoring is needed, environmental group says",,,,,,https://lailluminator.com/2026/02/05/cameron-pipeline-blast/,Most community environmental groups do not have the resources needed to purchase EPA-approved monitoring equipment. “It puts communities in a very ...,,,,,2026-02-05 20:59:44.100594
,Costs & Impacts,2026-02-05 22:44:21+00:00,www.bbc.com,Lebanon says Israel sprayed southern villages with concentrated herbicide,,,,,,https://www.bbc.com/news/articles/cgez359nd72o,Israel declines to comment on the allegation its planes sprayed glyphosate over an area with extensive farmland.,,https://ichef.bbci.co.uk/news/1024/branded_news/9dd8/live/9588fd30-0278-11f1-b5e2-dd58fc65f0f6.jpg,,,2026-02-05 20:59:44.100594
,,2026-02-05 22:29:13+00:00,The American Prospect,DOGE Lives On Through Russell Vought,,,,,,https://prospect.org/2026/02/05/doge-russell-vought-elon-musk-office-management-budget/,Trump’s White House OMB director has quietly institutionalized the government demolition agenda set in motion by Elon Musk’s wrecking crew.,,https://i0.wp.com/prospect.org/wp-content/uploads/2026/02/RDP-020526.jpg?fit=2000%2C1333&ssl=1,,,2026-02-05 21:59:32.745061
,,2026-02-05 22:22:57+00:00,JD Supra,EPA Draft Risk Calculation of Formaldehyde Marks Potential Shift in Regulatory Priorities | JD Supra,,,,,,https://www.jdsupra.com/legalnews/epa-draft-risk-calculation-of-6921780/,"Companies using formaldehyde in their manufacturing processes, and those that sell products incorporating formaldehyde-containing components from...",,https://jdsupra-static.s3.amazonaws.com/profile-images/og.12205_2644.jpg,,,2026-02-05 19:01:29.116864
,Opposition & Allies,2026-02-05 22:13:43+00:00,United Church of Christ,Congress Rebukes Trump (after Advocates Exercise Hope),,,,,,https://www.ucc.org/congress-rebukes-trump-after-advocates-exercise-hope/,Congress Rebukes Trump (after Advocates Exercise Hope),,http://www.ucc.org/wp-content/uploads/2020/10/wfj-socialmedia.jpg,,,2026-02-05 20:59:44.100594
,,2026-02-05 22:09:14+00:00,American Soybean Association,Agriculture Groups Urge EPA to Uphold Science-Based Pesticide Review Process - American Soybean Association,,,,,,https://soygrowers.com/news-releases/agriculture-groups-urge-epa-to-uphold-science-based-pesticide-review-process/,"A coalition of leading agricultural organizations today sent a letter to Lee Zeldin, Administrator of the U.S. Environmental Protection Agency (EPA),",,,,,2026-02-05 18:00:56.301271
,,2026-02-05 22:07:54+00:00,www.spglobal.com,"Metropolitan St. Louis Sewer District, MO Series | S&P Global Ratings",,,,,,https://www.spglobal.com/ratings/en/regulatory/article/-/view/type/HTML/id/3513781,... environmental risk from sewer overflows that resulted in the U.S. Environmental Protection Agency (EPA) consent decree. Despite infiltration and ...,,,,,2026-02-05 20:59:44.100594
,Clean Air & Water,2026-02-05 22:05:07+00:00,www.cbs8.com,EPA Administrator Lee Zeldin to visit San Diego Thursday | cbs8.com,,,,,,https://www.cbs8.com/video/news/epa-administrator-lee-zeldin-to-visit-san-diego-thursday/509-b2a82a26-6010-4cb3-a7fb-4bf11fdc21a5,U.S. Environmental Protection Agency Administrator Lee Zeldin will visit San Diego Thursday to discuss the Tijuana. x. KFMB. To stream CBS 8 on your ...,,,,,2026-02-05 19:01:29.116864
,EPA Rollbacks,2026-02-05 21:58:42+00:00,www.instagram.com,The Trump administration's EPA has proposed a new rollback of the Clean Water Act ... - Instagram,,,,,,https://www.instagram.com/p/DUY3fkNEjcd/,"For more than 50 years, the law has protected drinking water, wetlands, streams, wildlife, and communities from pollution and flooding. This new ...",,,,,2026-02-05 22:59:36.372239
,Costs & Impacts,2026-02-05 21:55:51+00:00,www.facebook.com,South Bay sewage crisis | The Administrator of the Environmental Protection Agency will meet with elected officials to talk about solutions. | CBS 8 San Diego,,,,,,https://www.facebook.com/News8/videos/meeting-on-south-bay-sewage-crisis-thursday/894809739961252/,South Bay sewage crisis | The Administrator of the Environmental Protection Agency will meet with elected officials to talk about solutions.,,https://scontent-iad3-1.xx.fbcdn.net/v/t15.5256-10/629285252_1331988042069783_6619952116489059239_n.jpg?_nc_cat=102&ccb=1-7&_nc_sid=596eb7&_nc_ohc=jeUUDvaKrRMQ7kNvwFVBI3i&_nc_oc=AdlQOyAAl7bI8uyD7RzjeOB9sklPOUOrkoQvtqOWL4B089ysvas2S5a1kKuGmFfphkOvyxjOq9PlKqGXkrYz8As8&_nc_zt=23&_nc_ht=scontent-iad3-1.xx&_nc_gid=5f3K12it8b_MjAm0iVzg-g&oh=00_AfttR0yR4p3nurszegI1FdIsG2oUXy7-Y8btCQ2SihB_rA&oe=698B3F00,,,2026-02-05 22:59:36.372239
,,2026-02-05 21:50:10+00:00,SRN News,US environmental enforcement by Trump's EPA drops to record low - SRN News,,,,,,https://srnnews.com/us-environmental-enforcement-by-trumps-epa-drops-to-record-low/,"WASHINGTON, Feb 5 (Reuters) – Federal enforcement action against polluting companies in the U.S. fell to a historic low in 2025, the first year of President Donald Trump’s second term, according to a report released on Thursday. Just 16 complaints were filed in civil court by the Justice Department on behalf of the Environmental Protection […]",,https://www.srnnews.com/media/2026/02/17703147295173759vlDumNYam.jpg?x88125,,,2026-02-05 20:59:44.100594
,Opposition & Allies,2026-02-05 21:30:24+00:00,waterkeeper.org,Tell EPA to Let States and Tribes Protect Their Own Water Quality! - Waterkeeper Alliance,,,,,,https://waterkeeper.org/news/tell-epa-to-let-states-and-tribes-protect-their-own-water-quality/,"The U.S. Environmental Protection Agency (EPA) has announced plans to weaken Section 401 of the Clean Water Act, a critical safeguard that allows ...",,,,,2026-02-05 17:01:16.080684
,North Carolina,2026-02-05 21:25:14+00:00,thebedfordcitizen.org,Air Force Base Restoration Team Provides Updates on Remediation Efforts - The Bedford Citizen,,,,,,https://thebedfordcitizen.org/2026/02/air-force-base-restoration-team-provides-updates-on-remediation-efforts/,"In 2021, an agreement was reached between the Air Force, EPA, and Massachusetts Department of Environmental Protection to proceed with activities ...",,,,,2026-02-05 20:59:44.100594
,,2026-02-05 21:12:42+00:00,Steptoe,EPA Issues Final Guidance on Endangered Species Act Reviews for Antimicrobial Pesticides,,,,,,https://www.steptoe.com/en/news-publications/epa-issues-final-guidance-on-endangered-species-act-reviews-for-antimicrobial-pesticides.html,"On December 31, the US Environmental Protection Agency (EPA) issued final guidance describing how the Agency will conduct Endangered Species Act (ESA) assessments for antimicrobial pesticides. The gui...",,https://www.steptoe.com/a/web/173755/3ZEKXR/steptoe_og.jpg,,,2026-02-05 20:59:44.100594
,,2026-02-05 21:09:03+00:00,www.facebook.com,"FOX - U.S. Environmental Protection Agency (EPA) Administrator Lee Zeldin joined FOX 5 for an in-depth interview regarding the ongoing Tijuana River sewage crisis. Following a personal tour of the South Bay International Wastewater Treatment Plant and the U.S.-Mexico border, the Administrator addresses the decades-long pollution issue.  https://fox5sandiego.com/video/epa-administrator-responds-to-tijuana-river-crisis/11494803/ | Facebook",,,,,,https://www.facebook.com/fox5sandiego/photos/us-environmental-protection-agency-epa-administrator-lee-zeldin-joined-fox-5-for/1476564410735238/,U.S. Environmental Protection Agency (EPA) Administrator Lee Zeldin joined FOX 5 for an in-depth interview regarding the ongoing Tijuana River sewage crisis. Following a personal tour of the South...,,https://scontent-iad3-1.xx.fbcdn.net/v/t39.30808-6/627156444_1476564420735237_8324332493234023284_n.jpg?stp=dst-jpg_p240x240_tt6&_nc_cat=109&ccb=1-7&_nc_sid=27488d&_nc_ohc=LkPS7HNnfTMQ7kNvwGEY5iM&_nc_oc=AdnLGzSZPQ-LUwoR-ACNyjMcfBE4BkwZAd65RSo8-q8rls7l_XUCitFvtFSvdHAmyzPeC15gGsh595g9N-24B5aZ&_nc_zt=23&_nc_ht=scontent-iad3-1.xx&_nc_gid=ldhXprvDjg8LLqWzKk1bHw&oh=00_AfslGZM2swriBw4jSb09DVF6RcqVUX3ZW7r8j2P2Utqgfw&oe=698AF450,,,2026-02-05 17:01:16.080684
,Opposition & Allies,2026-02-05 20:50:56+00:00,Conduit Street,Counties Defend Local Oversight of Proven Drinking Water Safety Best Practices,,,,,,https://conduitstreet.mdcounties.org/2026/02/05/counties-defend-local-oversight-of-proven-drinking-water-safety-best-practices/,"On February 4, Director of Intergovernmental Relations Dominic Butchko submitted written testimony to the Environment and Transportation Committee in",,https://i0.wp.com/conduitstreet.mdcounties.org/wp-content/uploads/MACo-Testimony.jpg?fit=1200%2C628&ssl=1,,,2026-02-05 20:59:44.100594
,,2026-02-05 20:49:32+00:00,Governing,Illinois Becomes First State to Recognize ‘Rewilding’ Wetland Protection ,,,,,,https://www.governing.com/policy/illinois-becomes-first-state-to-recognize-rewilding-wetland-protection,"As federal safeguards erode, state lawmakers are laying the groundwork for restoring and protecting wetlands left vulnerable by Clean Water Act rollbacks.",,https://erepublic.brightspotcdn.com/dims4/default/45f78ea/2147483647/strip/true/crop/3000x1458+0+271/resize/1440x700!/quality/90/?url=http%3A%2F%2Ferepublic-brightspot.s3.us-west-2.amazonaws.com%2Fe9%2F0a%2F8d7fe0574ad1acd3ce33f2ff3109%2Fus-news-env-ill-rewilding-law-tb.jpg,,,2026-02-05 18:00:56.301271
,Costs & Impacts,2026-02-05 20:22:43+00:00,CareQuest Institute,Fluoride at a Crossroads: What the EPA’s New Review Means — and Why It Matters - CareQuest Institute,,,,,,https://carequest.org/fluoride-at-a-crossroads-what-the-epas-new-review-means-and-why-it-matters/,"The US Environmental Protection Agency (EPA) announced it will open a new, off-cycle evidence review of fluoride in drinking water — a move that comes amid increasing political pressure, growing state-level activity, and heightened public attention to community water fluoridation (CWF). Decades of research show that CWF is a safe, effective, and cost-saving public health […]",,https://carequest.org/wp-content/uploads/2026/02/iStock-1461453182-scaled.jpg?wsr,,,2026-02-05 18:00:56.301271
,,2026-02-05 20:04:45+00:00,iowacapitaldispatch.com,"Renewable fuels summit celebrates progress, stresses need for new markets",,,,,,https://iowacapitaldispatch.com/2026/02/05/renewable-fuels-summit-celebrates-progress-stresses-need-for-new-markets/,... Environmental Protection Agency authorized the year-round sale of E15. What is E15? E15 is fuel blend with 15% ethanol. This is a higher ...,,,,,2026-02-05 18:00:56.301271
,Clean Air & Water,2026-02-05 19:41:48+00:00,US EPA,Email Subscriptions for Regional News | US EPA,,,,,,https://www.epa.gov/newsroom/forms/email-subscriptions-regional-news,Sign up to receive news releases and other information from EPA Regional offices.,,https://www.epa.gov/system/files/images/2022-03/epa-standard-twitter.jpg,,,2026-02-05 18:00:56.301271
,EPA Rollbacks,2026-02-05 19:41:46+00:00,JD Supra,Winds of Change: EPA Takes Measures to Roll Back the Clean Air Act’s ‘Good Neighbor Rule’ | JD Supra,,,,,,https://www.jdsupra.com/legalnews/winds-of-change-epa-takes-measures-to-9754984/,"The Environmental Protection Agency has taken measures to roll back the “good neighbor” rule, which limits smokestack emissions affecting downwind...",,https://jdsupra-static.s3.amazonaws.com/profile-images/og.16177_1251.png,,,2026-02-05 16:00:42.787392
