id,name,published,outlet,title,authors,category,market,categoryorder,articleorder,url,description,text,image,error,sentiment,firstEyes
,,2026-02-04 20:35:20+00:00,www.michigan.gov,Annual report shows progress toward MI Healthy Climate Plan goals,,,,,,https://www.michigan.gov/egle/newsroom/mi-environment/2026/02/04/2025-mhcp,The 2025 MI Healthy Climate Plan Report provides a snapshot of how Michigan is leveraging resources to turn forward-thinking ambition into everyday action.,,https://www.michigan.gov/egle/-/media/Project/Websites/egle/Images/EGLE-Logos/Social.jpg?rev=fa9af8ebc6cc48f4ab7777c144d928b5&hash=AD089C78988ABC2E4DD23E2D36B9B8E6,,,2026-02-04 20:59:31.570195
,,2026-02-04 20:06:36+00:00,westmont.illinois.gov,"County Waterways Input Requested • Westmont, IL",,,,,,https://westmont.illinois.gov/m/newsflash/Home/Detail/2306,"Included within this partnership, the Illinois Environmental Protection Agency granted DuPage County Stormwater Management a countywide permit to meet ...",,,,,2026-02-04 16:00:28.543547
,,2026-02-04 20:06:09+00:00,www.wabe.org,Chattahoochee Riverkeeper and City of Atlanta settle Clean Water Act lawsuit - WABE,,,,,,https://www.wabe.org/chattahoochee-riverkeeper-and-city-of-atlanta-settle-clean-water-act-lawsuit/,"Clayton wastewater treatment plant. On average, CRK said E. coli levels were 340 times higher than the U.S. Environmental Protection Agency's ...",,,,,2026-02-04 17:02:34.585845
,Costs & Impacts,2026-02-04 19:59:18+00:00,www.instagram.com,"Friday's jet fuel spill at the Atlanta airport released an estimated 10,000 gallons of oil into the ...",,,,,,https://www.instagram.com/p/DUWQzk_CPpn/,Griffin officials said they were notified Friday of a fuel spill near Hartsfield-Jackson Atlanta International Airport that reached the Flint River. “ ...,,,,,2026-02-04 20:59:31.570195
,,2026-02-04 19:32:46+00:00,U.S. Department of the Treasury,"Minutes of the Meeting of the Treasury Borrowing Advisory Committee February 3, 2026",,,,,,https://home.treasury.gov/news/press-releases/sb0386,"The Committee convened in a closed session at the Department of the Treasury at 9:00 a.m.  All members except Jill Funk and Anastasia Titarchuk were present.  Rudy Gopinath from Citigroup was also present to assist the Committee Chair.  Director of Policy & Planning Hunter McMaster, Deputy Assistant Secretary for Federal Finance Brian Smith, Director of the Office of Debt Management Fred Pietrangeli, and Deputy Director of the Office of Debt Management Tom Katzenbach welcomed the Committee.  Other members of Treasury staff present were Abigail Brown, Chris Cameron, Dave Chung, Gabriella Csepe, Chris Furey, Liang Jensen, Gavin Ross, Joshua Stachura, Nick Steele, and Renee Tang.  Federal Reserve Bank of New York staff members Ellen Correia Golay, Oliver Giannotti, and Trevor Graney were also present. Deputy Assistant Secretary Smith opened the meeting by thanking outgoing member Gagan Singh for his service to the Committee and summarizing recent debt management developments.  Following his remarks, Treasury counsel presented the annual review of Committee guidelines.Director of the Office of Fiscal Projections Steele highlighted changes in receipts and outlays during Q1 FY2026.  Within receipts, Steele emphasized a 315% (or $71 billion) increase in customs deposits reflecting higher tariff revenue, as well as growth in both withheld (+$47 billion) and non-withheld (+$45 billion) taxes.  Somewhat offsetting these gains, corporate taxes declined by 23% (or $27 billion), likely because corporate tax provisions in the OBBB that allow for accelerated expensing and depreciation.  In terms of outlays, Steele noted that the largest increase occurred at Treasury, which rose by 13% (or $48 billion), primarily due to interest on the public debt. Department of Education outlays decreased by 26% (or $11 billion), while a group of other outlays fell by 64% (or $68 billion), primarily due to a reduction in disbursements by the Environmental Protection Agency and the Federal Emergency Management Agency. Director Pietrangeli then turned to deficit and privately-held net marketable borrowing projections, noting that the median primary dealer reduced its aggregate FY2026-28 privately-held marketable borrowing estimate by $258 billion.  The latest dealer estimates show that, at current issuance sizes, Treasury is slightly overfunded in FY2026.  However, looking ahead, the median primary dealer forecast for privately-held net marketable borrowing implies a $1.1 trillion funding shortfall in FY2027-28 based on current coupon auction sizes and bill supply. Deputy Director Katzenbach reviewed primary dealers’ expectations for coupon issuance.  The consensus remains that current coupon auction sizes leave Treasury well-positioned to meet its projected financing needs through FY2026, with changes in Treasury bill supply likely being adequate to address any changes in financing needs.  Respondents cited the Federal Reserve’s anticipated purchases of Treasury bills as supportive of demand in that sector of the market.  Dealers anticipate that nominal coupon auction sizes might next increase in late CY2026 or early CY2027.Debt Manager Jensen then summarized primary dealers’ views on Secured Overnight Financing Rate (SOFR)-indexed floating rate notes (FRNs).  The consensus was that the SOFR FRN market has expanded rapidly in the last five years, with demand focused primarily on money market mutual funds (MMFs) but also including bank treasury portfolios and foreign investors.  Most dealers expressed support for Treasury issuing SOFR-indexed FRNs.  Supporters argued that a Treasury SOFR FRN would diversify Treasury’s front-end issuance mix and potentially reduce funding costs, given the strong incremental demand.  Some dealers emphasized the risk of potentially cannibalizing demand for Treasury bills and for the existing 2-year Treasury FRN, while several dealers cautioned that Treasury could be exposed to spikes in SOFR during periods of funding market stress.  Most dealers pointed to a 1-year final maturity as particularly attractive in meeting demand from MMFs.  The Committee briefly discussed the feedback from dealers and the pros and cons of Treasury issuing a SOFR-linked FRN, and concluded that Treasury should study the idea further. Debt Manager Ross reviewed primary dealers’ thoughts on potential alternative buyback execution mechanisms.  Dealers noted that off-the-run Treasury securities typically trade on a yield spread basis relative to on-the-run benchmarks in the secondary market, and that exchange transactions are a well-established market practice. Allowing yield spread offers in buyback operations could attract broader participation among market participants, leading to more competitively priced offers in buyback operations. Exchange operations are viewed as marginally beneficial, but the impact would vary across market participants. While many dealers and certain leveraged investors may prefer some form of an exchange transaction due to their typical trading strategies, real-money investors could prefer outright cash transactions. From a Treasury supply perspective, exchanges would have a more neutral effect on the outstanding duration and the weighted average maturity of Treasury’s debt portfolio. However, they would also reduce Treasury’s flexibility in financing buybacks and result in changes to the supply of on-the-run securities. It is important to note that while Treasury values the feedback of market participants, either of these changes would require further exploration of key design details and significant time and effort to implement. Debt Manager Stachura then summarized primary dealers’ feedback on the potential to issue 7-year notes quarterly with two reopenings instead of a monthly new issue. Most dealers were supportive of this proposal, expecting it would improve liquidity in the secondary market, especially as the securities aged. Dealers estimated that billions of dollars in balance sheet space could be unlocked for intermediation under such a proposal. The potential impact on repo and futures markets was seen as largely benign. The Committee then discussed the first charge, addressing bill purchases and the consolidated balance sheet.  The presenter noted that the concept of a consolidated balance sheet between the Federal Reserve and Treasury was previously addressed in a February 2020 Committee presentation. The Committee then discussed the circumstances where Treasury should focus on the composition of privately-held Treasury debt outstanding or the composition of total debt outstanding.  The presenter reviewed the key elements of the Federal Reserve’s balance sheet, and how they alter effective interest rate risk when considered on a consolidated basis. The presenter noted that, in the current environment, it would be reasonable for Treasury to meet some portion of the Federal Reserve’s System Open Market Account (SOMA) demand for Treasury bills through increased issuance in this sector of the curve.  The presentation also discussed how the results of the Committee’s optimal debt issuance model might change when separating the interest-bearing and non-interest-bearing components.  Lastly, the presenter advised that Fed policy inflection points are relevant times to consider the composition of privately-held Treasury securities when making issuance decisions. The Committee adjourned at 11:45 a.m. for lunch.The Committee reconvened at 1:15 p.m. The Committee then discussed the second charge, which addressed trends in demand for Treasury securities.  The presenter highlighted several structural shifts shaping demand, including runoff from SOMA, growth in MMF assets, expanding bank portfolios, evolving pension plan structures, increasing Treasury holdings by foreign private investors, and potential demand associated with stablecoins.  The discussion also covered key considerations—such as collateral needs, duration management, diversification benefits, and central bank reserve management—that are influencing Treasury allocations in portfolios.  The presenter concluded by describing how incremental demand for Treasuries might evolve going forward, noting that the short and intermediate sectors of the curve were likely to experience the broadest growth. Finally, the Committee turned to its financing recommendation for the upcoming quarters and unanimously recommended that Treasury maintain nominal coupon, FRN, and TIPS auction sizes at current levels. The Committee adjourned at 2:20 p.m.The Committee reconvened at 3:00 p.m.The Chair summarized key elements of the Committee report for Secretary Bessent and followed with a discussion of recent market developments. The Committee adjourned at 3:55 p.m. _________________________________Brian SmithDeputy Assistant Secretary for Federal Finance United States Department of the TreasuryFebruary 3, 2026 Certified by:_________________________________Deirdre Dunn, ChairTreasury Borrowing Advisory CommitteeFebruary 3, 2026 Treasury Borrowing Advisory Committee Quarterly MeetingCommittee Charge – February 3, 2026Fiscal OutlookTaking into consideration Treasury's short, intermediate, and long-term financing requirements, as well as the variability in financing needs from quarter to quarter, what changes, if any, do you recommend to Treasury issuance?  Please also provide perspectives regarding market expectations for Treasury issuance, the effects of changes in SOMA holdings, the evolution of Treasury holdings by different types of investors, as well as auction calendar construction.Bill Purchases and the Consolidated Balance SheetIn December 2025, the Federal Reserve began purchasing Treasury bills through open market operations in order to reinvest principal payments on its holdings of agency mortgage-backed securities as well as maintain an ample supply of reserves on an ongoing basis. Building on previous work, including the TBAC presentation from February 2020 and analyses of the effect of Federal Reserve holdings on the maturity profile and timing of rate resets for the “consolidated” balance sheet, please assess to what extent Treasury issuance plans should be affected by expected Federal Reserve purchases of Treasury securities.  When evaluating its issuance mix, in what circumstances should Treasury focus on the composition of a) only privately-held Treasury securities or b) total Treasury debt outstanding (including holdings of the Federal Reserve System Open Market Account).Investor TrendsPlease discuss recent developments in investor demand for Treasury securities.  How do you expect structural demand for different Treasury products and tenors to evolve over the next several years?  What are the most promising sources of potential additional demand (either from new investors or additional demand from existing investors)?  What factors are most important in affecting demand from different investor types? Financing this QuarterWe would like the Committee’s advice on the following:The composition of Treasury notes and bonds to refund approximately $90.2 billion of privately-held notes and bonds maturing on February 15, 2026.The composition of Treasury marketable financing for the remainder of the January-March 2026 quarter.The composition of Treasury marketable financing for the April-June 2026 quarter.",,https://home.treasury.gov/system/files/291/treasury-preview-1900x950.jpg,,,2026-02-04 19:01:49.382874
,,2026-02-04 19:13:25+00:00,Deseret News,"Utah proves that population growth doesn't have to pollute the air, according to legislative report",,,,,,https://www.deseret.com/environment/2026/02/03/utah-cut-pollution-despite-population-growth/,Utah has significantly reduced air pollution despite population growth but faces ongoing ozone challenges largely from fuels and chemicals.,,https://www.deseret.com/resizer/v2/A7RLF4IS3BDWDMLFM33SKIXG3Y.JPG?focal=0%2C0&auth=7bc4ccf23db9052583e799c089e9a71d09e4531566961eb221e1d61e428d98ec&width=630,,,2026-02-04 17:02:34.585845
,Costs & Impacts,2026-02-04 19:03:03+00:00,www.wbur.org,Documents confirm ICE plans for N.H. warehouse and show some state workers knew for weeks,,,,,,https://www.wbur.org/news/2026/02/04/ice-new-hampshire-warehouse-processing-detention-plans-documents-boston,"Documents obtained by the ACLU show the Department of Homeland Security planned purchase and transform a vacant warehouse in Merrimack, New Hampshire into a Boston ICE processing center. While the department has refused to confirm plans to local officials, documents show that some state officials were in contact with the federal government about the proposal.  ",,https://wordpress.wbur.org/wp-content/uploads/2026/02/Ice-warehouse-2-1000x700.jpeg,,,2026-02-04 20:59:31.570195
,,2026-02-04 19:02:32+00:00,blogs.illinois.edu,"Summer Internship, Illinois EPA - Des Plaines, IL (due 2/22)",,,,,,https://blogs.illinois.edu/view/6466/826892307,"Work with EPA personnel in Streams & Lakes: Collecting water quality samples; Sampling macroinvertebrates, macrophytes, & fish; Recording discharge ...",,,,,2026-02-04 17:02:34.585845
,,2026-02-04 18:59:05+00:00,OhioHealth O’Bleness Hospital Earns Fourth ENERGY STAR® Certification for Energy Efficiency Excellence ,OhioHealth O’Bleness Hospital Earns Fourth ENERGY STAR® Certification for Energy Efficiency Excellence,,,,,,https://newsroom.ohiohealth.com/ohiohealth-obleness-hospital-earns-fourth-energy-star-certification-for-energy-efficiency-excellence/,"OhioHealth announced that O’Bleness Hospital in Athens has earned the U.S. Environmental Protection Agency’s (EPA) ENERGY STAR® certification for superior energy performance, marking the fourth time the hospital has received this national recognition. The achievement underscores O’Bleness Hospital’s sustained commitment to responsible e...",,https://content.presspage.com/uploads/1460/1920_o039bleness-210423-65.jpg?10000,,,2026-02-04 14:04:02.306970
,,2026-02-04 18:57:17+00:00,www.food-safety.com,"NASDA’s 2026 Policy Priorities Focus on Pesticides, Animal Diseases, and Farm Bill Food Safety",,,,,,https://www.food-safety.com/articles/11104-nasdas-2026-policy-priorities-focus-on-pesticides-animal-diseases-and-farm-bill-food-safety,"The National Association of State Departments of Agriculture (NASDA) has set its federal policy priorities for 2026. Food safety-related issues are central to NASDA’s Farm Bill, pesticides, and animal diseases and traceability advocacy.",,https://www.food-safety.com/ext/resources/News/2026/NASDA-2026-winter-policy-conference-speaker_NASDA.png?height=635&t=1770230742&width=1200,,,2026-02-04 14:04:02.306970
,Costs & Impacts,2026-02-04 18:46:04+00:00,Flathead Beacon,Kalispell’s Plan to Eliminate PFAS Advances Under DEQ Review - Flathead Beacon,,,,,,https://flatheadbeacon.com/2026/02/04/kalispells-plan-to-eliminate-pfas-advances-under-deq-review/,"In an environmental assessment published in January, Montana Department of Environmental Quality (DEQ) officials found no significant environmental impact in Kalispell’s proposed project to eliminate forever chemicals found in the city’s drinking wells. DEQ is accepting public comment on the assessment until Feb. 8. The city discovered per- and polyfluoroalkyl substances (PFAS) in municipal wells […]",,https://flatheadbeacon.com/wp-content/uploads/2024/06/20240612_KALI_TAPWATER_0053-copy.jpg,,,2026-02-04 17:02:34.585845
,Costs & Impacts,2026-02-04 18:33:32+00:00,Land Line Media,"EPA doubles down on DEF overhaul, demands data from manufacturers",,,,,,https://landline.media/epa-doubles-down-on-def-overhaul-demands-data-from-manufacturers/,"Truckers blame DEF for shutdowns and big repair bills. Now, the EPA wants data from manufacturers that could reshape DEF rules.",,https://landline.media/wp-content/uploads/2026/02/02-04-26-EPA-v-DEF-by-TF-pic.jpg,,,2026-02-04 14:04:02.306970
,Opposition & Allies,2026-02-04 18:27:08+00:00,www.mitchellwilliamslaw.com,Taconite Iron Ore Processing Facilities/Clean Air Act: Natural Resource Defense Council Federal District Court Action Challenging EPA Temporary NESHAP Exemption,,,,,,https://www.mitchellwilliamslaw.com/taconite-iron-ore-processing-facilities/clean-air-act-natural-resource-defense-council-federal-district-court-action-challenging-epa-temporary-neshap-exemption,... Environmental Protection Agency (“EPA”) regarding the Clean Air Act National Emission Standards for Hazardous Air Pollutants (“NESHAP”) for the ...,,https://www.mitchellwilliamslaw.com/images/site/Social_Logo.jpg,,,2026-02-04 17:02:34.585845
,Costs & Impacts,2026-02-04 17:58:01+00:00,WSB-TV Channel 2 - Atlanta,"EPA says 10,000 gallons of jet fuel dumped in Flint River from Hartsfield-Jackson spill",,,,,,https://www.wsbtv.com/news/local/clayton-county/epa-says-10000-gallons-jet-fuel-dumped-flint-river-hartsfield-jackson-spill/OBIEID7CLBDGHEPF4JZHR4CWO4/,Federal contractors are currently working around the clock to decontaminate the Flint River water system.,,https://cmg-cmg-tv-10010-prod.cdn.arcpublishing.com/resizer/v2/https%3A%2F%2Fcloudfront-us-east-1.images.arcpublishing.com%2Fcmg%2FSCM3F37FOVFMTGMI5JAOQSNJQM.jpeg?auth=7a66dd1ca21bbdbd82a279de9f060b9468f9df2b130bf22bc87245e7fe08c10a&width=1200&height=630&smart=true,,,2026-02-04 14:04:02.306970
,Costs & Impacts,2026-02-04 17:42:06+00:00,Earthjustice,Climate Change Is Harming Her Patients. Trump’s Latest Plan Will Make It Worse.,,,,,,https://earthjustice.org/article/climate-change-is-harming-her-patients-trumps-latest-plan-will-make-it-worse,"The administration wants to repeal a key scientific finding on climate change, limiting the government's ability to protect us from climate pollution.",,https://earthjustice.org/wp-content/uploads/2026/01/ap25173629866882_crop_2k-1024x705.jpg,,,2026-02-04 14:04:02.306970
,,2026-02-04 17:28:59+00:00,www.spglobal.com,"Newburgh, IN Series 2026 Sewage Works System Reve | S&P Global Ratings",,,,,,https://www.spglobal.com/ratings/en/regulatory/article/-/view/type/HTML/id/3512593,"... Environmental Protection Agency (EPA) in 2007; each year since, the town has completed its capacity, management, operation, and maintenance update ...",,,,,2026-02-04 13:01:31.615965
,,2026-02-04 17:04:54+00:00,Nature,Linking aerobic scope to fitness in the wild reveals potential opportunities to help recover imperiled salmon populations - Communications Biology,,,,,,https://www.nature.com/articles/s42003-026-09642-7,"A synthesis of respirometry data, telemetry studies, long-term population monitoring, and in situ predator-prey experiments reveals that aerobic scope can circumstantially both limit and facilitate the fitness of imperiled Chinook salmon populations.",,,,,2026-02-04 16:00:28.543547
,Costs & Impacts,2026-02-04 17:02:13+00:00,Law.com Radar,Public Employees For Environmental Responsibility v. U.S. Environmental Protection Agency | Law.com Radar,,,,,,https://www.law.com/radar/card/pm-62942937-public-employees-for-environmental-responsibility-v-us-environmental-protection-agency/,"Environmental Protection Agency - District of Columbia - Government -  - U.S., District of Columbia - 1:26-cv-00314 - Public Employees For Environmental Responsibility v. U.S. Environmental Protection Agency - Public Employees For Environmental Responsibility - Public Employees For Environmental Responsibility - U.S. Environmental Protection Agency - 2026-02-04",,https://www.law.com/assets/css/stylesheets/images/social-share-law-716x372.png,,,2026-02-04 12:08:28.502772
,Opposition & Allies,2026-02-04 16:37:35+00:00,dep.nj.gov,News Releases | Acting DEP Commissioner Potosnak Announces Joseph Seebode ... - NJDEP,,,,,,https://dep.nj.gov/newsrel/26_0008/,Acting Department of Environmental Protection Commissioner Ed Potosnak today announced the appointment of Joseph J. Seebode to the role of Deputy ...,,,,,2026-02-04 13:01:31.615965
,Costs & Impacts,2026-02-04 16:32:07+00:00,www.instagram.com,The EPA will stop considering the cost of lives saved and hospital visits reduced when ... - Instagram,,,,,,https://www.instagram.com/p/DUV8BIYDr6V/,The U.S. Environmental Protection Agency has announced a major change in how it evaluates air pollution regulations.,,,,,2026-02-04 12:08:28.502772
,,2026-02-04 16:29:02+00:00,www.vnf.com,Important Legal and Policy Developments Continue to Reshape Compliance for Motor Vehicle Manufacturers and Fleet Owners and Operators in the U.S.,,,,,,https://www.vnf.com/important-legal-and-policy-developments-continue-to-reshape-compliance-for-motor-vehicle-manufacturers-and-fleet-owners-and-operators-in-the-us,"EPA Partially Disapproves California's Heavy-Duty Inspection and Maintenance Regulation Impacting Fleet Owners and Operators. On January 27, 2026, the ...",,https://www.vnf.com/images/_wbmanaged/29426_wbc_socialimage.jpg,,,2026-02-04 15:02:05.786400
,Opposition & Allies,2026-02-04 16:22:54+00:00,www.californiawaterviews.com,The Impact of Governor Newsom’s Proposed Budget on Water Projects,,,,,,https://www.californiawaterviews.com/the-impact-of-governor-newsoms-proposed-budget-on-water-projects-2026,"Environmental Protection Agency, 598 U.S. 651 (2023). Sackett narrowed federal jurisdiction over “waters of the United States” (also called WOTUS).",,https://www.californiawaterviews.com/assets/images-t1770232276/1012.png,,,2026-02-04 15:02:05.786400
,Costs & Impacts,2026-02-04 16:14:35+00:00,www.hunton.com,"What to Watch For in 2026: A New Wave of PFAS Product Restrictions and Reporting Requirements Go Into Effect, with Many More Expected in 2027 and Beyond",,,,,,https://www.hunton.com/the-nickel-report/what-to-watch-for-in-2026-a-new-wave-of-pfas-product-restrictions-and-reporting-requirements-go-into-effect-with-many-more-expected-in-2027-and-beyond,"US EPA is expected to finalize a rule in June 2026 revising its PFAS reporting rule under the Toxic Substances Control Act (TSCA), which covers PFAS ...",,https://www.hunton.com/the-nickel-report/assets/images-t1770221017/201398.png,,,2026-02-04 12:08:28.502772
,,2026-02-04 16:11:56+00:00,The Herald-Times,"Top climate adviser, former EPA head Gina McCarthy to speak at IU",,,,,,https://www.heraldtimesonline.com/story/news/local/2026/02/04/gina-mccarthy-former-head-of-epa-to-talk-at-indiana-university/88496560007/,"Thursday's talk, ""Advocating for the Environmental as if our Future Depended upon it,"" is free and open to the public",,"https://www.heraldtimesonline.com/gcdn/authoring/authoring-images/2026/02/03/NHEN/88497292007-gina-mc-carthy.jpg?crop=1278,717,x0,y0&width=1278&height=717&format=pjpg&auto=webp",,,2026-02-04 12:08:28.502772
,,2026-02-04 16:00:30+00:00,Wesleyan University,Wesleyan in the News: February 2026,,,,,,https://www.wesleyan.edu/about/news/2026/02/wesleyan-alumni-faculty-news-media-february.html,,,https://www.wesleyan.edu/about/news/2026/02/images/1320-706-witn-feb-26.jpg,,,2026-02-04 15:02:05.786400
,,2026-02-04 16:00:05+00:00,www.epw.senate.gov,Chairman Capito Opening Statement at Hearing to Examine Cybersecurity Challenges ...,,,,,,https://www.epw.senate.gov/public/index.cfm/press-releases-republican%3FID%3D29B9FB8D-51FC-4589-97DF-E11F0CBE726D,"... services are essential to protect public health and provide fundamental services ... “For instance, in 2024 the Environmental Protection Agency ...",,,,,2026-02-04 12:08:28.502772
,Costs & Impacts,2026-02-04 15:53:03+00:00,www.wfmj.com,Lordstown residents summoned to power plant hearing,,,,,,https://www.wfmj.com/story/53422269/lordstown-residents-summoned-to-power-plant-hearing,Lordstown Mayor Jackie Woodward has called for a large community turnout at a public hearing this evening regarding a renewal of a local power plant’s permit.,,https://WFMJ.images.worldnow.com/images/28590158_G.jpeg,,,2026-02-04 16:00:28.543547
