id,name,published,outlet,title,authors,category,market,categoryorder,articleorder,url,description,text,image,error,sentiment,firstEyes
,Costs & Impacts,2025-10-01 05:49:19+00:00,E&E News by POLITICO,"Over 13,000 face furloughs under EPA’s shutdown plan",,,,,,https://www.eenews.net/articles/over-13000-face-furloughs-under-epas-shutdown-plan/,Staffers could also be vulnerable to layoffs as the White House instructed agencies to consider a reduction in force for those deemed nonessential.,,https://static.politico.com/dims4/default/55a1666/2147483647/resize/1200/quality/100/?url=https://static.politico.com/b8/dc/7e082bb843129bb57582737e42f5/trump-fuel-economy-39612.jpg,,,2025-10-01 09:02:28.759741
,,2025-10-01 05:29:21+00:00,www.ktvb.com,"EPA's job is to protect America's air, water and land. Here's how a shutdown affects that effort - KTVB",,,,,,https://www.ktvb.com/article/syndication/associatedpress/epas-job-is-to-protect-americas-air-water-and-land-heres-how-a-shutdown-affects-that-effort/616-1c7a4af8-2f61-47a4-8b82-51c98183d48a,The Environmental Protection Agency faces challenges during a government shutdown. The agency's mission to protect health and the environment is ...,,,,,2025-10-01 02:01:44.827881
,Costs & Impacts,2025-10-01 04:54:02+00:00,The Oxford Eagle,"Oxford Utilities responds to EPA PFAS Standards, begins proactive measures - The Oxford Eagle",,,,,,https://oxfordeagle.com/2025/09/30/oxford-utilities-responds-to-epa-pfas-standards-begins-proactive-measures/,"For more than 100 years, the city of Oxford and Oxford Utilities have provided safe drinking water and that mission continues. That is accomplished by being in compliance with regulatory requirements set by the Mississippi Department of Health, the Mississippi Department of Environmental Quality and the U.S. Environmental Protection Agency. Per- and polyfluoroalkyl substances (PFAS) […]",,https://oxfordeagle.com/wp-content/uploads/sites/38/2024/02/2.21-high-bills.jpg,,,2025-10-01 02:01:44.827881
,,2025-10-01 04:14:16+00:00,www.socialexplorer.com,Air Quality System (AQS) - Social Explorer,,,,,,https://www.socialexplorer.com/home/dataset-entry/air-quality-system-aqs,"EPA regulations require state environmental agencies to report air monitoring data at least quarterly, with data for a given calendar quarter due by ...",,,,,2025-10-01 05:02:23.492000
,Costs & Impacts,2025-10-01 02:32:53+00:00,Congresswoman Jan Schakowsky,Government Shutdown Information,,,,,,https://schakowsky.house.gov/government-shutdown-information-0,"I want to inform you directly that, as of midnight on September 30, 2025, the federal government has entered a shutdown. Republicans control the entire federal government — the Presidency, the Senate, and the House. This is an utter failure of Republican leadership — it will substantially impact our communities and our economy and will drive up health care costs for millions of people.",,,,,2025-09-30 22:58:48.506554
,Costs & Impacts,2025-10-01 02:11:59+00:00,JD Supra,Minnesota’s Proposed PFAS Reporting Rules Are Disapproved for Procedural and Substantive Deficiencies | JD Supra,,,,,,https://www.jdsupra.com/legalnews/minnesota-s-proposed-pfas-reporting-5155916/,We’ve been following Minnesota’s proposed PFAS-in-products reporting rules for the past several months. As part of the rulemaking process under the...,,https://jdsupra-static.s3.amazonaws.com/profile-images/og.15673_4521.jpg,,,2025-10-01 02:01:44.827881
,,2025-10-01 02:11:00+00:00,thelansingjournal.org,Illinois Electric Vehicle Rebate Program application cycle to open Oct. 28,,,,,,https://thelansingjournal.org/2025/09/30/illinois-electric-vehicle-rebate-program-application-cycle-to-open-october-28/,"Illinois EPA announces updates to the program. INFORMATION PROVIDED BY THE ILLINOIS ENVIRONMENTAL PROTECTION AGENCY. Springfield, Ill. – Illinois ...",,,,,2025-09-30 22:58:48.506554
,Costs & Impacts,2025-10-01 01:45:04+00:00,www.washingtonpost.com,Here's why one industry is worried about Trump's latest climate rollback - The Washington Post,,,,,,https://www.washingtonpost.com/climate-environment/2025/09/30/hydrofluorocarbons-climate-epa-rule-refrigerators/,"The Environmental Protection Agency said Tuesday it would rewrite a Biden-era rule aimed at limiting hydrofluorocarbons, a potent greenhouse gas.",,,,,2025-09-30 22:58:48.506554
,,2025-10-01 01:32:12+00:00,Yahoo Finance,"While Tesla Is Warning Trump, These Two Rivals Are Quietly Hitting Fresh Highs On Wall Street As EPA Seeks To Repeal 2009 Endangerment Finding",,,,,,https://finance.yahoo.com/news/while-tesla-warning-trump-two-233046658.html,"As Tesla Inc. (NASDAQ:TSLA) recently urged the Trump administration against repealing the 2009 Endangerment Finding, the EV giant's rivals are nearing record highs in pre-market. What Happened: Tesla's two Detroit-based rivals’ stock is performing ...",,https://media.zenfs.com/en/benzinga_79/e6971d60b6de05b671803e13a83ca2ce,,,2025-09-30 23:59:19.905329
,,2025-10-01 01:01:59+00:00,Los Angeles Times,California needs biomass energy to meet its wildfire goals. Its projects keep going South,,,,,,https://www.latimes.com/environment/story/2025-09-30/california-wants-biomass-energy-its-projects-keep-going-south,California needs to burn vegetation both for wildfire mitigation and to generate power. So why do biomass energy projects keep leaving the state?,,https://ca-times.brightspotcdn.com/dims4/default/bba8e55/2147483647/strip/true/crop/3000x1575+0+235/resize/1200x630!/quality/75/?url=https%3A%2F%2Fcalifornia-times-brightspot.s3.amazonaws.com%2F4c%2F22%2Fd0681eeb432e9d7c0f9d2c6c1a81%2F1516003-enviro-new-carbon-capture-tech-02-mjc.jpg,,,2025-09-30 22:58:48.506554
,EPA Rollbacks,2025-10-01 00:51:42+00:00,JD Supra,"While Vacating Drinking Water Standards for Some PFAS, the EPA Retains Other Biden-Era PFAS Regulations | JD Supra",,,,,,https://www.jdsupra.com/legalnews/while-vacating-drinking-water-standards-1745636/,"On Sept. 11, 2025, the U.S. Environmental Protection Agency announced in a court filing that it was moving to partially vacate its National Primary...",,https://jdsupra-static.s3.amazonaws.com/profile-images/og.16364_5428.gif,,,2025-09-30 22:00:45.882693
,EPA Rollbacks,2025-10-01 00:49:59+00:00,www.nytimes.com,Trump Administration Moves to Relax Rules on Hydrofluorocarbons - The New York Times,,,,,,https://www.nytimes.com/2025/09/30/climate/trump-hydrofluorocarbons-hfcs.html,"The E.P.A. plan would allow grocery stores, air-conditioning manufacturers and others to phase out hydrofluorocarbons in cooling equipment more ...",,,,,2025-09-30 22:00:45.882693
,,2025-10-01 00:39:51+00:00,Government Executive,"Just 23% of fed workers would be furloughed if the government shuts down, under the Trump administration’s plan",,,,,,https://www.govexec.com/workforce/2025/09/just-23-fed-workers-would-be-furloughed-if-government-shuts-down-under-trump-administrations-plan/408505/,"Several agencies plan to keep more employees working than usual, leading to fewer workers being sent home.",,https://cdn.govexec.com/media/img/cd/2025/09/30/09302025VoughtShutdown/open-graph.jpg,,,2025-09-30 22:00:45.882693
,EPA Rollbacks,2025-10-01 00:36:33+00:00,Cobb Courier,"Trump administration is on track to cut 1 in 3 EPA staffers by the end of 2025, slashing agency’s ability to keep pollution out of air and water",,,,,,https://cobbcountycourier.com/2025/09/trump-administration-is-on-track-to-cut-1-in-3-epa-staffers-by-the-end-of-2025-slashing-agencys-ability-to-keep-pollution-out-of-air-and-water/,"This article by Elizabeth Blum, Troy University, and Chris Sellers, Stony Brook University (The State University of New York), first appeared in The Conversation, republished with permission.",,https://cobbcountycourier.com/wp-content/uploads/2025/03/pollution.png,,,2025-10-01 05:02:23.492000
,North Carolina,2025-10-01 00:06:24+00:00,www.nbrc.gov,U.S. Environmental Protection Agency (EPA) Awards Eight NBRC Communities Through ...,,,,,,https://www.nbrc.gov/articles/175,Today the Northern Border Regional Commission is celebrating the U.S. Environmental Protection Agency (EPA) announcement that 25 small and rural ...,,,,,2025-10-01 05:02:23.492000
,EPA Rollbacks,2025-10-01 00:02:49+00:00,Government Executive,Trump administration is on track to cut 1 in 3 EPA staffers by the end of 2025,,,,,,https://www.govexec.com/workforce/2025/09/trump-administration-track-cut-1-3-epa-staffers-end-2025/408455/,Critics say the staffing cuts hinder the agency’s ability to keep pollution out of air and water.,,https://cdn.govexec.com/media/img/cd/2025/09/29/09292025EPA/open-graph.jpg,,,2025-09-30 23:59:19.905329
,Costs & Impacts,2025-09-30 23:55:50+00:00,US EPA,EPA Rings the Alarm on California’s Latest Questionable Attempt to Impose EV Mandates   | US EPA,,,,,,https://www.epa.gov/newsreleases/epa-rings-alarm-californias-latest-questionable-attempt-impose-ev-mandates,U.S. Environmental Protection Agency (EPA) submitted official comments to the California Air Resources Board (CARB) on its proposed “emergency” amendment and adoption of vehicle emissions regulations,,https://www.epa.gov/sites/all/themes/epa/img/epa-news-releases-og.jpg,,,2025-09-30 22:58:48.506554
,Costs & Impacts,2025-09-30 23:50:27+00:00,news.bloomberglaw.com,EPA Plans to Suspend 90% of Operations in Government Shutdown,,,,,,https://news.bloomberglaw.com/environment-and-energy/epa-prepares-for-government-shutdown-releases-contingency-plan,"The EPA would shrink by some 90% in case of a government shutdown, which could happen at midnight on Tuesday, according to a new agency plan.",,https://db0ip7zd23b50.cloudfront.net/dims4/default/7b2aa06/2147483647/crop/2984x1150+6+0/resize/960x370%3E/quality/90/?url=http%3A%2F%2Fbloomberg-bna-brightspot.s3.amazonaws.com%2F82%2F7a%2F19b0870b4e13bb19a491f46ec021%2Fgettyimages-654199022.jpg,,,2025-09-30 22:00:45.882693
,Costs & Impacts,2025-09-30 23:15:34+00:00,"Bergeson & Campbell, P.C.","Looming Government Shutdown Could Disrupt Chemical Regulation under TSCA - Bergeson & Campbell, P.C.",,,,,,https://www.lawbc.com/looming-government-shutdown-could-disrupt-chemical-regulation-under-tsca/,"As Congress edges closer to another potential government shutdown, questions loom large about how federal agencies will manage critical regulatory",,https://www.lawbc.com/wp-content/uploads/fed01-e1757631055521.jpg,,,2025-09-30 20:04:39.210598
,,2025-09-30 22:54:25+00:00,www.nytimes.com,How Many Federal Workers Could Be Furloughed in a Government Shutdown?,,,,,,https://www.nytimes.com/interactive/2025/09/30/us/politics/government-shutdown-furloughs.html,"If the government shuts down on Wednesday, hundreds of thousands of workers will be sent home without pay, disrupting a wide range of federal programs. Here’s what we know so far.",,https://static01.nyt.com/images/2025/09/29/multimedia/2025-09-26-shutdown-employees-index/2025-09-26-shutdown-employees-index-facebookJumbo-v14.jpg,,,2025-09-30 20:04:39.210598
,Costs & Impacts,2025-09-30 22:40:15+00:00,KSNT 27 News,"Old White Lakes Mall, two historic schools targeted for cleanup in Topeka",,,,,,https://www.ksnt.com/news/local-news/old-white-lakes-mall-two-historic-schools-targeted-for-cleanup-in-topeka/,"TOPEKA (KSNT) – Federal dollars are set to be used to assess some blighted properties in the Topeka area, including two old schools and a former mall property. The Environmental Protection Ag…",,https://www.ksnt.com/wp-content/uploads/sites/86/2025/01/GettyImages-172899154.jpg?w=1280,,,2025-09-30 22:58:48.506554
,Costs & Impacts,2025-09-30 22:34:04+00:00,Inside Climate News,"Government Shutdown Threatens Further Destruction of Environment and Science Agencies, Advocates Warn - Inside Climate News",,,,,,https://insideclimatenews.org/news/30092025/government-shutdown-threatens-environment-science-agencies/,"Although Congress has passed bipartisan funding bills that maintain science funding for specific agencies, the president and the director of the budget office have described plans for layoffs that could thwart those efforts.",,https://insideclimatenews.org/wp-content/uploads/2025/09/GettyImages-2237812231-1024x683.jpg,,,2025-09-30 22:00:45.882693
,Costs & Impacts,2025-09-30 22:23:32+00:00,Congressman Brad Sherman,Government Shutdown - Practical Effects,,,,,,https://sherman.house.gov/media-center/press-releases/government-shutdown-practical-effects,"Unless Congress acts to appropriate funds by September 30th, there will be a shutdown of those federal programs and agencies that are deemed ""non-essential"". Learn of the practical effects on how a government shutdown could affect you.",,http://sherman.house.gov/sites/evo-subsites/sherman.house.gov/files/evo-media-image/untitled-design-3.png,,,2025-09-30 19:04:07.211994
,,2025-09-30 22:08:47+00:00,dnr.mo.gov,Eric Medlock selected as September 2025 Missouri Department of Natural Resources Team ...,,,,,,https://dnr.mo.gov/communications/news/eric-medlock-selected-september-2025-missouri-department-natural-resources-team-member-month,"Recently, the Environmental Protection Agency finalized new rules related to PFAS and to the identification and removal of lead water service lines.",,,,,2025-09-30 19:04:07.211994
,Costs & Impacts,2025-09-30 22:02:20+00:00,www.hud.gov,EPA and HUD Protect Newark Housing Authority Residents from Lead Paint,,,,,,https://www.hud.gov/news/hud-no-25-122,"Newark, N.J. (September 29, 2025) – Today, the U.S. Environmental Protection Agency (EPA) and the U.S. Department of Housing and Urban Development ...",,,,,2025-09-30 19:04:07.211994
,Costs & Impacts,2025-09-30 22:01:51+00:00,www.pa.gov,Permit status,,,,,,https://www.pa.gov/agencies/dep/data-and-tools/track-permits/search/details.id1542598.html,Permit status,,https://www.pa.gov/content/dam/copapwp-pagov/en/global/images/thumbnail.png,,,2025-09-30 22:00:45.882693
,Costs & Impacts,2025-09-30 21:46:20+00:00,lailluminator.com,'Forever chemicals' found in nearly all Southeast Louisiana drinking water samples,,,,,,https://lailluminator.com/2025/09/30/forever-chemicals-found-in-nearly-all-southeast-louisiana-drinking-water-samples/,Salt levels exceeded the Environmental Protection Agency's recommended thresholds for drinking water quality in 100% of the samples taken during ...,,,,,2025-09-30 20:04:39.210598
,EPA Rollbacks,2025-09-30 21:41:13+00:00,subscriber.politicopro.com,E&E News: EPA launches air office revamp amid deregulatory push,,,,,,https://subscriber.politicopro.com/article/eenews/2025/09/30/epa-launches-air-office-revamp-amid-deregulatory-push-00587302,The plan shutters the office that handles most climate initiatives and rejiggers the one responsible for regulating power plants and industrial polluters.,,https://static.politico.com/34/6a/c2f0b5ae436ab95b789a23785f60/alaska-energy-trump-69495.jpg,,,2025-09-30 20:04:39.210598
,Costs & Impacts,2025-09-30 21:41:13+00:00,subscriber.politicopro.com,"E&E News: Over 13,000 face furloughs under EPA’s shutdown plan",,,,,,https://subscriber.politicopro.com/article/eenews/2025/09/30/over-13-000-face-furloughs-under-epas-shutdown-plan-00587543,Staffers could also be vulnerable to layoffs as the White House instructed agencies to consider a reduction in force for those deemed nonessential.,,https://static.politico.com/b8/dc/7e082bb843129bb57582737e42f5/trump-fuel-economy-39612.jpg,,,2025-09-30 20:04:39.210598
,Costs & Impacts,2025-09-30 21:10:10+00:00,WPR,DNR names paper companies responsible for PFAS contamination in a Wisconsin county,,,,,,https://www.wpr.org/news/dnr-paper-companies-pfas-contamination-wisconsin,"The current and former owners of a Rhinelander paper mill are responsible for widespread PFAS contamination in the northern Wisconsin town of Stella, state environmental regulators said in new letters obtained by WPR.",,https://www.wpr.org/wp-content/uploads/2025/09/stella-town-hall.jpg,,,2025-09-30 18:03:38.653795
,,2025-09-30 21:07:22+00:00,www.publicpower.org,EPA Releases Proposal to Extend Steam ELG Compliance Deadlines,,,,,,https://www.publicpower.org/periodical/article/epa-releases-proposal-extend-steam-elg-compliance-deadlines,The Environmental Protection Agency's Office of Water released the prepublication versions of its proposed rule and accompanying direct final rule ...,,,,,2025-09-30 20:04:39.210598
,Costs & Impacts,2025-09-30 20:40:42+00:00,PBS News,"Medicare, FEMA and air traffic control: How a government shutdown could impact public services",,,,,,https://www.pbs.org/newshour/politics/medicare-fema-and-air-traffic-control-how-a-government-shutdown-could-impact-public-services,"Employee furloughs and potential layoffs would halt some government activities, but other functions — like NASA's space missions, Trump's immigration crackdown and certain public health work at FDA and the USDA — would continue.",,https://d3i6fh83elv35t.cloudfront.net/static/2025/09/2025-09-30T130608Z_1900591607_RC2B2HA0VYB0_RTRMADP_3_USA-SHUTDOWN-1024x683.jpg,,,2025-09-30 20:04:39.210598
,,2025-09-30 20:25:35+00:00,www.tn.gov,Natural Resources Trustees Release Draft of First Restoration Plan for Oak Ridge Reservation,,,,,,https://www.tn.gov/environment/news/2025/9/30/nr-trustees-draft-restoration-plan-oak-ridge-reservation.html,The ORR was designated a Superfund Site by the U.S. Environmental Protection Agency (EPA) in 1989. About 15 percent of the ORR is contaminated by ...,,,,,2025-09-30 17:04:45.840929
,,2025-09-30 19:43:59+00:00,UNCF,Dillard University Receives Keep Louisiana Beautiful Grant - UNCF,,,,,,https://uncf.org/the-latest/dillard-university-receives-keep-louisiana-beautiful-grant,Dillard University receives a Keep Louisiana Beautiful University Affiliate Grant to support its campus sustainability efforts.,,https://cdn.uncf.org/wp-content/uploads/Seven-Sisters-Oak.jpg,,,2025-09-30 22:00:45.882693
,,2025-09-30 19:41:44+00:00,JD Supra,Underground Injection Control/Safe Drinking Water Act: U.S. EPA Environmental Appeals Board Addresses Challenge to Activities Associated with South Dakota Uranium Mining | JD Supra,,,,,,https://www.jdsupra.com/legalnews/underground-injection-control-safe-7418066/,The United States Environmental Protection Agency (“EPA”) Environmental Appeals Board (“EAB”) issued a September 12th Order addressing a Petition for...,,https://jdsupra-static.s3.amazonaws.com/profile-images/og.15833_1120.jpg,,,2025-09-30 16:04:32.414850
,Costs & Impacts,2025-09-30 19:41:18+00:00,www.nytimes.com,Live Updates: Trump Addresses Rare Military Gathering as Government Shutdown Looms,,,,,,https://www.nytimes.com/live/2025/09/30/us/trump-government-shutdown-hegseth,The Environmental Protection Agency singled out “Congressional Democrats” to blame for Congress's inability to come to an agreement on how to fund the ...,,,,,2025-09-30 16:04:32.414850
,Costs & Impacts,2025-09-30 19:35:10+00:00,www.sfgate.com,Calif. power plant faces shut down after exceeding emissions for years - SFGATE,,,,,,https://www.sfgate.com/bayarea/article/coachella-valley-power-plant-clean-air-act-21074196.php,"During its 2021 inspection, the EPA found that levels of several pollutants — including sulfur dioxide, hydrochloric acid, carbon monoxide, nitrogen ...",,,,,2025-09-30 18:03:38.653795
,Costs & Impacts,2025-09-30 19:30:37+00:00,Yahoo Finance,"The US Environmental Protection Agency says Coal is Cool, Again",,,,,,https://finance.yahoo.com/news/us-environmental-protection-agency-says-183000711.html,"By framing the rules in partisan terms, the EPA increases the chance of future reversals, leaving utilities exposed to insurance, litigation, and climate-related financial risks despite temporary relief.",,https://media.zenfs.com/en/oilprice.com/25133bbc9699867e0050227959f22dfd,,,2025-09-30 19:04:07.211994
,,2025-09-30 19:28:09+00:00,www.youtube.com,Smitty's Supply Fire Update - YouTube,,,,,,https://www.youtube.com/watch%3Fv%3Dx1L_ocqM3Sw,... our comment policy: https://www.epa.gov/we... Smitty's Supply Fire Update. 4 views · 2 minutes ago ...more. U.S. Environmental Protection Agency. 31.3 ...,,,,,2025-09-30 16:04:32.414850
,Costs & Impacts,2025-09-30 19:26:58+00:00,www.nytimes.com,Multiple Federal Agencies Blame 'Radical' Left and Democrats for Shutdown,,,,,,https://www.nytimes.com/2025/09/30/us/politics/federal-agencies-government-shutdown.html,Veterans Affairs faulted “Radical liberals.” The Environmental Protection Agency singled out “Congressional Democrats” to blame for Congress's ...,,,,,2025-09-30 17:04:45.840929
,,2025-09-30 19:20:12+00:00,Federal News Network - Helping feds meet their mission.,Here’s a look at federal agencies’ shutdown contingency plans,,,,,,https://federalnewsnetwork.com/government-shutdown/2025/09/heres-a-look-at-federal-agencies-contingency-plans-as-shutdown-looms/,"With hours left until a government shutdown, Federal News Network has compiled the need-to-know information from each federal agency's contingency plans.",,https://federalnewsnetwork.com/wp-content/uploads/2023/09/Government-Shutdown-Capitol.jpeg,,,2025-09-30 16:04:32.414850
,,2025-09-30 19:19:09+00:00,StormwaterONE,News,,,,,,https://stormwaterone.com/blogs/news,"StormwaterONE is a registered occupational trade school specializing in stormwater management courses and state-specific stormwater certification programs. We offer SWPPP training in multiple formats including self-paced online courses, live virtual sessions, and in-person instruction.",,http://stormwaterone.com/cdn/shop/files/1742796371338.jpg?v=1742796397,,,2025-09-30 20:04:39.210598
,,2025-09-30 18:51:09+00:00,America's Electric Cooperatives,Electric Co-ops Welcome New Agency Efforts to Support Crucial Generation,,,,,,https://www.electric.coop/electric-co-ops-welcome-new-agency-efforts-to-support-crucial-generation,Electric co-op leaders gathered at the Interior Department as the Trump administration announced new steps to protect energy reliability and affordability.,,https://www.electric.coop/wp-content/uploads/2025/09/Image-1.jpg,,,2025-09-30 16:04:32.414850
,Costs & Impacts,2025-09-30 18:38:35+00:00,OilPrice.com,"The US Environmental Protection Agency says Coal is Cool, Again | OilPrice.com",,,,,,https://oilprice.com/Energy/Coal/The-US-Environmental-Protection-Agency-says-Coal-is-Cool-Again.html,"By framing the rules in partisan terms, the EPA increases the chance of future reversals, leaving utilities exposed to insurance, litigation, and climate-related financial risks despite temporary relief.",,https://d32r1sh890xpii.cloudfront.net/article/718x300/2025-09-30_8kyfchur7g.jpg,,,2025-09-30 15:05:07.012288
,,2025-09-30 18:36:19+00:00,governor.nc.gov,Governor Stein Announces Boards and Commissions Appointments,,,,,,https://governor.nc.gov/news/press-releases/2025/09/30/governor-stein-announces-boards-and-commissions-appointments,Today Governor Josh Stein announced appointments to boards and commissions.,,,,,2025-09-30 15:05:07.012288
,,2025-09-30 18:31:55+00:00,nsarchive.gwu.edu,"Disappearing Data, Part II: Distorted Science and Deregulation | National Security Archive",,,,,,https://nsarchive.gwu.edu/briefing-book/climate-change-transparency-project/2025-09-30/disappearing-data-part-ii-distorted,EPA. Figure 3. Environmental Protection Agency Climate Risk Assessment Resources webpage before and after screenshots. (Left image is a Wayback ...,,,,,2025-09-30 15:05:07.012288
,Costs & Impacts,2025-09-30 18:23:54+00:00,US EPA,EPA announces $48 million for southeastern states to repair water systems impacted by Hurricane Helene | US EPA,,,,,,https://www.epa.gov/newsreleases/epa-announces-48-million-southeastern-states-repair-water-systems-impacted-hurricane,EPA announces $48 million for southeastern states to repair water systems impacted by Hurricane Helene,,https://www.epa.gov/sites/all/themes/epa/img/epa-news-releases-og.jpg,,,2025-09-30 15:05:07.012288
,Opposition & Allies,2025-09-30 18:14:45+00:00,Government Executive,Judge blocks Trump’s anti-union executive order for IFPTE-represented workers,,,,,,https://www.govexec.com/workforce/2025/09/judge-blocks-trumps-anti-union-executive-order-ifpte-represented-workers/408486/%3Foref%3Dge-home-top-story,U.S. District Judge Paul Friedman said the president “clearly” exceeded his authority when issuing an edict stripping two-thirds of the federal workforce of its collective bargaining rights.,,https://cdn.govexec.com/media/img/cd/2025/09/30/093025_Getty_GovExec_CollectiveBargaining/open-graph.jpg,,,2025-09-30 17:04:45.840929
,Opposition & Allies,2025-09-30 18:10:39+00:00,subscriber.politicopro.com,E&E News: Dems toy with ‘all of the above’ on energy as GOP embraces fossil fuels,,,,,,https://subscriber.politicopro.com/article/eenews/2025/09/30/dems-toy-with-all-of-the-above-on-energy-as-gop-embraces-fossil-fuels-00557975,The parties seemed to have swapped stances as Democrats see an opening amid rising energy costs.,,https://static.politico.com/c6/1a/3791bc764080bb5c31634b712183/u-s-congress-61460.jpg,,,2025-09-30 18:03:38.653795
,Costs & Impacts,2025-09-30 18:10:15+00:00,Federal News Network - Helping feds meet their mission.,"EPA ‘very susceptible’ to more layoffs under shutdown, former officials warn",,,,,,https://federalnewsnetwork.com/government-shutdown/2025/09/epa-very-susceptible-to-more-layoffs-under-shutdown-former-officials-warn/,"Only about 11% of EPA’s more than 15,000 employees would continue working during a government shutdown, according to its latest contingency plans.",,https://federalnewsnetwork.com/wp-content/uploads/2023/03/Water_Contamination_Nitrates_Oregon_90474-scaled.jpg,,,2025-09-30 15:05:07.012288
,,2025-09-30 17:50:22+00:00,X (formerly Twitter),"Environmental Protection Agency, Punjab - X",,,,,,https://x.com/EPCCDpunjab/status/1973022394085449734,"Environmental Protection Agency, Punjab · @EPCCDpunjab. Punjab's Air Quality Update – 29th September, 2025 Average AQI in Lahore: 164 (Unhealthy ...",,,,,2025-09-30 17:04:45.840929
