id,name,published,outlet,title,authors,category,market,categoryorder,articleorder,url,description,text,image,error,sentiment,firstEyes
,,2026-01-16 09:16:46+00:00,catalog.data.gov,U.S. Environmental Protection Agency - Sampling and Analysis of Antimicrobial Resistant Bacteria in Surface Water Samples Collected in the East Fork Watershed in Southwest Ohio Dataset,,,,,,https://catalog.data.gov/dataset/sampling-and-analysis-of-antimicrobial-resistant-bacteria-in-surface-water-samples-collect,"Dataset for a year long watershed study in southwestern Ohio to analyze antimicrobial resistant bacteria (E. coli, Enterococcus, and Salmonella) in surface waters and wastewater...",,https://s3-us-gov-west-1.amazonaws.com/cg-0817d6e3-93c4-4de8-8b32-da6919464e61/hero-image-bg.png,,,2026-01-16 07:58:16.997603
,Costs & Impacts,2026-01-16 08:06:24+00:00,www.thelancet.com,US EPA backs industry lawsuit to undo its own work on air pollution rule - The Lancet,,,,,,https://www.thelancet.com/journals/lanres/article/PIIS2213-2600(26)00012-3/abstract,"In an extraordinary legal manoeuvre, the US Environmental Protection Agency (EPA) switched sides in a federal lawsuit, joining industry groups and ...",,,,,2026-01-16 12:03:22.762219
,,2026-01-16 06:45:43+00:00,E&E News by POLITICO,Trump admin redirects carbon capture funds to prop up old coal plants,,,,,,https://www.eenews.net/articles/trump-admin-redirects-carbon-capture-funds-to-prop-up-old-coal-plants/,The Energy Department says it’s legally sound to shift more than half a billion dollars to help revive old and closed coal plants. Department officials,,https://static.politico.com/dims4/default/55a1666/2147483647/resize/1200/quality/100/?url=https://static.politico.com/7d/2d/f3f9ccf04a1994a13a6973dd8577/climate-kansas-coal-plant-59299.jpg,,,2026-01-16 12:03:22.762219
,,2026-01-16 05:58:16+00:00,US EPA,Hydraulic Hybrid Vehicles Demonstration Project | US EPA,,,,,,https://www.epa.gov/cati/hydraulic-hybrid-vehicles-demonstration-project,EPA and the United Parcel Service (UPS) have developed a hydraulic hybrid delivery vehicle to explore and demonstrate the environmental benefits of the hydraulic hybrid for urban pick-up and delivery fleets.,,https://www.epa.gov/sites/all/themes/epa/img/epa-standard-og.jpg,,,2026-01-16 11:03:18.762886
,Opposition & Allies,2026-01-16 05:48:26+00:00,www.nytimes.com,Trump Administration Lawsuit Seeking California Voter Data Is Dismissed,,,,,,https://www.nytimes.com/2026/01/15/us/california-voter-roll-lawsuit-trump.html,"... protect the privacy of Californians' data,” Ms. Weber said. “I will ... Environmental Protection Agency: In a reversal, the agency plans to ...",,,,,2026-01-16 00:59:51.761777
,Costs & Impacts,2026-01-16 05:33:22+00:00,WAMU,The EPA will no longer account for lives saved when regulating some air pollutants,,,,,,https://wamu.org/story/26/01/15/the-epa-will-no-longer-account-for-lives-saved-when-regulating-some-air-pollutants/,Instead the focus regulatory analysis almost entirely on costs to industry.,,https://wamu.org/wp-content/uploads/2026/01/GettyImages-654199026.jpg,,,2026-01-16 00:59:51.761777
,,2026-01-16 04:36:04+00:00,www.lung.org,American Lung Association Commends Congress for Passing Bill to Fund EPA,,,,,,https://www.lung.org/media/press-releases/fy26-epa-funding-bill,"Just now, the U.S. Senate passed a bipartisan bill that provides funding for the U.S. Environmental Protection Agency (EPA) for the rest of the federal fiscal year. This follows the House passage of the bill last week. In response to the vote, American Lung Association President and CEO Harold Wimmer issued the following statement:",,https://www.lung.org/getmedia/826b9ab0-e581-45d3-abe6-117dee8c2adb/ala-logo-f.jpg,,,2026-01-16 11:03:18.762886
,Costs & Impacts,2026-01-16 04:30:45+00:00,ecology.wa.gov,Hanford cleanup gets record $3.2 billion budget,,,,,,https://ecology.wa.gov/about-us/who-we-are/news/2026/jan-15-hanford-cleanup-gets-record-3-2-billion-budget,"On Thursday, Congress approved a record budget for cleanup for the Hanford Site in Washington state, one of the world’s most contaminated and complex nuclear cleanup projects.",,https://ecology.wa.gov/Ecology/media/BlogMedia/NWP/2025-WTP-LAW-Melter-Gallery.jpg?width=630 ,,,2026-01-16 00:59:51.761777
,,2026-01-16 04:10:42+00:00,The Commercial Appeal,EPA updates turbine regulations. How it could impact xAI power options,,,,,,https://www.commercialappeal.com/story/money/business/development/2026/01/15/epa-updated-turbine-regulations-xai-impact-memphis-tn-southaven-ms/88200392007/,"A recent EPA decision may impact how power options for Elon Musk's artificial intelligence company, xAI, in Memphis and Southaven.",,"https://www.commercialappeal.com/gcdn/authoring/authoring-images/2024/10/02/PMCA/75482784007-20240907-t-005101-z-1037585345-rc-2-av-9-a-623-uj-rtrmadp-3-muskai.JPG?crop=3450,1941,x0,y517&width=3200&height=1801&format=pjpg&auto=webp",,,2026-01-16 00:59:51.761777
,,2026-01-16 03:24:23+00:00,Environmental Protection Network,In the News,,,,,,https://www.environmentalprotectionnetwork.org/epn-in-the-news/page/102/,"News items about, written by, featuring, or published with assistance from EPN and EPN's members. [Read more]",,https://www.environmentalprotectionnetwork.org/wp-content/uploads/2018/06/philip-strong-213128-unsplash-e1528313743160-1024x228.jpg,,,2026-01-16 00:59:51.761777
,,2026-01-16 03:20:47+00:00,Prism,Does the Superfund program clean up polluted lands?,,,,,,https://prismreports.org/2026/01/15/superfund-sites-tribal-lands-epa/,"Over 400,000 Indigenous peoples live within three miles of a heavily contaminated site, including 19 Superfund sites on tribal lands",,https://prismreports.org/wp-content/uploads/2026/01/GettyImages-2041454743-scaled.jpg,,,2026-01-16 00:59:51.761777
,,2026-01-16 02:54:58+00:00,public-inspection.federalregister.gov,"Environmental Protection Agency [FRL-13110-01-OA] Farm, Ranch, and Rural Communities ...",,,,,,https://public-inspection.federalregister.gov/2026-00779.pdf,"EPA established the FRRCC in 2008 pursuant to the Federal Advisory Committee Act, Public. Law 92-463, to help EPA build a more positive and proactive ...",,,,,2026-01-16 00:59:51.761777
,Costs & Impacts,2026-01-16 02:41:58+00:00,www.facebook.com,New EPA Proposal Would Strip States' and Tribes' Authority to Block Oil and Gas Pipelines,,,,,,https://www.facebook.com/momscleanairforce/posts/new-epa-proposal-would-strip-states-and-tribes-authority-to-block-oil-and-gas-pi/1293457112814268/,This agency is no longer living up to its name. I think it should be rebranded as the EDA. Environmental destructive agency. 1 hr.,,,,,2026-01-16 02:57:31.500337
,Costs & Impacts,2026-01-16 01:49:32+00:00,1A,The EPA will no longer account for lives saved when regulating some air pollutants,,,,,,https://the1a.org/segments/the-epa-will-no-longer-account-for-lives-saved-when-regulating-some-air-pollutants/,Instead the focus regulatory analysis almost entirely on costs to industry.,,https://the1a.org/wp-content/uploads/sites/4/2026/01/GettyImages-654199026.jpg,,,2026-01-15 22:58:45.576527
,,2026-01-16 01:21:42+00:00,the Guardian,"Elon Musk’s xAI datacenter generating extra electricity illegally, regulator rules",,,,,,https://www.theguardian.com/technology/2026/jan/15/elon-musk-xai-datacenter-memphis,Win for Memphis activists who say ‘Colossus’ facilities add extra pollution to already overburdened communities,,"https://i.guim.co.uk/img/media/35ea77469eaf6bce0c12acdb9ce4762b484e729f/1328_0_6827_5464/master/6827.jpg?width=1200&height=630&quality=85&auto=format&fit=crop&precrop=40:21,offset-x50,offset-y0&overlay-align=bottom%2Cleft&overlay-width=100p&overlay-base64=L2ltZy9zdGF0aWMvb3ZlcmxheXMvdGctZGVmYXVsdC5wbmc&enable=upscale&s=9b1075319c3d5051751bb342d54dc8a7",,,2026-01-15 21:00:40.125274
,Costs & Impacts,2026-01-16 01:11:13+00:00,www.nytimes.com,"For the World's Food Supply, Federal Funding Cuts Have Long-Term Impacts",,,,,,https://www.nytimes.com/2026/01/15/science/agriculture-science-usaid-global-food.html,"Until last year, when the Trump administration dismantled it, the U.S. Agency ... Environmental Protection Agency: In a reversal, the agency plans to ...",,,,,2026-01-15 22:58:45.576527
,,2026-01-16 01:06:14+00:00,www.ci.southbridge.ma.us,"EPA Brownfields Cleanup Grant Application - Southbridge, MA",,,,,,https://www.ci.southbridge.ma.us/m/newsflash/Home/Detail/235,"As part of this commitment, the Town is actively pursuing federal funding through the U.S. Environmental Protection Agency's Brownfields Cleanup Grant ...",,,,,2026-01-16 00:59:51.761777
,Costs & Impacts,2026-01-16 01:01:21+00:00,WyoFile,"After EPA finds chart-topping fecal bacteria in Lonesome Lake, state doesn’t detect E. coli - WyoFile",,,,,,https://wyofile.com/after-epa-finds-chart-topping-fecal-bacteria-in-lonesome-lake-state-doesnt-detect-e-coli/,"More recent water quality results mean the crowded Wind River Range lake won’t face ‘impaired’ listing, but the improvement also does not clear it of all human health concerns.",,https://wyofile.com/wp-content/uploads/2025/07/Utah-group-crossing-outlet-scaled.jpeg,,,2026-01-16 00:59:51.761777
,,2026-01-16 00:49:54+00:00,www.pa.gov,Nicholas Meat,,,,,,https://www.pa.gov/agencies/dep/about-dep/regional-office-locations/northcentral-regional-office/nicholas-meat,Nicholas Meat,,https://www.pa.gov/content/dam/copapwp-pagov/en/global/images/thumbnail.png,,,2026-01-15 21:00:40.125274
,Opposition & Allies,2026-01-16 00:43:07+00:00,Bracewell LLP,The Brewing Legal Fight Over Trump’s Air Pollution Plan | Bracewell LLP Media Mentions,,,,,,https://www.bracewell.com/news-events/the-brewing-legal-fight-over-trumps-air-pollution-plan/,Bracewell's Jeff Holmstead told Axios EPA will likely not face legal issues with the cessation of calculating health benefits to reducing pollutants,,,,,2026-01-16 02:57:31.500337
,Costs & Impacts,2026-01-16 00:27:47+00:00,www.courthousenews.com,Advocacy groups sue EPA over approval of 'forever chemical' - Courthouse News Service,,,,,,https://www.courthousenews.com/advocacy-groups-sue-epa-over-approval-of-forever-chemical/,(CN) — Two nonprofits filed a lawsuit Thursday against the U.S. Environmental Protection Agency after its November 2025 approval of a “forever ...,,,,,2026-01-15 21:00:40.125274
,,2026-01-16 00:26:19+00:00,www.threads.com,The Environmental Protection Agency (EPA) is taking a major step toward changing its math ...,,,,,,https://www.threads.com/%40motherjonesmag/post/DTjPgSrD0QA/the-environmental-protection-agency-epa-is-taking-a-major-step-toward-changing,Mother Jones (@motherjonesmag). 122 Views. The Environmental Protection Agency (EPA) is taking a major step toward changing its math to favor ...,,,,,2026-01-15 21:00:40.125274
,,2026-01-15 23:30:16+00:00,iowaagriculture.gov,"Secretary Naig Supports WOTUS Updates, Urges Additional Relief to Accelerate ...",,,,,,https://iowaagriculture.gov/news/support-WOTUS-updates-conservation,"15, 2026) – Iowa Secretary of Agriculture Mike Naig recently submitted comments to the U.S. Environmental Protection Agency (EPA) and the U.S. Army ...",,,,,2026-01-16 00:59:51.761777
,Costs & Impacts,2026-01-15 23:19:00+00:00,Drought.gov,"Drought in 2025 in 14 Graphics | January 15, 2026 | Drought.gov",,,,,,https://www.drought.gov/news/drought-2025-14-graphics-2026-01-15,"From the catastrophic wildfires in Southern California to record-low streamflow in the Northeast, drought and its impacts touched nearly every corner of the country. The year saw the unusual return of two La Niña events and devastating weather whiplash that brought historic floods to drought-stricken Texas. 2025 showed us that drought is even more devastating when compounded with other climate hazards, such as wildfire and flood. This list breaks down some significant drought-related events of 2025 that made 2025 a year of water extremes across the United States.",,https://www.drought.gov/sites/default/files/hero/news/AdobeStock_28996577.jpeg,,,2026-01-15 19:00:58.903852
,Clean Air & Water,2026-01-15 23:11:56+00:00,High Country News,Congress passes environmental funding without Trump’s deep cuts - High Country News,,,,,,https://www.hcn.org/articles/congress-passes-environmental-funding-without-trumps-deep-cuts/,But the bipartisan effort still trimmed climate research and fails to solve agencies’ chronic underfunding. The Senate passed an environmental spending package that rejects many of Trump's cuts but could still harm climate research.,,https://www.hcn.org/wp-content/uploads/2026/01/011526-fedapprop-2.jpg,,,2026-01-15 19:00:58.903852
,,2026-01-15 23:07:15+00:00,American Chemistry Council,ACC Comments on House Energy & Commerce Committee Release of TSCA Legislation - American Chemistry Council,,,,,,https://www.americanchemistry.com/chemistry-in-america/news-trends/press-release/2026/acc-comments-on-house-energy-commerce-committee-release-of-tsca-legislation,"The American Chemistry Council (ACC) President & CEO Chris Jahn today released the following statement on the introduction of legislation in the U.S. House of Representatives aimed at restoring predictable, science-driven implementation of the nation’s primary chemical management law, the Toxic Substances Control Act (TSCA).",,https://www.americanchemistry.com/var/site/storage/images/4/6/5/2/192564-1-eng-US/d25fecc093bd-Chemistry-Creates-America-Competes-US-Capitol-Building.png,,,2026-01-15 21:00:40.125274
,,2026-01-15 22:53:00+00:00,www.mass.gov,Healey-Driscoll Administration Awards Nearly $1.3M to Support Public Water Systems,,,,,,https://www.mass.gov/news/healey-driscoll-administration-awards-nearly-13m-to-support-public-water-systems,"Funding for Small, Underserved, Disadvantaged Communities grants is provided by the U.S. Environmental Protection Agency through the Water ...",,,,,2026-01-15 18:01:45.871550
,Costs & Impacts,2026-01-15 22:41:33+00:00,US EPA,"EPA Acts to Protect Public from Harmful Chemical Releases in Springfield, Massachusetts  | US EPA",,,,,,https://www.epa.gov/newsreleases/epa-acts-protect-public-harmful-chemical-releases-springfield-massachusetts,"EPA News Release: EPA Acts to Protect Public from Harmful Chemical Releases in Springfield, Massachusetts ",,https://www.epa.gov/sites/all/themes/epa/img/epa-news-releases-og.jpg,,,2026-01-15 18:01:45.871550
,Costs & Impacts,2026-01-15 22:30:12+00:00,Environmental Defense Fund,"Draft House Bill Would Gut Toxic Substances Control Act, Despite Overwhelming Public Support for Chemical Protections",,,,,,https://www.edf.org/media/draft-house-bill-would-gut-toxic-substances-control-act-despite-overwhelming-public-support,A new Republican proposal released today in the U.S. House of Representatives would put Americans’ health at risk.,,,,,2026-01-15 18:01:45.871550
,Costs & Impacts,2026-01-15 22:12:39+00:00,Center for Biological Diversity,Lawsuit Challenges Trump EPA’s Latest Approval of ‘Forever Chemical’ Pesticide,,,,,,https://biologicaldiversity.org/w/news/press-releases/lawsuit-challenges-trump-epas-latest-approval-of-forever-chemical-pesticide-2026-01-15/,"Conservation groups filed a lawsuit today challenging the Environmental Protection Agency’s approval of isocycloseram, a “forever chemical” insecticide that falls into the class of highly persistent PFAS, or per- or polyfluoroalkyl substances.

The insecticide was approved for use on golf courses, lawns and a host of food crops, including apples, oranges, lettuce, spinach, tomatoes, broccoli, bell peppers, cucumbers, peaches, almonds, wheat and oats.",,https://www.biologicaldiversity.org/news/press_releases/images/center-frog-logo-300.jpg,,,2026-01-15 18:01:45.871550
,,2026-01-15 21:59:22+00:00,US EPA,Independent Audit of the EPA's Fiscal Years 2025 and 2024 Consolidated Financial Statements | US EPA,,,,,,https://www.epa.gov/office-inspector-general/independent-audit-epas-fiscal-years-2025-and-2024-consolidated-financial,[Paste the description here.],,https://www.epa.gov/sites/all/themes/epa/img/epa-standard-og.jpg,,,2026-01-15 21:00:40.125274
,,2026-01-15 21:59:21+00:00,US EPA,Independent Audit of the EPA's Fiscal Years 2024 and 2023 Hazardous Waste Electronic Manifest System Fund Financial Statements | US EPA,,,,,,https://www.epa.gov/office-inspector-general/independent-audit-epas-fiscal-years-2024-and-2023-hazardous-waste,[Paste the description here.],,https://www.epa.gov/sites/all/themes/epa/img/epa-standard-og.jpg,,,2026-01-15 21:00:40.125274
,,2026-01-15 21:59:21+00:00,US EPA,Audit of the EPA's Greenhouse Gas Reduction Fund – Solar for All Program | US EPA,,,,,,https://www.epa.gov/office-inspector-general/audit-epas-greenhouse-gas-reduction-fund-solar-all-program,[Paste the description here.],,https://www.epa.gov/sites/all/themes/epa/img/epa-standard-og.jpg,,,2026-01-15 21:00:40.125274
,,2026-01-15 21:59:21+00:00,US EPA,Audit of the U.S. Chemical Safety and Hazard Investigation Board's Compliance with the Federal Information Security Modernization Act for FY 2025 | US EPA,,,,,,https://www.epa.gov/office-inspector-general/audit-us-chemical-safety-and-hazard-investigation-boards-compliance,[Paste the description here.],,https://www.epa.gov/sites/all/themes/epa/img/epa-standard-og.jpg,,,2026-01-15 19:00:58.903852
,,2026-01-15 21:59:21+00:00,US EPA,Independent Audit of the EPA's Fiscal Years 2024 and 2023 Pesticide Reregistration and Expedited Processing Fund Financial Statements and Independent Audit of the EPA's Fiscal Years 2024 and 2023 Pesticide Registration Fund Financial Statements | US EPA,,,,,,https://www.epa.gov/office-inspector-general/independent-audit-epas-fiscal-years-2024-and-2023-pesticide-reregistration,[Paste the description here.],,https://www.epa.gov/sites/all/themes/epa/img/epa-standard-og.jpg,,,2026-01-15 21:00:40.125274
,Costs & Impacts,2026-01-15 21:36:31+00:00,Planet Detroit,EPA drops health cost calculations for air pollution: How it could harm Detroiters,,,,,,https://planetdetroit.org/2026/01/epa-stops-health-cost-calculations/,"The EPA will no longer factor health benefits into air pollution rules, potentially raising health risks in Detroit, advocates say.",,https://planetdetroit.org/wp-content/uploads/2025/05/AP20295585735415-min-scaled.jpg,,,2026-01-15 17:01:19.326096
,Costs & Impacts,2026-01-15 21:23:07+00:00,US EPA,What Are the Health Effects of Uranium? | US EPA,,,,,,https://www.epa.gov/navajo-nation-uranium-cleanup/what-are-health-effects-uranium,"Information regarding the health effects of uranium, its potential impact on health, methods to avoid exposure, and efforts to increase access to safe drinking water.",,https://www.epa.gov/sites/all/themes/epa/img/epa-standard-og.jpg,,,2026-01-15 18:01:45.871550
,,2026-01-15 21:22:46+00:00,RMI,"The State of Utility Planning, 2025 Q4 - RMI",,,,,,https://rmi.org/the-state-of-utility-planning-2025-q4/,A review of all integrated resource plans for electric utilities across the United States to evaluate progress toward a clean and secure energy future.,,https://rmi.org/wp-content/uploads/2026/01/iStock-2159550598.jpg,,,2026-01-15 17:01:19.326096
,Costs & Impacts,2026-01-15 21:05:29+00:00,NAACP,NAACP Responds to EPA Confirmation that Large Methane Gas Turbines Require Permits,,,,,,https://naacp.org/articles/naacp-responds-epa-confirmation-large-methane-gas-turbines-require-permits,"Below are statements from the Southern Environmental Law Center, Young Gifted & Green, and NAACP in response to the announcement: ""EPA's gas turbine ...",,https://naacp.org/sites/default/files/styles/og_image/public/images/Pollution_smoke_factory.jpg?itok=IpVM7QGB,,,2026-01-15 21:00:40.125274
,Costs & Impacts,2026-01-15 20:23:20+00:00,X (formerly Twitter),The Trump administration on Tuesday proposed a rule revising Biden-era #pollution ...,,,,,,https://x.com/FarmPolicy/status/2011619348314554521,... Environmental Protection Agency said would speed permitting of energy and artificial intelligence infrastructure.,,,,,2026-01-15 16:01:08.609020
,Costs & Impacts,2026-01-15 20:15:12+00:00,nsarchive.gwu.edu,Trump's Withdrawal from UN Climate Body Breaks Bipartisan Consensus on Multilateral Efforts,,,,,,https://nsarchive.gwu.edu/briefing-book/climate-change-transparency-project/2026-01-15/trumps-withdrawal-un-climate-body,EPA Administrator William Reilly watches as President George H. W. Bush signs the Clean Air Act Amendments (Source: Environmental Protection Agency).,,,,,2026-01-15 16:01:08.609020
,Costs & Impacts,2026-01-15 20:08:28+00:00,Vero News,The EPA warns of ‘Forever chemicals’ in Vero’s water - Vero News,,,,,,https://veronews.com/2026/01/15/the-epa-warns-of-forever-chemicals-in-veros-water/,"Is Vero Beach’s water safe to drink? Right now, there are two opinions. City officials say it is, but the Environmental Protection Agency has raised a red flag. The question … Read More »",,https://veronews.com/wp-content/uploads/2018/10/Water-faucet.jpeg,,,2026-01-15 16:01:08.609020
,,2026-01-15 20:01:18+00:00,EL PAÍS English,The EPA will no longer calculate the lives saved thanks to air pollution restrictions,,,,,,https://english.elpais.com/health/2026-01-15/the-epa-will-no-longer-calculate-the-lives-saved-thanks-to-air-pollution-restrictions.html,The change in regulatory policy emphasizes costs for industry and raises concerns about a weakening of environmental protection,,https://imagenes.elpais.com/resizer/v2/MWGSCAAVG5HMBCFCSF5T7Y6PZE.jpg?auth=68266dde9008e164c9b5d4fbf730810419f85e667004804b37849f21df213cc3&width=1200,,,2026-01-15 16:01:08.609020
,,2026-01-15 19:56:00+00:00,www.wateronline.com,EPA Proposal Could Redefine How States Review Federal Water Permits,,,,,,https://www.wateronline.com/doc/epa-proposal-could-redefine-how-states-review-federal-water-permits-0001,"The U.S. EPA has proposed a revision to Section 401 of the Clean Water Act, a move that could significantly reshape how states exercise authority over infrastructure projects that may affect water quality.",,https://vertassets.blob.core.windows.net/image/8592147e/8592147e-f7e8-4c55-a4cb-0acefb0f8bab/usa_topographic_map_gettyimages_173169385.jpg,,,2026-01-15 18:01:45.871550
,EPA Rollbacks,2026-01-15 19:51:56+00:00,JD Supra,EPA’s proposed rescission of its 2009 endangerment finding | JD Supra,,,,,,https://www.jdsupra.com/legalnews/epa-s-proposed-rescission-of-its-2009-7442579/,"On July 29, 2025, the Environmental Protection Agency (EPA) proposed rescinding its 2009 Greenhouse Gas Endangerment Finding (Endangerment Finding)....",,https://jdsupra-static.s3.amazonaws.com/profile-images/og.15731_1400.jpg,,,2026-01-15 15:01:11.087909
,Costs & Impacts,2026-01-15 19:41:30+00:00,US EPA,EPA Proposes Cleanup Plan for Industrial Contamination in Newark’s Pierson’s Creek | US EPA,,,,,,https://www.epa.gov/newsreleases/epa-proposes-cleanup-plan-industrial-contamination-newarks-piersons-creek,"Newark, N.J. - U.S. Environmental Protection Agency (EPA) is proposing a plan to clean up contaminated sediment, soil and industrial waste in Pierson’s Creek, a 1.5-mile waterway that runs through an industrial area in Newark, New Jersey.",,https://www.epa.gov/sites/all/themes/epa/img/epa-news-releases-og.jpg,,,2026-01-15 15:01:11.087909
,,2026-01-15 19:35:49+00:00,www.law360.com,Aligning With EPA's 'Compliance First' Enforcement Policy - Law360,,,,,,https://www.law360.com/energy/articles/2429878/aligning-with-epa-s-compliance-first-enforcement-policy,"To take advantage of the U.S. Environmental Protection Agency's new ""compliance first"" policy, companies will need to maintain up-to-date compliance programs, implement self-audits and find-and-fix protocols, and lean more into open communication with regulators, say attorneys at Crowell & Moring.",,https://www.law360.com/images/law360-stacked.png,,,2026-01-15 18:01:45.871550
,,2026-01-15 19:24:00+00:00,www.mitchellwilliamslaw.com,Section 401/Clean Water Act: U.S. EPA Issues Proposed Rule Addressing Certification,,,,,,https://www.mitchellwilliamslaw.com/section-401/clean-water-act-us-epa-issues-proposed-rule-addressing-certification,The United States Environmental Protection Agency (“EPA”) announced on January 13th a proposed rule addressing the certification process under ...,,https://www.mitchellwilliamslaw.com/images/site/Social_Logo.jpg,,,2026-01-15 17:01:19.326096
,,2026-01-15 19:18:59+00:00,Office of Advocacy,"Roundtable on EPA’s Proposed National Primary Drinking Water Regulation for Perchlorate – February 4, 2026",,,,,,https://advocacy.sba.gov/2026/01/15/roundtable-on-epas-proposed-national-primary-drinking-water-regulation-for-perchlorate/,"The next Office of Advocacy (Advocacy) environmental roundtable will be held virtually on February 4, 2026, at 2 PM ET on the Microsoft Teams platform. The discussion will focus on the U.S. Environmental Protection Agency’s (EPA) proposed national pr",,https://advocacy.sba.gov/wp-content/uploads/2018/11/agency_EPA_environmental-protection-agency-1024x681.jpg,,,2026-01-15 18:01:45.871550
,Costs & Impacts,2026-01-15 19:15:10+00:00,Nature,Accounting for ocean impacts nearly doubles the social cost of carbon - Nature Climate Change,,,,,,https://www.nature.com/articles/s41558-025-02533-5,"Oceans provide essential ecosystem services to human society, yet the climate impacts on blue capital have long been ignored. Incorporating the latest works on ocean science and economics, researchers show that accounting for the potential damage would almost double the social cost of carbon estimation.",,https://media.springernature.com/m685/springer-static/image/art%3A10.1038%2Fs41558-025-02533-5/MediaObjects/41558_2025_2533_Fig1_HTML.png,,,2026-01-15 15:01:11.087909
