id,name,published,outlet,title,authors,category,market,categoryorder,articleorder,url,description,text,image,error,sentiment,firstEyes
,EPA Rollbacks,2026-01-15 01:53:30+00:00,www.facebook.com,The EPA says it will stop calculating how much money is saved in health care costs avoided ...,,,,,,https://www.facebook.com/NBCNews/posts/the-epa-says-it-will-stop-calculating-how-much-money-is-saved-in-health-care-cos/1260382669286929/,So how will the Environmental Protection Agency determine the optimal methods to protect the environment all of the humans live in? Should they just ...,,,,,2026-01-14 23:59:25.402223
,Opposition & Allies,2026-01-15 01:45:27+00:00,www.grassley.senate.gov,Grassley Echoes Iowa Attorney General Bird’s Call for Answers on Small Refinery Exemptions | U.S. Senator Chuck Grassley of Iowa,,,,,,https://www.grassley.senate.gov/news/news-releases/grassley-echoes-iowa-attorney-general-birds-call-for-answers-on-small-refinery-exemptions,"Click HERE for video
WASHINGTON – Sen. Chuck Grassley (R-Iowa) sent a letter to Environmental...",,https://www.grassley.senate.gov/assets/images/sharelogo.png,,,2026-01-14 23:59:25.402223
,,2026-01-15 01:17:30+00:00,www.bdlaw.com,Albert J. Beveridge III – 1935-2025 - The Environmental Law Firm,,,,,,https://www.bdlaw.com/news/albert-j-beveridge-iii-1935-2025/,Ruckelshaus (first and fifth administrator of the U.S. Environmental Protection Agency (EPA) and 2015 recipient of the Presidential Medal of Freedom).,,,,,2026-01-15 05:58:50.262519
,,2026-01-15 01:08:25+00:00,www.klgates.com,2026 Regulatory Outlook: Advanced Recycling,,,,,,https://www.klgates.com/2026-Regulatory-Outlook-Advanced-Recycling-1-14-2026,"The recycling industry, traditionally seen as stable, is in an era of innovation and growth.",,https://files.klgates.com/images/_wbmanaged/policy-regulatory-01_wbc_socialimage_384128.png,,,2026-01-14 23:59:25.402223
,Clean Air & Water,2026-01-15 00:47:24+00:00,CBT News | #1 Source for Automotive News & Dealership Intelligence,EPA revises air pollution analysis framework for power plant rules,,,,,,https://www.cbtnews.com/epa-revises-air-pollution-analysis-framework/,"EPA will no longer assign dollar values to health benefits when regulating PM2.5 and ozone, marking a shift in federal air policy.",,https://d9s1543upwp3n.cloudfront.net/wp-content/uploads/2026/01/01142026-EPA-scaled.jpg,,,2026-01-14 21:00:33.731502
,,2026-01-15 00:38:32+00:00,www.reddit.com,EPA to stop calculating money and lives saved by curbs on air pollution - Reddit,,,,,,https://www.reddit.com/r/news/comments/1qd3ioz/epa_to_stop_calculating_money_and_lives_saved_by/,Is the EPA just a bunch of Trump cronies collecting paychecks while they golf and abuse children?,,,,,2026-01-14 21:00:33.731502
,Costs & Impacts,2026-01-15 00:30:35+00:00,www.durangoco.gov,City to host virtual meeting on Environmental Protection Agency brownfield grant application,,,,,,https://www.durangoco.gov/m/newsflash/Home/Detail/4489,... department and city hall project as part of a brownfield cleanup grant application with the Environmental Protection Agency. The meeting will be ...,,,,,2026-01-14 23:59:25.402223
,Costs & Impacts,2026-01-15 00:21:44+00:00,www.nytimes.com,Renaming Defense Department Could Cost Taxpayers $125 Million - The New York Times,,,,,,https://www.nytimes.com/2026/01/14/us/defense-department-name-change.html,"... Department began during the Biden administration. In 2021, Congress ... Environmental Protection Agency: In a reversal, the agency plans to ...",,,,,2026-01-14 21:00:33.731502
,,2026-01-15 00:06:56+00:00,PubMed,US Environmental Protection Agency's revised guidelines for Carcinogen Risk Assessment: incorporating mode of action data - PubMed,,,,,,https://pubmed.ncbi.nlm.nih.gov/9748625/%3Fdopt%3DAbstract,US Environmental Protection Agency's revised guidelines for Carcinogen Risk Assessment: incorporating mode of action data,,https://cdn.ncbi.nlm.nih.gov/pubmed/persistent/pubmed-meta-image-v2.jpg,,,2026-01-14 21:59:02.918275
,Costs & Impacts,2026-01-15 00:05:57+00:00,www.facebook.com,EPA Administrator Lee Zeldin has proposed to double the amount of formaldehyde ...,,,,,,https://www.facebook.com/momscleanairforce/posts/epa-administrator-lee-zeldin-has-proposed-to-double-the-amount-of-formaldehyde-a/1292453396247973/,*_ga_Y8LNLM894J*czE3Njg0MjI3NjAkbzM 0NCRnMSR0MTc2ODQyMjgxMSRqOSRsMC RoMA.. actnow.momscleanairforce.org. Tell EPA: Protect Our Children ...,,,,,2026-01-15 05:58:50.262519
,,2026-01-14 23:48:34+00:00,US EPA,Water Quality Certification of the Quillayute River Oxbow Restoration on the Quileute Reservation | US EPA,,,,,,https://www.epa.gov/publicnotices/water-quality-certification-quillayute-river-oxbow-restoration-quileute-reservation,Public notice of EPA's proposed water quality certification of the Historic Oxbow Restoration and Steep Hill Road Rehab and Re-Route Project on the Quileute Reservation in Washington.,,https://www.epa.gov/system/files/images/2022-03/epa-standard-twitter.jpg,,,2026-01-14 19:01:22.640256
,,2026-01-14 23:37:57+00:00,Zenodo,"US EPA Air Quality data, 1972-1988",,,,,,https://zenodo.org/records/18087357,"U.S. Environmental Protection Agency air pollution monitoring data from 1972 through 1988 consist of raw, monitor-level observations for sulfur dioxide (SO₂), total suspended particulates (TSP), nitrogen dioxide (NO₂), ozone (O₃), and carbon monoxide (CO), obtained directly from the EPA. SO₂ measurements typically reflect sample durations of about one hour, while other pollutants are reported according to contemporaneous EPA monitoring practices, with substantial variation in sampling frequency and spatial coverage across pollutants and years. SO₂ has the broadest and most consistent coverage, with thousands of monitors operating in over 1,000 counties, whereas TSP is measured less frequently, O₃ data are largely unavailable prior to 1980, NO₂ coverage declines by the late 1980s, and CO data become widely available starting in the mid-1970s.  The provided .do file serves as an example for how to process the provided datasets into a daily monitor-level dataset.",,,,,2026-01-14 21:59:02.918275
,,2026-01-14 23:12:46+00:00,United States Trade Representative,Ambassador Greer Joins Transportation Secretary Duffy and EPA Administrator Zeldin for the Freedom Means Affordable Cars Tour,,,,,,https://ustr.gov/about/policy-offices/press-office/press-releases/2026/january/ambassador-greer-joins-transportation-secretary-duffy-and-epa-administrator-zeldin-freedom-means,"WASHINGTON — On Friday, January 16 and Saturday, January 17, Ambassador Jamieson Greer will join U.S. Transportation Secretary Sean P. Duffy and EPA Administrator Lee Zeldin for the Freedom Means Affordable Cars Tour. This two-day swing will highlight the work the Trump Administration is doing to lower car prices for American families, unleash American auto manufacturing, and increase consumer choice.",,https://ustr.gov/sites/default/files/2026-01/Meta%20Tag.png,,,2026-01-14 19:01:22.640256
,Opposition & Allies,2026-01-14 23:06:37+00:00,tennesseelookout.com,Water wars continue with 2026 legislation concerning Duck River - Tennessee Lookout,,,,,,https://tennesseelookout.com/2026/01/14/water-wars-continue-with-2026-legislation-concerning-duck-river/,"One bill seeks to prohibit the Tennessee Department of Environment and Conservation, which regulates water withdrawals from rivers, from stopping any ...",,,,,2026-01-14 21:00:33.731502
,Costs & Impacts,2026-01-14 23:04:07+00:00,Esquire,"Sorry, the EPA No Longer Cares About Your Health",,,,,,https://www.esquire.com/news-politics/politics/a70003360/epa-air-pollution-human-lives/,The organization’s updated regulations will protect corporate profits though.,,"https://hips.hearstapps.com/hmg-prod/images/bronze-sign-marks-the-location-of-the-u-s-environmental-news-photo-1768431634.pjpeg?crop=1.00xw:0.753xh;0,0.247xh&resize=1200:*",,,2026-01-14 21:00:33.731502
,Costs & Impacts,2026-01-14 22:49:24+00:00,www.nytimes.com,Trump Cuts $2 Billion in Federal Funding for Mental Health and Substance Abuse Services,,,,,,https://www.nytimes.com/2026/01/14/health/samhsa-funding-cuts.html,"... services no longer aligned with the agency's priorities. The letter ... Environmental Protection Agency: In a reversal, the agency plans to ...",,,,,2026-01-14 21:00:33.731502
,Costs & Impacts,2026-01-14 22:39:11+00:00,lrsa-nj.gov,Notice for the LRSA Flood Mitigation Project - Linden Roselle Sewerage Authority,,,,,,https://lrsa-nj.gov/notice-for-the-lrsa-flood-mitigation-project/,The NJWB is a State Revolving Fund program jointly administered by the New Jersey Department of Environmental Protection (DEP) and the New Jersey ...,,,,,2026-01-14 23:59:25.402223
,Costs & Impacts,2026-01-14 22:38:09+00:00,www.justice.gov,Justice Department Files Complaint Against California Over Unconstitutional State Regulation of Federal Lands,,,,,,https://www.justice.gov/opa/pr/justice-department-files-complaint-against-california-over-unconstitutional-state-regulation,"The Justice Department’s Environment and Natural Resources Division (ENRD) filed a complaint in U.S. District Court for the Eastern District of California challenging California Senate Bill 1137 (SB 1137), which prevents oil and gas development activities within 3,200 feet of a so-called “sensitive receptor.” SB 1137 would knock out about one-third of all federally authorized",,https://www.justice.gov/themes/custom/usdoj_uswds/images/metatag-image--press-release.png,,,2026-01-14 21:00:33.731502
,,2026-01-14 22:14:20+00:00,Republican Study Committee,"Welcome Back to RSC, EPA Administrator Lee Zeldin",,,,,,https://rsc-pfluger.house.gov/media/press-releases/welcome-back-rsc-epa-administrator-lee-zeldin,"WASHINGTON, D.C. — The Republican Study Committee (RSC) hosted Environmental Protection Agency (EPA) Administrator Lee Zeldin on Capitol Hill for a members-only meeting. Administrator Zeldin made it clear that the EPA is returning to its core mission of conserving America’s vast natural resources without stifling innovation.",,https://republicanstudycommittee.house.gov/sites/evo-subsites/republicanstudycommittee.house.gov/files/evo-media-image/AP-PRESSER_0.jpg,,,2026-01-14 17:59:54.226579
,,2026-01-14 22:08:49+00:00,Forest Service,Pike-San Isabel National Forests & Cimarron and Comanche National Grasslands : Press Release - USDA Forest Service begins 10-year partnership with $7.3M dollar investment to reduce wildfire risk,,,,,,https://www.fs.usda.gov/r02/psicc/newsroom/releases/usda-forest-service-begins-10-year-partnership-73m-dollar-investment,"PUEBLO, Colo., Jan.",,https://www.fs.usda.gov/themes/custom/wfs/img/usfs_placeholder.png,,,2026-01-14 21:00:33.731502
,,2026-01-14 22:01:25+00:00,www.facebook.com,The U.S. Environmental Protection Agency has laid out a timeline for how it intends to ... - Facebook,,,,,,https://www.facebook.com/69WFMZ/posts/the-us-environmental-protection-agency-has-laid-out-a-timeline-for-how-it-intend/1324454149724413/,The U.S. Environmental Protection Agency has laid out a timeline for how it intends to address the overabundance of potentially harmful chemicals ...,,,,,2026-01-14 21:00:33.731502
,,2026-01-14 21:57:39+00:00,US EPA,Notification: CSB’s fiscal year 2025 compliance with the Payment Integrity Information Act of 2019 | US EPA,,,,,,https://www.epa.gov/office-inspector-general/notification-csbs-fiscal-year-2025-compliance-payment-integrity,Notification: CSB’s fiscal year 2025 compliance with the Payment Integrity Information Act of 2019,,https://www.epa.gov/sites/all/themes/epa/img/epa-standard-og.jpg,,,2026-01-14 19:01:22.640256
,,2026-01-14 21:35:52+00:00,dnr.mo.gov,"Department of Natural Resources awards $67500 in grants to Reeds Spring, Dade County",,,,,,https://dnr.mo.gov/communications/news/department-natural-resources-awards-67500-grants-reeds-spring-dade-county,This project will be funded wholly or in part with monies received from the U.S. Environmental Protection Agency. For more information on ...,,,,,2026-01-14 17:00:06.012365
,Costs & Impacts,2026-01-14 21:21:55+00:00,www.kuow.org,Seattle Schools knew there was methane gas beneath its new high school — but skipped some safety measures,,,,,,https://www.kuow.org/stories/seattle-schools-knew-there-was-methane-gas-beneath-its-new-high-school-but-skipped-some-safety-measures,"Before Seattle Public School spent $300 million to rebuild Rainier Beach High School on a peat bog, scientists hired by the district warned that methane in the soil could pose an explosive problem if it were to leak into the school.",,https://kuow-prod.imgix.net/store/ff49e8a678bdf722ccaab8b8edb13690.jpg?fm=jpg&fit=max&w=1200&h=628&q=80,,,2026-01-14 17:00:06.012365
,,2026-01-14 21:11:55+00:00,www.quarles.com,"Illinois Governor Signs Wide-Ranging Energy Legislation Addressing Battery Storage, Nuclear Power, Renewables, and More",,,,,,https://www.quarles.com/newsroom/publications/illinois-governor-signs-wide-ranging-illinois-energy-legislation-addressing-battery-storage-nuclear-power-renewables-and-more,... Environmental Protection Agency to collaborate on development of an Integrated Resource Plan (“IRP”) relating to Illinois electricity load. The ...,,https://www.quarles.com/assets/images-t1768421937/23084.jpeg,,,2026-01-14 17:59:54.226579
,Costs & Impacts,2026-01-14 21:02:05+00:00,WFMZ.com,150+ residents turn out to hear plan for PFAS remediation in Palmerton water,,,,,,https://www.wfmz.com/news/area/poconos-coal/150-residents-turn-out-to-hear-plan-for-pfas-remediation-in-palmerton-water/article_e3f9c022-d4f8-4fc2-993d-2f4f41f590e1.html,"In 2024, PFAS were detected in municipal water supply wells near the Palmerton Zinc Pile Superfund site.",,https://bloximages.newyork1.vip.townnews.com/wfmz.com/content/tncms/assets/v3/editorial/5/cd/5cd4fa81-f28b-4d71-ae96-578dcbe7a4e1/6967e703d71cc.image.jpg?crop=1279%2C673%2C0%2C23&resize=1200%2C631&order=crop%2Cresize,,,2026-01-14 21:00:33.731502
,Opposition & Allies,2026-01-14 20:49:33+00:00,X (formerly Twitter),A Seattle federal judge denied a coalition of states' bid to preliminarily block the U.S. ...,,,,,,https://x.com/Law360/status/2011517457278636533,... Environmental Protection Agency from cutting solar power grant programs as they challenge the agency's termination of its $7 billion Biden-era ...,,,,,2026-01-14 17:59:54.226579
,,2026-01-14 20:47:56+00:00,www.wateronline.com,"EPA Proposes CWA Section 401 Rule To Streamline Permitting, Unleash Economic Growth, And Protect America's Waterways",,,,,,https://www.wateronline.com/doc/epa-proposes-cwa-section-rule-to-streamline-permitting-unleash-economic-growth-and-protect-america-s-waterways-0001,"Today, U.S. Environmental Protection Agency (EPA) announced a proposed rule that would return Clean Water Act (CWA) Section 401 to its proper statutory purpose, protecting water quality while eliminating regulatory overreach that has imposed unnecessary burden on critical infrastructure projects. This proposed rule would fulfill EPAs statutory role to ensure the water quality certification process operates within the clear boundaries established by Congress, maximizing permitting efficiency and eliminating unwarranted delays that have stifled economic growth. The changes directly support the essential role that state co-regulators and authorized tribes play in protecting water resources while advancing the Trump Administrations commitment to cooperative federalism.",,,,,2026-01-14 21:00:33.731502
,,2026-01-14 20:34:30+00:00,subscriber.politicopro.com,"E&E News: 18 Trump energy, enviro officials to watch in 2026",,,,,,https://subscriber.politicopro.com/article/eenews/2026/01/14/18-trump-energy-enviro-officials-to-watch-in-2026-00721909,"Meet the behind-the-scenes officials driving the president's ""energy dominance"" agenda. ",,https://static.politico.com/34/16/0ab7048f41f2ae65615c975f1ed3/trump-19210.jpg,,,2026-01-14 16:01:29.099263
,Clean Air & Water,2026-01-14 19:48:03+00:00,www.tnonline.com,EPA discusses Palmerton water | Times News Online,,,,,,https://www.tnonline.com/20260114/epa-discusses-palmerton-water/,"About 150 Palmerton residents flooded the Aquashicola Fire Company Tuesday night to hear an update from the Environmental Protection Agency.
The EPA answered questions on well testing, health concerns...",,https://imengine.prod.ltn.infomaker.io/?uuid=a77a38c6-a6f5-41b5-bb11-6f378a4fc412&function=fit&type=preview,,,2026-01-14 15:00:32.602445
,Costs & Impacts,2026-01-14 19:36:18+00:00,MS NOW,Opinion | Trump's EPA is giving companies a license to make Americans sick,,,,,,https://www.ms.now/opinion/epa-pollution-fine-particles-ozone,"The EPA is reportedly preparing to stop calculating the harm to people when regulating air pollution, focusing only on the harm to businesses.",,https://www.ms.now/wp-content/uploads/2026/01/260113-EPA-pollution-zz.jpg?w=1200&h=630&crop=1,,,2026-01-14 15:00:32.602445
,Opposition & Allies,2026-01-14 19:27:00+00:00,www.mitchellwilliamslaw.com,Waters of the United States/Clean Water Act: Arkansas Farm Bureau Comments on the U.S. EPA Proposed Rule,,,,,,https://www.mitchellwilliamslaw.com/waters-of-the-united-states/clean-water-act-arkansas-farm-bureau-comments-on-the-us-epa-proposed-rule,Environmental Protection Agency. Provide greater regulatory certainty/predictability/consistency by clarifying the definition of WOTUS. Implement ...,,https://www.mitchellwilliamslaw.com/images/site/Social_Logo.jpg,,,2026-01-14 17:59:54.226579
,,2026-01-14 19:19:19+00:00,National Institutes of Health (NIH),"Statement on the Appointment of Dr. Nicole Kleinstreuer as NIH Deputy Director for Program Coordination, Planning, and Strategic Initiatives",,,,,,https://www.nih.gov/about-nih/nih-director/statements/statement-appointment-dr-nicole-kleinstreuer-nih-deputy-director-program-coordination-planning-strategic-initiatives,"Dr. Kleinstreuer is internationally recognized for her leadership in developing innovative, human-relevant research strategies that improve public health protection.",,https://www.nih.gov/sites/default/files/styles/max_650x650/public/2025-06/nk-thumbnail_1.jpg?itok=XBaxudYs,,,2026-01-14 15:00:32.602445
,,2026-01-14 19:09:39+00:00,www.healthday.com,EPA May Stop Assessing Health Benefits When Setting Air Pollution Rules,,,,,,https://www.healthday.com/health-news/environmental-health/epa-may-stop-assessing-health-benefits-when-setting-air-pollution-rules,"WEDNESDAY, Jan. 14, 2026 (HealthDay News) — The U.S. Environmental Protection Agency (EPA) may soon stop putting a dollar value on the health benefits of cleane",,https://media.assettype.com/healthday-en%2F2025-07-30%2F1q6nohnm%2FAdobeStock1464005401EditorialUseOnly.jpeg?w=1200&ar=40%3A21&auto=format%2Ccompress&ogImage=true&mode=crop&enlarge=true&overlay=false&overlay_position=bottom&overlay_width=100,,,2026-01-14 17:59:54.226579
,North Carolina,2026-01-14 19:06:37+00:00,https://www.wect.com,"North Carolina finds PFAS chemicals in wastewater, soil across state",,,,,,https://www.wect.com/2026/01/13/north-carolina-finds-pfas-chemicals-wastewater-soil-across-state/,"North Carolina environmental officials have found PFAS chemicals in soil, wastewater and biosolids.",,https://gray-wect-prod.gtv-cdn.com/resizer/v2/XCPCCO5DYZE75NV3FHLXCMNRNE.jfif?auth=0e791360beb4c48edfd3fa08d5b4c88fc7eab0d1b5095f637c4bcf0c1b89c8b7&width=1200&height=600&smart=true,,,2026-01-14 15:00:32.602445
,Clean Air & Water,2026-01-14 19:01:36+00:00,www.instagram.com,30 years of nutrient data show progress in reducing sources of pollution! In a new ... - Instagram,,,,,,https://www.instagram.com/p/DTgIbpQExwl/,"... Environmental Protection Agency (EPA) find that despite growth in population and agriculture, nutrient data show promising trends from 1987 to ...",,,,,2026-01-14 17:59:54.226579
,,2026-01-14 19:01:00+00:00,www.cato.org,The Benefits of Fine Particulate Matter Regulation | Cato at Liberty Blog,,,,,,https://www.cato.org/blog/benefits-fine-particulate-matter-regulation,"Between 2006 and 2016, the Environmental Protection Agency (EPA) accounted for 71 percent of the monetized benefits and 55 percent of the costs of all ...",,,,,2026-01-14 17:59:54.226579
,Costs & Impacts,2026-01-14 18:53:16+00:00,mlive,Rural roads near Michigan potash mine to get $10M rebuild,,,,,,https://www.mlive.com/environment/2026/01/rural-roads-near-michigan-potash-mine-to-get-10m-rebuild.html,"Heavy truck-ready roads are required for the proposed Michigan Potash & Salt Mine’s viability, according to a county grant application.",,https://www.mlive.com/resizer/v2/BXH67VDIXNGDZDTEML74MNWFIE.jpg?auth=c172e87d34e5c0d7a52b2a5dad16e9571bf1a6ae1b66266544316452a9b7c6b6&width=1280&smart=true&quality=90,,,2026-01-14 17:59:54.226579
,,2026-01-14 18:52:36+00:00,US EPA,ICYMI: EPA Requests Nominations for Panel Members and Ad Hoc Reviewers for the Science Advisory Committee on Chemicals | US EPA,,,,,,https://www.epa.gov/chemicals-under-tsca/icymi-epa-requests-nominations-panel-members-and-ad-hoc-reviewers-science,Listserv soliciting nominations for scientific experts to be appointed to the Science Advisory Committee on Chemicals (SACC) panel.,,https://www.epa.gov/sites/all/themes/epa/img/epa-standard-og.jpg,,,2026-01-14 17:00:06.012365
,Costs & Impacts,2026-01-14 18:07:09+00:00,Inside Climate News,"New EPA Proposal Would Strip States’ and Tribes’ Authority to Block Oil and Gas Pipelines, Other Infrastructure Projects - Inside Climate News",,,,,,https://insideclimatenews.org/news/14012026/epa-proposal-streamlines-oil-gas-infrastructure-approval/,Environmental advocates warn the changes deprive states and tribes of their rights and weaken freshwater-quality protections.,,https://insideclimatenews.org/wp-content/uploads/2026/01/GettyImages-1233311659-1024x683.jpg,,,2026-01-14 15:00:32.602445
,,2026-01-14 17:50:01+00:00,MyLO,"LWVUS Submits Comments to EPA Opposing Changing Definition of ""Waters of the United States""",,,,,,https://my.lwv.org/new-york/utica-rome-metropolitan-area/article/lwvus-submits-comments-epa-opposing-changing-definition-waters-united-states,"The League of Women Voters of the United States submitted comments to the Environmental Protection Agency (EPA) opposing their proposal to change the definition of ""Waters of the United States"" (WOTUS).",,,,,2026-01-14 16:01:29.099263
,,2026-01-14 17:44:44+00:00,The Journalist's Resource,Q&A with economist W. Kip Viscusi,,,,,,https://journalistsresource.org/economics/value-statistical-life-kip-viscusi/,"As a major federal agency reportedly moves away from monetizing the health benefits of regulations, the economist who developed those metrics weighs in.",,https://journalistsresource.org/wp-content/uploads/2026/01/shawn-rain-FdZae6zV0JU-unsplash-scaled.jpg,,,2026-01-14 13:00:23.908925
,Costs & Impacts,2026-01-14 17:44:25+00:00,ProPublica,"After Sowing Distrust in Fluoridated Water, Kennedy and Skeptics Turn to Obstructing Other Fluoride Sources",,,,,,https://www.propublica.org/article/fluoride-supplements-fda-rfk-jr-ken-paxton-restrictions,"Florida and Utah have banned fluoridation, with multiple other states looking to do the same. Critics of fluoride in drinking water point to supplements as an alternative, but many are creating barriers to these very products.",,"https://www.propublica.org/wp-content/uploads/2026/01/GettyImages-1888389534_maxHeight_3000_maxWidth_3000.jpg?resize=2000,1333",,,2026-01-14 14:02:25.447957
,Costs & Impacts,2026-01-14 17:01:55+00:00,Chicago Tribune,"Nearly a year after asphalt spill in Chicago Sanitary and Ship Canal, EPA criticized for leaving cleanup unfinished",,,,,,https://www.chicagotribune.com/2026/01/14/chicago-sanitary-ship-canal-asphalt-spill/,Officials and environmentalists say there is still asphalt in the waterway and along the shore from the February spill in Bedford Park and Forest View.,,https://www.chicagotribune.com/wp-content/uploads/2026/01/CTC-LChicago-58240432.jpg?w=1024&h=740,,,2026-01-14 13:00:23.908925
,,2026-01-14 16:53:26+00:00,US EPA,EPA Hosts Public Meeting on Superfund Site Cleanup in Palmerton | US EPA,,,,,,https://www.epa.gov/newsreleases/epa-hosts-public-meeting-superfund-site-cleanup-palmerton,The U.S. Environmental Protection Agency's (EPA) Mid-Atlantic Region held a public meeting on Jan. 13 to update the Palmerton community on the ongoing cleanup efforts at the Palmerton Zinc Pile Superfund site and the local public water system.,,https://www.epa.gov/sites/all/themes/epa/img/epa-news-releases-og.jpg,,,2026-01-14 13:00:23.908925
,,2026-01-14 16:52:22+00:00,JD Supra,EPA’s New “Compliance First” Policy | JD Supra,,,,,,https://www.jdsupra.com/legalnews/epa-s-new-compliance-first-policy-7361017/,"On December 5, 2025, the U.S. Environmental Protection Agency’s Office of Enforcement and Compliance Assurance  issued a memorandum titled...",,https://jdsupra-static.s3.amazonaws.com/profile-images/og.15900_5945.jpg,,,2026-01-14 13:00:23.908925
,Costs & Impacts,2026-01-14 16:34:18+00:00,JD Supra,PFAS in Biosolids: What EPA’s Draft Risk Assessment Means for Industry and Municipalities | JD Supra,,,,,,https://www.jdsupra.com/legalnews/pfas-in-biosolids-what-epa-s-draft-risk-3734736/,The U.S. Environmental Protection Agency (EPA) released its 2025 Draft Risk Assessment for perfluorooctanoic acid (PFOA) and perfluorooctane sulfonic...,,https://jdsupra-static.s3.amazonaws.com/profile-images/og.16174_3024.jpg,,,2026-01-14 15:00:32.602445
