id,name,published,outlet,title,authors,category,market,categoryorder,articleorder,url,description,text,image,error,sentiment,firstEyes
,Costs & Impacts,2026-02-06 22:28:58+00:00,https://www.walb.com,"Fuel system failure spills 10,000 gallons at Hartsfield-Jackson Airport",,,,,,https://www.walb.com/2026/02/06/fuel-system-failure-spills-10000-gallons-hartsfield-jackson-airport/,The EPA said a fuel pit hydrant valve connected to a fuel system pipeline at the airport caused the spill.,,https://gray-walb-prod.gtv-cdn.com/resizer/v2/BMTTA3TU4ZERDHPQ7HVVEUN7XE.jpg?auth=6629f1415b4cc03788a9cb3d96617c36784c7ffc06ac141677dfb9c18c5b6589&width=1200&height=600&smart=true,,,2026-02-06 18:00:44.033931
,Opposition & Allies,2026-02-06 22:28:07+00:00,CalMatters,California union pushes work-from-home bill as Newsom calls state employees back to the office,,,,,,https://calmatters.org/politics/2026/02/telework-bill-pecg-state-workers/,The public employee union known as PECG is backing legislation that calls for the state to provide telework options as Gov. Gavin Newsom calls employees back to the office.,,https://calmatters.org/wp-content/uploads/2026/02/020626-CalEPA-MG-CM-01.jpg,,,2026-02-06 18:00:44.033931
,Costs & Impacts,2026-02-06 22:25:59+00:00,US EPA,Trump EPA Highlights Major Year One PFAS Actions to Combat Risks and Make America Healthy Again | US EPA,,,,,,https://www.epa.gov/newsreleases/trump-epa-highlights-major-year-one-pfas-actions-combat-risks-and-make-america-healthy,EPA released a top list of actions the agency has taken in the first year of the Trump Administration to combat risks from per- and polyfluoroalkyl substances (PFAS) contamination and Make America Healthy Again.,,https://www.epa.gov/sites/all/themes/epa/img/epa-news-releases-og.jpg,,,2026-02-06 18:00:44.033931
,,2026-02-06 22:24:25+00:00,Former EPA administrators reflect on work at IU Maurer event - Indiana Daily Student,Former EPA administrators reflect on work at IU Maurer event,,,,,,https://www.idsnews.com/article/2026/02/scientists-research-united-nations-climate-change-bloomington-indiana-campus,Gina McCarthy and Janet McCabe reflect on their careers.,,https://snworksceo.imgix.net/ids/52f24462-9821-4db9-a675-1cc0a1015d3a.sized-1000x1000.jpg?w=800&h=600,,,2026-02-06 18:00:44.033931
,Costs & Impacts,2026-02-06 22:18:17+00:00,www.sierraclub.org,Donald Trump Forgoes Enforcement of Toxic Coal Ash,,,,,,https://www.sierraclub.org/press-releases/2026/02/donald-trump-forgoes-enforcement-toxic-coal-ash,"Washington, D.C. - Today, Donald Trump’s Environmental Protection Agency gave a group of polluters a 33-month extension to clean up coal ash dump sites. This is twice as long an extension as what the EPA had proposed last year.",,,,,2026-02-06 18:00:44.033931
,Opposition & Allies,2026-02-06 21:20:30+00:00,Montana Department of Justice,  Attorney General Knudsen urges House Judiciary Committee to expand investigation into improper judicial influence ,,,,,,https://dojmt.gov/attorney-general-knudsen-urges-house-judiciary-committee-to-expand-investigation-into-improper-judicial-influence/,"HELENA – Montana Attorney General Austin Knudsen joined a 22-state coalition urging the U.S. House Judiciary Committee to expand its ongoing investigation into the improper influence of federal proceedings to include The Federal Judicial Center, which recently published a biased climate change manual for judges across the country.

In a letter sent Tuesday to the",,https://dojmt.gov/wp-content/uploads/2025/03/AG-logo-500x.png,,,2026-02-06 18:00:44.033931
,Costs & Impacts,2026-02-06 20:33:38+00:00,fox2now.com,Head of EPA says Mexico making progress stopping sewage from flowing into US - FOX 2,,,,,,https://fox2now.com/news/national/head-of-epa-says-mexico-making-progress-stopping-sewage-from-flowing-into-us/,Environmental Protection Agency Administrator Lee Zeldin spent Thursday in San Diego checking on progress being made on projects that are supposed ...,,,,,2026-02-06 16:01:09.439527
,,2026-02-06 20:30:25+00:00,Oklahoma Farm Report - Farm and Ranch Programming,EPA Actions Help Safeguard Water Systems from Cyberattacks - Oklahoma Farm Report,,,,,,https://www.oklahomafarmreport.com/2026/02/06/epa-actions-help-safeguard-water-systems-from-cyberattacks/,"Today, U.S. Environmental Protection Agency (EPA) is highlighting progress protecting water systems from cyberattacks in 2025. EPA's Office of Water (OW) proactively identified cybersecurity vulnerabilities at 277 water systems and worked to fix the issues with individualized solutions ranging from authentication protocols to enforcing strict access controls along with other technical updates and restrictions. Cyber",,,,,2026-02-06 16:01:09.439527
,Costs & Impacts,2026-02-06 20:13:17+00:00,www.usda.gov,"ICYMI: Secretary Rollins, Administrator Zeldin, and Administrator Loeffler Pen Joint Op-ed in ...",,,,,,https://www.usda.gov/about-usda/news/press-releases/2026/02/06/icymi-secretary-rollins-administrator-zeldin-and-administrator-loeffler-pen-joint-op-ed-newsweek,The U.S. Environmental Protection Agency (EPA) released guidance to manufacturers reaffirming the agency's position that the Clean Air Act (CAA) ...,,,,,2026-02-06 16:01:09.439527
,EPA Rollbacks,2026-02-06 20:08:19+00:00,Earthjustice,Trump EPA Delays Cleanup of Hundreds of Coal Ash Dumps in Advance of Larger Rollback,,,,,,https://earthjustice.org/press/2026/trump-epa-delays-cleanup-of-hundreds-of-coal-ash-dumps-in-advance-of-larger-rollback,The rule comes just days before a deadline for owners to report on previously unregulated coal ash dumping at power plant sites,,https://earthjustice.org/wp-content/uploads/coalash-waste_shutterstock_nenad-zivkovic.jpg,,,2026-02-06 16:01:09.439527
,Opposition & Allies,2026-02-06 19:38:04+00:00,The Allegheny Front,EPA decision could lead to reversal of clean air gains,,,,,,https://www.alleghenyfront.org/epa-decision-could-lead-to-reversal-of-clean-air-gains/,"In January, the U.S. Environmetal Protection Agency announced the economic value of human health benefits will no longer be a factor in air pollution regulations for soot and smog.",,https://www.alleghenyfront.org/wp-content/uploads/2017/06/pollution.jpg,,,2026-02-06 15:02:26.251766
,,2026-02-06 19:00:12+00:00,Tallahassee Democrat,Florida tests bread for Roundup chemical. Here's what they found,,,,,,https://www.tallahassee.com/story/news/2026/02/06/florida-tests-bread-food-toxin-results-best-worst/88543920007/,Florida's Department of Health tested popular bread brands for glyphosate. Here's what it found.,,"https://www.tallahassee.com/gcdn/authoring/authoring-images/2026/02/06/PTCN/88544042007-bread-tests.jpg?crop=479,269,x0,y53&width=479&height=269&format=pjpg&auto=webp",,,2026-02-06 15:02:26.251766
,Clean Air & Water,2026-02-06 18:56:41+00:00,www.dcwater.com,"DC Water Identifies Significant Rock Blockage in Potomac Interceptor, Impacting Cleaning ...",,,,,,https://www.dcwater.com/about-dc-water/media/news/dc-water-identifies-significant-rock-blockage-potomac-interceptor,"Consistent with public health and U.S. Environmental Protection Agency standards, E. coli levels which exceed 410 MPN/100 mL are considered unsafe.",,,,,2026-02-06 17:02:14.830124
,Opposition & Allies,2026-02-06 18:52:43+00:00,US EPA,ICYMI: EPA Sets Record Straight — Americans Have the Right to Repair Their Farm or Other Nonroad Diesel Equipment | US EPA,,,,,,https://www.epa.gov/newsreleases/icymi-epa-sets-record-straight-americans-have-right-repair-their-farm-or-other-nonroad,EPA Administrator Lee Zeldin set the record straight with guidance reaffirming American farmers and equipment owners’ right to repair the farm and other nonroad diesel equipment they own.,,https://www.epa.gov/sites/all/themes/epa/img/epa-news-releases-og.jpg,,,2026-02-06 15:02:26.251766
,Costs & Impacts,2026-02-06 18:52:41+00:00,US EPA,ICYMI: Administrator Zeldin Takes Additional Measures to Address Diesel Exhaust Fluid (DEF) Issues for American Farmers and Truckers | US EPA,,,,,,https://www.epa.gov/newsreleases/icymi-administrator-zeldin-takes-additional-measures-address-diesel-exhaust-fluid-def,"Administrator Lee Zeldin took another step to further the Trump EPA’s work to address widespread concerns from farmers, truckers, motor coach operators, and other diesel equipment operators regarding Diesel Exhaust Fluid (DEF) system failures.",,https://www.epa.gov/sites/all/themes/epa/img/epa-news-releases-og.jpg,,,2026-02-06 15:02:26.251766
,,2026-02-06 18:52:39+00:00,US EPA,EPA Selects 25 Organizations to Receive $12 Million in Brownfields Job Training Grants to Boost Local Economies and Clean Up Communities | US EPA,,,,,,https://www.epa.gov/newsreleases/epa-selects-25-organizations-receive-12-million-brownfields-job-training-grants-boost,EPA is announcing the selection of $12 million in Brownfields Job Training Grants to 25 grantees in communities across the United States.,,https://www.epa.gov/sites/all/themes/epa/img/epa-news-releases-og.jpg,,,2026-02-06 15:02:26.251766
,Costs & Impacts,2026-02-06 18:45:13+00:00,E&E News by POLITICO,Trump team: EPA pushback fueled fed-firing rule,,,,,,https://www.eenews.net/articles/trump-team-epa-pushback-fueled-fed-firing-rule/,The regulation is designed to swiftly remove policymaking civil servants who undermine the president’s directives.,,https://static.politico.com/dims4/default/55a1666/2147483647/resize/1200/quality/100/?url=https://static.politico.com/10/ee/f671e45e4c4ebdad95c94d8bd9b2/https-delivery-gettyimages.com/downloads/2252098055,,,2026-02-06 15:02:26.251766
,Costs & Impacts,2026-02-06 18:38:17+00:00,www.nea.org,Americans Want Scientific Research. The Government Cut It Anyway. | NEA,,,,,,https://www.nea.org/nea-today/all-news-articles/americans-want-scientific-research-government-cut-it-anyway,"According to new Pew survey, the U.S. public supports investment in research and wants to see the U.S. as a leader in the field.",,https://www.nea.org/sites/default/files/styles/1200x630/public/2026-02/scienctific_research.jpeg?itok=6pRs_fe4,,,2026-02-06 15:02:26.251766
,,2026-02-06 18:20:37+00:00,adanews.ada.org,EPA initiates accelerated review of fluoride in drinking water ,,,,,,https://adanews.ada.org/ada-news/2026/february/epa-initiates-accelerated-review-of-fluoride-in-drinking-water/,The ADA is urging members to contact the EPA after the agency said it will initiate an accelerated review of fluoride in drinking water.,,https://adanews.useast01.umbraco.io/media/m1ldl5xc/fluoride-faucet.jpg?width=1110&amp;height=700,,,2026-02-06 14:01:35.453811
,Costs & Impacts,2026-02-06 17:51:27+00:00,The Invading Sea,EPA’s new way of evaluating pollution rules hands deregulators a license to ignore public health | The Invading Sea,,,,,,https://www.theinvadingsea.com/2026/02/06/pollution-clean-air-act-epa-public-health-trump-ozone-pm2-5-cost-benefit-analysis-power-plants/,Health benefits will no longer be quantified when assessing the monetary impact of new pollution regulations.,,http://www.theinvadingsea.com/wp-content/uploads/2025/01/carbon-emissions-smokestack-sun.jpg,,,2026-02-06 14:01:35.453811
,Costs & Impacts,2026-02-06 17:29:33+00:00,neworleanscitybusiness.com,"Cameron pipeline blast shows why local air monitoring is needed, environmental group says",,,,,,https://neworleanscitybusiness.com/blog/2026/02/06/cameron-parish-pipeline-explosion-air-quality-monitoring/,"The law, approved in 2024, prevents data from monitors without U.S. Environmental Protection Agency certification from being used in any ...",,,,,2026-02-06 13:02:13.150521
,Clean Air & Water,2026-02-06 17:06:34+00:00,WPR,"PFAS levels in Great Lakes fish are dropping, study finds",,,,,,https://www.wpr.org/news/pfas-levels-great-lakes-fish-decline-study,A new study shows PFAS levels in Great Lakes fish are on the decline as manufacturers have phased out some chemicals in recent decades.,,https://www.wpr.org/wp-content/uploads/2019/11/15176006018_b4492b9a21_k_0.jpg,,,2026-02-06 13:02:13.150521
,Costs & Impacts,2026-02-06 17:02:13+00:00,R Street Institute,Low-Energy Fridays: What Is the Future of the Endangerment Finding? - R Street Institute,,,,,,https://www.rstreet.org/commentary/low-energy-fridays-what-is-the-future-of-the-endangerment-finding/,The “endangerment finding” is back in the news again. This is policy wonk shorthand for the 2009 determination by the Environmental Protection Agency (EPA) that greenhouse gases (GHGs) endanger the public and must be regulated. The reason for resurgent interest in the endangerment finding is that the Department of Energy (DOE) produced a report that would...,,https://www.rstreet.org/wp-content/uploads/2019/12/Carbon-Dioxide-Pollution-Sunset-Energy.jpg,,,2026-02-06 13:02:13.150521
,Opposition & Allies,2026-02-06 16:59:26+00:00,westvirginiawatch.com,WV GOP doesn't want you to have nice things,,,,,,https://westvirginiawatch.com/2026/02/06/wv-gop-doesnt-want-you-to-have-nice-things/,"For example, in January, McCuskey led a brief, along with 23 other attorneys general against the Environmental Protection Agency's Greenhouse Gas ...",,,,,2026-02-06 13:02:13.150521
,Costs & Impacts,2026-02-06 16:57:28+00:00,National League of Cities,PFAS Settlement Deadlines Updated: How to Secure Your City’s Share of Funding,,,,,,https://www.nlc.org/article/2026/02/06/pfas-settlement-deadlines-updated-how-to-secure-your-citys-share-of-funding/,"Authored by Ken Sansone, Senior Partner, SL Environmental Law Group & Kyla Tengdin, Marketing Manager, Education & Outreach, SL Environmental Law Group Note: This article provides an update to the…",,https://www.nlc.org/wp-content/uploads/2026/02/GettyImages-2255565202.jpg,,,2026-02-06 17:02:14.830124
,,2026-02-06 16:49:52+00:00,JRC Publications Repository,Towards Harmonized Soil Monitoring in the EU: An Inventory of Existing International and European Standards,,,,,,https://publications.jrc.ec.europa.eu/repository/handle/JRC144540,"The directive on soil monitoring and resilience (Soil Monitoring Law) was included in the Official Journal of the European Union (EU 2025/2360) on November 26th, 20225. After water and air, this Directive puts forward the first EU legislation on the soil environmental compartment. The directive establishes a harmonised soil monitoring framework for assessing the health of soils throughout the EU. A harmonised approach implies that standards become important to ensure intercomparability among, and within, Member States. The directive prescribes reference methodologies and requires transfer functions for other methods. The Directive also includes some standards for the monitoring and measuring of soil descriptors based on those being used through the LUCAS topsoil surveys from 2009 to 2022. The present technical report provides an inventory of 574 soil-related standards from international and European standard bodies including the International Organization for Standardisation (ISO) and the European Committee for Standardisation (CEN), as well as standards from other well-recognised international institutions including the United States Environmental Protection Agency (EPA) and the Food and Agriculture Organization of the United Nations (FAO-GLOSOLAN). There is a need for harmonisation of soil-related standards to ensure consistency and comparability of soil data and to support effective soil management and protection efforts.",,https://publications.jrc.ec.europa.eu/repository/cover/JRC144540_cover.jpg,,,2026-02-06 13:02:13.150521
,,2026-02-06 16:44:07+00:00,JD Supra,EPA Proposes to Narrow Scope of Clean Water Act Section 401 Water Quality Certifications – Comment Deadline Looming | JD Supra,,,,,,https://www.jdsupra.com/legalnews/epa-proposes-to-narrow-scope-of-clean-1961504/,"On January 13, 2026, the United States Environmental Protection Agency (EPA) announced a proposed rule, to be codified as 40 C.F.R. Part 121,...",,https://jdsupra-static.s3.amazonaws.com/profile-images/og.15900_5945.jpg,,,2026-02-06 13:02:13.150521
,,2026-02-06 16:37:07+00:00,www.facebook.com,"1.3K views | BONG: FPA VIDEO: The Executive Director of the Environmental Protection Agency (EPA), together with his team, has met with MNG Gold’s Head of Environment, Raphael A. Kennedy, following a chemical spill from MNG’s cargo in Money Sweet Town, District Two, Bong County | FrontPage Africa",,,,,,https://www.facebook.com/frontpageafrica/videos/bong-fpa-video-the-executive-director-of-the-environmental-protection-agency-epa/1614770469558732/,"BONG: FPA VIDEO: The Executive Director of the Environmental Protection Agency (EPA), together with his team, has met with MNG Gold’s Head of Environment, Raphael A. Kennedy, following a chemical...",,https://scontent-iad3-1.xx.fbcdn.net/v/t15.5256-10/629312249_1448053916897650_2645582864379204916_n.jpg?_nc_cat=108&ccb=1-7&_nc_sid=a27664&_nc_ohc=6HCSjpndBhgQ7kNvwEmle_i&_nc_oc=AdnDhBbfITd7TVWwMc6F0qe7upIs2B7UjLaPcm06LF9TjYBrKTgZ6P-gFvbud7aqTr7W3CuuTF6-sXr2MOLSZBKF&_nc_zt=23&_nc_ht=scontent-iad3-1.xx&_nc_gid=9rnA31giQpWETE_Ip6phDg&oh=00_AftY2H21kHZmkY4As3ws-E8vyE7Ts3ZxCX7-P-sInF5ncA&oe=698BF43A,,,2026-02-06 14:01:35.453811
,,2026-02-06 16:33:29+00:00,downloads.regulations.gov,ENVIRONMENTAL PROTECTION AGENCY - Regulations.gov,,,,,,https://downloads.regulations.gov/EPA-R07-OAR-2025-0289-0004/content.pdf,ENVIRONMENTAL PROTECTION AGENCY. State Implementation Plans (SIPs) Summary. Section 110. Plan Name: State(s):. Submitted By: Submitted: MO_10 CSR 10 ...,,,,,2026-02-06 14:01:35.453811
,Costs & Impacts,2026-02-06 16:27:15+00:00,https://www.kswo.com,EPA conducts PFAS water testing at Oklahoma military installations,,,,,,https://www.kswo.com/2026/02/06/epa-conducts-pfas-water-testing-oklahoma-military-installations/,"Agency sampling nearly every base in state for ‘forever chemicals’ in water supply.
",,https://gray-kswo-prod.gtv-cdn.com/resizer/v2/PERBWCXPNJACVEUYLXH6HDKE3Y.bmp?auth=fe7cf6dab3c9e9090847e0629fec23a03057534843b28f8e76186f1703daeeff&width=1200&height=600&smart=true,,,2026-02-06 13:02:13.150521
,Opposition & Allies,2026-02-06 16:22:38+00:00,WPBF,State warns families about glyphosate levels in popular bread brands,,,,,,https://www.wpbf.com/article/florida-state-warns-families-about-glyphosate-levels-in-popular-bread-brands/70261655,Florida officials identify popular bread brands with reportedly high levels of a toxin.,,"https://kubrick.htvapps.com/vidthumb/7b848693-a727-43d7-acc0-bec5ca4dfcad/22fc5d92-9542-4a7e-9e87-924ea5c137e7.jpg?crop=1xw:1.0xh;center,top&resize=1200:*",,,2026-02-06 14:01:35.453811
,Costs & Impacts,2026-02-06 16:22:28+00:00,www.nytimes.com,When Venezuelan Oil Comes to the U.S. - The New York Times,,,,,,https://www.nytimes.com/2026/02/05/climate/when-venezuelan-oil-comes-to-the-us.html,"... Environmental Protection Agency, U.S. Department of the Interior, Donald Trump. Add a comment. Share full article. 0. The Latest on the Trump ...",,,,,2026-02-06 13:02:13.150521
,,2026-02-06 16:12:52+00:00,ScienceAlert,Mormon Hair Clippings Preserve Legacy of US Ban on Leaded Gas,,,,,,https://www.sciencealert.com/mormon-hair-clippings-preserve-legacy-of-us-ban-on-leaded-gas,Hair samples preserved in family scrapbooks across the past century have revealed the success of the US Environmental Protection Agency's (EPA) efforts to crack down on lead pollution since the 1970s.,,https://www.sciencealert.com/images/2026/02/lock-of-hair.jpg,,,2026-02-06 13:02:13.150521
,,2026-02-06 15:51:30+00:00,www.linkedin.com,The latest GHG Indicator Report and more - January updates from the EPA | Environmental Protection Agency (EPA) Ireland,,,,,,https://www.linkedin.com/posts/environmental-protection-agency-ireland_the-latest-ghg-indicator-report-and-more-activity-7425561442713673728-Co1J,"Welcome to The Month in 5 Updates, a concise overview of Ireland‚Äôs key environmental developments throughout January.
¬†
In this edition, we take a closer look at the latest Greehouse Gas Indicator Report, explore the latest Climate Change in the Irish Mind article, and share a new career opportunity at the EPA, along with other key updates shaping Ireland‚Äôs environmental landscape.
¬†
üëá¬†You can access the full newsletter for more information, and we would love to hear your comments.",,https://media.licdn.com/dms/image/v2/D4D12AQEn8wAyVa6zBQ/article-cover_image-shrink_720_1280/B4DZwuZX61IwAI-/0/1770304933151?e=2147483647&v=beta&t=8QfIoD-T4HPW55eipx1YXdAieJN_kKjlWPnQg_m25es,,,2026-02-06 14:01:35.453811
,,2026-02-06 15:39:19+00:00,lawschool.unm.edu,School of Law Professor Cliff Villa Publishes Fourth Edition of Environmental Justice,,,,,,https://lawschool.unm.edu/news/2026/01/school-of-law-professor-cliff-villa-publishes-fourth-edition-of-environmental-justice-law-policy-and-regulation.html,He served in the Biden administration within the U.S. Environmental Protection Agency (EPA) as the political head of Office of Land and Emergency ...,,,,,2026-02-06 14:01:35.453811
,Costs & Impacts,2026-02-06 15:38:20+00:00,www.mass.gov,MassDEP Cracks Down on Illegal Mattress Dumping in Mattapan - Mass.gov,,,,,,https://www.mass.gov/news/massdep-cracks-down-on-illegal-mattress-dumping-in-mattapan,"BOSTON — The Massachusetts Department of Environmental Protection (MassDEP) has assessed a $17,400 penalty to Geraghty Associates, Inc., ...",,,,,2026-02-06 14:01:35.453811
,,2026-02-06 15:33:28+00:00,www.facebook.com,The Environmental Protection Agency has pursued an aggressive deregulatory agenda.,,,,,,https://www.facebook.com/theoregonian/posts/the-environmental-protection-agency-has-pursued-an-aggressive-deregulatory-agend/1290553546453134/,The Environmental Protection Agency has pursued an aggressive deregulatory agenda. How environmental enforcement has dropped under Trump. OREGONLIVE.,,,,,2026-02-06 12:04:58.193340
,,2026-02-06 15:20:01+00:00,action.nrdc.org,Protect our clean water from corporate polluters | NRDC,,,,,,https://action.nrdc.org/letter/4735-clean-water-act-012926%3Finitms%3DWBSNACWAPETC30126%26ms%3DWBSNACWAPETC30126,A dangerous new Environmental Protection Agency (EPA) proposal would drastically restrict the rights of states and Tribes to deny or modify ...,,,,,2026-02-06 12:04:58.193340
,Costs & Impacts,2026-02-06 14:13:48+00:00,frontpageafricaonline.com,Liberia: EPA Issues Clarification on Associated Press and Gecko Project Report on Bea ...,,,,,,https://frontpageafricaonline.com/environment/liberia-epa-liberia-issues-clarification-on-associated-press-and-gecko-project-report-on-bea-mountain-mining-operations/,Monrovia — The Environmental Protection Agency (EPA) has issued a clarification in response to an investigative report published by the Associated ...,,,,,2026-02-06 14:01:35.453811
,,2026-02-06 13:27:41+00:00,Nature,Risk assessment of trihalomethanes in drinking water with seasonal variation considerations - Scientific Reports,,,,,,https://www.nature.com/articles/s41598-025-30481-9,"This study evaluated the concentrations of trihalomethanes (THMs) in Alexandria’s drinking water across seven districts during summer and winter, and assessed the associated cancer risks. THMs, byproducts of water chlorination, are known for their potential carcinogenicity. A total of 35 drinking water samples were analyzed using gas chromatography with an electron capture detector (GC-ECD) to determine the concentrations of chloroform (CF), bromodichloromethane (BDCM), dibromochloromethane (DBCM), and bromoform (BF). The results revealed significant seasonal variations. Region-2 recorded the highest summer concentration (150&nbsp;µg/L), while Region-7 had the highest winter concentration (196&nbsp;µg/L). Hazard index (HI) calculations indicated that chloroform contributed the most to non-carcinogenic risks, with Region-7 recording an HI of 0.5698 in winter, while Region-2 showed a summer HI of 0.4843. Carcinogenic risk assessments using the USEPA methodology showed lifetime cancer risks significantly exceeding the acceptable threshold of 1 × 10−6, with an annual average total cancer risk of 67.027 × 10−6. These outcomes highlight the critical need for Alexandria to adopt advanced water treatment methods, such as ozonation and UV disinfection, optimize chlorine dosing, and strengthen routine monitoring to ensure compliance with safety standards and protect public health to safer drinking water and better health outcomes for Alexandria’s residents.",,,,,2026-02-06 13:02:13.150521
