id,name,published,outlet,title,authors,category,market,categoryorder,articleorder,url,description,text,image,error,sentiment,firstEyes
,EPA Rollbacks,2026-02-05 19:31:07+00:00,California Cotton Ginners and Growers Association,EPA Strikes Down Part of Heavy-Duty Truck Inspection Program,,,,,,https://ccgga.org/epa-strikes-down-part-of-heavy-duty-truck-inspection-program/,"Cotton, Cotton Associations, Cotton Bales, Cotton Growers, Cotton Ginners, Ginning, Cotton Research, Used Gin Equipment, Ag Industry Issues, History of Cotton, Cotton Education, Cotton Info, SPCC, Agriculture, California, Regulations",,https://ccgga.org/wp-content/themes/twentytwelve/images/logo2.png,,,2026-02-05 18:00:56.301271
,Costs & Impacts,2026-02-05 19:27:04+00:00,www.instagram.com,South Bay sewage crisis | The Administrator of the Environmental Protection Agency ... - Instagram,,,,,,https://www.instagram.com/reel/DUYvHktAELg/,"Progress is being made but many say not quickly enough. So, the former IB mayor and current county supervisor Paloma Aguiri is set to meet with the ...",,,,,2026-02-05 15:01:00.332130
,,2026-02-05 19:08:38+00:00,www.spglobal.com,Calumet Inc. Outlook Revised To Positive From Sta | S&P Global Ratings,,,,,,https://www.spglobal.com/ratings/en/regulatory/article/-/view/type/HTML/id/3513639,"Additionally, the Environmental Protection Agency's (EPA) recent decisions on small refinery exemption (SRE) applications and the extension of the ...",,,,,2026-02-05 18:00:56.301271
,,2026-02-05 18:52:16+00:00,www.justice.gov,Florida Man Pleads Guilty to Biofuel Fraud Conspiracy | United States Department of Justice,,,,,,https://www.justice.gov/usao-sdfl/pr/florida-man-pleads-guilty-biofuel-fraud-conspiracy-0,... Environmental Protection Agency (EPA) renewable fuels credits and sought over $6 million in fraudulent tax credits connected to the purported ...,,,,,2026-02-05 15:01:00.332130
,,2026-02-05 18:32:47+00:00,hillcopartners.com,Public Hearing on EPA’s Proposed Updates to Section 401 of CWA,,,,,,https://hillcopartners.com/89th-interim-energy-environment/public-hearing-on-epas-proposed-updates-to-section-401-of-cwa/,"On January 13, 2026, the U.S. Environmental Protection Agency announced a proposed rule to revise the existing Clean Water Act (CWA) Section 401 water quality certification regulations. EPA is accepting public comments on the proposed rule through February 17, 2026. The EPA will host a third public meeting session regarding the proposal on Thursday, February 5, 2026, from 12-3 p.m. To attend [...]",,,,,2026-02-05 16:00:42.787392
,Opposition & Allies,2026-02-05 18:31:56+00:00,E&E News by POLITICO,"Zeldin to LA: If you want wildfire recovery money, ditch Newsom",,,,,,https://www.eenews.net/articles/zeldin-to-la-if-you-want-wildfire-recovery-money-ditch-newsom/,The EPA administrator said that wildfire-scarred local governments might have better success in unlocking federal dollars if they abandoned the governor's,,https://static.politico.com/dims4/default/55a1666/2147483647/resize/1200/quality/100/?url=https://static.politico.com/37/41/831d7c2d4bc98d5a2ff3b3bc5e2c/https-delivery-gettyimages.com/downloads/2231529607,,,2026-02-05 14:05:48.898272
,Costs & Impacts,2026-02-05 18:28:33+00:00,Civil Eats,EPA Affirms Farmers’ Right to Repair,,,,,,https://civileats.com/2026/02/05/epa-affirms-farmers-right-to-repair/,"The agency issued new guidance on a Biden-era policy, which prohibits manufacturers from using environmental laws to prevent repair work.",,https://civileats.com/wp-content/uploads/2026/02/260205-food-policy-tracker-right-to-repair-tractors-John-deere-congress-epa-usda-monopoly-biden-1-credit-lutz-blohm-flickr.jpg,,,2026-02-05 14:05:48.898272
,Clean Air & Water,2026-02-05 18:25:09+00:00,Chemical & Engineering News,"Judge rules DOE climate group illegal, but lets their science stand",,,,,,https://cen.acs.org/policy/litigation/doe-climate-working-group-illegal/104/web/2026/02,The scientific community called the group’s July 2025 report ‘fundamentally incorrect.’ The EPA can use it to slash regulations anyway,,/content/dam/cen/104/02/05/WEB/Judge-rules-DOE-group-illegal--but-not-their-climate-report---339333.jpg,,,2026-02-05 14:05:48.898272
,,2026-02-05 18:17:53+00:00,public-inspection.federalregister.gov,6560-50-P ENVIRONMENTAL PROTECTION AGENCY 40 CFR Part 52 [EPA-R09-OAR-2025-0101,,,,,,https://public-inspection.federalregister.gov/2026-02344.pdf,"On October 23, 2025, the EPA proposed to approve the 2022 Nevada Regional Haze Plan. (excluding the portions withdrawn on July 27, 2023) and appendix ...",,,,,2026-02-05 16:00:42.787392
,Costs & Impacts,2026-02-05 17:48:29+00:00,earthjustice.org,1 19TH JUDICIAL DISTRICT COURT PARISH OF EAST BATON ROUGE STATE OF ... - Earthjustice,,,,,,https://earthjustice.org/document/formosa-psd-permit-extension-petition-for-judicial-review,"Lastly, LDEQ ignored—without explanation—U.S. Environmental Protection Agency (“EPA”) policy on PSD extensions that would have at least required ...",,,,,2026-02-05 14:05:48.898272
,Costs & Impacts,2026-02-05 17:38:52+00:00,ABC7 Los Angeles,Trump officials outline president's wildfire rebuilding plan during Palisades visit,,,,,,https://abc7.com/post/trump-officials-outline-presidents-wildfire-rebuilding-plan-during-pacific-palisades-visit/18543723/,Trump administration officials visited Pacific Palisades to explain the president's executive order to accelerate rebuilding efforts following last year's wildfires.,,https://cdn.abcotvs.com/dip/images/18545212_palisades-rebuild.jpg?w=1600,,,2026-02-05 16:00:42.787392
,Costs & Impacts,2026-02-05 17:27:07+00:00,PEER.org,"PEERMail | PEER sues EPA, New Additions and More",,,,,,https://peer.org/peermail-peer-sues-epa-new-additions-and-more/,"The atmosphere at federal agencies has become toxic, with employees enduring more than a year of attacks from their political leaders.",,https://peer.org/wp-content/uploads/2026/02/PEERMail-Web-1-2.5.26.png,,,2026-02-05 15:01:00.332130
,Costs & Impacts,2026-02-05 17:14:47+00:00,www.chegg.com,Fore Farms reported a pretax operating loss of $137 | Chegg.com,,,,,,https://www.chegg.com/homework-help/questions-and-answers/fore-farms-reported-pretax-operating-loss-137-million-financial-reporting-purposes-2027-co-q262546028,﻿Contributing to the loss were(a) ﻿a penalty of $5 ﻿million assessed by the Environmental Protection Agency for violation of a federal law and paid in ...,,,,,2026-02-05 14:05:48.898272
,Clean Air & Water,2026-02-05 17:13:35+00:00,US EPA,EPA Stops Industrial Discharge and Launches Source Pollution Study in Elizabeth River Tributary | US EPA,,,,,,https://www.epa.gov/newsreleases/epa-stops-industrial-discharge-and-launches-source-pollution-study-elizabeth-river,"U.S. Environmental Protection Agency (EPA) is investigating industrial pollution in Hillside, New Jersey after receiving a public complaint about an odorous, slimy residue in an Elizabeth River tributary.",,https://www.epa.gov/sites/all/themes/epa/img/epa-news-releases-og.jpg,,,2026-02-05 14:05:48.898272
,,2026-02-05 17:12:28+00:00,floridadep.gov,"February 13, 2026, Acquisition and Restoration Council Meeting Agenda | Florida ...",,,,,,https://floridadep.gov/lands/environmental-services/content/february-13-2026-acquisition-and-restoration-council-meeting,"The Florida Department of Environmental Protection is the state's lead ... agency for environmental management and stewardship – protecting our air, ...",,,,,2026-02-05 14:05:48.898272
,Costs & Impacts,2026-02-05 17:09:26+00:00,www.reuters.com,US environmental enforcement by Trump's EPA drops to record low | Reuters,,,,,,https://www.reuters.com/legal/litigation/us-environmental-enforcement-by-trumps-epa-drops-record-low-2026-02-05/,"Just 16 complaints were filed in civil court by the Justice Department on behalf of the Environmental Protection Agency, down 76% from the first year ...",,,,,2026-02-05 14:05:48.898272
,EPA Rollbacks,2026-02-05 17:08:06+00:00,Chamber Business News,"EPA proposal to roll back “Good Neighbor Plan” welcomed by Arizona business community, manufacturers - Chamber Business News",,,,,,https://chamberbusinessnews.com/2026/02/05/epa-proposal-to-roll-back-good-neighbor-plan-welcomed-by-arizona-business-community-manufacturers/,"Arizona’s business and manufacturing community is closely watching a new proposal from the U.S. Environmental Protection Agency that would restore a more cooperative, state-led approach to air quality regulation and remove Arizona from the Biden-era “Good Neighbor Plan.” EPA late last month proposed approving Arizona’s State Implementation Plan (SIP) for the 2015 eight-hour ozone National […]",,https://chamberbusinessnews.com/wp-content/uploads/2026/02/Gemini_Generated_Image_451xwq451xwq451x-1024x559.png,,,2026-02-05 16:00:42.787392
,Costs & Impacts,2026-02-05 17:02:34+00:00,www.wabe.org,Inside the toxic legacy of Georgia's multibillion-dollar carpet empire - WABE,,,,,,https://www.wabe.org/inside-the-toxic-legacy-of-georgias-multibillion-dollar-carpet-empire/,"The Georgia Environmental Protection Division, which declined an interview request, said it “relies on the expertise of” the EPA. Meanwhile, carpet ...",,,,,2026-02-05 14:05:48.898272
,,2026-02-05 16:59:56+00:00,westernagnetwork.com,National Environmental Stewardship Award Presented to Nebraska Ranch,,,,,,https://westernagnetwork.com/national-environmental-stewardship-award-presented-to-nebraska-ranch,"The National Cattlemen’s Beef Association (NCBA) has announced that Wine Glass Ranch in Imperial, Nebraska, is the 2025 Environmental Stewardship Award Program (ESAP) National winner. The award, which annually recognizes the outstanding stewardship practices and conservation achievements of cattle producers, was presented to the Pribbeno family, during CattleCon 2026 in Nashville, Tennessee.",,https://westernagnetwork.com/images/img_Qejx9nEZzTew3vrxXKQUMf/esap-26-winner-for-website.png?preset=facebook,,,2026-02-05 16:00:42.787392
,,2026-02-05 16:09:03+00:00,Entergy,Water heating: 6 ways to save,,,,,,https://www.entergy.com/blog/water-heating-6-ways-to-save,Did you know that water heating is the second largest energy user in the average home? The following tips can help you reduce the amount of water your family uses and the energy it takes heat it. You’…,,https://www.entergy.com/wp-content/uploads/2026/02/HandWashingNewsroom2026.jpg,,,2026-02-05 12:02:02.868067
,Costs & Impacts,2026-02-05 16:00:04+00:00,www.sierraclub.org,Legislation to require radon mitigation in new residences,,,,,,https://www.sierraclub.org/iowa/blog/2026/02/legislation-require-radon-mitigation-new-residences,A bill has been introduced that would require passive radon mitigation be installed in new residences.,,https://www.sierraclub.org/sites/default/files/styles/sierra_full_page_width/public/sce-uploads/blogs/IA%20capitol.jpg.webp?itok=ovHZlkOK,,,2026-02-05 14:05:48.898272
,,2026-02-05 15:59:10+00:00,www.hklaw.com,Understanding MOSAIC and the Future of eVTOL Regulation with Katie Inman of Holland & Knight | Insights | Holland & Knight,,,,,,https://www.hklaw.com/en/insights/media-entities/2026/02/understanding-mosaic-and-the-future-of-evtol-regulation,,,https://www.hklaw.com/-/media/images/twittercards/hk_opengraph.png?rev=ec0d75523b1f4e68920e3e1b42304866&sc_lang=en&hash=3345DDE33F8D43A99B42BABA11D22AF8,,,2026-02-05 14:05:48.898272
,Costs & Impacts,2026-02-05 15:51:45+00:00,US EPA,Administrator Zeldin Travels to Los Angeles to Meet with Wildfire Victims and Local Officials to Discuss Fast Tracking the Rebuild Process | US EPA,,,,,,https://www.epa.gov/newsreleases/administrator-zeldin-travels-los-angeles-meet-wildfire-victims-and-local-officials,EPA and SBA leaders met with local residents and government officials to discuss ways to fast track the rebuilding of communities devastated by the Palisades and Eaton fires one year ago.,,https://www.epa.gov/sites/all/themes/epa/img/epa-news-releases-og.jpg,,,2026-02-05 11:02:21.425044
,,2026-02-05 15:48:46+00:00,Department of Environmental Conservation,DEC Sets Youth Conservation Program Dates,,,,,,https://dec.ny.gov/news/press-releases/2026/2/dec-sets-youth-conservation-program-dates,"New York State Department of Environmental Conservation (DEC) Regional Director Cathy Haas announced a two-day, hands-on youth hunting safety course to be offered in April by DEC’s Hunter Education Program.",,,,,2026-02-05 15:01:00.332130
,Opposition & Allies,2026-02-05 15:43:14+00:00,www.instagram.com,Iowa's attorney general says the status quo hurts farmers and the entire agriculture industry.,,,,,,https://www.instagram.com/reel/DUYa_lFio-U/,So here's a copy of the letter that was sent to the EPA administrator Lee Zelden where AG Bird says that the current mandate effectively bans the ...,,,,,2026-02-05 11:02:21.425044
,,2026-02-05 15:42:34+00:00,www.youtube.com,EPA Administrator Lee Zeldin to visit San Diego Thursday - YouTube,,,,,,https://www.youtube.com/watch%3Fv%3D1jWHTbySVcA,U.S. Environmental Protection Agency Administrator Lee Zeldin will visit San Diego Thursday to discuss the Tijuana River sewage crisis.,,,,,2026-02-05 11:02:21.425044
,,2026-02-05 15:41:47+00:00,"Bergeson & Campbell, P.C.","2026 Forecast: TSCA Reform Developments — A Conversation with Richard E. Engler, Ph.D. and Ryan N. Schmit - Bergeson & Campbell, P.C.",,,,,,https://www.lawbc.com/2026-forecast-tsca-reform-developments-a-conversation-with-richard-e-engler-ph-d-and-ryan-n-schmit/,"This week, I had the pleasure of speaking with Dr. Richard E. Engler, Director of Chemistry for B&C and The Acta Group (Acta®), our consulting",,https://www.lawbc.com/wp-content/uploads/yoast-1.png,,,2026-02-05 14:05:48.898272
,,2026-02-05 15:16:19+00:00,www.al.com,Some federal workers are getting 3.8% pay raises instead of 1%: Here's the list - al.com,,,,,,https://www.al.com/news/2026/02/some-federal-workers-are-getting-38-pay-raises-instead-of-1-heres-the-list.html,"Office of Safety, Security, and Protection: employees providing personal protection services ... Environmental Protection Agency, Department of ...",,,,,2026-02-05 14:05:48.898272
,Costs & Impacts,2026-02-05 15:14:21+00:00,www.facebook.com,In this morning's Streamline newsletter: -- EPA head returns to San Diego to discuss sewage crisis,,,,,,https://www.facebook.com/ABC10News/posts/in-this-mornings-streamline-newsletter-epa-head-returns-to-san-diego-to-discuss-/1316847103807544/,"Mexico to dump millions of gallons of sewage into Tijuana River, US continues to be a dumping ground: Official. Jeff Soucek and 114 others.",,,,,2026-02-05 11:02:21.425044
,,2026-02-05 15:11:25+00:00,eponline.com,Industry -- Environmental Protection,,,,,,https://eponline.com/portals/industry.aspx%3Fadmgarea%3Dht.hydraulicfracturing,"A new audit highlights weaknesses in monitoring and documentation practices tied to large federal environmental grants, underscoring the importance of ...",,,,,2026-02-05 11:02:21.425044
,,2026-02-05 14:58:58+00:00,Manhattan Institute,New Report: How Stormwater Reform Could Lower Housing Costs ,,,,,,https://manhattan.institute/article/new-report-how-stormwater-reform-could-lower-housing-costs,"Federal runoff mandates add thousands to development costs while delivering limited environmental benefits NEW YORK, NY – In elections, policy debates, and news headlines, discussions of the affordability crisis overwhelmingly focus on housing. Although housing policy is largely determined at the local level, rising costs have affected Americans nationwide and led federal officials, including President Trump and […]",,https://media4.manhattan-institute.org/wp-content/uploads/mi-blue-social-card-default.jpg,,,2026-02-05 14:05:48.898272
,Costs & Impacts,2026-02-05 14:34:21+00:00,Business Journal Daily | The Youngstown Publishing Company,Ohio EPA Provides Funds for Trumbull Gas Station Cleanups,,,,,,https://businessjournaldaily.com/ohio-epa-provides-funds-for-trumbull-gas-station-cleanups/,"Work should get underway soon to remediate five former gas station sites in Trumbull County, a TNP representative said.",,https://businessjournaldaily.com/wp-content/uploads/2026/02/Former-gas-station-site-2855-Tod-Ave-SW-Warren.jpg,,,2026-02-05 10:02:08.684980
,Opposition & Allies,2026-02-05 14:19:22+00:00,JD Supra,Taconite Iron Ore Processing Facilities/Clean Air Act: Natural Resource Defense Council Federal District Court Action Challenging EPA Temporary NESHAP Exemption | JD Supra,,,,,,https://www.jdsupra.com/legalnews/taconite-iron-ore-processing-facilities-5547059/,"The Natural Resource Defense Council, Inc. and Minnesota Center for Environmental Advocacy (collectively, “NRDC”) filed a February 2nd Complaint for...",,https://jdsupra-static.s3.amazonaws.com/profile-images/og.15833_1120.jpg,,,2026-02-05 10:02:08.684980
,Costs & Impacts,2026-02-05 13:37:00+00:00,www.economist.com,In America science-sceptics are now in charge - The Economist,,,,,,https://www.economist.com/science-and-technology/2026/02/04/in-america-science-sceptics-are-now-in-charge,"... Environmental Protection Agency were rejected in the budget passed by Congress on January 15th, for example. Grant Witness, a project that tracks ...",,,,,2026-02-05 12:02:02.868067
,,2026-02-05 13:22:13+00:00,www.justice.gov,Bexar County Man Indicted for Tampering with Public Water Systems - Department of Justice,,,,,,https://www.justice.gov/usao-wdtx/pr/bexar-county-man-indicted-tampering-public-water-systems,The FBI and the Environmental Protection Agency's Office of Enforcement and Compliance Assurance are investigating the case. Assistant U.S. ...,,,,,2026-02-05 09:00:55.114122
,,2026-02-05 12:44:17+00:00,American Enterprise Institute - AEI,Comment to the National Highway Traffic Safety Administration,,,,,,https://www.aei.org/articles/comment-to-the-national-highway-traffic-safety-administration/,Notice of Availability of the 11th National Outer Continental Shelf Oil and Gas Leasing Draft Proposed Program:1st Analysis and Proposal,,https://www.aei.org/wp-content/uploads/2025/07/whyai072125.jpg,,,2026-02-05 09:00:55.114122
,,2026-02-05 12:43:13+00:00,www.linkedin.com,"The EPA welcomes the outcomes of the International Atomic Energy Agency (IAEA) Integrated Regulatory Review Service (IRRS) Mission to Ireland, which took place between 19th and 28th January 2026. The… | Environmental Protection Agency (EPA) Ireland",,,,,,https://www.linkedin.com/posts/environmental-protection-agency-ireland_the-epa-welcomes-the-outcomes-of-the-international-activity-7425147960566521858-HCgv,"The EPA welcomes the outcomes of the International Atomic Energy Agency (IAEA) Integrated Regulatory Review Service (IRRS) Mission to Ireland, which took place between 19th and 28th January 2026. The report’s findings will help shape our next steps as we continue strengthening our regulatory framework and upholding the highest standards of radiation protection in Ireland. We particularly welcome the IAEA’s recognition of the EPA’s Generative AI policy as a good practice. 
 
The EPA is fully committed to implementing the report’s findings and will continue to maintain close collaboration with the HIQA - Health Information and Quality Authority and with our parent department—the Department of Climate, Energy and the Environment—to ensure that Ireland’s regulatory system remains robust, effective, and aligned with the highest IAEA safety standards. ",,https://media.licdn.com/dms/image/v2/D4D22AQEhKDiNzV0mtw/feedshare-shrink_800/B4DZwtsuIBI4Ag-/0/1770293224510?e=2147483647&v=beta&t=lzZ-wowxSxOusOdE1bSUuSdaPy_ZpYVpNP8pOJe6NpI,,,2026-02-05 12:02:02.868067
,,2026-02-05 12:32:57+00:00,Biofuels International,"The biofuels industry 2026: Innovation, opportunity and leadership",,,,,,https://biofuels-news.com/news/the-biofuels-industry-2026-innovation-opportunity-and-leadership/,"In the US, the Environmental Protection Agency (EPA) has proposed record-high Renewable Fuel Standard (RFS) quotas ...",,https://biofuels-news.com/wp-content/uploads/2026/02/Pic-2-EcoCeres-Hebei-Luanzhou-Plant-768x432.jpg,,,2026-02-05 12:02:02.868067
,,2026-02-05 12:22:00+00:00,nebraskaexaminer.com,Pillen team offers new explanation for timing of $2.5 million no-bid emergency contract,,,,,,https://nebraskaexaminer.com/2026/02/05/pillen-team-offers-new-explanation-for-timing-of-2-5-million-no-bid-emergency-contract/,... Protection Agency grant from the Biden administration the state used to justify choosing her. ... EPA grant contract after the water agency's ...,,,,,2026-02-05 09:00:55.114122
,Costs & Impacts,2026-02-05 11:20:26+00:00,Manhattan Institute,The High Cost of Stormwater Regulations,,,,,,https://manhattan.institute/article/the-high-cost-of-stormwater-regulations,"Real estate in the United States is regulated mainly by local governments, which can control everything from the size of new buildings to their design. As the costs of construction—particularly, housing—have increased in recent years, politicians in Washington, DC, have looked for ways to loosen these local regulations. But the federal government has limited tools […]",,https://media4.manhattan-institute.org/wp-content/uploads/the-high-cost-of-stormwater-regulations-GettyImages-984796430.jpg,,,2026-02-05 10:02:08.684980
,,2026-02-05 11:08:37+00:00,northdakotamonitor.com,"Farm, biofuel groups welcome federal agency's tax credit rules - North Dakota Monitor",,,,,,https://northdakotamonitor.com/2026/02/05/farm-biofuel-groups-welcome-federal-agencys-tax-credit-rules/,"Censky said the proposed rule still needs to be finalized along with other policies, such as the Environmental Protection Agency setting targets for ...",,,,,2026-02-05 10:02:08.684980
,Costs & Impacts,2026-02-05 11:07:16+00:00,WPR,"More than 900K tons of food waste ends up in Wisconsin landfills, report finds",,,,,,https://www.wpr.org/news/900k-tons-food-waste-wisconsin-landfills-report,"The state wants residents to cut their food waste in half as more than 900,000 tons of wasted food and scraps ended up in Wisconsin landfills in 2024, making up 20 percent of all trash.",,https://www.wpr.org/wp-content/uploads/2022/05/dane_county_landfill_characterization_2_small.jpg,,,2026-02-05 07:59:31.539743
,,2026-02-05 10:45:03+00:00,Southeast AgNET,EPA Guidance to Manufacturers Clarifies Clean Air Act Supports Right To Repair,,,,,,https://southeastagnet.com/2026/02/05/epa-guidance-clean-air-act-right-to-repair-farm-equipment/,"The EPA has issued new guidance clarifying that the Clean Air Act supports Americans’ right to repair their own equipment, a major win for ...",,https://i0.wp.com/southeastagnet.com/wp-content/uploads/2026/02/50217172322_6bd9870f77_6k-2048x1365-226a44d1a919429cb093a53d2af12d86.webp?fit=750%2C500&ssl=1,,,2026-02-05 09:00:55.114122
,Costs & Impacts,2026-02-05 10:24:38+00:00,Post and Courier,"20,000 gallons of diesel fuel leaks from Spartanburg holding tanks, contaminating local creek",,,,,,https://www.postandcourier.com/spartanburg/news/epa-spartanburg-diesel-fuel-spill-leak-creek-cleanup/article_c1736fb8-e43b-4935-b8a8-863188ad2358.html,"About 20,000 gallons of diesel fuel leaked from Kinder Morgan tanks in Spartanburg and contaminated Four Mile Branch Creek. The EPA is helping clean up.",,https://bloximages.newyork1.vip.townnews.com/postandcourier.com/content/tncms/assets/v3/editorial/7/47/747682d1-d76e-4fef-8942-511e9e4307be/698391def01c5.image.jpg?crop=1662%2C873%2C0%2C55&resize=1200%2C631&order=crop%2Cresize,,,2026-02-05 09:00:55.114122
,Costs & Impacts,2026-02-05 10:03:16+00:00,KVCR News,"Trump's EPA issues record low legal actions against polluters, watchdog group finds",,,,,,https://www.kvcrnews.org/2026-02-04/trumps-epa-issues-record-low-legal-actions-against-polluters-watchdog-group-finds,The EPA enforced a record low number of environmental laws and regulations during the first year of President Trump's second term in office.,,https://npr.brightspotcdn.com/dims4/default/60f7e67/2147483647/strip/true/crop/7899x4147+0+148/resize/1200x630!/quality/90/?url=https%3A%2F%2Fnpr.brightspotcdn.com%2Fdims3%2Fdefault%2Fstrip%2Ffalse%2Fcrop%2F7899x4443%200%20413%2Fresize%2F7899x4443%21%2F%3Furl%3Dhttp%3A%2F%2Fnpr-brightspot.s3.amazonaws.com%2F21%2F74%2Fb51ae7884a00914aef38e83ca997%2Fgettyimages-2200431267.jpg,,,2026-02-05 10:02:08.684980
,Costs & Impacts,2026-02-05 09:30:05+00:00,www.facebook.com,ESTIMATED 10000 GALLONS OF FUEL RELEASED INTO AIRPORT STORM WATER ...,,,,,,https://www.facebook.com/CodyAlcornNews/posts/estimated-10000-gallons-of-fuel-released-into-airport-storm-water-system-and-the/1434725374683088/,"▪️11:00 a.m., EMA was contacted by Clayton County Fire that the EPD, and represenative from the Atlanta Airport were at Flint River at the Upper ...",,,,,2026-02-05 10:02:08.684980
,Costs & Impacts,2026-02-05 07:10:07+00:00,ABC 10 News San Diego KGTV,EPA Administrator Lee Zeldin returns to San Diego County to address ongoing sewage crisis,,,,,,https://www.10news.com/news/local-news/san-diego-news/epa-administrator-lee-zeldin-returns-to-san-diego-county-to-address-ongoing-sewage-crisis,"One year after taking office, EPA Administrator Lee Zeldin will return to San Diego County Thursday to continue addressing the decades-old Tijuana sewage crisis.",,https://ewscripps.brightspotcdn.com/dims4/default/b66336d/2147483647/strip/true/crop/1280x672+0+24/resize/1200x630!/quality/90/?url=https%3A%2F%2Fcf.cdn.uplynk.com%2Fause1%2Fslices%2Fd90%2F790551469ef2448fbb6dfa541303db12%2Fd9003da582cd46aab1b004a43c3dde28%2Fposter_8ec6886b239040deb9dcce38009714e6.jpg,,,2026-02-05 02:58:49.370410
