id,name,published,outlet,title,authors,category,market,categoryorder,articleorder,url,description,text,image,error,sentiment,firstEyes
,California,2025-06-25 23:25:32+00:00,The Voice,California found in violation of Title IX in clash with Trump officials over transgender athletes,,,,,,https://www.voicenews.com/2025/06/25/california-trump-transgender-athletes/,"If California rejects the proposal, the Education Department could move to terminate the state’s federal education funding.",,https://www.voicenews.com/wp-content/uploads/2025/06/California_Transgender_Athletes_04306-1.jpg?w=1024&h=682,,,2025-06-25 23:03:39.788279
,California,2025-06-25 22:36:51+00:00,www.13newsnow.com,New report shows Virginia falling behind in access to early childhood education - WVEC,,,,,,https://www.13newsnow.com/video/news/education/new-report-shows-virginia-falling-behind-in-access-to-early-childhood-education/291-e34b426c-8aae-4e68-96b1-36394bf94d26,"As a national report reveals Virginia is falling behind in preschool access and enrollment, Suffolk leaders are calling for education and ...",,,,,2025-06-25 20:03:19.704617
,California,2025-06-25 22:02:58+00:00,Los Angeles Times,UC Berkeley law professors take on a case for colleagues: Fighting Trump research cuts,,,,,,https://www.latimes.com/california/story/2025-06-25/trump-lawsuit-university-of-california-researchers,Federal judge orders President Trump to restore millions of dollars in grants to University of California researchers in class-action lawsuit.,,https://ca-times.brightspotcdn.com/dims4/default/6eb5b74/2147483647/strip/true/crop/5000x2625+0+354/resize/1200x630!/quality/75/?url=https%3A%2F%2Fcalifornia-times-brightspot.s3.amazonaws.com%2Fdc%2Fae%2Fb83c27ab42fb8925d9df4cad005a%2Fhttps-delivery-gettyimages.com%2Fdownloads%2F2211635165,,,2025-06-25 23:03:39.788279
,California,2025-06-25 22:02:51+00:00,Baltimore Sun,Report finds deep inequities in early childhood education in Baltimore,,,,,,https://www.baltimoresun.com/2025/06/25/early-childhood-education/,"A new report from a coalition of early childhood educators, advocates and funders reveals disparities in access to quality early learning programs for Baltimore’s youngest students.",,https://www.baltimoresun.com/wp-content/uploads/migration/2022/09/12/43IKW7SD65DYVNE6TBM5RS63DE.jpg?w=1024&h=670,,,2025-06-25 19:09:16.928453
,California,2025-06-25 22:00:31+00:00,K-12 Dive,Education Department finds California trans athlete policy violated Title IX,,,,,,https://www.k12dive.com/news/education-department-california-interscholastic-federation-transgender-athlete-policy/751677/,"If California doesn’t sign a proposed resolution agreement within 10 days, its case could be referred to the U.S. Department of Justice for enforcement.",,https://imgproxy.divecdn.com/RcYN7_45OGvTBqW8dfaZeQFg0Ka_zmJYfaAjl--lNeQ/g:ce/rs:fit:770:435/Z3M6Ly9kaXZlc2l0ZS1zdG9yYWdlL2RpdmVpbWFnZS9TY3JlZW5zaG90XzIwMjUtMDQtMTZfYXRfNS4wNy4yM1BNLnBuZw==.webp,,,2025-06-25 21:00:13.751518
,California,2025-06-25 21:32:01+00:00,newslj.com,"Children's Center struggles with funding challenges, including lack of state dollars",,,,,,https://newslj.com/not-just-child-care-childrens-center-struggles-funding-challenges-including-lack-state-dollars,"School districts can use some Title I funding for early childhood education ... The California-based Heising-Simons Foundation, and the Bill and ...",,,,,2025-06-25 20:03:19.704617
,California,2025-06-25 21:18:43+00:00,Human Rights Watch,Strengthening the Right to Free Education,,,,,,https://www.hrw.org/news/2025/06/25/strengthening-the-right-to-free-education,"For millions of children around the world, the cost of schooling remains one of the most significant barriers to education, particularly at the pre-primary and secondary level. The goal: A new optional protocol to the Convention on the Rights of the Child, enshrining an explicit right to early childhood care and education; to free public pre-primary education, beginning with at least one year; and to free public secondary education—consistent with the right to free primary education.",,,,,2025-06-25 21:00:13.751518
,California,2025-06-25 21:16:52+00:00,KPBS Public Media,Trump administration says California must bar trans girls from girls sports,,,,,,https://www.kpbs.org/news/education/2025/06/25/trump-administration-says-california-must-bar-trans-girls-from-girls-sports,The U.S. Education Department says the policies violate a federal law banning sex discrimination in education. U.S. Education Secretary Linda McMahon says California could lose federal funding if it does not comply.,,https://cdn.kpbs.org/dims4/default/8f37877/2147483647/strip/true/crop/1024x538+0+0/resize/1200x630!/quality/90/?url=http%3A%2F%2Fkpbs-brightspot.s3.us-west-2.amazonaws.com%2Ff3%2Fd9%2Fe7e26ce64d37a836c7bcd9d878a2%2Fap25176666834046.jpg,,,2025-06-25 18:09:59.784587
,California,2025-06-25 21:11:53+00:00,The Courier-Journal,"Days before retirement, JCPS' Pollio receives final evaluation. Here's what it said",,,,,,https://www.courier-journal.com/story/news/education/2025/06/25/jcps-superintendent-marty-pollio-gets-final-evaluation-before-retiring/84331020007/,"After 28 years within JCPS, Superintendent Marty Pollio's last day will be June 30.",,"https://www.courier-journal.com/gcdn/authoring/authoring-images/2025/06/23/PLOU/84322978007-jfjcpsjpf-08455.jpg?crop=3996,2249,x2,y190&width=3200&height=1802&format=pjpg&auto=webp",,,2025-06-25 20:03:19.704617
,California,2025-06-25 21:05:20+00:00,ABC7 San Francisco,"CA violated Title IX over transgender athletes, U.S. Education Department says",,,,,,https://abc7news.com/post/california-violated-title-ix-allowing-trans-athletes-compete-females-education-dept/16845258/,The U.S. Department of Education says that California violated Title IX by allowing transgender athletes to compete in girls sports.,,https://cdn.abcotvs.com/dip/images/16845288_062525-kabc-title-ix.jpg?w=1600,,,2025-06-25 21:00:13.751518
,California,2025-06-25 20:45:42+00:00,Pittsburgh Post-Gazette,California found in violation of Title IX in clash with Trump officials over transgender athletes,,,,,,https://www.post-gazette.com/news/education/2025/06/25/california-title-ix-transgender-sports-civil/stories/202506250050,WASHINGTON — The Trump administration has found that the California Department of Education and the state’s high school sports federation violated...,,https://f50d772ec1e2a4347264-964b3324d77f313a724faa237152e95f.ssl.cf2.rackcdn.com/stories/202506250050/1140x_a10-7_cTC/track-stock_1750868006.jpg,,,2025-06-25 18:09:59.784587
,California,2025-06-25 20:39:58+00:00,mlive,Bookkeeper admits $1M scheme that closed preschool learning agency,,,,,,https://www.mlive.com/news/grand-rapids/2025/06/bookkeeper-admits-1m-scheme-that-closed-preschool-learning-agency.html,"Sharon Killebrew entered into a plea agreement with federal prosecutors and admitted she conspired to embezzle or convert nearly $1.2 million in Early Learning Neighborhood Collaborative funds, court records said.",,https://www.mlive.com/resizer/v2/BSAH27O4YJAULC742NDAGPRA3U.jpg?auth=bb8658886d1f8ae5a8f8df559f76aceb817bcb052f8951205d6f80a1fb0c8039&width=1280&quality=90,,,2025-06-25 19:09:16.928453
,California,2025-06-25 20:24:16+00:00,www.pahouse.com,"Democrats fight to make Cyber Charter Students safer, demand accountability from online schools",,,,,,https://www.pahouse.com/educationcommittee/InTheNews/NewsRelease/%3Fid%3D139179,"... children enrolled in cyber charter schools. House Education Committee ... Funding (May 04, 2025). Cyber Charter School Costs to School ...",,,,,2025-06-25 19:09:16.928453
,California,2025-06-25 20:16:35+00:00,Spokesman.com,California schools risk DC funding cuts on transgender athlete debate,,,,,,https://www.spokesman.com/stories/2025/jun/25/california-schools-risk-dc-funding-cuts-on-transge/,Public school funding in California is at risk after the US Education Department found that the state is violating rules protecting female athletes from unfair competition and unsafe situations “by allowing males in girls’ sports and intimate spaces.”,,https://thumb.spokesman.com/l2sMHX5ZvY-IivJJOF8GNS33NSY=/600x0/media.spokesman.com/graphics/2020/08/sr_placeholder.png,,,2025-06-25 17:07:24.383991
,California,2025-06-25 20:12:26+00:00,ABC News,Trump administration says California must bar trans girls from girls sports,,,,,,https://abcnews.go.com/US/wireStory/trump-administration-california-bar-trans-girls-girls-sports-123207805,The Trump administration says California must change its policies allowing transgender girls to compete on sports teams consistent with their gender identity,,https://i.abcnewsfe.com/a/ad6da977-681b-4ab9-92e1-f5ff6636a059/wirestory_29ab7154363c1054bd06b32587421161_16x9.jpg?w=1600,,,2025-06-25 17:07:24.383991
,California,2025-06-25 20:01:11+00:00,www.startribune.com,California found in violation of Title IX in clash with Trump officials over transgender athletes,,,,,,https://www.startribune.com/california-found-in-violation-of-title-ix-in-clash-with-trump-officials-over-transgender-athletes/601379066,The Trump administration has found that the California Department of Education and the state's high school sports federation violated civil rights law by allowing transgender girls to compete on girls sports teams.,,https://www.startribune.com/200.png,,,2025-06-25 17:07:24.383991
,California,2025-06-25 19:56:34+00:00,WHEC.com,Trump administration says California must bar trans girls from girls sports,,,,,,https://www.whec.com/ap-top-news/trump-administration-says-california-must-bar-trans-girls-from-girls-sports/,The Trump administration says California must change its policies allowing transgender girls to compete on sports teams consistent with their gender identity. The U.S. Education Department says the policies violate a federal law banning sex discrimination in education. U.S. Education Secretary Linda McMahon says California could lose federal funding if it does not comply. But the state says all students should have the opportunity to play. The issue garnered renewed attention in California after a trans athlete recently participated in the state high school track and field championship. The sports governing body running the meet allowed more girls to participate and medal in events in which the trans athlete was competing.,,https://www.whec.com/wp-content/uploads/apimg/2025/06/California_Transgender_Athletes_79236.jpg,,,2025-06-25 18:09:59.784587
,California,2025-06-25 19:40:51+00:00,WORLD,"California trans athlete rules violated Title IX, Education…",,,,,,https://wng.org/sift/ca-trans-athlete-rules-broke-title-ix-education-dept-says-1750874913,"WORLD is a news organization producing Biblically sound, daily coverage of global, national, and cultural current events.",,https://www4.wng.org/_1200x630_crop_center-center_82_none/Education-Dept-6.25.25.jpg?mtime=1750875183,,,2025-06-25 20:03:19.704617
,California,2025-06-25 19:32:44+00:00,www.sfchronicle.com,"California has 10 days to ban transgender athletes, Trump admin says",,,,,,https://www.sfchronicle.com/politics/article/california-title-ix-20393470.php,... schools that receive federal funding. The Department of Education announced soon after that it would investigate California and other states that ...,,,,,2025-06-25 20:03:19.704617
,California,2025-06-25 19:18:54+00:00,Education Week,"California Violated Title IX Over Transgender Athletes, Ed. Dept. Concludes",,,,,,https://www.edweek.org/policy-politics/california-violated-title-ix-over-transgender-athletes-ed-dept-concludes/2025/06,The U.S. Department of Education said the state's school sports policies for transgender athletes violated female students' rights.,,https://epe.brightspotcdn.com/dims4/default/825e95c/2147483647/strip/true/crop/1720x1150+0+0/resize/942x630!/quality/90/?url=https%3A%2F%2Fepe-brightspot.s3.us-east-1.amazonaws.com%2Faa%2Fc9%2F839dbdba422296ddb470660277b4%2F062525-california-transgender-ap-bs.jpg,,,2025-06-25 16:09:26.215786
,California,2025-06-25 19:17:38+00:00,Journal Sentinel,Wisconsin Supreme Court rules against Gov. Evers in dispute over $50 million in 'science of reading' funds,,,,,,https://www.jsonline.com/story/news/education/2025/06/25/50-million-for-wi-science-of-reading-law-in-question-after-supreme-court-ruling/84331065007/,"Funding for Act 20, Wisconsin's science of reading law, has been deadlocked in a court battle.",,"https://www.jsonline.com/gcdn/authoring/authoring-images/2025/04/29/PMJS/83348885007-mjs-biden-madison-0556-1.jpg?crop=2399,1351,x0,y124&width=2399&height=1351&format=pjpg&auto=webp",,,2025-06-25 19:09:16.928453
,California,2025-06-25 19:10:00+00:00,WLOS,California faces ultimatum: ban transgender athletes or lose federal education funding,,,,,,https://wlos.com/news/nation-world/california-faces-ultimatum-ban-transgender-athletes-or-lose-federal-education-funding,"It’s now official, California’s Department of Education and the state’s high school sports federation are guilty of violating civil rights laws by allowing tran",,https://wlos.com/resources/media2/16x9/8640/986/0x450/90/2887f0d1-a0b5-4201-a9bc-773de09fbcd9-AP25152102189188.jpg,,,2025-06-25 16:09:26.215786
,California,2025-06-25 19:01:46+00:00,Governor of California,Governor Newsom announces $135 million available for new wildfire projects amid Trump’s assault on resources protecting communities | Governor of California,,,,,,https://www.gov.ca.gov/2025/06/25/governor-newsom-announces-135-million-available-for-new-wildfire-projects-amid-trumps-assault-on-resources-protecting-communities/,"Activities include hazardous fuels reduction, wildfire prevention planning, and wildfire prevention education. The funding builds on $72 million ...",,https://www.gov.ca.gov/wp-content/uploads/2025/06/DRAFT-wildfire-prevention-grants-.png,,,2025-06-25 17:07:24.383991
,California,2025-06-25 18:57:56+00:00,www.nytimes.com,Trump Administration Says California's Trans Sports Policies Discriminate Against Girls,,,,,,https://www.nytimes.com/2025/06/25/us/trump-california-trans-athletes.html,"Athletes stand on a field. The Trump administration declared on Wednesday that the California Department of Education ... funding for schools, which is ...",,,,,2025-06-25 16:09:26.215786
,California,2025-06-25 18:43:11+00:00,K-12 Dive,Missed special education targets show need for support,,,,,,https://www.k12dive.com/news/states-miss-special-education-targets-Education-Department-IDEA-requirements/751477/,The U.S. Department of Education says states needing assistance with IDEA compliance and student outcomes should receive technical assistance.,,https://imgproxy.divecdn.com/OxVclhV2RZBxXCfySeb_ARLSDZEYnPa9XFD2eldLquU/g:ce/rs:fit:770:435/Z3M6Ly9kaXZlc2l0ZS1zdG9yYWdlL2RpdmVpbWFnZS9HZXR0eUltYWdlcy0xNDEwNjA3MDU1LmpwZw==.webp,,,2025-06-25 17:07:24.383991
,California,2025-06-25 18:39:00+00:00,lamag.com,Trump Administration Demands Removal of 'Gender Ideology' from California Sex Ed,,,,,,https://lamag.com/news-and-politics/trump-administration-demands-removal-of-gender-ideology-from-california-sex-ed,The Trump admin warns California to drop gender identity topics from sex ed or lose federal health education funding.,,,,,2025-06-25 16:09:26.215786
,California,2025-06-25 18:37:24+00:00,capitalandmain.com,Federal Funding Uncertain for Adult Education Programs in Texas,,,,,,https://capitalandmain.com/doge-posts/federal-funding-uncertain-for-adult-education-programs-in-texas,"Cuts to the Department of Education are impacting adult education in Texas, reports Texas Standard, noting that the federal money pays for about 80% of those services:


The money is usually allocated in the spring. But Sharon Bonney — the CEO of a national advocacy organization called the Coalition on Adult Basic Education — said this year, spring came and went with no announcement about incoming money…
The Texas Workforce Commission was also waiting. In the midst of the uncertainty, TWC staff proposed at least allocating a smaller budget so providers of adult education in Texas had some ability to plan for the months ahead.
For Waco and the surrounding counties, that provider is McLennan Community College. This summer, a small group of GED students at McLennan are preparing to take their math exams — among them is Brittnay Camp, who started taking GED courses last August.   » Read more about: Federal Funding Uncertain for Adult Education Programs in Texas  »",,https://capitalandmain.com/wp-content/uploads/2025/06/GettyImages-1973372833-1000x600.jpg,,,2025-06-25 16:09:26.215786
,California,2025-06-25 18:32:23+00:00,www.the74million.org,"Looming California Budget Changes Threaten Black Students, Study Says",,,,,,https://www.the74million.org/article/looming-california-budget-changes-threaten-black-students-study-says/,USC researchers say funding cuts could worsen inequities faced by Black kids.,,https://www.the74million.org/wp-content/uploads/2025/06/black-students-USC-research-825x495.jpg?cb=1017330,,,2025-06-25 16:09:26.215786
,California,2025-06-25 18:00:33+00:00,School Construction News,Bisnow’s Southern California Student Housing and Higher Education Summit Highlights Funding Challenges and Student Experience - School Construction News,,,,,,https://schoolconstructionnews.com/2025/06/25/bisnows-southern-california-student-housing-and-higher-education-summit-highlights-funding-challenges-and-student-experience/,"The event kicked off with a breakdown of Compton College’s volumetric prefabricated modular housing project, completed with the Division of the State Architect by HPI, Bernards and Gafcon.",,https://schoolconstructionnews.com/wp-content/uploads/2025/06/1-Bisnow-IMG_7721.jpg,,,2025-06-25 15:11:32.063846
,California,2025-06-25 17:57:04+00:00,Bangor Daily News,California found in violation of Title IX in clash with Trump officials over transgender athletes,,,,,,https://www.bangordailynews.com/2025/06/25/nation/california-found-in-violation-of-title-ix-in-clash-with-trump-officials-over-transgender-athletes/,WASHINGTON (AP) — The Trump administration has found that the California Department of Education and the state’s high school sports federation violated,,https://i0.wp.com/bdn-data.s3.amazonaws.com/uploads/2025/06/preview-371.jpg?fit=1024%2C683&ssl=1,,,2025-06-25 15:11:32.063846
,California,2025-06-25 17:45:16+00:00,"Inside Higher Ed | Higher Education News, Events and Jobs",CTE Advocates Worry About ED’s Plans for the Programs,,,,,,https://www.insidehighered.com/news/government/politics-elections/2025/06/25/cte-advocates-worry-about-eds-plans-programs,"While paused for now, the Education Department has plans to let the Department of Labor take over funding for career and technical education programs. CTE advocates fear the shift.",,https://www.insidehighered.com/sites/default/files/styles/large/public/2025-06/GettyImages-1395428816.jpg?itok=ikSqauGf,,,2025-06-25 17:07:24.383991
,California,2025-06-25 17:38:45+00:00,CNN,California found in violation of Title IX in clash with Trump officials over transgender athletes | CNN,,,,,,https://www.cnn.com/2025/06/25/us/trump-education-california-title-ix,The Trump administration has found that the California Department of Education and the state‚Äôs high school sports federation violated civil rights law by allowing transgender girls to compete on girls sports teams.,,"https://media.cnn.com/api/v1/images/stellar/prod/ap25152006338867.jpg?c=16x9&q=w_800,c_fill",,,2025-06-25 15:11:32.063846
,California,2025-06-25 17:33:26+00:00,Governor of California,"First Partner launches and expands her annual Book Club, celebrates libraries as community treasures open to all Californians | Governor of California",,,,,,https://www.gov.ca.gov/2025/06/25/first-partner-launches-and-expands-her-annual-book-club-celebrates-libraries-as-community-treasures-open-to-all-californians/,"... early literacy, reducing the “summer slide” of learning, and supporting the mental health and well-being of all California children. Libraries ...",,https://www.gov.ca.gov/wp-content/uploads/2025/06/Press-release-Book-Club-2025-.jpg,,,2025-06-25 15:11:32.063846
,California,2025-06-25 17:12:14+00:00,San Diego Foundation,Finding Their ‘Y’: The Alperts’ Heartfelt Path to Giving,,,,,,https://www.sdfoundation.org/news-events/sdf-news/finding-their-y-the-alperts-heartfelt-path-to-giving/,It all began with a conversation in the grocery store. Michael Alpert had recently retired from practicing law when he bumped into a longtime friend – a,,https://www.sdfoundation.org/wp-content/uploads/2025/06/sdfnews_alperts1.png,,,2025-06-25 17:07:24.383991
,California,2025-06-25 16:55:54+00:00,New York Post,Trump admin rules Calif. committed ‘clear violation’ of Title IX after transgender athlete probe,,,,,,https://nypost.com/2025/06/25/us-news/california-put-on-notice-after-probe-finds-clear-violation-of-title-ix/,The civil rights office has given the Golden State 10 days to reverse course — or face “imminent enforcement action” that could include a referral to the Department of Justice.,,https://nypost.com/wp-content/uploads/sites/2/2025/06/107123136.jpg?quality=75&strip=all&w=1024,,,2025-06-25 17:07:24.383991
,California,2025-06-25 16:45:28+00:00,WJBF,Trump administration says California violates Title IX by allowing transgender athletes on girls teams ,,,,,,https://www.wjbf.com/hill-politics/trump-administration-says-california-violates-title-ix-by-allowing-transgender-athletes-on-girls-teams/amp/,"The Trump administration on Wednesday said California is defying federal law in permitting transgender girls to compete on girls school sports teams, escalating a roughly monthlong battle between t…",,https://www.wjbf.com/wp-content/uploads/sites/47/2025/06/2__0998.jpeg?w=1280,,,2025-06-25 16:09:26.215786
,California,2025-06-25 16:44:01+00:00,California Policy Center |,California accepts billions in federal funds for education while defying federal law | California Policy Center,,,,,,https://californiapolicycenter.org/california-accepts-billions-in-federal-funds-for-education-while-defying-federal-law/,"The California legislature passed the 2025-26 budget bill earlier this month and sent it to Governor Gavin Newsom for his signature. The bill amounts to $325 billion, marking a spending increase of 51 percent since Newsom first took office in 2019. Spending on education has similarly ballooned, despite the fact that enrollment in traditional public",,https://californiapolicycenter.org/wp-content/uploads/2023/06/pexels-pixabay-256395-scaled.jpg,,,2025-06-25 13:13:42.893801
,California,2025-06-25 16:33:53+00:00,www.cincinnati.com,"The Enquirer Subscription Offers, Specials, and Discounts",,,,,,https://www.cincinnati.com/story/news/politics/2025/06/25/northern-kentucky-superintendent-resigned-ahead-of-contract/84188142007/,"Huge Savings: Subscribe today to enjoy sports, entertainment, life, money, tech, and travel news along with videos, apps, and more.",,https://staticassets.gannettdigital.com/gci-static-assets/assets/global/checkout/meta-generic.png,,,2025-06-25 16:09:26.215786
,California,2025-06-25 16:32:02+00:00,The Hill,Trump administration says California violates Title IX by allowing transgender athletes on girls teams ,,,,,,https://thehill.com/homenews/lgbtq/5368915-trump-administration-mcmahon-california-title-ix-transgender-athletes-girls-sports/,"The Trump administration on Wednesday said California is defying federal law in permitting transgender girls to compete on girls school sports teams, escalating a roughly monthlong battle between t…",,https://thehill.com/wp-content/uploads/sites/2/2025/06/2__0998.jpeg?w=1280,,,2025-06-25 14:09:09.429559
,California,2025-06-25 16:24:44+00:00,The Missoula Current News - Daily News in Missoula Montana,US House split on solutions to the high cost of child care,,,,,,https://missoulacurrent.com/cost-child-care/,"Republicans and Democrats on a U.S. House Education and Workforce subcommittee agreed at a Tuesday hearing that child care affordability was a problem, but proposed different solutions.",,https://townsquare.media/site/1098/files/2022/08/attachment-Child-care.jpg?w=1200&q=75&format=natural,,,2025-06-25 16:09:26.215786
,California,2025-06-25 16:21:44+00:00,LAist,"With costs rising and relief money gone, LAUSD taps reserves to pay for new budget",,,,,,https://laist.com/news/education/lausd-los-angeles-unified-school-district-budget-fiscal-year-2026,Enrollment has declined for more than two decades and the district is spending more money than it brings in.,,https://scpr.brightspotcdn.com/dims4/default/26404ac/2147483647/strip/true/crop/3600x1890+0+228/resize/1200x630!/quality/90/?url=http%3A%2F%2Fscpr-brightspot.s3.us-west-2.amazonaws.com%2Fc1%2Ff8%2Faad144c542edafa6ee4634f5da9b%2Fcarvalho-lausd-budget.jpg,,,2025-06-25 13:13:42.893801
