id,name,published,outlet,title,authors,category,market,categoryorder,articleorder,url,description,text,image,error,sentiment,firstEyes
,California,2025-06-26 19:15:36+00:00,Youth Today,Q&A: Advocacy group leader talks about the challenges of transitional kindergarten,,,,,,https://youthtoday.org/2025/06/qa-advocacy-group-leader-talks-about-the-challenges-of-transitional-kindergarten/,Children learn at different rates. We need to individualize early childhood education.,,https://youthtoday.org/wp-content/uploads/sites/13/2025/06/Transitional-Kindergarten01_Randall-Benton-EdSource-1000x600.jpg,,,2025-06-26 16:09:27.586668
,California,2025-06-26 19:15:19+00:00,K-12 Dive,Can this team-based staffing model reduce teacher turnover?,,,,,,https://www.k12dive.com/news/next-education-workforce-team-teaching-asu-crpe/751671/,"Teachers participating in the Next Education Workforce model were less likely to quit compared to those in traditional classrooms, researchers found.",,https://imgproxy.divecdn.com/uXtWrbO7r2pyQbOd-BMKiirSeGynQXHDe4m1rPk1q1k/g:ce/rs:fit:770:435/Z3M6Ly9kaXZlc2l0ZS1zdG9yYWdlL2RpdmVpbWFnZS9HZXR0eUltYWdlcy0xMzQ2NTA1NDgxX3hUcG82bjQuanBn.webp,,,2025-06-26 17:09:17.555227
,California,2025-06-26 18:47:13+00:00,www.cde.ca.gov,2025–26 School Nutrition Programs AR List - Nutrition (CA Dept of Education) - CA.gov,,,,,,https://www.cde.ca.gov/ls/nu/snparlist20252026.asp,Please note that the list of SFAs scheduled for an SNP AR is subject to change and the California Department of Education (CDE) will contact SFAs that ...,,,,,2025-06-26 17:09:17.555227
,California,2025-06-26 18:26:33+00:00,Committee on Education &amp; the Workforce,"Chair Walberg Continues Investigation into Antisemitism at DePaul, Haverford, and Cal Poly San Luis Obispo Following May 7 Hearing",,,,,,https://edworkforce.house.gov/news/documentsingle.aspx%3FDocumentID%3D412606,"Today, Education and Workforce Committee Chairman Tim Walberg (R-MI) sent letters to DePaul University, California Polytechnic State University ...",,https://edworkforce.house.gov/images/facebook-meta-119.jpg,,,2025-06-26 17:09:17.555227
,California,2025-06-26 18:16:46+00:00,www.youtube.com,California could face funding cuts over transgender girls in school sports - YouTube,,,,,,https://www.youtube.com/watch%3Fv%3DvQYjo0LWq18,California could face funding cuts over transgender girls in school sports The U.S. Department of Education's Office for Civil Rights ruled on ...,,,,,2025-06-26 16:09:27.586668
,California,2025-06-26 18:07:12+00:00,Beverly Press & Park Labrea News,L.A. County DEO kicks off summer with Youth@Work hiring events - Beverly Press & Park Labrea News,,,,,,https://beverlypress.com/2025/06/l-a-county-deo-kicks-off-summer-with-youthwork-hiring-events/,The Los Angeles County Department of Economic Opportunity officially kicked off summer with a series of Youth@Work Summer...,,https://beverlypress.com/wp-content/uploads/2025/06/A-Schools-LA.County.DEO_.Summer.png,,,2025-06-26 16:09:27.586668
,California,2025-06-26 17:24:54+00:00,www.kgw.com,Oregon bill threatening Multnomah County's 'Preschool for All' program is dead - KGW,,,,,,https://www.kgw.com/article/news/education/parents-advocates-push-back-state-amendment-threatening-pre-school-for-all-program-multnomah-county/283-ea061f0c-82ac-4d6c-8a03-d57fde64f44e,"... early childhood education. ""That's what a lot of parents in my community face every day,"" said Lydia Gray-Hollifield, another parent. ""Do I pay my ...",,,,,2025-06-26 16:09:27.586668
,California,2025-06-26 17:21:56+00:00,www.ppic.org,California Increases Financial Aid Application Rate,,,,,,https://www.ppic.org/blog/california-increases-financial-aid-application-rate/,"A majority of this year's high school graduates—nearly six in ten—applied for higher education funding, either through the Free Application for ...",,,,,2025-06-26 15:09:24.212153
,California,2025-06-26 17:02:27+00:00,www.pahouse.com,State must step up as federal government abandons commitment to homeless students,,,,,,https://www.pahouse.com/InTheNews/Opinion/%3Fid%3D139197,... education funding for Pennsylvania schools. This funding rescission's ... programs such the Education for Children and Youth Experiencing Homelessness ...,,,,,2025-06-26 14:13:04.840870
,California,2025-06-26 16:55:58+00:00,www.nytimes.com,Opinion | Bolster the Building Blocks of Kindergarten - The New York Times,,,,,,https://www.nytimes.com/2025/06/26/opinion/kindergarten-boys-girls.html,If we care about closing early learning gaps and helping all young children ... U.S.. Sections. U.S. · Politics · New York · California · Education ...,,,,,2025-06-26 16:09:27.586668
,California,2025-06-26 15:22:02+00:00,National Governors Association,Governors’ Perspectives on Addressing Child Care Needs: Supply and Demand Trends to Watch,,,,,,https://www.nga.org/publications/governors-perspectives-on-addressing-child-care-needs-supply-and-demand-trends-to-watch/,"The NGA Center, in partnership with the First Five Years Fund, convened a full-day roundtable discussion for state and territorial child care leaders to explore the future of state child care leadership.",,https://www.nga.org/wp-content/uploads/2025/06/ChildCarepaper-scaled.jpeg,,,2025-06-26 12:24:18.014714
,California,2025-06-26 15:10:56+00:00,Fortune,Elementary school students in Pennsylvania could soon be required to learn cursive,,,,,,https://fortune.com/2025/06/26/pennsylvania-mandating-cursive-education-elementary-schools/,An analog throwback in a digital world.,,"https://fortune.com/img-assets/wp-content/uploads/2025/06/GettyImages-1326615339-e1750949379173.jpg?resize=1200,600",,,2025-06-26 14:13:04.840870
,California,2025-06-26 14:42:35+00:00,Word In Black,What California Education Cuts Could Mean for Black Students,,,,,,https://wordinblack.com/2025/06/california-education-cuts-black-students/,"Already projected to be decades behind in reading and math, Black kids are met with another barrier as the Trump administration threatens to cut $8 billion in federal school funding. ",,https://wordinblack.com/wp-content/uploads/2025/06/SAC_RCB_20230411_RALLY0489.jpeg,,,2025-06-26 12:24:18.014714
,California,2025-06-26 14:34:15+00:00,New Bedford Standard-Times,New Bedford's pre-K is changing this fall. Meet the principal who will lead the new center,,,,,,https://www.southcoasttoday.com/story/news/education/2025/06/26/new-bedford-pre-k-parker-early-childhood-center-principal/84339819007/,"The move to New Bedford's new pre-K center as principal is a ""full circle moment"" for this long-term educator.",,"https://www.southcoasttoday.com/gcdn/authoring/authoring-images/2025/06/12/NSTT/84168938007-ellyn-gallant-bland-6625-1.jpg?crop=1199,675,x0,y336&width=1199&height=675&format=pjpg&auto=webp",,,2025-06-26 13:09:57.917121
,California,2025-06-26 14:19:11+00:00,www.newsfromthestates.com,"Declining federal funds, late notice extinguish Ms. Paula's preschool 'magic'",,,,,,https://www.newsfromthestates.com/article/declining-federal-funds-late-notice-extinguish-ms-paulas-preschool-magic,... funding in most of Wyoming's school districts. Notice from the federal ... Fremont County School District 1 Early Childhood Education Liaison ...,,,,,2025-06-26 14:13:04.840870
,California,2025-06-26 13:58:28+00:00,The Post-Crescent,Local education leaders say budget bill doesn't do enough for schools,,,,,,https://www.postcrescent.com/story/news/education/2025/06/26/appleton-neenah-menasha-school-leaders-roundtable-on-budget-bill/84318422007/,School leaders from six districts said the state budget bill in its current form doesn't do enough to address schools' financial needs.,,"https://www.postcrescent.com/gcdn/authoring/authoring-images/2025/05/30/PAPN/83936699007-apc-columbus-school-0529250371-djp.jpg?crop=4687,2637,x0,y313&width=3200&height=1801&format=pjpg&auto=webp",,,2025-06-26 13:09:57.917121
,California,2025-06-26 13:29:49+00:00,www.oaklandca.gov,Apply to Head Start,,,,,,https://www.oaklandca.gov/Community/Child-and-Youth-Services/Head-Start-and-Early-Head-Start/Apply-to-Head-Start,Find out if you are eligible and how to apply for the City of Oakland Head Start and Early Head Start.,,,,,2025-06-26 12:24:18.014714
,California,2025-06-26 13:26:38+00:00,www.oaklandca.gov,Head Start and Early Head Start,,,,,,https://www.oaklandca.gov/Community/Child-and-Youth-Services/Head-Start-and-Early-Head-Start,"The City of Oakland Head Start and Early Head Start Programs offer free early childhood education and care, prenatal education and family services to low-income residents.",,,,,2025-06-26 09:40:47.198406
,California,2025-06-26 13:09:42+00:00,pasadenanow.com,School Board to Review Ambitious $300 Million Capital Improvement Program Tonight,,,,,,https://pasadenanow.com/main/school-board-to-review-ambitious-300-million-capital-improvement-program-tonight,"... early childhood education centers. Get our daily Pasadena newspaper in your email box. Free. Get all the latest Pasadena news, more than 10 fresh ...",,,,,2025-06-26 12:24:18.014714
,California,2025-06-26 12:54:58+00:00,www.youtube.com,Navigating Quality and Leadership in Early Education with Jessica Van Hoose - YouTube,,,,,,https://www.youtube.com/watch%3Fv%3DB20kjlM-XEQ,"In this episode, Jessica Van Hoose of Child Development Schools shares her journey in early education and insights on building quality programs ...",,,,,2025-06-26 15:09:24.212153
,California,2025-06-26 12:48:17+00:00,Davis Vanguard,California Faces Federal Pressure to Halt Transgender Athletes - Davis Vanguard,,,,,,https://davisvanguard.org/2025/06/federal-clash-over-transgender-athletes/,"The Trump administration has threatened to revoke federal education funding to California if the state does not ban transgender girls from participating in girls' high school sports, sparking a clash with the state's existing law that allows students to participate in school programs consistent with their gender identity.",,https://davisvanguard.org/wp-content/uploads/2023/01/Transgender_Pride_flag.png,,,2025-06-26 15:09:24.212153
,California,2025-06-26 12:44:45+00:00,standard-journal.com ,Early childhood education program prepares Milton student for college,,,,,,https://www.standard-journal.com/news/local/article_5d6d5bb1-2e05-4475-b767-bcec6d04be6d.html,BLOOMSBURG — “Life is 10% what happens to you and 90% how you react to it.”,,https://bloximages.chicago2.vip.townnews.com/standard-journal.com/content/tncms/assets/v3/editorial/3/ed/3ed603af-3c7f-444e-9fa1-848b9503ce2a/685c16d918169.image.jpg?crop=287%2C287%2C71%2C0&resize=200%2C200&order=crop%2Cresize,,,2025-06-26 11:13:53.712617
,California,2025-06-26 11:15:19+00:00,www.wtol.com,"Ohio budget passes Senate with tax cuts, stadium funding | wtol.com",,,,,,https://www.wtol.com/article/news/local/ohio/ohio-state-budget-plan-passes-house-senate-seeks-approval-by-dewine/512-e39b9370-9603-41bd-a09e-4ef4ff171ad2,"... funding changes. Includes $600M for Browns Stadium, education funding adjustments ... years (2026-2027) passed through the House and Senate on ...",,,,,2025-06-26 09:40:47.198406
,California,2025-06-26 11:08:56+00:00,The Times of India,Play by our gender rules or pay the price: Trump’s Title IX ultimatum to California education department - Times of India,,,,,,https://timesofindia.indiatimes.com/education/news/california-vs-trump-title-ix-clash-over-trans-athletes-shakes-the-foundations-of-public-education/articleshow/122084529.cms,"News News: California’s decision to allow transgender girls in school sports has sparked a high-stakes legal battle with the Trump administration, which accuses ",,"https://static.toiimg.com/thumb/msid-122084795,width-1070,height-580,imgsize-93388,resizemode-75,overlay-toi_sw,pt-32,y_pad-40/photo.jpg",,,2025-06-26 14:13:04.840870
,California,2025-06-26 10:06:48+00:00,The American Prospect,University Unions Stand Up to Trump’s Research Cuts While Administrators Waver,,,,,,https://prospect.org/education/2025-06-26-university-unions-trump-research-cuts/,"While some universities have capitulated to Trump’s NIH cuts, there are faculty and graduate student union leaders on the frontlines pushing back.",,https://prospect.org/downloads/23111/download/AP25107845008937.jpg?cb=ee8931eb4fe85f7cc6a0501d337a8304&w=1000,,,2025-06-26 15:09:24.212153
,California,2025-06-26 09:56:04+00:00,Voice of San Diego,The Learning Curve: San Diego Unified May Get $36 Million More for PrimeTime,,,,,,https://voiceofsandiego.org/2025/06/25/the-learning-curve-san-diego-unified-may-get-36-million-more-for-primetime/,New funding thresholds for before- and after-school care programs in California schools will bring a whole lot more dough to districts like San Diego Unified.  ,,https://voiceofsandiego.org/wp-content/uploads/2025/02/ChollasMeadElementary_0021.jpg,,,2025-06-26 15:09:24.212153
,California,2025-06-26 08:51:23+00:00,FOX40 News,Two Leading Organizations Launch a New Partnership to Support Multigenerational Learning in the District of Columbia.,,,,,,https://fox40.com/business/press-releases/ein-presswire/825197225/two-leading-organizations-launch-a-new-partnership-to-support-multigenerational-learning-in-the-district-of-columbia,"From left: Thomas Selishev, Haley Wiggins (TFP), Saubia Fatemi, Monica Rivera (AppleTree Institute), and Oralia Puente (TFP) celebrate a new partnership between AppleTree Institute and The Family Place PCS—announced at the TFP Celebration of Achievement. AppleTree and The Family Place Are Building a New, Sustainable Way of Supporting Students from Both Generations Within the Same Family Through Partnerships. WASHINGTON, DC, UNITED STATES, June 25, 2025 /EINPresswire.com/ -- The Family ...",,https://fox40.com/wp-content/uploads/sites/13/2022/12/cropped-512x512_40-logo-1.png?strip=1&w=250,,,2025-06-26 07:02:57.749775
,California,2025-06-26 07:40:13+00:00,https://www.whsv.com,California found in violation of Title IX in clash with Trump officials over transgender athletes ,,,,,,https://www.whsv.com/2025/06/26/california-found-violation-title-ix-clash-with-trump-officials-over-transgender-athletes/,The Trump administration has found that the California Department of Education and the state’s high school sports federation violated civil rights law by allowing transgender girls to compete on girls sports teams. ,,https://gray-whsv-prod.gtv-cdn.com/resizer/v2/77FOQINFEZCANAIS3DXYAU7X5I.jpg?auth=75ddbbc072fb2ef592ec7e8307a5fa8000a88bad126dff6fa5c5d04ca030bc68&width=1200&height=600&smart=true,,,2025-06-26 05:02:42.092273
,California,2025-06-26 07:06:45+00:00,Zócalo Public Square,What Happens If ICE Kidnaps My Dad? | Essay,,,,,,https://www.zocalopublicsquare.org/what-happens-ice-kidnaps-dad-raid-rights/,"My Family Knows Our Rights. It’s a Comfort, and a Source of Pride, in a Moment of Heartbreak",,https://i0.wp.com/www.zocalopublicsquare.org/wp-content/uploads/2025/06/immigration-rights-AP-PhotoAmr-Alfiky-lede-scaled.jpg?fit=2560%2C1707&quality=89&ssl=1,,,2025-06-26 07:02:57.749775
,California,2025-06-26 06:59:00+00:00,www.youtube.com,California faces ultimatum: ban transgender athletes or lose federal education funding,,,,,,https://www.youtube.com/watch%3Fv%3Dh-7bEPxQN_E,It's now official: California's Department of Education and the state's high school sports federation are guilty of violating civil rights laws by ...,,,,,2025-06-26 05:02:42.092273
,California,2025-06-26 06:51:24+00:00,www.cde.ca.gov,Outdoor Learning Environments - School Facilities (CA Dept of Education),,,,,,https://www.cde.ca.gov/ls/fa/outdoorlearningenviron.asp,"The California Department of Education (CDE) supports outdoor learning environments (OLEs) that foster hands-on learning, improve student health and ...",,,,,2025-06-26 05:02:42.092273
,California,2025-06-26 05:53:29+00:00,Green Bay Press-Gazette,Check out photos from Governor Tony Evers' visit to Encompass Early Education and Care,,,,,,https://www.greenbaypressgazette.com/picture-gallery/news/2025/06/25/see-photos-as-tony-evers-visits-encompass-early-education-and-care/84361579007/,Wisconsin Governor Tony Evers visited Encompass Early Education and Care in De Pere to tour the facility and observe operations.,,"https://www.greenbaypressgazette.com/gcdn/authoring/authoring-images/2025/06/25/PGRB/84361508007-gpg-tony-evers-encompass-childcare-062525-159-ttm.jpg?crop=3523,1984,x4,y93&width=3200&height=1803&format=pjpg&auto=webp",,,2025-06-26 07:02:57.749775
,California,2025-06-26 05:44:43+00:00,www.youtube.com,Transgender Athletes Update: Trump Admin Pushes to Ban Trans Girls in CA Sports - YouTube,,,,,,https://www.youtube.com/watch%3Fv%3DDp5dL-VRzvo,"The federal Education Department proposed a resolution on June 25, 2025, requiring California ... funding. The move aligns with the ...",,,,,2025-06-26 07:02:57.749775
,California,2025-06-26 05:17:44+00:00,Cal Coast News,Trump administration tells California to ban transgender athletes,,,,,,https://calcoastnews.com/2025/06/trump-administration-tells-california-to-ban-transgender-athletes/,By KAREN VELIE The Trump administration announced on Wednesday that the California Department of Education and the state’s high school sports federation have violated civil rights law by allowing t…,,https://calcoastnews.com/images/2025/04/Screenshot-2025-04-26-at-12-33-27-CA-student-details-experience-being-forced-to-share-locker-room-with-biological-male-Fox-News-Video.png,,,2025-06-26 07:02:57.749775
,California,2025-06-26 04:38:22+00:00,jobs.apta.org,"Early Intervention Physical Therapist, Child Development Services Job Opening in Los ...",,,,,,https://jobs.apta.org/job/early-intervention-physical-therapist-child-development-services/78767425/,"Education and Experience: A doctorate, master's, or bachelor's degree in physical therapy from an accredited institution is required. California ...",,,,,2025-06-26 04:01:07.759760
,California,2025-06-26 04:31:47+00:00,https://www.wdbj7.com,California found in violation of Title IX in clash with Trump officials over transgender athletes ,,,,,,https://www.wdbj7.com/2025/06/26/california-found-violation-title-ix-clash-with-trump-officials-over-transgender-athletes/,The Trump administration has found that the California Department of Education and the state’s high school sports federation violated civil rights law by allowing transgender girls to compete on girls sports teams. ,,https://gray-wdbj-prod.gtv-cdn.com/resizer/v2/77FOQINFEZCANAIS3DXYAU7X5I.jpg?auth=75ddbbc072fb2ef592ec7e8307a5fa8000a88bad126dff6fa5c5d04ca030bc68&width=1200&height=600&smart=true,,,2025-06-26 05:02:42.092273
,California,2025-06-26 04:20:44+00:00,Introduction to Curriculum for Early Childhood Education,3.4 Conclusion – Introduction to Curriculum for Early Childhood Education,,,,,,https://pressbooks.atlanticoer-relatlantique.ca/ece-curriculum/chapter/3-4-conclusion/,"<img src=""https://pressbooks.atlanticoer-relatlantique.ca/app/uploads/sites/638/2025/06/nscc-open-textbook-logo.png"" width=""250"" height=""300"" alt=""image"" /><br />",,https://pressbooks.atlanticoer-relatlantique.ca/app/uploads/sites/638/2023/08/Intro-to-Curriculum-ECE-Cover-1.jpg,,,2025-06-26 04:01:07.759760
,California,2025-06-26 03:04:30+00:00,KPBS Public Media,A life-changing youth behavioral program is set to lose funding under Trump,,,,,,https://www.kpbs.org/news/education/2025/06/25/la-mesa-spring-valley-behavioral-program-set-to-lose-funding-under-trump,"In May, the Department of Education told districts across the country, including the La Mesa-Spring Valley School District, that its school-based mental health grant program would end two years early.",,https://cdn.kpbs.org/dims4/default/752fcbf/2147483647/strip/true/crop/5236x2749+0+353/resize/1200x630!/quality/90/?url=http%3A%2F%2Fkpbs-brightspot.s3.us-west-2.amazonaws.com%2Fb5%2Fbd%2Fbdff3d7b411a96b6f8ccc48f009c%2Fimg-8466.JPG,,,2025-06-26 01:00:08.139424
,California,2025-06-26 02:23:37+00:00,https://www.wdam.com,California found in violation of Title IX in clash with Trump officials over transgender athletes ,,,,,,https://www.wdam.com/2025/06/26/california-found-violation-title-ix-clash-with-trump-officials-over-transgender-athletes/,The Trump administration has found that the California Department of Education and the state’s high school sports federation violated civil rights law by allowing transgender girls to compete on girls sports teams. ,,https://gray-wdam-prod.gtv-cdn.com/resizer/v2/77FOQINFEZCANAIS3DXYAU7X5I.jpg?auth=75ddbbc072fb2ef592ec7e8307a5fa8000a88bad126dff6fa5c5d04ca030bc68&width=1200&height=600&smart=true,,,2025-06-26 01:00:08.139424
,California,2025-06-26 02:19:52+00:00,Yahoo News,Superintendents’ Early Childhood Plan: A decade of Omaha metro success,,,,,,https://news.yahoo.com/superintendents-early-childhood-plan-decade-012301475.html,"As superintendents of the 11 school districts that make up the Learning Community of Douglas and Sarpy Counties, we want to take full advantage of the awe-inspiring early years when children’s brains develop most rapidly. We want young children, especially those living in poverty, to receive quality early childhood services from birth to Grade 3. […]",,https://media.zenfs.com/en/nebraska_examiner_articles_344/59b2ec78f493be7f62cdb8c535a26f6d,,,2025-06-26 01:00:08.139424
,California,2025-06-26 02:16:00+00:00,OCDE Newsroom,Sunburst cadets explore STEM magic during Disneyland experience,,,,,,https://newsroom.ocde.us/sunburst-cadets-explore-stem-magic-during-disneyland-experience/,Education news from Orange County and beyond,,https://newsroom.ocde.us/wp-content/uploads/2021/09/250513-Z-FD650-1109.jpg,,,2025-06-26 05:02:42.092273
,California,2025-06-26 01:06:05+00:00,https://www.actionnews5.com,California found in violation of Title IX in clash with Trump officials over transgender athletes ,,,,,,https://www.actionnews5.com/2025/06/26/california-found-violation-title-ix-clash-with-trump-officials-over-transgender-athletes/,The Trump administration has found that the California Department of Education and the state’s high school sports federation violated civil rights law by allowing transgender girls to compete on girls sports teams. ,,https://gray-wmctv-prod.gtv-cdn.com/resizer/v2/77FOQINFEZCANAIS3DXYAU7X5I.jpg?auth=75ddbbc072fb2ef592ec7e8307a5fa8000a88bad126dff6fa5c5d04ca030bc68&width=1200&height=600&smart=true,,,2025-06-26 01:00:08.139424
,California,2025-06-26 00:44:48+00:00,NBC 6 South Florida,"California violates civil rights with transgender student athlete policy, federal officials rule",,,,,,https://www.nbcmiami.com/news/national-international/california-violates-civil-rights-with-transgender-student-athlete-policy-federal-officials-rule/3645758/,Federal officials have ruled that California violated civil rights by allowing transgender athletes to compete against biological females.,,https://media.nbcmiami.com/2025/06/AP25152167876536.jpg?quality=85&strip=all&crop=0px%2C341px%2C5537px%2C3114px&resize=1200%2C675,,,2025-06-25 23:03:39.788279
,California,2025-06-26 00:43:39+00:00,https://www.14news.com,California found in violation of Title IX in clash with Trump officials over transgender athletes ,,,,,,https://www.14news.com/2025/06/26/california-found-violation-title-ix-clash-with-trump-officials-over-transgender-athletes/,The Trump administration has found that the California Department of Education and the state’s high school sports federation violated civil rights law by allowing transgender girls to compete on girls sports teams. ,,https://gray-wfie-prod.gtv-cdn.com/resizer/v2/77FOQINFEZCANAIS3DXYAU7X5I.jpg?auth=75ddbbc072fb2ef592ec7e8307a5fa8000a88bad126dff6fa5c5d04ca030bc68&width=1200&height=600&smart=true,,,2025-06-26 01:00:08.139424
,California,2025-06-26 00:32:17+00:00,CalMatters,"Pandemic graduates: They had no prom, no pomp and circumstance, and started college on Zoom",,,,,,https://calmatters.org/education/2025/06/pandemic-graduates-california/,"Five years after COVID shut down most California high schools, today's college students describe a difficult transition to adulthood.",,https://i0.wp.com/calmatters.org/wp-content/uploads/2025/06/051925_Pandemic-Graduates_KG_CM_10.jpg?fit=2000%2C1333&ssl=1,,,2025-06-25 21:00:13.751518
,California,2025-06-26 00:27:52+00:00,ABC30 Fresno,"US Dept. of Education threatens California, saying state violated Title IX",,,,,,https://abc30.com/post/us-dept-education-threatens-california-saying-state-violated-title-ix/16847879/,The federal government has put California on notice after weeks of push and pull.,,https://cdn.abcotvs.com/dip/images/16848860_title-ix-img.png?w=1600,,,2025-06-25 21:00:13.751518
,California,2025-06-25 23:46:46+00:00,ny1.com,"More than 7,000 preschoolers went without services like speech therapy this year",,,,,,https://ny1.com/nyc/all-boroughs/education/2025/06/25/more-than-7-000-preschoolers-went-without-services-like-speech-therapy-this-year,The Department of Education says there&#39;s a shortage of providers.,,https://s7d2.scene7.com/is/image/TWCNews/Jillian_PKG_Preschool_Services_NY_062525,,,2025-06-26 01:00:08.139424
,California,2025-06-25 23:31:26+00:00,Canon City Daily Record,California found in violation of Title IX in clash with Trump officials over transgender athletes,,,,,,https://www.canoncitydailyrecord.com/2025/06/25/california-trump-transgender-athletes/,"If California rejects the proposal, the Education Department could move to terminate the state’s federal education funding.",,https://www.canoncitydailyrecord.com/wp-content/uploads/2025/06/California_Transgender_Athletes_04306-1.jpg?w=1024&h=682,,,2025-06-25 23:03:39.788279
