id,name,published,outlet,title,authors,category,market,categoryorder,articleorder,url,description,text,image,error,sentiment,firstEyes
,California,2025-06-25 16:06:03+00:00,"myMotherLode.com - The Mother Lode's Local News, Sports, Weather, Movies, Classifieds, Yellow Pages, Real Estate",California found in violation of Title IX in clash with Trump officials over transgender athletes - myMotherLode.com,,,,,,https://www.mymotherlode.com/news/state/4035974/california-found-in-violation-of-title-ix-in-clash-with-trump-officials-over-transgender-athletes.html,"The Trump administration has found that the California Department of Education and the state’s high school sports federation violated civil rights law by allowing transgender girls to compete on girls sports teams. The federal Education Department announced the finding Wednesday. The agency proposed a resolution that would require California to bar transgender women from women’s sports and strip transgender athletes of records, titles and awards. It’s the latest escalation in the Trump administration’s effort to bar transgender athletes from women’s sports teams nationwide. If California rejects the proposal, the Education Department could move to terminate the state’s federal education funding.",,https://www.mymotherlode.com/wp-content/uploads/2025/06/AP_8608d619c83545ba97b43734105eda52_7272baa00e.jpg,,,2025-06-25 13:13:42.893801
,California,2025-06-25 16:00:28+00:00,ABC News,California found in violation of Title IX in clash with Trump officials over transgender athletes,,,,,,https://abcnews.go.com/US/wireStory/california-found-violation-title-ix-clash-trump-officials-123197086,The Trump administration has found that the California Department of Education and the state’s high school sports federation violated civil rights law by allowing transgender girls to compete on girls sports teams,,https://i.abcnewsfe.com/a/ebedc073-7c99-4030-8bb1-9c1d8c9f12b4/wirestory_921cada31395db33105316fe0e198c12_16x9.jpg?w=1600,,,2025-06-25 12:14:57.466648
,California,2025-06-25 15:48:53+00:00,ABC7 Los Angeles,CA violated Title IX by allowing trans athletes to compete against females: US Education Dept,,,,,,https://abc7.com/post/california-violated-title-ix-allowing-trans-athletes-compete-females-education-dept/16845258/,The U.S. Department of Education says that California violated Title IX by allowing transgender athletes to compete against females.,,https://cdn.abcotvs.com/dip/images/16845288_062525-kabc-title-ix.jpg?w=1600,,,2025-06-25 12:14:57.466648
,California,2025-06-25 15:23:38+00:00,Journal Sentinel,Milwaukee School Board approves $1.5 billion budget plan. Here are the highlights.,,,,,,https://www.jsonline.com/story/news/education/2025/06/24/mps-school-board-approves-1-5-billion-budget-for-2025-26-school-year/84290043007/,"Unlike in recent years, school board members didn't make any changes to the new MPS superintendent's budget plan.",,"https://www.jsonline.com/gcdn/authoring/authoring-images/2025/06/13/PMJS/84190674007-mps-budget-4593.jpg?crop=2699,1518,x0,y0&width=2699&height=1518&format=pjpg&auto=webp",,,2025-06-25 12:14:57.466648
,California,2025-06-25 15:15:17+00:00,Reasons to be Cheerful,How Zohran Mamdani's Big Goals Could Transform Life in New York City,,,,,,https://reasonstobecheerful.world/zohran-mamdani-goals-learn-more/,"The NYC mayoral candidate has made history. Learn more about the groundbreaking measures he’s proposing, from free buses to city-owned supermarkets.",,https://reasonstobecheerful.world/wp-content/uploads/2025/06/shutterstock_2642346839-scaled.jpg,,,2025-06-25 12:14:57.466648
,California,2025-06-25 15:04:29+00:00,www.bloomberg.com,California Schools Risk DC Funding Cuts on Transgender Athlete Debate - Bloomberg,,,,,,https://www.bloomberg.com/news/articles/2025-06-25/ca-schools-risk-dc-funding-cuts-on-transgender-athlete-debate,Public school funding in California is at risk after the US Education ... Child Labor. Credit Line. Risk Reduction. Decentralized exchange. Islamic ...,,,,,2025-06-25 12:14:57.466648
,California,2025-06-25 14:46:28+00:00,Los Angeles Times,"California violated civil rights of female students by allowing trans athletes to compete, feds say",,,,,,https://www.latimes.com/california/story/2025-06-25/california-title-ix-violation-ocr-finds,The U.S. Department of Education says California violated the civil rights of female students on the basis of sex by allowing transgender students to compete in school sports according to their gender identity.,,https://ca-times.brightspotcdn.com/dims4/default/5296999/2147483647/strip/true/crop/3000x1575+0+303/resize/1200x630!/quality/75/?url=https%3A%2F%2Fcalifornia-times-brightspot.s3.amazonaws.com%2F47%2Fe5%2F1c18e8ad444d8514ad3a4e6e5d07%2F1508463-sp-trans-gender-athlete-controversy-0018.JPG,,,2025-06-25 12:14:57.466648
,California,2025-06-25 14:35:15+00:00,corporate.charter.com,Spectrum Awards $1.1 Million in 2025 Spectrum Digital Education Grants | Charter Communications,,,,,,https://corporate.charter.com/newsroom/spectrum-digital-education-awards-grants-2025,Spectrum Digital Education has awarded $1.1 million in grants to 55 nonprofit organizations for 2025.,,https://corporate.charter.com/sites/default/files/2025-01/Spectrum%20Logo_Social%20Share.jpg,,,2025-06-25 12:14:57.466648
,California,2025-06-25 14:32:55+00:00,Fox News,"Trump admin accuses California of violating Title IX, threatens to pull federal funding | Fox News Video",,,,,,https://www.foxnews.com/video/6374853687112,Education Secretary Linda McMahon joins 'Fox & Friends' to discuss why the Trump administration believes there have been violations and what will happen if the state doesn't 'make it right' for the affected female athletes. ,,https://a57.foxnews.com/cf-images.us-east-1.prod.boltdns.net/v1/static/694940094001/0574b0ed-6ad0-4960-8d18-99ca5599142f/c80b5055-a499-4ffe-90a2-29a7e0a31ec8/1280x720/match/1024/512/image.jpg?ve=1&tl=1,,,2025-06-25 12:14:57.466648
,California,2025-06-25 14:32:49+00:00,Los Angeles Times,"Revised LAUSD budget saves jobs today, trims future retiree health benefit contributions",,,,,,https://www.latimes.com/california/story/2025-06-25/18-8-billion-lausd-budget-approved-over-unions-objections-to-future-cuts,The L.A. school board approved an $18.8 billion budget that postpones layoffs for a year and does not cut services to students. But future years may looking much different.,,https://ca-times.brightspotcdn.com/dims4/default/2fdee6a/2147483647/strip/true/crop/4032x2117+0+454/resize/1200x630!/quality/75/?url=https%3A%2F%2Fcalifornia-times-brightspot.s3.amazonaws.com%2Ffb%2F9d%2F4897fcb14f719e7dc87da3e6c5c8%2Fimg-5584.jpg,,,2025-06-25 12:14:57.466648
,California,2025-06-25 14:12:14+00:00,www.washingtontimes.com,Education Department gives California 10 days to boot transgender athletes from girls' sports,,,,,,https://www.washingtontimes.com/news/2025/jun/25/education-department-gives-california-10-days-boot-transgender/,... funding from states that allow biological males in female sports. Ms. McMahon said California runs the risk of losing K-12 federal funding because ...,,,,,2025-06-25 12:14:57.466648
,California,2025-06-25 13:58:06+00:00,Silicon Valley,Sky-high housing prices spur San Jose charter school default,,,,,,https://www.siliconvalley.com/2025/06/25/californias-sky-high-housing-prices-spur-charter-school-default/,"Downtown College Prep, a three-campus charter school operator in San Jose, defaulted on $34 million of municipal bonds earlier this month.",,https://www.siliconvalley.com/wp-content/uploads/2025/06/SJM-L-ALUMCLOSE-0328-2.jpg?w=1024&h=682,,,2025-06-25 13:13:42.893801
,California,2025-06-25 13:49:29+00:00,silive,Staten Island teacher retires after 32 years at school she once attended ,,,,,,https://www.silive.com/education/2025/06/staten-island-teacher-retires-after-32-years-at-school-she-once-attended.html,"This Staten Island teacher walked the halls of PS 42 as a student in the 1970s, and returned to start her teaching career in the early 1990s.",,https://www.silive.com/resizer/v2/FREVSKKIEVCHXOXSZ3J7LKHTYI.jpeg?auth=bf61dc2a6ac1942754f6cd06038e43ac318c5e9f5d98c619ad5314fddfb468fe&width=1280&quality=90,,,2025-06-25 12:14:57.466648
,California,2025-06-25 13:01:39+00:00,"Inside Higher Ed | Higher Education News, Events and Jobs",Sonoma State to Receive $45M Funding Infusion,,,,,,https://www.insidehighered.com/news/business/financial-health/2025/06/25/sonoma-state-receive-45m-funding-infusion,California lawmakers announced the additional financial support months after the university proposed sweeping cuts due to budget issues. Now some cuts will be reversed.,,https://www.insidehighered.com/sites/default/files/styles/large/public/2025-06/Sonoma_state_university_Salazar_Hall_Wikimedia_Commons_edit.jpg?itok=jnY-eIG1,,,2025-06-25 12:14:57.466648
,California,2025-06-25 13:01:33+00:00,www.americanprogress.org,Preparing Rural Students for College and Beyond by Improving Access to Coursework,,,,,,https://www.americanprogress.org/article/preparing-rural-students-for-college-and-beyond-by-improving-access-to-coursework/,Rural school districts rely on federal funding programs such as the Rural Education ... early and finish an education degree program.<sup>55</sup> Key ...,,,,,2025-06-25 12:14:57.466648
,California,2025-06-25 12:57:31+00:00,U.S. Department of Education,U.S. Department of Education Finds California Department of Education and California Interscholastic Federation in Violation of Title IX,,,,,,https://www.ed.gov/about/news/press-release/us-department-of-education-finds-california-department-of-education-and-california-interscholastic-federation-violation-of-title-ix,"Today, the Department’s OCR announced the conclusion of its Title IX investigations into the California Department of Education (CDE) and the California Interscholastic Federation (CIF) for allegations of discrimination on the basis of sex.",,http://www.ed.gov/themes/custom/edgov/images/ed-og.png,,,2025-06-25 12:14:57.466648
,California,2025-06-25 12:56:30+00:00,WJHL | Tri-Cities News & Weather,Two Leading Organizations Launch a New Partnership to Support Multigenerational Learning in the District of Columbia.,,,,,,https://www.wjhl.com/business/press-releases/ein-presswire/825197225/two-leading-organizations-launch-a-new-partnership-to-support-multigenerational-learning-in-the-district-of-columbia,"From left: Thomas Selishev, Haley Wiggins (TFP), Saubia Fatemi, Monica Rivera (AppleTree Institute), and Oralia Puente (TFP) celebrate a new partnership between AppleTree Institute and The Family Place PCS—announced at the TFP Celebration of Achievement. AppleTree and The Family Place Are Building a New, Sustainable Way of Supporting Students from Both Generations Within the Same Family Through Partnerships. WASHINGTON, DC, UNITED STATES, June 25, 2025 /EINPresswire.com/ -- The Family ...",,https://www.wjhl.com/wp-content/uploads/sites/98/2019/09/cropped-11.png?strip=1&w=250,,,2025-06-25 12:14:57.466648
,California,2025-06-25 12:55:59+00:00,coloradonewsline.com,Colorado colleges that serve Hispanic students get federal grants. A lawsuit may change that.,,,,,,https://coloradonewsline.com/2025/06/25/colorado-hispanic-students-federal-grants/,"... educational outcomes and low government funding. Between the years 2000 ... California. Colorado Newsline is part of States Newsroom, the ...",,,,,2025-06-25 12:14:57.466648
,California,2025-06-25 12:37:22+00:00,WHYY,Camden students show how music achievement can predict academic and professional success,,,,,,https://whyy.org/articles/camden-creative-arts-high-school/,"Students at New Jersey’s Creative Arts High School exemplify how music can empower, academically and personally.",,https://whyy.org/wp-content/uploads/2025/06/05-22-2025-k-paynter-camden-creative-arts-high-school-jazz_-2.jpg,,,2025-06-25 12:14:57.466648
,California,2025-06-25 12:33:22+00:00,CalMatters,"California budget deal forces cuts to immigrant health care, taps rainy day funds",,,,,,https://calmatters.org/politics/2025/06/california-budget-newsom-democrats/,"California’s tough choices: Budget deal limits immigrant health coverage, uses rainy day funds as the state grapples with $12 billion shortfall.",,https://i0.wp.com/calmatters.org/wp-content/uploads/2025/06/052325_Assembly-Floor_FG_CM_03.jpg?fit=2000%2C1333&ssl=1,,,2025-06-25 12:14:57.466648
,Early Childhood Education,2025-06-25 11:14:39+00:00,Fingerlakes1.com,Langworthy announces $2.5M federal grant for Head Start in Bath | Fingerlakes1.com,,,,,,https://www.fingerlakes1.com/2025/06/24/langworthy-announces-2-5m-federal-grant-for-head-start-in-bath/,"Congressman Nick Langworthy (NY-23) announced Tuesday that more than $2.5 million in federal funding will support Head Start programs in Steuben County. The U.S. Department of Health and Human Services has awarded $2,530,907 to Pro Action of Steuben and Yates, Inc. to expand and sustain early childhood education initiatives in Bath, N.Y. “I was proud… MoreLangworthy announces $2.5M federal grant for Head Start in Bath",,https://www.fingerlakes1.com/wp-content/uploads/2024/11/CAP-Reading-Headstart.jpg,,,2025-06-25 16:09:26.215786
,California,2025-06-25 10:43:28+00:00,Park Rapids Enterprise,Georgia Nunn,,,,,,https://www.parkrapidsenterprise.com/obituaries/obits/georgia-nunn-mjd99id7ixeq0uruaoh1,"Georgia Ann Nunn, of Yucca Valley, California, peacefully passed away in her home on Saturday, June 14, 2025, at 9:30 PM.",,https://cdn.forumcomm.com/dims4/default/33c92f7/2147483647/strip/true/crop/450x600+0+0/resize/800x1066!/quality/90/?url=https%3A%2F%2Fres.cloudinary.com%2Fdgqq2xsfd%2Fimage%2Fupload%2Fenotice-production%2Fdocumentcloud%2Fads%2F1750798969151%2F1750798969529%2Fupscaled_1750798969529_071d41a08e37871a0a4a21f6f5bc59b8a7515b84.png.jpg,,,2025-06-25 12:14:57.466648
,California,2025-06-25 10:22:43+00:00,The Enquirer,"PreK closures, staff cuts and curriculum: Cincinnati Public Schools' makes over 200 cuts",,,,,,https://www.cincinnati.com/story/news/education/2025/06/25/5-summaries-of-notable-cuts-from-cincinnati-public-schools-this-week/84332056007/,"The Cincinnati Public Schools board of education approved a ""master list"" of more than 200 cuts as it addresses a roughly $50 million budget gap.",,"https://www.cincinnati.com/gcdn/authoring/authoring-images/2024/08/14/PCIN/74798552007-cps-16.jpg?crop=4405,2479,x0,y146&width=3200&height=1801&format=pjpg&auto=webp",,,2025-06-25 12:14:57.466648
,California,2025-06-25 10:19:53+00:00,www.commercialappeal.com,"The Commercial Appeal Subscription Offers, Specials, and Discounts",,,,,,https://www.commercialappeal.com/story/news/education/2025/06/25/mscs-head-start-issues/84316832007/,"Huge Savings: Subscribe today to enjoy sports, entertainment, life, money, tech, and travel news along with videos, apps, and more.",,https://staticassets.gannettdigital.com/gci-static-assets/assets/global/checkout/meta-generic.png,,,2025-06-25 07:06:45.236277
,California,2025-06-25 08:41:29+00:00,www.abc10.com,California Auditor: Highlands Community Charter and Technical Schools took $180 million ...,,,,,,https://www.abc10.com/article/news/investigations/california-auditor-highlands-community-charter-technical-schools-took-180-million-improperly/103-36adcb13-b6c0-4f7d-97c7-00b3813f8cf5,"The California Department of Education takes the appropriate, effective use of education dollars very seriously. Over multiple years, CDE has directly ...",,,,,2025-06-25 06:01:14.231606
,California,2025-06-25 07:48:58+00:00,www.msn.com,Avon breaks ground on $13M early childhood development center - MSN,,,,,,https://www.msn.com/en-us/news/us/avon-breaks-ground-on-13m-early-childhood-development-center/ar-AA1HkHu5,"... early childhood education and development facility. ... Ask a Pro: ""How Long Will $1M Last in Retirement?"" Sponsored. California laws changing July 1: ...",,,,,2025-06-25 07:06:45.236277
,California,2025-06-25 07:19:11+00:00,www.sdcoe.net,American Red Cross Honors Real Heroes,,,,,,https://www.sdcoe.net/about-sdcoe/news/post/~board/news/post/american-red-cross-honors-real-heros,"The American Red Cross of San Diego and Imperial counties is accepting nominations for their 23rd Annual Real Heroes Awards. This event raises awareness of local heroes making a positive impact in the community. A total of eight categories are represented and the winning heroes will be recognized in September at a ceremony aboard the USS Midway Museum.  
",,https://resources.finalsite.net/images/v1750710826/sdcoenet/azld5tfztbki3bs2hvmb/Davila-emergency-hero.jpg,,,2025-06-25 06:01:14.231606
,California,2025-06-25 06:45:01+00:00,EdSource,California’s education code is smothering innovation,,,,,,https://edsource.org/2025/california-education-code-needs-overhaul/735017,Red tape strangles innovation in California classrooms. But there's a way out of the morass without sacrificing accountability.,,https://edsource.org/wp-content/uploads/2023/08/Redwood_Elem_015-1024x683.jpg,,,2025-06-25 06:01:14.231606
,California,2025-06-25 05:34:04+00:00,www.11alive.com,Barrow County School Board Approves $226M budget; funding for SROs included,,,,,,https://www.11alive.com/article/news/education/barrow-county-board-education-approves-226m-budget-2m-for-resource-officers/85-b47b2f66-e71c-4703-a823-f5544ed16576,... Education approves $226M budget that includes funding for school ... schools are what's most important — the safety of the children and the teachers.,,,,,2025-06-25 06:01:14.231606
,California,2025-06-25 05:12:53+00:00,The Hechinger Report,Governors in 13 states reject funding for summer food program,,,,,,https://hechingerreport.org/young-children-may-go-hungry-as-summer-begins/,Thousands more children are expected to go hungry this summer as a growing number of states and cities decline federal summer food dollars.,,https://hechingerreport.org/wp-content/uploads/2025/12/EC-summer-food-getty1-scaled.jpg,,,2025-06-25 06:01:14.231606
,California,2025-06-25 04:56:25+00:00,subscriber.politicopro.com,"POLITICO Pro: Newsom, lawmakers strike budget deal on undocumented health care, education funding",,,,,,https://subscriber.politicopro.com/article/2025/06/newsom-lawmakers-strike-budget-deal-on-undocumented-health-care-education-funding-00421644,"Discussions remain over housing, and federal cuts could impact the budget outlook.",,https://static.politico.com/1e/0b/b3f687f94ac8b813b80165043754/https-delivery-gettyimages.com/downloads/2082077936,,,2025-06-25 06:01:14.231606
,California,2025-06-25 02:10:22+00:00,AS USA,A 4-year-old boy with high abilities refuses to go back to school after “the teacher said in front of everyone that he...”,,,,,,https://en.as.com/latest_news/a-4-year-old-boy-with-high-abilities-refuses-to-go-back-to-school-after-the-teacher-said-in-front-of-everyone-that-he-n-2/,"After early struggles in preschool, a gifted child began to thrive with tailored support and understanding.",,https://img.asmedia.epimg.net/resizer/v2/IJEDXJE63BB6VE64N2WKOZ7KSU.png?auth=171e731a7917c163d9ad4cf54cff61d3efaa8b4a2b02107714bc322a112853c2&width=1472&height=828&smart=true,,,2025-06-24 23:02:50.854793
,California,2025-06-25 01:51:37+00:00,www.sfchronicle.com,California college leaders urge Congress to reject Pell Grant cuts - San Francisco Chronicle,,,,,,https://www.sfchronicle.com/california/article/california-pell-grant-cuts-20392459.php,"In their letter, the education leaders said Trump's tax proposal would set the maximum Pell Grant back to what it was 10 years ago, cutting many ...",,,,,2025-06-24 23:02:50.854793
,California,2025-06-25 01:01:22+00:00,Los Angeles Times,"Parents, chill: Why you don't need to teach your 3-year-old to read",,,,,,https://www.latimes.com/california/story/2025-06-24/why-you-dont-need-to-teach-your-3-year-old-to-read,"California’s dismal reading scores point to the need to bolster early literacy, but here's why experts say it may be possible to introduce reading too early.",,https://ca-times.brightspotcdn.com/dims4/default/e373d7a/2147483647/strip/true/crop/6720x3528+0+476/resize/1200x630!/quality/75/?url=https%3A%2F%2Fcalifornia-times-brightspot.s3.amazonaws.com%2F21%2F71%2Fe18a5c6a4658959ffb5a60d9286a%2F1338147-la-me-home-infant-home-visits-015-fo.jpg,,,2025-06-24 23:02:50.854793
,California,2025-06-25 01:00:41+00:00,cleveland,Judge rules Ohio’s EdChoice private school voucher program unconstitutional   ,,,,,,https://www.cleveland.com/open/2025/06/judge-rules-ohios-edchoice-private-school-voucher-program-unconstitutional.html,Franklin County Common Pleas Judge Jaiza Page granted summary judgment in favor of the plaintiffs in three of the five counts in their complaint.,,https://www.cleveland.com/resizer/v2/2R7MBNETO5DLRPK5V4PL7LH46U.jpg?auth=8b55997a0cf10ce7de7ad4f8555ccd49a36135b53d63e0b4b848e596e76145e3&width=1280&quality=90,,,2025-06-24 23:02:50.854793
,California,2025-06-25 00:30:38+00:00,MyNorthwest.com,Seattle residents to vote on billion-dollar education levy,,,,,,https://mynorthwest.com/mynorthwest-politics/seattle-education-levy-2/4103156,"Seattle's $1.3 billion education levy is set for the 2025 ballot, impacting local schools and funding priorities.",,https://mynorthwest.com/wp-content/uploads/2025/06/Seattles-education-levy.jpg,,,2025-06-24 21:01:29.109262
,California,2025-06-24 23:18:27+00:00,KCRA,"Sacramento charter school got $180 million it wasn't eligible for, audit finds",,,,,,https://www.kcra.com/article/sacramento-highlands-charter-school-audit/65177737,"A state audit found that a Sacramento area charter school received more than $180 million in funding it was not eligible for, engaged in wasteful spending, and assigned teachers to classes they did not have the credentials to teach.",,"https://kubrick.htvapps.com/htv-prod/ibmig/cms/image/kcra/18149436-classroom-desks-jpg.jpg?crop=1.00xw:1.00xh;0,0&resize=1200:*",,,2025-06-24 20:05:59.595402
,California,2025-06-24 23:01:57+00:00,www.youtube.com,Barrow County Board of Education meeting on school resource officer funding - YouTube,,,,,,https://www.youtube.com/watch%3Fv%3DEqTRW_N2xtc,The cut shifts full financial responsibility for 12 of 24 school resource officers back onto the district.,,,,,2025-06-24 21:01:29.109262
,California,2025-06-24 22:22:17+00:00,CalMatters,Legal rulings may return hundreds of health research grants to California,,,,,,https://calmatters.org/education/higher-education/2025/06/health-research-california/,"Trump’s move to cancel health research funding would wipe out funding for studies on lung disease, dementia and aging.",,https://calmatters.org/wp-content/uploads/2025/05/050625_CSU-San-Marcos_AH_CM_47.jpg,,,2025-06-24 19:08:31.389492
,California,2025-06-24 22:17:59+00:00,Lookout Santa Cruz,California's long-awaited salmon season closes early after anglers exceed quota,,,,,,https://lookout.co/californias-long-awaited-salmon-season-closes-early-after-anglers-exceed-quota/story,"After a successful opening weekend exceeded the season limit, California's salmon spot-fishing days in July and August have been canceled.",,https://lookout.co/wp-content/uploads/2025/06/Ian-Cole-of-Ocean2Table-11-scaled.jpg,,,2025-06-24 23:02:50.854793
,California,2025-06-24 22:07:20+00:00,www.newsfromthestates.com,"Dems, GOP members of US House panel split on solution to high cost of child care",,,,,,https://www.newsfromthestates.com/article/dems-gop-members-us-house-panel-split-solution-high-cost-child-care,"... Early Childhood, Elementary and Secondary Education, said at the panel's hearing. “At the same time, child care can be exceedingly expensive — the ...",,,,,2025-06-24 19:08:31.389492
,California,2025-06-24 22:01:55+00:00,oregonlive,"Outdoor school, rural teacher programs, other education initiatives face cuts as Legislature winds down",,,,,,https://www.oregonlive.com/education/2025/06/outdoor-school-rural-teacher-programs-other-education-initiatives-face-cuts-as-legislature-winds-down.html,"With precious little time left for advocacy, time is running out for an eleventh hour save.
",,https://www.oregonlive.com/resizer/v2/2GT6AGV4JZAGJDPNY2ZJPDWS3Q.jpg?auth=dcfd8d8ed7f7eaef0ab02fe5916c567786f3a806a05fa41c96acfa4d91e5db0d&width=1280&quality=90,,,2025-06-24 20:05:59.595402
,California,2025-06-24 22:01:52+00:00,www.9news.com,Avon breaks ground on $13M early childhood development center - 9News,,,,,,https://www.9news.com/article/news/education/early-childcare-center-avon/73-3a339db5-ff83-4405-9d4b-8ab049927568,This facility will provide much-needed childcare options for working families and will deliver high-quality early childhood education to our ...,,,,,2025-06-24 19:08:31.389492
,California,2025-06-24 21:55:47+00:00,www.modbee.com,Modesto board approves 5th-grade sex ed curriculum amid strong community debate,,,,,,https://www.modbee.com/news/local/education/article309325740.html,"Research shows that comprehensive sex education, especially when started early ... school year, with the California Department of Education overseeing ...",,,,,2025-06-24 19:08:31.389492
,California,2025-06-24 21:55:30+00:00,Children's Defense Fund,CDF listening tour to stop in South Carolina as President and CEO Starsky Wilson hears families' pressing needs - Children's Defense Fund,,,,,,https://www.childrensdefense.org/cdf-listening-tour-to-stop-in-south-carolina-as-president-and-ceo-starsky-wilson-hears-families-pressing-needs/,"On Wednesday, Rev. Dr. Starsky Wilson, president and CEO of the national children’s advocacy organization Children’s Defense Fund (CDF), will visit Columbia to learn more about the challenges facing children and families, as well as the solutions they seek, amid ongoing uncertainty surrounding the economy and key programs related to education and health in America.",,https://www.childrensdefense.org/wp-content/uploads/2024/11/cdf-logo-rgb_Horizontal-Logo-Full-Color-1200x675-1.png,,,2025-06-24 19:08:31.389492
