id,name,published,outlet,title,authors,category,market,categoryorder,articleorder,url,description,text,image,error,sentiment,firstEyes
,California,2025-06-24 21:52:54+00:00,www.wltx.com,Meet News19 Teacher of the Week Salina Jeffcoat - WLTX,,,,,,https://www.wltx.com/article/news/local/teacher-of-the-week/meet-news19-teacher-of-the-week-salina-jeffcoat/101-bc28e720-64e8-4618-87e9-10c9dc08f4e1,"... Early Childhood Education. “I just really like the younger grades. Especially early literacy skills, when they're just learning to read and ...",,,,,2025-06-24 19:08:31.389492
,California,2025-06-24 21:49:23+00:00,LAist,"California retires RICA, new teacher test to focus on phonics",,,,,,https://laist.com/news/education/california-retires-rica-new-teacher-test-to-focus-on-phonics,"On July 1, the unpopular Reading Instruction Competence Assessment will be replaced with a performance assessment to ensure teachers are prepared to teach students to read.",,https://scpr.brightspotcdn.com/dims4/default/4b28a3b/2147483647/strip/true/crop/1024x538+0+65/resize/1200x630!/quality/90/?url=http%3A%2F%2Fscpr-brightspot.s3.us-west-2.amazonaws.com%2Fff%2F4f%2Fa2f362c74bd196fa8631804318bf%2Fedsource-rica-test.JPEG,,,2025-06-24 19:08:31.389492
,California,2025-06-24 21:33:17+00:00,Education Week,Trump Admin. Orders California to Remove Gender Identity From Sex Ed Curriculum,,,,,,https://www.edweek.org/policy-politics/trump-admin-orders-california-to-remove-gender-identity-from-sex-ed-curriculum/2025/06,The state has 60 days to make the change or it risks losing federal funds.,,https://epe.brightspotcdn.com/dims4/default/da244cb/2147483647/strip/true/crop/1720x1150+0+0/resize/942x630!/quality/90/?url=https%3A%2F%2Fepe-brightspot.s3.us-east-1.amazonaws.com%2Fbc%2F5a%2Fa39fa36a45fb8b2dfb2fe5107cd9%2F062425-california-pride-ap-bs.jpg,,,2025-06-24 19:08:31.389492
,California,2025-06-24 21:29:57+00:00,www.hartselleenquirer.com,Sparkman will not seek reelection to Hartselle school board - hartselleenquirer,,,,,,https://www.hartselleenquirer.com/2025/06/24/sparkman-will-not-seek-reelection-hartselle-school-board/,"After 14 years of service to Hartselle City Schools, board member Randy Sparkman has announced he will not seek reelection. Sparkman called his time on the board one of the honors of his life and expressed gratitude to the Hartselle community for the opportunity to serve. “Together, we modernized campuses, fought to prioritize academic achievement, supported early childhood education and built a solid financial foundation,” he said. “Most importantly, we...",,https://www.hartselleenquirer.com/hartselleenquirer/news/wp-content/uploads/sites/3/2025/06/Sparkman.png,,,2025-06-24 20:05:59.595402
,California,2025-06-24 21:28:38+00:00,the Guardian,Quebec provides universal childcare for less than $7 a day. Here’s what the US can learn,,,,,,https://www.theguardian.com/us-news/2025/jun/24/quebec-universal-childcare-us-learn,"Public childcare network is a win for everyone – kids, parents and the government, and the Quebec model is a shining example",,https://i.guim.co.uk/img/media/5f9a06ce3228b53509f145f330be73cc03035aaf/0_0_3000_2400/master/3000.jpg?width=1200&height=630&quality=85&auto=format&fit=crop&overlay-align=bottom%2Cleft&overlay-width=100p&overlay-base64=L2ltZy9zdGF0aWMvb3ZlcmxheXMvdGctZGVmYXVsdC5wbmc&enable=upscale&s=2ed28da2d3d4dc8fa3aa9e206a1a76c8,,,2025-06-24 19:08:31.389492
,California,2025-06-24 21:08:21+00:00,San Diego Union-Tribune,Head Start enrolling children for childcare services amid talk of federal budget cuts,,,,,,https://www.sandiegouniontribune.com/2025/06/24/head-start-enrolling-children-for-childcare-services-amid-talk-of-federal-budget-cuts/,Funding for early childhood education continues for now in Ramona and Poway.,,https://www.sandiegouniontribune.com/wp-content/uploads/2025/06/RAS-L-HEADSTART-01.jpg?w=1024&h=964,,,2025-06-24 18:10:39.506205
,California,2025-06-24 20:41:17+00:00,6abc Philadelphia,"Phila. Fed. of Teachers President, School District Superintendent head to Harrisburg for funding",,,,,,https://6abc.com/post/philadelphia-federation-techers-president-school-district-superintendent-team-head-harrisburg-funding/16837660/,"School's out, but this week's lesson plan is fair funding.",,https://cdn.abcotvs.com/dip/images/16838477_062425-wpvi-christie-philly-school-funding-harrisburg-4pm-vid.jpg?w=1600,,,2025-06-24 20:05:59.595402
,California,2025-06-24 20:41:10+00:00,www.nationalreview.com,Trump Admin Tells California to Remove Gender Ideology from Sex Education Program,,,,,,https://www.nationalreview.com/news/trump-admin-tells-california-to-remove-gender-ideology-from-sex-education-program/,... funding. The Administration for Children and Families (ACF) at the Department of Health and Human Services sent a letter to California requiring ...,,,,,2025-06-24 18:10:39.506205
,California,2025-06-24 20:35:30+00:00,Willamette Week,Eleventh-Hour Amendment to Senate Bill Seeks to End Preschool for All Tax,,,,,,https://www.wweek.com/news/schools/2025/06/23/eleventh-hour-amendment-to-senate-bill-seeks-to-end-preschool-for-all-tax/,An amendment posted late Monday night to an Oregon Senate bill seeks to end Multnomah County’s Preschool for All program.,,https://www.wweek.com/resizer/v2/PXZJH4GCIBD5VPDQNLXHE2UBWI.jpg?smart=true&auth=107aaad0fd7228757bc566d86655fa0f9488b161608c98f0430bd1879fd94269&width=1200&height=630,,,2025-06-24 18:10:39.506205
,California,2025-06-24 20:26:02+00:00,www.mass.gov,AG Campbell Joins Multistate Lawsuit Challenging Trump Administration's Illegal Attempts ...,,,,,,https://www.mass.gov/news/ag-campbell-joins-multistate-lawsuit-challenging-trump-administrations-illegal-attempts-to-terminate-critical-federal-funding-for-states,"Early Childhood Education & Care · Elementary & Secondary Schools · Higher ... In Massachusetts, the Trump Administration's terminations have already ...",,,,,2025-06-24 18:10:39.506205
,California,2025-06-24 19:59:56+00:00,www.sacbee.com,"Sacramento-area school inappropriately collected $180M state funds, audit says",,,,,,https://www.sacbee.com/news/local/article309272730.html,"... funding while failing to “meet the legal ... However, the Twin Rivers School District, SCOE and the California Department of Education ...",,,,,2025-06-24 18:10:39.506205
,California,2025-06-24 19:14:18+00:00,Los Angeles Times,1.2 million fake students applied to California community colleges last year. What's being done?,,,,,,https://www.latimes.com/california/story/2025-06-24/community-colleges-financial-aid-fraud,Scammers stole more than $10 million in financial aid last year by fraudulently enrolling in California's community colleges. State and federal officials are working to combat the rising fraud.,,https://ca-times.brightspotcdn.com/dims4/default/e8039eb/2147483647/strip/true/crop/4000x2100+0+237/resize/1200x630!/quality/75/?url=https%3A%2F%2Fcalifornia-times-brightspot.s3.amazonaws.com%2F5d%2Fff%2Fb4168d5d4d159be43118ddab76d0%2Fla-photos-1staff-636109-la-me-california-community-colleges-gift-4-als.jpg,,,2025-06-24 16:14:59.300066
,California,2025-06-24 18:59:58+00:00,Education Week,What We Know About How ICE Raids Disrupt Student Learning,,,,,,https://www.edweek.org/leadership/what-we-know-about-how-ice-raids-disrupt-student-learning/2025/06,Past and present research studies found broad implications of immigration enforcement on students' school attendance.,,https://epe.brightspotcdn.com/dims4/default/3b9c82e/2147483647/strip/true/crop/5790x3860+0+0/resize/945x630!/quality/90/?url=https%3A%2F%2Fepe-brightspot.s3.us-east-1.amazonaws.com%2Fee%2F1a%2F9a054e7d450db03ae5fd2a473ea7%2Fdc-immigration-a-rumor-spreads-25127829039202.jpg,,,2025-06-24 20:05:59.595402
,California,2025-06-24 18:37:44+00:00,ABC7 Los Angeles,Crews break ground on $240 million campus revamp of Inglewood High School,,,,,,https://abc7.com/post/crews-break-ground-inglewood-high-school-campus-revamp/16837651/,"Inglewood High School has been standing for more than 100 years, and on Tuesday crews broke ground on the campus to give it a major facelift.",,https://cdn.abcotvs.com/dip/images/16835893_062425-kabc-6am-inglewood-hs-groundbreaking-vid.jpg?w=1600,,,2025-06-24 17:10:25.283233
,California,2025-06-24 18:21:17+00:00,www.kgw.com,Lawmaker pushes to curb Oregon kicker payouts for school funding | kgw.com,,,,,,https://www.kgw.com/article/news/politics/oregon-legislature-laws-kicker-return-public-funding-schools/283-ccc75062-c774-4599-bee3-9b740aeedfa5,"The bill would reallocate kicker money toward things like public education. ... PORTLAND, Ore. — As the legislative session winds down, some lawmakers ...",,,,,2025-06-24 15:15:08.664529
,California,2025-06-24 18:02:48+00:00,www.bloomberg.com,California's Sky-High Housing Market Seeds Muni Bond Default - Bloomberg,,,,,,https://www.bloomberg.com/news/articles/2025-06-24/california-s-sky-high-housing-market-seeds-muni-bond-default,"... years. With funding dependent on how many pupils attend, the school's finances were pressured. Officials blamed the area's high home prices for ...",,,,,2025-06-24 16:14:59.300066
,California,2025-06-24 17:46:57+00:00,Stu News Laguna,Three Thurston Intermediate School girls 062425,,,,,,https://stunewslaguna.com/three-thurston-intermediate-school-girls-062425/,"Three Thurston Intermediate School girls win Tech Trek Scholarships The American Association of University Women (AAUW) of Laguna Beach awards Tech Trek scholarships to girls between grades 7 and 8 to attend a week-long experience of living on a college campus. In late June, they will be on the University of San Diego campus and participate daily in hands-on science, technology, engineering and math (STEM) activities, such as learning CSI-type forensics, building models and taking a field trip to see advanced fusion energy activities at the DIII-D National Fusion Facility. One popular interactive session features women in professional fields of science sharing",,https://stunewslaguna.com/wp-content/uploads/2025/06/Three-Thurston-1.jpg,,,2025-06-24 17:10:25.283233
,California,2025-06-24 17:19:36+00:00,www.dir.ca.gov,California awards over $15 million to align disconnected youth with apprenticeships in high ...,,,,,,https://www.dir.ca.gov/DIRNews/2025/2025-57.html,About 40% of the programs awarded COYA funding are part of the care industry. This includes sectors such as healthcare and education—areas which ...,,,,,2025-06-24 15:15:08.664529
,California,2025-06-24 17:19:18+00:00,KWKT - FOX 44,Fostering Growth and Confidence: Veteran-Owned Celebree School Debuts in East Louisville,,,,,,https://www.fox44news.com/business/press-releases/cision/20250624CL17453/fostering-growth-and-confidence-veteran-owned-celebree-school-debuts-in-east-louisville,"Early Childhood Education Franchise Opens in East Louisville, Brings Well-Rounded Program to the Community
EAST LOUISVILLE, Ky., June 24, 2025 /PRNewswire/ -- Celebree School, a leader in early childhood education that provides infant and toddler care, preschool, before and aftercare, and summer camp programs, opened its newest school on June 23. Located at 13307 Magisterial Dr., the new school will provide a customized program that addresses the physical, social, emotional, and academic needs of children while adhering to Kentucky's early education standards.",,https://mma.prnewswire.com/media/2718027/Celebree_Logo_Horizontal_Logo_v2.jpg?p=publish,,,2025-06-24 13:51:06.792986
,California,2025-06-24 17:15:05+00:00,Governor of California,California awards over $15 million to apprenticeship programs connecting youth to high-paying jobs | Governor of California,,,,,,https://www.gov.ca.gov/2025/06/24/california-awards-over-15-million-to-apprenticeship-programs-connecting-youth-to-high-paying-jobs/,What you need to know: California is providing $15 million in new apprenticeship funding for youth for new high-paying opportunities that do not ...,,https://www.gov.ca.gov/wp-content/uploads/2025/06/Apprenticeship-Programs.jpg,,,2025-06-24 13:51:06.792986
,California,2025-06-24 17:13:09+00:00,www.abc10.com,New 5th grade health curriculum sparks debate in Modesto - ABC10,,,,,,https://www.abc10.com/article/news/local/health-curriculum-sparks-debate-modesto/103-f85eae8c-6d9c-41b6-a346-3a4e48dab5c0,"... early education is allowed if it's age-appropriate, medically accurate and inclusive. The district confirmed lessons will begin in the upcoming school ...",,,,,2025-06-24 18:10:39.506205
,California,2025-06-24 17:05:55+00:00,Springfield News-Leader,Missouri school funding task force confronts district property tax disparities,,,,,,https://www.news-leader.com/story/news/education/2025/06/24/missouri-school-funding-task-force-considers-property-tax-inequities/84333719007/,"The formula that calculates state money for Missouri public schools relies on outdated assumptions about local funding, education officials say.",,"https://www.news-leader.com/gcdn/authoring/authoring-images/2025/06/24/PSPR/84333797007-img-16212048-x-1536.jpg?crop=2047,1152,x0,y307&width=2047&height=1152&format=pjpg&auto=webp",,,2025-06-24 13:51:06.792986
,California,2025-06-24 16:15:36+00:00,The Baltimore Banner,NASA planes will fly over Baltimore today,,,,,,https://www.thebaltimorebanner.com/community/local-news/low-flying-plane-baltimore-nasa-WAQQCNWCRJG5ZGUP3HQXASBIJM/,"From 1-4 p.m. on Tuesday, NASA planes will be flying low over Baltimore to conduct atmospheric research, according to Rob Garner, a spokesperson for NASA‚Äôs Goddard Space Flight Center.",,https://www.thebaltimorebanner.com/resizer/v2/6GHXPGUNX5CJFODIJ24VB6Y3OA.jpg?auth=6d16abea0ea556f281061383d19f16123043d100fe74a08b2e15c712e3d844cd&width=900&smart=true&quality=85,,,2025-06-24 16:14:59.300066
,California,2025-06-24 15:59:51+00:00,UC Davis,Big Bang! Business Competition Celebrates 25 Years of Empowering Entrepreneurs,,,,,,https://www.ucdavis.edu/curiosity/news/big-bang-competition-celebrates-25-years,"Benjamin Wang ’06, a medical doctor, brought his life-saving innovation to the UC Davis Big Bang! Business Competition in 2014. His team won first place — and Wang credited the experience with helping him launch the venture.After witnessing a patient die from an antibiotic-resistant infection, he developed NEVAP — a breathing tube designed to prevent bacterial infections in ventilated patients.""Winning the competition helped to validate the idea that creating a better breathing tube was possible and viable as a business,"" Wang said.",,https://www.ucdavis.edu/sites/default/files/styles/sf_landscape_16x9/public/media/images/Cereal-UC-Davis.jpg?h=854a7be2&itok=98xEiXj9,,,2025-06-24 13:12:00.849364
,California,2025-06-24 15:58:25+00:00,Good Morning America,California becomes 1st state to offer free meals at school for kids,,,,,,https://www.goodmorningamerica.com/food/story/california-becomes-1st-state-to-offer-free-meals-at-school-for-kids-88290584,"California will be the first state to implement the Universal Meals Program, providing free meals to all schoolchildren, starting this upcoming school year.

",,https://s.abcnews.com/images/US/school-lunch-gty-rc-211018_1634582910697_hpMain_2_16x9_992.jpg?w=992,,,2025-06-24 13:51:06.792986
,California,2025-06-24 15:45:35+00:00,The Indianapolis Star,Gov. Braun announces in-state tuition freeze for Indiana's public colleges and universities,,,,,,https://www.indystar.com/story/news/education/2025/06/24/no-in-state-tuition-fee-increases-at-indiana-colleges-for-next-two-years-purdue-iu-ball-state-braun/84329972007/,"""Out of all state entities, our higher education institutions are in the best financial position to weather these cuts,"" Braun said.",,"https://www.indystar.com/gcdn/authoring/authoring-images/2025/05/14/NSBT/83632317007-indiana-university-south-bend-commencement-17.jpg?crop=5669,3189,x0,y296&width=3200&height=1801&format=pjpg&auto=webp",,,2025-06-24 15:15:08.664529
,California,2025-06-24 15:10:47+00:00,KFI AM 640,Trump Orders California to Remove Gender Identity from Sex Ed | KFI AM 640,,,,,,https://kfiam640.iheart.com/content/2025-06-24-trump-orders-california-to-remove-gender-identity-from-sex-ed/,The Trump administration has ordered California remove gender identity from sex ed lessons within 60 days or lose $12.3 million in federal grants. ,,"https://i.iheart.com/v3/re/assets.getty/62bb695c474600e9b0accf42?ops=gravity(%22north%22),fit(1200,675),quality(65)",,,2025-06-24 13:12:00.849364
,California,2025-06-24 15:09:08+00:00,Chalkbeat,AI-powered literacy screener Amira coming to Newark Public Schools this fall,,,,,,https://www.chalkbeat.org/newark/2025/06/24/ai-literacy-screener-amira-learning-adopted-per-state-plan-coming-this-fall/,Newark Public Schools will use a new AI tool to help identify students who may be struggling to read as part of the state’s new literacy plan aimed at boosting early reading skills.,,https://www.chalkbeat.org/resizer/v2/7XFFIAYJTJB23ADQ3UBTQXQ72Q.JPG?smart=true&auth=3c81aae947eba626937e985c34f40e88cb2d74325fd9b21321efe21c3117481e&width=1200&height=630,,,2025-06-24 13:51:06.792986
,California,2025-06-24 15:01:52+00:00,Salish Current,"Five counselors for 2,600 students in Anacortes schools",,,,,,https://salish-current.org/2025/06/24/five-counselors-for-2600-students-in-anacortes-schools/,School board says reductions are necessary to balance the budget. Students and teachers say the cuts will create ‘a safety concern.’ ,,http://salish-current.org/wp-content/uploads/2025/06/Renae-Newell-900x900-1.jpg,,,2025-06-24 12:13:42.856768
,California,2025-06-24 14:41:40+00:00,Committee on Education &amp; the Workforce,Kiley Holds Hearing on Child Care and the American Workforce,,,,,,https://edworkforce.house.gov/news/documentsingle.aspx%3FDocumentID%3D412578,"Today, Early Childhood, Elementary, and Secondary Education ... All told, pandemic-era legislation increased regular child care block grant funding by ...",,https://edworkforce.house.gov/images/facebook-meta-119.jpg,,,2025-06-24 12:13:42.856768
,California,2025-06-24 14:39:29+00:00,www.businesswire.com,Pangram Closes $4 Million in Seed Funding for AI Detection Technology - Business Wire,,,,,,https://www.businesswire.com/news/home/20250623805035/en/Pangram-Closes-%25244-Million-in-Seed-Funding-for-AI-Detection-Technology,"“Identifying AI text with confidence is increasingly essential across education, business, and the media, and we have the best technology to do that,” ...",,,,,2025-06-24 15:15:08.664529
,California,2025-06-24 14:31:28+00:00,Catholic News Agency,German archdiocese faces backlash over sexuality education framework,,,,,,https://www.catholicnewsagency.com/news/264957/german-diocese-faces-backlash-over-sexuality-education-framework,The document is scheduled for implementation across all 15 Catholic school locations in Hamburg beginning with the 2026-2027 school year.,,https://www.catholicnewsagency.com/images/stmarycathedralhamburggermany062425.jpg?jpg,,,2025-06-24 13:12:00.849364
,California,2025-06-24 13:52:12+00:00,Magnolia Tribune,"IHL approves Mississippi Early Childhood Inclusion Center, new degree paths",,,,,,https://magnoliatribune.com/2025/06/24/ihl-approves-mississippi-early-childhood-inclusion-center-new-degree-paths/,"New degree paths were added at Southern Miss, Mississippi State and Delta State.",,https://magnoliatribune.com/wp-content/uploads/2025/06/Screenshot-2025-06-06-141104.png,,,2025-06-24 13:12:00.849364
,California,2025-06-24 13:37:37+00:00,EdTrust,Math as Play: Cultivating a Nation of Math People,,,,,,https://edtrust.org/blog/math-as-play-cultivating-a-nation-of-math-people/,"Math can involve numbers, but mathematics is so much more than digits strung together by symbols",,https://edtrust.org/wp-content/uploads/2025/05/jeswin-thomas-hecib2an4T4-unsplash.jpg,,,2025-06-24 11:22:08.488670
,California,2025-06-24 13:15:06+00:00,San Francisco Examiner,Asian American history education rare  — even in SF,,,,,,https://www.sfexaminer.com/news/education/why-asian-american-history-education-rare-in-sf-beyond/article_735ce7d5-3a1d-43ff-8989-42d85e058b77.html,Local K-12 schools largely don’t include in curriculum.,,https://bloximages.chicago2.vip.townnews.com/sfexaminer.com/content/tncms/assets/v3/editorial/9/64/96416d84-36ef-4c32-80a1-5ac8b62fcd25/67e71def90bb6.image.jpg?crop=1763%2C926%2C0%2C124&resize=1200%2C630&order=crop%2Cresize,,,2025-06-24 10:03:33.704474
,California,2025-06-24 13:01:15+00:00,Los Angeles Times,Trump administration orders California to remove gender identity from sex education lessons,,,,,,https://www.latimes.com/california/story/2025-06-24/trump-administration-orders-california-to-remove-gender-identity-from-sex-ed-materials,Trump administration gives California 60 days to remove references to gender identity in federally funded program promoting abstinence and contraception.,,https://ca-times.brightspotcdn.com/dims4/default/bd0a666/2147483647/strip/true/crop/7879x4136+0+559/resize/1200x630!/quality/75/?url=https%3A%2F%2Fcalifornia-times-brightspot.s3.amazonaws.com%2F43%2F7d%2Fc665474045e8a3a5de03092bb037%2F1424056-me-parental-notification-ballot-measure-sr-0021.jpg,,,2025-06-24 10:03:33.704474
,California,2025-06-24 12:57:20+00:00,nj,Beloved N.J. environmental school will shut down if ‘tragic’ budget cut is approved,,,,,,https://www.nj.com/education/2025/06/beloved-nj-environmental-school-will-shut-down-if-tragic-budget-cut-is-approved.html,"Teachers say kids from across New Jersey learn with ""muddy boots"" at the historic school, which is facing a devastating $3 million budget cut.",,https://www.nj.com/resizer/v2/OFQ2GXZ3INGY5MZLDOAEE43FUM.JPG?auth=088885430d24d25c7ed41058d6248ec6b19c1b8af13ec2622247df8b014167af&width=1280&quality=90,,,2025-06-24 11:22:08.488670
,California,2025-06-24 12:43:28+00:00,www.cbsnews.com,Philadelphia education officials to head to Harrisburg to fight for funding,,,,,,https://www.cbsnews.com/philadelphia/video/philadelphia-education-officials-to-head-to-harrisburg-to-fight-for-funding/,"Tony Watlington, the superintendent of Philadelphia schools, and Arthur Steinberg, the president of the Philadelphia Federation of Teachers, will both go to Harrisburg to fight for funding for almost 200,000 students.",,https://assets3.cbsnewsstatic.com/hub/i/r/2025/06/24/0918adbb-23b5-4ddd-9ce9-962c3e5bf48d/thumbnail/1200x630/a9261d1b98dbbe2c03f467e3c3d77967/24d33325b045f079bd6171c6539afe6e.jpg?v=64f55bb7ef9382fe7916b907da543f1f,,,2025-06-24 10:03:33.704474
,California,2025-06-24 12:13:50+00:00,LAist,These community college grads are headed to universities. A basic income program helped make it happen,,,,,,https://laist.com/news/education/boost-los-angeles-community-college-district-guaranteed-basic-income-graduation,"Most community college students aspire to earn a bachelor’s degree, but few manage to transfer.",,https://scpr.brightspotcdn.com/dims4/default/516fbba/2147483647/strip/true/crop/4032x2117+0+454/resize/1200x630!/quality/90/?url=http%3A%2F%2Fscpr-brightspot.s3.us-west-2.amazonaws.com%2Fb0%2F58%2Fda5e8cc34bce88ecccd85ccd159f%2Fimg-5926.jpg,,,2025-06-24 13:12:00.849364
,California,2025-06-24 11:50:49+00:00,www.washingtonpost.com,A former NBA player-turned-basketball GM for a … high school? - The Washington Post,,,,,,https://www.washingtonpost.com/sports/2025/06/24/lawrence-moten-gm/,Moten's degree from Syracuse is in early-childhood education. Before ... California powerhouse St. John Bosco signed in 2022. Moten said ...,,,,,2025-06-24 11:22:08.488670
,California,2025-06-24 11:42:06+00:00,www.mysanantonio.com,Elon Musk's Ad Astra school in Texas is now taking student applications - MySA,,,,,,https://www.mysanantonio.com/business/article/elon-musk-ad-astra-school-bastrop-texas-20351410.php,... early test Wednesday as a longtime ally ... The pair began the school in California to educate their kids and the children of SpaceX employees.,,,,,2025-06-24 13:12:00.849364
,California,2025-06-24 10:52:53+00:00,onlinelibrary.wiley.com,"STEM Education With a Focus on Equity and Justice: Traditional Approaches, Contemporary ...",,,,,,https://onlinelibrary.wiley.com/doi/10.1002/tea.70013%3Faf%3DR,"Since the early 2010s, contemporary approaches in science and engineering education ... In more recent years, while STEM education as a school ...",,,,,2025-06-24 10:03:33.704474
,California,2025-06-24 10:52:45+00:00,spectrumnews1.com,Kentucky schools struggle to keep up as funding lags behind inflation,,,,,,https://spectrumnews1.com/ky/louisville/news/2025/06/23/education-funding-report,The Council for Better Education finds the downward trend has been happening since 2008. It says the shortfalls affect every aspect of education.,,https://s7d2.scene7.com/is/image/TWCNews/chalkboard_math_istock-944038668croppedjpg,,,2025-06-24 11:22:08.488670
,California,2025-06-24 10:34:17+00:00,www.the74million.org,Some States Suspend Students With the Same Disabilities Far More Frequently,,,,,,https://www.the74million.org/article/for-students-with-disabilities-suspension-is-not-just-a-matter-of-race-and-gender-but-geography/,Exclusive analysis by The 74 of 2022-23 IDEA data reveals stark disparities among students already subject to disproportionate punishment in school.,,https://www.the74million.org/wp-content/uploads/2025/06/school-suspensions-usa-disabled-students_IDEA-1-825x495.jpg?cb=1016869,,,2025-06-24 10:03:33.704474
