id,name,published,outlet,title,authors,category,market,categoryorder,articleorder,url,description,text,image,error,sentiment,firstEyes
,,2025-06-30 20:25:29+00:00,Yahoo Entertainment,NPR's Felix Contreras opened minds to Latin alternative music. He's finally getting his due,,,,,,https://www.yahoo.com/entertainment/articles/nprs-felix-contreras-opened-minds-185421307.html,"Known as ""Tío Felix"" among friends and colleagues, Contreras will be honored at the Hispanic Heritage Awards in September.",,https://media.zenfs.com/en/la_times_articles_853/7de3bb49fa323476978a624b6ab52c8c,,,2025-06-30 17:12:35.449597
,,2025-06-30 19:47:26+00:00,Premium Times Nigeria,"The Club World Cup: Becoming more competitive and entertaining than expected, By Yusuf Bangura",,,,,,https://www.premiumtimesng.com/opinion/804156-the-club-world-cup-becoming-more-competitive-and-entertaining-than-expected-by-yusuf-bangura.html,The lopsided African representation in the Club World Cup is very different from what usually obtains in country-based World Cup tournaments.,,https://media.premiumtimesng.com/wp-content/files/2025/03/Dr.-Yusuf-Bangura.jpg,,,2025-06-30 16:11:12.860166
,,2025-06-30 18:56:30+00:00,Los Angeles Times,NPR's Felix Contreras opened minds to Latin alternative music. He's finally getting his due,,,,,,https://www.latimes.com/delos/story/2025-06-30/npr-felix-contreras-journalism-hispanic-heritage-awards-2025,"Known as ""Tío Felix"" among friends and colleagues, Contreras will be honored at the Hispanic Heritage Awards in September.",,https://ca-times.brightspotcdn.com/dims4/default/48583a2/2147483647/strip/true/crop/5504x2890+0+1866/resize/1200x630!/quality/75/?url=https%3A%2F%2Fcalifornia-times-brightspot.s3.amazonaws.com%2Fe5%2F5b%2F704af5484900a5ef09095abc91b7%2Fla-de-los-felix-contreras.jpg,,,2025-06-30 15:01:20.611085
,,2025-06-30 15:42:18+00:00,Daily Herald,Mount Prospect Village Fair to feature Latin music showcase,,,,,,https://www.dailyherald.com/20250630/submitted-content/mount-prospect-village-fair-to-feature-latin-music-showcase/,"A Latin music showcase will add flair to the Mount Prospect Lions Club’s 86th annual Village Fair, which takes place Wednesday, July 2 through Sunday, July 6, at Melas Park on Central Road, just eas...",,https://imengine.public.prod.pdh.navigacloud.com/?uuid=9B58FF3C-302F-4D80-B2BC-3710BAD7859B&function=fit&type=preview,,,2025-06-30 12:15:42.263019
,,2025-06-30 15:06:48+00:00,The Indian Express,"‘I’m Latin, so we love entertaining with a lot of food and friends’: Inside the LA home of Sofia Vergara, Modern Family’s much-loved Gloria",,,,,,https://indianexpress.com/article/lifestyle/art-and-culture/im-latin-we-love-entertaining-with-food-friends-inside-modern-family-gloria-sofia-vergara-la-home-9968388/,"It wasn’t love at first sight for the house itself. When Sofia first saw the property, it resembled ""a castle in Transylvania,"" she quips.",,https://images.indianexpress.com/2025/04/sofia-vergara.jpg,,,2025-06-30 12:15:42.263019
,,2025-06-30 14:59:03+00:00,www.prnewswire.com,Send money from the U.S. to Latin America from less than $1 with MyBambu,,,,,,https://www.prnewswire.com/news-releases/send-money-from-the-u-s-to-latin-america-from-less-than-1-with-mybambu-875506040.html,"/PRNewswire-HISPANIC PR WIRE/ -- MyBambu, an innovative financial app, makes international money transfers to more than 17 Latin American countries easy and...",,,,,2025-06-30 12:15:42.263019
,,2025-06-30 14:21:26+00:00,MercoPress,The future of e-commerce is Latin America,,,,,,https://en.mercopress.com/2025/06/30/the-future-of-e-commerce-is-latin-america,"In the last few years and especially during COVID-19 pandemic, Latin America has quietly but rapidly become one of the most promising regions for digital industries and e-commerces. The reasons why lie in the growing digital access and mobile adoption, but also in the interest many companies have shown in investing in this area.",,https://en.mercopress.com/data/cache/noticias/105639/600x315/41687.jpg,,,2025-06-30 12:15:42.263019
,,2025-06-30 14:01:50+00:00,Latin Times,Karol G and Airbnb Launch the Ultimate Medellín and 'Tropicoqueta' Experience and Only 24 Fans Will Get In - EXCLUSIVE,,,,,,https://www.latintimes.com/karol-g-airbnb-launch-ultimate-medellin-tropicoqueta-experience-only-24-fans-will-get-585829,The home-rental platform Airbnb partnered with Karol G to launch one of its most significant and high-profile experiences to date in Latin America.,,https://d.latintimes.com/en/full/580160/karol-g-airbnb-experience-tropicoqueta.jpg,,,2025-06-30 12:15:42.263019
,,2025-06-30 13:32:05+00:00,www.gamesbras.com,TVBET: Insights on iGaming Growth in Latin America - ﻿Games Magazine Brasil,,,,,,https://www.gamesbras.com/english-version/2025/6/30/tvbet-insights-on-igaming-growth-in-latin-america-56180.html,"In an exclusive interview with Francisco Bravo, LATAM Sales Director at TVBET, Timeless Tech dives deep into the exciting developments in the Latin American iGaming market. The executive shares his views on the region’s preferences, regulatory challenges, and the growing interest in live casino content.",,https://www.gamesbras.com/u/fotografias/m/2025/6/30/f960x0-44205_44223_0.jpg,,,2025-06-30 12:15:42.263019
,,2025-06-30 12:19:14+00:00,FF News | Fintech Finance,FINNOSUMMIT 2025 Unveils First Speakers for Latin America’s Pioneering and Most Influential Fintech Event in Mexico City,,,,,,https://ffnews.com/02-events/finnosummit-2025-unveils-first-speakers-for-latin-americas-pioneering-and-most-influential-fintech-event-in-mexico-city/,"FINNOSUMMIT announces its first confirmed speakers for its ninth edition, taking place on September 24 & 25 in Mexico City.",,https://ffnews.com/wp-content/uploads/2025/06/merged_image_341723.jpg,,,2025-06-30 09:05:53.809136
,,2025-06-30 06:37:54+00:00,The Korea Herald,"Hybe to open Indian office this year, testing K-pop playbook from America to Asia",,,,,,https://m.koreaherald.com/article/10520988,"Hybe, the K-pop powerhouse behind BTS, Seventeen and Enhypen, is preparing to launch a new overseas branch in India between September and October, according to",,https://wimg.heraldcorp.com/news/cms/2025/06/30/news-p.v1.20250630.9fe595871e68454d8bddb21dd95151c2_T1.jpg,,,2025-06-30 09:05:53.809136
,,2025-06-29 23:36:26+00:00,CHOSUNBIZ,HYBE expands global presence with Indian subsidiary and multi-genre strategy,,,,,,https://biz.chosun.com/en/en-entertainment/2025/06/30/KQ3ZWCCMLFARPM4HSYHP2CMV7Q/,HYBE expands global presence with Indian subsidiary and multi-genre strategy,,https://biz.chosun.com/resizer/v2/UHO42S2KGDVTVHRVH2ACICKFUU.jpg?auth=8722550aa8b1533545fdf5ed4142a0fd3bfefc0e2ddef64126ef23b9c2bfe758&width=650&height=341&smart=true,,,2025-06-30 10:11:41.145927
,,2025-06-29 23:07:48+00:00,www.pressreader.com,"Festivals, fireworks and more: 15 fun things to do in Peoria in July - PressReader",,,,,,https://www.pressreader.com/usa/journal-star-peoria/20250630/281513642145553,"Fiesta en el Rio, a music festival that celebrates Hispanic and Latino culture, will be held Saturday, July 26, at CEFCU Center Stage on the Peoria ...",,,,,2025-06-30 17:12:35.449597
,,2025-06-29 21:38:29+00:00,KVNF Community Radio,Inside the U.S. plan to detain immigrants in Latin America as bargaining chips in WWII,,,,,,https://www.kvnf.org/2025-06-29/inside-the-u-s-plan-to-detain-immigrants-in-latin-america-as-bargaining-chips-in-wwii,"During World War II, the United States arrested hundreds of Japanese, German and Italian immigrants and deported them to America where they lived in camps.",,,,,2025-06-30 09:05:53.809136
