id,name,published,outlet,title,authors,category,market,categoryorder,articleorder,url,description,text,image,error,sentiment,firstEyes
,,2025-07-25 11:39:06+00:00,West Plains Daily Quill,Top photos from Latin America and the Caribbean - West Plains Daily Quill,,,,,,"https://www.westplainsdailyquill.net/stories/top-photos-from-latin-america-and-the-caribbean,191271","July 18-24, 2025  A worker pounded into rock to make gravel and sand in Port-au-Prince, Haiti. Brazilian former President Jair Bolsonaro showed off an ankle monitor the Supreme Court ordered him  &hellip;",,https://mapi.associatedpress.com/v2/items/7eff637cbcb44bedab929515ac4cbc7f.1/preview/preview.jpg?nfe=true&s=512&wm=false&app=MPK&tag=iid~7eff637cbcb44bedab929515ac4cbc7f!rsn~1!cid~82e53f628f0c40fd96fcc37197d8d318!orgId~46245!qt~Vs_5FucDSeI!orgNm~WEST%20PLAINS%20DAILY%20QUILL!role~Preview!mt~photo!fmt~JPEG%20Baseline,,,2025-07-25 09:57:43.733556
,,2025-07-25 09:58:18+00:00,Toronto Star,Top photos from Latin America and the Caribbean,,,,,,https://www.thestar.com/news/world/americas/top-photos-from-latin-america-and-the-caribbean/article_c4426753-33d7-5da6-b709-90e5d4578959.html,"July 18-24, 2025",,https://bloximages.chicago2.vip.townnews.com/thestar.com/content/tncms/assets/v3/editorial/f/cc/fccf3a96-a531-50c0-a87a-7c1f27fa2705/6883152cd8d53.image.jpg?crop=1620%2C851%2C0%2C114&resize=1200%2C630&order=crop%2Cresize,,,2025-07-25 06:56:25.385296
,,2025-07-25 09:12:01+00:00,Tallahassee Democrat,Thomasville Entertainment kicks off sales for 88th performance season,,,,,,https://www.tallahassee.com/story/entertainment/things-to-do/2025/07/25/thomasville-entertainment-kicks-off-ticket-sales-for-88th-season/85340492007/,Opening the season on October 21 will be a classical recital by two award-winning young performers.,,"https://www.tallahassee.com/gcdn/authoring/authoring-images/2025/07/23/PTAL/85340555007-orpheus-chamber.jpg?crop=3499,1968,x0,y182&width=3200&height=1800&format=pjpg&auto=webp",,,2025-07-25 09:57:43.733556
,,2025-07-25 07:32:08+00:00,The Vermont Journal & The Shopper,Mambo Jazz Party at Bandwagon Summer Series - The Vermont Journal & The Shopper,,,,,,https://vermontjournal.com/arts-entertainment/mambo-jazz-party-at-bandwagon-summer-series/,The Bandwagon Summer Series continues its 2025 season with a fiery celebration of Latin jazz with Jonathan Powell’s Mambo Jazz Party...,,https://vermontjournal.com/wp-content/uploads/2025/07/Jonathan-Powell.-Photo-provided-scaled.jpg,,,2025-07-25 06:56:25.385296
,,2025-07-25 06:33:21+00:00,thecanadianpressnews.ca,Top photos from Latin America and the Caribbean,,,,,,https://www.thecanadianpressnews.ca/world/top-photos-from-latin-america-and-the-caribbean/article_45de76d7-c7a3-588d-a547-3fdd68b45a6e.html,"July 18-24, 2025",,https://bloximages.chicago2.vip.townnews.com/thecanadianpressnews.ca/content/tncms/assets/v3/editorial/1/49/1495a809-cd21-58f1-a1c7-a1cdfce284e8/68831df1b0a84.image.jpg?crop=1400%2C735%2C0%2C99&resize=1200%2C630&order=crop%2Cresize,,,2025-07-25 06:56:25.385296
,,2025-07-25 06:25:48+00:00,ABC4 Utah,"COP 30 CEO, Ana Toni, to deliver keynote address at Fastmarkets Latin America Carbon Forum",,,,,,https://www.abc4.com/business/press-releases/cision/20250724NE37000/cop-30-ceo-ana-toni-to-deliver-keynote-address-at-fastmarkets-latin-america-carbon-forum,"LONDON, July 24, 2025 /PRNewswire/ -- Fastmarkets, a global leader in providing independent, transparent pricing and economic insights across key commodity sectors, is excited to announce that Ana Toni, CEO of COP 30, will deliver the keynote address at the Latin America Carbon Forum this August in São Paulo.

    
                
                        
                    
                        
                

    
Fastmarkets' Latin America Carbon Forum emphasizes the importance of actionable dialogue and strategic investment in climate initiatives. By featuring Ana Toni's keynote and convening policymakers, market experts and thought leaders, the event aims to foster regional collaboration and drive significant global action ahead of COP 30, the UN climate summit where world leaders will set in motion the next phase of global action to tackle climate change.",,https://mma.prnewswire.com/media/749593/Fastmarkets_Logo.jpg?p=publish,,,2025-07-25 06:56:25.385296
,,2025-07-25 05:57:23+00:00,The Morning Sun,Top photos from Latin America and the Caribbean - The Morning Sun,,,,,,"http://www.morningsun.net/stories/top-photos-from-latin-america-and-the-caribbean,226528","July 18-24, 2025  A worker pounded into rock to make gravel and sand in Port-au-Prince, Haiti. Brazilian former President Jair Bolsonaro showed off an ankle monitor the Supreme Court ordered him  &hellip;",,https://mapi.associatedpress.com/v2/items/7eff637cbcb44bedab929515ac4cbc7f.1/preview/preview.jpg?nfe=true&s=512&wm=false&app=MPK&tag=iid~7eff637cbcb44bedab929515ac4cbc7f!rsn~1!cid~82e53f628f0c40fd96fcc37197d8d318!orgId~46179!qt~_fNHWLKeheI!orgNm~THE%20MORNING%20SUN%20!role~Preview!mt~photo!fmt~JPEG%20Baseline,,,2025-07-25 06:56:25.385296
,,2025-07-25 05:29:50+00:00,The Bakersfield Californian,Top photos from Latin America and the Caribbean,,,,,,https://www.bakersfield.com/ap/national/top-photos-from-latin-america-and-the-caribbean/article_7ed10d47-86f1-5581-ad9d-4d607705d7cc.amp.html,"July 18-24, 2025",,https://bloximages.newyork1.vip.townnews.com/bakersfield.com/content/tncms/assets/v3/editorial/c/64/c64a3ef7-d3cf-5c74-98eb-ba0baead51f8/68831496c6ccf.image.jpg?crop=1763%2C926%2C0%2C124&resize=1200%2C630&order=crop%2Cresize,,,2025-07-25 07:56:18.592515
,,2025-07-25 05:21:10+00:00,AP News,Top photos from Latin America and the Caribbean,,,,,,https://apnews.com/photo-gallery/latin-america-caribbean-top-photos-this-week-46a645f26782a12bdf02f13ec2cca430,"July 18-24, 2025 A worker pounded into rock to make gravel and sand in Port-au-Prince, Haiti. Brazilian former President Jair Bolsonaro showed off an ankle monitor the Supreme Court ordered him to wear, at Congress in Brasília.",,https://dims.apnews.com/dims4/default/e7c5960/2147483647/strip/true/crop/5760x3240+0+300/resize/1440x810!/quality/90/?url=https%3A%2F%2Fassets.apnews.com%2F55%2Ff2%2F39bcbf569ab0d85999992f1f0ea1%2F7eff637cbcb44bedab929515ac4cbc7f,,,2025-07-25 06:56:25.385296
,,2025-07-25 01:10:11+00:00,NBC New York,Inside look at the Latin American Foto Festival,,,,,,https://www.nbcnewyork.com/video/on-air/as-seen-on/inside-look-at-the-latin-american-foto-festival/6347758/,"A photography exhibit in the South Bronx is bringing the artwork directly to the public — going beyond a single gallery space to showcase the work of Latin American photographers not just in the streets, but across the boroughs. NBC 4 New York’s Gilma Avalos reports.",,https://media.nbcnewyork.com/2025/07/40980347155-1080pnbcstations.jpg?quality=85&strip=all&resize=1200%2C675,,,2025-07-24 21:34:13.972116
,,2025-07-25 00:34:38+00:00,Yahoo Entertainment,"Latin Mafia, Omar Apollo Sing a Melancholic Cumbia on ‘Hecho Para Ti’",,,,,,https://www.yahoo.com/entertainment/articles/latin-mafia-omar-apollo-sing-000136347.html,Apollo and the Latin Mafia members first played the song live during a concert earlier this summer,,https://s.yimg.com/ny/api/res/1.2/Vb298FAAQ7ieQXrEllkvmw--/YXBwaWQ9aGlnaGxhbmRlcjt3PTEyMDA7aD04MDA7Y2Y9d2VicA--/https://media.zenfs.com/en/rollingstone.com/e37444871c6c1a5f2df4a404dface406,,,2025-07-24 21:34:13.972116
,,2025-07-25 00:10:07+00:00,Variety,Omar Apollo and Latin Mafia Release ‘Hecho Para Ti’ Single and Video,,,,,,https://variety.com/2025/music/news/omar-apollo-latin-mafia-release-hecho-para-ti-video-1236469681/,"Omar Apollo and Latin Mafia team up for an emo cumbia release, 'Hecho Para Ti.'",,https://variety.com/wp-content/uploads/2025/07/LATIN-MAFIA-ft-OMAR-APOLLO-3.jpg?crop=0px%2C83px%2C6546px%2C3682px&resize=1000%2C563,,,2025-07-24 21:34:13.972116
,,2025-07-24 21:10:19+00:00,Milford-Orange Times,Latin Jazz Band To Perform At Case Memorial,,,,,,https://theorangetimes.com/latin-jazz-band-to-perform-at-case-memorial/,"Latin jazz band Goza will perform a variety of Latin dance rhythms at Case Memorial Library on Saturday, Aug. 23 at 2 p.m. “Goza” is the Spanish word for j",,https://s0.wp.com/i/blank.jpg,,,2025-07-24 17:56:48.741483
,,2025-07-24 21:09:46+00:00,theorangetimes.com,Latin Jazz Band To Perform At Case Memorial - Milford-Orange Times,,,,,,https://theorangetimes.com/%3Fp%3D10780,"Latin Jazz Band To Perform At Case Memorial ... The Survivors Swing Band improvises music of the big band… July 18, 2021. In ""Arts & Entertainment ...",,,,,2025-07-25 07:56:18.592515
,,2025-07-24 21:04:16+00:00,Urban Milwaukee,Washington Park Wednesdays Presents Viva! Latin Swing July 30 Concert,,,,,,https://urbanmilwaukee.com/pressrelease/washington-park-wednesdays-presents-viva-latin-swing-july-30-concert/,Juan Mungia and Latin Swing Factor promise an evening of dance music,,https://urbanmilwaukee.com/wp-content/uploads/2022/12/836.jpg,,,2025-07-24 17:56:48.741483
,,2025-07-24 21:02:54+00:00,The Seattle Times,THING festival cancels Latin day amid 'community safety concerns',,,,,,https://www.seattletimes.com/entertainment/music/thing-festival-cancels-latin-day-amid-community-safety-concerns/,The third weekend of Seattle Theatre Group's new-look festival was intended to showcase Latinx and Spanish-language artists.,,https://images.seattletimes.com/wp-content/uploads/2025/07/07242025_THING_tzr_134811.jpg?d=1200x630,,,2025-07-24 17:56:48.741483
,,2025-07-24 20:53:56+00:00,Latin Times,White House Melts Down After South Park Torched Trump in Premiere Episode: 'Desperate Attempt for Attention',,,,,,https://www.latintimes.com/white-house-melts-down-after-south-park-torched-trump-premiere-episode-desperate-attempt-587527,"The White House erupted after 'South Park' mocked Donald Trump in its season premiere, slamming the show as irrelevant.",,https://d.latintimes.com/en/full/582220/south-park-episode-featuring-trump-satan.png,,,2025-07-24 18:56:28.272835
,,2025-07-24 20:43:30+00:00,www.igamingtoday.com,Rafael Moraes Appointed as CEO of Brazilian Series of Poker with Ambitious Growth Vision,,,,,,https://www.igamingtoday.com/rafael-moraes-appointed-as-ceo-of-brazilian-series-of-poker-with-ambitious-growth-vision/,"... entertainment brand with regional and global recognition. “The BSOP can have the dominant competitive entertainment in Latin America“, said Moraes.",,,,,2025-07-24 18:56:28.272835
,,2025-07-24 19:49:51+00:00,www.igamingtoday.com,White Hat Studios Launches Custom Version of Jackpot Royale Express™ Exclusively on ...,,,,,,https://www.igamingtoday.com/white-hat-studios-launches-custom-version-of-jackpot-royale-express-exclusively-on-caesars-entertainments-online-casino-platforms/,"Armen Tatarevic, VP Gaming at White Hat Studios, said: “We are delighted to strengthen our partnership with Caesars Entertainment on this exclusive ...",,,,,2025-07-24 17:56:48.741483
,,2025-07-24 18:04:56+00:00,LatinAmerican Post,Hudson Nights Burn Bright as Sunset Salsa Turns New York into a Latin Dancefloor,,,,,,https://latinamericanpost.com/life/hudson-nights-burn-bright-as-sunset-salsa-turns-new-york-into-a-latin-dancefloor/,"As the sun slips behind New Jersey's cliffs, Pier 76 explodes with rhythm. Office workers, elders, and toddlers dance under the skyline in a ritual of sweat, memory, and joy‚Äîwhere salsa is therapy, unity, and New York's unofficial national anthem.",,https://latinamericanpost.com/wp-content/uploads/2025/07/ec0a1cac8b0b39ae1db53d94e3c7ec5b812281a4w.jpg,,,2025-07-24 14:56:33.231870
,,2025-07-24 17:16:28+00:00,ourmidland.com,"Lux Women's Choir presents ""The Music of Living"" - Midland Daily News Events",,,,,,https://ourmidland.com/entertainment/%3F_evDiscoveryPath%3D/event/3019570-lux-women-s-choir-presents-the-music-of-living,"Find entertainment news and reviews on movies, theater, music, TV ... Midland-based Lux (Latin for ""light"") was founded in 2021 by Artistic ...",,,,,2025-07-25 07:56:18.592515
,,2025-07-24 17:16:06+00:00,Houston Chronicle,"Top things to do in Houston this weekend: ‘Honky Tonk Laundry,’ Viva Fest",,,,,,https://www.houstonchronicle.com/entertainment/special_events/article/things-to-do-houston-weekend-honky-tonk-laundry-20782821.php,"Our weekend top picks also include ""The Last Five Years,"" Latin Restaurant Weeks, Houston Astros and more. ",,https://s.hdnux.com/photos/01/53/60/42/28248214/5/rawImage.jpg,,,2025-07-24 14:56:33.231870
,,2025-07-24 16:20:57+00:00,Baltimore Sun,Afro Latin restaurant Papi Cuisine relocates to downtown Baltimore,,,,,,https://www.baltimoresun.com/2025/07/24/papi-cuisine-downtown-baltimore/,"Papi Cuisine, an Afro Latin fusion restaurant with a sizable Instagram following, has moved from South Baltimore to downtown. ",,https://www.baltimoresun.com/wp-content/uploads/migration/2022/02/24/E3FLTDJXGNCMHCHOZHKNTVZEGI.jpg?w=1024&h=670,,,2025-07-24 15:56:38.509201
,,2025-07-24 16:06:07+00:00,gamingamerica.com,Rafael Moraes named CEO of Latin America's largest poker circuit,,,,,,https://gamingamerica.com/news/13737/rafael-moraes-named-ceo-of-latin-americas-largest-poker-circuit,"Kambi, the home of premium sports betting solutions, is the world's trusted sportsbook partner, pioneering next-generation betting entertainment ...",,,,,2025-07-24 15:56:38.509201
,,2025-07-24 15:16:09+00:00,HOLA! USA,Yamilex Hernández shares her dreams as the first Miss Universe Latina aiming for the 2025 Miss Universe crown,,,,,,https://www.hola.com/us/entertainment/20250724846360/yamilex-hernandez-interview-first-miss-universe-latina-2025-crown/,"Latin America has a new beauty queen who, this coming November, will represent an entire community at the most prestigious beauty pageant in the world",,https://www.hola.com/us/horizon/landscape/39791e0c03f8-screen-shot-2025-07-24-at-71423-am.jpg?im=Resize=(1200),,,2025-07-24 11:57:34.131313
,,2025-07-24 14:19:24+00:00,IQ Magazine,Latin artist Ana Mena set to make history in Asia | IQ Magazine,,,,,,https://www.iqmagazine.com/2025/07/latin-artist-ana-mena-to-make-history-in-asia/,EB Producciones chief Eduardo Basagaña reveals the singer is set to become the first female Latin act to headline a festival on the continent,,https://www.iqmagazine.com/wp-content/uploads/2025/07/31.png,,,2025-07-24 10:56:25.580875
,,2025-07-24 14:10:42+00:00,billboard.it,Italian-Chilean Singer Franno Takes Latin Music by Storm - Billboard Italia,,,,,,https://billboard.it/english/franno-takes-historia-de-amor/2025/07/24189277/,"This connection between healing and music lies at the core of Franno's identity as an artist. It's not just about entertainment, it's about creating ...",,,,,2025-07-24 15:56:38.509201
,,2025-07-24 13:46:43+00:00,www.msn.com,Meet the Latino Artist Reinventing Cumbia with Jazz in the U.S. Underground Scene - MSN,,,,,,https://www.msn.com/en-us/entertainment/news/meet-the-latino-artist-reinventing-cumbia-with-jazz-in-the-us-underground-scene/ar-AA1Ja2AY,"How Can I Avoid Taxes?"" Sponsored. Rene Kirby, “Shallow Hal” actor, dies at 70 after lifelong battle with. Entertainment Weekly. Rene Kirby, “Shallow ...",,,,,2025-07-24 12:56:26.889897
,,2025-07-24 12:13:14+00:00,Asbury Park Press,Perth Amboy group La Seleccion de la Bachata to play big Carteret Latin Fest,,,,,,https://www.app.com/story/entertainment/music/2025/07/24/bachata-latin-music-carteret-festival/85334418007/,"The Carteret Latin Fest takes place Saturday, July 26, at the borough's Civic Center Park and Sports Complex.",,"https://www.app.com/gcdn/authoring/authoring-images/2025/07/23/PAPP/85334424007-la-seleccion-de-la-bachata.jpg?crop=1999,1125,x0,y0&width=1999&height=1125&format=pjpg&auto=webp",,,2025-07-24 10:56:25.580875
,,2025-07-24 10:40:54+00:00,Al Día News,The New Trend in Restaurants Is Latino-Run,,,,,,https://aldianews.com/en/culture/destinations/latin-touch-flavor,Rooftop terraces and bars are a major trend in the U.S. and they’re being run by Latinos.,,https://aldianews.com/sites/default/files/2025-07/restaurante.jpg,,,2025-07-24 10:56:25.580875
,,2025-07-24 10:00:16+00:00,northernvirginiamag.com,12 of the Best Weekend Events in Northern Virginia and DC,,,,,,https://northernvirginiamag.com/things-to-do/2025/07/24/12-of-the-best-weekend-events-in-northern-virginia-and-dc-to-do-in-july/,"These 12 fun events will keep you entertained all weekend long. ... Latin music, fun, and culture. The event this weekend brings together ...",,,,,2025-07-24 14:56:33.231870
,,2025-07-24 06:29:22+00:00,Brattleboro Reformer,Next Stage Arts brings Blue Dahlia to NECCA,,,,,,https://www.reformer.com/arts_and_culture/entertainment/next-stage-arts-brings-blue-dahlia-to-necca/article_7337ae59-5891-4283-a04f-38792a5b2374.html,"BRATTLEBORO — Next Stage Arts continues its Bandwagon Summer Series with a performance by The Blue Dahlia, a world fusion group blending French chanson, reggae, klezmer, Latin rhythms, and more.",,https://bloximages.newyork1.vip.townnews.com/reformer.com/content/tncms/custom/image/bd63a06c-429a-11ee-8950-d704275f5abb.png?resize=600%2C315,,,2025-07-24 04:56:05.483594
,,2025-07-24 05:46:37+00:00,InsightTrendsWorld,Entertainment: Rock's Roaring Comeback: How Streaming and Authenticity Are Fueling a Genre Revival,,,,,,https://www.insighttrendsworld.com/post/entertainment-rock-s-roaring-comeback-how-streaming-and-authenticity-are-fueling-a-genre-revival,"Why it is the topic trending: The Unforeseen Resurgence of a Declared ""Dead"" Genre • Contradicting Prior Predictions: Just over a decade ago, prominent figures like Gene Simmons declared rock music ""dead"" due to piracy. Its current surge, as detailed by Luminate's midyear report showing it as one of the fastest-growing genres, directly contradicts these predictions, making it a surprising and trending topic. • New Talent Breaking Through: The emergence of new rock bands like Ghost and Sleep Toke",,"https://static.wixstatic.com/media/9d60f9_c3344fb2292040a38e8445dc931b6a5e~mv2.png/v1/fill/w_1000,h_563,al_c,q_90/9d60f9_c3344fb2292040a38e8445dc931b6a5e~mv2.png",,,2025-07-24 17:56:48.741483
,,2025-07-24 01:49:14+00:00,KPRC,Botonica: This beautiful bar in Houston conjures a love letter to Latin America with every sip 🍸✨ ,,,,,,https://www.click2houston.com/video/houston-life/2025/07/24/botonica-this-beautiful-bar-in-houston-conjures-a-love-letter-to-latin-america-with-every-sip/,"Step inside Botonica, a sultry new cocktail bar in Houston’s River Oaks where every sip tells a story. Founded by award-winning bartender Alexis Mijares, Botonica blends Latin spirits, heritage ingredients, and cultural storytelling in a moody, romantic space designed to transport you. From a tasting menu that traces the history of the margarita to unexpected flavor pairings like Bolivian Singani and Caribbean mamey, this bar is shaking up the Houston cocktail scene...literally. 
🍸✨ If you mention Houston Life you'll get 25% off your entire bill up until the end of the month 🍸✨ 
📍 Located at 2301 Westcreek Lane, Houston, TX
🌐 www.botonicahouston.com
📸 Follow @botonicahouston on Instagram & Facebook

",,"https://res.cloudinary.com/graham-media-group/image/upload/f_auto/q_auto/c_thumb,w_700/v1/media/anyclip/fstl-tf/Wg_COZgBEkhpdhLZvoqZ/1753315999747_1920x1080_thumbnail.jpg?_a=DATAg1eAZAA0",,,2025-07-24 02:01:00.777308
,,2025-07-23 23:05:50+00:00,KTLA,ALEJANDRO DUQUE TAKES ON DUAL ROLE AS PRESIDENT OF ADA & PRESIDENT OF WARNER MUSIC LATIN AMERICA,,,,,,https://ktla.com/business/press-releases/cision/20250723NY36183/alejandro-duque-takes-on-dual-role-as-president-of-ada-president-of-warner-music-latin-america,"Forward-thinking executive to helm WMG's distribution arm in addition to existing responsibilities leading LATAM business
NEW YORK, July 23, 2025 /PRNewswire/ -- It was announced today that accomplished leader Alejandro Duque has been named President of ADA, the independent distribution and label services arm of Warner Music Group (NASDAQ: WMG), expanding on his existing responsibilities as President of Warner Music Latin America. Duque will continue to be based in Miami and report to WMG CEO Robert Kyncl.",,https://mma.prnewswire.com/media/1686132/WMG_Black_Logo.jpg?p=publish,,,2025-07-23 21:56:17.372591
,,2025-07-23 22:18:23+00:00,we are Mitú. 100% American & Latino,"Los Bukis Just Got a Star on the Hollywood Walk of Fame — and Honestly, It’s What They Deserve",,,,,,https://wearemitu.com/wearemitu/entertainment/los-bukis-star-walk-of-fame/,"Los Bukis are the newest members of the Hollywood Walk of Fame, honoring their more than 50 years of creating music for adoring fans.",,https://d18ufwot1963hr.cloudfront.net/wp-content-production/uploads/2025/07/Los-Bukis-Star-Walk-of-Fame.jpg,,,2025-07-23 18:56:23.251948
,,2025-07-23 21:59:05+00:00,Latin Times,Who Will Represent the Dominican Republic in the Miss Universe? Latina Candidate's Resignation Shakes Pageant Scene,,,,,,https://www.latintimes.com/who-will-represent-dominican-republic-miss-universe-latina-candidates-resignation-shakes-587467,Magdelin Martínez's resignation comes one day after another Dominican woman represented Latinas in the United States by winning the Telemundo reality show Miss,,https://d.latintimes.com/en/full/582177/magdelin-martinez-suddenly-resigns-miss-universe-dominican-republic.jpg,,,2025-07-23 19:56:25.839026
,,2025-07-23 21:55:52+00:00,Los Angeles Times,The Friday Night Latin District brings culture and community back to downtown L.A.,,,,,,https://www.latimes.com/delos/story/2025-07-23/friday-night-latin-district-downtown-la-ice-raids,"Amid ICE raids, downtown L.A. event coordinators aim to revive nightlife with the Friday Night Latin District, a coalition of Latino-owned bars dedicated to hosting weekly cultural celebrations.",,https://ca-times.brightspotcdn.com/dims4/default/14ddba7/2147483647/strip/true/crop/1080x567+0+311/resize/1200x630!/quality/75/?url=https%3A%2F%2Fcalifornia-times-brightspot.s3.amazonaws.com%2Fc4%2Fbb%2F77f62a6842f59f34c551fc9d320c%2Flatindistrict-2.png,,,2025-07-23 18:56:23.251948
,,2025-07-23 21:32:28+00:00,USA TODAY,"Prince Royce runs on 'old-school' workouts, video games and action TV",,,,,,https://www.usatoday.com/story/entertainment/celebrities/2025/07/23/prince-royce-interview-the-essentials-eterno/84279656007/,"Latin pop star Prince Royce dishes on the nostalgia of his latest album ""Eterno"" as well as his daily staples for USA TODAY's The Essentials.",,"https://www.usatoday.com/gcdn/authoring/authoring-images/2025/06/23/USAT/84314732007-1.jpg?crop=1919,1079,x0,y0&width=1919&height=1079&format=pjpg&auto=webp",,,2025-07-23 17:57:00.460835
,,2025-07-23 20:22:31+00:00,Engadget,Google DeepMind's Aeneas model can restore fragmented Latin text,,,,,,https://www.engadget.com/ai/google-deepminds-aeneas-model-can-restore-fragmented-latin-text-202004714.html,Augustus said what?!,,https://s.yimg.com/ny/api/res/1.2/7fRM4DLp9XwwXH.OqMxZGw--/YXBwaWQ9aGlnaGxhbmRlcjt3PTEyMDA7aD04MDA-/https://s.yimg.com/os/creatr-uploaded-images/2025-07/c10afe90-67ff-11f0-b07b-aeecbf7673da,,,2025-07-23 16:57:52.514332
,,2025-07-23 20:12:04+00:00,NewJerseyStage.com,Newark to Host Annual Latin Festival on August 17th,,,,,,https://www.newjerseystage.com/articles2/2025/07/23/newark-to-host-annual-latin-festival-on-august-17th/,"(NEWARK, NJ) -- Mayor Ras J. Baraka, Deputy Mayor for Community Engagement Jacqueline Mercado-Quiles, and the Office of Violence Prevention and Trauma Recovery (OVPTR) will host the Annual Latin Festival on Sunday, August 17, 2025 from noon to 10:00pm, on Bloomfield Avenue between Lake Street and Clifton Avenue, in Newark's North Ward.",,,,,2025-07-23 16:57:52.514332
,,2025-07-23 18:54:18+00:00,HISTORY,Gymnast Mary Lou Retton scores two perfect '10s' to win gold,,,,,,https://www.history.com/this-day-in-history/mary-lou-retton-perfect-10-olympics,She also won four more medals at the 1984 Summer Olympic Games.,,"https://res.cloudinary.com/aenetworks/image/upload/c_fill,w_1200,h_630,g_auto/dpr_auto/f_auto/q_auto:eco/v1/152208838_dhrhkz?_a=BAVAZGDX0",,,2025-07-23 19:56:25.839026
,,2025-07-23 18:39:32+00:00,Latin Times,Meet the Latino Artist Reinventing Cumbia with Jazz in the U.S. Underground Scene,,,,,,https://www.latintimes.com/meet-latino-artist-reinventing-cumbia-jazz-us-underground-scene-587436,"Terror/Cactus, Martín Selasco's musical project, is spinning cumbia into something jazzy, hypnotic, electronic, and wildly improvisational, all while staying rooted in Latinidad.",,https://d.latintimes.com/en/full/582131/martin-selasco-terror-cactus-electronic-cumbia-jazz.jpg,,,2025-07-23 14:56:10.720516
,,2025-07-23 18:24:18+00:00,Digital Journal,AI helps Latin scholars decipher ancient Roman texts,,,,,,https://www.digitaljournal.com/tech-science/ai-helps-latin-scholars-decipher-ancient-roman-texts/article,"Around 1,500 Latin inscriptions are discovered every year, offering an invaluable view into the daily life of ancient Romans -- and posing a daunting",,https://www.digitaljournal.com/wp-content/uploads/2025/07/2e265952b364d1937017ea812b0175ff2f713b1a.jpg,,,2025-07-23 14:56:10.720516
,,2025-07-23 17:39:57+00:00,The Hollywood Reporter,Warner Music Group Names Alejandro Duque New President of ADA,,,,,,https://www.hollywoodreporter.com/business/business-news/warner-music-group-names-alejandro-duque-president-of-ada-1236327040/,"Duque, who will continue to serve as president of Warner Music Latin America, was appointed a day after Cat Kreidich announced she was stepping down from her role this week.",,https://www.hollywoodreporter.com/wp-content/uploads/2025/07/Alejandro-Duque.jpg?crop=0px%2C825px%2C5200px%2C2910px&resize=1440%2C810,,,2025-07-23 13:57:24.504702
