id,name,published,outlet,title,authors,category,market,categoryorder,articleorder,url,description,text,image,error,sentiment,firstEyes
,,2025-07-02 12:38:19+00:00,TipRanks Financial,Inspired Entertainment launched Virtual Sports with BetMGM - TipRanks.com,,,,,,https://www.tipranks.com/news/the-fly/inspired-entertainment-launched-virtual-sports-with-betmgm-thefly,"Inspired Entertainment (INSE) announces the launch of its Virtual Sports products with BetMGM, via the Kambi Engage platform, with an initial focus on Brazil. This ...",,https://blog.tipranks.com/wp-content/uploads/2023/06/Consumer-Cylical-3-750x406.jpg,,,2025-07-02 09:03:38.935154
,,2025-07-02 08:16:38+00:00,AJU PRESS,Hybe names new heads for Americas and APAC as global push accelerates  | AJU PRESS,,,,,,https://www.ajupress.com/view/20250702153744543,"SEOUL, July 02 (AJP) - Hybe, the South Korean entertainment company behind BTS, has appointed Isaac Lee as CEO and Chairman of Hybe America, expanding his current leadership role over Latin America to include the entire Western Hemisphere. The move reflects Hybes broader push to streamline global operations and build stronger local networks in key ...",,https://image.ajunews.com/content/image/2025/07/02/20250702161910902881.jpeg,,,2025-07-02 07:05:15.523260
,,2025-07-02 07:24:05+00:00,www.thebulwark.com,Latin Music Business Suffers as Trump’s Assault on Immigrants Expands,,,,,,https://www.thebulwark.com/p/latin-music-business-suffers-trump-dhs-ice-deportations,"Tour dates canceled, ticket sales down, artists’ visas revoked, and a climate of fear growing around shows that fans have attended for years.",,"https://substackcdn.com/image/fetch/$s_!RJOt!,w_1200,h_600,c_fill,f_jpg,q_auto:good,fl_progressive:steep,g_auto/https%3A%2F%2Fsubstack-post-media.s3.amazonaws.com%2Fpublic%2Fimages%2F4751ab23-05f7-4c9a-9beb-242ef3321e8a_2100x1500.jpeg",,,2025-07-02 03:58:29.997915
,,2025-07-02 07:08:32+00:00,KWKT - FOX 44,"Global Times: Chinese modernization brings to Latin America discussions about development, new ideas: Argentine scholar",,,,,,https://www.fox44news.com/business/press-releases/cision/20250702CN22906/global-times-chinese-modernization-brings-to-latin-america-discussions-about-development-new-ideas-argentine-scholar,"BEIJING, July 2, 2025 /PRNewswire/ -- The ""Global Times Overseas China Week and Global South Dialogue: Seminar on Relations between China and Latin America and the Caribbean (LAC) countries, and the Mutual Perception of Public Opinion"" were held in Buenos Aires, capital of Argentina, on Monday local time. Political, business, academic, think tank, and media representatives from China and Argentina gathered to engage in in-depth exchanges on deepening mutual understanding, strengthening the public support foundation, and promoting mutual learning among civilizations between China and LAC countries.In an interview with the Global Times, Patricio Conejero Ortiz, Director of Latin America–China Observatory (OLAC) at University of Buenos Aires,told the Global Times that ""when we discuss economic development, most of the models that we take in account are models developed in the Western world. There is something very useful in learning about Chinese modernization, which is to have more diversity in terms of the possible ways in the path to development."" Patricio think that the Chinese modernization could bring to Latin America discussions about development and new ideas. ""If you look at the countries in the Global South, of course there is a clear characteristic in China, which is leading a revolutionary process of transforming new technologies. The recent summit that we had in Beijing, China between CELAC and China was the latest step in a process that has been working for more than 10 years. So recently it's a historical construction in the relationship between CELAC countries and China."" China and Argentina are probably the farthest countries in the world, but what we need to think is how are we going to build the bridge to connect our people. ""There are some characteristics of the Chinese people and the Argentine people that makes us very close in some parts of our language, in some aspects of our culture. What we need to do is to increase people-to-people exchanges,"" Patricio said.This will create a closer connection and we will be able to build the bridge that we need to have a closer relationship between China and Argentina, the scholar said.",,https://www.fox44news.com/wp-content/uploads/sites/82/2019/07/cropped-Favicon-2-1-1.png?strip=1&w=250,,,2025-07-02 07:05:15.523260
,,2025-07-02 03:19:07+00:00,MySA,'Jurassic World Rebirth' actress has family ties to San Antonio,,,,,,https://www.mysanantonio.com/entertainment/article/luna-blaise-jurassic-world-rebirth-20403252.php,Actress Luna Blaise has family ties to San Antonio.,,https://s.hdnux.com/photos/01/52/75/27/28038642/3/rawImage.jpg,,,2025-07-02 02:00:11.792473
,,2025-07-02 00:42:29+00:00,HOLA! USA,Meet the Latino singers on 'Building the Band',,,,,,https://www.hola.com/us/entertainment/20250702841537/meet-latino-singers-building-the-band-netflix/,These Latinos are ready to build the band,,https://www.hola.com/us/horizon/landscape/7f29a54588d5-untitled-design.jpg?im=Resize=(1200),,,2025-07-01 22:02:41.628202
,,2025-07-02 00:37:18+00:00,San Francisco Chronicle,"Catholic bishops from Asia, Africa, Latin America demand climate justice",,,,,,https://www.sfchronicle.com/news/world/article/catholic-bishops-from-asia-africa-latin-america-20402280.php,"Catholic bishops from Asia, Africa and Latin America are demanding climate justice for the parts of the world most affected by rising temperatures. They have penned a first ecological appeal to reject...",,https://s.hdnux.com/photos/01/52/75/00/28037129/3/rawImage.jpg,,,2025-07-01 23:59:08.190312
,,2025-07-01 21:11:11+00:00,"WEIS | Local & Area News, Sports, & Weather - Southern, Country, and American Proud!","Nashville notes: Kacey Musgraves’ Latin American tour + Ashley Monroe’s ‘Magnolia’ - WEIS | Local & Area News, Sports, & Weather",,,,,,https://weisradio.com/2025/07/01/nashville-notes-kacey-musgraves-latin-american-tour-ashley-monroes-magnolia/,"Dollywood's Blazing Fury roller coaster will reopen Friday during a ceremony starting at 10 a.m. ET. Members of the Pigeon Forge Fire Department will be the first on board the firefighting-themed coaster, built in 1978.Kacey Musgraves will play three shows this fall in Latin America, starting Sept. 24 in Mexico City, and continuing on to Jaguariúna,",,https://weisradio.com/wp-content/uploads/2025/07/Nashville_Notes1.jpg,,,2025-07-01 18:06:42.307919
,,2025-07-01 19:20:14+00:00,thecanadianpressnews.ca,"Catholic bishops from Asia, Africa, Latin America demand climate justice",,,,,,https://www.thecanadianpressnews.ca/world/catholic-bishops-from-asia-africa-latin-america-demand-climate-justice/article_db35e593-b942-5963-8ec3-9b1e966ec277.html,"VATICAN CITY (AP) — Catholic bishops from Asia, Africa and Latin America demanded climate justice for the parts of the world most affected by rising temperatures and rejected what they",,https://bloximages.chicago2.vip.townnews.com/thecanadianpressnews.ca/content/tncms/assets/v3/editorial/e/4a/e4afcdc3-94a5-51a3-8c9d-d889a10953dc/6863dc0ec0b49.image.jpg?crop=1400%2C735%2C0%2C99&resize=1200%2C630&order=crop%2Cresize,,,2025-07-02 02:58:45.739205
,,2025-07-01 18:28:21+00:00,Miami's Community News | Your local connection,Baptist Health Foundation Welcomes Latin GRAMMY® Winning Superstar Luis Fonsi to The Grand Gala 2025 | Biscayne Bay Tribune#,,,,,,https://communitynewspapers.com/biscayne-bay/baptist-health-foundation-welcomes-latin-grammy-winning-superstar-luis-fonsi-to-the-grand-gala-2025/,"Baptist Health Foundation will celebrate its 2025 Grand Gala benefiting Baptist Health on Saturday, November 8 the Miami Beach Convention Center Grand Ballroom. The annual event, which raises funds for Baptist Health entities and programs throughout Miami-Dade, Broward, Palm Beach and Monroe counties, will feature a cocktail reception, formal dinner, silent auction and renowned entertainment.",,https://communitynewspapers.com/wp-content/uploads/2025/07/image005.jpg,,,2025-07-01 15:08:31.009331
,,2025-07-01 17:49:17+00:00,www.echo.net.au,A taste of Italy and family fun - The Echo,,,,,,https://www.echo.net.au/2025/07/a-taste-of-italy-and-family-fun/,"... Latin Mafia and aromas of espresso, pasta, and woodfired pizza tempt your tastebuds. There'll be live entertainment, the Summerland Bank Tug-O-War ...",,,,,2025-07-02 07:05:15.523260
,,2025-07-01 16:58:01+00:00,www.thefutoncritic.com,"FX and Disney+ Latin America's ""Necaxa"" New Docuseries from the Producers of ""Welcome ...",,,,,,http://www.thefutoncritic.com/news/2025/07/01/fx-and-disneyplus-latin-americas-necaxa-new-docuseries-from-the-producers-of-welcome-to-wrexham-premieres-thursday-august-7-827514/20250701fx01/,"The series is produced by Hyphenate Media Group, More Better Productions, Maximum Effort and 3 Arts Entertainment. Follow FX's Necaxa on social ...",,,,,2025-07-01 14:10:46.044333
,,2025-07-01 16:57:41+00:00,San Antonio Express-News,Apple TV app - Top Movies,,,,,,https://www.expressnews.com/entertainment/article/apple-tv-app-top-movies-20402768.php,Apple TV app (Movies) charts for week ending June 29,,https://s.hdnux.com/photos/01/31/33/07/23441860/5/rawImage.jpg,,,2025-07-02 07:05:15.523260
,,2025-07-01 16:43:21+00:00,www.msn.com,P1Harmony unveils dates and locations for North American leg of world tour - MSN,,,,,,https://www.msn.com/en-us/music/news/p1harmony-unveils-dates-and-locations-for-north-american-leg-of-world-tour/ar-AA1HJczY,Boy band ... This will be the band's first solo concerts in Latin America in two years.,,,,,2025-07-01 17:06:59.682043
,,2025-07-01 16:37:59+00:00,www.inc.com,Giving Latin Talent a Global Stage - Inc. Magazine,,,,,,https://www.inc.com/inccustomstudio/giving-latin-talent-a-global-stage/91208160,"In 2019, after 22 years in the entertainment industry, Lex Borrero was ready to retire. But when the former music executive arrived in Miami to ...",,,,,2025-07-01 13:10:30.882957
,,2025-07-01 15:58:21+00:00,Yahoo Entertainment,The 25 Best Latin Songs of 2025 So Far (Staff Picks),,,,,,https://www.yahoo.com/entertainment/articles/25-best-latin-songs-2025-153613283.html,See our editorial picks here for the best Latin tracks from the year's first six months.,,https://s.yimg.com/ny/api/res/1.2/KzDJ4C7dbB9ApWtVJM0CKg--/YXBwaWQ9aGlnaGxhbmRlcjt3PTEyMDA7aD03OTQ7Y2Y9d2VicA--/https://media.zenfs.com/en/billboard_547/a5d429533c05e9a172091f7cebc6bb24,,,2025-07-01 13:10:30.882957
,,2025-07-01 15:50:51+00:00,hispanicprwire.com,reVolver Podcasts Debuts “Jorge Ramos y Su Banda” — A Powerhouse Soccer Show ...,,,,,,https://hispanicprwire.com/en/revolver-podcasts-debuts-jorge-ramos-y-su-banda-a-powerhouse-soccer-show-featuring-iconic/,"reVolver Podcasts Debuts “Jorge Ramos y Su Banda” — A Powerhouse Soccer Show Featuring Iconic Latin American Voices ... entertainment, lifestyle ...",,,,,2025-07-01 15:08:31.009331
,,2025-07-01 15:35:59+00:00,RTTNews,Kendrick Lamar Announces Latin American 'Grand National Tour' Dates ,,,,,,https://www.rttnews.com/3550150/kendrick-lamar-announces-latin-american-grand-national-tour-dates.aspx,"Kendrick Lamar has announced dates for the Latin American leg of his highly successful ""Grand National Tour."".",,https://cdn.rttnews.com/articleimages/ustopstories/2024/march/kendricklamar-27032024-lt.jpg,,,2025-07-01 12:18:48.109437
,,2025-07-01 15:21:19+00:00,Business Debut | New Business Openings,Longwood Social Lounge to Open This August With Latin Flair,,,,,,https://www.businessdebut.com/longwood-social-lounge-to-open-this-august-with-latin-flair/,Restaurateur Joey Acevedo is launching a new Latin-fusion bar and lounge in Longwood this summer.,,https://www.businessdebut.com/content/images/size/w1200/2025/07/h.jpg,,,2025-07-01 14:10:46.044333
,,2025-07-01 14:46:11+00:00,Hastings Tribune,NPR’s Felix Contreras opened minds to Latin alternative music. He’s finally getting his due,,,,,,https://www.hastingstribune.com/ap/entertainment/npr-s-felix-contreras-opened-minds-to-latin-alternative-music-he-s-finally-getting-his/article_0906b5d6-6324-5b60-b900-0cfc6728a53a.html,"LOS ANGELES — National Public Radio journalist Felix Contreras, best known for chronicling Latino music in his podcast “Alt.Latino,” will be honored this year at the 38th annual Hispanic Heritage",,https://bloximages.newyork1.vip.townnews.com/hastingstribune.com/content/tncms/custom/image/7b43d562-eeac-11e4-8a7b-970670abfcb2.jpg?resize=600%2C315,,,2025-07-01 15:08:31.009331
,,2025-07-01 14:42:50+00:00,GazetteXtra,NPR’s Felix Contreras opened minds to Latin alternative music. He’s finally getting his due,,,,,,https://www.gazettextra.com/entertainment/npr-s-felix-contreras-opened-minds-to-latin-alternative-music-he-s-finally-getting-his/article_5812604e-a21c-52c4-8c14-41f6027d8f38.html,"LOS ANGELES — National Public Radio journalist Felix Contreras, best known for chronicling Latino music in his podcast “Alt.Latino,” will be honored this year at the 38th annual Hispanic Heritage",,https://bloximages.newyork1.vip.townnews.com/gazettextra.com/content/tncms/custom/image/bd5993ec-56a6-11ec-a43c-8f7b005e099d.jpg,,,2025-07-01 11:17:47.823798
,,2025-07-01 14:08:27+00:00,HOLA! USA,Shakira wants Mexican fans to help pick her new setlist,,,,,,https://www.hola.com/us/entertainment/20250701841425/shakira-mexico-new-setlist/,"Get ready, Mexico! Shakira is making her way back; this time, she wants you to help shape the show",,https://www.hola.com/us/horizon/landscape/9fd4bac289dd-gettyimages-2219001187.jpg?im=Resize=(1200),,,2025-07-01 11:17:47.823798
,,2025-07-01 13:56:25+00:00,thesource.com,Kendrick Lamar Adds Latin America Dates to Grand National Tour,,,,,,https://thesource.com/2025/07/01/kendrick-lamar-latin-america-tour/,"Following a string of sold-out shows in North America and upcoming dates with SZA in Europe, Kendrick Lamar is bringing his Grand National Tour to Latin America.",,https://thesource.com/wp-content/uploads/2025/07/image001-2.jpg,,,2025-07-01 18:06:42.307919
,,2025-07-01 12:58:21+00:00,Toronto Star,"Catholic bishops from Asia, Africa, Latin America demand climate justice",,,,,,https://www.thestar.com/news/world/europe/catholic-bishops-from-asia-africa-latin-america-demand-climate-justice/article_d44a3683-6531-577b-a611-745d4953aef4.html,"VATICAN CITY (AP) — Catholic bishops from Asia, Africa and Latin America demanded climate justice for the parts of the world most affected by rising temperatures and rejected what they",,https://bloximages.chicago2.vip.townnews.com/thestar.com/content/tncms/assets/v3/editorial/c/90/c90daf02-0592-569f-b73d-1280578b6d64/6863d5f4af454.image.jpg?crop=1620%2C851%2C0%2C114&resize=1200%2C630&order=crop%2Cresize,,,2025-07-01 10:02:41.008029
,,2025-07-01 12:46:57+00:00,Jacksonville Journal-Courier,"Catholic bishops from Asia, Africa, Latin America demand climate justice",,,,,,https://www.myjournalcourier.com/news/world/article/catholic-bishops-from-asia-africa-latin-america-20402280.php,"Catholic bishops from Asia, Africa and Latin America are demanding climate justice for the parts of the world most affected by rising temperatures. They have penned a first ecological appeal to reject...",,https://s.hdnux.com/photos/01/52/75/00/28037129/3/rawImage.jpg,,,2025-07-01 11:17:47.823798
,,2025-07-01 12:37:03+00:00,Beaumont Enterprise,"Catholic bishops from Asia, Africa, Latin America demand climate justice",,,,,,https://www.beaumontenterprise.com/news/world/article/catholic-bishops-from-asia-africa-latin-america-20402280.php,"Catholic bishops from Asia, Africa and Latin America are demanding climate justice for the parts of the world most affected by rising temperatures. They have penned a first ecological appeal to reject...",,https://s.hdnux.com/photos/01/52/75/00/28037129/3/rawImage.jpg,,,2025-07-01 10:02:41.008029
,,2025-07-01 12:31:33+00:00,AP News,"Catholic bishops from Asia, Africa, Latin America demand climate justice",,,,,,https://apnews.com/article/vatican-climate-justice-pope-bishops-34174d1ae3b62e33e0238e360ae6e67b,"Catholic bishops from Asia, Africa and Latin America are demanding climate justice for the parts of the world most affected by rising temperatures.",,https://dims.apnews.com/dims4/default/1a276ce/2147483647/strip/true/crop/4000x2250+0+208/resize/1440x810!/quality/90/?url=https%3A%2F%2Fassets.apnews.com%2F10%2Fd4%2F474c976448f6d63949e9647bdcd7%2Fe3fe20020fec4efa82985392b8c37e73,,,2025-07-01 11:17:47.823798
,,2025-07-01 12:28:13+00:00,Texomashomepage.com,Experience Noche Latina & Art: A night of culture and fun,,,,,,https://www.texomashomepage.com/news/interviews/experience-noche-latina-art-a-night-of-culture-and-fun/,"WICHITA FALLS (KFDX/KJTL) — A local business in downtown Wichita Falls is asking residents to come and support a great cause with lively entertainment. On Saturday, July 12, from 6 p.m. to 2 a.m., …",,https://www.texomashomepage.com/wp-content/uploads/sites/41/2025/07/noche-latina-2025.jpg?w=1280,,,2025-07-01 11:17:47.823798
,,2025-07-01 12:05:08+00:00,The Lethbridge Herald - News and Sports from around Lethbridge,Brazil to reopen National Museum destroyed by fire in 2018,,,,,,https://lethbridgeherald.com/entertainment/entertainment-news/2025/06/30/brazil-to-reopen-national-museum-destroyed-by-fire-in-2018/,"RIO DE JANEIRO (AP) — Brazil's National Museum offered a glimpse of its renovated building and collection on Monday, two days before it reopens for",,https://lethbridgeherald.com/wp-content/uploads/2017/09/logo_lethbridge_herald.png,,,2025-07-01 11:17:47.823798
,,2025-07-01 11:30:49+00:00,The Globe and Mail,New Rogers Stadium hosts K-pop superstars Stray Kids in upbeat opening night,,,,,,https://www.theglobeandmail.com/arts/music/article-rogers-stadium-k-pop-stray-kids-opening-night/,"Young, predominantly female crowd of almost 50,000 shriek, dance and literally rock the grandstands at brand new venue",,https://www.theglobeandmail.com/resizer/v2/GACANEPP3ZFVJGLB7EGKNKJYBU.jpg?auth=f6c97b87fca996d25422b7583097aacb01bf45770cec20d83a01aabc1c55803f&width=1200&height=800&quality=80&smart=true,,,2025-07-01 10:02:41.008029
,,2025-07-01 11:30:05+00:00,LBC,Jon Bon Jovi refusing to sell beachfront property to myserious buyer,,,,,,https://www.lbc.co.uk/news/entertainment/jon-bon-jovi-refusing-to-sell-beachfront-property-to-myserious-buyer/,A rockstar is reportedly refusing to sell his Florida beachfront home as a mysterious buyer purchases neighbouring properties.,,https://images.lbc.co.uk/images/735650?width=1200&crop=16_9&signature=gQr-sshQza_3xpZk9P8dv4n6Mec=,,,2025-07-01 10:02:41.008029
,,2025-07-01 07:18:41+00:00,WVPE,Review: Karol G went for a pan-Latin sound in new album 'Tropicoqueta',,,,,,https://www.wvpe.org/2025-06-30/review-karol-g-went-for-a-pan-latin-sound-in-new-album-tropicoqueta,"NPR'S Andrew Limbong and Anamaria Sayer review the latest album from Karol G, Tropicoqueta.",,,,,2025-07-01 10:02:41.008029
,,2025-07-01 06:38:01+00:00,Latin Times,Victoria Ruffo Breaks Silence on Why She Isn't in Karol G's 'Tropicoqueta' Video,,,,,,https://www.latintimes.com/victoria-ruffo-breaks-silence-why-she-isnt-karol-gs-tropicoqueta-video-585907,"The iconic actress was invited to be part of the promotional campaign for Karol G's new album. However, she said no, and her reasons are admirable.",,https://d.latintimes.com/en/full/580234/victoria-ruffo-rejected-karol-gs-tropicoqueta-soap-operas.jpg,,,2025-07-01 10:02:41.008029
,,2025-07-01 06:02:52+00:00,Yahoo Entertainment,Fans Choose Wampi & Leoni Torres’ ‘La Última’ as Their Favorite New Latin Music of the Week,,,,,,https://www.yahoo.com/entertainment/articles/fans-choose-wampi-leoni-torres-233920034.html,The romantic collaboration generated over 45% of the vote in last week's poll.,,https://s.yimg.com/ny/api/res/1.2/cr0UV2E3jAunCfylJqt5vw--/YXBwaWQ9aGlnaGxhbmRlcjt3PTEyMDA7aD03OTQ7Y2Y9d2VicA--/https://media.zenfs.com/en/billboard_547/52d7943299d855631e54671de0bba6ab,,,2025-07-01 05:01:45.655431
,,2025-07-01 05:36:42+00:00,Bakchormeeboy,Dance with Me: An Interview with Burn The Floor dancers Jorja Freeman and Gustavo Viglio,,,,,,https://bakchormeeboy.com/2025/07/01/dance-with-me-an-interview-with-burn-the-floor-dancers-jorja-freeman-and-gustavo-viglio/,"For over two decades, Burn the Floor has redefined the world of Latin and ballroom dance, lighting up stages from Broadway to the West End and captivating audiences in more than 180 countries. With…",,https://i0.wp.com/bakchormeeboy.com/wp-content/uploads/2025/05/screenshot-2025-05-29-at-12.48.23-pm.png?fit=1200%2C596&ssl=1,,,2025-07-01 04:02:36.444868
,,2025-07-01 05:18:39+00:00,Miami's Community News | Your local connection,Grant Miller joins in the fun at the ChamberSOUTH Pickleball Tournament! | Biscayne Bay Tribune#,,,,,,https://communitynewspapers.com/biscayne-bay/grant-miller-joins-in-the-fun-at-the-chambersouth-pickleball-tournament/,"Grant Miller joins in the fun at the ChamberSOUTH Pickleball Tournament! #thatscommunitynews #communitynewspapers #miamidade #miamidadecounty #thatscommunity #miamicommunitynews #coralgables #palmettobay #southmiami #doral #aventura #pinecrest #kendall #broward #biscaynebay ABOUT US: Miami Community Newspapers is your go-to source for Miami community news, offering daily updates, podcasts, and multimedia content. Covering local events, business updates, and lifestyle features across",,https://communitynewspapers.com/wp-content/uploads/2025/06/Grant-Miller-joins-in-the-fun-at-the-ChamberSOUTH-Pickleball-Tournament-0-23-screenshot.png,,,2025-07-01 11:17:47.823798
,,2025-07-01 05:10:59+00:00,Hastings Tribune,Adrian Quesada steps into his star power in new LP ‘Boleros Psicodélicos II’,,,,,,https://www.hastingstribune.com/ap/entertainment/adrian-quesada-steps-into-his-star-power-in-new-lp-boleros-psicod-licos-ii/article_3a7f2da1-fae1-5d4f-a37d-76e35eaa695c.html,"LOS ANGELES — Speaking with musician and producer Adrian Quesada elicits a calming effect, as if a salve has been applied to the people conversing with him. His voice moves",,https://bloximages.newyork1.vip.townnews.com/hastingstribune.com/content/tncms/custom/image/7b43d562-eeac-11e4-8a7b-970670abfcb2.jpg?resize=600%2C315,,,2025-07-01 03:01:12.152922
,,2025-07-01 03:46:34+00:00,koreajoongangdaily.joins.com,P1Harmony unveils dates and locations for North American leg of world tour,,,,,,https://koreajoongangdaily.joins.com/news/2025-07-01/entertainment/kpop/P1Harmony-unveils-dates-and-locations-for-North-American-leg-of-world-tour/2342707,"Boy band P1Harmony released the dates and locations for the North American leg of its ""P1ustage H: Most Wanted"" world tour on Tuesday.",,https://koreajoongangdaily.joins.com/data/photo/2025/07/01/302999a5-54e2-49ce-a158-9a304f6beec4.jpg,,,2025-07-01 03:01:12.152922
,,2025-07-01 03:41:10+00:00,www.koreatimes.co.kr,"P1Harmony to launch world tour, take stage at Intuit Dome in US - The Korea Times",,,,,,https://www.koreatimes.co.kr/amp/entertainment/k-pop/20250701/p1harmony-to-launch-world-tour-take-stage-at-intuit-dome-in-us,"K-pop boy band P1Harmony will launch its biggest world tour to date, with performances across major arena venues in North and Latin America, their agency FNC Entertainment said Tuesday. Titled ""2025 P...",,https://newsimg.koreatimes.co.kr/2025/07/01/1c4f4ef5-448f-4e71-b491-bf51ab4e2ea1.jpeg,,,2025-07-01 03:01:12.152922
,,2025-07-01 03:01:01+00:00,rivercountry.newschannelnebraska.com,Wow Remote Teams Unpacks the Marketing Talent Surge Across Latin America,,,,,,https://rivercountry.newschannelnebraska.com/story/52887891/wow-remote-teams-unpacks-the-marketing-talent-surge-across-latin-america,Latin America's remote marketing talent is booming—Wow Remote Teams reports a surge in U.S. demand for bilingual specialists across key LATAM hubs.,,https://NCN.images.worldnow.com/images/21756793_G.png,,,2025-07-01 04:02:36.444868
,,2025-07-01 00:02:50+00:00,Yahoo Entertainment,Karol G’s ‘Tropicoqueta’ Album Storms In at No. 1 on Top Latin Albums Chart,,,,,,https://www.yahoo.com/entertainment/articles/karol-g-tropicoqueta-album-storms-232703438.html,The singer also breaks her own record among women with 20 simultaneous songs on the Hot Latin Songs chart.,,https://s.yimg.com/ny/api/res/1.2/E.pObVSGpsbbsmFI0i46nA--/YXBwaWQ9aGlnaGxhbmRlcjt3PTEyMDA7aD03OTQ7Y2Y9d2VicA--/https://media.zenfs.com/en/billboard_547/d16f491de6fb7448a1a46faca9511e29,,,2025-06-30 22:01:06.956445
,,2025-06-30 22:07:46+00:00,The Georgia Straight,CANADA DAY LATIN BOAT PARTY – Things to do in Vancouver – Georgia Straight,,,,,,https://www.straight.com/listings/events/1457261,All your favorite Latin hits & amazing views!,,https://www.straight.com/files/v3/styles/gs_feature/public/events/25/06/canada-day-latin.jpg?itok=xIEJt_to,,,2025-06-30 20:04:06.344610
,,2025-06-30 21:59:15+00:00,KVNF Community Radio,Review: Karol G went for a pan-Latin sound in new album 'Tropicoqueta',,,,,,https://www.kvnf.org/2025-06-30/review-karol-g-went-for-a-pan-latin-sound-in-new-album-tropicoqueta,"NPR'S Andrew Limbong and Anamaria Sayer review the latest album from Karol G, Tropicoqueta.",,,,,2025-07-01 03:01:12.152922
,,2025-06-30 20:54:45+00:00,TAPinto,Edison Township Schedules First Ever Latin Music Festival,,,,,,https://www.tapinto.net/towns/edison/sections/arts-and-entertainment/articles/edison-township-schedules-first-ever-latin-music-festival,"The township will host their first-ever Latin Music Festival on Saturday, July 26, from 4:00 PM to 8:00 PM at Old Stewarts Lot, located at 922 Amboy Avenue.",,http://tapinto-production.s3.amazonaws.com/uploads/photos/09/facebook_1e8a373ce27b643bc47c_mini_magick20250630-1642029-his0vt.jpg,,,2025-06-30 17:12:35.449597
