id,name,published,outlet,title,authors,category,market,categoryorder,articleorder,url,description,text,image,error,sentiment,firstEyes
,,2025-07-23 16:55:45+00:00,The Economic Times,AI helps Latin scholars decipher ancient Roman texts - The Economic Times,,,,,,https://m.economictimes.com/tech/artificial-intelligence/ai-helps-latin-scholars-decipher-ancient-roman-texts/articleshow/122864098.cms,"Around 1,500 Latin inscriptions are discovered every year, offering an invaluable view into the daily life of ancient Romans and posing a daunting challenge for the historians tasked with interpreting them. It can now estimate the location of an inscription among the 62 Roman provinces, offer a decade when it was produced and even guess what missing sections might have contained, they said.",,"https://img.etimg.com/thumb/width-1200,height-900,imgsize-192232,resizemode-75,msid-122864098/tech/artificial-intelligence/ai-helps-latin-scholars-decipher-ancient-roman-texts.jpg",,,2025-07-23 13:57:24.504702
,,2025-07-23 16:52:03+00:00,barrons,AI Helps Latin Scholars Decipher Ancient Roman Texts,,,,,,https://www.barrons.com/news/ai-helps-latin-scholars-decipher-ancient-roman-texts-4857d0c6,"Around 1,500 Latin inscriptions are discovered every year, offering an invaluable view into the daily life of ancient Romans -- and posing a daunting challenge for the historians tasked with interpreting them.",,https://www.barrons.com/asset/external-media/afp/AFP1039497965093415285361939216334795153446---1.jpg,,,2025-07-23 13:57:24.504702
,,2025-07-23 16:52:02+00:00,www.barrons.com,AI Helps Latin Scholars Decipher Ancient Roman Texts - Barron's,,,,,,https://www.barrons.com/news/ai-helps-latin-scholars-decipher-ancient-roman-texts-4857d0c6%3Frefsec%3Dtopics_afp-news,"Around 1500 Latin inscriptions are discovered every year, offering ... Target, Caesars Entertainment and 6 Other Stocks to Sell Short ...",,,,,2025-07-23 13:57:24.504702
,,2025-07-23 16:48:09+00:00,The News-Gazette,Perez Receives Honor For Latin America Book,,,,,,"https://www.thenews-gazette.com/article/11253,perez-receives-honor-for-latin-america-book","The News-Gazette | A weekly, family-owned newspaper serving Lexington, Buena Vista and Rockbridge County Virginia since 1801.",,https://static2.thenews-gazette.com/data/articles/xga-4x3-perez-receives-honor-for-latin-america-book-1753279968.jpg,,,2025-07-23 19:56:25.839026
,,2025-07-23 16:44:46+00:00,www.prnewswire.com,ALEJANDRO DUQUE TAKES ON DUAL ROLE AS PRESIDENT OF ADA & PRESIDENT OF WARNER MUSIC LATIN AMERICA,,,,,,https://www.prnewswire.com/news-releases/alejandro-duque-takes-on-dual-role-as-president-of-ada--president-of-warner-music-latin-america-302512181.html,"/PRNewswire/ -- It was announced today that accomplished leader Alejandro Duque has been named President of ADA, the independent distribution and label...",,https://mma.prnewswire.com/media/1686132/WMG_Black_Logo.jpg?p=facebook,,,2025-07-23 13:57:24.504702
,,2025-07-23 14:17:43+00:00,The Times of India,V's Slow Dancing Gets a Venezuelan Makeover - When K-pop Meets Latin Soul | - Times of India,,,,,,https://timesofindia.indiatimes.com/entertainment/k-pop/music/news/vs-slow-dancing-gets-a-venezuelan-makeover-when-k-pop-meets-latin-soul/articleshow/122861886.cms,"Discover how Venezuelan band GUACO beautifully remixes BTS member V's \""Slow Dancing\"" with their own track, creating a magical fusion of K-pop and Latin music. Dive into the world of musical collaboration and artistry!",,"https://static.toiimg.com/thumb/msid-122861918,width-1070,height-580,imgsize-29588,resizemode-75,overlay-toi_sw,pt-32,y_pad-40/photo.jpg",,,2025-07-23 13:57:24.504702
,,2025-07-23 13:48:25+00:00,senalnews.com,CANELA MEDIA SETS NEW BENCHMARK IN HISPANIC FAST STREAMING  - SEÑAL NEWS,,,,,,https://senalnews.com/en/digital/canela-media-sets-new-benchmark-in-hispanic-fast-streaming-,Canela's FAST ecosystem surpassed 6 million monthly viewing hours — an extraordinary 88% increase year-over-year from 3.2 million hours in June 2024.,,https://senalnews.com/adjuntos/imagenes/000/149/0000149364.jpg,,,2025-07-23 14:56:10.720516
,,2025-07-23 13:42:17+00:00,USA TODAY,"J Balvin talks 'Mixteip' album, fatherhood and taking it easy: 'Let life surprise me'",,,,,,https://www.usatoday.com/story/entertainment/music/2025/07/23/j-balvin-interview-mixteip/85304358007/,"J Balvin chats with USA TODAY about his latest release, the experimental ""Mixteip,"" as well as his family life with girlfriend Valentina Ferrer.",,"https://www.usatoday.com/gcdn/authoring/authoring-images/2025/07/22/USAT/85318781007-j-balvin-profile-story-promo.png?crop=1919,1079,x0,y0&width=1919&height=1079&format=pjpg&auto=webp",,,2025-07-23 10:56:14.474120
,,2025-07-23 13:34:38+00:00,CBS17.com,TEXAS-BASED SIMFLO EXPANDS OPERATIONS TO LATIN AMERICA,,,,,,https://www.cbs17.com/business/press-releases/cision/20250722DA35260/texas-based-simflo-expands-operations-to-latin-america,"SIMFLO appointed Leo Villanueva to lead Latin America expansion
LUBBOCK, Texas, July 22, 2025 /PRNewswire/ -- Lubbock, Texas-based SIMFLO, one of the nation's top providers of industrial, municipal, and commercial and agricultural-use vertical and submersible turbine pumps, has announced its expansion into the Latin American market with the appointment of Leo Villanueva as Sales Manager for Latin America, Mining, and Oil & Gas. This newly established role is designed to strengthen SIMFLO's presence and accelerate business growth in the Central and South American regions, while supporting the company's broader international expansion strategy.",,https://www.cbs17.com/wp-content/uploads/sites/29/2019/06/cropped-Browser-tab-logo.jpg?strip=1&w=250,,,2025-07-23 11:58:57.623235
,,2025-07-23 10:41:44+00:00,KWKT - FOX 44,AIRS Medical Accelerates SwiftMR™ Adoption in Latin America With Key Partnerships,,,,,,https://www.fox44news.com/business/press-releases/cision/20250723SF34496/airs-medical-accelerates-swiftmr-adoption-in-latin-america-with-key-partnerships,"CHICAGO, July 23, 2025 /PRNewswire/ -- AIRS Medical, creator of the AI-powered MRI enhancement solution SwiftMR, is expanding its global footprint through strategic partnerships and a surge in customer growth across Latin America. In the past six months alone, more than 150 imaging centers in Brazil have adopted SwiftMR, underscoring the region's increasing demand for faster, AI-enhanced MRI.",,https://mma.prnewswire.com/media/2457674/airs_logo_new_Logo.jpg?p=publish,,,2025-07-23 10:56:14.474120
,,2025-07-23 10:07:31+00:00,jamaica-star.com,Gothic teams up with Latin music stars | Entertainment - Jamaica Star,,,,,,https://jamaica-star.com/article/entertainment/20250723/gothic-teams-latin-music-stars,"Gothic chills with Latin artiste Don Pablo Mures (centre) and Empress Ann. Montego Bay-based dancehall artiste Gothic, making a ...",,,,,2025-07-23 06:58:33.106020
,,2025-07-23 04:33:58+00:00,www.prnewswire.com,TEXAS-BASED SIMFLO EXPANDS OPERATIONS TO LATIN AMERICA,,,,,,https://www.prnewswire.com/news-releases/texas-based-simflo-expands-operations-to-latin-america-302510981.html,"/PRNewswire/ -- Lubbock, Texas-based SIMFLO, one of the nation's top providers of industrial, municipal, and commercial and agricultural-use vertical and...",,https://mma.prnewswire.com/media/2736070/Simflo.jpg?p=facebook,,,2025-07-23 06:58:33.106020
,,2025-07-23 03:10:31+00:00,CHOSUNBIZ,"WONHO wraps successful Latin America tour, boosts global appeal through media interactions",,,,,,https://biz.chosun.com/en/en-entertainment/2025/07/23/KBLC2DA6JJAFJJT4PYNZN6RV3I/,"WONHO wraps successful Latin America tour, boosts global appeal through media interactions",,https://biz.chosun.com/resizer/v2/TZMDRWRVHGDIQYXMTHSNC2CWUU.jpg?auth=b914cd358cad685c4b4a1c526154c195133b9dd595035959c5d1233b40506ada&width=530&height=278&smart=true,,,2025-07-23 01:18:48.598701
,,2025-07-23 01:19:41+00:00,www.newsarticleinsiders.com,HYBE expands aggressively in Latin America - The Korea News Plus,,,,,,https://www.newsarticleinsiders.com/news/articleView.html%3Fidxno%3D3069,South Korea's leading entertainment company HYBE is making bold moves to expand its presence in the Latin American music market.,,,,,2025-07-22 21:56:14.661462
,,2025-07-23 00:30:00+00:00,Latin Times,"Ozzy Osbourne Dead at 76, Days After His Farewell Concert with Black Sabbath",,,,,,https://www.latintimes.com/ozzy-osbourne-dead-76-days-after-his-farewell-concert-black-sabbath-587340,"Legendary heavy metal icon Ozzy Osbourne has passed away at the age of 76, after a long battle with parkinsons, his family announced today",,https://d.latintimes.com/en/full/582024/ozzy-osbourne-dead-76-what-happened-last-concert.jpg,,,2025-07-22 21:56:14.661462
,,2025-07-22 22:57:30+00:00,UPI,Catholic clergy: ‘It is time to end this nonsense’ in Gaza - UPI.com,,,,,,https://www.upi.com/Top_News/World-News/2025/07/22/holy-family-church-news-conference/9781753221606/,The Catholic Church's Latin Patriarchate of Jerusalem called on regional and world leaders to end the violence in Gaza after Thursday's deadly church shelling.,,https://cdnph.upi.com/sv/ph/og/upi/9781753221606/2025/1/f6d425af04173d95265737fa466b2523/v1.5/Catholic-clergy-It-is-time-to-end-this-nonsense-in-Gaza.jpg,,,2025-07-22 21:56:14.661462
,,2025-07-22 22:35:14+00:00,Yahoo Entertainment,Fans Choose DANNA’s ‘Khe Calor’ as Their Favorite New Latin Music of the Week,,,,,,https://www.yahoo.com/entertainment/articles/fans-choose-danna-khe-calor-215622380.html,The Mexican star's new song generated more than 80% of the vote in the latest poll.,,https://s.yimg.com/ny/api/res/1.2/Hs2Mrh2HwII9Kbn9w.Jpuw--/YXBwaWQ9aGlnaGxhbmRlcjt3PTEyMDA7aD03OTQ7Y2Y9d2VicA--/https://media.zenfs.com/en/billboard_547/228655cff74ce66505303527433a160e,,,2025-07-22 18:56:19.987296
,,2025-07-22 22:27:29+00:00,www.miamiherald.com,Meet the winner of Miss Universe Latina. “I won because I showed my scars” - Miami Herald,,,,,,https://www.miamiherald.com/entertainment/article311191035.html,"... Entertainment. Meet the winner of Miss Universe Latina. “I won because I showed my scars”. By Sarah Moreno. July 22, 2025 5:51 PM. <style>.mcclatchy ...",,,,,2025-07-22 21:56:14.661462
,,2025-07-22 20:26:58+00:00,CW33 Dallas / Ft. Worth,Casa Brasa spices up Dallas with Latin-inspired cuisine,,,,,,https://cw33.com/a-taste-of-north-texas/food-and-drink/casa-brasa-spices-up-dallas-with-latin-inspired-cuisine/,"Casa Brasa, a Latin American-inspired steak and seafood restaurant, is set to open this summer at 8111 Preston Road, featuring prime cuts of beef, fresh-caught seafood, sushi, and a lively bar.",,https://cw33.com/wp-content/uploads/sites/8/2025/07/download_3a56ef.png?w=1280,,,2025-07-24 13:56:57.644426
,,2025-07-22 19:43:22+00:00,Remezcla,"Meet Marie Leguizamo, the Latina Shaping How Latin Americans Are Seen on Screen",,,,,,https://remezcla.com/features/film/interview-marie-leguizamo-latina-banijay-mexico-us-hispanic/,"Marie Leguizamo is the Managing Director for Banijay Mexico & US Hispanic, which focuses on creating content in both English & Spanish.",,https://remezcla.com/wp-content/uploads/sites/3/2025/07/Marie-Leguizamo.jpg,,,2025-07-22 15:56:47.747651
,,2025-07-22 19:35:09+00:00,CaloNews.com,Free Ivy Queen concert in downtown LA,,,,,,https://www.calonews.com/news/entertainment/free-ivy-queen-concert-in-downtown-la/article_aaa5fca3-f2bc-47af-a255-c00251282885.html,"The Queen of Reggaeton, Ivy Queen, will be performing live at Pershing Square in a free concert.",,https://bloximages.chicago2.vip.townnews.com/calonews.com/content/tncms/assets/v3/editorial/c/0b/c0b4dce8-843b-45f7-b17f-df1ad2beb5bd/687fc6de4178b.image.jpg?crop=895%2C470%2C22%2C0,,,2025-07-23 06:58:33.106020
,,2025-07-22 19:20:39+00:00,The Fandomentals,New Marvel's Voices Special White Tiger Reborn Celebrates The Legacy Of Marvel's First Latin Hero - The Fandomentals,,,,,,https://www.thefandomentals.com/new-marvels-voices-special-white-tiger-reborn-celebrates-the-legacy-of-marvels-first-latin-hero/,Marvel Comics will celebrate Hispanic and Latin American Heritage Month this year by spotlighting Marvel Comics’ first Latin Super Hero in White Tiger Reborn,,https://www.thefandomentals.com/wp-content/uploads/2025/07/Untitled-design-2025-07-22T082502.102.png,,,2025-07-22 17:56:29.811025
,,2025-07-22 17:50:48+00:00,Media Play News,Canela Media Announces Its FAST Channels Have Surpassed 6M Monthly Viewing Hours - Media Play News,,,,,,https://www.mediaplaynews.com/canela-media-announces-its-fast-channels-have-surpassed-6m-monthly-viewing-hours/,"Hispanic content streaming company Canela Media has announced record-breaking growth across its portfolio of FAST (Free Ad-Supported Streaming Television) channels serving both U.S. Hispanic and Latin American audiences. In June 2025 alone, Canela’s FAST ecosystem surpassed 6 million monthly viewing hours — a 88% increase year-over-year from 3.2 million hours in June 2024. “Our FAST … Continue reading ""Canela Media Announces Its FAST Channels Have Surpassed 6M Monthly Viewing Hours""",,https://www.mediaplaynews.com/wp-content/uploads/2025/01/Canela-Media.jpg,,,2025-07-22 14:57:12.005899
,,2025-07-22 17:00:36+00:00,HISTORY,‘Rosebud’: The ‘Citizen Kane’ Mystery Explained,,,,,,https://www.history.com/articles/rosebud-citizen-kane-meaning,It's the core enigma of Orson Welles' movie masterpiece. ,,"https://res.cloudinary.com/aenetworks/image/upload/c_fill,w_1200,h_630,g_auto/dpr_auto/f_auto/q_auto:eco/v1/2BFA8PJ_f96hwv?_a=BAVAZGDX0",,,2025-07-22 14:57:12.005899
,,2025-07-22 16:31:33+00:00,www.montecitojournal.net,Going South - Montecito Journal,,,,,,https://www.montecitojournal.net/2025/07/22/going-south-2/,"Going South. By Steven Libowitz | July 22, 2025. The Latin Grammy-winning guitarist Twanguero is coming to the Ventura Music ...",,,,,2025-07-22 14:57:12.005899
,,2025-07-22 16:25:14+00:00,Noticias Newswire - Hispanic Press Release Distribution Wire Service,21 Events Presents: The Puerto Rico Day,,,,,,https://www.noticiasnewswire.com/21-events-presents-the-puerto-rico-day/,21 Events Presents: The Puerto Rico Day at The Ballpark at Major League Stadiums,,https://www.noticiasnewswire.com/wp-content/uploads/2025/07/featured-image-07221.jpg,,,2025-07-22 17:56:29.811025
,,2025-07-22 16:05:38+00:00,KWKT - FOX 44,"Latin America's Largest Market, Brazil, Awards Platts Dated Brent and Nine Other Platts Benchmarks as the Basis of its Royalty Calculations",,,,,,https://www.fox44news.com/business/press-releases/cision/20250722NY35194/latin-americas-largest-market-brazil-awards-platts-dated-brent-and-nine-other-platts-benchmarks-as-the-basis-of-its-royalty-calculations,"LONDON and NEW YORK and SINGAPORE and SÃO PAULO, July 22, 2025 /PRNewswire/ -- Latin America's largest market, Brazil, has again awarded the benchmarks of Platts, part of S&P Global Commodity Insights, as the pricing reference in its calculations of the nation's oil and gas royalty payments on the gross revenue of producing fields. This is the second consecutive commitment by Brazilian National Agency of Petroleum, Natural Gas and Biofuels (Portuguese: Agência Nacional do Petróleo, Gás Natural e Biocombustíveis – ANP), the government agency responsible for the regulation of Brazil's oil sector, after its 2020 award, to utilize the Platts benchmarks in its calculations under its current open bidding process and will maintain the key reference position for Platts until at least 2035.",,https://mma.prnewswire.com/media/360700/SP_Global_Commodity_Logo.jpg?p=publish,,,2025-07-22 18:56:19.987296
,,2025-07-22 15:58:25+00:00,The Tab,"Um, I'm losing my mind over this video of Harrison from Love Island with long hair?!",,,,,,https://thetab.com/2025/07/22/um-im-losing-my-mind-over-this-video-of-harrison-from-love-island-with-long-hair,He looks SO different,,https://cdn.thetab.com/wp-content/uploads/2025/07/22121420/Hayley-2025-07-22T121359.845.png,,,2025-07-22 14:57:12.005899
,,2025-07-22 15:50:19+00:00,Encyclopedia Britannica, Why was Amy Winehouse not allowed in the U.S.?  | Britannica,,,,,,https://www.britannica.com/question/Why-was-Amy-Winehouse-not-allowed-in-the-U-S, Why was Amy Winehouse not allowed in the U.S.?   Amy Winehouse was denied a visa to enter the United States on several occasions. Issues of drug use ,,https://cdn.britannica.com/27/154727-050-FAEF8943/Amy-Winehouse.jpg,,,2025-07-22 13:08:54.706640
,,2025-07-22 15:25:04+00:00,UPI,Latin America positions itself as a global green hydrogen leader by 2050 - UPI.com,,,,,,https://www.upi.com/Top_News/World-News/2025/07/22/chile-hydrogen-plant-development/7051753195871/,"With more than 200 projects being developed in several counties, Latin America is positioning itself as a key player in the low-emissions hydrogen market.",,https://cdnph.upi.com/sv/ph/og/i/7051753195871/2025/1/17531972286275/v1.5/Latin-America-positions-itself-as-a-global-green-hydrogen-leader-by-2050.jpg,,,2025-07-22 13:08:54.706640
,,2025-07-22 15:11:59+00:00,The Tab,Drag Race queens call out the show for repeatedly not crowning a Latin winner,,,,,,https://thetab.com/2025/07/22/drag-race-queens-call-out-the-show-for-repeatedly-not-crowning-a-latin-winner,'There has been one Latin winner of Drag Race in 27 seasons',,https://cdn.thetab.com/wp-content/uploads/2025/07/22155139/unnamed-2219.jpg,,,2025-07-22 13:08:54.706640
,,2025-07-22 14:43:53+00:00,Latin Post,Entertainment Music Venezuelan Artist Nacho Reveals Chyno's Label Struggles and Announces New Music with Fer Ariza: 'I'm Free Now' - EXCLUSIVE,,,,,,https://www.latinpost.com/articles/166025/20250722/entertainment-music-venezuelan-artist-nacho-reveals-chynos-label-struggles-announces-new-music.htm,"The Venezuelan artist released a new song with his Colombian colleague Fer Ariza, and has big plans for the coming months. Nacho remains at the forefront of Latin music.",,https://d.latinpost.com/en/full/1725612/nacho-fer-ariaza-launch-love-pa-ti-no-hay.jpg,,,2025-07-22 14:57:12.005899
