published,outlet,title,description,category,market,categoryorder,articleorder,authors,image,url,firstEyes
2025-03-06 10:58:17+00:00,impactalpha.com,"Investment Analyst, Latin America & Caribbean - ImpactAlpha","... Latin America and the Caribbean. You will play a crucial role in ... entertainment, the winner is…. Features | David Bank. Asset managers ...",,,,,,,https://impactalpha.com/job/investment-analyst-latin-america-caribbean-2/,2025-03-06 07:00:12.201575
2025-03-06 10:54:50+00:00,TechCrunch,Prime Video tests AI dubbing for select movies and TV series | TechCrunch,"Prime Video is now experimenting with AI-assisted dubbing for select licensed movies and TV shows, as announced by the Amazon-owned streaming service on Prime Video is now experimenting with AI-assisted dubbing for select licensed movies and TV shows",,,,,,https://techcrunch.com/wp-content/uploads/2025/03/prime-video-aidubbing-.jpeg?w=1200,https://techcrunch.com/2025/03/05/prime-video-tests-ai-dubbing-for-select-movies-and-tv-series/,2025-03-06 07:00:12.201575
2025-03-06 10:45:55+00:00,The Stanford Daily,Farm fresh jazz (notes from a saxophonist): SJO recap and SALJE preview,Penelope Keep ’28 offers backstage memories from Stanford Jazz Orchestra's concert last week and previews an energetic jazz show to come.,,,,,,https://stanforddaily.com/wp-content/uploads/2025/03/unnamed-1.jpg,https://stanforddaily.com/2025/03/05/farm-fresh-jazz-notes-from-a-saxophonist-sjo-recap-amp-salje-preview/,2025-03-06 07:00:12.201575
2025-03-06 10:36:55+00:00,Digital Music News,Discovery to Proceed in Drake v. Universal Music Lawsuit,"Discovery is proceeding in the high-stakes Drake v. Universal Music lawsuit, which the major label is looking to dismiss.",,,,,,https://www.digitalmusicnews.com/wp-content/uploads/2025/03/Drake-Discovery.jpg,https://www.digitalmusicnews.com/2025/03/05/drake-universal-music-lawsuit-discovery/,2025-03-06 07:00:12.201575
2025-03-06 10:26:12+00:00,ABS-CBN,"BINI Reveals ""Blink Twice"" Latin Artist Collaboration on Tiktok | ABS-CBN Entertainment","Dubbed as the ""Dos Veces Remix"", the track features popular Spanish-Mexican singer-actress Belinda.",,,,,,https://od2-image-api.abs-cbn.com/prod/20250306000336/7c9a5729dcab59f3c64cbc07d0cddd6addabade3398fd3991a34b948f5014cbc.png?w=1200&h=800,https://www.abs-cbn.com/entertainment/studios/music/2025/3/6/bini-reveals-blink-twice-latin-artist-collaboration-on-tiktok-0920,2025-03-06 07:00:12.201575
2025-03-06 09:52:35+00:00,Engadget,Prime Video is beginning an AI dubbing pilot program for select movies and series,Amazon is testing a way to use AI to help generate dubs for select shows on Prime Video.,,,,,,https://s.yimg.com/ny/api/res/1.2/lKaT6VBEuUlH4RQi4KNCjQ--/YXBwaWQ9aGlnaGxhbmRlcjt3PTEyMDA7aD02NzU-/https://s.yimg.com/os/creatr-uploaded-images/2025-03/eed57ad0-f9f0-11ef-967d-5d922a78298c,https://www.engadget.com/entertainment/streaming/prime-video-is-beginning-an-ai-dubbing-pilot-program-for-select-movies-and-series-190252188.html,2025-03-06 07:00:12.201575
2025-03-06 09:00:33+00:00,Salsa and spins at the Buskirk-Chumley - Indiana Daily Student,Salsa and spins at the Buskirk-Chumley,Latin Jazz Ensemble performs at the Buskirk-Chumley Theatre.,,,,,,https://snworksceo.imgix.net/ids/3f127307-a46a-44bf-bd82-b2eb6d675789.sized-1000x1000.jpg?w=800&h=600,https://www.idsnews.com/article/2025/03/salsa-and-spins-at-the-buskirk-chumley-latin-jazz-music-dance,2025-03-06 07:00:12.201575
2025-03-06 08:54:31+00:00,English Version - Periódico Digital Centroamericano y del Caribe,"Following US Lead, Canada Designates 7 Latin American Criminal Groups as Terrorist Entities",U.S. border patrol statistics show that less than 1% of all fentanyl seized is found at the northern border. But Canadian officials have expressed a ...,,,,,,https://newsinamerica.com/en/wp-content/uploads/2025/03/Following-US-Lead-Canada-Designates-7-Latin-American-Criminal-Groups-as-Terrorist-Entities.webp,https://newsinamerica.com/en/headlinenews/2025/following-us-lead-canada-designates-7-latin-american-criminal-groups-as-terrorist-entities/,2025-03-06 07:00:12.201575
2025-03-06 08:45:02+00:00,Billboard,"How Marketing Agency 9F Plans Creative Campaigns for Stars Like Bad Bunny, Karol G & Beyoncé","Juan from 9F has directed the campaigns for the releases of Beyoncé's 'Renaissance' and 'Cowboy Carter,' Bad Bunny's 'Un Verano Sin Ti' and more.",,,,,,https://www.billboard.com/wp-content/uploads/2025/03/Juan-Martin-Salazar-9F-Agency-CEO-cr-Valentino-Summo-billboard-1548.jpg?w=1024,https://www.billboard.com/music/latin/9f-marketing-agency-bad-bunny-karol-g-1235915042/,2025-03-06 07:00:12.201575
2025-03-06 08:31:24+00:00,manchester.inklink.news,"Weekly Entertainment Report March 6-9: Lively arts, music, shows in Southern NH","... music in the style of Count Basie to Duke Ellington, plus your favorite pop, funk, and Latin selections. They have plenty of music for everyone ...",,,,,,,https://manchester.inklink.news/weekly-entertainment-report-march-6-9-lively-arts-music-shows-in-southern-nh/,2025-03-06 07:00:12.201575
2025-03-06 08:30:34+00:00,www.papermag.com,Nathy Peluso Gives Us Nostalgic 'Erotika',Did you feel like you were bridging the gap between traditional Latin music and new wave? Yes. I am always looking to show people what I love and ...,,,,,,,https://www.papermag.com/nathy-peluso-erotika,2025-03-06 07:00:12.201575
2025-03-06 07:16:20+00:00,www.prensario.net,"CoProduction Salon Connects Entertainment Media Leaders at FOMEX, Riyadh, Fueling Growth in MENA’s Thriving Entertainment Sector"," Hosted by the Saudi Broadcasting Authority, the Salon (Arabic for “lounge”) established its position as the main platform connecting global media leaders with the MENA region’s rapidly expanding entertainment industry.",,,,,,https://www.prensario.net/Multimedios/imgs/65223_750.jpg?v=3,https://www.prensario.net/CoProduction-Salon-Connects-Entertainment-Media-Leaders-at-FOMEX-Riyadh-Fueling-Growth-in-MENAs-Thriving-Entertainment-Sector-48353.note.aspx,2025-03-06 07:00:12.201575
2025-03-06 05:50:56+00:00,Westerly Sun,Picks of the Week March 6,"Thursday, March 6",,,,,,https://bloximages.newyork1.vip.townnews.com/thewesterlysun.com/content/tncms/assets/v3/editorial/8/06/8063da0e-f867-11ef-befd-a70583297621/67c60606903d4.image.jpg?crop=960%2C504%2C0%2C227,https://www.thewesterlysun.com/lifestyle/entertainment/picks-of-the-week-march-6/article_f46bedf8-f536-11ef-8262-4b5867a9d33b.html,2025-03-06 07:00:12.201575
2025-03-06 05:26:00+00:00,CHOSUNBIZ,NMIXX Captivates Latin America with Successful Concert Tour,NMIXX Captivates Latin America with Successful Concert Tour,,,,,,https://biz.chosun.com/resizer/v2/UR4RB43JA2UNTNOJ3RT4GI3RXI.jpg?auth=6b04d8e816d274f22700f29d2e966be116c12663e385da16224ae2852f3e0082&width=650&height=341&smart=true,https://biz.chosun.com/en/en-entertainment/2025/03/06/LAM5Y4FPSBET7B3G3IAEFMKNPI/,2025-03-06 07:00:12.201575
2025-03-06 05:18:13+00:00,BET,Savoring Black Excellence: A Culinary Tour Through Baltimore’s Black-Owned Eateries,"From rotisserie chicken with a Parisian twist to Afro-Latin empanadas, Baltimore’s Black-owned restaurants are shaping the city’s food scene. Visit Baltimore spotlighted these culinary gems as part of CIAA's festivities.",,,,,,https://images.paramount.tech/uri/mgid:arc:imageassetref:shared.bet.us:12b361bc-9421-4a34-b0f0-6d074c15708b?quality=0.7&gen=ntrn&format=jpg&width=1200&height=630&crop=true,https://www.bet.com/article/b5m852/savoring-black-excellence-a-culinary-tour-through-baltimores-black-owned-eateries,2025-03-06 07:00:12.201575
2025-03-06 04:44:31+00:00,www.businesswire.com,TelevisaUnivision and DIRECTV Announce a New Multi-Year Agreement for Most-Watched ...,"TelevisaUnivision and DIRECTV Announce a New Multi-Year Agreement for Most-Watched Spanish-Language News, Sports, and Entertainment in the U.S.. MIAMI ...",,,,,,,https://www.businesswire.com/news/latinowire/20250305415993/en,2025-03-06 07:00:12.201575
2025-03-06 03:50:22+00:00,latv.com,Iván Cornejo: The New Face of Mexican Music Hits SXSW & Coachell - LATV,"Suddenly, 'Alma Vacía' was sitting at #2 on the Billboard Regional Mexican Albums chart and #7 on the Top Latin Albums chart. The New York Times even ...",,,,,,,https://latv.com/who-is-ivan-cornejo/,2025-03-06 07:00:12.201575
2025-03-06 03:15:32+00:00,GlobeNewswire News Room,"Location-Based Entertainment (LBE) Industry Report 2025: Revenues to Exceed $15.3 Billion by 2029, Led by Microsoft, Google, Meta, Unity Technologies, and Nvidia","Dublin, March  05, 2025  (GLOBE NEWSWIRE) -- The ",,,,,,https://ml.globenewswire.com/Resource/Download/908fb457-7f8e-4a08-9081-5565e3dfb3d7,https://www.globenewswire.com/news-release/2025/03/05/3037522/0/en/Location-Based-Entertainment-LBE-Industry-Report-2025-Revenues-to-Exceed-15-3-Billion-by-2029-Led-by-Microsoft-Google-Meta-Unity-Technologies-and-Nvidia.html,2025-03-06 07:00:12.201575
2025-03-06 00:12:22+00:00,www.houstonchronicle.com,Selena's purple Houston Rodeo jumpsuit is a piece of fashion history,"Entertainment//Selena ... It not only marked the zenith of Selena's trajectory as the vanguard of Tejano music, it solidified her place among Latin ...",,,,,,,https://www.houstonchronicle.com/entertainment/selena/article/selena-purple-jumpsuit-houston-rodeo-fabric-muse-20195712.php,2025-03-06 07:00:12.201575
2025-03-05 21:41:34+00:00,www.streetinsider.com,Xtreme One Entertainment Invited to Participate in the 37th Annual ROTH Investor Conference,"worldwide, including over 50 televised professional MMA events spanning hundreds of fights in the U.S. and Latin America produced since 2006.",,,,,,,https://www.streetinsider.com/Press%2BReleases/Xtreme%2BOne%2BEntertainment%2BInvited%2Bto%2BParticipate%2Bin%2Bthe%2B37th%2BAnnual%2BROTH%2BInvestor%2BConference/24454669.html,2025-03-06 07:00:12.201575
2025-03-05 18:27:32+00:00,cw33.com,New Latin-inspired eatery Gigi's Bar & Lounge to open in Plano - CW33.com,"Guests can expect a nightly entertainment lineup, with live music and DJ sets from 8 p.m. to 2 a.m. Additionally, Gigi's will host three signature ...",,,,,,,https://cw33.com/a-taste-of-north-texas/food-and-drink/gigis-bar-lounge-plano/,2025-03-05 15:36:34.432065
2025-03-05 18:01:17+00:00,Billboard,How Grupo Frontera Is Repping the Border and Making Mexican Music Pop,"Grupo Frontera share their tour ambitions, talk TikTok, songs and what's next.",,,,,,https://www.billboard.com/wp-content/uploads/2025/03/cover-groupo-frontera-billboard-espanol-2025-bb4-jasmine-archie-8-1260.jpg?w=1024,https://www.billboard.com/music/latin/grupo-frontera-sxsw-billboard-cover-1235914782/,2025-03-05 15:36:34.432065
2025-03-05 15:09:03+00:00,vestaviavoice.com,ASC Presents: Alex Cuba - VestaviaVoice.com,"Alex Cuba creates genre-bending Latin music based on folk and popular traditions. Alex Cuba has released 9 albums to date and won a Grammy award, ...",,,,,,,https://vestaviavoice.com/events/asc-presents-alex-cuba/%3Focc_dtstart%3D2025-04-03T19:00,2025-03-05 15:36:34.432065
2025-03-05 13:02:09+00:00,Los Angeles Times,"Rancho Humilde, Sony will collaborate on music label's feature film debut 'Clika'","Music mogul Jimmy Humilde's record label Rancho Humilde is teaming up with Sony to release the film ""Clika"" on Aug. 15",,,,,,https://ca-times.brightspotcdn.com/dims4/default/1a2202a/2147483647/strip/true/crop/6720x3528+0+0/resize/1200x630!/quality/75/?url=https%3A%2F%2Fcalifornia-times-brightspot.s3.amazonaws.com%2F08%2F30%2F166558b54e58bb93c8af874ca97b%2Fla-photos-1staff-769278-et-0510-rancho-humilde-cmh-09.JPG,https://www.latimes.com/delos/story/2025-03-04/jimmy-humilde-rancho-humilde-sony-pictures-clika-sony-music,2025-03-05 15:36:34.432065
2025-03-05 12:22:19+00:00,www.sonymusic.com,"Top Latin Record Label Rancho Humilde, Sony Music Latin, and Sony's Columbia Pictures ...","Alex Gallardo, President, Sony Music US Latin quote: “We are very excited to be part of this film alongside Rancho Humilde and Sony Pictures. Jimmy ...",,,,,,,https://www.sonymusic.com/sonymusic/rancho-humilde-columbia-pictures-clika/,2025-03-05 15:36:34.432065
2025-03-05 08:14:59+00:00,www.abqjournal.com,The Albuquerque Journal Events - Severo Y Grupo Fuego,"Latin superstar Severo, brings cumbia flavor with a touch of tropical rhythm to the Latin music genre. His style is very versatile, ...",,,,,,,https://www.abqjournal.com/local-events/%3F_evDiscoveryPath%3D/event/106262166n-severo-y-grupo-fuego,2025-03-05 15:36:34.432065
