id,name,published,outlet,title,authors,category,market,categoryorder,articleorder,url,description,text,image,error,sentiment,firstEyes
,,2025-07-03 15:01:46+00:00,BioEnergy Times,North Dakota working on first integrated jet fuel plant from bioethanol - BioEnergy Times,Vivek Waghmode,,,,,https://bioenergytimes.com/north-dakota-working-on-first-integrated-jet-fuel-plant-from-bioethanol/,"Fedorchak’s visit came months after Gevo Inc., a Colorado-based sustainable fuel company, purchased the plant for approximately $210 million.
The company announced it plans to add a new on-site facility to convert ethanol into sustainable aviation fuel.
The company had originally planned a sustainable aviation fuel plant in Lake Preston, South Dakota, but when that site failed to secure permits, Gevo turned its attention to Richardton.
If completed ahead of Gevo’s South Dakota plant, the Richardton facility could become the first fully integrated sustainable aviation fuel plant in the United States.
“By blending biofuel with petroleum jet fuel, not only do you stretch fuel supply, but you also reduce overall emissions.” The blended fuel typically contains 10–50% sustainable aviation fuel, depending on current regulations.","Richardton, N.D: North Dakota Congresswoman Julie Fedorchak visited the Red Trail Energy bioethanol and carbon sequestration facility in Richardton on Monday, marking a significant moment for the future of sustainable energy in the state, reports AGWeek.

Fedorchak’s visit came months after Gevo Inc., a Colorado-based sustainable fuel company, purchased the plant for approximately $210 million. The company announced it plans to add a new on-site facility to convert ethanol into sustainable aviation fuel.

The acquisition was first revealed in September 2024. Red Trail Energy shareholders approved the sale in December, and the deal was finalized in February 2025.

Fedorchak, who co-chairs the Congressional Biofuels Caucus, met with Gevo representatives to discuss biofuel production, project timelines, carbon capture, and how energy and agriculture can work together. In a conversation with The Dickinson Press, she voiced strong support for the initiative.

“North Dakota’s economy is rooted in agriculture,” Fedorchak said. “We need to find better and higher value uses for our crops. Biofuels represent a major opportunity, especially now when the world is demanding more energy with lower carbon emissions.”

Gevo, founded in 2005, focuses on developing sustainable, low-carbon alternatives to traditional petroleum-based fuels. The company had originally planned a sustainable aviation fuel plant in Lake Preston, South Dakota, but when that site failed to secure permits, Gevo turned its attention to Richardton.

Chris Ryan, Gevo’s president and COO, said the Richardton location was ideal due to its existing infrastructure, access to local agriculture, and an operational carbon capture system.

“We wanted a site that aligns with our strategy and could move quickly. Richardton checked every box,” Ryan said.

If completed ahead of Gevo’s South Dakota plant, the Richardton facility could become the first fully integrated sustainable aviation fuel plant in the United States. Currently, the plant produces 65 million gallons of ethanol annually using 23 million bushels of corn. It also sells by-products like distillers grains, animal feed syrup, and corn oil.

The site already hosts the country’s first carbon storage project permitted under state regulations.

“The team running the plant is very efficient,” Ryan said. “We don’t plan on changing that.”

Gevo’s planned facility would convert the plant’s ethanol output directly into jet fuel on-site.

“That’s our main focus—producing sustainable aviation fuel from the ethanol already being made there,” Ryan added.

The project is expected to create around 50 permanent jobs, along with many more during the construction phase.

Stark County Commission Chairman Neal Messer, a Richardton native and grain farmer, welcomed the project, saying it would bring added value to local crops and support rural communities.

“This is a win for farmers. It lets smaller towns like Richardton grow and prosper,” Messer said.

He also confirmed receiving payments for carbon storage beneath his land and said he’s optimistic about the project’s agricultural impact, believing it would allow farmers to expand and diversify.

The aviation industry is under growing pressure to cut emissions. In 2021, the International Air Transport Association pledged to reach net-zero carbon emissions by 2050, with sustainable aviation fuel expected to account for 65% of that reduction and carbon capture for another 19%.

“Airlines are looking for lower-carbon fuel options,” Ryan said. “By blending biofuel with petroleum jet fuel, not only do you stretch fuel supply, but you also reduce overall emissions.”

The blended fuel typically contains 10–50% sustainable aviation fuel, depending on current regulations. Ryan believes that 100% sustainable aviation fuel could become more common in the future.

However, not everyone agrees on the benefits. The World Resources Institute (WRI) has raised concerns that sustainable aviation fuel may not significantly reduce emissions, pointing to the need for more farmland and the loss of carbon-absorbing grasslands—issues particularly relevant in North Dakota’s landscape.

Ryan responded that no major land-use changes are expected, since the ethanol plant has been operating for years. He also acknowledged the potential for increased corn production but said local farmers are ready.

“We asked our suppliers if they could grow more corn, and they said yes,” Ryan said.

Critics have also pointed out that the ethanol-to-jet fuel conversion ratio—1.7 gallons of ethanol to 1 gallon of jet fuel—is inefficient. Ryan countered that the process actually concentrates energy by removing water, improving energy content.

On carbon sequestration, environmental groups have raised safety concerns, including potential leaks into groundwater. Gevo officials said they are taking steps to reduce those risks.

As the Richardton project moves forward, it reflects both the promise and the complexity of transitioning to cleaner energy while supporting rural economies.",https://bioenergytimes.com/wp-content/uploads/2025/05/Ethanol-1.jpeg,N,,2025-07-03 13:13:52.151478
,,2025-07-03 14:59:06+00:00,www.resourcewise.com,Food vs Fuel: Feeding and Powering the Future - ResourceWise,Harvey Greer,,,,,https://www.resourcewise.com/blog/food-vs-fuel-feeding-and-powering-the-future,"But every liter of renewable fuel or ethanol needs a feedstock to power it.
Should we use food crops or croplands for fuel when global hunger remains a fundamental problem?
Scholars now frame the dilemma as a food energy ecosystem.
When people ask what foods are fuel, the answer spans first-generation and emerging candidates: Crop or Source Fuel Route Notes These examples highlight why food is more than just fuel.
Food vs Fuel Pros and Cons Below is a concise look at commonly cited food vs fuel pros and cons: Dimension Pros (Fuel Perspective) Cons (Food Perspective) Charting a Smarter Biofuel Future Global food challenges continue to influence the production of biofuels.","Biofuels have raced from the margins to the mainstream. The International Energy Agency projects that global demand for transport biofuels will climb 23 percent to roughly 200 billion liters by 2028—a scale big enough to shave millions of tons off net greenhouse-gas emissions.

At the same time, the advanced biofuel market is also experiencing intensive growth. Forecasts call for continued rapid expansion over the next several years.

But every liter of renewable fuel or ethanol needs a feedstock to power it. When that feedstock is corn, sugarcane, soy, or rapeseed that could have been somebody's dinner, we collide with several questions:

How do we decide whether this crop is food or fuel?

How do we decide food vs fuel for a cropland?

Should we use food crops or croplands for fuel when global hunger remains a fundamental problem?

This post unpacks what is the food vs fuel debate, why it matters to climate and human well-being, and where the science is pointing for a balanced path forward.

What Is Food vs Fuel?

At its core, the debate asks whether scarce agricultural land, water, and other inputs should be used to grow calories for people or hydrocarbons for engines.

The issue exploded during the 2007-2008 food-price spike, when rising biofuel mandates and commodity speculation pushed grain prices to record highs. The backlash sparked riots in more than thirty countries.

Scholars now frame the dilemma as a food energy ecosystem. The aim is to drive a holistic stewardship of land, carbon, and livelihoods.

With this in mind, what does it mean when food is a fuel? It means the same kernel of corn can power an SUV or nourish a child.

Converting corn to sustainable fuel delivers renewable energy and rural income. At the same time, it diverts cropland and may trigger indirect land-use change (ILUC)—for example, pasture converted to soy in one region pushes ranchers to clear forests elsewhere.

The International Food Policy Research Institute (IFPRI) notes that US corn used for ethanol ballooned from 54 million tons in 2006-2007 to 127 million tons by 2011-2012. This shift marks over 40 percent of total harvest to ethanol at its peak.

Unsurprisingly, these reallocations rippled through food markets worldwide.

What Foods Are Fuel?

When people ask what foods are fuel, the answer spans first-generation and emerging candidates:

Crop or Source

Fuel Route

Notes

These examples highlight why food is more than just fuel. It is culture, nutrition, and security. These values all argue for directing edible biomass to plates first.

Food vs Fuel Pros and Cons

Below is a concise look at commonly cited food vs fuel pros and cons:

Dimension

Pros (Fuel Perspective)

Cons (Food Perspective)

Charting a Smarter Biofuel Future

Global food challenges continue to influence the production of biofuels. Despite their historic rise over the last decade and a half, their adoption should never interfere with anyone's access to food.

But from that same human-centric position, the rise of biofuels comes due to the imminent existential threat of climate change. The faster we adopt biofuels and deploy them to replace fossil fuels, the better.

Between these two points in food-vs-fuel lies a tension. Do we risk food shortages and world hunger to power the world on renewables? Or do we risk climate disaster by slowing down feedstock crops to produce food?

Fortunately, technology is rewriting the playbook and finding ingenious solutions to this issue.

Second- and third-generation processes turn waste oils, landfill gas, agricultural residues, and even algae into drop-in fuels at a commercial scale. Global demand growth is now projected to be led by renewable diesel and sustainable aviation fuel (SAF) made primarily from non-food feedstocks.

Continuous R&D, carbon-smart farming, and yield-boosting ag-genomics mean we don't have to choose between energy and food. Both issues can be better addressed simultaneously.

So, what is food vs fuel in 2025? It is no longer a zero-sum fight but a design challenge. Innovate so that kilns, cook-tops, and car engines run on carbon-light molecules while fields keep feeding a population on track for 9.7 billion by 2050.

The food vs fuel debate will stay with us for now. But its future chapters will be written through cooperative integration of technology and innovation that both nourish people and power progress.

Subscribe to the ResourceWise blog and newsletter to never miss a beat on what's happening in the biofuels market. Sign up today.",https://www.resourcewise.com/hubfs/images-and-graphics/blog/esg/2025/07-2025/food-vs-fuel-biofuel-crops.jpg,N,,2025-07-03 14:11:19.911253
,,2025-07-03 14:53:05+00:00,AGN,Bangkok Airlines officially introduces SAF on commercial flights - Aerospace Global News,Chloe Greenbank,,,,,https://aerospaceglobalnews.com/news/bangkok-airways-officially-introduces-saf-refuellings/,"Subscribe Bangkok Airways has announced it is refuelling with sustainable aviation fuel (SAF) on commercial flights departing from the Thai capital.
Despite the blend being initially just 1% SAF combined with 99% jet fuel, “the official use of SAF on commercial flights marks a significant milestone in the airline’s transition toward a more environmentally friendly future,” said Captain Puttipong Prasarttong-Osoth, President of Bangkok Airways.
Bangkok Airways’ low carbon journey The regional carrier first refuelled with SAF on a pilot flight operating between Samui and Bangkok in 2024.
In addition to refuelling with SAF, the airline has implemented other measures to reduce emissions, including more efficient aviation fuel use.
In 2023 Thailand’s flag carrying airline, Thai Airways operated its first flights using SAF produced by Neste and supplied by PTT.","Sign up for our newsletter and get our latest content in your inbox.

Subscribe

Bangkok Airways has announced it is refuelling with sustainable aviation fuel (SAF) on commercial flights departing from the Thai capital.

The regional carrier, which primarily serves destinations across Thailand as well as China and the Maldives, is now uplifting SAF on flights departing from Bangkok (Suvarnabhumi Airport) to international destinations including Phnom Penh, Siem Reap, Luang Prabang and the Maldives.

Despite the blend being initially just 1% SAF combined with 99% jet fuel, “the official use of SAF on commercial flights marks a significant milestone in the airline’s transition toward a more environmentally friendly future,” said Captain Puttipong Prasarttong-Osoth, President of Bangkok Airways.

According to the airline this blend will help reduce emissions by an average of approximately 128 kg of CO2 per flight. It is also in keeping with Thailand’s proposed introduction of a SAF mandate at a 1% blend from 2026. This is expected to increase to 3 per cent in 2030 and 8 % by 2037.

By comparison, the UK’s SAF mandate, which was introduced on 1 January 2025, starts at 2 % of total UK jet fuel demand, increasing linearly to 10% in 2030 and then to 22% in 2040. It could deliver up to 6.3 megatonnes of carbon savings per year by 2040.

Bangkok Airways’ low carbon journey

The regional carrier first refuelled with SAF on a pilot flight operating between Samui and Bangkok in 2024. The fuel was supplied by PTT Oil and Retail Business Public Company (OR) and in May of this year, the airline signed a Letter of Intent with OR as part of its Low Carbon Skies initiative to use SAF produced domestically in Thailand.

In addition to refuelling with SAF, the airline has implemented other measures to reduce emissions, including more efficient aviation fuel use. The airline also prides itself on actively contributing to the sustainable growth of Thailand’s aviation industry.

It is “committed to evolving into a truly sustainable airline,” guided by its Environmental, Social and Governance (ESG) framework. Other areas it is investing in to decarbonise is more efficient waste management and use of resources as well as the broader adoption of alternative energy sources.

How aviation stakeholders in Thailand are scaling SAF supply and demand

In March, 2025 the Thai government through the Ministry of Industry (MoI) announced it is partnering with six local companies and their affiliates to establish a waste cooking oil-based SAF feedstock supply chain. The initiative also aims to raise public awareness and participation through campaigns, education and network-building.

In May, one of the six companies the Thai government is partnering with – Bangchak Group – announced the launch of its first SAF production plant at the Bangchak Phra Khanong Refinery in Bangkok. The facility will produce 100% neat SAF with an initial production capacity of 1m litres per day. Confirmed customers include Shell Eastern Trading in Singapore and Japan’s Cosmo Oil.

In 2023 Thailand’s flag carrying airline, Thai Airways operated its first flights using SAF produced by Neste and supplied by PTT. The refuelling was carried out at Phuket Airport ahead of the airline flying to Bangkok.",https://aerospaceglobalnews.com/wp-content/uploads/2025/07/Bangkok-Airways-SAF-refuelling-1.jpg,N,,2025-07-03 13:13:56.379132
,,2025-07-03 14:39:00+00:00,advancedbiofuelsusa.info,The Digest's 2025 Multi-Slide Guide to Waste-to-Energy Innovations for SAF,Not Available,,,,,https://advancedbiofuelsusa.info/the-digest-s-2025-multi-slide-guide-to-waste-to-energy-innovations-for-saf,"The Digest’s 2025 Multi-Slide Guide to Waste-to-Energy Innovations for SAF by Jim Lane (Biofuels Digest) This presentation highlights the vast potential of 180-220 million tons of waste for energy, addressing rising disposal costs and significant GHG emissions.
Key innovations include AMP Robotics’ AI-powered MSW sorting with 99% accuracy and improved MSW feeding designs.
Hydrothermal Liquefaction (HTL) converts wet waste to biocrude oil with 94-99% conversion and achieves >10,000x PFAS/PFOS reduction, making it a promising pathway for Sustainable Aviation Fuel (SAF) production.","The Digest’s 2025 Multi-Slide Guide to Waste-to-Energy Innovations for SAF

by Jim Lane (Biofuels Digest) This presentation highlights the vast potential of 180-220 million tons of waste for energy, addressing rising disposal costs and significant GHG emissions. Key innovations include AMP Robotics’ AI-powered MSW sorting with 99% accuracy and improved MSW feeding designs. Hydrothermal Liquefaction (HTL) converts wet waste to biocrude oil with 94-99% conversion and achieves >10,000x PFAS/PFOS reduction, making it a promising pathway for Sustainable Aviation Fuel (SAF) production. READ MORE",https://advancedbiofuelsusa.info/assets/images/Advanced-Biofuels-Logo.jpg,N,,2025-07-03 13:13:59.960532
