id,name,published,outlet,title,authors,category,market,categoryorder,articleorder,url,description,text,image,error,sentiment,firstEyes
,,2025-06-02 09:22:54+00:00,Global Trade Magazine,Global Aviation Sector Faces Challenges with Sustainable Fuel Adoption,IndexBox,,,,,https://www.globaltrademag.com/global-aviation-sector-faces-challenges-with-sustainable-fuel-adoption/,"The International Air Transport Association (IATA) has projected that the production of sustainable aviation fuel (SAF) will double by 2025, reaching 2 million tonnes, which would account for just 0.7% of the total fuel consumption by airlines.
For more details, you can read the full report here.
Read also: Shipping Industry Leaders Oppose Biofuel Use Amid Climate Concerns Despite this anticipated increase, IATA has expressed concerns that the pace of SAF production is not sufficient to meet the aviation industry’s sustainability targets.
Willie Walsh, IATA’s Director General, highlighted that although the rise in production is a positive sign, the limited volume of SAF will contribute an additional $4.4 billion to the global aviation fuel bill.
The aviation industry collectively committed to achieving net-zero emissions by 2050, primarily through a gradual transition to SAF, which is derived from waste oils and biomass.","The International Air Transport Association (IATA) has projected that the production of sustainable aviation fuel (SAF) will double by 2025, reaching 2 million tonnes, which would account for just 0.7% of the total fuel consumption by airlines. For more details, you can read the full report here.

Read also: Shipping Industry Leaders Oppose Biofuel Use Amid Climate Concerns

Despite this anticipated increase, IATA has expressed concerns that the pace of SAF production is not sufficient to meet the aviation industry’s sustainability targets. Willie Walsh, IATA’s Director General, highlighted that although the rise in production is a positive sign, the limited volume of SAF will contribute an additional $4.4 billion to the global aviation fuel bill. This underscores the need for accelerated production and cost-reduction strategies.

The aviation industry collectively committed to achieving net-zero emissions by 2050, primarily through a gradual transition to SAF, which is derived from waste oils and biomass. However, airlines are currently in dispute with energy companies over the limited supply of SAF, while also holding aircraft manufacturers like Airbus and Boeing responsible for delays in delivering more fuel-efficient aircraft.",https://i0.wp.com/www.globaltrademag.com/wp-content/uploads/2025/06/6i256xh3.png?fit=840%2C429&ssl=1,N,,2025-06-02 06:57:17.857603
,,2025-06-02 09:18:51+00:00,Tech Funding News,Can Aviation go green? Dutch SkyNRG just raised €300M to prove it - Tech Funding News,Sofia Chesnokova,,,,,https://techfundingnews.com/can-aviation-go-green-dutch-skynrg-just-raised-e300m-to-prove-it/,"One Dutch company is leading the charge toward cleaner flight: SkyNRG, an Amsterdam-based pioneer in Sustainable Aviation Fuel (SAF), has secured €300 million to accelerate its global expansion.
Their founding focus, reducing emissions, enhancing energy security, and driving green innovation, remains central to their mission today.
The company strives to establish sustainable aviation fuel as the new global standard, supporting aviation’s commitment to achieve net-zero emissions by 2050.
In 2011, SkyNRG achieved a milestone by powering the first commercial SAF flight with KLM Royal Dutch Airlines.
Above all, SkyNRG exemplifies the power of collaboration — uniting airlines, governments, investors, and environmental groups to prove that aviation decarbonisation succeeds when innovation meets partnership.","The aviation industry is at a crossroads. Responsible for around 2.5% of global CO₂ emissions, projected to double by 2050 if left unchecked, the sector faces mounting pressure to decarbonise. One Dutch company is leading the charge toward cleaner flight: SkyNRG, an Amsterdam-based pioneer in Sustainable Aviation Fuel (SAF), has secured €300 million to accelerate its global expansion.

The funding round signals strong confidence in SAF’s future role in aviation. Dutch pension asset manager APG led the investment with €250 million on behalf of pension fund ABP, while returning investor Macquarie Asset Management contributed €50 million. This capital will fund the construction of three large-scale SAF production facilities across Europe and North America, bringing clean jet fuel closer to mainstream adoption.

Arjan Reinders, Head of Infrastructure Europe at APG, emphasised that “SkyNRG is a frontrunner in the SAF market, demonstrating an entrepreneurial spirit and a strong commercial focus,” positioning this investment as part of APG’s ambition to invest at the forefront of energy transition assets.

The story of SkyNRG: from Dutch roots to global reach

SkyNRG’s expansion centres on a flagship SAF facility in Delfzijl, the Netherlands — a cornerstone for European SAF production. Connected to Schiphol Airport through existing pipelines, the plant is ideally positioned to meet new EU regulations like ReFuelEU Aviation, which mandate increasing SAF usage across the bloc.

The facility, developed with Swedish energy firm Skellefteå Kraft, will produce 100,000 tonnes of SAF annually. Using green hydrogen (from water and renewable electricity) and captured CO₂, its e-fuel production method reduces lifecycle emissions by over 80% compared to conventional jet fuel.

SkyNRG’s ambitions extend further. The company is developing Project SkyKraft, another e-fuel plant with Skellefteå Kraft in Sweden. Across the Atlantic, Project Wigeon in Washington State will convert biogenic methane from landfill waste and manure into SAF and renewable diesel. Backed by U.S. incentives, this project promises environmental and economic benefits, creating hundreds of jobs while demonstrating effective public-private collaboration in clean energy.

Building a net-zero aviation future

Founded in 2009 by Maarten van Dijk and Theye Veen, SkyNRG grew from a vision to integrate aviation into the bio-based economy. Their founding focus, reducing emissions, enhancing energy security, and driving green innovation, remains central to their mission today.

The company strives to establish sustainable aviation fuel as the new global standard, supporting aviation’s commitment to achieve net-zero emissions by 2050. SkyNRG builds SAF production capacity, manages supply and distribution, ensures sustainability through certified feedstocks, develops regional supply chains, and helps partners meet decarbonisation goals.

SkyNRG distinguishes itself through complete control of the SAF value chain. Unlike oil giants like Shell or TotalEnergies, which focus on specific segments, SkyNRG manages everything, from sourcing and certification to blending and distribution, ensuring a more sustainable, transparent, and reliable supply.

Corporate climate action, reinvented

An independent Sustainability Board guides SkyNRG, comprising experts from WWF International, the European Climate Foundation, and the University of Groningen. This board enforces strict environmental and ethical standards, permitting only sustainable feedstocks like waste oils and agricultural residues, without compromise.

In 2011, SkyNRG achieved a milestone by powering the first commercial SAF flight with KLM Royal Dutch Airlines. Today, it supplies over 50 airlines and major corporations worldwide, with long-term SAF purchase agreements worth €4 billion demonstrating industry confidence.

The company is revolutionising corporate climate engagement through its “Board Now” program. This program enables companies like PwC, Microsoft, and Skyscanner to invest directly in SAF and offset travel emissions, creating an effective model for corporate climate action.

Projects like DSL-01, a regional supply chain in the Netherlands, showcase SkyNRG’s dedication to reducing transport emissions and supporting local economies. These local hubs make SAF greener, more affordable, and more accessible.

Behind SkyNRG: Leading the SAF value chain

As the first company to supply SAF for commercial flight (KLM, 2011), SkyNRG has grown to serve over 40 airlines globally, becoming a trusted industry leader. Unlike competitors such as TotalEnergies or Shell, SkyNRG manages the entire SAF value chain, from sourcing to distribution, certification, and price gap co-funding, enabling superior quality control and reliability.

The company reduces the cost difference between SAF and conventional jet fuel through co-funding partnerships with airlines, corporations, and logistics partners. By developing regional supply lines like DSL-01, SkyNRG cuts transport emissions, boosts local economies, and strengthens supply resilience.

SkyNRG leads in SAF market research, technology development, and advisory services, guiding airlines, airports, and governments toward faster SAF adoption and policy implementation. Their “Board Now” initiative allows companies to invest directly in SAF and reduce travel emissions, exemplifying effective corporate climate action.

SkyNRG’s strict sustainability standards and independent oversight set it apart in the competitive landscape. While Neste and World Energy focus on scale, and LanzaTech advances carbon recycling, SkyNRG’s comprehensive value chain integration, regional approach, and corporate engagement programs make it unique.

Above all, SkyNRG exemplifies the power of collaboration — uniting airlines, governments, investors, and environmental groups to prove that aviation decarbonisation succeeds when innovation meets partnership.",https://techfundingnews.com/wp-content/uploads/2025/06/SkyNRG-team.jpg,N,,2025-06-02 06:57:21.432453
,,2025-06-02 09:17:09+00:00,Reuters,"Trade barriers, plane delivery delays challenge global airline growth | Reuters",Tim Hepher,,,,,https://www.reuters.com/business/aerospace-defense/airlines-warn-over-weakening-global-trade-rules-2025-06-02/,"The head of a global airlines industry body said on Monday that growing trade barriers risked damaging the economy and the air travel sector, and ""unacceptable"" plane delivery delays were frustrating growth plans at a time of record passenger numbers.",Not Available,https://www.reuters.com/resizer/v2/KCKH2HWGZJLMTFEWHU5VVU6F74.jpg?auth=c10e7209ac94bd31d45ba1e8c6fd7ffb86f9bc198057b60974bf009bc22e3e38&height=1005&width=1920&quality=80&smart=true,N,,2025-06-02 06:57:25.917153
,,2025-06-02 08:23:55+00:00,www.argusmedia.com,India lowers edible oil import duties to 10pc | Latest Market News - Argus Media,Argus Media,,,,,https://www.argusmedia.com/news-and-insights/latest-market-news/2694440-india-lowers-edible-oil-import-duties-to-10pc,"The oil, natural gas and mining industries grew by 0.2pc following a 3.6pc contraction.
The sector's gain was led by oil and gas exploration, but was slowed by a drop in iron ore mining, IBGE said.
Exports rose by 1.2pc from a 0.7pc contraction in the previous quarter, while imports decelerated to 14pc from 16pc.
Brazil posted higher vehicles, oil products and agriculture exports, while the country's imports were led by transport equipment, machinery and chemicals, IBGE said.
""The incident did not affect the production process as a whole, especially the production of titanium sponge.","News

Brazil's GDP growth slows to 2.9pc in 1Q

Sao Paulo, 30 May (Argus) — Brazil's economy grew at an annualized 2.9pc in the first quarter, as slowing consumption and factory output offset a rebound in farming activity. Growth in gross domestic product (GDP) decelerated from 3.6pc in the previous quarter and was off for a second quarter from 4pc in the third quarter of 2024, according to government statistics agency IBGE. Agriculture grew by an annual 10.2pc in the first quarter, more than offsetting a 1.5pc contraction in the last quarter of 2024. The increase in the sector was led by good crop performance and a rise in the outlook for the 2024-25 crop , IBGE said. The industrial sector expanded by 2.4pc, slightly slower than 2.5pc in the prior quarter. Manufacturing decelerated to an annual 2.8pc in the first quarter from 5.3pc in the previous quarter. Electricity and gas, water and sewage management increased by 1.6pc following a 3.5pc contraction in the last quarter of 2024. The sector was led by higher residential demand, IBGE said. The oil, natural gas and mining industries grew by 0.2pc following a 3.6pc contraction. The sector's gain was led by oil and gas exploration, but was slowed by a drop in iron ore mining, IBGE said. Construction decelerated to an annual 3.4pc from 5.1pc in the previous quarter. Household consumption decelerated to 2.6pc from 3.7pc in the earlier quarter, while government spending eased to 1.1pc from 1.2pc. Exports rose by 1.2pc from a 0.7pc contraction in the previous quarter, while imports decelerated to 14pc from 16pc. Brazil posted higher vehicles, oil products and agriculture exports, while the country's imports were led by transport equipment, machinery and chemicals, IBGE said. Gross fixed capital formation — which measures how much companies increased their capital goods — decelerated to an annual 9.1pc from 9.4pc. By Maria Frazatto Send comments and request more information at feedback@argusmedia.com Copyright © 2025. Argus Media group . All rights reserved.

News

Dutch pension fund invests €250mn in SAF firm SkyNRG

Amsterdam, 30 May (Argus) — Dutch pension services provider APG is investing up to €250mn ($283mn) in Dutch sustainable aviation fuel (SAF) distributor SkyNRG, to accelerate that company's global development of SAF production facilities. The funding, on behalf of pension fund ABP, is a part of a wider €300mn round that also includes an additional €50m from Macquarie Asset Management in 2023 , to take its backing to €225mn from €175mn. The capital will support SkyNRG's SAF infrastructure expansion and its existing production facilities. In the Netherlands, SkyNRG is developing a 100,000 t/yr hydroprocessed esters and fatty acids SAF plant at Delfzijl . In Sweden, through a joint venture with power company Skelleftea Kraft, it is developing 100,000 t/yr e-SAF plant from renewable electricity and biogenic CO2 . In the US, SkyNRG is preparing a 150,000 t/yr facility combining SAF and renewable diesel production from feedstocks such as syngas. Located at the Port of Walla Walla in Washington state, construction is slated to begin in 2026, with production expected by 2029. SkyNRG supplies SAF to airlines and corporate customers. Its push for dedicated SAF facilities is to meet anticipated demand driven by mandates like ReFuelEU . Under that mandate, fuel suppliers will need to include 2pc SAF in their jet fuel deliveries in 2025, rising to 6pc in 2030, 20pc in 2035, 34pc in 2040, 42pc in 2045 and 70pc in 2050. RefuelEU also requires a specific proportion of synthetic aviation fuels, such as e-kerosene and hydrogen, that are defined as renewable fuels of non-biological origin (RFNBOs). Synthetics must reach a total share of aviation fuels of 1.2pc in 2030, 2pc in 2032, 5pc in 2035 and 35pc in 2050. European SAF prices have been at relatively low levels because of oversupply, but started picking up recently. Argus assessed spot hydrotreated esters and fatty acids (HEFA) synthetic paraffinic kerosene (SPK) fob ARA range at $1,886.5/t on 29 May, up from $1,177.8/t on 22 May, driven by stronger seasonal European demand ahead of the summer flying season. By Anna Prokhorova Send comments and request more information at feedback@argusmedia.com Copyright © 2025. Argus Media group . All rights reserved.

News

US tariff ruling could revive biofuel feedstock trade

New York, 29 May (Argus) — A sweeping court ruling Wednesday against President Donald Trump's emergency tariffs could make foreign biofuel feedstock imports, which have wavered this year, more attractive. A three-judge panel on the US Court of International Trade struck down tariffs Trump set under a little-used economic emergency law, including bilateral tariffs on China, ""reciprocal"" tariffs on nearly every country, and levies on some Canadian and Mexican products to combat drug trafficking. The tariffs upended global trade flows, including by making recently fast-rising inputs for renewable diesel production like Chinese used cooking oil and Brazilian beef tallow more expensive. The trade court gave the government ten days to comply, though the Trump administration has asked for a pause on the ruling and pledged to appeal. Tariffs enacted under other laws, including sectoral tariffs on steel and aluminum imports, would remain intact. Trump could also still eye different authorities to revive his broader tariffs, which he sees as a crucial negotiating tool to counter what he has called unfair trade practices abroad. But the court's decision, if it holds, would still be a significant barrier to Trump's efforts to rewire global trade. The US could even be required to offer refunds of emergency tariffs that have already been paid. US levies on Chinese products imposed under the emergency law at one point reached 145pc, raising fears of a protracted trade war and global economic slowdown. Fewer options for foreign biofuel feedstocks because of tariffs also helped increase the price of domestic alternatives like US soybean oil, where futures were down 2pc in early trading Thursday, and compounded the pain for refiners struggling with major changes to biofuel tax credits. Biomass-based diesel production in the US has been down sharply this year because of all the policy shifts. Formerly fast-rising flow Before this year, renewable diesel and sustainable aviation fuel producers along the US Gulf and west coasts were expanding capacity and increasingly looking abroad for inputs. Waste feedstocks like used cooking oil and beef tallow are considered lower-carbon feedstocks than crops and thus generally fetch larger government subsidies — even if sourced from abroad. The US imported nearly 5.4bn lbs of used cooking oil in 2024, a record-high and with more than half that total coming from China. But Trump's tariffs sharply reduced the incentive to import foreign feedstocks. Duties on Chinese products have varied significantly but were last at 30pc before the court ruling, adding to existing 15.5pc charges on Chinese used cooking oil. Reciprocal tariffs of 10pc on nearly every country added new costs to Australian and Brazilian tallow too. US import data is only available through March, before Trump imposed his most far-reaching tariffs as part of an April ""Liberation Day"" announcement . But global feedstock traders more recently have said that the tariffs — and the unpredictability of future policy — have made global inputs riskier. While some tariffs are eligible for duty drawbacks, creating options for biofuel producers targeting foreign markets, US imports of Chinese used cooking oil were down 27pc in the first quarter compared to the same period last year. Other barriers remain Even if the court ruling holds, other policies could deter US biorefineries from relying too heavily on foreign feedstocks. For one, current government guidance around a new US clean fuel tax credit prevents refiners from claiming any subsidy for road fuels derived from foreign used cooking oil . Those rules also pin the carbon intensity of canola-based fuels as too high to claim any subsidy, choking off interest in Canadian canola oil imports that had been rising significantly before this year. And farm groups, worried that foreign feedstocks are hurting demand for US crops, are lobbying regulators and lawmakers for more severe limits. A party-line budget bill that passed the House this month would restrict clean fuel tax credit eligibility to fuels derived from North American feedstocks, a win for US oilseed crushers but a major blow to refiners reliant on foreign tallow. While that bill still needs Senate approval and changes would only kick in next year, the proposal is a clear signal from Republicans that refiners should start looking closer to home for renewable diesel inputs. By Cole Martin Send comments and request more information at feedback@argusmedia.com Copyright © 2025. Argus Media group . All rights reserved.

News

Ti market assesses fallout of UKTMP chlorine gas leak

London, 28 May (Argus) — The titanium market is assessing the fallout of a chlorine gas leak at Kazakh titanium sponge producer Ust-Kamenogorsk Titanium and Magnesium Plant (UKTMP) on 19 May, with the company anticipating no significant impact to production but other sources cautioning the possibility of outages during repairs. ""An industrial incident occurred during a scheduled preventive cleaning of equipment at one of the production sites, as a result of a short-term deviation in the operation of the gas exhaust system,"" UKTMP told Argus . The leak occurred during maintenance to repair blocked pipes on one of the plant's chlorinators. One of the emitted gases was chlorine, which is used in the Kroll process to convert titanium dioxide into titanium tetrachloride. Titanium tetrachloride is subsequently reduced with magnesium to produce titanium sponge. Additional cleaning was promptly carried out and UKTMP switched to a reserve chlorinator per standard procedure, it told Argus . But one market source questioned the condition of UKTMP's reserve equipment, owing to a lack of investment in recent years. ""The incident did not affect the production process as a whole, especially the production of titanium sponge. Today, the plant is operating normally, without any change to the production schedule,"" UKTMP said. Mixed or limited information received by market participants has led to varied reactions. Some sources have claimed that the situation is more critical than UKTMP has said, underpinned in part by videos released online of green chlorine gas over Ust-Kamenogorsk in eastern Kazakhstan, although Argus could not verify these videos. It could take more than six months to repair damaged equipment, during which time sponge production will be affected, some sources claimed, but UKTMP denied such an outage. US titanium producer ATI confirmed to Argus that its supply of titanium sponge is secure, but ATI could not provide insight on UKTMP's operations. France's Aubert & Duval — a consumer of aerospace-grade 6Al 4V ingot, and titanium sponge through its EcoTitanium subsidiary — declined to comment. One Atlantic alloy producer that Argus understands procures 6Al 4V ingot from UKTMP said it does not see any risk to grade 5 ingot supply as a result of the leak. UKTMP produced 19,000t of titanium sponge last year, according to the company, accounting for 21pc of aerospace-approved sponge supply, or 16pc, including Russia. By Samuel Wood Send comments and request more information at feedback@argusmedia.com Copyright © 2025. Argus Media group . All rights reserved.",https://www.argusmedia.com/-/media/project/argusmedia/mainsite/images/14-generic-hero-banners/herobanner_1600x530_generic-c.jpg?h=530&iar=0&w=1600&rev=2cf023b4e0484c1bb091b9f72dbf7771&hash=72DBDFEBEF6EE62E751AB5DD2221C77E,N,,2025-06-02 06:57:30.454571
