id,name,published,outlet,title,authors,category,market,categoryorder,articleorder,url,description,text,image,error,sentiment,firstEyes
,,2025-06-01 13:56:45+00:00,www.airwaysmag.com,IATA AGM: IndiGo Charts Global Ascent - Airways,Not Available,,,,,https://www.airwaysmag.com/new-post/iata-agm-indigo-charts-global-ascent,"Peter Elbers, CEO, IndiGo, emphasized the carrier’s evolution from a domestic low-cost carrier to a global powerhouse, backed by strategic partnerships, infrastructure investment, and a commitment to sustainability.
“This is more than just about IndiGo — it's about India's aviation story,” Elbers said.
“This is a great moment for IndiGo — and a great moment for India,” said Elbers.
In 2023, IATA reported that India’s domestic passenger traffic grew by more than 22% year-on-year — a strong indicator of both economic momentum and evolving consumer behavior.
With one of the youngest fleets in the world, IndiGo already has a strong emissions profile.","‍DELHI – During the first day of the 81ST IATA Annual General Meeting in New Delhi, IndiGo (6E) unveiled its global vision, exercising 30 Airbus A350 options into firm and plans to expand its network to over 50 international cities.

Peter Elbers, CEO, IndiGo, emphasized the carrier’s evolution from a domestic low-cost carrier to a global powerhouse, backed by strategic partnerships, infrastructure investment, and a commitment to sustainability.

Taking the stage, Elbers delivered a compelling vision of IndiGo’s future. “This is more than just about IndiGo — it's about India's aviation story,” Elbers said. “With the IATA AGM back in India after 42 years, it's a fitting time to show the world how India is redefining flight.”

Doubling Down on Growth

A major announcement during the event was the conversion of options into firm orders for 30 Airbus A350-900s, doubling IndiGo’s wide-body commitment to 60. With deliveries starting in 2027, the deliveries will now continue well beyond 2035.

“This is a great moment for IndiGo — and a great moment for India,” said Elbers. “The A350s are not just planes; they are bridges — between India and the world, between dreams and destinations.”

Benoît de Saint-Exupéry, Chief Commercial Officer, Airbus, joined Elbers on stage. “IndiGo has ordered over 1,400 aircraft with us. That scale is unprecedented,” said Saint-Exupéry. “It’s not just a business relationship — it’s a shared journey.”

India’s Aviation Moment

According to IATA, India is currently the third-largest domestic aviation market in the world and is projected to become the third-largest overall aviation market (domestic and international combined) by 2030, surpassing the United Kingdom. In 2023, IATA reported that India’s domestic passenger traffic grew by more than 22% year-on-year — a strong indicator of both economic momentum and evolving consumer behavior.

India also boasts one of the youngest flying populations globally, with a median age of just under 29. “An ambitious, mobile, and tech-savvy middle class is reshaping how India travels,” Elbers noted. “We see this reflected in every flight we operate. And we're here to meet that demand — not just with more seats, but with more choices, more comfort, and more destinations.”

Expanding Horizons: Domestically and Internationally

Elbers outlined IndiGo’s plans to expand its domestic network from 91 to 95 destinations this year, alongside a bold push to grow its international network from 41 to over 50 cities. Besides Amsterdam (AMS) and Manchester (MAN), Elbers announced that Athens (ATH), Copenhagen (CPH) and London will be the next European destinations, plus four Central Asian cities, including Siem Reap (SAI).

“This is just the beginning,” Elbers stated. “Today, 90% of India’s population lives within 100 kilometers of an IndiGo-served airport. Soon, we want to ensure that 90% of the world is within reach of our wings.”

Beyond Numbers: The IndiGo Way

While growth metrics were abundant — including 118 million passengers flown last year and over 2,300 daily flights — Elbers emphasized culture and values. “Every three days, one million customers board an IndiGo flight. But behind every seat is a story. A business dream. A long-overdue reunion. A student’s first step abroad. That's the real weight of what we carry.”

The airline has also led inclusivity efforts in aviation, employing the highest number of female pilots globally at 16% and offering work opportunities to people with disabilities across its operations.

New Products, New Partnerships

In a nod to changing customer expectations, IndiGo is enhancing its premium offerings. The airline’s “IndiGo Stretch” product — a business-class experience — is being expanded to international routes such as Singapore (SIN), Bangkok (BKK), Phuket (HKT), and Dubai (DXB). Additionally, IndiGo's frequent flyer program, Blue Chip, has already amassed over three million members.

IndiGo is also forming deeper global alliances. Hours before the press briefing, the airline announced plans to develop a partnership, enhancing the connectivity of India with Europe and North America with Delta Air Lines (DL), Air France-KLM, and Virgin Atlantic (VS).

Recent partnerships with Delta, Virgin Atlantic, Air France-KLM, and Japan Airlines are enhancing IndiGo’s network connectivity and brand visibility abroad. “These aren’t just codeshares,” said Elbers. “They’re strategic bridges to the future.”

Investing in Infrastructure and Sustainability

Elbers announced that IndiGo is developing its own MRO (Maintenance, Repair, and Overhaul) facility in Bengaluru — a step toward operational independence and cost efficiency. ""India is brimming with engineering talent,"" he said. ""Why should we send our aircraft overseas when we can build world-class facilities here?""

On sustainability, Elbers acknowledged the global push toward Sustainable Aviation Fuel (SAF) and decarbonization. While SAF is not yet widely available in India, he admitted, “We’re committed to flying cleaner. With one of the youngest fleets in the world, IndiGo already has a strong emissions profile. And we are ready to do more as the technology and infrastructure evolve.”

Looking to 2030 and Beyond

Summing up the airline’s direction, Elbers shared a clear ambition: “By 2030, IndiGo will not just be India’s airline — it will be a global airline. Powered by Indian ambition, Indian talent, and Indian innovation.”

Elbers emphasized that the airline’s expansion is not just about size, but about strengthening connectivity, improving service, and building long-term alliances. “We are growing with purpose,” Elbers said. “As India continues to develop, IndiGo’s role is to connect people, places, and opportunities — both within the country and across the world.”

With firm plans in place, a growing fleet, and a focus on both access and efficiency, IndiGo is preparing for its next chapter — one that aims to align closely with India’s broader economic and global ambitions.",https://cdn.prod.website-files.com/65c26eeea7cdaa706d97a75c/683c5affc2040fc029ba96af_Image%20from%20Roberto%20Leiro%20Airways%20Magazine%20(1).webp,N,,2025-06-01 11:57:09.509750
