id,name,published,outlet,title,authors,category,market,categoryorder,articleorder,url,description,text,image,error,sentiment,firstEyes
,,2025-06-02 20:06:59+00:00,Blue Sky News,Avina Announces Development of Nation's First On-Site SAF Production Facility at PIT,"Evan Dougherty, Blue Sky Staff",,,,,https://blueskypit.com/avina-announces-development-of-nations-first-on-site-saf-production-facility-at-pit/,"This development supports PIT’s unrelenting commitment to resiliency and energy innovation initiatives for the aviation industry.
Avina’s SAF facility will provide the opportunity for hundreds of full-time jobs, when constructed.
Support from Global Aviation Leaders The project has earned support from international aviation leaders.
Project leaders from KBR, Pittsburgh International Airport and Avina acknowledged the global support and potential impact the project would have.
“Pittsburgh International Airport has long been committed to resiliency and driving innovation in the aviation and energy industries,” Cassotis said.","Pittsburgh International Airport and Avina Synthetic Aviation Fuel are partnering to develop the first on-airport sustainable aviation fuel (SAF) production facility utilizing one of the very first alcohol-to-jet pathways in the U.S.

Avina said it will build a state-of-the-art facility to provide ASTM certified fuel on airport property just south of PIT’s terminal by deploying KBR’s innovative PureSAF alcohol-to-jet technology, developed and owned by Swedish Biofuels AB and exclusively licensed globally by KBR.

This facility will be a gamechanger in the infrastructure and economic development for the Pittsburgh region and will present a unique opportunity for airline partners to secure SAF readily and cost-effectively to meet their ambitious decarbonization targets. This development supports PIT’s unrelenting commitment to resiliency and energy innovation initiatives for the aviation industry.

The facility, through multiple phases of development, is expected to produce over 100 million gallons of SAF annually to meet local and regional commercial and cargo needs at PIT and beyond. Avina’s SAF facility will provide the opportunity for hundreds of full-time jobs, when constructed. The plant will have a carbon intensity that is at least 65 percent lower than that of conventional jet fuel, according to Avina’s May 29 press release.

Support from Global Aviation Leaders

The project has earned support from international aviation leaders.

“In pursuit of responsible and resilient growth in aerospace, Boeing supports the development of advanced, synthetic fuels here in the U.S. to power air travel into the future,” said Mike Caston, Director, Americas Partnerships and Policy, Boeing.

Project leaders from KBR, Pittsburgh International Airport and Avina acknowledged the global support and potential impact the project would have.

“KBR is proud to support the Pittsburgh International Airport team and enable it to be one of the first airports globally to provide SAF to its customers by producing it onsite at the airport,” said Hari Ravindran, KBR’s Global SVP for Technology said. “PureSAF (alcohol-to-jet) Technology, is designed to allow the facility to deliver 100 percent drop-in fuel made from renewable feedstocks while meeting global specifications for sustainable jet fuel. This project is a real example of how innovation and strong business relationships are delivering tangible benefits to the aviation industry.”

“This unique partnership with Avina and KBR will result in on-site SAF production and fills a growing need for our airline partners and the industry overall,” said Christina Cassotis, CEO of Pittsburgh International Airport. “With abundant natural resources, robust energy infrastructure, and available fuel storage, PIT is uniquely positioned to meet these goals and serve the growing demands for SAF.”

Vishal Shah, Founder and CEO of Avina said, “Avina is excited to support the vision of Pittsburgh International Airport and bring a SAF production facility to their doorstep. We are committed to bringing hundreds of jobs to the community and expanding the energy production ecosystem. With Pittsburgh’s commercial and cargo demand along with the network to connect to the other regional hubs, we aim to set the platform for such developments nationally and globally.”

Latest Addition to PIT’s Energy Resiliency and Innovation

The announcement adds to the airport’s energy portfolio, which includes a first-in-the-world microgrid launched in 2021.

Power outages that shut down London Heathrow Airport and airports in Spain and Portugal earlier this year highlighted the significance of PIT’s award-winning microgrid, a blueprint for airport resiliency around the world.

Thanks to the microgrid, PIT is the first to completely generate its own power using natural gas and solar energy – and, in addition to boosting resiliency, has saved the airport more than $1 million per year in electricity costs.

In addition, the airport announced a project in April to more than double the 10,000 solar panels that already exist on airport property.

“Pittsburgh International Airport has long been committed to resiliency and driving innovation in the aviation and energy industries,” Cassotis said.",https://blueskypit.com/wp-content/uploads/2025/06/51554001372_ff04d030c5_o.jpg,N,,2025-06-02 16:56:33.226678
,,2025-06-02 19:31:07+00:00,www.facebook.com,"WSU Leads Global Research in Sustainable Aviation Fuels PULLMAN, WA - Facebook",Not Available,,,,,https://www.facebook.com/story.php%3Fstory_fbid%3D945677301103609%26id%3D100069840424825,"... sustainable aviation fuel (SAF), based on an analysis of articles, papers, editorials, and news items published from 2001 to 2023. Log in.",Not Available,,N,,2025-06-02 18:56:36.693918
,,2025-06-02 19:00:56+00:00,Flight Global,"after 30-plus years commercial aviation is coming home, but can D328eco win customers' hearts?","Murdo Morrison, Dominic Perry, Exclusive partner Honeywell",,,,,https://www.flightglobal.com/aerospace/made-in-germany-after-30-plus-years-commercial-aviation-is-coming-home-but-can-d328eco-win-customers-hearts/163197.article,"Sierra Nevada-owned Deutsche Aircraft admits the D328eco – which it hopes to fly later this year with an entry into service target of quarter four 2027 – is not a clean-sheet design.
Unlike rival Heart Aerospace, which is developing the ES-30 hybrid-electric 30-seat airliner, Deutsche Aircraft has opted for conventional propulsion provided by off-the-shelf PW127XT-S powerplants, similar to those on the ATR 42-600.
Although Deutsche Aircraft has not announced firm orders for the D328eco, Neumann says the company is talking to around 60 potential customers and has “lots of” letters of intent or LOIs.
Founded in Friedrichshafen in 1914 by Claude Dornier, the original Dornier company set up its Oberpfaffenhofen factory in the 1930s and became one of the biggest names in German aviation.
Neither will Deutsche Aircraft be rushing to join the electric or disruptive propulsion bandwagon.","Excitement and pride were in plentiful supply on 28 May as politicians, dignitaries, and suppliers joined Deutsche Aircraft management and staff in an Oberpfaffenhofen hangar to hail the roll-out of the D328eco as the first all-German commercial aircraft in a generation to enter production. “German aviation is back home,” enthused the company’s co-chief executive Nico Neumann as employees embraced amid the applause.

Airbus – which assembles airliners in Hamburg, fighters in Manching, and helicopters in Donauworth – and the likes of military trainer specialist Grob might take issue with Deutsche Aircraft’s suggestion that it is single-handedly revitalizing the domestic aircraft manufacturing sector. However, the business’s pledge to bring back to life a type introduced almost 35 years ago and become only the second player after ATR in the 40-seat turboprop market is certainly significant.

Sierra Nevada-owned Deutsche Aircraft admits the D328eco – which it hopes to fly later this year with an entry into service target of quarter four 2027 – is not a clean-sheet design. Rather, it is an “advanced evolution” of the original Dornier 328 with the latest version of Pratt & Whitney Canada’s PW100-series engine, new Garmin avionics, redesigned landing gear, and a fuselage stretched by 2.1m (6.9ft) to accommodate 40 seats instead of its predecessor’s 32.

Some might even say the “eco” designation is also a bit of a misnomer. Unlike rival Heart Aerospace, which is developing the ES-30 hybrid-electric 30-seat airliner, Deutsche Aircraft has opted for conventional propulsion provided by off-the-shelf PW127XT-S powerplants, similar to those on the ATR 42-600. The company also makes great play of the D328eco being “100% SAF [sustainable aviation fuel] compatible”, but that hardly makes it unique. Most modern engines are, in theory.

However, the biggest challenge facing Deutsche Aircraft – which succeeded 328 Support Services, the company that took over the type certificate and design rights to the original Dornier 328 turboprop and its 328JET sibling and was subsequently acquired by Sierra Nevada in 2015 – will be breathing new life into a moribund market for sub-50-seat passenger aircraft.

Sales of the ATR 42 are massively outpaced by those of the larger ATR 72. In fact, last year, of 56 ATRs ordered, only five were for the smaller variant. The only other Western company in the segment, De Havilland Canada, which owns the out-of-production DHC-8 series of regional turboprops, has shown little appetite to return to manufacturing.

So, what makes Neumann confident that Deutsche Aircraft can deliver in the sort of numbers that will justify its investment in a new production plant at Leipzig airport capable of building 48 aircraft a year, which will be ready to begin production in early 2026, and a supply chain that includes a rear fuselage assembly line at Dynamatic Technologies in Bengaluru, India? “Quite simply, the market loves this product,” he says.

Although Deutsche Aircraft has not announced firm orders for the D328eco, Neumann says the company is talking to around 60 potential customers and has “lots of” letters of intent or LOIs. On top of a “replacement market” for ageing small regional aircraft – including 150 legacy 328 turboprops and jets still in service – there are “classic growth markets” in India and the rest of Asia, where demand for regional air services is growing exponentially, he asserts.

He refutes the suggestion that most new airlines in emerging markets want to start large – eschewing 40-seat regional turboprops for bigger regional jets or even Airbus and Boeing narrowbodies. Many existing carriers offering essential connectivity services around the world have “had the chance to go big and haven’t”, he suggests. He cites Norway, Australia, and the north of Canada as being among the territories where there is the largest need to replace ageing fleets.

While Neumann makes much of the “Dornier DNA” behind the D328eco, Deutsche Aircraft decided not to build the aircraft in the erstwhile brand’s spiritual home of Bavaria, where Dornier made its name and the original 328 was assembled. Instead, it chose Saxony in eastern Germany where wages and living costs are lower. Leipzig, says Neumann, is also “well connected” by transport links and, as a DHL hub, is one of the centres of the European air freight industry.

Construction of the new facility began a few weeks ago, and Deutsche Aircraft aims to have it ready before the end of the year, when it will begin installing jigs and assembly lines. Neumann expects output in the first full year to be around 12 aircraft, rising into the 20s in the second or third and eventually into the forties, although he is reluctant to set out a precise ramp-up timetable.

The aircraft unveiled at Oberpfaffenhofen – test aircraft or TAC 1 - was lacking engines. Its PW127XTs are poised at P&WC’s facility at Longueuil near Montreal but shipping them over for a roll-out ceremony months before they are required would be “sending the wrong signal” to staff at a time when the business needs to preserve cash, says Neumann.

TAC 1’s fuselage is constructed from two separate legacy 328 structures – the nose and empennage from one and centre section from the other – to achieve a stretch without plugs. TAC 2 will join it in flight testing next year, chiefly to evaluate aircraft systems, while a third test platform, with final cabin configuration, will be the first example assembled in Leipzig.

Following its appearance at last year’s Farnborough event, Deutsche Aircraft will be at the Paris air show with a mock-up of the D328eco on display in its chalet. The company is one of at least three spin-offs from the original Dornier – others are Dornier Seawings, developer of the Seastar CD2 amphibian, which has offices next to Deutsche Aircraft in Oberpfaffenhofen, and General Atomics AeroTec Systems, an offshoot of the US defence giant, which is behind the NXT variant of the original Dornier 228 turboprop.

Founded in Friedrichshafen in 1914 by Claude Dornier, the original Dornier company set up its Oberpfaffenhofen factory in the 1930s and became one of the biggest names in German aviation. In the mid-1990s, the business was taken over by US firm Fairchild, becoming Fairchild Dornier and continuing production of the 328, which entered service in 1993, as well as developing a 70-seat regional jet called the 728JET. However, the costs of the latter programme proved too much and Fairchild Dornier collapsed in 2002, days after rolling out the prototype.

A short-lived venture, AvCraft, acquired the rights to the 328 and planned to restart production of the jet, but itself went bankrupt three years later. 328 Support Services took over the entire 328 programme in 2006 – with the aim of providing maintenance, repair, and overhaul services to operators of the existing fleet. Nine years later, 328 Support Services was itself taken over by Sierra Nevada, which in turn renamed it Deutsche Aircraft with plans to resume production of the turboprop.

However, the 328JET will not be resurrected. “There is no market in a sustainable aviation world for a [regional] jet,” says Neumann. Neither will Deutsche Aircraft be rushing to join the electric or disruptive propulsion bandwagon. “Maybe down the line we could look at a hybrid or even hydrogen in 15 years, but our priority is establishing the D328eco,” he says.",https://d3lcr32v2pp4l1.cloudfront.net/Pictures/1024x536/2/4/9/110249_tac1_706811.jpg,N,,2025-06-02 15:57:08.913708
,,2025-06-02 18:19:29+00:00,www.enn.com,"What is Sustainable Aviation Fuel, and Why Are we Not Using it Already?",Not Available,,,,,https://www.enn.com/articles/76583-what-is-sustainable-aviation-fuel-and-why-are-we-not-using-it-already,"The aviation industry accounted for 2.5% of global energy-related CO2 emissions in 2023, according to the International Energy Agency, opens in a new window (IEA).
It means there is a significant challenge, which the industry acknowledges.
That is to transition, especially in terms of fuelling aircraft, in order to meet Net Zero targets and deliver a low-carbon future.
One of the potential solutions is the development of sustainable air fuel (SAF) as a cleaner alternative, given the fact it can reduce greenhouse gas emissions by around 70-80% compared to using traditional jet fuel.
Read more at: University of New South Wales - Sydney Photo Credit: garten-gg via Pixabay","The aviation industry accounted for 2.5% of global energy-related CO2 emissions in 2023, according to the International Energy Agency, opens in a new window (IEA).

It means there is a significant challenge, which the industry acknowledges. That is to transition, especially in terms of fuelling aircraft, in order to meet Net Zero targets and deliver a low-carbon future.

One of the potential solutions is the development of sustainable air fuel (SAF) as a cleaner alternative, given the fact it can reduce greenhouse gas emissions by around 70-80% compared to using traditional jet fuel.

Read more at: University of New South Wales - Sydney

Photo Credit: garten-gg via Pixabay",,N,,2025-06-02 15:57:12.525341
,,2025-06-02 18:09:04+00:00,Travel Radar - Aviation News,2025 IATA Diversity and Inclusion Award Winners Revealed - Travel Radar - Aviation News,Maisie Adams,,,,,https://travelradar.aero/2025-iata-diversity-and-inclusion-award-winners-revealed/,"The International Air Transport Association (IATA) has revealed the winners of the 7th annual Diversity and Inclusion Awards.
Celebrating those who have dedicated their work to the growth and representation of the aviation industry.
The Diversity and Inclusion Awards Sponsored by Qatar Airways these awards support innovation in the industry and provide support for underrepresented communities within the aviation industry.
Presented during the World Air Transport summit in New Delhi, India the winners were recognised for the work they do to support communities and provide opportunities in the world of aviation.
Here are the winners of the Diversity and Inclusion Awards 2025: Inspirational Role Model – Claudia Zapata-Cardone As the daughter of Latino immigrants to the US, Claudia is committed to opening doors for underrepresented communities.","The International Air Transport Association (IATA) has revealed the winners of the 7th annual Diversity and Inclusion Awards. Celebrating those who have dedicated their work to the growth and representation of the aviation industry.

The Diversity and Inclusion Awards

Sponsored by Qatar Airways these awards support innovation in the industry and provide support for underrepresented communities within the aviation industry. Presented during the World Air Transport summit in New Delhi, India the winners were recognised for the work they do to support communities and provide opportunities in the world of aviation. Karen Walker, chair of the judging panel reflected on the need for diversity within the sector as it is “strategic for aviation as the industry’s growth is contingent upon attracting a strong talent pool with a wide variety of skills”. Here are the winners of the Diversity and Inclusion Awards 2025:

Inspirational Role Model – Claudia Zapata-Cardone

As the daughter of Latino immigrants to the US, Claudia is committed to opening doors for underrepresented communities. She is the President of the Latin Professionals in Aerospace (LPA), an airline captain, and a volunteer advocate. Through her work, she has expanded scholarships, increased female membership, and launched programs to inspire youth engagement and pilot mental health.

High Flyer – Katherine Moloney

Katherine is the founder of the online program Elevate (Her), a resource dedicated to raising the percentage of women in aviation across all sectors. This program offers cost-free access to memberships and events targeted to women looking to kick-start their careers in aviation. Facilitated by British Airways, Virgin Atlantic, and many more it has grown to thousands of members in the space of a year across 63 countries. With events held online and in-person, the program has reached thousands of women hoping to break into the skies.

Diversity and Inclusion Team – Air Canada

Air Canada’s AC Spark (for 5-17 year olds) and AC Take Off (for 17-25 year olds) have reached youth communities to inspire and open pathways for a career in aviation. Through their CARE model (Community Outreach, Accountability, Representation, and Engagement & Belonging) they have aided youth groups by providing mentorships, scholarships, and inspiration globally.",https://travelradar.aero/wp-content/uploads/2025/06/iata.jpeg,N,,2025-06-02 16:56:40.169665
,,2025-06-02 18:06:21+00:00,BioEnergy Times,Uttar Pradesh to unveil Sustainable Aviation Fuel Manufacturing Promotion Policy-2025,Vivek Waghmode,,,,,https://bioenergytimes.com/uttar-pradesh-to-unveil-sustainable-aviation-fuel-manufacturing-promotion-policy-2025/,"Uttar Pradesh is set to unveil the Uttar Pradesh Sustainable Aviation Fuel (SAF) Manufacturing Promotion Policy-2025, which is expected to be the first dedicated SAF policy in India, officials confirmed.
The announcement came during an event organized by Invest UP, where Chief Secretary Manoj Kumar Singh briefed industry representatives and investors about the upcoming policy framework.
Singh highlighted the state’s strategic advantages as a potential hub for SAF production, citing proposed incentives, streamlined facilitation processes, and robust logistics infrastructure.
The event drew strong interest from investors, with over 18 companies expressing a willingness to set up SAF manufacturing units in the state.
Invest UP CEO Vijay Kiran Anand and senior officials from various departments were also present at the event.","Uttar Pradesh is set to unveil the Uttar Pradesh Sustainable Aviation Fuel (SAF) Manufacturing Promotion Policy-2025, which is expected to be the first dedicated SAF policy in India, officials confirmed.

The announcement came during an event organized by Invest UP, where Chief Secretary Manoj Kumar Singh briefed industry representatives and investors about the upcoming policy framework.

Singh highlighted the state’s strategic advantages as a potential hub for SAF production, citing proposed incentives, streamlined facilitation processes, and robust logistics infrastructure. He emphasized that the policy aims not only to attract investment but also to create significant benefits for the agricultural community in the state.

The SAF sector’s reliance on biomass and grain-based feedstock—such as sugarcane bagasse, rice husk, wheat straw, and surplus grains—could open new revenue streams for farmers, Singh said. By sourcing raw materials locally, the initiative is expected to boost rural incomes and offer better price realisation for agricultural produce.

“This initiative not only strengthens our commitment to green energy but also ensures that farmers become direct beneficiaries, enhancing their earnings while contributing to a more sustainable future,” Singh stated.

A detailed presentation by Invest UP outlined the state’s vision for SAF and was followed by a discussion session with key industry stakeholders. Topics such as land availability, policy framework, and ease of doing business were addressed during the interaction.

The event drew strong interest from investors, with over 18 companies expressing a willingness to set up SAF manufacturing units in the state. These firms collectively proposed investment intents exceeding ₹3,000 crore.

Singh also underscored Uttar Pradesh’s unparalleled connectivity, pointing to its extensive air, rail, and road network, including five international airports, which offers seamless logistics and market access for potential investors.

Previously, Invest UP had issued an Expression of Interest (EOI) to attract global SAF technology providers and clean energy innovators to participate in the state’s growing green energy ecosystem.

Invest UP CEO Vijay Kiran Anand and senior officials from various departments were also present at the event.",https://bioenergytimes.com/wp-content/uploads/2024/07/SAF-7.png,N,,2025-06-02 14:56:12.151581
