id,name,published,outlet,title,authors,category,market,categoryorder,articleorder,url,description,text,image,error,sentiment,firstEyes
,,2025-07-02 23:26:02+00:00,EurekAlert!,Upgrading biocrude oil into sustainable aviation fuel using zeolite-supported iron ...,Not Available,,,,,https://www.eurekalert.org/news-releases/1089826,"Wet wastes, including food waste and biomass, are promising candidates for sustainable aviation fuel (SAF) production due to their triglyceride content, which can be converted into biocrude via hydrothermal liquefaction (HTL).
SAF precursors must meet criteria derived from conventional fuels (e.g.
Jet A), including complete oxygen removal to prevent jet engine corrosion and a higher heating value (HHV) close to Jet A.
The metal carbide nanocatalysts were reusable in upgrading tests multiple times and retained their deoxygenation activity.
This work demonstrates for the first time the feasibility of catalytically upgrading wet waste-derived biocrudes into SAF precursors using zeolite-supported Mo2C nanocatalyst.","Wet wastes, including food waste and biomass, are promising candidates for sustainable aviation fuel (SAF) production due to their triglyceride content, which can be converted into biocrude via hydrothermal liquefaction (HTL). SAF precursors must meet criteria derived from conventional fuels (e.g. Jet A), including complete oxygen removal to prevent jet engine corrosion and a higher heating value (HHV) close to Jet A. Currently, no HTL-derived biocrude meets these. This study, with contributions from researchers at the Center for Advanced Bioenergy and Bioproducts Innovation (CABBI), explored using zeolite-supported molybdenum carbide (Mo2C) nanocatalysts to upgrade wet waste-derived biocrudes into SAF precursors that meet all essential criteria for the first time.

Mo2C nanocatalysts were generated in gas phase and dispersed onto zeolite, tested for their ability to remove oxygen from biocrudes, then used to upgrade wet waste-derived biocrude to SAF via HTL. The upgraded biocrudes were characterized against Federal Aviation Administration specifications.

Our data showed complete oxygen removal from the biocrude and a high heating value of 46.5 MJ/kg, comparable to Jet A. Prescreening tests showed the average carbon number of the upgraded biocrude’s distilled SAF fraction was 10.6, close to 11.4 for average conventional jet fuel, and it satisfied all key SAF prescreening standard specifications, including surface tension, density, viscosity, flash point, and freezing point. The metal carbide nanocatalysts were reusable in upgrading tests multiple times and retained their deoxygenation activity.

This work demonstrates for the first time the feasibility of catalytically upgrading wet waste-derived biocrudes into SAF precursors using zeolite-supported Mo2C nanocatalyst.

Images available upon request",https://www.eurekalert.org/images/EurekAlert-bluebg_Twitter_601X601.png,N,,2025-07-02 23:01:03.241956
,,2025-07-02 23:01:42+00:00,www.turkishairlines.com,Sustainable aviation fuel (SAF) - Turkish Airlines ®️,Not Available,,,,,https://www.turkishairlines.com/en-sg/additional-services/sustainable-aviation-fuel/saftys/,Sustainable Aviation Fuel,Not Available,,N,,2025-07-02 22:01:45.995487
,,2025-07-02 22:16:20+00:00,Bangkok Airways,Bangkok Airways Officially Introduces Sustainable Aviation Fuel (SAF) on Commercial Flights,Bangkok Airways,,,,,https://www.bangkokair.com/eng/press-release/view/bangkok-airways-officially-introduces-sustainable-aviation-fuel-saf-on-commercial-flights,"Fly full-service with Bangkok Airways. Enjoy a 20kg baggage allowance, in-flight meals, and seat selection for domestic and international flights.",Not Available,https://media.bangkokair.com/uploads/logo/og-image_default.png,N,,2025-07-02 23:58:54.471722
,,2025-07-02 21:57:48+00:00,AVweb: Premier Aviation News and Insights for Pilots and Professionals​,'Big Beautiful Bill's' Air Traffic Control Overhaul Advances - AVweb,Parris Clarke,,,,,https://avweb.com/aviation-news/big-beautiful-bills-air-traffic-control-overhaul-advances/,"Funding valued at $12.5 billion is included in President Trump’s “One Big Beautiful Bill” for a number of air traffic control and aviation-related technological and infrastructure initiatives.
But some lawmakers have expressed concern with aspects of the package related to building a new Air Route Traffic Control Center (ARTCC).
The sprawling domestic legislation allocates the $12.5 billion for technological and infrastructural upgrades to the nation’s air traffic control system.
In the post he defended the bill, saying that if not passed, the department will “do nothing” on the air traffic control front.
His support is a backtrack of previous comments where he expressed it would require additional funding in order to implement the needed overhauls to air traffic control.","Funding valued at $12.5 billion is included in President Trump’s “One Big Beautiful Bill” for a number of air traffic control and aviation-related technological and infrastructure initiatives. The Senate passed its version of the bill in the early hours of Tuesday morning.

But some lawmakers have expressed concern with aspects of the package related to building a new Air Route Traffic Control Center (ARTCC). The bill includes $1.9 billion to build the ARTCC, but one provision of that budget item states that at least three current ARTCCs must be “divested and integrated” into the new facility. Additionally, $100 million is allocated to establish the ARTCC Realignment and Consolidation Effort, where at least 10 ARTCCs would be “closed or consolidated to facilitate recapitalization of ARTCC facilities” operated by the FAA.

This consolidation effort is one of the major aviation amendments from the original House bill, one that could give many state representatives pause. Potential closures would disrupt jobs across a number of districts. Representatives in these districts might be less apt to vote to pass the bill knowing constituents’ jobs are about to be slashed. Currently, 22 ARTCCs are in operation across the country. Which centers are on the chopping block remains unclear.

The sprawling domestic legislation allocates the $12.5 billion for technological and infrastructural upgrades to the nation’s air traffic control system. First passed by the House of Representatives, the bill now returns to the lower chamber where members will vote on the changes made by the Senate before sending it to the president’s desk for signature. Republicans in the house, holding a razor-thin majority, are hoping for a swift passage.

Included in the Senate-passed package is $7.75 billion to telecommunications infrastructure and radar system upgrades, $1 billion for bolstering terminal radar approach control (TRACON) facilities, and $500 million for runway safety and surveillance technologies, among other initiatives. Funding will be provided fully upfront and prioritization of which projects will take precedence will be left to the discretion of the FAA. The bill also reduces the tax credit for using Sustainable Aviation fuel (SAF) from $1.75 per gallon to $1.

As part of the up-front funding, the FAA is required to report specific expenditures to Congress 180 days after the bill’s final passage and every 90 days after that.

On X.com, U.S. Transportation Secretary Sean Duffy implored Congress to send the bill to the president’s desk. In the post he defended the bill, saying that if not passed, the department will “do nothing” on the air traffic control front.

His support is a backtrack of previous comments where he expressed it would require additional funding in order to implement the needed overhauls to air traffic control.

Duffy said at a press conference in May when asked about the bill, “I’m having conversations with [Congress] at a private level about what I think it could be. The $12.5 billion that we have in the House bill; it’s going to be more than that.”

Aviation industry advocates such as the National Business Aviation Association (NBAA) have lauded the legislation for the steps taken to revitalize air traffic control. “We thank the Senate for recognizing with this initial funding that a safe and efficient national airspace requires a robust, resilient ATC system that bolsters our nation’s global aviation leadership,” NBAA president and CEO Ed Bolen said in a statement.",https://avweb.b-cdn.net/wp-content/uploads/sites/3/2025/07/25-7-3-Congress.jpg,N,,2025-07-02 19:06:40.589743
,,2025-07-02 21:19:17+00:00,Instagram,Avfuel | Sustainable aviation fuel is now available at Million Air Albany (KALB). Same ... - Instagram,Not Available,,,,,https://www.instagram.com/reel/DLkw4SVsXTx/,"avfuel on July 1, 2025: ""Sustainable aviation fuel is now available at Million Air Albany (KALB). Same performance. Lower lifecycle emissions. No modifications needed. Ask to fuel up with SAF on your next stop—or learn more at Avfuel.com/SAF."".",Not Available,https://scontent-iad3-1.cdninstagram.com/v/t51.82787-15/515211723_18486949954064675_4402874562467604398_n.jpg?stp=cmp1_dst-jpg_e35_s640x640_tt6&_nc_cat=101&ccb=1-7&_nc_sid=18de74&_nc_ohc=m64NJTq1wvkQ7kNvwH0XHov&_nc_oc=Adl80KATPQ74oFFoueWkVfMca8Iui4CmeTW3KcOb2U2R250Dnza0fGxs8Uu46zH13yFMfo5PDD4w5nmhmZYWgoXK&_nc_zt=23&_nc_ht=scontent-iad3-1.cdninstagram.com&_nc_gid=oCCAvE5tW2mAUmHP4NqFEA&oh=00_AfPxfRDr9lzaTmGuxwwEOl3A0eq61snD7kCbTYITQGYEGg&oe=686B97D7,N,,2025-07-02 20:04:37.346199
,,2025-07-02 21:05:52+00:00,www.convenience.org,Senate Passes One Big Beautiful Bill - NACS,NACS Daily,,,,,https://www.convenience.org/Media/Daily/2025/July/2/2-Senate-Passes-One-Big-Beautiful-Bill_GR,"By Jon Taets, director of Government Relations at NACS On Tuesday, the U.S. Senate passed their version of the “One Big Beautiful Bill” by a vote of 51 to 50, with Vice President J.D.
The Senate’s version made several changes to the House bill passed on May 22.
While the Senate did make some changes to the House-passed tax title, NACS’ main priorities remained in the bill.
The Senate bill also maintained the House language making increases in the Estate Tax and Section 179 expensing thresholds permanent.
On the energy side, the Senate bill also levels the playing field between sustainable aviation fuel and other biofuels.","By Jon Taets, director of Government Relations at NACS

On Tuesday, the U.S. Senate passed their version of the “One Big Beautiful Bill” by a vote of 51 to 50, with Vice President J.D. Vance breaking the tie, sending it back to the House for final passage before becoming law. The vote was the culmination of an—at times—tumultuous week for Senate GOP leaders who had to keep a procedural vote on the legislation open for three hours on Saturday night to secure the votes necessary to move forward.

The Senate’s version made several changes to the House bill passed on May 22. Most of the changes came after the Senate Parliamentarian ruled some provisions of the bill were in violation of the so-called “Byrd Rule” in the Senate. That rule requires any legislation considered under the reconciliation procedures to be primarily budgetary and not just a policy change that doesn’t impact the budget or only impacts it secondarily. This required changes to, or jettisoning entirely, quite a few of the House’s spending cut provisions.

While the Senate did make some changes to the House-passed tax title, NACS’ main priorities remained in the bill. The Senate did eliminate the House-passed increase in the 199(A) deduction for pass-through entities, but it preserved NACS’ top priority of making the existing deduction permanent.

The Senate bill also maintained the House language making increases in the Estate Tax and Section 179 expensing thresholds permanent. It also improves the House bill by not only extending 100% Bonus Depreciation and the return to EBITDA for calculating income for the purposes of the business interest deductions, but making those changes permanent as well.

Below is a list of tax features the Senate Reconciliation Bill has updated:

Federal Corporate Tax Rate (C-corps): Remains flat 21%, no rate cut in Senate text

Graduated Rates: The flat rate stays at 21%

Corporate Alternative Minimum Tax: Eliminated under TCJA, no new CAMT included in bill

Pass-Through Income (QBI, sec 199A): Makes permanent at 20% (20% deduction legacy was previously set to expire in 2025)

Bonus Depreciation: Permanently extended, was previously 100% through 2025 under TCJA

R&D Expensing (Sec 174): Permanent suspension of capitalization, retroactive

Interest Limitation: Switches to EBITDA cap permanently

Section 179 Expensing: Expanded to $2.5M/$4M limit, was previously $1.16M limit

Estate Tax: Permanently sets exemption at $15M per person, indexed annually

One of the most contentious negotiations among GOP Senators was the same as on the House side—how to deal with the State and Local Tax (SALT) Deduction. Notable for many convenience retailers, the Senate’s compromise eliminates the House language that invalidated SALT deduction work arounds for businesses that many states had passed since 2018.

On the energy side, the Senate bill also levels the playing field between sustainable aviation fuel and other biofuels. This provision will help level the playing field for biofuel production instead of arbitrarily creating winners and losers among the trucking, railway and aviation industries.

Noting the above benefits to our industry, NACS sent a letter to Senate Majority Leader John Thune (R-SD) expressing our industry’s support and urging Senators to support final passage of the Reconciliation package.

Due to the changes the Senate made, the bill must now be passed again in the House of Representatives before it can be sent to President Donald Trump. It remains to be seen if the changes made will be acceptable to the House GOP, particularly to budget hard liners in the caucus. If the House makes any further changes, it will have to be sent back to the Senate for another round of voting. Should that occur, the overall viability of the legislation would be in even greater jeopardy. The goal of republican leadership remains to have this package on the President’s desk by July 4, meaning the House will have to be called back from their district work period this week to take the needed votes.",https://www.convenience.org/getattachment/Media/Daily/2025/July/2/2-Senate-Passes-One-Big-Beautiful-Bill_GR/Story-2.png,N,,2025-07-02 18:07:56.781590
,,2025-07-02 20:40:12+00:00,nobhillgazette.com,Wings of Desire: The Inside Track on Flying Private | Travel | nobhillgazette.com,"David Nash, Courtesy FXAIR, Courtesy Wheels Up, Courtesy Dreamline Aviation",,,,,https://www.nobhillgazette.com/places/travel/wings-of-desire-the-inside-track-on-flying-private/article_c7c3efc4-8d00-46bb-acf2-018c567f3ad7.html,"If you’re considering flying private, we’ve got the inside track on a few of the most popular and trusted companies — and what it costs to take off.",Not Available,https://bloximages.chicago2.vip.townnews.com/nobhillgazette.com/content/tncms/assets/v3/editorial/b/dd/bdd8bdbc-be2d-4833-b784-28ac250c4950/6847565c9ac98.image.jpg?crop=1587%2C833%2C0%2C235&resize=1200%2C630&order=crop%2Cresize,N,,2025-07-02 21:02:22.158134
,,2025-07-02 20:21:24+00:00,ACT News,Senate Approves 'One Big Beautiful Bill' with Clean Energy Rollbacks - ACT News,Not Available,,,,,https://www.act-news.com/news/senate-approves-one-big-beautiful-bill-with-clean-energy-rollbacks/,"The U.S. Senate narrowly passed the sweeping One Big Beautiful Bill today with a 51–50 vote.
The newest version of the bill includes a rollback of certain clean energy tax credits established under the Inflation Reduction Act.
The Senate’s version of the bill also shortens the lifespan of the 45V hydrogen production tax credit.
The Senate version of the bill also includes modifications to biofuel and renewable diesel tax credits.
For sustainable aviation fuel, the Senate version rolls back the enhanced credit rate for fuel sold after 2025.","The U.S. Senate narrowly passed the sweeping One Big Beautiful Bill today with a 51–50 vote. Vice President J.D. Vance cast the tiebreaking vote, securing the bill’s return to the House for a final vote.

The newest version of the bill includes a rollback of certain clean energy tax credits established under the Inflation Reduction Act. Under the Senate-passed version, the bill accelerates the sunset of some existing incentives, including the consumer tax credit for electric vehicles and used EV credit, which will expire on September 30, 2025.

The Senate’s version of the bill also shortens the lifespan of the 45V hydrogen production tax credit. Originally enacted as part of the Inflation Reduction Act, the 45V credit was designed to provide up to $3 per kilogram of low-emission hydrogen during a 10-year period. Under the Senate-passed legislation, the credit would be phased out entirely for projects not under construction by the end of 2027. Hydrogen facilities that begin construction before the bill’s enactment and are operational by December 31, 2027, would remain eligible for the credit. The change could also affect the future of the Department of Energy’s Regional Clean Hydrogen Hubs initiative, which is reliant on the 45V credit to attract private capital and ensure commercial feasibility.

The Senate version of the bill also includes modifications to biofuel and renewable diesel tax credits. It extends the clean fuel production credit — Section 45Z — through 2031, but applies a 20% reduced credit value for biofuels manufactured from feedstocks sourced outside the U.S. The legislation also revives and increases the small agri-biodiesel producer credit, boosting it from $0.10 to $0.20 per gallon and extending eligibility through December 31, 2026, and reinstates credit transferability.

For sustainable aviation fuel, the Senate version rolls back the enhanced credit rate for fuel sold after 2025. However, the basic SAF credit remains available through fuel sold in 2029 as part of Section 45Z adjustments.

The House is expected to take up the bill later this week. If successful, President Trump is expected to sign the bill into law on or before July 4.",https://www.act-news.com/wp-content/uploads/2025/07/CSPAN-Senate-Vote.jpg,N,,2025-07-02 19:06:44.456543
,,2025-07-02 19:51:15+00:00,Aviation Pros,"Senate Passes ATC Funding, Extends Bonus Depreciation | Aviation Pros",Not Available,,,,,https://www.aviationpros.com/airport-business/airport-infrastructure-operations/press-release/55300911/senate-passes-atc-funding-extends-bonus-depreciation,"After more than 24 hours of Senate floor debate, the Trump Administration’s budget reconciliation bill continues to make progress toward final passage.
Included in the latest version are several pro-aviation policies passed by the House of Representatives in late May, notably a $12.5-billion “down payment” on critical air traffic control modernization and controller staffing.
Although the Senate bill extends the 45Z Clean Fuel Production Credit through December 31, 2029, it eliminates the enhanced value for sustainable aviation fuel, which producers have signaled is key to scaling up domestic production facilities.
The “Big, Beautiful Bill” narrowly passed the U.S. Senate this afternoon in a 51-50 vote, with the Vice President breaking the tie.
This version now goes back to the House for approval, where leadership hopes to approve a final version before the Administration’s July 4 deadline.","After more than 24 hours of Senate floor debate, the Trump Administration’s budget reconciliation bill continues to make progress toward final passage. Included in the latest version are several pro-aviation policies passed by the House of Representatives in late May, notably a $12.5-billion “down payment” on critical air traffic control modernization and controller staffing.

NATA joined more than 50 fellow members of the Modern Skies Coalition in thanking the Senate for approving the critical funds: “The safety of travelers and our employees is paramount, and this dedicated investment is a much needed down payment to creating a more efficient National Airspace System (NAS) by urgently addressing antiquated technology and deteriorating facilities.”

NATA also applauds the Senate’s permanent extension of 100-percent bonus depreciation for aircraft purchased after January 19, 2025, as well its pathway for pilot and aircraft mechanic training expenses to qualify for 529 college savings plans, if they are used to pursue an occupational or professional license issued or recognized by the federal government. Although the Senate bill extends the 45Z Clean Fuel Production Credit through December 31, 2029, it eliminates the enhanced value for sustainable aviation fuel, which producers have signaled is key to scaling up domestic production facilities.

The “Big, Beautiful Bill” narrowly passed the U.S. Senate this afternoon in a 51-50 vote, with the Vice President breaking the tie. This version now goes back to the House for approval, where leadership hopes to approve a final version before the Administration’s July 4 deadline.","https://img.aviationpros.com/files/base/cygnus/cavc/image/2025/07/686536ec41e160ef84430ea8-nata.png?auto=format,compress&fit=fill&fill=blur&w=1200&h=630",N,,2025-07-02 18:08:01.710524
,,2025-07-02 19:26:17+00:00,YouTube,Why 45Z Incentives Are Key for U.S. Sustainable Aviation Fuel #youtubeshorts #carbonintensity,Not Available,,,,,https://www.youtube.com/shorts/309K3HKn2kA,"Is 45Z make or break for the SAF industry? Not exactly — but without durable federal and state incentives, the U.S. risks falling behind. Hear what Meg Whitt...",Not Available,https://i.ytimg.com/vi/309K3HKn2kA/oar2.jpg?sqp=-oaymwEoCJUDENAFSFqQAgHyq4qpAxcIARUAAIhC2AEB4gEKCBgQAhgGOAFAAQ==&rs=AOn4CLCeNFSYr1muOwFhNZTCy0sUKN1_KQ,N,,2025-07-02 19:06:49.032341
