id,name,published,outlet,title,authors,category,market,categoryorder,articleorder,url,description,text,image,error,sentiment,firstEyes
,,2025-07-04 08:19:24+00:00,Sangri Today,Energy Visionary Vasanth JB Bullish on ASEAN Sustainable Aviation Fuel Market,"ST Webdesk, Sangri Today",,,,,https://www.sangritoday.com/energy-visionary-vasanth-jb-bullish-on-asean-sustainable-aviation-fuel-market,"Sustainable Aviation Fuel (SAF) represents a breakthrough in sustainable aviation.
As a strong advocate for Sustainable Aviation Fuel (SAF), Indian industrialist and energy visionary Vasanth JB views Southeast Asia as a regional force that can lead the global charge toward cleaner skies.
Unlike regular jet fuel, SAF is sustainable as an aviation fuel.
According to Vasanth, the synergy among policy, industry, and airport infrastructure is creating “a golden corridor for green aviation” in Southeast Asia.
While blending mandates are currently under national jurisdiction, informal dialogues suggest a regional SAF target announcement.","The aviation industry has made the world smaller, making international travel a matter of hours instead of months or years. However, the heavy carbon footprints of long-haul flights are also making air travel increasingly environmentally unsustainable and a serious concern. Sustainable Aviation Fuel (SAF) represents a breakthrough in sustainable aviation. Unlike conventional jet fuel derived from petroleum, SAF is produced from a diverse range of renewable feedstocks. As a strong advocate for Sustainable Aviation Fuel (SAF), Indian industrialist and energy visionary Vasanth JB views Southeast Asia as a regional force that can lead the global charge toward cleaner skies.

What is SAF?

Unlike regular jet fuel, SAF is sustainable as an aviation fuel. It is produced from renewable feedstocks, like waste oils, agricultural residues, municipal solid waste, and even captured carbon dioxide.

The fundamental distinction lies not in its combustion properties as SAF performs identically to conventional jet fuel in aircraft engines. Sustainability comes from SAF’s lifecycle carbon profile. SAF feedstocks are specifically selected to avoid competition with food production, prevent deforestation, and minimize water consumption, and thus encompasses a comprehensive approach to sustainability. SAF production contributes to broader environmental goals rather than merely shifting environmental burdens from one sector to another.

In a world increasingly conscious of climate imperatives, few voices resonate with both clarity and conviction like that of Indian industrialist and energy visionary Vasanth JB. As a strong advocate for Sustainable Aviation Fuel (SAF), Vasanth sees Southeast Asia not just as a passive consumer in the aviation transition, but as a regional force that could lead the global charge toward cleaner skies.

“The ASEAN bloc is poised for a fuel transformation. With the right policy coordination and industry participation, Southeast Asia could become the world’s most cost-effective, feedstock-rich SAF region.” - Vasanth JB during a closed-door session with energy executives in Kuala Lumpur.

The SAF Momentum in ASEAN: A Perfect Takeoff Runway

ASEAN (Association of Southeast Asian Nations) countries are aligning their strategies with ICAO’s (International Civil Aviation Organization) CORSIA framework. It encompasses net-zero targets and lays the policy and infrastructure groundwork for widespread adoption of SAF.

Singapore, Malaysia, Indonesia, Thailand, and Vietnam have made concrete contributions, starting from formulating SAF blending mandates, repurposing refineries, to securing long-term procurement agreements with international carriers.

According to Vasanth, the synergy among policy, industry, and airport infrastructure is creating “a golden corridor for green aviation” in Southeast Asia.

Airports Fuel the Future

One of the clearest indicators of progress is the commitment from major ASEAN airports to integrate SAF infrastructure into their fueling systems. These airports are:

●Changi International Airport (Singapore)

●KLIA (Kuala Lumpur, Malaysia)

●Soekarno-Hatta International Airport (Jakarta, Indonesia)

●Suvarnabhumi Airport (Bangkok, Thailand)

They are in various stages of feasibility studies and infrastructure upgrades for SAF blending, storage, and distribution pipelines. These upgrades will be rolled out in phases between 2026 and 2030, reflecting an accelerated transition to operational readiness.

Feedstock Richness: The ASEAN Advantage

A defining strength for ASEAN is its abundance of feedstock sources suitable for HEFA (Hydroprocessed Esters and Fatty Acids)-based SAF:

●Malaysia and Indonesia lead in palm oil waste and used cooking oil.

●Thailand and Vietnam offer large volumes of agricultural residues.

●Singapore is becoming the logistics and refining nexus

In fact, “feedstock availability and logistics integration give ASEAN an edge over other regions,” said Vasanth as part of his discussions with several SAF startups and biofuel traders across the region.

Harmonizing Regional Targets: The Next Milestone

The emerging policy harmonization across ASEAN countries is extremely promising for many players in the region’s biofuel sector. While blending mandates are currently under national jurisdiction, informal dialogues suggest a regional SAF target announcement. This will be potentially modeled on the EU’s ReFuelEU initiative.

A multi-nation regional target would reduce fragmentation, pool investment across borders, and give global investors a coherent, scalable framework for entering the ASEAN SAF market.",https://www.sangritoday.com/uploads/images/202507/image_870x580_68678ce7b19c1.webp,N,,2025-07-04 07:05:40.415553
,,2025-07-04 08:08:01+00:00,Hydrocarbon Engineering,Petrobras announces investments in refining and petrochemicals in Brazil,Ellie Brosnan,,,,,https://www.hydrocarbonengineering.com/petrochemicals/04072025/petrobras-announces-investments-in-refining-and-petrochemicals-in-brazil/,"Petrobras has announced that investments totalling approximately R$33 billion are planned for refining and petrochemical projects in Rio de Janeiro, Brazil, of which R$29 billion are planned for the Petrobras Capex and R$4 billion in another project that operates in synergy with Petrobras assets.
This new structure will increase S-10 diesel production by 76 000 bpd, 56 000 of which will come from quality improvements and 20 000 from additional capacity.
The project also provides for a 20 000 bpd increase in jet fuel production capacity and a 12 000 bpd increase in Group II lubricating oil production.
Decarbonisation at Reduc Reduc has completed a test for producing the first jet fuel with renewable content (SAF) through co-processing, reaching up to 1.2% corn oil in jet fuel production.
In addition to Petrobras’ projects in the region, Braskem, a Petrobras affiliate, is planning to expand its polyethylene plant, increasing the unit’s production capacity by up to 230 000 tpy.","Petrobras has announced that investments totalling approximately R$33 billion are planned for refining and petrochemical projects in Rio de Janeiro, Brazil, of which R$29 billion are planned for the Petrobras Capex and R$4 billion in another project that operates in synergy with Petrobras assets.

Energy Complex (Itaboraí – RJ) and Reduc (Duque de Caxias – RJ) involves an estimated investment of R$26 billion. This amount is included in the 2025 - 2029 Business Plan (PN 2025 - 2029), and service packages for the projects are currently in the bidding phase.

This new structure will increase S-10 diesel production by 76 000 bpd, 56 000 of which will come from quality improvements and 20 000 from additional capacity. The project also provides for a 20 000 bpd increase in jet fuel production capacity and a 12 000 bpd increase in Group II lubricating oil production.

The project also includes a dedicated bio jet fuel plant at the Boaventura Complex, with a production capacity of 19 000 bpd of renewable fuels, including hydrotreated vegetable oil (HVO) and sustainable aviation fuel (SAF); and two gas-fired power plants at the complex, which will participate in capacity reserve auctions. The engineering project for the power plants has been approved, and the units will leverage synergies with the infrastructure of the Itaboraí Natural Gas Processing Unit (UPGN).

A lubricant oil re-refining project with a capacity of 30 000 m³/month (6300 bpd) is also under evaluation at Reduc. With the operation of the Boaventura Complex for Group II lubricant oil production, Reduc may repurpose existing units to re-refine used oil, applying the circular economy concept to generate high-value products from waste. The co-processing test has already been authorised by ANP and is expected to take place in 2025.

Decarbonisation at Reduc

Reduc has completed a test for producing the first jet fuel with renewable content (SAF) through co-processing, reaching up to 1.2% corn oil in jet fuel production. ANP authorisation has already been granted, and commercial production at Reduc is scheduled to begin in 2025, with a capacity of up to 50 000 m³/month (10 000 bpd).

Reduc already produces Diesel R5, with 5% renewable content, and has received ANP authorisation to begin testing a new 7% blend for Diesel R7 production. These initiatives reinforce Petrobras’ commitment to the decarbonisation of its products and the energy transition.

Petrobras plans to build a new thermal power plant at Reduc to replace obsolete steam and power generation equipment, with expected investments of R$860 million, enhancing reliability and bringing the refinery up to the highest international efficiency standards.

Investments of up to R$2.4 billion in maintenance shutdowns at Reduc are also planned from 2025 to 2029, to ensure the integrity, reliability, and safety of the facilities. Major shutdowns are scheduled for 2026 in the delayed coking and hydrotreatment units of the refinery.

Petrochemicals

In the petrochemical segment, a study for the production of acetic acid and monoethylene glycol (MEG) is under evaluation at the Boaventura Complex. Acetic acid is an important raw material for the production of paint, PET, and the broader chemical industry. Brazil currently imports its entire acetic acid demand and complements MEG demand with imports.

In addition to Petrobras’ projects in the region, Braskem, a Petrobras affiliate, is planning to expand its polyethylene plant, increasing the unit’s production capacity by up to 230 000 tpy. The project, which uses part of the natural gas processed at Route 3 of the Boaventura Complex, is budgeted at around R$4 billion and remains subject to the necessary approvals by Braskem’s governance bodies.",https://dlgivnpf6gg8w.cloudfront.net/media/articles/pop/brazil-02.jpg,N,,2025-07-04 12:15:15.081743
,,2025-07-04 06:31:16+00:00,financialpost,Petrobras Boosts Lula's Economic Agenda With Refining Investment | Financial Post,Bloomberg News,,,,,https://financialpost.com/pmn/business-pmn/petrobras-boosts-lulas-economic-agenda-with-refining-investment,"Unlimited online access to read articles from Financial Post, National Post and 15 news sites across Canada with one account.
Article content We apologize, but this video has failed to load.
Petrobras Boosts Lula's Economic Agenda With Refining Investment Back to video Article content Article content The refining investments are part of Lula’s push to expand fuel supply and make prices more affordable, and the announcement comes at a time when Lula is contending with some of his lowest approval ratings.
Article content Chambriard took the helm of Petrobras a year-ago with a mandate to speed up investments and help revive Brazilian industry.
Article content New petrochemicals studies and projects mark a rapprochement between Petrobras and Braskem.","Article content

(Bloomberg) — Brazil’s state-controlled oil producer Petrobras announced on Thursday about 30 billion reais ($5.5 billion) in refining and petrochemicals investments in Rio de Janeiro state that align with the government’s wider plan to create jobs and accelerate economic growth.

THIS CONTENT IS RESERVED FOR SUBSCRIBERS ONLY

Subscribe now to read the latest news in your city and across Canada.

Exclusive articles from Barbara Shecter, Joe O'Connor, Gabriel Friedman, and others.

Daily content from Financial Times, the world's leading global business publication.

Unlimited online access to read articles from Financial Post, National Post and 15 news sites across Canada with one account.

National Post ePaper, an electronic replica of the print edition to view on any device, share and comment on.

Daily puzzles, including the New York Times Crossword.

SUBSCRIBE TO UNLOCK MORE ARTICLES

Subscribe now to read the latest news in your city and across Canada.

Exclusive articles from Barbara Shecter, Joe O'Connor, Gabriel Friedman and others.

Daily content from Financial Times, the world's leading global business publication.

Unlimited online access to read articles from Financial Post, National Post and 15 news sites across Canada with one account.

National Post ePaper, an electronic replica of the print edition to view on any device, share and comment on.

Daily puzzles, including the New York Times Crossword.

REGISTER / SIGN IN TO UNLOCK MORE ARTICLES

Create an account or sign in to continue with your reading experience.

Access articles from across Canada with one account.

Share your thoughts and join the conversation in the comments.

Enjoy additional articles per month.

Get email updates from your favourite authors.

THIS ARTICLE IS FREE TO READ REGISTER TO UNLOCK.

Create an account or sign in to continue with your reading experience.

Access articles from across Canada with one account

Share your thoughts and join the conversation in the comments

Enjoy additional articles per month

Get email updates from your favourite authors

Sign In or Create an Account

Email Address

or

Article content

The group of investments focus on producing renewable fuels and improving energy efficiency. President Luiz Inacio Lula da Silva will travel to Rio on Friday for an official announcement of the projects that could create more than 38,000 jobs, according to the company.

Article content

We apologize, but this video has failed to load.

Try refreshing your browser, or

tap here to see other videos from our team.

Petrobras Boosts Lula's Economic Agenda With Refining Investment Back to video

Article content

Article content

The refining investments are part of Lula’s push to expand fuel supply and make prices more affordable, and the announcement comes at a time when Lula is contending with some of his lowest approval ratings.

Article content

“We’re meeting the expectations not only of President Lula, but also of ourselves and society,” Chief Executive Officer Magda Chambriard said at a press conference.

Article content

Chambriard took the helm of Petrobras a year-ago with a mandate to speed up investments and help revive Brazilian industry. In addition to outlays at refineries that the previous administration wanted to sell, the oil company has plans increase its fleet of ships and explore new offshore areas in the country.

Article content

Petroleo Brasileiro SA, as it’s formally known, will deploy nearly 9 billion reais in new projects that include a sustainable aviation plant, modernizing a thermoelectric plant and refinery maintenance.

Article content

That adds to another 20 billion reais of ongoing investments by Petrobras to expand a refinery at Duque de Caxias and its Boaventura Energy Complex, located about an hour and a half from Rio. Petrobras’s 2025-2029 spending plan earmarks $19.6 billion for refining and related business lines such as fertilizers and logistics, 17% more than the previous one.

Article content

Article content

The state-run oil giant also included in the package a 4.3-billion-reais project to increase output at a plastics hub run by Braskem, a top thermoplastic resins maker that has Petrobras as its second-biggest shareholder. The plant is expected to start in 2028 and the spending will be made by Braskem.

Article content

“The investment doesn’t affect Petrobras’s cash generation or financial resources,” said Braskem CEO, Roberto Ramos, adding that Braskem will use fiscal credits and may access the debt market to pay for it.

Article content

Petrobras is also starting test production of fuels with renewable content, including the so-called diesel R that is made by processing fossil fuel with animal or vegetable oil, as well as sustainable aviation fuel.

Article content

New petrochemicals studies and projects mark a rapprochement between Petrobras and Braskem. Petrobras’s CEO has said that the oil producer wants a bigger role in Braskem’s management to maximize synergies with the company.",https://smartcdn.gprod.postmedia.digital/financialpost/wp-content/uploads/2025/07/775979134.jpg,N,,2025-07-04 11:02:57.312589
,,2025-07-04 06:20:50+00:00,Bloomberg.com,Petrobras Boosts Lula's Economic Agenda With Refining Investment - Bloomberg.com,"Mariana Durao, Beatriz Amat",,,,,https://www.bloomberg.com/news/articles/2025-07-03/petrobras-boosts-lula-s-economic-agenda-with-refining-investment,"Brazil’s state-controlled oil producer Petrobras announced on Thursday about 30 billion reais ($5.5 billion) in refining and petrochemicals investments in Rio de Janeiro state that align with the government’s wider plan to create jobs and accelerate economic growth.
The group of investments focus on producing renewable fuels and improving energy efficiency.
President Luiz Inacio Lula da Silva will travel to Rio on Friday for an official announcement of the projects that could create more than 38,000 jobs, according to the company.","Brazil’s state-controlled oil producer Petrobras announced on Thursday about 30 billion reais ($5.5 billion) in refining and petrochemicals investments in Rio de Janeiro state that align with the government’s wider plan to create jobs and accelerate economic growth.

The group of investments focus on producing renewable fuels and improving energy efficiency. President Luiz Inacio Lula da Silva will travel to Rio on Friday for an official announcement of the projects that could create more than 38,000 jobs, according to the company.",https://assets.bwbx.io/images/users/iqjWHBFdfxIU/iXFWh2AC6Gys/v0/1200x800.jpg,N,,2025-07-04 11:03:01.995418
,,2025-07-04 04:22:19+00:00,www.hydrocarbonprocessing.com,Bangkok Airways introduces SAF on commercial flights - Hydrocarbon Processing,Not Available,,,,,https://www.hydrocarbonprocessing.com/news/2025/07/bangkok-airways-introduces-saf-on-commercial-flights/,"Bangkok Airways Public Company Ltd. continues to drive its ""Low Carbon Skies by Bangkok Airways"" campaign, aiming to reduce carbon dioxide emissions.
Captain Puttipong Prasarttong-Osoth, President of Bangkok Airways Public Company Limited, revealed that “The official use of SAF on commercial flights marks a significant milestone in the airline’s transition toward a more environmentally friendly aviation future.
As a leading regional airline, Bangkok Airways is committed to enhancing the quality of its services while upholding its core mission to create sustainable value for all stakeholders.
Bangkok Airways is committed to evolving into a truly “Sustainable Airline,” guided by the ESG framework, which is integrated across all aspects of its operations.
In terms of environmental responsibility, Bangkok Airways focuses on climate change management, waste management, efficient use of resources, and the adoption of alternative energy sources.","Bangkok Airways Public Company Ltd. continues to drive its ""Low Carbon Skies by Bangkok Airways"" campaign, aiming to reduce carbon dioxide emissions. The airline has officially announced the adoption of sustainable aviation fuel (SAF) on its commercial flights, reinforcing Thailand’s green aviation industry and laying a crucial foundation for environmentally balanced aviation development in the future. The initiative will take effect starting July 1, 2025.

Captain Puttipong Prasarttong-Osoth, President of Bangkok Airways Public Company Limited, revealed that “The official use of SAF on commercial flights marks a significant milestone in the airline’s transition toward a more environmentally friendly aviation future. This initiative aligns with the goal of achieving Net Zero Carbon Emissions, which lies at the heart of sustainability policies in the aviation sector. In 2024, the airline began using SAF on a pilot flight operating between Samui and Bangkok. This time, SAF will be used on commercial flights departing from Bangkok (Suvarnabhumi Airport) to international destinations including Phnom Penh, Siem Reap, Luang Prabang, and the Maldives.”

Bangkok Airways will begin using SAF blended at 1% with 99% Jet A-1 fuel, which can help reduce carbon dioxide emissions by an average of approximately 128 kilograms of CO₂ per flight.

As a leading regional airline, Bangkok Airways is committed to enhancing the quality of its services while upholding its core mission to create sustainable value for all stakeholders. The airline takes pride in delivering memorable and environmentally conscious travel experiences to its passengers, while actively contributing to the genuine and sustainable growth of Thailand’s aviation industry.

Bangkok Airways is committed to evolving into a truly “Sustainable Airline,” guided by the ESG framework, which is integrated across all aspects of its operations. The airline upholds responsibility in three aspects: Environmental, Social, and Governance. In terms of environmental responsibility, Bangkok Airways focuses on climate change management, waste management, efficient use of resources, and the adoption of alternative energy sources.

The company continues to explore comprehensive measures to improve fuel efficiency, conduct corporate carbon footprint reporting (Scopes 1–3), expand waste separation bins, and promote the upcycling of operational waste into products that benefit both society and the environment. The airline also encourages stakeholders to participate in environmentally friendly services and initiatives, such as the “Love Earth, Save Earth” project, now in its 8th year, which involves planting coconut trees to support the ecosystem of Koh Samui.

Related News

From the Archive",https://hydrocarbonprocessing.com//media/vu1ei0vd/bangkok-airways.jpg,N,,2025-07-04 04:00:02.754478
,,2025-07-04 03:54:21+00:00,Instagram,BusinessDay | The International Air Transport Association (IATA) announced the release of ...,Not Available,,,,,https://www.instagram.com/p/DLpjsaotQAR/,"6 likes, 0 comments - businessdayng on July 3, 2025: ""The International Air Transport Association (IATA) announced the release of the Sustainable Aviation Fuel (SAF) Matchmaker platform to facilitate SAF procurement between airlines and SAF producers by matching requests for SAF supply with offers.

When there is a match, airlines and suppliers can connect and take their negotiation offline to agree on specific terms, including price and payment terms.

Specifically, the SAF Matchmaker addresses three critical issues:

Efficiency: The availability of a central platform will simplify SAF procurement by making it easier and faster for all parties to connect without additional fees. It will therefore facilitate further development of the voluntary market for SAF purchasing.

Click the link in bio to read more.

#aviation #airlines #fuel #businessday"".",Not Available,https://scontent.cdninstagram.com/v/t51.82787-15/515181862_18400987468114079_5361124536695706569_n.jpg?stp=c216.0.648.648a_dst-jpg_e35_s640x640_tt6&_nc_cat=103&ccb=1-7&_nc_sid=18de74&_nc_ohc=HTTP3IQAfrMQ7kNvwG3DVyM&_nc_oc=Adm92-8DYydhKC7xmv2BCuuaTRY0WbVtwSrd6BgfaNosCblqUYoW9IqtFoXxL5soixM&_nc_zt=23&_nc_ht=scontent.cdninstagram.com&_nc_gid=ap-5xNYiRQv5C4vGItDQbw&oh=00_AfPCkp8kMAYRD7p1x1fiaVrM7FBLiYqr681I9TR0NnnWHw&oe=686D817C,N,,2025-07-04 05:02:56.547319
,,2025-07-04 03:09:47+00:00,www.biofuels-congress.com,Portugal Turns Kitchen Waste into SkyFriendly Fuel - Biofuels Congress 2025,IQ-HUB,,,,,https://www.biofuels-congress.com/news/portugal-turns-kitchen-waste-into-skyfriendly-fuel,"The BIOFUELS CONGRESS 2025 will be one of the largest exhibitions. A large array of professionals from the biofuels, biogas, and renewable energy sectors will be featured. Experts, including technology providers, AI specialists, and sustainable energy leaders, will showcase innovative solutions to address the industry's current challenges and advance energy goals.",Not Available,https://www.biofuels-congress.com/news/preview-image.png,N,,2025-07-04 08:00:03.952147
