id,name,published,outlet,title,authors,category,market,categoryorder,articleorder,url,description,text,image,error,sentiment,firstEyes
,,2025-06-03 17:21:46+00:00,www.chemanalyst.com,Honeywell and NTPC Green Partner to Produce Sustainable Aviation Fuel in India,Not Available,,,,,https://www.chemanalyst.com/NewsAndDeals/NewsDetails/honeywell-and-ntpc-green-partner-to-produce-sustainable-aviation-fuel-in-india-37090,"Global diversified technology and manufacturing leader Honeywell has announced a strategic collaboration with NTPC Green, the renewable energy arm of India's largest power utility NTPC Ltd.
The two companies have signed an agreement to jointly explore the production of Sustainable Aviation Fuel (SAF) within India, leveraging Honeywell's advanced eFining technology.
DMR Panda, Executive Director (Green Hydrogen) at NTPC Ltd., emphasized the importance of this collaboration, stating that SAF production forms a ""sizeable part"" of NTPC Green's ambitious Green Hydrogen Hub in Pudimadaka, Andhra Pradesh.
The Pudimadaka Green Hydrogen Hub, where SAF production will be explored, is being developed as India's first Green Hydrogen Hub under the National Green Hydrogen Mission.
1.85 lakh crore (approximately $22 billion), aims to produce 1,500 tonnes per day (TPD) of green hydrogen and 7,500 TPD of green hydrogen derivatives, including SAF, green methanol, and green urea.","Global diversified technology and manufacturing leader Honeywell has announced a strategic collaboration with NTPC Green, the renewable energy arm of India's largest power utility NTPC Ltd. The two companies have signed an agreement to jointly explore the production of Sustainable Aviation Fuel (SAF) within India, leveraging Honeywell's advanced eFining technology.

This landmark partnership aims to revolutionize SAF production by utilizing carbon dioxide (CO2) captured from NTPC's power plants as a feedstock, combined with green hydrogen.

DMR Panda, Executive Director (Green Hydrogen) at NTPC Ltd., emphasized the importance of this collaboration, stating that SAF production forms a ""sizeable part"" of NTPC Green's ambitious Green Hydrogen Hub in Pudimadaka, Andhra Pradesh. ""We believe that the mandate in the aviation sector for blending SAF in jet fuel will drive many early mover projects in green hydrogen,"" Panda added, highlighting the anticipated policy push that will accelerate SAF adoption.

Honeywell's proprietary eFining technology is central to this initiative. This cutting-edge process enables the efficient conversion of eMethanol, produced from captured CO2 and green hydrogen, into high-quality SAF. This technology is designed to produce a low-carbon intensity jet fuel with high SAF yield and selectivity, while also minimizing capital expenditure and plot space. It is a ""drop-in"" replacement fuel, meaning it can be blended with conventional jet fuel without requiring modifications to existing aircraft engines or infrastructure.

Ranjit Kulkarni, Vice President and General Manager, Energy and Sustainability Solutions, Honeywell India, underscored the strategic alignment of this partnership with India's environmental objectives. ""Our collaboration with NTPC Green will leverage Honeywell's expertise in SAF solutions to efficiently treat emissions from thermal energy, foster green hydrogen adoption, diversify feedstocks for SAF production and help India's aviation sector meet its long-term environmental goals,"" Kulkarni stated.

India has set ambitious targets for SAF blending, with plans to mandate a 1% SAF blending target by 2027, rising to 2% by 2028, and a more significant 5% by 2030. These targets align with international frameworks like CORSIA (Carbon Offsetting and Reduction Scheme for International Aviation) and India's broader commitment to achieving net-zero emissions by 2070 under the Panchamrit strategy.

The Pudimadaka Green Hydrogen Hub, where SAF production will be explored, is being developed as India's first Green Hydrogen Hub under the National Green Hydrogen Mission. This mega-project, with an estimated investment of Rs. 1.85 lakh crore (approximately $22 billion), aims to produce 1,500 tonnes per day (TPD) of green hydrogen and 7,500 TPD of green hydrogen derivatives, including SAF, green methanol, and green urea. Its strategic location near Visakhapatnam, with proximity to seaports, positions it as a potential hub for both domestic consumption and export of green fuels.",https://www.chemanalyst.com/images/favicon.ico,N,,2025-06-03 13:56:59.560188
,,2025-06-03 17:16:29+00:00,Reuters,"Britain has 12 days to save bioethanol industry, says AB Foods | Reuters",James Davey,,,,,https://www.reuters.com/sustainability/britain-has-12-days-save-bioethanol-industry-says-ab-foods-2025-06-03/,One of Britain's biggest bioethanol producers warned the government on Tuesday that unless it steps in with a support package for the industry within the next 12 days it will have to start closure processes at its plant.,Not Available,https://www.reuters.com/resizer/v2/IHU42F4LHNPORLOVGJ4NXCJFVQ.jpg?auth=277d0f6f0cba7279333792844c06261f71aa7ee52462038a1d73069cec235edb&height=1005&width=1920&quality=80&smart=true,N,,2025-06-03 13:57:03.685420
,,2025-06-03 15:53:42+00:00,Skift,Can Airline Growth and Climate Goals Coexist? Delta Thinks So - Skift,Darin Graham,,,,,https://skift.com/2025/06/03/can-airline-growth-and-climate-goals-coexist-delta-thinks-so/,"Speaking on Skift’s climate podcast GreenShift, Amelia DeLuca, Delta’s Chief Sustainability Officer, acknowledged the tension between business expansion and climate goals.
“Delta is not a sustainability company that just happens to have an airline - we're an airline that has a sustainability team and policy,” DeLuca said.
“The industry, Delta included, is in growth mode as we come back from the pandemic,” DeLuca said.
The Race for Sustainable Aviation Fuel DeLuca made it clear that operational tweaks and better planes won’t be enough.
Airlines alone can’t solve climate change.” Skift’s in-depth reporting on climate issues is made possible through the financial support of Intrepid Travel.","Delta Air Lines says sustainability is still a top priority, even as the company grows and its greenhouse gas emissions increase.

Speaking on Skift’s climate podcast GreenShift, Amelia DeLuca, Delta’s Chief Sustainability Officer, acknowledged the tension between business expansion and climate goals.

But she said the airline remains focused on reducing emissions.

“Delta is not a sustainability company that just happens to have an airline - we're an airline that has a sustainability team and policy,” DeLuca said. “But we also know that if we don’t decarbonize, we lose our license to operate over the next hundred years.”

Listen to This Podcast

A Balancing Act Between Growth and Green Goals

Airlines are under growing pressure to curb emissions, with the sector pledging to reach net zero by 2050. But Delta’s emissions rose in 2024 to their highest level since before the pandemic, according to its most recent sustainability report.

“The industry, Delta included, is in growth mode as we come back from the pandemic,” DeLuca said. “We’ve just seen continued support for international travel and premium travel. So Delta is obviously trying to serve its customers as best we can. And through that, you’re seeing growth in international destinations and premium seats.”

The airline has hundreds of planes on order and while new aircraft are more efficient, more flights will mean more emissions.

Despite rising emissions, DeLuca pointed to signs of progress. She said Delta increased its capacity by 5% last year compared to 2019, but used less jet fuel, a first for the airline. It saved 45 million gallons of jet fuel and roughly $110 million.

“That means we’re growing, but doing so more efficiently,” she said.

Delta credits that efficiency to flight improvements such as more efficient routes as well as newer aircraft, which the International Air Transport Association says can be up to 20% more fuel efficient than older models.

DeLuca also said part of the emissions increase comes down to better data. As Delta improves tracking of indirect emissions, such as those from suppliers, its total footprint appears larger.

“Our scope three emissions look like they’re going up, but it’s just because we’re now working with our supply chain to give us the most accurate emissions that we can get,” she said.

The Race for Sustainable Aviation Fuel

DeLuca made it clear that operational tweaks and better planes won’t be enough.

“Sustainable aviation fuel (SAF) is the biggest lever,” she said. “It’s the only thing that gets us to net zero. We’re in a race against time.”

Delta is building a SAF blending hub in Minnesota and working with corporate clients to create demand. The airline hopes this can serve as a model for broader state-level action.

There have been concerns that SAF production will never be able to grow to the level required by the entire aviation sector, as it tries to decarbonize, due to issues around feedstocks.

The fuel uses things like used cooking oil, of which there is limited supply, and plants, which are feared might result in crop displacement - taking vital land away for things like food for humans, for SAF.

“There's a limit to how much used cooking oil exists. The next generation of SAF is using biomass type products, such as corn waste, potentially woody biomass from fallen trees,” DeLuca said. “All those have a limit.”

DeLuca called on the sector to continue investing in new technologies such as carbon capture, capturing gasses out of the atmosphere using renewable energy and turning it back into fuel. “These are unlimited feedstocks. And that cost profile of that product, if you have unlimited feedstocks, is actually lower than conventional jet fuel today. But that is a long way off. This is going to take all of us. Airlines alone can’t solve climate change.”

Skift’s in-depth reporting on climate issues is made possible through the financial support of Intrepid Travel. This backing allows Skift to bring you high-quality journalism on one of the most important topics facing our planet today. Intrepid is not involved in any decisions made by Skift’s editorial team.","https://skift.com/wp-content/uploads/2025/06/dsc09631.jpg?resize=1024,683",N,,2025-06-03 12:56:52.845259
,,2025-06-03 15:28:18+00:00,Legal Planet,Could Zero-Emission Hydrogen Help Reduce Aviation Emissions in California? - Legal Planet,Not Available,,,,,https://legal-planet.org/2025/06/03/hydrogen-in-californias-aviation-sector/%3Fpdf%3D43518,"Climate Lawsuits Now a Matter of Life and Death The Drain is a weekly roundup of environmental and climate news from Legal Planet.
Gas Price Politics and Desperate Moderates The Drain is a weekly roundup of environmental and climate news from Legal Planet.
Trump Goes Nuclear Four new executive orders try to launch a nuclear renaissance.
Climate Lawsuits Now a Matter of Life and Death The Drain is a weekly roundup of environmental and climate news from Legal Planet.
Gas Price Politics and Desperate Moderates The Drain is a weekly roundup of environmental and climate news from Legal Planet.","A Critical Analysis of the Seven Counties Opinion

The court’s opinion ignores basic principles of law and statutory text in order to achieve a policy goal.

Climate Lawsuits Now a Matter of Life and Death

The Drain is a weekly roundup of environmental and climate news from Legal Planet.

Could Zero-Emission Hydrogen Help Reduce Aviation Emissions in California?

State’s federally funded hydrogen hub releases aviation whitepaper co-led by CLEE.

The Outcome of the Seven Counties Case

Court emphasizes agency discretion and judicial deference in NEPA.

Left NIMBYs Strike Out Yet Again

The Urban Institute study that they cite as evidence for stopping housing does not say what they claim.

Environmental Rollbacks: Will the Trump Administration Overplay Its Hand?

The odds are good that Trump agencies will go too far out on a limb.

Gas Price Politics and Desperate Moderates

The Drain is a weekly roundup of environmental and climate news from Legal Planet.

Trump Goes Nuclear

Four new executive orders try to launch a nuclear renaissance.

What Happened to EPA Enforcement?

Enforcement efforts peaked long ago and have been in long-term decline. Trump will accelerate that.

Calling Captain Renault

We are shocked – SHOCKED – that building more housing causes rents to fall

Why You Should Care That Congress Might Use the CRA to Overturn California Waivers

Here are at least six reasons.

Climate Lawsuits Now a Matter of Life and Death

The Drain is a weekly roundup of environmental and climate news from Legal Planet.

If Dodgers Don’t Quit Big Oil, the Olympics May Make Them

The Olympic Committee’s ban on most advertising could finally force the Dodgers to drop the 76 sponsorship from Dodger Stadium, which is now an LA 2028 venue.

The Outcome of the Seven Counties Case

Court emphasizes agency discretion and judicial deference in NEPA.

Environmental Rollbacks: Will the Trump Administration Overplay Its Hand?

The odds are good that Trump agencies will go too far out on a limb.

Gas Price Politics and Desperate Moderates

The Drain is a weekly roundup of environmental and climate news from Legal Planet.

Trump Goes Nuclear

Four new executive orders try to launch a nuclear renaissance.

What Happened to EPA Enforcement?

Enforcement efforts peaked long ago and have been in long-term decline. Trump will accelerate that.

Executive Disorders

One after another, Trump has let loose destructive blasts at the environment to promote fossil fuels, mining, and logging.

A Midnight Public Land Sale?

Last-minute addition to House reconciliation bill proposes sale or exchange of hundreds of thousands of acres of public lands",,N,,2025-06-03 13:57:10.626787
,,2025-06-03 15:24:58+00:00,Brownfield Ag News,Sustainable Aviation Fuel Opportunities - Brownfield Ag News,Abbie.Kemna@learfield.com,,,,,https://www.brownfieldagnews.com/managing-for_profit/sustainable-aviation-fuel-opportunities/,"The Illinois Corn Marketing Board believes that sustainable aviation fuel could be the next boom for corn demand.
In this Managing for Profit, Dr. Steffen Mueller, principal economist at the University of Illinois-Chicago Energy Resources Center, discusses how checkoff funding is helping to expand research to ensure corn’s inclusion in the developing global SAF industry.","The Illinois Corn Marketing Board believes that sustainable aviation fuel could be the next boom for corn demand. In this Managing for Profit, Dr. Steffen Mueller, principal economist at the University of Illinois-Chicago Energy Resources Center, discusses how checkoff funding is helping to expand research to ensure corn’s inclusion in the developing global SAF industry.",https://www.brownfieldagnews.com/wp-content/themes/brownfield/images/favicon.ico,N,,2025-06-03 12:56:57.393964
,,2025-06-03 15:23:19+00:00,Legal Planet,Could Zero-Emission Hydrogen Help Reduce Aviation Emissions in California?,Shruti Sarode,,,,,https://legal-planet.org/2025/06/03/hydrogen-in-californias-aviation-sector/,"Could Zero-Emission Hydrogen Help Reduce Aviation Emissions in California?
To explore the potential for hydrogen to help decarbonize the aviation sector, the state’s federally funded hydrogen hub ARCHES (Alliance for Renewable Clean Hydrogen Energy Systems, representing a California-based public-private partnership to develop and deploy renewable, clean hydrogen projects) just released a white paper detailing the opportunities, challenges, and policy needs.
Integrate Aviation into Clean Transportation Programs: Including hydrogen aviation projects in state-level clean transportation initiatives—such as the CEC’s Clean Transportation Program—would accelerate hydrogen propulsion timelines and de-risk private investment.
Foster Regional Hydrogen Clusters: Developing hydrogen “clusters” at airports like Long Beach would create hubs of hydrogen activity, supporting ground equipment, transit systems, and eventually hydrogen aircraft.
With planning and leadership, hydrogen could become a cornerstone of a clean, resilient aviation system in California.","Could Zero-Emission Hydrogen Help Reduce Aviation Emissions in California?

State’s federally funded hydrogen hub releases aviation whitepaper co-led by CLEE.

Few industries face as complex a challenge in decarbonizing as aviation. While great for decarbonizing on-road transportation, batteries are generally too heavy to power long-distance flights. Low-carbon biofuels blended into fossil jet fuel represent only a partial solution, due to lack of feedstocks and blend limits. Zero-emission hydrogen could represent a solution, either as an ingredient for synthetic jet fuel that can drop in as a replacement for fossil jet fuel or to power fuel cells on redesigned zero-emission aircraft.

To explore the potential for hydrogen to help decarbonize the aviation sector, the state’s federally funded hydrogen hub ARCHES (Alliance for Renewable Clean Hydrogen Energy Systems, representing a California-based public-private partnership to develop and deploy renewable, clean hydrogen projects) just released a white paper detailing the opportunities, challenges, and policy needs. Berkeley Law’s Center for Law, Energy & the Environment (CLEE) co-chaired the ARCHES Aviation Working Group that produced the report, along with San Francisco International Airport (SFO) and RMI.

Key Recommendations

While hydrogen’s promise is substantial, barriers remain. High production costs, limited infrastructure, and fragmented safety and technical standards have slowed adoption. The whitepaper offers a targeted set of recommendations for state leaders, including:

Develop Standards and Policy Frameworks: California state agencies, in collaboration with federal and international partners, could create robust policies and safety standards for hydrogen production, storage, and distribution at airports. This includes infrastructure to support both ground support equipment and hydrogen-powered aircraft.

Expand Incentives Through the California Air Resources Board and Energy Commission: The Board and Energy Commission could incentivize the use of low-carbon hydrogen as a feedstock for sustainable aviation fuel or for direct consumption in hydrogen aircraft. These incentives could mirror existing programs like the Low Carbon Fuel Standard.

Integrate Aviation into Clean Transportation Programs: Including hydrogen aviation projects in state-level clean transportation initiatives—such as the CEC’s Clean Transportation Program—would accelerate hydrogen propulsion timelines and de-risk private investment.

Enable Airport Leadership: Airport authorities can lead by empowering staff to engage with hydrogen producers based on proximity, price, and emissions profile, and by developing plans for future hydrogen fueling needs in coordination with operators.

Foster Regional Hydrogen Clusters: Developing hydrogen “clusters” at airports like Long Beach would create hubs of hydrogen activity, supporting ground equipment, transit systems, and eventually hydrogen aircraft. These clusters could leverage economies of scale to lower costs and build a more resilient supply chain.

With planning and leadership, hydrogen could become a cornerstone of a clean, resilient aviation system in California. While hydrogen won’t be able to solve aviation’s climate challenges overnight, the runway to decarbonization is now open, if policymakers, industry, and airport leaders work to accelerate the takeoff.",https://legal-planet.org/wp-content/uploads/2025/06/Cover-page-of-the-report.png,N,,2025-06-03 12:57:00.827406
,,2025-06-03 15:13:30+00:00,advancedbiofuelsusa.info,"Klobuchar Wants to Extend Tax Credit for Plant-Based Jet Fuel, but Environmentalists Say ...",Not Available,,,,,https://advancedbiofuelsusa.info/klobuchar-wants-to-extend-tax-credit-for-plant-based-jet-fuel-but-environmentalists-say-the-climate-could-suffer,"by Kristoffer Tigue (The Minnesota Star Tribune) A bipartisan Senate bill eliminates an environmental standard for whether growers can qualify for credits to grow sustainable aviation fuel.
-- U.S. Sen. Amy Klobuchar wants to help Midwest corn farmers tap into new lucrative tax credits aimed at making airplane fuel more climate friendly.
The tax credit for sustainable aviation fuel (SAF), created by the 2022 Inflation Reduction Act, is available for any fuel manufacturer that can show their product is at least 50% less carbon intensive than today’s petroleum-based jet fuel.
“Sustainable aviation fuel in Minnesota will not develop without some sort of economic incentive in the near term,” he said.
“So her support for making sure that this tax credit is extended … is critically important in a political environment where House Republicans are looking for savings and cuts for every single green energy tax credit that was included in the inflation Reduction Act.” Werner also said that some of the formulas used to calculate emissions related to land use changes can be overly burdensome for biofuel producers.","by Kristoffer Tigue (The Minnesota Star Tribune) A bipartisan Senate bill eliminates an environmental standard for whether growers can qualify for credits to grow sustainable aviation fuel. -- U.S. Sen. Amy Klobuchar wants to help Midwest corn farmers tap into new lucrative tax credits aimed at making airplane fuel more climate friendly. But some environmentalists worry her proposal could make climate change worse.

The tax credit for sustainable aviation fuel (SAF), created by the 2022 Inflation Reduction Act, is available for any fuel manufacturer that can show their product is at least 50% less carbon intensive than today’s petroleum-based jet fuel. The credit has mobilized universities and major companies like Cargill to explore a bevy of alternative fuels, including hydrogen gas, ethanol and even recycled cooking oil.

...

In April, Klobuchar, a Democrat, and U.S. Sen. Roger Marshall (R-Kans.) introduced a bill that would extend the SAF credit for another 10 years, while also prohibiting biofuels and other fuel feedstock imported from overseas from qualifying for the subsidy.

...

“Domestically produced biofuel strengthens our energy independence, supports our farmers and boosts rural economies,” Klobuchar said in a press release, announcing the proposal.

...

Klobuchar declined an interview request from the Minnesota Star Tribune, but said in a statement that her “bipartisan bill with Senator Marshall protects the sustainable aviation fuel credit from being exploited by foreign feedstocks from deforested rainforests — while giving farmers the certainty they need to produce lower-carbon fuel.”

...

Brian Werner, the executive director of the Minnesota Bio-Fuels Association, said ethanol producers generally support Klobuchar’s legislation.

“Sustainable aviation fuel in Minnesota will not develop without some sort of economic incentive in the near term,” he said. “So her support for making sure that this tax credit is extended … is critically important in a political environment where House Republicans are looking for savings and cuts for every single green energy tax credit that was included in the inflation Reduction Act.”

Werner also said that some of the formulas used to calculate emissions related to land use changes can be overly burdensome for biofuel producers. The current model used by the federal government considers projections of farmland expansion in countries that export to the U.S.",https://advancedbiofuelsusa.info/assets/images/Advanced-Biofuels-Logo.jpg,N,,2025-06-03 12:57:04.892318
,,2025-06-03 15:03:55+00:00,www.greenairnews.com,News Roundup June 2025 - GreenAir News,Not Available,,,,,https://www.greenairnews.com/%3Fp%3D7370,"404 Not Found The resource requested could not be found on this server!
Proudly powered by LiteSpeed Web Server Please be advised that LiteSpeed Technologies Inc. is not a web hosting company and, as such, has no control over content found on this site.","404

Not Found

The resource requested could not be found on this server!

Proudly powered by LiteSpeed Web Server

Please be advised that LiteSpeed Technologies Inc. is not a web hosting company and, as such, has no control over content found on this site.",,N,,2025-06-03 11:57:25.623086
,,2025-06-03 14:39:02+00:00,www.greenairnews.com,IATA chief hits out at “profiteering” fuel suppliers as SAF production expected to double in 2025,Not Available,,,,,https://www.greenairnews.com/%3Fp%3D7361,"404 Not Found The resource requested could not be found on this server!
Proudly powered by LiteSpeed Web Server Please be advised that LiteSpeed Technologies Inc. is not a web hosting company and, as such, has no control over content found on this site.","404

Not Found

The resource requested could not be found on this server!

Proudly powered by LiteSpeed Web Server

Please be advised that LiteSpeed Technologies Inc. is not a web hosting company and, as such, has no control over content found on this site.",,N,,2025-06-03 12:57:07.753415
