id,name,published,outlet,title,authors,category,market,categoryorder,articleorder,url,description,text,image,error,sentiment,firstEyes
,VTDigger,2025-11-28 21:57:14+00:00,VTDigger,Larry Moquin: A nation where work no longer matters,Opinion,,,,,https://vtdigger.org/2025/11/28/larry-moquin-a-nation-where-work-no-longer-matters/,"
Our strength lies in our unity, whether on the picket line, at the bargaining table or in the halls of government. We are one movement fighting for justice for all. 
Read the story on VTDigger here:  Larry Moquin: A nation where work no longer matters.","This commentary is by Larry Moquin. He is a second-generation member of the Laborers’ International Union of North America, where he serves as business manager of Local 668. He also serves as president of the Vermont AFL-CIO, advocating for workers’ rights in the Green Mountain state.
Recently, the richest person in the world was granted a salary of $1 trillion over 10 years.
Let that sink in. $1,000,000,000,000.


One person will receive ONE HUNDRED BILLION DOLLARS per year for 10 years to run a company. One person, already unimaginably wealthy, was handed more money than the total budget of the state of Vermont, not to mention that a trillion dollars is larger than most countries’ GDP.
At the same time of that announcement, tens of thousands of federal employees went to work and didn’t get paid because of the government shutdown. Millions of poor and working-class Americans didn’t receive their SNAP benefits and struggled to feed their families. And health care costs for working people are sky rocketing with no end in sight.
Meanwhile, the U.S. House of Representatives, the leaders we elected to run the government, didn’t meet for over a month. The president, with no sense of irony, threw a Great-Gatsby–themed party, a celebration of excess named after a story that was supposed to warn us about it.
The rich got richer. People went to work and didn’t get paid. Millions went hungry. And somehow, this has become normal.
What is happening in our country?
We used to value work. We believed that if you worked hard, you’d earn enough to live with dignity. One job could support you and your family. Now, too many companies and politicians treat workers as disposable and view the economy not as a shared project, but as a game to be won by a handful of shareholders.
The results are everywhere: record corporate profits, record CEO pay, and record levels of despair among working people. The rich continue to spend, propping up our economy while millions of people look for food. When the system rewards hoarding instead of helping, and speculation instead of service, it’s no wonder faith in the American dream is fading.
It doesn’t have to be this way. We can value labor over luxury, community over greed, and people over profits. But that means demanding more — from our government, from corporations and from ourselves. 
At the Vermont AFL-CIO, we  work every day to support workers throughout the state and raise up their voices. Through the power of collective bargaining and union organizing, working families in the Green Mountain State can restore hope for tomorrow.
Our strength lies in our unity, whether on the picket line, at the bargaining table or in the halls of government. We are one movement fighting for justice for all. We are building a future where every Vermonter earns a fair wage, has a safe workplace and can live with dignity and security. 
Because if we keep rewarding the richest for taking and punishing the rest for working, we won’t just lose our paychecks. We’ll lose our soul as a country. 
Read the story on VTDigger here:  Larry Moquin: A nation where work no longer matters.",https://vtdigger.org/wp-content/uploads/2025/02/Commentaries_featured-image-25.png,,,2025-11-28 16:56:50.535897
,Florida Phoenix,2025-11-28 21:15:28+00:00,Florida Phoenix,"Robotics, AI the answer to dwindling labor population, UF researcher says",Jay Waagmeester,,,,,https://floridaphoenix.com/2025/11/28/robotics-ai-the-answer-to-dwindling-labor-population-uf-researcher-says/,"Artificial intelligence and robots have potential to boost agricultural production — and their possibilities are only beginning, a University of Florida researcher told the Florida Senate last week. UF broke ground this month on the Center for Applied Artificial Intelligence in Agriculture at the Gulf Coast Research and Education Center in Hillsborough Count[...]","Turning to robots will boost agricultural production, a UF researcher says. (Photo by Keith Weller/USDA)Artificial intelligence and robots have potential to boost agricultural production — and their possibilities are only beginning, a University of Florida researcher told the Florida Senate last week.
UF broke ground this month on the Center for Applied Artificial Intelligence in Agriculture at the Gulf Coast Research and Education Center in Hillsborough County.
According to Nathan Boyd, a professor at UF studying weed science and associate director of the center, artificial intelligence will provide a 35% boost to agricultural production, including in Florida, by 2030. 
“We’re just seeing the start of what artificial intelligence and robotics can do in agriculture,” Boyd said while presenting to the Senate Committee on Agriculture.
Using AI to target spraying and harvesting crops could allow use of fewer pesticides and streamline processes otherwise done by humans, he said.
“Labor is a critical issue. The reason it’s becoming more of an issue is, number one, we do have aging farm operators — that’s part of it. We also do not have or have a very, very small domestic labor force for agriculture, which means we’re relying on labor outside of our domestic population, and the result of that has been labor shortages. And if you look at population trends here and in other countries, this is going to get worse, not better,” Boyd continued. 
As of May 2024, Florida had 9,640 crop, nursery, and greenhouse workers, the second-most in the United States, behind only California, which has more than 10 times as many workers, according to the Bureau of Labor Statistics. The Miami-Fort Lauderdale-West Palm Beach metropolitan area had the highest number in the state and 11th most nationwide.
As of April, Florida farmers paid near the bottom of the nation to field crop workers at $15.71 per hour, according to the U.S. Department of Agriculture.
Earlier this year, in the thick of legislative discourse about cracking down on illegal immigration, Agriculture Commissioner Wilton Simpson predicted the effort would not affect farm help. About two-thirds of crop farmworkers in the U.S. are immigrants, according to the U.S. Department of Labor. At the time, Simpson said H2A visas give permission to “the vast majority” of farmers to hire foreign nationals on a temporary basis. 
Ag commissioner dismisses economic harm from mass deportations

“We have to come up with a solution of, ‘How are we going to continue to grow the food that we do in Florida, understanding that we feed our country in the winter time? How are we going to continue to do that with fewer people?’ So, here comes the robots,” Boyd said. 
As technology improves, so do yields and quality of products, Boyd said. Technology can monitor plant health and development.
The technology, although often more accessible to larger growers, can be developed for small growers, according to Boyd.  
The Florida Department of Commerce, upon groundbreaking for the center, named agricultural technology as a new target industry. That means the state recognizes it as having a high potential to generate “significant returns on investment through job creation, innovation, and long-term growth.”
SUBSCRIBE: GET THE MORNING HEADLINES DELIVERED TO YOUR INBOX
Robotic harvesting, a $236 million industry in 2022, is expected to be worth $6.8 billion by 2030, according to Boyd. Agriculture drones are expected to constitute a $18 billion dollar industry in five years, too.
The center at UF will have resources to design and build robots for agriculture, with about 100 employees. In the 2025 state budget, lawmakers dedicated $2.25 million for the center. 
Artificial intelligence is becoming a university-wide focus for UF, home to HiPerGator, the most powerful university-owned supercomputer in the U.S.",https://floridaphoenix.com/wp-content/uploads/2025/11/USDA-orange.jpg,,,2025-11-28 16:56:50.535897
,VTDigger,2025-11-28 21:01:04+00:00,VTDigger,Vermont bids for new federal money to boost rural health system,Olivia Gieger,,,,,https://vtdigger.org/2025/11/28/vermont-bids-for-new-federal-money-to-boost-rural-health-system/,"
Vermont policymakers see the five-year grant, worth an annual $100 million-plus, as a potential lifeline in the face of looming Medicaid spending cuts, though they also caution the funds cannot replace that lost revenue.
Read the story on VTDigger here:  Vermont bids for new federal money to boost rural health system.","Owen Foster, chair of the Green Mountain Care Board, in 2023. File photo by Glenn Russell/VTDigger
The wishlist for achieving a more stable health care system in Vermont is a long and lofty one: By 2031, the Agency of Human Services says it aims to strengthen the rural health care workforce in the state and increase access to timely care in those rural areas, all while increasing quality and reducing cost. 
One big piece of achieving those goals rests in moving more of the health care Vermonters receive outside of hospitals, the agency argues in its latest vision for hospital transformation, made public last week.
In a bid for a five-year federal rural health grant worth at least $500 million to the state, the agency proposes a sweeping range of expenditures, ranging from the broad — like allocations for incentivizing primary care providers to increase appointment access — to the specific — like funding more recovery housing for those with substance use disorders or investing in dialysis and ventilator units in nursing homes, rather than hospitals. 

READ MORE

What might become a reality depends in part on grant funding decisions the federal government is expected to make by the end of this year.
The national opportunity became available in September after funding for the program was inserted into the federal budget reconciliation package to win the needed support of rural Senate Republicans concerned about the impacts of Medicaid spending cuts in that bill. 
Since then, health care professionals across Vermont have closely watched how the state might use the grant, to solidify the otherwise eroding foundation of the health care system in the state. 
“It does give us a lifeline if we use it really well,” Owen Foster, the chair of the Green Mountain Care Board, told VTDigger in October, before the state submitted an application.
Still, now that the agency’s application is public, much remains up in the air about how much funding will come to the state and what exactly it will go toward when it does.
The new funding availability comes at a time when the majority of Vermont’s hospitals face serious solvency risks and Vermonters bear some of the highest health care costs in the country. At the same time, the state’s rural populations are overall less healthy than the rest of the state, with higher rates of chronic disease, obesity, opiod-related death and suicide.
Many providers, patients, regulators and lawmakers in the state agree that the system is in dire need of a radical reboot. Some are still waiting for the details of that reboot to become more concrete.
“The proposal is more of a list of priorities than a detailed plan of what Vermont would do with federal funds if or when they arrive,” Alex Garlick, a UVM political science professor who specializes in health care policy but who is not involved in the application process, told VTDigger. 
“The ideas for shoring up the delivery of rural health care are sound, but I’d categorize them as incremental instead of transformational,” he said.
‘A holistic view’
Part of the plan’s high-level scope is because of how the federal government plans to dole out the funding.
The Centers for Medicare and Medicaid Services said they will award $10 billion a year between 2026 and 2030. Each year, half of that will go equally to each approved state — suggesting that each of the 50 eligible U.S. states are expected to get $100 million per year. The remaining $5 billion pot will go to states based on a more competitive grant evaluation criteria. 
Agency staff think it’s likely that Vermont will receive only its share of the half promised to all states, said Julie Mazza Olson, AHS’s director of Medicaid and health systems, who oversaw the application process. The federal agency has already posted its scoring metrics that the state can judge its eligibility against.
Nevertheless, the state proposed a budget for $200 million of spending each year in part to make a bid for the higher amount. But also the state agency can’t be sure which of the proposed priorities the feds will accept as ways to spend the state’s allocation, so Olson says the agency intentionally made the application flexible.
Olson said her agency tried to build upon programs for health system transformation that the state has already set in motion largely through a 2022 law, known as Act 167, a bill focused on shoring up the state’s hospitals. 
That was a practical necessity because the application needed to come together quickly: CMS released the applications in mid-September and gave states until Nov. 5 to submit them. 
“It’s a really really short amount of time to develop a plan and get the kind of input that you want when you’re doing something as complex as this,” Olson said.
Still, while trying to move quickly by building off existing projects, Olson said that the agency also tried to broaden the scope beyond hospital-specific reform. Often receiving care in a hospital is more expensive than getting the same treatment in an outpatient clinic or independent facility.
“If we’re going to have less care in hospitals, we’re going to need more care somewhere else,” Olson said. “There are other providers who we haven’t really engaged with in the same way on transformation.” 
Specifically, the application identifies investments in staff, technology and supplies for nursing homes, home health care, community mental health and substance use clinics, as well as through increased support and training for EMTs and paramedic emergency response teams.
Garlick, the UVM professor, specifically pointed to training programs for licensed nursing assistants and supporting primary care as good ideas for ways to strengthen the delivery of rural health care. 
“There are also outside-the-box considerations, including grants to increase the housing stock available to health care workers, which show the state is taking a holistic view of the problems related to health care finance,” he said.
A far bigger federal challenge  
Health care officials remain clear-eyed about the importance these funds can have in boosting a system in such dire straits. 
“Vermont’s healthcare system, including all provider types, remains under significant financial strain,” Foster, the care board chair, wrote in a Friday email to VTDigger. “We are seeing many service line closures and disruptions to patient care.  Hospitals are expected to continue to experience great financial pressure at a time when Vermonters cannot afford to pay more for healthcare.” 
Foster wrote that he was optimistic that Vermont’s application for the program would garner support, adding that he was encouraged by its recognition of the importance of preventative care and community-based providers. “Vermont has committed to intentional and meaningful health system transformation, and these critical funds would bolster our ability to transition Vermont into a sustainable and modern health system,” he said.
Still, strong headwinds remain against the rural health care system across the country as well as in Vermont. 
The changes to Medicaid enshrined in the big budget reconciliation President Donald Trump signed into law this July could result in a $137 billion loss to rural hospitals over 10 years, an analysis by the health care news organization KFF found. Comparatively, this five-year $50 billion rural health transformation grant, also included in that law, cannot balance the scale.
“The dollars that are available to us are really addressing a different set of concerns than the dollars that we’re losing. This is an opportunity, and we want to use this opportunity, but from a policy perspective it doesn’t make up for [other losses],” Olson said. 
Those losses don’t include the potential drop in income that rural hospitals can expect to come as a result of the loss of some of the federal subsidies for plans purchased on Vermont Health Connect, the state’s Affordable Care Act marketplace. Thousands of Vermonters are expected to reduce or entirely drop their insurance due to the increased expense.
The KFF authors also point out another imbalance of this funding opportunity that Vermont officials are also keenly aware of: While the changes to Medicaid would require future congressional action to ever reverse the cuts, this federal funding opportunity is finite. After five years, it is gone.
“It’s one-time money, so we have to think about how we can invest in ways to sustain it or turn things on and off,” Olson said. 
It’s an opportunity, she sees, to strengthen the system at the root, to do things like invest in concrete pieces of equipment — ventilators, mobile care technology — or programs that will have long dividends for the state, like education and training for the health care workforces.
She is wary of seeing it as the catch-all solution for all the challenges the system is facing.  
“The rural health transformation grant is not our entire healthcare system or all the things we’re doing on healthcare reform,” she said. “It’s an opportunity that we want to make the best of, even if it does not solve all of our problems.”
Read the story on VTDigger here:  Vermont bids for new federal money to boost rural health system.",https://vtdigger.org/wp-content/uploads/2023/04/owen-foster-1-20231130-1024x681.jpg,,,2025-11-28 16:56:50.535897
,DC,2025-11-28 20:53:18+00:00,News From The States - Fair. Fearless. Free.,Trump social media post claims to void Biden orders,Jennifer Shutt,,,,,https://www.newsfromthestates.com/article/trump-social-media-post-claims-void-biden-orders,,"President Donald Trump said Friday he will try to reverse any law, pardon or still-in-effect executive order that former President Joe Biden signed with an autopen, though it wasn’t immediately clear how that would work or whether it would be legal. Trump declared in a social media post that any documents Biden signed with the autopen are “hereby terminated, and of no further force or effect.”“I am hereby cancelling all Executive Orders, and anything else that was not directly signed by Crooked Joe Biden, because the people who operated the Autopen did so illegally,” Trump alleged. “Joe Biden was not involved in the Autopen process and, if he says he was, he will be brought up on charges of perjury. Thank you for your attention to this matter!”The White House press office didn’t immediately respond to a request for the list of documents Trump believes he has the ability to rescind based on the manner they were signed.States Newsroom also asked the Trump administration if officials believe the president would need to sign an executive order in order to implement his social media post. Experts dismissed earlier autopen challenge The post was similar to one Trump published in March when he claimed any pardons Biden signed with the autopen were void, something legal experts said at the time was “absurd” and a “red herring.”Trump brought up his frustration with autopen use again in June when he ordered the White House legal counsel and U.S. attorney general to investigate when and why Biden administration staff used an autopen. Trump said during an Oval Office appearance at the time he hadn’t found any evidence Biden aides violated the law.“No, but I've uncovered the human mind,” Trump said. “I was in a debate with the human mind and I didn't think he knew what the hell he was doing. So it's one of those things, one of those problems. We can't ever allow that to happen to our country.”Biden and spokespeople working for him have repeatedly said he knew what official documents were being signed in his name and rejected claims that White House staff used the autopen without his authorization or knowledge. Biden released a statement in June following the Trump memorandum, saying the investigation “is nothing more than a distraction by Donald Trump and Congressional Republicans who are working to push disastrous legislation that would cut essential programs like Medicaid and raise costs on American families, all to pay for tax breaks for the ultra-wealthy and big corporations.”“Let me be clear: I made the decisions during my presidency. I made the decisions about the pardons, executive orders, legislation, and proclamations,” Biden wrote at the time. “Any suggestion that I didn’t is ridiculous and false.""While presidents have regularly rescinded their predecessors executive orders, usually within their first few days or weeks in office, Congress would very likely need to act in order to alter or eliminate any laws that Biden signed with an autopen. Trump seeking to overturn a law, or part of a law, unilaterally would likely lead to a lawsuit over whether he holds that power. Trump doesn’t cite legal authorityIt also wasn’t immediately clear what legal authority Trump believes he has as president to undo pardons if Biden used an autopen to sign the documents. David Super, a constitutional and administrative law professor at Georgetown University, told States Newsroom in March that “the Constitution does not require signatures for pardons. It simply says the president has the power to pardon.”“So if President Biden wanted to simply verbally tell someone they're pardoned, he could do that. It wouldn't have to be in writing at all,” he said. “Administratively, of course, we want things in writing. It makes things a lot simpler, but there's no constitutional requirement.”Ashley Murray contributed to this report.",,,,2025-11-28 15:57:31.477217
