id,name,published,outlet,title,authors,category,market,categoryorder,articleorder,url,description,text,image,error,sentiment,firstEyes
,Missouri Independent,2025-11-28 12:00:59+00:00,Missouri Independent,USDA defunded a program that helped Missouri farmers. What’s next for those who relied on it?,Meg Cunningham,,,,,https://missouriindependent.com/2025/11/28/usda-defunded-a-program-that-helped-missouri-farmers-whats-next-for-those-who-relied-on-it/,"When Makeesha Munro and her partner Travis Jones started their farm in Collins, Missouri, they didn’t expect to be traveling across the state to sell the culinary mushrooms they grow. Jones was semiretired and looking for a way to leverage their property for additional income. One night, they decided to dive into farming mushrooms. After […]","With the help of a now-defunded program from the U.S. Department of Agriculture, Travis Jones and Makeesha Munro spend almost 15 hours a week traveling to various farmers markets and selling their culinary mushrooms to other buyers in Sedalia, Joplin and Springfield (Meg Cunningham/The Beacon).When Makeesha Munro and her partner Travis Jones started their farm in Collins, Missouri, they didn’t expect to be traveling across the state to sell the culinary mushrooms they grow.
Jones was semiretired and looking for a way to leverage their property for additional income. One night, they decided to dive into farming mushrooms. After a few late-night online purchases, Root 54 Farm was up and running.
They made some mistakes along the way. But with the help of a now-defunded program from the U.S. Department of Agriculture, they spend almost 15 hours a week traveling to various farmers markets and selling to other buyers in Sedalia, Joplin and Springfield.
“Owning a business is overwhelming,” Jones said. “Farming is overwhelming. When the two come together, it’s super overwhelming. So we are really grateful to people who help.”
The Heartland Regional Food Business Center was a part of a Biden administration program aimed at increasing the resilience of local food systems following the COVID-19 pandemic. The program aimed to help small and midsized farms with things like market access and technical assistance to help them grow and maintain their businesses.
But under Trump administration budget cuts, USDA terminated the program.
Now, its leaders are figuring out how to move forward under a new moniker — the Heartland Regional Food Business Coalition — and without the millions of dollars in federal funding once used to support their work.
The program reimbursed farmers for big purchases and helped make connections between farmers and potential buyers. Jones and Munro were never selected for monetary support, but the connections they made helped their business take off.
“We met a lot of the people we needed to meet,” Jones said.
 What’s next for the regional food business centers? 

Heartland was one of a handful regional food business centers established by the USDA. It officially launched in 2023 to help farmers across Missouri, Kansas, Iowa, Nebraska, Oklahoma and some Arkansas counties.
The group was slated to get $25 million in funding over four years. But it only made one round of grants to farmers before the rest of the funding was rescinded this summer.
In the only round of grant funding under USDA, Heartland provided nearly $4 million in financial assistance to 90 farmers after receiving nearly 500 applications from across the region.
Heartland was preparing for the second round of Business Builder grants — nearly $9 million in funding — and expected over 1,000 farmers to apply. Instead, it got word that federal funds may be pulled.
The group and its farmers ended up waiting six months to see if that money would actually be paid out.
One farmer was a sunflower producer who was looking for funds to upgrade his packaging process.
“He was ready and poised to expand his market this year,” said Katie Nixon, who currently shepherds the coalition through New Growth, a rural community development corporation in El Dorado Springs, Missouri.
Because the funding comes as reimbursements, farmers had to make the upgrades before they could see any of the money.
“You’re paralyzed — you’ve gotten this grant and they say, ‘If you spend the money, you’re not going to get reimbursed,’” Nixon said. “So do you say, ‘Well forget it, I’m just going to go my own way and lose $50,000, or do you wait?’”
Along with programs like Local Food for Schools, which was also eliminated earlier this year, the federal initiative was part of a larger effort to promote local food systems across the country.
“They took the conditions of the region and really focused to amplify that to provide an unmet demand from the rest of the nation,” said Hannah Quigley, a policy specialist at the National Sustainable Agriculture Coalition. “They were investing in scaling very regional specialized products.”
Support from the regional centers across the country resulted in more than 2,600 new partnerships between farmers and buyers, a June 2024 USDA brief said.
The June data also showed the program taking off. Farmers were starting to report improved processing, distribution, storage and aggregation of regional food products as a result of the support from their regional centers under the initiative.
Part of the reason for the success is because the money was there to actually keep people involved in the conversation. There are so many demands on small farmers, Nixon said. Without the possibility of some financial support, it can be difficult to prioritize where to spend your time.
“This just helped (relationships) become stronger and more formalized, because you had money to help keep people at the table,” Nixon said.
“We know that a lot of food and farm businesses came to us for technical assistance because they saw the Business Builder opportunity,” Nixon said. “So having that funding to be able to offer really gets people motivated.”
Only a small portion of federal farm support goes to producers of specialty crops, which includes produce like fruits and vegetables or nursery crops, Quigley said.
In the 1970s, the U.S. was a net exporter of those specialty crops. By the mid-1990s, it became a net importer. Still, in 2020 speciality crops contributed nearly $54 billion to U.S. agriculture’s $363 billion in cash receipts, USDA data from 2022 show.
“We have plenty of land and the way that our food system is organized right now, with commodity crops — most of those are grown specifically to send somewhere else to export,” Nixon said. “What if even just a sliver of that energy was actually to domesticate real food products?”
For smaller farmers, having dedicated support for funding and market access could make a huge difference in their success.
Heartland hosts monthly new farmer calls and connects farmers with established mentors to help them grow their specialty crop.
“They were connecting these farmers who might not have immediately known how to get connected to a distributor,” Quigley said. “I think a farmer could figure it out, but it might take them two full years, potentially three different growing seasons … to figure it out.”
From July 2023 to June 2024, the centers nationwide formalized more than 250 partnerships for their farmers. In the last six months of 2024, they finalized 466.
They were trying to reach the farmers who traditionally don’t receive USDA loans, Nixon said.
Nixon and her colleagues are looking for sources to make up for some of the lost USDA funding. But what exactly that will mean is still unclear.
“Local food is not easy,” Nixon said. “We’re trying to make it easier.”
 How to build out a regional food system 

Part of the difficulty in building up more regional food systems comes from connecting farmers to wholesale buyers who need large quantities of produce.
That was some of what the regional centers were aiming to address.
“In some cases, they connected small farmers to an aggregator, or someone who brokered purchases, then they were able to aggregate them, buy from all these small farmers and then sell to a single buyer,” Quigley said.
That structure could help incentivize larger purchasers like food banks, states or school districts to buy more local food.
Because of the control wholesale grocery suppliers have over those markets, it can be more difficult for businesses to stray away from what has become the mainstream model for buying food.
Quigley pointed to agreements the USDA has with states that let states take a more hands-on approach to local food purchasing.
“That brings those contracts down from a national scale or a 12-state scale, down to a single-state scale,” Quigley said. “It allows for a greater number of farmers and businesses to be able to successfully bid on those contracts. They don’t have to have a distribution network to serve 12 states, they can just serve a single state.”
A 2020 local food marketing survey found that the number of farms selling locally produced food fell by 12% nationwide from 2015 to 2020.
Still, Missouri is seeing some growth when it comes to produce farmers. The 2022 Census of Agriculture in Missouri found that the number of farms working in greenhouse, nursery and floriculture production had grown to 485 in 2022, up from 348 in 2017.
In 2021, more than 90% of the farms selling food directly to consumers were considered small farms.
“When you buy from somebody local, your money stays local,” Munro said. “When you’re in the local food business, you really get to know people, and we really do support each other. It’s part of what I love, it is a community.”
This article first appeared on Beacon: Missouri and is republished here under a Creative Commons Attribution-NoDerivatives 4.0 International License.",https://missouriindependent.com/wp-content/uploads/2025/11/root54-1024x512.jpg,,,2025-11-28 07:57:51.337645
,Rhode Island Current,2025-11-28 12:00:32+00:00,Rhode Island Current,Rhode Island Community Food Bank delays release of its annual hunger report,Christopher Shea,,,,,https://rhodeislandcurrent.com/2025/11/28/rhode-island-community-food-bank-delays-release-of-its-annual-hunger-report/,"In any other year, the data that informs an annual report released every Thanksgiving by the Rhode Island Community Food Bank would tell the whole story about hunger in the Ocean State.  But 2025 has been unlike any other year for the Providence-based nonprofit — especially after the recent federal shutdown disrupted benefits for 42 […]","Cans of chickpeas at the Rhode Island Community Food Bank in Providence await being sent off to the organization's network of 137 affiliate food pantries in the Ocean State. (Photo by Alexander Castro/Rhode Island Current)In any other year, the data that informs an annual report released every Thanksgiving by the Rhode Island Community Food Bank would tell the whole story about hunger in the Ocean State. 
But 2025 has been unlike any other year for the Providence-based nonprofit — especially after the recent federal shutdown disrupted benefits for 42 million Americans enrolled in the Supplemental Nutrition Assistance Program (SNAP), including 145,000 Rhode Islanders.
Which is why the release of the annual “Status Report on Hunger in Rhode Island” will have to wait until late January.
“The recent federal government shutdown and SNAP delay has been our top priority this fall,” Melissa Cherney, the food bank’s CEO, said in a statement to Rhode Island Current. “We remain committed to putting together a comprehensive report and providing an in-depth look at who is food insecure in Rhode Island that takes into account how the government shutdown has impacted food security in our state.”
First released in 2007, the annual report lists how many households across the state struggle to afford adequate meals, receive food assistance, along with policy recommendations on how to reduce hunger.
Last year’s six-page report focused on the need for Congress to expand federal programs like SNAP, which the food bank projected could help the 90,500 households enrolled at the time to easily afford three healthy meals per day. The report had also urged state leaders to reduce barriers for SNAP enrollment.
The food bank’s report typically relies on hunger data compiled by Blue Cross & Blue Shield of Rhode Island and the Brown University School of Public Health as part of its annual RI Life Index survey. But that survey is conducted in the spring. 
Food bank spokesperson Kate MacDonald said the data would not account for the rapid increase in food insecurity across Rhode Island observed this fall during the 43-federal government shutdown.
Food pantries in the state served around 100,000 people in the month of October. Pantries last year served roughly 84,400 individuals per month, which at the time was the highest total tracked by the Rhode Island Community Food Bank.
“We want to be able to capture that in our status report,” MacDonald said in an interview. “The data we’re working with has to represent what’s going on now.”
Food bank staff had to shift their focus away from completing the report during the shutdown i to ensuring there was enough food to distribute across its 137 affiliated pantries and other agencies, MacDonald added.
SNAP payments have since resumed now that the longest federal shutdown in history has ended, but the fallout continues, MacDonald said.
“Families who were impacted might be seeing these effects for a little while,” she said. “Families have made choices in what bills to pay and what not to pay.”
Then there’s the massive changes to SNAP under President Trump and Republicans’ signature tax legislation, known as the “one big, beautiful bill.” Under the new law, parents and older Americans will be required to meet stricter work requirements, and states eventually will have to share in the cost of SNAP benefits.
The law also cuts off access completely for refugees and other immigrants starting Feb. 1, 2026.
“It’s going to take some time for what that all means for people’s monthly benefits,” MacDonald said.
The food bank’s full 2025 report will be released Jan. 27 to coincide with Food Insecurity Awareness Day, when its leaders will gather at the State House and hold a virtual town hall to discuss the latest findings.
SUBSCRIBE: GET THE MORNING HEADLINES DELIVERED TO YOUR INBOX",https://rhodeislandcurrent.com/wp-content/uploads/2025/11/IMG_0045-scaled-1-1024x682.jpg,,,2025-11-28 07:57:51.337645
,Washington State Standard,2025-11-28 12:00:28+00:00,Washington State Standard,WA lawmakers will gather in Olympia to gear up for 2026 session,Jerry Cornfield,,,,,https://washingtonstatestandard.com/2025/11/28/wa-lawmakers-will-gather-in-olympia-to-gear-up-for-2026-session/,"How best to spend, save and raise money will be a recurring theme when Washington lawmakers convene in Olympia next week for their annual “committee days.”  The state is facing a budget shortfall that’s poised to dominate the 2026 session, which begins Jan. 12. Data centers, vaccine safety, bridges hit by trucks, and the states […]","The Washington state Capitol building in Olympia. (Photo by Bill Lucia/Washington State Standard)How best to spend, save and raise money will be a recurring theme when Washington lawmakers convene in Olympia next week for their annual “committee days.” 
The state is facing a budget shortfall that’s poised to dominate the 2026 session, which begins Jan. 12.
Data centers, vaccine safety, bridges hit by trucks, and the states mounting legal payouts are other issues to be tackled in the three days of work sessions, which start Wednesday.
This year, both chambers will be in town at the same time. It will provide a sense of the pace and tenor of policy debates to come in next year’s 60-day session.
Wednesday, Dec. 3, is reserved for meetings of seven committees composed of House and Senate members. On Thursday and Friday, individual House and Senate committees will meet starting at 8 a.m. each day. 
Data Centers will grab the spotlight at 1:30 p.m. Wednesday. That’s when the Joint Committee on Energy Supply, Energy Conservation, and Energy Resilience will hear recommendations of the data center work group established by an executive order from Gov. Bob Ferguson. A report from the work group is due to the governor by Dec. 1. Data centers consume large amounts of electricity, and more are coming online as artificial intelligence technology expands.
Also Wednesday, health insurance costs and vaccine safety will be on the agenda when the Joint Select Committee on Health Care and Behavioral Health Oversight meets at 3 p.m. 
Thursday will be dominated by budget-related conversations.
This year, Democratic lawmakers pushed through billions in new and increased taxes, along with spending cuts, to bridge a projected gap around $16 billion over four years.
Concerns about one of the largest new business taxes that took effect Oct. 1 will be a hot topic in the House Finance Committee at 1:30 p.m. Thursday. 
Senate Bill 5814 imposes new sales taxes on a number of services and is counted on to bring in $1.1 billion in the two-year budget that began July 1. Local governments will get a cut of the state sales tax proceeds. Rep. April Berg, D-Mill Creek, the committee chair, has said the law needs fine-tuning to make clearer who is required to collect and pay the taxes.
Operating and transportation expenses will be showcased in four different budget committees meeting at 4 p.m. Thursday.
The Senate Ways and Means Committee has a packed agenda with discussions on future tax collections, growing lawsuit payouts, and state pensions. 
In the House Appropriations Committee, conversations are planned on the state’s budget outlook, plus updates on federal funding and Washington’s strained juvenile rehabilitation system.
Highway maintenance and preservation will be a focus of both the Senate and House transportation panels. The Senate Transportation Committee will devote its one-hour work session to the subject.
Meanwhile, members of the House Transportation Committee will get briefed on how the state Department of Transportation is dealing with bridges damaged by truck collisions. Also on the agenda is an update on the Washington State Ferries multi-billion-dollar electrification program.
For the full schedule, agendas and documents, visit the Legislature’s website. All meetings will be livestreamed on TVW.",https://washingtonstatestandard.com/wp-content/uploads/2025/02/state-capitol-5-1024x610.jpg,,,2025-11-28 07:57:51.337645
