id,name,published,outlet,title,authors,category,market,categoryorder,articleorder,url,description,text,image,error,sentiment,firstEyes
,Alaska Beacon,2025-11-27 15:00:23+00:00,Alaska Beacon,How the Plymouth Pilgrims took over Thanksgiving – and who history left behind,Thomas Tweed,,,,,https://alaskabeacon.com/2025/11/27/how-the-plymouth-pilgrims-took-over-thanksgiving-and-who-history-left-behind/,"Nine in 10 Americans gather around a table to share food on Thanksgiving. At this polarizing moment, anything that promises to bring Americans together warrants our attention. But as a historian of religion, I feel obliged to recount how popular interpretations of Thanksgiving also have pulled us apart. Communal rituals of giving thanks have a […]","‘The First Thanksgiving, 1621,’ by Jean L. G. Ferris.
(Library of Congress)
Nine in 10 Americans gather around a table to share food on Thanksgiving. At this polarizing moment, anything that promises to bring Americans together warrants our attention.
But as a historian of religion, I feel obliged to recount how popular interpretations of Thanksgiving also have pulled us apart.
Communal rituals of giving thanks have a longer history in North America, and it was only around the turn of the 20th century that most people in the U.S. came to associate Thanksgiving with Plymouth “Pilgrims” and generic “Indians” sharing a historic meal.
The emphasis on the Pilgrims’ 1620 landing and 1621 feast erased a great deal of religious history and narrowed conceptions of who belongs in America – at times excluding groups such as Native Americans, Catholics and Jews.
 Farming faiths and harvest festivals

The usual Thanksgiving depiction overlooks Indigenous rituals that give thanks, including harvest festivals.
The Wampanoag, who shared food with the Pilgrims in 1621, continue to celebrate the cranberry harvest, and similar feasts were held long before Columbus sailed and Pilgrims landed.
As I note in my 2025 book, “Religion in the Lands That Became America,” for instance, celebrants gathered for a communal feast in the late 11th century in the 50-acre plaza of Cahokia. That Native city, across the river from present-day St. Louis, was the largest population center north of Mexico before the American Revolution.

The St. Louis, Mo., skyline is seen beyond Monks Mound at Cahokia Mounds State Historic Site in Collinsville, Ill., on July 11, 2019. (Daniel Acker for The Washington Post via Getty Images)
Cahokians and their neighbors came in late summer or early autumn to give deities thanks, smoke ritual tobacco and eat special food – not corn, their dietary staple, but symbolically significant animals such as white swans and white-tailed deer. So, those Cahokians attended a thanks-giving feast five centuries before the Pilgrims’ harvest-time meal.
 ‘Days of Thanksgiving’

The usual depiction also de-emphasizes the tradition of officials announcing special “Days of Thanksgiving,” a practice familiar to the Pilgrims and their descendants.
The Pilgrims, who settled in what is now Plymouth, Massachusetts, were separatist Puritans who had denounced the Catholic elements that remained in the Protestant Church of England. They first sought to form their own “purified” church and community in Holland. After about 12 years, many of them moved again, crossing the Atlantic in 1620. The Pilgrims’ colony southeast of Boston was gradually absorbed into Massachusetts Bay Colony, founded in 1630 by a larger group of Puritans who did not split from England’s official church.
As historians have noted, Puritan ministers in Massachusetts’ state-sanctioned Congregational Church didn’t just speak on Sundays. Now and then they also gave special thanksgiving sermons, which expressed gratitude for what the community considered divine interventions, from military victory to epidemic relief.
The practice continued and spread. During the American Revolution, for instance, the Continental Congress declared a Day of Thanksgiving to commemorate the victory at Saratoga in 1777. President James Madison announced Days of Thanksgiving during the War of 1812. Leaders of the United States and the Confederate states did the same during the Civil War.
This tradition influenced Americans such as Sarah Hale, who called for a national Thanksgiving holiday. A magazine editor and poet best known for “Mary Had a Little Lamb,” she successfully pitched the idea to Abraham Lincoln in 1863.
 Harvest feast of 1621

Many Americans’ view of “The First Thanksgiving” resembles the scene depicted in a Jean Ferris painting by that name. Finished around 1915, it is similar to another popular image painted around the same time, Jennie Augusta Brownscombe’s “The First Thanksgiving at Plymouth.”

‘The First Thanksgiving at Plymouth’ by Jennie A. Brownscombe. (Stedelijk Museum De Lakenhal/Wikimedia Commons)
Both images distort the historical context and misrepresent Indigenous attendees from the nearby Wampanoag Confederacy. The Native leaders wear headdresses from Plains tribes, and there are too few Indigenous attendees.
Only one eyewitness account survives: a 1621 letter from the Pilgrim Edward Winslow. He reported that the Wampanoag’s leader, Massasoit, brought 90 men. That means, some historians suggest, the shared meal was as much a diplomatic event marking an alliance as an agricultural feast celebrating a harvest.
Ferris’ painting also implies that the English provided the food. Plymouth residents brought “fowl,” as Winslow recalled – probably wild turkey – but the Wampanoag added five killed deer. Even the harvest of “Indian corn” depended on Native aid. Tisquantum or Squanto, the lone survivor of the village that the Pilgrims called Plymouth, had offered lifesaving advice about planting as well as diplomacy.
The image’s cheerful scene also obscures how death had destabilized the area. The Pilgrims lost almost half their group to famine or exposure that first winter. After earlier European contact, however, even larger numbers of the Wampanoag had died in a regional epidemic that raged between 1616-1619. That’s why the Pilgrims found Squanto’s village abandoned, and why both communities were open to the alliance he brokered.
 Pilgrims’ primacy

The Pilgrims were latecomers to the Thanksgiving table. Lincoln’s 1863 proclamation, published in Harper’s Monthly, mentioned “the blessing of fruitful fields,” but not the Pilgrims. Nor were Pilgrims depicted in the magazine’s illustrated follow-up. The page showed town and country, as well as emancipated slaves, celebrating the feast day by praying at “the Union altar.” For years before and after the proclamation, in fact, many Southerners resisted Thanksgiving, which they saw as a Northern, abolitionist holiday.
 
This ‘Thanksgiving Day’ illustration, made by cartoonist Thomas Nast, commemorated its first celebration as a U.S. holiday. (Syracuse University Art Museum)


The Pilgrims’ absence makes sense, since they were not the first Europeans to land on North America’s eastern coast – or to give thanks there. Spanish Catholics had founded St. Augustine in 1565. According to an eyewitness account, the Spanish leader asked a priest to celebrate Mass on Sept. 8, 1565, which Native Americans attended, and “ordered that the Indians be fed.”
Two decades later, an English group had tried and failed to establish a colony on Roanoke Island, North Carolina – including a Jewish engineer. The English had more success when they settled Jamestown, Virginia, in 1607. A commander leading a new group to Virginia was instructed to mark “a day of Thanksgiving to Almighty God” in 1619, two years before the Plymouth meal.
But over the years, Plymouth’s Pilgrims still moved slowly toward the center of the national holiday – and America’s founding narrative.
In 1769, Plymouth residents promoted their town by organizing a “Forefathers’ Day.” In 1820 the Protestant politician Daniel Webster gave a speech commemorating the bicentennial of the landing at Plymouth Rock and praising the Pilgrims’ arrival as “the first footsteps of civilized man” in the wilderness. Then in an 1841 volume, “Chronicles of the Pilgrim Fathers,” a Boston minister reprinted the 1621 eyewitness account and described the shared harvest meal as “the first Thanksgiving.”
 Rising immigration

Between 1880 and 1920, the Pilgrims emerged as the central characters in national narratives about both Thanksgiving Day and America’s origin. It was no coincidence that these years were the peak of immigration to the U.S., and many Americans saw the new immigrants as inferior to those who had landed at Plymouth Rock.

A late-1800s depiction of the Plymouth landing, published by the printmaking business Currier and Ives. (Mabel Brady Garvan Collection/Yale University Art Gallery)
Irish Catholics already had a presence in Boston when the “Pilgrim Fathers” volume appeared in 1841, and more came after the Irish potato famine later that decade. Boston’s foreign-born population increased further as poverty and politics pushed Italian Catholics and Russian Jews to seek a better life in America.
The same was happening in many northern cities, and some Protestants were alarmed. In an 1885 bestseller called “Our Country,” a Congregational Church minister warned that “the glory is departing from many a New England village, because men, alien in blood, in religion, and in civilization, are taking possession of homes in which were once reared the descendants of the Pilgrims.”
During the 300th anniversary of the Pilgrims’ landing and harvest meal, celebrated in 1920 and 1921, the federal government issued commemorative stamps and coins. Officials staged pageants, and politicians gave speeches. About 30,000 people gathered in Plymouth, for instance, to hear President Warren Harding and Vice President Calvin Coolidge praise the “Pilgrim Spirit.”
Soon nativist worries about the newcomers, especially Catholics and Jews, led Coolidge to sign the Immigration Act of 1924, which would largely close America’s borders for four decades.
Americans kept telling the Pilgrim story after U.S. immigration policy became more welcoming in 1965, and many will tell it again next year as we celebrate the nation’s 250th anniversary. Understood in its full context, it’s a story worth telling. But we might use caution since, as history reminds us, stories about the country’s spiritual past can either bring us together or pull us apart.
This article is republished from The Conversation under a Creative Commons license. Read the original article.",https://alaskabeacon.com/wp-content/uploads/2025/11/file-20251029-66-uo9232.jpg.avif,,,2025-11-27 10:57:58.833633
,Alaska Beacon,2025-11-27 14:30:54+00:00,Alaska Beacon,Murkowski offers support to Democratic senator targeted for retribution by Trump administration,James Brooks,,,,,https://alaskabeacon.com/briefs/murkowski-offers-support-to-democratic-senator-targeted-for-retribution-by-trump-administration/,"Alaska Republican Sen. Lisa Murkowski denounced the Trump administration’s targeting of Arizona Democratic Sen. Mark Kelly on Tuesday, saying on social media that its actions are “reckless and flat-out wrong.” Kelly, a retired astronaut and U.S. Navy officer, was one of six Democratic senators who appeared in a video directed to members of the U.S. […]","The U.S. Capitol on the evening of Tuesday, Sept. 30, 2025, just hours before a federal government shutdown. (Photo by Ashley Murray/States Newsroom)Alaska Republican Sen. Lisa Murkowski denounced the Trump administration’s targeting of Arizona Democratic Sen. Mark Kelly on Tuesday, saying on social media that its actions are “reckless and flat-out wrong.”
Kelly, a retired astronaut and U.S. Navy officer, was one of six Democratic senators who appeared in a video directed to members of the U.S. military. In that video, they say members of the military are being subject to political pressure and should uphold the Constitution and ignore “illegal orders.”
Afterward, President Donald Trump took to social media to call for all six to be executed for treason. The FBI has begun to make inquiries about the video, and the Department of Defense have vowed to investigate. Secretary of Defense Pete Hegseth has been particularly critical of Kelly.
“Senator Kelly valiantly served our country as an aviator in the U.S. Navy before later completing four space shuttle missions as a NASA astronaut,” Murkowski said. “To accuse him and other lawmakers of treason and sedition for rightfully pointing out that servicemembers can refuse illegal orders is reckless and flat-out wrong. The Department of Defense and FBI surely have more important priorities than this frivolous investigation.”
It has become unusual for elected Republican officials to speak in defense of elected Democrats, particularly when it places them at odds with President Donald Trump, who remains popular among Republican voters, even if his approval overall is low.
Alaska Republican Sen. Dan Sullivan previously expressed concerns about the possible politicization of the military during the presidency of Democrat Joe Biden. 
Asked about the situation with Kelly, Sullivan criticized the Democratic video and the administration’s response to it. 
“The Democrats in the video have offered no explanation of what they considered to be an illegal order, sowing confusion and politicizing the ranks in a way that risks undermining military discipline, lethality and readiness,” his office said in a written statement.
The statement went on to say that “he does not believe it is a good use of the Pentagon’s time to investigate Senator Kelly” because “such an investigation has the potential to turn into a major distraction for our military.”
The office of Rep. Nick Begich, R-Alaska, did not return a text message or email seeking comment.
Sullivan’s office requested that his statement be printed in full. Because it has not been published elsewhere, we think there is news value in reprinting it, so it is published below.
“Senator Sullivan strongly disagreed with many actions taken by the Pentagon under Presidents Obama and Biden — such as President Biden’s use of enlisted Marines as political props standing behind him in a very partisan speech in Philadelphia in 2022. But he would never have put out a video — like the one released by Senator Mark Kelly and five other Democratic lawmakers — implying that troops should question orders from their superiors. The Democrats in the video have offered no explanation of what they considered to be an illegal order, sowing confusion and politicizing the ranks in a way that risks undermining military discipline, lethality and readiness. 
Instead of using our troops as political pawns, members of Congress should press top Pentagon officials directly on issues over which they have concerns. Senator Sullivan does this regularly in Senate Armed Services Committee hearings and in meetings and phone calls with top Pentagon leaders regardless of which party controls the White House.
While Senator Sullivan believes the message in the video was irresponsible and politically driven, he does not believe it is a good use of the Pentagon’s time to investigate Senator Kelly — who served honorably in the Navy — under the UCMJ, particularly given that the Constitution’s Speech or Debate Clause would likely take precedence over any UCMJ provision. Such an investigation has the potential to turn into a major distraction for our military. After four years of Biden’s woke military, the Department of War needs to stay laser focused on lethality and war fighting.”

SUBSCRIBE: GET THE MORNING HEADLINES DELIVERED TO YOUR INBOX",https://alaskabeacon.com/wp-content/uploads/2025/10/capitolsunsetsept302025-1024x769.jpg,,,2025-11-27 09:56:50.487473
,Source New Mexico,2025-11-27 13:06:21+00:00,Source New Mexico,"In NM’s most SNAP-reliant county, fear persists as the holiday season begins",Patrick Lohmann,,,,,https://sourcenm.com/2025/11/27/in-nms-most-snap-reliant-county-fear-persists-as-the-holiday-season-begins/,"A little more than 45% of Sierra County’s roughly 11,500 residents rely on the federal Supplemental Nutrition Assistance Program, according to the state Health Care Authority. That makes it the county with the highest rate of SNAP participation in New Mexico, which also is the state with the highest SNAP reliance in the United States.","Volunteers prepare for a food distribution at the Shepherd’s Closet food pantry in Elephant Butte in Sierra County on Nov. 25, 2025. In the state’s most SNAP-reliant county, food bank manager Tami Smith said food lines won’t become any shorter anytime soon. (Courtesy Tami Smith)Like she does every Tuesday afternoon when the bell rings at the Shepherd’s Closet in Elephant Butte, Tami Smith stepped out the Tuesday before Thanksgiving to greet a growing line of hungry people at the food pantry she runs. Then, like she also does every Tuesday, she joined some of them in prayer.
This week, ahead of Thanksgiving, she said she read from Isaiah 41:10. It was a reminder, she said, that, “There will always be trials and tribulations in life, but God will carry you through every storm.” Then she helped 138 households comprising 523 people get food for the week, she said.
A little more than 45% of Sierra County’s roughly 11,500 residents rely on the federal Supplemental Nutrition Assistance Program, according to the state Health Care Authority. That makes it the county with the highest rate of SNAP participation in New Mexico, which also is the state with the highest SNAP reliance in the United States.  
Tami Smith has volunteered at Sheperd’s Closet for a decade. (Courtesy Tami Smith)
The county’s high rate of SNAP reliance made the food pantry even more vital earlier this year when federal cuts and stoppages threw the program into upheaval, Smith said. The food pantry distributes at least 36,000 pounds of food a month, she said, to people who line up beginning at 7:30 a.m. and come from as far away as Alamogordo, Socorro or Las Cruces. 
“When you have food insecurity, and then you have all this going on with SNAP, people panic,” she said. “They want to make sure that they have enough food for their family. And we have multi-generational families here. It’s not uncommon to have 11, 12, 15 people in the household.”
Those people have turned to Shepherd’s Closet during a chaotic year. 
First, federal cuts to The Emergency Food Assistance Program left Roadrunner Food Bank, which supplies most of the pantry’s food, with 30 fewer truckloads, primarily of dairy products. The food pantry in Elephant Butte had to make up the difference with canned food, Smith said. 
Then, the “One Big Beautiful Bill Act” President Donald Trump signed in July contained provisions that cut SNAP and imposed future work requirements, along with other measures that prompted longer lines at the food pantry. 
Finally, when the federal government shut down Oct. 1, Smith said she knew to expect even longer lines. She’s worked as a volunteer at the pantry for a decade, including during the COVID-19 pandemic. 
“It was severe fear and panic during the pandemic, and we see that same stuff right now, because it’s still so uncertain,” she said. “And people, especially during the holidays, they panic because they don’t think they can get enough food.”
Shepherd’s Closet volunteers package Christmas boxes each year for their holiday distribution. (Courtesy Tami Smith)
The food line has not shrunk even though the state stepped in to pay for SNAP itself, first with a $30 million payment that covered SNAP through the first days of November and later with a $162.5 million payment meant to cover the program through January. And the line has stayed long even after the 43-day federal government shutdown ended, Smith said. 
“As long as there’s still that fear out there, the lines are not going to go down,” she said. “It would take the government to agree all the time, which won’t ever happen.”
Amid the panic, Smith said Shepherd’s Closet will continue opening every Tuesday to give out as much food as people need without judgment.
“I don’t ask many questions, because that’s not my business,” she said. “God says, ‘Feed my people.’ That’s what I do.”",https://sourcenm.com/wp-content/uploads/2025/11/IMG_3203-e1764175859222-1024x826.jpg,,,2025-11-27 08:57:25.223379
