id,name,published,outlet,title,authors,category,market,categoryorder,articleorder,url,description,text,image,error,sentiment,firstEyes
,Education Funding,2025-12-08 18:23:05+00:00,Representative Nancy Mace,Rep. Nancy Mace Helps Secure Over $400 Million In Federal Grants For South Carolina,,,,,,https://mace.house.gov/media/press-releases/rep-nancy-mace-helps-secure-over-400-million-federal-grants-south-carolina,"CHARLESTON, S.C. (Dec. 8, 2025) — Congresswoman Nancy Mace (R-SC-01) today announced she has helped local governments, nonprofits, small businesses, and organizations secure over $400 million in federal grants since the start of 2024. These competitive awards span infrastructure, public safety, education, veterans, and economic and workforce development across South Carolina’s 1st Congressional District.",,,,,2025-12-08 14:56:48.357057
,Pennsylvania,2025-12-08 18:10:43+00:00,York Dispatch,Pa. education advocates brace for upheavals as Trump unwinds US agency,,,,,,https://www.yorkdispatch.com/story/news/education/2025/12/08/education-advocates-brace-for-more-upheavals-as-trump-unwinds-federal-agency/87572916007/,"Rural schools' federal funding may be at risk as the U.S. Department of Education is unraveled, according to the Education Law Center.",,"https://www.yorkdispatch.com/gcdn/authoring/authoring-images/2024/12/02/PPYD/76700275007-opedklascolumnget-2.jpg?crop=1599,900,x0,y83&width=1599&height=900&format=pjpg&auto=webp",,,2025-12-08 13:57:02.855530
,Education Funding,2025-12-08 17:37:59+00:00,JD Supra,District Dilemma: Comply with Department of Education’s Directives (and risk lawsuits) or Binding Court Decisions (and risk losing Federal funding) | JD Supra,,,,,,https://www.jdsupra.com/legalnews/district-dilemma-comply-with-department-1041674/,"Fairfax Cty. Sch. Bd. v. McMahon, Civil Action No. 1:25-cv-1432, 2025 U.S. Dist. LEXIS 179299, at *5 (E.D. Va. Sep. 5, 2025).  District Court for the...",,https://jdsupra-static.s3.amazonaws.com/profile-images/og.15378_5515.jpg,,,2025-12-08 13:57:02.855530
,Education Funding,2025-12-08 15:58:48+00:00,"Los Angeles, CA Patch","GALS LA Awarded $750K Federal Grant to Support Expansion, Heightened Enrollment Demand",,,,,,https://patch.com/california/los-angeles/gals-la-awarded-750k-federal-grant-support-expansion-heightened-enrollment,One of your neighbors posted in Schools. Click through to read what they have to say. (The views expressed in this post are the author’s own.),,https://patch.com/img/cdn20/users/22940564/20251208/094743/styles/patch_image/public/1q6a1362-resized___08094735607.jpg,,,2025-12-08 11:56:48.913776
,Salt Lake City,2025-12-08 14:31:13+00:00,KUER,Utah passed emergency funding for English learners this year. No schools qualified,,,,,,https://www.kuer.org/education/2025-12-08/utah-passed-emergency-funding-for-english-learners-this-year-no-schools-qualified,"While some schools reported large percentage increases in the number of beginner English learners this year, none met the 30-student threshold established by HB42.",,https://npr.brightspotcdn.com/dims4/default/bb7b2d8/2147483647/strip/true/crop/5400x2835+0+0/resize/1200x630!/quality/90/?url=http%3A%2F%2Fnpr-brightspot.s3.amazonaws.com%2Fd2%2F01%2F6f9eb946434f89e5c69e950a19be%2Fpublicsafety3.JPG,,,2025-12-08 10:58:29.952217
,West Virginia,2025-12-08 10:59:29+00:00,Real WV,"First WV BOE performance audit complete, more RIFs anticipated - Real WV",,,,,,https://therealwv.com/2025/12/08/first-wv-boe-performance-audit-complete-more-rifs-anticipated/,"By Autumn Shelton, RealWV CHARLESTON, W.Va. – The first performance audit of the West Virginia Department of Education was released on Sunday to members of the Legislative Oversight Commission on Education Accountability during their December interim meeting. And, although the initial audit may not have been as thorough as was anticipated, it did provide data […]",,https://therealwv.com/wp-content/uploads/2025/12/WP7_4868-56-scaled.jpg,,,2025-12-08 06:56:37.749754
,Pennsylvania,2025-12-08 10:20:39+00:00,York Daily Record,"When feds block Pa. funding, should state bite back? Dems say yes",,,,,,https://www.ydr.com/story/news/politics/state/2025/12/08/when-feds-block-funding-how-should-pa-respond/87624403007/,"The Pa. proposal seeks to “stop the political weaponization” of government funding, pointing to delays and freezes of billions in federal payments.",,"https://www.ydr.com/gcdn/authoring/authoring-images/2025/02/04/PPYR/78215172007-020425-pmkstate-capital.jpg?crop=1998,1123,x0,y0&width=1998&height=1123&format=pjpg&auto=webp",,,2025-12-08 07:56:18.845796
,Education Funding,2025-12-07 20:42:23+00:00,Shoreline Media Group,"WS ESD board to weigh funding resolutions, policy updates at Dec. 9 meeting",,,,,,https://www.shorelinemedia.net/ludington_daily_news/news/ws-esd-board-to-weigh-funding-resolutions-policy-updates-at-dec-9-meeting/article_485e8295-ecf7-40d7-b49d-4927ee24eb61.html,"LUDINGTON — The West Shore Educational Service District Board of Education will consider several major funding and policy actions when it meets Monday, Dec. 9, according to the full meeting",,https://bloximages.chicago2.vip.townnews.com/shorelinemedia.net/content/tncms/custom/image/f53e5480-792c-11e6-b8d5-1f9317f28374.jpg?crop=292%2C292%2C54%2C0&resize=200%2C200&order=crop%2Cresize,,,2025-12-07 16:57:09.614274
,Education Funding,2025-12-07 19:44:00+00:00,seattlecollegian.com,Seattle Central loses TRIO funding–students feel the effects,,,,,,https://seattlecollegian.com/seattle-central-loses-trio-funding-students-feel-the-effects/,"... Education would not renew funding for TRIO Classic. The program is one of the college's two federal TRIO programs. The other program, which ...",,,,,2025-12-07 15:56:48.640509
,Education Funding,2025-12-07 19:27:05+00:00,timesnews.net,"Sullivan schools to lose almost $400K in federal title, special ed funding",,,,,,https://timesnews.net/news/172647/sullivan-schools-to-lose-almost-400k-in-federal-title-special-ed-funding/,"BLOUNTVILLE — Although the final numbers for the new fiscal year are still to be tweaked, Sullivan County's school budget for 2017-18 will be nearly $400,000 shorter overall on federal title and special education funds than in 2016-17, money that in most cases benefited low-income children.",,http://d1gpmunylt23vy.cloudfront.net/360_SixRivers_Live/0/0/0/0/238/713/238713_1,,,2025-12-07 20:56:50.112369
,New York City,2025-12-07 12:32:42+00:00,New York Daily News,"NYC schools chief Aviles-Ramos, with union and parent support, makes a case for Mamdani to keep her on",,,,,,https://www.nydailynews.com/2025/12/07/nyc-schools-chief-aviles-ramos-with-union-and-parent-support-makes-a-case-for-mamdani-to-keep-her-on/,"New York City Public Schools Chancellor Melissa Aviles-Ramos made the case Friday for Zohran Mamdani to keep her at the helm of the nation’s largest school district, just days after the mayor-elect…",,https://www.nydailynews.com/wp-content/uploads/migration/2023/02/02/WDRH5R2IHEHHMYTOBSABANN4SI.jpg?w=1024&h=670,,,2025-12-07 08:57:11.292631
,West Virginia,2025-12-07 10:59:22+00:00,Real WV,The audacity of the Hope Scholarship - Real WV,,,,,,https://therealwv.com/2025/12/07/the-audacity-of-the-hope-scholarship/,"By Matthew Young, RealWV CHARLESTON, W.Va. – The West Virginia chapter of Americans for Prosperity (AFP), on Friday, hosted a Hope Scholarship panel discussion at the Four Points by Sheraton in downtown Charleston. Moderated by AFP State Director Jason Huffman, panelists included the Cardinal Institute’s Tiffany Hoben, State Senator Mark Maynard, R-Wayne, and House of […]",,https://therealwv.com/wp-content/uploads/2025/12/IMG_4852-e1765077690876.jpg,,,2025-12-07 08:57:11.292631
,Education Funding,2025-12-06 20:10:10+00:00,The Columbian,"La Center United loses its federal grant, but not its determination to serve local youth",,,,,,https://www.columbian.com/news/2025/dec/06/la-center-united-loses-its-federal-grant-but-not-its-determination-to-service-local-youth/,"La Center United launched in 2013 to increase community collaboration and reduce youth substance use and mental health issues. The nonprofit organization has received $125,000 per year from the federa",,https://www.columbian.com/wp-content/uploads/2025/12/1020072297-La-Center-United_12.3_TB01.jpg,,,2025-12-06 16:31:20.104390
,Education Funding,2025-12-06 17:12:39+00:00,EveryLibrary,EveryLibrary Applauds Reintroduction of the Federal Right to Read Act of 2025,,,,,,https://www.everylibrary.org/applaud_reintroduction_federal_right_to_read_act_2025,"This bold federal legislation that directly addresses America's literacy crisis, restores investment in school libraries, and reaffirms every ...",,https://assets.nationbuilder.com/votelibraries/pages/22946/meta_images/original/Screenshot_2025-12-06_at_9.56.39%E2%80%AFAM.png?1765036658,,,2025-12-06 13:57:12.414926
,Pennsylvania,2025-12-06 14:20:24+00:00,MyChesCo,PA Lawmakers Unveil Aggressive Plan to Fight Federal Funding Freezes - MyChesCo,,,,,,https://www.mychesco.com/a/news/government/pa-lawmakers-unveil-aggressive-plan-to-fight-federal-funding-freezes/,"HARRISBURG, PA — A group of Democratic state lawmakers introduced legislation this week designed to shield Pennsylvania from what they describe as unlawful federal funding freezes that jeopardize public safety, …",,https://i0.wp.com/www.mychesco.com/wp-content/uploads/2019/01/Capitol-e1637414430200.jpg?fit=735%2C400&ssl=1,,,2025-12-06 12:57:18.160825
,Education Funding,2025-12-06 07:33:35+00:00,Richmondside,WCCUSD strike: District-unions will hold negotiating meetings Saturday,,,,,,https://richmondside.org/2025/12/05/wccusd-strike-day-2-school-board-emergency-meeting/,"An estimated 2,500 rallied at Marina Bay Park in Richmond as the WCCUSD school board held an all-day emergency meeting.",,https://richmondside.org/wp-content/uploads/2025/12/wccusdstrikerally_1202525_tligon-1701.jpg,,,2025-12-06 09:56:13.493608
,Education Funding,2025-12-06 07:10:25+00:00,The Center Square,WATCH: House passes bills to block CCP's influence on schools,,,,,,https://www.thecentersquare.com/florida/article_117c1237-4a6e-47fe-a017-7a13b0700975.html,(The Center Square) - House representatives passed three bills this week aimed at protecting K-12 classrooms from the influence of the Chinese Communist Party.,,https://bloximages.newyork1.vip.townnews.com/thecentersquare.com/content/tncms/assets/v3/editorial/5/7e/57ebaa31-b6b7-4c0a-aa9f-2619afde694f/68dc2014ecf3c.image.jpg?crop=1200%2C630%2C0%2C22,,,2025-12-06 14:56:14.430981
