id,name,published,outlet,title,authors,category,market,categoryorder,articleorder,url,description,text,image,error,sentiment,firstEyes
,Education Funding,2025-12-06 03:56:29+00:00,www.king.senate.gov,"King, Colleagues Slam Latest Efforts to Dismantle the Department of Education | ",,,,,,https://www.king.senate.gov/newsroom/press-releases/king-colleagues-slam-latest-efforts-to-dismantle-the-department-of-education,"<p><strong>WASHINGTON, D.C. — </strong>U.S. Senator Angus King joined a letter with a number of his colleagues to Department of Education Secretary Linda McMahon slamming the Department’s recent <a href=""https://www.ed.gov/about/news/press-release/us-department-of-education-announces-six-new-agency-partnerships-break-federal-bureaucracy"">announcement</a> that it has signed interagency agreements (IAAs) to illegally outsource core functions that students and their families rely on to four other federal agencies. In the letter, the senators called on the Secretary to reverse these latest steps that would further erode the Department of Education. Earlier this year, Senator King <a href=""https://www.king.senate.gov/newsroom/press-releases/king-blasts-trump-executive-order-to-dismantle-the-department-of-education"">criticized an executive order</a> from the Trump Administration to dismantle the Department of Education, saying “it could cost our children untold damage in their lives.”</p>
<p><strong><em>The senators began</em></strong><em>, “The actions you announced on November 18<sup>th</sup> to continue hollowing out the U.S. Department of Education are outrageous, illegal, and will jeopardize the funding and support that tens of millions of students, teachers, and families across the country rely on. Your brazen attempt to dismantle the Department by transferring to other federal agencies complex and foundational responsibilities that Congress specifically charged to the Department—including more than half of all federal funds for elementary and secondary education programs and billions in higher education funding—will undermine public education.” </em></p>
<p><em>“Let’s be very clear: You are choosing to create even more bureaucracy that states, school districts, and educational institutions across America will have to expend time and resources navigating at the expense of students and families. We urge you to immediately reverse course and to focus your time and attention on actions that actually help states, school districts and educational institutions improve educational outcomes and support for students,” <strong>wrote the senators</strong>.</em></p>
<p><em>“We expect you to work with Congress to pursue any ideas to streamline programs and improve public education, as the law and the Constitution require, and you have yourself stated you would do in your confirmation hearing. … Congress has unambiguously authorized dozens of education programs to be administered by the Department through numerous laws and has clearly appropriated funding on a bipartisan basis for decades to the Department to carry out those programs. Appropriations law prohibits the transfer of funds to another federal agency unless expressly authorized in appropriations law, which it has not done in this case,” <strong>added the senators</strong>.</em></p>
<p><strong><em>The senators continued</em></strong><em>, “Unfortunately, we have already seen negative consequences for states, schools, colleges, and students as these IAAs roll out: the first IAA inked earlier this year between the Department and DOL on career and technical education and adult education has been plagued with serious challenges—and it is but a small fraction of what is now being transferred to DOL.”</em></p>
<p>In addition to Senator King, the letter was signed by Senators Patty Murray (D-WA), Tammy Baldwin (D-WI), Bernie Sanders (I-ME), Chuck Schumer (D-NY), Andy Kim (D-NJ), Lisa Blunt Rochester (D-DE), Tina Smith (D-MN), Jack Reed (D-RI), Richard Blumenthal (D-CT), Mazie Hirono (D-HI), Tim Kaine (D-VA), Brian Schatz (D-HI), Cory Booker (D-NJ), Ed Markey (D-MA), Chris Van Hollen (D-MD), Adam Schiff (D-CA), Michael Bennet (D-CO), Amy Klobuchar (D-MN), Angela Alsobrooks (D-MD), Kirsten Gillibrand (D-NY), Jeff Merkley (D-OR), Elizabeth Warren (D-MA), Ben Ray Luján (D-NM), Raphael Warnock (D-GA), Ron Wyden (D-OR), Dick Durbin (D-IL), Chris Coons (D-DE), Alex Padilla (D-CA), John Fetterman (D-PA), Peter Welch (D-VT), Martin Heinrich (D-NM), Mark Warner (D-VA), Tammy Duckworth (D-IL), Gary Peters (D-MI) and John Hickenlooper (D-CO).</p>
<p>The full text of the letter can be found <u><a href=""https://www.appropriations.senate.gov/imo/media/doc/251203_letter_to_secretary_mcmahon_re_interagency_agreements.pdf"">here</a></u> and below.</p>
<p style=""text-align: center;"">+++</p>
<p>Dear Secretary McMahon:</p>
<p>The actions you announced on November 18 to continue hollowing out the U.S. Department of Education (“the Department”) are outrageous, illegal, and will jeopardize the funding and support that tens of millions of students, teachers, and families across the country rely on. Your brazen attempt to dismantle the Department by transferring to other federal agencies complex and foundational responsibilities that Congress specifically charged to the Department—including more than half of all federal funds for elementary and secondary education programs and billions in higher education funding—will undermine public education. This is the latest example of this administration’s complete lack of regard for our laws and its failure to provide the certainty, clarity, and stability that students and schools deserve when it comes to the federal government’s approach and commitment to properly implementing federal education laws and appropriations.</p>
<p>Let’s be very clear: You are choosing to create even more bureaucracy that states, school districts, and educational institutions across America will have to expend time and resources navigating at the expense of students and families. We urge you to immediately reverse course and to focus your time and attention on actions that actually help states, school districts and educational institutions improve educational outcomes and support for students. We expect you to work with Congress to pursue any ideas to streamline programs and improve public education, as the law and the Constitution require, and you have yourself stated you would do in your confirmation hearing.</p>
<p>The Department of Education is the only federal agency whose sole mission is to help children learn and improve their educational outcomes. The Department delivers much-needed federal funding and enforces basic educational guardrails and civil rights protections so that every child can get the quality public education that they are entitled to under the law, no matter who they are or where they live. Congress has unambiguously authorized dozens of education programs to be administered by the Department through numerous laws and has clearly appropriated funding on a bipartisan basis for decades to the Department to carry out those programs. Appropriations law prohibits the transfer of funds to another federal agency unless expressly authorized in appropriations law, which it has not done in this case. When Congress wants another agency to administer a program or function, it has expressly said so—and in some cases, it has provided authority to transfer funds to allow this to happen. By contrast, Congress has not expressly authorized any other agency to administer the programs established under the previously mentioned laws, nor has it provided the authority for the Department to transfer these programs and associated funding to another agency.</p>
<p>The November 18 announcement outlines six interagency agreements (IAAs) with the Departments of Labor, Interior, Health and Human Services, and State to transfer major responsibilities out of the Department of Education. The authorities cited in the IAAs do not enable the Department to do an end-run around the relevant authorizing and appropriating statutes. For example, the Department cites the Economy Act to justify its use of the IAA framework. While the Economy Act is routinely used by other federal agencies to enter into IAAs for the procurement of discrete goods and services that a particular agency might have expertise in and authority to provide, such as DOJ’s fingerprinting authority, this authority was never contemplated to allow the transfer of major program functions or entire offices to another agency with the express stated purpose of eventually dismantling the agency or putting the Secretary “out of a job.” Federal resources outlining the purpose of the Economy Act make this clear. This view is further affirmed by the Department’s inability to cite a single instance of using this statute or any others in a similar way prior to this year.</p>
<p>You have expressed your interest in working with Congress on these issues, but these IAAs were developed in secret without outside input. The fiscal year 2026 budget request for the Department makes no reference to administering these programs at other agencies and the fiscal year 2026 budget request for the U.S. Department of Labor (DOL), for example, makes no reference to administering them either. The Secretaries of Labor, Interior, State, and HHS have similarly never testified to Congress on how they would carry out and administer these critical education programs.</p>
<p>Since you were nominated to lead the Department, you have routinely misled the public about the level of involvement the Department has long had in the day-to-day management of schools—inaccurately suggesting that the Department was depriving states and families from making choices about their children’s education, shackling teachers with burdensome regulations and paperwork and causing K-12 and college students to experience “drudgery caused by administrative burdens.” On the basis of these false assertions, you have strangely claimed that we need to “Return Education to the States.” In fact, states and local communities have—since the founding of our republic—had the primary responsibility for educating our students and the establishment of the Department in 1979 did nothing to change that fact. In fact, there are numerous federal laws that prevent the Department from being involved in the day-to-day decision making in schools and colleges as it relates to curriculum, teaching, and programs.</p>
<p>Until your arrival at the Department, its role has been to provide funding, support, and oversight as authorized by federal education laws to ensure students from all walks of life and in every part of the country can get a high-quality public education. The Department’s programs ensure that parents get timely, accessible information about how their kids’ schools are doing. They ensure students with disabilities’ rights are enforced, so that they can get the education they are entitled to. The Department administers programs to help under-resourced rural school districts and allocates Impact Aid for more than 1,000 school districts with a reduced revenue base or increased costs due to a federal presence, such as a military base. It also administers programs to help first-generation and low-income students pursue and succeed in college. These are just a select few examples of the indispensable supporting role that the federal government—and the Department, in particular—plays in advancing educational outcomes for students.</p>
<p>To justify these new IAA’s, you say federal funding will keep flowing to states, school districts, and colleges. But we have already seen funding held up and seriously delayed because of this administration’s chaotic changes—and its extreme policies—and the moves you announced last week are certain to further jeopardize these funds.</p>
<p>You claim these actions will improve student achievement, yet your actions will significantly weaken federal monitoring of states’ K-12 accountability and school improvement systems. Before Congress mandated that states develop these systems with key guardrails in the Elementary and Secondary Education Act, several states had weak or no school improvement systems, which allowed vulnerable students to slip through the cracks. As part of ESEA and subsequent appropriations directives, Congress has charged OESE with improving state compliance in state and local school report cards requirements, school improvement, and more. But without the staff expertise from OESE, it is likely that DOL will be ineffective in holding states accountable for improving student outcomes.</p>
<p>The Department also provides deep policy expertise to ensure programs support improved student outcomes, such as through expert guidance to colleges and universities to improve college access, retention, and completion through programs like TRIO, GEAR UP, the Postsecondary Student Success Grant Program, and others. Now, DOL, who lacks the necessary expertise, is tasked with managing these programs and students will suffer as a result.</p>
<p>DOL has no prior experience in administering education programs at this scale and complexity and will need to develop the capacity and processes to allot billions of dollars in funding to state and local educational agencies. States will also have to make changes to receive any funds distributed through DOL’s grant system while continuing to draw down prior year grant funding in the Department’s system. Your IAA also seems to suggest the Department will still retain some authorities over Title I-A, which means that states will now have to work with two federal agencies when they need help navigating this complex and absolutely critical program. These changes solve exactly zero problems but manage to create an onslaught of new ones. We are very concerned that these changes will mean funds our constituents rely on will not continue to flow as intended under federal education laws.</p>
<p>In addition to its scope and complexity, the Title I-A program primarily funds instruction and activities in elementary schools. We do not believe kindergartners or other elementary school students should be the focus of efforts to integrate workforce programming and education activities, activities that are better suited to older students. Instead of improving students’ readiness for the workforce, the move of Title I-A to DOL is much more likely to deprive states and school districts of the technical assistance and support they need to effectively implement federal education funding in their schools and provide high-quality educational opportunities to all students.</p>
<p>DOL already has a comprehensive workload to support the nation’s workers and workforce programs. It is authorized and funded to administer workforce training and enforce worker protection programs for which Congress appropriates $13.5 billion in discretionary funding annually, including for roughly a dozen workforce training grant programs totaling approximately $4 billion in annual funding. In addition to lacking the subject area expertise needed to administer the Department’s programs, DOL does not have the grant administration capacity to take on the work outlined in the IAA; the approximately $30 billion in the Department’s funding across approximately 50 discrete formula and competitive education grant programs that you seek to transfer now to DOL dwarf its current grant administration and oversight work. Transferring basic and significant responsibilities for administering education programs to DOL creates very significant risks of delays in funding and other administrative challenges for states, school districts, institutions of higher education, and other organizations through Impact Aid, rural education programs, afterschool programs, TRIO, and foundational education formula grant programs that tens of thousands of schools count on to help provide a quality education to millions of students.</p>
<p>Unfortunately, we have already seen negative consequences for states, schools, colleges, and students as these IAAs roll out: the first IAA inked earlier this year between the Department and DOL on career and technical education and adult education has been plagued with serious challenges—and it is but a small fraction of what is now being transferred to DOL. In fact, as your own staff reportedly concluded in its analysis after this transfer, “The size and scope of OCTAE's programs are miniscule [sic] compared to other [Education Principal Operating Components] and programs…Larger formula grants and competitive grants are going to be much more difficult to migrate.” States and districts faced delays in accessing their Perkins CTE funding, and advocates report delays in guidance and training issued by DOL. Moreover, a CTE expert recently testified before the House of Representatives, “At a time of scarce resources, it’s hard to understand why the Department is paying Labor to do work that it can do for itself.” The fiscal year 2025 funding level for Perkins CTE and adult education was $2.18 billion, whereas the other programs DOL will now be responsible for are funded at roughly $30 billion. If the administrative costs balloon under these new IAAs as the administrative costs under the CTE IAA have, not only will these IAAs be terrible for students, their families, and educators, they will also be a catastrophic waste of time and money for the American taxpayer.</p>
<p>The Department has provided no substantive detail or even basic information about how the significant changes envisioned by these IAAs would be implemented. The other federal agencies that will suddenly have significant responsibilities in administering billions in education funding—have provided no information about their roles or their capacity to carry out these programs and activities. The plan seems clear—to jam these changes through for a talking point, whatever the consequences may be for states, school districts, schools, students, and families.</p>
<p>We once again demand that you reverse these detrimental plans and refocus your efforts on supporting state and local efforts by properly implementing federal laws intended to improve educational opportunities and outcomes for all students, especially those who count on the Department doing its job most.</p>
<p style=""text-align: center;"">Sincerely,</p>
<p style=""text-align: center;"">###</p>",,https://www.king.senate.gov/assets/images/sharelogo.jpg?10-22-2020,,,2025-12-06 06:56:09.529832
,Education Funding,2025-12-06 03:27:23+00:00,Maryland Daily Record,Court rejects Trump bid to halt school mental health grants,,,,,,https://thedailyrecord.com/2025/12/05/court-rejects-trump-school-mental-health-grants-halt/,A federal appeals court rejected the Trump administration's bid to halt an order to release grants to boost mental health workers in schools.,,https://thedailyrecord.com/files/2025/05/Education-Secretary-Linda-McMahon-April-16.jpg,,,2025-12-06 02:56:27.728463
,New York City,2025-12-06 03:05:32+00:00,CTVNews,Education Minister doesn’t expect trustees to return to OCDSB ‘anytime soon’,,,,,,https://www.ctvnews.ca/ottawa/article/education-minister-doesnt-expect-trustees-to-return-to-ocdsb-anytime-soon/,Ontario Education Minister Paul Calandra says he does not foresee school board trustees returning to Ottawa’s largest school board “anytime soon.”,,https://www.ctvnews.ca/resizer/v2/3XXXNYYDEVAYZCGT2BUILOSFXM.png?smart=true&auth=80cfc0a80b0f4046ef8d8b6fbac01068d88fbd4f41798b9aa624f7e276dd831d&width=1200&height=630,,,2025-12-06 00:56:48.493908
,Education Funding,2025-12-06 02:29:47+00:00,www.youtube.com,FY 2025 FIPSE-SP Pre-Application Technical Assistance Webinar - YouTube,,,,,,https://www.youtube.com/watch%3Fv%3DkPpdJdNFEHk,This is a pre-recording of the pre-application technical assistance (TA) webinar for the FY 2025 competition for the Fund for the Improvement of ...,,,,,2025-12-06 09:56:13.493608
,Arizona,2025-12-06 00:46:24+00:00,https://www.kold.com,Federal cuts leave many Arizona special education students without oversight,,,,,,https://www.kold.com/2025/12/06/federal-cuts-leave-many-arizona-special-education-students-without-oversight/,"Federal cuts have left more than 100,000 special education students in Arizona without oversight after the Trump administration began making cuts to the Department of Education in March.",,https://gray-kold-prod.gtv-cdn.com/resizer/v2/TM44QUSHPVEINLXXH3OGGV7DLY.jpg?auth=bf1b6dc3c4c67023269615bb2e5f84ce1678d1f09e82c198d13a735e70058b94&width=1200&height=600&smart=true,,,2025-12-05 22:56:49.529794
,Education Funding,2025-12-06 00:09:15+00:00,York Dispatch,York Suburban school officials grapple with new mandates despite arrival of funds,,,,,,https://www.yorkdispatch.com/story/news/education/2025/12/05/york-suburban-school-officials-grapple-with-new-mandates-amid-arrival-of-funds/87484398007/,"York Suburban officials discussed topics such as how the special education funding keeps increasing, but the state's funding doesn't match.",,"https://www.yorkdispatch.com/gcdn/presto/2021/04/20/PPYD/77149084-e5f9-4571-99cb-e4927fdf15d4-210420_djs_BUILDING_MUG-York_Suburban_Administrative_01.jpg?crop=2499,1406,x1,y0&width=2499&height=1406&format=pjpg&auto=webp",,,2025-12-05 23:56:07.353592
,Education Funding,2025-12-05 23:59:11+00:00,Texas AFT,Federal Reshuffle of the U.S. Department of Education: What Happens When Core Functions Are Scattered,,,,,,https://www.texasaft.org/policy/funding/federal-reshuffle-of-the-u-s-department-of-education-what-happens-when-core-functions-are-scattered/,A Union of Professionals,,https://www.texasaft.org/wp-content/uploads/2025/10/all-in-for-public-schools-aft-101-1.jpg,,,2025-12-05 20:57:05.594051
,Education Funding,2025-12-05 23:06:00+00:00,www.grahamleader.com,GISD breaking down school finance with Dollars and Sense website | The Graham Leader,,,,,,https://www.grahamleader.com/news/gisd-breaking-down-school-finance-dollars-and-sense-website,"The school finance tab shows how the district's budget is split into local, state and federal funding. Local funding makes up approximately 36% of the ...",,,,,2025-12-05 23:56:07.353592
,Connecticut,2025-12-05 22:45:23+00:00,CT Mirror,US appeals court rejects Trump bid to halt school mental health grants,,,,,,https://ctmirror.org/2025/12/05/us-appeals-court-rejects-trump-halt-school-mental-health-grants/,"The mental health program included grants meant to help schools hire more counselors, psychologists and social workers.",,https://ctmirror.org/wp-content/uploads/2025/12/AP25339224849926-scaled.jpg,,,2025-12-05 18:57:34.305654
,Education Funding,2025-12-05 21:34:06+00:00,Federal Way Mirror,FWPS levy renewal approved for February ballot | Federal Way Mirror,,,,,,https://www.federalwaymirror.com/news/fwps-levy-renewal-approved-for-february-ballot/,"Levy will fund academic programs, instructional and support staff, and daily operational costs.",,https://www.federalwaymirror.com/wp-content/uploads/2025/12/41000737_web1_EPOlevy-fwm-251205-FundingGraph_1.jpeg,,,2025-12-05 16:57:05.930248
