id,name,published,outlet,title,authors,category,market,categoryorder,articleorder,url,description,text,image,error,sentiment,firstEyes
,Costs & Impacts,2025-12-03 23:34:52+00:00,www.facebook.com,Yahoo - Six former Environmental Protection Agency employees on Wednesday filed a First Amendment legal challenge against EPA ​Administrator Lee Zeldin for terminating their employment because they protested what ‌they said was the politicization of science under the Trump administration. | Facebook,,,,,,https://www.facebook.com/yahoonews/photos/six-former-environmental-protection-agency-employees-on-wednesday-filed-a-first-/1236088525043497/,Six former Environmental Protection Agency employees on Wednesday filed a First Amendment legal challenge against EPA ​Administrator Lee Zeldin for terminating their employment because they protested...,,https://scontent-iad3-1.xx.fbcdn.net/v/t39.30808-6/594969241_1236088528376830_679968537244985211_n.jpg?stp=dst-jpg_p206x206_tt6&_nc_cat=110&ccb=1-7&_nc_sid=27488d&_nc_ohc=TTDj4q-KTikQ7kNvwF-WRFj&_nc_oc=AdkmGea5A6Pgk9Ys1X0mwr8k6YHrCc3Xh3NvmLOrcDxrt-5fU6an5LgdAag8zwbfDaPGbW80q0O9AWro1h8ICX3P&_nc_zt=23&_nc_ht=scontent-iad3-1.xx&_nc_gid=6boT1-UhD11S3HCQBG8T7Q&oh=00_AfkaXct212kwey8hFOsf6E97Xdj23yAksRXxP-AZk_6vzg&oe=6936A834,,,2025-12-03 20:59:48.145501
,Costs & Impacts,2025-12-03 23:34:44+00:00,US EPA,"Toxic Substances Control Act (TSCA), Superfund and PFAS | US EPA",,,,,,https://www.epa.gov/quality/toxic-substances-control-act-tsca-superfund-and-pfas,Request for Correction about TSCA and Designation of PFOA and PFOS as Hazardous Substances under CERLA,,https://www.epa.gov/sites/all/themes/epa/img/epa-standard-og.jpg,,,2025-12-03 20:59:48.145501
,,2025-12-03 23:33:41+00:00,JD Supra,US EPA and Army Corps Issue Long-Awaited Proposed WOTUS Rule | JD Supra,,,,,,https://www.jdsupra.com/legalnews/us-epa-and-army-corps-issue-long-2170446/,"On November 20, 2025, the US EPA and the Army Corps of Engineers published the long-awaited proposed rule revising the regulatory definition of...",,https://jdsupra-static.s3.amazonaws.com/profile-images/og.15853_0143.jpg,,,2025-12-03 20:59:48.145501
,,2025-12-03 23:32:47+00:00,Federal News Network - Helping feds meet their mission.,"Fired EPA employees challenge agency, alleging free speech violations",,,,,,https://federalnewsnetwork.com/workforce-rightsgovernance/2025/12/fired-epa-employees-challenge-agency-alleging-free-speech-violations/,Six former EPA employees who signed a letter criticizing the Trump administration are now appealing their subsequent terminations to the MSPB.,,https://federalnewsnetwork.com/wp-content/uploads/2025/03/EPA_Green_Bank_46992-scaled.jpg,,,2025-12-03 19:05:58.367408
,,2025-12-03 23:31:21+00:00,www.allenmatkins.com,EPA and Army Corps Release Proposed Rule Significantly Narrowing Federal “Waters of ...,,,,,,https://www.allenmatkins.com/real-ideas/epa-and-army-corps-release-proposed-rule-significantly-narrowing-federal-waters-of-the-united-states-wotus-jurisdiction-after-sackett.html,"On November 17, 2025, the U.S. Environmental Protection Agency (EPA) and Army Corps of Engineers (Corps) (collectively, the “Agencies”) released a ...",,,,,2025-12-03 20:59:48.145501
,Costs & Impacts,2025-12-03 23:16:18+00:00,NPR,Trump administration rolls back fuel economy standards,,,,,,https://www.npr.org/2025/12/03/nx-s1-5630389/trump-administration-rolls-back-fuel-economy-standards,"At the White House this afternoon, President Trump said he was terminating ""ridiculously burdensome"" fuel economy rules. It's part of a series of changes relaxing or eliminating rules promoting cleaner cars.",,https://npr.brightspotcdn.com/dims3/default/strip/false/crop/5920x3330+0+172/resize/1400/quality/100/format/jpeg/?url=http%3A%2F%2Fnpr-brightspot.s3.amazonaws.com%2F02%2F41%2F41e21b9a4746b037eb9bea98f959%2Fgettyimages-2249777843.jpg,,,2025-12-03 19:05:58.367408
,,2025-12-03 23:01:44+00:00,Energy.gov,Thousands of acres at Oak Ridge deemed suitable for reuse,,,,,,https://www.energy.gov/em/articles/thousands-acres-oak-ridge-deemed-suitable-reuse,OREM worked with EPA and TDEC to confirm half of the acreage on the Oak Ridge Reservation was not impacted by previous operations and does not require cleanup. This clarification provides transparency about the condition of the land and supports reuse.,,https://www.energy.gov/sites/default/files/2025-04/white-fallback_0.png,,,2025-12-03 19:05:58.367408
,Costs & Impacts,2025-12-03 22:52:44+00:00,www.bbc.com,Trump administration to roll back fuel economy rules set under Biden,,,,,,https://www.bbc.com/news/articles/cly13we8zxeo,"Carmakers hailed the change as a victory for ""common sense"", while environmental groups criticised the plan.",,https://ichef.bbci.co.uk/news/1024/branded_news/2ac1/live/72675210-d06a-11f0-8039-b97ff13472bc.jpg,,,2025-12-03 19:05:58.367408
,,2025-12-03 22:48:40+00:00,www.youtube.com,Environmental groups suing Ohio EPA - YouTube,,,,,,https://www.youtube.com/watch%3Fv%3DHndJPrb75v4,Environmental groups are taking the state to court over changes to how the Ohio Environmental Protection Agency regulates air pollution.,,,,,2025-12-03 19:05:58.367408
,Costs & Impacts,2025-12-03 22:36:00+00:00,www.facebook.com,President Trump said that he'd cancel the Environmental Protection Agency's tailpipe ... - Facebook,,,,,,https://www.facebook.com/WINKNewsTV/posts/president-trump-said-that-hed-cancel-the-environmental-protection-agencys-tailpi/895492443040969/,"President Trump cancels EPA tailpipe emission standards, announces increased funding in autom... President Donald Trump held a news conference on ...",,,,,2025-12-03 18:04:19.254393
,Clean Air & Water,2025-12-03 22:29:38+00:00,American Chemistry Council,ACC Formaldehyde Panel Commends EPA’s Announcement to Strengthen TSCA Risk Evaluation - American Chemistry Council,,,,,,https://www.americanchemistry.com/chemistry-in-america/news-trends/press-release/2025/acc-formaldehyde-panel-commends-epa-s-announcement-to-strengthen-tsca-risk-evaluation,The American Chemistry Council’s (ACC) Formaldehyde Panel today issued the following statement in response to the U.S. Environmental Protection Agency’s (EPA) decision to revisit its Toxic Substances Control Act (TSCA) risk evaluation for formaldehyde.,,https://www.americanchemistry.com/var/site/storage/images/3/9/9/2/2993-2-eng-US/Government-EPA-Building.png,,,2025-12-03 18:04:19.254393
,Costs & Impacts,2025-12-03 22:12:32+00:00,www.facebook.com,Six former Environmental Protection Agency employees on Wednesday filed a First ... - Facebook,,,,,,https://www.facebook.com/yahoonews/posts/six-former-environmental-protection-agency-employees-on-wednesday-filed-a-first-/1236088551710161/,EPA leaders had placed 144 employees on leave for endorsing a public missive that said the changes President Donald Trump and his appointees had made ...,,,,,2025-12-03 19:05:58.367408
,,2025-12-03 22:08:33+00:00,www.pa.gov,DEP Extends PA Freight Innovations in Transportation Grant Deadline,,,,,,https://www.pa.gov/agencies/dep/newsroom/2025-12-03-dep-extends-pa-freight-innovations-in-transportation-grant-deadline,DEP Extends PA Freight Innovations in Transportation Grant Deadline,,https://www.pa.gov/content/dam/copapwp-pagov/en/global/images/thumbnail.png,,,2025-12-03 19:05:58.367408
,,2025-12-03 22:01:05+00:00,WVXU,"Some local wetlands, streams could lose federal protections under proposed EPA rule",,,,,,https://www.wvxu.org/environment/2025-12-03/wetlands-streams-federal-protections-epa-rule,"In mid-November, the EPA and Army Corps of Engineers announced a proposal for a new definition of the waters of the United States, limiting what qualifies for protection under the Clean Water Act.",,https://npr.brightspotcdn.com/dims4/default/ed3fe14/2147483647/strip/true/crop/4023x2112+211+0/resize/1200x630!/quality/90/?url=http%3A%2F%2Fnpr-brightspot.s3.amazonaws.com%2F88%2Fde%2F04055120465093f5bcb9a4f4008e%2Fclark-st-lhd-after.jpg,,,2025-12-03 18:04:19.254393
,Costs & Impacts,2025-12-03 21:46:05+00:00,www.washingtontimes.com,Biden's EPA paid $10.9 million in lawyers' fees in sue-and-settle cases - Washington Times,,,,,,https://www.washingtontimes.com/news/2025/dec/3/bidens-epa-paid-109-million-lawyers-fees-sue-settle-cases/,"The Biden administration set records for sue-and-settle cases, according to a new study that said the EPA paid out $10.9 million in lawyers' fees ...",,,,,2025-12-03 18:04:19.254393
,,2025-12-03 21:34:12+00:00,ecomagazine.com,NFWF Announces Grants from Long Island Sound Futures Fund - ECO Magazine,,,,,,https://ecomagazine.com/news/coastal/nfwf-announces-grants-from-long-island-sound-futures-fund/,Launch new oyster restoration efforts. Funding for the grant program comes from the US Environmental Protection Agency (EPA) as part of the Long ...,,,,,2025-12-03 17:05:38.148868
,Costs & Impacts,2025-12-03 21:28:13+00:00,WTOP News,Chesapeake Bay leaders set new cleanup goal for 2040 - WTOP News,,,,,,https://wtop.com/local/2025/12/chesapeake-bay-leaders-set-new-cleanup-goal-for-2040/,Chesapeake Bay area leaders have officially committed to a new deadline for improving the health of the nation’s largest estuary: 2040.,,https://wtop.com/wp-content/uploads/2025/12/DSC09263-2048x1365-1-e1764802419800.jpeg,,,2025-12-03 19:05:58.367408
,Costs & Impacts,2025-12-03 21:24:25+00:00,thehill.com,Trump proposes to roll back auto gas mileage standards - The Hill,,,,,,https://thehill.com/policy/energy-environment/5632162-trump-auto-gas-mileage-standards/,Those standards were issued in conjunction with Environmental Protection Agency vehicle emissions standards that were considered even more ...,,,,,2025-12-03 18:04:19.254393
,,2025-12-03 21:18:05+00:00,natlawreview.com,EPA Seeks to Implement Sackett v EPA in Proposed WOTUS Rule - The National Law Review,,,,,,https://natlawreview.com/article/epa-and-army-corps-release-proposed-rule-significantly-narrowing-federal-waters,"Environmental Protection Agency and Army Corps of Engineers released Proposed Rule to revise Waters of US definition under the Clean Air Act, ...",,,,,2025-12-03 17:05:38.148868
,,2025-12-03 21:13:20+00:00,AgriLife Today,"Crop, livestock risk protection seminar set on Dec. 17 across Panhandle, South Plains - AgriLife Today",,,,,,https://agrilifetoday.tamu.edu/event-advance/crop-livestock-risk-protection-seminar-set-on-dec-17-across-panhandle-south-plains/,The Texas A&M AgriLife Extension Service will host the AgriLife Extension Crop and Livestock Risk Protection Seminar Dec. 17.,,https://media.agrilifetoday.tamu.edu/2025/12/DSC_9131.jpg,,,2025-12-03 17:05:38.148868
,,2025-12-03 21:09:20+00:00,thehill.com,EPA staffers challenge their terminations over 'dissent' letter - The Hill,,,,,,https://thehill.com/policy/energy-environment/5632300-epa-dissent-letter-terminations/,Former EPA employees challenge their terminations after signing a letter criticizing the Trump administration. They claim it violates their free ...,,,,,2025-12-03 17:05:38.148868
,,2025-12-03 21:07:05+00:00,www.newaginternational.com,Biotalys' EVOCA biofungicide secures U.S. EPA approval - New AG International,,,,,,http://www.newaginternational.com/biocontrol/biotalys-evoca-biofungicide-secures-u-s-epa-approval/,"By Janet Kanters Biotalys, an agricultural technology company, has achieved a significant milestone with the U.S. Environmental Protection Agency ...",,,,,2025-12-03 19:05:58.367408
,,2025-12-03 21:03:16+00:00,www.waterboards.ca.gov,"Six new members, three returning appointees named to State Water Board SAFER Advisory Group",,,,,,https://www.waterboards.ca.gov/press_room/press_releases/2025/pr20251203-safer.html,"Angela Islas, non-governmental organization, Central California Environmental ... the authority of the California Environmental Protection Agency CalEPA ...",,,,,2025-12-03 19:05:58.367408
,,2025-12-03 20:59:21+00:00,www.justice.gov,Two Virginia Men Arrested for Conspiring to Destroy Government Databases,,,,,,https://www.justice.gov/opa/pr/two-virginia-men-arrested-conspiring-destroy-government-databases,A federal grand jury in the Middle District of Louisiana returned an indictment today charging a Texas man with a scheme to obtain controlled substances from multiple pharmacies using fraudulent prescriptions and then sell those drugs on the street.,,https://www.justice.gov/themes/custom/usdoj_uswds/images/metatag-image--press-release.png,,,2025-12-03 17:05:38.148868
,,2025-12-03 20:54:15+00:00,The White House,Fact Sheet: President Donald J. Trump Announces the Reset of Corporate Average Fuel Economy (CAFE) Standards,,,,,,https://www.whitehouse.gov/fact-sheets/2025/12/fact-sheet-president-donald-j-trump-announces-the-reset-of-corporate-average-fuel-economy-cafe-standards/,"DELIVERING A WIN FOR AMERICAN FAMILIES AND AUTOMAKERS: Today, President Donald J. Trump is delivering major relief to American families by resetting",,https://www.whitehouse.gov/wp-content/uploads/2025/03/WH47-Social-Share-Card.jpg,,,2025-12-03 17:05:38.148868
,Costs & Impacts,2025-12-03 20:15:28+00:00,protectnps.org,36 Community Groups to EPA: Don't Weaken Regional Haze Protections for Parks and ...,,,,,,https://protectnps.org/36-community-groups-to-epa-dont-weaken-regional-haze-protections-for-parks-and-communities/,We strongly urge the Environmental Protection Agency to ensure that any revisions or changes to the Regional Haze Rule safeguard: 1) the Rule's ...,,,,,2025-12-03 16:03:25.215247
,Costs & Impacts,2025-12-03 20:14:08+00:00,www.wastetodaymagazine.com,PaintCare to operate statewide in Illinois - Waste Today,,,,,,https://www.wastetodaymagazine.com/news/illinois-paint-epr-paintcare-collection-waste-diversion-2025/,"Oversight for the program will be provided by the Illinois Environmental Protection Agency (EPA). ""The launch of the PaintCare program represents ...",,,,,2025-12-03 18:04:19.254393
,Costs & Impacts,2025-12-03 20:06:07+00:00,Aberdeen Insider,3M Reports 'forever Chemicals' Contamination In Soil And Groundwater Near Aberdeen Plant | Aberdeen Insider,,,,,,https://aberdeeninsider.com/3m-reports-pfas-contamination-in-soil-and-groundwater-at-aberdeen-facility/,"Higher-than-allowed levels of manmade ""forever chemicals"" that have the potential to cause environmental and health problems have been found in soil and",,https://aberdeen-insider-media.s3.us-east-2.amazonaws.com/wp-content/uploads/2023/08/05115418/3MCO_Aberdeen_Aerial-1022_800x430.jpg,,,2025-12-03 18:04:19.254393
,Costs & Impacts,2025-12-03 19:35:20+00:00,Center for Biological Diversity,Journal Retracts Key Paper Claiming Glyphosate Not Linked to Cancer,,,,,,https://biologicaldiversity.org/w/news/press-releases/journal-retracts-key-paper-claiming-glyphosate-not-linked-to-cancer-2025-12-03/,"The scientific journal Regulatory Toxicology and Pharmacology has issued a rare retraction of one of the most cited studies on the safety of the pesticide glyphosate, the main ingredient in the weedkiller Roundup.  

The study, which found that glyphosate poses no cancer or other health risks to people, was retracted because it relied exclusively on unpublished Monsanto studies. The study failed to review any research that was not conducted by Monsanto, the maker of glyphosate, now owned by Bayer. The journal also found that the paper may have been ghostwritten by Monsanto employees and that financial compensation from Monsanto was not disclosed.

The article has been cited extensively by regulatory agencies around the world, including the U.S. Environmental Protection Agency, as evidence that glyphosate poses no cancer risk to humans. The paper is in the top 0.1% of cited articles on glyphosate in the scientific literature, meaning it is more highly cited than 99.9% of articles written on the chemical.",,https://www.biologicaldiversity.org/news/press_releases/images/center-frog-logo-300.jpg,,,2025-12-03 15:04:46.518359
,,2025-12-03 19:32:03+00:00,JD Supra,Federal Agencies Unveil Revised WOTUS Rule That May Ease CWA Permitting | JD Supra,,,,,,https://www.jdsupra.com/legalnews/federal-agencies-unveil-revised-wotus-9675399/,"On November 20, 2025, the U.S. Environmental Protection Agency (EPA) and the U.S. Army Corps of Engineers (Corps) issued a proposed rule to amend the...",,https://jdsupra-static.s3.amazonaws.com/profile-images/og.16024_4443.jpg,,,2025-12-03 17:05:38.148868
,Costs & Impacts,2025-12-03 19:32:03+00:00,JD Supra,EPA Proposes Narrowed Scope for PFAS Reporting Rule | JD Supra,,,,,,https://www.jdsupra.com/legalnews/epa-proposes-narrowed-scope-for-pfas-8102179/,The U.S. Environmental Protection Agency has proposed amendments to simplify its Toxic Substances Control Act Section 8(a)(7) PFAS Reporting and...,,https://jdsupra-static.s3.amazonaws.com/profile-images/og.16335_5345.jpg,,,2025-12-03 15:04:46.518359
,Costs & Impacts,2025-12-03 19:18:06+00:00,www.contagionlive.com,Petition Urges EPA to Halt Antibiotic and Antifungal Pesticide Use Over Resistance Risks | Contagion Live,,,,,,https://www.contagionlive.com/view/petition-urges-epa-to-halt-antibiotic-and-antifungal-pesticide-use-over-resistance-risks,A public health and farmworker coalition says agricultural spraying of medically important antibiotics and antifungals contributes to environmental resistance and warrants EPA cancellation.,,https://cdn.sanity.io/images/0vv8moc6/contagion/6ec7721e70fe4c831b7186d88052d2ffd460d987-1536x1024.png,,,2025-12-03 15:04:46.518359
,Costs & Impacts,2025-12-03 19:00:59+00:00,ProPublica,Powerful Friends: Sympathetic Officials and “Cultural Power” Help Ranchers Dodge Oversight,,,,,,https://www.propublica.org/article/politicians-help-ranchers-dodge-oversight,"Elected officials are quick to support public lands ranchers who are accused of breaking rules. As a result, federal agencies pull punches when enforcing regulations.",,"https://www.propublica.org/wp-content/uploads/2025/12/OG250603_HCN_0867_maxHeight_3000_maxWidth_3000-copy.jpg?resize=2000,1050",,,2025-12-03 17:05:38.148868
,,2025-12-03 18:40:56+00:00,www.cgsmc.com,Warp Recognized as a SmartWay® Transport Partner by the U.S. Environmental Protection Agency,,,,,,https://www.cgsmc.com/markets/stocks.php%3Farticle%3Dgnwcq-2025-12-3-warp-recognized-as-a-smartway-transport-partner-by-the-us-environmental-protection-agency,"SmartWay is the EPA's flagship program for measuring, benchmarking, and improving freight transportation efficiency. As a certified SmartWay carrier, ...",,,,,2025-12-03 17:05:38.148868
,,2025-12-03 18:21:51+00:00,Yahoo Finance,Warp Recognized as a SmartWay® Transport Partner by the U.S. Environmental Protection Agency,,,,,,https://sg.finance.yahoo.com/news/warp-recognized-smartway-transport-partner-181500266.html,"Los Angeles, CA, Dec. 03, 2025 (GLOBE NEWSWIRE) -- Warp announced today that it has been officially recognized as a certified SmartWay® Transport Partner carrier by the U.S. Environmental Protection Agency (EPA). This designation marks a significant milestone in the company’s commitment to delivering cleaner, more efficient, and cost-effective freight transportation. SmartWay is the EPA’s flagship program for measuring, benchmarking, and improving freight transportation efficiency. As a certifie",,https://media.zenfs.com/en/globenewswire.com/9b1ce3fcc25137cf32f2e6ede4947c33,,,2025-12-03 14:06:33.220523
,,2025-12-03 18:08:43+00:00,www.reuters.com,Fired employees file First Amendment lawsuit against EPA | Reuters,,,,,,https://www.reuters.com/legal/litigation/fired-employees-file-first-amendment-lawsuit-against-epa-2025-12-03/,Six former Environmental Protection Agency employees on Wednesday filed a First Amendment legal challenge against EPA Administrator Lee Zeldin for ...,,,,,2025-12-03 14:06:33.220523
,EPA Rollbacks,2025-12-03 18:05:12+00:00,www.facebook.com,The Trump EPA is delivering historic deregulation that lowers costs and strengthens ... - Facebook,,,,,,https://www.facebook.com/EPA/posts/the-trump-epa-is-delivering-historic-deregulation-that-lowers-costs-and-strength/1296013212566482/,The Trump EPA is delivering historic deregulation that lowers costs and strengthens America's energy security⚡️    . We're repealing Biden-Obama ...,,,,,2025-12-03 17:05:38.148868
,Clean Air & Water,2025-12-03 18:04:44+00:00,www.epa.ie,ETS1 Stationary Installation Operators: Carbon Dioxide EPA Emission Factors 2025,,,,,,https://www.epa.ie/publications/licensing--permitting/climate-change/ets1-stationary-installation-operators-carbon-dioxide-epa-emission-factors-2025.php,Tables showing fuel factors for calculating carbon dioxide emissions,,,,,2025-12-03 17:05:38.148868
,,2025-12-03 17:50:44+00:00,www.washingtonpost.com,Here's how to position your shower curtain to reduce mold risk - The Washington Post,,,,,,https://www.washingtonpost.com/wellness/2025/12/02/shower-curtain-humidity-mold/,"... Environmental Protection Agency. Too far above that, and mold can begin to grow. This is especially a concern in bathrooms where water and humid ...",,,,,2025-12-03 15:04:46.518359
,Costs & Impacts,2025-12-03 17:25:17+00:00,Environmental Defense Fund,Trump EPA Proposal Lowballs Risk of Cancer-causing Formaldehyde,,,,,,https://www.edf.org/media/trump-epa-proposal-lowballs-risk-cancer-causing-formaldehyde,The Trump administration’s Environmental Protection Agency has proposed altering the way it assesses risk for cancer-causing formaldehyde,,,,,2025-12-03 13:03:37.732748
,Costs & Impacts,2025-12-03 17:23:34+00:00,North Dakota Living,EPA transfers some coal oversight to state,,,,,,https://ndliving.com/epa-transfers-some-coal-oversight-state,"During U.S. Environmental Protection Agency (EPA) Administrator Lee Zeldin’s visit to North Dakota in November, the agency announced its approval of North Dakota’s coal combustion residuals (CCR) permit program. The approval allows the state, instead of the federal government, to regulate the disposal of CCR in surface impoundments and landfills, making North Dakota the fourth state to have this oversight authority. Zeldin says the move signals EPA’s commitment to permitting reform, which has become a policy priority for electric cooperatives.",,https://ndliving.com/sites/default/files/styles/focal_point_article_images_1200x630/public/images/inpage/CCR-EPA-Meeting-9_800x600_2025.png.jpg?itok=6amE1Vjn,,,2025-12-03 17:05:38.148868
,,2025-12-03 17:18:15+00:00,www.youtube.com,Lee Zeldin Shares Environmental Protection Agency Update at Trump's 9th MAGA Cabinet Meeting,,,,,,https://www.youtube.com/watch%3Fv%3D1144_ikki54%26vl%3Diw,"Live coverage of speeches, rallies, and events across America with raw, unfiltered, authentic reporting. MAGNO NEWS is committed to transparency ...",,,,,2025-12-03 15:04:46.518359
,,2025-12-03 17:16:18+00:00,https://www.wvlt.tv,"25.5 square miles in Oak Ridge previously tapped for environmental cleanup cleared by EPA, DOE says",,,,,,https://www.wvlt.tv/2025/12/03/255-square-miles-oak-ridge-previously-tapped-environmental-cleanup-cleared-by-epa-doe-says/,"Thousands of acres previously considered contaminated in Oak Ridge through decades of uranium enrichment have been cleared for use, according to the U.S. Department of Energy’s (DOE) Oak Ridge Office of Environmental Management (OREM). ",,https://gray-wvlt-prod.gtv-cdn.com/resizer/v2/F6D67ECZG5KFBPC73DCE6DMQV4.jpg?auth=2baa2117f24401d110317994c9a5951f37f09ffa64dcb70b2b2726e788523720&width=1200&height=600&smart=true,,,2025-12-03 13:03:37.732748
,,2025-12-03 16:54:24+00:00,public-inspection.federalregister.gov,BILLING CODE 6560-50-P ENVIRONMENTAL PROTECTION AGENCY [EPA-HQ-OPPT-2017-0647,,,,,,https://public-inspection.federalregister.gov/2025-21938.pdf,"Title: PCBs, Consolidated Reporting and Recordkeeping Requirements. EPA ICR No.: 1446.15. OMB Control No.: 2070-0112. ICR Status: This ICR is ...",,,,,2025-12-03 14:06:33.220523
,,2025-12-03 16:38:37+00:00,CT.gov - Connecticut's Official State Website,DEEP Announces New Inland Sportfish Regulations Focused on Conserving Wild Brook Trout,,,,,,https://portal.ct.gov/deep/news-releases/news-releases---2025/deep-announces-new-inland-sportfish-regulations-focused-on-conserving-wild-brook-trout,DEEP Announces New Inland Sportfish Regulations Focused on Conserving Wild Brook Trout,,https://portal.ct.gov/Assets/Images/facebook-default_01.png,,,2025-12-03 14:06:33.220523
,,2025-12-03 16:11:55+00:00,www.americanenergyalliance.org,American Energy Alliance's Statement on WOTUS and ESA Reform,,,,,,https://www.americanenergyalliance.org/2025/12/american-energy-alliances-statement-on-wotus-and-esa-reform/%3Famp%3D1,"Washington, DC, USA - May 5, 2011: United States Environmental Protection Agency (EPA) sign at the headquarters building in Washington, DC. WASHINGTON ...",,,,,2025-12-03 15:04:46.518359
,,2025-12-03 16:07:44+00:00,RFD-TV,EPA Clarifies Safety of Single-Fluorinated Pesticide Approvals,,,,,,https://www.rfdtv.com/epa-clarifies-safety-of-single-fluorinated-pesticide-approvals,The Environmental Protection Agency confirms that new single-fluorinated pesticides are not PFAS and remain fully compliant with current safety standards.,,https://rfdtv.brightspotgocdn.com/dims4/default/a6806d8/2147483647/strip/true/crop/1280x719+0+1/resize/730x410!/quality/90/?url=https%3A%2F%2Fbrightspot-go-k1-rfdtv.s3.us-east-1.amazonaws.com%2Fbrightspot%2F30%2F0c%2Fd7a7ec4240d3b3f24c2a9ea02ebf%2Fchemical-pesticides-ag-revolution-22148933-g.jpeg,,,2025-12-03 12:02:54.157702
,Costs & Impacts,2025-12-03 16:01:39+00:00,WAKA 8,"EPA rejects permit application for Covington County CO2 storage hub, sources say - WAKA 8",,,,,,https://www.waka.com/2025/12/03/epa-rejects-permit-application-for-covington-county-co2-storage-hub-sources-say/,"In an August notice, the EPA informed Reliant CCS that their Class VI permit application was missing information, including the number or name, and location of all wells, roads, and territory boundaries. ",,https://www.waka.com/content/uploads/2025/12/w/o/epa.png,,,2025-12-03 13:03:37.732748
