id,name,published,outlet,title,authors,category,market,categoryorder,articleorder,url,description,text,image,error,sentiment,firstEyes
,,2025-12-31 23:27:46+00:00,www.newsfromthestates.com,Court rules on Big Sky Quarry subdivision project | News From The States,,,,,,https://www.newsfromthestates.com/article/court-rules-big-sky-quarry-subdivision-project,"The project was approved in 2022, the same year the Environmental Protection Agency declared the Gallatin River to be “impaired,” due to an ...",,,,,2025-12-31 18:58:52.816163
,Opposition & Allies,2025-12-31 23:05:25+00:00,www.hoosieragtoday.com,Final Days to Submit Comments on EPA Waters Proposal | Hoosier Ag Today,,,,,,https://www.hoosieragtoday.com/2025/12/31/final-days-to-submit-comments-on-epa-waters-proposal/%3Famp%3D1,The Environmental Protection Agency has proposed a new Waters of the U.S. rule aimed at giving farmers and ranchers clearer guidance on what ...,,,,,2025-12-31 20:58:43.187769
,Costs & Impacts,2025-12-31 22:56:09+00:00,www.facebook.com,"The Trump EPA is announcing that, following gold standard science, promoting radical ... - Facebook",,,,,,https://www.facebook.com/EPA/posts/-the-trump-epa-is-announcing-that-following-gold-standard-science-promoting-radi/1317153247119145/,EPA has been working on phthalates for decades. Nothing new here. The 1990s was a period of scientific assessment and monitoring for phthalates within ...,,,,,2025-12-31 20:58:43.187769
,Costs & Impacts,2025-12-31 22:50:09+00:00,news.bloomberglaw.com,Five Plastic Chemicals’ Risks Prompt EPA to Start Crafting Rules,,,,,,https://news.bloomberglaw.com/health-law-and-business/five-plastic-chemicals-risks-prompt-epa-to-start-crafting-rules,The EPA announced Wednesday it will regulate dozens of ways five chemicals are used to protect workers and the environment.,,https://db0ip7zd23b50.cloudfront.net/dims4/default/e95dda9/2147483647/legacy_thumbnail/960x370%3E/quality/90/?url=http%3A%2F%2Fbloomberg-bna-brightspot.s3.amazonaws.com%2Fde%2F68%2F807942274334a25c004de501ad3b%2Fbli-phthalates-collage-final.png,,,2025-12-31 17:59:03.537707
,,2025-12-31 22:40:37+00:00,CaltechAUTHORS,Studies of concentrated electrolyte solutions using the electrodynamic balance. 3. Solute nucleation,,,,,,https://authors.library.caltech.edu/records/ws04a-ry783,"The nucleation of crystals from aqueous solution has been investigated for several common inorganic salts alone and in mixtures. Single, charged solution droplets approximately 20 µm in diameter were suspended in an electrodynamic balance and continuously weighed. The solute concentration in the droplet was changed by adjusting the relative humidity of the air surrounding the particle. Nucleation theory was used to estimate the surface excess free energy and critical nucleus size from the measured supersaturation at which nucleation occurred.",,,,,2025-12-31 20:58:43.187769
,,2025-12-31 22:38:51+00:00,Department of Environmental Conservation,"DEC Reminds New Yorkers of Expanded Waste Reduction Laws Taking Effect January 1, 2026",,,,,,https://dec.ny.gov/news/press-releases/2025/12/dec-reminds-new-yorkers-of-expanded-waste-reduction-laws-taking-effect-january-1-2026,"The New York State Department of Environmental Conservation (DEC) is reminding businesses, organizations, and consumers of upcoming waste ...",,,,,2025-12-31 17:59:03.537707
,Clean Air & Water,2025-12-31 22:30:47+00:00,US EPA,Draft Risk Evaluation for Dicyclohexyl Phthalate (DCHP) | US EPA,,,,,,https://www.epa.gov/assessing-and-managing-chemicals-under-tsca/draft-risk-evaluation-dicyclohexyl-phthalate-dchp,EPA designated dicyclohexyl phthalate as a high priority chemical in December 2019 and the chemical is currently undergoing risk evaluation.,,https://www.epa.gov/sites/all/themes/epa/img/epa-standard-og.jpg,,,2025-12-31 20:58:43.187769
,Costs & Impacts,2025-12-31 22:27:38+00:00,US EPA,EPA Announces Intent to Regulate Dozens of Uses of Five Phthalate Chemicals to Protect Workers and Environment | US EPA,,,,,,https://www.epa.gov/newsreleases/epa-announces-intent-regulate-dozens-uses-five-phthalate-chemicals-protect-workers-and,EPA announced today that it will move to regulate dozens of applications of five widely used phthalate chemicals to address environmental and workplace risks.,,https://www.epa.gov/sites/all/themes/epa/img/epa-news-releases-og.jpg,,,2025-12-31 17:59:03.537707
,Opposition & Allies,2025-12-31 22:25:29+00:00,Inside Climate News,"As Trump Rolls Back Protections For Wetlands, New Jersey Maintains a Higher Standard - Inside Climate News",,,,,,https://insideclimatenews.org/news/31122025/new-jersey-wetlands-standards/,The Trump administration is moving to narrow which wetlands qualify for federal protection. But New Jersey’s stricter legal framework shows how states can fight back.,,https://insideclimatenews.org/wp-content/uploads/2025/12/GettyImages-1230528415-1024x683.jpg,,,2025-12-31 17:59:03.537707
,Costs & Impacts,2025-12-31 22:16:38+00:00,US EPA,EPA Seeks Public Comment on Proposed Guidance for Pesticide Registrants to Improve Efficiencies on Notifications and Minor Amendments Submitted to the Agency | US EPA,,,,,,https://www.epa.gov/pesticides/epa-seeks-public-comment-proposed-guidance-pesticide-registrants-improve-efficiencies,"EPA is releasing for public comment proposed updates to Pesticide Registration Notice (PRN) 98-10, “Notifications, Non-notifications and Minor Formulation Amendments.”",,https://www.epa.gov/sites/all/themes/epa/img/epa-standard-og.jpg,,,2025-12-31 20:58:43.187769
,,2025-12-31 22:14:13+00:00,www.tn.gov,Transporters,,,,,,https://www.tn.gov/environment/program-areas/solid-waste/hw/waas/transporters.html,The U.S. Environmental Protection Agency (EPA) maintains a Manifest Registry of specific sources authorized to print and distribute the Uniform ...,,,,,2025-12-31 20:58:43.187769
,Costs & Impacts,2025-12-31 20:52:32+00:00,www.wyomingpublicmedia.org,EPA delay of methane regs could worsen pollution | Wyoming Public Media,,,,,,https://www.wyomingpublicmedia.org/natural-resources-energy/2025-12-31/epa-delay-of-methane-regs-could-worsen-pollution%3F_amp%3Dtrue,Groups working for environmental justice are concerned a delay in Environmental Protection Agency (EPA) methane emission rules will put thousands ...,,,,,2025-12-31 18:58:52.816163
,,2025-12-31 20:41:07+00:00,www.sierraclub.org,These Pacific Northwest Groups Feed the Region When It Needs It Most,,,,,,https://www.sierraclub.org/sierra/these-pacific-northwest-groups-feed-region-when-it-needs-it-most,How gleaners are reducing food waste and helping families make ends meet,,,,,2025-12-31 20:58:43.187769
,,2025-12-31 20:21:25+00:00,epa.illinois.gov,Thank You,,,,,,https://epa.illinois.gov/topics/environmental-justice/thank-you.html,"Thank you for signing up to receive electronic Environmental Justice notification letters. If you wish to contact the Illinois Office of Environmental Justice with questions or concerns, please call Chris Pressnall at 217/524-1284.",,,,,2025-12-31 17:00:09.574428
,,2025-12-31 20:06:41+00:00,www.mitchellwilliamslaw.com,"Storage Tank Enforcement: U.S. Environmental Protection Agency and Ashland, Virginia Facility Etner into Consent Administrative Order",,,,,,https://www.mitchellwilliamslaw.com/storage-tank-enforcement-us-environmental-protection-agency-and-ashland-virginia-facility-etner-into-consent-administrative-order,"The United States Environmental Protection Agency (“EPA”) and James River Petroleum, Inc. (“JRP”) entered into a September 30th Consent Agreement ...",,https://www.mitchellwilliamslaw.com/images/site/Social_Logo.jpg,,,2025-12-31 18:58:52.816163
,Costs & Impacts,2025-12-31 19:56:40+00:00,www.bloomberg.com,Delhi's Worst Air in Years Fuels Anger in Test for Modi's Party - Bloomberg.com,,,,,,https://www.bloomberg.com/news/articles/2025-12-31/delhi-s-worst-air-in-years-fuels-anger-in-test-for-modi-s-party,"... Environmental Protection Agency. The worsening air quality has been an early test for Modi's Bharatiya Janata Party, with its approach drawing ...",,,,,2025-12-31 15:58:39.432414
,Opposition & Allies,2025-12-31 19:36:50+00:00,wkkg.com,Final Days to Submit Comments on EPA Waters Proposal - 101.5 WKKG,,,,,,https://wkkg.com/hoosier-ag-today/final-days-to-submit-comments-on-epa-waters-proposal/,"""value"":"" The Environmental Protection Agency has proposed a new Waters of the U.S. rule aimed at giving farmers and ranchers clearer guidance on ...",,,,,2025-12-31 15:00:48.181151
,,2025-12-31 19:33:44+00:00,www.govinfo.gov,Environmental Protection Agency § 1039.715 - GovInfo,,,,,,https://www.govinfo.gov/content/pkg/CFR-2025-title40-vol36/pdf/CFR-2025-title40-vol36-sec1039-715.pdf,"Environmental Protection Agency. § 1039.715 credits to the nearest kilogram (kg), using consistent units throughout the following equation ...",,,,,2025-12-31 17:59:03.537707
,,2025-12-31 19:31:37+00:00,NBC10 Philadelphia,Take on these New Year’s resolutions and cut your climate impact at the same time,,,,,,https://www.nbcphiladelphia.com/news/national-international/common-new-years-resolutions-cut-climate-impact/4325330/,"Small habits tied to common New Year’s resolutions like saving money, eating healthier and getting organized can also help cut waste and reduce climate pollution.",,https://media.nbcphiladelphia.com/2025/12/GettyImages-2225935169.jpg?quality=85&strip=all&resize=1200%2C675,,,2025-12-31 17:00:09.574428
,,2025-12-31 19:27:52+00:00,silive,Staten Islanders made nearly 130K calls to 311 in 2025; These were the most common complaints,,,,,,https://www.silive.com/data/2025/12/staten-islanders-made-nearly-130k-calls-to-311-in-2025-these-were-the-most-common-complaints.html,"The NYPD received the most complaints of any agency, data shows.",,https://www.silive.com/resizer/v2/CXQJL5NWCVGMLFMKWAGS3FFAMI.jpg?auth=c11eda333efb01f9b639082b6694484f361c6a62a0655aad3e07e5b8ad671fe5&width=1280&smart=true&quality=90,,,2025-12-31 15:58:39.432414
,Costs & Impacts,2025-12-31 19:26:31+00:00,US EPA,EPA Releases Final Guidance for Antimicrobial Pesticides that Require Endangered Species Act Reviews | US EPA,,,,,,https://www.epa.gov/pesticides/epa-releases-final-guidance-antimicrobial-pesticides-require-endangered-species-act,"EPA is releasing final guidance on how the agency will conduct endangered species assessments for new active ingredients, new use, and registration review actions for antimicrobial pesticides.",,https://www.epa.gov/sites/all/themes/epa/img/epa-standard-og.jpg,,,2025-12-31 17:00:09.574428
,,2025-12-31 19:16:35+00:00,The Herald-Mail,RET: Pioneering an Internet-Driven Circular Economy,,,,,,https://www.heraldmailmedia.com/press-release/story/39334/ret-pioneering-an-internet-driven-circular-economy/,"GREENWOOD VILLAGE, CO, UNITED STATES, December 31, 2025 /EINPresswire.com/ — Republic Energy Technology Group (hereinafter referred to as RET) is an Internet resource recycling company and an innovative enterprise dedicated to promoting the development of the global circular economy. The company was jointly established in 2023 by Republic Services, the second-largest environmental protection company in […]",,https://heraldmailmedia.xpr-gannett.com/wp-content/uploads/sites/95/2025/05/image-14.png,,,2025-12-31 15:58:39.432414
,,2025-12-31 19:12:34+00:00,baystatebanner.com,"In 2025, city and state actions against climate change made progress despite federal rollbacks",,,,,,https://baystatebanner.com/2025/12/31/in-2025-city-and-state-actions-against-climate-change-made-progress-despite-federal-rollbacks/,... environment funding had been cancelled by the Trump administration. This includes the U.S. Environmental Protection Agency's Thriving Communities ...,,,,,2025-12-31 15:00:48.181151
,Costs & Impacts,2025-12-31 19:11:15+00:00,The New Bedford Light,2025 in review: The top environmental issues New Bedford tackled in 2025 - The New Bedford Light,,,,,,https://newbedfordlight.org/2025-in-review-new-bedford-talks-trash-wrangles-rats-and-plans-for-a-better-cleaner-harbor/,Some years are a “dumpster fire.” Some years a waste transfer station proposal goes up in smoke.,,https://newbedfordlight.org/wp-content/uploads/2025/08/1213-1.jpg,,,2025-12-31 17:59:03.537707
,North Carolina,2025-12-31 18:51:22+00:00,Port City Daily,"No. 2 Most Read of 2025: NC Chamber asks Sen. Tillis to help prevent 1,4-dioxane regulation | Port City Daily",,,,,,https://portcitydaily.com/local-news/2025/12/31/no-2-most-read-of-2025-nc-chamber-asks-sen-tillis-to-help-prevent-14-dioxane-regulation/,"SOUTHEASTERN N.C. — As the region continues to reel from PFAS reaching its water supply, another chemical threatens the Cape Fear River. Port City Daily’s coverage in February about an upstream…",,https://images.portcitydaily.com/wp-content/uploads/2025/12/image-4.jpeg,,,2025-12-31 18:58:52.816163
,Costs & Impacts,2025-12-31 18:33:31+00:00,Michigan Public,"EPA delays tougher coal wastewater standards in Michigan, nation",,,,,,https://www.michiganpublic.org/environment-climate-change/2025-12-31/epa-delays-tougher-coal-wastewater-standards-in-michigan-nation,"Environmental and clean water advocates are raising concerns after the Environmental Protection Agency announced late on Christmas Eve it would delay tougher wastewater treatment standards for coal-fired power plants, including the J.H. Campbell plant in western Michigan.",,https://npr.brightspotcdn.com/dims4/default/9b7836f/2147483647/strip/true/crop/558x293+0+62/resize/1200x630!/quality/90/?url=http%3A%2F%2Fnpr-brightspot.s3.amazonaws.com%2Ffe%2F66%2Fe1c887c8413ea1670a6b5a7ff371%2Fcampbell-plant.jpg,,,2025-12-31 13:58:57.979182
,Costs & Impacts,2025-12-31 18:31:57+00:00,Governor of California,"Following LA fires, Governor Newsom extends key provision to fast‑track wildfire safety window, protecting more communities across the state | Governor of California",,,,,,https://www.gov.ca.gov/2025/12/31/following-la-fires-governor-newsom-extends-key-provision-to-fast-track-wildfire-safety-window-protecting-more-communities-across-the-state/,California state agencies are diligently reviewing wildfire projects to ensure the state maintains its nation-leading environmental standards without ...,,https://www.gov.ca.gov/wp-content/uploads/2025/12/Following-LA-fires-Governor-Newsom-extends-key-provision-to-fast‑track-wildfire-safety-window-protecting-more-communities-across-the-state-SEO-GFX-v3.png,,,2025-12-31 13:58:57.979182
,,2025-12-31 18:28:17+00:00,spectrumlocalnews.com,"2025 in pictures: Sewage sludge, prison strikes, immigration raids and more",,,,,,https://spectrumlocalnews.com/nys/central-ny/news/2025/12/31/a-year-in-pictures,A collection of images from major news events in New York state.,,https://s7d2.scene7.com/is/image/TWCNews/UNY-Spec-EmilyKenny-2025photos-20250307-005,,,2025-12-31 17:59:03.537707
,,2025-12-31 18:06:25+00:00,epa.illinois.gov,Meetings,,,,,,https://epa.illinois.gov/topics/bureau-of-safety-and-sustainability/environmental-justice/advisory-group/meetings.html,April 5 Invite Agenda Minutes,,,,,2025-12-31 13:58:57.979182
,,2025-12-31 17:59:23+00:00,epa.illinois.gov,Fact Sheet 4 October 1998 - Illinois Environmental Protection Agency,,,,,,https://epa.illinois.gov/topics/bureau-of-safety-and-sustainability/community-relations/sites/indian-refining/fact-sheet-4.html,Yes. The Illinois Environmental Protection Agency (Illinois EPA) sent a field office asbestos inspector to the site in July to confirm that all of the ...,,,,,2025-12-31 17:00:09.574428
,,2025-12-31 17:21:51+00:00,attheu.utah.edu,U startup tackles e-waste with degradable materials - @theU,,,,,,https://attheu.utah.edu/president/innovate-initiatives/u-startup-tackles-e-waste-with-degradable-materials/,EnduraCure develops high-performance polymer substrates that can be chemically broken down to recover valuable electronic components.,,https://d26toa8f6ahusa.cloudfront.net/wp-content/uploads/2025/12/17114034/e-waste_feature.jpg,,,2025-12-31 13:01:14.353047
,,2025-12-31 17:14:48+00:00,public-inspection.federalregister.gov,6560-50-P ENVIRONMENTAL PROTECTION AGENCY [FRL OPRM-FAD-203 ...,,,,,,https://public-inspection.federalregister.gov/2025-24190.pdf,Notice: Section 309(a) of the Clean Air Act requires that EPA make public its comments on EISs issued by other Federal agencies.,,,,,2025-12-31 15:58:39.432414
,,2025-12-31 17:14:44+00:00,public-inspection.federalregister.gov,6560-50-P ENVIRONMENTAL PROTECTION AGENCY 40 CFR Part 63 [EPA-HQ-OAR-2023-0330,,,,,,https://public-inspection.federalregister.gov/2025-24202.pdf,ACTION: Final rule. SUMMARY: The U.S. Environmental Protection Agency (EPA or Agency) is amending the Code of Federal Regulations (CFR) to remove the ...,,,,,2025-12-31 15:00:48.181151
,Costs & Impacts,2025-12-31 17:04:20+00:00,Duluth News Tribune,2025 Year in Review: National issues come home to the Northland,,,,,,https://www.duluthnewstribune.com/news/local/2025-year-in-review-national-issues-come-home-to-the-northland,"The past year saw dozens of national headlines hit close to home, from canceled grants to federal funding cuts, protests against local, state, and congressional lawmakers to ICE raids.",,https://cdn.forumcomm.com/dims4/default/b318c4e/2147483647/strip/true/crop/4883x3255+0+0/resize/1599x1066!/quality/90/?url=https%3A%2F%2Fforum-communications-production-web.s3.us-west-2.amazonaws.com%2Fbrightspot%2Fb6%2F9d%2F094306094cff96cfa1fe62760185%2F050125-n-dnt-stauber-c18.jpg,,,2025-12-31 13:01:14.353047
,North Carolina,2025-12-31 16:54:41+00:00,ncnewsline.com,NC joins fight against Trump proposal to relax EPA reporting rules for forever chemicals,,,,,,https://ncnewsline.com/briefs/nc-joins-fight-against-trump-proposal-to-relax-epa-reporting-rules-for-forever-chemicals/,The U.S. Environmental Protection Agency announced in November a proposal to implement more exceptions for businesses to report the levels of ...,,,,,2025-12-31 12:14:24.236535
,,2025-12-31 16:48:24+00:00,epa.illinois.gov,Hegeler Zinc - Illinois Environmental Protection Agency,,,,,,https://epa.illinois.gov/topics/bureau-of-safety-and-sustainability/community-relations/sites/hegeler-zinc.html,"The Illinois EPA collected on-site soil, waste (slag), sediment and groundwater samples. Off-site sampling included residential soil and sediment ...",,,,,2025-12-31 15:00:48.181151
,,2025-12-31 16:31:10+00:00,The American Prospect,2025 in Review: James Baratta - The American Prospect,,,,,,https://prospect.org/2025/12/31/2025-in-review-james-baratta/,Our writing fellow offers his favorite stories of the year.,,https://i0.wp.com/prospect.org/wp-content/uploads/2025/12/Baratta-Best-of-2025.jpg?fit=2000%2C1500&ssl=1,,,2025-12-31 13:58:57.979182
,Clean Air & Water,2025-12-31 16:27:42+00:00,US EPA,"EPA Announces Intent to Regulate Nearly One Dozen 1,3-Butadiene Uses to Protect American Workers | US EPA",,,,,,https://www.epa.gov/newsreleases/epa-announces-intent-regulate-nearly-one-dozen-13-butadiene-uses-protect-american,"In compliance with a court ordered deadline, EPA completed a robust review of 1,3-butadiene using gold standard science.",,https://www.epa.gov/sites/all/themes/epa/img/epa-news-releases-og.jpg,,,2025-12-31 11:58:51.212037
,Clean Air & Water,2025-12-31 16:18:39+00:00,www.instagram.com,"""Think of the Smell | How the Environmental Protection Agency got its start #history ""Shall we ...",,,,,,https://www.instagram.com/reel/DS7yawEGP-c/,"7 likes, 0 comments - lyras_letters on December 31, 2025: ""Think of the Smell | How the Environmental Protection Agency got its start #history ...",,,,,2025-12-31 13:01:14.353047
,Costs & Impacts,2025-12-31 16:06:14+00:00,protectnps.org,"Environmental Groups Urge FAA and NPS to Halt Bay Area Air Tour Agreement, Citing ...",,,,,,https://protectnps.org/2025/12/31/environmental-groups-urge-faa-and-nps-to-halt-bay-area-air-tour-agreement-citing-court-order-violations-and-threats-to-national-parks/,"... agency action is not likely to jeopardize ESA-protected species or habitat. Defenders of Wildlife v.Gutierrez, 532 F.3d 913 (D.C. Cir. 2008) The ...",,,,,2025-12-31 15:00:48.181151
,Opposition & Allies,2025-12-31 15:59:18+00:00,CT News Junkie,CT Officials Join 28 Other States In Opposing EPA Rollback Of Clean Water Standards | CT News Junkie,,,,,,https://ctnewsjunkie.com/2025/12/31/ct-officials-join-28-other-states-in-opposing-epa-rollback-of-clean-water-standards/,Legislators who signed the letter stressed that clean water protections are critical to preserving safe drinking water for millions of Americans.,,https://ctnewsjunkie.com/wp-content/uploads/2025/03/shetucket-river-1-dh-20250327-1200x900-1.jpg,,,2025-12-31 11:58:51.212037
,,2025-12-31 15:55:04+00:00,"SANIBEL-CAPTIVA - Island Reporter, Islander and Current",Guest commentary: Protect the waters of the United States,,,,,,https://www.captivasanibel.com/opinion/2025/12/guest-commentary-protect-the-waters-of-the-united-states/,"The U.S. Environmental Protection Agency (EPA) is proposing to strip the protections from millions of acres of wetlands under the claim of providing “regulatory certainty.” The proposed rule change would narrow the definition of “Waters of the United States,” a term of art that affords Clean Water Act protections to many of our most vulnerable […]",,https://ogden_images.s3.amazonaws.com/florida.ogdennews.com/images/sites/3/2025/12/31104750/GUEST-COMMENTARY-1-1.jpg,,,2025-12-31 15:00:48.181151
,Clean Air & Water,2025-12-31 15:47:37+00:00,www.facebook.com,"EPA's 1,3-butadiene risk evaluation results are in! After studying 30 different uses of ... - Facebook",,,,,,https://www.facebook.com/EPA/posts/-epas-13-butadiene-risk-evaluation-results-are-in-after-studying-30-different-us/1316870260480777/,"EPA's 1,3-butadiene risk evaluation results are in! After studying 30 different uses of this colorless gas that is vital to the manufacturing of ...",,,,,2025-12-31 13:01:14.353047
,Opposition & Allies,2025-12-31 15:40:50+00:00,www.houstonpublicmedia.org,Texas AG Ken Paxton again blocked from enforcing reporting rules against Democratic DAs,,,,,,https://www.houstonpublicmedia.org/articles/news/2025/12/31/539744/texas-ag-ken-paxton-again-blocked-from-enforcing-reporting-rules-against-democratic-das/%3Futm_source%3Drss-criminal-justice-article%26utm_medium%3Dlink%26utm_campaign%3Dhpm-rss-link,"The Corpus Christi Ship Channel. The Environmental Protection Agency rejected a permit this week for · ICE detainee dead, two others injured in ...",,,,,2025-12-31 11:00:12.440281
,Costs & Impacts,2025-12-31 14:38:20+00:00,news.bloomberglaw.com,"Chemical Used for Rubber, Plastics Is Too Risky, EPA Finds (1)",,,,,,https://news.bloomberglaw.com/environment-and-energy/chemical-used-for-rubber-plastics-is-too-risky-epa-concludes,"The EPA has concluded there’s too much potential for 1,3-butadiene to injure workers’ health, so its uses will need to be restricted.",,https://db0ip7zd23b50.cloudfront.net/dims4/default/cda011e/2147483647/legacy_thumbnail/960x370%3E/quality/90/?url=http%3A%2F%2Fbloomberg-bna-brightspot.s3.amazonaws.com%2Fe7%2F7f%2F2d6d1678460a8b931a94a73fa6f4%2Fsept3-tires.jpg,,,2025-12-31 12:14:24.236535
,Costs & Impacts,2025-12-31 14:00:35+00:00,The Business Download,Why Big Oil Is Asking EPA Not to Cut its Polluter Reporting Program,,,,,,https://thebusinessdownload.com/why-big-oil-is-asking-epa-not-to-cut-its-polluter-reporting-program/,"(Bloomberg) — The Environmental Protection Agency says its proposal to stop greenhouse gas reporting for big polluters could save oil and gas companies up to $256 million a year. Some of them are countering that it could hurt their business instead. Companies, industry trade groups and other energy experts warn that axing the more than a decade-old Greenhouse Gas…",,https://thebusinessdownload.com/wp-content/uploads/2025/12/144578jpg-sc-landscape-2880x1620-1-scaled.jpg,,,2025-12-31 10:00:35.175030
,,2025-12-31 13:43:04+00:00,PetaPixel,"A Largely Unknown 1970s Photo Project Captured Over 80,000 Images of American Pollution",,,,,,https://petapixel.com/2025/12/30/a-largely-unknown-1970s-photo-project-captured-over-80000-images-of-american-pollution/,"Photographers captured America's pollution in the 1970s, and people mostly forgot.",,https://petapixel.com/assets/uploads/2025/12/klein-documerica-featured.jpg,,,2025-12-31 10:00:35.175030
,,2025-12-31 13:36:59+00:00,Urbanize Chicago,Phase One environmental cleanup finished for Focal Point Community Campus,,,,,,https://chicago.urbanize.city/post/phase-one-environmental-cleanup-finished-focal-point-community-campus,"Chicago Southwest Development Corporation (CSDC) has completed Phase One of the environmental cleanup for the future home of Saint Anthony Hospital on the Focal Point Community Campus, at the corner of 31st St. and Kedzie Ave. on Chicago’s Southwest Side.",,https://chicago.urbanize.city/sites/default/files/styles/social_1200x630/public/background/2022-01/Lead%20Image%20-%20Focal%20Point%20Community%20Campus%20-%202%20-%20HDR.jpg?itok=B-6me2N_,,,2025-12-31 12:14:24.236535
