id,name,published,outlet,title,authors,category,market,categoryorder,articleorder,url,description,text,image,error,sentiment,firstEyes
,Costs & Impacts,2025-12-31 13:06:43+00:00,Yahoo News,Trump Trolled for Bird-Brained Error in Anti-Windmill Post,,,,,,https://www.yahoo.com/news/articles/trump-trolled-bird-brained-error-065951087.html,"President Donald Trump was apparently too blinded by his hatred of windmills to recognize the glaring error in his social media post about bald eagles. On Tuesday, Trump, 79, wrote on Truth Social that windmills “are killing all of our beautiful bald eagles!” The photograph he attached to his post showed a dead bird with a windmill in the background. But the bird was a falcon, the windmill was in Israel, and the raptor’s unfortunate demise occurred at least eight years ago. California Gov. Gavin",,https://s.yimg.com/ny/api/res/1.2/SGW_2ePTqTRAc1pYTwMIug--/YXBwaWQ9aGlnaGxhbmRlcjt3PTEyMDA7aD02NzU7Y2Y9d2VicA--/https://media.zenfs.com/en/thedailybeast.com/cce4c57d1cd3bec51b6154036d15cd85,,,2025-12-31 13:58:57.979182
,,2025-12-31 13:04:07+00:00,The Indiana Lawyer,Melissa Hamer: A year loaded with environmental regulatory changes - The Indiana Lawyer,,,,,,https://www.theindianalawyer.com/articles/melissa-hamer-a-year-loaded-with-environmental-regulatory-changes,"Between Supreme Court rewrites of familiar statutes, extended methane deadlines, and Indiana’s new stormwater and water-pipeline rules, our regulated community spent 2025 chasing certainty.",,https://www.theindianalawyer.com/wp-content/uploads/2025/12/in-practice-hamer-melissa.png,,,2025-12-31 11:00:12.440281
,Costs & Impacts,2025-12-31 12:59:06+00:00,www.youtube.com,Iran Reveals 3 Powerful Nuclear Advances Just After Trump-Netanyahu Threatened War,,,,,,https://www.youtube.com/watch%3Fv%3DcDJwzlLjgII,"... agency spokesperson, the accelerator will have diverse applications in environmental protection, medicine, nuclear technology and scientific ...",,,,,2025-12-31 12:14:24.236535
,,2025-12-31 12:24:10+00:00,www.mondaq.com,"EPA's ""Compliance First"" Directive Creates Pathway For Preemption Of Citizen Suits",,,,,,https://www.mondaq.com/unitedstates/clean-air-pollution/1725770/epas-compliance-first-directive-creates-pathway-for-preemption-of-citizen-suits,"On December 5, 2025, the U.S. Environmental Protection Agency's (EPA) Office of Enforcement and Compliance Assurance (OECA) published an internal memorandum formally adopting a new ""compliance first"" enforcement approach for all OECA staff.",,http://www.mondaq.com/images/profile/companythumb/21358.webp?v=20241101122045,,,2025-12-31 11:58:51.212037
,,2025-12-31 12:17:40+00:00,www.kentucky.com,'Least bad' option: KY regulators allow power company to reinvest in W.Va. coal plant,,,,,,https://www.kentucky.com/news/state/kentucky/article314065788.html,Tougher U.S. Environmental Protection Agency standards on polluted wastewater means the plant's spent coal ash ponds need major renovations. In ...,,,,,2025-12-31 11:00:12.440281
,,2025-12-31 11:37:42+00:00,morningjournalnews.com,More derailment-related water sampling announced,,,,,,https://www.morningjournalnews.com/news/local-news/2025/12/more-derailment-related-water-sampling-announced/,"LISBON — The Columbiana County Health District on Tuesday announced the second application period for the new Expanded Potable Water Sampling Program outside of the East Palestine priority zones will begin Thursday. To be considered for this round of sampling, applications must be submitted to the county health district by Jan. 31. An application can […]",,http://d14e0irai0gcaa.cloudfront.net/www.morningjournalnews.com/images/2017/01/27143353/MoJoICON.jpg,,,2025-12-31 12:14:24.236535
,Costs & Impacts,2025-12-31 11:35:43+00:00,www.mondaq.com,EPA Announces Accelerated Crackdown On Toxic And Poisonous Imports ,,,,,,https://www.mondaq.com/unitedstates/chemicals/1725712/epa-announces-accelerated-crackdown-on-toxic-and-poisonous-imports,"The U.S. Environmental Protection Agency (EPA) announced on December 23, 2025, that under the Trump Administration...",,http://www.mondaq.com/images/MondaqThumb.png,,,2025-12-31 12:14:24.236535
,Costs & Impacts,2025-12-31 11:15:56+00:00,www.ctinsider.com,Letter: Is the EPA protecting us? - CT Insider,,,,,,https://www.ctinsider.com/waterbury/opinion/article/epa-pfas-pesticide-regulations-21268397.php,It is hard to believe but the U.S. Environmental Protection Agency (EPA) is considering approval of several new pesticides containing forever ...,,,,,2025-12-31 10:00:35.175030
,,2025-12-31 10:55:49+00:00,Department of Environmental Conservation,DEC Announces Completion of Spruce Grouse Releases,,,,,,https://dec.ny.gov/news/press-releases/2025/12/dec-announces-completion-of-spruce-grouse-releases,"The New York State Department of Environmental Conservation (DEC) announced the culmination of a multiyear, international effort to restore and stabilize the endangered Spruce Grouse population. The milestone is marked following the conclusion of Spruce Grouse translocations into the Adirondacks in 2025.",,,,,2025-12-31 12:14:24.236535
,,2025-12-31 10:46:27+00:00,Newsday,How the EPA says cleanups are working at 5 Long Island Superfund sites,,,,,,https://www.newsday.com/long-island/environment/epa-superfund-site-kun6abf4,"Some toxic areas need continued monitoring, the agency said.",,https://cdn.newsday.com/ace/c:NWZkNWM3NWItNDAxYi00:NjY2MjUzNmItNGZlYi00/landscape/1280,,,2025-12-31 05:59:21.093755
,,2025-12-31 10:30:56+00:00,www.facebook.com,"Proud moment for EPA! Congratulations to our Director General, Dr. Lelise Neme , on ... - Facebook",,,,,,https://www.facebook.com/epaethio/posts/proud-moment-for-epa-congratulations-to-our-director-general-dr-lelise-neme-on-a/1175231274760442/,"Proud moment for EPA! Congratulations to our Director General, Dr. Lelise Neme , on achieving a PhD a well deserved milestone reflecting ...",,,,,2025-12-31 11:58:51.212037
,Costs & Impacts,2025-12-31 10:21:26+00:00,https://www.ktiv.com,Supervisors put off road project to fund $3.1 million equipment budget,,,,,,https://www.ktiv.com/2025/12/31/supervisors-put-off-road-project-fund-31-million-equipment-budget/,"Discussion, Tuesday night, addressed the concern that waiting*to buy the equipment, because of new Environmental Protection Agency rules, could increase the cost.",,https://gray-ktiv-prod.gtv-cdn.com/resizer/v2/PQNRZLZJNRFKXHMQG2U7W7HCNE.png?auth=e4f6112c12a75a8469c19a26de635f7406daa0688086ff13d54799cfe8320635&width=1200&height=600&smart=true,,,2025-12-31 10:00:35.175030
,North Carolina,2025-12-31 10:10:44+00:00,Wilmington Star-News,NC air is getting better even as environmental oversight shrinks,,,,,,https://www.starnewsonline.com/story/news/local/2025/12/31/nc-air-quality-is-improving-despite-shrinking-environmental-oversight/87812215007/,Air in the Tar Heel State is cleaner than it has been in decades. But oversight of the environment is shrinking.,,"https://www.starnewsonline.com/gcdn/presto/2021/10/05/NSTN/04484f4a-6f0a-44fb-b42f-570e2ce079ed-Bridges63.JPG?crop=1791,1008,x0,y88&width=1791&height=1008&format=pjpg&auto=webp",,,2025-12-31 10:00:35.175030
,,2025-12-31 10:07:37+00:00,www.food-safety.com,USDA Reports 99 Percent of Foods Tested in 2024 Complied with Pesticide Residue Tolerances,,,,,,https://www.food-safety.com/articles/11012-usda-reports-99-percent-of-foods-tested-in-2024-complied-with-pesticide-residue-tolerances,"As in years past, USDA’s Pesticide Data Program reports that more than 99 percent of foods sampled in 2024 were compliant with EPA pesticide residue limits. Some persistent organic pollutants, like DDT, continue to show up in crops.",,https://www.food-safety.com/ext/resources/News/2025/many-different-fruit-and-veg.png?height=635&t=1767122477&width=1200,,,2025-12-31 05:59:21.093755
,,2025-12-31 09:50:45+00:00,www.dvidshub.net,"USACE continues wildfire debris removal efforts in Altadena, Pacific Palisades - DVIDS",,,,,,https://www.dvidshub.net/news/printable/555415,The U.S. Environmental Protection Agency's removal of household hazardous materials during Phase 1 paved the way for USACE's debris removal process.,,,,,2025-12-31 10:00:35.175030
,,2025-12-31 09:12:28+00:00,Federal Register,"Regulation of Fuels, Fuel Additives, and Regulated Blendstocks",,,,,,https://www.federalregister.gov/documents/2025/12/31/2025-24084/regulation-of-fuels-fuel-additives-and-regulated-blendstocks,"Search, browse and learn about the Federal Register. Federal Register 2.0 is the unofficial daily publication for rules, proposed rules, and notices of Federal agencies and organizations, as well as executive orders and other presidential documents.",,https://www.federalregister.gov/assets/open_graph_site_banner.png,,,2025-12-31 07:59:18.740083
,Opposition & Allies,2025-12-31 08:26:19+00:00,epa.illinois.gov,Advisory Group,,,,,,https://epa.illinois.gov/topics/bureau-of-safety-and-sustainability/environmental-justice/advisory-group.html,We will be as open as possible but honor the right of privacy. What is discussed in our group will remain confidential. We will respect differences. We won’t discount others’ ideas. We will be supportive rather than judgmental. We will give feedback ,,,,,2025-12-31 11:58:51.212037
,Costs & Impacts,2025-12-31 07:56:35+00:00,Bluedot Living,Dear Dot: Do EVs Cause More Environmental Damage In Manufacturing?,,,,,,https://bluedotliving.com/dear-dot-do-evs-cause-more-environmental-damage-in-manufacturing/,"Learn about the benefits of electric vehicles (EVs) from a firsthand experience. Find out how EVs perform on long trips, charging options, and environmental impact.",,https://bluedotliving.com/wp-content/uploads/2023/05/Dear_Dot_Final.jpg.webp,,,2025-12-31 04:58:12.297685
,,2025-12-31 07:27:14+00:00,AgriNews,A step in the right direction on WOTUS,,,,,,https://www.agrinews-pubs.com/opinion/columnists/2025/12/31/a-step-in-the-right-direction-on-wotus/,Clean water is essential for every farmer and rancher; we depend on it every day. That’s why we’re encouraged to see the new proposed rule from the Environmental Protection Agency and Army Corps of Engineers.,,https://www.agrinews-pubs.com/resizer/7Hw8v1AKO1X9cSRkXukbSHXHZRM=/1200x630/filters:format(jpg):quality(70)/cloudfront-us-east-1.images.arcpublishing.com/shawmedia/OGI6ARPEYZBTJDX2WWBCYELCMI.jpg,,,2025-12-31 10:00:35.175030
,,2025-12-31 07:00:44+00:00,The Reminder,Chicopee awarded grant to design sewer separation project - The Reminder,,,,,,https://thereminder.com/local-news/chicopee-awarded-grant-to-design-sewer-separation-project/,"CHICOPEE — Chicopee received $250,000 in overflow and stormwater reuse municipal grants to continue the design of sewer separation in the downtown area.",,https://cdn.thereminder.com/wp-content/uploads/2024/04/1624px-ChicopeeRiver.jpg,,,2025-12-31 11:00:12.440281
,Clean Air & Water,2025-12-31 06:41:25+00:00,The Vallejo Sun,Sensor cars are mapping Vallejo’s air quality block-by-block,,,,,,https://www.vallejosun.com/sensor-cars-are-mapping-vallejos-air-quality-block-by-block/,The tech company Aclima is working with the state on the $27 million initiative.,,https://www.vallejosun.com/content/images/size/w1200/2025/12/exampleofanAclimacar.jpg,,,2025-12-31 11:00:12.440281
,,2025-12-31 06:38:41+00:00,ChemRxiv,Toxicity Screening of Five Tire-Related Chemicals using New Approach Methodologies (NAMs),,,,,,https://chemrxiv.org/engage/chemrxiv/article-details/69455f62e3cb457e13a46297,"There is increasing concern around the potential environmental and public health impacts of tire wear transformation products even as significant data gaps exist on the environmental fate and potential ecological and human health impacts. Here, we provide a preliminary review and synthesis of existing information concerning five specific tire wear transformation products, including 6PPDQ, 4 ADPA, two newly identified constituents in snow and wastewater, TP 249 and TP 259_2, as well as the parent compound, 6PPD. We conduct a systematic review, relying on data sources and analytical models ranging from in silico to in vitro to in vivo, including read-across and quantitative structure activity relationships (QSAR), and data gap filling techniques based on data from chemically similar analogues. We summarize the available data and modeling results for these constituents to identify commonalities and differences across them and to evaluate whether these methods provide insights into potential behavior in the environment and toxicity mechanisms. Assay results are available from the US Environmental Protection Agency Computational Toxicology dashboard for 6PPD and 4 ADPA and show that the majority of activated assays relate to cell viability and cycling, cytotoxicity, and cell proliferation and energetics, consistent with targeted in vivo and in vitro studies from the literature. Generalized read-across and other QSAR-based models for 6PPDQ, TP 249, and TP 259_2 show very few or no statistically-significant predictions, but do suggest a set of assays in common across all constituents with consistent cellular and organ targets, including nuclear receptor activation and cell energetics across genes largely expressed in the kidney and liver, supporting limited in vivo and in vitro data from the literature. No clear conclusions can be drawn around observed differences in acute mortality and sensitivity across fish species following exposure to 6PPDQ, but likely cellular and subcellular targets suggest activation of genes related to DNA repair, cell proliferation, and oxidative stress. Overall, existing data are insufficient to make conclusive evaluations of the potential impact of these tire wear particles to human health or the environment. Additional, targeted studies such as specific in vitro tests together with limited in vivo testing, and emerging transcriptomic methods as proposed by the US Environmental Protection Agency (EPA) could help fill these data gaps.",,https://chemrxiv.org/engage/api-gateway/chemrxiv/assets/orp/resource/item/69455f62e3cb457e13a46297/largeThumb/toxicity-screening-of-five-tire-related-chemicals-using-new-approach-methodologies-na-ms.jpg,,,2025-12-31 07:59:18.740083
,,2025-12-31 06:17:31+00:00,news.wttw.com,Organizers Push for Ballot Referendum on South Chicago Quantum Computing Campus,,,,,,https://news.wttw.com/2025/12/30/organizers-push-ballot-referendum-south-chicago-quantum-computing-campus,... Environmental Protection Agency to move forward with construction. Amid concerns about the project's environmental impact on surrounding ...,,,,,2025-12-31 04:58:12.297685
,,2025-12-31 05:52:28+00:00,Nature,Tracking electricity use and scope2 CO2 emissions in 111 cities of Madagascar - Scientific Reports,,,,,,https://www.nature.com/articles/s41598-025-33490-w,"Several sources related that the electricity sector emits almost a quarter of greenhouse gases each year in the world. It is therefore one of the important sectors to take into account to limit global warming. Indian Ocean cities produce significant CO2 emissions during electricity consumption. Their volume and accuracy remain practically unknown and untested. Indeed, until now, there is no methodology suggested by the researchers to evaluate Fossil Fuel carbon dioxide (FFCO2) emission, and electricity consumption in this region. Aware of these crucial problems, this study was carried out to assess and analyse CO2 emissions coming from Electricity consumption (called Scope2) in 111 cities located in the Indian Ocean from 55 Power plants between 2015 and 2022 (08 years) and in four sectors (Residential, Commercial, Industrial, and On-road). To carry out a good comparison, all the data were grouped into three categories, before the lockdown measures due to COVID-19 (2015–2018); During the COVID-19-induced lockdown period (2019–2020); and after the lockdown period (2021–2022). The results showed that the CO2 emission difference is significant in the residential and commercial sectors. It was observed that CO2 emissions increased in 2019–2022 in the residential, industrial, and on-road sectors whereas, simultaneously during the same period, it decreased in the commercial sector. During the three periods, the CO2 emissions rate was the highest in the residential sector (around 52%), and the least on-road (around 1%). The significant difference in the commercial sector suggests a decrease in electricity consumption during the peak of the pandemic due to reduced business activities. Businesses adapted to new operating conditions, such as reduced hours or enhanced energy efficiency measures, which also contributed to the change in consumption patterns.",,,,,2025-12-31 10:00:35.175030
,,2025-12-31 04:51:21+00:00,Association of California Water Agencies,ACWA Selects Firm for ED Recruitment - Association of California Water Agencies,,,,,,https://www.acwa.com/news/acwa-selects-firm-for-ed-recruitment/,SACRAMENTO — The ACWA Board of Directors has selected Bob Murray & Associates to lead the new recruitment process for […],,https://www.acwa.com/wp-content/uploads/2025/10/IMG_1729.jpg,,,2025-12-31 11:00:12.440281
,,2025-12-31 04:03:32+00:00,ilga.gov,410 ILCS 46/5 - Illinois General Assembly,,,,,,https://ilga.gov/documents/legislation/ilcs/documents/041000460K5.htm,"prepared by the U.S. Environmental Protection Agency and submitted to the U.S. Congress in 1997, mercury fever thermometers contribute ...",,,,,2025-12-31 04:58:12.297685
,Costs & Impacts,2025-12-31 03:02:59+00:00,www.clarkcountynv.gov,"Seasonal Air Quality Advisory Issued for Ozone, Wildfire Smoke",,,,,,https://www.clarkcountynv.gov/news/environment_and_sustainability/2025/20251230advsmokefireworks,"The Clark County Department of Environment and Sustainability (DES) has issued an advisory for Wednesday, Dec. 31 and Thursday, Jan. 1 for smoke and high ...",,,,,2025-12-31 00:57:43.700464
,,2025-12-31 02:47:32+00:00,www.harmonywithnatureun.org,Sierra Leone - Harmony With Nature - Environmental Provision,,,,,,http://www.harmonywithnatureun.org/provision/3v6Rqw4Ux5ee0cYJGE5ATKTyKMsNvbh80OgsKXnqT8QygLY1llV!gjrrQj3IwEcqsGUPfEsA7niiEN6919UNXQ%3D%3D,The Environment Protection Act of 2000 provides the framework for effective environmental protection and its administration. The Act establishes the ...,,,,,2025-12-31 04:58:12.297685
,,2025-12-31 02:32:26+00:00,Los Angeles Times,2025 was a rough year. End it on a good note with these entertainment specials,,,,,,https://www.latimes.com/california/newsletter/2025-12-30/best-of-comedy-tv-documentaries,"Your morning catch-up: The best entertainment to help close out the year, SoCal's wild weather and more big stories.",,https://ca-times.brightspotcdn.com/dims4/default/0561c32/2147483647/strip/true/crop/3000x1575+0+213/resize/1200x630!/quality/75/?url=https%3A%2F%2Fcalifornia-times-brightspot.s3.amazonaws.com%2F32%2Fe3%2Ff176e05c4066a01f4412286c9d0e%2Fbill-burr-hulu-173556-1354-v1.jpg,,,2025-12-31 04:58:12.297685
,,2025-12-31 02:20:58+00:00,Pioneer Tribune -,Coalition urges federal court to maintain Great Lakes invasive protections - Pioneer Tribune,,,,,,https://www.pioneertribune.com/articles/coalition-urges-federal-court-to-maintain-great-lakes-invasive-protections/,"LANSING – Michigan Attorney General Dana Nessel led a coalition of attorneys general in filing an amicus brief with the U.S. Court of Appeals for the D.C. Circuit challenging the U.S. Environmental Protection Agency’s (EPA) Final Standards on ballast water discharges from large vessels, including ships operating on the Great Lakes. The coalition argues that the standards unlawfully weaken long-standing <a href=""https://www.pioneertribune.com/articles/coalition-urges-federal-court-to-maintain-great-lakes-invasive-protections/"">[…]</a>",,https://www.pioneertribune.com/wp-content/uploads/2019/01/Logo.jpg,,,2025-12-31 04:58:12.297685
,North Carolina,2025-12-31 01:54:45+00:00,www.thecharlottepost.com,"EPA, states could consider regulating abortion pills ",,,,,,https://www.thecharlottepost.com/news/2025/12/30/health/epa-states-could-consider-regulating-abortion-pills/,"Administrators, lawmakers would classify them as pollutants to deny access ",,https://www.thecharlottepost.com/clientuploads/v52n17photos/reproductive-health-supplies-coalition-Unsplash.jpg,,,2025-12-30 21:58:13.927853
,,2025-12-31 01:47:11+00:00,www.bdlaw.com,"Parker Moore, Peter Selimos, to Speak, Moderate Panel on WOTUS for DC Bar's ...",,,,,,https://www.bdlaw.com/events/parker-moore-peter-selimos-to-speak-moderate-panel-on-wotus-for-dc-bars-environment-energy-and-natural-resources-community/,"... Environmental Protection Agency. The agencies propose a new definition of Waters of the United States (WOTUS), which dictates the extent to which ...",,,,,2025-12-30 23:58:57.074819
,,2025-12-31 01:22:38+00:00,The Detroit News,"In a tumultuous year, U.S. health policy has been dramatically reshaped under RFK Jr.",,,,,,https://www.detroitnews.com/story/news/nation/2025/12/30/tumultuous-year-us-health-policy-dramatically-reshaped-under-rfk-jr/87957069007/,Experts warn of potential damage to scientific leadership.,,"https://www.detroitnews.com/gcdn/authoring/authoring-images/2025/11/21/PDTN/87392838007-ap-25316691810361.jpg?crop=7418,4173,x0,y386&width=3200&height=1801&format=pjpg&auto=webp",,,2025-12-31 05:59:21.093755
,Opposition & Allies,2025-12-30 22:55:12+00:00,Blue Book,AFF: USDA pesticide report is more good news for consumers,,,,,,https://www.bluebookservices.com/aff-usda-pesticide-report-is-more-good-news-for-consumers/,"In 2024, more than 99 percent of the commodities sampled by USDA had residues well below the established EPA safety standards.",,https://www.bluebookservices.com/wp-content/uploads/2025/12/usda-pesticide-data-program-2025.png,,,2025-12-30 20:59:05.922974
,Clean Air & Water,2025-12-30 22:32:28+00:00,US EPA,"Draft Risk Evaluation for 1,3-Butadiene | US EPA",,,,,,https://www.epa.gov/assessing-and-managing-chemicals-under-tsca/draft-risk-evaluation-13-butadiene,"EPA designated 1,3-butadiene as a high priority chemical in December 2019 and the chemical is currently undergoing risk evaluation.",,https://www.epa.gov/sites/all/themes/epa/img/epa-standard-og.jpg,,,2025-12-30 23:58:57.074819
,EPA Rollbacks,2025-12-30 22:27:21+00:00,news.bloomberglaw.com,"EPA Shouldn’t Regulate Most Wetlands, Legal Group Tells Agency",,,,,,https://news.bloomberglaw.com/environment-and-energy/epa-shouldnt-regulate-most-wetlands-legal-group-tells-agency,"The EPA’s proposed definition of waters of the US, or WOTUS, doesn’t fully satisfy the US Supreme Court’s landmark Sackett ruling, the legal group that successfully argued the case said in public comments about the rule. ",,https://db0ip7zd23b50.cloudfront.net/dims4/default/4821f82/2147483647/crop/3999x1541+0+592/resize/960x370%3E/quality/90/?url=http%3A%2F%2Fbloomberg-bna-brightspot.s3.amazonaws.com%2F6d%2Fc5%2Fb0ef4e3b4a5c94d880c0399560a9%2Fwetlands-generic.jpg,,,2025-12-30 21:58:13.927853
,Costs & Impacts,2025-12-30 22:19:40+00:00,Cape Gazette,Clean water is under threat,,,,,,https://www.capegazette.com/article/clean-water-under-threat/299603,"Riding along on an annual count of juvenile fish in the Delaware River, a state biologist compared for me the river of yore to the river of the 1990s. Once so low in dissolved oxygen and high in pollution, the Delaware was dying. By the 1970s,...",,https://www.capegazette.com/sites/capegazette/files/domain/capegazette/web-logo-cape-gazette-bw-200.png,,,2025-12-30 22:57:44.810566
,,2025-12-30 22:04:23+00:00,American Farm Bureau Federation,AFBF Encourages Famers and Ranchers to Share Thoughts on WOTUS Rule,,,,,,https://www.fb.org/newsline/afbf-encourages-famers-and-ranchers-to-share-thoughts-on-wotus-rule,... EPA's new Waters of the U.S. Rule will close in early 2026. Chad Smith has more on the upcoming deadline. Smith: The Environmental Protection Agency ...,,https://www.fb.org/imgz/Issues/WOTUS/_socialwFacebook/AFBF_Louisiana_ColeStaudt_Wotus.jpg,,,2025-12-30 17:59:57.859783
,Costs & Impacts,2025-12-30 21:36:09+00:00,X (formerly Twitter),SEPTA is applying for a Brownfields Cleanup Grant from the U.S. Environmental Protection ...,,,,,,https://x.com/CouncilmemberKJ/status/2006060176856547739,Kenyatta Johnson (@CouncilmemberKJ). 81 views. SEPTA is applying for a Brownfields Cleanup Grant from the U.S. Environmental Protection Agency (EPA) ...,,,,,2025-12-30 19:57:37.175082
,Opposition & Allies,2025-12-30 21:32:37+00:00,spectrumnews1.com,AG Nessel urges court to keep clean water protections for Great Lakes,,,,,,https://spectrumnews1.com/oh/toledo/news/2025/12/30/nessel-urges-epa-protections,"Dana Nessel is leading a coalition of attorneys general urging a federal appeals court to keep long-standing protections in place to help prevent invasive species from entering the Great Lakes.

",,https://s7d2.scene7.com/is/image/TWCNews/1000037728_Cropped,,,2025-12-30 20:59:05.922974
,,2025-12-30 21:05:26+00:00,Capital Press,National pesticide applicator manual updated | Capital Press,,,,,,https://capitalpress.com/2025/12/30/national-pesticide-applicator-manual-updated/,"The late 2025 National Pesticide Applicator Certification Core Manual reflects changes in Federal Insecticide, Fungicide and Rodenticide Act regulations since the manual was last updated in 2014.",,https://capitalpress.com/wp-content/uploads/sites/11/2025/12/PESTICIDE-APPLICATOR-MANUAL-PHOTO-Sherm-Takatori-2026-01-02-copy.jpeg?w=640,,,2025-12-30 16:59:19.193950
,,2025-12-30 20:41:28+00:00,www.spglobal.com,"Erie County Water Authority, NY Water Revenue Bon | S&P Global Ratings",,,,,,https://www.spglobal.com/ratings/en/regulatory/article/-/view/type/HTML/id/3498639,"The quality of the drinking water provided by the system meets state and Environmental Protection Agency (EPA) standards set to protect public health, ...",,,,,2025-12-30 20:59:05.922974
