id,name,published,outlet,title,authors,category,market,categoryorder,articleorder,url,description,text,image,error,sentiment,firstEyes
,,2025-12-02 23:08:47+00:00,"Environment, Land & Resources",Trump Administration Proposes New Rule Defining “Waters of the United States”,,,,,,https://www.globalelr.com/2025/12/trump-administration-proposes-new-rule-defining-waters-of-the-united-states/,"The proposed rule would scale back federal jurisdiction under the Clean Water Act. By Nikki Buffa, John C. Heintz, Michael G. Romey, Jennifer K. Roy,",,https://www.globalelr.com/wp-content/uploads/sites/16/2024/07/GettyImages-1136780816_50034-scaled.jpg,,,2025-12-02 19:03:00.134713
,,2025-12-02 23:02:51+00:00,Chesapeake Bay Program,"Chesapeake Executive Council Approves Revised Watershed Agreement, Ushering in the Next Era of Bay Restoration",,,,,,https://www.chesapeakebay.net/news/pressrelease/chesapeake-executive-council-approves-revised-watershed-agreement-ushering-in-the-next-era-of-bay-restoration,Partnership tasked with recommending how to best include Indigenous tribes and knowledge moving forward; Pennsylvania Gov. Josh Shapiro elected chair,,https://www.chesapeakebay.net/files/_670xAUTO_crop_center-center_none/54196312428_8aa23d9823_c-2.jpg,,,2025-12-02 23:57:44.385733
,Costs & Impacts,2025-12-02 23:02:24+00:00,www.mitchellwilliamslaw.com,PM2.5/Clean Air Act: U.S. Environmental Protection Agency Motion for Vacatur of Revised NAAQS,,,,,,https://www.mitchellwilliamslaw.com/pm25/clean-air-act-us-environmental-protection-agency-motion-for-vacatur-of-revised-naaqs,The United States Environmental Protection Agency (“EPA”) filed a Motion for Vacatur (“Motion”) in the United States Court of Appeals for the D.C. ...,,https://www.mitchellwilliamslaw.com/images/site/Social_Logo.jpg,,,2025-12-02 21:01:13.321717
,,2025-12-02 23:01:41+00:00,www.supremecourt.gov,brief - In the Supreme Court of the United States,,,,,,https://www.supremecourt.gov/DocketPDF/24/24-1068/386073/20251201170732560_24-1068%2520--%2520Monsanto%2520v.%2520Durnell.pdf,"by the U.S. Environmental Protection Agency (EPA), where EPA has determined that a particular warning is not required and the warning cannot be ...",,,,,2025-12-02 18:03:48.650606
,,2025-12-02 22:56:59+00:00,jm-aq.com,EPA Brownfields Grants: Federal Funding for Community Revitalization - McAllister & Quinn,,,,,,https://jm-aq.com/%3Fp%3D48675,"The EPA Brownfields Grants program offers federal funding up to $4 million for local governments, states, tribes, and coalitions to assess, plan, ...",,,,,2025-12-02 21:01:13.321717
,,2025-12-02 22:37:07+00:00,ieasafety.com,FacilitiesManagement Archives - IEA Safety,,,,,,https://ieasafety.com/tag/facilitiesmanagement/,"Tags: Environmental Protection Agency, FacilitiesManagement, IEA Safety, INSPEC, MCHEA, Minnesota Healthcare Engineers, Safety Tips, ...",,,,,2025-12-02 23:57:44.385733
,,2025-12-02 22:22:12+00:00,www.austintexas.gov,Austin's Newest Water Reservoir Enhances Reliability for the Future | AustinTexas.gov,,,,,,https://www.austintexas.gov/news/austins-newest-water-reservoir-enhances-reliability-future,"... Agency (EPA), which is administered by the Texas Water Development ... AWU Footer Right. Environmental Protection · Technical Center · Contact Us ...",,,,,2025-12-02 18:03:48.650606
,EPA Rollbacks,2025-12-02 21:51:33+00:00,E&E News by POLITICO,"EPA ‘rightsizing’ key offices in California, Illinois",,,,,,https://www.eenews.net/articles/epa-rightsizing-key-offices-in-california-illinois/,The agency is shedding office space and reorganizing staff following an exodus of personnel and an effort under President Donald Trump to shrink the,,https://static.politico.com/dims4/default/55a1666/2147483647/resize/1200/quality/100/?url=https://static.politico.com/6d/d2/4f294d184f19abf90e65fa253a85/trump-air-pollution-61795.jpg,,,2025-12-02 19:03:00.134713
,,2025-12-02 21:47:12+00:00,www.hunton.com,Agencies Issue Four Proposals to Improve Endangered Species Regulations,,,,,,https://www.hunton.com/the-nickel-report/agencies-issue-four-proposals-to-improve-endangered-species-regulations,"Environmental Law Institute, Environmental Markets, Environmental Permitting, Environmental Protection Agency, Environmental Protection Agency (EPA) ...",,https://www.hunton.com/the-nickel-report/assets/images-t1764714752/201300.png,,,2025-12-02 18:03:48.650606
,,2025-12-02 21:29:49+00:00,www.pa.gov,Shapiro Administration Awards Funding to Protect Lake Erie Coastal Zone,,,,,,https://www.pa.gov/agencies/dep/newsroom/2025-12-02-shapiro-administration-awards-funding-to-protect-lake-erie-coastal-zone,Shapiro Administration Awards Funding to Protect Lake Erie Coastal Zone,,https://www.pa.gov/content/dam/copapwp-pagov/en/global/images/thumbnail.png,,,2025-12-02 23:57:44.385733
,Costs & Impacts,2025-12-02 21:28:15+00:00,www.aei.org,Regional Haze State Plan Requirements Rule Revision Propo,,,,,,https://www.aei.org/wp-content/uploads/2025/12/EPA-Regional-Haze-Program-Revision-Zycher-comment-RIN-2060-AU01-12-1-2025.pdf%3Fx85095,This comment paper responds to the Environmental Protection Agency request for. “feedback on a restructuring of the Regional Haze program” (RHP) ...,,,,,2025-12-02 19:59:11.603259
,Costs & Impacts,2025-12-02 21:17:53+00:00,www.waterboards.ca.gov,Boeing accused of discharge violations at Santa Susana Field Laboratory,,,,,,https://www.waterboards.ca.gov/press_room/press_releases/2025/pr20251202-santa-susana.html,"These creeks are not drinking water sources. In 2022, the California Environmental Protection Agency (CalEPA) announced a comprehensive framework that ...",,,,,2025-12-02 17:02:34.414473
,Costs & Impacts,2025-12-02 20:58:11+00:00,mcgarvey.house.gov,EPA Region 4 Letter re UPS Plane Crash - Morgan McGarvey,,,,,,https://mcgarvey.house.gov/imo/media/doc/epa_region_4_letter_re_ups_plane_crash.pdf,"United States Environmental Protection Agency. Region 4. Sam Nunn Atlanta Federal Center. 61 Forsyth Street, SW. Atlanta, GA 30303-8960. Dear ...",,,,,2025-12-02 23:57:44.385733
,,2025-12-02 20:53:10+00:00,Shipman - EPA Proposes Narrowed Scope for PFAS Reporting Rule,Shipman & Goodwin LLP,,,,,,https://www.shipmangoodwin.com/insights/epa-proposes-narrowed-scope-for-pfas-reporting-rule.html,"The U.S. Environmental Protection Agency has proposed amendments to simplify its Toxic Substances Control Act Section 8(a)(7) PFAS Reporting and Recordkeeping Rule, first released in 2023. Compliance…",,https://www.shipmangoodwin.com/a/web/kyk3QAng8Ga9ZDnDiHWQ1c/2owH57/shipmanlogo_social_media_square_final.jpg,,,2025-12-02 18:03:48.650606
,,2025-12-02 20:49:40+00:00,CT Mirror,"$12M awarded for cleanup, restoration of Long Island Sound",,,,,,https://ctmirror.org/2025/12/02/long-island-sound-grants-epa-nfwf/,"The money, which will help fund projects regionwide, comes as the EPA has sought to slash staff and funding for efforts across the U.S.",,https://ctmirror.org/wp-content/uploads/2025/07/EPA-CLOSE-0723_02.jpeg,,,2025-12-02 17:02:34.414473
,,2025-12-02 20:48:53+00:00,McGlinchey Stafford PLLC,Federal Agencies Unveil Revised WOTUS Rule That May Ease CWA Permitting | McGlinchey Stafford PLLC,,,,,,https://www.mcglinchey.com/insights/federal-agencies-unveil-revised-wotus-rule-that-may-ease-cwa-permitting/,The U.S. Environmental Protection Agency and the U.S. Army Corps of Engineers issued a proposed rule to amend the regulatory definition of “waters of the United States” under the Clean Water Act.,,https://www.mcglinchey.com/wp-content/uploads/2025/12/water-marsh.jpg,,,2025-12-02 19:59:11.603259
,Costs & Impacts,2025-12-02 20:35:53+00:00,www.mass.gov,MassDEP Fines Property Owner for Cleanup Violations at Former Gas Station Site in Uxbridge,,,,,,https://www.mass.gov/news/massdep-fines-property-owner-for-cleanup-violations-at-former-gas-station-site-in-uxbridge,"BOSTON — The Massachusetts Department of Environmental Protection (MassDEP) has assessed an $8,156 penalty against Adam Brothers Towing, LLC, ...",,,,,2025-12-02 17:02:34.414473
,,2025-12-02 20:35:44+00:00,Brookings Register,"Rhoden, other governors express support for E15 ethanol - Brookings Register",,,,,,"https://brookingsregister.com/stories/rhoden-other-governors-express-support-for-e15-ethanol,166950","PIERRE — Recently, South Dakota Gov. Larry Rhoden and six fellow governors sent a letter to the Committee on Environment & Public Works, urging them to support American farmers by ensuring  …",,https://cdn4.creativecirclemedia.com/nmcsd/original/20240422-075714-SummerEthanol.jpg,,,2025-12-02 19:59:11.603259
,Opposition & Allies,2025-12-02 20:34:10+00:00,subscriber.politicopro.com,E&E News: Biden EPA official takes charge of Maryland county department,,,,,,https://subscriber.politicopro.com/article/eenews/2025/12/02/biden-epa-official-takes-charge-of-maryland-county-department-00672642,Jennifer Macedonia steered the agency’s air office in its handling of the ex-president’s trademark climate law.,,https://static.politico.com/6e/cb/1ab1a183405d9a63d1e6ff198d30/gw-0617-reilly-people-1160-01.jpg,,,2025-12-02 19:03:00.134713
,Opposition & Allies,2025-12-02 20:33:06+00:00,www.klgates.com,Environmental Justice Update,,,,,,https://www.klgates.com/Environmental-Justice-Update-12-2-2025,"advancing new policies, legislation, and regulatory approaches aimed at integrating environmental justice considerations",,https://files.klgates.com/images/_wbmanaged/elnr_wbc_socialimage_377976.png,,,2025-12-02 17:02:34.414473
,Costs & Impacts,2025-12-02 20:33:05+00:00,www.klgates.com,EPA Proposes Modifications to PFAS Reporting Rule,,,,,,https://www.klgates.com/EPA-Proposes-Modifications-to-PFAS-Reporting-Rule-12-2-2025,Alert regarding the EPA's recently proposed rule change for PFAS reporting under the Toxic Substances Control Act,,https://files.klgates.com/images/_wbmanaged/elnr_wbc_socialimage_377989.png,,,2025-12-02 17:02:34.414473
,Costs & Impacts,2025-12-02 20:29:19+00:00,the Guardian,Trump administration puts Fema workers back on administrative leave,,,,,,https://www.theguardian.com/us-news/2025/dec/02/trump-fema-workers-administrative-leave,Fourteen workers who signed a petition that warned cuts put the US at risk were initially suspended in August,,"https://i.guim.co.uk/img/media/e3f078909cd8407cc213e26849bace2cff896a61/500_0_5000_4000/master/5000.jpg?width=1200&height=630&quality=85&auto=format&fit=crop&precrop=40:21,offset-x50,offset-y0&overlay-align=bottom%2Cleft&overlay-width=100p&overlay-base64=L2ltZy9zdGF0aWMvb3ZlcmxheXMvdGctZGVmYXVsdC5wbmc&enable=upscale&s=e8603fce53e37e6d298714d177d103bb",,,2025-12-02 17:02:34.414473
,Costs & Impacts,2025-12-02 20:29:08+00:00,Congresswoman Veronica Escobar,"Congresswoman Escobar Expresses Concern, Requests Answers from Cardinal Health Following El Paso Matters Investigation into Toxic Air Emissions",,,,,,https://escobar.house.gov/news/documentsingle.aspx%3FDocumentID%3D2999,"... Environmental Protection Agency's acceptable risk is 1 in 10,000). El Pasoans who live near the Don Haskins facility and were interviewed for ...",,https://escobar.house.gov/images/facebook-meta-25.jpg,,,2025-12-02 17:02:34.414473
,Costs & Impacts,2025-12-02 20:28:20+00:00,www.12news.com,A grocery store chain distributed illegal disinfectants in Arizona. Now the EPA is taking action.,,,,,,https://www.12news.com/article/money/grocery-store-chain-distributed-illegal-disinfectants-arizona-epa-taking-action/75-e684c7bd-2c0d-4a32-a4a8-ef0ebc506f7b,"... Environmental Protection Agency and Chedraui USA, Inc. In a release sent Tuesday, the EPA announced the settlement with the company that also does ...",,,,,2025-12-02 17:02:34.414473
,,2025-12-02 20:27:08+00:00,WE ACT for Environmental Justice,"On 55th Anniversary of the EPA, Environmental Justice Leaders & Networks Push for Accountability with Renewed Vision",,,,,,https://weact.org/updates/on-55th-anniversary-of-the-epa-environmental-justice-leaders-networks-push-for-accountability-with-renewed-vision/,"On 55th Anniversary of the EPA, Environmental Justice Leaders & Networks Push for Accountability with Renewed Vision",,https://weact.org/wp-content/uploads/2025/12/4.png,,,2025-12-02 18:03:48.650606
,Opposition & Allies,2025-12-02 20:23:33+00:00,JD Supra,DPR Considering Changes to Enforcement Response Regulations | JD Supra,,,,,,https://www.jdsupra.com/legalnews/dpr-considering-changes-to-enforcement-6940224/,"On November 13, 2025, the California Department of Pesticide Regulation (DPR) held a webinar to discuss potential changes to its Enforcement Response...",,https://jdsupra-static.s3.amazonaws.com/profile-images/og.15432_3114.jpg,,,2025-12-02 17:02:34.414473
,,2025-12-02 19:56:00+00:00,US EPA,Water Quality Certification of Satus Creek Restoration Project on the Yakama Reservation | US EPA,,,,,,https://www.epa.gov/publicnotices/water-quality-certification-satus-creek-restoration-project-yakama-reservation,Public notice of EPA's proposed water quality certification of the Satus Creek Wood Loading RM 20-25 Project on the Yakama Reservation in Washington.,,https://www.epa.gov/system/files/images/2022-03/epa-standard-twitter.jpg,,,2025-12-02 16:04:01.068373
,,2025-12-02 19:55:18+00:00,news.mt.gov,DEQ Announces Approval of Montana’s Regional Haze State Implementation Plan,,,,,,https://news.mt.gov/Department-of-Environmental-Quality/DEQ-Announces-Approval-of-Montanas-Regional-Haze-State-Implementation-Plan,"The Montana Department of Environmental Quality (DEQ) announces that the U.S. Environmental Protection Agency (EPA) has issued its final approval of Montana’s regional haze State Implementation Plan (SIP) submitted on August 10, 2022. The approval affirms Montana’s long-term strategy to improve visibility in national parks and wilderness areas in accordance with the federal Clean Air Act (CAA) and EPA’s Regional Haze Rule.",,,,,2025-12-02 16:04:01.068373
,Costs & Impacts,2025-12-02 19:47:01+00:00,thehill.com,Trump admin backs Monsanto effort to limit Roundup lawsuits over glyphosate - The Hill,,,,,,https://thehill.com/policy/energy-environment/5630178-glyphosate-bayer-monsanto-roundup-maha-scotus-lawsuits/,The Trump administration's brief notes that the Environmental Protection Agency (EPA) considers Roundup ingredient glyphosate not likely to be ...,,,,,2025-12-02 16:04:01.068373
,Costs & Impacts,2025-12-02 19:33:10+00:00,JD Supra,Natural Resources Damages/Spill Compensation and Control Act Enforcement: New Jersey and Seven Companies Enter Into Consent Judgment | JD Supra,,,,,,https://www.jdsupra.com/legalnews/natural-resources-damages-spill-1712073/,The New Jersey Attorney General and the New Jersey Department of Environmental Protection in the Superior Court of New Jersey entered into a Consent...,,https://jdsupra-static.s3.amazonaws.com/profile-images/og.15833_1120.jpg,,,2025-12-02 15:02:27.970442
,,2025-12-02 19:19:34+00:00,attheu.utah.edu,U of U Health achieves record research funding - @theU,,,,,,https://attheu.utah.edu/facultystaff/u-of-u-health-achieves-record-research-funding/,The National Institutes of Health continues to be the largest source of research support for U of U Health.,,https://d26toa8f6ahusa.cloudfront.net/wp-content/uploads/2023/08/01143826/Fall-Colors-2_header.jpg,,,2025-12-02 15:02:27.970442
,,2025-12-02 19:15:55+00:00,www.nao.usace.army.mil,"NAO-2020-00657 (TREC Route 15, Loudoun County, Virginia) - Norfolk District - Army.mil",,,,,,https://www.nao.usace.army.mil/Media/Public-Notices/Article/4345352/nao-2020-00657-trec-route-15-loudoun-county-virginia/,"In accordance with Certification Rule part 121.12, the Corps will notify the U.S. Environmental Protection Agency (EPA) Administrator when it has ...",,,,,2025-12-02 18:03:48.650606
,,2025-12-02 19:10:05+00:00,Resource Recycling,Top stories from November 2025 ,,,,,,https://resource-recycling.com/recycling/2025/12/02/top-stories-from-november-2025/,"Stories exploring Denver's zero-waste plan, an Ohio plastics recycling start-up, Canadian PRO alignment, Michigan's bottle bill and a leader in",,https://resource-recycling.com/wp-content/uploads/2025/12/Denver-Airport-DIA_Ted-Alexander-Somerville-shutterstock-1.jpg,,,2025-12-02 15:02:27.970442
,,2025-12-02 19:09:57+00:00,journals.plos.org,Occupational pesticide exposure and safety assessment among farmers in Hohoe municipality: An ethnographic qualitative study,,,,,,https://journals.plos.org/plosone/article%3Fid%3D10.1371/journal.pone.0337693,"Introduction Occupational pesticide exposure poses significant health risks, particularly among smallholder farmers in developing countries like Ghana, where such exposures are common due to widespread subsistence agricultural activities. The Environmental Protection Agency (EPA) of Ghana is responsible for registering and monitoring pesticide use and regulating the presence of unregistered or banned products on the local market; however, this regulation is ineffective. Farmers frequently acquire pesticides directly from vendors who may not possess sufficient training, and the lack of stringent measures facilitates the accessibility of hazardous products. Furthermore, while regulations mandate safe handling and disposal practices, there are also possible oversights at the community level, leaving farmers largely dependent on their own knowledge, practices, or what they have learnt from other colleagues. This study explores the safety practices, perceived exposure levels, and awareness among rural farmers in the Hohoe municipality of Ghana.   Methods A qualitative ethnographic approach was adopted, involving in-depth interviews with 13 purposively selected farmers with over five years of farming experience. Data was collected using semi-structured interviews guide informed by prior literature. Thematic analysis was conducted using ATLAS.ti version 25, with open and selective coding techniques.   Results Four major themes emerged: knowledge and practices of pesticide use, health risks and exposure, safety practices, pesticide storage and disposal. Most farmers (approximately 10 out of 13) reported using Glyphosate as their primary herbicide, followed by Paraquat Dichloride and 2,4-D, relying on vendor recommendations for application methods. Common health complaints included eye and skin irritation, waist pain, and temporary vision loss. While some farmers used PPE like boots and gloves, many lacked complete protective gear, especially eye protection. Pesticide containers were often stored at home or discarded on farms or by burning, indicating poor disposal practices. Awareness of pesticide expiry dates and proper dosage was inconsistent.   Conclusion The study reveals substantial gaps in pesticide safety knowledge and practices among rural farmers, posing significant public health risks. Targeted interventions, including regular training on safe pesticide handling, PPE use, and environmentally sound disposal methods, are critical to reducing occupational exposure and its associated health burdens.",,https://journals.plos.org/plosone/article/figure/image?id=10.1371/journal.pone.0337693.g001&size=inline,,,2025-12-02 15:02:27.970442
,Costs & Impacts,2025-12-02 19:05:54+00:00,US EPA,"EPA Takes Action Against Grocery Store Chains for Distribution of Illegal Disinfectants to Arizona, California, and Nevada | US EPA",,,,,,https://www.epa.gov/newsreleases/epa-takes-action-against-grocery-store-chains-distribution-illegal-disinfectants,"Today, U.S. Environmental Protection Agency (EPA) is announcing a settlement with Chedraui USA, Inc., doing business as El Super and Smart & Final Stores LLC, for violating federal pesticide law by distributing illegal disinfectants.",,https://www.epa.gov/sites/all/themes/epa/img/epa-news-releases-og.jpg,,,2025-12-02 15:02:27.970442
,Opposition & Allies,2025-12-02 19:03:32+00:00,spectrumnews1.com,"Rep. McGarvey writes letter to EPA, urging continued oversight of UPS crash site",,,,,,https://spectrumnews1.com/ca/southern-california/news/2025/12/02/epa-ups-crash-site-oversight,McGarvey is asking the EPA to continue to play an active role in overseeing the site.,,https://s7d2.scene7.com/is/image/TWCNews/Kentucky_AP_25311580744963_NAT_1108,,,2025-12-02 17:02:34.414473
,Costs & Impacts,2025-12-02 19:02:44+00:00,spectrumnews1.com,"Rep. McGarvey writes letter to EPA, urging continued oversight of UPS crash site",,,,,,https://spectrumnews1.com/ky/lexington/news/2025/12/02/epa-ups-crash-site-oversight,McGarvey is asking the EPA to continue to play an active role in overseeing the site.,,https://s7d2.scene7.com/is/image/TWCNews/Kentucky_AP_25311580744963_NAT_1108,,,2025-12-02 15:02:27.970442
,,2025-12-02 19:00:38+00:00,ProPublica,Wealthy Ranchers Profit From Public Lands. Taxpayers Pick Up the Tab.,,,,,,https://www.propublica.org/article/grazing-ranchers-public-lands-trump,A ProPublica and High Country News investigation found that government programs supporting grazing on public lands prop up a wealthy few while harming the environment. The Trump administration is supercharging the system.,,"https://www.propublica.org/wp-content/uploads/2025/12/OG250602_HCN_9175_preview_maxWidth_3000_maxHeight_3000_ppi_72_embedColorProfile_true_quality_95-copy.jpg?resize=2000,1050",,,2025-12-02 17:02:34.414473
,,2025-12-02 18:55:52+00:00,www.facebook.com,"U.S. - Today, EPA is celebrating 55 years of protecting human health and the environment. From cleaner air and water to stronger partnerships with states, tribes, and communities, our mission remains as important today as it was in 1970. Happy Birthday, EPA! | Facebook",,,,,,https://www.facebook.com/EPA/photos/today-epa-is-celebrating-55-years-of-protecting-human-health-and-the-environment/1295295145971622/,"Today, EPA is celebrating 55 years of protecting human health and the environment. From cleaner air and water to stronger partnerships with states, tribes, and communities, our mission remains as...",,https://scontent-iad3-1.xx.fbcdn.net/v/t39.30808-6/594059573_1295295149304955_3662937249077689994_n.jpg?stp=dst-jpg_s851x315_tt6&_nc_cat=104&ccb=1-7&_nc_sid=27488d&_nc_ohc=RR8U1T_HxZEQ7kNvwH-QgwD&_nc_oc=AdkEJ2dMeheZn2gJqdFl3KrDBrBpG8_gJWDSJkNOgnaM5d2WIYP0KehSWkCXXCN4Jx277FY5GqhckG2hRYFoHfH2&_nc_zt=23&_nc_ht=scontent-iad3-1.xx&_nc_gid=HzaFL6qDhH149x1RloXqXg&oh=00_AflnUeC633j3YrMh8WUvQea0TMM_ZEtZueJJ8UL2Y5Mrkw&oe=69353F8A,,,2025-12-02 16:04:01.068373
,,2025-12-02 18:55:52+00:00,www.facebook.com,"Today, EPA is celebrating 55 years of protecting human health and the environment ... - Facebook",,,,,,https://www.facebook.com/EPA/posts/today-epa-is-celebrating-55-years-of-protecting-human-health-and-the-environment/1295295169304953/,The United States Environmental Protection Agency was the first dedicated national environmental agency of its kind and has been instrumental in ...,,,,,2025-12-02 16:04:01.068373
,Costs & Impacts,2025-12-02 18:41:20+00:00,E&E News by POLITICO,Biden EPA official takes charge of Maryland county department,,,,,,https://www.eenews.net/articles/biden-epa-official-takes-charge-of-maryland-county-department/,Jennifer Macedonia steered the agency’s air office in its handling of the ex-president’s trademark climate law.,,https://static.politico.com/dims4/default/55a1666/2147483647/resize/1200/quality/100/?url=https://static.politico.com/6e/cb/1ab1a183405d9a63d1e6ff198d30/gw-0617-reilly-people-1160-01.jpg,,,2025-12-02 14:02:47.337695
,Opposition & Allies,2025-12-02 18:36:40+00:00,www.plasticsnews.com,Governors ask EPA for national microplastics drinking water monitoring,,,,,,https://www.plasticsnews.com/public-policy/pn-governors-petition-epa-microplastics/,"Governors from 7 states want the EPA to develop national monitoring of microplastics in drinking water, seen as a step toward federal standards.",,https://cloudfront-us-east-1.images.arcpublishing.com/crain/RAUAW723ANANHOQE2YWNELCI6Y.JPG,,,2025-12-02 14:02:47.337695
,,2025-12-02 18:08:22+00:00,US EPA,Joint Advisory Committee 92nd Meeting (December 2025) | US EPA,,,,,,https://www.epa.gov/usmexicoborder/joint-advisory-committee-92nd-meeting-december-2025,"Joint Advisory Committee 92nd meeting (hybrid) in Santa Teresa, New Mexico",,https://www.epa.gov/sites/all/themes/epa/img/epa-standard-og.jpg,,,2025-12-02 16:04:01.068373
,Costs & Impacts,2025-12-02 18:00:12+00:00,Michigan Environmental Council -,EPA delay rule will result in 3.8 million tons of methane (and more) in our atmosphere - Michigan Environmental Council,,,,,,https://environmentalcouncil.org/discover-post/epa-delay-rule-will-result-in-3-8-million-tons-of-methane-and-more-in-our-atmosphere/,"On November 26, 2025, the U.S. Environmental Protection Agency (EPA) announced it is extending critical compliance deadlines by 10 months for ...",,https://environmentalcouncil.org/wp-content/uploads/2025/12/1.png,,,2025-12-02 16:04:01.068373
,,2025-12-02 17:48:33+00:00,X (formerly Twitter),"#OnThisDay in 1970, the Environmental Protection Agency was formed.",,,,,,https://x.com/ABAesq/status/1995863063946203467,"American Bar Association (@ABAesq). 440 views. #OnThisDay in 1970, the Environmental Protection Agency was formed.",,,,,2025-12-02 16:04:01.068373
,Opposition & Allies,2025-12-02 17:46:18+00:00,www.whas11.com,McGarvey urges EPA to continue monitoring environmental impacts of UPS plane crash,,,,,,https://www.whas11.com/article/news/local/ups-plane-crash-epa-response-louisville-waterways/417-d68af045-43cb-41ad-8969-628797e9e11a,... Environmental Protection Agency (EPA) Administrator Lee Zeldin on Monday. “We are also concerned with the long-term public health implications of ...,,,,,2025-12-02 14:02:47.337695
