id,name,published,outlet,title,authors,category,market,categoryorder,articleorder,url,description,text,image,error,sentiment,firstEyes
,,2025-12-29 17:50:53+00:00,Humane World for Animals,2025 brought us closer to a world without animal testing and research,,,,,,https://www.hsi.org/en/blog/closer-to-world-without-animal-testing-research,"Montessa, a chimpanzee, spent 50 years in a barren laboratory, and for 30 of them, she endured harmful testing procedures. This year, however, her fortune changed. She, along with other chimpanzees from a federally owned facility in New Mexico, finally arrived at Chimp Haven in Louisiana—thanks in large part to our persistent advocacy for their sanctuary retirement. She and her peers are now living their best lives there. Just recently, the chimps received holiday stockings stuffed with treats.",,https://www.humaneworld.org/sites/default/files/styles/sa_social_media_facebook/public/2025-12/Al_HD%201080p%20Horizontal.jpg?h=d1cb525d&itok=PsLqiIGO,,,2025-12-29 13:00:42.941745
,,2025-12-29 17:47:27+00:00,JOGH,Current landscape and future directions of policies addressing air quality improvement in Pakistan: a scoping review — JOGH,,,,,,https://jogh.org/2025/jogh-15-04349,"Air quality refers to the cleanliness of the air, whereas air pollution is the presence of harmful chemical, physical, or biological substances in the atmosphere [1]. Common pollutants include particulate matter (PM), nitrogen oxides, ozone, sulphur oxides, carbon monoxide (CO), and lead. Major sources of air pollution include motor vehicle emissions, industrial processes, household combustion, […]",,https://jogh.org/wp-content/uploads/2025/12/jogh-15-04349-F1.png,,,2025-12-29 16:12:55.426294
,,2025-12-29 17:41:22+00:00,www.portarthurtx.gov,COPA Applying for Funding from EPA Grant regarding Hotel Sabine Site - City of Port Arthur,,,,,,https://www.portarthurtx.gov/CivicAlerts.aspx%3FAID%3D2671,"The City will hold a Public Meeting to present the proposed cleanup plan, review the draft ABCA, and discuss key components of the EPA Cleanup Grant ...",,,,,2025-12-29 13:00:42.941745
,Opposition & Allies,2025-12-29 17:35:45+00:00,www.facebook.com,Michigan is asking a federal appeals court to strike down an Environmental Protection ... - Facebook,,,,,,https://www.facebook.com/mlive/posts/michigan-is-asking-a-federal-appeals-court-to-strike-down-an-environmental-prote/1322312916592842/,How does the EPA act so ignorant and get away with it? They know better than this! 29 mins.,,,,,2025-12-29 15:13:38.328072
,,2025-12-29 17:23:14+00:00,MAVEN'S NOTEBOOK | California Water News Central,"DAILY DIGEST. 12/29: Rain to return to California, just in time for New Year’s; Dramatic changes in store for private island on edge of San Francisco Bay; A sediment basin retrofit for enhanced recharge; Could this idea help solve some of the Colorado River water fights?; and more ...",,,,,,https://mavensnotebook.com/2025/12/29/daily-digest-12-29-rain-to-return-to-california-just-in-time-for-new-years-dramatic-changes-in-store-for-private-island-on-edge-of-san-francisco-bay-a-sediment-basin-retrofit-for-enhance/,"[cmtoc_table_of_contents] Several news sources featured in the Daily Digest may limit the number of articles you can access without a subscription. However, gift articles and open-access links are provided when available. For more open access California water news articles, explore the main page at MavensNotebook.com. In California water news today … Rain to return to California, just in time for New Year’s celebrations “Following several days of dry, sunny and windy conditions, a new storm packing rain and travel delays […]",,https://mavensnotebook.com/wp-content/uploads/2023/02/Header_Daily-2.jpg,,,2025-12-29 14:59:00.454326
,,2025-12-29 17:12:06+00:00,"Bergeson & Campbell, P.C.","What to Expect in Chemicals Policy and Regulation and on Capitol Hill in 2026, January 27, 2026, 11:00 a.m. - 12:00 p.m. (EST), via webinar - Bergeson & Campbell, P.C.",,,,,,https://www.lawbc.com/what-to-expect-in-chemicals-policy-and-regulation-and-on-capitol-hill-in-2026-january-27-2026-via-webinar/,"Register now to join Bergeson & Campbell, P.C. (B&C®) for “What to Expect in Chemicals Policy and Regulation and on Capitol Hill in 2026,” a",,https://www.lawbc.com/wp-content/uploads/iStock-869295582.jpg,,,2025-12-29 13:00:42.941745
,,2025-12-29 16:59:48+00:00,Nature,Evaluation of bacterial bioaerosols and their relationship with environmental factors in the air of the wastewater treatment plant of industrial - Scientific Reports,,,,,,https://www.nature.com/articles/s41598-025-28692-1,"Bioaerosol emissions from wastewater treatment plants (WWTPs) can pose a potential risk to human health and the environment. This study aimed to identify and analyze the dominant bacterial species in airborne bioaerosols at the Jahanabad Industrial Zone WWTPs in Meybod, and to examine their relationship with environmental factors. This study was conducted in the spring and summer of 2020 at the Jahanabad Industrial WWTP in Meybod. Over a period of 6 months, 96 bacterial bioaerosol samples were collected using an Anderson device, and environmental parameters were measured simultaneously. After differential tests and examination of phenotypic characteristics, the dominant colonies were maintained in TSB medium with 30% glycerol and confirmed by PCR. A total of 19 bacterial species belonging to 5 genera were identified through sequencing. The most dominant genus observed was Bacillus (52.6%), followed by Kocuria (26.3%) and Micrococcus (10.5%). The equalization tank (ET) exhibited the highest mean concentrations (176.98 ± 12.37 CFU/m3; 75.13 ± 5.25 CFU/plate), while the lowest levels were observed 100 m downstream (100D) of the treatment plant (36.81 ± 13.89 CFU/m3; 15.63 ± 5.89 CFU/plate). No significant correlation was found between bioaerosol concentrations and wind speed (r = − 0.08, p = 0.44). However, a significant positive correlation was observed with relative humidity (r = 0.51, p &lt; 0.001), and significant negative correlations were found with Temperature (r = − 0.56, p &lt; 0.001), UVA (r = − 0.51, p &lt; 0.001), and UVC radiation (r = − 0.59, p &lt; 0.001). This study demonstrated that industrial WWTPs, regardless of variations in wastewater characteristics, possess a high potential for emitting bacterial bioaerosols into the environment, posing potential risks to both worker health and the surrounding ecosystem.",,https://media.springernature.com/m685/springer-static/image/art%3A10.1038%2Fs41598-025-28692-1/MediaObjects/41598_2025_28692_Fig1_HTML.png,,,2025-12-29 13:00:42.941745
,,2025-12-29 16:59:00+00:00,www.argusmedia.com,Viewpoint: US biodiesel supply to lean domestic in 2026 | Latest Market News,,,,,,https://www.argusmedia.com/news-and-insights/latest-market-news/2770266-viewpoint-us-biodiesel-supply-to-lean-domestic-in-2026,US biodiesel blenders will continue to shift toward domestic supplies next year because importers are ineligible for federal incentives and domestic production credits are set to double.,,https://www.argusmedia.com/-/media/project/argusmedia/mainsite/images/14-generic-hero-banners/herobanner_1600x530_generic-c.jpg?h=530&iar=0&w=1600&rev=2cf023b4e0484c1bb091b9f72dbf7771&hash=72DBDFEBEF6EE62E751AB5DD2221C77E,,,2025-12-29 13:00:42.941745
,,2025-12-29 16:57:34+00:00,public-inspection.federalregister.gov,6560-50 ENVIRONMENTAL PROTECTION AGENCY [EPA-HQ-OAR-2022-0066 - Federal Register,,,,,,https://public-inspection.federalregister.gov/2025-23921.pdf,"SUMMARY: The Environmental Protection Agency has submitted an information collection request (ICR), NSPS for Grain Elevators (EPA ICR Number 1130.14, ...",,,,,2025-12-29 14:13:26.853077
,,2025-12-29 16:57:24+00:00,public-inspection.federalregister.gov,6560-50-P ENVIRONMENTAL PROTECTION AGENCY [EPA-HQ-OLEM-2018-0646,,,,,,https://public-inspection.federalregister.gov/2025-23973.pdf,"SUMMARY: The Environmental Protection Agency (EPA) has submitted an information collection request (ICR), Safe Management of Recalled Airbags Rule ( ...",,,,,2025-12-29 14:13:26.853077
,Costs & Impacts,2025-12-29 16:56:38+00:00,https://www.newschannel6now.com,City of Lawton sending letters to community for water line review,,,,,,https://www.newschannel6now.com/2025/12/29/city-lawton-sending-letters-community-water-line-review/,"The City of Lawton will mail letters to community water customers, notifying them of their service line materials.",,https://gray-kauz-prod.gtv-cdn.com/resizer/v2/4EE5RHFGWNBDDPUQ4ETSUL5K3U.jpg?auth=336d40f57d7342a42e11f569cd7880eb2a8797d33196ffb8b68ad3bd6cf4845d&width=1200&height=600&smart=true,,,2025-12-29 13:00:42.941745
,Costs & Impacts,2025-12-29 16:34:24+00:00,Government Accountability Project,Leaders of Four Congressional FEMA Oversight Committees Seek Official Action to Protect FEMA Whistleblowers,,,,,,https://whistleblower.org/press/leaders-of-four-congressional-fema-oversight-committees-seek-official-action-to-protect-fema-whistleblowers/,"Today, three public interest organizations supporting FEMA whistleblowers who signed The Katrina Declaration—Government Accountability Project, Lawyers For Good Government and Stand Up For Science—applauded the recent Congressional letter protesting FEMA’s gross mishandling.",,https://whistleblower.org/wp-content/uploads/2025/09/shutterstock_2524200501-scaled.jpg,,,2025-12-29 13:00:42.941745
,Costs & Impacts,2025-12-29 16:28:08+00:00,iowacapitaldispatch.com,"Property taxes, eminent domain debate to return in 2026 Iowa legislative session",,,,,,https://iowacapitaldispatch.com/2025/12/29/property-taxes-eminent-domain-debate-to-return-in-2026-iowa-legislative-session/,"... Environmental Protection Agency. “At the end of the day, they did not take away your rights to sue that company for cause in any way, shape or ...",,,,,2025-12-29 11:59:34.783297
,Costs & Impacts,2025-12-29 16:27:42+00:00,US EPA,"EPA Fulfills Statutory Obligation, Completes Reviews at 32 Superfund Sites Across New Jersey, New York and Puerto Rico | US EPA",,,,,,https://www.epa.gov/newsreleases/epa-fulfills-statutory-obligation-completes-reviews-32-superfund-sites-across-new,"U.S. Environmental Protection Agency (EPA) has fulfilled its statutory obligation and completed required comprehensive site cleanup reviews, known as ""five-year reviews,"" for 32 Superfund sites on the National Priorities List.",,https://www.epa.gov/sites/all/themes/epa/img/epa-news-releases-og.jpg,,,2025-12-29 11:59:34.783297
,,2025-12-29 16:18:15+00:00,www.rotary.org,A restoration plan for Texas coastal waters includes rain gardens,,,,,,https://www.rotary.org/en/a-restoration-plan-for-texas-coastal-waters-includes-rain-gardens,... Environmental Protection Agency. Rain gardens can filter out 90 percent of those chemicals and 80 percent of sediments before returning stormwater ...,,https://www.rotary.org/sites/default/files/styles/w_600/public/2026-01-algae_water-hero.jpg?itok=-RNVjSok,,,2025-12-29 11:59:34.783297
,,2025-12-29 16:03:58+00:00,capitalandmain.com,Editor’s Picks: Capital & Main’s Standout Stories of 2025,,,,,,https://capitalandmain.com/editors-picks-capital-mains-standout-stories-of-2025,"A selection of some of our most memorable, revealing and impactful journalism of the year.",,https://capitalandmain.com/wp-content/uploads/2025/03/Border_Killing_-001-1000x600.jpg,,,2025-12-29 11:59:34.783297
,,2025-12-29 16:03:24+00:00,PetfoodIndustry,Purina Foundation awards over $1 million to nonprofits,,,,,,https://www.petfoodindustry.com/news-newsletters/pet-food-news/news/15774866/purina-foundation-awards-over-1-million-to-nonprofits,"The foundation supported 27 organizations across the U.S. with grants totaling $1,165,000 in 2025.",,https://img.petfoodindustry.com/mindful/watt/workspaces/default/uploads/2025/12/nestle-purina-petcare-grants-to-support-communities-and-pets-in-need.1NQYLRcVjL.jpg?auto=format%2Ccompress&fit=max&q=70&w=1200,,,2025-12-29 11:59:34.783297
,Opposition & Allies,2025-12-29 15:46:44+00:00,PEER.org,Burgum’s Offshore Wind Halt of Questionable Legality,,,,,,https://peer.org/burgum-offshore-wind-halt-questionable-legality/,Interior Department Riddled with Conflicts of Interest and Ethical Challenges,,https://peer.org/wp-content/uploads/2025/12/Featured-Releases-2025-1-12-29-25-offshore-wind.png,,,2025-12-29 11:59:34.783297
,Opposition & Allies,2025-12-29 15:37:01+00:00,The River Reporter,Goodbye ‘25—hello ‘26! - The River Reporter,,,,,,"https://riverreporter.com/stories/goodbye-25hello-26,238317","UPPER DELAWARE RIVER VALLEY, NY & PA — It’s January, and that means we’re breaking open the seal on a brand new year!   2025 brought with it changes, challenges and a host of interesting  …",,https://alpha.creativecirclecdn.com/riverreporter/original/20251229-102926-40d-narrowsburg%20on%20ice.jpg,,,2025-12-29 11:00:56.766462
,Costs & Impacts,2025-12-29 15:33:59+00:00,www.facebook.com,Save - We agree with the U.S. Environmental Protection Agency. Remove the dams! | Facebook,,,,,,https://www.facebook.com/savethecolorado/photos/we-agree-with-the-us-environmental-protection-agency-remove-the-dams/1322120053279157/,We agree with the U.S. Environmental Protection Agency. Remove the dams!,,https://scontent-iad3-1.xx.fbcdn.net/v/t39.30808-6/605127382_1322120056612490_7469661943728613063_n.jpg?stp=dst-jpg_p206x206_tt6&_nc_cat=104&ccb=1-7&_nc_sid=27488d&_nc_ohc=_5WuginizHoQ7kNvwF6gQlE&_nc_oc=AdlRIiB_n91Lv8W71jAKSD2p7rJGzw9PNiABK5PqOCgoIYkc5SB81x6d6cMPMHjD5AtJYkWXg4nvyY3_T3psAztQ&_nc_zt=23&_nc_ht=scontent-iad3-1.xx&_nc_gid=DNnYZCmXVSODz6Ci16eaUg&oh=00_AflYihBnYkMNz8k5ggxNJWHKLFohtzxLdVA2CAFqzcbfEw&oe=6958729C,,,2025-12-29 12:12:41.809296
,Costs & Impacts,2025-12-29 15:33:59+00:00,www.facebook.com,We agree with the U.S. Environmental Protection Agency. Remove the dams!,,,,,,https://www.facebook.com/savethecolorado/posts/we-agree-with-the-us-environmental-protection-agency-remove-the-dams/1322549013236261/,"Trump Administration Review of Columbia-Snake River Dams Fails to Protect Salmon, Orcas, Rivers. 0 reactions.",,,,,2025-12-29 13:13:18.561244
,Costs & Impacts,2025-12-29 15:17:12+00:00,CT.gov - Connecticut's Official State Website,Connecticut Welcomes 2026 with First Day Hikes on January 1,,,,,,https://portal.ct.gov/deep/news-releases/news-releases---2025/connecticut-welcomes-2026-with-first-day-hikes-on-january-1,"(HARTFORD) — The Connecticut Department of Energy and Environmental Protection (DEEP) and its partners encourage residents and visitors to start the new year outdoors. On New Year’s Day, January 1, 2026, walk, hike, and enjoy nature by joining volunteer-led outings hosted by Connecticut’s State Park partner groups as the state celebrates First Day Hikes, a nationwide initiative to get people outside.",,https://portal.ct.gov/Assets/Images/facebook-default_01.png,,,2025-12-29 13:00:42.941745
,,2025-12-29 15:08:18+00:00,American Recycler: Your reliable companion in the world,"Mercedes-Benz agrees to settlement to resolve consumer fraud, environmental claims",,,,,,https://americanrecycler.com/mercedes-benz-agrees-to-settlement-to-resolve-consumer-fraud-environmental-claims/amp/,"Attorney General Matthew J. Platkin announced that 50 attorneys general reached a $149,673,750 settlement with Mercedes-Benz USA and Mercedes-Benz Group AG (collectively, Mercedes) for violating state consumer and environmental protection laws by making, selling, and distributing vehicles equipped with illegal and undisclosed software that was allegedly intended to circumvent federal or state emission standards and",,https://americanrecycler.com/wp-content/uploads/2025/12/Mercedes-Benz.jpg,,,2025-12-29 13:00:42.941745
,,2025-12-29 15:02:22+00:00,www.mondaq.com,"EPA Issues ""Compliance First"" Memorandum, Shifting Enforcement Approach",,,,,,https://www.mondaq.com/unitedstates/environmental-law/1724688/epa-issues-compliance-first-memorandum-shifting-enforcement-approach,"On December 5, 2025, the Environmental Protection Agency's (EPA) Office of Enforcement and Compliance Assurance (OECA) issued a memorandum that directs all EPA staff...",,http://www.mondaq.com/images/MondaqThumb.png,,,2025-12-29 11:00:56.766462
,,2025-12-29 14:46:24+00:00,www.cato.org,Deregulation Based on Good Sludge | Cato Institute,,,,,,https://www.cato.org/regulation/winter-2025-2026/deregulation-based-good-sludge,"The Environmental Protection Agency's RIA supporting an endangerment finding regarding greenhouse gas emissions underwent judicial review, where ...",,,,,2025-12-29 13:00:42.941745
,,2025-12-29 14:46:23+00:00,www.cato.org,Regulatory Gatekeepers and Their Sludge - Cato Institute,,,,,,https://www.cato.org/regulation/winter-2025-2026/regulatory-gatekeepers-their-sludge,"Gatekeepers have noble purposes: They ensure the protection of privacy, public health, safety, and environmental quality. ... Agency (EPA), and ...",,,,,2025-12-29 13:00:42.941745
,,2025-12-29 14:08:24+00:00,Earth.com,Pollution hotspots exposed in stunning new carbon maps,,,,,,https://www.earth.com/news/americas-pollution-hotspots-exposed-in-new-carbon-fuel-emission-maps/,"Experts mapped US fossil fuel emissions street by street, showing where pollution really comes from and why data matters for climate action.",,https://cff2.earth.com/uploads/2025/12/28153353/co2-emissions_US-map_2010-2022_Scientific-Data_1m.jpg,,,2025-12-29 11:59:34.783297
,Costs & Impacts,2025-12-29 14:03:08+00:00,Mississippi Free Press,"Trump Kills Mississippi Solar Projects, Nixing Energy Savings",,,,,,https://www.mississippifreepress.org/bidens-solar-for-all-program-promised-millions-in-energy-savings-for-mississippi-families-trump-killed-it/,"The Trump administration canceled the Solar for All program, which was designed to bring affordable solar energy to places like the Mississippi Delta.",,https://www.mississippifreepress.org/wp-content/uploads/2025/10/Solar-for-All-project-Maryland_courtesy-Clem-Howard.jpg,,,2025-12-29 11:00:56.766462
,Costs & Impacts,2025-12-29 13:50:24+00:00,Los Angeles Times,"L.A. fire cleanups reports describe repeated violations, illegal dumping allegation",,,,,,https://www.latimes.com/environment/story/2025-12-29/la-fire-cleanups-reports-describe-repeated-violations-illegal-dumping-allegation,We reviewed thousands of pages of Army Corps of Engineering quality assurance reports for the January fire soil cleanup. The results were startling.,,https://ca-times.brightspotcdn.com/dims4/default/f09ebfb/2147483647/strip/true/crop/5280x2772+0+592/resize/1200x630!/quality/75/?url=https%3A%2F%2Fcalifornia-times-brightspot.s3.amazonaws.com%2Fc9%2F85%2Fa123152545cead8ed93d15ea964b%2F1494493-me-debris-removal-altadena-26-ajs.jpg,,,2025-12-29 08:58:15.466442
,North Carolina,2025-12-29 13:30:42+00:00,ProPublica,How GOP Lawmakers’ Power Transfers Are Reshaping Everything From Utilities to Environmental Regulation in North Carolina,,,,,,https://www.propublica.org/article/north-carolina-legislature-power-transfers,The GOP-led North Carolina legislature spent nearly 10 years trying to control the elections board. But it’s also taken aim at other commissions in the state by shifting who has power to appoint members that historically belonged to the governor.,,"https://www.propublica.org/wp-content/uploads/2025/12/AP24164734285600_maxHeight_3000_maxWidth_3000.jpg?resize=2000,1333",,,2025-12-29 08:58:15.466442
,,2025-12-29 13:20:57+00:00,AgUpdate,Proposed rule affects producer futures,,,,,,https://agupdate.com/agriview/news/regional/article_da65046d-8dbe-4384-a26a-70143b47a818.html,Key Takeaways,,https://bloximages.chicago2.vip.townnews.com/agupdate.com/content/tncms/assets/v3/editorial/f/75/f755b4b2-d538-43fe-bf41-4023f068b206/6949fcb29e2ca.image.jpg?crop=1985%2C1042%2C0%2C0&resize=1200%2C630&order=crop%2Cresize,,,2025-12-29 08:58:15.466442
,,2025-12-29 13:11:48+00:00,Southern Farm Network,Ethanol Groups Continue Pushing for Year-Round Ethanol,,,,,,https://www.sfntoday.com/2025/12/29/9804/,The American Coalition for Ethanol (ACE) is actively engaging the Environmental Protection Agency on the Renew...,,https://media-cdn.socastsrm.com/wordpress/wp-content/blogs.dir/3839/files/2025/12/shutterstock-ethanol-pump2-1500x1000-1-1200x675.jpg,,,2025-12-29 08:58:15.466442
,,2025-12-29 12:53:45+00:00,The State Journal-Register,Hundreds of new laws take effect in Illinois in 2026,,,,,,https://www.sj-r.com/story/news/state/2025/12/29/hundreds-of-new-laws-coming-to-illinois-in-2026/87623621007/,"Some of the new laws include the end of the statewide grocery tax, seniors not needing to take a driving test until they're 87 and more.",,"https://www.sj-r.com/gcdn/authoring/authoring-images/2025/04/22/NJOS/83218084007-usatsi-24854906.jpg?crop=8639,4861,x0,y449&width=3200&height=1801&format=pjpg&auto=webp",,,2025-12-29 11:00:56.766462
,,2025-12-29 12:44:59+00:00,kiowacountypress.net,Public comment period ending ahead of clean water rule change | KiowaCountyPress.net,,,,,,https://kiowacountypress.net/content/public-comment-period-ending-ahead-clean-water-rule-change,The Environmental Protection Agency says its proposed rule change would align with the 2023 U.S. Supreme Court decision in Sackett vs the EPA.,,,,,2025-12-29 08:58:15.466442
,Costs & Impacts,2025-12-29 12:37:53+00:00,www.euronews.com,Will Trump's climate criticism backfire? New poll shows most US voters support Paris Agreement,,,,,,https://www.euronews.com/green/2025/12/29/will-trumps-climate-criticism-backfire-new-poll-shows-most-us-voters-support-paris-agreeme,"Earlier this month, theUS Environmental Protection Agency (EPA) also removed all mention of fossil fuels – the main driver of global warming ...",,,,,2025-12-29 08:58:15.466442
,,2025-12-29 12:28:06+00:00,ImpactAlpha,"Holiday List No. 3: These founders and funders are ‘PluggedIn’ to a just, diverse climate transition",,,,,,https://impactalpha.com/holiday-list-no-3-five-founders-and-funders-pluggedin-to-a-diverse-climate-transition/,Catch up on ImpactAlpha's PluggedIn interviews that highlight agents of change and their visions for an inclusive climate future.,,http://impactalpha.com/wp-content/uploads/2025/12/Holiday-List-3-PluggedIn.png,,,2025-12-29 08:58:15.466442
,,2025-12-29 12:25:03+00:00,WyoFile,Trump's sweeping energy policies dominated Wyoming energy headlines in 2025 - WyoFile,,,,,,https://wyofile.com/trumps-sweeping-energy-policies-dominated-wyoming-energy-headlines-in-2025/,"Conservationists decried Trump's policies, while Wyomingites clashed on nuclear manufacturing proposals.",,https://i0.wp.com/wyofile.com/wp-content/uploads/2025/07/Dirt-shovel-Belle-Ayr-coal-mine-DBleizeffer.jpeg?fit=1200%2C905&ssl=1,,,2025-12-29 08:58:15.466442
,,2025-12-29 12:06:16+00:00,www.fondriest.com,How the Ohio EPA Uses Water Quality Data to Monitor Change in State Waterways,,,,,,https://www.fondriest.com/news/%3Fp%3D40643,"Therefore, protecting the health of these water bodies is a leading concern for regulatory groups like the Ohio Environmental Protection Agency (EPA).",,,,,2025-12-29 10:13:57.069427
,,2025-12-29 12:03:04+00:00,Corporate Compliance Insights,Piercing the Corporate Veil: A Case Study and Best Practices Checklist,,,,,,https://www.corporatecomplianceinsights.com/piercing-corporate-veil-case-study-best-practices/,"Though standards vary across jurisdictions, parties seeking to pierce the corporate veil must generally show that owners dominated the entity",,https://www.corporatecomplianceinsights.com/wp-content/uploads/2025/12/separation-of-entities-concept-converging-bodies-of-water.jpg,,,2025-12-29 08:58:15.466442
,Costs & Impacts,2025-12-29 11:59:22+00:00,guampdn.com,Palisades appeal of $1.7M landslide fine set for Guam EPA hearing,,,,,,https://www.guampdn.com/news/palisades-appeal-of-1-7m-landslide-fine-set-for-guam-epa-hearing/article_3f55a1c9-d219-4440-97cc-e4ee7f795a3e.html,The developer for upscale gated community The Palisades has filed a formal appeal of a $1.7 million fine and violation notice connected to an Oct. 15 landslide that blocked Marine,,https://bloximages.newyork1.vip.townnews.com/guampdn.com/content/tncms/assets/v3/editorial/f/21/f219c64a-d9ca-48a6-9506-3fd6328eeadc/68ef00bfc69ad.image.jpg?crop=1805%2C948%2C0%2C100&resize=1200%2C630&order=crop%2Cresize,,,2025-12-29 08:58:15.466442
,,2025-12-29 11:48:46+00:00,SCS Engineers,Balancing the Phenomena of Data Center Growth with Our Environment,,,,,,https://www.scsengineers.com/balancing-the-phenomena-of-data-center-growth-with-our-environment/,Using greener cooling methods for data centers will help minimize environmental impacts on air quality and local water resources for cooling.,,https://www.scsengineers.com/wp-content/uploads/2025/12/balancing-act-business-and-environment-scs-engineers-4-3.jpg,,,2025-12-29 08:12:52.651315
,Costs & Impacts,2025-12-29 11:46:44+00:00,KJZZ,Phoenix is among worst in U.S. for New Year's pollution. Air Quality Department says you can help,,,,,,https://www.kjzz.org/kjzz-news/2025-12-29/phoenix-is-among-worst-in-u-s-for-new-years-pollution-air-quality-department-says-you-can-help,Phoenix rang in 2025 with some of the worst air quality ever recorded in the Valley. The Maricopa County Air Quality Department is urging residents to help keep skies clearer for New Year’s 2026.,,https://npr.brightspotcdn.com/dims4/default/68c70db/2147483647/strip/true/crop/1500x788+0+28/resize/1200x630!/quality/90/?url=http%3A%2F%2Fnpr-brightspot.s3.amazonaws.com%2Flegacy%2Fs3fs-public%2Ffireworks-2020.jpg,,,2025-12-29 08:58:15.466442
