id,name,published,outlet,title,authors,category,market,categoryorder,articleorder,url,description,text,image,error,sentiment,firstEyes
,,2025-12-30 20:30:32+00:00,US EPA,Stormwater Runoff Preparedness and Resilience | US EPA,,,,,,https://www.epa.gov/arc-x/stormwater-runoff-preparedness-and-resilience,"EPA works with local, state and tribal governments to reduce runoff and improve water quality by supporting stormwater management practices",,https://www.epa.gov/sites/all/themes/epa/img/epa-standard-og.jpg,,,2025-12-30 17:14:40.938195
,,2025-12-30 20:29:06+00:00,goldrushcam.com,U.S. Environmental Protection Agency (EPA) Administrator Lee Zeldin Highlights How ...,,,,,,https://goldrushcam.com/sierrasuntimes/index.php/news/local-news/74153-u-s-environmental-protection-agency-epa-administrator-lee-zeldin-highlights-how-reducing-food-waste-matters-for-all-americans,U.S. Environmental Protection Agency (EPA) Administrator Lee Zeldin Highlights How Reducing Food Waste Matters for All Americans.,,,,,2025-12-30 15:58:27.654064
,,2025-12-30 20:26:18+00:00,epa.illinois.gov,Outreach,,,,,,https://epa.illinois.gov/topics/bureau-of-safety-and-sustainability/environmental-justice/outreach.html,Léalo en Español,,,,,2025-12-30 16:14:24.622402
,,2025-12-30 20:21:17+00:00,epa.illinois.gov,Funding and Grant Opportunities,,,,,,https://epa.illinois.gov/topics/bureau-of-safety-and-sustainability/environmental-justice/funding-and-grant-opportunities.html,"Below is information related to federal funding opportunities compiled by the Illinois EPA. Illinois EPA encourages all eligible entities to apply. See details below for information about open opportunities, eligibility, and application deadlines for",,,,,2025-12-30 18:13:32.574190
,,2025-12-30 20:18:23+00:00,www.linkedin.com,We‚Äôre proud to recognize our retirees and thank them for their years of dedicated service. Their contributions have strengthened our organization and the communities we serve. Wishing you all the‚Ä¶ | Illinois Environmental Protection Agency,,,,,,https://www.linkedin.com/posts/illinois-environmental-protection-agency_were-proud-to-recognize-our-retirees-and-activity-7411814966175035392-PIOc,We‚Äôre proud to recognize our retirees and thank them for their years of dedicated service. Their contributions have strengthened our organization and the communities we serve. Wishing you all the best in this next chapter. Thank you for your service and congratulations on your retirement! üëèüéâ,,https://media.licdn.com/dms/image/v2/D5622AQFGqGtgR5a91g/feedshare-shrink_1280/B56ZtwObxYJoAs-/0/1767114392069?e=2147483647&v=beta&t=ZhrU8pcKGMg3VLhu6bkeBK-rHaF-v324My8nqUhLIKo,,,2025-12-30 17:14:40.938195
,,2025-12-30 20:12:46+00:00,epa.illinois.gov,Environmental Education,,,,,,https://epa.illinois.gov/topics/bureau-of-safety-and-sustainability/education.html,The Office of Education educates Illinois' residents of all ages on environmental issues to foster stewardship and awareness.,,,,,2025-12-30 16:14:24.622402
,,2025-12-30 20:07:01+00:00,Office of the New York City Comptroller Brad Lander,Audit of the New York City Department of Environmental Protection’s Leak Detection Program,,,,,,https://comptroller.nyc.gov/reports/audit-of-the-new-york-city-department-of-environmental-protections-leak-detection-program/,"Audit Impact Summary of Findings The New York City Department of Environmental Protection’s (DEP) Leak Detection Program (the Program) is not functioning as a proactive, prevention-focused initiative as intended. Instead of progressing through the citywide system, DEP surveyed only a small portion of its planned coverage—just 27% of the 401...",,https://comptroller.nyc.gov/wp-content/uploads/2025/12/Pages-from-DEP_SE25-076A.jpg,,,2025-12-30 15:58:27.654064
,,2025-12-30 20:00:14+00:00,www.petfoodprocessing.net,Rendering added back to EPA Wasted Food Scale | Pet Food Processing,,,,,,https://www.petfoodprocessing.net/articles/19989-rendering-added-back-to-epa-wasted-food-scale,— The North American Renderers Association (NARA) expressed its support in the US Environmental Protection Agency's (EPA) decision to restore ...,,,,,2025-12-30 15:58:27.654064
,,2025-12-30 19:42:02+00:00,www.countyofglenn.net,Resources | County of Glenn,,,,,,https://www.countyofglenn.net/resources%3Ff%255B0%255D%3Dcategory%253AAgreements%26f%255B1%255D%3Dcategory%253ABids%26f%255B2%255D%3Dcategory%253AEnvironment%26f%255B3%255D%3Dcategory%253AOlive%2520Fruit%2520Fly%2520Counts%26f%255B4%255D%3Dcategory%253AYouth%26page%3D8,"California Environmental Protection Agency (CalEPA) ... In 1991, California's environmental authority was unified in a single Cabinet level agency—the ...",,,,,2025-12-30 18:13:32.574190
,,2025-12-30 19:21:52+00:00,sourcenm.com,Environment and health in New Mexico: top stories of 2025 - SourceNM,,,,,,https://sourcenm.com/2025/12/30/the-environment-and-health-top-stories-of-2025/,The Environmental Protection Agency has said that exposure to the chemicals may cause cancer. The EPA last year set a 2029 deadline for public ...,,,,,2025-12-30 16:59:19.193950
,Costs & Impacts,2025-12-30 19:17:14+00:00,www.pennfuture.org,The worst U.S. Supreme Court decisions: Sackett v. EPA and the Clean Water Act,,,,,,https://www.pennfuture.org/Blog-Item-2025-Supreme-Court-Environmental-Decisions-Recap-Sackett-v-EPA-and-the-Clean-Water-Act,"Part of their property contained wetlands, which they backfilled during construction. The Environmental Protection Agency (EPA) claimed this action ...",,,,,2025-12-30 17:14:40.938195
,,2025-12-30 18:48:10+00:00,www.facebook.com,"City - In a nationwide effort to reduce exposure to lead in drinking water—and to comply with the Environmental Protection Agency’s Lead and Copper Rule Revisions—the City of Mesa Water Resources department is required to inventory all water service lines to determine if any contain lead or galvanized materials.   While no lead service lines have been found in Mesa, the City remains committed to ensuring the safety and integrity of our water distribution system by verifying all service lines currently classified as “unknown.”  In the coming days, Mesa residents with galvanized pipes or service lines marked as “unknown” will receive a letter with recommended next steps.   For more information, visit https://my.mesaaz.gov/4qhMxDT | Facebook",,,,,,https://www.facebook.com/CityofMesa/photos/in-a-nationwide-effort-to-reduce-exposure-to-lead-in-drinking-waterand-to-comply/1301964715306967/,In a nationwide effort to reduce exposure to lead in drinking water—and to comply with the Environmental Protection Agency’s Lead and Copper Rule Revisions—the City of Mesa Water Resources department...,,https://scontent-iad3-2.xx.fbcdn.net/v/t39.30808-6/607608558_1301964718640300_7600223933497188033_n.jpg?stp=dst-jpg_p173x172_tt6&_nc_cat=105&ccb=1-7&_nc_sid=27488d&_nc_ohc=FxeymgO3FLgQ7kNvwG8tc2i&_nc_oc=Adlc1UKJM9QKY8r4hcSuzaynz8frS7BqUu_zB8-Ccvn2h4H-d8GLQ10ZTKWMkM8YNteHtkdfxlkVoTFifuuo2XFQ&_nc_zt=23&_nc_ht=scontent-iad3-2.xx&_nc_gid=sITgkYAKnquRIRMo_8WCnw&oh=00_AflzlvzC22ODxy8OMqBt7X3nGo78tUTkC-hUdt3__Ls0Wg&oe=695A67D0,,,2025-12-30 20:59:05.922974
,,2025-12-30 18:45:35+00:00,Governor Kathy Hochul,Governor Hochul Celebrates Landmark $3.8 Billion Investment in Water Infrastructure During SFY 2025,,,,,,https://www.governor.ny.gov/news/governor-hochul-celebrates-landmark-38-billion-investment-water-infrastructure-during-sfy-2025,Governor Hochul announced the State’s $3.8 billion investment in local water infrastructure projects during State Fiscal Year 2025.,,https://www.governor.ny.gov/sites/default/files/styles/cover_image_660x400_/public/thumbnails/image/Water_Infrastructure_hero.jpg?h=776e34d3&itok=GchWBaeC,,,2025-12-30 13:59:20.668242
,EPA Rollbacks,2025-12-30 18:43:31+00:00,The Detroit News,'Trump’s EPA' in 2025: A fossil fuel-friendly approach to deregulation,,,,,,https://www.detroitnews.com/story/news/nation/2025/12/30/trumps-epa-2025-fossil-fuel-friendly-approach-deregulation/87961073007/,Experts warn these changes could have lasting impacts on the EPA's effectiveness.,,"https://www.detroitnews.com/gcdn/authoring/authoring-images/2025/10/01/PDTN/86451517007-ap-25273760708492.jpg?crop=5993,3373,x0,y433&width=3200&height=1802&format=pjpg&auto=webp",,,2025-12-30 14:59:13.970840
,Opposition & Allies,2025-12-30 18:31:54+00:00,Democrat and Chronicle,Big steps back on the environment mark turbulent 2025,,,,,,https://www.democratandchronicle.com/story/news/local/blogs/environment/2025/12/30/rochester-reporter-recaps-key-environment-changes-in-2025/87690365007/,"From solar projects to High Falls park plans, here’s how New York’s environment story unfolded in 2025.",,"https://www.democratandchronicle.com/gcdn/authoring/authoring-images/2025/10/21/PROC/86825286007-high-falls-plans.JPG?crop=4031,2269,x0,y377&width=3200&height=1802&format=pjpg&auto=webp",,,2025-12-30 17:59:57.859783
,Costs & Impacts,2025-12-30 18:10:56+00:00,Iowa City Press-Citizen,Chris Jones won’t stop advocating for clean water in Iowa. Here’s why:,,,,,,https://www.press-citizen.com/story/news/2025/12/30/chris-jones-iowa-water-quality/87686429007/,"Iowa's water crisis isn't new, and neither is Chris Jones' voice in the fight. Now he is considering a run for office to challenge the status quo.",,"https://www.press-citizen.com/gcdn/authoring/authoring-images/2025/12/16/PIOC/87793428007-20251210-chris-jones-0017.jpg?crop=5999,3375,x0,y200&width=3200&height=1801&format=pjpg&auto=webp",,,2025-12-30 14:59:13.970840
,,2025-12-30 18:00:58+00:00,CBIA,EPA Compliance First Memo: Key Takeaways for Regulated Entities » CBIA,,,,,,https://www.cbia.com/news/issues-policies/epa-compliance-first-memo,The EPA memo claims to introduce a policy shift: prioritizing timely and effective compliance over punitive enforcement.,,https://www.cbia.com/wp-content/uploads/2023/12/us-epa-building.jpeg,,,2025-12-30 13:59:20.668242
,,2025-12-30 17:43:19+00:00,JD Supra,Adam Kosmicki on Environmental Protection Agency (EPA) | JD Supra,,,,,,https://www.jdsupra.com/authors/adam-kosmicki/environmental-protection-agency-epa/,Latest environmental protection agency (epa) publications by attorney Adam Kosmicki at Husch Blackwell LLP via law news provider JD Supra.,,https://jdsupra-static.s3.amazonaws.com/profile-images/og.15872_4946.jpg,,,2025-12-30 15:13:24.425458
,,2025-12-30 17:42:55+00:00,vineyardgazette.com,Avian Adventures Abound at Christmas Bird Count - The Vineyard Gazette,,,,,,https://vineyardgazette.com/news/2025/12/30/avian-adventures-abound-christmas-bird-count,"The National Audubon Society, the Environmental Protection Agency and the U.S. Fish & Wildlife Service have all used information collected by Vineyard ...",,,,,2025-12-30 16:59:19.193950
,Costs & Impacts,2025-12-30 17:06:37+00:00,Conduit Street,2026 Issue Preview: PFAS,,,,,,https://conduitstreet.mdcounties.org/2025/12/30/2026-issue-preview-pfas/,"Ahead of the 2026 Legislative Session, MACo is previewing some of the major issues likely to gain widespread attention amongst the General Assembly. Among",,https://conduitstreet.mdcounties.org/wp-content/uploads/environment-1-600x600.png?crop=1,,,2025-12-30 15:58:27.654064
,,2025-12-30 17:03:47+00:00,Fred Minnick,Bardstown Bourbon Again Winds ENERGY STAR Certification - Fred Minnick,,,,,,https://www.fredminnick.com/2025/12/30/bardstown-bourbon-again-winds-energy-star-certification/,Bardstown Bourbon Company again earned the U.S. Environmental Protection Agency’s ENERGY STAR certification. ,,https://www.fredminnick.com/wp-content/uploads/2024/08/Bardstown-Bourbon-Co-Origin-Series-High-Wheat-bourbon-bottle-label.jpg,,,2025-12-30 12:59:34.245893
,Opposition & Allies,2025-12-30 17:00:56+00:00,ProPublica,Oregon Faced a Huge Obstacle in Adding Green Energy. Here’s What Changed This Year.,,,,,,https://www.propublica.org/article/oregon-renewable-energy-legislative-progress,Gov. Tina Kotek has been pushing to make progress on the state's renewable energy projects since ProPublica and Oregon Public Broadcasting highlighted obstacles.,,"https://www.propublica.org/wp-content/uploads/2025/12/OG-RQCU4KFX2VHWXCXQBJYJOOQFXU.jpg?resize=2000,1049",,,2025-12-30 12:59:34.245893
,,2025-12-30 16:44:42+00:00,JD Supra,Federal Climate Disclosure Requirements Wane as State Regulations Grow | JD Supra,,,,,,https://www.jdsupra.com/legalnews/federal-climate-disclosure-requirements-1435687/,"Companies’ obligations to identify and disclose climate-related financial risks and climate data have become increasingly complex in recent years,...",,https://jdsupra-static.s3.amazonaws.com/profile-images/og.15872_4946.jpg,,,2025-12-30 12:59:34.245893
,Costs & Impacts,2025-12-30 16:33:27+00:00,Pittsburgh Post-Gazette,"Twenty years into fracking, Pennsylvania has yet to reckon with its radioactive waste",,,,,,https://www.post-gazette.com/business/powersource/2025/12/30/fracking-pennsylvania-radioactive-waste/stories/202512300005,"When John Quigley became secretary of the Pennsylvania Department of Environmental Protection in 2015, he knew that he would be busy trying to keep up...",,https://73f3e7d5672db1849e6c-6434aaf008a29447cc424990bc6a54a7.ssl.cf2.rackcdn.com/stories/202512300005/1140x_a10-7_cTC/20150630giRoyalties_1766513561.jpg,,,2025-12-30 14:59:13.970840
,,2025-12-30 16:26:14+00:00,epa.illinois.gov,Bureau of Safety and Sustainability,,,,,,https://epa.illinois.gov/topics/bureau-of-safety-and-sustainability.html,Skip to main content. Illinois.gov · Agencies · Services · Illinois Environmental Protection Agency. English.,,,,,2025-12-30 12:02:03.038574
,,2025-12-30 16:23:52+00:00,Block Club Chicago,Chicago’s 'Quantum Prairie' Promises New Era Of Great Lakes Technology And Water Use,,,,,,https://blockclubchicago.org/2025/12/30/chicagos-quantum-prairie-promises-new-era-of-great-lakes-technology-and-water-use/,Big technology development aims for zero water waste.,,https://bcc-newspack.s3.amazonaws.com/uploads/2024/07/PsiQuantum_IQMP_1.png,,,2025-12-30 12:02:03.038574
,Costs & Impacts,2025-12-30 16:09:06+00:00,Business Journal Daily | The Youngstown Publishing Company,Plaintiffs Seek Default Judgment in Warren Steel Foreclosure,,,,,,https://businessjournaldaily.com/plaintiffs-seek-default-judgment-in-warren-steel-foreclosure/,"None of the seven defendants have responded to an initial complaint filed earlier this year, documents say.",,https://businessjournaldaily.com/wp-content/uploads/2020/10/p01-rot.jpg,,,2025-12-30 13:59:20.668242
,,2025-12-30 16:03:38+00:00,US EPA,EPA's Role at Moss Landing: Under what authority is EPA overseeing the Fire Response? | US EPA,,,,,,https://www.epa.gov/ca/epas-role-moss-landing-under-what-authority-epa-overseeing-fire-response,Under what authority is EPA overseeing the Moss Landing Vistra Battery Fire Response?,,https://www.epa.gov/sites/all/themes/epa/img/epa-standard-og.jpg,,,2025-12-30 13:13:07.651943
,,2025-12-30 15:49:44+00:00,Performance Racing Industry,Here's Your 2025 PRI and SEMA Advocacy Wrap-Up,,,,,,https://www.performanceracing.com/magazine/industry-news/12-30-2025/heres-your-2025-pri-and-sema-advocacy-wrap,"At the start of the year, PRI and SEMA mapped their advocacy agenda for 2025, and our advocates showed up in force as we elevated to heights previously unseen by the motorsports industry.

Here's your 2026 PRI/SEMA advocacy wrap-up:",,https://www.performanceracing.com/sites/default/files/home/PRI_Web-TradeShow_Homepage.jpg,,,2025-12-30 14:59:13.970840
,EPA Rollbacks,2025-12-30 15:45:23+00:00,www.usnews.com,'Trump's EPA' in 2025: A Fossil Fuel-Friendly Approach to Deregulation,,,,,,https://www.usnews.com/news/politics/articles/2025-12-30/trumps-epa-in-2025-a-fossil-fuel-friendly-approach-to-deregulation,"WASHINGTON (AP) — The Trump administration has transformed the Environmental Protection Agency in its first year, cutting federal limits on air ...",,,,,2025-12-30 11:04:11.564501
,Costs & Impacts,2025-12-30 15:38:11+00:00,www.nytimes.com,Trump Upended the Federal Government. The Full Scope of the Impact Is Still Unclear.,,,,,,https://www.nytimes.com/2025/12/30/us/politics/trump-federal-government-fallout.html,"“E.P.A. is a skeleton of what it once was,” said Francesca Grifo, the former scientific integrity official at the agency, describing it as “an agency ...",,,,,2025-12-30 11:04:11.564501
,,2025-12-30 15:33:21+00:00,www.mass.gov,Healey-Driscoll Administration Energy and Environmental Agency Releases Yearly Report,,,,,,https://www.mass.gov/news/healey-driscoll-administration-energy-and-environmental-agency-releases-yearly-report-0,"Report highlights progress made in energy affordability, protecting nature and climate resilience efforts.",,,,,2025-12-30 12:02:03.038574
,,2025-12-30 15:32:26+00:00,ethanolproducer.com,POET's growth accelerates in 2025 | Ethanol Producer Magazine,,,,,,https://ethanolproducer.com/articles/poets-growth-accelerates-in-2025,"On the policy front, the Environmental Protection Agency (EPA) granted a waiver to allow summertime sales of E15, though POET is still seeking a ...",,,,,2025-12-30 13:59:20.668242
,Opposition & Allies,2025-12-30 15:29:39+00:00,PenBay Pilot,"Maine DEP denies request for stay of Rock Road removal; landowner disputes neighbor's appeal, says Rockport encouraged removal",,,,,,https://www.penbaypilot.com/article/dep-denies-stay-request-rock-road-demolition-landowner-disputes-appeal-says-town-encouraged,"ROCKPORT — On Christmas Eve, Maine Department of Environmental Commissioner Melanie Loyzim told two Rockport landowners that she was denying their petition to put a temporary halt on a state permit allowing their neighbor to demolish a section of the old Rock Road.",,,,,2025-12-30 11:04:11.564501
,,2025-12-30 15:07:11+00:00,NOLA.com,Louisiana has a new law to collect ‘chemtrails’ reports. Hundreds have poured in.,,,,,,https://www.nola.com/news/politics/why-louisiana-is-collecting-reports-of-chemtrails/article_5c676c6b-25dd-4107-b5ca-203fc8962dff.html,"“Our skies belong to We the People, not to corporations, contractors, or agencies experimenting with our weather,” said State Sen. Valarie Hodges, a Denham Springs Republican,",,https://bloximages.newyork1.vip.townnews.com/nola.com/content/tncms/assets/v3/editorial/8/23/82325ef8-43ea-4293-9108-a89763641130/684a1c53e15d8.image.jpg?crop=1763%2C926%2C0%2C124&resize=1200%2C630&order=crop%2Cresize,,,2025-12-30 11:04:11.564501
,Costs & Impacts,2025-12-30 15:04:54+00:00,www.kare11.com,'Trump's EPA' in 2025: A fossil fuel-friendly approach to deregulation | kare11.com,,,,,,https://www.kare11.com/article/syndication/associatedpress/trumps-epa-in-2025-a-fossil-fuel-friendly-approach-to-deregulation/616-a9cfdb94-f6cf-4385-a184-99626321ec74,"The Trump administration has reshaped the Environmental Protection Agency, reversing pollution limits and promoting fossil fuels.",,,,,2025-12-30 11:04:11.564501
,Costs & Impacts,2025-12-30 14:51:22+00:00,OKW News,Administrator Zeldin in The Hill: EPA Highlights How Reducing Food Waste Matters for All Americans - OKW News,,,,,,https://okwnews.com/news/lifestyle/administrator-zeldin-in-the-hill-epa-highlights-how-reducing-food-waste-matters-for-all-americans/,"WASHINGTON – On Christmas Eve, U.S. Environmental Protection Agency (EPA) Administrator [...]",,https://okwnews.com/wp-content/uploads/2025/02/epa_new-e1739491410329.jpg,,,2025-12-30 10:14:56.162115
,EPA Rollbacks,2025-12-30 14:38:41+00:00,Loonie Politics,'Trump’s EPA' in 2025: A fossil fuel-friendly approach to deregulation - Loonie Politics,,,,,,https://looniepolitics.com/trumps-epa-in-2025-a-fossil-fuel-friendly-approach-to-deregulation/,"WASHINGTON (AP) — The Trump administration has transformed the Environmental Protection Agency in its first year, cutting federal limits on air and water pollution and promoting fossil fuels, a metamorphosis that clashes with the agency’s historic mission to protect human health and the environment. The administration says its actions will “unleash” the American economy, but […]",,https://looniepolitics.com/wp-content/uploads/2025/12/5a46820b35f554145d4d63c9c93ae2222f7904de690a3231bee27a31e769efcf.jpg,,,2025-12-30 10:14:56.162115
,Costs & Impacts,2025-12-30 14:27:53+00:00,www.lexology.com,NY DEC Announces Four New PFAS Initiatives - Lexology,,,,,,https://www.lexology.com/library/detail.aspx%3Fg%3D93ea1ece-590c-4e33-9fc7-4c4a311238d1,Other comments suggested DEC delay action and wait for the U.S. Environmental Protection Agency (EPA) to develop national guidance or regulations.,,,,,2025-12-30 13:59:20.668242
,Costs & Impacts,2025-12-30 14:20:53+00:00,Impakter,Year in Review: Trump 2.0 and the Environment,,,,,,https://impakter.com/year-in-review-trump-and-the-environment/,A month-by-month breakdown of President Donald Trump’s impact on environmental policies in the U.S. and across the globe.,,https://fastcdn.impakter.com/wp-content/uploads/2025/12/54932846014_becd05eda2_o.jpg?strip=all&quality=92&webp=92&avif=80,,,2025-12-30 12:59:34.245893
,EPA Rollbacks,2025-12-30 14:20:23+00:00,Ottumwa Courier,'Trump’s EPA' in 2025: A fossil fuel-friendly approach to deregulation,,,,,,https://www.ottumwacourier.com/news/national_news/trump-s-epa-in-2025-a-fossil-fuel-friendly-approach-to-deregulation/article_8ece9d64-f443-5626-8a80-9f7a548a2e6c.html,"The Trump administration has reshaped the Environmental Protection Agency, reversing pollution limits and promoting fossil fuels. Under Administrator Lee Zeldin, the agency has moved quickly to deregulate. He argues the",,https://bloximages.chicago2.vip.townnews.com/ottumwacourier.com/content/tncms/assets/v3/editorial/4/c0/4c0796d3-a63b-5604-baaf-73adbc834be9/6953dd3800615.image.jpg?crop=1763%2C926%2C0%2C124&resize=1200%2C630&order=crop%2Cresize,,,2025-12-30 10:14:56.162115
,,2025-12-30 14:15:32+00:00,SDPB,Rapid City receives nearly $5 million EPA grant for solid waste upgrades,,,,,,https://www.sdpb.org/2025-12-30/rapid-city-receives-over-4-9-million-epa-grant-for-recycling-upgrades,The City plans to use grant money to lower recycling costs and help with landfill capacity.,,https://npr.brightspotcdn.com/dims4/default/56177f8/2147483647/strip/true/crop/640x336+0+72/resize/1200x630!/quality/90/?url=http%3A%2F%2Fnpr-brightspot.s3.amazonaws.com%2F30%2F4c%2F7c37e82144e3919ef0978e566770%2Flucas-hartshorn-and-ria-hannon-walk-around-compacted-bales-of-recyclable-materials-outside-the-facility.jpg,,,2025-12-30 11:04:11.564501
,,2025-12-30 14:11:06+00:00,newsforkids.net,2025 Year in Review: Climate & Environment - News for Kids,,,,,,https://newsforkids.net/articles/2025/12/30/2025-year-in-review-climate-environment/,"Under US President Donald Trump, the Environmental Protection Agency (EPA) has announced a plan that would remove a 2009 decision that says climate ...",,,,,2025-12-30 12:59:34.245893
,,2025-12-30 14:09:23+00:00,Earth911,Can The PACK Act Fix America's Recycling Label Confusion?,,,,,,https://earth911.com/business-policy/can-the-pack-act-fix-americas-recycling-label-confusion/,"Wondering whether a package's chasing arrows symbol means you can actually recycle it? The PACK Act, introduced in December, aims to change that.",,https://earth911.com/wp-content/uploads/2025/12/AdobeStock_1734958278-cropped.jpg,,,2025-12-30 11:04:11.564501
,,2025-12-30 12:41:23+00:00,Detroit Free Press,"She was wrong about RoboCop, right about Project 2025 | Opinion Year in Review",,,,,,https://www.freep.com/story/opinion/columnists/2025/12/30/detroit-robocop-project-2025-whitmer-2028/87853384007/,"It's her job to have opinions, and boy, does she.",,"https://www.freep.com/gcdn/authoring/authoring-images/2025/12/03/PDTF/87591923007-120325-dfp-robo-cop-statue-rg-01.jpg?crop=2399,1350,x0,y0&width=2399&height=1350&format=pjpg&auto=webp",,,2025-12-30 11:04:11.564501
,,2025-12-30 12:37:59+00:00,Carbon Herald,Kansas Steps Onto Carbon Capture Map With EPA Nod For Ethanol Project,,,,,,https://carbonherald.com/kansas-steps-onto-carbon-capture-map-with-epa-nod-for-ethanol-project/,"The EPA has taken a significant step toward bringing carbon capture and storage to Kansas, tentatively approving a plan by ethanol producer PureField Ingredients to permanently store CO2 beneath the state’s central plains.",,https://carbonherald.com/wp-content/uploads/2025/12/getty-images-Dp6juePDgoA-unsplash-scaled.jpg,,,2025-12-30 11:04:11.564501
,,2025-12-30 12:31:57+00:00,www.argusmedia.com,Viewpoint: Tallow flows to pivot on US policy shifts | Latest Market News,,,,,,https://www.argusmedia.com/news-and-insights/latest-market-news/2770569-viewpoint-tallow-flows-to-pivot-on-us-policy-shifts,"Global tallow trade is facing shifting dynamics in 2026, driven by US policy. ",,https://www.argusmedia.com/-/media/project/argusmedia/mainsite/images/14-generic-hero-banners/herobanner_1600x530_generic-c.jpg?h=530&iar=0&w=1600&rev=2cf023b4e0484c1bb091b9f72dbf7771&hash=72DBDFEBEF6EE62E751AB5DD2221C77E,,,2025-12-30 08:13:41.430911
,Costs & Impacts,2025-12-30 12:31:13+00:00,www.bloomberg.com,The Lows of the Trump Administration's Climate Onslaught - Bloomberg,,,,,,https://www.bloomberg.com/graphics/2025-opinion-trump-climate-rollback,"... Environmental Protection Agency in 1970. Fifty-five years later, President Donald Trump's EPA has all but dropped “Environmental Protection” from ...",,,,,2025-12-30 08:13:41.430911
