id,name,published,outlet,title,authors,category,market,categoryorder,articleorder,url,description,text,image,error,sentiment,firstEyes
,,2025-12-04 17:05:39+00:00,The Allegheny Front,"Ohio landfills take drilling waste, but don’t track or test much of it",,,,,,https://www.alleghenyfront.org/ohio-landfills-fracking-waste-radioactivity/,"Our investigation reveals the lack of oversight of drilling waste moving through Ohio landfills, potentially putting waterways at risk.",,https://www.alleghenyfront.org/wp-content/uploads/2025/12/IWS_Apex-Landfill_flags.jpg,,,2025-12-04 17:03:34.729093
,Costs & Impacts,2025-12-04 17:05:32+00:00,Block Club Chicago,Quantum Developers' Environmental Cleanup Plans For Old South Works Steel Site Approved By State,,,,,,https://blockclubchicago.org/2025/12/04/quantum-developers-environmental-cleanup-plans-for-old-south-works-steel-site-approved-by-state/,Plans to remediate pollution at the lakefront megadevelopment gained conditional approval from the Illinois Environmental Protection Agency this week.,,https://bcc-newspack.s3.amazonaws.com/uploads/2024/07/072524-PsiQuantum-South-Works-Colin-Boyle-1462.jpg,,,2025-12-04 13:06:26.987998
,EPA Rollbacks,2025-12-04 17:02:52+00:00,Adirondack Almanack,EPA rollback of air pollution standards threatens Adirondacks - Adirondack Almanack,,,,,,https://www.adirondackexplorer.org/environment/epa-rollback-of-air-pollution-standards-threatens-adirondacks/,Looser EPA regulations create the potential for harm to the environment of the Adirondacks as well as public health.,,https://i0.wp.com/www.adirondackexplorer.org/wp-content/uploads/2025/12/2007252916_e87966bc77_o.jpg?fit=854%2C570&ssl=1,,,2025-12-04 13:06:26.987998
,Costs & Impacts,2025-12-04 17:01:13+00:00,Bethesda Magazine,"County condemns Wheaton apartment building, Safeway after massive water leak",,,,,,https://bethesdamagazine.com/2025/12/04/condemned-wheaton-apartment-safeway-water-leak/,Plus: Former Biden EPA official takes over MoCo department; MCPS superintendent apologizes for weather-related delay Tuesday,,https://assets.bethesdamagazine.com/wp-content/uploads/2025/01/Morning-Notes_BT-1-scaled-e1736198242232.jpg,,,2025-12-04 13:06:26.987998
,,2025-12-04 16:51:37+00:00,public-inspection.federalregister.gov,6560-50-P ENVIRONMENTAL PROTECTION AGENCY 40 CFR Part 63 [EPA–HQ–OAR ...,,,,,,https://public-inspection.federalregister.gov/2025-22034.pdf,"Why is the EPA rescinding the IFR? On July 8, 2025, the Agency issued an IFR that extended the compliance dates for fenceline monitoring, PQBS MACT ...",,,,,2025-12-04 16:03:34.293631
,Costs & Impacts,2025-12-04 16:50:55+00:00,Center for Biological Diversity,"EPA, MAHA Commission Urged to Assess Christmas Tree Pesticides Risks to Children",,,,,,https://biologicaldiversity.org/w/news/press-releases/epa-maha-commission-urged-to-assess-christmas-tree-pesticides-risks-to-children-2025-12-04/,"The Center for Biological Diversity and Alliance of Nurses for Healthy Environments petitioned the Environmental Protection Agency and President’s Make America Healthy Again Commission today to address the health risks posed by the heavy use of toxic pesticides on Christmas trees.

Tree farms in Oregon, Michigan, Pennsylvania, California, Florida and Texas that produce nearly two-thirds of the Christmas trees harvested in the U.S. have reported spraying 270,000 pounds of pesticides each year.

Many of these pesticides include products known to be potent endocrine disruptors, carcinogens and neurotoxins that impede children’s brain development. The pesticides are chlorothalonil, simazine, glyphosate, hexazinone, carbaryl, chlorpyrifos and dimethoate.",,https://s3-us-west-2.amazonaws.com/s3-wagtail.biolgicaldiversity.org/images/RSChristmas-trees-Monongahela-JW-Glass-FPWC.original.jpg,,,2025-12-04 13:06:26.987998
,,2025-12-04 16:45:36+00:00,W&M News,‘We hacked it’: William & Mary students helped restore Virginia’s peregrine falcon population,,,,,,https://news.wm.edu/2025/12/04/we-hacked-it-william-mary-students-helped-restore-virginias-peregrine-falcon-population/,"Amanda Allen Beheler ’92, M.A. ’95 will never forget the first time she saw a peregrine falcon fly. It’s etched on her soul, she says.  She was one of nearly 20 William & Mary undergraduate students who took part in the Eastern Peregrine Falcon Recovery Team in the 1970s-1990s. Assembled 50 years ago, this group […]",,https://wmit-news-prod.s3.amazonaws.com/wp-content/uploads/2025/12/03163329/falcon-story-cover-photo-e1764856368733-1080x720.jpg,,,2025-12-04 13:06:26.987998
,Opposition & Allies,2025-12-04 16:26:24+00:00,Planet Detroit,Whitmer joins Democratic governors calling on EPA to monitor microplastics in drinking water,,,,,,https://planetdetroit.org/2025/12/governors-petition-epa-microplastics/,"Seven governors, including Michigan's, request for the EPA to add microplastics to drinking water monitoring.",,https://planetdetroit.org/wp-content/uploads/2025/06/iStock-511928310.jpg,,,2025-12-04 12:02:12.134193
,,2025-12-04 16:08:45+00:00,KWWL,Roundup safety paper retracted,,,,,,https://www.kwwl.com/news/roundup-safety-paper-retracted/article_cfeffdf6-d298-4bc1-987a-a23f40f1fce4.html,"[KWWL] -- A scientific journal is retracting a paper regarding the safety of the herbicide Roundup and its key ingredient, glyphosate.",,https://bloximages.newyork1.vip.townnews.com/kwwl.com/content/tncms/assets/v3/editorial/a/4b/a4beff49-ee4a-477b-a3cc-03b0333236bf/6930fafcc7fb1.image.png?crop=774%2C406%2C0%2C317,,,2025-12-04 13:06:26.987998
,,2025-12-04 16:05:41+00:00,www.linkedin.com,"Prepare and be aware. Flooding can affect you. 

We work 24/7 to help you prepare and be aware of flooding to reduce the impact it can have on your lives, homes and journeys. 

Three simple things… | Scottish Environment Protection Agency",,,,,,https://www.linkedin.com/posts/scottish-environment-protection-agency_prepare-and-be-aware-flooding-can-affect-activity-7402376554670104577-UAa5,"Prepare and be aware. Flooding can affect you. 

We work 24/7 to help you prepare and be aware of flooding to reduce the impact it can have on your lives, homes and journeys. 

Three simple things you can do are: 

✔ Check the Scottish Flood Forecast for a 3-day outlook on where flooding might happen 
✔ Sign up to Floodline for local phone or email messages 
✔ Follow us on social media for regular updates  

Find out more: 
https://lnkd.in/e93y_vzC",,https://dms.licdn.com/playlist/vid/v2/D4E05AQEwv7E4t-xlfg/thumbnail-with-play-button-overlay-high/B4EZrqGPOVIQDQ-/0/1764864096767?e=2147483647&v=beta&t=t11Z3O6OLWitsjF526wO0UXvz3Kj63prWXh9kpGVqDE,,,2025-12-04 16:03:34.293631
,,2025-12-04 16:02:04+00:00,www.epa.ie,Compliance and Enforcement Publications,,,,,,https://www.epa.ie/publications/compliance--enforcement/88/,EPA published reports and guidance documents on Compliance and Enforcement.,,,,,2025-12-04 15:02:43.036965
,Costs & Impacts,2025-12-04 15:41:16+00:00,The New Lede,"Citing ""serious ethical concerns,"" journal retracts key Monsanto Roundup safety study - The New Lede",,,,,,https://www.thenewlede.org/2025/12/citing-serious-ethical-concerns-journal-retracts-key-monsanto-roundup-safety-study/,The journal Regulatory Toxicology and Pharmacology has formally retracted a sweeping scientific paper published in the year 2000 that became a key defense for Monsanto’s claim that Roundup herbicide and its active ingredient glyphosate don’t cause cancer.,,https://www.thenewlede.org/wp-content/uploads/2022/04/Monsanto-new-1024x680.png,,,2025-12-04 13:06:26.987998
,,2025-12-04 15:39:12+00:00,Yale Climate Connections,The EPA let companies estimate their own pollution levels. We discovered real emissions are far worse. » Yale Climate Connections,,,,,,https://yaleclimateconnections.org/2025/12/the-epa-let-companies-estimate-their-own-pollution-levels-we-discovered-real-emissions-are-far-worse/,"'The more we learned, the more afraid we were.'",,https://i0.wp.com/yaleclimateconnections.org/wp-content/uploads/2025/11/1125_steelplant_1600.jpg?fit=1600%2C900&ssl=1,,,2025-12-04 11:11:55.571604
,,2025-12-04 15:19:38+00:00,www.michigan.gov,10 DTMB-managed buildings achieve ENERGY STAR Rated High Performer status,,,,,,https://www.michigan.gov/dtmb/about/newsroom/all-news/2025/12/04/10-dtmb-managed-buildings-achieve-energy-star-rated-high-performer-status,"ENERGY STAR is an Environmental Protection Agency and Department of Energy funded program that assesses the energy efficiency of products, homes ...",,https://www.michigan.gov/dtmb/-/media/Project/Websites/SOM/Images/Global-SOM/Michigangov-OG-Image.png?rev=04d34972184442b1bd24b5efb46cd150&hash=C152E86FFAC5549EEFF975F2B3C92CDB,,,2025-12-04 12:02:12.134193
,Costs & Impacts,2025-12-04 15:15:52+00:00,Oak Ridger,Must the Oak Ridge Reservation remain an EPA Superfund site until the 2050s?,,,,,,https://www.oakridger.com/story/news/local/2025/12/04/must-the-oak-ridge-reservation-remain-an-epa-superfund-site-until-the-2050s/86734575007/,Oak Ridge Office of Environmental Management Manager Erik Olds hopes to convince the EPA to delist Oak Ridge as a Superfund site.,,"https://www.oakridger.com/gcdn/authoring/authoring-images/2025/12/03/NOAK/87585153007-oak-ridge-reservation-with-sites-copy.jpg?crop=1768,994,x0,y0&width=1768&height=994&format=pjpg&auto=webp",,,2025-12-04 11:11:55.571604
,,2025-12-04 14:56:12+00:00,environment.gov.pk,Pakistan Environmental Protection Agency,,,,,,https://environment.gov.pk/NewsDetail/ZTExZDBlY2YtOGE0Ny00N2M5LWE5ZDctMmIzN2M4ZTI5OTVj,Pak-EPA Conducts Vehicular Emission Monitoring Drive in Collaboration with Islamabad Traffic Police on 30th October 2025. In pursuance of its mandate ...,,,,,2025-12-04 14:02:28.853560
,,2025-12-04 14:55:17+00:00,www.capecoral.gov,City of Cape Coral Awarded $6.5 Million for North 1 East Reclaimed Water Extension,,,,,,https://www.capecoral.gov/newdetail_T3_R1646.php,The City of Cape Coral has been awarded $6.5 million from the Governor's Office through the Florida Department of Environmental Protection (DEP) ...,,,,,2025-12-04 13:06:26.987998
,Clean Air & Water,2025-12-04 14:41:09+00:00,Clean Air Task Force,New CATF analysis highlights Brazil’s largest opportunities to cut waste methane ,,,,,,https://www.catf.us/2025/12/new-catf-analysis-highlights-brazils-largest-opportunities-cut-waste-methane/,"At COP30, the Government of Brazil announced the launch of a process to develop a first-of-its-kind national initiative to detect and mitigate methane emissions from the country’s waste sector.",,https://cdn.catf.us/wp-content/uploads/2025/12/03133426/cop30-brazil-wastemethane.jpg,,,2025-12-04 14:02:28.853560
,Opposition & Allies,2025-12-04 14:28:14+00:00,Governor of California,"Governor Newsom advocates for LA fire survivors in Washington, urges Trump to uphold his commitments to help LA | Governor of California",,,,,,https://www.gov.ca.gov/2025/12/04/governor-newsom-advocates-for-la-fire-survivors-in-washington-urges-trump-to-uphold-his-commitments-to-help-la/,The partnership between the state and the U.S. Army Corps of Engineers and Environmental Protection Agency has been historic. But after cleanup ...,,https://www.gov.ca.gov/wp-content/uploads/2025/12/Governor-Newsom-advocates-for-LA-fire-survivors-in-Washington-urges-Trump-to-uphold-his-commitments-to-help-LA-SEO-GFX-v3.png,,,2025-12-04 13:06:26.987998
,Opposition & Allies,2025-12-04 14:01:02+00:00,SEJ,"""EPA Staffers Challenge Their Terminations Over ‘Dissent’ Letter""",,,,,,https://www.sej.org/headlines/epa-staffers-challenge-their-terminations-over-dissent-letter,"""Six staffers who the Trump administration fired after they signed a “Declaration of Dissent” letter have filed claims with the Merit Systems Protection Board, according to Public Employees for Environmental Responsibility (PEER), which is helping to represent the ex-employees.""",,https://www.sej.org/sites/default/files/default_images/logo200x200_3.png,,,2025-12-04 11:11:55.571604
,Clean Air & Water,2025-12-04 13:37:11+00:00,Barnstable County,First in Massachusetts: Barnstable County Water Quality Laboratory Pioneers Automated Bacterial Testing - Barnstable County,,,,,,https://www.capecod.gov/2025/12/03/a-new-era-of-water-testing-automated-tecta-system-debuts-at-barnstable-county-lab/,"Visit this page on the Barnstable County, Cape Cod website for more information about First in Massachusetts: Barnstable County Water Quality Laboratory Pioneers Automated Bacterial Testing.",,https://www.capecod.gov/wp-content/uploads/2025/12/IMG_0156.jpg,,,2025-12-04 11:11:55.571604
,,2025-12-04 13:24:10+00:00,foundation.myniu.com,"Honor Morgan, '23, Keeps Public Informed at US Environmental Protection Agency By Tony Scott",,,,,,https://foundation.myniu.com/article.html%3Faid%3D2915,"Honor Morgan, '23, is a public affairs specialist with the U.S. EPA. (Photo credit: Honor Morgan). Honor Morgan, '23, has dedicated her life to ...",,,,,2025-12-04 11:11:55.571604
,Costs & Impacts,2025-12-04 12:52:35+00:00,AgriNews,"EPA, Army Corps unveil WOTUS proposal",,,,,,https://www.agrinews-pubs.com/news/science/2025/12/04/epa-army-corps-unveil-wotus-proposal/,The U.S. Environmental Protection Agency and U.S. Army Corps of Engineers released a proposed rule revising the regulatory definition of “waters of the U.S.” intended to resolve the regulatory uncertainty regarding the scope of federal jurisdiction.,,https://www.agrinews-pubs.com/resizer/Ij32dgxU6MdH-T9Eja92QkUYsR4=/1200x630/filters:format(jpg):quality(70)/cloudfront-us-east-1.images.arcpublishing.com/shawmedia/KVD5RX7JQZDVFK56LD55AONSLU.jpg,,,2025-12-04 11:11:55.571604
,Costs & Impacts,2025-12-04 11:04:59+00:00,Beyond Pesticides Daily News Blog,"At Odds with Intl Regulatory Bodies, EPA Defines Away PFAS Problem, Allows Widespread Contamination - Beyond Pesticides Daily News Blog",,,,,,https://beyondpesticides.org/dailynewsblog/2025/12/at-odds-with-int-regulatory-bodies-epa-defines-away-pfas-problem-allows-widespread-contamination/,"The definition of PFAS used by EPA continues to threaten public health, as it ignores peer-reviewed literature and scientific input.",,https://beyondpesticides.org/dailynewsblog/wp-content/uploads/2025/12/DN-12.4.25.jpg,,,2025-12-04 07:00:18.210907
,,2025-12-04 11:03:24+00:00,www.nyc.gov,New York City Department of Environmental Protection - NYC.gov,,,,,,https://www.nyc.gov/assets/dep/downloads/pdf/about/filtration-avoidance-determination/fad_4.6_crep-csbi_metrics_11-18.pdf,New York City Department of Environmental Protection. Bureau of Water Supply. Stream Management Program. Proposed Metrics for Evaluation of the ...,,,,,2025-12-04 11:11:55.571604
,Costs & Impacts,2025-12-04 10:29:19+00:00,www.americanprogress.org,Clean Drinking Water for Millions of People at Risk as Trump Administration Targets ...,,,,,,https://www.americanprogress.org/article/clean-drinking-water-for-millions-of-people-at-risk-as-trump-administration-targets-national-monuments/,"Tackling Climate Change and Environmental Injustice, Biden Administration, Conservation, Environmental ... U.S. Environmental Protection Agency, “Basic ...",,,,,2025-12-04 11:11:55.571604
,,2025-12-04 10:10:21+00:00,www.epa.ie,Bailieboro Audit 07/10/2025,,,,,,https://www.epa.ie/publications/compliance--enforcement/drinking-water/audit-reports/cavan/bailieboro-audit-07102025.php,Report of an audit carried out at Bailieboro public drinking water supply Co. Cavan on 07/10/2025.,,,,,2025-12-04 07:59:46.680573
,Costs & Impacts,2025-12-04 08:26:27+00:00,R Street Institute,"If States Replace the Federal GHGRP, New Programs Will Be More Expensive - R Street Institute",,,,,,https://www.rstreet.org/commentary/if-states-replace-the-federal-ghgrp-new-programs-will-be-more-expensive/,"With the proposed repeal of the federal Greenhouse Gas Reporting Program (GHGRP), it is possible that states will adopt their own reporting programs to replace it. A small number of state-level greenhouse gas (GHG) reporting programs exist currently, but more are emerging in response to a potential repeal of the federal GHGRP. This analysis compares...",,https://www.rstreet.org/wp-content/uploads/2020/02/Coal-Plant-Power-Energy.jpg,,,2025-12-04 12:02:12.134193
,,2025-12-04 07:58:14+00:00,WTOP News,"Virginia joins Chesapeake Bay states, DC in new watershed agreement - WTOP News",,,,,,https://wtop.com/maryland/2025/12/virginia-joins-chesapeake-bay-states-dc-in-new-watershed-agreement/,"Governors from the Chesapeake Bay watershed states enacted a new, 15-year agreement to reduce pollution, build habitats and protect the Bay.",,https://wtop.com/wp-content/uploads/2025/12/WatershedAgreement.jpg,,,2025-12-04 11:11:55.571604
,,2025-12-04 07:02:17+00:00,www.nytimes.com,Environmentally Friendly Coffee - The New York Times,,,,,,https://www.nytimes.com/2025/12/03/climate/climate-change-coffee.html,Environmental Protection Agency: The agency announced it would delay a Biden-era requirement that the oil and gas industry limit emissions of ...,,,,,2025-12-04 04:59:01.772142
,Costs & Impacts,2025-12-04 06:30:03+00:00,Engadget,"US Department of Transportation doubles down on gas, cuts fuel efficiency standards",,,,,,https://www.engadget.com/transportation/us-department-of-transportation-doubles-down-on-gas-cuts-fuel-efficiency-standards-234542939.html,The Department of Transportation under President Donald Trump is moving to reverse more of the climate policies that had been enacted by President Joe Biden.,,https://s.yimg.com/ny/api/res/1.2/Mq2d.JaDrm_dVPTcz3cflA--/YXBwaWQ9aGlnaGxhbmRlcjt3PTEyMDA7aD04MDA-/https://d29szjachogqwa.cloudfront.net/images/2025-12/2e2ee43a-e067-4274-8813-355b98019ea8,,,2025-12-04 02:01:26.842738
,Costs & Impacts,2025-12-04 05:47:09+00:00,www.washingtonpost.com,Trump plans to weaken fuel efficiency rules for cars and trucks - The Washington Post,,,,,,https://www.washingtonpost.com/climate-environment/2025/12/03/fuel-efficiency-rules-rollback/,Trump also said his administration will “cancel” Environmental Protection Agency rules that limited greenhouse gas pollution from vehicles' tailpipes.,,,,,2025-12-04 02:01:26.842738
,Opposition & Allies,2025-12-04 04:29:20+00:00,Common Dreams,'Truth Is Not a Fireable Offense': Former EPA Staffers File Legal Challenge Over Terminations by Trump | Common Dreams,,,,,,https://www.commondreams.org/news/epa-employees-fired-dissent-challenge,"Six former EPA employees are challenging their terminations for signing a letter criticizing the policies of its administrator, Lee Zeldin. ""Truth is not a fireable offense,"" they said.",,https://www.commondreams.org/media-library/image.jpg?id=62270261&width=1200&height=600&coordinates=0%2C167%2C0%2C167,,,2025-12-04 01:00:41.273103
,,2025-12-04 04:22:10+00:00,today.westlaw.com,Fired employees file First Amendment lawsuit against EPA | Business Information & News,,,,,,https://today.westlaw.com/Document/I9b462f90d07311f0ba528feedf5dc316/View/FullText.html%3FtransitionType%3DCategoryPageItem%26contextData%3D(sc.Default),"... EPA employees,. WASHINGTON, Dec 3 (Reuters) - Six former Environmental Protection Agency employees on Wednesday filed a First Amendment legal ...",,,,,2025-12-04 01:00:41.273103
,,2025-12-04 04:11:04+00:00,Chemical & Engineering News,"For chemical companies, Supreme Court tariff case goes beyond imports",,,,,,https://cen.acs.org/policy/litigation/chemical-companies-Supreme-Court-tariff/103/web/2025/12,The high court’s decision could create new routes for action on climate change or stymie regulation,,"https://s7d1.scene7.com/is/image/CENODS/Impacts-of-the-Supreme-Court-tariff-case-for-the-chemical-sector---254031-1:Widescreen?$responsive$&qlt=90,0&resMode=sharp2&fmt=webp",,,2025-12-04 02:01:26.842738
,Costs & Impacts,2025-12-04 04:06:12+00:00,The Colorado Sun,Activists capturing and burning methane at an abandoned Colorado coal mine as a “macro solution” for the climate,,,,,,https://coloradosun.com/2025/12/03/paonia-methane-flaring-project/,The methane destruction project above Paonia could be a global model for reducing emissions of a potent greenhouse gas,,https://i0.wp.com/newspack-coloradosun.s3.amazonaws.com/wp-content/uploads/2025/12/IMG_2879-scaled.jpg?fit=2560%2C1920&quality=85&ssl=1,,,2025-12-04 02:01:26.842738
,,2025-12-04 04:03:13+00:00,Sports Radio KWSN,Fired employees file First Amendment lawsuit against EPA,,,,,,https://kwsn.com/2025/12/03/fired-employees-file-first-amendment-lawsuit-against-epa/,"By Valerie Volcovici WASHINGTON, Dec 3 (Reuters) - Six former Environmental Protection Agency employees on Wednesday filed a First Amendment legal challenge against EPA Administrator Lee Zeldin for terminating their employment because they protested wh...",,https://storage.googleapis.com/media.mwcradio.com/mimesis/2025-12/03/2025-12-03T180957Z_2_LYNXMPELB214D_RTROPTP_3_USA-EPA-WORKFORCE.JPG,,,2025-12-04 07:59:46.680573
,Costs & Impacts,2025-12-04 03:42:19+00:00,washingtonstand.com,"Law Firms, Enviro Groups Got $20 Million in ‘Sue and Settle’ Schemes with EPA",,,,,,https://washingtonstand.com/article/law-firms-enviro-groups-got-20-million-in-sue-and-settle-schemes-with-epa,Law firms representing radical environmental activist groups like the Sierra Club and Center for Biological Diversity reaped more than $20 million in tax-funded,,https://www.frc.org/img/domain/frc/item/AE25L15_NORMAL.jpg,,,2025-12-04 01:00:41.273103
,Costs & Impacts,2025-12-04 02:45:35+00:00,ABC7 Chicago,"Microplastics in brains, bloodstreams: I-Team investigates contamination, efforts to measure risks",,,,,,https://abc7chicago.com/post/microplastics-found-brains-bloodstreams-abc7-team-investigates-plastic-contamination-efforts-measure-risks-chicago/18247519/,The ABC7 I-Team is tracking a new and major push to understand the level of microplastics in drinking water in Chicago and throughout the country.,,https://cdn.abcotvs.com/dip/images/18247546_120325-wls-rivera-iteam-microplastics-6p-vid.jpg?w=1600,,,2025-12-04 01:00:41.273103
,,2025-12-04 02:37:14+00:00,Government Accountability Project,Government Accountability Project Whistleblower Disclosures Featured in Motion to Intervene in Federal Consent Decree with Norfolk Southern,,,,,,https://whistleblower.org/press/government-accountability-project-whistleblower-disclosures-featured-in-motion-to-intervene-in-federal-consent-decree-with-norfolk-southern/,"Today, Government Accountability Project announced that critical whistleblower evidence documenting ongoing toxic contamination in East Palestine, Ohio is now—for the first time—before a federal judge.",,https://whistleblower.org/wp-content/uploads/2024/06/shutterstock_2264155081-1.jpg,,,2025-12-04 01:00:41.273103
,Costs & Impacts,2025-12-04 02:07:20+00:00,US EPA,"Alcoa/Lavaca Bay Superfund Site Community Meeting, Dec. 2025 | US EPA",,,,,,https://www.epa.gov/publicnotices/alcoalavaca-bay-superfund-site-community-meeting-dec-2025,A community meeting to provide information about the Alcoa/Lavaca Bay Superfund site. EPA and Alcoa representatives will make presentations and answer questions.,,https://www.epa.gov/system/files/images/2022-03/epa-standard-twitter.jpg,,,2025-12-04 03:00:30.956042
,Clean Air & Water,2025-12-04 01:41:51+00:00,insideepa.com,Login Redirect Cookie - InsideEPA.com |,,,,,,https://insideepa.com/sites/insideepa.com/files/documents/2025/dec/epa2025_2109b.pdf,Inside EPA is a subscription-fee-based daily digital news service from Inside Washington Publishers. SITE LICENSES. Economical site license packages ...,,,,,2025-12-03 23:59:47.968120
,Costs & Impacts,2025-12-04 00:12:53+00:00,nevadacurrent.com,Grocery chain fined for marketing pesticide as a disinfectant - Nevada Current,,,,,,https://nevadacurrent.com/briefs/grocery-chain-fined-for-marketing-pesticide-as-a-disinfectant/,"In a release issued Tuesday, the EPA said their findings were based on inspections performed by the federal agency and California Department of ...",,,,,2025-12-03 20:59:48.145501
,,2025-12-03 23:57:10+00:00,Sanford School of Public Policy,A Conversation with the 16th Administrator of the EPA Michael Regan [Podcast] | Sanford School of Public Policy,,,,,,https://sanford.duke.edu/story/conversation-16th-administrator-epa-michael-regan-podcast/,"Michael Regan recently served as the 16th Administrator of the EPA. A Distinguished Fellow at Polis, he joins interim Dean Manoj Mohanan on the Policy 360 podcast.",,https://sanford.duke.edu/sites/default/files/styles/small_2_5_1/public/20251121_regan_michael3.jpg?h=44999749&itok=vKcdH5mn,,,2025-12-03 20:59:48.145501
,Costs & Impacts,2025-12-03 23:34:57+00:00,Government Executive,EPA workers fired over dissent letter appeal to MSPB,,,,,,https://www.govexec.com/workforce/2025/12/epa-workers-fired-over-dissent-letter-appeal-mspb/409919/,"Only a fraction of the more than 130 employees who signed an open letter to EPA Administrator Lee Zeldin accusing the Trump administration of “recklessly undermining” the agency’s mission were ultimately terminated, purportedly because they worked in “public-facing” roles.",,https://cdn.govexec.com/media/img/cd/2025/12/03/12032025EPA/open-graph.jpg,,,2025-12-03 19:05:58.367408
