id,name,published,outlet,title,authors,category,market,categoryorder,articleorder,url,description,text,image,error,sentiment,firstEyes
,Opposition & Allies,2025-12-05 11:31:50+00:00,www.washingtonpost.com,A retracted study on Roundup reignites debate over its potential cancer risk,,,,,,https://www.washingtonpost.com/climate-environment/2025/12/05/glyphosate-roundup-cancer-bayer-study/,"The Environmental Protection Agency, which is slated to announce an updated human health risk assessment for glyphosate next year, cited the paper ...",,,,,2025-12-05 07:00:50.967121
,Costs & Impacts,2025-12-05 10:21:43+00:00,The Colorado Sun,"Texas company Enterprise broke federal rules in cleanup of Colorado gas spill, EPA says",,,,,,https://coloradosun.com/2025/12/05/texas-company-federal-rules-cleanup-colorado-gas-spill/,"Federal officials cited Enterprise Products for improperly managing hazardous materials while cleaning up a 97,000-gallon gasoline spill.",,https://i0.wp.com/newspack-coloradosun.s3.amazonaws.com/wp-content/uploads/2025/05/Remediation-Site-JWS-May-2025-0110-scaled.jpg?fit=2560%2C1707&quality=85&ssl=1,,,2025-12-05 06:01:43.665773
,Costs & Impacts,2025-12-05 05:49:34+00:00,eponline.com,EPA Fines Grocery Chains for Selling Illegal Disinfectants in Three States,,,,,,https://eponline.com/articles/2025/12/04/epa-fines-grocery-chains-for-selling-illegal-disinfectants-in-three-states.aspx,"Unregistered disinfectants removed from shelves. EPA investigators, working with the California Department of Pesticide Regulation, found that El ...",,,,,2025-12-05 06:01:43.665773
,Costs & Impacts,2025-12-05 05:39:10+00:00,Char-Koosta News,EPA’s New WOTUS Definition Further Threatens Montana’s Water,,,,,,https://www.charkoosta.com/news/epa-s-new-wotus-definition-further-threatens-montana-s-water/article_f09c866c-826a-484f-a70b-d398cc2faf54.html,"Last week, the Trump administration’s Environmental Protection Agency (EPA) published a proposal to revise the definition of “waters of the United States” (WOTUS), further undermining clean water protections and threatening",,https://bloximages.newyork1.vip.townnews.com/charkoosta.com/content/tncms/assets/v3/editorial/f/09/f09c866c-826a-484f-a70b-d398cc2faf54/6930a261de687.preview.png?crop=1081%2C568%2C0%2C256,,,2025-12-05 06:01:43.665773
,Opposition & Allies,2025-12-05 05:22:36+00:00,Spokesman.com,Former EPA lawyer based in Seattle fights Trump-related firing,,,,,,https://www.spokesman.com/stories/2025/dec/04/former-epa-lawyer-based-in-seattle-fights-trump-re/,A former U.S. Environmental Protection Agency attorney who was based in Seattle is among those challenging their firings for signing a letter critical of the Trump administration.,,https://thumb.spokesman.com/l2sMHX5ZvY-IivJJOF8GNS33NSY=/600x0/media.spokesman.com/graphics/2020/08/sr_placeholder.png,,,2025-12-05 06:01:43.665773
,Clean Air & Water,2025-12-05 02:04:39+00:00,US EPA,Region 6 Tribal Clean Air Act Funding - Fiscal Year 2026 | US EPA,,,,,,https://www.epa.gov/tribal/region-6-tribal-clean-air-act-funding-fiscal-year-2026,Region 6 Tribal Clean Air Act Guidance,,https://www.epa.gov/sites/all/themes/epa/img/epa-standard-og.jpg,,,2025-12-05 06:01:43.665773
,,2025-12-05 02:04:39+00:00,US EPA,"Calendar for Paige Hallen Hanson, Chief Financial Officer and Chief Administrative Officer | US EPA",,,,,,https://www.epa.gov/senior-leaders-calendars/calendar-paige-hallen-hanson-chief-financial-officer-and-chief,"View the simplified senior leader calendar for Paige Hallen Hanson, Chief Financial Officer",,https://www.epa.gov/sites/all/themes/epa/img/epa-standard-og.jpg,,,2025-12-05 00:58:28.283922
,,2025-12-05 00:49:28+00:00,CNBC,Apple announces departure of general counsel and policy chief,,,,,,https://www.cnbc.com/2025/12/04/apple-announces-departure-lisa-jackson-kate-adams.html,The two executives reported to Apple CEO Tim Cook and are the latest members of senior leadership to exit the iPhone maker. ,,https://image.cnbcfm.com/api/v1/image/108236957-1764884536150-gettyimages-849713784-TECHCRUNCH_SF.jpeg?v=1764884591&w=1920&h=1080,,,2025-12-04 21:00:50.645838
,Costs & Impacts,2025-12-05 00:18:59+00:00,WHYY,Public health advocates say Trump rollbacks would increase Philly air pollution,,,,,,https://whyy.org/articles/trump-vehicle-mileage-rules-air-quality-emissions-philly/,The Trump administration said it wants to make cars more affordable.,,https://whyy.org/wp-content/uploads/2025/04/traffic-italian-market-philly-2025-04-29.jpg,,,2025-12-04 21:00:50.645838
,,2025-12-04 23:36:56+00:00,www.nytimes.com,Climate Shift Upends Atlantic Seaweed: One Massive Patch Grows as Another Vanishes,,,,,,https://www.nytimes.com/2025/12/04/climate/atlantic-seaweed-sargassum-climate.html,Environmental Protection Agency: The agency announced it would delay a ... Reshaping U.S. Environmental Policy: The Trump administration ...,,,,,2025-12-04 19:04:01.965850
,Costs & Impacts,2025-12-04 23:36:38+00:00,www.sullivan.senate.gov,Senate Unanimously Passes Sullivan-Whitehouse Legislation to Reauthorize Marine Debris Grant Programs | U.S. Senator Dan Sullivan of Alaska,,,,,,https://www.sullivan.senate.gov/newsroom/press-releases/senate-unanimously-passes-sullivan-whitehouse-legislation-to-reauthorize-marine-debris-grant-programs,The Official U.S. Senate website of Senator Dan Sullivan of Alaska,,https://www.sullivan.senate.gov/themes/sullivan/images/sharelogo.jpg,,,2025-12-04 19:04:01.965850
,,2025-12-04 23:33:06+00:00,US EPA,Fraudcast: Social Media Scams | US EPA,,,,,,https://www.epa.gov/office-inspector-general/fraudcast-social-media-scams,Podcast: Fraudcast: Social Media Scams,,https://www.epa.gov/sites/all/themes/epa/img/epa-standard-og.jpg,,,2025-12-04 21:00:50.645838
,,2025-12-04 23:21:54+00:00,Office of Advocacy,EPA and Army Corps Announce December 12 Public Hearing on Proposed WOTUS Revisions,,,,,,https://advocacy.sba.gov/2025/12/04/epa-and-army-corps-announce-december-12-public-hearing-on-proposed-wotus-revisions/,"What: The U.S. Environmental Protection Agency (EPA) and the United States Army Corps of Engineers (Corps) announced they will hold a public meeting in Bismark, ND on the revised definition of “waters of the United States” (WOTUS).  Why: WOTUS is use",,https://advocacy.sba.gov/wp-content/uploads/2018/11/agency_EPA_environmental-protection-agency-1024x681.jpg,,,2025-12-05 06:01:43.665773
,Clean Air & Water,2025-12-04 23:21:53+00:00,Office of Advocacy,EPA Seeks Comment on Updated Formaldehyde Risk Calculation Memo,,,,,,https://advocacy.sba.gov/2025/12/04/epa-seeks-comment-on-updated-formaldehyde-risk-calculation-memo/,"What: On December 3, 2025, the U.S. Environmental Protection Agency (EPA) released an updated draft risk calculation memorandum for formaldehyde.Why: EPA is currently reconsidering the use of certain hazard values in the 2024 formaldehyde risk evalua",,https://advocacy.sba.gov/wp-content/uploads/2018/11/agency_EPA_environmental-protection-agency-1024x681.jpg,,,2025-12-05 06:01:43.665773
,,2025-12-04 23:14:38+00:00,California Wildfire & Forest Resilience,ENHANCING EFFICIENCY AND CAPACITY - California Wildfire & Forest Resilience,,,,,,https://wildfiretaskforce.org/enhancing-efficiency-and-capacity/,"... protecting public health and the environment.To date, 184 projects have been approved. In October 2025, the U.S. Environmental Protection Agency (EPA) ...",,https://wildfiretaskforce.org/wp-content/uploads/2025/04/53807176458_b70fa9bcd2_o.jpg,,,2025-12-05 00:58:28.283922
,Costs & Impacts,2025-12-04 22:31:24+00:00,Science 2.0,TSCA: Here Is What You Need To Know About EPA Taking A New Look At Formaldehyde,,,,,,https://www.science20.com/hank_campbell/tsca_here_is_what_you_need_to_know_about_epa_taking_a_new_look_at_formaldehyde-257649,The U.S. Environmental Protection Agency has signaled it will once again examine formaldehyde under the Toxic Substances Control Act.,,https://www.science20.com/files/images/formaldehyde_structure.png,,,2025-12-04 21:00:50.645838
,Costs & Impacts,2025-12-04 22:25:37+00:00,www.wsj.com,Can Trump's EPA Break the Ethanol Habit? - WSJ,,,,,,https://www.wsj.com/opinion/can-trumps-epa-break-the-ethanol-habit-c36cbb41,"Gasoline prices are down, but the Environmental Protection Agency is about to push them up. President Trump is committed to affordable energy, ...",,,,,2025-12-04 19:04:01.965850
,Costs & Impacts,2025-12-04 22:15:54+00:00,Sound Rivers,Tell EPA to ditch the ‘Polluted Water Rule’,,,,,,https://soundrivers.org/tell-epa-to-ditch-the-polluted-water-rule/,Our public waterways are under attack! We need you to raise your voice against the Trump Administration’s proposed revised definition of Waters of the United States — dubbed by clean-water advocates as the “Polluted Water Rule”,,https://soundrivers.org/wp-content/uploads/2025/12/WOTUS-UNDER-ATTACK-PETITION_WEB.jpg,,,2025-12-04 20:01:11.505297
,Opposition & Allies,2025-12-04 22:13:16+00:00,www.newsobserver.com,"RTP scientists fight EPA firings over petition criticizing Trump, Zeldin policies",,,,,,https://www.newsobserver.com/news/politics-government/article313365645.html,A group of Environmental Protection Agency workers fired for signing a letter criticizing EPA Administrator Lee Zeldin have formally challenged ...,,,,,2025-12-04 21:00:50.645838
,Costs & Impacts,2025-12-04 22:07:43+00:00,Earthjustice,Groups File Lawsuit Challenging Trump EPA Final Rule That Delays Methane Pollution Protections from Oil and Gas Industry,,,,,,https://earthjustice.org/press/2025/groups-file-lawsuit-challenging-trump-epa-final-rule-that-delays-methane-pollution-protections-from-oil-and-gas-industry,"Unlawful delay ignores health risks, energy waste, widespread opposition",,https://earthjustice.org/wp-content/uploads/earthjustice-logo-1200-1.png,,,2025-12-04 18:05:24.984474
,Costs & Impacts,2025-12-04 21:55:01+00:00,E&E News by POLITICO,New York finalizes emissions-reporting requirements,,,,,,https://www.eenews.net/articles/new-york-finalizes-emissions-reporting-requirements/,Polluters will have to report greenhouse gas emissions in the Empire State.,,https://www.eenews.net/wp-content/uploads/2021/07/eenewslogo-sqaure.jpg,,,2025-12-04 18:05:24.984474
,,2025-12-04 21:46:27+00:00,www.facebook.com,We're modernizing permitting to help make the U.S. the AI capital of the world . EPA is ...,,,,,,https://www.facebook.com/EPA/posts/were-modernizing-permitting-to-help-make-the-us-the-ai-capital-of-the-world-epa-/1296897822478021/,"Once again you are supposed to be PROTECTING THE ENVIRONMENT, not business interests. Stay in your lane and protect our land and water for future ...",,,,,2025-12-04 21:00:50.645838
,,2025-12-04 21:37:51+00:00,AgFunderNews,Landmark glyphosate paper retracted in random reckoning for a scientific relic,,,,,,https://agfundernews.com/landmark-glyphosate-safety-report-randomly-retracted-as-trump-supports-roundup-lawsuit-appeal,The retraction of the glyphosate safety report comes as the Trump admin throws support behind Roundup lawsuit appeal.,,https://agfundernews.com/wp-content/uploads/2025/12/iStock-1318850180-1.jpg,,,2025-12-04 17:03:34.729093
,,2025-12-04 21:32:11+00:00,JD Supra,EPA and Army Corps Release Proposed Rule Significantly Narrowing Federal “Waters of the United States” (WOTUS) Jurisdiction After Sackett | JD Supra,,,,,,https://www.jdsupra.com/legalnews/epa-and-army-corps-release-proposed-4154620/,"On November 17, 2025, the U.S. Environmental Protection Agency (EPA) and Army Corps of Engineers (Corps) (collectively, the “Agencies”) released a...",,https://jdsupra-static.s3.amazonaws.com/profile-images/og.865_1359.jpg,,,2025-12-04 17:03:34.729093
,Clean Air & Water,2025-12-04 21:28:00+00:00,www.mitchellwilliamslaw.com,2023 Triennial Review/ Arkansas Water Quality Standards U.S. Environmental Protection Agency Letter Addressing Revisions to 8 CAR § 21 (Rule 2),,,,,,https://www.mitchellwilliamslaw.com/2023-triennial-review/-arkansas-water-quality-standards-us-environmental-protection-agency-letter-addressing-revisions-to-8-car-21-rule-2,... Environmental Protection Agency Letter Addressing Revisions to 8 CAR § 21 (Rule 2) ... The Arkansas Department of Energy and Environment – Division of ...,,https://www.mitchellwilliamslaw.com/images/site/Social_Logo.jpg,,,2025-12-04 21:00:50.645838
,,2025-12-04 21:14:21+00:00,Tribeca Citizen,Tribeca Citizen |   The plans for the reconstruction of Rockefeller Park,,,,,,https://tribecacitizen.com/2025/12/03/the-plans-for-the-reconstruction-of-rockefeller-park/,"<p>Rockefeller Park and parts of the streets of Tribeca are about to be under construction for years starting in January.</p>
",,https://tribecacitizen.com/wp-content/uploads/2025/12/Rockefeller-resiliency-3.jpg-420x152.png,,,2025-12-04 21:00:50.645838
,,2025-12-04 21:12:50+00:00,www.dcwater.com,Know Your Pipes: DC Water Sends Annual Notifications to Help Customers Stay Informed,,,,,,https://www.dcwater.com/about-dc-water/media/news/know-your-pipes-dc-water-sends-annual-notifications-help-customers-stay,... Environmental Protection Agency requires these updates every year to keep customers informed and safe. EPA's Lead and Copper Rule Improvements ...,,,,,2025-12-04 17:03:34.729093
,,2025-12-04 21:11:44+00:00,www.lexology.com,Proposed New WOTUS Definitions and Impacts on Tribes - Lexology,,,,,,https://www.lexology.com/library/detail.aspx%3Fg%3D53a302b8-ae3a-405a-bcfd-61e455c0c71b,"On November 17, 2025, the U.S. Environmental Protection Agency (EPA) and the Army Corps of Engineers released a proposed rule that would revise ...",,,,,2025-12-04 17:03:34.729093
,,2025-12-04 21:09:29+00:00,www.linkedin.com,"How do heatwaves impact society and the economy? With the winter weather, it’s hard to picture a heatwave in Ireland! And we all love a bit of sunshine, but there can be cascading impacts due to… | Environmental Protection Agency (EPA) Ireland",,,,,,https://www.linkedin.com/posts/environmental-protection-agency-ireland_how-do-heatwaves-impact-society-and-the-economy-activity-7402413071966765059-Ob62,"How do heatwaves impact society and the economy? With the winter weather, it’s hard to picture a heatwave in Ireland! And we all love a bit of sunshine, but there can be cascading impacts due to periods of intense heat that you might not have thought about before. Check out the diagram from our Climate Cascades series, where we share illustrative ways in which high temperatures can lead to a ripple effect across water quality, human health, ecosystems, and more.

This work comes from the EPA report the National Climate Change Risk Assessment, which lays out the risks associated with a changing climate in Ireland. Learn more at the link in the comments.",,https://media.licdn.com/dms/image/v2/D4E10AQGQO3QjlTcn0w/image-shrink_1280/B4EZrqndm9KkAQ-/0/1764872805807?e=2147483647&v=beta&t=4-Dr9sJ_bK6cdcU5R9p2GWw69kYY0qXPODpwLwcWTP4,,,2025-12-04 20:01:11.505297
,Opposition & Allies,2025-12-04 21:01:20+00:00,CT.gov - Connecticut's Official State Website,Governor Lamont and Commissioner Dykes Statements on Trump Administration’s Rollback of Fuel Economy Standards,,,,,,https://portal.ct.gov/deep/news-releases/news-releases---2025/governor-lamont-and-commissioner-dykes-statements-on-trump-administrations-rollback-of-fuel-economy,Governor Lamont and Commissioner Dykes Statements on Trump Administration’s Rollback of Fuel Economy Standards,,https://portal.ct.gov/Assets/Images/facebook-default_01.png,,,2025-12-04 17:03:34.729093
,Costs & Impacts,2025-12-04 20:54:08+00:00,sourcenm.com,PRC member floats receivership for troubled water utility • Source New Mexico,,,,,,https://sourcenm.com/2025/12/04/prc-member-floats-receivership-for-troubled-water-utility/,"(Courtesy of Environmental Protection Agency). Billing problems, dry ... Environment Department sued the Camino Real Regional Utility ...",,,,,2025-12-04 18:05:24.984474
,,2025-12-04 20:37:01+00:00,PA Department of Community & Economic Development,Shapiro Administration Invests More Than $1.5 Million to Support Roadway Improvements in Lancaster County,,,,,,https://dced.pa.gov/newsroom/shapiro-administration-invests-more-than-1-5-million-to-support-roadway-improvements-in-lancaster-county/,"This investment will increase safety, improve traffic flows, and support new economic development in East Donegal Township. Since day one, Governor Josh Shapiro has been committed to strengthening communities and […]",,https://dced.pa.gov/wp-content/uploads/2025/12/PA_441_NB_past_Union_Street_Middletown_FB.png,,,2025-12-04 19:04:01.965850
,,2025-12-04 20:25:11+00:00,www.mass.gov,Massachusetts Clean Water Trust Board of Trustees approves $104.2 million in new loans ...,,,,,,https://www.mass.gov/news/massachusetts-clean-water-trust-board-of-trustees-approves-1042-million-in-new-loans-and-grants-at-its-december-meeting,... Environmental Protection Agency and the Commonwealth of Massachusetts. SRFs function like an environmental infrastructure bank by financing water ...,,,,,2025-12-04 16:03:34.293631
,,2025-12-04 20:17:34+00:00,www.instagram.com,Mop Water Study Reveals Surprising Truth About U.S. Cleaning Habits,,,,,,https://www.instagram.com/p/DR0aehTjTnj/,"The Trump administration has sent shockwaves through the Environmental Protection Agency (EPA) by notifying over 1,000 employees that they are on ...",,,,,2025-12-04 16:03:34.293631
,,2025-12-04 20:13:41+00:00,Retraction Watch,Glyphosate safety article retracted eight years after Monsanto ghostwriting revealed in court,,,,,,https://retractionwatch.com/2025/12/04/glyphosate-safety-article-retracted-elsevier-monsanto-ghostwriting/,Credit: Mike Mozart/Flickr (CC BY 2.0) A review article concluding the weed killer Roundup “does not pose a health risk to humans” has been retracted eight years after documents released in a court…,,https://retractionwatch.com/wp-content/uploads/2025/12/roundup-monsanto-credit-mike-mozart-flickr.jpg,,,2025-12-04 19:04:01.965850
,,2025-12-04 20:01:36+00:00,dep.nj.gov,New Jersey State Parks Branding And Merchandise Line Unveiled In Advance Of Nation's ...,,,,,,https://dep.nj.gov/newsrel/25_0053/,"In advance of the celebration of the nation's 250th birthday, the Department of Environmental Protection today unveiled new branding and ...",,,,,2025-12-04 16:03:34.293631
,Opposition & Allies,2025-12-04 19:37:32+00:00,The Seattle Times,Former EPA lawyer based in Seattle fights Trump-related firing,,,,,,https://www.seattletimes.com/seattle-news/climate-lab/former-epa-lawyer-based-in-seattle-fights-trump-related-firing/,"Ted Yackulic spent 35 years at the agency, ensuring pollution cleanups in the Northwest. This summer, he joined 150 colleagues in a dissent letter.",,https://images.seattletimes.com/wp-content/uploads/2025/12/12032025_tzr_tzr_163248.jpg?d=1200x630,,,2025-12-04 16:03:34.293631
,Costs & Impacts,2025-12-04 19:36:04+00:00,US EPA,EPA Region 4 to Review Cleanups at 55 Southeast Superfund Sites in 2026   | US EPA,,,,,,https://www.epa.gov/newsreleases/epa-region-4-review-cleanups-55-southeast-superfund-sites-2026,EPA Region 4 to Review Cleanups at 55 Southeast Superfund Sites in 2026  ,,https://www.epa.gov/sites/all/themes/epa/img/epa-news-releases-og.jpg,,,2025-12-04 15:02:43.036965
,,2025-12-04 19:25:13+00:00,www.facebook.com,"This morning, Administrator Zeldin joined with organization leaders and partners from ... - Facebook",,,,,,https://www.facebook.com/EPA/posts/this-morning-administrator-zeldin-joined-with-organization-leaders-and-partners-/1296767352491068/,"""The Trump Environmental Protection Agency (EPA) has abandoned or proposed the abandonment of numerous environmental controls and regulations since ...",,,,,2025-12-04 18:05:24.984474
,,2025-12-04 19:20:27+00:00,PilieroMazza PLLC,"Weekly Update for Government Contractors and Commercial Businesses – December 4, 2025 | PilieroMazza, Law Firm, Government Contracts Attorney",,,,,,https://www.pilieromazza.com/weekly-update-for-government-contractors-and-commercial-businesses-december-4-2025/,"The Weekly Update recaps recent legislative and regulatory updates affecting government contractors and commercial businesses. If you have questions concerning this content, please email  marketing@pilieromazza.com . _____________________________________________ NONPROFIT AND TAX-EXEMPT ORGANIZATIONS Nonprofits Celebrate PilieroMazza’s Kristen Centre for Transformative Legal Support, PilieroMazza News, Kristen Centre Pro Bono Partnership  (PBP) has recognized  PilieroMazza  Partner  Kristen Centre  for her outstanding contributions to nonprofit organizations by offering vital, pro bono legal support on matters ranging from corporate governance, contract review, and complex organizational transitions. As one of PBP’s most dedicated and trusted volunteers, Kristen exemplifies the organization’s spirit of service . . . Read More",,https://www.pilieromazza.com/wp-content/uploads/2021/11/Picture1.jpg,,,2025-12-04 18:05:24.984474
,,2025-12-04 19:10:36+00:00,www.americafirstpolicy.com,State Food Liability Protection Laws Reduce Waste & Feed The Vulnerable | Fact Sheet,,,,,,https://www.americafirstpolicy.com/issues/state-food-liability-protection-laws-reduce-waste-feed-the-vulnerable,"... Environmental Protection Agency (EPA), an in-depth 2021 report on hotels around the world estimates that around 20% of total food sourced ends up ...",,,,,2025-12-04 17:03:34.729093
,,2025-12-04 19:06:23+00:00,Clean Air Task Force,Ghana’s EPA and CATF strengthen climate leadership through methane regulation  ,,,,,,https://www.catf.us/2025/12/ghanas-epa-catf-strengthen-climate-leadership-methane-regulation/,Ghana has taken another decisive step in its journey to cut methane emissions from the oil and gas sector.,,https://cdn.catf.us/wp-content/uploads/2018/10/21094221/Burning_Tourch_1a.jpg,,,2025-12-04 17:03:34.729093
,,2025-12-04 19:06:01+00:00,X (formerly Twitter),The Environmental Protection Agency has recently proposed changes to reporting ...,,,,,,https://x.com/KLGates/status/1996610814569025797/photo/1,K&L Gates LLP (@KLGates). 27 views. The Environmental Protection Agency has recently proposed changes to reporting requirements for certain ...,,,,,2025-12-04 16:03:34.293631
,,2025-12-04 18:11:58+00:00,news.santaclaracounty.gov,County Provides Nearly $200000 to Local Farmers to Promote Climate Resilience,,,,,,https://news.santaclaracounty.gov/county-provides-nearly-200000-local-farmers-promote-climate-resilience,"Launched by the County Consumer and Environmental Protection Agency, Division of Agriculture, the program provides up to $30,000 per recipient for ...",,,,,2025-12-04 14:02:28.853560
,Costs & Impacts,2025-12-04 18:11:35+00:00,Capital Press,Feds urge Supreme Court to weigh in on pesticide labeling | Capital Press,,,,,,https://capitalpress.com/2025/12/03/feds-urge-supreme-court-to-weigh-in-on-pesticide-labeling/,The federal government is urging the U.S. Supreme Court to review and overturn rulings allowing pesticide manufacturers to be liable for “failure to warn” of alleged pesticide dangers.,,https://capitalpress.com/wp-content/uploads/sites/11/2025/12/Supreme-court-copy.jpg,,,2025-12-04 17:03:34.729093
,Costs & Impacts,2025-12-04 18:05:27+00:00,US EPA,"Proposed penalty of $39,500 against Gilbane Building Company | US EPA",,,,,,https://www.epa.gov/dc/proposed-penalty-39500-against-gilbane-building-company,"The EPA Region 3 proposes a penalty of $39,500.00 against Gilbane Building Company for violations of the Clean Water Act at Respondent’s site located at 2700 North Capitol Street, NW, Washington, D.C. 20002.",,https://www.epa.gov/sites/all/themes/epa/img/epa-standard-og.jpg,,,2025-12-04 16:03:34.293631
,,2025-12-04 18:00:03+00:00,JD Supra,Proposed WOTUS Rule Could Reduce CWA Permitting Burdens for Developers | JD Supra,,,,,,https://www.jdsupra.com/legalnews/proposed-wotus-rule-could-reduce-cwa-1328941/,"On November 20, 2025, the Environmental Protection Agency (EPA) and the U.S. Army Corps of Engineers (Corps, together the “Agencies”) published a...",,https://jdsupra-static.s3.amazonaws.com/profile-images/og.14961_4044.jpg,,,2025-12-04 16:03:34.293631
,,2025-12-04 17:52:48+00:00,Michigan Technological University,"Playing to Win: Finance, FinTech, and Stock Market Strategy Propel Senior to Success",,,,,,https://www.mtu.edu/stories/2025/10/playing-to-win-finance-fintech-and-stock-market-strategy-propel-senior-to-success.html,"The 2024-25 academic year was a big one for Elijah Joseph. What lies ahead this fall is even bigger, as the finance major with a financial technology (FinTech) minor gets ready to walk the stage at Michigan Tech's 2025 Midyear Commencement.",,https://www.mtu.edu/stories/2025/10/images/elijah-joseph-banner1200.jpg,,,2025-12-04 16:03:34.293631
,Costs & Impacts,2025-12-04 17:25:14+00:00,Chesapeake Bay Foundation,"Amid Recent Sewage Overflows, Baltimore City Cannot Delay System Upgrades • Chesapeake Bay Foundation",,,,,,https://www.cbf.org/news/amid-recent-sewage-overflows-baltimore-city-cannot-delay-system-upgrades/,"To help prevent additional sewage overflows and pollution in Baltimore, the Chesapeake Bay Foundation (CBF) and Blue Water Baltimore this week urged the Baltimore City Department of Public Works (DPW), Maryland Department of the Environment (MDE), and U.S. Environmental Protection Agency (EPA) to complete critical sewer line upgrades by 2030.",,https://live-cbf-wp.pantheonsite.io/wp-content/uploads/2025/10/©Garth_Lenz-Baltimore-8655-scaled.jpg,,,2025-12-04 16:03:34.293631
