id,name,published,outlet,title,authors,category,market,categoryorder,articleorder,url,description,text,image,error,sentiment,firstEyes
,Youth Mental Health & Screens,2025-09-24 16:24:31+00:00,The New Indian Express,ICMR-Kerala govt research to reduce suicide risk among youth,,,,,,https://www.newindianexpress.com/states/kerala/2025/Sep/24/icmr-kerala-govt-research-to-reduce-suicide-risk-among-youth,KOCHI: The Indian Council of Medical Research (ICMR) and the Kerala government have joined hands to conduct research on mental health and suicide risks among th,,https://media.newindianexpress.com/newindianexpress%2F2025-01-13%2F0yh8y6ls%2FANI_20250113102952.jpg?rect=0%2C64%2C600%2C315&w=1200&ar=40%3A21&auto=format%2Ccompress&ogImage=true&mode=crop&enlarge=true&overlay=false&overlay_position=bottom&overlay_width=100,,,2025-09-24 13:04:56.732061
,Parent & Community Organizing,2025-09-24 04:31:53+00:00,Take One,Seventh day of Swasth Nari Sashakt Parivar Abhiyaan sees strong community response in Udhampur,,,,,,https://www.takeonedigitalnetwork.com/seventh-day-of-swasth-nari-sashakt-parivar-abhiyaan-sees-strong-community-response-in-udhampur/,"Today 23rd September 2025 seventh day of the Swasth Nari Shakshat Parivar Abhiyaan (SNSPA) campaign, special emphasis was laid on Tuberculosis screening across District Udhampur. Women were actively screened for TB through sputum examination, chest X-rays, and clinical evaluation, ensuring early detection and timely referral for treatment. In addition, routine screenings for hypertension, diabetes, anaemia, […]",,https://www.takeonedigitalnetwork.com/wp-content/uploads/2025/09/PHOTO-2025-09-23-21-42-15.jpg,,,2025-09-24 03:00:51.638402
,Media & Policy Landscape,2025-09-24 03:27:27+00:00,Aspen Daily News,Growing Community: Screen addiction expert to visit Aspen,,,,,,https://www.aspendailynews.com/opinion/growing-community-screen-addiction-expert-to-visit-aspen/article_855171d9-77cb-4cfd-9afa-1b784bd63dbd.html,"Picture the scene. A family enters a restaurant. There are two children, both under 10, and once seated, the mother pulls out two brightly...",,https://bloximages.newyork1.vip.townnews.com/aspendailynews.com/content/tncms/assets/v3/editorial/8/5b/85b61a3e-0d57-4275-8be9-615f7522443c/68d32a7f1aa51.image.jpg?crop=1080%2C567%2C0%2C20,,,2025-09-24 01:58:12.156049
,Media & Policy Landscape,2025-09-24 03:21:43+00:00,Law.com,Judge Permits 10 Plaintiffs’ Experts to Testify in Social Media Addiction Cases | Law.com,,,,,,https://www.law.com/therecorder/2025/09/23/judge-permits-10-plaintiffs-experts-to-testify-in-social-media-addiction-cases/,Monday’s ruling by Los Angeles Superior Court Judge Carolyn Kuhl allowed 10 of the 11 plaintiffs’ experts on general causation to testify at trials.,,https://k2-prod-alm.s3.us-east-1.amazonaws.com/brightspot/f4/60/7bf14a524db1bd7eee7864d66d1b/tik-tok-child-adobestock-382769229-editorial-use-only-jpeg767x505.jpg,,,2025-09-24 01:58:12.156049
,Media & Policy Landscape,2025-09-23 20:18:59+00:00,www.hunton.com,Ninth Circuit Upholds “Addictive” Social Media Feed Ban and Default Privacy Settings for Minors in California’s Protecting Our Kids from Social Media Addiction Act,,,,,,https://www.hunton.com/privacy-and-information-security-law/ninth-circuit-upholds-addictive-social-media-feed-ban-and-default-privacy-settings-for-minors-in-californias-protecting-our-kids-from-social-media-addiction-act,"... Media Addiction Act (SB 976) (the “Act”), allowing enforcement of the ... Legislation, Liability, LinkedIn, Lisa Sotto, Litigation, Location-Based ...",,https://www.hunton.com/privacy-and-information-security-law/assets/images-t1758662240/206144.png,,,2025-09-23 18:04:15.795051
,Parent & Community Organizing,2025-09-23 14:16:16+00:00,Take One,Sixth day of Swasth Nari Sashakt Parivar Abhiyaan sees strong community response in Udhampur,,,,,,https://www.takeonedigitalnetwork.com/sixth-day-of-swasth-nari-sashakt-parivar-abhiyaan-sees-strong-community-response-in-udhampur/,"Udhampur, Sept 22: Today 22nd September 2025 the sixth day of the Swasth Nari Shakshat Parivar Abhiyaan (SNSPA) campaign, health teams across District Udhampur continued to provide comprehensive screening and counselling services for women. Screenings were conducted for hypertension, diabetes, anaemia, tuberculosis, and common cancers such as cervical, breast, and oral cancers. Free diagnostic tests […]",,https://www.takeonedigitalnetwork.com/wp-content/uploads/2025/09/376aaae9-74a4-43ed-9799-6ced92165bf7.jpg,,,2025-09-24 03:00:51.638402
,Tech Accountability & Safeguards,2025-09-23 13:20:21+00:00,lbbonline.com,EACA and 5Rights Launch Competition to Champion Children's Safety Online | LBBOnline,,,,,,https://lbbonline.com/news/EACA-and-5Rights-Launch-Competition-to-Champion-Childrens-Safety-Online,"Little Black Book, The initiative aims to raise awareness of advertising best practices for child online safety based on international industry ...",,,,,2025-09-23 10:00:53.752881
,Media & Policy Landscape,2025-09-23 12:08:33+00:00,NonStop Local KHQ,Can anxiety in lonely night owls trigger social media addiction?,,,,,,https://www.khq.com/lifestyles/health/can-anxiety-in-lonely-night-owls-trigger-social-media-addiction/article_05b7c9ba-9819-5d80-bfeb-c58ba2683d10.html,No previous study had investigated the underlying link between being an “evening person” and problematic technology use.,,https://bloximages.newyork1.vip.townnews.com/khq.com/content/tncms/assets/v3/editorial/9/50/95092928-5260-596f-9a68-8b399f23eff2/68d179abc6843.image.jpg?crop=1280%2C672%2C0%2C90&resize=1200%2C630&order=crop%2Cresize,,,2025-09-23 12:10:36.231938
,Media & Policy Landscape,2025-09-23 09:49:18+00:00,happiful.com,"Loneliness and anxiety fuel social media addiction in night owls, new study finds",,,,,,https://happiful.com/loneliness-and-anxiety-fuel-social-media-addiction-in-night-owls-new-study-finds,... media addiction. Researchers found that young adults who are ... Proof policy · Wellbeing A-Z · Helplines. Shop. Buy in print · Store locations ...,,,,,2025-09-23 12:10:36.231938
,Media & Policy Landscape,2025-09-23 07:29:52+00:00,RealClearEducation,Think Before You Post: Why Students Should Hit Pause on Social Media,,,,,,https://www.realcleareducation.com/articles/2025/09/22/think_before_you_post_why_students_should_hit_pause_on_social_media_1136455.html,"Every morning, millions of students start their day the same way: roll over, reach for the phone, and open a social media app. Scroll. Snap. Like. Post. Repeat.
It feels natural; almost automatic. The",,https://assets.realclear.com/images/65/654629_6_.jpeg,,,2025-09-23 04:58:08.193195
,Media & Policy Landscape,2025-09-23 04:54:16+00:00,The Business Times,Meta must face US state lawsuits over teen social media addiction,,,,,,https://www.businesstimes.com.sg/pulse/article/5139391,"FACEBOOK parent company Meta must face lawsuits by US states accusing it of fueling mental health problems among teens by making its Facebook and Instagram platforms addictive, a federal judge in California ruled on Tuesday. Oakland-based US District Judge Yvonne Gonzalez Rogers rejected Meta’s bid ...",,https://cassette.sphdigital.com.sg/image/businesstimes/fece9a3f4a21686c7c614af238d0a3ca45b00ef60a737cde0ce08eb9268b1161?w=1200&f=webp,,,2025-09-23 04:58:08.193195
,Media & Policy Landscape,2025-09-23 04:41:01+00:00,Caledonian Record,Can anxiety in lonely night owls trigger social media addiction?,,,,,,https://www.caledonianrecord.com/features/health/can-anxiety-in-lonely-night-owls-trigger-social-media-addiction/article_b712885b-56ca-5b33-9697-6684168ca193.html,No previous study had investigated the underlying link between being an “evening person” and problematic technology use.,,https://bloximages.newyork1.vip.townnews.com/caledonianrecord.com/content/tncms/assets/v3/editorial/5/35/53567c69-a8f8-5e0f-b51f-30e8d40e5f3e/68d179a32d414.image.jpg?crop=1280%2C672%2C0%2C90&resize=1200%2C630&order=crop%2Cresize,,,2025-09-23 04:58:08.193195
,Media & Policy Landscape,2025-09-23 04:14:32+00:00,PsyPost - Psychology News,"Night owls more prone to problematic smartphone use, with loneliness and anxiety as key factors",,,,,,https://www.psypost.org/night-owls-more-prone-to-problematic-smartphone-use-with-loneliness-and-anxiety-as-key-factors/,"New research finds young adults who are ""night owls"" are more prone to problematic smartphone and social media use. A study in PLOS One suggests this isn't just about sleep patterns but is strongly linked to underlying feelings of loneliness and anxiety.",,https://www.psypost.org/wp-content/uploads/2024/06/young-man-reading-smartphone-on-bed-at-night.jpg,,,2025-09-23 04:58:08.193195
,Media & Policy Landscape,2025-09-22 23:26:52+00:00,FOX 28 Spokane,Can anxiety in lonely night owls trigger social media addiction? | FOX 28 Spokane,,,,,,https://www.fox28spokane.com/can-anxiety-in-lonely-night-owls-trigger-social-media-addiction/,"By Stephen Beech Loneliness and anxiety among ""night owls"" trigger smartphone and social media addiction, according to new research. Young adults who stay up all hours are more prone to developing ""problematic"" relationships with technology due to a ""vicious cycle"" as a result of being more active in the evening, say scientists. The researchers say",,https://www.fox28spokane.com/wp-content/uploads/2025/09/68d179abc6843.image_.jpg,,,2025-09-22 20:59:57.526701
,Media & Policy Landscape,2025-09-22 23:18:11+00:00,www.researchgate.net,(PDF) Structural Modeling of Turkish Sports Science Students' Addiction on Social Media ...,,,,,,https://www.researchgate.net/publication/395720847_Structural_Modeling_of_Turkish_Sports_Science_Students%27_Addiction_on_Social_Media_and_Academic_Procrastination_The_Mediating_Role_of_Academic_Self-Efficacy,"The direct effect of social media addiction on academic procrastination remained significant and together social media addiction ... Public Health,18(21) ...",,,,,2025-09-23 12:10:36.231938
,Media & Policy Landscape,2025-09-22 22:45:29+00:00,The Messenger,Can anxiety in lonely night owls trigger social media addiction?,,,,,,https://www.the-messenger.com/lifestyles/health/article_baa77274-0163-5ac2-8101-99e19eba95d0.html,No previous study had investigated the underlying link between being an “evening person” and problematic technology use.,,https://bloximages.chicago2.vip.townnews.com/the-messenger.com/content/tncms/assets/v3/editorial/c/28/c288df8d-fe31-5f39-8462-85f32879ecf6/68d179a855a02.image.jpg?crop=1280%2C672%2C0%2C90&resize=1200%2C630&order=crop%2Cresize,,,2025-09-22 20:59:57.526701
,Media & Policy Landscape,2025-09-22 22:44:31+00:00,Sunnyside Sun,Can anxiety in lonely night owls trigger social media addiction?,,,,,,https://www.sunnysidesun.com/lifestyle/health-fitness/can-anxiety-in-lonely-night-owls-trigger-social-media-addiction/article_ae81214c-8ded-54b8-b8bf-2bbf3314b9b5.html,No previous study had investigated the underlying link between being an “evening person” and problematic technology use.,,https://bloximages.newyork1.vip.townnews.com/sunnysidesun.com/content/tncms/assets/v3/editorial/7/16/7169953d-e005-54ca-91ab-fead491bfe45/68d179f4cf1f9.image.jpg?crop=1280%2C672%2C0%2C90&resize=1200%2C630&order=crop%2Cresize,,,2025-09-22 20:59:57.526701
,Media & Policy Landscape,2025-09-22 22:44:10+00:00,KPCNews,Can anxiety in lonely night owls trigger social media addiction?,,,,,,https://www.kpcnews.com/lifestyles/health/article_a36f31ba-1f04-5cb8-bd25-12a4c413d710.html,No previous study had investigated the underlying link between being an “evening person” and problematic technology use.,,https://bloximages.newyork1.vip.townnews.com/kpcnews.com/content/tncms/assets/v3/editorial/0/8d/08d39683-334e-5bb1-b2e1-8f7abbd0b18b/68d17a06903bb.image.jpg?crop=1280%2C672%2C0%2C90&resize=1200%2C630&order=crop%2Cresize,,,2025-09-22 20:59:57.526701
,Media & Policy Landscape,2025-09-22 22:41:07+00:00,Northeast Mississippi Daily Journal,Can anxiety in lonely night owls trigger social media addiction?,,,,,,https://www.djournal.com/lifestyle/health/can-anxiety-in-lonely-night-owls-trigger-social-media-addiction/article_f5c4cdea-34d0-5beb-bd17-5886a80d0250.html,No previous study had investigated the underlying link between being an “evening person” and problematic technology use.,,https://bloximages.newyork1.vip.townnews.com/djournal.com/content/tncms/assets/v3/editorial/d/61/d6194e96-5c1a-56dd-8ef1-f8e8ba9c279a/68d179a6e3dc3.image.jpg?crop=1280%2C672%2C0%2C90&resize=1200%2C630&order=crop%2Cresize,,,2025-09-22 20:59:57.526701
,Media & Policy Landscape,2025-09-22 22:40:46+00:00,guampdn.com,Can anxiety in lonely night owls trigger social media addiction?,,,,,,https://www.guampdn.com/lifestyle/wellness/can-anxiety-in-lonely-night-owls-trigger-social-media-addiction/article_aa411398-1a68-54ab-99ac-6fb65617fdd5.html,No previous study had investigated the underlying link between being an “evening person” and problematic technology use.,,https://bloximages.newyork1.vip.townnews.com/guampdn.com/content/tncms/assets/v3/editorial/5/ac/5ac0d3e8-05f3-5dfd-ba69-eb7e372f736e/68d179d33535c.image.jpg?crop=1280%2C672%2C0%2C90&resize=1200%2C630&order=crop%2Cresize,,,2025-09-22 20:59:57.526701
,Media & Policy Landscape,2025-09-22 22:39:47+00:00,Lebanon Democrat,Can anxiety in lonely night owls trigger social media addiction?,,,,,,https://www.lebanondemocrat.com/lifestyles/health/can-anxiety-in-lonely-night-owls-trigger-social-media-addiction/article_903e8a85-2f12-5eb5-ab06-0d6d1000c162.html,No previous study had investigated the underlying link between being an “evening person” and problematic technology use.,,https://bloximages.chicago2.vip.townnews.com/lebanondemocrat.com/content/tncms/assets/v3/editorial/c/25/c2533302-70ed-5fd7-b42c-829ef54895ee/68d179e51cb5a.image.jpg?crop=1280%2C672%2C0%2C90&resize=1200%2C630&order=crop%2Cresize,,,2025-09-22 20:59:57.526701
,Industry Narrative / Counter-Messaging,2025-09-22 22:28:23+00:00,www.msn.com,The myopia epidemic: Why reducing screen time is crucial for kids - MSN,,,,,,https://www.msn.com/en-in/health/health-news/the-myopia-epidemic-why-reducing-screen-time-is-crucial-for-kids/ar-AA1sbrin%3Fapiversion%3Dv2%26noservercache%3D1%26domshim%3D1%26renderwebcomponents%3D1%26wcseo%3D1%26batchservertelemetry%3D1%26noservertelemetry%3D1,"Childhood myopia, exacerbated by increased screen time, poses severe long-term eye health risks such as glaucoma and retinal detachment.",,,,,2025-09-23 15:02:25.856895
,Media & Policy Landscape,2025-09-22 22:26:37+00:00,Grand Rapids Herald-Review,Can anxiety in lonely night owls trigger social media addiction?,,,,,,https://www.grandrapidsmn.com/around_the_web/health/can-anxiety-in-lonely-night-owls-trigger-social-media-addiction/article_6456465b-4465-5829-bce6-5963b5cc231f.html,No previous study had investigated the underlying link between being an “evening person” and problematic technology use.,,https://bloximages.chicago2.vip.townnews.com/grandrapidsmn.com/content/tncms/assets/v3/editorial/3/3f/33f2c824-8a0c-5a5b-b620-33fbc625d219/68d176c11a567.image.jpg?crop=1280%2C672%2C0%2C90&resize=1200%2C630&order=crop%2Cresize,,,2025-09-22 20:59:57.526701
,Media & Policy Landscape,2025-09-22 20:10:30+00:00,newswav.com,How your bedtime may be fuelling your social media addiction - Newswav,,,,,,https://newswav.com/article/how-your-bedtime-may-be-fuelling-your-social-media-addiction-A2509_s7rzIq,Your use of this app indicates your understanding and acceptance of this information. Company. Creator · Terms of Use · Privacy Policy · Careers.,,,,,2025-09-22 20:59:57.526701
,Media & Policy Landscape,2025-09-22 18:31:34+00:00,nationalenquirer.com,‘Night Owls’ More Vulnerable To Social Media Addiction Due To Being ‘Socially Out Of Sync’ And Lonely,,,,,,https://nationalenquirer.com/night-owls-more-vulnerable-to-social-media-addiction-due-to-being-socially-out-of-sync-and-lonely/,"Young adults who prefer staying up late at night are far more likely to develop problematic smartphone and social media habits, and a new study suggests it isnt just about screen time, its about loneliness and anxiety. Researchers at the University of Portsmouth in the U.K., working with the University of Surrey, found that so-called […]",,https://nationalenquirer.com/wp-content/uploads/2025/09/a55663dc13504801826932a2b31dec20-00000-1000x600.jpg,,,2025-09-22 20:59:57.526701
,Media & Policy Landscape,2025-09-22 17:48:39+00:00,Iosco County News Herald,Can anxiety in lonely night owls trigger social media addiction?,,,,,,https://www.iosconews.com/news/nation/article_91712028-882c-53b0-b5d5-20311c71fd64.html,No previous study had investigated the underlying link between being an “evening person” and problematic technology use.,,https://bloximages.chicago2.vip.townnews.com/iosconews.com/content/tncms/assets/v3/editorial/0/16/01610b02-fa23-5021-9b08-6880de63a9b9/68d17a33a95a9.image.jpg?crop=1280%2C672%2C0%2C90&resize=1200%2C630&order=crop%2Cresize,,,2025-09-22 20:59:57.526701
,Media & Policy Landscape,2025-09-22 17:31:52+00:00,The Independent,How your bedtime may be fuelling your social media addiction ,,,,,,https://www.the-independent.com/news/uk/home-news/phone-addiction-social-media-bedtime-loneliness-b2831249.html,Those who prefer to go to sleep later at night are ‘significantly’ more at risk of developing smartphone and social media addiction ,,"https://static.the-independent.com/2025/09/12/20/37/iStock-2193727018.jpeg?trim=0,0,0,0&width=1200&height=800&crop=1200:800",,,2025-09-22 14:03:28.272442
,Media & Policy Landscape,2025-09-22 16:45:03+00:00,HomeTown Register,Can anxiety in lonely night owls trigger social media addiction?,,,,,,https://www.hometownregister.com/lifestyles/health/can-anxiety-in-lonely-night-owls-trigger-social-media-addiction/article_03f88936-6756-516a-9c2a-380961e9e0e3.html,No previous study had investigated the underlying link between being an “evening person” and problematic technology use.,,https://bloximages.chicago2.vip.townnews.com/hometownregister.com/content/tncms/assets/v3/editorial/d/4f/d4f31689-9f66-5080-b8e9-a2374bdf21e2/68d1798ebb5d7.image.jpg?crop=1280%2C672%2C0%2C90&resize=1200%2C630&order=crop%2Cresize,,,2025-09-22 20:59:57.526701
,Media & Policy Landscape,2025-09-22 16:43:24+00:00,WFMZ.com,Can anxiety in lonely night owls trigger social media addiction?,,,,,,https://www.wfmz.com/health/can-anxiety-in-lonely-night-owls-trigger-social-media-addiction/article_86e6aca6-66e9-5d7f-b945-64d80a5e527a.html,No previous study had investigated the underlying link between being an “evening person” and problematic technology use.,,https://bloximages.newyork1.vip.townnews.com/wfmz.com/content/tncms/assets/v3/editorial/5/b6/5b6a1ae7-9dae-57a8-acdd-ea574da5a54a/68d1798d4c0b6.image.jpg?crop=1280%2C672%2C0%2C90&resize=1200%2C630&order=crop%2Cresize,,,2025-09-22 14:03:28.272442
,Media & Policy Landscape,2025-09-22 16:37:40+00:00,Griffin Daily News,Can anxiety in lonely night owls trigger social media addiction?,,,,,,https://www.griffindailynews.com/lifestyles/health/can-anxiety-in-lonely-night-owls-trigger-social-media-addiction/article_e07d97d6-a20a-5bbf-b553-acdec0e116c3.html,No previous study had investigated the underlying link between being an “evening person” and problematic technology use.,,https://bloximages.newyork1.vip.townnews.com/griffindailynews.com/content/tncms/assets/v3/editorial/4/d7/4d7e080e-0d39-50fa-9a9f-5a1f41914eab/68d179e47389e.image.jpg?crop=1280%2C672%2C0%2C90&resize=1200%2C630&order=crop%2Cresize,,,2025-09-22 14:03:28.272442
,Media & Policy Landscape,2025-09-22 16:33:15+00:00,The Independent,"‘Night owls’ more likely to develop social media addiction, study finds",,,,,,https://www.independent.co.uk/bulletin/lifestyle/social-media-addiction-bed-time-study-b2831355.html,,,"https://static.independent.co.uk/2025/06/06/13/44/iStock-1289222149.jpeg?trim=0,0,0,0&width=1200&height=800&crop=1200:800",,,2025-09-22 14:03:28.272442
,Media & Policy Landscape,2025-09-22 16:24:27+00:00,Bryan Times,Can anxiety in lonely night owls trigger social media addiction?,,,,,,https://www.bryantimes.com/news/health/can-anxiety-in-lonely-night-owls-trigger-social-media-addiction/article_88a928ea-5428-54c3-8919-65094f5f2c3f.html,No previous study had investigated the underlying link between being an “evening person” and problematic technology use.,,https://bloximages.chicago2.vip.townnews.com/bryantimes.com/content/tncms/assets/v3/editorial/d/c6/dc6dc5ea-3d0b-5c0e-b2f1-7c1246ae12ba/68d176a79abbd.image.jpg?crop=1280%2C672%2C0%2C90&resize=1200%2C630&order=crop%2Cresize,,,2025-09-22 20:59:57.526701
,Media & Policy Landscape,2025-09-22 16:17:41+00:00,www.newsbreak.com,"'Night owls' more likely to develop social media addiction, study finds - NewsBreak",,,,,,https://www.newsbreak.com/the-independent-517119/4249002877980-night-owls-more-likely-to-develop-social-media-addiction-study-finds,... media addiction. Researchers from the University of Portsmouth and the ... Community Policy. YOU MAY ALSO LIKE. avatar img. Jim DeLillo. Users in ...,,,,,2025-09-22 20:59:57.526701
,Media & Policy Landscape,2025-09-22 15:26:37+00:00,inkl,"‘Night owls’ more likely to develop social media addiction, study finds",,,,,,https://www.inkl.com/news/night-owls-more-likely-to-develop-social-media-addiction-study-finds,IN FULL,,https://images.inkl.com/s3/article/lead_image/22525359/iStock-1289222149.jpeg,,,2025-09-22 20:59:57.526701
,Media & Policy Landscape,2025-09-22 14:53:29+00:00,Yahoo News,How your bedtime may be fuelling your social media addiction,,,,,,https://nz.news.yahoo.com/bedtime-may-fuelling-social-media-125735803.html,Those who prefer to go to sleep later at night are ‘significantly’ more at risk of developing smartphone and social media addiction,,https://media.zenfs.com/en/the_independent_577/346be16917fb893d6aab03415c5983d9,,,2025-09-22 14:03:28.272442
,Industry Narrative / Counter-Messaging,2025-09-22 14:17:55+00:00,The Miami Times,‘Destroying vital evidence’: Florida CFO accuses social media companies of shielding child predators,,,,,,https://www.miamitimesonline.com/business/destroying-vital-evidence-florida-cfo-accuses-social-media-companies-of-shielding-child-predators/article_f4f3f17c-140b-4d2f-b8f6-f5487d13236b.html,Florida’s chief financial officer demanded Friday that social media companies be held accountable for creating disappearing messages that handicap child sex trafficking investigations.,,https://bloximages.newyork1.vip.townnews.com/miamitimesonline.com/content/tncms/assets/v3/editorial/5/23/52357d99-97af-4b25-9ee1-be95a0f668a5/68d159161faa5.image.jpg?crop=1659%2C871%2C0%2C189&resize=1200%2C630&order=crop%2Cresize,,,2025-09-22 18:02:16.988518
,Media & Policy Landscape,2025-09-22 12:05:12+00:00,www.expats.cz,How to curb your child’s scrolling habit? This Prague school has a plan,,,,,,https://www.expats.cz/czech-news/article/how-to-curb-your-child-s-scrolling-habit-park-lane-international-school-prague-school-has-a-plan,"With a realistic, blame-free approach to digital wellness, Park Lane International School helps families set effective tech boundaries.",,https://www.expats.cz/images/publishing/articles/2025/05/og/park-lane-052025-cover-01-uagiy.jpg,,,2025-09-22 14:03:28.272442
,Media & Policy Landscape,2025-09-22 06:05:12+00:00,www.expats.cz,How to curb your child's scrolling habit? This Prague school has a plan - Expats.cz,,,,,,https://www.expats.cz/czech-news/article/how-to-curb-your-child-s-scrolling-habit-park-lane-international-school-prague-school-has-a-plan%3Futm_source%3Dexpats.cz%26utm_medium%3Dsponsored-content-article-widget%26utm_campaign%3Dinternal-sp-hp-promotion,"With a realistic, blame-free approach to digital wellness, Park Lane International School helps families set effective tech boundaries ... policy.",,,,,2025-09-22 07:04:10.446056
,Youth Mental Health & Screens,2025-09-22 02:03:25+00:00,Media Outreach,"Award-winning Chill Lab youth mental health program impacted 146,000+ lives in two years with latest ""We Can"" student-led projects benefiting 17,000+ people #ZurichHongKong #ZZurichFoundation",,,,,,https://www.media-outreach.com/news/hong-kong/2025/09/22/410503/award-winning-chill-lab-youth-mental-health-program-impacted-146000-lives-in-two-years-with-latest-we-can-student-led-projects-benefiting-17000-people/,"          Chill Lab has positively impacted 146,161 people across Hong Kong              187 secondary schools were engaged via augmented reality (AR) and...",,https://images.media-outreach.com/Thumb/800x418/673955/1.Tulsi_Eric_Sofyen.JPG,,,2025-09-21 23:59:33.669017
,Industry Narrative / Counter-Messaging,2025-09-21 19:45:44+00:00,jang.com.pk,Elon Musk slammed by Sir Ed over child safety failures on social media,,,,,,https://jang.com.pk/en/48034-elon-musk-slammed-by-sir-ed-over-child-safety-failures-on-social-media-news,"Sir Ed Davey has criticized Elon Musk over concerns about hi social media platform's impact on children.The Liberal Democrat leader accused Musk of allowing online harm and failing to protect young users on X, claiming the platform is 'inciting...",,https://jang.com.pk/assets/uploads/english_news/2025-09-22/48034_124040_eng.jpg,,,2025-09-21 22:59:16.405834
