id,name,published,outlet,title,authors,category,market,categoryorder,articleorder,url,description,text,image,error,sentiment,firstEyes
,Industry Narrative / Counter-Messaging,2025-09-27 08:24:56+00:00,WIRED,Is Silicon Valley Still the Tech Capital?,,,,,,https://www.wired.com/story/uncanny-valley-podcast-is-silicon-valley-still-the-tech-capital/,"On this special episode of ""Uncanny Valley"" recorded in front of a live audience in San Francisco, our hosts discuss Silicon Valley's history and future.",,"https://media.wired.com/photos/68c1f74bca24fc3ce92058f1/191:100/w_1280,c_limit/Uncanny-Valley-Live-KQED-Business-9095.jpg",,,2025-09-27 08:00:19.008462
,Media & Policy Landscape,2025-09-27 03:34:42+00:00,citizenportal.ai,New Providence School Board Launches Digital Wellness Initiative for Students and Parents,,,,,,https://citizenportal.ai/articles/5833827/New-Jersey/New-Providence-School-Board-Launches-Digital-Wellness-Initiative-for-Students-and-Parents,Board introduces community engagement plan to address technology's impact on mental health.,,https://assets.pipeline.soar.com/5833737-f31dc5f9a2af001cf7f67877d6ee148e/thumbnail_232005.jpg,,,2025-09-27 06:58:42.305949
,Media & Policy Landscape,2025-09-26 23:52:34+00:00,Sokolove Law,Meta & Facebook Addiction Lawsuit | Payouts & Settlements,,,,,,https://www.sokolovelaw.com/personal-injury/social-media-addiction/facebook/,"If your child suffers mental health issues from a Facebook addiction, you may be eligible for Facebook addiction lawsuit settlements.",,https://www.sokolovelaw.com/wp-content/uploads/social-media-addiction-meta-lawsuits.jpg,,,2025-09-26 23:58:35.930789
,Youth Mental Health & Screens,2025-09-26 17:37:22+00:00,https://www.wfsb.com,Leaders meet to address youth mental health crisis,,,,,,https://www.wfsb.com/2025/09/26/leaders-meet-address-youth-mental-health-crisis/,Leaders gathered on Friday at Fair Haven School to confront what they called a growing youth mental health crisis across Connecticut. ,,https://gray-wfsb-prod.gtv-cdn.com/resizer/v2/UOJLACVRWVDFVK2FZOLQI7OKGE.jpg?auth=f9c45b99f1d490fa4997e4bee6a814b9c0508dd5b5c57bec22d21989023c06f3&width=1200&height=600&smart=true,,,2025-09-26 15:02:03.883042
,Media & Policy Landscape,2025-09-26 16:17:48+00:00,www.newser.com,Is AptarGroup Inc. (AGT) stock worth buying before Fed action - Newser,,,,,,https://www.newser.com/story/video/Is-AptarGroup-Inc.-(AGT)-stock-worth-buying-before-Fed-action,... 【Portfolio Diversification】✌️ Real-time US stock data and free expert insights on low-risk stocks with high growth potential ... media addiction.,,,,,2025-09-27 13:00:52.495959
,Media & Policy Landscape,2025-09-26 09:19:33+00:00,Fiji Sun,Carnival Queen Warns Youth Against Social Media Addiction | Fiji Sun,,,,,,https://fijisun.com.fj/news/nation/carnival-queen-warns-youth-against-social-media-addiction,Miss Vodafone Golden Water 2025 urges young Fijians to reconnect with the real world.,,https://images.fijisun.com.fj/media/f41ce491-7d4b-4d6c-9f99-cc3b20b49eb4,,,2025-09-26 16:01:07.523829
,Youth Mental Health & Screens,2025-09-26 08:33:11+00:00,North Carolina Health News,Stronger Together: Conference focuses on Black youth mental health,,,,,,https://www.northcarolinahealthnews.org/2025/09/26/black-youth-mental-health-stronger-together-conference/,"College student panel says resources available to help with Black youth mental health, but many friends and families don’t know about them.",,https://i0.wp.com/www.northcarolinahealthnews.org/wp-content/uploads/2025/09/IMG_20250920_123242216_HDR-scaled.jpg?fit=2560%2C1920&ssl=1,,,2025-09-26 06:58:22.446667
,Youth Mental Health & Screens,2025-09-26 06:51:23+00:00,Observer Voice,"LGBTQ+ Youth's Mental Health Impacted by Lack of Safe Online Spaces, Studies Reveal",,,,,,https://observervoice.com/lgbtq-youths-mental-health-impacted-by-lack-of-safe-online-spaces-studies-reveal-147622/,"LGBTQ+ Youth's Mental Health Impacted by Lack of Safe Online Spaces, Studies Reveal",,https://observervoice.com/wp-content/uploads/2025/09/LGBTQ-Youths-Mental-Health-Impacted-by-Lack-of-Safe-Online-Spaces-Studies-Reveal.png,,,2025-09-26 04:59:56.430176
,Youth Mental Health & Screens,2025-09-26 05:04:39+00:00,City AM,AI chief on transforming the NHS,,,,,,https://www.cityam.com/some-of-the-benefits-are-fairly-boring-but-they-save-lives-ai-chief-on-transforming-the-nhs/,"It’s the unglamorous, everyday AI tools that will help the NHS by freeing staff, streamlining care, and saving lives.",,https://www.cityam.com/wp-content/uploads/2024/07/Labour-Leader-Sir-Keir-Starmer-Visits-Chelsea-and-Westminster-Hospital-On-The-Anniversary-Of-UKs-First-Lockdown-1231888215.webp,,,2025-09-26 02:58:23.289303
,Tech Accountability & Safeguards,2025-09-26 02:21:58+00:00,Law and Tech,Tales of Digital Sovereignty and Child Online Safety: Von der Leyen’s State of the Union Address - Law and Tech,,,,,,https://lawandtech.ie/tales-of-digital-sovereignty-and-child-online-safety-von-der-leyens-state-of-the-union-address/,"Each September, the President of the European Commission delivers the State of the Union address (SOTEU) before the European Parliament. First introduced in",,https://lawandtech.ie/wp-content/uploads/2025/09/©-European-Union-2025-CC-BY-4.0-14.png,,,2025-09-26 08:59:08.679744
,Media & Policy Landscape,2025-09-25 22:08:30+00:00,today.rtl.lu,Digital detox: How a Luxembourgish school is tackling screen addiction,,,,,,https://today.rtl.lu/news/luxembourg/a/2339906.html,"To kick off the new school year, the Sainte-Anne private school in Ettelbruck introduced a Ministry of Education directive to tackle the dangers linked to mobile phone addiction.",,https://www.rtl.lu/sassets/rtl2008.lu/nt/p/2025/09/25/15/fd90d1c6e4f77359ca9f39ccf6ebbe94.jpeg,,,2025-09-25 19:02:31.703362
,Media & Policy Landscape,2025-09-25 21:09:49+00:00,markets.financialcontent.com,"LeadMeNot Launches on Apple's App Store, Helping People Regain Control of Their Digital Lives",,,,,,https://markets.financialcontent.com/stocks/article/prlog-2025-9-25-leadmenot-launches-on-apples-app-store-helping-people-regain-control-of-their-digital-lives,LeadMeNot is a digital wellness platform dedicated to helping people build healthier relationships with technology. ... Privacy Policy and Terms Of ...,,,,,2025-09-26 01:58:50.089689
,Media & Policy Landscape,2025-09-25 20:11:56+00:00,AboutLawsuits.com,Lawsuits Over Social Media Mental Health Risks Clear Major Hurdle in California State Court,,,,,,https://www.aboutlawsuits.com/social-media-mental-health-risks-california-state-court/,"A judge in California state court has determined that plaintiffs' expert witnesses are qualified to argue before juries that platforms like Facebook, Instagram and TikTok took actions that harmed the mental health of children.",,https://www.aboutlawsuits.com/wp-content/uploads/Social-Media-Mental-Health-Risks-California-State-Court-SS2391960803.jpg,,,2025-09-25 19:02:31.703362
,Youth Mental Health & Screens,2025-09-25 20:08:15+00:00,arunachaltimes.in,Gatekeeper trg on suicide risk reduction held - The Arunachal Times,,,,,,https://arunachaltimes.in/index.php/2025/09/26/gatekeeper-trg-on-suicide-risk-reduction-held/,... suicide risk reduction and improving mental health among school ... social media.” Pandey said that “the present situations are ultimately ...,,,,,2025-09-25 21:00:17.836832
,Youth Mental Health & Screens,2025-09-25 19:58:53+00:00,Intercontinental Cry,"Indigenous Nations Sue Social Media Giants, Citing Youth Mental Health Harms – Intercontinental Cry",,,,,,https://icmagazine.org/indigenous-nations-sue-social-media-giants-citing-youth-mental-health-harms/,"The Chickasaw and Choctaw Nations have filed separate lawsuits against major social media companies, alleging product designs on platforms including TikTok, Ins",,https://icmagazine.org/wp-content/uploads/2025/09/social-media-e1758817480451.jpg,,,2025-09-25 17:03:21.852242
,Tech Accountability & Safeguards,2025-09-25 19:01:53+00:00,British Politics and Policy at LSE -,Criticism of the Online Safety Act is premature - British Politics and Policy at LSE,,,,,,https://blogs.lse.ac.uk/politicsandpolicy/criticism-of-the-online-safety-act-is-premature/,The Online Safety Act has faced criticism with questions over its effectiveness and potential violation of privacy. But many of the criticisms are misguided.,,https://blogsmedia.lse.ac.uk/blogs.dir/8/files/2025/09/Online-Safety-Bill-featured.jpg,,,2025-09-26 00:59:20.806271
,Media & Policy Landscape,2025-09-25 17:17:38+00:00,Saratoga TODAY newspaper,SPAC Announces “In Conversation” Event with Julie Scelfo,,,,,,https://saratogatodaynewspaper.com/spac-announces-in-conversation-event-with-julie-scelfo/,"SARATOGA SPRINGS — The Saratoga Performing Arts Center (SPAC) recently announced that its popular fundraising event, “SPAC in Conversation,” will return on Wednesday, Oct. 22 with a refreshed event format in the historic Hall of Springs, featuring award-winning journalist, former New York Times staff writer, and media ecologist Julie Scelfo. Founder and executive director of […]",,https://saratogatodaynewspaper.com/wp-content/uploads/2025/09/AE.-SPAC-Announces-In-Conversation-Event-With-Julie-Scelfo.jpg,,,2025-09-26 01:58:50.089689
,Media & Policy Landscape,2025-09-25 17:15:04+00:00,www.digitaljournal.com,"LeadMeNot Launches on Apple's App Store, Helping People Regain Control of Their Digital Lives",,,,,,https://www.digitaljournal.com/pr/news/pr-zen/leadmenot-launches-apple-s-app-store-1853510159.html,LeadMeNot is a digital wellness platform dedicated to helping people build healthier relationships with technology. ... PRIVACY POLICY · CONTACT US.,,,,,2025-09-25 19:02:31.703362
,Tech Accountability & Safeguards,2025-09-25 13:36:34+00:00,Tech Policy Press,"At UNGA, Lula Defends Democracy and Brazil’s Efforts to Regulate Tech, but Slips on Data Centers | TechPolicy.Press",,,,,,https://www.techpolicy.press/at-unga-lula-defends-democracy-and-brazils-efforts-to-regulate-tech-but-slips-on-data-centers,"Despite President Lula's bold talk about sovereignty, Brazil’s data center plan may not reduce its dependency on Big Tech services, writes Laís Martins.",,https://cdn.sanity.io/images/3tzzh18d/production/470d0552badf121566b8d9ee6cdda229c267fde4-1200x675.png,,,2025-09-25 10:02:02.416602
,Tech Accountability & Safeguards,2025-09-25 12:13:02+00:00,NEOS KOSMOS,Mitsotakis to visit Australia in 2026 as leaders unite on child online safety - Neos Kosmos,,,,,,https://neoskosmos.com/en/2025/09/25/news/australia/mitsotakis-to-visit-australia-in-2026-as-leaders-unite-on-child-online-safety/,"Greek Prime Minister Kyriakos Mitsotakis is expected to visit Australia in early 2026, according to comments made by Australia's federal prime minister, Anthony Albanese.",,https://cdn1.neoskosmos.com/uploads/sites/2/2025/09/mitsotakisalbaneseeu_55449.jpg,,,2025-09-25 10:02:02.416602
,Youth Mental Health & Screens,2025-09-25 07:23:21+00:00,KCRW,‘Forever elsewhere’: Social media is worsening youth… | KCRW,,,,,,https://www.kcrw.com/stories/something-super-important-happened,'Forever elsewhere': Social media is worsening youth mental health ... All that screen time means kids aren't doing one of the most important ...,,https://images.ctfassets.net/2658fe8gbo8o/4leTxKZLMWnffTpdckzmmW/f4cfa06de65fa582451541dba89d36ff/media.webp?w=1200&h=630&fm=webp&q=80&fit=fill#_ratio=1.9047619047619047,,,2025-09-25 12:09:04.254611
,Parent & Community Organizing,2025-09-25 04:05:14+00:00,www.unica.ro,Jack Getting Lost at Sea: Photo Captures Adventurous Moment and Community Response,,,,,,https://www.unica.ro/relatii/top-10-ingrediente-esentiale-pentru-o-femeie-fericita-in-opinia-terapeutului-spiritual-andrea-filip-358429%3Fsport-news-179859-2025-09-25-jack-getting-lost-at-sea-photo-adventure-moment,"... community response, online gallery, photo narration, caption, captioning ... digital media, audience participation, viewer engagement, post ...",,,,,2025-09-26 02:58:23.289303
,Media & Policy Landscape,2025-09-24 20:51:15+00:00,BIOENGINEER.ORG,"Narcissism, FOMO, and Social Media Addiction in College",,,,,,https://bioengineer.org/narcissism-fomo-and-social-media-addiction-in-college/,"In the rapidly evolving digital landscape, the interplay between personality traits and technology usage is gaining unprecedented attention from both researchers and the general public. A",,https://bioengineer.org/wp-content/uploads/2025/09/Narcissism-FOMO-and-Social-Media-Addiction-in-College.jpg,,,2025-09-24 22:58:55.731031
,Media & Policy Landscape,2025-09-24 19:16:48+00:00,What's Trending,Ginko Launches Clinician-Backed AI to Help Parents Manage Screen Time,,,,,,https://whatstrending.com/ginko-launches-as-clinician-backed-ai-platform-for-digital-parenting/,"Digital wellness activist Larissa May and Dr. Raghu Appasani launch Ginko, an AI parenting app guiding families through screen time and online safety.",,https://whatstrending.com/wp-content/uploads/2025/09/KTSuraPhotography-9655-1-scaled-e1758717991284.jpg,,,2025-09-24 22:58:55.731031
