id,name,published,outlet,title,authors,category,market,categoryorder,articleorder,url,description,text,image,error,sentiment,firstEyes
,,2026-02-03 18:32:30+00:00,The Athletic,"Matt Rempe builds confidence, mobility in journey back from thumb injury - The Athletic",Peter Baugh,,,,,https://www.nytimes.com/athletic/7016565/2026/02/03/rangers-matt-rempe-thumb-injury-recovery/,"“I was going to lose my mind,” said Rempe, who did not end up dropping the gloves that day.
The two agreed he would keep practicing with the team but sit out of games as his thumb continued healing.
The 23-year-old Rempe initially suffered his injury in an October fight with San Jose’s Ryan Reaves.
Rempe’s thumb got caught in the Sharks forward’s jersey during their bout and broke in “many places,” Rempe said, requiring surgery.
Rempe received an injection to help reduce pain and improve his thumb’s mobility after the Boston blowout.","TARRYTON, N.Y. — On Jan. 10, when the New York Rangers were in the midst of their disastrous 10-2 loss in Boston, Matt Rempe considered doing something that, in his words, “would’ve been really stupid.”

He had been back in the lineup for 12 games after a nearly two-month absence due to a broken thumb, and yet he still felt the effects of the injury. The 6-foot-9 winger couldn’t fully grip his stick, so smaller players were able to out-battle him for pucks. He felt like he wasn’t able to play the style necessary for him to be effective.

As his performance dipped, his frustration level did the opposite. So with the Rangers down big to the Bruins, Rempe considered finding a Boston player to fight, even though the Rangers’ doctors had not yet cleared him to do so.

“I was going to lose my mind,” said Rempe, who did not end up dropping the gloves that day. “That wasn’t a good place mentally.”

After the team returned to New York, he and coach Mike Sullivan talked through his situation. The two agreed he would keep practicing with the team but sit out of games as his thumb continued healing. They viewed it as a necessary step back.

The 23-year-old Rempe initially suffered his injury in an October fight with San Jose’s Ryan Reaves. Rempe’s thumb got caught in the Sharks forward’s jersey during their bout and broke in “many places,” Rempe said, requiring surgery. He still has metal in his thumb from the operation, and he doesn’t have full mobility, though not for a lack of effort. He bends and stretches it constantly throughout the day, trying to get it closer and closer to normal.

Rempe received an injection to help reduce pain and improve his thumb’s mobility after the Boston blowout. He remained out for two weeks, going through conditioning skates with the Rangers’ healthy scratches after morning skates. His thumb started feeling better toward the end of the team’s recent California road trip. He told Sullivan and the team doctors in the days after that he felt he could be himself again on the ice, and he returned to the lineup Jan. 26 against Boston.

His four games back have been a mix of results. He liked how he played the first three games — one against the Bruins and two against the New York Islanders — but was on the ice for two Penguins goals in the first period Saturday in Pittsburgh.

Sullivan said his young forward is in a tough spot because he’s trying to get better on the fly while coming off an injury. But, the coach added, “I think he’s in a much better place than he was the last time he was in the lineup.”

“Still definitely not where I want it to be, but it’s much better than it was before,” Rempe said. “I’ve been real physical every game, been blowing guys up and stuff and had the puck a lot more. … First period last game was terrible, but other than that it’s been good.”

Rempe started the season as right wing on a fourth line with Sam Carrick and Adam Edström. The trio was effective in eight games together, leading opponents 75-59 in shot attempts and collecting 55.37 percent of the expected goal share at five-on-five, per Natural Stat Trick. The Rangers still have 53.13 percent of the expected goal share on the season with Rempe on the ice, though that number is aided by the fact that he plays the most sheltered minutes of any Rangers regular, per Hockey Stat Cards.

Rempe struggled to find a groove in his first stint back from injury (Dec. 15-Jan. 10). The Rangers had only 50 percent of the five-on-five expected goal share with him on the ice, per Natural Stat Trick, down from his previous rates. Sullivan gave him less ice time, too, playing him an average of 8:52 per game in that span and never more than 10 minutes in one game. He averaged 10:48 before his injury.

“It was really demoralizing,” Rempe said of his initial stretch back from injury. “I (couldn’t) win battles and be a menace or anything at all.”

Now, after more time off, he’s trying to get back to his early-season levels. He was nervous heading into his first game back but was relieved to find he could protect pucks much better than before. He also liked the chances his line created in the Rangers’ overtime win against Boston.

“Now I can have confidence that I’m not going to just bobble a puck or drop my stick or feel like I’m skating on the ice with a hand grenade,” said the winger, who is still not cleared to fight.

“His strength on the puck and his ability to handle the puck has improved, which is obviously a critical element of your ability to have success out there,” Sullivan added. “But there’s an element to Remps’ game that I think we can tap into moving forward. That being his ability to execute plays with the puck and things of that nature: just his decision-making, making sure that he executes wall plays, he gains the line, he’s a predictable player for us so that he can disrupt and he can create momentum for our team.”

Pittsburgh’s second goal Saturday, scored by Noel Acciari, offered a glimpse at what Sullivan hopes Rempe can improve upon. The forward failed to get the puck out of the defensive zone shortly before the goal. Instead, Blake Lizotte snagged it from him along the boards and kept the play alive for Pittsburgh. In retrospect, Rempe wishes he chipped it past the Penguins forward. Rempe took only three more shifts until the third period, though Sullivan said after the game it wasn’t because of Acciari’s goal.

Earlier this season, Rempe played with the simplicity and responsibility needed for him to be an effective bottom-six player. He’d like to finish the year with a similar stretch.

“Then I can have a great start and great end,” he said. “Just a bump in the middle.”

Iorio arrives in New York

Defenseman Vincent Iorio, whom the Rangers claimed off waivers from San Jose on Saturday, skated with the team for the first time Monday. The 23-year-old wore No. 6 and was primarily paired with Connor Mackey on the fourth pair.

“I’m a solid, two-way defenseman,” he said. “I just want to break pucks out, play hard defensively, try and contribute and join the rush as much as I can. But for the first couple games or however much I play, just play simple, play solid, and build that confidence.”

Iorio is familiar with several Rangers teammates. He played with Scott Morrow at Shattuck-St. Mary’s prep school, then was with Braden Schneider for the Brandon Wheat Kings in the WHL. He was around both Conor Sheary and Taylor Raddysh while in the Washington Capitals organization, though Iorio spent most of his time in the AHL.

“He’s a big boy and has a good stick,” Morrow said. “He’s definitely rangy defensively. He plays with a little bit of physicality, and he can move the puck back there as well. I think he’s definitely going to find success at this level at some point.”

Iorio had three points in 21 games this season with San Jose.",https://static01.nyt.com/athletic/uploads/wp/2026/02/02223819/USATSI_28092671-scaled.jpg?width=1200&height=630&fit=cover,N,,2026-02-03 18:03:22.990303
,,2026-02-03 18:22:50+00:00,Florida International University,AI voice analysis could diagnose a concussion within seconds of a player going down,Alexandra Pecharich,,,,,https://news.fiu.edu/2026/ai-voice-analysis-could-diagnose-a-concussion-within-seconds-of-a-player-going-down,"While rules have since been revised to prevent such a situation from occurring again, the fact remains: diagnosing a concussion is neither quick nor easy.
Identifying a concussion during a football or soccer match, professional or otherwise, can be challenging.
Classified as mild traumatic brain injury, concussions can impair cognitive function but do not appear on CT scans or other imaging.
Better AI, better results Poellabauer began studying the correlation between “speech biosignatures” and the most common form of traumatic brain injury some 10 years ago.
The tool is currently able to correlate changes in voice to cases of brain injury with greater than 90% accuracy.","In 2022, Miami Dolphins quarterback Tua Tagovailoa returned to a game against the Buffalo Bills after sustaining a head injury that the NFL later acknowledged should have been classified as a concussion.

Team medical staff and an independent consultant incorrectly attributed his visible physical instability to a previously reported back injury rather than a neurological issue, despite the NFL and players’ association later stating that concussion protocol had been followed.

While rules have since been revised to prevent such a situation from occurring again, the fact remains: diagnosing a concussion is neither quick nor easy.

Research out of FIU aims to change that.

Hear vs. see

It is estimated that more than 50% of concussions in the United States go undiagnosed, and roughly 70% occur in sports settings. Identifying a concussion during a football or soccer match, professional or otherwise, can be challenging. On the sidelines, evaluation often relies on brief self-reported symptom checks, such as asking whether an athlete has a headache or feels dizzy, before a decision is made about returning to play.

Classified as mild traumatic brain injury, concussions can impair cognitive function but do not appear on CT scans or other imaging. Diagnosis may rely on assessments of vision, eye movements, reflexes and balance.

“The problem is that these tests are not the most accurate,” says Christian Poellabauer, a professor in the Knight Foundation School of Computing and Information Sciences.

While severe concussions can be more obvious – such as the reflexive upper-limb “fencing response” exhibited by Tagovailoa on the field during two other episodes – “It’s very difficult to find those more subtle cases,” Poellabauer says.

“The concern is if you have too many concussions in a row, or if you keep playing and you get another one, that’s going to have long-term effects on your health.”

Although most concussions typically cannot be seen, Poellabauer and his team have made an important discovery: They can be heard.

Better AI, better results

Poellabauer began studying the correlation between “speech biosignatures” and the most common form of traumatic brain injury some 10 years ago.

“We were looking for ways of measuring or detecting concussions that are a little bit more foolproof,” recalls the computer scientist who focuses on developing novel healthcare solutions.

He landed on speech biosignatures, which capture subtle acoustic, phonetic or linguistic biomarkers unique to an individual. While sometimes likened to fingerprints for their uniqueness, speech biosignatures can show changes over time – depending upon the presence of illness or injury or even intoxication – and so do not remain fixed in the way fingerprints do.

Poellabauer’s research group took several voice samples from each of hundreds of high school and college athletes, including those involved in boxing, tackle football, lacrosse, rugby and cheerleading, both before and during their respective seasons. The information collected reflected that of test subjects who eventually experienced confirmed concussions and control subjects who did not.

Comparisons between individuals’ two sets of data showed differences on measures such as amplitude, frequency (pitch) and vibration for those who had documented brain trauma. Imperceptible to the human ear, the variations were captured by artificial intelligence.

With the rapid improvement of machine learning, Poellabauer’s earlier research has accelerated in recent years. The tool is currently able to correlate changes in voice to cases of brain injury with greater than 90% accuracy.

Doctoral candidate Rahmina Rubaiat is picking up the thread by working to identify a single word or sound that could best be used for both baseline and diagnostic samples. Participants in the original study had been recorded verbalizing eight different words, phrases and sounds.

Simplifying the test would allow athletic trainers or other personnel to take a sample easily from each member of a team in the pre-season and store it, on a tablet using an app, for comparison with the same simple test repeated in the event of an incident, Rubaiat explains. Results would indicate the degree of injury – mild, moderate, severe – to inform a rest and recovery period. Retesting could continue until measures return to baseline.

No concussion should ever be ignored, Rubaiat says. “A severe concussion or mild back-to-back concussions, after a few years, may lead to experiencing some other neurological impairments,” she says in an echo of Poellabauer’s concerns.

Voice: the next frontier?

Pollabauer has expanded his research to examine how a voice-based test might diagnose the onset of neurological diseases such as Parkinson’s and Alzheimer’s, both of which show changes in acoustic properties of the voice with progression. His work might even help to distinguish when someone with a neurodegenerative disorder might have the added trauma of a concussion from, for example, a fall.

Outside interest has focused on the possible application of his findings to the assessment of neurological impairment caused on the job in fields with inherent physical dangers such as law enforcement, fire service, the military and construction.",https://res.cloudinary.com/digicomm/image/upload/t_metadata/news-magazine/2026/_assets/football-1518123_1280.jpg,N,,2026-02-03 17:01:40.411516
,,2026-02-03 17:53:40+00:00,Yahoo Sports,Drake Maye Opens Patriots Super Bowl Week With Injury Update - Yahoo Sports,Mike D'Abate,,,,,https://sports.yahoo.com/articles/drake-maye-opens-patriots-super-120007171.html,"Advertisement Though Maye was a limited participant in New England's first practice in advance of Super Bowl week, he was conspicuous by his absence from the media portion of their second session.
""I threw as much today as I would in a normal practice,"" Maye told ESPN's Mike Reiss.
Drake Maye Has Been the Patriots MVP This Season ThePatriotsare gearing up to take on the Seattle Seahawks in Super Bowl LX and could be bringing home yet another NFL Championship.
Accordingly, the narrative surrounding Maye's arms should rightfully take its place behind that of his pursuit to help bring an NFL-record seventh Super Bowl Championship back to New England.
Mike Vrabel Makes NFL History In Patriots' AFC Title Win Patriots Head to Super Bowl LX With Win Over Broncos Five Patriots to Watch in AFC Championship Game vs. Broncos Drake Maye Declares Patriots Ready for AFC Championship Game Former Patriots TE Recalls Iconic Playoff Tackle","As the ample crowd inside the San Jose Convention Centerin San Jose, Calif. began to congregate around New England Patriots quarterback Drake Maye, the Pats' second-team All-Pro delivered the news that mostly every football fan in the nation was waiting to hear.

""I'm feeling great ... I'll be fine,"" Maye said with a smile via WEEI. ""Was out there today, got an extra day of work in of practice...And then from there, looking forward to getting back out there the next couple of days.""

Advertisement

Though Maye was a limited participant in New England's first practice in advance of Super Bowl week, he was conspicuous by his absence from the media portion of their second session. As a result, the media was not provided the opportunity to observe Maye making any throws before the team traveled to Santa Clara this weekend to represent the AFC on Feb 8. Maye was missing from the field due to both illness and a potential injury to his throwing shoulder.

Though many entered Super Bowl week with notable concern that he would continue to be limited in his practicing throughout the week, Maye seemingly put any lingering qualms to rest by detailing his participation during his first practice of the week on the grounds of Stanford University.

""I threw as much today as I would in a normal practice,"" Maye told ESPN's Mike Reiss. The Pats QB went on to say that he felt he turned a corner with his right shoulder around the time the flight arrived in San Jose during the previous day. Ultimately, he liked the way it responded at practice.

Drake Maye Has Been the Patriots MVP This Season

ThePatriotsare gearing up to take on the Seattle Seahawks in Super Bowl LX and could be bringing home yet another NFL Championship. Patriots Nation has been collectively holding its breath since rumors began circulating that Maye injured his throwing arm during the team's 10-7 victory over the Denver Broncos in the AFC championship game.

Advertisement

Sports physician Dr. David Chao, per a recent mediaappearance, believes that the Pats' QB injured his throwing shoulder in the third quarter, prior to the flea-flicker pass play to Mack Hollins. Chao notes that Maye was slow to get up after being hit, while also demonstrating signs of discomfort when tapped on his shoulder pads in congratulations from his wife, Ann Michael Maye.

Maye finished the game without missing any time, and did not look particularly bothered by his shoulder or any other injuries during and after the contest. He completed his longest pass of the day, a 31-yarder to Hollins, two plays after the scramble in question and was quick to pop up again following a sack in the fourth quarter that saw him land on that very same right shoulder.

Though severalPatriotsplayers have significantly contributed to their streak of success, the one constant throughout the season has been Maye. The third overall selection in the 2024 NFL Draft compiled 4,394 passing yards and 31 touchdowns to just eight interceptions - helping to lead the Patriots to a 14-3 record and their first postseason appearance since 2021. Therefore, it should come as no surprise that Maye is also earning deserved mentions as a strong candidate for NFL MVP.

While few, if any, expected his game day status to be jeopardized by Maye's shoulder injury, the lack of hindrance in his throwing motion or mobility should be encouraging news for his game play. Accordingly, the narrative surrounding Maye's arms should rightfully take its place behind that of his pursuit to help bring an NFL-record seventh Super Bowl Championship back to New England.

Advertisement

Make sure you bookmark New England Patriots on SI for the latest news, exclusive interviews, film breakdowns, and so much more!

Mike Vrabel Makes NFL History In Patriots' AFC Title Win

Patriots Head to Super Bowl LX With Win Over Broncos

Five Patriots to Watch in AFC Championship Game vs. Broncos

Drake Maye Declares Patriots Ready for AFC Championship Game

Former Patriots TE Recalls Iconic Playoff Tackle",https://s.yimg.com/os/en/new_england_patriots_on_si_articles_598/40ca808ce67723a87e3ebd65f1c9a1ab,N,,2026-02-03 18:03:25.848528
,,2026-02-03 17:48:44+00:00,The Tipton Times,Former NFL Pro Alex Smith Fears Concussions Could Cause Football “Existential Crisis”,Not Available,,,,,"https://tiptontimes.com/premium/napsnet/stories/former-nfl-pro-alex-smith-fears-concussions-could-cause-football-existential-crisis,177491%3F","We use cookies on our site to enhance your user experience, provide personalized content, and analyze our traffic.","We use cookies on our site to enhance your user experience, provide personalized content, and analyze our traffic.",,N,,2026-02-03 14:06:33.375292
,,2026-02-03 17:23:15+00:00,Yahoo Sports,Patriots LB Gives Encouraging Injury Update Ahead of Super Bowl - Yahoo Sports,Ethan Hurwitz,,,,,https://sports.yahoo.com/articles/patriots-lb-gives-encouraging-injury-120007221.html,"The New England Patriots filed their injury report last week with a few names on there to monitor for Super Bowl LX.
""We're recovering, getting better every day,"" Spillane told reporters at Super Bowl Opening Night.
But a non-padded practice at Stanford is different than the Super Bowl.
Make sure you bookmark New England Patriots on SI for the latest news, exclusive interviews, film breakdowns, and so much more!
Mike Vrabel Makes NFL History In Patriots' AFC Title Win Patriots Head to Super Bowl LX With Win Over Broncos Five Patriots to Watch in AFC Championship Game vs. Broncos Drake Maye Declares Patriots Ready for AFC Championship Game Former Patriots TE Recalls Iconic Playoff Tackle","The New England Patriots filed their injury report last week with a few names on there to monitor for Super Bowl LX. Quarterback Drake Maye (right shoulder/illness) obviously drew most of the attention, but also on there was an injured linebacker who could make or break the Patriots' defense against the Seattle Seahawks.

Robert Spillane was listed as questionable after not participating in the team's last three practices. He had left the AFC championship game in Denver with a lower-body injury after making a pair of tackles, later announced as an ankle injury, and did not return to the team's 10-7 victory against the Broncos.

Advertisement

So how is the team captain feeling heading into the final week of the season?

""We're recovering, getting better every day,"" Spillane told reporters at Super Bowl Opening Night. ""We're on the right track. We're where we need to be and the goal is to obviously go out there and be dominant.""

Robert Spillane Trending Up For Super Bowl Debut

Spillane has been one of the team's cogs on defense, leading the Patriots in total tackles (97) to go with a pair of interceptions. He's been banged up at times this season, missing four games during the middle of the team's winning stretch, but returned for the playoffs.

Advertisement

Since making the trip to California, Spillane said he was ""running around"" at the Patriots' first practice of Super Bowl week -- a shortened 90-minute session without pads. It's a step in the right direction, for sure. But a non-padded practice at Stanford is different than the Super Bowl. There's a plan in place for Spillane to make his return to the lineup, and that starts with a good week of practice.

So far, the veteran likes what he sees from his team.

""I think we're in such a great place where it's confidence and light airiness,"" Spillane said. ""We know we're going to be right where we need to be.""

Advertisement

A trip to the Super Bowl isn't something Spillane -- a former undrafted free agent -- might have envisioned when he signed in New England this past offseason. It's clear he'll do whatever it takes to suit up with a trophy on the line.

""It's a long time coming,"" he said. ""It's years and years of dedication and passion, and love for this game. ... I'm just so proud and grateful to be here today.""

Make sure you bookmark New England Patriots on SI for the latest news, exclusive interviews, film breakdowns, and so much more!

Mike Vrabel Makes NFL History In Patriots' AFC Title Win

Patriots Head to Super Bowl LX With Win Over Broncos

Five Patriots to Watch in AFC Championship Game vs. Broncos

Drake Maye Declares Patriots Ready for AFC Championship Game

Former Patriots TE Recalls Iconic Playoff Tackle",https://s.yimg.com/os/en/new_england_patriots_on_si_articles_598/63c9a5c015c67403cded08e3a840b89c,N,,2026-02-03 18:03:29.732846
,,2026-02-03 17:15:55+00:00,www.tiktok.com,Bo Nix Criticizes Payton's Injury Comments | TikTok,Not Available,,,,,https://www.tiktok.com/en/trending/detail/bo-nix-criticizes-payton%25E2%2580%2599s-injury-comments,Broncos QB Bo Nix injury update!! @NFL @Denver Broncos #nfl #footballedit #nflfootballtiktok #broncos #injury · original sound - ARMCHAIR QB TALK. 35 ...,Not Available,,N,,2026-02-03 17:01:45.017566
