id,name,published,outlet,title,authors,category,market,categoryorder,articleorder,url,description,text,image,error,sentiment,firstEyes
,,2026-02-04 11:40:18+00:00,Yahoo Sports,Lindsey Vonn will compete despite torn ACL. Here's how other athletes performed with injury,"Chris Cwik, Chris Cwik Contributing",,,,,https://sports.yahoo.com/olympics/article/winter-olympics-2026-lindsey-vonn-will-compete-despite-torn-acl-heres-how-other-athletes-performed-with-injury-181245719.html,"Lindsey Vonn has a torn ACL.
A torn ACL typically results in about a year of rehab, and that's if both surgery and recovery go well.
Here is a list of players who have managed to keep playing through a torn ACL: NFL Garrison Hearst, Arizona Cardinals, 1993 It's unclear whether Garrison Hearst played on a torn ACL in college.
Carson Wentz, Philadelphia Eagles quarterback, 2017 In the midst of a possible MVP season, Philadelphia Eagles quarterback Carson Wentz sustained a torn ACL.
Rondo originally believed he was dealing with a hamstring issue, and had intended to continue playing through what was actually a torn ACL.","Lindsey Vonn has a torn ACL. Lindsey Vonn is still going to compete in the 2026 Milan Cortina Olympics. Those two sentences seem at odds with each other, but they are both true.

Vonn, who tore her ACL during a fall Friday, announced Tuesday that she still plans to compete at the Olympics despite the injury. She plans to wear a knee brace when she participates in the women's downhill Sunday.

Advertisement

Given the severity and nature of the injury, Vonn's desire to try and compete on a shredded knee feels like it shouldn't be possible. A torn ACL typically results in about a year of rehab, and that's if both surgery and recovery go well. Some athletes have missed even more time trying to return from one of sport's most devastating injuries.

But a select few have actually pushed through the pain and competed despite torn ACLs. Those athletes typically don't last long before they need to undergo surgery, but what Vonn is attempting has been done in the past.

Here is a list of players who have managed to keep playing through a torn ACL:

NFL

Garrison Hearst, Arizona Cardinals, 1993

It's unclear whether Garrison Hearst played on a torn ACL in college. The injury was discovered during the 1993 NFL scouting combine, though Hearst claimed he had not experienced knee pain during his time at Georgia. Hearst opted to not immediately undergo surgery, and was selected by the Arizona Cardinals with the No. 3 overall pick that year. Hearst then reportedly sustained another injury to the same knee during his rookie season in the NFL and underwent surgery after just six games. The exact nature of that surgery is not known, but Hearst may have played a few games in the NFL with a torn ACL.

Advertisement

Philip Rivers, San Diego/Los Angeles Chargers quarterback, 2008

Former Los Angeles Chargers quarterback Philip Rivers' toughness is not in question. The long-time vet — who improbably returned to the NFL in 2025 — is tied for third with 243 consecutive starts in the NFL. While this particular instance didn't count toward that streak, it proves his willingness to gut out injuries. In 2008, Rivers played the AFC championship game six days after tearing his ACL and meniscus in his right knee. The Chargers lost the contest 21-12. Rivers finished the game 19 for 37, with 211 passing yards and two interceptions.

Carson Wentz, Philadelphia Eagles quarterback, 2017

In the midst of a possible MVP season, Philadelphia Eagles quarterback Carson Wentz sustained a torn ACL. The injury occurred during the team's Week 14 win over the Los Angeles Rams. Wentz injured his knee during a third-quarter touchdown run that was called back due to a penalty. He attempted two more passes on the drive, completing a 2-yard touchdown to Alshon Jeffery to finish the drive. Wentz, however, was replaced by Nick Foles the next time the Eagles' offense took the field. Wentz then underwent season-ending surgery, missing the rest of the regular season and playoffs.

Advertisement

NHL

Joe Thornton, San Jose Sharks center, 2017

With the San Jose Sharks tied 1-1 with the Edmonton Oilers in the first round of the 2017 playoffs, Joe Thornton returned from a torn ACL and MCL to play in the final four games of the series. He managed two assists over those four games, though couldn't lead the Sharks to a win in the series. After the extent of Thornton's injuries were revealed, then-Sharks coach Peter DeBoer called it ""as courageous an effort ... as I've ever seen.""

Kyle Palmieri, New York Islanders forward, 2025

With the Islanders trailing the Philadelphia Flyers 3-0 in a November game, forward Kyle Palmieri took an ugly hit into the boards, tearing his ACL. Play wasn't stopped, however, as Palmieri somehow got up and gingerly made his way back to the team's bench. On the way there, he stole the puck from Flyers defenseman Emil Andrae. Palmieri then passed it to Jonathan Drouin, who passed it to Emil Heineman, who scored the first goal of the game for the Islanders. Palmieri was credited with an assist as he left the ice to go get his knee examined.

Advertisement

NBA

Rajon Rondo, Boston Celtics guard, 2013

During a January game against the Atlanta Hawks, Boston Celtics guard Rajon Rondo tore his ACL ... and stayed in the game for 12 more minutes. While it's unclear exactly when Rondo sustained the injury, it's believed it happened during a drive to the basket in the fourth quarter. Rondo remained in the contest after that and even intended to play in the team's next game before team doctors examined his knee 24 minutes before tip-off. Rondo originally believed he was dealing with a hamstring issue, and had intended to continue playing through what was actually a torn ACL.

Klay Thompson, Golden State Warriors guard, 2019

During Game 6 of the NBA Finals against the Toronto Raptors, Golden State Warriors sharpshooter Klay Thompson tore his ACL on a foul late in the third quarter. Thompson initially started to leave the game, but returned to the court to shoot his free throws. Thompson knew he wouldn't be allowed to return to the game had another player taken those shots, so he took them himself. Thompson made both shots before leaving the contest. He was unable to return to the contest, which the Warriors lost.

Golf

Tiger Woods, 2007

At some point in 2007, Tiger Woods ruptured his ACL while running at home. Instead of immediately having surgery, Woods opted to play through the injury. He won five of his next six events, including the 2008 U.S. Open, before eventually having his ACL repaired in 2008.

Advertisement

NCAA

Robert Griffin III, Baylor quarterback, 2009

During a 68-13 win over Northwestern State, Baylor quarterback Robert Griffin III threw three touchdowns in the first half after sustaining a torn ACL in the victory. Griffin, who was injured on the team's first drive, remained in the contest until halftime, believing he had hyperextended his knee. An MRI later revealed he tore his ACL. Griffin missed the rest of the season due to the injury.

MJ Metz, Duke designated hitter, 2023

During the regional round of the NCAA baseball tournament, Duke graduate transfer MJ Metz played four games on a torn ACL. He performed incredibly well, going 8-for-18 with four home runs and eight RBI despite the injury. Metz served as the team's designated hitter and played with a brace to stabilize his knee. He appeared in three more games in the super regional round, going 4-for-11 to finish out the year.

Advertisement

Kurtis Rourke, Indiana quarterback, 2024

Indiana quarterback Kurtis Rourke played his final NCAA season with a torn ACL, his agent revealed last January. Rourke managed 29 touchdowns against five interceptions with Indiana, leading the team to an 11-2 record. He underwent surgery to repair the injury last January and was selected by the San Francisco 49ers in the seventh round of the NFL Draft that April. He spent his rookie season on injured reserve.

Athletes who played without ACLs

While it's not exactly the same, there have been cases of some athletes having successful professional careers despite not having ACLs. Pittsburgh Steelers wideout Hines Ward has openly talked about that phenomenon, saying he found out he didn't have an ACL ahead of the 1998 NFL Draft.

He's not the only NFL player with that story. Tennessee Titans running back Tyjae Spears has played three seasons in the NFL without an ACL in one of his knees.

Advertisement

In the NBA, former San Antonio Spurs forward DeJuan Blair played seven seasons in the league despite not having either of his ACLs. Blair reportedly had two surgeries in high school that eventually resulted in him no longer having ACLs in his knees.",https://s.yimg.com/ny/api/res/1.2/T4EUzEg3jGkQywjDb3APrg--/YXBwaWQ9aGlnaGxhbmRlcjt3PTEyMDA7aD04MDA7Y2Y9d2VicA--/https://d29szjachogqwa.cloudfront.net/images/2026-02/efd30424-ff19-4127-b62c-602599b8b568,N,,2026-02-04 13:02:26.451854
,,2026-02-04 10:59:31+00:00,www.dailymotion.com,EVALUATION: NFL doctor explains Drake Maye's shoulder injury - video Dailymotion,Not Available,,,,,https://www.dailymotion.com/video/x9z6jp2,Watch EVALUATION: NFL doctor explains Drake Maye's shoulder injury - Channel B on Dailymotion.,Not Available,https://static.neon-ssr.dailymotion.com/neon-user-ssr/static/favicons/android-icon-36x36.2bcbc53d92a87f65eaf3.png,N,,2026-02-04 14:04:32.670029
,,2026-02-04 10:31:56+00:00,Heavy Sports,Insider Issues Eye-Opening Update on Patriots QB Drake Maye's Injury Status,"Owen Crisafulli, www.facebook.com, owen.crisafulli, heavy.com",,,,,https://heavy.com/sports/nfl/new-england-patriots/insider-drake-maye-shoulder-injury-update/,"As has usually been the case throughout the season, second-year quarterback Drake Maye is the talk of the town, but this time, he’s in the news for a different reason.
According to one NFL insider, though, it sounds like Maye and the Patriots have nothing to worry about.
Drake Maye’s Injury Status Not a Concern Ahead of Super Bowl LX In his first full season as the Patriots’ starting quarterback, Maye flourished under center.
In the wake of the AFC Championship Game, Maye popped up on the Pats’ injury report with a shoulder injury, immediately raising concerns about his status for the Super Bowl.
But make no mistake about it; the Pats mean business now that they are in the Super Bowl.","The New England Patriots are preparing for their final game of the 2025 campaign, which will see them square off against the Seattle Seahawks in Super Bowl LX. As has usually been the case throughout the season, second-year quarterback Drake Maye is the talk of the town, but this time, he’s in the news for a different reason.

All year long, Maye’s sudden rise from an inconsistent rookie to a de facto MVP candidate has made him one of the most popular players in the league. Ahead of the Super Bowl, though, Maye has been dealing with a bothersome shoulder injury, which has become one of the biggest storylines in the buildup to this game. According to one NFL insider, though, it sounds like Maye and the Patriots have nothing to worry about.

Drake Maye’s Injury Status Not a Concern Ahead of Super Bowl LX

In his first full season as the Patriots’ starting quarterback, Maye flourished under center. He finished the season with 4,394 yards and 31 touchdowns in the air, while also rushing for 450 yards and four more scores. Those numbers earned him his second straight Pro Bowl selection and a spot on the All-Pro Second Team.

In the postseason, Maye hasn’t been as good, but it’s worth noting that he’s faced three of the top-five defenses in the league, with two of those games featuring adverse weather conditions. It hasn’t necessarily been pretty, but when New England has needed a big play, Maye has been able to step up and deliver the goods.

In the wake of the AFC Championship Game, Maye popped up on the Pats’ injury report with a shoulder injury, immediately raising concerns about his status for the Super Bowl. However, Maye himself has publicly said he’s ready to roll for this game, and according to Ian Rapoport of NFL Network, it sounds like the same message is being echoed behind the scenes, too.

“It is going to be OK,” Rapoport said about Maye’s shoulder injury on “Super Bowl Live.” “That is the words of Drake Maye, that is the words of people I’ve spoken with who have in-depth knowledge of the situation … For Drake Maye, it is all systems go for the Super Bowl.”

Drake Maye Looking to Lead Patriots to Super Bowl Victory

Regardless of what happens in the Super Bowl, Maye has already proven himself to be not just New England’s quarterback of the future, but also one of the best players at his position in the entire league. Considering how this is only year No. 2 for him, that is wildly impressive, and it feels like the sky’s the limit for Maye and the Patriots.

But make no mistake about it; the Pats mean business now that they are in the Super Bowl. The Seahawks pose the biggest challenge this team has faced all season, but N.E. has proven it can go toe-to-toe with any team on any given night. And chances are, if the Patriots come out on top, it will be because Maye had another big game under center for his team.",https://heavy.com/wp-content/uploads/2026/02/GettyImages-2259662853-e1770156722798.jpg?quality=65&strip=all,N,,2026-02-04 11:06:56.729128
,,2026-02-04 08:42:37+00:00,www.rotowire.com,Amari Kight Injury: Shifts to IR - RotoWire,Not Available,,,,,https://www.rotowire.com/football/headlines/amari-kight-injury-shifts-to-ir-628861,"Need some more help when setting your NFL starting lineups? Use our NFL optimizer to guide your decisions, and be sure to check out our exclusive ...",Not Available,,N,,2026-02-04 11:07:29.263238
,,2026-02-04 08:31:29+00:00,www.si.com,Commanders Named as Trade Destination for NFL's Fastest Player - Sports Illustrated,Not Available,,,,,https://www.si.com/nfl/commanders/onsi/news/washington-commanders-trade-rumors-tyreek-hill-miami-dolphins,"Commanders Named as Trade Destination for NFL's Fastest Player. Despite serious injury concerns, the veteran speedster is viewed as the perfect ...",Not Available,,N,,2026-02-04 11:07:48.777970
,,2026-02-04 07:01:57+00:00,www.al.com,Former Alabama offensive lineman will miss Super Bowl LX,Not Available,,,,,https://www.al.com/sports/2026/02/former-alabama-offensive-lineman-will-miss-super-bowl-lx.html,"However, Kight sustained a knee injury in the playoff game and had not practiced since. FOR MORE OF AL.COM'S COVERAGE OF THE NFL, GO TO OUR NFL PAGE.",Not Available,,N,,2026-02-04 10:00:20.723647
,,2026-02-04 04:53:10+00:00,Jaguars Wire,Jacksonville Jaguars add a linebacker in 2-round 2025 NFL redraft,Paul Bretl,,,,,https://jaguarswire.usatoday.com/story/sports/nfl/jaguars/2026/02/03/jacksonville-jaguars-add-linebacker-2-round-2025-nfl-redraft/88490978007/,"ESPN's NFL Nation reporters recently redrafted the 2025 NFL draft.
So, who did the Jacksonville Jaguars come away with this time?
In the actual 2025 draft, the Jaguars traded up from pick No.
Now with those details out of the way, who did the Jaguars select?
In the actual draft, Campbell went 31st overall to Philadelphia.","ESPN's NFL Nation reporters recently redrafted the 2025 NFL draft. So, who did the Jacksonville Jaguars come away with this time?

In the actual 2025 draft, the Jaguars traded up from pick No. 5 to pick No. 2 to select Travis Hunter. In the redraft, however, there weren't any trades.

This means that the Jaguars picked at fifth overall and again in Round 2 at pick No. 36. Jacksonville didn't actually make that pick last year as it was part of the deal with Cleveland to move up to pick No. 2.

Now with those details out of the way, who did the Jaguars select?

Well, at pick No. 5, Travis Hunter was still on the board, so that is who Jacksonville selected.

Unfortunately, Hunter's season ended early due to a knee injury. And that injury occurred just as it looked like he was about to take off on the offensive side of the ball.

In Hunter's final game against the LA Rams in Week 7, he caught his first touchdown pass and recorded his first 100-yard receiving game. His role moving forward on offense was about to expand.

On defense, Hunter made 14 of his 15 tackle attempts. In coverage, he allowed 9 completions on 15 targets at a modest 10.7 yards per catch. Hunter logged two pass breakups and was penalized twice.

From the sounds of it, Hunter will see more time at cornerback at least to begin 2026.

Then at pick No. 36, the Jaguars went with Alabama linebacker Jihaad Campbell. In the actual draft, Campbell went 31st overall to Philadelphia.

As a rookie, he played 712 defensive snaps, totaling 14 quarterback pressures and 78 tackles. In coverage, he had an interception and two pass breakups, according to PFF.

What Campbell's role as a rookie would have looked like is unclear with Devin Lloyd and Foye Oluokun on the roster. But in 2026, with Lloyd set to hit free agency, the Jaguars would be more prepared for his potential departure.","https://jaguarswire.usatoday.com/gcdn/authoring/authoring-images/2026/01/24/SEAG/88338246007-usatsi-27572683.jpg?crop=4772,2684,x0,y0&width=3200&height=1800&format=pjpg&auto=webp",N,,2026-02-04 11:08:01.311141
,,2026-02-04 04:52:10+00:00,NFL.com,Josh Allen joins 'Super Bowl Live' to discuss injury and new HC in 2026 - NFL.com,Not Available,,,,,https://www.nfl.com/videos/josh-allen-joins-super-bowl-live-to-discuss-injury-and-new-hc-in-2026,"Buffalo Bills quarterback Josh Allen joins ""Super Bowl Live"" for an exclusive interview to discuss foot injury and new head coach Joe Brady.
Pro Football Hall of Fame running back John Riggins joins ""Super Bowl Live"" breaks down running back play ahead of Super Bowl LX.
Former NBA All-Star Baron Davis joins ""Super Bowl Live"" shares his thoughts on the Super Bowl LX matchup as well as the future of the Las Vegas Raiders.
Linebacker Christian Elliss on the New England Patriots opportunity to win franchise's seventh Super Bowl.
New England Patriots running back TreVeyon Henderson on his excitement to play in a Super Bowl.","Buffalo Bills quarterback Josh Allen joins ""Super Bowl Live"" for an exclusive interview to discuss foot injury and new head coach Joe Brady.

Seattle Seahawks linebacker Ernest Jones IV praises his high school and college football coaches for helping him get to where he is today.

NFL insider Ian Rapoport weighs in on Arizona Cardinals quarterback Kyler Murray's future with the team after Mike LaFleur's introductory press conference as head coach.

NFL media insider Ian Rapoport shares that New England Patriots quarterback Drake Maye's minor shoulder injury should not be an issue ahead of Super Bowl LX against the Seattle Seahawks.

Pro Football Hall of Fame running back John Riggins joins ""Super Bowl Live"" breaks down running back play ahead of Super Bowl LX.

Former NBA All-Star Baron Davis joins ""Super Bowl Live"" shares his thoughts on the Super Bowl LX matchup as well as the future of the Las Vegas Raiders.

NFL media insider Ian Rapoport discusses the Denver Broncos plan to promote former quarterback coach Davis Webb to offensive coordinator.

Linebacker Christian Elliss on the New England Patriots opportunity to win franchise's seventh Super Bowl.

New England Patriots running back TreVeyon Henderson on his excitement to play in a Super Bowl.

NFL commissioner Roger Goodell discusses new international cities that are set to host NFL games during the 2026 season.

NFL Network anchor Mike Yam, analyst David Carr, and chief national reporter Steve Wyche discuss who they think will win the 2025 AP Offensive Rookie of the Year at the NFL Honors on February 5th, 2026.

NFL Insider Ian Rapoport reports that the Pittsburgh Steelers have interviewed New Orleans Saints quarterback coach Scott Tolzien for their offensive coordinator vacancy.",https://static.www.nfl.com/image/upload/t_editorial_landscape_12_desktop/league/eohoc3hxmzdbqu9uyute,N,,2026-02-04 01:00:10.684890
,,2026-02-04 04:51:00+00:00,Newsweek,Patriots Get Concerning Drake Maye Injury Update Days Before Super Bowl LX - Newsweek,Nelson Espinal,,,,,https://www.newsweek.com/sports/nfl/patriots-get-concerning-drake-maye-injury-update-days-before-super-bowl-lx-11461683,"The New England Patriots are ramping up their preparations for Super Bowl LX, and Drake Maye's status has become a topic of discussion due to a lingering shoulder injury.
""Yeah, I think I'm a little bit more curious about the Drake Maye shoulder,"" Tucker said on an appearance of ""Donnie and Dhali.""
What has Drake Maye said about his injury?
During Super Bowl media day, May sounded confident about his status and availability, noting that he should be ready to go like normal.
""I felt good from the flight and throwing out there today, I think it turned the corner, and I really had no doubt being 100% for the game, this is the Super Bowl.","The New England Patriots are ramping up their preparations for Super Bowl LX, and Drake Maye's status has become a topic of discussion due to a lingering shoulder injury.

Maye is the star of the Patriots' offense, powering the engine and creating plays when needed, and the team will need him firing at full capacity given their underdog status.

Maye has been dealing with a shoulder problem, though he has downplayed its severity despite being listed as questionable in the last practice before heading out to Santa Clarita.

He was a limited participant in practice due to an injury and also missed Friday's practice with an illness.

With media activities leading up to the game starting, conversation about the true nature of his injury has begun, and Ross Tucker of CBS Sports believes Maye is more hurt than he is letting on.

""Yeah, I think I'm a little bit more curious about the Drake Maye shoulder,"" Tucker said on an appearance of ""Donnie and Dhali.""

""I think he'll play and I think he'll probably be fine, but fine is not the same as 100 percent. Fine is not the same as, you know, being able to do the stuff he did all season.

""I'm really curious, because even like last night, you watched some videos of him, didn't seem like he was moving the right arm as much as he was moving his left arm, and you know, maybe this is a big conspiracy theory.

""Maybe I'm making too much of it, but I'm curious to see how much it affects him, if at all. I mean he's talking about it, he says he'll be fine, but I guess we'll find out.""

What has Drake Maye said about his injury?

During Super Bowl media day, May sounded confident about his status and availability, noting that he should be ready to go like normal.

""I turned a corner landing on the flight (to San Francisco on Sunday),"" he said. ""I felt good from the flight and throwing out there today, I think it turned the corner, and I really had no doubt being 100% for the game, this is the Super Bowl. We get two weeks to prepare for it and do whatever we got to do to get it right. I've got confidence and feel good.""",https://assets.newsweek.com/wp-content/uploads/2026/02/GettyImages-2258691030.jpg?w=1200crop=1,N,,2026-02-04 01:00:14.539748
