id,name,published,outlet,title,authors,category,market,categoryorder,articleorder,url,description,text,image,error,sentiment,firstEyes
,,2026-02-05 03:43:57+00:00,NFLTradeRumors.co,Seahawks S Nick Emmanwori Suffered Ankle Injury In Practice On Wednesday,Tony Williams,,,,,https://nfltraderumors.co/seahawks-s-nick-emmanwori-suffered-ankle-injury-in-practice-on-wednesday/,"Seahawks S Nick Emmanwori suffered an ankle injury during practice on Wednesday, according to Kalyn Kahler.
Emmanwori will undergo imaging to make sure that he didn’t suffer a serious injury, Ian Rapoport adds.
Emmanwori, 21, was a three-star prospect and the 59th-ranked safety in the 2022 recruiting class out of Irmo, South Carolina.
He committed to South Carolina and enrolled for the 2022 season.
In 2025, Emmanwori has appeared in 14 games for the Seahawks, making 11 starts.","Seahawks S Nick Emmanwori suffered an ankle injury during practice on Wednesday, according to Kalyn Kahler. Emmanwori was injured while attempting to defense a pass late in practice.

He was, however, able to walk off under his own power.

“He had an ankle today, we brought him in to look at it, and we’ll kind of go from here and figure out what are the next steps,” HC Mike Macdonald said.

Emmanwori will undergo imaging to make sure that he didn’t suffer a serious injury, Ian Rapoport adds.

Emmanwori, 21, was a three-star prospect and the 59th-ranked safety in the 2022 recruiting class out of Irmo, South Carolina. He committed to South Carolina and enrolled for the 2022 season.

Emmanwori was selected as a First-Team AP All-American in 2024.

The Seahawks used the No. 35 overall pick in the 2025 NFL Draft on Emmanwori. He signed a four-year, $11,601,260 rookie contract with a $5,077,280 signing bonus.

In 2025, Emmanwori has appeared in 14 games for the Seahawks, making 11 starts. He has 81 total tackles, including nine tackles for loss and 2.5 sacks.",https://i0.wp.com/nfltraderumors.co/wp-content/uploads/2026/02/USATSI_28086319_168383805_lowres.jpg?fit=2182%2C1455&ssl=1,N,,2026-02-05 01:59:30.286502
,,2026-02-05 03:35:41+00:00,PFWA,"New England Patriots PFWA Super Bowl LX Pool Report – Feb. 4, 2026",PFWA,,,,,https://www.profootballwriters.org/2026/02/04/new-england-patriots-pfwa-super-bowl-lx-pool-report-feb-4-2026/,"New England Patriots Practice Feb. 4, 2025 By Lindsay Jones Pro Football Writers of America PALO ALTO, Calif. – New England Patriots quarterback Drake Maye was a full participant in Wednesday’s practice as the team resumed its on-field preparations for Super Bowl LX against Seattle.
This was a suggestion from offensive coordinator Josh McDaniels, who is coaching in his 10th Super Bowl as a member of the Patriots’ staff.
“We’re now talking about 36 hours being critical here, before people come in, friends and obligations that come with this game,” Vrabel said.
Like McDaniels, those three men are quite familiar with the Super Bowl preparation process, but it’s all new for most of Vrabel’s squad.
No Patriot remains on the roster from their last Super Bowl and only five players on the current roster have prior Super Bowl experience.","New England Patriots Practice

Feb. 4, 2025

By Lindsay Jones

Pro Football Writers of America

PALO ALTO, Calif. – New England Patriots quarterback Drake Maye was a full participant in Wednesday’s practice as the team resumed its on-field preparations for Super Bowl LX against Seattle.

The second-year quarterback, who injured his right shoulder during the AFC championship game, took all of the team’s first-team reps during a 90-minute practice at Stanford Stadium. He had told reporters earlier in the week that he was “feeling good” and that certainly appeared to be the case as the team worked through seven-on-seven and full-squad drills in full shoulder pads.

While the team installed much of its game plan during practices last week in Foxborough, head coach Mike Vrabel said his staff saved several elements of that plan so they would have new information to present to players in meetings and practices here in the Bay Area. This was a suggestion from offensive coordinator Josh McDaniels, who is coaching in his 10th Super Bowl as a member of the Patriots’ staff.

“No one has more experience than Josh with this, and he felt like that we needed to do something to keep them engaged and stimulated, so they weren’t looking at some things for the second or third time,” Vrabel said.

Vrabel is taking that engagement literally. After practice ended, Vrabel pulled a group of interior defensive linemen aside for extra instruction. Vrabel even got down into a three-point stance to work with defensive tackle Cory Durden on pass rush technique.

“We’re now talking about 36 hours being critical here, before people come in, friends and obligations that come with this game,” Vrabel said.

Team owners Robert and Jonathan Kraft arrived at Stanford with legendary Patriots receiver Julian Edelman. Like McDaniels, those three men are quite familiar with the Super Bowl preparation process, but it’s all new for most of Vrabel’s squad. No Patriot remains on the roster from their last Super Bowl and only five players on the current roster have prior Super Bowl experience.

“We’ve got some things to clean up, and then we’ve got to forge ahead,” Vrabel said. “We want to continue to keep the energy and the enthusiasm, but the execution is going to end up really helping us win the game.”

Maye was listed on the team’s first injury report with the shoulder, but as a full participant. Linebacker Robert Spillane was the only Patriots player who did not participate as he continues to recover from an ankle injury he suffered in the AFC title game in Denver. Linebacker Harold Landry was listed as a limited participant with a knee injury. Other players listed on the injury report were backup offensive lineman Thayer Munford Jr. (limited, knee) and defensive tackle Joshua Farmer (full participant, hamstring.) Farmer remains on the injured reserved list but has been designed to return.",https://www.profootballwriters.org/wp-content/uploads/2026/02/sb60patriotspool020426.png,N,,2026-02-05 03:58:40.483793
,,2026-02-05 03:23:40+00:00,masslive,Seahawks 'X-factor' suffers injury in practice days before Super Bowl 60 - MassLive,"Chris Mason | cmason@masslive.com, Chris Mason, cmason@masslive.com",,,,,https://www.masslive.com/patriots/2026/02/seahawks-x-factor-suffers-injury-in-practice-days-before-super-bowl-60.html,One of Seattle’s best young players suffered an injury in Wednesday’s practice.,Not Available,https://www.masslive.com/resizer/v2/WEIY36PEJ5GK5EUDYHK3DASTWM.jpg?auth=69bf20d84d7a05a1fd7719e82440762ea2aeaca905f607d387aed82c8c396fc7&width=1280&smart=true&quality=90,N,,2026-02-05 00:01:18.386177
,,2026-02-05 02:58:41+00:00,www.si.com,Patriots Fans Get Promising News From Drake Maye's First Injury Report - Sports Illustrated,Not Available,,,,,https://www.si.com/nfl/patriots/onsi/news/new-england-patriots-fans-promising-drake-mayes-first-injury-report,"... injury to his throwing shoulder ... Making their 12th Super Bowl appearance, a victory will give the Patriots their seventh NFL title and the most Super ...",Not Available,,N,,2026-02-05 00:01:24.260649
,,2026-02-05 02:57:04+00:00,The Athletic,Drake Maye a full participant in Patriots practice; LB Robert Spillane still sidelined,Chad Graff,,,,,https://www.nytimes.com/athletic/7022888/2026/02/04/drake-maye-patriots-injury-status-robert-spillane-super-bowl/,"SANTA CLARA, Calif. — For the first time since suffering an injury to his throwing shoulder in the AFC Championship Game, New England Patriots quarterback Drake Maye was listed as a full participant in practice on Wednesday.
“It feels good,” Maye said of his shoulder on Wednesday morning before the team’s afternoon practice at Stanford University.
The Patriots have two practices — on Thursday and Friday — remaining before the Super Bowl.
The bad news was that leading tackler Robert Spillane did not participate in the practice due to an ankle injury.
Spillane said Wednesday morning that he’s confident he’ll play in the Super Bowl, but it’s still noteworthy that the linebacker did not take part in practice.","SANTA CLARA, Calif. — For the first time since suffering an injury to his throwing shoulder in the AFC Championship Game, New England Patriots quarterback Drake Maye was listed as a full participant in practice on Wednesday.

Maye has insisted all week in interviews that his shoulder feels fine, but worry was ramped up last Friday when Maye did not participate in the team’s final practice before flying to California.

“It feels good,” Maye said of his shoulder on Wednesday morning before the team’s afternoon practice at Stanford University.

The Patriots have two practices — on Thursday and Friday — remaining before the Super Bowl.

Maye’s status was the good news for New England. The bad news was that leading tackler Robert Spillane did not participate in the practice due to an ankle injury. Spillane said Wednesday morning that he’s confident he’ll play in the Super Bowl, but it’s still noteworthy that the linebacker did not take part in practice.

Harold Landry, who led the Patriots with 8.5 sacks in the regular season, was a limited participant on Wednesday due to a knee injury that has lingered for over a month.

But Maye was the big concern. After insisting he would be fine for the Super Bowl, it was a good sign for the Patriots that he was back to being a full go in practice.",https://static01.nyt.com/athletic/uploads/wp/2026/02/04203412/GettyImages-2259975283-scaled.jpg?width=1200&height=630&fit=cover,N,,2026-02-05 03:58:44.028868
,,2026-02-05 02:49:59+00:00,www.seahawks.com,Seahawks vs. Patriots Super Bowl Injury Report,John Boyle,,,,,https://www.seahawks.com/news/seahawks-vs-patriots-super-bowl-injury-report,"Wednesday's Injury Report Also limited due to injury were tackle Josh Jones, who is dealing with knee and ankle injuries, fullback Robbie Ouzts, who missed the NFC championship game with a neck injury, and safety Nick Emmanwori, who is new to the injury report this week with an ankle injury.
Per the pool report put out by the Pro Football Writers of America (each Super Bowl team is assigned one pool reporter), Emmanwori suffered the ankle injury during practice.
From ESPN's Kalyn Kahler, who served as the pool reporter: The rookie safety injured his ankle while defending a pass late in practice.
He walked off the field on his own shortly before 4 p.m. Several players and coaches went over to comfort him before he left.
Quarterback Drake Maye, who last week was limited in practice two days and did not practice another due to a shoulder injury, was a full participant.","Wednesday's Injury Report

Also limited due to injury were tackle Josh Jones, who is dealing with knee and ankle injuries, fullback Robbie Ouzts, who missed the NFC championship game with a neck injury, and safety Nick Emmanwori, who is new to the injury report this week with an ankle injury.

Per the pool report put out by the Pro Football Writers of America (each Super Bowl team is assigned one pool reporter), Emmanwori suffered the ankle injury during practice. From ESPN's Kalyn Kahler, who served as the pool reporter:

The rookie safety injured his ankle while defending a pass late in practice. He walked off the field on his own shortly before 4 p.m. Several players and coaches went over to comfort him before he left.

""He had an ankle today, we brought him in to look at it, and we'll kind of go from here and figure out what are the next steps?"" (Mike) Macdonald said.

Among those on the injury report but practicing fully are two players who exited the NFC championship game win over Rams early due to injury, fullback and special teams standout Brady Russell (hand) and linebacker Drake Thomas (shoulder)

For the Patriots, starting linebacker Robert Spillane was a non-participant due to an ankle injury, while two players, outside linebacker Harold Landry (knee) and tackle Thayer Munford (knee) were limited. Quarterback Drake Maye, who last week was limited in practice two days and did not practice another due to a shoulder injury, was a full participant.",https://static.clubs.nfl.com/image/upload/t_editorial_landscape_12_desktop/seahawks/lojclc7czy3vcvufpzfq,N,,2026-02-04 22:00:02.418537
,,2026-02-05 02:48:47+00:00,www.yourvalley.net,NFL Injury Report - Daily Independent,,,,,,"https://www.yourvalley.net/stories/nfl-injury-report,658909","NFL Injury Report. Posted Wednesday, February 4, 2026 6:51 pm. By The Associated Press. The National Football League injury report, as provided by ...",Not Available,,Y,,2026-02-04 22:59:11.046542
,,2026-02-05 02:47:11+00:00,CBS Sports,"Super Bowl LX injury report: Updates on Drake Maye's right shoulder, Sam Darnold's oblique, more",Tyler Sullivan,,,,,https://www.cbssports.com/nfl/news/super-bowl-lx-injury-report-updates-on-drake-mayes-right-shoulder-sam-darnolds-oblique-more/,"SAN FRANCISCO -- We are one step closer to Super Bowl LX.
One of the key storylines of this Super Bowl will be the health of both franchises as each has dealt with some injuries, particularly at the quarterback position.
Sam Darnold has been nursing an oblique injury this postseason, while Drake Maye has been managing an injury to his right throwing shoulder.
Of course, if both teams have to have their best chances of finding themselves as the land team standing and Super Bowl champions, they'll need their signal-callers firing on all cylinders.
Seattle Seahawks (-4.5) at New England Patriots Sunday, 6:30 p.m.","SAN FRANCISCO -- We are one step closer to Super Bowl LX. Both the Seattle Seahawks and New England Patriots took the practice field on Wednesday to continue their preparation for their bid to hoist the Lombardi Trophy.

One of the key storylines of this Super Bowl will be the health of both franchises as each has dealt with some injuries, particularly at the quarterback position. Sam Darnold has been nursing an oblique injury this postseason, while Drake Maye has been managing an injury to his right throwing shoulder. Of course, if both teams have to have their best chances of finding themselves as the land team standing and Super Bowl champions, they'll need their signal-callers firing on all cylinders.

Below, we'll update you on both Maye and Darnold, along with the rest of the roster, as both clubs unveil their first official injury report of Super Bowl week.

Seattle Seahawks (-4.5) at New England Patriots

Sunday, 6:30 p.m. ET on NBC

Seahawks: Seattle had perfect attendance at practice, but did have several players limited: Quarterback Sam Darnold (oblique), offensive tackle Charles Cross (foot), safety Nick Emmanwori (ankle), offensive tackle Josh Jones (ankle, knee), linebacker Demarcus Lawrence (rest), fullback Robbie Ouzts (neck), receiver Jaxon Smith-Njigba (rest), and defensive end Leonard Williams (rest).",https://sportshub.cbsistatic.com/i/r/2026/02/04/18f682b1-6591-40db-96a5-c9abfb5bfd87/thumbnail/1200x675/c29be88e901aba68c8eb5f22d8821a33/template-pic.jpg,N,,2026-02-04 22:00:06.287616
,,2026-02-05 02:45:30+00:00,Seattle Sports,"Super Bowl Injury Report: Seahawks' list is long, but Pats have a DNP - Seattle Sports",Brent Stecker,,,,,https://sports.mynorthwest.com/nfl/seattle-seahawks/super-bowl-injury-report-first-seattle-seahawks/1838193,"The Seattle Seahawks’ first official injury report of Super Bowl is a long list of players, but the good news is every single one of them practiced Wednesday.
Spillane, who did not practice at all last week, said Wednesday to the media that he is confident he will play Sunday in the Super Bowl.
Here are the full Seahawks and Patriots injury reports from Wednesday.
Seattle Sports 710 AM, KIRO Newsradio 97.3 FM and the Seattle Sports, KIRO Newsradio and official Seahawks apps will be the only places where you can hear Steve Raible and Dave Wyman call the Super Bowl.
Super Bowl: Seattle Seahawks vs. New England Patriots • Seahawks’ track record should worry Pats QB Drake Maye • There’s only one way Pats can beat Seahawks in Super Bowl, insider says • Super Bowl: Seahawks activate LB, place OT on injured reserve • Unheralded Seahawks and Patriots who could impact Super Bowl • How Seattle Seahawks would stack up historically with Super Bowl win","The Seattle Seahawks’ first official injury report of Super Bowl is a long list of players, but the good news is every single one of them practiced Wednesday.

Daniel Jeremiah: One matchup where Pats have clear edge over Seahawks

The New England Patriots, on the other hand, had a much shorter list but had one player who did not participate in practice.

That one player is linebacker Robert Spillane, an eighth-year linebacker who started 13 games in the regular season and three postseason games for the Patriots. The 30-year-old Spillane has an ankle injury that kept him from playing four games during the season and was re-aggravated in New England’s AFC Championship win in Denver.

Spillane, who did not practice at all last week, said Wednesday to the media that he is confident he will play Sunday in the Super Bowl.

As for the Seahawks, they had eight players listed as limited in Wednesday’s practice, two of which were for rest reasons, and another six who were full participants despite dealing with injuries.

Among Seattle’s limited players were starting left tackle Charles Cross (foot) and his backup, Josh Jones (ankle/knee). Quarterback Sam Darnold continued to be listed as limited with an oblique injury, something he has played with throughout the playoffs.

Seahawks’ Sam Darnold says oblique feels ‘really good’

One potential concern for Seattle is the inclusion of standout rookie safety Nick Emmanwori as a limited player with an ankle injury. Emmanwori previously missed nearly a month after injuring his ankle in Week 1 of the season.

The Patriots’ injury report was just five players long. Quarterback Drake Maye was listed as a full participant with a shoulder injury, an issue that became known after the AFC Championship.

Here are the full Seahawks and Patriots injury reports from Wednesday.

Seattle Seahawks

Full participation

WR Jake Bobo (hand)

LB Ernest Jones IV (chest)

S Julian Love (shoulder)

FB Brady Russell (hand)

TE Eric Saubert (hamstring)

LB Drake Thomas (shoulder)

Limited participation

OT Charles Cross (foot)

QB Sam Darnold (oblique)

S Nick Emmanwori (ankle)

OT Josh Jones (ankle, knee)

LB Demarcus Lawrence (rest)

FB Robbie Ouzts (neck)

WR Jaxon Smith-Njigba (rest)

DE Leonard Williams (rest)

New England Patriots

Full participation

DT Joshua Farmer (hamstring)

QB Drake Maye (right shoulder)

Limited participation

LB Harold Landry (knee)

OT Thayer Munford (knee)

Did not practice

LB Robert Spillane (ankle)

Radio coverage of the Super Bowl on Seattle Sports will begin with the Seahawks Radio Network pregame show at noon on Sunday. Seattle Sports 710 AM, KIRO Newsradio 97.3 FM and the Seattle Sports, KIRO Newsradio and official Seahawks apps will be the only places where you can hear Steve Raible and Dave Wyman call the Super Bowl.

Super Bowl: Seattle Seahawks vs. New England Patriots

• Seahawks’ track record should worry Pats QB Drake Maye

• There’s only one way Pats can beat Seahawks in Super Bowl, insider says

• Super Bowl: Seahawks activate LB, place OT on injured reserve

• Unheralded Seahawks and Patriots who could impact Super Bowl

• How Seattle Seahawks would stack up historically with Super Bowl win",https://sports.mynorthwest.com/wp-content/uploads/2026/02/super-bowl-injury-report-seattle-seahawks-patriots-robert-spillane-getty-900.jpg,N,,2026-02-04 22:00:10.496989
,,2026-02-05 02:44:58+00:00,Boston Herald,Patriots get great news on first injury report of Super Bowl LX week - Boston Herald,Doug Kyed,,,,,https://www.bostonherald.com/2026/02/04/patriots-get-great-news-on-first-injury-report-of-super-bowl-lx-week/,"SANTA CLARA — Patriots quarterback Drake Maye upgraded his participation in practice this week.
Maye was a full participant on Wednesday, the first practice of the week.
The Patriots starting QB clearly should be good to go for Super Bowl LX on Sunday.
Elsewhere, linebacker Robert Spillane (ankle) was a non-participant on Wednesday.
Landry has been dealing with a nagging knee injury since Week 6, while Spillane injured his ankle in last Sunday’s AFC Championship Game win over the Broncos.","SANTA CLARA — Patriots quarterback Drake Maye upgraded his participation in practice this week.

Maye was a full participant on Wednesday, the first practice of the week. Maye didn’t practice last Friday due to an illness and right shoulder injury. The Patriots starting QB clearly should be good to go for Super Bowl LX on Sunday.

Elsewhere, linebacker Robert Spillane (ankle) was a non-participant on Wednesday.

Here’s the full injury report:

DID NOT PARTICIPATE

LB Robert Spillane – Ankle

LIMITED PARTICIPATION

LB Harold Landry III – Knee

OT Thayer Munford Jr. – Knee

FULL PARTICIPATION

DT Joshua Farmer – Hamstring

QB Drake Maye – Right Shoulder

Spillane and Landry both have said they are trending towards playing in Super Bowl LX. Landry has been dealing with a nagging knee injury since Week 6, while Spillane injured his ankle in last Sunday’s AFC Championship Game win over the Broncos.

Spillane was spotted testing the ankle out on the sideline but couldn’t return to the game.

Farmer remains on injured reserve. It feels unlikely that he’ll be activated by Sunday, barring another injury at defensive tackle.",https://www.bostonherald.com/wp-content/uploads/2026/02/AP26036042714309.jpg?w=1024&h=683,N,,2026-02-04 22:00:15.469958
,,2026-02-05 02:42:57+00:00,Field Gulls,Seattle Seahawks release first Super Bowl game week injury report | Field Gulls,Mookie Alexander,,,,,https://www.fieldgulls.com/seattle-seahawks-injury-report/161989/seahawks-release-first-super-bowl-game-week-injury-report-nfl-news,"The Seattle Seahawks’ Wednesday practice report is out for Super Bowl week, and it’s more encouraging than the lengthy list suggests.
None of the 14 players the Seahawks put on their initial injury report was a non-participant.
Sam Darnold remains limited in the loosest sense as he manages an oblique injury that otherwise has not caused him to miss any game time, and certainly not the Super Bowl.
Amari Kight being placed on injured reserve should bode well for the likelihood that Josh Jones will have no issues being available for Super Bowl Sunday.
Jones was active for the NFC Championship Game after missing the San Francisco 49ers game due to multiple injuries.","The Seattle Seahawks’ Wednesday practice report is out for Super Bowl week, and it’s more encouraging than the lengthy list suggests.

None of the 14 players the Seahawks put on their initial injury report was a non-participant. Fullback Robbie Ouzts is still worth monitoring closely given he missed the NFC Championship Game with a neck injury, and has otherwise been limited over te past several practices. Field Gulls attended media availability, for which Ouzts was slated to be a participant at a table alongside fellow fullback Brady Russell, but we only saw Russell the entire time.

Sam Darnold remains limited in the loosest sense as he manages an oblique injury that otherwise has not caused him to miss any game time, and certainly not the Super Bowl. Jaxon Smith-Njigba, Leonard Williams, and DeMarcus Lawrence got to rest a bit and do some light work.

Amari Kight being placed on injured reserve should bode well for the likelihood that Josh Jones will have no issues being available for Super Bowl Sunday. Jones was active for the NFC Championship Game after missing the San Francisco 49ers game due to multiple injuries.

Safety Nick Emmanwori was limited with an ankle issue, although the severity is unknown. Starting left tackle Charles Cross was also limited but otherwise there’s no reason to worry, for he told Field Gulls, “I’m feeling good.”

Here’s the full report for both the Seahawks and New England Patriots, whose injury report was light but did have linebacker Robert Spillane as a non-participant.

The Seahawks are back at practice on Thursday, with game designations set for Friday.",https://platform.fieldgulls.com/wp-content/uploads/sites/81/2026/02/gettyimages-2251243521.jpg?quality=90&strip=all&crop=0%2C10.735702674343%2C100%2C78.528594651313&w=1200,N,,2026-02-04 22:00:19.835318
,,2026-02-05 01:58:54+00:00,X (formerly Twitter),Najee Harris at the NFL Awards after winning “funniest injury ever”,Not Available,,,,,https://x.com/theMayor_Mike/status/2019087515853205967,Mayor Mike (@theMayor_Mike). 191 replies. Najee Harris at the NFL Awards after winning “funniest injury ever”,"JavaScript is not available.

We’ve detected that JavaScript is disabled in this browser. Please enable JavaScript or switch to a supported browser to continue using x.com. You can see a list of supported browsers in our Help Center.",,N,,2026-02-04 22:59:14.343593
,,2026-02-05 01:55:42+00:00,X (formerly Twitter),Drake Maye (right shoulder) listed a full participant in first injury report of Super Bowl week ...,Not Available,,,,,https://x.com/AroundTheNFL/status/2019216905731731479,Around The NFL (@AroundTheNFL). 22 likes 4 replies. Drake Maye (right shoulder) listed a full participant in first injury report of Super Bowl ...,"JavaScript is not available.

We’ve detected that JavaScript is disabled in this browser. Please enable JavaScript or switch to a supported browser to continue using x.com. You can see a list of supported browsers in our Help Center.",,N,,2026-02-04 22:59:17.745048
