id,name,published,outlet,title,authors,category,market,categoryorder,articleorder,url,description,text,image,error,sentiment,firstEyes
,,2026-02-05 22:07:21+00:00,Seattle Sports,Doctors weigh in on Nick Emmanwori's ankle injury on social media - Seattle Sports,Brent Stecker,,,,,https://sports.mynorthwest.com/nfl/seattle-seahawks/doctors-seattle-seahawks-nick-emmanwori-ankle-injury-super-bowl/1838276,"A pair of well-known sports medicine doctors on social media have shared their thoughts on the ankle injury suffered by standout Seattle Seahawks rookie safety Nick Emmanwori in practice Wednesday, just days ahead of the Super Bowl.
Fellow Seahawks safety Coby Bryant had a more positive update on Emmanwori when he joined Seattle Sports’ Brock and Salk on Thursday morning.
Radio coverage of the Super Bowl on Seattle Sports will begin with the Seahawks Radio Network pregame show at noon on Sunday.
Seattle Sports 710 AM, KIRO Newsradio 97.3 FM and the Seattle Sports, KIRO Newsradio and official Seahawks apps will be the only places where you can hear Steve Raible and Dave Wyman call the Super Bowl.
Super Bowl: Seattle Seahawks vs. New England Patriots • Seahawks’ track record should worry Pats QB Drake Maye • There’s only one way Pats can beat Seahawks in Super Bowl, insider says • Super Bowl: Seahawks activate LB, place OT on injured reserve • Unheralded Seahawks and Patriots who could impact Super Bowl • How Seattle Seahawks would stack up historically with Super Bowl win","A pair of well-known sports medicine doctors on social media have shared their thoughts on the ankle injury suffered by standout Seattle Seahawks rookie safety Nick Emmanwori in practice Wednesday, just days ahead of the Super Bowl.

Seahawks ‘fully expect’ Emmanwori to play in Super Bowl

A TikTok video that made its way onto X showed Emmanwori getting out of a vehicle and walking into a hotel on Wednesday night, favoring his right leg while doing so.

David J. Chao, who goes by the handle @ProFootballDoc, said the way Emmanwori walks in the video signals a “likely right inversion ankle sprain.” Chao, who was the head team doctor of the NFL’s San Diego Chargers for 17 years and is now an injury expect for SiriusXM and FOX Sports Radio, added that he believed Emmanwori “would be out today but (Super Bowl 60 is three) days away.”

Super Bowl Injury Report: Seahawks’ list is long, but Pats have a DNP

Jesse Morse, whose handle is @DrJesseMorse, shared a more detailed assessment after seeing the same video of Emmanwori, describing the way he walked into the hotel as a “significant limp.” Morse believes Emmanwori’s ankle injury is a new one and not a re-aggravation of the high-ankle sprain that he suffered in Week 1 that kept him out of action for nearly a month.

“Upon further review this appears to be a new injury to his right ankle, not an exact reinjury to his old Week 1 injury, likely to the medial aspect of the right ankle, but it’s not blatantly obvious which ligaments are affected the most,” Morse wrote. “This is unlikely to be a high-ankle sprain, especially since he’s not on crutches or in a boot.”

That’s potentially good news as a high-ankle sprain is generally a tougher injury to recover from than a normal ankle sprain. That being said, Morse wrote that the injury is “still very concerning nonetheless” and that “he will be VERY limited” should Emmanwori play in the Super Bowl on Sunday.

Emmanwori, who the Seahawks picked in the second round of the 2025 NFL Draft out of South Carolina, is a versatile weapon who the Seahawks move between several positions on defense. He is a finalist for the Defensive Rookie of the Year Award that will announced during the NFL Honors ceremony on Thursday night after registering 11 passes defensed, one interception, 2.5 sacks, four QB hits, nine tackles for loss and 81 combined tackles in 14 games in the regular season. In two playoff games, Emmanwori has made four passes defensed, a fumble recovery and eight combined tackles.

Seahawks head Mike Macdonald didn’t have much to share about Emmanwori’s status after Wednesday’s practice.

“He had an ankle today, we brought him in to look at it, and we’ll kind of go from here and figure out what are the next steps,” Macdonald said.

Fellow Seahawks safety Coby Bryant had a more positive update on Emmanwori when he joined Seattle Sports’ Brock and Salk on Thursday morning. Click here for more.

Radio coverage of the Super Bowl on Seattle Sports will begin with the Seahawks Radio Network pregame show at noon on Sunday. Seattle Sports 710 AM, KIRO Newsradio 97.3 FM and the Seattle Sports, KIRO Newsradio and official Seahawks apps will be the only places where you can hear Steve Raible and Dave Wyman call the Super Bowl.

Super Bowl: Seattle Seahawks vs. New England Patriots

• Seahawks’ track record should worry Pats QB Drake Maye

• There’s only one way Pats can beat Seahawks in Super Bowl, insider says

• Super Bowl: Seahawks activate LB, place OT on injured reserve

• Unheralded Seahawks and Patriots who could impact Super Bowl

• How Seattle Seahawks would stack up historically with Super Bowl win",https://sports.mynorthwest.com/wp-content/uploads/2026/02/seattle-seahawks-nick-emmanwori-side-profile-injury-getty-900.jpg,N,,2026-02-05 18:01:21.756288
,,2026-02-05 21:19:43+00:00,Sky Sports,Nick Emmanwori expecting to play at Super Bowl after Seattle Seahawks star suffers injury scare,Not Available,,,,,https://www.skysports.com/nfl/news/12118/13503817/super-bowl-2026-nick-emmanwori-expecting-to-play-at-super-bowl-after-seattle-seahawks-star-suffers-injury-scare,"The Seattle Seahawks are expected to have Nick Emmanwori available for Sunday's Super Bowl despite a late injury scare for the star defender.
Seahawks head coach Mike Macdonald was able to see the lighter side on Thursday, joking of the inevitable opening question to his press conference.
Welcome to Super Bowl 60!
The greatest party in sport is here Super Bowl 2026: All you need to know Got Sky?
Watch the Super Bowl on the Sky Sports app📱 Not got Sky?","The Seattle Seahawks are expected to have Nick Emmanwori available for Sunday's Super Bowl despite a late injury scare for the star defender.

The second-round rookie nickel limped off at practice on Wednesday after suffering an ankle injury, leaving Seahawks fans with an anxious overnight wait just days out from their Super Bowl 60 showdown with the New England Patriots in Santa Clara, California.

Seahawks head coach Mike Macdonald was able to see the lighter side on Thursday, joking of the inevitable opening question to his press conference.

""There's no way the first question is about Nick, is it?,"" he said.

Welcome to Super Bowl 60! The greatest party in sport is here

Super Bowl 2026: All you need to know

Got Sky? Watch the Super Bowl on the Sky Sports app📱

Not got Sky? Get instant access with NOW 📺

""He rolled his ankle yesterday, has a low ankle sprain. Not sure how extensive. He's confident, we fully expect him to play.

""He's doing great, just got to make sure we handle it the right way. Probably have to be overly-careful and over-cautious.""

Emmanwori has asserted himself as one of the most valuable and versatile cogs to Macdonald's shape-shifting defense across the second half of the season.

He would spread his time across safety, nickel, corner, linebacker and even edge rusher as Seatte's new prized chesspiece, recording 81 tackles, 2.5 sacks, one interception and 11 pass break-ups during the regular season before managing a fumble recovery and four pass defenses in the playoffs.

""I expect to play on Sunday. Feel good,"" Emmanwori told reporters on Thursday.

The Seahawks selected Emmanwori with the 35th overall pick out of South Carolina last year, his arrival immediately prompting comparisons to Macdonald's multi-purpose use of Baltimore Ravens safety Kyle Hamilton.

Emmanwori's impact was modest over the first half of the season, before he erupted down the stretch and delivered standout performances against the San Francisco 49ers in Week 18 and then against the Los Angeles Rams at the NFC Championship Game.

""He got better every game,"" said cornerback Devon Witherspoon earlier this week. ""He can do everything. He's still buying in. For a rookie to come in and play like a vet, you can't ask for much more than that. He's one of one.

""The guy can blitz, he can take on tackles, set the edge, blitz through the B-gap, I mean, literally the guy can do anything. He can cover the slot, cover the tight end. Everything you want him to do, he can do. When we've got our guy out there, it's kind of hard to game plan against him.""",https://e0.365dm.com/26/02/1600x900/skysports-nick-emmanwori-seattle-seahawks_7156761.jpg?20260205192720,N,,2026-02-05 18:01:26.435387
,,2026-02-05 21:14:59+00:00,www.youtube.com,"Jayden Daniels on historic rookie season, bouncing back from injury, what's next for the ... - YouTube",,,,,,https://www.youtube.com/watch%3Fv%3DXS7sKWL389w,"Jayden Daniels on historic rookie season, bouncing back from injury, what's next for the Commanders. 1 view · 1 minute ago. #nfl #superbowl # ...",Not Available,,Y,,2026-02-05 18:01:30.919343
,,2026-02-05 20:56:04+00:00,ESPN.com,Seahawks 'fully expect' Nick Emmanwori (ankle) to play in SB LX - ESPN,"Brady Henderson, Matt Miller, Bill Barnwell, Jordan Raanan, Sarah Barshop, David Newton, Nick Wagoner, Daniel Dopp, ESPN staff, NFL Nation",,,,,https://www.espn.com/nfl/story/_/id/47840494/seahawks-fully-expect-nick-emmanwori-ankle-play-sb-lx,"SAN JOSE, Calif. -- Seattle Seahawks coach Mike Macdonald said Thursday that he ""fully expects"" rookie nickelback Nick Emmanwori to play in Super Bowl LX despite an injury scare with an ankle.
Macdonald said Emmanwori suffered a low right ankle sprain when he rolled it late in practice Wednesday.
""Nobody really wants to get hurt or banged up during the Super Bowl week or any week at that,"" he said.
The Defensive Rookie of the Year winner will be announced Thursday evening at the NFL Honors show.
I think a Super Bowl ring would be way better.""","SAN JOSE, Calif. -- Seattle Seahawks coach Mike Macdonald said Thursday that he ""fully expects"" rookie nickelback Nick Emmanwori to play in Super Bowl LX despite an injury scare with an ankle.

Macdonald said Emmanwori suffered a low right ankle sprain when he rolled it late in practice Wednesday. The coach wasn't sure how much, if at all, Emmanwori would practice Thursday afternoon.

""But he's doing great,"" Macdonald said. ""Moving around. Just got to make sure we handle it the right way. Probably going to be overcareful and overcautious at this point to make sure we're rolling going into the weekend.""

The Seahawks play the New England Patriots on Sunday at Levi's Stadium.

According to the pool report from ESPN's Kalyn Kahler, players and coaches went over to Emmanwori after he went down Wednesday before he walked off the field on his own power.

""It kind of caught me off guard,"" Emmanwori said Thursday. ""The practice wasn't nothing crazy or nothing; we weren't going hard out there. But I just rolled it. I'll be good to go for Sunday, so I'm looking forward to that.""

Emmanwori, a second-round draft pick out of South Carolina, injured the same ankle on the first series of the Seahawks' season opener, sidelining him for the rest of that game and the next three. After his return, he emerged as a difference-maker while playing virtually every snap and moving all around Macdonald's defense.

Emmanwori, a finalist for AP Defensive Rookie of the Year, said this ankle injury didn't feel as severe initially as the one from the opener, noting that he was able to walk off on his own.

""Nobody really wants to get hurt or banged up during the Super Bowl week or any week at that,"" he said. ""So, it just kind of caught me off guard. It was just a little scare. But imaging came back. ... We've got a good plan to go for Sunday, so I'll be fine. I'll be good.

The Defensive Rookie of the Year winner will be announced Thursday evening at the NFL Honors show. The other finalists are New York Giants outside linebacker Abdul Carter, Atlanta Falcons defensive end James Pearce Jr., Cleveland Browns linebacker Carson Schwesinger and Falcons safety Xavier Watts.

""For an individual award, that would be huge to add to my young career,"" Emmanwori said. ""But right now ... I think a Super Bowl ring would be way better.""",https://a3.espncdn.com/combiner/i?img=%2Fphoto%2F2026%2F0205%2Fr1610968_1296x729_16%2D9.jpg,N,,2026-02-05 17:01:36.050512
,,2026-02-05 20:50:27+00:00,USA TODAY,Nick Emmanwori injury update: Seahawks safety expected to play - USA Today,Nate Davis,,,,,https://www.usatoday.com/story/sports/nfl/seahawks/2026/02/05/nick-emmanwori-super-bowl-60-injury-seahawks/88530348007/,"SAN JOSE, CA − In what's been a relatively quiet week in the ramp-up to Super Bowl 60, the ankle injury suffered by Seattle Seahawks starting safety Nick Emmanwori in practice on Feb. 4 certainly qualified as news.
Head coach Mike Macdonald revealed Feb. 5 that Emmanwori suffered a low ankle sprain.
The Feb. 4 pool report revealed Emmanwori was hurt late in Wednesday's padded practice but the severity of the injury was not clear.
""Nobody wants to get hurt or banged up during Super Bowl week or anything like that,"" he said.
Seattle quarterback Sam Darnold was also limited Feb. 4 by his oblique injury, originally suffered in a practice last month.","SAN JOSE, CA − In what's been a relatively quiet week in the ramp-up to Super Bowl 60, the ankle injury suffered by Seattle Seahawks starting safety Nick Emmanwori in practice on Feb. 4 certainly qualified as news.

Head coach Mike Macdonald revealed Feb. 5 that Emmanwori suffered a low ankle sprain. He's not expected to practice Thursday but should be available for the game.

""Fully expect him to play,"" said Macdonald. ""He's doing great and moving around, just gotta make sure we handle it the right way.""

The Feb. 4 pool report revealed Emmanwori was hurt late in Wednesday's padded practice but the severity of the injury was not clear.

Emmanwori on Feb. 5 told the media that he rolled the ankle toward the end of practice, saying, ""It kind of caught me off guard.""

""Nobody wants to get hurt or banged up during Super Bowl week or anything like that,"" he said. ""... I'll be fine. I'll be good.""

A second-round draft pick last year, Emmanwori is a finalist for Defensive Rookie of the Year, an award that will be revealed at the Feb. 5 NFL Honors. Massive (6-foot-3, 220 pounds) by safety standards and a freakish athlete, he had 11 pass breakups, 2½ sacks and 81 tackles in the regular season.

Seattle quarterback Sam Darnold was also limited Feb. 4 by his oblique injury, originally suffered in a practice last month. But it hasn't seemed to hinder Darnold in either of the Seahawks' playoff wins.

“Sam’s right on schedule,” Macdonald said in the pool report. “So we’ve had this plan here over the last X amount of weeks, and it varies every day. And today he had a great day, so we’re right on schedule.”","https://www.usatoday.com/gcdn/authoring/authoring-images/2026/02/05/USAT/88529989007-nick-emmanwori-seahawks-imagn.jpg?crop=2886,1624,x0,y0&width=2886&height=1624&format=pjpg&auto=webp",N,,2026-02-05 17:01:40.164428
,,2026-02-05 20:14:41+00:00,The Patriot Ledger,"Super Bowl 60 injury report: Patriots' Drake Maye cleared, Seahawks' Sam Darnold limited",Seth Jacobson,,,,,https://www.patriotledger.com/story/sports/nfl/patriots/2026/02/05/the-most-recent-injury-report-for-super-bowl-60-is-out-who-is-on-it-patriots-seahawks-nfl-playoffs/88529644007/,"The latest injury report for Super Bowl 60 has been released.
Another injury report is expected later on Thursday, Feb. 5, and then again on Friday, Feb. 6.
It's almost time for the New England Patriots to take on the Seattle Seahawks in Super Bowl 60 on Sunday, Feb. 8, 2026.
And the injury report has been released, and things are looking relatively good in terms of health on the Patriots: particularly when it comes to quarterback Drake Maye.
Who is currently on the Patriots' injury report for Super Bowl 60?","The latest injury report for Super Bowl 60 has been released.

Patriots QB Drake Maye was a full participant at Wednesday's practice, according to Pats Pulpit online.

Another injury report is expected later on Thursday, Feb. 5, and then again on Friday, Feb. 6.

It's almost time for the New England Patriots to take on the Seattle Seahawks in Super Bowl 60 on Sunday, Feb. 8, 2026.

And the injury report has been released, and things are looking relatively good in terms of health on the Patriots: particularly when it comes to quarterback Drake Maye.

After being listed as questionable for illness and a shoulder injury, he's back to full participation.

At the same time last week, the Seahawks had one player listed as ""doubtful,"" and three players listed as ""questionable,"" with several players on the injury list with no designation, meaning they will most likely play in Super Bowl 60.

The latest injury report was released on Wednesday, Feb. 4, 2026.

Here's what players are on it.

Who is currently on the Patriots' injury report for Super Bowl 60?

Here are the Patriots players who did not participate in the team's most recent practice:

LB Robert Spillane (ankle)

Here are the Patriots players who had ""limited participation"" in practice:

OT Thayer Munford Jr. (knee)

LB Harold Landry III (knee)

Pats Pulpit is also reporting that, ""running back Terrell Jennings’ 21-day window to return from injured reserve officially closed without his activation,"" meaning he will not play in Super Bowl 60.

Who is currently on the Seahawks' injury report for Super Bowl 60?

There were no Seahawks players who were held out of practice this week. However, here are the players who had ""limited participation"":

QB Sam Darnold (oblique)

FB Robbie Ouzts (neck)

WR Jaxon Smith-Njigba (not injury related — rest)

OT Charles Cross (foot)

OT Josh Jones (ankle, knee)

DE Leonard Williams (not injury related — rest)

LB Demarcus Lawrence (not injury related — rest)

S Nick Emmanwori (ankle)

When will the next injury report be released?","https://www.patriotledger.com/gcdn/authoring/authoring-images/2026/02/04/USAT/88513559007-drake-maye-patriots-imagn.jpg?crop=4813,2707,x0,y0&width=3200&height=1800&format=pjpg&auto=webp",N,,2026-02-05 16:01:06.133324
,,2026-02-05 19:56:23+00:00,www.youtube.com,49ers RB Christian McCaffrey: Kyle Shanahan Should be NFL Coach of the Year - YouTube,,,,,,https://www.youtube.com/watch%3Fv%3DksYCGGi2Zyo,49ers RB Christian McCaffrey tells Rich Eisen his thoughts on the Niners' injury-riddled season. Tune in to the Emmy-nominated Rich Eisen Show ...,Not Available,,Y,,2026-02-05 18:01:33.581595
,,2026-02-05 19:53:33+00:00,www.facebook.com,I feel very differently about the Emmanwori injury #NFL #Seahawks #seattleseahawks #superbowl,Not Available,,,,,https://www.facebook.com/HawkBlogger/videos/i-feel-very-differently-about-the-emmanwori-injury-nfl-seahawks-seattleseahawks-/1472799154493341/,🚨I feel very differently about the Emmanwori injury #NFL #Seahawks #seattleseahawks #superbowl,Not Available,https://scontent-iad3-1.xx.fbcdn.net/v/t15.5256-10/629114738_937173325402582_8819192391183373693_n.jpg?_nc_cat=105&ccb=1-7&_nc_sid=596eb7&_nc_ohc=E67ZhfMuMvkQ7kNvwEW2Klt&_nc_oc=AdkXmWL1iwzywXrfaVxkqcu8IbwReOw2H3C2J2bwkdmxRyozYXvDVjhnTlmBznF1ENpEUPKqYy1KWhOtdBd_U7TK&_nc_zt=23&_nc_ht=scontent-iad3-1.xx&_nc_gid=n5TAHQO3AWZ_H5moht8kSg&oh=00_Afv1lmSq6L_ZQbIzX0S9U_C1wez9Z8oh-M1sNTTJUcY-Yw&oe=698AE45F,N,,2026-02-05 18:01:37.316227
,,2026-02-05 19:34:26+00:00,Instagram,I feel very differently about the Emmanwori injury #NFL #Seahawks #seattleseahawks #superbowl,Not Available,,,,,https://www.instagram.com/reel/DUYyygZl6d9/,"447 likes, 11 comments - hawkblogger on February 5, 2026: ""🚨I feel very differently about the Emmanwori injury #NFL #Seahawks #seattleseahawks #superbowl"".",Not Available,https://scontent-iad3-1.cdninstagram.com/v/t51.82787-15/625577409_18446791705106304_849268845230632447_n.jpg?stp=cmp1_dst-jpg_e35_s640x640_tt6&_nc_cat=103&ccb=7-5&_nc_sid=18de74&efg=eyJlZmdfdGFnIjoiQ0xJUFMuYmVzdF9pbWFnZV91cmxnZW4uQzMifQ%3D%3D&_nc_ohc=8WlSi3icjdAQ7kNvwGfBv3U&_nc_oc=Adn4i424WEk8qXCXimM3UtH02gZM-6WnHDxZ5uHhfwurp-_KeBfT79tEWvZNIVNjFW8jl9mEf5-73NC6kSkezlvl&_nc_zt=23&_nc_ht=scontent-iad3-1.cdninstagram.com&_nc_gid=Yj-taq59RGI92-GUcMVlqg&oh=00_AfuHSioIim3FALfMvn6Q9xL1WkbvGpqUgk1DJh84NdIZ4w&oe=698AC5FC,N,,2026-02-05 15:01:21.506941
,,2026-02-05 19:28:58+00:00,Instagram,How Nick Emmanwori's injury CRUSHES the Seahawks defense. #seattleseahawks ... - Instagram,Not Available,,,,,https://www.instagram.com/reel/DUYyBbICRQe/,"190 likes, 12 comments - yapp.matt on February 5, 2026: ""How Nick Emmanwori’s injury CRUSHES the Seahawks defense. 🫣

#seattleseahawks #seahawks #superbowl #nfl #nflfootball"".",Not Available,https://scontent-iad3-1.cdninstagram.com/v/t51.82787-15/627960201_17925681627215502_4784551757122571038_n.jpg?stp=cmp1_dst-jpg_e35_s640x640_tt6&_nc_cat=108&ccb=7-5&_nc_sid=18de74&efg=eyJlZmdfdGFnIjoiQ0xJUFMuYmVzdF9pbWFnZV91cmxnZW4uQzMifQ%3D%3D&_nc_ohc=2FZXhYCuVX4Q7kNvwEWHJhg&_nc_oc=AdlHlJ0Kd6zlxndRCbuh98K6Vg0AcD6JKQpD124KrTr7i5NE4F40AvBBuvT_FVbshfVxB0_s4qed5_a3fP8RrroL&_nc_zt=23&_nc_ht=scontent-iad3-1.cdninstagram.com&_nc_gid=QwwoJBd6bwP4iETWg0rDoA&oh=00_AfsjPxBhoXHkIDP9A9s2jd_XqYgL_ZREzCfOzFv0cg5xng&oe=698ADDE3,N,,2026-02-05 15:01:26.120212
,,2026-02-05 19:23:46+00:00,Yahoo Sports,Nick Emmanwori Injury Update: NFL Injury Expert Gives Concerning Update Ahead of Super Bowl LX,Samnur Reza,,,,,https://sports.yahoo.com/articles/nick-emmanwori-injury-nfl-injury-185258093.html,"As the Seattle Seahawks capped off their first practice in San Jose ahead of the Super Bowl, fans received one piece of good news and one concerning update.
Safety Nick Emmanwori has been added to the team’s injury list.
That is where NFL injury expert Dr. Jesse Morse comes in with a more concerning outlook.
Still, Morse emphasized that the injury is concerning, and if the safety does end up playing, he would be “VERY” limited.
The safety is scheduled for imaging (MRI/X-rays) on Thursday to determine the severity of the injury, according to reports.","As the Seattle Seahawks capped off their first practice in San Jose ahead of the Super Bowl, fans received one piece of good news and one concerning update. Starting with the good, quarterback Sam Darnold, while limited in Wednesday’s practice due to an oblique injury, looked sharp and said himself that he is feeling good heading into Super Bowl 60. Now for the bad news.

Safety Nick Emmanwori has been added to the team’s injury list. Reports state that the rookie nickelback, a strong candidate for Defensive Rookie of the Year, was attempting to defend a pass late in practice when he suffered an ankle injury.

Advertisement

Emmanwori walked off the field under his own power, but later, while heading into his hotel, he was seen limping. That is where NFL injury expert Dr. Jesse Morse comes in with a more concerning outlook.

Morse wrote on Twitter that Emmanwori does not appear to have reinjured the right high-ankle sprain he suffered in Week 1, when he was labeled week-to-week. However, that means the injury sustained on Wednesday is a new one.

Morse added that it is not “blatantly obvious which ligaments are affected the most,” but noted that Emmanwori’s injury did not look like a high-ankle sprain since he was not using crutches or a walking boot during his limping walk to the hotel room. Still, Morse emphasized that the injury is concerning, and if the safety does end up playing, he would be “VERY” limited.

It’s the last thing any fan wants to hear, and for a rookie on the brink of something special, the timing couldn’t be more crushing. The safety is scheduled for imaging (MRI/X-rays) on Thursday to determine the severity of the injury, according to reports.

Advertisement

“We brought him in to look at it, and we’ll kind of go from here and figure out what are the next steps,” head coach Mike Macdonald said after Wednesday’s session, as per ESPN.

Seattle will take on the high-flying New England Patriots, led by MVP candidate Drake Maye, so the defense needs to be as sharp as it has been all season. Emmanwori’s absence could turn into a major issue. He recorded 81 tackles, 2.5 sacks, and 11 pass breakups during the regular season, and he will be needed at full strength for Seattle’s formidable defense to perform at its best.

If necessary, the Seahawks will have to rely more on Ty Okada on Sunday. But given Emmanwori’s versatility at safety, nickel cornerback, and strongside linebacker, it cannot be overstated how much his limited availability would hurt that secondary.",https://s.yimg.com/os/en/the_sportsrush_articles_230/81c5bc01b5629a984ce714ba7e8e7a0c,N,,2026-02-05 16:01:11.570161
,,2026-02-05 19:19:37+00:00,YouTube,I feel very differently about the Emmanwori injury #nfl #seahawks #seattleseahawks #superbowl,Not Available,,,,,https://m.youtube.com/shorts/Uhi2GaRrVZA,"Enjoy the videos and music you love, upload original content, and share it all with friends, family, and the world on YouTube.",Not Available,https://i.ytimg.com/vi/Uhi2GaRrVZA/oardefault.jpg?sqp=-oaymwEoCJUDENAFSFqQAgHyq4qpAxcIARUAAIhC2AEB4gEKCBgQAhgGOAFAAQ==&rs=AOn4CLA6EWIeO-oYix8ze3jw6Iso1APlfw&usqp=CCk,N,,2026-02-05 17:01:44.959626
