id,name,published,outlet,title,authors,category,market,categoryorder,articleorder,url,description,text,image,error,sentiment,firstEyes
,,2025-06-24 22:18:57+00:00,www.cbsnews.com,Committee of Latin American Ladies cancels Long Island fundraiser as ICE raids create fear,,,,,,https://www.cbsnews.com/newyork/video/committee-of-latin-american-ladies-cancels-long-island-fundraiser-as-ice-raids-create-fear/,"As ICE raids continue across the Tri-State Area, sparking fear and uncertainty, some Latino groups are canceling events. CBS News New York's Jennifer McLogan spoke to a Suffolk County organization that raises money for cancer patients and has been forced to make a tough decision.",,https://assets1.cbsnewsstatic.com/hub/i/r/2025/06/24/0a3862ea-cd21-4ca9-ad18-2ad40527c1bc/thumbnail/1200x630/04c229b69db6961d052ee478ca905d3f/d23e124ea2e129b7562fa0f9a9835542.jpg,,,2025-06-24 19:07:04.473403
,,2025-06-24 19:12:47+00:00,Yahoo Entertainment,What is the state of Latin music today? These hitmakers have ideas,,,,,,https://www.yahoo.com/entertainment/articles/state-latin-music-today-182306324.html,"A panel of Latin America's boldest and brightest stars, from Juanes to Mon Laferte, weigh in on a rapidly globalizing genre",,https://media.zenfs.com/en/la_times_de_los_699/222f5a52c01d06e75c84e789e7bd334e,,,2025-06-24 18:07:53.199400
,,2025-06-24 18:39:52+00:00,Yahoo Entertainment,Going ‘Deep’: Prince Royce Dives to No. 1 on Latin Airplay Chart,,,,,,https://www.yahoo.com/entertainment/articles/going-deep-prince-royce-dives-151316302.html,The bilingual bachata version of the Bee Gees’ 1977 hit marks his 18th chart-topper on the overall Latin radio ranking.,,https://s.yimg.com/ny/api/res/1.2/DD4EXewu201jl0MK.02GFA--/YXBwaWQ9aGlnaGxhbmRlcjt3PTEyMDA7aD03OTQ-/https://media.zenfs.com/en/billboard_547/d08a159831af3f5f2a1be1ea869bd499,,,2025-06-24 15:13:33.753646
,,2025-06-24 18:37:22+00:00,Los Angeles Times,What is the state of Latin music today?,,,,,,https://www.latimes.com/delos/story/2025-06-24/the-state-of-latin-music-panel-juanes-mon-laferte-los-tigres-del-norte-cimafunk-francisca-valenzuela,"A panel of Latin America's boldest and brightest stars, from Juanes to Mon Laferte, weigh in on a rapidly globalizing genre",,https://ca-times.brightspotcdn.com/dims4/default/10f16b0/2147483647/strip/true/crop/1080x567+0+178/resize/1200x630!/quality/75/?url=https%3A%2F%2Fcalifornia-times-brightspot.s3.amazonaws.com%2F87%2F61%2F2ff685a54e3fb9e217d50c3e2b46%2Flatinmusic.png,,,2025-06-24 15:13:33.753646
,,2025-06-24 13:44:10+00:00,TVDRAMA,Leonardo Padrón Launches Production Company - TVDRAMA,,,,,,https://worldscreen.com/tvdrama/leonardo-padron-launches-production-company/,"Latin American writer and producer Leonardo Padrón (Pálpito, Accidente) has launched Leonardo Padrón Productions with EndemolShine Boomdog and Banijay Entertainment.",,https://worldscreen.com/tvdrama/wp-content/uploads/sites/11/2025/06/LeonardoPadronProductions-LeonardoPadron-0625.jpg,,,2025-06-24 11:20:39.352920
,,2025-06-24 12:53:52+00:00,Mix 94.1,Cinergy’s New Game Turns Up the Summer Fun,,,,,,https://mix941kmxj.com/ixp/195/p/cinergy-gel-blasters-amarillo/,"Amarillo’s newest, mess-free, high-energy battle game. Fun for kids, families, and even office teams!",,https://townsquare.media/site/195/files/2025/06/attachment-02.jpg?w=1200&q=75&format=natural,,,2025-06-24 11:20:39.352920
,,2025-06-24 12:52:44+00:00,Aberdeen Insider,Salsa Del Soul Offers Latin American Music At Library Block Party On June 28 | Aberdeen Insider,,,,,,https://aberdeeninsider.com/salsa-del-soul-offers-latin-american-music-at-library-block-party-on-june-28/,"Salsa del Soul, a nine-piece Latin American orchestra from Minneapolis, will be playing from 6 to 8 p.m.",,https://aberdeen-insider-media.s3.us-east-2.amazonaws.com/wp-content/uploads/2025/06/13101346/Salsa-del-Soul.jpg,,,2025-06-24 11:20:39.352920
,,2025-06-24 12:21:07+00:00,www.businesswire.com,Intercept Music Secures Indie Label Successes in Latin America - Business Wire,,,,,,https://www.businesswire.com/news/home/20250624527333/en/Intercept-Music-Secures-Indie-Label-Successes-in-Latin-America,Intercept Music empowers independent artists and labels with innovative entertainment technology. The company provides cutting-edge tools and services ...,,,,,2025-06-24 09:06:26.999400
,,2025-06-24 07:30:06+00:00,koreajoongangdaily.joins.com,Stray Kids wins Favorite Music Group category at Nickelodeon Kids' Choice Awards,,,,,,https://koreajoongangdaily.joins.com/news/2025-06-24/entertainment/kpop/Stray-Kids-wins-Favorite-Music-Group-category-at-Nickelodeon-Kids-Choice-Awards/2337111,"Boy band Stray Kids won the Favorite Music Group category at the 2025 Nickelodeon Kids’ Choice Awards, which was held on Saturday in Los Angeles. The annual awards ceremony honors figures in television, film, music and sports.",,https://koreajoongangdaily.joins.com/data/photo/2025/06/24/71f08605-3d1f-4d62-98d2-2f7fab78bd1d.jpg,,,2025-06-24 08:01:35.910614
,,2025-06-24 07:28:36+00:00,www.prensario.net,Eddy Arias: 'I joined Paramount in early 2019 as a consultant supporting the launch of Paramount+ in Latin America',,,,,,https://www.prensario.net/Eddy-Arias-I-joined-Paramount-in-early-2019-as-a-consultant-supporting-the-launch-of-Paramount-in-Latin-America-49533.note.aspx,"The executive was responsible for driving the international growth of Pluto TV: securing 𝟒𝟖𝟓 𝐜𝐨𝐧𝐭𝐞𝐧𝐭 𝐩𝐚𝐫𝐭𝐧𝐞𝐫𝐬𝐡𝐢𝐩𝐬, launching 𝟏,𝟒𝟎𝟎 𝐜𝐡𝐚𝐧𝐧𝐞𝐥𝐬, and delivering 𝟑𝟎𝟎,𝟎𝟎𝟎 𝐡𝐨𝐮𝐫𝐬 𝐨𝐟 𝐜𝐨𝐧𝐭𝐞𝐧𝐭 to millions of viewers worldwide.",,https://www.prensario.net/Multimedios/imgs/66538_750.jpg?v=4,,,2025-06-24 06:58:40.866962
,,2025-06-24 07:04:29+00:00,www.prnewswire.com,ANBC represents Latin America in global debate about the impact of Artificial Intelligence on credit at ICCR event in South Africa,,,,,,https://www.prnewswire.com/news-releases/anbc-represents-latin-america-in-global-debate-about-the-impact-of-artificial-intelligence-on-credit-at-iccr-event-in-south-africa-302488822.html,/PRNewswire/ -- The President of the National Association of Credit Bureaus (ANBC) and representative of the Latin American Association of Credit Bureaus...,,,,,2025-06-24 05:01:01.951035
,,2025-06-24 05:07:24+00:00,The Independent,Gloria Estefan: ‘My abuser told me he’d kill my mother if I told anyone’,,,,,,https://www.the-independent.com/arts-entertainment/music/features/gloria-estefan-trump-stranger-things-b2773034.html,"The Cuban-American superstar talks to Fiona Sturges about her childhood abuser and her father’s disappearance, the ‘inhumanity’ of Trump’s America, and why her new album is her masterpiece... plus why she’s catching up on ‘Stranger Things’",,https://static.the-independent.com/2025/06/19/11/newFile.jpg?width=1200&height=800&crop=1200:800,,,2025-06-24 01:59:08.898251
,,2025-06-24 04:48:35+00:00,www.thetelegraph.com,Alton Telegraph Events - Ozomatli,,,,,,https://www.thetelegraph.com/entertainment/%3F_evDiscoveryPath%3D/event/106868090n-ozomatli,"Find entertainment news and reviews on movies, theater, music, TV ... Since 1995, the multi-genre cultural powerhouse has blended Latin, hip ...",,,,,2025-06-24 02:59:28.668198
,,2025-06-24 04:43:25+00:00,Penticton Herald,Pint-size pioneer 'Dora the Explorer' celebrates her 25th anniversary,,,,,,https://www.pentictonherald.ca/entertainment/national_entertainment/article_4e8876d9-2538-5567-ab4d-5c6a52f23c8a.html,"NEW YORK (AP) — Twenty-five years ago, a little girl with a bob haircut appeared on our TVs, speaking a mix of English and Spanish, with a spunky, can-do spirit.",,https://bloximages.newyork1.vip.townnews.com/pentictonherald.ca/content/tncms/assets/v3/editorial/3/b0/3b0c6a54-be22-5df8-ba4b-51800abf3f52/68596c14ceb71.image.jpg?crop=640%2C336%2C0%2C45,,,2025-06-24 01:59:08.898251
,,2025-06-24 03:46:11+00:00,Indulgexpress,Dora the Explorer celebrates her 25th anniversary,,,,,,https://www.indulgexpress.com/entertainment/2025/Jun/24/dora-the-explorer-celebrates-her-25th-anniversary,"Twenty-five years ago, a little girl with a bob haircut appeared on our TVs, speaking a mix of English and Spanish, with a spunky, can-do spirit. She had an adv",,https://media.assettype.com/indulgexpress%2F2025-06-24%2Fjxdqzqev%2FScreenshot-2025-06-24-8.45.03-AM.png?w=1200&ar=40%3A21&auto=format%2Ccompress&ogImage=true&mode=crop&enlarge=true&overlay=false&overlay_position=bottom&overlay_width=100,,,2025-06-24 01:59:08.898251
,,2025-06-24 01:09:32+00:00,De Último Minuto,Giannina Azar will dress the finalists of Miss Universe Latina 2025 | De Último Minuto English,,,,,,https://deultimominuto.net/en/entertainment/giannina-azar-will-dress-the-finalists-of-miss-universe-latina-2025/,"With her new collection “Opulence” the Dominican designer will mark a milestone in regional fashion this Wednesday, June 25th, by dressing the 20 finalists of",,https://cdn.deultimominuto.net/en/wp-content/uploads/sites/2/2025/06/11452ff3-d8de-4a15-b073-ac23d60457c5-1024x574.jpg,,,2025-06-24 12:12:51.362201
,,2025-06-23 22:05:36+00:00,www.iftn.ie,IFC Midnight Secures 'Grabbers' North & Latin American Rights | The Irish Film & Television Network,,,,,,https://www.iftn.ie/news/FestivalsNews/%3Fact1%3Drecord%26only%3D1%26aid%3D73%26rid%3D4284665%26tpl%3Darchnews%26force%3D1,International sales are being handled by The Salt Company whilst Sony Pictures Home Entertainment had previously acquired UK rights to the project.,,,,,2025-06-24 05:01:01.951035
,,2025-06-23 20:36:09+00:00,www.formatbiz.it,Two New Local Format Versions Of The Traitors Recruited For LatAm - FormatBiz,,,,,,https://www.formatbiz.it/dettNews.aspx%3Fid%3D13125,All3Media International has announced its first local format licenses in Latin America via an agreement with NBCUniversal International Networks ...,,,,,2025-06-23 19:02:48.435392
,,2025-06-23 20:01:58+00:00,www.msn.com,Top Latin American Screenwriter Leonardo Padrón Inks Two-Year Alliance With Banijay ...,,,,,,https://www.msn.com/en-us/news/technology/top-latin-american-screenwriter-leonardo-padr%25C3%25B3n-inks-two-year-alliance-with-banijay-americas-a-f%25C3%25A1brica-mexico-u-s-hispanic/ar-AA1Hg6OP,"Having Banijay Entertainment onboard reinforces our ambition to expand globally."" The team at A Fábrica Mexico & U.S. Hispanic, led by Luiz Noronha ...",,,,,2025-06-24 12:12:51.362201
,,2025-06-23 18:58:04+00:00,UPI,Latin America’s identity documents are highly vulnerable - UPI.com,,,,,,https://www.upi.com/Top_News/World-News/2025/06/23/world-latin-america-identity-documents-vulnerable-2025/7241750703639/,The vulnerability of identity documents has become a critical challenge for Latin America amid rising migration and regional security crises.,,https://cdnph.upi.com/ph/st/th/7241750703639/2025/upi/b623f49e25506544aee081f7735a7747/v1.5/Latin-Americas-identity-documents-are-highly-vulnerable.jpg?lg=5,,,2025-06-23 16:05:48.768145
,,2025-06-23 17:02:28+00:00,Boston Herald,Pint-size pioneer ‘Dora the Explorer’ celebrates her 25th anniversary,,,,,,https://www.bostonherald.com/2025/06/23/dora-the-explorer-25th-anniversary/,Dora was the first Latina to lead a major cartoon series.,,https://www.bostonherald.com/wp-content/uploads/2025/06/TV-Dora_the_Explorer-25th_Anniversary_44466-1.jpg?w=1024&h=683,,,2025-06-23 19:02:48.435392
,,2025-06-23 16:26:25+00:00,Banijay,"ENDEMOLSHINE BOOMDOG, BANIJAY ENTERTAINMENT AND ACCLAIMED WRITER & PRODUCER LEONARDO PADRÓN UNITE TO LAUNCH “LEONARDO PADRÓN PRODUCTIONS” - Banijay",,,,,,https://www.banijay.com/blog/2025/06/23/endemolshine-boomdog-banijay-entertainment-and-acclaimed-writer-producer-leonardo-padron-unite-to-launch-leonardo-padron-productions/,")— EndemolShine Boomdog and Banijay Entertainment are teaming with acclaimed Latin American writer and producer, Leonardo Padrón to launch Leonardo Padrón Productions. Focused on premium content, the venture will partner with Banijay Americas label, A Fábrica Mexico & U.S. Hispanic, to deliver a slate defined by distinctive storytelling. Padrón, one of Latin America’s most renowned screenwriters, […]",,,,,2025-06-23 13:11:26.808821
,,2025-06-23 16:19:32+00:00,VideoAge International,Leonardo Padrón Partners with Banijay,,,,,,https://www.videoageinternational.net/2025/06/23/news/leonardo-padron-partners-with-banijay/,"EndemolShine Boomdog and Banijay Entertainment are teaming with Latin American writer and producer Leonardo Padrón to launch Leonardo Padrón Productions.

Padrón is the creative force behind Netflix hits like Pálpito and Accidente. His extensive body of work includes titles for Univision and Televisa, La Mujer del Diablo, Si nos Dejan, Amar a Muerte, and the revival of the classic Mexican novela Rubí.

Leonardo Padrón",,https://www.videoageinternational.net/wp-content/uploads/2025/06/LeonardoPadronxRobertoMata-7422.jpeg,,,2025-06-23 14:10:16.211235
,,2025-06-23 16:15:56+00:00,www.imdb.com,Top Latin American Screenwriter Leonardo Padrón Inks Two-Year Alliance With Banijay ... - IMDb,,,,,,https://www.imdb.com/news/ni65347662/%3Fref_%3Dnwc_art_perm,"This content is published for the entertainment of our users only. The news articles, Tweets, and blog posts do not represent IMDb's opinions nor can ...",,,,,2025-06-23 13:11:26.808821
,,2025-06-23 16:12:59+00:00,m.imdb.com,Top Latin American Screenwriter Leonardo Padrón Inks Two-Year Alliance With Banijay ... - IMDb,,,,,,https://m.imdb.com/fr/news/ni65347619/%3Fref_%3Dnwc_art_perm,Apple TV+ Signs First-Look Film Deal with North Road's Chernin Entertainment. 22/06/2025; par Rance Collins; Indiewire. Image. 'You Kind of Have to ...,,,,,2025-06-24 13:10:47.692285
,,2025-06-23 16:09:19+00:00,ABC News,Pint-size pioneer 'Dora the Explorer' celebrates her 25th anniversary,,,,,,https://abcnews.go.com/Entertainment/wireStory/pint-size-pioneer-dora-explorer-celebrates-25th-anniversary-123121942,"Twenty-five years ago, a little girl with a bob haircut appeared on our TVs, speaking a mix of English and Spanish, with a spunky, can-do spirit",,https://i.abcnewsfe.com/a/cf08a40f-4df0-4e5f-96dd-ef8414e092d0/wirestory_d76a73a0dc04f34fd0f612de34f9485a_16x9.jpg?w=1600,,,2025-06-23 13:11:26.808821
,,2025-06-23 15:57:55+00:00,TTV News,EndemolShine Boomdog and Banijay Launch Production Label with Leonardo Padrón - TTV News,,,,,,https://todotvnews.com/en/endemolshine-boomdog-and-banijay-launch-production-label-with-leonardo-padron/,"Leonardo Padrón Productions, focused on premium content, will partner with Banijay Americas label, A Fábrica Mexico & U.S. Hispanic, to deliver a",,http://todotvnews.com/wp-content/uploads/2025/06/LeonardoPadronxRobertoMata-7422.jpeg,,,2025-06-23 14:10:16.211235
,,2025-06-23 15:50:55+00:00,www.allsides.com,Top Latin American Screenwriter Leonardo Padrón Inks Two-Year Alliance with Banijay ...,,,,,,https://www.allsides.com/news/2025-06-23-0800/general-news-top-latin-american-screenwriter-leonardo-padr-n-inks-two-year,"... Hispanic. Arts And Entertainment, Entertainment, Movies. Posted on AllSides June 23rd, 2025. Save for Later. From The Left. Variety.",,,,,2025-06-23 14:10:16.211235
,,2025-06-23 15:14:12+00:00,The Seattle Times,Pint-size pioneer ‘Dora the Explorer’ celebrates her 25th anniversary,,,,,,https://www.seattletimes.com/entertainment/pint-size-pioneer-dora-the-explorer-celebrates-her-25th-anniversary/%3Futm_source%3DRSS%26utm_medium%3DReferral%26utm_campaign%3DRSS_all,"“Dora the Explorer,” featured the first Latina to lead a major cartoon series and the girl who helped spearhead the rise of multicultural children’s programming.",,https://images.seattletimes.com/wp-content/uploads/2025/06/06232025_dora_tzr_081931.jpg?d=1200x630,,,2025-06-23 15:23:12.078170
,,2025-06-23 15:10:19+00:00,Broadcast,Banijay doubles down in LatAm with Leonardo Padrón label,,,,,,https://www.broadcastnow.co.uk/broadcast-international/banijay-doubles-down-in-latam-with-leonardo-padron-label/5206302.article,Scripted outfit will work with Banijay Americas' recently launched A Fábrica Mexico &amp; US Hispanic on 'high-impact' dramas,,https://d11p0alxbet5ud.cloudfront.net/Pictures/1024x536/4/4/1/1453441_leonardopadronxrobertomata7422_66457.jpeg,,,2025-06-23 12:15:56.581973
,,2025-06-23 15:01:53+00:00,www.myplainview.com,Pint-size pioneer 'Dora the Explorer' celebrates her 25th anniversary - Plainview Herald,,,,,,https://www.myplainview.com/entertainment/article/pint-size-pioneer-dora-the-explorer-celebrates-20389555.php,"By MARK KENNEDY, AP Entertainment WriterUpdated June 23, 2025 10:01 a.m. ... Latin representation on TV — then and now — has been a struggle. The ...",,,,,2025-06-23 16:05:48.768145
,,2025-06-23 14:55:04+00:00,www.thetelegraph.com,Pint-size pioneer 'Dora the Explorer' celebrates her 25th anniversary - Alton Telegraph,,,,,,https://www.thetelegraph.com/entertainment/article/pint-size-pioneer-dora-the-explorer-celebrates-20389555.php,Entertainment. Pint-size pioneer 'Dora the Explorer' celebrates her ... Latin representation on TV — then and now — has been a struggle. The ...,,,,,2025-06-23 12:15:56.581973
,,2025-06-23 14:50:20+00:00,Newsday,Pint-size pioneer 'Dora the Explorer' celebrates her 25th anniversary,,,,,,https://www.newsday.com/entertainment/dona-explorer-anniversary-25-c27229,"Twenty-five years ago, a little girl with a bob haircut appeared on our TVs, speaking a mix of English and Spanish, with a spunky, can-do spirit.",,https://cdn.newsday.com/ace/c:MTA4ZjY0NDAtZWVkNy00:OWNmZWIyYzMtNjMwNS00/landscape/1280,,,2025-06-23 14:10:16.211235
,,2025-06-23 14:48:01+00:00,Variety,Top Latin American Screenwriter Leonardo Padrón Inks Two-Year Alliance With Banijay Americas’ A Fábrica Mexico & U.S. Hispanic,,,,,,https://variety.com/2025/film/global/leonardo-padron-banijay-a-fabrica-mexico-endemolshine-1236437120/,Latin American screenwriter Leonardo Padrón has signed a two-year partnership with Banijay Americas’ A Fábrica Mexico & U.S. Hispanic.,,https://variety.com/wp-content/uploads/2025/06/2-split-11.jpg?w=1000&h=563&crop=1,,,2025-06-23 12:15:56.581973
,,2025-06-23 13:57:59+00:00,HISTORY,Car Games: Backseat Diversions Through the Decades,,,,,,https://www.history.com/articles/popular-car-games,"Amusements included the license plate game, I Spy and Mad Libs.",,"https://res.cloudinary.com/aenetworks/image/upload/c_fill,w_1200,h_630,g_auto/dpr_auto/f_auto/q_auto:eco/v1/476054109_f7brz5?_a=BAVAZGDX0",,,2025-06-23 12:15:56.581973
,,2025-06-23 13:43:37+00:00,FashionNetwork.com,Pitti Uomo 108: plenty of entertaining stands but transport strike spoils the party,,,,,,"https://uk.fashionnetwork.com/news/Pitti-uomo-108-plenty-of-entertaining-stands-but-transport-strike-spoils-the-party,1742788.html","On its third day, the menswear show reported a 3% rise in visiting foreign buyers, but on Thursday a transport strike kept a significant number of visitors away from the stands, many of them themed around entertainment.",,"https://media.fashionnetwork.com/cdn-cgi/image/fit=cover,width=600,height=600,format=auto/m/9468/19bd/009f/d51b/f517/b3de/60c4/54fe/d2f1/111a/111a.jpg",,,2025-06-23 14:10:16.211235
,,2025-06-23 13:04:35+00:00,BELatina,"Bella Dose, the World’s First Bilingual Latina Girl Group, Drops 'Feliz y Soltera' and Brings the Vibe This Summer Needs | BELatina",,,,,,https://belatina.com/bella-dose-worlds-first-bilingual-latina-girl-group-feliz-y-soltera-vibe-summer/,"For Bella Dose, the world’s first bilingual Latina girl group, born and raised in Miami, that sound comes naturally.",,https://belatina.com/wp-content/uploads/2025/06/Website-Creatives-34-1.jpg,,,2025-06-23 19:02:48.435392
,,2025-06-23 11:05:20+00:00,www.formatbiz.it,Two New Local Format Version of The Traitors Recruited for LatAm - FormatBiz,,,,,,https://www.formatbiz.it/dettNews.aspx%3Fid%3D13120,"... Latin America for The Traitors. Under the deal, NBCUIN & DTC Latin ... Entertainment. He moderated a panel on TV adaptations. The panel ...",,,,,2025-06-23 08:07:04.621450
,,2025-06-23 10:02:04+00:00,MICHELIN Guide,"A Food Lover’s Guide to the Latin Quarter, Paris’ Arty-Academic Area",,,,,,https://guide.michelin.com/us/en/article/travel/latin-quarter-paris-food-guide,"Famously eclectic, and ever shifting between the high and low, the Latin Quarter in Paris is where the city’s intellectual heart beats. But it’s not just ...",,https://d3h1lg3ksw6i6b.cloudfront.net/media/image/2025/06/19/d001b609b0e74feab65f5d08d50e520e_00_BUCI_A7305870_HeroImage_05.jpg,,,2025-06-23 07:05:34.086847
,,2025-06-23 10:00:48+00:00,The Austinot,"Best Fun Events In Austin This Weekend Of June 27, 2025",,,,,,https://austinot.com/best-fun-events-in-austin-this-weekend-of-june-27-2025,"Our top picks for Best Fun Events in Austin this weekend of June 27, 2025 include Sazon Latin Food Festival, Pride celebrations, and more!",,https://austinot.com/wp-content/uploads/2025/06/Best-Fun-Events-in-Austin-this-Weekend-of-June-27-2025.png,,,2025-06-23 07:05:34.086847
,,2025-06-23 07:04:21+00:00,Spokesman.com,The science behind clouds and how to remember their (latin) names,,,,,,https://www.spokesman.com/stories/2025/jun/23/the-science-behind-clouds-and-how-to-remember-thei/,"Puffy, wispy, white and gray, we’ve seen them all this spring. Clouds come in a variety of types, and each type comes with critical information about incoming weather patterns. If you’re a local hiker, boater, pilot or otherwise outdoor-enjoyer, you can understand the value of eyeing a storm before it arrives. ",,https://thumb.spokesman.com/QPC89iyujYg9DdRDhPTGlk0F02A=/1200x630/smart/media.spokesman.com/photos/2025/06/20/645ad8f62bde6.hires.jpg,,,2025-06-23 04:01:28.544512
,,2025-06-23 06:41:56+00:00,The Manila Times,"Lleida.net Wins First Latin American Tender for its Universal Signature Verification Certificate (USVC)

",,,,,,https://www.manilatimes.net/2025/06/23/tmt-newswire/globenewswire/lleidanet-wins-first-latin-american-tender-for-its-universal-signature-verification-certificate-usvc/2137692,**media[661494]**,,https://www.manilatimes.net/manilatimes/uploads/images/2025/06/23/661494.png,,,2025-06-23 12:15:56.581973
,,2025-06-23 01:50:34+00:00,"Woodbridge, NJ Patch","Local Event: Alborada's ""Summerfest"" Gala",,,,,,https://patch.com/new-jersey/woodbridge/calendar/event/20250727/3bb613fa-e527-40b7-b680-1789e9442a38/alboradas-summerfest-gala,Check out the latest community post from one of your neighbors. (The views expressed in this post are the author’s own.),,https://patch.com/img/cdn20/users/1999309/20250622/094301/summerfest-2025-ad-2___22214258089.jpg,,,2025-06-23 01:58:37.418393
,,2025-06-22 21:32:48+00:00,Yahoo News,Are Latin American travelers still coming to the US for vacations?,,,,,,https://www.yahoo.com/news/latin-american-travelers-still-coming-090353816.html,Latin American countries like Mexico make up a large demographic of US travelers. Here's why some are skipping the US right now.,,https://s.yimg.com/ny/api/res/1.2/nmZeRIDjWdcRDxeC9mdO6A--/YXBwaWQ9aGlnaGxhbmRlcjt3PTEyMDA7aD03OTg-/https://media.zenfs.com/en/usa_today_travel_320/b52986c410fb2a781e97a3c6db396987,,,2025-06-22 19:01:09.502553
,,2025-06-22 18:54:38+00:00,Glam Adelaide,Feel the fire of Latin America at Latino Fest in Bowden this July,,,,,,https://glamadelaide.com.au/feel-the-fire-of-latin-america-at-latino-fest-in-bowden-this-july/,"Get ready to dance, dine and celebrate at Latino Fest, a fiery winter fiesta lighting up Plant 4 Bowden this July.",,https://glamadelaide.com.au/wp-content/uploads/2025/06/LatinoFest_Plant4_6.jpg,,,2025-06-22 15:59:41.632657
,,2025-06-22 14:46:06+00:00,Latin Times,"Meet the new Korean band 1Verse, featuring North Korean defectors, a Japanese man, and a Chinese American",,,,,,https://www.latintimes.com/meet-new-korean-band-1verse-featuring-north-korean-defectors-japanese-man-chinese-american-585397,"Created by Cho Michelle, founder of Singing Beetle and A&R producer at SM Entertainment, 1 Verse stands out from other Korean music bands thanks to its members' incredible story, among other things.",,https://d.latintimes.com/en/full/579625/1verse-new-korean-band-north-korea.jpg,,,2025-06-22 12:06:38.213230
,,2025-06-22 14:05:04+00:00,Latin Times,"Meet the new Korean band 1Verse, featuring North Korean defectors, a Japanese man, and a Chinese American",,,,,,http://www.latintimes.com/meet-new-korean-band-1verse-featuring-north-korean-defectors-japanese-man-chinese-american-585397,"Created by Cho Michelle, founder of Singing Beetle and A&R producer at SM Entertainment, 1 Verse stands out from other Korean music bands thanks to its members' incredible story, among other things.",,https://d.latintimes.com/en/full/579625/1verse-new-korean-band-north-korea.jpg,,,2025-06-23 07:05:34.086847
,,2025-06-22 02:43:58+00:00,latv.com,How Kunno Became a TikTok Star and a Voice for Latino LGBTQ+ Yout - LATV,,,,,,https://latv.com/queer/who-is-kunno/,How Kunno Became a TikTok Star and a Voice for Latino LGBTQ+ Youth. By LatiNation. Entertainment · QUEER · kunno · tiktoker · Entertainment · QUEER ...,,,,,2025-06-22 01:58:14.053495
