id,name,published,outlet,title,authors,category,market,categoryorder,articleorder,url,description,text,image,error,sentiment,firstEyes
,,2025-03-19 17:33:38+00:00,ajc,The Latin Grammys get closer to cinema with the new best music for visual media category,,,,,,https://www.ajc.com/news/nation-world/the-latin-grammys-get-closer-to-cinema-with-the-new-best-music-for-visual-media-category/R5Y4QYMV2RAJNBNEAQFPFOZNGA/,The Latin Grammys are getting closer to cinema and television with the new best music for visual media category.,,https://www.ajc.com/resizer/v2/HSI3RCSNZZSYONAQUZDFEYZ72Y.jpg?auth=7ec16d6efae0dbaae03ba09ee585147a8cac9b55443d2a32f2a231e35590d76e&width=1200&height=630&smart=true,,,2025-03-19 15:03:03.667183
,,2025-03-19 17:17:09+00:00,Billboard,Billboard Celebrates Spanish Music Leaders at Exclusive Event in Madrid: ‘Total Commitment’,,,,,,https://www.billboard.com/pro/billboard-celebrates-spanish-music-leaders-madrid/,Billboard celebrates Spanish music leaders at an exclusive cocktail event in Madrid. Here are all the details. ,,https://www.billboard.com/wp-content/uploads/2025/03/01-a-Billboard-Madrid-Event-2025-a-billboard-1548.jpg?w=1024,,,2025-03-19 15:03:03.667183
,,2025-03-19 16:22:20+00:00,Trinidad and Tobago Newsday,Pop sensation Maite Montenegro making waves in Latin America - Trinidad and Tobago Newsday,,,,,,https://newsday.co.tt/2025/03/18/pop-sensation-maite-montenegro-making-waves-in-latin-america/,"At just 16, Maite Merritt, known in the entertainment industry as Maite Montenegro, is already making waves in Latin America, becoming one of the most promising growing young voices.",,https://newsday.co.tt/wp-content/uploads/2025/03/23940242-1-e1742379558412.jpg,,,2025-03-19 14:02:07.192998
,,2025-03-19 16:15:53+00:00,Hindustan Times,Rachel Zegler blasts ‘White’ movie execs for asking her to prove her Latina heritage,,,,,,https://www.hindustantimes.com/entertainment/hollywood/rachel-zegler-blasts-white-movie-execs-for-asking-her-to-prove-her-latina-heritage-101742399107872-amp.html,"Snow White star Rachel Zegler revealed that when she was auditioning for West Side Story, movie bosses questioned her Colombian heritage.",,https://www.hindustantimes.com/ht-img/img/2025/03/19/1600x900/Rachel-Zegler-snow-white_1742374564759_1742400749460.jpg,,,2025-03-19 15:03:03.667183
,,2025-03-19 16:13:50+00:00,Miami's Community News | Your local connection,FIU and Dolan Family Foundation unveil D.R.E.A.M.S. – a groundbreaking program for the future of location-based entertainment | Featured#,,,,,,https://communitynewspapers.com/featured/fiu-and-dolan-family-foundation-unveil-d-r-e-a-m-s-a-groundbreaking-program-for-the-future-of-location-based-entertainment/,"Florida International University (FIU), in partnership with the Dolan Family Foundation, announced the launch of the Digital Research Entertainment Arts Media Sciences (D.R.E.A.M.S.) program. This groundbreaking program aims to position FIU at the forefront of the rapidly growing location-based entertainment (LBE) industry, creating new opportunities for education, hands-on learning and industry partnerships to prepare students",,https://communitynewspapers.com/wp-content/uploads/2025/03/Picture2.png,,,2025-03-19 17:01:51.271982
,,2025-03-19 15:59:50+00:00,EntertainmentNow,"Latin Grammy Awards Adds New Categories, Field For Winners ",,,,,,https://entertainmentnow.com/music/latin-grammy-awards-new-categories-field/,The Latin Grammy Awards ready their show to evolve with the musical landscape in order to accompany the always developing music creators.,,https://entertainmentnow.com/wp-content/uploads/2025/03/Jennifer-Lopez.jpg,,,2025-03-19 14:02:07.192998
,,2025-03-19 15:41:56+00:00,Forbes,Romeo Santos Reaches An Astounding Landmark With His Biggest Album,,,,,,https://www.forbes.com/sites/hughmcintyre/2025/03/19/romeo-santos-reaches-an-astounding-landmark-with-his-biggest-album/,"Romeo Santos’s Formula, Vol. 2 celebrates 520 weeks on the Top Latin Albums chart, marking a full decade as one of the most-consumed Latin albums in the U.S.",,https://imageio.forbes.com/specials-images/imageserve/67dad04ea3cafb2992e93fa6/0x0.jpg?format=jpg&height=900&width=1600&fit=bounds,,,2025-03-19 15:03:03.667183
,,2025-03-19 15:11:08+00:00,IndieWire,Rachel Zegler Says ‘White Executives’ Asked Her to ‘Prove’ Her Latin Heritage for ‘West Side Story’ Role,,,,,,https://www.indiewire.com/news/general-news/rachel-zegler-prove-latin-heritage-west-side-story-1235104670/,Rachel Zegler explained how earning the 'West Side Story' role included 'proving' her Latin heritage.,,https://www.indiewire.com/wp-content/uploads/2023/03/Rachel-Zegler.jpg?w=650,,,2025-03-19 14:02:07.192998
,,2025-03-19 15:07:27+00:00,Las Vegas Sun,AP Entertainment SummaryBrief at 10:59 a.m. EDT,,,,,,https://lasvegassun.com/news/2025/mar/18/ap-entertainment-summarybrief-at-1059-am-edt/,AP Entertainment SummaryBrief at 10:59 a.m. EDT,,//assets.lasvegassun.com/media/assets/images/icons/favicon-app.png,,,2025-03-19 14:02:07.192998
,,2025-03-19 14:44:37+00:00,www.usnews.com,The Latin Grammys Get Closer to Cinema With the New Best Music for Visual Media Category,,,,,,https://www.usnews.com/news/entertainment/articles/2025-03-19/the-latin-grammys-get-closer-to-cinema-with-the-new-best-music-for-visual-media-category,The Latin Grammys are getting closer to cinema and television with ... Entertainment News · News; Home. The Latin Grammys Get Closer to Cinema ...,,,,,2025-03-19 12:06:41.237745
,,2025-03-19 14:04:59+00:00,www.newsnationnow.com,The Latin Grammys get closer to cinema with the new best music for visual media category,,,,,,https://www.newsnationnow.com/entertainment-news/entertainment-headlines/ap-the-latin-grammys-get-closer-to-cinema-with-the-new-best-music-for-visual-media-category/,The Latin Grammys get closer to cinema with the new best music for visual media category ... Entertainment Headlines. Copyright 2025 The Associated ...,,,,,2025-03-19 14:02:07.192998
,,2025-03-19 14:03:55+00:00,Yahoo Entertainment,Latin Grammys Add Visual Media Field & Best Roots Song Category for 2025,,,,,,https://www.yahoo.com/entertainment/latin-grammys-add-visual-media-130000393.html,"New updates include eligibility changes, multiple renamed categories & more.",,https://media.zenfs.com/en/billboard_547/c3d9919cda893581ca1239c85de9f9dc,,,2025-03-19 19:01:24.996291
,,2025-03-19 13:55:43+00:00,Page Six,Rachel Zegler hits back at ‘white executives’ who questioned her Latina heritage during ‘West Side Story’ casting,,,,,,https://pagesix.com/2025/03/19/entertainment/rachel-zegler-white-executives-questioned-latina-heritage/,"“There’s confusion because I don’t have a single ounce of Latin in my name,” the actress, whose mother is Colombian, told Allure.",,https://pagesix.com/wp-content/uploads/sites/3/2025/03/100715350.jpg?quality=75&strip=all&w=1024,,,2025-03-19 12:06:41.237745
,,2025-03-19 13:54:31+00:00,www.sfchronicle.com,The Latin Grammys get closer to cinema with the new best music for visual media category,,,,,,https://www.sfchronicle.com/entertainment/article/the-latin-grammys-get-closer-to-cinema-with-the-20229556.php,"Arts & Entertainment. The Latin Grammys get closer to cinema with the new best music for visual media category. By The Associated Press, MIAMI March ...",,,,,2025-03-19 17:01:51.271982
,,2025-03-19 13:41:10+00:00,www.sfgate.com,The Latin Grammys get closer to cinema with the new best music for visual media category,,,,,,https://www.sfgate.com/entertainment/article/the-latin-grammys-get-closer-to-cinema-with-the-20229556.php,"Entertainment. The Latin Grammys get closer to cinema with the new best music for visual media category. By The Associated Press, MIAMI March 19, 2025.",,,,,2025-03-19 14:02:07.192998
,,2025-03-19 13:26:30+00:00,www.wtnh.com,The Latin Grammys get closer to cinema with the new best music for visual media category,,,,,,https://www.wtnh.com/entertainment-news/ap-entertainment/ap-the-latin-grammys-get-closer-to-cinema-with-the-new-best-music-for-visual-media-category/,The Latin Grammys are getting closer to cinema and television with ... Entertainment. The Latin Grammys get closer to cinema with the new best ...,,,,,2025-03-19 12:06:41.237745
,,2025-03-19 13:24:37+00:00,fox5sandiego.com,The Latin Grammys get closer to cinema with the new best music for visual media category,,,,,,https://fox5sandiego.com/entertainment/ap-entertainment/ap-the-latin-grammys-get-closer-to-cinema-with-the-new-best-music-for-visual-media-category/,The Latin Grammys are getting closer to cinema and television ... entertainment and video from fox5sandiego.com. Watch newscasts from FOX ...,,,,,2025-03-19 14:02:07.192998
,,2025-03-19 13:24:07+00:00,ABC News,The Latin Grammys get closer to cinema with the new best music for visual media category,,,,,,https://abcnews.go.com/Entertainment/wireStory/latin-grammys-closer-cinema-new-best-music-visual-119943505,The Latin Grammys are getting closer to cinema and television with the new best music for visual media category,,https://s.abcnews.com/images/US/abc_news_default_2000x2000_update_16x9_992.jpg,,,2025-03-19 12:06:41.237745
,,2025-03-19 13:18:31+00:00,TampaBeacon.com,"Sasha Caicedo: The Latin power that roars in ""The Lion King""",,,,,,https://www.tampabeacon.com/arts_and_entertainment/sasha-caicedo-the-latin-power-that-roars-in-the-lion-king/article_4239ff6e-034e-11f0-b2ab-db9c4ee7faf2.html,"Disney’s production “The Lion King,” considered one of the most iconic and successful works in musical theater, arrives in Tampa for a series of performances from April 2-20 at the",,https://bloximages.newyork1.vip.townnews.com/tampabeacon.com/content/tncms/assets/v3/editorial/8/c6/8c6fba9c-034e-11f0-a019-3743c7411ac8/67d85082aca2a.image.jpg?crop=1842%2C967%2C0%2C78&resize=1200%2C630&order=crop%2Cresize,,,2025-03-19 12:06:41.237745
,,2025-03-19 13:17:58+00:00,Yahoo News,The Latin Grammys get closer to cinema with the new best music for visual media category,,,,,,https://www.yahoo.com/news/latin-grammys-closer-cinema-best-130047975.html,"The Latin Grammys are getting closer to cinema and television with the new best music for visual media category.  The new category announced Wednesday will recognize original music for movies, TV shows, video games and other visual media.  For a project to participate in this category, it must feature Latin rhythms or be composed by someone of Ibero American descent.",,https://s.yimg.com/cv/apiv2/social/images/yahoo_default_logo-1200x1200.png,,,2025-03-19 12:06:41.237745
,,2025-03-19 13:12:26+00:00,GazetteXtra,The Latin Grammys get closer to cinema with the new best music for visual media category,,,,,,http://www.gazettextra.com/entertainment/the-latin-grammys-get-closer-to-cinema-with-the-new-best-music-for-visual-media/article_fb6b019d-17c3-5bcf-8c23-b415e53368af.html,The Latin Grammys are getting closer to cinema and television with the new best music for visual media category. The new category announced Wednesday by the Latin Recording Academy will,,https://bloximages.newyork1.vip.townnews.com/gazettextra.com/content/tncms/custom/image/bd5993ec-56a6-11ec-a43c-8f7b005e099d.jpg,,,2025-03-19 12:06:41.237745
,,2025-03-19 13:12:24+00:00,wgnradio.com,The Latin Grammys get closer to cinema with the new best music for visual media category,,,,,,https://wgnradio.com/news/entertainment-news/ap-the-latin-grammys-get-closer-to-cinema-with-the-new-best-music-for-visual-media-category/,"... Hispanic American origin, whether in Spanish ... Entertainment News. The Latin Grammys get closer to cinema with the new … Entertainment ...",,,,,2025-03-19 14:02:07.192998
,,2025-03-19 13:11:46+00:00,Your Hometown Stations,The Latin Grammys get closer to cinema with the new best music for visual media category,,,,,,https://www.hometownstations.com/news/entertainment/the-latin-grammys-get-closer-to-cinema-with-the-new-best-music-for-visual-media/article_12730921-be7b-5c07-bd23-1ece3373c990.html,The Latin Grammys are getting closer to cinema and television with the new best music for visual media category. The new category announced Wednesday by the Latin Recording Academy will,,https://bloximages.newyork1.vip.townnews.com/hometownstations.com/content/tncms/custom/image/46b64a2a-ded4-11e8-a898-e34431a11d22.jpg?resize=200%2C200,,,2025-03-19 12:06:41.237745
,,2025-03-19 13:05:26+00:00,Los Angeles Times en Español,Anuncian nuevas categorías y cambios en ciertas reglas de elegibilidad para el Latin Grammy,,,,,,https://www.latimes.com/espanol/entretenimiento/articulo/2025-03-19/anuncian-nuevas-categorias-y-cambios-en-reglas-de-elegibilidad-para-el-latin-grammy,La Academia Latina de la Grabación además añade una nueva área y modifican los requisitos en algunas ternas existentes ¿Cuáles son?,,https://ca-times.brightspotcdn.com/dims4/default/2438d75/2147483647/strip/true/crop/2675x1404+0+100/resize/1200x630!/quality/75/?url=https%3A%2F%2Fcalifornia-times-brightspot.s3.amazonaws.com%2F6a%2Fad%2Fae4076794b1a80202c20ef023fe9%2Flatin-grammy-3.jpg,,,2025-03-19 14:02:07.192998
,,2025-03-19 13:02:31+00:00,www.prweb.com,LoanPro and NovoPayment partner to expand access to credit in Latin America,,,,,,https://www.prweb.com/releases/loanpro-and-novopayment-partner-to-expand-access-to-credit-in-latin-america-302405427.html,"/PRNewswire-PRWeb/ -- LoanPro, the leading modern credit platform, has jointly announced a partnership with NovoPayment, a leading next gen financial...",,https://mma.prnewswire.com/media/2644660/novopaymentpadded.jpg?p=facebook,,,2025-03-19 12:06:41.237745
,,2025-03-19 10:19:30+00:00,Entertainment Focus,Review: Maluma proved he's untouchable during '+Pretty +Dirty' London show,,,,,,https://entertainment-focus.com/2025/03/19/review-maluma-proved-hes-untouchable-during-pretty-dirty-london-show/,"Seeing Maluma live is always an experience. He’s without a doubt one of the best live performers in music, always bringing energy and charisma to the stage.",,https://6835b446.delivery.rocketcdn.me/wp-content/uploads/2025/03/maluma2025o2feat.jpg,,,2025-03-19 12:06:41.237745
,,2025-03-19 09:28:08+00:00,New York Post,Rachel Zegler slams ‘white executives’ who asked her to ‘prove’ her Latin heritage for ‘West Side Story’ role,,,,,,https://nypost.com/2025/03/19/entertainment/rachel-zegler-slams-white-executives-who-asked-her-to-prove-her-latin-heritage-for-west-side-story-role/,"The “Snow White” actress, 23, opened up about being repeatedly questioned over her identity ahead of landing the part in Steven Spielberg’s 2021 film, “West Side Story.&#822…",,https://nypost.com/wp-content/uploads/sites/2/2025/03/100708370.jpg?quality=75&strip=all&w=1024,,,2025-03-19 05:59:15.256559
,,2025-03-19 07:35:52+00:00,EW.com,Rachel Zegler was asked by white execs if she's a 'legit' Latina in 'West Side Story' casting,,,,,,https://ew.com/rachel-zegler-asked-by-white-execs-if-legit-latina-for-west-side-story-11699539,"Rachel Zegler is opening up about her experience being cast in Steven Spielberg's 'West Side Story,' which at one point involved a room full of white executives asking if she was a 'legit' Latina.",,https://ew.com/thmb/AsG620-N1CnRneyAYOaBCfWUIyU=/1500x0/filters:no_upscale():max_bytes(150000):strip_icc()/rachel-zegler-2-west-side-story-031825-f206bacd53154069b6a7524c4b7e90d7.jpg,,,2025-03-19 03:57:29.087898
,,2025-03-19 07:35:07+00:00,BNamericas.com,BNamericas - Amazon and DirecTV announce a new partnershi...,,,,,,https://www.bnamericas.com/en/news/amazon-and-directv-announce-a-new-partnership-in-south-america,"Vrio, the parent company of DirecTV Latin America, is adding Amazon Prime Video and Amazon Prime Gaming to its service offering, offering its customers benef...",,https://www.bnamericas.com/assets/img/opengraphbna.jpg,,,2025-03-19 05:59:15.256559
,,2025-03-19 07:11:22+00:00,www.msn.com,"JYP Entertainment's 2025 Outlook: Stray Kids' Albums, TWICE's World Tour And ITZY's Solo Projects",,,,,,https://www.msn.com/en-in/entertainment/other/jyp-entertainment-s-2025-outlook-stray-kids-albums-twice-s-world-tour-and-itzy-s-solo-projects/ar-AA1B8OrQ,"JYP Entertainment, a South Korean multinational entertainment ... Following this, they will also embark on a series of fan concerts across Latin America ...",,,,,2025-03-19 05:59:15.256559
,,2025-03-19 05:06:26+00:00,Austin American-Statesman,"Austin's Café con Ron, a daytime Latin music celebration, expands to other Texas cities",,,,,,https://www.statesman.com/story/entertainment/music/2025/03/18/cafe-con-ron-day-party-austin-texas-latin-music-celebration-expands/82496661007/,"This isn't your typical nightlife story. A local DJ's vision is turning mornings into a cultural celebration, and it's spreading like wildfire.",,"https://www.statesman.com/gcdn/authoring/authoring-images/2025/03/17/NAAS/82497053007-img-0750.JPEG?crop=5471,3078,x0,y547&width=3200&height=1801&format=pjpg&auto=webp",,,2025-03-19 03:57:29.087898
,,2025-03-19 02:48:12+00:00,News,World Languages Week Celebrates Global Cultures with a Week of Events,,,,,,https://news.illinoisstate.edu/2025/03/world-languages-week-celebrates-global-cultures-with-a-week-of-events/,"In honor of World Languages Week, the Department of Languages, Literatures, and Cultures hosted a vibrant series of cultural events from March 4-7. The celebrations featured a mix of food, games, art, and discussions, all designed to highlight the diverse linguistic and cultural heritage of the world.",,https://news.illinoisstate.edu/files/2025/03/IMG_8231.jpeg,,,2025-03-18 23:58:53.132758
,,2025-03-19 01:28:49+00:00,thesnaponline.com,SCCA will host Latin Swing Entertainment - The Stanly News & Press,,,,,,https://thesnaponline.com/2025/03/18/scca-will-host-latin-swing-entertainment/%3Futm_source%3Dsite%26utm_medium%3Dorganic%26utm_campaign%3Drecirculation,The Stanly County Concert Association will present Latin Swing Entertainment at 7:30 p.m. March 22 at the Stanly County Agri-Civic Center.,,,,,2025-03-18 23:58:53.132758
,,2025-03-19 00:37:18+00:00,www.prnewswire.com,Illuccix® Approved for Prostate Cancer Imaging in Brazil: First Marketing Authorization in Latin America,,,,,,https://www.prnewswire.com/apac/news-releases/illuccix-approved-for-prostate-cancer-imaging-in-brazil-first-marketing-authorization-in-latin-america-302403659.html,"/PRNewswire/ -- Telix Pharmaceuticals Limited (ASX: TLX, Nasdaq: TLX, Telix, the Company) today announces that the Brazilian Health Regulatory Agency (Agencia...",,https://mma.prnewswire.com/media/1920208/Telix_Main_Logo_Logo.jpg?p=facebook,,,2025-03-18 23:58:53.132758
,,2025-03-19 00:17:57+00:00,ESPN Press Room U.S.,USPA Global and Global Polo Entertainment Extend Historic ESPN Relationship,,,,,,https://espnpressroom.com/us/press-releases/2025/03/uspa-global-and-global-polo-entertainment-extend-historic-espn-relationship/,USPA Global and Global Polo Entertainment Extend Historic ESPN Relationship,,https://espnpressroom.com/us/files/2025/03/9b0a7426f86ee9329669beba9f6b.png,,,2025-03-19 03:57:29.087898
,,2025-03-18 23:42:35+00:00,"Oklahoma City Free Press | Oklahoma City's locally owned, fiercely independent news source",Cine Latino Film Festival brings world of Latin film to OKC,,,,,,https://freepressokc.com/cine-latino-film-festival-brings-world-of-latin-film-to-okc/,"Friday and Saturday, Capitol Hill will be bursting with creative energy, excitement, and culture as the Cine Latino Film Festival celebrates its eleventh year.",,https://freepressokc.com/wp-content/uploads/2025/03/Red-Mist-A-Portrait-of-Men.jpg,,,2025-03-18 23:58:53.132758
,,2025-03-18 23:02:36+00:00,The Hollywood Reporter,iHeartRadio Music Awards Winners: Billie Eilish and Finneas Take Album of the Year,,,,,,https://www.hollywoodreporter.com/lists/iheartradio-music-awards-winners-2025-full-list/,"Taylor Swift, Benson Boone, SZA, GloRilla, Sabrina Carpenter and Green Day also were among the winners during Monday night's show.",,https://www.hollywoodreporter.com/wp-content/uploads/2025/03/GettyImages-2205628285.jpg?w=1440&h=810&crop=1,,,2025-03-18 23:58:53.132758
,,2025-03-18 22:34:02+00:00,Cosmopolitan,Rachel Zegler Had to Prove She Was Latina Enough for ‘West Side Story’,,,,,,https://www.cosmopolitan.com/entertainment/celebs/a64223487/rachel-zegler-had-to-prove-she-was-latina-enough-for-west-side-story/,"“I remember thinking, ‘Do you want me to bring my abuelita in?’”",,"https://hips.hearstapps.com/hmg-prod/images/gettyimages-2202392597-67d9de97a7eb8.jpg?crop=1.00xw:0.752xh;0,0.0577xh&resize=1200:*",,,2025-03-18 23:58:53.132758
,,2025-03-18 22:18:52+00:00,LehighValleyNews.com,New Latino culture festival coming to downtown Allentown,,,,,,https://www.lehighvalleynews.com/local-news/new-latino-culture-festival-coming-to-downtown-allentown,"Fiesta on Hamilton will take over Hamilton Street from 9th Street to 11th Street 1 to 7 p.m. May 18, the Chamber announced.",,https://static.lehigh-v.lehigh-valley.production.k1.m1.brightspot.cloud/dims4/default/8514f42/2147483647/strip/true/crop/1280x672+0+24/resize/1200x630!/quality/90/?url=http%3A%2F%2Flehigh-valley-brightspot.s3.us-east-2.amazonaws.com%2F6d%2F68%2F73290bf04e62bb3104b3d3b7c201%2Flatinfest.jpeg,,,2025-03-18 23:58:53.132758
,,2025-03-18 22:06:20+00:00,Global Voices,‘Emilia Pérez’: An Oscar for Latin American stereotypes,,,,,,https://globalvoices.org/2025/03/18/emilia-perez-an-oscar-for-latin-american-stereotypes/,"For many, this musical is cultural extractivism to the detriment of the true image of our region.",,https://es.globalvoices.org/wp-content/uploads/2025/02/Premios-oscar-1024x576-1-800x450.jpg,,,2025-03-18 23:58:53.132758
,,2025-03-18 22:04:46+00:00,www.etnow.com,Latin Music's Premio Lo Nuestro awards are beat perfect with Hippotizer - ETNow.com,,,,,,https://www.etnow.com/news/2025/3/latin-musics-premio-lo-nuestro-awards-are-beat-perfect-with-hippotizer,"... Entertainment in North America. The JMT team consisted of Jorge M. Toro as head of programming and video producer, Mauricio Caicedo as server ...",,,,,2025-03-18 23:58:53.132758
,,2025-03-18 21:44:53+00:00,www.myjournalcourier.com,"12 killed in Honduras plane crash, including Garifuna musician Aurelio Martínez Suazo",,,,,,https://www.myjournalcourier.com/entertainment/article/12-killed-in-honduras-plane-crash-including-20228732.php,Entertainment. 12 killed in ... The victims bodies were taken from Roatan to the morgue in San Pedro Sula. ____. Follow AP's coverage of Latin ...,,,,,2025-03-18 23:58:53.132758
,,2025-03-18 21:41:25+00:00,www.thebeijinger.com,Grills & Grooves: All the Entertainment at Sausage Fest!,,,,,,https://www.thebeijinger.com/blog/2025/03/18/grills-grooves-all-entertainment-sausage-fest,"From sausage-themed games to live music, this is going to be one banger of an event!",,https://www.thebeijinger.com/sites/default/files/thebeijinger/blog-images/394868/2_1600_3000_gif_0.jpg,,,2025-03-19 03:57:29.087898
,,2025-03-18 20:14:41+00:00,Yahoo Entertainment,Rachel Zegler Says ‘White Executives’ Asked Her to ‘Prove’ Her Latin Heritage for ‘West Side Story’ Role,,,,,,https://www.yahoo.com/entertainment/rachel-zegler-says-white-executives-200000244.html,"""There’s confusion because I don’t have a single ounce of Latin in my name,"" the “Snow White” star said. ""They kept calling to ask if I was legit.""",,https://s.yimg.com/ny/api/res/1.2/_gUx9n4tfRXv5B_Q8dk6ew--/YXBwaWQ9aGlnaGxhbmRlcjt3PTEyMDA7aD04MDA-/https://media.zenfs.com/en/indiewire_268/1506fbbd8c5abc885020dd66cd9750f3,,,2025-03-18 23:58:53.132758
,,2025-03-18 19:07:37+00:00,Dallas News,"New D-FW restaurant and cocktail lounge promises fresh Latin flavors, vibrant nightlife",,,,,,https://www.dallasnews.com/food/restaurant-news/2025/03/17/gigis-bar-lounge-plano/,"Gigi’s Bar & Lounge, a Latin-inspired restaurant and cocktail lounge, will open this spring at The Shops at Legacy North in Plano.",,https://dmn-dallas-news-prod.cdn.arcpublishing.com/resizer/v2/LNDE3SF6SNB65JRZCM6IIEBT5E.jpeg?auth=57e51f0cded1836890c315fc204b29dcec43ce57e781156fa94e2e381b1517e8&height=630&width=1200&smart=true&quality=80,,,2025-03-18 23:58:53.132758
,,2025-03-18 18:43:58+00:00,FF News | Fintech Finance,Kuady Partners with Deriv to Enhance Seamless Trading Payments Across Latin America,,,,,,https://ffnews.com/newsarticle/tradetech/kuady-partners-with-deriv-to-enhance-seamless-trading-payments-across-latin-america/,"Kuady, a leading digital wallet solution, has announced a new partnership with Deriv, a global online trading platform, to integrate its payment services for both deposits and withdrawals.",,https://ffnews.com/wp-content/uploads/2025/03/merged_image_320570.jpg,,,2025-03-18 23:58:53.132758
,,2025-03-18 18:39:31+00:00,HOLA! USA,"Lollapalooza 2025: Young Miko, Sabrina Carpenter, Olivia Rodrigo, The Marias and many more ",,,,,,https://www.hola.com/us/entertainment/20250318820915/lollapalooza-2025-lineup/,With a strong presence from Latino artists who are continuing to shape the global music scene.,,https://www.hola.com/us/horizon/landscape/9995aeb7f955-olivia-rodrigo-performs-at-the-olivia-rodrigo-guts-world-tour-at-the-kia-forum-o.jpg?im=Resize=(1200),,,2025-03-18 23:58:53.132758
,,2025-03-18 17:00:07+00:00,hispanicprwire.com,"Coppel Access Is Now AccessMás, Expanding Its Offerings Across Latin America",,,,,,https://hispanicprwire.com/en/coppel-access-is-now-accessmas-expanding-its-offerings-across-latin-america/,"Entertainment · Family & Living · General · Goverment & Politics · Ibero ... Currently available in six countries, AccessMás plans to expand to other ...",,,,,2025-03-18 23:58:53.132758
