id,name,published,outlet,title,authors,category,market,categoryorder,articleorder,url,description,text,image,error,sentiment,firstEyes
,,2025-04-21 15:39:57+00:00,Fortune,Chipotle is opening up in Mexico in first foray into Latin America,,,,,,https://fortune.com/article/chipotle-expanding-mexico-latin-america/,The burrito maker is betting the country’s familiarity with its ingredients make it an attractive growth market,,"https://fortune.com/img-assets/wp-content/uploads/2025/04/GettyImages-2165824159-e1745244125901.jpg?resize=1200,600",,,2025-04-21 12:24:43.533342
,,2025-04-21 15:30:20+00:00,Times Union,"Pope Francis, Latin America's first pontiff who ministered with charm and humility, dies at 88",,,,,,https://www.timesunion.com/news/world/article/pope-francis-latin-america-s-first-pontiff-who-20286026.php,Cardinal Kevin Farrell says Pope Francis has died at age 88. The first Latin American...,,https://s.hdnux.com/photos/01/50/06/32/27289228/3/rawImage.jpg,,,2025-04-21 12:24:43.533342
,,2025-04-21 15:06:26+00:00,Yahoo News,"Pope Francis, first Latin American pontiff, dies at 88",,,,,,https://www.yahoo.com/news/pope-francis-first-latin-american-085534491.html,Pope Francis has died. He was history’s first Latin American pontiff who charmed the world with his humble style and concern for the poor but alienated conservatives with critiques of capitalism and climate change. He was 88.,,https://s.yimg.com/ny/api/res/1.2/csVkZZbEJGL6WRC0upKpyA--/YXBwaWQ9aGlnaGxhbmRlcjt3PTEyMDA7aD02NzU-/https://cf-images.us-east-1.prod.boltdns.net/v1/jit/6415665815001/8aeba4fb-22fd-49ce-a56a-88c795a9fd92/main/1280x720/1m6s762ms/match/image.jpg,,,2025-04-21 12:24:43.533342
,,2025-04-21 14:58:28+00:00,Huron Daily Tribune,AP PHOTOS: Pope Francis on Easter Sunday,,,,,,https://www.michigansthumb.com/news/article/ap-photos-pope-francis-on-easter-sunday-20286390.php,This is a photo gallery curated by AP photo editors,,https://s.hdnux.com/photos/01/50/06/45/27289938/3/rawImage.jpg,,,2025-04-21 12:24:43.533342
,,2025-04-21 14:05:42+00:00,Times Union,"Pope Francis, first Latin American pontiff who ministered with a charming, humble style, dies at 88",,,,,,https://www.timesunion.com/news/world/article/pope-francis-has-died-the-vatican-camerlengo-20285965.php,Pope Francis has died at age 88. ,,https://s.hdnux.com/photos/01/50/06/32/27289247/3/rawImage.jpg,,,2025-04-21 11:13:44.603093
,,2025-04-21 14:04:35+00:00,www.youtube.com,"Pope Francis, The First Latin American Leader Of The Catholic Church, Dies At 88 | Archives",,,,,,https://www.youtube.com/watch%3Fv%3Dd1EGXiZDr2w,... entertainment news live | latest bollywood news | bollywood | news18 | n18oc_movies Liked the video? Please press the thumbs up icon and leave a ...,,,,,2025-04-21 11:13:44.603093
,,2025-04-21 13:53:41+00:00,AP News,"Explore Pope Francis' life, in photos",,,,,,https://apnews.com/article/pope-francis-vatican-obit-dead-photos-f110d39b3a25f0da8d014f184c420e95,"Pope Francis, history’s first Latin American pontiff who charmed the world with his humble style and concern for the poor but alienated conservatives with critiques of capitalism and climate change, died Monday.",,https://dims.apnews.com/dims4/default/f822692/2147483647/strip/true/crop/3000x1688+0+246/resize/1440x810!/quality/90/?url=https%3A%2F%2Fassets.apnews.com%2F7c%2F36%2F68d87656cf044620159423248b8a%2F31cead8d6a954afa963c360d33067801,,,2025-04-21 11:13:44.603093
,,2025-04-21 13:50:53+00:00,WOAI,Families enjoy fun and treats during San Antonio Zoo's egg-citing Easter celebration,,,,,,https://news4sanantonio.com/newsletter-daily/families-enjoy-fun-and-treats-during-san-antonio-zoos-egg-citing-easter-celebration,SAN ANTONIO - The San Antonio Zoo was full of egg-citing activities on Easter Sunday.They hosted the free egg-stravaganza for the community. It was full of foo,,https://news4sanantonio.com/resources/media2/16x9/1280/986/center/90/35acf16c-6517-422b-9d60-b2159e589570-SAZOOEGGSTRAVAGANZA_btm.0005_frame_739.jpeg,,,2025-04-21 11:13:44.603093
,,2025-04-21 13:48:12+00:00,AP News,"Pope Francis, first Latin American pontiff, dies at 88",,,,,,https://apnews.com/video/pope-francis-first-latin-american-pontiff-dies-at-88-1b4adac01e324aa2b756bc3276ce6a08,Pope Francis has died. He was history’s first Latin American pontiff who charmed the world with his humble style and concern for the poor but alienated conservatives with critiques of capitalism and climate change.,,https://dims.apnews.com/dims4/default/c37cf29/2147483647/strip/true/crop/1280x720+0+0/resize/1440x810!/quality/90/?url=https%3A%2F%2Fassets.apnews.com%2F8d%2F76%2F13de5ce848f4828a52c4a0ee9601%2Fmaryland-1-2025-04-21t184034-817.png,,,2025-04-21 11:13:44.603093
,,2025-04-21 12:50:49+00:00,Huron Daily Tribune,'A huge sense of shock': Vatican City visitors mournful following death of Pope Francis,,,,,,https://www.michigansthumb.com/news/article/a-huge-sense-of-shock-vatican-city-visitors-20286181.php,Pope Francis has died at the age of 88.,,https://s.hdnux.com/photos/01/50/06/40/27289657/3/rawImage.jpg,,,2025-04-21 11:13:44.603093
,,2025-04-21 11:53:53+00:00,WRGB,"Pope Francis, first Latin American pontiff, dies at 88",,,,,,https://cbs6albany.com/news/nation-world/pope-francis-first-latin-american-pontiff-roman-catholic-church-easter-monday-dies-at-88-casa-santa-marta-holy-father-bishop-of-rome-basilica-st-mary-major-conclave-health-issues-pneumonia,"According to his final wishes, he is expected to be buried at the ancient Basilica of St. Mary Major. ",,https://cbs6albany.com/resources/media2/16x9/1024/986/0x9/90/a16ded5d-57b9-4df7-b8db-6deda3946bf7-AP23026312848380.jpg,,,2025-04-21 11:13:44.603093
,,2025-04-21 11:48:44+00:00,Seattle Post-Intelligencer,"AP PHOTOS: Pope Francis, first Latin American pontiff, dies at 88",,,,,,https://www.seattlepi.com/news/article/ap-photos-pope-francis-first-latin-american-20286081.php,"Pope Francis, history’s first Latin American pontiff who charmed the world with his...",,https://s.hdnux.com/photos/01/50/06/41/27289676/3/rawImage.jpg,,,2025-04-21 11:13:44.603093
,,2025-04-21 11:33:04+00:00,www.wane.com,Pope Francis: Key dates in the life of the first Latin American pontiff | WANE 15,,,,,,https://www.wane.com/news/pope-francis-key-dates-in-the-life-of-the-first-latin-american-pontiff/,... Entertainment · Wild on WANE · National/World · Veterans Voices · Black History Month · Hispanic Heritage Month · Platinum Perspective · Positively ...,,,,,2025-04-21 11:13:44.603093
,,2025-04-21 11:23:55+00:00,The Weekly Journal,Chinese Students Learn Spanish with Bad Bunny Songs,,,,,,https://www.theweeklyjournal.com/lifestyle/entertainment/chinese-students-learn-spanish-with-bad-bunny-songs/article_2d7f34b9-5f97-47f4-bd3d-771cbd9c8df7.html,"In China, reggaeton is not only danced, it is also studied. What started as a musical taste has become a curious educational tool: More and more college students are learning",,https://bloximages.newyork1.vip.townnews.com/theweeklyjournal.com/content/tncms/assets/v3/editorial/6/17/617e447b-350d-4b76-b8d6-84e0239e7c8a/6802a4ef9296c.image.png?crop=882%2C463%2C0%2C24,,,2025-04-21 12:24:43.533342
,,2025-04-21 11:23:37+00:00,Young Post,"Pope Francis, who ministered with humility and advocated for compassion, dies at 88",,,,,,https://www.scmp.com/yp/discover/news/global/article/3307336/pope-francis-dies-88-first-latin-american-pope-advocated-peace-and-compassion,"Head of the Catholic Church, whose reform efforts attracted fierce supporters and critics, blessed thousands on Easter Sunday, one day before his death.",,https://cdn.i-scmp.com/sites/default/files/styles/og_image_young_post/public/d8/images/canvas/2025/04/21/ef912ef9-267e-4595-92e1-3914153da96d_1a80d05c.jpg?itok=MoD34CqY&v=1745231416,,,2025-04-21 11:13:44.603093
,,2025-04-21 11:23:37+00:00,Page Six,"Pope Francis, the first Latin American pontiff, dead at 88 after months-long battle with pneumonia",,,,,,https://pagesix.com/2025/04/21/celebrity-news/pope-francis-first-latin-american-pontiff-dead-at-88-after-pneumonia-battle/,The head of the Catholic Church met with King Charles III and Queen Camilla earlier this month and Vice President JD Vance on Easter Sunday.,,https://pagesix.com/wp-content/uploads/sites/3/2025/04/pope-francis-36.jpg?quality=75&strip=all&w=1024,,,2025-04-21 11:13:44.603093
,,2025-04-21 11:16:48+00:00,The Times of India,Remembering Pope Francis: When the first Latin American leader of the Roman Catholic Church met the Italian actor Roberto Benigni | - The Times of India,,,,,,https://timesofindia.indiatimes.com/entertainment/english/hollywood/news/remembering-pope-francis-when-the-first-latin-american-leader-of-the-roman-catholic-church-met-the-italian-actor-roberto-benigni/articleshow/120484820.cms,"A tribute to Pope Francis, the first Latin American leader of the Roman Catholic Church, highlights his heartfelt meeting with Italian actor Roberto Benigni, showcasing the joy and light he brought to many during his papacy. Discover the memories of this beloved figure as we reflect on his legacy following his passing.",,"https://static.toiimg.com/thumb/msid-120484874,width-1070,height-580,imgsize-55612,resizemode-75,overlay-toi_sw,pt-32,y_pad-40/photo.jpg",,,2025-04-21 11:13:44.603093
,,2025-04-21 11:13:54+00:00,www.nytimes.com,"Francis, the First Latin American Pope, Dies at 88 - The New York Times",,,,,,https://www.nytimes.com/2025/04/21/world/europe/pope-francis-dead.html,"When he became pope, Benedict ordered the removal of the editor of a Jesuit journal, America, because it entertained ideas anathema to conservative ...",,,,,2025-04-21 11:13:44.603093
,,2025-04-21 11:12:57+00:00,WPLG,"Pope Francis, first Latin American pontiff who ministered with a charming, humble style, dies at 88",,,,,,https://www.local10.com/news/world/2025/04/21/pope-francis-has-died-the-vatican-camerlengo-announces/,Pope Francis has died at age 88.,,"https://res.cloudinary.com/graham-media-group/image/upload/f_auto/q_auto/c_thumb,w_700/v1/media/gmg/IGP3P42GSZDYNDNNQFWJAYR4ZY.jpg?_a=DATAdtccZAA0",,,2025-04-21 11:13:44.603093
,,2025-04-21 11:01:57+00:00,The Morning Sun,"AP PHOTOS: Pope Francis, first Latin American pontiff, dies at 88 - The Morning Sun",,,,,,"http://www.morningsun.net/stories/ap-photos-pope-francis-first-latin-american-pontiff-dies-at-88,191298","Pope Francis, history’s first Latin American pontiff who charmed the world with his humble style and concern for the poor but alienated conservatives with critiques of capitalism and climate  &hellip;",,https://mapi.associatedpress.com/v2/items/605f04d236a845d4bba38fa2eda304cc.0/preview/preview.jpg?nfe=true&s=512&wm=false&app=MPK&tag=iid~605f04d236a845d4bba38fa2eda304cc!rsn~0!cid~c315e176f4584f85afd3680a50ecb1b2!orgId~46179!qt~2uZR8JQ6ZgeI!orgNm~THE%20MORNING%20SUN%20!role~Preview!mt~photo!fmt~JPEG%20Baseline,,,2025-04-21 11:13:44.603093
,,2025-04-21 08:54:19+00:00,spectrumlocalnews.com,Pope Francis dies at 88,,,,,,https://spectrumlocalnews.com/us/national/religion/2025/04/21/pope-francis-dead,"From his election, the Argentine-born Jorge Mario Bergoglio signaled a different papacy, embracing refugees and the downtrodden",,https://s7d2.scene7.com/is/image/TWCNews/AP23359419295055_crop_3,,,2025-04-21 11:13:44.603093
,,2025-04-21 08:36:46+00:00,The Hollywood Reporter,"Pope Francis, First Latin American Pontiff, Dies at 88",,,,,,https://www.hollywoodreporter.com/news/general-news/pope-francis-dead-at-88-1236196499/,"Francis, who suffered from chronic lung disease and had part of one lung removed as a young man, was admitted to Gemelli hospital on Feb. 14, 2025, for a respiratory crisis that developed into double pneumonia.",,https://www.hollywoodreporter.com/wp-content/uploads/2025/04/GettyImages-2210546713-1.jpg?w=1296&h=730&crop=1,,,2025-04-21 05:01:39.450476
,,2025-04-21 08:33:40+00:00,www.9news.com.au,Live updates: The death of Pope Francis,,,,,,https://www.9news.com.au/world/pope-francis-dies-aged-88-first-latin-american-pope-live-updates-latest-news-headlines/16670af8-dfe9-4ab3-b697-7856e153b82b,The Vatican announced the pontiff's death just hours after he had made two surprise appearances to greet Ea...,,https://imageresizer.static9.net.au/0CMqn2VcSBeLN_4byEWzG6EIpws=/0x101:1024x677/1200x628/smart/https%3A%2F%2Fprod.static9.net.au%2Ffs%2F6d848e2a-9646-488f-ae34-676091dd226f,,,2025-04-21 05:01:39.450476
,,2025-04-21 08:33:36+00:00,Hindustan Times,Pope Francis death news | Live updates: Latin American pontiff dies at 88; tributes pour in,,,,,,https://www.hindustantimes.com/world-news/pope-francis-death-news-live-vatican-easter-2025-age-88-illness-catholic-church-101745222877037.html,Pope Francis death: He was 88 and had recently survived a serious bout of double pneumonia.,,https://www.hindustantimes.com/ht-img/img/2025/04/21/550x309/Pope_Francis_1742728836331_1745223453434.JPG,,,2025-04-21 05:01:39.450476
,,2025-04-21 08:23:38+00:00,Business Insider,"Pope Francis, Catholic Church trailblazer and first Latin American pope, dies",,,,,,https://www.businessinsider.com/pope-francis-dead-obituary-2025-4,"Pope Francis died at 88 on Easter Monday, more than 12 years after he became the first Latin American pope.",,https://i.insider.com/67ba5265c040bd1b4ca2e442?width=1200&format=jpeg,,,2025-04-21 05:01:39.450476
,,2025-04-21 08:22:41+00:00,www.bbc.com,Francis: Traditional Pope from Latin America who changed Catholic Church ,,,,,,https://www.bbc.com/news/articles/c98zxx13d3go,His papacy heralded many firsts and raised questions about the leadership of the Catholic Church.,,https://ichef.bbci.co.uk/news/1024/branded_news/703c/live/29bd8c00-f5d2-11ef-896e-d7e7fb1719a4.jpg,,,2025-04-21 05:01:39.450476
,,2025-04-21 08:21:16+00:00,KGAN,"Pope Francis, first Latin American pontiff dies at 88",,,,,,https://cbs2iowa.com/news/local/pope-francis-first-latin-american-pontiff-who-ministered-with-a-charming-humble-style-d,"VATICAN CITY (AP) &mdash; Pope Francis, history&rsquo;s first Latin American pontiff who charmed the world with his humble style and concern for the poor but alienated cons",,https://cbs2iowa.com/resources/media2/16x9/951/986/0x9/90/419fc45a-ea59-41ec-8d45-7c5d8fa85c31-POPE.png,,,2025-04-21 05:01:39.450476
,,2025-04-21 08:11:32+00:00,The Hindu,Pope Francis passes away at 88,,,,,,https://www.thehindu.com/news/international/pope-francis-death-catholic-church-april-21-2025/article69254510.ece,"Pope Francis, first Latin American leader of the Roman Catholic Church, dies after battling respiratory illness, leaving a legacy of reform.",,https://th-i.thgim.com/public/incoming/ho63kh/article69473745.ece/alternates/LANDSCAPE_1200/2025-04-21T080535Z_891476312_RC2M1EAPN8OL_RTRMADP_3_PEOPLE-POPE-FRANCIS.JPG,,,2025-04-21 05:01:39.450476
,,2025-04-21 08:00:18+00:00,AP News,"Pope Francis, first Latin American pontiff who ministered with a charming, humble style, dies at 88",,,,,,https://apnews.com/article/vatican-pope-francis-dead-01ca7d73c3c48d25fd1504ba076e2e2a,Pope Francis was history’s first Latin American pontiff who charmed the world with his humble style and concern for the poor but alienated conservatives with critiques of capitalism and climate change.,,https://dims.apnews.com/dims4/default/477f539/2147483647/strip/true/crop/512x288+0+27/resize/1440x810!/quality/90/?url=https%3A%2F%2Fassets.apnews.com%2Fa8%2F42%2F22d62bf3d7a63c52245157d3f02e%2F7ffaa421181d48248c92a5f34b12b4c1,,,2025-04-21 05:01:39.450476
,,2025-04-20 22:57:04+00:00,hoodline.com,"Chandler Museum Unveils ""¡MONSTRAS"" A Fresh Take on Latin American Female Legends",,,,,,https://hoodline.com/2025/04/chandler-museum-unveils-monstras-a-fresh-take-on-latin-american-female-legends/,"... Fun & Entertainment navigation icon. Fun & Entertainment · Weather ... The Chandler Museum will open a new exhibition, “¡MONSTRAS!: Female Legends of ...",,,,,2025-04-20 20:01:08.890750
,,2025-04-20 22:47:41+00:00,www.msn.com,Snow White star Rachel Zegler says she had to 'prove Latin ethnicity' to 'white movie executives',,,,,,http://www.msn.com/en-us/entertainment/entertainment-celebrity/snow-white-star-rachel-zegler-says-she-had-to-prove-latin-ethnicity-to-white-movie-executives/ar-AA1BfV62%3Focid%3DFUJITSUDHP17%26apiversion%3Dv2%26noservercache%3D1%26domshim%3D1%26renderwebcomponents%3D1%26wcseo%3D1%26batchservertelemetry%3D1%26noservertelemetry%3D1,"The Latina actress, 23, who plays the titular Snow White in Disney's upcoming live-action remake, says she was repeatedly asked to prove her ...",,,,,2025-04-21 04:02:01.041524
,,2025-04-20 21:08:05+00:00,Seattle Post-Intelligencer,"Pope Francis emerges from convalescence on Easter, delights crowd with popemobile tour",,,,,,https://www.seattlepi.com/news/world/article/vatican-s-easter-mass-opens-without-pope-francis-20285104.php,Pope Francis has emerged from his convalescence on Easter Sunday to bless people in St....,,https://s.hdnux.com/photos/01/50/06/03/27287801/3/rawImage.jpg,,,2025-04-21 05:01:39.450476
,,2025-04-20 19:21:41+00:00,Glam,The Stunning Style Transformation Of Shakira - Glam,,,,,,https://www.glam.com/1837022/stunning-style-transformation-shakira/,Shakira's fashion has been everything from rockstar to pop-star chic and even preppy at times. Here's her full style journey from 1995 to now.,,https://www.glam.com/img/gallery/the-stunning-style-transformation-of-shakira/l-intro-1744901851.jpg,,,2025-04-20 22:01:12.153238
,,2025-04-20 16:42:10+00:00,CiberCuba,Celia Cruz will be honored at the Women Latinas in Music gala during the Billboard Awards,,,,,,https://en.cibercuba.com/noticias/2025-04-20-u1-e43231-s27065-nid301311-celia-cruz-recibira-homenaje-gala-mujeres-latinas,"Ivy Queen, Olga Tañón, and La India will perform the most iconic hits of the Queen of Salsa.",,https://cdn0.celebritax.com/sites/default/files/styles/watermark_100/public/1745166050-celia-cruz-recibira-homenaje-postumo-gala-mujeres-latinas-musica-billboard.jpg,,,2025-04-20 17:03:27.672892
,,2025-04-20 15:58:05+00:00,Seattle Post-Intelligencer,"Vance meets Pope Francis on Easter Sunday after tangle over migration, gets chocolate eggs for kids",,,,,,https://www.seattlepi.com/news/world/article/jd-vance-meets-pope-francis-on-easter-sunday-20285123.php,"Just days before he was hospitalized in February, Francis blasted the deportation plans,...",,https://s.hdnux.com/photos/01/50/06/03/27287799/3/rawImage.jpg,,,2025-04-20 17:03:27.672892
,,2025-04-20 12:07:08+00:00,West K News,Free gospel concert in Kelowna to help build schools in Latin America,,,,,,https://www.westknews.com/local-entertainment/free-gospel-concert-in-kelowna-to-help-build-schools-in-latin-america-7951229,"The concert is on Friday, May 2",,https://www.bpmcdn.com/f/files/kelowna/2025-april/fehr.jpg;w=1200;h=800;mode=crop,,,2025-04-20 12:07:44.921490
,,2025-04-19 21:56:15+00:00,www.bulletinaylmer.com,Latin culture takes center stage at the HOLA Festival in Aylmer,,,,,,https://www.bulletinaylmer.com/latin-culture-takes-center-stage-at-the-hola-festival-in-aylmer,,,,,,2025-04-19 19:03:47.754265
,,2025-04-19 17:53:04+00:00,Yahoo Entertainment,Nacho’s Christian Album ‘Sobre La Roca’ & More Uplifting Moments in Latin Music,,,,,,https://www.yahoo.com/entertainment/articles/nacho-christian-album-sobre-la-140000833.html,"Plus, a movie about Las Chicas del Can is on the horizon.",,https://s.yimg.com/ny/api/res/1.2/0lAbhOVHZNWBgwUYZVV40Q--/YXBwaWQ9aGlnaGxhbmRlcjt3PTEyMDA7aD03OTQ-/https://media.zenfs.com/en/billboard_547/557fb5c01683cf771268a0b6a26b7406,,,2025-04-19 17:04:49.736859
,,2025-04-19 06:34:25+00:00,Huron Daily Tribune,AP Week in Pictures: Latin America and Caribbean,,,,,,https://www.michigansthumb.com/news/article/ap-week-in-pictures-latin-america-and-caribbean-20282302.php,"April 11-17, 2025",,https://s.hdnux.com/photos/01/50/04/63/27282629/3/rawImage.jpg,,,2025-04-19 20:04:07.543006
,,2025-04-19 04:06:26+00:00,TAPinto,Cantabile Chamber Chorale performs Echoes of Spain/Ecos de España,,,,,,https://www.tapinto.net/events/cantabile-chamber-chorale-performs-echoes-of-spain-ecos-de-espana-3,"In our 2025 concert series “Ecos de España/Echoes of Spain,"" Cantabile Chamber Chorale performs songs that are a testament to the vibrant choral music of Spain and Latin America, reflecting a blend...",,http://tapinto-production.s3.amazonaws.com/uploads/events/cp/facebook_cp-April-26%2C-2025-flyer-with-white-text-for-Emma-email.jpg,,,2025-04-19 11:02:53.338559
,,2025-04-19 00:57:01+00:00,Yahoo Entertainment,Beéle & Marc Anthony’s ‘Dios Me Oyó’ & More Best New Music Latin,,,,,,https://www.yahoo.com/entertainment/articles/le-marc-anthony-dios-oy-165157367.html,"Plus, check out Billboard's New Music Latin weekly playlist below!",,https://s.yimg.com/ny/api/res/1.2/vA7OOkWpNZv6b93xSDAYfg--/YXBwaWQ9aGlnaGxhbmRlcjt3PTEyMDA7aD03OTQ-/https://media.zenfs.com/en/billboard_547/3d1001bf682a69f8662d05cd32d973f4,,,2025-04-18 23:03:10.273865
,,2025-04-19 00:55:47+00:00,Yahoo Entertainment,"Kenia OS, Anitta & More: Vote for the Best New Latin Music This Week",,,,,,https://www.yahoo.com/entertainment/articles/kenia-os-anitta-more-vote-200452808.html,Which release do you think is the best?,,https://s.yimg.com/ny/api/res/1.2/s8f0gsb3E9NhWpC59ZOoaw--/YXBwaWQ9aGlnaGxhbmRlcjt3PTEyMDA7aD03OTQ-/https://media.zenfs.com/en/billboard_547/1ec5aedb80103492749c772a4e63384c,,,2025-04-18 23:03:10.273865
,,2025-04-18 22:17:22+00:00,Milford Mirror,AP Week in Pictures: Latin America and Caribbean,,,,,,https://www.milfordmirror.com/news/article/ap-week-in-pictures-latin-america-and-caribbean-20282302.php,"April 11-17, 2025",,https://s.hdnux.com/photos/01/50/04/63/27282629/3/rawImage.jpg,,,2025-04-19 16:02:03.737712
,,2025-04-18 21:20:46+00:00,The Wilton Bulletin,AP Week in Pictures: Latin America and Caribbean,,,,,,https://www.wiltonbulletin.com/news/article/ap-week-in-pictures-latin-america-and-caribbean-20282302.php,"April 11-17, 2025",,https://s.hdnux.com/photos/01/50/04/63/27282629/3/rawImage.jpg,,,2025-04-19 11:02:53.338559
,,2025-04-18 20:03:42+00:00,Petaluma Argus-Courier,"Cracker, Ozomatli, English Beat: Lineup of Petaluma Music Festival announced",,,,,,https://www.petaluma360.com/article/entertainment/cracker-ozomatli-petaluma-music-festival/,"The 2025 Petaluma Music Festival will return on Saturday, July 26. It’s one of Petaluma’s most popular events, raising much-needed money in support of music programs throughout town.",,https://imengine.prod.srp.navigacloud.com/?uuid=F40765C2-4407-453E-8514-20E929580792&type=primary&q=75&width=1600,,,2025-04-18 17:07:56.852129
,,2025-04-18 18:59:27+00:00,Indianapolis News | Indiana Weather | Indiana Traffic | WISH-TV |,Butler University Latin Jazz Ensemble shines under Pavel's guidance,,,,,,https://www.wishtv.com/lifestylelive/pavel-polanco-safadit-butler-university/,"Experience the vibrant rhythms of Latin jazz as Pavel Polanco-Safadit joins the Butler University Latin Jazz Ensemble, bringing a rich cultural experience to students.",,https://www.wishtv.com/wp-content/uploads/2025/04/18/pavel.jpg,,,2025-04-18 17:07:56.852129
,,2025-04-18 17:54:07+00:00,Kansas City Magazine,"What To Expect From Kohinoor, A Latin-Inspired Cocktail Lounge Opening In KC",,,,,,https://kansascitymag.com/what-to-expect-from-kohinoor-a-latin-inspired-cocktail-lounge-opening-in-kc/,"Jasmine Rios is bringing her Mexican heritage to Kohinoor, her cocktail bar and lounge set to open in about a month. ",,https://kansascitymag.com/wp-content/uploads/2025/04/IMG_4023.jpg,,,2025-04-18 14:10:25.111829
,,2025-04-18 16:31:50+00:00,Porterville Recorder,AP Week in Pictures: Latin America and Caribbean,,,,,,https://www.recorderonline.com/news/national_news/ap-week-in-pictures-latin-america-and-caribbean/article_eb572267-4298-5667-a60a-a7957c2b9397.html,"April 11-17, 2025",,https://bloximages.newyork1.vip.townnews.com/recorderonline.com/content/tncms/assets/v3/editorial/3/43/343a2f47-453b-58e9-b84c-7728b4120084/6801d3b780d75.image.jpg?crop=1763%2C926%2C0%2C124&resize=1200%2C630&order=crop%2Cresize,,,2025-04-18 13:13:08.834752
