id,name,published,outlet,title,authors,category,market,categoryorder,articleorder,url,description,text,image,error,sentiment,firstEyes
,,2025-03-21 10:48:18+00:00,AP News,AP Week in Pictures: Latin America and Caribbean,,,,,,https://apnews.com/article/latin-america-caribbean-top-photos-this-week-6038eee7b583e9e15b6b2a0c646d5c25,"March 14-20, 2025 A woman cries after her friend died from a bullet wound when soldiers fired their guns into the air as a tribute during the funeral of two soldiers in Port-au-Prince, Haiti.",,https://dims.apnews.com/dims4/default/46d6fd5/2147483647/strip/true/crop/6720x3780+0+350/resize/1440x810!/quality/90/?url=https%3A%2F%2Fassets.apnews.com%2F61%2Fc4%2F9c33314690ea7724154f7f2f47dd%2Fbc977c8981cb4ea78d434a1a4f1279bd,,,2025-03-21 08:01:18.477511
,,2025-03-21 10:36:01+00:00,mariettatimes.com,The Latin Grammys get closer to cinema with the new best music for visual media category,,,,,,https://www.mariettatimes.com/news/2025/03/the-latin-grammys-get-closer-to-cinema-with-the-new-best-music-for-visual-media-category/,"(AP) — The Latin Grammys are getting closer to cinema and television with the new best music for visual media category. The new category announced Wednesday will recognize original music for movies, TV shows, video games and other visual media. For a project to participate in this category, it must feature Latin rhythms or be […]",,http://d14e0irai0gcaa.cloudfront.net/www.mariettatimes.com/images/2016/09/15131252/mt_fb.jpg,,,2025-03-21 08:01:18.477511
,,2025-03-21 10:28:27+00:00,Los Angeles Times,"Indie-pop singer Sophie Castillo on British Latinas: 'Yes, we exist'",,,,,,https://www.latimes.com/delos/story/2025-03-20/indie-pop-singer-sophie-castillo-british-latina-new-ep,"Ahead of her March 21 show at the Moroccan Lounge, Castillo talks new EP and London's growing Latin scene.",,https://ca-times.brightspotcdn.com/dims4/default/64677ad/2147483647/strip/true/crop/1080x567+0+392/resize/1200x630!/quality/75/?url=https%3A%2F%2Fcalifornia-times-brightspot.s3.amazonaws.com%2F46%2Fef%2F5c76f65b43f9a311d7b87f2e125b%2Fsophie-castillo-2.png,,,2025-03-21 08:01:18.477511
,,2025-03-21 10:05:04+00:00,Blooloop,DOF Robotics heading to Mexico City for IAAPA Latin America Summit,,,,,,https://blooloop.com/technology/news/dof-robotics-iaapa-latin-america-summit-2025/,"DOF Robotics, a producer of dynamic simulation platforms, will be exhibiting at the IAAPA Latin America and Caribbean Summit 2025.",,https://blooloop.com/wp-content/uploads/2025/03/DOF-at-IAAPA-Latin-America.jpg,,,2025-03-21 08:01:18.477511
,,2025-03-21 09:28:43+00:00,New Jersey Monthly,UCMP Presents LATIN NIGHT THURSDAYS!,,,,,,https://njmonthly.com/events/ucmp-presents-latin-night-thursdays/,"Whether you're an avid music lover, a dancer, or simply looking for an exciting night out, these events promise to be an unforgettable experience!",,,,,2025-03-21 08:01:18.477511
,,2025-03-21 07:15:21+00:00,WFLA,Latin icon Robi Draco Rosa brings his Grammy-winning music to Florida,,,,,,https://www.wfla.com/video/latin-icon-robi-draco-rosa-brings-his-grammy-winning-music-to-florida/10556723/,"In an exclusive interview with TampaHoy.com the hispanic division of WFLA Channel 8 On Your Side, Draco reflects on his musical journey, from his early days in Menudo to becoming a renowned composer for artists like Ricky Martin, Juan Luis Guerra, and Shakira.",,https://c104216-ucdn.mp.lura.live/expiretime=2082787200/efdd57c91a03985d692b83cd645c25e34220d0252b02f51df3ebc2fd270ffe8c/wfla/vupl_lin/329/742/329742530BB74B5F8814B3C6242A8E6E-0-1742497391647.png,,,2025-03-21 08:01:18.477511
,,2025-03-21 06:31:26+00:00,Billboard,Gerardo Ortiz Pleads Guilty and Testifies Against Del Entertainment’s Ángel del Villar in Criminal Trial,,,,,,https://www.billboard.com/pro/gerardo-ortiz-testifies-del-records-angel-del-villar-trial/,Regional Mexican star Gerardo Ortiz testified against Del Records' CEO Ángel del Villar in a federal courtroom on Wednesday. Get the details here. ,,https://www.billboard.com/wp-content/uploads/2024/02/gerardo-ortiz-la3c-2022-billboard-1548.jpg?w=1024,,,2025-03-21 08:01:18.477511
,,2025-03-21 06:16:11+00:00,Speedway Digest - Home for NASCAR News - Latin Music Royalty Drives Pace Car At NASCAR Cup Series Race At Homestead-Miami Speedway,Latin Music Royalty Drives Pace Car At NASCAR Cup Series Race At Homestead-Miami Speedway - Speedway Digest - Home for NASCAR News,,,,,,https://speedwaydigest.com/index.php/news/speedway-news/431153-latin-music-royalty-drives-pace-car-at-nascar-cup-series-race-at-homestead-miami-speedway/,"Grammy Award-winning artist Wisin is getting behind the wheel as the honorary pace car driver for the Straight Talk Wireless 400 happening at Homestead-Miami Speedway. The duo Gente de Zona will also be part of the festivities as honorary officials, bringing Latin music stars to the forefront of the NASCAR Cup Series. Stars At Miami - Speedway Digest Staff - March 20, 2025",,https://speedwaydigest.com/wp-content/uploads/2025/03/Straight-Talk-400.png,,,2025-03-21 08:01:18.477511
,,2025-03-21 00:18:59+00:00,Hartford Courant,The Latin Grammys get closer to cinema with the new best music for visual media category,,,,,,https://www.courant.com/2025/03/20/latin-grammys-new-categories/,"The new category will recognize original music for movies, TV shows, video games and other visual media.",,https://www.courant.com/wp-content/uploads/2025/03/Grammy_Awards_29460.jpg?w=1024&h=682,,,2025-03-20 21:59:43.025386
,,2025-03-21 00:08:25+00:00,NBCUniversal Telemundo Enterprises Press Releases,Billboard Latin Women in Music Returns with a Star-Studded Live Show on April 24 at 9pm/8c Exclusively on Telemundo - NBCUniversal Telemundo Enterprises Press Releases,,,,,,https://nbcuniversalnewsgroup.com/telemundo/2025/03/20/billboard-latin-women-in-music-returns-with-a-star-studded-live-show-on-april-24-at-9pm-8c-exclusively-on-telemundo/,"Hosted by Legendary Mexican Artist, Ana Bárbara, This Year’s Special Will Honor Female Music Superstars and Feature Can’t-Miss Performances Miami, FL, March 20, 2025 – Telemundo and Billboard announced the third annual Billboard Latin Women in Music special, airing live from Telemundo Center in Miami on Thursday, April 24 at 9 PM/8C exclusively on Telemundo. [...]Read More... from Billboard Latin Women in Music Returns with a Star-Studded Live Show on April 24 at 9pm/8c Exclusively on Telemundo",,https://nbcuniversalnewsgroup.com/telemundo/wp-content/uploads/sites/7/2025/03/Host-Billboards-Mujeres-Latinas-en-la-Musica-ENG-1920x1080-1-1024x576.png,,,2025-03-21 08:01:18.477511
,,2025-03-20 23:36:26+00:00,HOLA! USA,"Baja Beach Fest 2025: J Balvin, Don Omar, Maluma, Young Miko, Anitta, and many more",,,,,,https://www.hola.com/us/entertainment/20250320821466/baja-beach-fest-2025-j-balvin-don-omar-maluma-more/,BBF is known for booking A-list names and rising stars ,,https://www.hola.com/us/horizon/landscape/71f097e79008-untitled-design-2.jpg?im=Resize=(1200),,,2025-03-20 21:59:43.025386
,,2025-03-20 22:09:43+00:00,www.cbsnews.com,"Joaquina: Latin Grammy's youngest Best New Artist on her journey, influences and future",,,,,,https://www.cbsnews.com/miami/video/joaquina-latin-grammys-youngest-best-new-artist-on-her-journey-influences-and-future/,"At just 20 years old, singer-songwriter Joaquina has made history as the youngest-ever winner of the Latin Grammy for Best New Artist.",,https://assets3.cbsnewsstatic.com/hub/i/r/2025/03/20/470a54f7-9fb3-4f63-bf48-e957dfcea524/thumbnail/1200x630/ec0dea09ea7e572a123e9bad1ba228b4/b4916a8e0a944cc45bc7972f949088c6.jpg?v=9e5c48f1b04ac2a564e8a4c51250ac89,,,2025-03-20 19:01:25.660545
,,2025-03-20 21:55:55+00:00,www.cbsnews.com,"Joaquina: Latin Grammy's youngest Best New Artist on her journey, influences and future",,,,,,https://www.cbsnews.com/miami/news/joaquina-latin-grammys-youngest-best-new-artist-on-her-journey-influences-and-future/,Her journey from Venezuela to Miami at age six has shaped both her personal story and musical style.,,https://assets1.cbsnewsstatic.com/hub/i/r/2025/03/20/fd223e16-4f4b-4a7c-8f79-d02192121d74/thumbnail/1200x630/a3efdc68a47940c1419b0e7d4bcc6c9f/capture.png?v=9e5c48f1b04ac2a564e8a4c51250ac89,,,2025-03-20 19:01:25.660545
,,2025-03-20 21:00:12+00:00,www.wdbj7.com,Jstop Latin Soul Performs on 7@four - WDBJ,,,,,,https://www.wdbj7.com/video/2025/03/20/jstop-latin-soul-performs-7four/,Entertainment · Jstop  ...,,,,,2025-03-20 19:01:25.660545
,,2025-03-20 21:00:07+00:00,www.wdbj7.com,Jstop Latin Soul Gets Residency at Martin's Downtown - WDBJ,,,,,,https://www.wdbj7.com/video/2025/03/20/jstop-latin-soul-gets-residency-martins-downtown/,Jstop Latin Soul Gets ...,,,,,2025-03-21 08:01:18.477511
,,2025-03-20 20:46:35+00:00,we are Mitú. 100% American & Latino,We're Manifesting These Latino Celebs in a Calvin Klein Ad—Because They’d 100% Break the Internet Again,,,,,,https://wearemitu.com/wearemitu/entertainment/calvin-klein-underwear-dream-casting/,"Bad Bunny set the bar, but these Latino celebs in a Calvin Klein ad would send the internet into another meltdown.",,https://d18ufwot1963hr.cloudfront.net/wp-content-production/uploads/2025/03/Latinos-Calvin-Klein-Ad.jpg,,,2025-03-20 19:01:25.660545
,,2025-03-20 19:33:51+00:00,Yahoo Entertainment,Billboard & Telemundo Announce Third Annual Billboard Latin Women in Music,,,,,,https://www.yahoo.com/entertainment/billboard-telemundo-announce-third-annual-180000660.html,"Hosted by Mexican star Ana Bárbara, the special will air live on Telemundo on April 24.",,https://s.yimg.com/ny/api/res/1.2/wfxARFLZ6gF7W8oWMlhaSw--/YXBwaWQ9aGlnaGxhbmRlcjt3PTEyMDA7aD04MDA-/https://media.zenfs.com/en/billboard_547/5b4615ecaf19573cbf128dd6d236fb75,,,2025-03-20 18:16:28.111764
,,2025-03-20 18:39:51+00:00,nj,New Jersey Hall of Fame is backtracking after mistakenly nominating a celebrity who isn’t from N.J.,,,,,,https://www.nj.com/entertainment/2025/03/new-jersey-hall-of-fame-is-backtracking-after-mistakenly-nominating-a-celebrity-who-isnt-from-nj.html,Organizers of the hall said they realized that the nominee 'does not meet their standards for residency.',,https://www.nj.com/resizer/v2/7EHGI433SFCK5HSYJ5BTQO6HNQ.jpeg?auth=98371882fbf89a8b3d943f031006500fc015a8c1df03de46355eec9164aba9a2&width=1280&quality=90,,,2025-03-20 18:16:28.111764
,,2025-03-20 18:32:16+00:00,The Langara Voice,Latin American studies department draws big crowd for cultural events,,,,,,https://www.langaravoice.ca/latin-american-studies-department-draws-big-crowd-for-cultural-events/,"By Sage SmithThe Latin American studies department said it is “punching above their weight” right now as their small department hosted some big events. Despite facing reductions due to a large drop in student enrolment at Langara, the department said",,https://i0.wp.com/www.langaravoice.ca/wp-content/uploads/2025/03/C0312T01.jpg?fit=1170%2C658&ssl=1,,,2025-03-20 19:01:25.660545
,,2025-03-20 16:28:17+00:00,Yahoo Entertainment,"Gloria Estefan Releases ‘Raíces,’ Lead Single & Video From Her First Spanish-Language Album in 18 Years",,,,,,https://www.yahoo.com/entertainment/gloria-estefan-releases-ra-ces-040100250.html,"""Every sincere word and gesture plants the roots of a beautiful tomorrow — and that is what this song is all about,"" Estefan tells Billboard Español.",,https://s.yimg.com/ny/api/res/1.2/hc8qH0116llI9FRQaoYJnA--/YXBwaWQ9aGlnaGxhbmRlcjt3PTEyMDA7aD03OTQ-/https://media.zenfs.com/en/billboard_547/154764cc7662b8a7080149e91a93cb71,,,2025-03-20 21:59:43.025386
,,2025-03-20 15:25:34+00:00,Inverse,Sic Semper Systema? 'Daredevil: Born Again's Episode Title Reveals The Show's Hidden Truth,,,,,,https://www.inverse.com/entertainment/sic-semper-systema-daredevil-born-again-episode-4-title-meaning,The MCU series borrowed a phrase steeped in American history for its latest episode.,,https://imgix.bustle.com/uploads/image/2025/3/19/85144357/disney-studios-otk-104.jpg?w=1200&h=630&fit=crop&crop=faces&fm=jpg,,,2025-03-20 13:05:45.052672
,,2025-03-20 12:00:59+00:00,Galway Advertiser,Latin sounds from Los Wachos ,,,,,,https://www.advertiser.ie/galway/article/145263/latin-sounds-from-los-wachos,"One of Galway&rsquo;s newest Latin music bands, Los Wachos, will perform at Monroe's Live Backstage venue on Friday, March 21 at 9pm.",,https://www.advertiser.ie/images/2025/03/145263.jpg?fbrefresh=7b18ca0f0b92,,,2025-03-20 18:16:28.111764
,,2025-03-20 11:29:31+00:00,Las Vegas Sun,AP Entertainment SummaryBrief at 7:28 a.m. EDT,,,,,,https://lasvegassun.com/news/2025/mar/19/ap-entertainment-summarybrief-at-728-am-edt/,AP Entertainment SummaryBrief at 7:28 a.m. EDT,,//assets.lasvegassun.com/media/assets/images/icons/favicon-app.png,,,2025-03-20 15:04:52.959409
,,2025-03-20 09:54:22+00:00,unb.com.bd, Latin Grammys get closer to cinema with new best music for visual media category ,,,,,,https://unb.com.bd/category/Entertainment/latin-grammys-get-closer-to-cinema-with-new-best-music-for-visual-media-category/155931," The Latin Grammys are getting closer to cinema and television with the new best music for visual media category.
The new category announced Wedn ",,https://unb.com.bd/watermark/category/Entertainment/english/155931/latin-grammys-get-closer-to-cinema-with-new-best-music-for-visual-media-category,,,2025-03-20 11:03:21.639282
,,2025-03-20 06:27:50+00:00,Voice of Alexandria,The Latin Grammys get closer to cinema with the new best music for visual media category,,,,,,https://www.voiceofalexandria.com/entertainment/celebrity_news/the-latin-grammys-get-closer-to-cinema-with-the-new-best-music-for-visual-media/article_76152039-4e39-5392-b9a2-555873032881.html,The Latin Grammys are getting closer to cinema and television with the new best music for visual media category. The new category announced Wednesday by the Latin Recording Academy will,,https://bloximages.newyork1.vip.townnews.com/voiceofalexandria.com/content/tncms/assets/v3/editorial/c/f0/cf099d6c-1749-55b3-b56b-a0c72783063e/67db0bb9b2582.image.jpg?crop=1763%2C926%2C0%2C125&resize=1200%2C630&order=crop%2Cresize,,,2025-03-20 11:03:21.639282
,,2025-03-20 06:13:54+00:00,Greenwich Time,"Maná talks historic new tour, unseating Bruce Springsteen and the Rock and Roll Hall of Fame",,,,,,https://www.greenwichtime.com/entertainment/article/man-talks-historic-new-tour-unseating-bruce-20230247.php,Mexican pop-rock giants Maná will embark on a huge North American tour this fall. It...,,https://s.hdnux.com/photos/01/47/57/66/27196856/3/rawImage.jpg,,,2025-03-20 11:03:21.639282
,,2025-03-20 05:17:03+00:00,The Killeen Daily Herald,The Latin Grammys get closer to cinema with the new best music for visual media category,,,,,,https://kdhnews.com/living/ae/the-latin-grammys-get-closer-to-cinema-with-the-new-best-music-for-visual-media/article_4c4d5d36-969c-57c5-98d3-dd938d3b261f.html,The Latin Grammys are getting closer to cinema and television with the new best music for visual media category. The new category announced Wednesday by the Latin Recording Academy will,,https://bloximages.newyork1.vip.townnews.com/kdhnews.com/content/tncms/assets/v3/editorial/b/55/b552d2ad-a120-537b-82d3-31a59ebb57cf/67db0b8c7c6fa.image.jpg?crop=1763%2C926%2C0%2C125&resize=1200%2C630&order=crop%2Cresize,,,2025-03-20 11:03:21.639282
,,2025-03-20 05:16:13+00:00,Imperial Valley Press Online,The Latin Grammys get closer to cinema with the new best music for visual media category,,,,,,https://www.ivpressonline.com/news/nation/the-latin-grammys-get-closer-to-cinema-with-the-new-best-music-for-visual-media/article_5d9f6f12-1554-5923-b65b-a284e21319cd.html,The Latin Grammys are getting closer to cinema and television with the new best music for visual media category.,,https://bloximages.newyork1.vip.townnews.com/ivpressonline.com/content/tncms/assets/v3/editorial/a/cc/acc69c25-5f50-5f15-8682-137ac4e49c4a/67db4e0f0a8c6.image.jpg?crop=1763%2C926%2C0%2C125&resize=1200%2C630&order=crop%2Cresize,,,2025-03-20 11:03:21.639282
,,2025-03-20 05:00:58+00:00,Yankton Press & Dakotan,The Latin Grammys get closer to cinema with the new best music for visual media category,,,,,,https://www.yankton.net/news/national_ap/article_cb39f79d-9171-5b35-b279-3b21959fabaa.html,The Latin Grammys are getting closer to cinema and television with the new best music for visual media category. The new category announced Wednesday by the Latin Recording Academy will,,https://bloximages.chicago2.vip.townnews.com/yankton.net/content/tncms/assets/v3/editorial/7/98/79869d42-12a8-56c2-a4e8-0b700cd2acd0/67db0ac1e3773.image.jpg?crop=1763%2C926%2C0%2C125&resize=1200%2C630&order=crop%2Cresize,,,2025-03-20 11:03:21.639282
,,2025-03-20 04:46:39+00:00,Chron,The Latin Grammys get closer to cinema with the new best music for visual media category,,,,,,https://www.chron.com/entertainment/article/the-latin-grammys-get-closer-to-cinema-with-the-20229556.php,The Latin Grammys are getting closer to cinema and television with the new best music for...,,https://s.hdnux.com/photos/01/47/57/70/27196934/3/rawImage.jpg,,,2025-03-20 11:03:21.639282
,,2025-03-20 03:54:55+00:00,www.youtube.com,Astronomer Alan Duffy On How Astronauts Entertain Themselves On Board - YouTube,,,,,,https://www.youtube.com/watch%3Fv%3DiAV_pn7j2Ks,Bonus: Astronomer Alan Duffy On How Astronauts Entertain Themselves On Board ... Lefties Losing It: Alec Baldwin humiliated by fake Latin wife. Sky News ...,,,,,2025-03-20 02:57:33.286792
,,2025-03-20 01:27:26+00:00,Connecticut Post,The Latin Grammys get closer to cinema with the new best music for visual media category,,,,,,https://www.ctpost.com/entertainment/article/the-latin-grammys-get-closer-to-cinema-with-the-20229556.php,The Latin Grammys are getting closer to cinema and television with the new best music for...,,https://s.hdnux.com/photos/01/47/57/70/27196934/3/rawImage.jpg,,,2025-03-20 11:03:21.639282
,,2025-03-20 01:17:18+00:00,Penticton Herald,The Latin Grammys get closer to cinema with the new best music for visual media category,,,,,,https://www.pentictonherald.ca/entertainment/national_entertainment/article_d91d567e-dd26-5694-96af-00a853847333.html,The Latin Grammys are getting closer to cinema and television with the new best music for visual media category.,,https://bloximages.newyork1.vip.townnews.com/pentictonherald.ca/content/tncms/assets/v3/editorial/8/46/846edae5-dbb9-5c4b-a2c2-1fb94a1dad58/67db149d361b3.image.jpg?crop=640%2C336%2C0%2C45,,,2025-03-20 00:36:21.287339
,,2025-03-20 01:12:26+00:00,LancasterOnline,The Latin Grammys get closer to cinema with the new best music for visual media category,,,,,,https://lancasteronline.com/features/entertainment/national/the-latin-grammys-get-closer-to-cinema-with-the-new-best-music-for-visual-media/article_93e0b9dd-e21b-5e80-a3eb-86bed3dc8906.html,The Latin Grammys are getting closer to cinema and television with the new best music for visual media category. The new category announced Wednesday by the Latin Recording Academy will,,https://bloximages.newyork1.vip.townnews.com/lancasteronline.com/content/tncms/assets/v3/editorial/3/67/36742af2-b59e-58a2-b8e2-08928cce4db2/67db0ab043e53.image.jpg?crop=1763%2C926%2C0%2C125&resize=1200%2C630&order=crop%2Cresize,,,2025-03-20 02:57:33.286792
,,2025-03-20 01:03:12+00:00,Newsday,The Latin Grammys get closer to cinema with the new best music for visual media category,,,,,,https://www.newsday.com/entertainment/latin-grammys-2025-new-categories-h01229,The Latin Grammys are getting closer to cinema and television with the new best music for visual media category.,,https://cdn.newsday.com/ace/c:NjY3ZmQ0MWItNDA5MS00:OTEwN2IwYjAtYTM1OC00/landscape/1280,,,2025-03-20 02:57:33.286792
,,2025-03-20 00:25:19+00:00,www.lmtonline.com,Tue for Tuesday at Big Bib Too. Featuring The BillyRay Sheppard Duo - Laredo Morning Times,,,,,,https://www.lmtonline.com/entertainment/%3F_evDiscoveryPath%3D/event/106617438n-billyray-sheppard-performs-tue-for-tuesday-at-big-bib-too-featuring-the-billyray-sheppard-duo,"Entertainment. Ticket and Promote Your Events with Laredo Morning ... Latin, Tejano and Country bands. It's his love for music that has kept ...",,,,,2025-03-20 18:16:28.111764
,,2025-03-19 23:15:12+00:00,Yahoo Entertainment,Garbage Praise the ‘Wonderful’ Global Rise of Latin Music Amid Latin American Tour,,,,,,https://www.yahoo.com/entertainment/garbage-praise-wonderful-global-rise-221026041.html,"Back on tour in Latin America for the first time in a decade, the alternative rock band will arrive in Mexico in April for the Tecate Pa'l Norte festival.",,https://s.yimg.com/ny/api/res/1.2/30jKtXy5D1OuxJLojTi6HA--/YXBwaWQ9aGlnaGxhbmRlcjt3PTEyMDA7aD03OTQ-/https://media.zenfs.com/en/billboard_547/c3a278884edea83c08c0645ec5079795,,,2025-03-20 00:36:21.287339
,,2025-03-19 23:04:35+00:00,HuffPost,Rachel Zegler Claims White 'West Side Story' Executives Questioned Her Latina Identity,,,,,,https://www.huffpost.com/entry/rachel-zegler-white-studio-execs-west-side-story-casting_n_67daddaee4b097824b23ed70,The actor got candid about the shocking experience.,,https://img.huffingtonpost.com/asset/67db34e715000026006ff713.jpeg?cache=eqxIIH2WCD&ops=1200_630,,,2025-03-20 00:36:21.287339
,,2025-03-19 20:05:47+00:00,www.wdtn.com,The Latin Grammys get closer to cinema with the new best music for visual media category,,,,,,https://www.wdtn.com/entertainment/ap-entertainment/ap-the-latin-grammys-get-closer-to-cinema-with-the-new-best-music-for-visual-media-category/,"Missing Georgia girl Asata Amun's photos. Entertainment. Gene Hackman, Betsy Arakawa's $80M estate: Who will … Gene Hackman waves from a ...",,,,,2025-03-19 17:01:51.271982
,,2025-03-19 19:36:25+00:00,www.stamfordadvocate.com,The Latin Grammys get closer to cinema with the new best music for visual media category,,,,,,https://www.stamfordadvocate.com/entertainment/article/the-latin-grammys-get-closer-to-cinema-with-the-20229556.php,"The Latin Grammys are getting closer to cinema ... (L-R) Andrew Lawrence, Matthew Lawrence and Joey Lawrence attend the That's 4 Entertainment's ...",,,,,2025-03-19 17:01:51.271982
,,2025-03-19 19:04:28+00:00,HOLA! USA,Rachel Zegler and Gal Gadot feud: 'Snow White' star says sisterhood is 'not always easy to find' in Hollywood,,,,,,https://www.hola.com/us/celebrities/20250319821185/rachel-zegler-gal-gadot-feud-snow-white/,"“I really do believe in championing your friends and co-workers,” she said amid the rumored drama",,https://www.hola.com/us/horizon/landscape/c93c8e244af4-anaheim-california-rachel-zegler-and-gal-gadot-pose-at-the-imdb-official-portrai.jpg?im=Resize=(1200),,,2025-03-20 11:03:21.639282
,,2025-03-19 19:02:35+00:00,www.youtube.com,SC Set To Hear Whether Lokpal Can Entertain Complaints Against a HC Judge - YouTube,,,,,,https://www.youtube.com/watch%3Fv%3DFB-KfiKSpRU,Live Law New 639 views · 17:25 · Go to channel · Lefties Losing It: Alec Baldwin humiliated by fake Latin wife. Sky News Australia New 687K views · 1: ...,,,,,2025-03-20 00:36:21.287339
,,2025-03-19 18:38:11+00:00,Las Vegas Sun,AP Entertainment SummaryBrief at 2:31 p.m. EDT,,,,,,https://lasvegassun.com/news/2025/mar/18/ap-entertainment-summarybrief-at-231-pm-edt/,AP Entertainment SummaryBrief at 2:31 p.m. EDT,,//assets.lasvegassun.com/media/assets/images/icons/favicon-app.png,,,2025-03-19 15:03:03.667183
,,2025-03-19 18:19:32+00:00,Billboard,ATEEZ’s KQ Entertainment Partners With AEG To Produce Tours,,,,,,https://www.billboard.com/pro/ateez-kq-entertainment-partners-aeg-produce-tours/,"KQ Entertainment, the South Korean music company behind ATEEZ, signed a multi-year agreement with AEG Presents to oversee tours for the K-pop group.",,https://www.billboard.com/wp-content/uploads/2025/02/ateez-2024-press-credit-KQ-ENTERTAINMENT-billboard-1548.jpg?w=1024,,,2025-03-19 15:03:03.667183
,,2025-03-19 18:19:29+00:00,Midland Daily News,"Maná talks historic new tour, unseating Bruce Springsteen and the Rock and Roll Hall of Fame",,,,,,https://www.ourmidland.com/entertainment/article/man-talks-historic-new-tour-unseating-bruce-20230247.php,Mexican pop-rock giants Maná will embark on a huge North American tour this fall. It...,,https://s.hdnux.com/photos/01/47/57/66/27196856/3/rawImage.jpg,,,2025-03-20 00:36:21.287339
,,2025-03-19 18:15:12+00:00,thecanadianpressnews.ca,The Latin Grammys get closer to cinema with the new best music for visual media category,,,,,,https://www.thecanadianpressnews.ca/entertainment/the-latin-grammys-get-closer-to-cinema-with-the-new-best-music-for-visual-media/article_46efecd4-9fb0-54c1-b262-fd4ef56df21f.html,The Latin Grammys are getting closer to cinema and television with the new best music for visual media category.,,https://bloximages.chicago2.vip.townnews.com/thecanadianpressnews.ca/content/tncms/assets/v3/editorial/e/7d/e7d7d818-3ffc-5c9e-bb29-39bda3f1ff47/67db148a5807f.image.jpg?crop=1400%2C735%2C0%2C99&resize=1200%2C630&order=crop%2Cresize,,,2025-03-20 00:36:21.287339
,,2025-03-19 18:10:29+00:00,Santa Maria Times,AP Entertainment SummaryBrief at 2:31 p.m. EDT,,,,,,https://santamariatimes.com/ap/entertainment/ap-entertainment-summarybrief-at-2-04-p-m-edt/article_d385b52f-23c9-5c3c-a42e-680d1834191c.html,"Maná talks historic new tour, unseating Bruce Springsteen and the Rock and Roll Hall of Fame",,https://bloximages.chicago2.vip.townnews.com/santamariatimes.com/content/tncms/custom/image/b9c888ca-59a2-11eb-a31f-0b4d74fa96dc.jpg?resize=200%2C200,,,2025-03-19 19:01:24.996291
,,2025-03-19 18:08:16+00:00,Las Vegas Sun,AP Entertainment SummaryBrief at 2:04 p.m. EDT,,,,,,https://lasvegassun.com/news/2025/mar/18/ap-entertainment-summarybrief-at-204-pm-edt/,AP Entertainment SummaryBrief at 2:04 p.m. EDT,,//assets.lasvegassun.com/media/assets/images/icons/favicon-app.png,,,2025-03-19 15:03:03.667183
