id,name,published,outlet,title,authors,category,market,categoryorder,articleorder,url,description,text,image,error,sentiment,firstEyes
,,2026-01-10 10:00:20+00:00,Shell plc’s Next Act: Can a Supermajor Rewire Itself for the Post-Oil Era?,Shell plc's Next Act: Can a Supermajor Rewire Itself for the Post-Oil Era? - AD HOC NEWS,Not Available,,,,,https://www.ad-hoc-news.de/boerse/news/ueberblick/shell-plc-s-next-act-can-a-supermajor-rewire-itself-for-the-post-oil/68474291,"The Supermajor’s Dilemma: What Shell plc Is Really Selling Now Shell plc is no longer just an oil company.
Get all details on Shell plc here Inside the Flagship: Shell plc When analysts talk about Shell plc as a product, they are increasingly talking about a portfolio architecture rather than a single headline asset.
Power, renewables, and EV charging Shell plc’s growth-facing product set sits in its power and renewables portfolio and its global mobility business.
Market Rivals: Royal Dutch Shell A (alt) -> Shell plc vs.
Yet Shell maintains several edges: LNG scale: While TotalEnergies is a serious LNG player, Shell plc’s LNG trading and shipping network remains the industry benchmark.","The Supermajor’s Dilemma: What Shell plc Is Really Selling Now

Shell plc is no longer just an oil company. It is positioning itself as a full-stack energy and chemicals platform that sells molecules, electrons, and infrastructure across the entire value chain. From liquefied natural gas (LNG) and advanced petrochemicals to EV charging networks and renewable power trading, Shell plc is trying to turn a legacy hydrocarbon engine into a diversified energy machine that can survive — and profit — in a decarbonizing world.

This evolution matters because the traditional playbook for integrated oil and gas companies is under existential pressure. Investors want cash returns, regulators want emissions cuts, and customers want energy that is cleaner, cheaper, and more reliable. Shell plc’s core product today is not a single asset or technology, but an ecosystem: a global portfolio of upstream production, LNG, refining, petrochemicals, power trading, and customer-facing businesses, all wrapped in a narrative of ""orderly transition"" rather than abrupt disruption.

Get all details on Shell plc here

Inside the Flagship: Shell plc

When analysts talk about Shell plc as a product, they are increasingly talking about a portfolio architecture rather than a single headline asset. The company has been reshaping that architecture around several flagship pillars.

1. LNG and gas-centric energy

Shell is one of the world’s largest LNG players, and this is arguably its most defensible and differentiated product line. Through projects in Qatar, Australia, the U.S., and West Africa, Shell plc markets LNG as a transition fuel that can backstop intermittent renewables and displace coal. Its LNG trading, shipping, and regasification infrastructure create a global platform that smaller rivals struggle to match.

Beyond production, Shell’s integrated gas unit acts like a high-frequency logistics and arbitrage machine: buying, routing, blending, and selling cargoes into price-sensitive markets in Europe and Asia. That flexibility became a critical product feature when Russian pipeline gas to Europe collapsed; Shell plc’s LNG portfolio effectively became part of Europe’s energy security toolkit.

2. Integrated refining, chemicals, and low-carbon fuels

Shell has been pruning its older, less efficient refineries and retooling some into so-called ""energy and chemicals parks."" These assets are designed to shift from classic fuels into higher-margin and lower-carbon products: biofuels, sustainable aviation fuel (SAF), lubricants, and performance chemicals.

At facilities like Shell’s Energy and Chemicals Park in Rotterdam and its operations in Singapore, the company is investing in renewable diesel, advanced biofuels made from waste feedstocks, and technologies to cut emissions intensity via electrification and carbon capture. The pitch is simple: if Shell can turn refineries into multi-output, lower-carbon product hubs, it can keep the infrastructure advantages of being a supermajor while aligning with net-zero policies.

3. Power, renewables, and EV charging

Shell plc’s growth-facing product set sits in its power and renewables portfolio and its global mobility business. Under the Shell Recharge brand, the company operates thousands of EV charge points across Europe, North America, and Asia, often integrated into its existing retail service stations. This allows Shell to use legacy real estate as a bridge from liquid fuels to electrons.

Beyond charging, Shell has been building a position in power generation and trading: offshore and onshore wind, solar farms, grid-scale batteries, and virtual power plants aggregating distributed energy resources. The company is less a pure-play green generator and more a power-market operator, using its trading DNA to balance intermittency and optimize pricing. For large corporates, Shell plc increasingly sells power purchase agreements (PPAs) and bundled decarbonization solutions rather than just diesel or gas.

4. Customer solutions and digitalization

On the customer side, Shell plc is wrapping all of this into more integrated offerings: fleet solutions that combine fuel cards, EV charging, telematics, and route optimization; B2B decarbonization packages blending biofuels, offsets, and consultancy; and digital apps that link retail fuels, charging, and loyalty programs.

The unifying theme is that Shell is trying to move from commodity seller to service provider. While molecules and megawatt-hours are still the revenue engine, the differentiation increasingly comes from integration, optionality, and data.

Market Rivals: Royal Dutch Shell A (alt) -> Shell plc vs. The Competition

Shell plc does not operate in a vacuum. Its closest peers are other European integrated energy majors that are undergoing their own transitions: BP plc and TotalEnergies SE are the most direct competitors, with ExxonMobil and Chevron acting as U.S.-centric hydrocarbon counterpoints.

BP: The ""Reinvented"" Energy Company

Compared directly to BP’s integrated energy portfolio, Shell plc looks more conservative but also more balanced. BP spent the early 2020s branding itself around aggressive renewables growth, from offshore wind auctions to large solar pipelines. It positioned EV charging under the BP Pulse brand and chased early-mover status in green power retail in markets like the UK and Germany.

However, BP backtracked on some of its most ambitious targets under investor pressure to prioritize returns from oil and gas. Shell plc, by contrast, set less extreme renewables volume targets but focused heavily on LNG and cash generation, using those flows to fund both shareholder returns and selective low-carbon bets.

In practical product terms:

Renewables and power: BP has been more aggressive in headline gigawatt-scale wind and solar projects. Shell plc leans more on LNG and power trading, plus targeted renewables plays where it can monetize volatility.

EV charging: BP Pulse vs. Shell Recharge is a tightly contested race. Shell’s advantage is its vast retail footprint and its ability to bundle charging with convenience retail and fleet services.

Hydrocarbon core: Shell’s LNG portfolio is widely viewed as stronger and more global than BP’s, giving Shell plc a more differentiated gas product.

TotalEnergies: The Multi-Energy Challenger

Compared directly to TotalEnergies’ multi-energy platform, Shell plc faces a rival that has arguably been more coherent in its rebranding from oil major to energy major. TotalEnergies has leaned hard into utility-scale solar and onshore renewables, building pipelines that make it look, in certain markets, as much like a power company as an oil company.

Yet Shell maintains several edges:

LNG scale: While TotalEnergies is a serious LNG player, Shell plc’s LNG trading and shipping network remains the industry benchmark. For customers buying flexible gas supply, that matters.

Retail and mobility: Shell operates one of the world’s largest fuel retail networks, and its pivot to EV charging and convenience retail at scale gives it a consumer presence TotalEnergies is still scaling toward.

Power trading: Shell’s capabilities in energy trading — both physical and financial — give it a formidable position as power markets get more volatile.

ExxonMobil and Chevron: Hydrocarbon Maximalists

Compared directly to ExxonMobil’s upstream-heavy portfolio and Chevron’s hydrocarbon-centered strategy, Shell plc looks more diversified and more aligned with European-style climate regulation. The U.S. majors are focusing on oil, gas, and carbon capture & storage (CCS) with far less emphasis on renewables and EV charging.

This divergence creates a clear competitive contrast:

Shell plc offers institutional investors a way to stay exposed to hydrocarbons, LNG, and cash flows while also owning a real — though still minority — stake in renewables, power, and EV infrastructure.

ExxonMobil and Chevron are effectively pure-play bets on a slower energy transition, while Shell positions itself as a hedge on both speed and direction of change.

The Competitive Edge: Why it Wins

Shell plc’s core advantage isn’t that it is the greenest, nor that it is the purest hydrocarbon play. Its edge is that it is building an integrated, transition-ready product stack that can flex depending on how policy, technology, and demand actually evolve.

1. LNG as a strategic backbone

LNG is the closest thing Shell plc has to a flagship product. It underpins the company’s narrative that natural gas will remain essential for power generation, industry, and heating for decades, particularly in Asia and Europe. Shell’s scale in LNG production, shipping, and marketing means it can arbitrage regional price differences and respond quickly when crises hit, as Europe’s gas crunch starkly demonstrated.

Where competitors might own impressive individual LNG assets, Shell plc owns a system. That system-level advantage is difficult and slow to replicate, making LNG a durable differentiator.

2. A portfolio built for optionality

Shell’s strategy emphasizes ""disciplined"" capital allocation into low-carbon businesses rather than all-out land-grabs. This has drawn criticism from climate advocates who want faster decarbonization, but from a product perspective it delivers optionality: if certain technologies — say hydrogen or advanced biofuels — scale successfully and profitably, Shell plc is positioned to ramp up; if they stall, it has not overcommitted.

This optionality-based approach differentiates Shell from BP’s earlier high-ambition renewables push and from Exxon’s low-renewables, CCS-heavy path. Shell plc is essentially selling investors a conviction-lite transition product: meaningful exposure to new energy, but not at the expense of short- and medium-term returns.

3. Customer integration and brand

Few energy companies have the consumer-facing footprint of Shell plc. Millions of daily retail transactions at service stations, a rapidly expanding Shell Recharge EV charging network, and deep relationships with commercial fleets give Shell data, loyalty, and cross-selling opportunities that utilities and pure-play renewables developers lack.

When a logistics company wants to decarbonize, Shell can offer a bundled solution: biofuels and lubricants now, EV and hydrogen options later, digital fleet optimization in the background. That integrated offer is a product in its own right, and it is harder for narrower competitors to match.

4. Trading and risk management as a product layer

As grids fill with variable renewables and as LNG and power markets become more volatile, trading and risk management become central to the value proposition. Here, Shell plc’s decades of experience in commodities trading turn into a software-like moat: complex models, algorithms, and human expertise that help customers manage price swings and supply risks.

Where some competitors sell energy units, Shell increasingly sells energy plus optionality, plus risk hedging — a higher-value bundle that leverages its scale.

Impact on Valuation and Stock

On the financial side, Shell plc — listed in London and other exchanges under ISIN NL0000009827 — remains a bellwether for how markets price the energy transition.

Real-time snapshot

As of the latest market data checked via multiple financial sources (including Yahoo Finance and MarketWatch) on a recent trading day, Shell plc’s stock was trading in line with other European energy majors, with valuation metrics reflecting a blend of classic oil & gas cash generation and cautious growth expectations in low-carbon segments. When markets are closed, investors focus on the last close price and the trailing performance over the preceding months, which has broadly tracked the swings in oil and gas prices as well as macroeconomic sentiment.

Importantly, the stock remains highly correlated with commodity cycles, but the narrative around it is shifting: investors increasingly scrutinize not just how much capital Shell returns via buybacks and dividends, but also where it allocates growth spend — LNG expansions, refinery-to-chemicals conversions, EV charging rollouts, renewables, and power trading capabilities.

Product portfolio as a valuation driver

The success of Shell plc’s product strategy influences its stock in several ways:

Cash engines: Upstream oil, gas, and LNG remain the core cash machines. Strong performance here funds shareholder distributions and underwrites investments in transition businesses. When these segments deliver high margins, markets are more tolerant of moderate spending on low-carbon projects.

Growth options: EV charging, renewables, and power trading are treated as long-dated growth options. Clear evidence of profitability or scalable competitive advantage in these areas can support a higher valuation multiple versus pure hydrocarbon peers.

Risk profile: A credible transition plan with tangible assets — energy and chemicals parks, LNG expansion, grid-scale renewables, and charging networks — helps reduce regulatory and stranded-asset risk in the eyes of ESG-sensitive investors.

Is it a growth driver?

Right now, Shell plc’s low-carbon and power businesses function more as strategic hedge and optionality than as the primary earnings engine. The growth story is that, over time, a larger share of Shell’s EBITDA will come from power, low-carbon fuels, and customer-centric energy solutions, supported by the LNG backbone.

For investors, Shell plc is effectively a transition hybrid: still heavily dependent on fossil-based revenues, but with a visible — if gradual — reallocation of capital toward products and platforms aligned with a lower-carbon future. How well Shell executes on this product roadmap will determine whether its stock continues to trade primarily as a cyclical oil play or earns a re-rating as a diversified, transition-resilient energy platform.",https://mdb.ad-hoc-news.de/bilder/bild-2405014_600_800.jpg,N,,2026-01-10 08:56:49.425679
,,2026-01-10 08:13:35+00:00,Ground News,Washington state pumps more tax dollars toward green jet fuel - Ground News,Not Available,,,,,https://ground.news/article/washington-state-pumps-more-tax-dollars-toward-green-jet-fuel,"Washington state matches $10 million in tax funds with donor support to foster sustainable aviation fuel and reduce air travel emissions by up to 80%, officials said.
Summary by OPB A who’s who from Washington state business and Democratic politics on Thursday extolled the virtues of alternative jet fuel and said the state would strive to become the nation’s leading enabler of greener flying.The occasion was a splashy launch event in Snohomish County for a new state-funded eco-fuel development nonprofit, dubbed the Cascadia Sustainable Aviation Accelerator.The business accelerator debuted with $10 million in tax dollars app… OPB Dailyfly - Lewis Clark Valley News View article Caret Right Icon My Edmonds News View article Caret Right Icon KUOW View article Caret Right Icon washingtonstatestandard.com View article Caret Right Icon mylynnwoodnews.com View article Caret Right Icon mymltnews.com View article Caret Right Icon + 6 Reposted by 6 other sources Washington state pumps more tax dollars toward green jet fuel A who’s who from Washington state business and Democratic politics on Thursday extolled the virtues of alternative jet fuel and said the state would strive to become the nation’s leading enabler of greener flying.The occasion was a splashy launch event in Snohomish County for a new state-funded eco-fuel development nonprofit, dubbed the Cascadia Sustainable Aviation Accelerator.The business accelerator debuted with $10 million in tax dollars app… 18 hours ago·Portland, United States Read Full Article Think freely.Subscribe and get full access to Ground NewsSubscriptions start at $9.99/year Coverage Details Total News Sources7 Leaning Left2Leaning Right0Center1Last Updated4 hours agoBias Distribution 67 % Left Factuality Info Icon To view factuality data please Upgrade to Premium Ownership Info Icon To view ownership data please Upgrade to Vantage washingtonstatestandard.com broke the news in 1 day ago on Friday, January 9, 2026 .
Too Big Arrow Icon Caret Down Icon Sources are mostly out of ( 0 ) Similar News Topics Washington State Similar News Topics Washington State","Washington state matches $10 million in tax funds with donor support to foster sustainable aviation fuel and reduce air travel emissions by up to 80%, officials said.

Summary by OPB

A who’s who from Washington state business and Democratic politics on Thursday extolled the virtues of alternative jet fuel and said the state would strive to become the nation’s leading enabler of greener flying.The occasion was a splashy launch event in Snohomish County for a new state-funded eco-fuel development nonprofit, dubbed the Cascadia Sustainable Aviation Accelerator.The business accelerator debuted with $10 million in tax dollars app…

OPB

Dailyfly - Lewis Clark Valley News

View article

Caret Right Icon

My Edmonds News

View article

Caret Right Icon

KUOW

View article

Caret Right Icon

washingtonstatestandard.com

View article

Caret Right Icon

mylynnwoodnews.com

View article

Caret Right Icon

mymltnews.com

View article

Caret Right Icon

+ 6 Reposted by 6 other sources

Washington state pumps more tax dollars toward green jet fuel

A who’s who from Washington state business and Democratic politics on Thursday extolled the virtues of alternative jet fuel and said the state would strive to become the nation’s leading enabler of greener flying.The occasion was a splashy launch event in Snohomish County for a new state-funded eco-fuel development nonprofit, dubbed the Cascadia Sustainable Aviation Accelerator.The business accelerator debuted with $10 million in tax dollars app…

18 hours ago·Portland, United States

Read Full Article

Think freely.Subscribe and get full access to Ground NewsSubscriptions start at $9.99/year

Coverage Details

Total News Sources7

Leaning Left2Leaning Right0Center1Last Updated4 hours agoBias Distribution

67 % Left

Factuality Info Icon

To view factuality data please Upgrade to Premium

Ownership

Info Icon

To view ownership data please Upgrade to Vantage

washingtonstatestandard.com broke the news in 1 day ago on Friday, January 9, 2026 .

Too Big Arrow Icon

Caret Down Icon

Sources are mostly out of ( 0 )

Similar News Topics

Washington State

Similar News Topics

Washington State","data:image/svg+xml,<svg xmlns=%22http://www.w3.org/2000/svg%22 width=%22280%22 height=%22280%22 viewBox=%220 0 280 280%22><path transform=%22translate(97.3,0)%22 d=%22M44,140.1h42.8V272H54.9c0-0.1,0-103.8,0-103.8H44V140.1z M44,1c28.4,0,42.6,16.2,42.6,42.2v66.1H54.9V43.8 c0-7.2-3.1-11.7-10.6-11.7c-7,0-10.6,4.2-10.6,11.7c0,0,0,228.1,0,228.2H0.2c0-0.5,0-228.8,0-228.8C0.1,16.8,14.8,1,44,1L44,1z%22/><style>path { fill: %23262626 } @media (prefers-color-scheme: dark) { path { fill: %23EEEFE9 } }</style></svg>",N,,2026-01-10 10:57:15.898878
