id,name,published,outlet,title,authors,category,market,categoryorder,articleorder,url,description,text,image,error,sentiment,firstEyes
,,2025-12-22 16:10:29+00:00,OilPrice.com,Nova Scotia Clears First Hurdle for Massive Jet Fuel Project | OilPrice.com,Andrew Topf,,,,,https://oilprice.com/Alternative-Energy/Biofuels/Nova-Scotia-Clears-First-Hurdle-for-Massive-Jet-Fuel-Project.html,"Now it could be put on the map for an entirely different reason: low-carbon, sustainable jet fuel.
The jet fuel plant would require 60 truckloads of biomass (wood waste) per day and 586 cubic meters of fresh water per hour, which would be pulled from two nearby lakes.
Related: $60 Oil Is No Longer a Floor Nova Sustainable Fuels expects it will take two to three years to construct and have a 50-year lifespan.
Sustainable aviation fuel (SAF) is a cleaner alternative to traditional jet fuel, made from sustainable sources such as biofuels, biomass, and captured carbon from oil and gas operations.
However, SAF accounted for just 0.3% of global jet fuel production and 11% of global renewable fuel, according to IATA's latest estimates.","The Maritime province of Nova Scotia is known for its lighthouses, lobster, Celtic/Acadian vibe, and Canadian history like the UNESCO heritage site of Old Town Lunenburg.

Now it could be put on the map for an entirely different reason: low-carbon, sustainable jet fuel.

CBC News reported this week that a proposal for an industrial plant on Nova Scotia’s Eastern Shore has passed its first regulatory hurdle: environmental approval from the province.

The proponent, Nova Sustainable Fuels, backed by European energy giant Octopus Energy, plans to build a $4-6 billion facility to produce sustainable aviation fuel and renewable ethanol, using solar and wind power and biomass. The company describes the products as “two critical low-carbon fuels for decarbonizing the transportation sector.”

The project would proceed in two phases. The first phase is building a production facility near the mouth of Isaacs Harbour, NS. In the second phase, wind and solar farms would be built to connect to the plant. That, says CBC, would require another environmental assessment, which the company said it plans to submit in 2027.

The jet fuel plant would require 60 truckloads of biomass (wood waste) per day and 586 cubic meters of fresh water per hour, which would be pulled from two nearby lakes.

Related: $60 Oil Is No Longer a Floor

Nova Sustainable Fuels expects it will take two to three years to construct and have a 50-year lifespan. Nova Scotia’s environment minister, Tim Halman, has put a few conditions on the project, including that it must be built within two years.

Nova Scotia has recently turned toward traditional oil and gas sources, despite strategizing a shift from fossil fuels to renewables focused on wind power. In July the province announced it is returning to offshore petroleum exploration for the first time since 2018, offering 13 new parcels covering 3.3 million hectares near the Scotian Shelf.

Energy Minister Trevor Boudreau said offshore natural gas presents a “major economic opportunity”.

Sustainable aviation fuel (SAF) is a cleaner alternative to traditional jet fuel, made from sustainable sources such as biofuels, biomass, and captured carbon from oil and gas operations. It is said to cut greenhouse gas emissions by up to 80% and can be used in existing aircraft and infrastructure without modifications.

SAF has another Canadian connection in Parkland Corporation, which in 2024 produced the first batch of made-in-Canada low-carbon jet fuel from its facility in Burnaby, British Columbia, just outside of Vancouver.

The 10,000 liters of fuel were sourced from non-food-grade canola and tallow. The entire batch of the production run was bought by Air Canada.

Previously, the Canadian aviation industry purchased SAF from other countries and imported it into Canada.

SAF is being employed at major airports including Amsterdam, Los Angeles, San Francisco and Houston.

Airlines are collaborating with fuel suppliers, airports and industries like tech and agriculture to boost SAF supply chains. They are also signing multi-year agreements with fuel producers like Neste and World Energy.

Despite these developments, the ramp-up of Sustainable Aviation Fuel has been slower than expected due to high costs and economic uncertainty, putting global clean jet fuel supply off course to reach the 2030 targets, according to a March report by Boston Consulting Group (BCG).

Airlines and airports globally invest just 1-3% of their revenues or capex on SAF, per the report cited by Reuters.

High production costs remain the key barriers to faster adoption of SAF, according to BCG's findings.

Last year, for example, Shell paused on-site construction work at a biofuels plant in Rotterdam amid weak market conditions. The plant is designed to produce sustainable aviation fuel and renewable diesel made from waste.

In 2023, Willie Walsh, director general at the International Air Transport Association (IATA), said that the airline industry would be ready to embrace the fact that SAF would always be more expensive than oil-based jet fuel.

In 2024, SAF production volumes reached 1 million tons, double the 500,000 tons produced in 2023. However, SAF accounted for just 0.3% of global jet fuel production and 11% of global renewable fuel, according to IATA's latest estimates.

By Andrew Topf for Oilprice.com

More Top Reads From Oilprice.com

Global Coal Demand Hits All-Time High

Phillips 66 Sees Strong Support for Western Gateway Pipeline

U.S. Blockade Threatens Venezuela's Crucial Russian Naphtha Supply",https://d32r1sh890xpii.cloudfront.net/article/718x300/2025-12-22_trpoghtdu3.jpg,N,,2025-12-22 17:10:19.731915
,,2025-12-22 16:08:22+00:00,Springwise,Converting food waste into sustainable aviation fuel - Springwise,angela,,,,,https://springwise.com/circular-economy/converting-food-waste-into-sustainable-aviation-fuel/,"Want to explore this innovation?
Start a free trial and get 7 days access to our global innovation database, AI-powered scouting tools, and expert insights.
No commitment required Start free trial  View plans ","Want to explore this innovation?

Start a free trial and get 7 days access to our global innovation database, AI-powered scouting tools, and expert insights. No commitment required

Start free trial  View plans ",https://springwise.com/wp-content/themes/spring-wise/images/cover.png,N,,2025-12-22 17:10:37.549266
,,2025-12-22 16:04:55+00:00,www.linkedin.com,Sustainable Aviation Fuel (SAF) is a viable alternative to conventional fossil fuels and plays ...,DHL,,,,,https://www.linkedin.com/posts/dhl_sustainable-aviation-fuel-saf-is-a-viable-activity-7408868972827443200-Y2ZX,"Sustainable Aviation Fuel (SAF) is a viable alternative to conventional fossil fuels and plays a key role in reducing greenhouse gas emissions in aviation. ✈️
In 2023, we sourced 14% of the global SAF supply for our own fleet. In 2024, we increased our blend ratio to 3.5%, one of the highest among global airlines.

We will continue to share updates as the landscape around SAF evolves.
What’s your experience, opinion, or question? Share it in the comments! 👇",Not Available,https://media.licdn.com/dms/image/v2/D5622AQGWhTJe-Zn-NQ/feedshare-shrink_2048_1536/B56ZtFotNyIEAw-/0/1766399861097?e=2147483647&v=beta&t=Fe0XiwR3NDW7BK1R7G2k86CpFw9RDgSiRDrBG7MB-eU,N,,2025-12-22 17:11:02.609324
,,2025-12-22 16:04:00+00:00,csrwire.com,FedEx Champions Youth Engagement in Japan's Sustainable Future - CSRwire,Not Available,,,,,http://csrwire.com/press-release/fedex-champions-youth-engagement-japans-sustainable-future/,"The one-day hiking program offered immersive nature experiences that highlight the importance of sustainability and the preservation of Japan’s natural environment for future generations.
“Through sustainability initiatives within the communities we serve, we can foster meaningful connections between future generations and nature while promoting environmental stewardship that benefits Japan’s sustainable future.
This initiative is part of the FedEx Cares, the company’s global community program.
To learn more about FedEx Cares initiatives, read here.
Click here to learn about FedEx Cares, our global community engagement program.","Federal Express Corporation, one of the world’s largest express transportation companies, has helped inspire environmental awareness among children from care homes in the Greater Tokyo Area. The one-day hiking program offered immersive nature experiences that highlight the importance of sustainability and the preservation of Japan’s natural environment for future generations.

Organized by Mirai no Mori, 13 FedEx volunteers accompanied 28 children on a 4-kilometer hike at Mt. Mitake in western Tokyo. FedEx volunteers served as mentors throughout the day, guiding participants and sharing practical knowledge about protecting the environment. The program gave the children the opportunity to enjoy the outdoors, explore a new environment, and simply have fun—experiences that are just as important as the lessons learned.

“We believe in empowering our team members and our communities to help create a healthier and more positive future for the environment,” said Kei Alan Kubota, managing director of FedEx Japan. “Through sustainability initiatives within the communities we serve, we can foster meaningful connections between future generations and nature while promoting environmental stewardship that benefits Japan’s sustainable future. It is a privilege for our team members to contribute to this important environmental project in our community.”

Across Japan, an estimated 23,000 children live in care homes, many of whom face significant challenges as they prepare to transition into adulthood. [1] Mirai no Mori offers these young people transformative experiences through nature-based activities such as trekking, forestry work, and river rafting. The program fosters cognitive, personal and social skills – the key life skills that empower them to navigate life after leaving the care system at age 18.

This initiative is part of the FedEx Cares, the company’s global community program. To learn more about FedEx Cares initiatives, read here.

Click here to learn about FedEx Cares, our global community engagement program.",https://csrwire.com/wp-content/uploads/sites/2/2025/12/champions-youth-engagement_FedEx_102025.jpeg,N,,2025-12-22 17:11:18.614860
,,2025-12-22 16:01:04+00:00,Instagram,Did you know? We're scaling Sustainable Aviation Fuel (SAF) to cut lifecycle emissions ... - Instagram,Not Available,,,,,https://www.instagram.com/p/DSkeqA8iMYV/,"I am having a terrible experience for the second time in recent months.
My parcel has gone missing again, nobody can tell me where it is and the customer service is awful.
DHL is consistently the worst courier I have dealt with.
I have sent so many emails for help and nobody ever replies to help.","I am having a terrible experience for the second time in recent months. My parcel has gone missing again, nobody can tell me where it is and the customer service is awful. DHL is consistently the worst courier I have dealt with. I have sent so many emails for help and nobody ever replies to help.",https://scontent-iad3-1.cdninstagram.com/v/t39.30808-6/604811875_1278308507660741_8389843438491984857_n.jpg?stp=c216.0.648.648a_dst-jpg_e35_s640x640_tt6&_nc_cat=108&ccb=7-5&_nc_sid=18de74&efg=eyJlZmdfdGFnIjoiQ0FST1VTRUxfSVRFTS5iZXN0X2ltYWdlX3VybGdlbi5DMyJ9&_nc_ohc=44eA28wwzaQQ7kNvwE8pwP6&_nc_oc=Adn_ZY1MBa2tg7XOMYcIG45P-khZQQvsqzhT0-XKL3jO5PzRsus6yHfNW7sn-sVy_uyVSzf1WtRRYyDLD6yhedK2&_nc_zt=23&_nc_ht=scontent-iad3-1.cdninstagram.com&_nc_gid=vA7ugXPKm_hICIN7P6tA5w&oh=00_AflGhJWkPBYQ9K00UKRQC1IBSzW66QSagYDKEE3CqSnAzA&oe=694F842A,N,,2025-12-22 17:11:50.150077
,,2025-12-22 15:52:36+00:00,www.chemanalyst.com,Borealis Raises the Bar with Worldwide Deployment of its AI-enabled Borstar Digital Twin Platform,Not Available,,,,,https://www.chemanalyst.com/NewsAndDeals/NewsDetails/borealis-raises-the-bar-with-worldwide-deployment-of-its-ai-enabled-40489,"The worldwide deployment of the Borstar Digital Twin represents a major step forward in transforming how manufacturing plants operate, make decisions, and continuously improve performance.
At its core, the Borstar Digital Twin is a sophisticated suite of digital solutions that merges cutting-edge technology with Borealis’ deep expertise in process engineering.
The capabilities of the Borstar Digital Twin extend across multiple dimensions of plant performance.
According to Wolfram Krenn, Executive Vice President Operations at Borealis, the adoption of the Borstar Digital Twin goes far beyond simply introducing new technology.
He emphasizes that the Borstar Digital Twin transforms advanced technology into a tangible customer benefit by delivering greater speed, reliability, and quality.","Borealis has announced the global rollout of its advanced Borstar® Digital Twin program, setting a new benchmark for the use of artificial intelligence and digitalization in industrial operations. This initiative reflects Borealis’ continued commitment to pushing the limits of digital innovation by embedding AI-driven intelligence directly into core production processes. The worldwide deployment of the Borstar Digital Twin represents a major step forward in transforming how manufacturing plants operate, make decisions, and continuously improve performance.

At its core, the Borstar Digital Twin is a sophisticated suite of digital solutions that merges cutting-edge technology with Borealis’ deep expertise in process engineering. By combining artificial intelligence, real-time optimization tools, and advanced data analytics, the platform delivers a highly accurate virtual representation of the physical production process. This digital replica allows plants to monitor operations in real time, anticipate future process behavior, and run advanced simulations without disrupting actual production. As a result, Borealis facilities can achieve new levels of efficiency, productivity, and operational reliability.

The capabilities of the Borstar Digital Twin extend across multiple dimensions of plant performance. It supports data-driven decision-making by enabling operators and engineers to optimize processes using predictive insights and scenario-based simulations. Safety is enhanced through early identification and prediction of potential process or equipment issues, allowing preventive action before problems escalate. Sustainability objectives are also strengthened, as the system helps reduce waste, lower energy consumption, and minimize overall environmental impact. In addition, the platform accelerates innovation by shortening product development cycles and enabling virtual operator training in a risk-free digital environment.

The Borstar Digital Twin program was initially launched in 2023, with a specific focus on Borealis’ proprietary Borstar® technology used in the production of polyethylene and polypropylene. From the outset, the program was designed to ensure that production plants operate at peak efficiency while maintaining consistently high product quality. By 2025, Borealis reached a digital maturity milestone that made it possible to scale this solution globally. The program is now being rolled out across all Borstar units worldwide, including those operated by licensees such as Baystar™ and Borouge. This global expansion signals a new phase in which digital tools and AI-enabled workflows are becoming standard practice within Borealis’ core manufacturing operations.

According to Wolfram Krenn, Executive Vice President Operations at Borealis, the adoption of the Borstar Digital Twin goes far beyond simply introducing new technology. He explains that by integrating AI-based predictions with rigorous process models, plants can operate more efficiently, execute faster and more controlled grade transitions, and consistently deliver prime-quality products. Real-time monitoring also enables early detection and mitigation of process deviations or equipment anomalies, reducing unplanned shutdowns and improving overall reliability.

From a strategic perspective, Borealis CEO Stefan Doboczky highlights the broader value of the initiative. He emphasizes that the Borstar Digital Twin transforms advanced technology into a tangible customer benefit by delivering greater speed, reliability, and quality. In doing so, the program directly supports Borealis’ We4Customers strategy, reinforcing the company’s focus on customer success while strengthening its competitive position in the global polymers market.",https://www.chemanalyst.com/images/favicon.ico,N,,2025-12-22 17:11:54.135158
,,2025-12-22 15:51:43+00:00,International Airport Review,Salvador Bahia Airport introduces Sustainable Aviation Fuel,Gabriel Higgins,,,,,https://www.internationalairportreview.com/news/301297/salvador-bahia-airport-becomes-brazils-first-to-supply-sustainable-aviation-fuel-for-regular-flights/,"Salvador Bahia Airport becomes Brazil’s first to supply Sustainable Aviation Fuel for regular flights 0 SHARES Posted: 22 December 2025 | Gabriel Higgins | Starting November, Salvador Bahia Airport supplies SAF for daily Gol and LATAM flights, reducing emissions and reinforcing Brazil’s commitment to sustainable aviation practices Credit: VINCI Airports Salvador Bahia Airport (SSA), part of VINCI Airports’ network since 2018, is pioneering Brazil’s aviation decarbonisation by becoming the country’s first airport to supply Sustainable Aviation Fuel (SAF) for commercial operations.
Regular use of SAF begins this November, marking a significant milestone for both the airport and VINCI Airports’ commitment to accelerating the energy transition across its mobility infrastructure and stakeholders.
The fuel blend used at Salvador meets international sustainability criteria and can help lower lifecycle greenhouse gas emissions compared to conventional jet fuel.
Two daily flights from Salvador Bahia, operated by Gol Linhas Aéreas and LATAM Airlines Brasil, now use a blend of 10 per cent pure SAF and 90 per cent conventional jet fuel, the highest proportion currently applied in Brazilian aviation.
Get exclusive access to the latest aviation insights from International Airport Review — all tailored to your interests.","Salvador Bahia Airport becomes Brazil’s first to supply Sustainable Aviation Fuel for regular flights

0

SHARES

Posted: 22 December 2025 | Gabriel Higgins |

Starting November, Salvador Bahia Airport supplies SAF for daily Gol and LATAM flights, reducing emissions and reinforcing Brazil’s commitment to sustainable aviation practices

Credit: VINCI Airports

Salvador Bahia Airport (SSA), part of VINCI Airports’ network since 2018, is pioneering Brazil’s aviation decarbonisation by becoming the country’s first airport to supply Sustainable Aviation Fuel (SAF) for commercial operations. Regular use of SAF begins this November, marking a significant milestone for both the airport and VINCI Airports’ commitment to accelerating the energy transition across its mobility infrastructure and stakeholders.

The airport already serves as a regional benchmark for environmental performance. It was the first in the Americas to achieve the highest level of Airport Carbon Accreditation, ACA 5, implementing advanced practices for carbon management and reduction. More than 15 airports in the VINCI network now offer SAF, and Salvador Bahia’s introduction of regular SAF operations further strengthens its environmental position and aligns with decarbonisation goals across the network.

In Brazil, SAF is commercially distributed by Vibra. The fuel blend used at Salvador meets international sustainability criteria and can help lower lifecycle greenhouse gas emissions compared to conventional jet fuel. Two daily flights from Salvador Bahia, operated by Gol Linhas Aéreas and LATAM Airlines Brasil, now use a blend of 10 per cent pure SAF and 90 per cent conventional jet fuel, the highest proportion currently applied in Brazilian aviation. The pure SAF, produced from used cooking oil, is presently the only type available nationally. While flight emissions fall under airlines’ scope 1 and the airport’s scope 3, the renewable fuel reduces lifecycle greenhouse gas emissions and represents a first step in expanding SAF use in Brazil.

Governor Jerônimo Rodrigues said, “Bahia has made significant progress in clean energy production and in building a more sustainable future, where development and social justice move forward together.”

Julio Ribas, CEO of VINCI Airports in Brazil, added, “SAF is currently the most effective tool for reducing emissions in commercial aviation. Being able to offer flights fuelled with SAF in Salvador on a continuous basis places Bahia at the forefront of the energy transition and reinforces our commitment to transforming passenger journeys with increasingly sustainable solutions.”

SIGN ME UP

Stay Ahead in Aviation — Subscribe for Free!

Get exclusive access to the latest aviation insights from International Airport Review — all tailored to your interests.

✅ Expert-Led Webinars – Learn from industry leaders

✅ Weekly News & Reports – Airport updates, thought leadership, and exclusive interviews

✅ Event Invitations – Be part of the International Airport Summit

✅ Partner Innovations – Discover the latest industry trends

Choose the updates that matter most to you. Sign up now and stay informed, inspired, and connected — all for free!

Thank you for being part of our community. Let’s keep exploring the future of aviation together!",https://www.internationalairportreview.com/wp-content/uploads/6936f3897c8282ad820b14ac.jpg,N,,2025-12-22 17:11:58.218874
