id,name,published,outlet,title,authors,category,market,categoryorder,articleorder,url,description,text,image,error,sentiment,firstEyes
,,2025-12-17 13:34:41+00:00,Oils & Fats International,Shell signs agreement to purchase SAF from Green Sky Capital - Oils & Fats International,Not Available,,,,,https://www.ofimagazine.com/news/shell-signs-agreement-to-purchase-saf-from-green-sky-capital,"The agreement would help provide commercial certainty for investors to move forward with plans to build Egypt’s first commercial-scale SAF plant, Shell said in a 5 December LinkedIn post.
“By securing 100% of the plant’s output, Shell is strengthening its global supply network for low-carbon fuels and helping aviation meet decarbonisation targets,” said Geoff Mansfield, vice president, low carbon fuels, at Shell Trading.
As of July 2025, Shell had delivered SAF to more than 80 locations in 18 countries and, in 2024, became one of the world’s leading SAF traders and suppliers with close to 20% of total sales in Europe and North America, the company said.
Shell said the offtake agreement reflected the company’s strategy to scale up SAF availability worldwide and support airlines in meeting regulatory mandates and voluntary commitments.
Green Sky Capital is developing renewable fuel projects across the Middle East and North Africa (MENA) region, starting with the planned facility in Egypt.","The agreement would help provide commercial certainty for investors to move forward with plans to build Egypt’s first commercial-scale SAF plant, Shell said in a 5 December LinkedIn post.

Located in Egypt’s Suez Canal Economic Zone, the facility was scheduled to become operational by the end of 2027 and would produce up to 145,000 tonnes/year of SAF, as well as bio-naphtha and bio-propane, the company said.

“By securing 100% of the plant’s output, Shell is strengthening its global supply network for low-carbon fuels and helping aviation meet decarbonisation targets,” said Geoff Mansfield, vice president, low carbon fuels, at Shell Trading.

As of July 2025, Shell had delivered SAF to more than 80 locations in 18 countries and, in 2024, became one of the world’s leading SAF traders and suppliers with close to 20% of total sales in Europe and North America, the company said.

Shell said the offtake agreement reflected the company’s strategy to scale up SAF availability worldwide and support airlines in meeting regulatory mandates and voluntary commitments.

Green Sky Capital is developing renewable fuel projects across the Middle East and North Africa (MENA) region, starting with the planned facility in Egypt.",https://www.ofimagazine.com/content-images/news/_1200x630_crop_center-center_82_none/Shell-pic-for-news-AdobeStock_429938980.jpeg?mtime=1757340278,N,,2025-12-17 09:57:27.087009
,,2025-12-17 13:28:50+00:00,www.koreatimes.co.kr,"Sum Air, 1st Korean airline to focus on underserved areas, to launch next year",Ko Dong-hwan,,,,,https://www.koreatimes.co.kr/business/companies/20251217/sum-air-1st-korean-airline-to-focus-on-underserved-areas-to-launch-next-year,"Service Error An unexpected server error has occurred.
Please try again later.
Go to Homepage","Service Error

An unexpected server error has occurred. Please try again later.

Go to Homepage",https://newsimg.koreatimes.co.kr/2025/12/16/90b1f008-ddf6-4859-b858-16503fd7cc81.jpeg,N,,2025-12-17 09:57:31.811262
,,2025-12-17 13:14:17+00:00,Energy Capital & Power,Egypt Attracts $200M Qatari Investment for Sustainable Aviation Fuel,"Anne-Laure Klein, www.facebook.com, anine.kilian",,,,,https://energycapitalpower.com/egypt-attracts-200m-qatari-investment-for-sustainable-aviation-fuel/,"Egypt has signed a contract with Qatari holding company Al Mana for a first-phase investment of $200 million to produce sustainable aviation fuel (SAF) from used cooking oil in the Suez Canal Economic Zone (SCZone) at Ain Sokhna.
The agreement marks the first industrial investment by a Qatari company in the SCZone.
Al Mana has secured a long-term offtake agreement with Shell Global Aviation, under which Shell will purchase the facility’s entire output.
Deliveries of SAF are scheduled to begin by late 2027, following the completion of construction and commissioning.
The facility will produce fuel that meets international aviation fuel specifications and is expected to support export growth from the SCZone, while expanding Egypt’s industrial capacity in energy and advanced fuel production.","Egypt has signed a contract with Qatari holding company Al Mana for a first-phase investment of $200 million to produce sustainable aviation fuel (SAF) from used cooking oil in the Suez Canal Economic Zone (SCZone) at Ain Sokhna.

The project will be developed over three phases on a 100,000 m² site in the Integrated Sokhna Zone on Egypt’s Red Sea coast. The first phase is expected to have an annual production capacity of approximately 200,000 tons, comprising SAF produced via hydrotreated vegetable oil (HVO) technology, alongside co-products BioPropane and BioNaphtha. All outputs will be derived from the refining of used cooking oils. The agreement marks the first industrial investment by a Qatari company in the SCZone.

Al Mana has secured a long-term offtake agreement with Shell Global Aviation, under which Shell will purchase the facility’s entire output. Deliveries of SAF are scheduled to begin by late 2027, following the completion of construction and commissioning.

The facility will produce fuel that meets international aviation fuel specifications and is expected to support export growth from the SCZone, while expanding Egypt’s industrial capacity in energy and advanced fuel production.",https://ecpbucket.s3.eu-central-1.amazonaws.com/wp-content/uploads/2025/12/17084217/Egypt-aviation-fuel.jpg,N,,2025-12-17 09:57:36.951924
,,2025-12-17 13:13:32+00:00,American Ag Network,"SAF Coalition Members Welcome Introduction of H.R. 6518, The Securing America's Fuels Act",Jesse Allen,,,,,https://www.americanagnetwork.com/2025/12/17/saf-coalition-members-welcome-introduction-of-h-r-6518-the-securing-americas-fuels-act/,"Washington, D.C. – Last week, Representatives Mike Flood (R-NE), Sharice Davids (D-KS), Tracey Mann (R-KS), and Troy Carter (D-LA) introduced the Securing America’s Fuels (SAF) Act, H.R.
6518, bipartisan legislation that would restore the full value of the tax credit and extend the entire 45Z tax credit through 2033.
The Securing America’s Fuels Act reinstates the higher $1.75 credit rate for sustainable aviation fuel and extends the credit to 2033, two critical components needed to accelerate investment and secure new demand for American-grown biofuels.
The ACA strongly supports bipartisan efforts that ensure agriculture remains the backbone of America’s energy future.” —Tom Buis, ACA, CEO Boeing: “Boeing welcomes the introduction of The Securing America’s Fuels Act.
And now it’s time to lead a new industry – sustainable aviation fuel.","Washington, D.C. – Last week, Representatives Mike Flood (R-NE), Sharice Davids (D-KS), Tracey Mann (R-KS), and Troy Carter (D-LA) introduced the Securing America’s Fuels (SAF) Act, H.R. 6518, bipartisan legislation that would restore the full value of the tax credit and extend the entire 45Z tax credit through 2033. Members of the SAF Coalition issued the following statements of support.

Airlines for America:

“U.S. airlines are grateful to Representatives Flood, Davids, Carter, and Mann for introducing legislation that would restore and extend the full 45Z tax credit. This will stimulate private sector investment in SAF while also bolstering American energy dominance. This credit is a win-win for both the aviation and agriculture industries, supporting U.S. job growth across the country.”

American Carbon Alliance:

The American Carbon Alliance (ACA) applauds Reps. Mike Flood (NE-01), Sharice Davids (KS-03), Troy Carter (LA-02), and Tracey Mann (KS-01) for championing bipartisan legislation to strengthen Section 45Z and provide long-term certainty for clean fuel producers. The Securing America’s Fuels Act reinstates the higher $1.75 credit rate for sustainable aviation fuel and extends the credit to 2033, two critical components needed to accelerate investment and secure new demand for American-grown biofuels.

“Restoring the full 45Z credit and extending it to 2033 gives farmers and producers the certainty they’ve been missing, and it opens the door to new aviation markets. That means more demand, stronger prices, and real economic growth in rural America. The ACA strongly supports bipartisan efforts that ensure agriculture remains the backbone of America’s energy future.”

—Tom Buis, ACA, CEO

Boeing:

“Boeing welcomes the introduction of The Securing America’s Fuels Act. This bipartisan legislation aligns with our strategy to enable responsible growth in aviation, where increasing the supply of SAF complements other measures like designing and building a new generation of fuel-efficient airplanes.”

Darling:

“America has always led the way. And now it’s time to lead a new industry – sustainable aviation fuel. This is about jobs, innovation and securing our energy future. If we’re not at the table, others will write the rules. We’re ready to show what America can deliver – and smart policy will make it happen.”

—Shelby Neal, Vice President of Renewables and Energy Policy, Darling Ingredients

Delta:

“Delta applauds Reps. Flood (R-NE), Davids (D-KS), Mann (R-KS) and Carter (D-LA) for their leadership in introducing the Securing America’s Fuels Act, which will ensure 45Z reaches its full potential and provides the critical investment certainty necessary to bring additional SAF production facilities online to meet our industry’s unprecedented demand for cost-competitive, homegrown fuels.”

—Cherie Wilson, Vice President, Government Affairs – Sustainability, Delta Air Lines

GBTA:

“GBTA strongly supports the passage of the SAF Act. This bill will improve economic growth and lower costs for consumers and business travelers over time. We appreciate your leadership in advancing practical, pro-growth climate and energy solutions for aviation.”

—Suzanne Neufang, CEO, GBTA

Gevo:

“Domestic demand for jet fuel continues to rise, and policy can help support investment in new facilities needed to produce cost-competitive alcohol-to-jet synthetic aviation fuel (SAF) to meet this demand. Gevo thanks U.S. Reps. Sharice Davids (KS), Mike Flood (NE), Troy Carter (LA), and Tracey Mann (KS), for prioritizing SAF by introducing the Securing America’s Fuels Act to help accelerate solutions that increase American energy production – and grow rural and farm economies. The Securing America’s Fuels Act reflects ongoing bipartisan support for building a durable future for domestic jet fuel production that leverages the strength of U.S. agriculture by restoring the full value of the SAF credit and extending the 45Z credit through 2033.”

—Lindsay Fitzgerald, Chief Public Affairs Officer, Gevo

Twelve:

“Turning American feedstocks into American-made SAF is how we strengthen our energy independence and fuel U.S. innovation. Restoring the full SAF credit keeps this critical industry growing here at home.”

—Nicholas Flanders, Co-Founder and CEO, Twelve

United:

“United is grateful for the leadership of Representatives Mike Flood, Sharice Davids, Tracey Mann, and Troy Carter in introducing the “Securing America’s Fuels (SAF) Act”, which will help to ensure that the U.S. remains the world’s leading producer of SAF and other clean fuels, while also creating a huge market opportunity for U.S. farmers and feedstock producers. Extending the credit’s duration and guaranteeing its full value are pivotal policy actions that would accelerate domestic SAF production, strengthen U.S. energy and climate leadership, and reinforce America’s position as the world’s most competitive producer of cleaner, lower-carbon jet fuel.”

—Tom Michels, Director of Government Affairs, United Airlines",https://dehayf5mhw1h7.cloudfront.net/wp-content/uploads/sites/2470/2024/09/09111110/Web-Photo-Template-1020x640-2024-09-09T061008.981-898x563.jpg,N,,2025-12-17 09:57:42.164469
,,2025-12-17 13:05:44+00:00,www.unitetheunion.org,Unite response to Grangemouth investment - Unite the Union,Not Available,,,,,https://www.unitetheunion.org/news-events/news/2025/december/unite-response-to-grangemouth-investment,"... sustainable aviation fuel. “There has to be a joined-up strategy for a workers' transition, backed by investment. British industry must be backed ...",Not Available,,N,,2025-12-17 09:58:15.310764
,,2025-12-17 13:00:49+00:00,www.youtube.com,Paying more for green travel: Are levies and carbon taxes enough? | Wheel Insights Podcast,,,,,,https://www.youtube.com/watch%3Fv%3D-LT1hmM4OeE,... Sustainable Aviation Fuel (SAF). But is this levy enough to tackle aviation's carbon problem? Hosted by ST senior transport correspondent Lee Nian ...,Not Available,,Y,,2025-12-17 09:58:19.381674
,,2025-12-17 13:00:23+00:00,www.logupdateafrica.com,"Egypt–China ties underpin logistics, infrastructure & trade cooperation","Our Correspondent, Logistics Update Africa",,,,,https://www.logupdateafrica.com/shipping/egyptchina-ties-underpin-logistics-infrastructure-trade-cooperation-1357524,"Foreign Minister Badr Abdelatty welcomed the pace of bilateral engagement during a telephone call with Chinese Foreign Minister Wang Yi, noting that sustained political coordination has created a framework for deeper economic and investment cooperation between the two countries.
The foreign minister pointed to the role of Chinese companies in major infrastructure projects in Egypt, including the Light Rail Transit project and the Central Business District in the New Administrative Capital.
These projects are seen as strengthening urban transport capacity, connectivity and logistics efficiency, alongside cooperation in renewable energy and desalination.
The logistics role of Ain Sokhna has also been expanded through new industrial investments linked directly to port operations.
The discussions come as Egypt continues to position economic zones and transport corridors as platforms for foreign investment tied to manufacturing, logistics and trade flows, supported by large-scale infrastructure development.","Egypt’s government has linked the rapid development of Egypt–China relations to expanding cooperation in infrastructure, transport and trade-related sectors that support logistics and supply chains, according to statements made during high-level diplomatic exchanges on December 16, 2025.

Foreign Minister Badr Abdelatty welcomed the pace of bilateral engagement during a telephone call with Chinese Foreign Minister Wang Yi, noting that sustained political coordination has created a framework for deeper economic and investment cooperation between the two countries.

According to Foreign Ministry spokesman Tamim Khallaf, Abdelatty said Egypt is seeking to convene the fifth round of the ministerial-level Strategic Dialogue and the joint committee meeting to advance cooperation across multiple domains, as both sides prepare to mark 70 years of diplomatic relations next year.

The foreign minister pointed to the role of Chinese companies in major infrastructure projects in Egypt, including the Light Rail Transit project and the Central Business District in the New Administrative Capital. These projects are seen as strengthening urban transport capacity, connectivity and logistics efficiency, alongside cooperation in renewable energy and desalination.

Ain Sokhna’s logistics positioning has also been reinforced by recent developments at the port, where Deputy Prime Minister for Industrial Development and Minister of Industry and Transport Kamel El-Wazir received a Guinness World Records certificate recognising Ain Sokhna as the deepest man-made port basin constructed on land, with a depth of 19 metres. The port’s development forms part of a national plan to enhance Egypt’s role in international trade and position Sokhna as a logistics and transit hub on the Red Sea, supporting large vessels, higher cargo volumes and port-centric supply chains.

The logistics role of Ain Sokhna has also been expanded through new industrial investments linked directly to port operations. Earlier this month, Prime Minister Dr Mostafa Madbouly witnessed the signing of a contract for a sustainable aviation fuel production project by Qatari Al-Mana Holding Company in the Sokhna Integrated Zone of the Suez Canal Economic Zone. The project marks the first Qatari industrial investment within the Suez Canal economy and involves the establishment of SAf Fly Limited, a dedicated production entity located across both the industrial zone and the port area, integrating manufacturing and maritime logistics functions.

With an investment of $200 million, the project is being developed on a total area of 100,000 square metres, including 30,000 square metres inside Ain Sokhna port, enabling direct access to export infrastructure. The facility is designed to produce 200,000 tonnes annually of sustainable aviation fuel, bio-propane and bio-naphtha, derived from used edible oils. Al-Mana Holding has signed a long-term supply agreement with Shell to purchase the full output, with fuel deliveries scheduled to begin by the end of 2027, reinforcing Sokhna’s role in global energy and aviation fuel supply chains.

Abdelatty also highlighted investment opportunities linked to Egypt’s strategy to localise industry and transfer technology, with an emphasis on attracting Chinese investment in artificial intelligence and digitalisation, areas that support modern logistics, industrial automation and supply chain management.

The discussions come as Egypt continues to position economic zones and transport corridors as platforms for foreign investment tied to manufacturing, logistics and trade flows, supported by large-scale infrastructure development.

The call also covered coordination in multilateral forums and regional developments, including Gaza and Sudan, with both sides stressing continued consultation and cooperation as part of the broader strategic partnership.",https://www.logupdateafrica.com/h-upload/2025/12/17/90072-fb-img-1765730561817-1.jpg,N,,2025-12-17 12:57:40.368496
,,2025-12-17 12:55:27+00:00,www.freshplaza.com,Long-term synthetic SAF offtake agreed to support aviation sustainability - FreshPlaza,Not Available,,,,,https://www.freshplaza.com/north-america/article/9794959/long-term-synthetic-saf-offtake-agreed-to-support-aviation-sustainability/,"A central element of the agreement is collaboration around sustainable aviation fuel (SAF) produced by Synhelion, a Swiss cleantech company developing synthetic fuels made using solar energy.
© Kuehne+Nagel Under the agreement, Kuehne+Nagel, together with SWISS and its air freight division Swiss WorldCargo, will participate in a long-term SAF offtake framework designed to align fuel supply with expected demand.
The aim is to contribute to more stable market conditions for emerging synthetic aviation fuels and to support further technological development.
According to Kuehne+Nagel, scaling the production of synthetic SAF is necessary to support the aviation sector's longer-term climate objectives.
Synhelion's technology focuses on producing synthetic fuels using concentrated solar energy to create drop-in fuels compatible with existing aircraft and infrastructure.","Kuehne+Nagel and Swiss International Air Lines (SWISS) have signed a Memorandum of Understanding to expand their cooperation on sustainability initiatives in aviation, with a focus on improving efficiency and reducing environmental impact.

A central element of the agreement is collaboration around sustainable aviation fuel (SAF) produced by Synhelion, a Swiss cleantech company developing synthetic fuels made using solar energy. The partners have agreed on a long-term offtake arrangement intended to support the scaling of Synhelion's technology and provide greater planning certainty for future production.

© Kuehne+Nagel

Under the agreement, Kuehne+Nagel, together with SWISS and its air freight division Swiss WorldCargo, will participate in a long-term SAF offtake framework designed to align fuel supply with expected demand. The aim is to contribute to more stable market conditions for emerging synthetic aviation fuels and to support further technological development.

From 2027, Kuehne+Nagel plans to purchase Synhelion-produced SAF from SWISS for a period of five years, to be used for cargo shipments handled by Swiss WorldCargo. The SAF volumes will be applied to reduce the CO₂ footprint associated with these air freight movements, offering customers an option to lower emissions linked to their shipments.

According to Kuehne+Nagel, scaling the production of synthetic SAF is necessary to support the aviation sector's longer-term climate objectives. The company stated that partnerships with airlines and fuel producers are required to move new technologies beyond pilot scale and toward broader commercial use.

SWISS noted that sustainable aviation fuels are expected to play an important role in reducing emissions from air transport, but availability remains limited and costs remain high. The airline described the agreement as a step toward bringing new SAF solutions into commercial operation and increasing experience with alternative fuels in day-to-day operations.

Synhelion's technology focuses on producing synthetic fuels using concentrated solar energy to create drop-in fuels compatible with existing aircraft and infrastructure. The long-term offtake agreement is intended to support further investment and capacity expansion as the technology moves toward industrial-scale deployment.

The partners stated that the cooperation is aimed at contributing to the development of the SAF market rather than addressing aviation emissions on its own, highlighting the need for broader industry participation to achieve a meaningful impact.",https://www.freshplaza.com/remote/https/agfstorage.blob.core.windows.net/misc/FP_com/2025/12/17/0172-1.jpg?preset=OgImage,N,,2025-12-17 09:58:27.131289
