id,name,published,outlet,title,authors,category,market,categoryorder,articleorder,url,description,text,image,error,sentiment,firstEyes
,,2026-01-10 22:05:56+00:00,Phillips 66: How a Legacy Refiner Is Rebuilding Itself for a Low?Carbon Energy Future,Phillips 66: How a Legacy Refiner Is Rebuilding Itself for a Low?Carbon Energy Future,Not Available,,,,,https://www.ad-hoc-news.de/boerse/news/ueberblick/phillips-66-how-a-legacy-refiner-is-rebuilding-itself-for-a-low-carbon/68476388,"The Energy Problem Phillips 66 Wants to Solve Phillips 66 sits in the crosshairs of the energy transition.
Get all details on Phillips 66 here Inside the Flagship: Phillips 66 The core Phillips 66 offering is a vertically integrated energy and chemicals platform spanning refining, midstream logistics, marketing, and petrochemicals.
In chemicals, the company’s Chevron Phillips Chemical joint venture is a second flagship pillar of the broader Phillips 66 product universe.
The Competition Phillips 66 operates in one of the most competitive spaces in global industry: integrated and downstream energy.
In that sense, the Phillips 66 product platform is both a cash engine and a signaling device.","The Energy Problem Phillips 66 Wants to Solve

Phillips 66 sits in the crosshairs of the energy transition. It is big enough to matter in global fuel and chemicals markets, and exposed enough to be disrupted by electrification, efficiency gains, and aggressive climate policy. The company’s namesake product platform – Phillips 66, encompassing fuels, midstream logistics, chemicals, lubricants and now low?carbon solutions – is being forced to answer a hard question: how do you run a profitable hydrocarbon business while the world is demanding less carbon?

The answer, at least for now, is not to abandon fossil molecules but to upgrade them. Phillips 66 is betting on a mix of high?complexity refining, advantaged logistics, petrochemicals via its Chevron Phillips Chemical (CPChem) joint venture, and an expanding slate of lower?carbon offerings from renewable diesel to carbon capture and hydrogen integration. Instead of a single hero product, Phillips 66 functions more like a platform: a network of assets, technologies and proprietary processes tuned to squeeze out margin and emissions reductions from every barrel and every Btu that passes through its system.

This is not the loud, brand?forward pitch you get from an EV pioneer or a consumer?facing tech giant. It’s infrastructure?level innovation, where winning looks like quiet reliability, steady free cash flow, and decarbonization that is material on a megaton scale. Yet the stakes are huge. For investors in Phillips 66 Aktie and for policymakers trying to keep grids stable while lowering emissions, the way this product platform evolves over the next decade matters a lot.

Get all details on Phillips 66 here

Inside the Flagship: Phillips 66

The core Phillips 66 offering is a vertically integrated energy and chemicals platform spanning refining, midstream logistics, marketing, and petrochemicals. Rather than a single refinery or product line, think of Phillips 66 as a tightly choreographed system: crude and NGLs in, transportation fuels, specialty products and chemicals out, with every node optimized for cost, yield, and increasingly, carbon intensity.

On the conventional side, the Phillips 66 refining portfolio is built around complex, coastal refineries that can process discounted, heavy or opportunity crudes and upgrade them into higher?value products. That complexity is a quiet but powerful feature: coking, hydrocracking, and advanced distillation capacity let Phillips 66 pivot yields between gasoline, diesel, jet fuel, and petrochemical feedstocks based on demand and crack spreads. The company has been divesting lower?margin inland refineries and doubling down on sites with export access and integration with chemicals and midstream assets.

A standout example of this evolution is the Rodeo facility in California, which Phillips 66 is converting from a traditional oil refinery into one of the world’s largest renewable fuels plants. Once fully ramped, Rodeo Renewed is designed to produce renewable diesel and sustainable aviation fuel (SAF) from feedstocks such as used cooking oil, animal fats, and other wastes. That’s not just a feel?good story; it’s a technical flex that combines hydrotreating expertise, hydrogen management, and feedstock optimization into a commercial?scale low?carbon product line that taps into lucrative California and federal credit markets.

In chemicals, the company’s Chevron Phillips Chemical joint venture is a second flagship pillar of the broader Phillips 66 product universe. CPChem is a major global producer of polyethylene, specialty chemicals and petrochemical intermediates. Its current and planned projects in the U.S. Gulf Coast and Middle East are designed to leverage cheap natural gas liquids and export access to high?growth markets in Asia and beyond. This is the less visible but strategically crucial piece of the business, converting hydrocarbons into long?lived materials rather than fuels burned in an engine.

Layered on top of this industrial backbone is a suite of performance products and services under the Phillips 66, 76 and Kendall brands: branded transportation fuels, high?spec engine oils, industrial lubricants and specialty products. These offerings target both retail motorists and commercial and industrial customers, where performance claims (engine protection, extended drain intervals, fuel efficiency) translate directly into customer stickiness and margin.

Increasingly, the Phillips 66 product story includes low?carbon solutions. Beyond renewable diesel and SAF, the company is piloting and evaluating carbon capture, utilization, and storage (CCUS) at refinery and chemicals facilities; exploring hydrogen applications for process heat and fuels; and working on ways to lower the lifecycle emissions of its existing fuels and petrochemical products. None of these individually define the brand yet, but together they show a direction: decarbonize the barrel you have while preparing for a world that needs more molecules with fewer emissions.

Market Rivals: Phillips 66 Aktie vs. The Competition

Phillips 66 operates in one of the most competitive spaces in global industry: integrated and downstream energy. Its closest peers are U.S. and global refiners that are also trying to refit fossil?heavy product portfolios for a carbon?constrained world. Compared directly to Valero Energy’s refining and renewable diesel platform, Marathon Petroleum’s refining and MPLX midstream business, and the more globally diversified model of BP’s downstream and convenience business, the Phillips 66 product stack looks distinct in a few important ways.

Valero Energy’s flagship rivalry product is its highly optimized Gulf Coast refining network and the Diamond Green Diesel joint venture, which has become one of the world’s largest renewable diesel producers. Valero’s pitch is simple and sharp: scale, cost discipline, and aggressive capital allocation into high?return renewable diesel projects. Where Phillips 66 leans into integration with chemicals and logistics, Valero leans into pure?play refining leverage with a growing green fuels segment.

Marathon Petroleum, meanwhile, has turned its product platform into a refining?plus?midstream machine built around its MPLX partnership. After divesting Speedway, Marathon has focused on refinery optimization and midstream cash generation. Its renewable diesel product line, including the Martinez Renewable Fuels project in California, competes head?to?head with Phillips 66’s Rodeo Renewed in the West Coast low?carbon fuels market.

Then there is BP’s downstream and convenience operation, anchored by its Castrol lubricants and a global fuels marketing business. Compared directly to BP’s convenience & mobility product ecosystem – which spans retail stations, EV charging, premium fuels and lubricants – Phillips 66’s portfolio skews more industrial and North America?heavy. BP aims to turn forecourt real estate into a decarbonized mobility hub, while Phillips 66 is more focused on squeezing value from its refining, midstream, and chemicals platforms and selectively expanding lower?carbon fuels.

On the chemicals front, Chevron Phillips Chemical (part of the Phillips 66 universe) goes up against behemoths like ExxonMobil Chemical, Dow, and LyondellBasell. Compared directly to ExxonMobil’s performance polymers and chemical solutions product line, CPChem’s growth projects are more targeted and partnership?driven, emphasizing advantaged feedstock positions in the U.S. and the Middle East. The rivalry here is less about brand and more about who can bring on world?scale crackers and polyethylene plants at the lowest cost and with the most resilient demand profile.

Where Phillips 66 arguably concedes ground is in brand visibility to end consumers. BP and Shell can wrap their downstream products in a green narrative at the retail pump and on EV chargers. Valero and Marathon command outsized market share in key U.S. regions. Phillips 66, by contrast, often flies under the radar outside its core branded fuel regions, even as it quietly executes on projects that materially reshape its emissions and earning power.

The Competitive Edge: Why it Wins

The core competitive edge of Phillips 66 is not a single breakthrough technology but the way its refining, midstream and chemicals assets are stitched together into a high?optionality product platform. In practice, that translates into a few structural advantages.

1. Integration with chemicals, not just fuels. Unlike pure?play refiners, Phillips 66 has a major stake in petrochemicals through Chevron Phillips Chemical. That means a larger share of its hydrocarbon molecules can end up in long?lived plastics and specialty chemicals rather than short?cycle fuels. In an energy transition world, that matters: fuels volumes will face structural headwinds from EVs and efficiency, while demand for many plastics and chemical intermediates continues to grow, especially in emerging markets.

2. High?complexity coastal refineries with export optionality. Phillips 66 has been pruning its refinery portfolio to emphasize complex coastal sites tied into product export lanes and petrochemical feedstock markets. That gives the company a crucial edge in product placement: it can swing barrels to higher?margin regions and adjust yields quickly as global product balances shift. In a volatile macro and regulatory environment, that flexibility is a profit multiplier.

3. Real, not rhetorical, low?carbon products. While nearly every energy major talks about net zero, fewer have deployed significant capital into commercially scaled low?carbon products that leverage their existing process knowledge. Renewable diesel and SAF at Rodeo Renewed, alongside co?processing and efficiency upgrades at other sites, give Phillips 66 a tangible entry into low?carbon liquids. These products can command premium pricing, ride policy tailwinds, and extend the life of downstream infrastructure even as carbon constraints tighten.

4. Disciplined capital and portfolio management. The company has been actively selling non?core or underperforming assets and recycling capital into higher?return projects in midstream, renewable fuels, and CPChem expansions. That helps keep the product portfolio skewed toward assets that can earn through the cycle and support shareholder returns. In a sector often criticized for value?destructive capex, that discipline is itself a competitive feature.

5. Industrial?grade resilience. Phillips 66’s product universe is built around logistics resilience: pipelines, terminals, export docks, and storage. This backbone may not be glamorous, but it keeps fuels and feedstocks flowing during disruptions and enables arbitrage across basins. As climate?related extreme weather and geopolitical shocks become more frequent, this resilience becomes a sellable attribute to customers, regulators, and investors.

Put together, these factors give Phillips 66 a nuanced but powerful USP: it is one of the few large?scale energy companies capable of generating strong free cash flow from hydrocarbons today while methodically bending the emissions curve of those same products and pivoting more barrels into chemicals and low?carbon fuels over time.

Impact on Valuation and Stock

For investors in Phillips 66 Aktie (ISIN US7185461040), the performance of this product platform is not an abstract story; it feeds directly into earnings, cash returns, and how the market values the company relative to peers.

Using live market data as of the latest trading session, Phillips 66 shares trade in a range that reflects both its cyclical refining exposure and growing confidence in its transition strategy. According to real?time quotes from major financial sources including Yahoo Finance and MarketWatch, the stock’s most recently available price data show that the company is solidly in large?cap territory, with a market capitalization in the tens of billions of dollars and a valuation multiple that typically sits at a discount to the broader market but broadly in line with U.S. downstream peers. Where markets have rewarded Phillips 66 lately is in its ability to convert elevated refining margins and strong CPChem contributions into robust free cash flow, which is being directed toward dividends, share buybacks, and selective growth projects like Rodeo Renewed.

Crucially, the success of specific product initiatives is beginning to show up in analyst models. Renewable diesel and SAF volumes at Rodeo Renewed and Martinez?style peers are increasingly baked into long?term margin forecasts. CPChem’s global growth projects, particularly in the U.S. Gulf Coast and Middle East, provide visibility into non?refining earnings power. Midstream and logistics assets, once seen primarily as supporting infrastructure, are valued more like cash?generating toll roads that stabilize earnings when refining cycles turn down.

Markets also track Phillips 66’s decarbonization metrics and capital allocation closely. Demonstrable emissions reductions per barrel, growing low?carbon product volumes, and credible CCUS and hydrogen pathways reduce perceived transition risk. That, in turn, can compress the discount rate investors apply to future cash flows, supporting a stronger equity multiple than a pure?play, no?transition refiner might command.

In that sense, the Phillips 66 product platform is both a cash engine and a signaling device. Each incremental renewable diesel project, each chemicals expansion, each efficiency gain in refining and midstream sends a message that this is not a business planning to run in place until demand disappears. For Phillips 66 Aktie, that evolving narrative – from traditional refiner to integrated, lower?carbon energy and chemicals platform – is a key driver of how the stock is priced against rivals like Valero, Marathon Petroleum, and the downstream arms of the supermajors.

The transition will not be smooth, and the macro backdrop for fuels and chemicals will remain volatile. But if Phillips 66 can keep proving that its product upgrades and portfolio shifts translate into durable margins and lower carbon intensity, its stock will be less a hostage to the next down?cycle and more a geared play on a pragmatic, molecule?centric energy transition.",https://mdb.ad-hoc-news.de/bilder/bild-2405029_600_800.jpg,N,,2026-01-10 17:56:42.662936
,,2026-01-10 20:05:09+00:00,Leeham News and Analysis,Cascadia Sustainable Aviation Accelerator (CSAA) Archives - Leeham News and Analysis,Scott Hamilton,,,,,https://leehamnews.com/tag/cascadia-sustainable-aviation-accelerator-csaa/,"WE USE COOKIES ON THIS SITE.
This website, or its third party tools, use cookies to enhance your browsing experience.
By using this site you agree to this use of cookies.
Learn More About Privacy Policy","WE USE COOKIES ON THIS SITE.

This website, or its third party tools, use cookies to enhance your browsing experience. By using this site you agree to this use of cookies. Learn More About Privacy Policy",https://leehamnews.com/favicon-32x32.png?v=M4mdbyQzjm,N,,2026-01-10 16:12:21.603511
,,2026-01-10 19:15:51+00:00,theskysters.com,SkyNRG Secures environmental clearances for Wallula Sustainable Aviation Fuel facility,Not Available,,,,,https://theskysters.com/2026/01/skynrg-secures-environmental-clearances-for-wallula-sustainable-aviation-fuel-facility-bioenergy-times/,SkyNRG Secures environmental clearances for Wallula Sustainable Aviation Fuel facility  BioEnergy Times,Not Available,https://theskysters.com/wp-content/uploads/2025/04/cropped-saaslauncher-2-32x32.png,N,,2026-01-10 16:12:27.279769
,,2026-01-10 18:12:49+00:00,650 CKOM,"U.S. corn profit margins for 2026 crop? In a word, ugly | 650 CKOM",RealAgriculture News Team,,,,,https://www.ckom.com/2026/01/10/u-s-corn-profit-margins-for-2026-crop-in-a-word-ugly/,"As corn producers head into another growing season, economic headwinds are intensifying — not from just one direction, but from both sides of the balance sheet.
While production costs remain stubbornly high, corn prices have sharply declined, squeezing farm margins and prompting a push for long-term demand growth.
Krista Swanson, chief economist with the U.S. National Corn Growers Association (NCGA), outlined the association’s upcoming Q1 economic outlook and what it signals for U.S. corn producers.
Beyond costs, Swanson is focused on the demand side, where new market opportunities could change the trajectory.
As producers weigh planting decisions for 2026, the high cost of corn production versus soybeans looms large.","This story was first published on RealAgriculture.com on Jan. 8, 2026.

As corn producers head into another growing season, economic headwinds are intensifying — not from just one direction, but from both sides of the balance sheet.

While production costs remain stubbornly high, corn prices have sharply declined, squeezing farm margins and prompting a push for long-term demand growth.

Krista Swanson, chief economist with the U.S. National Corn Growers Association (NCGA), outlined the association’s upcoming Q1 economic outlook and what it signals for U.S. corn producers.

“Costs have been a huge focus of ours over the past six months,” she says, pointing to a plateau in production expenses that has held since 2022.

While some minor easing has occurred, the USDA projects the cost to grow an acre of corn will average $917 in 2026 — only 1 per cent lower than 2022 levels.

“Meanwhile, the market-year average price for corn is expected to be 37 per cent lower than 2022,” she adds.

Swanson noted fertilizer makes up about a third of operating costs and draws much attention, but increases in seed, pesticides, land, and machinery are also significant.

From an economist’s perspective, she warned that continued government payments, such as the USDA’s recent $44/acre “bridge” program, may also inadvertently contribute to price rigidity for those same inputs.

Beyond costs, Swanson is focused on the demand side, where new market opportunities could change the trajectory.

While year-round E15 ethanol remains a top short-term goal, she says longer-term strategies are being developed.

“Ethanol isn’t just a motor fuel … there are opportunities in maritime fuels, sustainable aviation fuel, and bioproducts,” she explained.

Diversification is another bright spot. Roughly 40 per cent of U.S. corn exports go to Mexico, but Swanson says the broader export pie is well-divided, with markets like Japan, Colombia, and South Korea contributing to feed and fuel demand.

As producers weigh planting decisions for 2026, the high cost of corn production versus soybeans looms large.

Still, futures price ratios and farmer preferences continue to favour corn. Whether that holds, Swanson says, will be a key trend to watch as the new crop year unfolds.",https://media-cdn.socastsrm.com/wordpress/wp-content/blogs.dir/648/files/2025/09/corn-stock-9725.jpg,N,,2026-01-10 13:57:20.677289
,,2026-01-10 18:09:48+00:00,Fokus Borneo,"BPDP Dukung Hilirisasi Sawit Kaltara, Muhammad Khoiruddin Tekankan Pentingnya ...",Redaksi,,,,,https://fokusborneo.com/daerah/2026/01/10/bpdp-dukung-hilirisasi-sawit-kaltara-muhammad-khoiruddin-tekankan-pentingnya-kemandirian-petani-melalui-umkm/,"​​Ketua Dewan Pimpinan Wilayah (DPW) APKASINDO Kaltara, Muhammad Khoiruddin, menekankan dukungan BPDP adalah momentum emas bagi petani sawit Kaltara untuk berhenti menjadi “penonton” di tanah sendiri.
​”Kami di DPW APKASINDO Kaltara melihat bahwa selama ini petani kita terlalu bergantung pada fluktuasi harga TBS (Tandan Buah Segar).
Kita ingin di masa depan, ada merek minyak goreng lokal atau pupuk organik hasil limbah sawit asli produksi petani Kaltara yang beredar di pasar.
​​Melalui sinergi antara BPDP, pemerintah daerah, dan APKASINDO, workshop ini diharapkan mampu menciptakan jejaring kerja yang kuat.
Dengan penguasaan teknologi pengolahan limbah dan minyak, petani sawit Kaltara diharapkan dapat meningkatkan pendapatan mereka sekaligus mendukung posisi Indonesia sebagai pemimpin industri sawit global yang ramah lingkungan.","​TARAKAN, Fokusborneo.com – Dukungan Badan Pengelola Dana Perkebunan (BPDP) unit di bawah Kementerian Keuangan yang mengelola dana perkebun terhadap sektor hilir, kembali nyata dirasakan di Bumi Benuanta.

Melalui kemitraan strategis, BPDP menyokong penuh gelaran Workshop Pengolahan Minyak dan Limbah Kelapa Sawit bagi UMKM yang dilaksanakan di Ballroom Hotel Lotus Panaya, Jumat (9/1/26).

​Kegiatan ini dihadiri jajaran petinggi daerah, termasuk Kepala Dinas Pertanian dan Ketahanan Pangan Kaltara, Ir. Heri Rudiyono, M.Si, serta Kepala Disperindagkop UKM Kaltara, Dr. Hj. Hasriyani, SH., MM, bersama puluhan petani dan pelaku usaha kecil dari berbagai kabupaten/kota.

​​Ketua Dewan Pimpinan Wilayah (DPW) APKASINDO Kaltara, Muhammad Khoiruddin, menekankan dukungan BPDP adalah momentum emas bagi petani sawit Kaltara untuk berhenti menjadi “penonton” di tanah sendiri.

​”Kami di DPW APKASINDO Kaltara melihat bahwa selama ini petani kita terlalu bergantung pada fluktuasi harga TBS (Tandan Buah Segar). Dengan dukungan BPDPKS dalam workshop ini, kita ingin mengubah pola pikir itu. Petani harus mulai melirik potensi hilirisasi. Jangan hanya menjual buah mentah, kita harus mampu mengolahnya menjadi minyak goreng atau produk turunan lainnya dalam skala UMKM,” tegas Khoiruddin.

​Ia juga menambahkan Kaltara memiliki potensi CPO dan PKO yang sangat melimpah, namun belum tergarap maksimal oleh tangan-tangan lokal.

​”Masalah utama kita adalah teknologi dan pengetahuan. Lewat workshop ini, kami ingin memastikan UMKM di Kaltara punya daya saing. Kita ingin di masa depan, ada merek minyak goreng lokal atau pupuk organik hasil limbah sawit asli produksi petani Kaltara yang beredar di pasar. Ini bukan sekadar pelatihan, ini adalah langkah menuju kedaulatan ekonomi petani sawit,” imbuhnya.

Senada dengan hal tersebut, Sekretaris Jenderal (Sekjen) DPP APKASINDO, Dr. Rino Afrino, ST., MM., C.APO, memberikan wawasan mengenai nilai ekonomi dari limbah yang selama ini terbuang.

​”Dunia internasional kini mencari minyak jelantah atau limbah sawit untuk diolah menjadi Sustainable Aviation Fuel (SAF) atau bahan bakar pesawat. Jadi, tidak ada yang terbuang. Semua proses dari TBS hingga limbah memiliki peluang ekonomi yang berlipat ganda jika kita menguasai teknologinya,” jelas Dr. Rino.

​Workshop yang didukung BPDP ini memiliki sembilan target utama guna memperkuat ekosistem sawit rakyat, di antaranya meningkatkan keterampilan teknis mengolah sawit menjadi produk bernilai tambah seperti kosmetik dan farmasi. Merumuskan pembangunan pabrik pupuk organik skala UMKM dari limbah sawit untuk menekan biaya produksi kebun.

Selain itu, membantu UMKM menciptakan produk inovatif yang sesuai dengan standar keberlanjutan (sustainability) agar mampu menembus pasar internasional.

​​Melalui sinergi antara BPDP, pemerintah daerah, dan APKASINDO, workshop ini diharapkan mampu menciptakan jejaring kerja yang kuat.

Dengan penguasaan teknologi pengolahan limbah dan minyak, petani sawit Kaltara diharapkan dapat meningkatkan pendapatan mereka sekaligus mendukung posisi Indonesia sebagai pemimpin industri sawit global yang ramah lingkungan.(*/mt)",https://fokusborneo.com/wp-content/uploads/2026/01/IMG_20260110_101216_650_x_639_piksel.jpg,N,,2026-01-10 15:56:34.641627
