id,name,published,outlet,title,authors,category,market,categoryorder,articleorder,url,description,text,image,error,sentiment,firstEyes
,,2026-01-08 20:22:37+00:00,"Alaska Airlines, Hawaiian Airlines and Horizon Air",Washington leaders launch Cascadia Sustainable Aviation Accelerator - Alaska Airlines,Alaska Airlines,,,,,https://news.alaskaair.com/sustainability/washington-leaders-launch-cascadia-sustainable-aviation-accelerator/,"Washington State leaders, aviation industry partners, research institutions, Tribal representatives and sustainability advocates today launched the Cascadia Sustainable Aviation Accelerator (CSAA).
Announced at the Boeing Future of Flight, the initiative is the most comprehensive and well-funded across the region of its kind to accelerate the production, deployment and adoption of sustainable aviation fuel (SAF).
In partnership with the Washington State Department of Commerce, CSAA is a non-profit organization dedicated to advancing the renewable fuels industry in the Pacific Northwest.
The panel focused on investment pathways, workforce development and the economic opportunity presented by large scale sustainable aviation fuel production.
About Alaska Air Group Alaska Airlines, Hawaiian Airlines and Horizon Air are subsidiaries of Alaska Air Group, and McGee Air Services is a subsidiary of Alaska Airlines.","Washington State leaders, aviation industry partners, research institutions, Tribal representatives and sustainability advocates today launched the Cascadia Sustainable Aviation Accelerator (CSAA). Announced at the Boeing Future of Flight, the initiative is the most comprehensive and well-funded across the region of its kind to accelerate the production, deployment and adoption of sustainable aviation fuel (SAF).

Funded through a 2025 State of Washington appropriation and private philanthropic donation of an additional $10 million, the CSAA positions the Pacific Northwest as a global leader in an accelerated transition to sustainable aviation fuel while capitalizing on the once-in-a-generation economic opportunity of scaling local SAF production. In partnership with the Washington State Department of Commerce, CSAA is a non-profit organization dedicated to advancing the renewable fuels industry in the Pacific Northwest.

The Cascadia region has been a trailblazer in aerospace innovation for over a century, and today it is uniquely positioned as a global center of aviation innovation, with an opportunity to unlock the next generation of sustainable fuel. With access to local, low carbon feedstocks, affordable clean energy, established infrastructure and a skilled workforce, the region has all the elements necessary to support production of up to one billion gallons of sustainable aviation fuel by 2035. Scaling production at this level would drive economic prosperity and development, strengthen regional energy security and independence, support state and regional climate initiatives and build on Cascadia’s long legacy as an aviation innovator.

The global aviation industry, which generates some $4.1 trillion in economic activity and supports 86.5 million jobs, currently accounts for approximately 2-3% of global carbon dioxide emissions, in addition to other environmental impacts. SAF is a safe, effective drop-in solution projected to be used for the next 70-plus years that can reduce emissions by 80% compared to fossil-based fuels and the transition to a thriving circular economy through locally produced SAF.

The Jan. 8 launch event featured remarks from leaders across the aviation, research and public sectors. Executives from Alaska Airlines and Hawaiian Airlines and Boeing spoke to the importance of aligning the full ecosystem of manufacturers and operators, policy, research, financing and public awareness to scale sustainable aviation fuel and secure the long-term future of aviation. Representative Mia Gregerson highlighted the need to center sustainability and airport communities as the industry transitions to cleaner fuels. Washington State University President Elizabeth Cantwell underscored the role of research and innovation in advancing sustainable aviation fuel from the lab to commercial deployment, while Washington State Department of Commerce Director Joe Nguyễn addressed the state’s investments in clean energy, economic development and partnerships with Tribal nations.

The event also hosted a panel discussion moderated by Tim Zenk, a sustainable aviation fuel expert at Earth Finance, featuring executives Guy Palumbo at Amazon; Andy Billig, board member at SkyNRG; labor leader Jon Holden, Machinists Union, District 751; and Port of Seattle Executive Director Steve Metruck. The panel focused on investment pathways, workforce development and the economic opportunity presented by large scale sustainable aviation fuel production.

About Alaska Air Group

Alaska Airlines, Hawaiian Airlines and Horizon Air are subsidiaries of Alaska Air Group, and McGee Air Services is a subsidiary of Alaska Airlines. We are a global airline with hubs in Seattle, Honolulu, Portland, Anchorage, Los Angeles, San Diego and San Francisco. We deliver remarkable care as we fly our guests to more than 140 destinations throughout North America, Latin America, Asia and the Pacific. We’ll serve Europe beginning in spring 2026. Guests can book travel at alaskaair.com and hawaiianairlines.com. Alaska is a member of the oneworld alliance, with Hawaiian scheduled to join oneworld in spring 2026. With oneworld and our additional global partners, guests can earn and redeem points for travel to over 1,000 worldwide destinations with Atmos Rewards. Learn more about what’s happening at Alaska and Hawaiian at news.alaskaair.com. Alaska Air Group is traded on the New York Stock Exchange (NYSE) as “ALK.”",https://news.alaskaair.com/wp-content/uploads/2024/12/20241218_as_sea_ramp0179.jpg?w=1000&h=667&crop=1,N,,2026-01-08 15:56:57.546665
,,2026-01-08 19:12:03+00:00,www.facebook.com,"HAPPENING NOW: WA Gov. Ferguson, Regional Aviation and Innovation Leaders Launch ...",Not Available,,,,,https://www.facebook.com/LynnwoodTimes/videos/happening-now-wa-gov-ferguson-regional-aviation-and-innovation-leaders-launch-ca/1397367875191347/,"🚨HAPPENING NOW: WA Gov. Ferguson, Regional Aviation and Innovation Leaders Launch Cascadia Sustainable Aviation Accelerator
 
Washington state leaders...",Not Available,https://scontent-iad3-2.xx.fbcdn.net/v/t15.5256-10/611638060_1295130482377158_6179651257880091264_n.jpg?_nc_cat=105&ccb=1-7&_nc_sid=a27664&_nc_ohc=NrO00pYqH1IQ7kNvwFrJ6w_&_nc_oc=AdnA6Vuo5lV7y1Na9k42YsUJKrrcsUS_biOWRT7ngVbEweF7pJEJpT9acPWgnjQfBCYtk6sSzBC9Goa-4PwK6AJ2&_nc_zt=23&_nc_ht=scontent-iad3-2.xx&_nc_gid=Ffcl-Odtw6u7hA6UidabEQ&oh=00_AfoUgNcQeB1kX2jQUpaxo-sEZHVsV3i6u2nU3MqZS6389A&oe=6965FE19,N,,2026-01-08 17:12:13.090840
,,2026-01-08 19:07:30+00:00,blog.gettransport.com,How JETEX's Investment in Azzera Advances Sustainable Aviation and Carbon Management - Blog,Not Available,,,,,https://blog.gettransport.com/news/jetex-azzera-sustainability-aviation/,... Sustainable Aviation Fuel (SAF) and innovative digital tools to monitor and reduce carbon footprints. Strategic Investment for a Cleaner Flight ...,Not Available,,N,,2026-01-08 17:59:08.183066
,,2026-01-08 19:07:29+00:00,The Business Times,China Aviation Oil confirms Sinopec merger with parent CNAF - The Business Times,Evan See,,,,,https://www.businesstimes.com.sg/companies-markets/china-aviation-oil-confirms-sinopec-merger-parent-cnaf,"[SINGAPORE] The parent company of China Aviation Oil (CAO) will merge with Chinese state-owned oil and gas enterprise Sinopec, the board of CAO said in a bourse filing on Thursday (Jan 8).
Word of the merger initiated by Beijing first emerged in November 2025, involving CAO’s parent China National Aviation Fuel (CNAF) and Sinopec – also known as China Petrochemical.
The Fortune 500 firm’s Singapore interests include petrochemical trading, marine bunkering operations and the sale of refined and chemical products.
Sinopec is expected to absorb all of CNAF’s assets and operations if the merger goes through, Bloomberg reported, quoting a source.
It is the largest physical jet fuel buyer in the Asia-Pacific and the key importer of such fuel into China.","[SINGAPORE] The parent company of China Aviation Oil (CAO) will merge with Chinese state-owned oil and gas enterprise Sinopec, the board of CAO said in a bourse filing on Thursday (Jan 8).

Word of the merger initiated by Beijing first emerged in November 2025, involving CAO’s parent China National Aviation Fuel (CNAF) and Sinopec – also known as China Petrochemical.

CAO said that following deliberation by the State-owned Assets Supervision and Administration Council, an institution under the State Council of China, the two companies would proceed with the “corporate restructuring”.

It added that the restructuring remains subject to further approvals and filing procedures in accordance with applicable regulations.

Sinopec is China’s biggest oil and petrochemical products supplier. The company is also the largest refining company and the second-largest chemical company in the world. The Fortune 500 firm’s Singapore interests include petrochemical trading, marine bunkering operations and the sale of refined and chemical products. It also operates petrol stations in Yishun and Bukit Timah.

Sinopec is expected to absorb all of CNAF’s assets and operations if the merger goes through, Bloomberg reported, quoting a source.

CNAF owns 51 per cent of CAO, and, on occasion, balances domestic supplies by importing or exporting cargoes via trading arms such as the company.

The core business of CAO is in jet fuel supply and trading. It is the largest physical jet fuel buyer in the Asia-Pacific and the key importer of such fuel into China.

China is one of the world’s biggest civil aviation markets. Demand for air travel has rebounded sharply since the end of the pandemic, with flights returning to the skies.

The country is expected to consume more than 40 million tonnes of jet fuel this year, or close to a million barrels a day – valued at about US$30 billion at prevailing prices.

Following the news of the merger last November, shares of CAO whipsawed as the counter surged by as much as 4.5 per cent, and then closed 1.3 per cent lower.

Shares of CAO closed flat at S$1.65 on Thursday, before the announcement.",https://cassette.sphdigital.com.sg/image/businesstimes/4bd175063457d99ec89d553518ef8e3441d541e79beb989a8735bc2389cf3daf?w=1200&f=webp,N,,2026-01-08 14:57:40.088404
,,2026-01-08 18:13:30+00:00,AGN,Study: Scrapping business class seats could cut airline emissions - Aerospace Global News,Chloe Greenbank,,,,,https://aerospaceglobalnews.com/news/scrap-business-class-seats-cut-airline-emissions/,"Subscribe Research from Sweden’s Linnaeus University suggests that operating near-full, economy-only seating, combined with efficient airframes, could halve CO2 emissions.
Frequently described as one of the most carbon-intensive activities, aviation accounts for 2.5% of global CO2 emissions, but has contributed around 4% to global warming to date.
Airline efficiency could halve aviation CO2 emissions In the study published by Communications Earth & Environment, researchers highlight that policymakers, airlines and other stakeholders need to think beyond alternative fuels and new technologies to reduce aviation’s CO2 emissions.
The theoretical 50% reduction is possible with all-economy layouts on the most efficient aircraft and 95% load factors.
Real-world challenges and trade-offs While the report’s theoretical reduction in CO2 emissions is compelling, significant practical challenges remain.","Sign up for our newsletter and get our latest content in your inbox.

Subscribe

Research from Sweden’s Linnaeus University suggests that operating near-full, economy-only seating, combined with efficient airframes, could halve CO2 emissions.

Frequently described as one of the most carbon-intensive activities, aviation accounts for 2.5% of global CO2 emissions, but has contributed around 4% to global warming to date.

Commercial airlines burned the equivalent of 892-936 million tonnes of CO2 in 2019, and without intervention, this figure is projected to rise as air travel demand grows.

Airline efficiency could halve aviation CO2 emissions

In the study published by Communications Earth & Environment, researchers highlight that policymakers, airlines and other stakeholders need to think beyond alternative fuels and new technologies to reduce aviation’s CO2 emissions. They should also rethink how aircraft are configured and operated.

The report led by Prof. Stefan Gössling at Linnaeus University found that operating flights with only economy-class seating on efficient aircraft with optimum load factors could theoretically reduce commercial aviation’s CO2 emissions by nearly 50% compared with current practices.

Commenting on the study, Gössling said: “We found that at least 50% (and up to 75%) of current fuel use could be avoided if airlines were forced to operate at maximum efficiency, while still transporting the same number of passengers over the same distances.”

He also argued that while much of the focus to reduce CO2 emissions has been on sustainable fuels, producing SAF is an expensive and uncertain process with a “significant business risk.” Instead, “It is far more prudent to reduce fuel use,” he said.

Carbon-intensive city pairs and airports

Gössling and his fellow researchers analysed data on 27.5 million flights between 26,156 city pairs in 2023 to understand the variations in CO2 emissions per passenger. The results showed that efficiency differs by region.

Flights departing from airports in the US, Australia and parts of Africa were found to be the most polluting. Atlanta and New York were among the airports with the least efficient flights overall. The study also found that the US – the largest emitting country in the world – had over 14% more polluting flights than the global average.

Airports in India, Brazil and Southeast Asia were primarily served by less polluting flights.

Typically, larger airports have a higher efficiency averaged across arriving and departing flights, while smaller airports that often serve less busy flights have a lower efficiency rating.

Crucially, the report highlighted that operating all routes at their demonstrated optimum could cut emissions by 10.7%. The theoretical 50% reduction is possible with all-economy layouts on the most efficient aircraft and 95% load factors.

Key efficiency measures for reducing CO2 emissions of airlines

Phasing out inefficient aircraft models (27% to 34% efficiency gain)

(Plus) removing premium-class seating (total 46% to 71% efficiency gain)

(Plus) increasing load factors (55% to 76% efficiency gain)

Why economy-only seating matters for airline carbon emissions

While factors influencing fuel consumption and the wider adoption of sustainable aviation fuels (SAF) are well documented, variations in operational efficiency across global markets have received far less attention.

In response, the Linnaeus University study explores not only the total fuel burned but also how that fuel translates into emissions per revenue passenger-kilometre (RPK) – or the amount of CO2 emitted to carry one paying passenger per km.

Researchers also found that modern aircraft vary widely in their CO2 intensity. The most efficient route (31.6g CO2/RPK) was from Milan in Italy to Incheon Airport in South Korea, while the least efficient (888.3g CO2/ RPK) was between two destinations – Kavieng and Tokua Laukunai, in Papua New Guinea.

It’s no great surprise that newer, lighter and more aerodynamic aircraft will burn significantly less fuel per passenger than their older counterparts. However, the seating layout and passenger load matter because emissions are spread over more people.

Premium seating takes up more space per passenger but generates roughly the same emissions as economy seats for the same flight distance. Configuring an aircraft with all-economy layouts increases the number of seats filled and spreads the emissions more thinly.

The International Air Transportation Association (IATA) reiterates this. It suggests that business and first-class seats are up to five times more CO2-intensive than economy class seats.

The report also highlighted that beyond seating, procedural and more efficient routing also contribute to additional gains. When implemented at scale across airline networks and regions, it’s this ecosystem of operational improvements combined that underpins the theoretical halving of emissions.

Real-world challenges and trade-offs

While the report’s theoretical reduction in CO2 emissions is compelling, significant practical challenges remain.

Passenger preferences continue to influence both seating choices and airline selection. Many travellers value the space, comfort and discretion offered in premium cabins. There is also the risk that previously premium passengers will switch to business jets, which would only further increase the global emissions per passenger-kilometre.

For airlines, these higher-yield products are also integral to commercial strategies, subsidising economy fares and supporting route viability.

What’s more, achieving 95% load factors or at least close to it and all-economy configurations could require policy incentives or restrictions, as well as higher chargers.

Gossling argues that “while strong resistance can be expected, the trade-off is essentially a temporary reduction in personal comfort for a minority of passengers in exchange for avoiding around half a gigatonne of CO2 emissions (in addition to non-CO2 effects).” In fuel terms, this would be equivalent to eliminating the need for approximately 150Mt of SAF.”

Ultimately, the study underlines that meaningful CO2 emission reductions do not rely solely on innovative fuel technology and new aircraft. Changes in how aircraft are configured and operated could also deliver substantial gains. It also reinforces that emissions per passenger are shaped as much by how we fly as what we fly.

Featured image: British Airways",https://aerospaceglobalnews.com/wp-content/uploads/2025/07/British-Airways-passenger-in-business-class.jpeg,N,,2026-01-08 13:57:35.129924
,,2026-01-08 17:51:03+00:00,FatHopes Energy Newsroom,From Zero to a Circular Ecosystem - FatHopes Energy,"superadmin, www.fathopesenergy.com",,,,,https://www.fathopesenergy.com/blog/zero-to-circular-ecosystem/,"People see the ecosystem today — the app, the fleet, the regional network.
What they don’t see is the decade where no one cared about used cooking oil.
We built everything from zero: 🚚 Our own fleet 🔧 Our own systems 🏬 Our own collection network 🔄 A circular model before “circular economy” became a headline No grants.
Today, households can trade used cooking oil directly through our app — closing the loop from waste to renewable energy.
It’s built.","People see the ecosystem today — the app, the fleet, the regional network.

What they don’t see is the decade where no one cared about used cooking oil.

We built everything from zero:

🚚 Our own fleet

🔧 Our own systems

🏬 Our own collection network

🔄 A circular model before “circular economy” became a headline

No grants. No templates. No shortcuts.

Today, households can trade used cooking oil directly through our app — closing the loop from waste to renewable energy.

A sustainable future isn’t talked into existence. It’s built.

Learn more: FatHopes Energy",https://www.fathopesenergy.com/blog/wp-content/uploads/2026/01/PUX07583-Logo.jpg,N,,2026-01-08 15:11:43.165123
,,2026-01-08 17:11:37+00:00,Eco-Business,Global Sustainable Aviation Fuel Summit 2026 (China) | Events | Asia - Eco-Business,Eco-Business,,,,,https://www.eco-business.com/events/saf-summit-global-sustainable-aviation-fuel-summit-2026-china/register/,"To register for this event please email , stating that you found the event listing on Eco-Business.
View the event details again","To register for this event please email , stating that you found the event listing on Eco-Business. Thanks!

View the event details again",https://eco-business.imgix.net/clients/event_featured_images/1920x10803_1_2sEeIOe.jpg?fit=crop&h=801&ixlib=django-1.2.0&q=85&w=1200,N,,2026-01-08 17:12:18.807662
,,2026-01-08 16:42:52+00:00,www.msn.com,"Norsk e-Fuel, Prime Capital, and RES to develop SAF plant in Sweden - MSN",Not Available,,,,,https://www.msn.com/en-us/money/markets/norsk-e-fuel-prime-capital-and-res-to-develop-saf-plant-in-sweden/ar-AA1z5kSh%3Fapiversion%3Dv2%26domshim%3D1%26noservercache%3D1%26noservertelemetry%3D1%26batchservertelemetry%3D1%26renderwebcomponents%3D1%26wcseo%3D1,"Norway's Norsk e-Fuel, Prime Capital, and renewable energy company RES have teamed up to establish a sustainable aviation fuel (SAF) production ...",Not Available,,N,,2026-01-08 15:12:02.417243
