id,name,published,outlet,title,authors,category,market,categoryorder,articleorder,url,description,text,image,error,sentiment,firstEyes
,,2025-12-16 14:46:33+00:00,Synhelion,SWISS signs long-term offtake agreement for solar jet fuel from Synhelion,Carmen Murer,,,,,https://synhelion.com/news/swiss-signs-long-term-offtake-agreement-for-solar-jet-fuel-from-synhelion,"Zurich, December 16, 2025 Swiss International Air Lines (SWISS) and Swiss cleantech company Synhelion have signed a long-term offtake agreement for sustainable aviation fuel (SAF).
From 2027, SWISS will purchase at least 200 tons of solar jet fuel from Synhelion annually, pioneering the use of this innovative fuel in civil aviation.
The agreement marks an important milestone on the road to more sustainable aviation.
SWISS is the first airline to sign a binding five-year SAF offtake agreement with Synhelion.
Thus, Synhelion directly replaces fossil crude oil with sustainable syncrude, without the need for any adjustments to the existing infrastructure.","Zurich, December 16, 2025

Swiss International Air Lines (SWISS) and Swiss cleantech company Synhelion have signed a long-term offtake agreement for sustainable aviation fuel (SAF). From 2027, SWISS will purchase at least 200 tons of solar jet fuel from Synhelion annually, pioneering the use of this innovative fuel in civil aviation. The agreement marks an important milestone on the road to more sustainable aviation.

SWISS is the first airline to sign a binding five-year SAF offtake agreement with Synhelion. This marks a pioneering step toward defossilizing aviation. From 2027, Synhelion will produce renewable synthetic crude oil, known as “syncrude”, at its first commercial plant. The syncrude will be processed in an existing refinery together with fossil crude oil and refined into certified Jet-A-1 fuel. Thus, Synhelion directly replaces fossil crude oil with sustainable syncrude, without the need for any adjustments to the existing infrastructure. The fuel will be delivered to the airport via the regular logistics chain and fed into the fuel supply system. Synhelion’s synthetic jet fuel is based on renewable energy and sustainable feedstocks.

A strong signal for sustainable aviation

“The partnership with Synhelion is a significant step for SWISS on the path to decarbonizing our flight operations,” says Jens Fehlinger, CEO of SWISS. “Sustainable aviation fuels (SAF) are a core element of our sustainability strategy. The offtake agreement with Synhelion sends a strong signal for innovation and responsibility in aviation.”

With this offtake agreement, SWISS is actively supporting the scaling of Synhelion’s technology for the production of renewable synthetic fuels as a customer, investor, and strategic partner. This long-term planning certainty enables targeted expansion of production capacity and helps reduce costs over time.

Pioneering partnership

Synhelion also emphasizes the significance of the agreement: “The fact that SWISS, a leading airline, has committed early on to adopt our fuels demonstrates confidence in the market readiness of our technology,” says Philipp Furler, Co-CEO and Co-Founder of Synhelion. “This partnership is a milestone for the commercial market launch of our fuels – and sets a powerful example to other airlines worldwide.”

Expanding the partnership with Kuehne+Nagel

Part of the renewable jet fuel produced by Synhelion will be resold by SWISS to the logistics service provider Kuehne+Nagel. The company will use the sustainable fuel for air freight transportation with Swiss WorldCargo, offering its customers a tangible solution to reduce their carbon footprint in global logistics.

First delivery already completed

In July 2025, SWISS became the first airline in the world to use solar fuel from Synhelion in regular flight operations. Synhelion delivered its first barrel of syncrude from its DAWN plant to a refinery in northern Germany, where the syncrude was processed into certified jet fuel (Jet-A-1) and subsequently fed into the fuel supply system via Hamburg Airport.

For the full English press release, see here.

For the full German press release, see here.

Further information as well as image and video material can be found in our press kit.",https://synhelion.com/media/pages/news/swiss-signs-long-term-offtake-agreement-for-solar-jet-fuel-from-synhelion/7e6b370bb0-1763049392/web-cover-1200x630-crop.jpg,N,,2025-12-16 12:57:35.578021
,,2025-12-16 14:32:14+00:00,The Globe and Mail,Low-Carbon Fuels Sector Experiencing Massive Growth with Overall Revenues Projected to ...,Unknown,,,,,https://www.theglobeandmail.com/investing/markets/stocks/GEVO-Q/pressreleases/36646389/low-carbon-fuels-sector-experiencing-massive-growth-with-overall-revenues-projected-to-exceed-300-billion-by-2030/,Detailed price information for Gevo Inc (GEVO-Q) from The Globe and Mail including charting and trades.,Not Available,https://www.theglobeandmail.com/pf/resources/assets/meta/favicon-32x32.png?d=809,N,,2025-12-16 10:57:25.363534
,,2025-12-16 14:23:26+00:00,Inc,Meet the Company That Can Make Jet Fuel Out of Thin Air - Inc. Magazine,Inc. Video,,,,,https://www.inc.com/inc-video/meet-the-company-that-can-make-jet-fuel-out-of-thin-air/91276570,"A common carbon capture strategy focuses on storing CO2 underground.
The gas is collected from industrial sites and injected deep into rock formations, where it can stay for thousands of years.
Instead of burying CO2, the company converts it into new products.
The company combines carbon from industrial plants with hydrogen inside a reactor and uses metal catalysts to produce a synthetic jet fuel.
Burning this fuel still releases CO2, but the emissions have been recycled rather than sourced from new fossil extraction, which brings the fuel closer to carbon neutral.","A common carbon capture strategy focuses on storing CO2 underground. The gas is collected from industrial sites and injected deep into rock formations, where it can stay for thousands of years. This method prevents emissions from entering the atmosphere but comes with risks, including leaky storage facilities, and a high price tag. Still others sell captured CO2 to oil companies for enhanced oil recovery. A recent report from the Intergovernmental Panel on Climate Change found that carbon capture and storage remains among the least effective and most expensive emissions solutions when compared with renewable energy.

Airco takes a different approach. Instead of burying CO2, the company converts it into new products. It began with small consumer items, such as vodka and perfume, to prove out its chemistry. Today, Airco is focused on sustainable aviation fuel. The company combines carbon from industrial plants with hydrogen inside a reactor and uses metal catalysts to produce a synthetic jet fuel. Burning this fuel still releases CO2, but the emissions have been recycled rather than sourced from new fossil extraction, which brings the fuel closer to carbon neutral.","https://img-cdn.inc.com/image/upload/f_webp,q_auto,c_fit/vip/2025/12/CarbonCapture1-thumb-inc.jpg",N,,2025-12-16 10:57:28.699240
,,2025-12-16 14:19:21+00:00,"Morningstar, Inc.",Low-Carbon Fuels Sector Experiencing Massive Growth with Overall Revenues Projected to ...,Not Available,,,,,https://www.morningstar.com/news/pr-newswire/20251216ln47983/low-carbon-fuels-sector-experiencing-massive-growth-with-overall-revenues-projected-to-exceed-300-billion-by-2030,"The increasing energy demand driven by rapid industrialization and urbanization has further hastened the shift towards renewable energy sources.
This transition has prompted economies to utilize renewable energy sources such as biomass, hydroelectric, and geothermal power.
Looking ahead to 2050, the global SAF market could exceed ~$250 billion.
By 2030, the U.S. SAF market is projected to reach nearly $7 billion, while global demand is expected to exceed 5.5 billion gallons, supporting a global market of more than $25 billion.
Looking ahead to 2050, the global SAF market could exceed $250 billion.","MarketNewsUpdates News Commentary

NEW YORK, Dec. 16, 2025 /PRNewswire/ -- A report from MarketsAndMarkets said that the global sustainable fuel market in terms of revenue was estimated to be worth $193.8 billion in 2024 and is poised to reach $299.9 billion by 2029, growing at a CAGR of 9.1% from 2024 to 2029. Rising concerns about climate change, stringent government regulations to reduce carbon emissions and reduced dependency on fossil fuels are few of the factors accelerating the growth of sustainable fuel market. According to other industry data, the low-carbon fuels market is experiencing massive growth, with the overall sustainable/low-carbon fuel market projected from approximately USD 190-200 Billion (2024/2025) to over $300 Billion by 2029-2030, driven by biofuels and advanced fuels (especially SAF) with CAGRs often above 30-60%. Specific segments like Sustainable Aviation Fuel (SAF) could hit over $350B by 2035, while Carbon Capture (CCS) markets are forecast to reach $50B+ by the 2030s, highlighting significant investment and revenue potential across different low-carbon platforms. The MarketsAndMarkets report continued, saying: ""The sustainable fuel market is expected to witness healthy growth during the review period due to growing demand for energy efficiency and transition towards renewable energy sources. Asia Pacific is expected to be the second largest market during the forecast period. Increasing adoption of alternative fuels to curb carbon emissions is anticipated to offer lucrative opportunities for market players in the next five years."" Active companies in the markets this week include DevvStream Corp. (NASDAQ: DEVS), XCF Global, Inc. (NASDAQ: SAFX), Gevo, Inc. (NASDAQ: GEVO), GE Vernova (NYSE: GEV), Brookfield Renewable Partners L.P. (NYSE: BEP).

MarketsAndMarkets continued: ""Global economies' efforts to diminish their carbon footprint and greenhouse gas emissions have spurred the adoption of clean and sustainable energy alternatives. The increasing energy demand driven by rapid industrialization and urbanization has further hastened the shift towards renewable energy sources. This transition has prompted economies to utilize renewable energy sources such as biomass, hydroelectric, and geothermal power. For instance, vehicles can utilize biofuels like ethanol and biodiesel, derived from renewable biomass sources such as corn, sugarcane, and soybeans. Similarly, hydrogen fuel cells can use green hydrogen, another renewable energy source. According to the International Energy Agency (IEA), biofuels and renewable electricity could reduce oil demand in the transportation sector by nearly 4 million barrels of oil equivalent per day by 2028. This reduction would help to limit the global carbon footprint and greenhouse gas emissions.""

DevvStream (NASDAQ:DEVS), Southern Energy, and XCF Global Announce Plan to Pursue Strategic Collaboration to Build Integrated Low-Carbon Fuels Platform and Advance Multi-Pathway SAF Strategy - MOU outlines plans for the development of a unified commercial platform combining fuel supply, logistics, and environmental-attribute value for aviation and industrial customers - DevvStream Corp. ($DEVS) (""DevvStream""), Southern Energy Renewables Inc. (""Southern""), and XCF Global, Inc. (""XCF"") (Nasdaq: SAFX) today announced a non-binding tripartite memorandum of understanding (""MOU"") to jointly explore the potential development of a next-generation low-carbon fuels platform designed to accelerate sustainable aviation fuel (""SAF"") adoption, expand domestic capacity, and integrate environmental-attribute monetization into a unified customer offering.

By 2030, the U.S. SAF market is projected to reach nearly $7 billion, while global demand is expected to exceed 5.5 billion gallons, with ~4 billion people living in countries that utilize SAF for air transportation, driving the global market past ~$25 billion. Looking ahead to 2050, the global SAF market could exceed ~$250 billion. This collaboration is intended to position the parties with a unified platform that directly supports this long-term growth.

The goal of the collaboration is to increase long-term SAF supply across multiple production pathways, and to advance the transparency and commercialization of environmental attributes. As part of the negotiation of a binding agreement, the parties expect to evaluate the commercial viability of developing a HEFA-based ""Gen 1"" SAF facility in Louisiana alongside Southern's previously announced biomass-based ""Gen 2"" SAF gasification facility.

Potential Unified Commercial Platform & Strategic Integration - The parties intend to negotiate a definitive collaboration agreement which, if executed, would create a collaborative venture that intends to develop a unified commercial platform that enables customers to procure fuel, logistics services, and environmental-attribute value through a single integrated offering. If developed, this structure would be expected to simplify procurement, improve pricing efficiency, and enhance long-term customer retention across the aviation and industrial markets.

Potential Environmental-Attribute Monetization and Digital Infrastructure - A core component of the potential collaboration is expected to be the integration of environmental-attribute capabilities, including voluntary and compliance carbon credits, CORSIA units, renewable energy certificates, digital MRV solutions, and tokenized environmental-attribute tracking systems. Under the MOU, DevvStream is expected to lead the generation, verification, and monetization of environmental assets associated with the potential platform's low-carbon fuels.

The parties plan to work towards jointly evaluating solutions to help customers capture, verify, and monetize environmental attributes, including LCFS credits, RINs, and benefits under 45Z/45Q. The parties also plan to evaluate lifecycle analysis (""LCA"") methodologies and carbon-intensity optimization systems which may strengthen project economics and support high-integrity SAF development.

""This collaboration has the potential to create the foundation for a first-of-its-kind, fully integrated low-carbon fuels platform, linking production, logistics, and environmental-attribute systems into a seamless value chain,"" said Chris Cooper, CEO of XCF. ""If we succeed in combining Southern's developmental stage biomass-to-methanol-to-jet technology, DevvStream's environmental-attribute and digital MRV capabilities, and XCF's HEFA production and commercial infrastructure, we see the potential to build a revolutionary end-to-end system that unlocks new value for customers and potentially accelerate the scaling of SAF in a disciplined, capital-efficient way."" Continued… Read this full release and additional news for DEVS by visiting: https://www.devvstream.com/news/news-releases/

Other recent developments in energy news sectors include:

XCF Global, Inc. (NASDAQ: SAFX); Southern Energy Renewables Inc. (""Southern""); and DevvStream Corp. (NASDAQ: DEVS) (together ""the parties"") recently announced a non-binding tripartite memorandum of understanding (""MOU"") to jointly explore the potential development of a next-generation low-carbon fuels platform designed to accelerate SAF adoption, expand domestic capacity, and integrate environmental-attribute monetization into a unified customer offering.

By 2030, the U.S. SAF market is projected to reach nearly $7 billion, while global demand is expected to exceed 5.5 billion gallons, supporting a global market of more than $25 billion. By that time, approximately 4 billion people are expected to live in countries that utilize SAF for air transportation. Looking ahead to 2050, the global SAF market could exceed $250 billion. This collaboration is intended to position the parties around a unified platform that directly supports this long-term growth.

The collaboration would seek to increase long-term SAF supply across multiple production pathways while advancing the transparency and commercialization of environmental attributes. As part of the negotiation of a binding agreement, the parties expect to evaluate the commercial viability of developing a HEFA-based SAF facility in Louisiana.

Gevo, Inc. (NASDAQ: GEVO), a leader in renewable fuel and chemicals, and carbon management, recently announced a strategic leadership transition designed to position the company for continued growth and innovation. Effective December 9, 2025, Dr. Paul Bloom has been appointed President of Gevo, Inc. and a director on Gevo's Board of Directors. Gevo's long-standing Chief Executive Officer and board member, Dr. Patrick Gruber, has assumed the role of Executive Chair of the Board. Board Chairman William H. Baum has moved into the role of lead independent director. As part of the succession plan, Dr. Gruber will continue as Chief Executive Officer until his retirement on April 1, 2026, at which time Dr. Bloom will succeed Dr. Gruber as Chief Executive Officer.

""I am honored to be leading Gevo into its next phase of critical growth,"" said Dr. Bloom. ""Our team is committed to delivering cost-effective fuels, chemicals, and carbon management solutions that create value for our customers and shareholders. Pat's vision and dedication have established Gevo as a global leader in our industry. My focus will be on increasing profitability from our active businesses while leveraging our technology, business system, and intellectual-property portfolio to accelerate Gevo's growth.""

GE Vernova (NYSE: GEV) recently announced its first onshore wind repower upgrade agreement outside the United States, signing with Taiwan Power Company (TPC) to supply 25 repower upgrade kits in Taiwan. The announcement was made during the B20 South Africa 2025 Summit in Johannesburg. The milestone international contract builds on GE Vernova's track record of repowering over 6,000 wind turbines in the United States, extending that expertise to support Taiwan's decarbonization goals.

Under the agreement, GE Vernova will provide repower upgrade kits to repower 25 GE Vernova 1.5 MW‑70.5m turbines and deliver a five‑year operations and maintenance (O&M) services package. The order was booked in the third quarter of 2025. Initial components are scheduled for delivery in the fourth quarter of 2025, with retrofit installation taking place throughout 2026 and 2027.

Wind repowering enables turbines approaching the end of their designed operational life to be modernized and returned to service with improved reliability and performance. By extending asset life beyond original design life, the project will help TPC continue generating affordable, renewable electricity while maximizing existing infrastructure.

Brookfield Renewable Partners L.P. (NYSE: BEP) recently announced an equity offering of its limited partnership units (""LP Units"") for gross proceeds of US$450 million (the ""Offering"") on a bought deal basis by a syndicate of underwriters (the ""Underwriters"") co-led by RBC Capital Markets, Scotiabank, TD Securities, BMO Capital Markets and CIBC Capital Markets. The LP Units are offered at a price of US$29.90 per LP Unit (the ""Offering Price"").

Concurrently, one or more subsidiaries of Brookfield Corporation will purchase US$200 million of LP Units at the Offering Price (net of underwriting commissions) (the ""Concurrent Private Placement""). ""In addition to the continued growth of our wind and solar business, we continue to see accretive opportunities to invest in essential baseload power generation and grid-stabilizing technologies, including hydro, nuclear, and energy storage. Recently, we increased our stake in a leading South American hydro business, signed a 3-gigawatt hydro framework agreement with Google and entered into a transformational partnership with the U.S. Government that should accelerate deployment of Westinghouse's leading reactor technology in the U.S. and abroad. Today, we see opportunities to accelerate our investment both into baseload power and across our platform, which we expect to drive growth for our business over the long term,"" said Connor Teskey, CEO of Brookfield Renewable. The aggregate gross proceeds of the Offering and the Concurrent Private Placement will be approximately US$650 million.

DISCLAIMER: MarketNewsUpdates.com (MNU) is a third party publisher and news dissemination service provider, which disseminates electronic information through multiple online media channels. MNU is NOT affiliated in any manner with any company mentioned herein. MNU and its affiliated companies are a news dissemination solutions provider and are NOT a registered broker/dealer/analyst/adviser, holds no investment licenses and may NOT sell, offer to sell or offer to buy any security. MNU'S market updates, news alerts and corporate profiles are NOT a solicitation or recommendation to buy, sell or hold securities. The material in this release is intended to be strictly informational and is NEVER to be construed or interpreted as research material. All readers are strongly urged to perform research and due diligence on their own and consult a licensed financial professional before considering any level of investing in stocks. All material included herein is republished content and details which were previously disseminated by the companies mentioned in this release. MNU is not liable for any investment decisions by its readers or subscribers. Investors are cautioned that they may lose all or a portion of their investment when investing in stocks. This press release was distributed on behalf of DevvStream Corp. For current services performed MNU was compensated forty four hundred dollars for news coverage of the current press releases issued by DevvStream Corp. by the Company. MNU HOLDS NO SHARES OF ANY COMPANY NAMED IN THIS RELEASE

This release contains ""forward-looking statements"" within the meaning of Section 27A of the Securities Act of 1933, as amended, and Section 21E the Securities Exchange Act of 1934, as amended and such forward-looking statements are made pursuant to the safe harbor provisions of the Private Securities Litigation Reform Act of 1995. ""Forward-looking statements"" describe future expectations, plans, results, or strategies and are generally preceded by words such as ""may"", ""future"", ""plan"" or ""planned"", ""will"" or ""should"", ""expected,"" ""anticipates"", ""draft"", ""eventually"" or ""projected"". You are cautioned that such statements are subject to a multitude of risks and uncertainties that could cause future circumstances, events, or results to differ materially from those projected in the forward-looking statements, including the risks that actual results may differ materially from those projected in the forward-looking statements as a result of various factors, and other risks identified in a company's annual report on Form 10-K or 10-KSB and other filings made by such company with the Securities and Exchange Commission. You should consider these factors in evaluating the forward-looking statements included herein, and not place undue reliance on such statements. The forward-looking statements in this release are made as of the date hereof and MNU undertakes no obligation to update such statements.

Contact Information:

Media Contact email: editor@marketnewsupdates.com - +1(561)486-1799

SOURCE: MarketNewsUpdates.com",https://images.contentstack.io/v3/assets/blt4eb669caa7dc65b2/blta7dd42ebdd7b93b8/61899b34a3c7df383578294c/morningstar-og.png,N,,2025-12-16 10:57:32.591623
