id,name,published,outlet,title,authors,category,market,categoryorder,articleorder,url,description,text,image,error,sentiment,firstEyes
,,2025-12-15 23:31:08+00:00,Denver Business Journal,Sustainable fuel company CEO to step down after nearly two decades - Denver Business Journal,Jackson Guilfoil,,,,,https://www.bizjournals.com/denver/news/2025/12/15/gevo-ceo-patrick-gruber-steps-down.html,"Paul Bloom will become CEO of Gevo Inc. in April 2026, succeeding Patrick Gruber, who will become executive chair after leading since 2007.",Not Available,https://media.bizj.us/view/img/9902562/alaska-gevo-jet-fuel*1200xx4928-2772-0-254.jpg,N,,2025-12-15 21:56:59.900479
,,2025-12-15 23:09:53+00:00,ChiniMandi,India likely to shift to ethanol-blended aviation fuel by mid-2027: Report - ChiniMandi,ChiniMandi,,,,,https://www.chinimandi.com/india-likely-shift-to-ethanol-blended-aviation-fuel-by-mid-2027-report/,"India has already carried out trial flights using cleaner aviation fuel.
In March 2023, Air Vistara, which has since merged with Air India, operated a long-haul Boeing 787 flight from the United States to India using fuel blended.
According to the news report, a long-pending policy on sustainable aviation fuel is likely to be released for public consultations next month, the official said, requesting anonymity.
The Centre is supporting biofuel projects through the Pradhan Mantri JI-VAN Yojana, which provides financial assistance for setting up plants, including those producing aviation fuel.
Various companies/PSUs namely Indian Oil Corporation Limited, Bharat Petroleum Limited, Hindustan Petroleum Limited, Mangalore Refinery and Petrochemicals Limited, CSIR Indian Institute of Petroleum, Chennai Petroleum Corporation Limited, Indian Institute of Petroleum etc.","India is likely to shift to ethanol-blended aviation fuel by mid-2027, gradually ramping it up in phases, with the addition of more than two dozen distilleries supported by federal biofuel incentives, an official familiar with the details said on Sunday, reported Hindustan Times.

The country, which has the world’s third-largest aviation market, is aiming to introduce 1% ethanol blending in jet fuel by 2027, raise it to 2% in 2028 and further to 5% by 2030. Union Minister of State for Civil Aviation Murlidhar Mohol had shared these targets in Parliament earlier this month.

India has already carried out trial flights using cleaner aviation fuel. In March 2023, Air Vistara, which has since merged with Air India, operated a long-haul Boeing 787 flight from the United States to India using fuel blended. In the same year, Air Asia flew the country’s first commercial domestic flight between Pune and Delhi with a fuel blend.

According to the news report, a long-pending policy on sustainable aviation fuel is likely to be released for public consultations next month, the official said, requesting anonymity.

International Civil Aviation Organization (ICAO) has adopted Carbon Offsetting & Reduction Scheme for International Aviation (CORSIA) as a global market-based measure to reduce emissions from international aviation which require offsetting of emissions above a baseline value. Airlines can either use SAF or offset their emissions by purchasing carbon credits from ICAO approved Emissions Unit Programmes. SAF offers a direct pathway to emission reduction by lowering the lifecycle carbon footprint of aviation fuel. When airlines adopt CORSIA Eligible SAF (CORSIA Eligible Fuel) certified against ICAO’s sustainability standards and verified through Monitoring, Reporting, and Verification (MRV), they can claim these reductions as substitutes for carbon credits, thereby decreasing their offsetting obligations under the scheme.

The Centre is supporting biofuel projects through the Pradhan Mantri JI-VAN Yojana, which provides financial assistance for setting up plants, including those producing aviation fuel.

Under the scheme, the government offers interest support for five years, including a one-year repayment break, on loans taken to set up new ethanol distilleries. The support covers interest up to 6% per year or half of the bank’s lending rate, whichever is lower.

Various companies/PSUs namely Indian Oil Corporation Limited, Bharat Petroleum Limited, Hindustan Petroleum Limited, Mangalore Refinery and Petrochemicals Limited, CSIR Indian Institute of Petroleum, Chennai Petroleum Corporation Limited, Indian Institute of Petroleum etc. are currently working on SAF production/research.",https://www.chinimandi.com/wp-content/uploads/2025/05/SAF-Sustainable-Aviation-Fuel-4.jpg,N,,2025-12-15 19:56:59.641159
,,2025-12-15 23:07:12+00:00,X (formerly Twitter),The global #sustainable aviation fuel market is set to be worth around $357.4 billion by 2035 ...,Not Available,,,,,https://x.com/SusOnlineNet/status/2000547697288491327,"SustainabilityOnline (@SusOnlineNet). 12 views. The global #sustainable aviation fuel market is set to be worth around $357.4 billion by 2035, ...","JavaScript is not available.

We’ve detected that JavaScript is disabled in this browser. Please enable JavaScript or switch to a supported browser to continue using x.com. You can see a list of supported browsers in our Help Center.",,N,,2025-12-15 20:56:19.191077
,,2025-12-15 23:06:40+00:00,Utilities Middle East,Egypt signs $200m SAF investment with Qatar's Al Mana Holding - Utilities Middle East,"Simone Liedtke, Travis Richards",,,,,https://www.utilities-me.com/news/egypt-qatar-saf-deal,"Egypt has signed a contract with Qatar’s Al Mana Holding for a first-phase investment of $200 million to establish a sustainable aviation fuel (SAF) production facility at Ain Sokhna in the Suez Canal Economic Zone, the cabinet said.
The first phase is expected to have an annual production capacity of 200,000 tonnes, according to the cabinet statement.
The agreement marks the first Qatari industrial investment in the Suez Canal Economic Zone, representing a milestone in bilateral economic cooperation between Cairo and Doha.
Egypt has been seeking to attract foreign investment, particularly from Gulf states, as it works to address high external debt levels and a widening budget deficit.
The agreement follows a series of major Qatari investments in Egypt.","Egypt has signed a contract with Qatar’s Al Mana Holding for a first-phase investment of $200 million to establish a sustainable aviation fuel (SAF) production facility at Ain Sokhna in the Suez Canal Economic Zone, the cabinet said.

According to a news report by Zawya, the project, which will be developed across three phases, will span 100,000 square metres in the Integrated Sokhna Zone on Egypt’s Red Sea coast. The first phase is expected to have an annual production capacity of 200,000 tonnes, according to the cabinet statement.

The agreement marks the first Qatari industrial investment in the Suez Canal Economic Zone, representing a milestone in bilateral economic cooperation between Cairo and Doha.

Prime Minister Mostafa Madbouly said the project reflects growing momentum in Egypt–Qatar relations, driven by a shared political will to expand cooperation through joint investments and increased trade.

Egypt has been seeking to attract foreign investment, particularly from Gulf states, as it works to address high external debt levels and a widening budget deficit.

The agreement follows a series of major Qatari investments in Egypt. Last month, the real estate arm of Qatar’s sovereign wealth fund announced plans to invest $29.7 billion in a luxury real estate and tourism development on Egypt’s Mediterranean coast, the largest Qatari investment in the country since diplomatic relations were restored after the 2017–2021 regional rift.

The deal also comes amid growing regional momentum in sustainable aviation fuel, with MENA Biofuels beginning implementation of the UAE’s first SAF production facility in Fujairah, targeting up to 250 million litres per year as part of the country’s SAF Roadmap 2030.",https://www.utilities-me.com/cloud/2025/12/15/shutterstock_2229562239-scaled.jpg,N,,2025-12-15 19:57:03.763189
,,2025-12-15 22:33:45+00:00,ESG Today,New York Releases Regulation Requiring Mandatory GHG Reporting for Large Emitters from 2027,Mark Segal,,,,,https://www.esgtoday.com/new-york-releases-regulation-requiring-mandatory-ghg-reporting-for-large-emitters-from-2027/,"New York State Department of Environmental Conservation (DEC) Commissioner Amanda Lefton announced the finalization of new regulations to implement mandatory greenhouse gas (GHG) emissions disclosure from carbon-intensive sectors, with reporting slated to begin in 2027.
Several states, including New York and California have moved to implement climate disclosure requirements over the past several months.
DEC issued draft regulations in March 2025, and received more than 3,000 public comments on the draft in its consultation.
The finalized regulation included a few changes, including extending the verification reporting deadline for the first two years, and reducing reporting requirements from facilities that closed or ceased operations.
Lefton said: “DEC’s greenhouse gas emissions reporting program and subsequent data collection is critical to the State’s ongoing efforts to protect our environment and improve the health and quality of life of all New Yorkers.”","New York State Department of Environmental Conservation (DEC) Commissioner Amanda Lefton announced the finalization of new regulations to implement mandatory greenhouse gas (GHG) emissions disclosure from carbon-intensive sectors, with reporting slated to begin in 2027.

The new reporting requirements come as the federal government under the Trump administration has pulled back on initiatives to provide transparency into corporate and industrial emissions, including plans to by the U.S. Environmental Protection Agency (EPA) end the Greenhouse Gas Reporting Program (GHGRP), and moves by the SEC to stop the implementation of its own new climate reporting rules. Several states, including New York and California have moved to implement climate disclosure requirements over the past several months.

Commissioner Lefton said:

“The Reporting Rule will enable DEC to collect the information necessary, despite proposed rollbacks on the federal level, and develop effective strategies that reduce harmful air pollution and direct investments where they are most needed.”

The finalization of DEC’s regulations follows a directive issued by New York Governor Kathy Hochul earlier this year to advance a Mandatory Greenhouse Gas Reporting Program, aimed at providing information on major polluters in the state, informing policies to reduce GHG emissions and to assess compliance with emissions reduction programs, and to help the state meet its emissions reduction goals.

Under the new regulation, facilities included in the new rules will be required to annually provide certain GHG emission data to DEC starting in June 2027, reflecting the previous year’s emissions. In addition, some large emission sources will also be required to verify their emissions data report annually using DEC-accredited third-party verification services.

Entities required to report under the new regulations include owners and operators of facilities in New York that emit 10,000 metric tons of CO2e annually, including electricity generation, stationary combustion, landfills, waste-to-energy, natural gas compressor stations, and other infrastructure; fuel suppliers including natural gas, liquid fuels, and petroleum products, liquefied natural gas and compressed natural gas, and coal; waste haulers and transporters with estimated emissions from solid wastes transported to landfills or combustion facilities outside of New York exceeding 10,000 MT CO2e in any year; electric power entities; agricultural lime and fertilizer suppliers, and anaerobic digestion and liquid storage of waste at facilities with waste imported to or generated at the facility generating 10,000 MT CO2 per year.

DEC issued draft regulations in March 2025, and received more than 3,000 public comments on the draft in its consultation. The finalized regulation included a few changes, including extending the verification reporting deadline for the first two years, and reducing reporting requirements from facilities that closed or ceased operations.

Lefton said:

“DEC’s greenhouse gas emissions reporting program and subsequent data collection is critical to the State’s ongoing efforts to protect our environment and improve the health and quality of life of all New Yorkers.”",https://www.esgtoday.com/wp-content/uploads/2025/12/emissions3.jpg,N,,2025-12-15 18:57:14.562652
,,2025-12-15 20:55:18+00:00,Reuters,These farmers are producing record crops despite droughts and floods - Reuters,Ed White,,,,,https://www.reuters.com/sustainability/cop/how-canadas-farmers-are-producing-record-crops-despite-droughts-floods-2025-12-15/,"When farmer Simon Ellis first drove his combine into this year's crop, he expected ""catastrophic failure,"" after a season of flooding followed by a long drought. But instead of shriveled kernels, plump seeds of wheat, oats and soybeans poured into his combine.",Not Available,https://www.reuters.com/resizer/v2/6L2VC2ULRVI7JHCB2EUWHBE4Y4.jpg?auth=232c03876e5ebd3607a886a5578eadfc276df026b43d2d45cf18f4f0afa4a177&height=1005&width=1920&quality=80&smart=true,N,,2025-12-15 18:57:17.529999
,,2025-12-15 20:47:05+00:00,www.facebook.com,Our partners at Million Air have introduced Sustainable Aviation Fuel (SAF) to their ... - Facebook,Not Available,,,,,https://www.facebook.com/AustinAirport/posts/our-partners-at-million-air-have-introduced-sustainable-aviation-fuel-saf-to-the/1323798829786695/,"SAF is on the rise in Texas 🌿✈️ — and Million Air Austin is proud to help lead the charge.
Cleaner fuel, clearer skies.
#BeyondGreen #MillionAir #Aviation #Sustainability","SAF is on the rise in Texas 🌿✈️ — and Million Air Austin is proud to help lead the charge. Cleaner fuel, clearer skies. #BeyondGreen #MillionAir #Aviation #Sustainability",https://scontent-iad3-2.xx.fbcdn.net/v/t15.5256-10/596037377_1618889842695921_655378606986295136_n.jpg?stp=dst-jpg_s235x350_tt6&_nc_cat=111&ccb=1-7&_nc_sid=d2b52d&_nc_ohc=9zrP-Nh7wxoQ7kNvwGnbEop&_nc_oc=Adm_51ohwwGT3wbM1_X6I_M8-loxtCLYD5Z-1kzXRJ_ykWdMDbryD65nV82E2ZgsYYOnEYdEM9VuxiUEDPpH59qX&_nc_zt=23&_nc_ht=scontent-iad3-2.xx&_nc_gid=RiN-9pmM--rfeCD1mG3vGg&oh=00_Afkh832OJjRkwknjnlNLnycyH9iK4RYH6s7t2LNHudUe-Q&oe=69467B64,N,,2025-12-15 17:56:24.624908
,,2025-12-15 20:13:38+00:00,FLYING Magazine,IATA: Growth in SAF Production Set to Slow in 2026 - FLYING Magazine,Zach Vasile,,,,,https://www.flyingmag.com/iata-growth-in-saf-production-set-to-slow-in-2026/,"Growth in the production of sustainable aviation fuel (SAF) will fall short of projections this year and slow down in 2026, the International Air Transport Association (IATA) reported this week.
The trade group estimates that SAF production will reach 1.9 million metric tons in 2025, almost double the amount made in 2024.
“Europe’s fragmented policies distort markets, slow investment, and undermine efforts to scale SAF production,” Willie Walsh, IATA’s director general, said in a statement.
SAF is a renewable alternative to conventional jet fuel made from nonpetroleum feedstocks.
Many airlines and private aviation companies now use SAF, and some have set targets for a gradual transition away from conventional jet fuel.","Growth in the production of sustainable aviation fuel (SAF) will fall short of projections this year and slow down in 2026, the International Air Transport Association (IATA) reported this week.

The trade group estimates that SAF production will reach 1.9 million metric tons in 2025, almost double the amount made in 2024. But that figure will fall short of IATA’s initial estimates for the year, and in 2026, growth in production is expected to slow to 2.4 million metric tons.

IATA officials placed the blame on “poorly designed” SAF-related mandates and policy frameworks enacted in the U.K. and Europe.

Europe’s ReFuelEU Aviation, for instance, has sharply increased costs, and airlines are now paying up to five times more for SAF than conventional jet fuel, the group said.

“Europe’s fragmented policies distort markets, slow investment, and undermine efforts to scale SAF production,” Willie Walsh, IATA’s director general, said in a statement. “Europe’s regulators must recognize that its approach is not working and urgently correct course.”

The trade association said governments should focus their efforts on production incentives, rather than mandates, to increase the global supply of SAF and drive down prices.

SAF is a renewable alternative to conventional jet fuel made from nonpetroleum feedstocks. According to the U.S. Department of Energy, it can be developed from food and yard waste, woody biomass, agricultural waste, cooking oils, animal fats, and algae.

SAF is a “drop in” fuel, meaning it can be blended with traditional jet fuel and used in existing aircraft engines without requiring modification. Its use can reduce lifecycle carbon emissions by up to 80 percent.

Many airlines and private aviation companies now use SAF, and some have set targets for a gradual transition away from conventional jet fuel. IATA said that, as a result of increasing costs, airlines that have pledged to use 10 percent SAF by 2030 will be “forced to reevaluate these commitments.”

“SAF is not being produced in sufficient amounts to enable these airlines to achieve their ambition,” Walsh said. “These commitments were made in good faith but simply cannot be delivered.”",https://flyingmag1.b-cdn.net/wp-content/uploads/sites/2/2025/08/shutterstock_2030568074.jpg,N,,2025-12-15 16:56:58.683224
,,2025-12-15 19:55:05+00:00,S&P Global,2026 Outlooks | S&P Global,Not Available,,,,,https://www.spglobal.com/en/research-insights/special-reports/2026-outlooks,"As we step into 2026, the chorus of voices warning of an impending credit downturn is getting louder.
And yet, we see a number of factors that point to a more balanced--dare we say, resilient--picture ahead.
Against this backdrop, broader policy uncertainty represents a key risk to the outlook and a potential trigger for market volatility.
Trade tensions may have peaked and markets have absorbed them, at least for now.
But they are symptomatic of a long-term shift toward a more transactional and multipolar world order which will have longer term credit implications.","As we step into 2026, the chorus of voices warning of an impending credit downturn is getting louder. And yet, we see a number of factors that point to a more balanced--dare we say, resilient--picture ahead. This includes resilient economies, extended maturities for issuers, and improved interest rates.

At the same time, the rapid scale of AI fundraising, and valuations attained by players, have sparked concerns of possible hubris or the emergence of new risks, with the ultimate transformational nature of AI’s outcomes still anyone’s guess.

Against this backdrop, broader policy uncertainty represents a key risk to the outlook and a potential trigger for market volatility. Trade tensions may have peaked and markets have absorbed them, at least for now. But they are symptomatic of a long-term shift toward a more transactional and multipolar world order which will have longer term credit implications.",https://spglobal.scene7.com/is/image/spglobalcom/spg-ocean-water-sky-sunset-sunrise?$responsive$,N,,2025-12-15 18:57:22.426587
,,2025-12-15 19:34:18+00:00,Instagram,Egypt Signs $200M Deal for Sustainable Aviation Fuel Production - Instagram,Not Available,,,,,https://www.instagram.com/p/DSSz-Z6jJQv/,"middleeast.explores 1h Egypt Goes Green: $200M Deal with Qatar for Sustainable Aviation Fuel 🌱✈️ Egypt has signed a $200 million deal with Qatar’s Al Mana Holding to produce sustainable aviation fuel from used cooking oil.
The new plant will be located in the Suez Canal Economic Zone and aims to produce 200,000 tonnes annually in its first phase.
This marks Qatar’s first industrial investment in the zone, highlighting the growing bilateral cooperation between the two countries.
The project is part of Egypt’s strategy to attract foreign investments, boost its economy, and tackle challenges like foreign debt and budget deficits.
If you could choose, would you support more projects that turn waste like used cooking oil into green energy in Egypt?","middleeast.explores

1h

Egypt Goes Green: $200M Deal with Qatar for Sustainable Aviation Fuel 🌱✈️

Egypt has signed a $200 million deal with Qatar’s Al Mana Holding to produce sustainable aviation fuel from used cooking oil. The new plant will be located in the Suez Canal Economic Zone and aims to produce 200,000 tonnes annually in its first phase.

This marks Qatar’s first industrial investment in the zone, highlighting the growing bilateral cooperation between the two countries.

The project is part of Egypt’s strategy to attract foreign investments, boost its economy, and tackle challenges like foreign debt and budget deficits.

If you could choose, would you support more projects that turn waste like used cooking oil into green energy in Egypt?",https://scontent-iad3-1.cdninstagram.com/v/t51.82787-15/601537893_18167429029381647_7173456239849645190_n.webp?stp=c216.0.648.648a_dst-jpg_e35_s640x640_tt6&_nc_cat=107&ccb=7-5&_nc_sid=18de74&efg=eyJlZmdfdGFnIjoiRkVFRC5iZXN0X2ltYWdlX3VybGdlbi5DMyJ9&_nc_ohc=LBCXB4gW_wgQ7kNvwHqAkA8&_nc_oc=AdntRDynHst9ric6BRaFqoVk7_MFZb-yrpRy-V8v1EVzyPnqLbP7bCPHQqGCfLUolSkvCa5amQ7dBExxPwtu1Pgs&_nc_zt=23&_nc_ht=scontent-iad3-1.cdninstagram.com&_nc_gid=I1NoWEbCYnUUpHwIXwh3dg&oh=00_AfkjKaqYKdQRmoKeYSbq6Z5xKto4cM_xATZ6EHB72xwkew&oe=694654B3,N,,2025-12-15 14:56:32.276993
