id,name,published,outlet,title,authors,category,market,categoryorder,articleorder,url,description,text,image,error,sentiment,firstEyes
,,2025-12-23 10:07:04+00:00,renewablesnow.com,Jet Zero Australia gets enviro nod for alcohol-to-jet fuel project - Renewables Now,Martina Markosyan,,,,,https://renewablesnow.com/news/jet-zero-australia-gets-enviro-nod-for-alcohol-to-jet-fuel-project-1287145/,... sustainable aviation fuel (SAF) plant south of the northeastern coastal ... sustainable aviation fuel (SAF) plant south of the northeastern ...,"Error with connection!

Thank you for using Renewables Now. This page was not found.",,N,,2025-12-23 05:11:46.225639
,,2025-12-23 09:06:14+00:00,eplaneai,Innovations in Sustainable Aviation Fuel Supply Chains - ePlaneAI,ePlane AI,,,,,https://www.eplaneai.com/news/innovations-in-sustainable-aviation-fuel-supply-chains,"Louise Burke recently engaged with Damien McLoughlin, Chief Commercial Officer of FlyORO, to discuss the critical challenges and emerging innovations within sustainable aviation fuel (SAF) supply chains.
In particular, fragmented and costly government policies—especially across Europe—have hindered SAF production and escalated costs.
Aviation leaders in Australia emphasize that without these foundational elements, the country will face considerable challenges in building a viable SAF supply chain.
While experts acknowledge that the aviation industry is unlikely to meet its 2030 targets for sustainable fuel adoption, innovations such as FlyORO’s modular blending technology and an emphasis on traceable, flexible supply chains offer promising avenues.
As the sector navigates complex policy environments, infrastructure limitations, and competing energy demands, localized and adaptable solutions may prove indispensable in accelerating the transition to sustainable aviation.","Louise Burke recently engaged with Damien McLoughlin, Chief Commercial Officer of FlyORO, to discuss the critical challenges and emerging innovations within sustainable aviation fuel (SAF) supply chains. As airlines worldwide intensify efforts to achieve ambitious decarbonization targets, the sector confronts significant obstacles. In particular, fragmented and costly government policies—especially across Europe—have hindered SAF production and escalated costs. Industry leaders warn that these regulatory complexities threaten to undermine the aviation sector’s capacity to scale SAF usage, jeopardizing progress toward net-zero emissions by 2050.

Challenges in SAF Production and Distribution

FlyORO, a Singapore-based technology company, is at the forefront of addressing these challenges by developing novel approaches to SAF distribution. The firm’s patented modular blending units can be deployed flexibly from production sites to airports, facilitating a more distributed and responsive delivery network. McLoughlin underscores that while much of the industry’s focus remains on SAF production, significant difficulties persist downstream in the supply chain. Without localized and adaptable solutions, he cautions, the sector risks creating disparities between airports—some gaining access to SAF while others are left behind.

The global SAF landscape remains uneven. Europe continues to struggle with policy fragmentation, impeding cohesive growth. In contrast, Asia currently stands as the only region experiencing tangible expansion in SAF capacity. Australia, despite recent momentum in its SAF transition, still lacks the structural certainty, coordinated government support, and clear investment signals necessary to establish a sustainable domestic industry. Aviation leaders in Australia emphasize that without these foundational elements, the country will face considerable challenges in building a viable SAF supply chain.

Emerging Pressures and Solutions

Compounding these issues is the rapid growth of artificial intelligence technologies, whose soaring energy demands increasingly compete for the same renewable energy resources required for SAF production. This competition poses a further risk to airlines’ sustainability ambitions.

In response to these complexities, demand is rising for SAF certificates and greater flexibility in accounting for Scope 3 emissions. McLoughlin highlights the critical role of robust traceability and the “book-and-claim” system, which enables airlines to claim environmental benefits from SAF even when physical delivery is not feasible. He argues that this mechanism is essential for scaling SAF demand and maintaining credibility, as it complements physical deployment with transparent and accountable tracking.

While experts acknowledge that the aviation industry is unlikely to meet its 2030 targets for sustainable fuel adoption, innovations such as FlyORO’s modular blending technology and an emphasis on traceable, flexible supply chains offer promising avenues. As the sector navigates complex policy environments, infrastructure limitations, and competing energy demands, localized and adaptable solutions may prove indispensable in accelerating the transition to sustainable aviation.",https://pub-a51e4d676a044eb380faeff15def343e.r2.dev/b91e457ddf7c4c0ab43bf3621625dc49.avif,N,,2025-12-23 05:12:00.130234
,,2025-12-23 06:57:35+00:00,Reccessary,"Vietnam's Vinh Long in talks with Sembcorp on renewables, eco-industrial parks | NEWS",Not Available,,,,,https://reccessary.com/en/news/vn-vinh-long-sembcorp,"Vietnam’s Vinh Long province is in talks with Singapore-based Sembcorp Industries on potential investments in renewable energy and an eco-industrial park.
(Photo: Sembcorp) Vietnam’s Vinh Long province is in talks with Singapore’s Sembcorp Industries to explore investment opportunities in renewable energy and an eco-industrial park, as the province seeks to position itself as a clean energy hub for the Mekong Delta and beyond.
Lawrence Chan, head of Vietnam–Singapore Industrial Parks (VSIP) in Vietnam, said on Dec. 22 that Sembcorp’s strategy aligns closely with Vietnam’s national energy transition goals, as well as with the technical readiness needed to unlock Vinh Long’s renewable energy potential.","Vietnam’s Vinh Long province is in talks with Singapore-based Sembcorp Industries on potential investments in renewable energy and an eco-industrial park. (Photo: Sembcorp)

Vietnam’s Vinh Long province is in talks with Singapore’s Sembcorp Industries to explore investment opportunities in renewable energy and an eco-industrial park, as the province seeks to position itself as a clean energy hub for the Mekong Delta and beyond.

Lawrence Chan, head of Vietnam–Singapore Industrial Parks (VSIP) in Vietnam, said on Dec. 22 that Sembcorp’s strategy aligns closely with Vietnam’s national energy transition goals, as well as with the technical readiness needed to unlock Vinh Long’s renewable energy potential.",https://reccessary.com/data/news/meta/1766467628478148471.jpg,N,,2025-12-23 02:11:51.603182
,,2025-12-23 06:49:53+00:00,bioenergytimes.com,New IOC fuel storage facility in Ladakh strengthens energy security in high-altitude areas,Not Available,,,,,https://bioenergytimes.com/new-ioc-fuel-storage-facility-in-ladakh-strengthens-energy-security-in-high-altitude-areas-ioc-chairman/,"Sustainable Aviation Fuel (SAF) · Sustainable aviation fuel boost: Korea targets 10% cut in airport carbon emissions by 2030. December 22, 2025. LEAVE ...",Not Available,,N,,2025-12-23 02:12:23.254655
,,2025-12-23 06:41:49+00:00,X (formerly Twitter),Jet Zero wins environmental approval for SAF project,Not Available,,,,,https://x.com/staunovo/status/2003336095258276320,"... sustainable aviation fuel (SAF) project, Project Ulysses ... sustainable aviation fuel (SAF) project, Project Ulysses.","JavaScript is not available.

We’ve detected that JavaScript is disabled in this browser. Please enable JavaScript or switch to a supported browser to continue using x.com. You can see a list of supported browsers in our Help Center.",,N,,2025-12-23 04:56:57.668071
,,2025-12-23 03:47:57+00:00,www.argusmedia.com,Jet Zero wins environmental approval for SAF project | Latest Market News - Argus Media,,,,,,https://www.argusmedia.com/en/news-and-insights/latest-market-news/2769034-jet-zero-wins-environmental-approval-for-saf-project,"... sustainable aviation fuel (SAF) project, Project Ulysses ... sustainable aviation fuel (SAF) project, Project Ulysses. The approval confirms the ...",Not Available,,Y,,2025-12-23 01:11:59.420045
,,2025-12-22 22:58:33+00:00,Aviation A2Z,Singapore Airlines Deploys A350 With Long-Haul Business Class to THIS Australian City,"David Hughes, Atharva Khadilkar, Shweta Shukla",,,,,https://aviationa2z.com/index.php/2025/12/22/singapore-airlines-deploys-a350-with-long-haul-business-class-to-brisbane/,"Singapore Airlines A350 Brisbane Flights From 1 November 2026, Singapore Airlines will upgrade the SQ265/266 rotation between Singapore (SIN) and Brisbane (BNE) from the Airbus A350 Medium Haul to the Airbus A350 Long Haul configuration.
Advertisement This aircraft features the airline’s 2013 long-haul Business Class seats and a dedicated Premium Economy cabin.
Brisbane’s Long-Haul Cabin History In 2018, Singapore Airlines operated all four daily Brisbane services with long-haul Business Class seating, using either the 2013 Business Class product or the now-retired 2006 configuration.
Singapore to Brisbane Brisbane to Singapore This structure provides a daytime service from Singapore to Brisbane with an evening return, supporting both local demand and onward connectivity.
New Closed-Door Business Class Suites Singapore Airlines plans to introduce its new closed-door Business Class suites on the Airbus A350 Long Haul from the second quarter of 2026.","SINGAPORE- One of the world’s best airlines, Singapore Airlines (SQ), will restore long-haul cabin products on its Singapore (SIN) to Brisbane (BNE) route from November 2026, reintroducing wider Business Class seats and Premium Economy after a four-year absence.

The upgrade applies to one of four daily services and will be operated by the Airbus A350 Long Haul, improving comfort and consistency for passengers connecting on ultra-long-haul itineraries.

Singapore Airlines A350 Brisbane Flights

From 1 November 2026, Singapore Airlines will upgrade the SQ265/266 rotation between Singapore (SIN) and Brisbane (BNE) from the Airbus A350 Medium Haul to the Airbus A350 Long Haul configuration.

Advertisement

This aircraft features the airline’s 2013 long-haul Business Class seats and a dedicated Premium Economy cabin.

According to Mainly Miles, this marks the first time since October 2022 that Brisbane will again receive Singapore Airlines’ long-haul cabin products, which were a regular feature on at least one daily service prior to the pandemic.

While overall seat capacity on the route will fall by approximately four percent, Business Class capacity will increase.

The A350 Long Haul’s premium-heavy layout adds 14 additional Business Class seats per week in each direction compared to the Medium Haul configuration.

Aircraft Assignment and Operational Shift

The change represents a clear operational shift. In both 2022 and pre-pandemic operations, the 3-class Airbus A350 Long Haul aircraft was assigned to the SQ245/246 service. From November 2026, this designation moves to SQ265/266.

The SQ265/266 rotation is notable as it was the final Brisbane frequency to be restored to daily service following the pandemic. The flight was upgraded from four weekly services to daily operation in mid-June 2025.

Brisbane’s Long-Haul Cabin History

In 2018, Singapore Airlines operated all four daily Brisbane services with long-haul Business Class seating, using either the 2013 Business Class product or the now-retired 2006 configuration.

These seats were progressively replaced by the Regional Business Class product from 2018 onward.

Although technically newer, the regional seat is narrower and is widely regarded by passengers as less comfortable than the older long-haul design. The return of the A350 Long Haul therefore, represents a qualitative improvement rather than a simple fleet substitution.

Daily Schedule from 1 November 2026

Singapore Airlines will operate four daily flights in each direction between Singapore and Brisbane. All services operate every day.

Singapore to Brisbane

Brisbane to Singapore

This structure provides a daytime service from Singapore to Brisbane with an evening return, supporting both local demand and onward connectivity.

Connectivity for Ultra-Long-Haul Passengers

The timing of SQ265 and SQ266 is optimized for long-haul connections via Singapore.

Inbound connections to SQ265 include arrivals from London Gatwick, London Heathrow, Paris, Amsterdam, Zurich, Rome, Johannesburg, and Cape Town, alongside selected services from India and China.

Outbound connections from SQ266 include London Heathrow, Zurich, Rome, Manchester, Johannesburg, Cape Town, and multiple destinations across India and North Asia.

Many passengers on these itineraries undertake journeys exceeding 22 hours. The availability of long-haul Business Class and Premium Economy on the Brisbane sector eliminates the current downgrade in comfort experienced by connecting passengers.

Strategic Importance

Singapore is Brisbane Airport’s second-busiest international route after Auckland. In 2024, Brisbane Airport CEO Gert-Jan de Graaff stated that more than half of all visitors from India to Brisbane traveled via Singapore Airlines.

Indian nationals were the largest group of non-Australian passport holders arriving in Brisbane on Singapore Airlines flights in 2024, followed by Singaporean and British travelers. This highlights the airline’s critical role in Queensland’s inbound tourism market.

KrisFlyer Award Redemption Rates

Singapore Airlines KrisFlyer members can redeem miles for one-way flights between Singapore and Brisbane at the following rates per person:

Taxes and fees apply in addition to mileage and typically total around S$102 from Singapore to Brisbane and S$97 in the return direction.

These amounts are higher than many other routes due to Australia’s international arrival and departure taxes.

Redemptions made on or after 1 April 2026, for travel on or after 1 October 2026, will also incur Singapore’s new Sustainable Aviation Fuel levy on this route.

New Closed-Door Business Class Suites

Singapore Airlines plans to introduce its new closed-door Business Class suites on the Airbus A350 Long Haul from the second quarter of 2026.

The airline aims to complete the full fleet retrofit by late 2030, although similar programs have historically taken longer than initially projected.

While Brisbane may not be among the first destinations to receive the new seats, continued A350 Long Haul deployment positions the route alongside Sydney and Melbourne, both of which already see flights operated by this aircraft type.

Bottom Line

Singapore Airlines’ decision to restore long-haul cabin products on the Singapore–Brisbane route from November 2026 strengthens the route’s appeal for premium and long-haul travelers.

The upgrade of SQ265/266 to the Airbus A350 Long Haul reintroduces Premium Economy and increases Business Class capacity.

For passengers connecting between Australia, Europe, Africa, and the Indian subcontinent, the change delivers consistent comfort across the entire journey.

Compared with 2018, when all four daily flights featured long-haul seating, this represents a measured but meaningful step toward rebuilding Brisbane’s long-haul product offering.

Stay tuned with us. Further, follow us on social media for the latest updates.",https://aviationa2z.com/wp-content/uploads/2024/07/ea7f0vxo.webp,N,,2025-12-22 18:56:41.205399
,,2025-12-22 22:49:13+00:00,www.moran.senate.gov,Visiting All 105 Kansas Counties - Senator Jerry Moran,Not Available,,,,,https://www.moran.senate.gov/public/index.cfm/newsletter%3Fid%3D794F26B0-1D88-4FF9-A93E-2833443A8054,The page you have requested does not exist or is undergoing routine maintenance.,The page you have requested does not exist or is undergoing routine maintenance.,https://www.moran.senate.gov/public/vendor/_skins/moran2017/images/template/seal.jpg,N,,2025-12-22 18:56:45.024656
