id,name,published,outlet,title,authors,category,market,categoryorder,articleorder,url,description,text,image,error,sentiment,firstEyes
,,2026-01-09 13:02:42+00:00,biomassmagazine.com,Fueling the Future | Biomass Magazine,Not Available,,,,,https://biomassmagazine.com/articles/fueling-the-future,"And to OPAL co-CEO Adam Comora, RNG is the perfect place to invest amid current climate goals.
Today, OPAL splits its operating segments into three categories: RNG fuel, renewable power and fuel station services, Comora explains.
You can’t get a more streamlined operational economic model for the sector.” The balancing act between building new RNG plants and expanding OPAL’s current fueling infrastructure is calculated at every step.
With major fleets increasingly reengaging with CNG and RNG, Comora and the OPAL Fuels team view fueling infrastructure as a compelling growth opportunity and are investing accordingly.
It also includes increasing fleet conversions for heavy-duty transportation, expanding into new markets such as marine fuels or exports to Japan, evaluating additional feedstocks, and growing the company’s fueling station network.","Five years ago, OPAL Fuels stepped out of the private sector and emerged as an ambitious leader in the production and distribution of renewable natural gas.

With major partners including NextEra Energy, UPS, CHS and Fiat Chrysler Automobiles, and more than 350 projects nationwide, OPAL has positioned itself at the forefront of the renewable energy transition. And just in time, it seems, as pressure to decarbonize increases. The United Nations’ COP30 climate summit, held in Brazil in November and the first post-U.S. withdrawal, stressed “the inherent connection between pursuing efforts to limit the global temperature increase to 1.5 degrees Celsius and pursuing just transition pathways.”

While the conference failed to agree on decarbonization regulations, 23 countries endorsed their commitment to Belém 4X, an initiative to quadruple the use of sustainable fuels by 2035. RNG serves as an easily applicable fuel source for industries looking to decarbonize while maintaining current infrastructure. And to OPAL co-CEO Adam Comora, RNG is the perfect place to invest amid current climate goals.

In With the New

Formed in late 2020 by Comora and co-CEO Jonathan Maurer, OPAL entered the public sector backed by decades of experience. “We got started in the business of capturing biogas and trying to find a productive use for it 25 years ago,” Comora says. “A lot of folks were noticing that methane emissions from decaying organic waste could be used productively and that electricity generation was a good answer because it’s baseload power, 24/7.”

Prior to OPAL’s formation, TruStar Energy, Fortistar Methane Group and Fortistar RNG operated as portfolio companies of Fortistar LLC. The three companies merged together to form OPAL Fuels, bringing together upstream and downstream capabilities. Later that year, OPAL combined with ArcLight Clean Transition Corp. II, officially exiting the private sector as a vertically integrated producer and distributor of RNG.

“We saw a really interesting opportunity to transform what we were doing at the Fortistar Methane Group on the landfill gas-to-electric side,” Comora continues. “We really got excited that there could be something better to do with the biogas resource from an economic perspective, and create an opportunity to help fleets achieve their objectives.”

OPAL’s long-term partnership with American legacy utility NextEra Energy began in April 2021 with the development of a Minnesota RNG project designed to produce 2,140 dekatherms of RNG per day, eliminating 43,900 metric tons of carbon per year. In December 2022, OPAL signed a long-term agreement with UPS to provide operations and maintenance services to 51 UPS RNG dispensing stations in the U.S. In 2023, OPAL and South Jersey Industries signed a 50-50 joint venture agreement to develop RNG facilities. The following year, OPAL announced commercial operations at its RNG facility at the Polk County municipal landfill in Jones Corner, Florida.

Today, OPAL splits its operating segments into three categories: RNG fuel, renewable power and fuel station services, Comora explains. In a report of OPAL’s third-quarter results, Comora noted an 8% increase in RNG production compared to the second quarter and a 30% increase compared to the third quarter of 2024, despite depressed D3 RIN prices. Maurer shared the company’s annual design capacity of 9.1 million MMBtu across 12 projects in operation during the same briefing, adding that “at present, RNG and CNG are the most attractive alternatives to replace diesel for the Class 8 trucking market.”

With D3 RINs remaining depressed, Comora and Maurer’s lengthy backgrounds in renewable energy investing bring stability to their work. “There are a few cost areas that we’re really focused on,” Comora says. “One is the capital costs of the facilities, where we did see some significant inflationary cost pressures over the past three to four years or so. Thankfully, those have been offset by the Section 48 ITC tax credit, and we did safe harbor a number of projects in our advanced development pipeline that will qualify for those ITC tax credits. But we are spending a lot of time on value engineering.”

Further federal tax incentives like the Section 45Z Clean Fuel Production Tax Credit and the Renewable Fuel Standard program affect how OPAL moves. “Policy clarity has a lot more impact on investing in RNG assets, and they all form a piece of the puzzle,” he says. “And 45Z is definitely helpful when thinking about investing in new RNG production facilities. Those run through 2029, so if new facilities take a ballpark estimate of 18 months to build, you may only be getting a year of 45Z benefits.”

Current legislative efforts, including a notice of proposed rulemaking released by the White House Office of Management and Budget, attempt to further extend 45Z beyond 2029, as well as reinstate the $1.75-per-gallon sustainable aviation fuel incentive, which Comora says makes a significant impact on RNG investments. “We’re waiting for final clarity on a GREET model to do all the carbon intensity scoring around our projects, but if you can have visibility or clarity on 45Z for a period of time, that can have a big impact on investing in RNG facilities,” he says. “It also works in conjunction with the 48 ITC, so 45Z is a tool or a lever that can offset those capital cost increases.”

Trucking Along

Despite OPAL’s roots in the U.S., Comora says opportunities beyond the domestic market are growing. “Japan is starting to import RNG. They have a mandate that by 2030, 1% of their net gas has to be low-CI. You can send it there as LNG or as renewable methanol,” he says. “In Europe, marine fuel is really interesting, as well as here in the U.S., whether it be in barges or around ports, and potentially for ocean-going vessels. There’s going to be a big market because they’re going to be taxed based on their carbon emissions when they pull into ports, and now you’ve got all these ships on the ocean that can run on renewable methanol. So, there are other offtake markets that want low-CI natural gas.”

New markets, of course, mean new regulations, even inside the continental U.S. “Any time we dispense RNG in California, CARB assigns us a CI score based off the Argonne GREET models. 45Z is going to have something similar. And we also have third-party engineers that do baselines,” Comora says.

When it comes to the transportation sector, the challenges of decarbonization are half the fun, and OPAL is happy to answer the call. “The reason why we’re focused on transportation fuel, and specifically heavy-duty trucking here in the U.S., is because it’s a hard-to-decarbonize sector,” he says. “Electrification is challenged by battery weight and electricity grids—there are just so many things that stand in the way, and hydrogen has proved challenging to distribute in the U.S. as well.

“We’re collecting biogas that’s maybe 50% methane,” Comora continues. “We are physically passing it through membranes to separate all other impurities so that you can get it up to a pipeline-quality spec, use existing pipeline infrastructure to transport it where you need it, build a fueling station that pulls off the RNG, compresses it and puts it right into the vehicle where it can be used. You can’t get a more streamlined operational economic model for the sector.”

The balancing act between building new RNG plants and expanding OPAL’s current fueling infrastructure is calculated at every step. “Everything that we invest capital in competes for that capital resource and needs to be justified on a strong, unlevered, risk-adjusted return,” Comora explains. “And the good news is we’re seeing good opportunities on both sides.

With major fleets increasingly reengaging with CNG and RNG, Comora and the OPAL Fuels team view fueling infrastructure as a compelling growth opportunity and are investing accordingly. “We see a stronger adoption curve of natural gas or RNG for heavy-duty trucking,” he says. “That being said, you’ll likely see us continue to invest in both, and at the same time, I feel like some of the capital is going to get shifted more toward the fuel station part of the business in the next couple of years.”

Using RNG allows companies to record zero Scope 1 emissions (direct emissions and fossil fuels) and zero Scope 2 emissions (indirect emissions released through purchased energy). The CI of the combusted RNG can then be used to offset Scope 3 emissions, which include all other indirect emissions occurring across the value chain. “It’s hard for companies to do Scope 3 emissions accounting work, but we provide the CI of the RNG we’re supplying if they’re trying to establish a Scope 3 framework,” Comora adds. “So if you use RNG in a fleet: zero Scope 1, zero Scope 2, you create a biogenic emission and then you have a reduction in your Scope 3 emissions based on the CI.”

Finding the Future

With five to six projects under construction, Comora says OPAL is looking ahead. “It’s been a lot more work, and it’s more expensive being a public company. And we think it’s worthwhile to do that work,” he says. “One, we think it’s a better platform to raise capital, raise awareness and do some of our public policy advocacy work. We also think it’s been really impactful to attract talent to our team, and it’s made us much more disciplined.”

With nearly 30 years of experience in the renewable investment industry, the challenges of operating as a public company are navigated by returning to fundamentals. “Methane emissions are 80 times more damaging than CO2, specifically over the first 20 years,” Comora stresses. “Methane abatement is likely the lowest-hanging fruit and the most impactful thing that we can do. Does it get us all the way there? No. Should we be doing it? Yes.”

For OPAL, success is defined by setting the industry benchmark for reliable RNG production, with high facility availability and uptime, Comora says. It also includes increasing fleet conversions for heavy-duty transportation, expanding into new markets such as marine fuels or exports to Japan, evaluating additional feedstocks, and growing the company’s fueling station network. “We really paved our own path in terms of how we built the company, so it was really exciting—and still is exciting,” he adds. “A lot of interesting things come from that. We found it to be really challenging and fun, and it continues to motivate all of us.”

Author: Caitlin Scheresky

Contributing Writer, Biomass Magazine",https://bbi-strapi.s3.us-east-2.amazonaws.com/feat3_biomass_Opal_lede2_0126_4b2316fbfa.jpg,N,,2026-01-09 08:58:00.921191
,,2026-01-09 12:32:04+00:00,International Airport Review,Watson Island heliport advanced air mobility plans - International Airport Review,Gabriel Higgins,,,,,https://www.internationalairportreview.com/news/301570/skyports-and-linden-partner-to-transform-watson-island-heliport-into-advanced-air-mobility-hub/,"Skyports and Linden partner to transform Watson Island heliport into advanced air mobility hub A new partnership will modernise Miami’s Watson Island Heliport, supporting helicopters today and paving the way for future eVTOL operations and advanced air mobility growth.
The collaboration aims to transform the historic Watson Island site into one of the most advanced urban aviation facilities in the United States.
The upgraded heliport will support both traditional rotorcraft operations and next generation eVTOL services, positioning Miami at the forefront of the emerging Advanced Air Mobility sector.
Its location makes it uniquely strategic, as the closest landing zone to Miami Beach and just minutes from Downtown Miami, Brickell, Fisher Island, Star Island, Palm Island, Hibiscus Island and the Port of Miami.
Together, Skyports and Linden will assess the highest and best use of the Watson Island Heliport, with the goal of restoring it to prominence while supporting the long-term growth of advanced air mobility in Miami.","Skyports and Linden partner to transform Watson Island heliport into advanced air mobility hub

A new partnership will modernise Miami’s Watson Island Heliport, supporting helicopters today and paving the way for future eVTOL operations and advanced air mobility growth.

Credit: Skyports

Skyports Infrastructure and Linden Airport Services Corporation have signed a Memorandum of Understanding to develop, modernise and operationalise Miami’s Watson Island Heliport, creating an immediate landing zone for helicopters and a future hub for electric vertical take-off and landing aircraft.

The collaboration aims to transform the historic Watson Island site into one of the most advanced urban aviation facilities in the United States. The upgraded heliport will support both traditional rotorcraft operations and next generation eVTOL services, positioning Miami at the forefront of the emerging Advanced Air Mobility sector.

The project will bring together industry-leading partnerships and relationships, including engagement with helicopter and eVTOL operators, collaboration with real estate developers, and preparations for the introduction of future eVTOL services. A comprehensive development plan will set out how the site can be adapted to support safe, efficient and scalable urban aviation operations.

Watson Island has a long aviation history dating back to the early 20th century and once played a central role in Miami’s vertical aviation network. Its location makes it uniquely strategic, as the closest landing zone to Miami Beach and just minutes from Downtown Miami, Brickell, Fisher Island, Star Island, Palm Island, Hibiscus Island and the Port of Miami. This central position gives the heliport unmatched accessibility for residents, visitors and commercial operators, reinforcing its importance as South Florida prepares to become a leading global market for eVTOL operations.

Linden Airport Services Corporation has been involved with the Watson Island Heliport project for more than 20 years, having been awarded the original heliport contract and working to secure Federal Aviation Administration and Florida Department of Transportation approvals. Final local occupancy permits are now in process. Linden’s experience managing Linden Airport in New Jersey, a major helicopter base serving the New York metropolitan area, complements Skyports’ operational expertise as the manager of the Downtown Skyport in New York, the world’s busiest civilian commercial heliport.

Together, Skyports and Linden will assess the highest and best use of the Watson Island Heliport, with the goal of restoring it to prominence while supporting the long-term growth of advanced air mobility in Miami.

“Watson Island is an extraordinary asset for Miami and a pivotal location for the future of urban aviation,” said Robbie Ladov, General Manager of US Heliports and Vertiports at Skyports Infrastructure. “By partnering with Linden, we are combining Skyports’ global leadership in skyport development with Linden’s decades-long dedication to preparing this site. Together, we are laying the foundation for a next generation facility that will serve the region for decades to come.”

Paul Dudley, CEO of Linden Airport Services Corporation, added: “Our commitment to Watson Island spans more than 20 years, navigating regulatory and operational milestones to get this site ready for the future. Partnering with Skyports enables us to advance the heliport into a modern skyport, engage key aviation and real estate partners, and help establish Miami as a leader in advanced air mobility.”

Both organisations will continue to work closely with local authorities and industry stakeholders as development progresses.",https://www.internationalairportreview.com/wp-content/uploads/Watson-Island-Heliport-Map-for-press.jpg,N,,2026-01-09 08:58:05.461632
,,2026-01-09 12:16:11+00:00,Red River Farm Network,A Biofuels Joint Venture Created - Red River Farm Network,Don Wick,,,,,https://www.rrfn.com/2026/01/09/a-biofuels-joint-venture-created/,"Corteva and BP have launched a 50-50 joint venture called Etlas.
The plan is to produce biofuels, like sustainable aviation fuel and renewable diesel, from crops including canola, sunflower and mustard.
Etlas plans to produce one million metric tons of feedstock per year by the mid-2030s.","Corteva and BP have launched a 50-50 joint venture called Etlas. The plan is to produce biofuels, like sustainable aviation fuel and renewable diesel, from crops including canola, sunflower and mustard. Etlas plans to produce one million metric tons of feedstock per year by the mid-2030s.",https://www.rrfn.com/wp-content/uploads/2018/04/rrfn_default_share_image.png,N,,2026-01-09 07:58:03.845374
,,2026-01-09 12:11:51+00:00,www.openaccessgovernment.org,The current options for the disposal of municipal solid waste - Open Access Government,,,,,,https://www.openaccessgovernment.org/the-current-options-for-the-disposal-of-municipal-solid-waste/203100/,Second-generation sustainable aviation fuel (SAF) manufacture. There is growing government and industry recognition that non-recyclable MSW can serve ...,Not Available,,Y,,2026-01-09 07:58:11.044436
,,2026-01-09 12:00:56+00:00,Washington State Standard,Washington state pumps more tax dollars toward green jet fuel,"Tom Banse, Jerry Cornfield, Yereth Rosen",,,,,https://washingtonstatestandard.com/2026/01/09/washington-state-pumps-more-tax-dollars-toward-green-jet-fuel/,"The earlier funding was meant to lure alternative fuel refiners to Washington state, supports a Washington State University research lab, and incentivizes green jet fuel use in the state.
The industry’s moniker for alternative jet fuel is sustainable aviation fuel, or SAF for short.
Most jet engines are currently limited to a maximum 50% blend with conventional jet fuel.
A competitor named Twelve recently completed construction on a synthetic jet fuel plant in Moses Lake.
The U.S. Energy Information Administration estimated Washington’s jet fuel consumption at 848 million gallons in 2024.","A who’s who from Washington state business and Democratic politics on Thursday extolled the virtues of alternative jet fuel and said the state would strive to become the nation’s leading enabler of greener flying.

The occasion was a splashy launch event in Snohomish County for a new state-funded eco-fuel development nonprofit, dubbed the Cascadia Sustainable Aviation Accelerator.

The business accelerator debuted with $10 million in tax dollars approved by the Legislature, matched by another $10 million from an unidentified philanthropic donor. Those new commitments build on tens of millions of dollars the Legislature and Congress previously allocated. The earlier funding was meant to lure alternative fuel refiners to Washington state, supports a Washington State University research lab, and incentivizes green jet fuel use in the state.

Executives from Boeing, Amazon, Alaska Airlines and the Port of Seattle joined Gov. Bob Ferguson, state legislators and the president of WSU on stage at Boeing’s Future of Flight visitor center next to Paine Field.

“Collectively, we have the political will and the private partnerships to get big things done,” state Rep. Mia Gregerson, D-SeaTac, told the standing-room crowd.

State Sen. Marko Liias, D-Edmonds, said, “Sustainable aviation fuel is essential to decarbonizing air transportation, and Cascadia is the one region with the research, industry, policy and workforce needed to scale it.”

The state’s approach contrasts with the Trump administration, which just this week pulled the U.S. out of the foundational United Nations Framework Convention on Climate Change. Trump administration officials have heaped scorn on taxpayer-financed decarbonization incentives. They favor policies to maximize fossil fuel production to drive down energy costs.

“While there are confusing signals coming out of the other Washington, the rest of the world is all-in on sustainable aviation fuel,” Liias said. “This is the fuel of the future.”

The board chair and vice-chair of the new Cascadia Sustainable Aviation Accelerator said the trade organization would lead education and advocacy efforts, recruit companies, invest in research and go to bat for project developers.

The industry’s moniker for alternative jet fuel is sustainable aviation fuel, or SAF for short. There are multiple methods to make it using a variety of feedstocks such as crop and forestry waste, used cooking oil, algae or hydrogen. Depending on the details, the eco-fuel can reduce the carbon footprint of air travel by anywhere from 50% to 80%.

SAF is favored by airlines because it is a “drop-in” fuel, meaning it works with existing airplane engines and fuel infrastructure. Most jet engines are currently limited to a maximum 50% blend with conventional jet fuel. Major engine makers are in the process of testing and certifying engines for 100% SAF.

The trouble is that SAF currently costs two to five times as much as conventional jet fuel. The high price and limited supply are holding back wider adoption.

At present, there is no continuous, commercial-scale production in Washington state. But several major companies have plants in design or construction.

Dutch energy company SkyNRG said Thursday that it aims to break ground in late 2027 or in 2028 on a large biofuel production facility at the Wallula Gap industrial park along the Columbia River southeast of Pasco. The company plans to produce 50 million gallons per year of SAF and renewable diesel by converting bio-methane collected from local and regional landfills, as well as a little bit from cow manure digesters.

A competitor named Twelve recently completed construction on a synthetic jet fuel plant in Moses Lake. Twelve plans to use a power-to-liquid production method that relies on lots of renewable electricity to transform carbon dioxide captured from the air and water into what it calls “E-Jet” fuel.

Executives at Twelve portrayed the Moses Lake facility as a demonstration plant. It may begin production in a matter of weeks and ramp up to 50,000 gallons annually. The California-based company plans to locate a much larger commercial-scale E-Jet fuel plant somewhere in the Midwest.

On the west side of the Cascades, BP received nearly $27 million in federal grant funding in 2024 to buy equipment and make upgrades at its Cherry Point refinery. The goal is to begin production in 2029 of 10 million gallons of SAF annually using biomass feedstocks, like food waste, vegetable oil and beef tallow. The BP oil refinery in Whatcom County is connected by pipeline to Seattle-Tacoma International Airport, and the major airports in Vancouver, British Columbia and Portland, Oregon.

If you add up the capacity of the eco-jet fuel projects announced in the state so far, you make only a modest dent to transition Washington airports to climate-friendly fuel. The U.S. Energy Information Administration estimated Washington’s jet fuel consumption at 848 million gallons in 2024. According to the Port of Seattle, Sea-Tac Airport alone dispenses around 600 million gallons of jet fuel per year, a number expected to rise over the coming decade.

By the end of the decade though, an Oregon border county could become home to a much larger alternative fuel refinery whose output would equal Sea-Tac’s annual demand. A Texas-headquartered company named NXTClean Fuels is in the process of permitting an alternative jet fuel and renewable diesel refinery along the Columbia River near Clatskanie with a capacity of 750 million gallons per year.

If that project comes to fruition, it would theoretically go a long way toward addressing limited supply in the Pacific Northwest. But that still leaves the barriers of feedstock availability and affordability for airlines.

During a press availability following Thursday’s launch event, the CEO of SkyNRG Americas, John Plaza, said he foresaw plenty of availability of the renewable natural gas raw ingredient that his company needs to make jet fuel at its planned southeast Washington plant.

Airlines such as Amazon Air have demonstrated some willingness to pay a premium to achieve climate and sustainability goals.

“We strive to have the airline industry pay as little a premium as possible,” Plaza said.",https://washingtonstatestandard.com/wp-content/uploads/2026/01/alaska_airlines_biofuel_001-2048x1363.jpg,N,,2026-01-09 07:58:14.308025
