id,name,published,outlet,title,authors,category,market,categoryorder,articleorder,url,description,text,image,error,sentiment,firstEyes
,,2025-12-18 04:04:28+00:00,BioEnergy Times,RSB ICAO CORSIA scheme Archives - BioEnergy Times,Not Available,,,,,https://bioenergytimes.com/tag/rsb-icao-corsia-scheme/,"BioEnergy Times brings the latest News & Information from India & around the world related to the BioFuels and BioEnergy.
Contact us: news@bioenergytimes.com","BioEnergy Times brings the latest News & Information from India & around the world related to the BioFuels and BioEnergy.

Contact us: news@bioenergytimes.com",https://bioenergytimes.com/wp-content/uploads/2024/03/cropped-bioenergytimes-thumbnail-32x32.png,N,,2025-12-17 23:59:01.278755
