id,name,published,outlet,title,authors,category,market,categoryorder,articleorder,url,description,text,image,error,sentiment,firstEyes
,,2025-12-21 09:44:21+00:00,ESG Today,ESG Today: Week in Review,Mark Segal,,,,,https://www.esgtoday.com/esg-today-week-in-review-242/,"Welcome to the final ESG Today Week in Review for 2025!
This week in ESG news: New York to require mandatory GHG emissions reporting for large emitters from 2027; EU to scrap 2035 ban on combustion engine cars; Microsoft signs large scale bioenergy-based carbon removal agreement; BlackRock loses another multi-billion dollar pension fund mandate over ESG policies; Canada to launch sustainable investment taxonomy in 2026; Google signs 21-year clean energy deal with TotalEnergies to power data centers; EU expands carbon tax on imports to machinery, appliances; IATA warns poor policy is holding back growth of sustainable aviation fuel production; asset owners increasing sustainability integration in investing in 2025, and more.
See below for the highlights of the past week, and get all your ESG news at ESG Today: Sustainability Goals, Initiatives and Achievements Microsoft Signs Enhanced Rock Weathering Carbon Removal Deal with InPlanet DHL Signs Emissions Reduction Rights Deal with Air France KLM Cargo Google, ReNew Sign Deal to Build 150 MW Solar Project in India Guest Post: 2026 The Credibility Test – Eight Sustainability Trends that Will Matter for Businesses Microsoft Signs Long-term Clean Energy and AI Deployment Deal in Spain with Iberdrola Google Signs 21-Year Clean Energy Deal with TotalEnergies to Power Malaysia Data Centers Neste Pushes Back Climate Targets Due to Required Investments that are “Currently Not Realistic” SBTi Pilots New Draft Power Sector Net Zero Standard IATA Warns Poor Policy is Slowing Production Growth, Increasing Price of Sustainable Aviation Fuel Microsoft Signs 3.6 Million Ton CO2 Removal Deal with U.S. Clean Fuel and Carbon Capture Project Government & Regulators EU Council Adopts Revised EUDR, Marking Final Step in Delay of Supply Chain Deforestation Law EU to Scrap Requirements for 100% Emissions Reduction from New Cars by 2035 EU to Expand CBAM Carbon Import Tax to Downstream Products to Avoid Production Shift to Countries with Weaker Climate Policies Sustainability Reporting EU Parliament Approves Omnibus Agreement to Cut Sustainability Reporting and Due Diligence Requirements Guest Post – The Smartest Path to CDP Success: Reframe Your Score as A Catalyst for Action and Advantage New York Releases Regulation Requiring Mandatory GHG Reporting for Large Emitters from 2027 ESG Services and Tools Barclays, ExpectAI Partner to Help SMEs Use Sustainability Data to Grow Profits Sustainable Finance Canada to Launch Sustainable Investment Taxonomy in 2026 Sustainable Investing STOXX Acquires Sustainable Investment Solutions Provider ECPI Asset Owners Increased Use of Sustainability Factors in 2025, with Performance as Top Driver: FTSE Russell Survey BlackRock Loses $5.9 Billion Mandate with Dutch Pension Fund Over ESG Stance Private Equity & Venture Capital Radiant Raises $300 Million to Mass Produce Small Nuclear Reactors HASI, KKR Double Down on U.S.
Sustainable Infrastructure Platform with New $1 Billion Commitment SuperCircle Raises $24 Million to Help Retail Brands Make Money Recycling End-of-Life Textiles Exec Moves Nordea AM Appoints 2 New Portfolio Managers for Sustainable Investing Team","Welcome to the final ESG Today Week in Review for 2025!

This week in ESG news: New York to require mandatory GHG emissions reporting for large emitters from 2027; EU to scrap 2035 ban on combustion engine cars; Microsoft signs large scale bioenergy-based carbon removal agreement; BlackRock loses another multi-billion dollar pension fund mandate over ESG policies; Canada to launch sustainable investment taxonomy in 2026; Google signs 21-year clean energy deal with TotalEnergies to power data centers; EU expands carbon tax on imports to machinery, appliances; IATA warns poor policy is holding back growth of sustainable aviation fuel production; asset owners increasing sustainability integration in investing in 2025, and more.

See below for the highlights of the past week, and get all your ESG news at ESG Today:

Sustainability Goals, Initiatives and Achievements

Microsoft Signs Enhanced Rock Weathering Carbon Removal Deal with InPlanet

DHL Signs Emissions Reduction Rights Deal with Air France KLM Cargo

Google, ReNew Sign Deal to Build 150 MW Solar Project in India

Guest Post: 2026 The Credibility Test – Eight Sustainability Trends that Will Matter for Businesses

Microsoft Signs Long-term Clean Energy and AI Deployment Deal in Spain with Iberdrola

Google Signs 21-Year Clean Energy Deal with TotalEnergies to Power Malaysia Data Centers

Neste Pushes Back Climate Targets Due to Required Investments that are “Currently Not Realistic”

SBTi Pilots New Draft Power Sector Net Zero Standard

IATA Warns Poor Policy is Slowing Production Growth, Increasing Price of Sustainable Aviation Fuel

Microsoft Signs 3.6 Million Ton CO2 Removal Deal with U.S. Clean Fuel and Carbon Capture Project

Government & Regulators

EU Council Adopts Revised EUDR, Marking Final Step in Delay of Supply Chain Deforestation Law

EU to Scrap Requirements for 100% Emissions Reduction from New Cars by 2035

EU to Expand CBAM Carbon Import Tax to Downstream Products to Avoid Production Shift to Countries with Weaker Climate Policies

Sustainability Reporting

EU Parliament Approves Omnibus Agreement to Cut Sustainability Reporting and Due Diligence Requirements

Guest Post – The Smartest Path to CDP Success: Reframe Your Score as A Catalyst for Action and Advantage

New York Releases Regulation Requiring Mandatory GHG Reporting for Large Emitters from 2027

ESG Services and Tools

Barclays, ExpectAI Partner to Help SMEs Use Sustainability Data to Grow Profits

Sustainable Finance

Canada to Launch Sustainable Investment Taxonomy in 2026

Sustainable Investing

STOXX Acquires Sustainable Investment Solutions Provider ECPI

Asset Owners Increased Use of Sustainability Factors in 2025, with Performance as Top Driver: FTSE Russell Survey

BlackRock Loses $5.9 Billion Mandate with Dutch Pension Fund Over ESG Stance

Private Equity & Venture Capital

Radiant Raises $300 Million to Mass Produce Small Nuclear Reactors

HASI, KKR Double Down on U.S. Sustainable Infrastructure Platform with New $1 Billion Commitment

SuperCircle Raises $24 Million to Help Retail Brands Make Money Recycling End-of-Life Textiles

Exec Moves

Nordea AM Appoints 2 New Portfolio Managers for Sustainable Investing Team",https://www.esgtoday.com/wp-content/uploads/2025/12/Wind-Austria.jpg,N,,2025-12-21 08:57:12.236725
,,2025-12-21 09:39:46+00:00,FAN Transport Insights,JETEX Partners with Azzera to Propel Sustainable Aviation Forward - Full Avante News,WCA,,,,,https://fullavantenews.com/jetex-invests-azzera-sustainable-aviation/,"As reported by FAN Transport News, Azzera Inc., a leader in aviation sustainability solutions, has received a significant investment from JETEX, a prominent player in the private aviation sector.
Under this agreement, JETEX plans to incorporate Sustainable Aviation Fuel (SAF) into its operations starting in 2026.
Azzera Inc. has announced that JETEX is now one of its key strategic investors in their digital carbon-management initiative.
As part of this partnership, JETEX will collaborate with Azzera as it begins procuring sustainable aviation fuel for its fleet early next year-a landmark step in their commitment to sustainability.
Azzera also revealed that JETEX will serve as a primary partner on the new SAF Productivity Operations and Delivery (SAF POD) platform.","As reported by FAN Transport News, Azzera Inc., a leader in aviation sustainability solutions, has received a significant investment from JETEX, a prominent player in the private aviation sector. This partnership was unveiled at the Dubai Airshow 2025 and aims to enhance Azzera’s carbon-management capabilities while introducing innovative sustainability tools for clients.

Under this agreement, JETEX plans to incorporate Sustainable Aviation Fuel (SAF) into its operations starting in 2026. This will be facilitated through Azzera’s forthcoming SAF POD platform, which is designed to simplify the processes of sourcing, tracking, and certifying emissions related to SAF. Additionally, JETEX will utilize Azzera’s FlyBeyond API for instantaneous carbon offsetting and SAF pricing during flight bookings-empowering customers to opt for more environmentally friendly choices.

Azzera Inc. has announced that JETEX is now one of its key strategic investors in their digital carbon-management initiative. This funding positions Azzera to further enhance its technology offerings and expand its global reach while providing new tools aimed at helping clients offset their emissions effectively.

The collaboration established during the Dubai Airshow represents a pivotal move towards promoting cleaner operations within the aviation industry. As part of this partnership, JETEX will collaborate with Azzera as it begins procuring sustainable aviation fuel for its fleet early next year-a landmark step in their commitment to sustainability.

Azzera also revealed that JETEX will serve as a primary partner on the new SAF Productivity Operations and Delivery (SAF POD) platform. This tool is specifically designed to alleviate administrative challenges associated with adopting SAF across supply chains-an essential factor for scaling up usage among operators globally. The platform will be integrated into CELESTE, allowing aircraft operators seamless access to manage fuel tracking and emission reductions efficiently.

Moreover, by incorporating the FlyBeyond API into its charter sales framework, JETEX enables real-time carbon offsetting options directly within flight quotes-making it easier than ever for customers and operators alike to make sustainable decisions when booking flights.

“Our collaboration with JETEX reflects our mutual commitment towards embedding sustainability into every aspect of air travel,” stated Puja Mahajan, CEO of Azzera. “Together we are transforming climate aspirations into actionable strategies through user-friendly technologies that promote transparency and accountability.”

Adel Mardini, CEO of JETEX remarked on this partnership: “As one of the largest entities in private aviation globally, we recognize our duty toward achieving ambitious climate goals within our industry. Partnering with Azzera allows us not only to innovate but also drive substantial progress toward decarbonization.”

This investment marks an important milestone as part of Azzera’s recent capital raise totaling USD $800 million aimed at advancing their digital ecosystem focused on emissions management compliance automation alongside access to premium carbon markets via CELESTE.",https://fullavantenews.com/wp-content/uploads/2025/12/120989-jetex-invests-in-azzera-to-advance-sustainable-aviation-initiatives.jpg,N,,2025-12-21 07:57:22.369489
,,2025-12-21 08:48:40+00:00,www.livehindustan.com,टमाटर के कचरे से तेल की जरूरतें पूरी होगी - Hindustan,,,,,,https://www.livehindustan.com/ncr/new-delhi/story-scientists-in-europe-develop-sustainable-aviation-fuel-from-tomato-waste-201766306661475.html,Hindi NewsNcr NewsDelhi NewsScientists in Europe Develop Sustainable Aviation Fuel from Tomato Waste ...,Not Available,,Y,,2025-12-21 08:57:19.586252
,,2025-12-21 08:41:50+00:00,DredgeWire,DEME secures two marine works contracts in Italy and Spain - DredgeWire,Lisa Parker,,,,,https://dredgewire.com/deme-secures-two-marine-works-contracts-in-italy-and-spain/,"DEME’s Dredging & Infra segment has secured two marine works contracts1 in Southern Europe, highlighting its expertise in environmental remediation and coastal protection.
In Italy, DEME will deliver marine works for the prestigious 38th America’s Cup sailing competition in Naples, including offshore breakwaters and seabed remediation at the Bagnoli-Coroglio site.
They also strengthen our position in the Mediterranean, where DEME continues to partner with local stakeholders to deliver high impact projects.” Marine works in Bagnoli-Coroglio This contract win further strengthens DEME’s portfolio of major marine projects in Italy.
About DEME DEME (Euronext Brussels: DEME) is a leading contractor in the fields of offshore energy, dredging, marine infrastructure, and environmental remediation.
DEME also engages in concessions activities in offshore wind, marine infrastructure, green hydrogen, and deep-sea mineral harvesting.","DEME’s Dredging & Infra segment has secured two marine works contracts1 in Southern Europe, highlighting its expertise in environmental remediation and coastal protection. In Italy, DEME will deliver marine works for the prestigious 38th America’s Cup sailing competition in Naples, including offshore breakwaters and seabed remediation at the Bagnoli-Coroglio site. Meanwhile, in Spain, DEME will restore three beaches along the Valencian coastline through a large-scale nourishment project, to combat erosion and safeguard the shoreline for the long term.

Jan Vandenbroeck, Area Director South Europe, comments: “These two contracts underscore DEME’s commitment to delivering sustainable, innovative solutions to complex marine challenges – from environmental remediation to coastal protection – while supporting the legendary America’s Cup and safeguarding natural heritage. They also strengthen our position in the Mediterranean, where DEME continues to partner with local stakeholders to deliver high impact projects.”

Marine works in Bagnoli-Coroglio

This contract win further strengthens DEME’s portfolio of major marine projects in Italy. The project in in the Bay of Naples focuses on the remediation and redevelopment of the Bagnoli–Coroglio industrial area. A consortium of DEME and Italian companies Savarese Costruzioni and Iterga Costruzioni Generali will perform marine works including 900 meters of offshore breakwaters, the removal of approximately 130,000 m³ of sediments, and demolition of the decaying central pier and former steel plant service buildings. Substantial completion is scheduled by next summer to enable urban regeneration and preparations for the preliminary regattas of the America’s Cup.

Valencia beach nourishment

In Spain, DEME has been awarded the Valencia beach nourishment project by the Ministry for Ecological Transition (MITECO) in a joint venture with Rover Maritime. The project will restore and protect three popular beaches (Sagunto, Sueca, and Cullera) which have suffered severe erosion over recent decades. Works include dredging and placing approximately 3 million m³ of sand using DEME’s advanced trailing suction hopper dredger Bonny River, which can operate at depths beyond 100 meters. Additional measures such as dune restoration and new groins will ensure long-term coastal stability, allowing residents and visitors to enjoy the coastline in its natural splendor once again.

About DEME

DEME (Euronext Brussels: DEME) is a leading contractor in the fields of offshore energy, dredging, marine infrastructure, and environmental remediation. DEME also engages in concessions activities in offshore wind, marine infrastructure, green hydrogen, and deep-sea mineral harvesting. The company can build on nearly 150 years of experience and is a front-runner in innovation and new technologies. DEME’s vision is to work towards a sustainable future by offering solutions for global challenges: climate change, a growing population and urbanization, increasing maritime trade, and environmental issues. With a team of more than 5,800 highly skilled professionals and one of the most advanced fleets in the world, DEME is well-positioned to tackle even the most complex projects. DEME realized a turnover of 4.1 billion euros with an EBITDA of 764 million euros in 2024. For more information, please visit www.deme-group.com.

Contact

Media relations Investor relations

Frederic Dryhoel Carl Vanden Bussche

dryhoel.frederic@deme-group.com vanden.bussche.carl@deme-group.com

+32 473 86 31 91 +32 498 90 61 13",https://dredgewire.com/wp-content/uploads/2025/12/3-8.jpg,N,,2025-12-21 08:57:24.738423
,,2025-12-21 08:33:16+00:00,koreajoongangdaily.joins.com,Korea aims to cut carbon emissions at int'l airports by 10% by 2030,koreajoongangdaily.joins.com,,,,,https://koreajoongangdaily.joins.com/news/2025-12-21/national/environment/Korea-aims-to-cut-carbon-emissions-at-intl-airports-by-10-by-2030/2482860,"Korea aims to cut carbon emissions at its international airports by 10 percent by 2030 while expanding the use of sustainable aviation fuel (SAF), a government report showed Sunday.
Under the blueprint for the 2026-2030 period, set by the Ministry of Land, Infrastructure and Transport, carbon emissions at Korea's international airports are projected to reach 29.8 million tons in 2030, up 28 percent from 23.3 million tons recorded this year.
The government aims to reduce the projected amount by 10 percent, or 2.87 million tons.
The report said the reduction can be achieved by using SAF, shorter standby time during takeoff and landing and improved efficiency in airport operations.
Korea will come up with measures to ease the financial burden on air carriers, considering that SAF prices are around three times higher than those of conventional jet fuel, including partially assisting with related costs.","Korea aims to cut carbon emissions at its international airports by 10 percent by 2030 while expanding the use of sustainable aviation fuel (SAF), a government report showed Sunday.

Under the blueprint for the 2026-2030 period, set by the Ministry of Land, Infrastructure and Transport, carbon emissions at Korea's international airports are projected to reach 29.8 million tons in 2030, up 28 percent from 23.3 million tons recorded this year.

The government aims to reduce the projected amount by 10 percent, or 2.87 million tons.

The report said the reduction can be achieved by using SAF, shorter standby time during takeoff and landing and improved efficiency in airport operations.

In line with the efforts, international aircraft taking off from Korea will be required to use SAF for at least 1 percent of their fuel, and the share will be raised to between 3 percent and 5 percent after 2030.

Korea will come up with measures to ease the financial burden on air carriers, considering that SAF prices are around three times higher than those of conventional jet fuel, including partially assisting with related costs.

Yonhap",https://koreajoongangdaily.joins.com/data/photo/2025/12/21/dd2c367c-8433-4717-82a7-8f1a438344fb.jpg,N,,2025-12-21 08:57:30.679733
,,2025-12-21 06:33:07+00:00,Apply Kite,PhD Cohort Programme in Sustainable Aviation at Imperial College London - ApplyKite,Not Available,,,,,https://www.applykite.com/positions/phd-cohort-programme-in-sustainable-aviation-at-imperial-college-london-gn9y4certu,PhD Cohort Programme in Sustainable Aviation at Imperial College London  Imperial College London,Not Available,https://kitepostmedia.blob.core.windows.net/payments/university_logos/imperial_college_london_20251103_020515_af54a64f.png?sp=r&st=2025-09-28T19:16:03Z&se=2026-09-01T03:31:03Z&sv=2024-11-04&sr=c&sig=sslrXrw8n6zC0RmGm9ygokR3riTAhruPDIpe2v8cORY%3D,N,,2025-12-21 07:57:27.527032
,,2025-12-21 05:39:32+00:00,www.facebook.com,Korea aims to cut carbon emissions at its international airports by 10 percent by 2030 while ...,Not Available,,,,,https://www.facebook.com/thekoreatimes/posts/korea-aims-to-cut-carbon-emissions-at-its-international-airports-by-10-percent-b/1183394040633026/,"Korea aims to cut carbon emissions at int'l airports by 10% by 2030 - The Korea Times Korea aims to cut carbon emissions at its international airports by 10 percent by 2030 while expanding the use of sustainable aviation fuel (SAF),...","Korea aims to cut carbon emissions at int'l airports by 10% by 2030 - The Korea Times

Korea aims to cut carbon emissions at its international airports by 10 percent by 2030 while expanding the use of sustainable aviation fuel (SAF),...",https://external.fagc3-1.fna.fbcdn.net/emg1/v/t13/15607022167515977438?url=https%3a%2f%2fnewsimg.koreatimes.co.kr%2f2025%2f12%2f21%2f486fb966-eba1-4378-97a8-28ec8d040fbd.png&fb_obo=1&utld=koreatimes.co.kr&stp=c0.5000x0.5000f_dst-jpg_flffffff_p600x600_q75_tt6&_nc_gid=HPfr-sp6YBFEgmA5jSW-CQ&_nc_oc=AdlcmoFzgBtbiInkEMFT0_oVbxO0_y2Ij4ruLNTzDMxtjnkiag1C4plZafcSd9gXRqEaLeO6MQtqT_HNoVBU3WWr&ccb=13-1&oh=06_Q3-6AQ6mw5Nr-w3INW3Eeru7aT2bCav2mNaC-Dc-_df8WLgL&oe=69497802&_nc_sid=867500,N,,2025-12-21 02:56:14.292706
,,2025-12-21 04:59:40+00:00,Lokmat Times,S. Korea aims to cut carbon emissions at international airports by 10 pc by 2030,Not Available,,,,,https://www.lokmattimes.com/business/s-korea-aims-to-cut-carbon-emissions-at-international-airports-by-10-pc-by-2030/,"Seoul, Dec 21 South Korea aims to cut carbon emissions at its international airports by 10 percent by 2030 while expanding the use of sustainable aviation fuel (SAF), a government report showed on Sunday.
Under the blueprint for the 2026-2030 period, set by the transport, environment and industry ministries, carbon emissions at South Korea's international airports are projected to reach 29.8 million tons in 2030, up 28 percent from 23.3 million tons recorded this year.
The government aims to reduce the projected amount by 10 percent, or 2.87 million tons, reports Yonhap news agency.
Meanwhile, Korean Air build a next-generation aircraft maintenance hangar at Incheon International Airport, South Korea's main gateway, under a 176 billion-won (US$119.2 million) joint investment deal with the airport operator, the airline said.
The 69,299-square-meter site will accommodate two wide-body aircraft and one narrow-body aircraft at once.","Seoul, Dec 21 South Korea aims to cut carbon emissions at its international airports by 10 percent by 2030 while expanding the use of sustainable aviation fuel (SAF), a government report showed on Sunday.

Under the blueprint for the 2026-2030 period, set by the transport, environment and industry ministries, carbon emissions at South Korea's international airports are projected to reach 29.8 million tons in 2030, up 28 percent from 23.3 million tons recorded this year.

The government aims to reduce the projected amount by 10 percent, or 2.87 million tons, reports Yonhap news agency.

The report said the reduction can be achieved by using SAF, shorter standby time during takeoff and landing, and improved efficiency in airport operations.

In line with the efforts, international aircraft taking off from South Korea will be required to use SAF for at least 1 percent of their fuel, and the share will be raised to between 3 percent and 5 percent after 2030.

South Korea will come up with measures to ease the financial burden on air carriers, considering that SAF prices are around three times higher than those of conventional jet fuel, including partially assisting with related costs.

Meanwhile, Korean Air build a next-generation aircraft maintenance hangar at Incheon International Airport, South Korea's main gateway, under a 176 billion-won (US$119.2 million) joint investment deal with the airport operator, the airline said.

The new hangar will be located inside the airport's High Tech Aviation Complex and will support airframe inspections, component checks, heavy maintenance and aircraft modification. The 69,299-square-meter site will accommodate two wide-body aircraft and one narrow-body aircraft at once. Construction is set to begin in 2027, with operations planned from late 2029.

Korean Air said the facility will strengthen its maintenance, repair and overhaul (MRO) capabilities ahead of the launch of the integrated carrier following the acquisition of rival carrier Asiana Airlines Inc.

Disclaimer: This post has been auto-published from an agency feed without any modifications to the text and has not been reviewed by an editor

Open in app",https://d3pc1xvrcw35tl.cloudfront.net/ln/feedImages/1200x900/80fdde0ce82010de5a372a28b49e97f5_202512.jpg,N,,2025-12-21 00:57:04.943906
