id,name,published,outlet,title,authors,category,market,categoryorder,articleorder,url,description,text,image,error,sentiment,firstEyes
,Maryland Matters,2025-12-26 10:31:29+00:00,Maryland Matters,Maryland universities saw international student enrollment decline over past year,Nicole Pilsbury,,,,,https://marylandmatters.org/2025/12/26/maryland-universities-saw-international-student-enrollment-decline-over-past-year/,"Maryland universities lost at least 449 international students in the past year, likely more, as Trump administration travel bans, visa interview pauses and revocations, and a lack of support have those students considering other options, experts said.","Maryland's public campuses lost several hundred international students between fall 2025 and this fall, according to campuses that provided data, as Trump policies reining in visasmany of the schools reportedfell from 7,608 last fall to 7(Photo by Klaus Vedfelt/Getty Stock ImagesMaryland’s public universities lost at least 449 international students in the past year, likely more, as Trump administration travel bans, visa interview pauses and revocations, and a lack of support have those students considering other options, experts said.
Eight of the 11 universities in the state that responded to a request for data reported declines in the number of international students in fall 2025, compared to fall 2024, losing a total of 569 students over the year. That number was offset by the three campuses that gained a total of 120 students.
The University of Maryland, College Park lost the largest number of students, going from about 4,260 in Fall 2024 to about 3,980 in Fall 2025 — a loss of nearly 300 students, or 6.7%. Campus Counts, the university’s enrollment map report, does not provide data from countries with less than five students, meaning the decrease could be larger.
St. Mary’s College of Maryland had the largest decrease of 80% — but that reflected a drop from just five international students in fall 2024 and one in fall 2025.
Maryland Matters reached out to 16 Maryland universities early in the semester. Eleven provided data on the number of international students enrolled at their university, and five were either not traditional campuses, such as the University of Maryland Global Campus, or did not respond with data.
﻿﻿﻿
Total international student enrollment fell from 7,608 to 7,159, out of a total of more than 118,000 students on the 11 campuses this fall.
The declines follow the Trump administration’s ongoing immigration crackdown and revocation of thousands of student visas in spring. Though many of these visas have been restored, tensions remain high as international students grapple with potential challenges concerning their access to education.
Travel bans, visa interview pauses and a lack of support from the Trump administration, in addition to visa terminations, deter students from choosing to study in the United States and increase global competition, said Rachel Banks, the senior director of public policy and legislative strategy at NAFSA, an international educators association.
“We’re in this sort of fraught, anxious, uncertain period — you have students considering other options, especially in the English language space,” Banks said. “They’re high-quality, and welcoming.”
Banks also cited the Trump administration’s proposals to end duration of status by limiting international students’ studies to four years, while the original duration of status policy allows international students to stay in the United States until their studies are complete. Students — especially those in a Ph.D. program — may choose other countries to study due to concerns that they will not finish their program before their duration of status expires, Banks said.
“If there’s that uncertainty hanging over a student’s head, they’re going to think twice — you know — ‘I’m better off going to Canada, or the UK, or even countries that are non-English speaking,’” Banks said.
The University of Maryland, Baltimore County lost more than 200 international students from Fall 2024 to Fall 2025, leaving them with a 23% decrease. While the number of international undergraduate students increased by 22, the number of incoming international graduate students decreased by 234 at UMBC.
“While the decline in incoming international graduate students is concerning, we are optimistic that we will be able to work with international students to navigate the changing environment and continue to be a thriving community of international learners, researchers and teachers,” Yvette Mozie-Ross, the university’s vice provost for enrollment management and planning, said in a statement.
﻿﻿
Frostburg State University saw a 15.2% decrease in international students on campus. This does not account for its partnership with the Hunan University of Technology and Business in Changsha, China, which saw a 24.3%  increase in enrollment.
Salisbury University’s international student enrollment dropped by 11% — a decrease of 10 students. Fall 2025 numbers are the university’s estimate from late September.
Bowie State University, Towson University and the University of Maryland, Baltimore all faced decreases of less than 10% — losing 19, 11 and 12 students, respectively.
“International students are experiencing increased uncertainty in the past year from new federal proposals and policies that have targeted them,” Michael Sandler, the University System of Maryland’s vice chancellor for communications and marketing, said in a statement. “These actions will constrict the pipeline of international talent that contributes to our academic strength and scientific innovation.”
Three universities — the University of Maryland Eastern Shore, Morgan State University and Coppin State University — saw increases in international student enrollment. Coppin State University had the largest increase of international students, at 25%, with 16 extra studens. The University of Maryland Eastern Shore and Morgan State University increased their international student enrollment by 8.1% and 9.2%, or 9 and 95 more students, respectively.
Banks emphasized the importance of international talent at universities, especially at large research institutions, such as those that contribute to research in the health care field or make technological advances.
She also noted that international students bring culture to domestic students who may not be able to have their own international experience, and presented worries about culture-focused small businesses that were inspired by international student’s presence.
“International students play an essential role in Maryland’s campus communities, bringing cultural diversity, global perspectives and research talent,” Sanjay Rai, the Maryland Higher Education Commission’s secretary, said in a statement. “While some institutions have seen short-term decreases, Maryland remains committed to being a welcoming destination for students around the world.”
SUPPORT: YOU MAKE OUR WORK POSSIBLE",https://marylandmatters.org/wp-content/uploads/2023/08/GettyImages-1171000142-1-1024x683.jpg,,,2025-12-26 08:11:53.107045
,Virginia Mercury,2025-12-26 10:15:58+00:00,Virginia Mercury,Federal funding shifts cloud Virginia’s transportation plans for 2026,Ian Stewart,,,,,https://virginiamercury.com/2025/12/26/federal-funding-shifts-cloud-virginias-transportation-plans-for-2026/,"Virginia’s transportation system is massive, with about 129,000 lane miles of roads and roughly 5,900 miles of rail criss-crossing the commonwealth, according to the Virginia Department of Transportation and a 2022 Virginia Statewide Rail Plan.   There’s always some kind of improvement or expansion underway, leaving drivers and commuters wondering when relie[...]","The Hampton Roads Bridge-Tunnel, the largest transportation project in Virginia history, is expected to reach substantial completion within the next year. (Photo by Sarah Vogelsong/Virginia Mercury)Virginia’s transportation system is massive, with about 129,000 lane miles of roads and roughly 5,900 miles of rail criss-crossing the commonwealth, according to the Virginia Department of Transportation and a 2022 Virginia Statewide Rail Plan.  
There’s always some kind of improvement or expansion underway, leaving drivers and commuters wondering when relief will arrive. 
But before unpacking what projects Virginians can expect in 2026, federal funding looms as a major factor shaping what moves forward — and what does not.
“Probably the biggest change to transportation development for 2026 is the fallout that all of our local and state partners are feeling from federal funding,” said Brantley Tyndall, director at BikeWalkRVA. 
”Federal funding in many ways [will be] reduced or dried up. And in particular the USDOT has been ordered to oppose the funding of bike/ped projects. They are viewed as antagonistic to cars and driving. We think that’s very shortsighted. It’s going to lead to years and years of funding short falls that will be very difficult to fill.”
 Some bright federal funding spots

In November, U.S. Sens. Mark Warner and Tim Kaine, both Democrats, touted an almost $70 million release of federal grant funding to improve Virginia’s bus and rail systems. Part of that package includes $8.6 million to the Virginia Department of Rail and Public Transportation system to replace aging vehicles. 
Also included under that $70 million amount will be roughly $10.9 million to the city of Alexandria and $50.3 million to the Washington Metropolitan Area Transit Authority to convert buses to low or no emission vehicles. 
The money comes from the Department of Transportation’s 2025-26 fiscal year Low or No Emission program and a FY25 Buses & Bus Facilities Program — all part of the Bipartisan Infrastructure Law passed during President Biden’s administration. 
Also in November, U.S. Transportation Secretary Sean Duffy released a similar press release announcing the same grants, describing them as part of the Trump’s administration’s investment in modernizing America’s transit bus infrastructure. 
 Highlights for 2026 at the General Assembly

With an eye toward 2026, here’s what some government and transportation officials say are on the horizon for the new year. 
Del. Karrie Delaney, D-Fairfax, chairs the Transportation Committee. She said one of the biggest issues her committee will be taking up next session will involve expanding photo speed enforcement devices, which she said did not become law during the previous session. 
“That was a big conversation last session and an important one,” Delaney said. “I think that we’re going to get a little more into [it] this session because the crime commission just released a study that I had asked them to complete.” Delaney said the report was based on conversations from the last session. 
“We just need to have this looked at a little closer so that we can really drill down on where the issues are, and what legislative solutions are needed to address,” she said. 
Delaney emphasized that some of those issues range from some transportation board members wanting to expand their use to include more locations — which some lawmakers disagree with. At the same time, there’s a debate about whether the current speed enforcement cameras already in place are doing what they’re supposed to be doing. 
“Are they fair? Are they just? And there’s been a lot of concern about their revenue generation,” Delaney said. “There are some localities in the commonwealth that are making thousands of dollars a year in profits off of their speed cameras. And now those funds are going to the general funds, and adding quite a bit of cushion to their budget. It creates, at a minimum, a concern that localities have an incentive to police for profit.”
The Virginia Mercury reported on this bill last session.
 Hampton Roads Bridge Tunnel

“The biggest project in the history of the commonwealth is, have you ever heard of a little thing called Hampton Roads Bridge Tunnel?” said John Mahaley, principal transportation planner at Hampton Roads Transportation Planning Organization. 
“If you’ve ever gone to the Outer Banks, you’ve been through there. That project needed to be done 30 years ago. Finally, we were able to get the money to do it.”
Mahaley said drivers will be able to see substantial completion within a year or so. But full completion — and opening the tunnel to traffic — won’t happen for several months after that, because eight express lanes still need to be built on either side of the water to match the tunnel.
 Washington Metro Area

Northern Virginia rail and transit commuters can expect to see line expansions, increased bus service and the installation of modernized bike parking within the Washington Metropolitan Area Transit Authority.
“We’re installing new bike lockers across 73 of our stations,” a Metro spokesperson said. “What that does is kind of enable a kind of wider reach for Metrorail stations. Most people might only walk 10 or 15 minutes to get to a Metro station. But if they live 20 or 25 minutes away, it gives people a safe place to park [their] bike.”
Lockers would cost $1 a day and bikes would be protected from rain and snow. Installation of the lockers will be ongoing, with updates posted on WMATA’s website. 
For riders on the Yellow Line, starting Dec. 31, the Yellow Line will extend to Greenbelt, serving destinations in D.C. including Shaw and Columbia Heights, among others. In mid-December, WMATA released a proposed budget that includes rail and service increases on 15% of their routes. If approved by the Metro Board of Directors, the new services would go into effect July 1, 2026.
 Richmond and Henrico eye more Fall Line Trail segments

“We are really looking at more groundbreaking and ribbon-cutting throughout the region,” said BikeWalkRVA’s Tyndall, in areas such as Lakeside, Bryan Park and Kanawha Plaza. 
“So by early 2026 we’re going to have about 20 miles under construction or at least under contract being administered and something active or completed in every locality.”
SUPPORT: YOU MAKE OUR WORK POSSIBLE",https://virginiamercury.com/wp-content/uploads/2023/08/HRBT-1024x603.jpg,,,2025-12-26 05:57:16.028264
,Pennsylvania Capital Star,2025-12-26 10:08:21+00:00,Pennsylvania Capital-Star,Staff favorites: Ian Karbal’s favorite Capital-Star stories of 2025,Ian Karbal,,,,,https://penncapital-star.com/media/staff-favorites-ian-karbals-favorite-capital-star-stories-of-2025/,"To state the obvious, it feels like it's been a year practically unlike any other for news.","Mobile soup kitchen God's Chuckwagon served 150 meals - quadruple the typical  count - in Shamokin and Sunbury during the first two days following the official stop of federal Supplemental Nutrition Assistance Program (SNAP) benefits. (Photo by Emily Previti/Pennsylvania Capital-Star)As the year ends, we’re taking an opportunity to highlight our favorite stories of 2025. 
The past year saw bitter fights over Pennsylvania’s state budget, drastic changes to federal programs the state relies on, consequential off-year elections, economic turbulence, data centers driving historic demands on the power grid, and history-making lawsuits. 
To state the obvious, it feels like it’s been a year practically unlike any other for news. 
Through it all, we’ve had changes at the Capital-Star too. In February, Tim Lambert became our new editor. Emily Previti joined our team in May to lead a new audio initiative that’s brought our work to radio stations across the commonwealth. We said goodbye to a great reporter, John Cole, and gained a new one in Whitney Downard.
Our team is small — four reporters and an editor. And it can be daunting to keep track of so many moving parts. But when I look at the work my colleagues have done, always centering the ordinary Pennsylvanians impacted by state and federal policy, I’m proud and grateful to be a part of it. 
When a federal shutdown threatened SNAP benefits for some of the most vulnerable Pennsylvanians, Emily Previti went to a part of the state where roughly one in five people rely on the program to keep food on their tables: Northumberland County. Emily not only broke down the complex hurdles the state faced in getting benefits to those who need them, but managed to convey the sense of fear and vulnerability by the people most affected, as well as their efforts to stay resilient.
Peter Hall has been doggedly reporting on what proliferating data centers mean for Pennsylvanians and their electric bills, as the federal government pushes to keep U.S. companies dominant in Artificial Intelligence. I thought this story was a great look at one federal government effort — to keep coal plants online past their planned retirement dates — and what that could mean for Pennsylvanian’s electric bills and the environment. 

Pa. electric customers will pay to keep an old power plant running under federal orders


Whitney Downard joined the Capital-Star in November, moving from one of our sister outlets in Indiana. She hit the ground running, covering one of the most consequential stories to emerge this year: the impacts of expiring subsidies for Pennsylvanians insured through Pennie plans, and the battle in Washington, D.C. over what to do about them. I loved this particular story because it was a human one, centering the stakes for one couple who rely on those subsidies for life-saving care.

Congressional health insurance tug-o-war puts Pennsylvanians in a lurch


As far as my work goes, I’m particularly proud of the stories I did documenting the Trump administration’s attempts to remake the federal workforce, and how it affected the tens of thousands of federal employees in Pennsylvania. While a lot has changed through lawsuits, pushback and changes in strategy in Washington, D.C., I think this early story I did captured the chaos of the early days of DOGE and mass layoffs, with a focus on affected workers and the impacts of the services they provide.

Trump’s cuts to federal workers have taken their toll on Pa. More are coming",https://penncapital-star.com/wp-content/uploads/2025/11/gods-chuck-wagon-2-1024x768.jpg,,,2025-12-26 05:12:13.237838
,Honolulu Civil Beat,2025-12-26 10:01:00+00:00,Honolulu Civil Beat,The Friday Crossword: New Year’s Traditions The World Over,"""The Civil Beat Staff""",,,,,https://www.civilbeat.org/2025/12/the-friday-crossword-new-years-traditions-the-world-over/,Prepare to ring in the New Year next week with these traditional customs from throughout the world.,Prepare to ring in the New Year next week with these traditional customs from throughout the world.,,,,2025-12-26 05:57:16.028264
,Honolulu Civil Beat,2025-12-26 10:01:00+00:00,Honolulu Civil Beat,Hawaiʻi Farmers Are Fighting To Keep Their Soil From Flushing Out To Sea,"""Thomas Heaton""",,,,,https://www.civilbeat.org/2025/12/hawaii-farmers-look-back-to-the-future-to-deal-with-climate-change/,"From kalo to cacao, farmers are adapting to effects of a changing climate by fusing traditional Hawaiian practices with new, regenerative agricultural techniques to save soils, streams and reefs. ","From kalo to cacao, farmers are adapting to effects of a changing climate by fusing traditional Hawaiian practices with new, regenerative agricultural techniques to save soils, streams and reefs.",,,,2025-12-26 05:57:16.028264
,Honolulu Civil Beat,2025-12-26 10:01:00+00:00,Honolulu Civil Beat,Kauai’s Next Top Cop To Take Over Department With ‘No Direction’,"""Brittany Lyte""",,,,,https://www.civilbeat.org/2025/12/kauais-next-top-cop-take-over-department-no-direction/,O‘ahu-born Rudy Tai describes himself as approachable with a positive attitude and the experience it takes to make demoralized employees feel inspired and valued.,O‘ahu-born Rudy Tai describes himself as approachable with a positive attitude and the experience it takes to make demoralized employees feel inspired and valued.,,,,2025-12-26 05:57:16.028264
,Honolulu Civil Beat,2025-12-26 10:01:00+00:00,Honolulu Civil Beat,Hawaiʻi Charter Schools Need Facilities. Could The DOE Be A Solution?,"""Megan Tagami""",,,,,https://www.civilbeat.org/2025/12/hawai%ca%bbi-charter-schools-need-facilities-could-the-doe-be-a-solution/,"Charter schools are the only growing sector of Hawaiʻi education, but limited funding and campus space has prevented schools from expanding and meeting families' demands. ","Charter schools are the only growing sector of Hawaiʻi education, but limited funding and campus space has prevented schools from expanding and meeting families' demands.",,,,2025-12-26 05:57:16.028264
