id,name,published,outlet,title,authors,category,market,categoryorder,articleorder,url,description,text,image,error,sentiment,firstEyes
,Minnesota Reformer,2025-12-26 13:00:40+00:00,Minnesota Reformer,Tragedy and a legislative boycott: 2025 year in review,Michelle Griffith,,,,,https://minnesotareformer.com/2025/12/26/tragedy-and-a-legislative-boycott-2025-year-in-review/,"On June 12 this year, editor Patrick Coolican and I sat down with Melissa Hortman to talk about the end of the legislative session. She walked in late carrying her lunch (Panera Bread), and I remember complimenting her fancy ice maker. On June 14 — a Saturday — I woke up to multiple missed calls […]","Speaker Emerita Melissa Hortman talks to colleagues during a special legislative session Monday, June 9, 2025 at the Minnesota State Capitol in St. Paul. (Photo by Nicole Neri/Minnesota Reformer)On June 12 this year, editor Patrick Coolican and I sat down with Melissa Hortman to talk about the end of the legislative session. She walked in late carrying her lunch (Panera Bread), and I remember complimenting her fancy ice maker.
On June 14 — a Saturday — I woke up to multiple missed calls from Patrick. This was unusual, because we’re lucky at the Reformer to rarely work weekends. He called to tell me that he heard Hortman had been shot and she may have died.
My colleagues were all out of town that weekend, so it was up to me to go to the press conference. I cried on the way there. I didn’t know Hortman well. I would only speak to her at press events, but it was surreal that someone I had known was killed. So, unfortunately, that day is top of mind for me when I reflect on 2025.
Despite the tragedies at the front of my mind, it was a good year, even if I’m hoping next year will be far different.
The 2024 election resulted in an evenly split 67-67 state House tie between Republicans and Democrats. A judge ruled that one of the House Democrats didn’t meet the state’s residency requirements, meaning that Democrats were down one member. Republicans had a temporary majority, and they intended to use it. This was the catalyst to a historic 2025 legislative session.
Here are some of the memorable Reformer stories I wrote in 2025.
The 2025 legislative session 
To kick off the legislative session earlier this year, House Democrats didn’t show.
The legislators battled over their interpretations of the Minnesota Constitution, which saw the Democrats’ seats empty while Republicans swore in their own speaker. Republicans held floor sessions and voted on bills without Democrats.
House Democrats sued their GOP colleagues and asked the Minnesota Supreme Court to weigh in and find that Republicans weren’t able to elect a speaker or conduct business without them. The state Supreme Court ruled in their favor.
During this time, House Republicans also threatened to unseat a Democratic lawmaker who won a contested race, which caused negotiations between Republicans and Democrats to drag on. But the parties eventually came to an agreement: Seat the Democratic member and Republicans would gain control of the speakership. The DFL boycott lasted for three weeks.
Once the session started in earnest, I wrote about a Minnesota House member making an appearance on the reality show “Love Is Blind.” Her daughter was on the show and decided not to get married (i.e. love wasn’t blind for her.)
The session was well underway when another bombshell dropped in March: GOP state Sen. Justin Eichorn was arrested on suspicion of soliciting sex with a 17-year-old girl. He resigned from the Senate shortly after he was charged.
A slew of intriguing GOP candidates hopped into the race to fill Eichorn’s seat, including the wife of a House member, the son of a former state senator and former Minnesota Republican Party chair Jennifer Carnahan.
Toward the end of the session, legislative leaders spent weeks negotiating a budget behind closed doors. Lawmakers were unable to pass a budget during the regular session, and they needed a one-day special session to pass 14 bills.
Four days after the special session, Hortman was killed in a politically motivated assassination.
Patrick and I wrote a story about Hortman’s legacy. She was a shrewd politician who merely tolerated the spotlight, happily shared credit and accepted blame, eschewed higher office, and by all accounts was motivated chiefly by an interest in public policy, its details and how it could help as many Minnesotans as possible.
Thousands of Minnesotans lined up at the Minnesota Capitol to pay their respects to Melissa and Mark Hortman and their dog Gilbert. Hortman was the first woman to lie in state.
The Hortmans were remembered at their funeral in The Basilica of Saint Mary in Minneapolis.
In July, I traveled to Detroit Lakes to cover the felony burglary trial of Sen. Nicole Mitchell. Mitchell took the stand and told jurors why she broke into her stepmother’s home in 2024.
The jury deliberated for three hours before finding her guilty. Shortly after her conviction, Mitchell resigned from the Minnesota Senate.
More tragedy struck in August — two children were shot and killed at the Annunciation Church in South Minneapolis.
The mass shooting spurred Walz to call for lawmakers to pass an assault weapons ban. Democrats didn’t pass an assault weapons ban when they had a trifecta in 2023 because some Democrats wouldn’t sign onto it.
People close to Walz said the governor was thrown off by the killing of Hortman, who was a friend and governing partner. But the Annunciation shooting appeared to light a fire in Walz to want to provide leadership during crisis, and he announced he would run for an unprecedented third, four-year term as governor.
I wrote about Sen. Omar Fateh’s run for Minneapolis mayor and how he was known for doing whatever it takes to win his priorities.
Last month, I fact-checked Walz when he said Minnesota has universal pre-K. Yeah, we don’t.
I pointed out that the DFL Party was standing by a northern Minnesota party official who has been charged with vehicular homicide. A few days after my story ran, the official resigned.
I was also at Mike Lindell’s Shakopee MyPillow warehouse where he announced he’s running for governor. He even has a bus.
Next year will be all about the governor’s race, which I’m excited to cover. Send me your thoughts or your tips at michelle@minnesotareformer.com",https://minnesotareformer.com/wp-content/uploads/2025/06/NN250609_0089-1024x683.jpg,,,2025-12-26 08:11:53.107045
,New Jersey Monitor,2025-12-26 13:00:38+00:00,New Jersey Monitor,A fortune awaits forgetful residents at NJ’s unclaimed property office,Dana DiFilippo,,,,,https://newjerseymonitor.com/briefs/nj-unclaimed-property/,New Jersey is safeguarding $7 billion in unclaimed cash and property. Residents can check for free to see if it's theirs.,"Old photos are among items New Jersey treasury officials are safeguarding, waiting for their rightful owners to claim. (Photo courtesy of N.J. Treasury)Anyone looking to recover from holiday spending sprees might want to check with New Jersey’s treasury department.
The state is holding onto $7 billion in unclaimed funds and property, waiting on their rightful owners to take it all back.
Most is cash, but people have left everything from jewelry to guns to a violin stashed in safe-deposit boxes around the Garden State, said Steve Harris, who has headed the treasury’s unclaimed property administration since 2008. Banks auction the boxes’ contents after five years and forward the proceeds — which amount to about $900,000 a year — to the administration for safekeeping, Harris said.
“People die, or they move and forget about it. Or someone doesn’t tell their wife that they have a box, and the bank opens it up and it’s loaded with cash,” he said.
Gold coins are common items forgotten in safe-deposit boxes. State treasury officials safeguard unclaimed property and cash while waiting for their rightful owners to claim it. (Photo courtesy of N.J. Treasury)
The agency has returned $3.1 billion in cash and liquidated items since it formed in 1947, including $720 million in the last three years alone, Harris said.
Many of the items in abandoned safe-deposit boxes are gold and silver coins, jewelry, and cash, which could be a fortune, with gold worth over $4,000 an ounce, he said.
Officials also have found half-smoked cigarettes in the boxes, as if their owners dashed off, mid-puff, in the middle of admiring their riches. Sentimental items including Purple Hearts and other military medals sometimes get left behind too, he said.
“We try to find a family, in those cases, to get those medals back to them,” Harris said. “We will not sell those medals.”
The items are secured in a safe space, but Harris declined to say where.
“It’s not like Raiders of the Lost Ark. It’s more like maybe six or seven rows of items,” he said. “We have cameras and everything else, and nobody knows where it is — really only about six people.”
People can check for free to see if they have any unclaimed money here.
A 1905 declaration signed by President Theodore Roosevelt is among unclaimed items the state treasury department is safeguarding while waiting for its rightful owners to claim it. (Photo courtesy of N.J. Treasury)
SUBSCRIBE: GET THE MORNING HEADLINES DELIVERED TO YOUR INBOX",https://newjerseymonitor.com/wp-content/uploads/2025/12/unclaimed-photos-1024x867.jpeg,,,2025-12-26 08:11:53.107045
