state,topic,outlet,headline,summary,url
Virginia,Immigration and Immigration Enforcement,Virginia Mercury,Virginia Democrats sharpen focus on ICE limits after Spanberger’s State of the Union rebuttal,"Virginia Democrats are advancing legislation to limit state and local cooperation with ICE, including SB 783 and HB 1141, which restrict law enforcement agreements with ICE unless constitutional due process guidelines are met. Governor Abigail Spanberger rescinded previous executive orders expanding 287(g) agreements, though 27 local agreements remain active across 25 localities. Additional bills would require judicial warrants for ICE operations in protected areas like courthouses, schools, and hospitals, and prohibit law enforcement from wearing facial coverings while on duty. The administration also halted the sale of the Augusta Correctional Center to prevent its potential use as an ICE detention facility, while local opposition blocked a proposed ICE processing center in Hanover County. These state-level actions represent a Democratic policy pushback against federal immigration enforcement priorities under President Trump.",https://virginiamercury.com/2026/02/26/virginia-democrats-sharpen-focus-on-ice-limits-after-spanbergers-state-of-the-union-rebuttal/
Washington,State Budget,Washington State Standard,Why WA child care program could bear brunt of budget cuts,"Washington Democratic lawmakers propose over $500 million in cuts to the Working Connections Child Care program across House and Senate supplemental budget plans totaling $79 billion over two years, addressing shortfalls from rising social service caseloads and federal Medicaid/food stamp changes. The Senate seeks $168 million in the current biennium and $857 million over the next two cycles, while the House proposes $112 million and $601 million respectively, both shifting provider reimbursements from enrollment-based to attendance-based payments. The policy changes, effective July-October 2025, eliminate planned program expansions for 2029 and 2031, marking the second consecutive year of child care reductions as lawmakers face a March 12 deadline to finalize the budget.",https://washingtonstatestandard.com/2026/02/26/why-wa-child-care-program-could-bear-brunt-of-budget-cuts/
Indiana,Immigration and Immigration Enforcement,Indiana Capital Chronicle,Immigration crackdown heads to Indiana governor after falling short last year,"The Indiana Senate passed SB 76 mandating local government cooperation with federal immigration detainer requests and penalizing businesses employing unauthorized workers, authorizing the Attorney General to sue localities and universities up to $10,000 per violation and allowing suspension or permanent revocation of business operating authorizations for employers who knowingly hire unauthorized workers, while Democratic opponents raised concerns about racial profiling, fiscal burdens on local communities, and hiring discrimination, reflecting political tensions between bill author Sen. Liz Brown and Attorney General Todd Rokita over enforcement authority.",https://indianacapitalchronicle.com/2026/02/26/immigration-crackdown-heads-to-indiana-governor-after-falling-short-last-year/
Missouri,State Budget,Missouri Independent,Ousted GOP budget chair unveils alternative Missouri budget to governor’s plan,"Missouri faces a fiscal cliff with general revenue spending exceeding income: the state spent $28.7 billion against $26.8 billion in revenue over two recent years, and current projections show appropriations of $17 billion versus $13.6 billion in revenue for the coming fiscal year, potentially draining the fund balance from $5.8 billion to $265 million by 2027. In response to Governor Kehoe's budget proposal, termed-out State Sen. Lincoln Hough introduced an alternative plan that reduces general revenue spending while increasing funding for public schools by $190 million, restoring $105 million in disability service cuts, and boosting higher education support. Hough's proposal would reallocate $451 million from Capitol renovation funds and eliminate $1.1 billion in budgetary gimmicks where funds are authorized but not expected to be spent. The plan also includes $46 million for the state employee retirement system and removes $150 million in unnecessary construction spending. Hough's alternative emerges from internal GOP conflict after his removal as Senate Appropriations Committee chairman for opposing party leadership on redistricting and initiative petition issues.",https://missouriindependent.com/2026/02/26/ousted-gop-budget-chair-unveils-alternative-missouri-budget-to-governors-plan/
Ohio,State Budget,Ohio Capital Journal,Ohio lawmaker proposes land value tax amendment as alternative to property tax elimination,"Ohio's Office of Management and Budget projects that eliminating property taxes would create a $24 billion state budget shortfall requiring 15-18% sales tax or 11-15% income tax to replace revenue that funds three-fifths of school budgets; a proposed land value tax alternative would shift local taxing authority from voter-approved levies to elected board majority votes, potentially expanding the tax base while avoiding the deficit scenario.",https://ohiocapitaljournal.com/2026/02/26/ohio-lawmaker-proposed-land-value-tax-amendment-as-alternative-to-property-tax-elimination/
Wisconsin,Public Health,Wisconsin Examiner,"Parents’ group supports new lead testing in Milwaukee schools, but says more should be done","Milwaukee Public Schools and the Milwaukee Health Department are implementing lead testing initiatives for children following contamination concerns. Advocacy group Lead Safe Schools MKE supports the testing but criticizes the district's 15 parts per billion safety standard as too lax, citing public health experts who recommend less than 1 part per billion. The group demands expanded testing beyond elementary schools to all grade levels. They also call for continued dust-wipe monitoring in stabilized buildings, soil testing on school grounds, and improved public transparency regarding exposure data. The Milwaukee Health Department states it supports continued vigilance and will work with MPS to ensure protective measures remain effective over time.",https://wisconsinexaminer.com/briefs/parents-group-supports-new-lead-testing-in-milwaukee-schools-but-says-more-should-be-done/
Maryland,Immigration and Immigration Enforcement,Maryland Matters,"Sheriffs make plea for restraint, as House, Senate weigh more immigration enforcement limits","Maryland's new law restricting 287(g) agreements with ICE has prompted sheriffs to consider legal challenges while opposing additional legislation like the Community Trust Act (SB 791), which would prohibit local detention based on immigration status without judicial warrants, and SB 660, which would mandate local police document federal immigration enforcement actions. Sheriffs argue these measures handcuff law enforcement and exceed local authority, while advocates claim they prevent deportation pipelines and ensure transparency. The debate intensified after a high-profile murder by an undocumented immigrant, with lawmakers citing public safety concerns versus advocates emphasizing most immigrants are not criminals. Federal funding may be jeopardized under Trump's executive order targeting jurisdictions limiting cooperation with federal immigration enforcement.",https://marylandmatters.org/2026/02/26/sheriffs-make-plea-for-restraint-as-house-senate-weigh-more-immigration-enforcement-limits/
Maryland,Immigration and Immigration Enforcement,Maryland Matters,House poised to approve bill creating tools to challenge federal agents in Maryland courts,"The Maryland House advanced a bill combining ""digital unmasking"" and ""No Kings Act"" provisions. The measure would enable state officials and residents to sue federal agents for civil rights violations and use surveillance data to identify masked officers. The legislation specifically targets alleged abuses in federal immigration enforcement. Democrats defeated Republican amendments requiring prior internal investigations, arguing such requirements would neuter the bill's effectiveness. Republicans warned the measure could trigger endless lawsuits and drain taxpayer funds to defend federal agents.",https://marylandmatters.org/2026/02/25/house-poised-to-approve-bill-creating-tools-to-challenge-federal-agents-in-maryland-courts/
California,Public Opinion Polls,CalMatters,"No clear frontrunner for governor, but new poll names five with the best shot","A Public Policy Institute of California poll of the gubernatorial race shows a highly fragmented field with no clear frontrunner, as five candidates poll between 10-14% and six others remain in single digits. The survey, which began just days after the final candidate entered, found two Republicans leading—Steve Hilton (14%) and Chad Bianco (12%)—triggering Democratic concerns that a split party vote could allow a GOP candidate to advance to the general election. Former congressional candidate Katie Porter leads Democrats at 13%, followed by Eric Swalwell (11%) and Tom Steyer (10%), while late entrant Matt Mahan was relegated to the bottom tier due to polling timing. The results are influencing a ""shadow election"" among wealthy donors and interest groups who will determine which campaigns can afford to continue, as Democratic leaders pressure lower-tier candidates to drop out and consolidate support. With only three months until the primary, the poll reveals an unusually volatile race where financial backing rather than public support may ultimately decide the outcome.",https://calmatters.org/commentary/2026/02/governor-poll-five-leading-california/
California,Immigration and Immigration Enforcement,CalMatters,"Mientras Escondido debate contrato con ICE, otros funcionarios locales evalúan si cooperar en la aplicación de la ley migratoria","The Escondido City Council is considering a $67,500 contract allowing ICE agents to use its police shooting range for up to 20 days annually, sparking protests from activists and opposition from 33 local officials who argue the collaboration undermines public trust. The dispute reflects broader tensions over California's sanctuary law, which restricts local coordination with immigration enforcement but permits varying interpretations: some jurisdictions like San Diego County impose additional anti-collaboration measures while conservative-led cities like El Cajón declare themselves ""non-sanctuary"" and pledge cooperation with ICE. State Democratic lawmakers are advancing legislation to further limit federal immigration enforcement, including banning police from working as federal agents and restricting arrests in courthouses, while some sheriffs and municipalities resist what they view as overreach. San Diego County Sheriff Kelly Martinez has asserted her independent authority to share information about undocumented immigrants convicted of serious crimes, potentially violating county policies. The conflicting local responses highlight a fragmented implementation of state sanctuary policies and intensifying political battles over immigration enforcement authority in California.",https://calmatters.org/calmatters-en-espanol/2026/02/escondido-debate-contrato-con-ice/
Connecticut,State Budget,CT Mirror,CT workforce funding approaches a cliff,"Connecticut faces a $100 million federal workforce funding cliff in July 2026, requiring state budget intervention to prevent dismantling of employment and training services; the article urges policymakers to prioritize workforce development in the state budget as essential economic infrastructure, calling for decisive investment to restore staffing, scale sector-based training, and strengthen regional partnerships to maintain the talent pipeline and economic competitiveness.",https://ctmirror.org/2026/02/26/rowena/
Connecticut,Public Opinion Polls,CT Mirror,"Poll: Lamont’s long-shot challenger is far behind, but slightly less so","The University of New Hampshire Survey Center's Nutmeg State Poll (Feb. 12-16) found Gov. Ned Lamont leading Rep. Josh Elliott 57% to 13% among likely Democratic primary voters, with Lamont's job approval at +4 (49% approve, 45% disapprove)—a stark contrast to a Morning Consult poll showing +33. Elliott's support nearly doubled since November while undecideds dropped from 37% to 29%. For the Republican nomination, the poll measured candidate favorability rather than a horse-race question, showing Sen. Ryan Fazio at 42% and former Mayor Erin Stewart at 40%, though Stewart's unfavorability was significantly higher at 22% versus Fazio's 3%. The poll had a margin of error of ±4.1% for all voters, ±7.4% for Democrats, and ±9.8% for Republicans.",https://ctmirror.org/2026/02/25/poll-lamont-elliott-stewart-fazio-governor-approval/
Vermont,Protests and Civil Unrest,VTDigger,Anya Schwartz: Pledges won’t bring peace,"Vermont's Town Meeting Day will feature votes on the Apartheid-Free Communities pledge urging boycotts and divestment from Israel over Palestinian policies; a Bristol resident opposes the pledge while supporting Jewish-Arab grassroots movement Standing Together, and the contentious nature of the Israel-Palestine debate suggests potential for public demonstrations or civil unrest in Vermont communities.",https://vtdigger.org/2026/02/25/anya-schwartz-pledges-wont-bring-peace/
Kentucky,K-12 Education,Kentucky Lantern,Schools get 2% increase but transportation funding still flat in revised House GOP budget,"Kentucky's revised HB 500 budget increases SEEK per-pupil funding by 2% annually to $4,626 and $4,792 over the biennium, while freezing school transportation at $399 million and removing a contested health insurance cost cap opposed by educators. The bill allocates $700,000 for Teach for America despite recent debate, and adds $617 million to the rainy day fund. Education advocates and Democrats, including House Democratic Leader Pamela Stevenson, argue the budget still chronically underfunds schools and fails to provide substantial teacher raises, stating it ""still does not meet the moment"" for struggling families. The Kentucky Center for Economic Policy criticized the plan for prioritizing tax cuts over transformative education investments.",https://kentuckylantern.com/2026/02/25/schools-get-2-increase-but-transportation-funding-still-flat-in-revised-house-gop-budget/
Georgia,State Budget,Georgia Recorder,Income tax cut clears the Georgia House as Kemp adds new money to cover budget priorities,"Gov. Brian Kemp added $1.4 billion to Georgia's $43.7 billion state budget, including $850 million for property tax relief and accelerated income tax cuts to 4.99% that will reduce revenues by $750 million. Democrats criticized the disproportionate benefit to wealthier residents and corporations, with the top 1% receiving 25% of tax savings. Republicans argued all taxpayers benefit from the across-the-board cut. The budget reflects Kemp's moderate tax relief strategy amid calls to eliminate the income tax entirely. The proposal passed the House 106-66 and awaits Senate action.",https://georgiarecorder.com/briefs/income-tax-cut-clears-the-georgia-house-as-kemp-adds-new-money-to-cover-budget-priorities/
Montana,State Budget,Daily Montanan,Governor pushes flat income tax rate at Mountain States Policy Center event,"Governor Gianforte's push for a flat 4.7% income tax rate by 2027 would further reduce state revenue and constrain budget options, building on previous cuts that lowered the top rate from 6.9% to 5.4%, while legislative resistance emerges from lawmakers prioritizing property tax relief over additional income tax reductions.",https://dailymontanan.com/2026/02/25/governor-pushes-flat-income-tax-rate-at-mountain-states-policy-center-event/
Montana,Protests and Civil Unrest,Daily Montanan,State Sen. Windy Boy joins race for eastern congressional seat,"Montana State Representative Jonathan Windy Boy spoke in support of Representative Zooey Zephyr on April 26, 2023, during legislative discussions at the Montana State Capitol about a motion to bar her from the House chamber, an incident that generated significant protests and civil disobedience.",https://dailymontanan.com/2026/02/25/state-sen-windy-boy-joins-race-for-eastern-congressional-seat/
Idaho,State Budget,Idaho Capital Sun,Bill that would let state freeze funding if AG suspects local government violated state law stalls,"Idaho House Bill 743 proposes allowing the Attorney General to freeze state general funds and revenue-sharing installments to local governments suspected of violating state law, creating a preemptive budget enforcement mechanism that could financially penalize municipalities before judicial review, thereby directly impacting state budget allocations and local government fiscal stability, with potential $50,000 civil penalties for willful violations by individual officials.",https://idahocapitalsun.com/2026/02/25/bill-that-would-let-state-freeze-funding-if-ag-suspects-local-government-violated-state-law-stalls/
Idaho,State Budget,Idaho Capital Sun,Idaho attorney general asks Legislature to restore budget cuts made to his office,"Idaho's Joint Finance-Appropriations Committee approved 4% budget cuts for fiscal year 2026 and permanent 5% cuts for fiscal year 2027 across most state agencies, prompting Attorney General Raúl Labrador to request restoration of $980,000 to avoid 11 furlough days this year and 14 next year (a 5% pay cut) or 12 layoffs, while other programs face reductions in wildland firefighting, public defenders, crisis response, mental health courts, and water quality monitoring.",https://idahocapitalsun.com/2026/02/25/idaho-attorney-general-asks-legislature-to-restore-his-offices-budget-cuts/
Idaho,State Budget,Idaho Capital Sun,"Bedke: Idaho lawmakers should protect Launch, water infrastructure amid budget cuts","Idaho faces a projected budget shortfall from $4 billion in tax cuts over five years, prompting Gov. Little to order 3% agency cuts and budget-writers to pursue $131 million in current-year and $143 million in FY 2027 reductions. Lt. Gov. Bedke is urging lawmakers to protect education and water infrastructure investments, highlighting the Idaho Launch scholarship program and $30 million in water projects. The Joint Finance-Appropriations Committee adopted a higher revenue projection than the governor's budget proposal, which balances with lower forecasts. Budget cuts require legislative approval through Senate Bill 1331 for the current year and are embedded in agency maintenance budgets for FY 2027. The committee continues work on enhancement budgets that could restore some funding.",https://idahocapitalsun.com/2026/02/25/bedke-idaho-lawmakers-should-protect-launch-water-infrastructure-amid-budget-cuts/
Idaho,K-12 Education,Idaho Capital Sun,Idaho public schools will be forced to cut budgets — even if state funding remains flat,"Idaho's $2.77 billion K-12 budget for 2026-27 remains flat despite inflation-driven cost increases, forcing school districts to cut staff and programs despite being exempt from statewide 5% budget reductions. State leaders, including Gov. Brad Little and legislative Republicans, tout a 70% funding increase since 2019 and ""held harmless"" messaging, but most of those gains target restricted categories like facilities and literacy rather than flexible operational costs. The Joint Finance-Appropriations Committee's proposal lacks increased discretionary funding for utilities, insurance, and supplies for the second consecutive year, while refusing to tap $1.3 billion in state reserves. Districts like Bonneville face $5-6 million shortfalls, and cuts to agencies like Career Technical Education will defund 164 high school programs. Democrats warn this effectively shifts education funding burdens back to local property taxpayers through supplemental levies.",https://idahocapitalsun.com/2026/02/25/idaho-public-schools-will-be-forced-to-cut-budgets-even-if-state-funding-remains-flat/
Mississippi,Public Health,Mississippi Today,UMMC clinic closures extend to Friday amid cyberattack recovery,"A ransomware cyberattack on Mississippi's only academic medical center (UMMC) has forced cancellation of clinic appointments and elective procedures for over a week, disrupting care for patients like one awaiting critical carotid artery results and straining the state's sole Level 1 trauma center. Nearby hospitals have increased staffing to fill care gaps while UMMC works toward resuming normal operations. The attack follows a 2013 HHS Office for Civil Rights investigation that identified longstanding cybersecurity vulnerabilities, resulting in a $2.75 million settlement and corrective action plan that was closed in 2022. Experts warn full recovery could take 6-12 months. The medical center has established an automated triage line for patients with time-sensitive needs.",https://mississippitoday.org/2026/02/25/ummc-friday-cyberattack-recovery/
Mississippi,Public Health,Mississippi Today,Regency Hospital in Meridian to close by mid-March,"Regency Hospital, a Meridian long-term acute care facility treating respiratory disorders, will close March 13 due to Medicare reimbursement cuts and Medicare Advantage plans increasingly denying coverage; this reduces Mississippi's specialized care capacity to just six similar hospitals, raising public health concerns about access to ventilator weaning for medically complex patients as CMS rate increases remain inadequate to sustain these critical facilities.",https://mississippitoday.org/2026/02/25/regency-hospital-meridian-to-close/
Rhode Island,State Budget,Rhode Island Current,RI lawmakers look for solution in a small state with a big problem: nowhere to send sludge,"Rhode Island's wastewater sludge disposal crisis is creating significant financial burdens for municipalities like West Warwick, which pays $1.2 million annually to ship waste to Ohio, while Woonsocket faces losing $3 million in host fees if its incinerator closes, prompting state lawmakers to establish a legislative study commission that will likely need to consider state budget allocations for regional wastewater infrastructure solutions by its January 2027 deadline.",https://rhodeislandcurrent.com/2026/02/25/ri-lawmakers-look-for-solution-in-a-small-state-with-a-big-problem-nowhere-to-send-sludge/
Texas,Immigration and Immigration Enforcement,The Texas Tribune,Texas grand jury won’t indict in 2025 fatal shooting of U.S. citizen by ICE agent,"Text references a Dallas ICE facility on Sept. 24, 2025, but provides no information on enforcement policies, operations, or governmental impacts.",https://feeds.texastribune.org/link/16799/17283986/texas-ice-shooting-death-grand-jury-no-bill
Texas,K-12 Education,The Texas Tribune,"Texas education board approves 4,200 corrections in Bible-infused curriculum","A kindergarten teacher at a Texas elementary school illustrates the frontline of K-12 education, where state policies on teacher salaries, early childhood funding, and curriculum standards directly impact classroom instruction and resource availability.",https://feeds.texastribune.org/link/16799/17283813/texas-board-education-correct-bluebonnet-errors
Texas,Public Opinion Polls,The Texas Tribune,"Jasmine Crockett leads James Talarico by double digits in Senate Democratic primary, poll finds","The 2026 Texas U.S. Senate Democratic primary debate between Rep. Jasmine Crockett and state Rep. James Talarico at the AFL-CIO convention may shape subsequent public opinion polling on candidate viability among labor voters, potentially impacting campaign resource allocation, policy positioning strategies, and electoral momentum.",https://feeds.texastribune.org/link/16799/17283636/texas-senate-poll-crockett-talarico-university-of-texas-paxton-cornyn-hunt-2026
Kansas,State Budget,Kansas Reflector,Kansas House dramatically amends bill aimed at constraining local property tax increases,"Kansas House Republicans highlighted a state budget imbalance, noting the Legislature spends $500-600 million more annually than state tax revenue generates; the chamber deleted a $60 million appropriation to reward local governments for limiting property tax increases, citing unaffordability and concerns that the expenditure would reduce funds available for core obligations, tax relief, or reserve stability; some legislators suggested tapping the state's $2 billion rainy-day fund for property tax relief, but the House Appropriations Committee chair opposed using emergency reserves for such purposes.",https://kansasreflector.com/2026/02/25/kansas-house-dramatically-amends-bill-aimed-at-constraining-local-property-tax-increases/
West Virginia,State Budget,West Virginia Watch,"WV House budget says no to governor’s tax cut, yes to Hope Scholarship, flood prevention","The West Virginia House passed a $5.46 billion FY2027 budget that excludes Governor Morrisey's $250 million income tax cut, making it $30 million less than the governor's proposal, which House Finance Chairman Criss called unconstitutional for spending beyond available revenue; the budget includes a 3% state employee pay raise, funds Medicaid through revenue dollars, allocates $211 million to the Hope Scholarship, and adds $25 million to the flood prevention fund, while noting that automatic tax cut triggers failed to activate due to unmet revenue targets, with the bill returning to the Senate for reconciliation.",https://westvirginiawatch.com/2026/02/25/wv-house-budget-says-no-to-governors-tax-cut-yes-to-hope-scholarship-flood-prevention/
