state,topic,outlet,headline,summary,url
Iowa,Public Health,Iowa Capital Dispatch,Bird flu detected in Keokuk County and Van Buren County flocks,"The CDC maintains that the public health risk of highly pathogenic avian influenza is low due to no known person-to-person spread, as Iowa's Department of Agriculture confirms two new backyard flock outbreaks in Van Buren and Keokuk counties and urges producers to follow biosecurity protocols.",https://iowacapitaldispatch.com/briefs/bird-flu-detected-in-keokuk-and-van-buren-county-flocks/
Minnesota,Protests and Civil Unrest,Minnesota Reformer,"Aliya Rahman, arrested at Capitol: ‘Every time you try to break my body, you fuel my spirit.’","Minneapolis resident Aliya Rahman was arrested during President Trump's State of the Union address for standing up in protest after he called Somali Minnesotans ""pirates,"" with Capitol Police charging her with disruption of Congress for refusing to sit down; Rep. Ilhan Omar, who invited Rahman as her guest, condemned the arrest as sending a chilling message about democracy and demanded a full explanation.",https://minnesotareformer.com/2026/02/25/aliya-rahman-arrested-at-capitol-every-time-you-try-to-break-my-body-you-fuel-my-spirit/
North Carolina,Immigration and Immigration Enforcement,NC Newsline,Lawsuit: Warrantless immigration arrests in North Carolina targeted U.S. citizens,"Four U.S. citizens and a visa holder filed a federal class-action lawsuit against the Department of Homeland Security, alleging ICE and CBP conducted warrantless immigration arrests in North Carolina without probable cause, violating constitutional standards. The suit highlights a 180% increase in arrests since January 2025, including ""Operation Charlotte's Web,"" and cites an ICE memo encouraging expanded warrantless arrests. It names Homeland Security Secretary Kristi Noem and seeks a court order to block the practice, following similar federal court restrictions in Oregon and Washington D.C. DHS denies the allegations, asserts constitutional compliance, and references a Supreme Court emergency order permitting similar tactics during litigation. The enforcement surge reportedly caused 30,000 student absences in Charlotte-Mecklenburg schools, demonstrating significant community disruption.",https://ncnewsline.com/2026/02/25/lawsuit-warrantless-immigration-arrests-in-north-carolina-targeted-u-s-citizens/
New Hampshire,K-12 Education,New Hampshire Bulletin,State to ask Supreme Court to overturn Claremont school funding rulings,"New Hampshire's Attorney General is asking the state Supreme Court to overturn 1990s Claremont rulings that established a constitutional duty to fund adequate K-12 education, arguing school funding is a political question for the Legislature, not the courts. This appeal of a 2024 ruling that found the $4,266 per-pupil formula unconstitutional aligns with Republican lawmakers' House Bill 1815, which would declare education funding a shared state-local responsibility. Success would end decades of precedent and reduce state obligations to public schools.",https://newhampshirebulletin.com/2026/02/25/state-to-ask-supreme-court-to-overturn-claremont-school-funding-rulings/
New Hampshire,Immigration and Immigration Enforcement,New Hampshire Bulletin,"Ayotte blocks ICE — but she had a lot of help from protesters, looming midterms, and a NIMBY GOP","New Hampshire Gov. Kelly Ayotte halted a planned ICE detention facility in Merrimack following public protests and midterm election pressures, though state Republican leadership expressed support for the Trump administration's deportation campaign while preferring such detention infrastructure be located elsewhere, demonstrating how local opposition and partisan political calculations can influence federal immigration enforcement implementation.",https://newhampshirebulletin.com/2026/02/25/ayotte-blocks-ice-but-she-had-a-lot-of-help-from-protesters-looming-midterms-and-a-nimby-gop/
Florida,Immigration and Immigration Enforcement,Florida Phoenix,"Sarasota, Palm Beach sheriffs walk back immigration bonuses for deputies","Two Florida sheriff's offices (Sarasota and Palm Beach) returned nearly $200,000 in state-approved immigration officer bonuses, citing fairness concerns that 287(g)-trained deputies deserve no special compensation, and will redirect funds to equipment like RAPID ID devices. This development occurs under Florida's 2025 mandate requiring all sheriffs to enter 287(g) partnerships and the State Board of Immigration Enforcement's $250 million grant program overseen by Gov. DeSantis. The Board also denied nearly two-thirds of Lee County's grant request—the first partial denial since approving over $60 million across 101 grants since September, though only $93,000 has been disbursed. Additionally, Alachua and Polk Counties reduced their detention bed funding requests by half.",https://floridaphoenix.com/2026/02/25/sarasota-palm-beach-sheriffs-walk-back-immigration-bonuses-for-deputies/
Florida,Public Health,Florida Phoenix,New emergency rules finish an administrative challenge to AIDS drug program cuts,"The Florida Department of Health filed emergency rules to restrict eligibility for the AIDS Drug Assistance Program, cutting income limits from 400% to 130% of federal poverty level and affecting 16,000 HIV/AIDS patients, citing a $120 million deficit. The emergency rule bypasses formal administrative rulemaking and public comment requirements, rendering moot an AIDS Healthcare Foundation challenge that argued the changes violated Florida law. The foundation's attorney accused the DeSantis administration of ""legal subterfuge"" for using emergency powers to avoid judicial review and public input. Legal challenges are now delayed, as the foundation must wait 14 days post-filing to contest the emergency rule, after the March 1 implementation date. A circuit court injunction request remains pending despite legislative efforts to add program funding.",https://floridaphoenix.com/2026/02/25/new-emergency-rules-finish-an-administrative-challenge-to-aids-drug-program-cuts/
Alabama,Public Health,Alabama Reflector,Rep. Jeff Sorrells appointed to Health Committee chair as Majority Leader Paul Lee steps down,"Rep. Jeff Sorrells (R-Hartford) was appointed chair of the Alabama House Health Committee following Rep. Paul Lee's (R-Dothan) departure to serve as House Majority Leader, marking a leadership transition that could influence state healthcare policy including the future of Medicaid expansion, an issue Lee previously signaled openness toward despite Alabama remaining one of 10 states that has not adopted the program.",https://alabamareflector.com/2026/02/25/rep-jeff-sorrells-appointed-to-health-committee-chair-as-majority-leader-paul-lee-steps-down/
Nebraska,Protests and Civil Unrest,Nebraska Examiner,"Nebraska Ukrainian refugees, supporters gather as fifth year of ‘occupation and resistance’ begins","Several hundred Ukrainian refugees and supporters rallied at Bethany Lutheran Church in Elkhorn to mark the fourth anniversary of Russia's invasion, with organizers urging attendees to contact elected officials about supporting Ukraine's democracy. U.S. Rep. Don Bacon is advancing bipartisan legislation via a discharge petition requiring one additional House signature to force a floor vote on military aid and weapons for Ukraine. Event organizer Amanda Hall of Orel Alliance emphasized the geopolitical stakes, stating ""if Ukraine falls, Europe is next"" and calling on Nebraskans to raise their voices. The gathering featured testimony from former State Sen. Tom Brewer, who has made eight fact-finding missions to Ukraine, and included calls for stronger sanctions against Russia. Participants held candles in solidarity while images of fallen soldiers and war-torn Ukraine were displayed, blending commemoration with political mobilization.",https://nebraskaexaminer.com/2026/02/25/ukrainian/
New Mexico,Public Health,Source New Mexico,First NM measles case for 2026 detected in Lordsburg jail,"New Mexico health officials confirmed a 2026 measles case in a federal inmate at Hidalgo County Detention Center, prompting coordinated state-county enforcement of quarantine and vaccination protocols; this follows the 2025 outbreak that infected 100 people, the state's largest in three decades, with NMDOH Chief Medical Officer Dr. Miranda Durham urging full vaccination and a state helpline (1-833-796-8773) available for exposure concerns.",https://sourcenm.com/briefs/first-nm-measles-case-for-2026-detected-in-lordsburg-jail/
Michigan,State Budget,Michigan Advance,Hall unveils revenue plan that would tax higher-income services like country club memberships,"Michigan House Speaker Matt Hall is preparing for a contentious 2026-27 budget fight by proposing a $5 billion property tax relief plan funded by a new 6% sales tax on luxury services like private jets and country clubs to backfill state revenue. The proposal faces political hurdles requiring passage through the GOP-led House and Democratic-led Senate. Hall claims exempting everyday services would still achieve the revenue target, though Gongwer News Service estimates the net effect as a $270 million tax cut.",https://michiganadvance.com/briefs/hall-unveils-revenue-plan-that-would-tax-higher-income-services-like-country-club-memberships/
Alaska,Immigration and Immigration Enforcement,Alaska Beacon,Alaska lawmakers probe state detention policies following ICE arrest of Soldotna family,"The ICE arrest and expedited deportation of a Soldotna asylum-seeking mother and her three minor children prompted the Alaska House Judiciary Committee to investigate minor detention practices and due process concerns after ICE officials declined to testify, revealing state-federal tensions over immigration enforcement authority. State officials confirmed the Department of Corrections contracts with federal authorities to detain ICE arrestees in state facilities (though claiming not to hold minors) while Alaska State Troopers maintain a policy of non-cooperation with ICE immigration enforcement. Committee Chair Rep. Andrew Gray is drafting a legislative resolution urging federal policy change and considering measures to compel ICE testimony, as legal advocates testified that child detentions are increasing nationally and often exceed legal limits. The incident reflects broader Trump administration immigration crackdowns with historic ICE funding increases, prompting state lawmakers to explore potential constraints on federal enforcement actions despite jurisdictional limitations.",https://alaskabeacon.com/2026/02/25/alaska-lawmakers-probe-state-detention-policies-following-ice-arrest-of-soldotna-family/
