id,name,published,outlet,title,authors,category,market,categoryorder,articleorder,url,description,text,image,error,sentiment,firstEyes
,Mississippi Today,2025-12-26 20:30:00+00:00,Mississippi Today,"Beyond the classroom, Jackson Public Schools helps students, families meet basic needs",Devna Bose,,,,,https://mississippitoday.org/2025/12/26/jps-basic-needs-food-insecurity/,"When students have to grapple with challenges outside of school such as homelessness and food insecurity, it can curb academic performance, attendance and mental health.  Those struggles can also lead to higher dropout rates and lower grades, said Josh Anderson of FutureEd, an education think tank. It’s like a stone dropping in a pond, with […]","When students have to grapple with challenges outside of school such as homelessness and food insecurity, it can curb academic performance, attendance and mental health. 
Those struggles can also lead to higher dropout rates and lower grades, said Josh Anderson of FutureEd, an education think tank. It’s like a stone dropping in a pond, with the impact rippling outward. 
But wraparound services, such as washers and dryers and food pantries, can directly counteract these negative effects, research shows. 
About 25 million students, or more than half of public school students in the country, were eligible for free or reduced-price lunch during the 2022-23 school year. Wraparound services are also essential in a district like Jackson Public Schools, where about a third of students live in poverty.
Jackson Public Schools leaders say the district works hard to eliminate barriers to education through wraparound services especially at their four “community schools.”
It’s a long-standing, mutually-beneficial model where communities pour into their schools to create students who will go on to support their communities. Jackson’s community schools aim to support the whole student, inside and out of the classroom.
“We preach it all day long: What’s your plus?” said Stacey Webb, principal of Lanier Junior Senior High School. “It’s a diploma, plus. It’s not just about academics, but also providing things to help scholars be successful.” 
Community Schools Coordinator Rosaline McCoy takes a look at the donated clothes at Lanier High School in Jackson, Friday, Nov. 21, 2025. Credit: Eric Shelton/Mississippi Today
But the services don’t just affect the students. Caring for the child includes caring for their families, Webb said. The services impact parents, too, boosting engagement and cementing schools as the anchors of their communities. 
“A helpful way to think about this is the hours we have,” Anderson said. “If you add them up over 18 or 20 years, we’re spending less than 20% of those hours in a school building and a lot more of our hours with our families and in our neighborhoods. 
“Schools are vital, and we need them to be better and better. But if we want kids to be ready to learn in school, supporting the family makes a tremendous difference.”
‘Just showing we care’
Laundry services operate on a need-to-know basis at Lanier. 
Students put their clothes in a laundry bag and hand it to a teacher, and by the end of the day, their clothes are washed, dried, folded and ready to go home with them — no questions asked. 
Parents in need, too, can wash their clothes at the school on weekends. 
“If the only thing keeping you from coming to school, we’re going to take care of that for you,” Webb said. “I tell my scholars all the time, we’re going to break the cycle some of them are in.”
The home appliance company Whirlpool started donating washer and dryers to schools across the country in 2015, making it easier for students to have access to clean clothes. At the end of the 2022-2023 school year, nearly 61% of students at participating schools considered at risk for chronic absenteeism were no longer at risk, according to the company. 

Laundry services are just one of the ways educators at Lanier care for their students. The school also operates a clothes closet — stocked with prom dresses, professional clothes for jobs interviews, school uniforms and casual attire — a food pantry and health clinic.
The clinic, staffed by nurse practitioners and nurses, opened a decade ago through a partnership with University of Mississippi Medical Center. 
Students can receive primary and preventive care of the clinic — services like mental health and physical assessments, prenatal care and asthma management — instead of missing class to go to a doctor’s office. 
Webb said all of these services the school provides signals to the students that their teachers and principals care about them, which she’s seen reflected in student grades and attendance.
“I believe it’s about the relationship, just showing we care about you as a person,” she said. “I tell my staff and students that if you can develop a relationship with someone, you can do anything to help them.”
Serving the whole family
This past school year, more than a quarter of K-12 students were considered chronically absent statewide, according to data from the Mississippi Department of Education. That’s more than double the rate during the 2018-19 school year. 
More than a third of JPS students are chronically absent. 
The more needs students can have addressed at school, the more likely they are to stay in class, Johnson Elementary Principal Guyniesha Johnson said. 
“If they don’t have a way to wash their clothes, let’s provide them with one,” she said. “If they don’t have food, let’s get them food. It’s our goal to meet all of those needs.”

Aside from laundry services and a uniform closet, the school has operated a weekend food service for years through a partnership with the Mississippi Food Network and the Junior League of Jackson: Students can take home a bag of food on Friday that will last their family through the weekend. Last year, Johnson Elementary also started stocking a food pantry, where students can go “shopping” for groceries.
Johnson Elementary is located in the Georgetown neighborhood. Many homes in the community continue to be multi-generational, the principal said, with grandparents and great-grandparents living in the same house as their grandchildren. 
The neighborhood has seen decreasing access to fresh food over the years, Johnson said — today, there’s just one grocery store. 
When food insecurity is an issue for a Johnson Elementary student, their families are struggling, too. Part of the district’s community schools model is to help the whole family, Johnson said. 
“We ask the kids how many people live in their household because we expect and believe that the food is to help everybody, not just our students,” she said. “We want to be able to fill those gaps.”
Reducing barriers to learning
Everything a student might need is located in one room at Walton Elementary School: The aptly-named “community room.”
The room houses nonperishable food items, uniforms, backpacks, coats, personal hygiene products, and on occasion, even bikes. 
Community Schools Coordinator Rosaline McCoy organizes the shelves in the Lanier High School’s food pantry in Jackson, Friday, Nov. 21, 2025. Credit: Eric Shelton/Mississippi Today
Principal LaRoy Merrick considers it a personal responsibility to keep the room stocked at all times, making sure the needs of all of his students are met. 
“I can’t control what a child gets when they leave me, but while they’re with me, they’re getting everything they need,” he said. “My responsibility is to make sure they’re educated and nurtured and loved.”
The school relies on community partnerships to serve its students. During the holidays, nearby Cade Chapel Missionary Baptist Church provides Thanksgiving meals to students and their families. The Junior League of Jackson hosts a sort of farmers market once a month at the school, where families can select fresh groceries to take home. 
“We’re a family here,” Merrick said. “In order to educate students’ minds, we have to educate them in all other ways.”
That community collaboration component is integral because schools alone cannot solve the myriad of challenges students face, said Anderson of FutureEd. A web of community partnerships help support the schools’ work. 
“If you provide support to a child and their family, you are doing one of two things, and both are super helpful,” he said. “You’re reducing barriers for them to get to school ready to learn … and you’re making home a more conducive environment for child development. A model that does these things consistently can make a meaningful contribution to a child’s wellbeing.”
It’s work that’s going to impact students far beyond their years at school, he said, “20 years down the road.”",https://cdn.mississippitoday.org/wp-content/uploads/2025/11/05140308/3X0A2256.jpg,,,2025-12-26 15:58:33.029689
,Utah News Dispatch,2025-12-26 19:26:24+00:00,Utah News Dispatch,"Utah beef prices reached a record high in 2025, report says",Alixel Cabrera,,,,,https://utahnewsdispatch.com/briefs/utah-beef-prices-reached-a-record-high-in-2025-report-says/,"Utah farmers saw record-high beef prices this year, but the benefits for the ranchers are likely short-term, according to a Kem C. Gardner Policy Institute report on agriculture in Utah. During a 2022 census of agriculture in the state, the average price of a pound of ground beef was $1.71. That year cattle sales represented […]","Cattle gathers around a watering hole near Monticello on Wednesday, Jan. 29, 2025. (Photo by Spenser Heaps for Utah News Dispatch)Utah farmers saw record-high beef prices this year, but the benefits for the ranchers are likely short-term, according to a Kem C. Gardner Policy Institute report on agriculture in Utah.
During a 2022 census of agriculture in the state, the average price of a pound of ground beef was $1.71. That year cattle sales represented about 26% of the state’s livestock and poultry product sales in the state, according to the report, accounting for $427.5 million.
That price soared, reaching “an all-time high” of $6.32 in August 2025. 
SUBSCRIBE: GET THE MORNING HEADLINES DELIVERED TO YOUR INBOX
“Declining cattle inventories, sustained demand, and rising input prices are (driving) the price increase,” the report says. “While producers benefit from higher beef prices in the short term, they are faced with higher costs to rebuild their herds in the long term.”
Hog production is also in sharp decline in Utah. After Smithfield Foods, the largest pork producer in Utah, ended contracts with 26 hog farms in the state in late 2023, the inventory of hogs fell from a high of over 1 million in September of 2020 to 105,000 in September 2024, researchers wrote. 
Smithfield Foods announced its decision to end the contracts “to optimize its supply chain for more efficient operations in the face of an industry oversupply of pork, weaker consumer demand and high feed prices,” the company said in a news release issued in 2023. 



Let us know what you think...


 


While farmers are receiving more money for their products, nationally, their business costs have been more volatile, the Gardner Institute wrote. 
“The prices paid index for crops has been relatively stable since 2022, while the prices received dropped from 2022 through early 2025 before recovering slightly,” the report says. “For livestock, the prices paid index steadily rose from 2020 through 2025, while the prices received index grew more rapidly over this period.”
The 2022 census also measured that farm sales in the state totaled $2.3 billion that year. 
“While the sales of agricultural products represented a small share of the state’s overall economy, agriculture plays an important role in many rural areas and covers nearly one-fifth of all land statewide,” researchers found.
SUPPORT: YOU MAKE OUR WORK POSSIBLE",https://utahnewsdispatch.com/wp-content/uploads/2025/02/012925_Cattle_07-1024x683.jpg,,,2025-12-26 14:57:12.152950
,New Hampshire Bulletin,2025-12-26 19:22:22+00:00,New Hampshire Bulletin,State senators to file legislation addressing abuse and neglect in NH’s disability care system,William Skipworth,,,,,https://newhampshirebulletin.com/2025/12/26/state-senators-to-file-legislation-addressing-abuse-and-neglect-in-nhs-disability-care-system/,"State Sen. David Rochefort, a Littleton Republican, said he and the state’s legislative staff are in the process of drafting a bill aimed at addressing systemic abuse and neglect issues in New Hampshire intellectual and developmental disability care system. In November, the Bulletin published a series of articles outlining abuse and neglect — sometimes fatal[...]","Sen. David Rochefort said he and his colleagues are “still working out the finer details” of the bill. (Photo by William Skipworth/New Hampshire Bulletin)State Sen. David Rochefort, a Littleton Republican, said he and the state’s legislative staff are in the process of drafting a bill aimed at addressing systemic abuse and neglect issues in New Hampshire intellectual and developmental disability care system.
In November, the Bulletin published a series of articles outlining abuse and neglect — sometimes fatal — committed by caretakers against people with disabilities. The stories also uncovered systemic failures of oversight and prevention that allowed the abuse and neglect to happen. State records obtained by the Bulletin show that from January 2023 through the first six months of 2025, 467 credible reports of abuse, neglect, and exploitation against people in the system were investigated by the state. The records also show 119 deaths occurred across the system during that time.
People with intellectual and developmental disabilities are legally entitled to care funded and overseen by the state. In New Hampshire, the Department of Health and Human Services’ Bureau of Developmental Services contracts with 10 private area agencies, each responsible for a region of the state, to coordinate the care.
While investigating these tragedies, the Bulletin spoke with several family members of people within this system who were abused or neglected, their attorneys, and advocates within the community. Rochefort, who is chairman of the Senate Health and Human Services Committee, said the series alarmed him and pushed him to look into the issue.
Rep. David Rochefort, a Littleton Republican, focused on landfill issues in the House. (Courtesy of David Rochefort)
“I don’t think there’s any opposition to making change here,” Rochefort said. “I think there’s a real desire to do something now from everyone involved, even senators who are not on (the Health and Human Services Committee), who approached me on this.”
He said colleagues from both parties have expressed support for the effort.
“I think that you’re going to see action happen sooner rather than later,” Rochefort said. “Nobody wants to kick the can here.”
Rochefort said he and his colleagues are “still working out the finer details” of the bill, but it’ll seek to strengthen oversight and improve data sharing to allow officials to better identify issues.
“Data on these things would be shared automatically, rather than the way that it’s shared now,” he said. “And it would give the state a better way to either respond to complaints or take action if there’s an issue.”
He also said the bill changes the composition of the Incapacitated and Vulnerable Adults Fatality Review Committee — a panel established by state law to review concerning deaths and make recommendations on how the state can prevent similar deaths in the future — to allow for “better representation of the communities affected and the people that would actually be able to affect change.”
The Bulletin previously reported on the December 2022 death of Stephen Weidlich Jr., a man with physical and developmental disabilities who was found dead behind the care home where he lived. Additionally, in July 2019, Christine Marie Bill, a woman with disabilities, was found dead after overheating in a hot, sealed car, according to the Bulletin’s reporting. Before the Bulletin published its findings, the co-chairs of the Incapacitated and Vulnerable Adults Fatality Review Committee, Vanessa Blais and Francesca Broderick, said they hadn’t been told about either death and that each should have been reviewed by the committee.",https://newhampshirebulletin.com/wp-content/uploads/2025/12/statehousclouds-1024x768.jpg,,,2025-12-26 14:57:12.152950
,Mississippi Today,2025-12-26 19:00:00+00:00,Mississippi Today,Some professors say students struggle with reading and critical thinking. This center at UM tackles a more complicated truth,Candice Wilder,,,,,https://mississippitoday.org/2025/12/26/um-center-supports-relevant-reading/,"Students told Liz Norell, who oversees the University of Mississippi's Center for Excellence in Teaching and Learning, that they don't do course readings if the assignments seem irrelevant or redundant.","There’s a complaint that Liz Norell often hears from faculty at the University of Mississippi: Students are not doing the course readings.
Is it true? And if so, what should professors be doing to help students?  
“We’ve been talking about this issue for as long as I’ve been in higher ed, and that’s almost 20-something years,” said Norell, an associate director of instructional support at the university’s Center for Excellence in Teaching and Learning. “It’s obviously much more complex than just a simple solution or answer. But I think we’re all trying to figure out how to reach our students in this time when everything feels so hard.” 
Norell provides resources, professional development and other services to help faculty improve their teaching. Her role at the center aims to promote innovative teaching practices, improve student success and create more inclusive learning environments. 
When these professors’ broad theories about college students’ reading habits became too critical, Norell spoke with students.
Last spring, she surveyed 155 students about their reading habits. That semester, Norell also created a student focus group to gather more input for her research. Students shared with her three common reasons why they didn’t complete reading assignments. 
First, some instructors didn’t talk about the readings in class, which students said  made the assignments seem pointless. Some students said they felt unsure of how to apply the information they read on exams or in class discussions. Other students said the assigned readings for different classes within the same major or field of study were too similar. 
Rethinking the types of supplemental materials faculty assign could help their students, Norell said. Reading assignments should be relevant or purposeful to students’ lives. 
“My students tell me all the time, ‘Why do I need to read this? Why should I care about this?’” Norell said. “If I can’t answer that question as an instructor, or if my answer is ‘Because I told you to,’ then I’m not motivating students to learn.” 
Creating ‘aha moments’ in the classroom 
When assistant professor Corbit Franks began teaching athletic training, he considered himself a traditionalist.  
Franks, who is also a clinical education coordinator of athletic training, was adamant about assigning coursework that included lengthy peer-reviewed journal articles and multiple textbook chapters. He also insisted students write papers and do critical analyses of the class readings. 
Since Franks began working with Norell and her team at the center, he adjusted his teaching style and syllabi to accommodate what he sees as a decline in students’ willingness to read and engage with supplemental class work.  His new approach often involves providing “a thoughtful explanation” of why the course readings are useful for future clinicians and healthcare professionals. 
Liz Norell is the associate director of instructional support at the University of Mississippi’s Center for Excellence in Teaching and Learning. Credit: Eric Shelton/Mississippi Today
If students come to class prepared to discuss supplemental readings such as research and peer-reviewed journal articles from the National Athletic Trainers Association Position Statement website, their knowledge of the profession, the human body and themselves will improve, he said. That effort can also help students pass their board certification exam. 
“When you look at most of the professions that these students are getting into, the biggest thing that they need is the ability to critically think and build upon one complex thought off of another,” Franks said. 
Franks said he tries to create “aha moments,” in class through reading discussion. It helps students see beyond the class and semester. The discussions can also help them engage with their future patients, clients and or athletes, he said. 
He also allows his students autonomy to design coursework such as questions for quizzes and exams, which helps him understand if they have a grasp on the reading assignments. 
Franks also redesigned his assignments around the skills he wants students to learn. 
“When it comes to certain projects, I allow them to do videos, podcasts or find other creative ways to show off their personality,” Franks said. “It allows students to learn, think creatively and critically, plus relay the information in a way they understand. Plus, it creates a sense of equity in the classroom.” 
Franks said he no longer sees teaching as a one-way street, with the instructor as the “authority figure ruling with an iron fist.” Instead, he said, his approach is a constant dialogue with his students.
“When you enter a classroom, you enter into a kind of a contractual agreement or mutual respect between student and instructor that you both are there for the betterment of the greater good,” Franks said. “It makes them feel comfortable to share and express their needs, thoughts or ask for help. It is effective for their overall success which is why I began teaching in the first place.” 
Getting back to the principles of teaching 
In October, Norell presented her first set of preliminary data on students’ reading habits to faculty in a small workshop titled “When and Why Do Students Read for Class?” She highlighted the disconnect she found between students’ motivation to read and what they are asked to do or learn for the course. 
Of students who responded to Norell’s survey, 55% reported a high motivation to complete their assignments, but less than 46% said they felt engaged with the course material.  Less than 44% said they felt well supported in their efforts to learn. The qualitative results also indicated that students don’t feel the assigned reading is useful or connected to their class performance.
The University of Mississippi in Oxford on Dec. 1, 2025. Credit: Eric Shelton/Mississippi Today
Caris Miller, a senior studying integrated marketing, said she is the type of student who reads and completes all of her assigned readings for her classes. But if professors don’t use the textbooks students bought for class, students may feel less obligated to do the readings required for the course, she said. 
“Professors don’t understand that we also have four other classes we’re juggling, so having eight required textbooks that we don’t need, but you have us buy, just feels like a waste of our resources,” Miller said. “A lot of us here are also on loans or student scholarships. We have to be smart about everything, including our money.” 
Norell also asked faculty members to reflect on their own reading habits. It opened discussion around a point often overlooked on the issue: Students’ and adults’ ability to read and focus for long periods of time has decreased. 
A 2021 Gallup poll results released in 2022 indicated U.S. adults are reading about two or three fewer books than they did between 2002 and 2016. The numbers are lower for college graduates, according to Gallup. They read an average of about six fewer books in 2021 than they did between 2002 and 2016.
“There’s an opportunity for us all to think about reading like practice, such as building muscle or a yoga practice where you’re investing time to do it.” 
Norell said she is recruiting other colleges and universities to assist with her research project. Gathering student input from other institutions across the country will help paint a national picture of the trends and patterns in students’ reading choices, she said. 
That input can also help better understand faculty members’ perceptions of the issue. 
“I believe that learning happens when we are in environments where we feel psychologically safe, where we feel like we belong, and where we feel like people care about us,” Norell said. “And that’s all relational.”",https://cdn.mississippitoday.org/wp-content/uploads/2025/12/03141842/3X0A6095.jpg,,,2025-12-26 14:11:40.906325
