id,name,published,outlet,title,authors,category,market,categoryorder,articleorder,url,description,text,image,error,sentiment,firstEyes
,,2025-12-12 20:23:31+00:00,kcentv.com,Lawmakers seek Army Inspector General investigation into handling of misconduct allegations,Ethan Love,,,,,https://www.kcentv.com/article/news/local/lawmakers-seek-army-inspector-general-investigation-handling-misconduct-allegations/500-343dcdb4-0668-48cc-8723-7794ca7dd9d5,"FORT HOOD, Texas — Rep. John Carter is leading a bipartisan group of lawmakers calling for an Inspector General investigation into what they describe as systemic failures in the Army’s handling of allegations against Maj. Blaine McGraw, a former Army physician accused of repeated misconduct toward service members and their families.
Carter, co-chair of the House Army Caucus and a former judge, joined Senators John Cornyn and Ted Cruz, and Rep. August Pfluger in sending a letter urging the Army Inspector General to conduct an independent, comprehensive review of the case.
Lawmakers also asked the Inspector General to examine potential breakdowns in clinical supervision, the Defense Health Agency’s oversight structure and reporting pathways for medical misconduct.
McGraw faces allegations involving more than 100 individuals across multiple states for secretly recording patients during their exams.
The claims involve patients from Fort Hood, Darnall Army Medical Center and Tripler Army Medical Center in Hawaii.","FORT HOOD, Texas — Rep. John Carter is leading a bipartisan group of lawmakers calling for an Inspector General investigation into what they describe as systemic failures in the Army’s handling of allegations against Maj. Blaine McGraw, a former Army physician accused of repeated misconduct toward service members and their families.

Carter, co-chair of the House Army Caucus and a former judge, joined Senators John Cornyn and Ted Cruz, and Rep. August Pfluger in sending a letter urging the Army Inspector General to conduct an independent, comprehensive review of the case.

“As a former judge and co-chair of the House Army Caucus, I find the allegations against Major McGraw to be an egregious breach of the trust placed in him, and the oversight failures that allowed him to continue practicing are equally alarming,” Carter said in a statement. He said the Army must determine how McGraw “was able to continue victimizing Soldiers and their families” and ensure steps are taken to prevent similar failures.

Cornyn echoed those concerns, saying the Army and the Department of War Inspector Generals “must conduct an investigation into the systemic failures that allowed Major Blaine McGraw to continue in his capacity amidst multiple accusations of egregious sexual misconduct.” He said the allegations and their alleged mishandling “warrant a thorough investigation” to bring justice to victims and prevent future lapses.

In their letter to Lieutenant General Telita Crosland Brady, the lawmakers said the accusations against McGraw raise serious questions about clinical oversight, command accountability and the integrity of the military health system. Because the alleged misconduct may stretch across multiple duty stations and time periods, they urged the Department of War to launch a review that goes beyond a “routine internal inquiry.”

The letter calls for an independent investigation into both McGraw’s actions and the Army’s prior response to complaints or warnings. Lawmakers also asked the Inspector General to examine potential breakdowns in clinical supervision, the Defense Health Agency’s oversight structure and reporting pathways for medical misconduct.

To ensure transparency, the lawmakers submitted a series of questions seeking clarity on how the Army intends to investigate previous complaints, what resources will be made available to victims, and whether state medical licensing boards have been notified. They also requested evaluations of graduate medical education supervision standards and the conduct of supervisors who worked with McGraw.

“The men and women served by the military health system deserve confidence that their care is provided in an environment that prioritizes safety, accountability and professionalism,” the letter states.

McGraw faces allegations involving more than 100 individuals across multiple states for secretly recording patients during their exams. The claims involve patients from Fort Hood, Darnall Army Medical Center and Tripler Army Medical Center in Hawaii.

""These reports are deeply concerning and indescribably horrific. I and my staff are in contact with the Army and monitoring their investigation. I'm committed to ensuring a full accounting of the facts and that justice is served,” said Sen. Ted Cruz in a statement.

The Army has established a single point of coordination for victim support and services related to this case. The point of coordination is the Lead Sexual Assault Response Coordinator (SARC) at Fort Hood at 254-449-6097.",https://media.kcentv.com/assets/KCEN/images/c491b6f7-6294-4503-89c8-ba4fdfc525ca/20251209T223911/c491b6f7-6294-4503-89c8-ba4fdfc525ca_1140x641.jpg,N,0.0,2025-12-12 16:56:36.586305
,,2025-12-12 20:18:07+00:00,We Are The Mighty,Everything there is to know about military pay and veteran benefits for 2026,Adam Gramegna,,,,,https://www.wearethemighty.com/military-news/2026-military-pay-benefits-rates/,"As of early December 2025, the National Defense Authorization Act (NDAA) conference report has confirmed a 3.8% pay raise for active duty and reserve troops.
The Base Pay: 3.8% (The “Standard Issue Raise”) Let’s start with the confirmed target.
Effective January 1, 2026, base pay will increase by 3.8% across the board.
First, address the most common misconception we see in the comment sections and emails: Your Post-9/11 GI Bill (Chapter 33) Monthly Housing Allowance does NOT go up on January 1.
2026 is bringing more money to the pipeline, but as always, it is on you to manage the logistics… please don’t pay 30% interest on that Mustang!","Get We Are The Mighty’s Weekly Newsletter

Military culture and entertainment direct to your inbox with zero chance of a ‘Reply All’ incident

Email address Thank you!

Terms of Use and Privacy Policy

If you have been waiting patiently for the official word on your 2026 paycheck, you can finally stop refreshing the Reddit feed. The numbers are in, and for the vast majority of the force, the news is pretty good, if less exciting than the last two years. As of early December 2025, the National Defense Authorization Act (NDAA) conference report has confirmed a 3.8% pay raise for active duty and reserve troops. It does track with civilian wage growth, even if it does not quite match the historic highs of the past three years.

But if you look past the headline percentage, the 2026 financial landscape is a different entity entirely. From a potential overhaul of junior enlisted pay to a TRICARE price hike that is quietly John Wick’ing your wallet, here is the no-nonsense breakdown of what is hitting your bank account next year.

The Base Pay: 3.8% (The “Standard Issue Raise”)

Let’s start with the confirmed target. Effective January 1, 2026, base pay will increase by 3.8% across the board. This number is locked in the final conference version of the defense bill announced on Dec. 7, 2025. Is it the 5.2% we saw back in 2024? No. But considering the historical average usually hovers closer to 2.5%, a 3.8% hike is designed to keep military purchasing power competitive with the private sector.

What does this mean for an E-5 with six years of service? It will translate to roughly an extra $134 per month before taxes. It won’t buy you a new Mustang (Hey! Please do not finance a Mustang at 30% APR), but it will help offset the price of beef.

The Wild Card: The Junior Enlisted “Stimulus”

Here is where the briefing gets interesting. While the 3.8% is locked and loaded, Congress, much like the late Steve Irwin, is currently wrastling with a much bigger animal: a targeted pay restructuring for grades E-1 through E-4, crikey. The House and Senate have both pushed for a targeted boost that could raise the total pay for junior troops by up to 15%, helping relieve the need for junior families to use food stamps to survive.

Before you PFCs start ordering bottle service at the club, understand that this is still in the “fog of war” phase. While the intent is there in the drafts, implementation is always the enemy. There is a strong chance this could be a “split raise,” where the standard 3.8% hits in January, and the targeted bonus (“the rest of the 15%”) doesn’t kick in until later in the fiscal year. Watch your Leave and Earnings Statement (LES) closely. Until you see that code on the printout, treat that extra cash as rumor, not as a resource.

Retirees & VA: The 2.8% COLA

For our veterans who have already hung up the uniform, the news is steady as she goes. The Social Security Administration confirmed a 2.8% Cost of Living Adjustment (COLA) effective Dec. 1, 2025. In case you are wondering, Soc Sec COLA applies to military pensions and VA disability compensation as well.

If you are rated at 100% disability (veteran only), your monthly payment is going from roughly $3,877 to almost $3,986. It is welcome, but let’s be honest: after the inflation we’ve had shoved down our throats since 2021, that extra money feels more like a band-aid on a bullet hole.

The Schoolhouse Rock (GI Bill, VR&E, & Chapter 35)

Now, if you are currently trading your uniforms and PT formation for a hoodie and sitting in a classroom, listen up. The education benefits do not follow the standard January 1st COLA timeline. The VA and DoD love to make things complicated, so here is the breakdown of what your stipend looks like as of Dec. 9, 2025.

First, address the most common misconception we see in the comment sections and emails: Your Post-9/11 GI Bill (Chapter 33) Monthly Housing Allowance does NOT go up on January 1. Even though the active duty BAH rates change in January, the VA does not update the MHA rates for students until August 1, 2026, the start of the new academic year. You are locked into the 2025-2026 academic year rates until next summer. Currently, the private school cap sits at roughly $29,920 per year, and online-only students are capped at $1,169 per month, which is half the national average.

However, if you are using VR&E (Chapter 31), your subsistence rates actually bumped up back on Oct. 1, 2025. If you haven’t checked the new pay scales, please be careful. As of Oct. 1, the full-time rate for a veteran with no dependents is $812.84 per month. If you have two dependents, that jumps to $1,188.15. Remember, if you are eligible for the Post-9/11 GI Bill, you can usually elect to get paid the Chapter 33 Post 9/11 BAH Rate (based on the zipcode of the school you attend) instead of these subsistence numbers, which is almost always more money.

For the spouses and kids using Chapter 35 (DEA), your rates also shifted at the start of the fiscal year on October 1. The full-time student rate is $1,574.00 per month. If you are going three-quarters time, that drops to $1,244.00. Finally, for the few of you still rocking the Montgomery GI Bill (Chapter 30), maybe you bought in for that $1,200 fee back in boot camp; your rates are effectively $2,518.00 a month for full-time enrollment as of Oct. 1, 2025.

Side note: The Supreme Court recently ruled in favor of Rudisill v. McDonough (April 2024), whoever paid their $1200 for Montgomery GI Bill and then forfeited it in order to obtain Post 9/11 benefits was not required to, and that it was illegal. Therefore, those affected will have time added to their educational benefits.

TRICARE and Housing

You didn’t think you were getting a raise without also getting a headache, did you? The 2026 updates come with a few roadbumps. The cost of convenience is going up at the pharmacy. If you use TRICARE Home Delivery for brand-name drugs, your copay is jumping from $38 to $44 for a 90-day supply. It is a subtle increase, but like a pebble in your shoe, you will feel it over time.

Then there is the housing situation, which finally got some much-needed clarity today. The Department of Defense released the 2026 Basic Allowance for Housing rates on December 11, 2025, confirming an average increase of 4.2% across the force. While the Pentagon is planning to deal out approximately $29.9 billion in housing allowances next year, you should probably hold off on browsing Zillow for an upgrade. That average increase varies widely by zip code; what this means is that troops in high-cost blast zones like San Diego or Norfolk might see a significant increase to match local rents, while others might see the needle barely move.

A raise is only good if the numbers check out. Do not wait until mid-January to find out if DFAS got it right. Check your MyPay account around December 19-20. That is usually when the “January 1” preview LES loads into the system. Always verify and constant vigilance; routinely go over your base pay for the month, check your tax withholdings, and for the love of all that is holy, make sure your allotments are still correct and updated. 2026 is bringing more money to the pipeline, but as always, it is on you to manage the logistics… please don’t pay 30% interest on that Mustang!

Don’t Miss the Best of We Are The Mighty",https://www.wearethemighty.com/wp-content/uploads/2025/12/military-pay-rates-money-pexels.jpg?w=1200,N,0.0,2025-12-12 16:56:40.726807
,,2025-12-12 20:05:28+00:00,www.expressnews.com,Pentagon in talks to move Defense Health Agency to San Antonio,Not Available,,,,,https://www.expressnews.com/business/article/pentagon-health-agency-coming-san-antonio-21239219.php,"Moves by city, congressmen hint that at least part of the Defense Health Agency is coming to JBSA-Fort Sam Houston.",Not Available,,N,0.0,2025-12-12 16:57:14.049959
,,2025-12-12 20:00:23+00:00,www.jbsa.mil,Getting care through TRICARE's Active Duty Dental Program - Joint Base San Antonio,Not Available,,,,,https://www.jbsa.mil/News/Photos/igphoto/2003841960/mediaid/9729314/,"By covering care at military dental clinics with support from civilian dentists in the ADDP, TRICARE helps you maintain dental readiness wherever you serve.",Not Available,https://media.defense.gov/2025/Dec/09/2003841960/431/300/0/251209-O-D0202-1001.JPG,N,1.0,2025-12-13 11:56:33.553956
,,2025-12-12 18:05:59+00:00,"Law Offices of Audrey Hildes Schechter, P.A.",TRICARE Fraud Whistleblower Attorney Clearwater FL,Not Available,,,,,https://www.floridamedicarefraudlawyer.com/health-care-fraud/tricare-fraud/,Get legal guidance from a Florida attorney for TRICARE fraud whistleblowers seeking protection and reporting options when facing retaliation risks.,Not Available,https://www.floridamedicarefraudlawyer.com/wp-content/uploads/sites/1605116/2021/04/OG-image.jpg,N,0.0,2025-12-12 16:57:17.490037
,,2025-12-12 17:58:57+00:00,Military Health System,The Gulf War Story | Health.mil,Not Available,,,,,https://www.health.mil/Military-Health-Topics/Environmental-Exposures-Hub/Environmental-Exposures-Topics/GulfLINK/The-Gulf-War-Story,"Continuum of mental health care for warfighters, families: Support is always there for you The military offers a variety of mental health support, therapies, advice lines, and telehealth to help service members address and succeed in their unique military lifestyle challenges.","Continuum of mental health care for warfighters, families: Support is always there for you

The military offers a variety of mental health support, therapies, advice lines, and telehealth to help service members address and succeed in their unique military lifestyle challenges.",https://health.mil/-/media/Images/MHS/Photos/Default-MHS-Seal.png,N,0.0,2025-12-13 09:56:34.739542
,,2025-12-12 17:58:11+00:00,Military Health System,Declassified Documents | Health.mil,Not Available,,,,,https://www.health.mil/Military-Health-Topics/Environmental-Exposures-Hub/Environmental-Exposures-Topics/GulfLINK/Gulf-War-Library/Declassified-Documents,"Continuum of mental health care for warfighters, families: Support is always there for you The military offers a variety of mental health support, therapies, advice lines, and telehealth to help service members address and succeed in their unique military lifestyle challenges.","Continuum of mental health care for warfighters, families: Support is always there for you

The military offers a variety of mental health support, therapies, advice lines, and telehealth to help service members address and succeed in their unique military lifestyle challenges.",https://health.mil/-/media/Images/MHS/Photos/Default-MHS-Seal.png,N,0.0,2025-12-12 13:56:22.616073
,,2025-12-12 17:36:21+00:00,Washington Technology,Aretum returns to M&A with Veterans Engineering purchase - Washington Technology,Nick Wakeman,,,,,https://www.washingtontechnology.com/companies/2025/12/aretum-returns-m-veterans-engineering-purchase/410132/%3Foref%3Dwt-homepage-river,"In its first acquisition in over two years, Aretum has purchased a tech contractor focused on the Veterans Affairs Department and other federal clients.
Terms of the transaction involving Veterans Engineering were not disclosed.
Aretum said Thursday it is seeking to enhance its offerings around cloud delivery, cybersecurity, and digital transformation.
Veterans Engineering also has customers at the departments of Homeland Security, State, and Energy.
Aretum made the acquisition with the backing of Renovus Capital, which created Aretum in 2023 when it merged two earlier acquisitions.","In its first acquisition in over two years, Aretum has purchased a tech contractor focused on the Veterans Affairs Department and other federal clients.

Terms of the transaction involving Veterans Engineering were not disclosed. Aretum said Thursday it is seeking to enhance its offerings around cloud delivery, cybersecurity, and digital transformation.

Veterans Engineering also has customers at the departments of Homeland Security, State, and Energy. The Defense Health Agency is a client as well.

Aretum made the acquisition with the backing of Renovus Capital, which created Aretum in 2023 when it merged two earlier acquisitions. After its formation, Aretum went on to make two acquisitions that year.

In a release, CEO Rohit Gupta called the VE acquisition a “strategic leap forward.”

Aretum is looking to put more energy behind pursuits related to cloud modernization, enterprise cybersecurity, digital transformation and data-driven mission systems for agencies.

“Veterans Engineering’s technical strength, track record in complex modernization programs, and commitment to mission outcomes are an ideal complement to Aretum’s capabilities,” Gupta said.",https://cdn.washingtontechnology.com/media/img/cd/2025/12/12/AcquisitionWT20251212/open-graph.jpg,N,0.0,2025-12-12 14:56:19.282813
,,2025-12-12 17:09:31+00:00,NOLA.com,Guest Column: It's time to stop denying military families needed autism care,"HANNAH RUE, Provided photo",,,,,https://www.nola.com/opinions/guest_columns/guest-column-it-s-time-to-stop-denying-military-families-needed-autism-care/article_ba8dc3d6-6f05-4c84-b586-493ad9a5b1a9.html,"But for military families, that labor of love can be even more difficult.
It's time for the Department of Defense to acknowledge this obvious truth and give military families the essential medical support they deserve.
That demonstration is still up and running — and currently provides about 16,000 military families with ABA services.
The committee also finds that the DOD's demonstration program has needlessly obstructed access to ABA for military families.
In short, this expert panel has corroborated what autism advocates and military families have known for years.","Raising a child with autism can be challenging under the best of circumstances. But for military families, that labor of love can be even more difficult.

More than 20,000 children of active-duty military service members have been diagnosed with autism. Yet for years, the health plan for these families, TRICARE, has refused to cover one of the most effective treatments for autism spectrum disorder as a basic benefit — a therapy known as applied behavior analysis, or ABA.

Families and clinicians have long been mystified, even outraged, by the military's stance on this issue. Last month, the prestigious National Academies of Sciences, Engineering, and Medicine joined their ranks.

In a new 310-page report, the National Academies concluded that ABA is a medically necessary therapy that should be offered to all children of military members who need it. The report went so far as to say, ""Scientific evidence indicates that ABA is an appropriate intervention to support health outcomes for autistic individuals.""

It's time for the Department of Defense to acknowledge this obvious truth and give military families the essential medical support they deserve.

ABA uses scientifically based insights and techniques to promote positive behavior — and discourage problematic behavior — in children with autism. The medical and scientific communities have acknowledged its benefits for years.

A recent review of the scientific literature in the journal Research in Autism Spectrum Disorders concluded that ""ABA programs are moderately to highly effective bringing significant benefits for children with ASD.""

As far back as 1999, the U.S. Department of Health and Human Services recognized ABA as the gold standard in autism care.

The Department of Defense, however, has been unconvinced. It was only in 2014 that TRICARE began offering ABA to families as part of a ""demonstration program"" aimed at studying the therapy's effectiveness.

That demonstration is still up and running — and currently provides about 16,000 military families with ABA services.

Yet more than a decade after the program launched, the Department of Defense continues to insist that ABA falls short of the evidence standards required for coverage under TRICARE.

This claim flies in the face of years of established scientific research — and now the new report from the National Academies.

Nearly four years ago, Congress tasked the independent committee of experts behind the new study with evaluating TRICARE's ABA demonstration. They concluded that ""ABA fits DOD’s Criteria for Reliable Evidence of Proven Medical Effectiveness.""

The report goes on to recommend, in no uncertain terms, that ""The Defense Health Agency should discontinue the Comprehensive Autism Care Demonstration (ACD) and authorize coverage of applied behavior analysis (ABA) as a Basic benefit under the TRICARE program.""

But it doesn't stop there. The committee also finds that the DOD's demonstration program has needlessly obstructed access to ABA for military families. And it implores the Defense Health Agency to ""take steps to ensure that administrative processes do not impede access to care.""

In short, this expert panel has corroborated what autism advocates and military families have known for years. The DOD has deliberately restricted access to medically necessary care for military-connected children. And it has inflicted enormous harm on service members and their families in doing so.

Active-duty armed services members sacrifice every day for the safety and security of our nation. Denying necessary medical care to these Americans — as well as to their children — is shameful.

It shouldn't have taken an expert report to point out this fact. But now that the NASEM has made plain the military's negligence, the Department of Defense should waste little time in correcting its mistake — and making ABA a basic health benefit for active-duty military families.",https://bloximages.newyork1.vip.townnews.com/nola.com/content/tncms/assets/v3/editorial/3/59/359214c1-9395-49e1-ad95-e2e92d608c3f/692761879aecc.image.jpg?crop=799%2C420%2C0%2C80,N,0.0,2025-12-12 12:56:34.376327
