id,name,published,outlet,title,authors,category,market,categoryorder,articleorder,url,description,text,image,error,sentiment,firstEyes
,,2025-12-11 19:41:42+00:00,Military.com,"$900 Billion NDAA: What Is In, What Was Left Out of Major Defense Spending Bill","Nick Mordowanec, Nick Mordowanec Published",,,,,https://www.military.com/daily-news/2025/12/11/900-billion-ndaa-what-what-was-left-out-of-major-defense-spending-bill.html,"The $900 billion National Defense Authorization Act (NDAA) for Fiscal Year 2026 passed the House of Representatives on Wednesday in bipartisan fashion.
A GOP-issued summary of the legislation says the NDAA authorizes $291 billion for maintenance and operations; $234 billion for military personnel and health care; $162 billion for procurement; $146 billion for research and development; $34 billion for nuclear defense programs; and $20 billion for military construction and family housing.
That includes over $2.7 billion in essential military construction projects and expands in that region.
It permanently repeals all existing Defense Department diversity, equity and inclusion (DEI) offices, programs, training and activities, as well as future DEI-related endeavors.
It cuts climate change-related programs at the Defense Department.","The $900 billion National Defense Authorization Act (NDAA) for Fiscal Year 2026 passed the House of Representatives on Wednesday in bipartisan fashion. The final version includes and also left out key provisions after months of negotiations by lawmakers on Capitol Hill.

The 3,086-page bill passed the House on a 312-112 vote (115 Democrats, 197 Republicans voted in favor) with Republicans and Democrats finding enough common ground to forward the legislation to the Senate—where it is expected to pass the GOP-controlled chamber and then be signed by President Donald Trump.

This year’s NDAA, passed annually by Congress, appropriates large amounts of funding that will impact the departments of Defense and Energy, health care, troops and salaries, research and development, immigration at the U.S.-Mexico border, collective bargaining, and diversity initiatives. Not all lawmakers got what they wanted but high-ranking committee members expressed mostly positive sentiments after the bill’s passing.

“This is a strong bipartisan bill that delivers for our warfighters and deters our adversaries,” House Armed Services Committee Chairman Mike Rogers (R-AL) said on the House floor prior to the bill’s passing. “It will fundamentally reform the defense acquisition enterprise. It will continue historic improvements in the quality of life for our servicemembers and their families.

“It will build the ready, capable, and lethal fighting force we need to deter China and our other adversaries. And it will deliver on President Trump’s Peace Through Strength agenda. I urge all members to support it.”

Rep. Adam Smith (D-WA), the ranking Democrat on the committee, called the bill “the most ambitious swing at acquisition reform that we’ve taken,” according to the Associated Press.

“This NDAA falls short. Trump and [Defense Secretary Pete] Hegseth are deploying troops to our streets, carrying out extrajudicial killings, and undermining our military readiness. Congress must reassert its oversight. We need accountability—not just handouts to Trump,” said Rep. John Garamendi (D-CA), a senior Armed Services Committee member, in a post on X.

Big Money

The House-passed bill in part authorizes some military construction projects and extends their authorization from previous fiscal years; requires the Department of Defense to develop a national strategy on the security implications of emerging biotechnologies; requires the Navy to implement certain processes to improve combat readiness of surface ships maintained and repaired at private shipyards; and extends the Pacific Deterrence Initiative which designed to enhance U.S. deterrence and defense posture in the Indo-Pacific region.

A GOP-issued summary of the legislation says the NDAA authorizes $291 billion for maintenance and operations; $234 billion for military personnel and health care; $162 billion for procurement; $146 billion for research and development; $34 billion for nuclear defense programs; and $20 billion for military construction and family housing.

Lawmakers say the FY 2026 bill overall will save taxpayers nearly $20 billion, including $40.5 million from eliminating DEI activities; $1.6 billion in cuts to climate change-related spending; $1.2 billion from retiring obsolete aircraft and ships; $6.8 billion from reductions in “unnecessary Pentagon bureaucracy”; $5.5 billion in cuts to consulting and service contracts; and $3.7 billion in cuts to inefficient defense programs.

NDAA’s Major Inclusions

Some of the NDAA’s major highlights are as follows:

A 3.8% pay raise for all military servicemembers, in addition to reauthorizing and expanding military bonuses and special pays; increases family separation allowance for deployed servicemembers; and requires a study to improve the calculation of Basic Allowance for Housing to ensure it keeps up with rising rental costs.

$400 million for Ukraine security assistance.

It extends the Pacific Deterrence Initiative (PDI) to improve U.S. posture in the Indo-Pacific region, including funding increases for new technologies needed to deter China such as hypersonic missiles, AI, autonomous systems, cyber, mobile micronuclear reactors, and high energy lasers. That includes over $2.7 billion in essential military construction projects and expands in that region.

Full funding ($1 billion) towards the Taiwan Security Cooperation Initiative.

$1.5 billion in new security assistance for the Philippines.

It formally establishes and authorizes $175 million for the Baltic Security Initiative to strengthen the defensive capability and interoperability of the Baltic states.

Full funding for the deployment of National Guard and active-duty troops in support of border patrol at the United States’ southwest border, including over $1 billion to fight drug trafficking ($398 million for Defense Department support of counter-narcotics operations and $216 million for National Guard counter-drug programs—$100 million over the budget request).

Reforms to military construction that costs 35% more on average than commercial construction, including accelerating construction and reducing costs by granting military departments multiyear contracting authority and authorizing the use of accelerated design-build and progressive design-build contracting methods to cut costs and speed up projects.

Oversight of Defense Department spending by way of fully funding the department’s Inspector General audit activities and requiring the department to submit quarterly reports to Congress on the status of balances and activities of funds previously approved within the One Big Beautiful Bill Act earlier this year.

More than $131 million for the construction of new military dining facilities and over $1.5 billion for new construction of barracks and family housing.

More than $335 million to renovate military hospitals and build new medical facilities, which includes better access to specialty care by lowering the threshold for travel reimbursement for medical appointments from 100 to 75 miles.

More than $491 million to design and build new childcare centers, including annual reviews of childcare costs and a pilot program to increase childcare financial assistance in high-cost areas.

More than $206 million to build new schools for children of servicemembers and allows National Guard and reserve members called to active duty to enroll their children in Defense Department schools. It also authorizes $50 million in Impact Aid assistance to public schools with military dependent students, and an additional $20 million in assistance to local schools teaching children with severe disabilities.

It extends military recruitment bonuses.

It prohibits the retirement of certain F-15E, A-10, C-130, E-3, RQ-4, and Grey Eagle aircraft, as well as the closure of the E-7A Wedgetail production line.

$26 billion in shipbuilding funding for the construction and support of numerous vessels including the third Columbia-class Ballistic Missile Submarine, one Virginia-class Submarine, one anti-submarine warfare auxiliary ship, and future procurements.

More than $38 billion for the development, procurement or modification of aircraft including full funding for the U.S. Air Force’s F-47 and Navy’s F/A-XX 6th Generation Aircraft programs.

Builds the “Golden Dome” to update national missile defense policy.

What's Not in the Bill

Some of what was excluded in the final version are as follows:

The final bill ultimately did not include a provision mandating health care coverage for assisted reproductive technology, including in vitro fertilization (IVF), for all active-duty service members. As previously reported by Military.com, some Democrats and numerous reproductive organizations warned prior to the final version that its removal would prevent the expansion of IVF access to all servicemembers due to current insurance plans through TRICARE.

It permanently repeals all existing Defense Department diversity, equity and inclusion (DEI) offices, programs, training and activities, as well as future DEI-related endeavors.

It cuts climate change-related programs at the Defense Department.

It removes Section 1110, the bipartisan House provision that would have restored collective bargaining rights for the Defense Department’s civilian workforce and would have prevented the department from using the bill’s funds to enforce an executive order that strips collective bargaining rights from hundreds of thousands of DoD civilians.

Rep. Bob Onder (R-MO), urged GOP colleagues in November to strip the provision from the final call, saying in an X post that it was “designed to stop union bosses from slowing down critical defense operations by pushing ineffective policies that hurt productivity” and would cause “political interference.”

Hegseth’s Travel Budget Tied to Caribbean Boat Strikes

The House-passed version also includes a provision to withhold a quarter of Defense Secretary Pete Hegseth’s travel budget until the Pentagon provides Congress with unedited videos of Caribbean airstrikes against alleged drug smuggling boats, according to reports.

It was included on the heels of the ongoing controversy surrounding orders to allegedly kill two survivors from a Sept. 2 strike, and further investigations by GOP-led House and Senate committees into whether that second strike was properly authorized and amounted to war crimes. The investigations remain ongoing.

Codifying Trump's Executive Orders

The NDAA also codifies all or parts of 15 executive orders issued by President Trump, including the following:

Restoring America's Fighting Force (EO 14185)

Ending Radical and Wasteful Government Diversity, Equity, and Inclusion (DEI) Programs and Preferencing (EO 14151)

Declaring a National Emergency at the Southern Border (Proclamation 10886)

Securing Our Borders (EO 14165)

Clarifying the Military's Role in Protecting the Territorial Integrity of the U.S. (EO 14167)

Modernizing Defense Acquisitions and Spurring Innovation in the Defense Industrial Base (EO 14265)

Building the Golden Dome for America (EO 14186)

Deploying Advanced Nuclear Reactor Technologies for National Security (EO 14299)

Restoring American Airspace Sovereignty (EO 14305)

Unleashing American Drone Dominance (EO 14307)

Story Continues",https://images05.military.com/sites/default/files/styles/full/public/2025-12/ap25344658317216.jpg,N,0.0,2025-12-11 16:56:32.505449
,,2025-12-11 19:41:30+00:00,sam.gov,Defense Health Agency Data Governance Transforming the Data Landscape - SAM.gov,Not Available,,,,,https://sam.gov/workspace/contract/opp/37b0a99a5cad48c89ded2a529f969830/view,Defense Health Agency Data Governance Transforming the Data Landscape: A ... Military Health System. The requirement includes developing a ...,Not Available,https://sam.gov/workspace/contract/opp/37b0a99a5cad48c89ded2a529f969830/favicon.ico,N,0.0,2025-12-11 18:56:44.492714
,,2025-12-11 19:34:01+00:00,www.linkedin.com,#mentalhealth #militaryhealth #holidayseason | Military Health System - LinkedIn,Military Health System,,,,,https://www.linkedin.com/posts/militaryhealthsystem_mentalhealth-militaryhealth-holidayseason-activity-7404955652785262592-u02N,"“Therapy can be so helpful for folks, whether they're struggling with relationships, anxiety, depression, or trauma-related symptoms.
In some ways, it forces us to confront our problems.” says Navy Cmdr.
Stephanie Long, a clinical and medical psychologist who is the director for psychological health for the U.S. Navy.
The Military Health System offers a continuum of #MentalHealth care that best fits with one’s unique challenges, family situations, and locations.
Full story: https://lnkd.in/gZg-vicv #MilitaryHealth | #HolidaySeason","“Therapy can be so helpful for folks, whether they're struggling with relationships, anxiety, depression, or trauma-related symptoms. In some ways, it forces us to confront our problems.” says Navy Cmdr. Stephanie Long, a clinical and medical psychologist who is the director for psychological health for the U.S. Navy. The Military Health System offers a continuum of #MentalHealth care that best fits with one’s unique challenges, family situations, and locations. Full story: https://lnkd.in/gZg-vicv #MilitaryHealth | #HolidaySeason",https://media.licdn.com/dms/image/v2/D5610AQGa_9KU-mZmIw/image-shrink_1280/B56ZsOv7mbJMAc-/0/1765479004805?e=2147483647&v=beta&t=wZszzD-7vaSHVqGwXtrSekie8kD-UJXlKEBRIDOdh3E,N,0.0,2025-12-11 18:56:47.351676
,,2025-12-11 18:11:07+00:00,DVIDS,Walter's Way: Shaping Care Through Your Feedback - DVIDS,Not Available,,,,,https://www.dvidshub.net/news/553864/walters-way-shaping-care-through-your-feedback,"– Walter Reed National Military Medical Center’s new approach to medical care begins with Walter’s Way and continues with the voices of those who use it every day.
As these areas shift to more proactive care, they are also implementing new tools to gather direct feedback from patients and staff.
This feedback is a cornerstone of Walter’s Way by helping teams evaluate what is working well, identifying opportunities for improvements, and strengthening the overall care experience.
To support continuous improvement, a dedicated Walter’s Way feedback form is now available for patients and families to share their experiences.
Whether the feedback highlights success, points out a challenge, or suggests a new idea, every response plays a meaningful role in shaping the future of patient care at Walter Reed.","By Roan Smith Walter Reed Hospital Communications

BETHESDA, Md. – Walter Reed National Military Medical Center’s new approach to medical care begins with Walter’s Way and continues with the voices of those who use it every day. This model is transforming the patient and staff experience through improved flexibility, easier access to care, and a renewed focus on whole-person wellness.

Several clinical departments, including Primary Care, Pediatrics, and Dermatology, have already adopted the Walter’s Way model. As these areas shift to more proactive care, they are also implementing new tools to gather direct feedback from patients and staff. This feedback is a cornerstone of Walter’s Way by helping teams evaluate what is working well, identifying opportunities for improvements, and strengthening the overall care experience.

To support continuous improvement, a dedicated Walter’s Way feedback form is now available for patients and families to share their experiences. Whether the feedback highlights success, points out a challenge, or suggests a new idea, every response plays a meaningful role in shaping the future of patient care at Walter Reed.

“We've had some positive feedback,” said U.S. Army Lt. Col. Elizabeth Simmons, Deputy Director for the Department of Medicine and Primary Care lead for Walter’s Way. “Families have even written in, or patients have written in comments to give great feedback about some of our Walter’s Way staff.”

As the hospital continues to refine and expand Walter’s Way, leadership remains committed to transparency, patient-centered care, and open communication. All patients and staff are encouraged to stay engaged, share insights, and help guide the evolution of this model.",https://cdn.dvidshub.net/images/dvids_logo.svg,N,0.0,2025-12-11 14:56:27.278130
,,2025-12-11 16:47:33+00:00,LifeNews.com,"IVF Provision Removed From Defense Bill, Pro-Life Groups Applaud - LifeNews.com",Steven Ertelt,,,,,https://www.lifenews.com/2025/12/11/ivf-provision-removed-from-defense-bill-pro-life-groups-applaud/,"The National Defense Authorization Act, known as the NDAA and formally designated S. 1071, cleared the House by a vote of 312-112.
The IVF language, which passed both chambers earlier this year, was dropped from the final negotiated version unveiled over the weekend.
Under the removed provision, Defense Secretary Pete Hegseth would have been directed to ensure that fertility-related care, including IVF, was covered under the TRICARE Prime and TRICARE Select health plans for active-duty service members and their dependents.
The provision’s elimination mirrored a similar removal from last year’s defense bill and came amid opposition from pro-life advocates, who argued that standard IVF practices involve the creation and destruction of human embryos, making taxpayer funding unethical.
“This victory shows us a sensitivity to that,” said Frank Pavone, national director of Priests for Life, referring to widespread moral concerns about IVF.","The U.S. House of Representatives passed a $901 billion defense authorization bill Wednesday stripped of a controversial provision that would have required insurance coverage for in vitro fertilization for military families

That move is drawing praise from pro-life organizations that hailed the move as a stand against the destruction of human embryos.

The National Defense Authorization Act, known as the NDAA and formally designated S. 1071, cleared the House by a vote of 312-112. The measure now heads to the Senate for consideration.

The IVF language, which passed both chambers earlier this year, was dropped from the final negotiated version unveiled over the weekend. Under the removed provision, Defense Secretary Pete Hegseth would have been directed to ensure that fertility-related care, including IVF, was covered under the TRICARE Prime and TRICARE Select health plans for active-duty service members and their dependents.

Get the latest pro-life news and information on X (Twitter). Follow @LifeNewsHQ

TRICARE currently does not cover IVF or other assisted reproductive technologies.

The provision’s elimination mirrored a similar removal from last year’s defense bill and came amid opposition from pro-life advocates, who argued that standard IVF practices involve the creation and destruction of human embryos, making taxpayer funding unethical. The industry has faced criticism for operating with little oversight, leading to the discard of tens of thousands of so-called “excess” embryos annually – essentially human beings who are killed.

House Speaker Mike Johnson, R-La., drew credit from conservative groups for blocking the measure, which some Senate Republicans had labeled a “poison pill” during negotiations.

“This victory shows us a sensitivity to that,” said Frank Pavone, national director of Priests for Life, referring to widespread moral concerns about IVF. “The people I’ve talked to in the administration have said very explicitly, you know, these concerns have been heard, these moral concerns.”

Kristi Hamrick, vice president of media and policy for Students for Life of America, called the removal a step toward better alternatives. “IVF is not an industry that deserves blanket support and funding. We can do better,” she said.

Hamrick added that the process destroys “far more lives than are allowed to live and thrive,” and that “more pre-born lives are lost in IVF than abortion.”

“Unquestioning financial support props up an industry known to prey on people’s hopes for a child while ending many lives,” Hamrick said. “The move to pull the funding for IVF will free up resources to seek better answers.”

Lila Rose, president of Live Action, thanked Johnson for “ensuring TRICARE was not used to subsidize this destruction of life.”

The bill’s passage caps a year of debate over fertility coverage, fueled in part by campaign pledges including one from President-elect Donald Trump to expand IVF access nationwide. Pro-life groups framed the removal not as a setback for military families but as a principled choice to prioritize methods that avoid embryo destruction.",https://www.lifenews.com/wp-content/uploads/2015/08/senate4.jpg,N,0.0,2025-12-11 14:56:31.791214
,,2025-12-11 16:40:58+00:00,Veterans Affairs,Virtual Education Center | Lovell Federal Health Care - TRICARE - Veterans Affairs,Not Available,,,,,https://www.va.gov/lovell-federal-health-care-tricare/programs-tricare/virtual-education-center,"Our resources cover 60 medical topics, including: Health and wellness information Clinic-specific resources Videos, handouts, and links to additional health resources Training materials, how-to videos, and step-by-step instructions The Virtual Education Center puts the power in your hands to research health topics before you talk to your provider.
It’s as easy as 1, 2, 3 … Go to https://vec.health.mil/ and agree to the terms.
Log in with your Common Access Card or DS Logon.
If you don’t already have a DS Logon, you’ll need to set it up.
Search topics, create personalized dashboards, and quickly find information sent to you directly from your providers.","Our resources cover 60 medical topics, including:

Health and wellness information

Clinic-specific resources

Videos, handouts, and links to additional health resources

Training materials, how-to videos, and step-by-step instructions

The Virtual Education Center puts the power in your hands to research health topics before you talk to your provider.

Get informed. Ask the right questions. Make the best decisions about your health.

How does it work?

You can log in from any mobile device. It’s as easy as 1, 2, 3 …

Go to https://vec.health.mil/ and agree to the terms.

Log in with your Common Access Card or DS Logon. If you don’t already have a DS Logon, you’ll need to set it up.

Explore and learn!

Search topics, create personalized dashboards, and quickly find information sent to you directly from your providers.

Need help?",https://www.va.gov/img/design/logo/va-og-image.png,N,0.0,2025-12-11 18:56:55.865905
