id,name,published,outlet,title,authors,category,market,categoryorder,articleorder,url,description,text,image,error,sentiment,firstEyes
,,2025-07-03 17:58:54+00:00,TradingView,Humana Expands Medicaid Footprint With Virginia's Cardinal Care Win - TradingView,Not Available,,,,,https://www.tradingview.com/news/zacks:3a60cfdac094b:0-humana-expands-medicaid-footprint-with-virginia-s-cardinal-care-win/,"Virginia’s Medicaid program, Cardinal Care, has chosen Humana Inc. HUM as one of five insurers to administer services through its new Humana Healthy Horizons plan.
All Virginia Cardinal Care members are now eligible to choose this as a new Medicaid plan option.
The Zacks Consensus Estimate for Centene’s current-year earnings is pegged at $7.28 per share, implying 1.5% year-over-year growth.
The Zacks Consensus Estimate for Cigna’s current-year earnings is pegged at $29.68 per share, implying 8.6% year-over-year growth.
The Zacks Consensus Estimate for Molina’s current-year earnings is pegged at $28.44 per share, implying 7.9% year-over-year growth.","Virginia’s Medicaid program, Cardinal Care, has chosen Humana Inc. HUM as one of five insurers to administer services through its new Humana Healthy Horizons plan. All Virginia Cardinal Care members are now eligible to choose this as a new Medicaid plan option.

Cardinal Care offers health coverage to low-income individuals, children, seniors, people with disabilities and pregnant women. Rather than paying healthcare providers directly, the program partners with private insurance companies known as Managed Care Organizations, which manage medical services, prescriptions and overall care coordination for members.

Humana Healthy Horizons is poised to deliver comprehensive care to individuals and families across the state, focusing not only on physical and mental health but also on the social factors that often hinder better overall well-being. With existing service to Medicare Advantage and TRICARE members in the state, the expansion into Cardinal Care allows Humana to extend its human-centred approach to Medicaid recipients, aiming to offer innovative solutions, address complex needs, and improve both health outcomes and quality of life.

This move opens a valuable opportunity for Humana’s growth. By managing care for enrolled members, the company can increase memberships and receive regular payments from the state, offering a steady and scalable source of revenue. Through Humana Healthy Horizons, the company already serves 1.5 million Medicaid members in the country. Expanding into Virginia’s Medicaid broadens Humana’s reach beyond Medicare and TRICARE.

HUM’s YTD Price Performance

In the year-to-date period, Humana’s shares have lost 3.9% compared with a 24% decline across the broader industry. Due to rising healthcare costs, increased service utilization, and operational inefficiencies, Humana continues to face pressure on its profitability and long-term margins.

Humana’s Zacks Rank & Key Picks

HUM currently has a Zacks Rank #3 (Hold).

Some better-ranked stocks in the medical space areCentene Corporation CNC,Cigna Group CI and Molina Healthcare Inc. MOH,each carrying a Zacks Rank #2(Buy) at present. You can see the complete list of today’s Zacks #1 Rank (Strong Buy) stocks here.

The Zacks Consensus Estimate for Centene’s current-year earnings is pegged at $7.28 per share, implying 1.5% year-over-year growth. CNC’s earnings surpassed estimates in each of the last three of four quarters, the average surprise being 25.5%. The consensus estimate for Centene’s current-year revenues is pegged at $179.5 billion, implying 10.1% year-over-year growth.

The Zacks Consensus Estimate for Cigna’s current-year earnings is pegged at $29.68 per share, implying 8.6% year-over-year growth. Cigna’s earnings surpassed estimates in three of the last four quarters. It has witnessed eight upward revisions in the last 60 days against no movement in the opposite direction. The consensus estimate for Cigna’s current-year revenues is pegged at $258.2 billion, implying 4.5% year-over-year growth.

The Zacks Consensus Estimate for Molina’s current-year earnings is pegged at $28.44 per share, implying 7.9% year-over-year growth. MOH’s earnings surpassed estimates in three of the last four quarters. The estimate remained stable in the last 60 days. The consensus estimate for Molina’s current-year revenues is pegged at $44.1 billion, implying 8.4% year-over-year growth.

This article originally published on Zacks Investment Research (zacks.com).

Zacks Investment Research",https://s.tradingview.com/static/images/illustrations/news-story.jpg,N,0.0,2025-07-03 14:56:19.890833
,,2025-07-03 17:46:10+00:00,DVIDS,"Military Health System Has Courage to Change, Official Says - DVIDS",Not Available,,,,,https://www.dvidshub.net/news/511514/military-health-system-has-courage-change-official-says,"On the final day of the 2012 Military Health System Conference here, the Defense Department’s top health affairs official spoke today not about the undisputed excellence of the system and its caregivers, but rather about the need for more collaboration, transformation and organizational courage.
Dr. Jonathan Woodson, assistant secretary of defense for health affairs and director of the TRICARE Management Activity, addressed 3,000 attendees at the conference.
Now, it’s about exhibiting organization courage -- specifically, the courage to change.” To keep pace with the future, Woodson said, the military health system must have the courage to become more joint, more collaborative and integrative, and broader in focus to leverage all the talent in the system, irrespective of service or rank.
The $53 million military health system includes more than 133,000 military and civilian doctors, nurses, medical educators, researchers, health care providers, allied health professionals, and health administration personnel around the world.
That’s the story we need to tell over and over again in all of our communities.” Fiscal challenges should not be allowed to distract the men and woman of the military health system, he said.","On the final day of the 2012 Military Health System Conference here, the Defense Department’s top health affairs official spoke today not about the undisputed excellence of the system and its caregivers, but rather about the need for more collaboration, transformation and organizational courage.

Dr. Jonathan Woodson, assistant secretary of defense for health affairs and director of the TRICARE Management Activity, addressed 3,000 attendees at the conference.

“Our people have always exhibited great personal courage over the years, and this has been shown many times on the battlefield,” he said. “There is no shortage of personal courage. Now, it’s about exhibiting organization courage -- specifically, the courage to change.”

To keep pace with the future, Woodson said, the military health system must have the courage to become more joint, more collaborative and integrative, and broader in focus to leverage all the talent in the system, irrespective of service or rank.

“We need the courage to [re-examine] how we incentivize behavior in our system. … We need to face up to the shortcomings of our information systems, our patient engagement strategies and our approaches to changing the behavior of our population in terms of health risks,” he said.

The system also must engage in a strategy of collaboration with all of its federal partners, Woodson said, particularly the Veterans Affairs Department.

The $53 million military health system includes more than 133,000 military and civilian doctors, nurses, medical educators, researchers, health care providers, allied health professionals, and health administration personnel around the world. Woodson said the system must assess its performance and relevance in terms of value and not cost alone, and must communicate this value to its stakeholders, especially the larger Defense Department community.

“On Feb. 13, [President Barack Obama’s] budget will be released, and as you would expect, … there will be a significant focus on the numbers. The budget’s numbers are important, but they don’t convey the story that was described to you this week by so many speakers,” Woodson told the conferees. “The story of the MHS is not about $53 billion or how many prescription drugs were purchased or [the number of] co-pays or deductibles. It’s about the value we provide to the people we serve. That’s the story we need to tell over and over again in all of our communities.”

Fiscal challenges should not be allowed to distract the men and woman of the military health system, he said. “Instead,” he added, “we should seize upon the opportunity to become stronger, better and more relevant.”

From the conference presentations, Woodson said, he’s taking away messages about leadership development, knowledge sharing and innovation.

“In most eras, the military has never been wanting for leaders, because that is what we do. … [But] the development of good leaders with updated competencies requires constant attention,” he said. “Military health system leaders need special competencies to manage health care issues effectively in the 21st century.”

During a conference session with senior enlisted advisors from each service, the assistant secretary said, he learned that one of their critical concerns is that the skills acquired by enlisted medics who performed so brilliantly on the battlefield not be allowed to atrophy as the kinetic wars subside and they return to peacetime duties.

“The integration of enlisted medics could be the critical shaping factor for our future,” Woodson said, “and may provide the answer to how we establish and staff effective patient-centered medical home teams with extended capabilities to meet our patients’ needs.”

The military health system also must focus on leadership development of officers in the post-war environment, he added.

“Our military treatment facility commanders and staff have borne a substantial burden in trying to balance the needs of deployment, readiness, training and running garrison health systems over the past decade,” Woodson said.

In addressing knowledge sharing and innovation, the assistant secretary described the need for a broader strategy of developing a culture of innovation, nurturing the innovative spirit and “rewarding the innovators in our midst.”

Woodson said he is convinced that MHS expertise is comparable to the best expertise anywhere in the world, “but we need to improve the access to this expertise.”

During one of the conference sessions, Dr. Denis A. Cortese, director of the Arizona State University Healthcare Delivery and Policy Program and a former Mayo Clinic chief executive officer, talked about internal knowledge-sharing systems in use at premier institutions such as Mayo, the Cleveland Clinic, the Intermountain system of hospitals and Johns Hopkins University.

“We have to do this, too,” Woodson said, “and we will.”

The conference has been not just an opportunity to share information and distribute knowledge across the enterprise, Woodson said.

“It’s also how we cull innovation and how that feeds into the generation of new knowledge,” he added. “This year and in the coming years, we will have the opportunity to change. The years will be challenging, the tasks will be hard, and we have the responsibility to get it right.”

Story by Cheryl Pellerin, American Forces Press Service",https://cdn.dvidshub.net/images/dvids_logo.svg,N,1.0,2025-07-03 14:56:24.346115
,,2025-07-03 16:53:08+00:00,The Coastland Times,Social Security Matters: Ask Rusty – What about non-career veterans and their VA healthcare?,Guest Columnist,,,,,https://www.thecoastlandtimes.com/2025/07/03/social-security-matters-ask-rusty-what-about-non-career-veterans-and-their-va-healthcare/,"Social Security Matters: Ask Rusty – What about non-career veterans and their VA healthcare?
If a non-career veteran is eligible for VA health care, couldn’t that be used in place of Medicare?
So, I use my VA coverage when it is convenient for me but rely also on non-VA, Medicare-approved specialists who I can choose to use (or not) at will.
A veteran can decline Medicare Part B coverage and save that monthly premium, but they would need to contact Social Security to do so.
But a non-career veteran can opt out of Medicare Part B if they get all of their healthcare services through the Veterans Administration.","Social Security Matters: Ask Rusty – What about non-career veterans and their VA healthcare?

Published 12:47 pm Thursday, July 3, 2025

Getting your Trinity Audio player ready...

By AMAC Certified Social Security Advisor Russell Gloor, Association of Mature American Citizens

Dear Rusty: In your answer to the retired U.S. Navy veteran about why he is forced to enroll in Medicare, you focused on military TriCare’s requirement for the member to enroll in Medicare. But you said nothing about regular VA health care. If a non-career veteran is eligible for VA health care, couldn’t that be used in place of Medicare? Signed: Veteran Advocate

Dear Veteran Advocate: Thank you for your feedback. FYI, I have previously explained numerous times that veterans who rely on the VA for 100% of their healthcare can, indeed, disenroll from Medicare Part B (thus saving the monthly Part B premium). I don’t personally recommend it because of my personal experience, but it certainly is possible to do so.

Get the latest headlines sent to you

Personally, I use the VA for some of my healthcare needs – usually an annual checkup and optometry services – at my local VA clinic which is only a mile away from where I live. But for any extensive treatment needs (medical tests, etc.) I must travel about 40 miles to the nearest VA hospital facility. For contrast, I have numerous private healthcare services, specialists and hospitals very near where I live, but to use them under the VA I must get VA preapproval and use only certain VA-approved providers, which is inconvenient for me. Personally, I prefer the freedom to go to any healthcare service provider I choose, without restriction, at any time I need to. So, I use my VA coverage when it is convenient for me but rely also on non-VA, Medicare-approved specialists who I can choose to use (or not) at will. For me, it’s a matter of convenience and the freedom to use whichever healthcare provider I want. That said, I fully understand that some veterans rely exclusively on the VA for their healthcare needs, and I have explained to many who have written to me that they have that option. I have also published several public articles about this as well. Here is one such article:

socialsecurityreport.org/ask-rusty-why-should-a-veteran-pay-for-medicare/

So, please rest assured that we regularly advise our veterans about their healthcare options under Medicare, including the ability to decline Medicare Part B coverage if they have full VA healthcare coverage. FYI, free Medicare Part A (inpatient hospitalization coverage) is mandatory to collect Social Security after age 65, but Medicare Part B coverage is always optional because there is a premium associated with Part B. A veteran can decline Medicare Part B coverage and save that monthly premium, but they would need to contact Social Security to do so. Social Security will want to interview the veteran to ensure they are aware of the potential financial consequences of not having Medicare Part B. And they may need to file form CMS-1763 (Request for Termination). But a non-career veteran can opt out of Medicare Part B if they get all of their healthcare services through the Veterans Administration.

READ ABOUT NEWS AND EVENTS HERE.",https://www.thecoastlandtimes.com/wp-content/uploads/sites/55/2019/01/ask-rusty-e1546533339278.jpg,N,0.0,2025-07-03 14:56:29.312336
,,2025-07-03 16:18:17+00:00,Instagram,Military Health System | Big news from Naval Health Research Center! Two of their ... - Instagram,Not Available,,,,,https://www.instagram.com/p/DLnmiIkpbIK/,"18 likes, 0 comments - militaryhealth on July 2, 2025: ""Big news from Naval Health Research Center! Two of their research teams have been honored with the prestigious 2025 Dr. Delores M. Etter Top Scientists and Engineers of the Year award. 

This recognition highlights their contributions to the U.S. Navy and U.S. Department of Defense (DoD), from optimizing sailor performance to revolutionizing marksmanship assessment.

Want to learn more about the brilliant minds behind these advancements and their impact on our military’s health and readiness? Click the link in the bio for MHS News.

https://www.med.navy.mil/Media/News/Article/4227661/nhrc-researchers-win-2025-dr-delores-m-etter-top-scientists-and-engineers-of-th/"".",Not Available,https://scontent-iad3-2.cdninstagram.com/v/t51.82787-15/514511326_18400188067119680_2250557197362377829_n.jpg?stp=c181.0.543.543a_dst-jpg_e35_s640x640_tt6&_nc_cat=111&ccb=1-7&_nc_sid=18de74&_nc_ohc=SX5w_SR-qjMQ7kNvwEmtg3M&_nc_oc=AdmMfYpUHo94IZWlYwjEBhgnnW7jpJWj-gxXA1durtMG0h-GHB8SDqOOkdbBUM6pROw&_nc_zt=23&_nc_ht=scontent-iad3-2.cdninstagram.com&_nc_gid=GeYHl6ToAsSVufeScY1Fmg&oh=00_AfO5gCbkmCcLBcyusX0QOz1uYxQEPRI4pBuvLeJeDrwSiw&oe=686CC15E,N,1.0,2025-07-03 15:56:15.060970
,,2025-07-03 16:03:47+00:00,Stars and Stripes,Border checks could delay return to Germany without proper ID | Stars and Stripes,Not Available,,,,,https://www.stripes.com/ktown/2025-07-03/germany-poland-border-checks-18322653.html,"American travelers in the Kaiserslautern Military Community who are leaving Germany should carry their passports, as border checks remain in place across much of the European Union.
Poland will temporarily reinstate controls with Germany and Lithuania starting Monday, Polish Prime Minister Donald Tusk said Tuesday.
While travelers may face fewer restrictions entering Czechia, Switzerland, Luxembourg or Belgium, returning to Germany without proper documentation could cause delays.
Germany reintroduced its own border controls in September 2024 in response to irregular migration and smuggling, according to the site.
Re-entry measures in Germany are expected to remain in place through Sept. 15, while border policies in neighboring countries are expected to remain in effect through various dates into the fall.","American travelers in the Kaiserslautern Military Community who are leaving Germany should carry their passports, as border checks remain in place across much of the European Union.

Poland will temporarily reinstate controls with Germany and Lithuania starting Monday, Polish Prime Minister Donald Tusk said Tuesday. France, Austria, the Netherlands and Denmark are also conducting heightened checks, according to the European Commission’s website.

While travelers may face fewer restrictions entering Czechia, Switzerland, Luxembourg or Belgium, returning to Germany without proper documentation could cause delays.

Germany reintroduced its own border controls in September 2024 in response to irregular migration and smuggling, according to the site.

Re-entry measures in Germany are expected to remain in place through Sept. 15, while border policies in neighboring countries are expected to remain in effect through various dates into the fall.",https://www.stripes.com/incoming/im0mqu-5390592.jpg/alternates/LANDSCAPE_480/5390592.jpg,N,0.0,2025-07-03 12:56:32.529919
,,2025-07-03 15:51:57+00:00,DVIDS,TRICARE Moves Forward With Prime Service Area Reductions - DVIDS,Not Available,,,,,https://www.dvidshub.net/news/507695/tricare-moves-forward-with-prime-service-area-reductions,"The Defense Department will reduce the number of TRICARE Prime service areas in the United States beginning Oct. 1, affecting about 171,000 retirees and their family members.
As always, officials noted, TRICARE beneficiaries still are covered by TRICARE Standard.
For those living within 100 miles of a remaining Prime service area, re-enrolling in Prime may be an option, depending on availability.
Prolonged protests resulted in a staggered transition, they added, and all Prime service areas were retained until all three new regional contracts were in place.
To provide affected beneficiaries with enough time to plan, Defense Department officials elected to delay the Prime service area reductions until Oct. 1.","The Defense Department will reduce the number of TRICARE Prime service areas in the United States beginning Oct. 1, affecting about 171,000 retirees and their family members.

Those beneficiaries, who mostly reside more than 40 miles from a military clinic or hospital, received a letter earlier this year explaining their options. They will receive a second letter later this month.

TRICARE Management Activity officials said changing the location of Prime service areas has been planned since 2007 as part of the move to the third-generation of managed care support contracts and will allow them to continue their commitment to making high-quality health care available while supporting DOD efforts to control the rising cost of health care for 9.6 million beneficiaries.

Health care under TRICARE Prime costs about $600 more annually per enrollee, but on average, each member of a family of three using TRICARE Standard will pay only about $20 more per month than if they were using Prime.

“The first thing TRICARE beneficiaries should know about the reduction in the number of Prime service areas is that it doesn’t mean they’re losing their TRICARE benefit,” said Dr. Jonathan Woodson, assistant secretary of defense for health affairs. “Next, it’s important to remember this change does not affect most of the more than 5 million people using TRICARE Prime, and [it affects] none of our active duty members and their families.”

All affected beneficiaries will receive a letter this month following up on their initial notification to ensure they have the time and information to make important decisions about their future health care options, officials said.

Current details on Prime service areas and the option for beneficiaries to sign for email updates are available at http://www.tricare.mil/PSA. A ZIP code tool is available on the site to help beneficiaries determine if they live in an affected area.

As always, officials noted, TRICARE beneficiaries still are covered by TRICARE Standard. For those living within 100 miles of a remaining Prime service area, re-enrolling in Prime may be an option, depending on availability. To do this, beneficiaries must waive their drive-time standards, and they may have to travel long distances for primary and specialty care.

“I urge all impacted beneficiaries to carefully consider their health care options – they should talk them over with family members and their current health care provider,” Woodson said. “Many beneficiaries may be able to continue with their current provider using the Standard benefit. Being close to your health care team usually offers the best and safest access to care.”

Those enrolled in TRICARE Prime are assigned a primary care provider who manages their health care. Retirees pay an annual enrollment fee and have low out-of-pocket costs under this plan. TRICARE Standard is an open-choice option with no monthly premiums and no need for referrals, but it has cost shares and an annual deductible.

The Prime service areas being eliminated are not close to existing military treatment facilities or base realignment and closure sites, officials said. Prolonged protests resulted in a staggered transition, they added, and all Prime service areas were retained until all three new regional contracts were in place. The West region completed the transition April 1.

To provide affected beneficiaries with enough time to plan, Defense Department officials elected to delay the Prime service area reductions until Oct. 1.

Story by From a TRICARE Management Activity News Release",https://cdn.dvidshub.net/images/dvids_logo.svg,N,-1.0,2025-07-03 12:56:36.266138
,,2025-07-03 15:31:53+00:00,Slator,US Defense Health Agency Is Looking for Language Solutions Integrators - Slator,Seyma Albarino,,,,,https://slator.com/us-defense-health-agency-looking-for-language-solutions-integrators/,"We are using cookies to give you the best experience on our website.
You can find out more about which cookies we are using or switch them off in .","We are using cookies to give you the best experience on our website.

You can find out more about which cookies we are using or switch them off in .",https://slator.com/assets/2025/07/US-Defense-Health-Agency-Is-Looking-for-Language-Solutions-Integrators.png,N,0.0,2025-07-03 12:56:44.012925
