id,name,published,outlet,title,authors,category,market,categoryorder,articleorder,url,description,text,image,error,sentiment,firstEyes
,,2025-12-13 14:36:22+00:00,www.linkedin.com,Defense Health Agency's Post - LinkedIn,Defense Health Agency,,,,,https://www.linkedin.com/posts/defense-health-agency_today-wreaths-across-america-volunteers-activity-7405594862940561408-k6J8,"Today, Wreaths Across America volunteers nationwide will place wreaths on the graves of our nation’s heroes; among them countless medical personnel whose charter was to care for those to their left and right on battlefields and here at home.
This is more than a ceremony— it’s a powerful act of remembrance, a heartfelt show of honor, and a moment to teach the importance of service and freedom.
Every wreath is a commitment to remember those who served.","Today, Wreaths Across America volunteers nationwide will place wreaths on the graves of our nation’s heroes; among them countless medical personnel whose charter was to care for those to their left and right on battlefields and here at home. This is more than a ceremony— it’s a powerful act of remembrance, a heartfelt show of honor, and a moment to teach the importance of service and freedom. Every wreath is a commitment to remember those who served.",https://media.licdn.com/dms/image/v2/D4E10AQH80xSMSjfecg/image-shrink_1280/B4EZsX1R.hIUAg-/0/1765631402452?e=2147483647&v=beta&t=qYEYs49ceYtEC17WrHq_QNWBwIvY9ya7YtQhwQG-9WI,N,0.0,2025-12-13 11:56:24.874620
,,2025-12-13 11:59:13+00:00,mccareer.org,MHS 2026 Military Health System Award for Advancement in Military Medicine Nomination form,Not Available,,,,,https://mccareer.org/wp-content/uploads/2025/12/2026-mhs-award-for-advancement-in-military-medicine-nomination-form.pdf,MHS 2026 Military Health System Award for Advancement in Military Medicine. Nomination form. Award Category (Junior or Senior):. Rank: Full Name of ...,Not Available,,N,0.0,2025-12-13 08:56:20.349234
,,2025-12-13 09:54:53+00:00,www.msn.com,Breast Pump Billing Scandal Sparks $1 Million Settlement With U.S. Government - MSN,Not Available,,,,,http://www.msn.com/en-us/news/us/breast-pump-billing-scandal-sparks-1-million-settlement-with-us-government/ar-AA1RzXNZ%3Fapiversion%3Dv2%26domshim%3D1%26noservercache%3D1%26noservertelemetry%3D1%26batchservertelemetry%3D1%26renderwebcomponents%3D1%26wcseo%3D1,"... TRICARE, the military's worldwide health care program. Should You ... Glen Diehl, Acting Deputy Director of the Defense Health Agency, said ...",Not Available,,N,0.0,2025-12-13 09:56:21.883121
,,2025-12-13 09:36:35+00:00,US Muslims,81 women expand sexual abuse lawsuit against US Army gynecologist in Texas,US Muslims,,,,,https://www.usmuslims.com/81-women-expand-sexual-abuse-lawsuit-against-us-army-gynecologist-in-texas-327920h.htm,"The civil case runs alongside an ongoing criminal prosecution, in which army prosecutors have charged McGraw with more than 50 specifications of “indecent visual recording” involving dozens of alleged victims, according to army officials.
- Monitoring case 'very closely' Army leadership has acknowledged the gravity of the allegations.
Undersecretary of the Army Mike Obadal and Army Surgeon General Lt. Gen. Mary Izaguirre recently visited the Fort Hood facility to review Defense Health Agency policies.
Army officials say he was removed from patient care in October, within hours of the first complaint.
Defense attorneys have not publicly responded to the expanded lawsuit.","Civil case against Maj. Blaine McGraw grows as US Army faces scrutiny over patient safety and oversight

By Gizem Nisa Demir

ISTANBUL (AA) - Eighty-one women have now joined a civil lawsuit in Texas accusing a US Army gynecologist at Fort Hood of sexual misconduct during medical exams, as the army faces growing scrutiny over patient safety and internal oversight.

Newsmax reported Friday that the expanded complaint, filed in Bell County, alleges Maj. Blaine McGraw covertly recorded patients, engaged in inappropriate touching, and conducted intrusive, unnecessary exams while serving at the Carl R. Darnall Army Medical Center.

The civil case runs alongside an ongoing criminal prosecution, in which army prosecutors have charged McGraw with more than 50 specifications of “indecent visual recording” involving dozens of alleged victims, according to army officials.

- Monitoring case 'very closely'

Army leadership has acknowledged the gravity of the allegations. Undersecretary of the Army Mike Obadal and Army Surgeon General Lt. Gen. Mary Izaguirre recently visited the Fort Hood facility to review Defense Health Agency policies.

“Our ethical and moral imperative is to ensure deployment-ready forces while providing a safe and professional environment for all patients,” Obadal said.

“I’m proud of our leaders and medical providers for the swift action taken to initiate the criminal investigation and prioritize patient safety — all of which reflects their unwavering commitment to patient care and army readiness.”

A US official, speaking anonymously, said Army Secretary Daniel Driscoll has been monitoring the case “very, very closely” and ordered a fact-finding mission to assess conditions “on the ground.”

“It goes without saying that the allegations are abhorrent, absolutely counter to the values the army and the military try to uphold,” the official added.

McGraw, 47, has been held in pretrial confinement at the Bell County Jail since early December. Army officials say he was removed from patient care in October, within hours of the first complaint. Defense attorneys have not publicly responded to the expanded lawsuit.

Kaynak:

This news has been read 79 times in total",https://www.usmuslims.com/d/news/0.jpg,N,-1.0,2025-12-13 11:56:29.669668
,,2025-12-13 07:52:01+00:00,Newsmax,81 Women Expand Sexual Abuse Lawsuit Against Army Doctor - Newsmax,Jim Thomas,,,,,https://www.newsmax.com/newsfront/army-doctor-sexual/2025/12/12/id/1238151/,"A civil lawsuit against Army Maj. Blaine McGraw expanded this week when the women added claims accusing the gynecologist of inappropriate touching, covert filming, and other alleged misconduct during medical exams.
The expanded civil complaint, filed in Bell County, Texas, alleges McGraw violated state assault, sexual assault, and battery laws and harmed patients through intrusive and unnecessary exams.
Attorneys for the women filed the expanded civil complaint shortly after the government announced criminal charges.
The lawsuit includes alleged victims from Texas and other states, reflecting a broader pattern of claims spanning McGraw’s Army career.
Defense lawyers have not publicly responded to the expanded complaint.","A total of 81 women have filed a civil lawsuit in Texas against U.S. Army Major Blaine McGraw, a gynecologist who faces criminal charges for allegedly surreptitiously recording patients at Fort Hood, prompting official responses from Army leadership concerning patient safety and the evaluation of Army policies.

A civil lawsuit against Army Maj. Blaine McGraw expanded this week when the women added claims accusing the gynecologist of inappropriate touching, covert filming, and other alleged misconduct during medical exams.

The development is the latest in a case already under criminal prosecution and now prompting official Army leadership statements.

McGraw, a medical officer at Carl R. Darnall Army Medical Center at Fort Hood, was charged by the Army’s Office of Special Trial Counsel with more than 50 specifications of ""indecent visual recording"" and related offenses involving dozens of victims, according to Army officials.

The expanded civil complaint, filed in Bell County, Texas, alleges McGraw violated state assault, sexual assault, and battery laws and harmed patients through intrusive and unnecessary exams.

Plaintiffs say McGraw took advantage of his position of trust to record intimate procedures secretly.

In published statements, Army leaders acknowledged the seriousness of the allegations and outlined steps being taken to review policies and protect patients.

Undersecretary of the Army Mike Obadal and Army Surgeon General Lt. Gen. Mary Izaguirre visited the medical center to review Defense Health Agency policies.

""Our ethical and moral imperative is to ensure deployment-ready forces while providing a safe and professional environment for all patients,"" Obadal said.

""I’m proud of our leaders and medical providers for the swift action taken to initiate the criminal investigation and prioritize patient safety — all of which reflects their unwavering commitment to patient care and Army readiness.""

A U.S. official, speaking on condition of anonymity about internal Army leadership discussions, said Army Secretary Daniel Driscoll has been monitoring the situation ""very, very closely"" and dispatched the team at Fort Hood as a fact-finding mission to understand the situation ""on the ground.""

""It goes without saying that the allegations are abhorrent, absolutely counter to the values the Army and the military try to uphold,"" the official said.

The civil complaint also contends that McGraw ""failed to document in her medical records that a rape kit had ever been performed,"" which the plaintiff’s lawyers argued interfered with subsequent criminal prosecution of an alleged assailant.

McGraw, 47, has been held in pretrial confinement in Bell County Jail since early December.

Army officials say he was suspended from patient care in October after the first allegations surfaced and that investigators began reviewing his conduct within hours of the initial complaint.

Attorneys for the women filed the expanded civil complaint shortly after the government announced criminal charges.

The lawsuit includes alleged victims from Texas and other states, reflecting a broader pattern of claims spanning McGraw’s Army career.

Defense lawyers have not publicly responded to the expanded complaint.",https://www.newsmax.com/CMSPages/GetFile.aspx?guid=18c9ca25-bc3d-441d-bd6f-e2df7ddea232&SiteName=Newsmax,N,-1.0,2025-12-13 07:56:34.458749
,,2025-12-13 06:47:18+00:00,ironmountaindailynews.com,Whitmer signs bipartisan bills to lower costs for Michigan National Guard members and their families,Not Available,,,,,https://www.ironmountaindailynews.com/news/local-news/2025/12/whitmer-signs-bipartisan-bills-to-lower-costs-for-michigan-national-guard-members-and-their-families/,"Gretchen Whitmer has signed Senate Bills 370, 540 and 542, which will lower the cost of health care and child care for members of the Michigan National Guard and their families.
“We are lowering the cost of health care and child care for members of the Michigan National Guard, ensuring they can carry out their missions to keep us all safe and provide for their families, too.
Senate Bill 540, sponsored by state Sen. Kevin Hertel, D-Saint Clair Shores, will create the Michigan National Guard Child Care Assistance Program within the DMVA.
The new program will help eligible Michigan National Guard members pay for child care costs during weekend drills or annual training.
Last month, Whitmer signed bipartisan legislation to establish the Michigan National Guard Benefit Fund.","LANSING, Mich. — Gov. Gretchen Whitmer has signed Senate Bills 370, 540 and 542, which will lower the cost of health care and child care for members of the Michigan National Guard and their families.

“These bills reaffirm our commitment to fight for those who fight for us,” Whitmer said. “We are lowering the cost of health care and child care for members of the Michigan National Guard, ensuring they can carry out their missions to keep us all safe and provide for their families, too. I’m proud that legislators worked across the aisle to pass these commonsense bills, building on years of bipartisan progress we have made to help our National Guard balance their service and their daily lives. Let’s keep working together to make health care and child care more affordable for everyone and stay focused on getting things done that make a real difference in people’s lives.”

Senate Bill 370, sponsored by state Sen. Sam Singh, D-East Lansing, will require the Department of Military and Veterans Affairs to create and operate a Tricare premium reimbursement program, lowering the cost of health care for residents who serve in the National Guard.

Senate Bill 540, sponsored by state Sen. Kevin Hertel, D-Saint Clair Shores, will create the Michigan National Guard Child Care Assistance Program within the DMVA. The new program will help eligible Michigan National Guard members pay for child care costs during weekend drills or annual training.

Senate Bill 542, sponsored by state Sen. Veronica Klinefelt, D-Eastpointe, is tie-barred to SB 540 and will require the balance remaining in the Michigan National Guard Tuition Assistance Fund at the end of the fiscal year to be transferred to the Michigan National Guard Member Benefits Fund.

Last month, Whitmer signed bipartisan legislation to establish the Michigan National Guard Benefit Fund. The three bills complete the four-bill package and ensure the men and women who serve Michigan in uniform save more money and get the benefits they deserve.",http://d14e0irai0gcaa.cloudfront.net/www.ironmountaindailynews.com/images/2016/11/15140544/fblike.jpg,N,0.0,2025-12-13 07:56:39.376354
,,2025-12-13 01:44:42+00:00,DHA.mil - The Official Website of The Defense Health Agency,'Deep sense of service' drives public health expert to protect warfighters - DHA.mil,Not Available,,,,,https://dha.mil/News/2025/12/12/17/09/Deep-sense-of-service-drives-public-health-expert-to-protect-warfighters,"Dr. Mark Rubertone, chief of functional information technology support for Defense Health Agency’s Armed Forces Health Surveillance Division within DHA-Public Health, received the Department of War’s Distinguished Civilian Service Award during a ceremony Dec. 3, 2025, at the Pentagon in Arlington, Virginia.
Describing Rubertone as an “icon in the Military Health System,” DHA Public Health Deputy Director Sean Friendly said, “His development of the Defense Military Surveillance System has tracked every military member medical encounter since 1997.
“Over 30 years ago, Dr. Rubertone created several important tools for military force health protection and readiness that are widely used today,” said Navy Capt.
“His unique skill set allows him to act as the bridge over the gap between information technology and public health epidemiology,” she said.
“I'm driven by a deep sense of service and a desire to use my skills to make a positive impact.”","Dr. Mark Rubertone, chief of functional information technology support for Defense Health Agency’s Armed Forces Health Surveillance Division within DHA-Public Health, received the Department of War’s Distinguished Civilian Service Award during a ceremony Dec. 3, 2025, at the Pentagon in Arlington, Virginia.

“I'm deeply grateful and humbled by this recognition,” said Rubertone. “Receiving this award is a testament to the dedication and hard work of the entire team I've had the privilege to lead and work alongside. It means a great deal to me — not just as an individual achievement — but as validation of the importance of public health data and health IT in supporting our nation's warfighters.”

The award is DOW’s highest recognition for career civilian employees whose work improves the efficiency and impact of the entire department.

Describing Rubertone as an “icon in the Military Health System,” DHA Public Health Deputy Director Sean Friendly said, “His development of the Defense Military Surveillance System has tracked every military member medical encounter since 1997. This system is critical to execute comprehensive health surveillance on our military family.”

Rubertone said the award is “truly a reflection of the incredible team I've been fortunate to work with throughout my career and in particular during the past 10 years at DHA. The success we've achieved is entirely attributable to their expertise, dedication, and unwavering commitment to our mission.”

Modernizing health data for readiness

As functional IT support chief, Rubertone led teams to upgrade tools used for tracking the burden of disease, injury, and illness among beneficiaries across the Military Health System.

Those systems helped public health experts study trends ranging from musculoskeletal injuries to COVID-19 and measure the effectiveness of prevention and treatment efforts. The data collected was vital for leaders in Congress, the Department, and the Department of Health and Human Services to set policy and allocate services.

“Over 30 years ago, Dr. Rubertone created several important tools for military force health protection and readiness that are widely used today,” said Navy Capt. Carlos Williams, deputy chief of AFHSD. “The impact of these tools on warfighter readiness comes from how they are used to track, interpret, validate, and communicate essential health threats that directly affect the force.”

Rubertone underscored his commitment to warfighter lethality, stating, “My work, at its core, is about ensuring our warfighters are healthy, protected, and ready to answer the call of duty. We accomplish this by providing data and tools necessary to identify threats to their health, track injury and illness trends, and measure the effectiveness of preventive measures.”

Air Force Col. Cecilia Session, chief of AFHSD’s epidemiology and analysis branch, highlighted Rubertone’s ability at translating complex data into clear, reliable information for commanders and policymakers. “His unique skill set allows him to act as the bridge over the gap between information technology and public health epidemiology,” she said. “As the DHA’s systems evolve to incorporate advances in information technology, he is the vanguard of modernizing and integrating our health data systems.”

Rubertone also played a key role in bringing data from MHS GENESIS into DOW's surveillance systems as the electronic health record rolled out between 2017 and 2024. That work helped link information from clinics and hospitals around the world to long-standing tools such as the Defense Medical Surveillance System and the Department of Defense Serum Repository.

In creating these tools, “his visionary ideas have been a cornerstone of force health protections and readiness,” said Dr. Shauna Stahlman, deputy chief of epidemiology and analysis at AFHSD. “His leadership shows that when we preserve the past with purpose, we equip the future with possibility.”

Data-driven service provides ‘meaningful change’ for readiness

The Distinguished Civilian Service Awards are reserved each year for a small number of career civilians whose work has a department-wide impact.

The award honors a career that has shown how advanced health surveillance and secure, integrated data systems serve what DHA calls “medicine for the mission” — protecting the force, promoting health, and ensuring the military remains ready to respond.

Data, Rubertone said, “has the power to drive meaningful change, especially when it comes to public health and national security.”

At the cornerstone of his renowned career, Rubertone emphasized, is his dedication in using this data to help the warfighter. “There's a constant challenge to innovate, to adapt to evolving threats, and to find new ways to use data to improve the health and readiness of our warfighters,” he said. “I'm driven by a deep sense of service and a desire to use my skills to make a positive impact.”",https://dha.mil/-/media/Project/Images/News-Images/9438883.jpg,N,1.0,2025-12-13 00:56:32.266507
,,2025-12-13 01:26:41+00:00,www.petersonschriever.spaceforce.mil,Access virtual mental health care with TRICARE - Peterson Space Force Base,Not Available,,,,,https://www.petersonschriever.spaceforce.mil/Newsroom/News/Display/Article/4359050/access-virtual-mental-health-care-with-tricare/,"By TRICARE Communications. FALLS CHURCH, Virginia --. Note: If you ... Defense Health Agency. “You have several different options for seeking ...",Not Available,,N,0.0,2025-12-12 21:56:22.584440
,,2025-12-12 23:51:20+00:00,www.facebook.com,"Moves by city, congressmen hint that at least part of the Defense Health Agency is coming to ...",Not Available,,,,,https://www.facebook.com/SAExpressNews/posts/moves-by-city-congressmen-hint-that-at-least-part-of-the-defense-health-agency-i/1504820478318487/,"Moves by city, congressmen hint that at least part of the Defense Health Agency is coming to JBSA-Fort Sam Houston.
Pentagon in talks to move major agency to San Antonio.
What it could mean.","Moves by city, congressmen hint that at least part of the Defense Health Agency is coming to JBSA-Fort Sam Houston.

Pentagon in talks to move major agency to San Antonio. What it could mean.",https://external.fagc3-1.fna.fbcdn.net/emg1/v/t13/17273624003647417625?url=https%3a%2f%2fs.hdnux.com%2fphotos%2f01%2f41%2f77%2f14%2f25686794%2f5%2frawImage.jpg&fb_obo=1&utld=hdnux.com&stp=c0.5000x0.5000f_dst-jpg_flffffff_p600x600_q75_tt6&_nc_gid=bKxWp5zT4tZxHVaQcI582Q&_nc_oc=AdkkyPHq-mgPawVJi9E0Z3LOE0VWD2_fWMaE0FQqRWKbAvwVZy816UG49N6uA5M5gjEYSaDkTpMf7Ompu-mI77VL&ccb=13-1&oh=06_Q3-6AXcEObd3zIuVsshLErCE9XSekYX6NyEXDaZ-kgH9VAF1&oe=693E8528&_nc_sid=867500,N,0.0,2025-12-12 19:56:23.370242
,,2025-12-12 23:19:39+00:00,www.reddit.com,Tricare vs FEHB. Is one better than the other for most people? : r/nationalguard - Reddit,Not Available,,,,,https://www.reddit.com/r/nationalguard/comments/1pl4urd/tricare_vs_fehb_is_one_better_than_the_other_for/,"There is a timeline for techs to be allowed to do TRS, if I recall correctly.
The net gain of being a tech compared to your current job still may make it worth it.
I’m definitely looking for AGR and ADOS first, but the longer I’m unemployed the more anything becomes better than nothing at all.
I left civilian federal service a few years back, but I know I had FEHB.
I thought I opted for that vs being forced, but it’s been even longer since I started the onboarding for that job.","There is a timeline for techs to be allowed to do TRS, if I recall correctly. The net gain of being a tech compared to your current job still may make it worth it.

Thank you. I’m definitely looking for AGR and ADOS first, but the longer I’m unemployed the more anything becomes better than nothing at all. Normally I wouldn’t consider health care to be such a big decision maker but we’re at one doctor or another several times a week every week all year long so it could be a major deal if the coverage is a lot worse. I appreciate your input!

Guess I’m remembering incorrectly. I left civilian federal service a few years back, but I know I had FEHB. I thought I opted for that vs being forced, but it’s been even longer since I started the onboarding for that job.",,N,0.0,2025-12-12 19:56:27.974676
,,2025-12-12 23:03:53+00:00,www.jbsa.mil,Access virtual mental health care with TRICARE - Joint Base San Antonio,Not Available,,,,,https://www.jbsa.mil/News/Photos/igphoto/2003841986/,TRICARE remains committed to helping you unlock your health through accessible mental health care options for you and your family members.,Not Available,https://media.defense.gov/2025/Dec/11/2003841986/431/300/0/251211-O-D0202-1001.JPG,N,1.0,2025-12-13 01:56:18.209258
