id,name,published,outlet,title,authors,category,market,categoryorder,articleorder,url,description,text,image,error,sentiment,firstEyes
,,2025-07-04 17:29:57+00:00,DVIDS,Health Affairs Chief Trumpets TRICARE Successes; Says Much Still to Be Done - DVIDS,Not Available,,,,,https://www.dvidshub.net/news/532056/health-affairs-chief-trumpets-tricare-successes-says-much-still-done,"He noted that military medical professionals at last year's conference set four major goals for the military health system: to improve force health protection and readiness; improve TRICARE; further outreach, coordination and collaboration; and to improve provider recruitment and retention.
""The Department of Defense immediately initiated vaccination of selected service members,"" he noted.
While military service members are healthier than the general public, our experience should serve as a guide to the civilian community, and you should take this message back home.""
You also enrolled more than 100,000 seniors into TRICARE Plus, providing a health system far superior to the previous 'space-available runaround.'""
In a final note on TRICARE, Winkenwerder said new contracts were released during summer 2002 that will change the way the program is administered -- for the better.","Noting that the nation is experiencing ""very serious times,"" Dr. William Winkenwerder Jr., assistant secretary of defense for health affairs, told more than 3,000 attendees at the National TRICARE Conference that ""there's much to be done in the coming year across the military health system.""

Winkenwerder pointed out that, ""Tens of thousands of Americans have deployed to the Gulf region; families have bid farewell to their loved ones from almost every naval harbor in the country; 37,000 American soldiers are sitting on point at Camp Bonifas at the Demilitarized Zone and throughout the Korean Peninsula; our reserve component service members continue to join their active duty counterparts in significant numbers as one fighting force.""

He noted that military medical professionals at last year's conference set four major goals for the military health system: to improve force health protection and readiness; improve TRICARE; further outreach, coordination and collaboration; and to improve provider recruitment and retention.

Reflecting on performances in achieving these goals and outlining what needs to be done this year, the secretary said, ""The most important step we took in 2002 was to restart a strategic planning and governance process for the entire military health system.""

Crediting the surgeons general and senior DoD leaders with spending a lot of time putting together a shared vision and strategy for the coming years, Winkenwerder said, ""We took a fresh look at what it is we do, those we service, and the values that our service represents and then redefined what is expected of us.

""Much has been accomplished,"" he added. This, he said, includes the resumption of the anthrax vaccination and initiation of smallpox immunizations.

DoD's top doctor emphasized that only a few critics remain since anthrax vaccinations were resumed in June 2002. ""Bad information has been beaten by a military force, including a DoD leadership, better informed about the threats posed by biological agents and a communications effort that has been second to none,"" he said.

Winkenwerder stood with President Bush on Dec. 13, 2002, when the president announced smallpox vaccinations for military members and first responders in the civilian medical community.

""The Department of Defense immediately initiated vaccination of selected service members,"" he noted. ""As a physician, I know that the smallpox vaccine has a risk profile that merits heightened awareness. But as your assistant secretary of defense for health affairs, I know that our experience with this vaccine sets a standard for safety for the rest of the country and the world. There's no other medical system in the country or on the planet with the documented experience and successful outcomes that we have.""

From 1945 to 1990, DoD immunized millions of service members against smallpox and didn't experience any deaths, the doctor emphasized.

""How?"" he asked, then answered, ""With great professional attention and the finest basic medical care -- careful screening before vaccination and close monitoring after the sticks. While military service members are healthier than the general public, our experience should serve as a guide to the civilian community, and you should take this message back home.""

To critics who argue that the threat isn't clear, therefore, the vaccination program isn't necessary, Winkenwerder said, ""I can' tell you whether the likelihood of a smallpox attack is 1/10th of 1 percent or 75 percent, but we know that the former Soviet Union weaponized smallpox and produced it in significant quantities.

""We don't know if it's all accounted for,"" he said. ""Others may also have produced and stored it.""

Consequently, Winkenwerder said, DoD made the right choice in taking pre-emptive action to protect American troops. ""We've attacked and neutralized the top two biological threats against the forces of freedom,"" he said. ""But the work doesn't end with vaccination against anthrax and smallpox. We have much more to do in the coming year to improve protection against a number of biological, chemical and other threats from weapons of mass destruction.""

The secretary said the successes were significant in the improvement of TRICARE. Last year's successes include kicking off the TRICARE for Life benefit, fixing computer glitches, and data sharing with Medicare. As a result, he said, ""the TRICARE for Life program truly represents and industry benchmark for how to reach out to consumers, including sitting down with people, ""one-by-one and telling them how their benefits work.

""This is about trust,"" he continued, ""and you restored that trust. You also enrolled more than 100,000 seniors into TRICARE Plus, providing a health system far superior to the previous 'space-available runaround.'""

Winkenwerder told the audience that quality improvement in TRICARE and patient safety are paramount. More than 50,000 potentially life-threatening adverse drug interactions were prevented in the Pharmacy Data Transaction Service.

""It's fast, accurate and saves lives,"" he said.

""Another program we're closely monitoring is the TRICARE On-Line initiative,"" the secretary said. ""We're out in front of much of the industry on providing our enrollees and other beneficiaries with quality Web-based support. In the year ahead, we'll deploy TRICARE On-Line to almost all of our military treatment facilities.""

The secretary also said TRICARE is launching an obstetrics initiative. ""Congress has amended nonavailability statement requirements for women not enrolled in TRICARE Prime, providing expanded patient choice,"" the doctor said. ""We have a story to tell about the high-quality of our obstetric care and about the customer-oriented services we pledge to deliver.""

He said DoD is studying the possibility for patients to e-mail and consult electronically with their healthcare providers.

In a final note on TRICARE, Winkenwerder said new contracts were released during summer 2002 that will change the way the program is administered -- for the better. This includes simplifying administration, increasing accountability and improving customer service. TRICARE is also moving from seven contracts to three contracts and from 11 regions in the U.S. to three regions.

""Every one of the issues I raised here is about our leadership responsibility -- greater accountability for performance in quality and optimized facilities; greater simplicity in management and patient administration; and in patients that are pleased with getting their care from their military health system,"" Winkenwerder said.

""Our beneficiaries also have expectations that their private medical information is secure,"" he said. Winkenwerder said DoD is tightening security and accountability for all sensitive information, particularly health information.

""We must remember that here in the Department of Defense, electronic and physical security is required to protect our patients, and to promote national security,"" he said. ""We all have responsibilities.""

Story by Rudi Williams, American Forces Press Service",https://cdn.dvidshub.net/images/dvids_logo.svg,N,1.0,2025-07-05 01:56:26.696551
,,2025-07-04 16:59:08+00:00,www.linkedin.com,"Defense Health Agency hiring Advanced Practice Nurse (Family Medicine) in Oak Harbor, WA",Not Available,,,,,https://www.linkedin.com/jobs/view/advanced-practice-nurse-family-medicine-at-defense-health-agency-4262457513,"Sign in to access AI-powered advices Welcome back Email or phone Password or By clicking Continue to join or sign in, you agree to LinkedIn’s User Agreement, Privacy Policy, and Cookie Policy.
Join now or New to LinkedIn?
Join now By clicking Continue to join or sign in, you agree to LinkedIn’s User Agreement, Privacy Policy, and Cookie Policy.
Sign in to evaluate your skills Welcome back Email or phone Password or By clicking Continue to join or sign in, you agree to LinkedIn’s User Agreement, Privacy Policy, and Cookie Policy.
Join now By clicking Continue to join or sign in, you agree to LinkedIn’s User Agreement, Privacy Policy, and Cookie Policy.","Sign in to access AI-powered advices

Welcome back

Email or phone

Password

or

By clicking Continue to join or sign in, you agree to LinkedIn’s User Agreement, Privacy Policy, and Cookie Policy.

New to LinkedIn? Join now

or

New to LinkedIn? Join now

By clicking Continue to join or sign in, you agree to LinkedIn’s User Agreement, Privacy Policy, and Cookie Policy.

Sign in to evaluate your skills

Welcome back

Email or phone

Password

or

By clicking Continue to join or sign in, you agree to LinkedIn’s User Agreement, Privacy Policy, and Cookie Policy.

New to LinkedIn? Join now

or

New to LinkedIn? Join now

By clicking Continue to join or sign in, you agree to LinkedIn’s User Agreement, Privacy Policy, and Cookie Policy.",https://static.licdn.com/aero-v1/sc/h/xlk678jv0tjp79pv10kglzkf,N,0.0,2025-07-04 16:56:19.275569
,,2025-07-04 16:31:16+00:00,www.linkedin.com,"Defense Health Agency hiring Advanced Practice Nurse ( Family Practice) in Tacoma, WA",Not Available,,,,,https://www.linkedin.com/jobs/view/advanced-practice-nurse-family-practice-at-defense-health-agency-4262455682,"Referrals increase your chances of interviewing at Defense Health Agency by 2x See who you know Sign in to see who you already know at Defense Health Agency Welcome back Email or phone Password or By clicking Continue to join or sign in, you agree to LinkedIn’s User Agreement, Privacy Policy, and Cookie Policy.
New to LinkedIn?
Join now or New to LinkedIn?
Join now By clicking Continue to join or sign in, you agree to LinkedIn’s User Agreement, Privacy Policy, and Cookie Policy.","Referrals increase your chances of interviewing at Defense Health Agency by 2x

See who you know

Sign in to see who you already know at Defense Health Agency

Welcome back

Email or phone

Password

or

By clicking Continue to join or sign in, you agree to LinkedIn’s User Agreement, Privacy Policy, and Cookie Policy.

New to LinkedIn? Join now

or

New to LinkedIn? Join now

By clicking Continue to join or sign in, you agree to LinkedIn’s User Agreement, Privacy Policy, and Cookie Policy.",https://static.licdn.com/aero-v1/sc/h/xlk678jv0tjp79pv10kglzkf,N,0.0,2025-07-04 17:56:16.900309
,,2025-07-04 16:31:09+00:00,www.linkedin.com,"Defense Health Agency hiring Physician (Medical Evaluation Board) in Manhattan, KS",Not Available,,,,,https://www.linkedin.com/jobs/view/physician-medical-evaluation-board-at-defense-health-agency-4262453803,"We’re unlocking community knowledge in a new way.
Experts add insights directly into each article, started with the help of AI.
Explore More","We’re unlocking community knowledge in a new way. Experts add insights directly into each article, started with the help of AI.

Explore More",https://static.licdn.com/aero-v1/sc/h/xlk678jv0tjp79pv10kglzkf,N,0.0,2025-07-04 15:56:17.100950
,,2025-07-04 16:05:13+00:00,www.reddit.com,Retired Navy question : r/VeteransBenefits - Reddit,Not Available,,,,,https://www.reddit.com/r/VeteransBenefits/comments/1lrknix/retired_navy_question/,"If you ever wanna use Medicare, I highly recommend that you have the $180 deducted from your Social Security check to pay for Medicare part B.
If you do not decide to sign up for it, after a certain amount of time, there’s no going back.
My wife who never served is currently on Medicare and tfl the only thing I’ve paid for is her rx every threee months.
In order for my wife to get access to tfl I had to sign up and pay a monthly premium for Tricare prime.
If you are satisfied with the VA and use it for your health care there's probably no point.","If you ever wanna use Medicare, I highly recommend that you have the $180 deducted from your Social Security check to pay for Medicare part B. If you do not decide to sign up for it, after a certain amount of time, there’s no going back. I’d highly recommend that you check with a professional on this.

I am pretty sure you have tri care for life since you are a retired military...my friend who is retired air force was telling me that while we were both in the doctors office , he had his three choices still VA, Tri-care and Medicare and he and his wife whom he was waiting on while we were having this conversation were in their 70's...I would however recommend that you do opt in for Medicare when the time comes. Through him and through others, having told me it has been a major blessing at various times...I would talk to knowledge base here for any and all specifics of each...but yes if you want all three the options are there for you...I wish I was wise and stayed in so I could have my military retirement and your options, it's blessing to many I know...you deserve it

To get/keep TFL you will have to sign up for Medicare at 65 (you will also get a new forever retired ID)- if you don't sign up for Medicare and do so later, hefty penalty. You will keep eligibility for free at VA. I use Medicare for most things and VA for eyes/ears -- I assume you either have Prime or standard/Select Tricare currently

At your rating, your VA medical/health care is free for life...I am still employed and have employer provided health insurance, which in no way affects my VA health benefits/care...so essentially for the time being I have my low cost employer health coverage AND my VA health care (which is not to be confused with 'insurance'). In your case, your option would be having Medicare at a cost AND your free VA Healthcare

Like others have said yes you will have to pay for Medicare out of your social security. That said you can also enroll in Tricare for life which wraps around Medicare. Additionally you can sign up for a Medicare advantage plan that you don’t pay for but in turn it gets paid for by Medicare and gives you money back at no additional cost!

This is exactly what I’m planning on doing next year when I turn 65. My wife who never served is currently on Medicare and tfl the only thing I’ve paid for is her rx every threee months. Also tfl has an option for overseas applications free of charge! In order for my wife to get access to tfl I had to sign up and pay a monthly premium for Tricare prime. Im currently at 60 percent and retired.

Dm me if you need further details.

Bottom line it’s worth it !

There is no requirement to sign up for medicare.

You should sign up for medicare part A which covers hospitalization and does not cost anything because it was paid for by deductions from your pay during the time you worked.

You can sign up for Part B which is totally voluntary and requires a monthly payment, but as you are totally covered by the VA that is a financial decision for you to make. If you are satisfied with the VA and use it for your health care there's probably no point. If you do not sign up for Part B when eligible, and later decide you want coverage there's a 2% penalty for every year you didn't get the coverage.",,N,0.0,2025-07-04 14:56:26.832143
,,2025-07-04 15:49:51+00:00,X (formerly Twitter),"Defense Health Agency on X: ""Huge news! The American @RedCross & ASBP have ...",Not Available,,,,,https://x.com/DoD_DHA/status/1941129902478029254,Defense Health Agency · @DoD_DHA. Huge news! The American. @RedCross. & ASBP have partnered to strengthen our nation's blood supply & support ...,"JavaScript is not available.

We’ve detected that JavaScript is disabled in this browser. Please enable JavaScript or switch to a supported browser to continue using x.com. You can see a list of supported browsers in our Help Center.",,N,1.0,2025-07-04 13:56:16.453673
,,2025-07-04 15:49:50+00:00,X (formerly Twitter),"Defense Health Agency on X: ""On this Fourth of July, we salute the foundational ideals of our ...",Not Available,,,,,https://x.com/DoD_DHA/status/1941144974122484062,"Defense Health Agency · @DoD_DHA. On this Fourth of July, we salute the foundational ideals of our nation. Military medicine proudly serves those who ...","JavaScript is not available.

We’ve detected that JavaScript is disabled in this browser. Please enable JavaScript or switch to a supported browser to continue using x.com. You can see a list of supported browsers in our Help Center.",,N,1.0,2025-07-04 14:56:31.373522
,,2025-07-04 15:21:29+00:00,Forum Insights,dha Archives - Page 89 of 211 - Forum Insights,Not Available,,,,,https://www.insights.govforum.io/tag/dha/page/89/,"Industry Moves Defense Health Agency adds Data Quality Chief This established DoD health data quality leader, with expertise in the areas of Healthcare Information Management, Billing Systems Training & Implementations, IT Project Management, Clinical Workflow Analysis, Data Quality, and Medical Records Administration, has recently taken on a new role as the liaison between the Data Quality Management Control Program, Cost Accounting Branch, and other functional leads at Defense Health HeadquartersThe post Defense Health Agency adds Data Quality Chief appeared first on G2Xchange Health.
Industry Moves NikSoft adds Fed Health industry leader Scott Turner as...
Looking to build on their broad Federal footprint, which includes providing program support for the migration of the Defense Health System Services (DHSS) systems and applications to DISA, this small business, whose focus is providing innovative software and efficient solutions to the Federal Government, recently added this established Federal Health and MHS business development leaderThe post NikSoft adds Fed Health industry leader Scott Turner as new Senior VP to lead Growth-Strategy appeared first on G2Xchange Health.","Industry Moves

Defense Health Agency adds Data Quality Chief

This established DoD health data quality leader, with expertise in the areas of Healthcare Information Management, Billing Systems Training & Implementations, IT Project Management, Clinical Workflow Analysis, Data Quality, and Medical Records Administration, has recently taken on a new role as the liaison between the Data Quality Management Control Program, Cost Accounting Branch, and other functional leads at Defense Health HeadquartersThe post Defense Health Agency adds Data Quality Chief appeared first on G2Xchange Health.

Industry Moves

NikSoft adds Fed Health industry leader Scott Turner as...

Looking to build on their broad Federal footprint, which includes providing program support for the migration of the Defense Health System Services (DHSS) systems and applications to DISA, this small business, whose focus is providing innovative software and efficient solutions to the Federal Government, recently added this established Federal Health and MHS business development leaderThe post NikSoft adds Fed Health industry leader Scott Turner as new Senior VP to lead Growth-Strategy appeared first on G2Xchange Health.",https://i0.wp.com/www.insights.govforum.io/wp-content/uploads/2023/02/fav-icon.png?fit=32%2C32&ssl=1,N,0.0,2025-07-04 14:56:37.048126
,,2025-07-04 14:49:27+00:00,physicians.associationcareernetwork.com,"Physician (Family Practice) Job Opening in Everett, Washington",,,,,,https://physicians.associationcareernetwork.com/job/physician-family-practice/78981024/,Experience may not be substituted for residency training that is required for the specialty identified. Job ID: 78981024. Defense Health Agency Logo.,Not Available,,Y,0.0,2025-07-04 18:56:27.227831
,,2025-07-04 14:36:27+00:00,higherlogicdownload.s3.amazonaws.com,U.S. DEPARTMENT OF DEFENSE MILITARY HEALTH SYSTEM PRESCRIBES ARUBA ...,Not Available,,,,,https://higherlogicdownload.s3.amazonaws.com/SYNNEX/a70230b1-f5b6-e5ed-05f8-8db309ea3a6f_file.pdf%3FX-Amz-Expires%3D3600%26X-Amz-Security-Token%3DIQoJb3JpZ2luX2VjECYaCXVzLWVhc3QtMSJGMEQCIC8H%252FT9MPlw%252BR5LORgFIrW7MfJhJdN7TdkMkt081Ps7jAiBmAVB5NwdYpZIxRm%252B5LDXUnRAsxJzrARUtcFqSh%252FRnBiqwBQgvEAAaDDM4MDMzNzM0MDcwNiIM8RRAGyT7PXcNwyJgKo0F9vhr1VymMudsyJ%252FK9DnfhVq6RCNvDtW6jbo%252BIK37%252BjDxCPdWITw5pN4wrQyDbGY7zmTVY3P%252FwtnE%252BonITWWvxO%252FdD1mXmFgWjEpxDLSXsHKLavLPCQN5Up%252BhPqx7b%252FO619JDGGPWNL2OmVOLPX538BhdgcBLvcdOwCFbyKlqYxZxPjzVFMRPgJDbMXdVzIOZwNURIjSAN0wWI6d1ftairDFWgNOGeGdjQU11uvWVcvj%252FkF4%252BBejlLkMQzIdsSoslqZVOuik8tZnRgUum1SbFxTEo8qj9OjlyKzHOfEjkrWgqiGcls%252B%252FHeb5LB%252B1j81ZIlGx2oHfpBgMap7SXv17pBM8GV17hI7eL1P3AGhkmZJwkeF%252F8B1VWjBcpdo9hS0gwQGO8YNDzuZ0m1SkIeIoq8zHsnwoAGAflfLSS%252F%252FAn%252F5LoSlFQvUAp2fTT8Sw91AT8%252FwHrzYRMWgvfj6JuxT7xadQYT8OgAYvkDNXC29D7ni1qTnDw2Vdq5Pu2coGbm3epCQgRCzCYNdQmFoymzfEp4ug8qmEvUzbNC8YIt83Fe0RBVI3OFFcmdKei7v0xyXL%252FTMYILDm8K83btjDqBbIRqf02LV4CC%252BjHEMs4SUE3WQB5zlIYA7NqiuIK6g6js0gxsasjVOsBLcnCpMG13CqtwaEsvrWkxxr0xLsndpUppzUiG%252Bx5XB1f8xOJsrnbVeIuKWwi28ql%252BEK5ak%252F67sbm7X%252BHQsh4cr8W5jzECS3H0MO%252FxsNegOFjQl%252B5WYQ7v8ZaIJLz8s%252B5iuEcip3xkQm2Keuo42pKWoCN5jJG1EgjTtwB432kw0UQWDl2jXRbCFJAHYuaycsW5khIKpEyvH%252FhjfdMV8c6FgXmEuAvOlkwgLGfwwY6sgG89m6Z7RV9kPehaCjXFQI9FNP37mlvpidtEAIJU8OfwVPTVqXdq79kKHje2bCbYy6aTFQ661hk64hkQhz9pk84okVPKvzBYFeu3PeKyX0DUMqgxjpXG86rmKo5inVFIhrHJHP%252B9%252FwUtKi2js54GY5en713YS84o1rvTWejtm9dCP%252B1SMfXtAglYwyqiD7GKLIkN5FjCzTAc7mbs4nbgAcM7cCJ5AWOh0zOBlRk3ViBTXf5%26X-Amz-Algorithm%3DAWS4-HMAC-SHA256%26X-Amz-Credential%3DASIAVRDO7IERBU3FCUZV%252F20250704%252Fus-east-1%252Fs3%252Faws4_request%26X-Amz-Date%3D20250704T135001Z%26X-Amz-SignedHeaders%3Dhost%26X-Amz-Signature%3Df9c777f914433dc1d9acc936e0d3e307bcb825eb962edf0ed18766c9755b88c8,The U.S. Department of Defense Military Health System (MHS) is responsible for providing health care to active duty and retired. U.S. military ...,"KeyTooLongErrorYour key is too long17111024QS51Z6X8SXWAA4MBw23fISlNRd7GNfARLGDw3sunBy56NotHtXALnbxapOJn7xnbrU+opoqJDQl4mwCThxSmv+W1Bxk=This XML file does not appear to have any style information associated with it. The document tree is shown below.

<Error><Code>KeyTooLongError</Code><Message>Your key is too long</Message><Size>1711</Size><MaxSizeAllowed>1024</MaxSizeAllowed><RequestId>QS51Z6X8SXWAA4MB</RequestId><HostId>w23fISlNRd7GNfARLGDw3sunBy56NotHtXALnbxapOJn7xnbrU+opoqJDQl4mwCThxSmv+W1Bxk=</HostId>...</Error>",,N,0.0,2025-07-04 13:56:26.344296
