id,name,published,outlet,title,authors,category,market,categoryorder,articleorder,url,description,text,image,error,sentiment,firstEyes
,,2025-12-11 05:05:02+00:00,www.hirono.senate.gov,"Hirono, Colleagues Demand Accountability from Army for Sexual Misconduct Failures",Not Available,,,,,https://www.hirono.senate.gov/news/press-releases/hirono-colleagues-demand-accountability-from-army-for-sexual-misconduct-failures,"Dr. McGraw was not suspended from his position until October 2025.
This appears to have happened in this case since Dr. McGraw was not suspended until this October.
After reportedly being assaulted during a patient visit with Dr. McGraw, Jane Doe said she begged a desk attendant to make a report.
The allegations against Dr. McGraw are extremely serious, and the Army’s criminal investigation of this matter must continue unabated.
Why did the Army fail to take disciplinary actions against Dr. McGraw until his October 2025 suspension?","WASHINGTON, D.C. – U.S. Senator Mazie K. Hirono (D-HI) and U.S. Representatives Chrissy Houlahan (D-PA), Jill Tokuda (D-HI), Nanette Barragan (D-CA), Lori Trahan (D-MA), Veronica Escobar (D-TX), and Sylvia Garcia (D-TX) led 58 members of the Democratic Women’s Caucus, House Democrats, and Democratic Senators in a letter to the Department of Defense (DOD) Acting Inspector General demanding accountability for the Army’s failure to stop widespread sexual misconduct.

Recently, over 80 women joined a lawsuit alleging that Dr. Major Blaine McGraw made sexual advances, directed lewd comments towards them, and secretly recorded patients during exams while working at Ford Hood and Tripler Army Medical Center. This included at least 10 patients McGraw saw in Hawaii when he served as a resident at Tripler Army Medical Center from 2019-2023. Dr. McGraw was not suspended from his position until October 2025.

“No woman should feel unsafe receiving medical care, especially during sensitive and private health services. Yet, far too many survivors have come forward with their experiences of alleged exploitation and abuse by a doctor who reportedly violated not just the basic principles of medical care and human decency, but also the expected conduct of a U.S. Army officer and physician,” said Senator Hirono. “The Department of Defense and U.S. Army must take accountability for their failure to rapidly respond to servicemembers and patient complaints. While nothing can reverse the harm reported by patients, a comprehensive investigation into this alleged misconduct, resulting in stronger protections for patients, is necessary to ensure that no one experiences abuse by our military health system again.”

In their letter, the lawmakers expressed their outrage over Army leadership’s inaction despite numerous complaints from servicemembers and their families that Dr. McGraw had sexually exploited patients in his care for years. They also explained some of the unconscionable abuses women experienced, including details from the story of Jane Doe.

The lawmakers shared how the Army ignored Jane Doe’s attempts to report her abuse:

“After reportedly being assaulted during a patient visit with Dr. McGraw, Jane Doe said she begged a desk attendant to make a report. Instead, she was told to ‘call or send an email.’ Jane Doe alleges she called the hospital seven different times but she was dismissed and hung up on each time. The purported lack of response and urgency to respond to these complaints would clearly violate reporting policy and the Army’s Sexual Harassment/Assault Response and Prevention Program protocols.”

They also expressed deep concern in their letter that this abuse is part of a recurring pattern of the Army failing to intervene in reports and cases of sexual misconduct:

“In the lawsuit, female servicemembers and patients noted that a recurring issue was the lack of adequate response from Army leadership. Reportedly, when victims and their loved ones tried to make complaints with Army leadership, they were ‘refused meetings at every level.’ If true, these women deserve better. The alleged dismissive response from the Army demonstrates an immense failure at every level to properly support survivors.”

The members and senators concluded the letter by demanding a full investigation from the DOD Inspector General, explanations on how complaints were handled, and stronger protections to ensure no patient faces this abuse again:

“The allegations against Dr. McGraw are extremely serious, and the Army’s criminal investigation of this matter must continue unabated. That said, the separate concerns raised by survivors about members of the Army at many levels not timely acting on their complaints must be confronted immediately. Additionally, we request that DoD IG investigate to determine whether personnel within the Army properly followed procedures to timely report allegations of sexual misconduct to law enforcement and whether other SAPR procedures and existing protections were followed or not.”

Last week, Senator Hirono and the Hawaii Congressional delegation also sent a letter calling on the DOD to thoroughly investigate every complaint against McGraw and the Army’s own failures in allowing his alleged misconduct to persist.

In addition to Senator Hirono and Representatives Houlahan, Tokuda, Barragan, Trahan, Escobar, and Garcia, the letter was also signed by Senators Angela Alsobrooks (D-MD), Kirsten Gillibrand (D-NY), Jeanne Shaheen (D-NH), Chris Van Hollen (D-MD), Elizabeth Warren (D-MA), and Ron Wyden (D-OR), and Representatives Joyce Beatty (D-OH), Julia Brownley (D-CA), Nikki Budzinski (D-IL), Andre Carson (D-IN), Judy Chu (D-CA), Maxine Dexter (D-OR), Debbie Dingell (D-MI), Sarah Elfreth (D-MD), Lizzie Fletcher (D-TX), Valerie Foushee (D-NC), Lois Frankel (D-FL), Laura Friedman (D-CA), Robert Garcia (D-CA), Adelita Grijalva (D-AZ), Val Hoyle (D-OR), Jonathan Jackson (D-IL), Sara Jacobs (D-CA), Pramila Jayapal (D-WA), Julie Johnson (D-TX), Timothy Kennedy (D-NY), Teresa Leger Fernandez (D-NM), Lucy McBath (D-GA), Sarah McBride (D-DE), Betty McCollum (D-MN), James McGovern (D-MA), LaMonica McIver (D-NJ), Gwen Moore (D-WI), Kelly Morrison (D-MN), Seth Moulton (D-MA), Eleanor Norton (D-DC), Alexandria Ocasio-Cortez (D-NY), Nancy Pelosi (D-CA), Nellie Pou (D-NJ), Delia Ramirez (D-IL), Emily Randall (D-WA), Deborah Ross (D-NC), Andrea Salinas (D-OR), Janice Schakowsky (D-IL), Lateefah Simon (D-CA), Melanie Stansbury (D-NM), Rashida Tlaib (D-MI), Norma Torres (D-CA), Debbie Wasserman Schultz (D-FL), Nikema Williams (D-GA), and Frederica Wilson (D-FL).

The full text of the letter is available here and below.

Dear Mr. Stebbins:

We write to express our strong concerns about the Army’s purported failure to timely intervene in the alleged misconduct of Dr. Major Blaine McGraw at Fort Hood and Tripler Army Medical Center, allegations, which if true, would possibly constitute the largest sexual misconduct case in U.S. military history. According to reports, for years, Dr. McGraw allegedly sexually exploited women, including servicewomen and military wives, in his care. When these women attempted to report their concerns and experiences were purportedly repeatedly ignored and Dr. McGraw was kept on staff. The Army, like the other Services, has a history of failing to adequately address sexual misconduct in the ranks, which required Congress to step in and institute hundreds of reforms over the last fifteen years, culminating in the establishment of the Office of the Special Trial Counsel in the FY22 National Defense Authorization Act (NDAA). One of those issues involved military services being slow to intervene in cases at an early stage. This appears to have happened in this case since Dr. McGraw was not suspended until this October. This delayed response is unacceptable, and we need answers. Separate, and not to interfere with the ongoing Army criminal investigation into the alleged misconduct of Dr. McGraw, we request the Department of Defense Office of Inspector General review if appropriate Military Health System policies were followed, to include whether patient complaints were timely evaluated and considered, and provide recommendations to the Defense Health Agency (DHA) to prevent further instances like this from occurring in the future.

This month over 80 women joined a lawsuit together alleging that Dr. McGraw made lewd sexual advances and comments towards them, as well as secretly recorded patients during exams. One example of the women’s horrific experiences is captured through Jane Doe’s story. After reportedly being assaulted during a patient visit with Dr. McGraw, Jane Doe said she begged a desk attendant to make a report. Instead, she was told to “call or send an email.” Jane Doe alleges she called the hospital seven different times but she was dismissed and hung up on each time. The purported lack of response and urgency to respond to these complaints would clearly violate reporting policy and the Army’s Sexual Harassment/Assault Response and Prevention Program protocols.

In the lawsuit, female servicemembers and patients noted that a recurring issue was the lack of adequate response from Army leadership. Reportedly, when victims and their loved ones tried to make complaints with Army leadership, they were “refused meetings at every level.” If true, these women deserve better. The alleged dismissive response from the Army demonstrates an immense failure at every level to properly support survivors.

The allegations against Dr. McGraw, and the Army’s purported failure to timely address survivor complaints, are not isolated. A separate investigation deemed Fort Hood as a notoriously “permissive environment” for sexual harassment and assault. The base has been plagued by this issue for years. For example, in 2020, Army Specialist Vanessa Guillén was murdered by a fellow soldier while stationed at Fort Hood. Throughout her time on base, Specialist Guillén was sexually harassed by a separate supervisor. Specialist Guillén’s tragic murder was the impetus for the aforementioned changes in the FY22 NDAA. However, even with these positive reforms, it is clear more needs to be done. The fact that this reported abuse occurred at the same base as Specialist Guillen’s murder is appalling. All women should be safe on a military base, and they surely should be able to safely seek treatment without fear of sexual assault or abuse.

The allegations against Dr. McGraw are extremely serious, and the Army’s criminal investigation of this matter must continue unabated. That said, the separate concerns raised by survivors about members of the Army at many levels not timely acting on their complaints must be confronted immediately. Additionally, we request that DoD IG investigate to determine whether personnel within the Army properly followed procedures to timely report allegations of sexual misconduct to law enforcement and whether other SAPR procedures and existing protections were followed or not. We therefore request a response to the following questions from the Defense Health Agency and the Inspector General within 60 days of receipt:

Please provide the range of dates for the sexual harassment/assault complaints filed, including the number of complaints received at Fort Hood and Tripler Army Medical Center relating to Dr. McGraw.

What was the Military Treatment Facility management’s response to each complaint at Fort Hood and Tripler Army Medical Center?

How did the Military Treatment Facility management at Fort Hood and Tripler Army Medical Center follow appropriate policies to supervise staff, prevent patient harm, and address patient complaints?

What are the next steps the Military Treatment Facility management at Fort Hood and Tripler Army Medical Center will take to further protect patients from sexual assault?

How will the Defense Health Agency ensure that no Military Treatment Facility will ignore sexual abuse allegations again?

How will the Defense Health Agency prevent future concealment and employment of sexual abusers on their staff across Military Treatment Facilities?

Was a quality assurance investigation initiated? If so, please share the status with the House Armed Services Committee.

Why did the Army fail to take disciplinary actions against Dr. McGraw until his October 2025 suspension?

We are committed to demanding justice for victims of sexual assault and harassment, and we will not stay silent while the safety of women is at risk. Again, we request prompt and thorough answers to these questions to prevent further harm and hold those responsible for this accountable.

Thank you for your prompt attention to this request.

Sincerely,

###",https://www.hirono.senate.gov/assets/images/sharelogo.jpg,N,0.0,2025-12-11 07:56:58.076190
,,2025-12-11 03:21:06+00:00,American Association for Cancer Research,Survival among Lung Cancer Patients in the U.S. Military Health System - AACR Journals,"Lin, Jie, Kamamia, Christine, Brown, Derek, Shao, Stephanie, McGlynn, Katherine A, Nations, Joel A, Carter, Corey A, Shriver, Craig D, Zhu, Kangmin, Katherine A",,,,,https://aacrjournals.org/cebp/article/doi/10.1158/1055-9965.EPI-17-0822/263730/p/Survival-among-Lung-Cancer-Patients-in-the-U-S,"This study compared survival of non–small cell lung cancer (NSCLC) patients in the MHS with that in the U.S. general population.
Results: A total of 16,257 NSCLC patients were identified from ACTUR and 65,028 matched patients from SEER.
Compared with SEER patients, ACTUR patients had significantly better overall survival (log-rank P < 0.001).
The survival advantage of the ACTUR patients was present regardless of cancer stage, grade, age group, sex, or race.
Conclusions: The MHS's universal care and lung cancer care programs may have translated into improved survival among NSCLC patients.","Background: The U.S. military health system (MHS) provides universal health care access to its beneficiaries. However, whether the universal access has translated into improved patient outcome is unknown. This study compared survival of non–small cell lung cancer (NSCLC) patients in the MHS with that in the U.S. general population.

Methods: The MHS data were obtained from The Department of Defense's (DoD) Automated Central Tumor Registry (ACTUR), and the U.S. population data were drawn from the National Cancer Institute's Surveillance, Epidemiology, and End Results (SEER) program. The study subjects were NSCLC patients diagnosed between January 1, 1987, and December 31, 2012, in ACTUR and a sample of SEER patients who were matched to the ACTUR patients on age group, sex, race, and year of diagnosis group with a matching ratio of 1:4. Patients were followed through December 31, 2013.

Results: A total of 16,257 NSCLC patients were identified from ACTUR and 65,028 matched patients from SEER. Compared with SEER patients, ACTUR patients had significantly better overall survival (log-rank P < 0.001). The better overall survival among the ACTUR patients remained after adjustment for potential confounders (HR = 0.78, 95% confidence interval, 0.76–0.81). The survival advantage of the ACTUR patients was present regardless of cancer stage, grade, age group, sex, or race.

Conclusions: The MHS's universal care and lung cancer care programs may have translated into improved survival among NSCLC patients.",https://aacrjournals.org/UI/app/svg/umbrella/logo.svg,N,1.0,2025-12-11 14:56:43.237481
,,2025-12-11 02:55:02+00:00,X (formerly Twitter),Getting care through TRICARE's Active Duty Dental Program,Not Available,,,,,https://x.com/NavyAdvancement/status/1998837951447351559,Navy Advancement (@NavyAdvancement). 15 views. Getting care through TRICARE's Active Duty Dental Program #Navy #USNavy #Veterans #USN ...,"JavaScript is not available.

We’ve detected that JavaScript is disabled in this browser. Please enable JavaScript or switch to a supported browser to continue using x.com. You can see a list of supported browsers in our Help Center.",,N,0.0,2025-12-11 09:56:35.510313
,,2025-12-11 00:04:09+00:00,Duke University School of Medicine,Duke Orthopaedic Faculty Advance Understanding of Shoulder Disorder Care in Military ...,Not Available,,,,,https://medschool.duke.edu/blog/duke-orthopaedic-faculty-advance-understanding-shoulder-disorder-care-military-health-system,"The study, titled “Healthcare Use Patterns for High Volume Musculoskeletal Shoulder Disorders: A Longitudinal Cohort from the U.S. Military Health System,” was recently published in Clinical Epidemiology (Volume 2025:17, Pages 1049–1060).
By analyzing longitudinal data from the Military Health System, the team identified patterns in healthcare utilization, including diagnostic imaging, physical therapy, surgical interventions, and medication use.
""Our findings provide a clearer picture of how care is delivered for shoulder disorders in a large, integrated health system.
""By examining real-world data from the Military Health System, we can better understand treatment patterns and identify gaps in care.
Collaborators on the Study: Nrupen A. Bhavsar (Duke Population Health Sciences) Steven Z. George, PT, PhD (Duke Orthopaedic Surgery) Maggie E. Horn, PT, DPT, PhD (Duke Orthopaedic Surgery) Sarah Morton-Oswald, Hui-Jie Lee (Uniformed Services University) Daniel I. Rhon (Brooke Army Medical Center), Senior Author","A new publication co-authored by Duke Orthopaedic Surgery faculty members Steven Z. George, PT, PhD, and Maggie E. Horn, PT, DPT, PhD, and colleagues sheds light on how patients with common shoulder disorders use healthcare services within the U.S. Military Health System. The study, titled “Healthcare Use Patterns for High Volume Musculoskeletal Shoulder Disorders: A Longitudinal Cohort from the U.S. Military Health System,” was recently published in Clinical Epidemiology (Volume 2025:17, Pages 1049–1060). Read the full article here.

This research addresses a critical gap in understanding treatment pathways for musculoskeletal shoulder conditions—one of the most frequent causes of pain and disability among active-duty service members and veterans. By analyzing longitudinal data from the Military Health System, the team identified patterns in healthcare utilization, including diagnostic imaging, physical therapy, surgical interventions, and medication use.

""Our findings provide a clearer picture of how care is delivered for shoulder disorders in a large, integrated health system. This knowledge is essential for identifying opportunities to improve efficiency and ensure patients receive the right care at the right time,"" said Steven Z. George, PT, PhD, professor in the Department of Orthopaedic Surgery at Duke.

Key Findings:

Shoulder disorders represent a significant burden in military populations, often requiring multi-modal care.

Utilization patterns varied based on diagnosis type, patient demographics, and care setting.

The study highlights opportunities to optimize care delivery, reduce unnecessary interventions, and improve outcomes.

Why It Matters:

Musculoskeletal injuries are among the leading causes of limited duty and medical discharge in the military. Understanding how patients navigate care systems can inform evidence-based guidelines, improve resource allocation, and enhance patient-centered care for both military and civilian populations.

""By examining real-world data from the Military Health System, we can better understand treatment patterns and identify gaps in care. These insights are critical for developing strategies that improve outcomes and reduce unnecessary costs,"" said Maggie E. Horn, PT, DPT, PhD, assistant professor in the Department of Orthopaedic Surgery at Duke.

Collaborators on the Study:

Nrupen A. Bhavsar (Duke Population Health Sciences)

Steven Z. George, PT, PhD (Duke Orthopaedic Surgery)

Maggie E. Horn, PT, DPT, PhD (Duke Orthopaedic Surgery)

Sarah Morton-Oswald, Hui-Jie Lee (Uniformed Services University)

Daniel I. Rhon (Brooke Army Medical Center), Senior Author",https://medschool.duke.edu/sites/default/files/styles/social_media_card/public/2025-12/msk_george_horn_600_x_400_px.png?h=252f27fa&itok=0DS8rxnc,N,0.0,2025-12-11 07:57:03.370044
,,2025-12-10 23:34:45+00:00,Catholic News Agency,U.S. House passes defense bill stripped of IVF provision | Catholic News Agency,Madalaine Elhabbal,,,,,https://www.catholicnewsagency.com/news/268405/us-house-passes-defense-bill-stripped-of-ivf-provision,"Washington, D.C. Newsroom, Dec 10, 2025 / 18:00 pm The House passed a defense authorization bill Dec. 10 without a provision to allow health care coverage of in vitro fertilization for active-duty military.
Pro-life groups cheered the provision’s removal from the bill.
The House passed the bill (S. 1071) by a vote of 312-112, and Senate consideration is next.
Like last year, the IVF provision was eliminated from the defense authorization bill shortly before its consideration.
“The move to pull the funding for IVF will free up resources to seek better answers,” she said.","Washington, D.C. Newsroom, Dec 10, 2025 / 18:00 pm

The House passed a defense authorization bill Dec. 10 without a provision to allow health care coverage of in vitro fertilization for active-duty military.

Pro-life groups cheered the provision’s removal from the bill. The original bill would have required Defense Secretary Pete Hegseth to “ensure that fertility-related care for a member of the uniformed services on active duty (or a dependent of such a member) shall be covered under TRICARE Prime and TRICARE Select.” Tricare does not cover IVF.

The House passed the bill (S. 1071) by a vote of 312-112, and Senate consideration is next.

Like last year, the IVF provision was eliminated from the defense authorization bill shortly before its consideration. President Donald Trump had made a campaign promise to make IVF free.

A spokesperson for House Speaker Mike Johnson told CNA in a statement that “President Trump and Congressional Republicans have been working to lower costs and expand access to IVF.”

“The Speaker has clearly and repeatedly stated he is supportive of access to IVF when sufficient pro-life protections are in place, and he will continue to be supportive when it is done responsibly and ethically,” the spokesperson said.

Live Action President Lila Rose praised Johnson for “ensuring TRICARE was not used to subsidize this destruction of life.”

“Students for Life has opposed IVF as practiced, as it's a business model that by design, destroys far more lives than are allowed to live and thrive,” Students for Life Vice President Kristy Hamrick told CNA in a statement responding to Speaker Mike Johnson’s move to strip the bill of IVF provisions. “The move to pull the funding for IVF will free up resources to seek better answers,” she said.

“Unquestioning financial support props up an industry known to prey on people's hopes for a child while ending many lives. We need to seek better answers for the question of how to help people have families than to assume that IVF is the solution,” she said. “We can do better.”

The Advancing American Freedom Foundation, which is led by former Vice President Mike Pence, posted a memo on X stating “many pro-life Americans are opposed to IVF because the standard process destroys human embryos.”

Tony Perkins, president of the Family Research Council reacted to news that IVF would be cut from the bill by praising Johnson, and said in a post on X: “The Speaker is right to put the pause on IVF funding in the Defense spending bill.”

“The IVF industry operates with little, if any, oversight, which has led to the creation and destruction of tens of thousands of so-called ‘excess’ embryos,” he said. “There are other pro-life options. Taxpayers' dollars should fund fertility methods that respect human dignity, treat the underlying causes of infertility, AND are successful—like Restorative Reproductive Medicine.”",https://www.catholicnewsagency.com/images/invitrofertilization022025.jpg?jpg,N,0.0,2025-12-11 07:57:07.149522
