id,name,published,outlet,title,authors,category,market,categoryorder,articleorder,url,description,text,image,error,sentiment,firstEyes
,,2025-07-04 07:41:43+00:00,www.arkansasonline.com,Law poses risks | The Arkansas Democrat-Gazette,DOUGLAS HOUSE Special to the Democrat-Gazette,,,,,https://www.arkansasonline.com/news/2025/jul/04/law-poses-risks/,"However, Arkansas is about to implement a law that will deny them--and thousands of other patients--access to their prescription medicines.
Sarah Huckabee Sanders signed Arkansas Act 624 into law, she put access to medications at risk for the thousands of active-duty and retired military service members living in Arkansas.
This law will have life-threatening consequences for thousands of Arkansas military beneficiaries and many other Arkansans who get their medications through a home-delivery specialty pharmacy.
If this goes forward or other states follow Arkansas' lead, expect catastrophic consequences for millions of military beneficiaries.
U.S. Army Col. Douglas House (retired) is an attorney and a former Arkansas state representative.","I have dedicated my life to service of my country, Arkansas, and our veterans. I always strive to ensure that our eligible active, reserve, National Guard warriors, veterans, military retirees, and their families receive the medical care promised by Congress for their service. However, Arkansas is about to implement a law that will deny them--and thousands of other patients--access to their prescription medicines.

Health coverage for military members is managed by the Department of Defense's TRICARE program. It is important to have TRICARE's pharmacy benefits supported by a national company to ensure that active-duty military members can get their medications reliably and affordably, no matter where they are.

Like many large employers and other health plans, TRICARE contracts with the pharmacy benefit manager (PBM) Express Scripts and its affiliate specialty pharmacy Accredo. Express Scripts sends prescribed medications to beneficiaries for common medical conditions like high blood pressure. Accredo ships specialty medications such as chemotherapy or biologics for medical conditions such as cancers, blood diseases, and inflammatory organ diseases, which are generally more complex and expensive. Most of these medicines are not stocked by neighborhood pharmacies because they require specific temperature controls and other special handling that they can't afford to provide.

But when Gov. Sarah Huckabee Sanders signed Arkansas Act 624 into law, she put access to medications at risk for the thousands of active-duty and retired military service members living in Arkansas. The law requires the state Pharmacy Board to revoke existing pharmacy licenses and refuse to issue licenses to PBMs that also maintain pharmacies, including congressionally mandated and TRICARE-contracted PBMs and pharmacies. Governor Sanders may claim ignorance of the effect of this law, but I personally delivered a letter to her office warning her about them before she signed the bill.

This law will have life-threatening consequences for thousands of Arkansas military beneficiaries and many other Arkansans who get their medications through a home-delivery specialty pharmacy. Not only in Arkansas, but if other states pass similar legislation as Governor Sanders is urging, military beneficiaries scattered or retired across our country where there is no military base or a full-service pharmacy would be at risk.

I am no friend of PBMs. As a state representative, I supported laws to bring transparency and fairness to how PBMs hired by insurance companies reimburse pharmacies, ensuring that patients were not overcharged for their medications. We carefully considered the potential consequences of these laws to ensure they would not affect access to medications for TRICARE beneficiaries or other patients.

Even after the PBMs filed lawsuits, the state laws were upheld by the United States Supreme Court. These laws were the foundation of our efforts to ensure pharmacies get paid fairly, insurance companies are not overcharged, and consumers can access the medications they need.

Now, the state Legislature has rushed to pass Act 624 with little time for public comment or discussion of the potential harm it could cause.

It's true some veterans may be eligible to use the Department of Veterans Affairs (VA) medical system for service-connected illnesses and injuries. But the VA is overwhelmed with patients, and military pharmacies also operate under budget constraints. I was told by the VA to wait three months for a primary-care doctor appointment and to wait three months for a referral to a specialist, in hopes that the specialist will prescribe the medicine that works rather than try other alternatives.

This is not just a matter of policy for me; it is a matter of life and death. I have Crohn's disease, a chronic and debilitating condition that requires an expensive specialty injection called Stelara. Accredo ships refrigerated Stelara directly to my home every four weeks, and I pay a set $38 co-pay established by Congress. Without it, I can expect abdominal resection surgeries and the resulting infection and sepsis. When I was an employee of the state, their employee benefits managers refused to pay for it. When I asked our local active-duty base pharmacy if they could supply this medication, they referred me to Express Scripts and Accredo.

In 2024, Express Scripts Pharmacy sent over 700,000 common prescriptions, while Accredo shipped over 72,000 specialty prescriptions to patients in Arkansas. If this law goes into effect in January 2026, Arkansans military beneficiaries and many other patients would lose access to mail-delivered prescriptions that are a lifeline for many, including me.

The government of Arkansas has made it clear: They do not care about military people. The consequences for military families and thousands of Arkansans who may lose access to their medications will be devastating. If this goes forward or other states follow Arkansas' lead, expect catastrophic consequences for millions of military beneficiaries.

Our country made a promise to our men, women and families in uniform. I believe in fairness, transparency and oversight, but all this law does is seek to preserve an antiquated business model.

U.S. Army Col. Douglas House (retired) is an attorney and a former Arkansas state representative.",https://wehco.media.clients.ellingtoncms.com/static-4/teaser_images/www.arkansasonline.com_default.webp,N,-1.0,2025-07-04 06:56:21.238910
,,2025-07-04 06:59:07+00:00,www.reddit.com,VA vs TRICARE ? : r/VeteransBenefits - Reddit,Not Available,,,,,https://www.reddit.com/r/VeteransBenefits/comments/1lrb7wn/va_vs_tricare/,"Retired in April and received my rating two weeks ago.
Curious about your healthcare experience if you have the option to choose between the VA and TRICARE for healthcare.
Located in Southern California (unfortunately).
If you don’t mind sharing your experiences with me (SOCAL a plus but not required) I would appreciate it greatly.
Thanks in advance.",Retired in April and received my rating two weeks ago. Curious about your healthcare experience if you have the option to choose between the VA and TRICARE for healthcare. Located in Southern California (unfortunately). If you don’t mind sharing your experiences with me (SOCAL a plus but not required) I would appreciate it greatly. Thanks in advance.,,N,0.0,2025-07-04 03:56:17.305847
,,2025-07-04 05:58:10+00:00,DVIDS,"DoD Got 'Best Value' from New Tricare Contracts, Top Health Official Says - DVIDS",Not Available,,,,,https://www.dvidshub.net/news/533039/dod-got-best-value-new-tricare-contracts-top-health-official-says,"DoD health officials announced Aug. 21 that Humana Military Healthcare Services, Louisville, Ky.; Health Net Federal Services, Rancho Cordova, Calif.; and TriWest Healthcare Alliance Corp, Phoenix, Ariz., were awarded the contracts for its managed care system.
According to a DoD press release, health care costs for these three contracts are estimated to range between $19.5 billion to $20.5 billion over the next five years.
With the new contracts, Tricare is moving from the current 11 regions involving four companies that operate under seven contracts to three regions with three healthcare companies under three contracts.
Winkenwerder also announced that Navy Rear Adm. James A. Johnson has been appointed as the new Tricare West regional director.
Johnson, a 37-year veteran, will be responsible for the administration of health care contracts in the west region; providing support to military medical facility commanders there; sustaining quality care, and improving customer satisfaction.","The Defense Department got the ""best value"" for its money when new Tricare contracts were awarded in late August to three healthcare companies to manage care for more than 8 million military personnel and their family members, the Pentagon's leading health official said here Sept. 10.

During a meeting with reporters in his office, Dr. William Winkenwerder Jr., assistant secretary of defense for health affairs, said, ""We've made a good program (Tricare) even better. The changes that we've implemented in this new set of contracts put customer satisfaction first.""

DoD health officials announced Aug. 21 that Humana Military Healthcare Services, Louisville, Ky.; Health Net Federal Services, Rancho Cordova, Calif.; and TriWest Healthcare Alliance Corp, Phoenix, Ariz., were awarded the contracts for its managed care system.

According to a DoD press release, health care costs for these three contracts are estimated to range between $19.5 billion to $20.5 billion over the next five years. The new contracts will be phased in over the next year, and will replace seven contracts currently in place, according to the release.

Winkenwerder told reporters that Tricare is restructuring its managed care system. With the new contracts, Tricare is moving from the current 11 regions involving four companies that operate under seven contracts to three regions with three healthcare companies under three contracts.

Humana received a $2 billion contract for the Tricare South region. That region covers healthcare for beneficiaries in Alabama, Arkansas, Florida, Georgia, Louisiana, Mississippi, Oklahoma, South Carolina, Tennessee and the eastern portion of Texas.

TriWest received a $2.1 billion contract for the Tricare West region, which covers Alaska, Arizona, California, Colorado, Hawaii, Idaho, Iowa, Kansas, Minnesota, Missouri, Montana, Nebraska, Nevada, New Mexico, North Dakota, Oregon, South Dakota, west Texas, Utah, Washington and Wyoming.

Health Net was awarded a $2.2 billion contract for the Tricare North region that includes Connecticut, Delaware, the District of Columbia, Illinois, Indiana, Kentucky, Maine, Maryland, Massachusetts, Michigan, New Hampshire, New Jersey, New York, North Carolina, Ohio, Pennsylvania, Rhode Island, Vermont, Virginia, West Virginia and Wisconsin.

Sierra Military Health Services, Las Vegas, which had covered the Northeast, filed a formal protest Aug. 29 with the Government Accounting Office on its unsuccessful bid. A press release by the company stated that company representatives met with DoD health officials to discuss the evaluation process used to award the contract and the evaluation findings. ""Subsequently, the company determined there were serious and material errors in the evaluation process and findings, warranting a formal protest,"" the release said.

Winkenwerder told reporters, ""We were not surprised that there was a protest based on the size of these contracts and the importance to the bidders."" And he added that healthcare services for beneficiaries will not be interrupted and, ""will move forward.""

Winkenwerder said the contracts were carefully evaluated based on several factors, such as clinical quality, customer satisfaction, past performance and price. These factors, he said, helped determine which contracts offered the ""best value"" to the government and its beneficiaries. He said cost is ""least important in the 'best value' package.""

Winkenwerder also announced that Navy Rear Adm. James A. Johnson has been appointed as the new Tricare West regional director. Johnson, a 37-year veteran, will be responsible for the administration of health care contracts in the west region; providing support to military medical facility commanders there; sustaining quality care, and improving customer satisfaction.

Story by Sgt. 1st Class Doug Sample, American Forces Press Service",https://cdn.dvidshub.net/images/dvids_logo.svg,N,0.0,2025-07-04 03:56:23.166107
,,2025-07-04 04:18:06+00:00,www.youtube.com,4 injured after ambulance crashes into home - YouTube,,,,,,https://www.youtube.com/watch%3Fv%3DWezrmshFDu8,... TriCare Medical Transportation ambulance wedged inside the front of the residence. Police say the ambulance was taking a non-emergency patient to ...,Not Available,,Y,0.0,2025-07-04 00:56:18.869723
,,2025-07-04 03:50:03+00:00,DVIDS,"TRICARE Improved; Changes, Challenges Ahead, Leaders Say - DVIDS",Not Available,,,,,https://www.dvidshub.net/news/527333/tricare-improved-changes-challenges-ahead-leaders-say,"Senior DoD leaders Feb. 4 praised improvements made to TRICARE, the military's healthcare system, and also noted the need for new methods and efficiencies to meet anticipated challenges ahead.
TRICARE has accomplished a lot in the past year, such as establishing TRICARE For Life coverage for beneficiaries over age 65, Carrato noted.
Winkenwerder, who came on board Oct. 16, 2001, also praised the quality of healthcare TRICARE provides to its 8.3 million beneficiaries.
The quality and the energy of the military medical team are superb, he said, and could be even better.
Harnessing digitized, Web-based data collection and information services will help improve customer service and provide increased efficiencies for TRICARE, Winkenwerder said.","Senior DoD leaders Feb. 4 praised improvements made to TRICARE, the military's healthcare system, and also noted the need for new methods and efficiencies to meet anticipated challenges ahead.

Hundreds of military and civilian health care professionals heard remarks by David S.C. Chu, undersecretary of defense for personnel and readiness; Dr. William Winkenwerder Jr., assistant secretary of defense for health affairs; and Thomas F. Carrato, TRICARE Management Activity executive director, at the first day of the Feb. 4-7 TRICARE conference here.

The consensus of Chu, Winkenwerder and Carrato was that TRICARE was living up to its 2002 conference theme: ""Getting the Job Done for America.""

""Nobody does it better than you,"" Carrato said to the audience. He became TMA executive director on June 7, 2001.

TRICARE has accomplished a lot in the past year, such as establishing TRICARE For Life coverage for beneficiaries over age 65, Carrato noted. At the same time, TRICARE professionals have fixed long-time customer irritants by improving claims processing, establishing a toll-free information line, simplifying pharmacy program co-payments, and more, he said.

Carrato then read a letter from a 75-year-old widow who praised the TRICARE coverage for her breast cancer treatment:

""Thank you so much, thank you to the American taxpayers and to the people who worked so hard to get this assistance measure through Congress. … I cannot express how much I truly appreciate this help, but I hope this letter gives you some idea,"" the woman wrote.

The woman's letter, Carrato noted, ""represents the promise that we've kept, the trust that we've restored, and the vision we've achieved to deliver this kind of high-quality healthcare benefit (to) all of these deserving men and women, these truly great Americans.""

Winkenwerder, who came on board Oct. 16, 2001, also praised the quality of healthcare TRICARE provides to its 8.3 million beneficiaries. He noted some challenges for the coming year.

The attacks of Sept. 11 and the anthrax attacks that followed the hijackings ""have mobilized our country and the Department of Defense,"" he said. Military medics and healthcare workers, he noted, ""continue to be on the front lines"" in today's wartime environment. The quality and the energy of the military medical team are superb, he said, and could be even better. He then outlined his priorities:

o Improve force health protection and medical readiness.

o Improve performance of the TRICARE program.

o Strengthen relationships outside of DoD, such as with the Department of Veterans Affairs.

o Ensure the services recruit the best medical professionals in the world.

""Biological warfare is no longer a theoretical possibility,"" Winkenwerder said. Consequently, the nation's vaccine policies and programs need to be ""greatly bolstered and refocused,"" he noted.

The Food and Drug Administration recently certified the anthrax vaccine made by Bioport of Lansing, Mich., Winkenwerder remarked. Vaccine production will resume soon, he said.

""We will soon announce our policy within DoD on how we will prioritize the resumption of vaccine efforts,"" he said, adding, ""One thing is certain … the vaccine is safe and it is effective.""

DoD's medical readiness training programs for biological, chemical and radiological warfare ""demand significant attention,"" Winkenwerder said. ""My goal is that all military health personnel will be trained to recognize and manage chemical and biological agents, depending upon their level and their position.""

Winkenwerder added that military medical personnel will also be trained to deal with the consequences of biological or chemical attack on both individuals and entire populations.

Though TRICARE has come a long way, ""We've got an opportunity to get (the job done) even better,"" he noted. He pledged faster identification and solution of problems within the system; better, integrated communications with beneficiaries; and solutions ""that put the responsibility on us, not on the beneficiaries, our customers.""

Harnessing digitized, Web-based data collection and information services will help improve customer service and provide increased efficiencies for TRICARE, Winkenwerder said.

Addressing efficiency and cost-effectiveness, Chu noted that DoD medical professionals in the future could expect to work with the Department of Veteran Affairs in a DoD outreach effort of working with other federal agencies. For instance, he said, key areas of DoD-VA coordination would include joint procurement of pharmaceuticals and other materials and joint facility use.

Story by Gerry J. Gilmore, American Forces Press Service",https://cdn.dvidshub.net/images/dvids_logo.svg,N,1.0,2025-07-04 00:56:22.147352
,,2025-07-04 03:19:57+00:00,www.youtube.com,Can Retired Military Use TRICARE? - Making Politics Simple - YouTube,,,,,,https://www.youtube.com/watch%3Fv%3DeEROh_LTprg,"Can Retired Military Use TRICARE? Are you curious about the healthcare options available for retired military members? In this informative video, ...",Not Available,,Y,0.0,2025-07-04 02:56:13.329625
,,2025-07-04 00:37:56+00:00,NBC10 Philadelphia,Ambulance crashes into New Jersey house - NBC10 Philadelphia,Emily Rose Grassi,,,,,https://www.nbcphiladelphia.com/news/local/ambulance-crash-into-blue-house-mount-holly-new-jersey/4225988/,"First responders are on scene after an ambulance crashed into a house in South Jersey on Thursday.
Léelo en español aquí The crash happened around 3:30 p.m. on July 3 along the 900 block of Woodlane Road in Mount Holly, New Jersey, according to officials.
Three EMTs along with the patient were in the ambulance when the crash happened.
At least one other car was involved in the crash that led to the ambulance crashing into the house, according to the Mount Holly Township Police Department Chief Clifford Spencer.
SkyForce10 was over the scene where the ambulance was seen with its front end through a wall at a house.","First responders are on scene after an ambulance crashed into a house in South Jersey on Thursday.

Léelo en español aquí

The crash happened around 3:30 p.m. on July 3 along the 900 block of Woodlane Road in Mount Holly, New Jersey, according to officials.

An ambulance from TriCare Medical Transportation was taking a person from a hospital to a different facility when it left the road and hit the house, according to Anthony S. Maneri Jr., president of TriCare Medical Transportation.

One person was inside the home, Maneri reported. Three EMTs along with the patient were in the ambulance when the crash happened.

No one was hurt, according to Maneri.

Local

Breaking news and the stories that matter to your neighborhood.

""The safety of our patients, employees, and the community is our highest priority. We are fully cooperating with local law enforcement and other relevant agencies as they investigate the circumstances surrounding this incident. A full internal review is also underway,"" Maneri wrote in a statement.

At least one other car was involved in the crash that led to the ambulance crashing into the house, according to the Mount Holly Township Police Department Chief Clifford Spencer.

SkyForce10 was over the scene where the ambulance was seen with its front end through a wall at a house.

NBC10 has crews on the way to the scene to gather more information.",https://media.nbcphiladelphia.com/2025/07/ambulance.jpg?quality=85&strip=all&resize=1200%2C675,N,0.0,2025-07-03 20:56:55.448245
,,2025-07-04 00:24:54+00:00,6abc Philadelphia,"4 injured after ambulance crashes into Burlington County, NJ home - 6ABC",6abc Digital Staff,,,,,https://6abc.com/post/ambulance-crashes-home-burlington-county-new-jersey/16939349/,"HOLLY, N.J. (WPVI) -- Four people were hospitalized after an ambulance crashed into a home in Burlington County on Thursday.
It happened around 3:30 p.m. on Thursday on the 900 block of Woodlane Road in Mt.
The view from Chopper 6 shows a portion of the ambulance wedged inside the front of the residence.
The four injured include one person inside the home, the ambulance driver and the EMT and the patient inside the ambulance, according to Mount Holly Township Police Chief Clifford Spencer.
According to TriCare Medical Transportation, the ambulance involved was completing a non-emergent transport from a hospital to a facility when the crash occurred.","MT. HOLLY, N.J. (WPVI) -- Four people were hospitalized after an ambulance crashed into a home in Burlington County on Thursday.

It happened around 3:30 p.m. on Thursday on the 900 block of Woodlane Road in Mt. Holly.

The view from Chopper 6 shows a portion of the ambulance wedged inside the front of the residence.

Officials told Action News multiple vehicles were involved in the incident. A damaged van was seen being taken away while Action News was on the scene.

The four injured include one person inside the home, the ambulance driver and the EMT and the patient inside the ambulance, according to Mount Holly Township Police Chief Clifford Spencer.

All injuries are believed to be non-life-threatening.

According to TriCare Medical Transportation, the ambulance involved was completing a non-emergent transport from a hospital to a facility when the crash occurred.

""The safety of our patients, employees, and the community is our highest priority. We are fully cooperating with local law enforcement and other relevant agencies as they investigate the circumstances surrounding this incident. A full internal review is also underway,"" the company said in a statement.

The cause of the crash is still under investigation.",https://cdn.abcotvs.com/dip/images/16939440_070325-wpvi-ambulance-hits-house-mount-hilly-430pm-video-vid.jpg?w=1600,N,0.0,2025-07-03 20:57:00.366713
,,2025-07-03 23:42:48+00:00,www.msn.com,Four North Texans charged in $14.6 billion nationwide healthcare fraud crackdown - MSN,Not Available,,,,,https://www.msn.com/en-us/news/us/four-north-texans-charged-in-146-billion-nationwide-healthcare-fraud-crackdown/ar-AA1HN2gO,"Osukoya allegedly submitted over $25 million in phony claims to Medicare, Tricare and other insurers for electroencephalogram testing. Osukoya ...",Not Available,,N,-1.0,2025-07-04 00:56:24.870502
,,2025-07-03 23:38:02+00:00,nj,"Ambulance crashes into N.J. home, cops say - nj.com","Matthew Enuco | NJ Advance Media for NJ.com, matthew-enuco, Matthew Enuco",,,,,https://www.nj.com/burlington/2025/07/ambulance-crashes-into-nj-home-cops-say.html,"One person was in the home at the time of the collision and three EMTs and one patient were aboard the ambulance, according to president of the medical transport company.",Not Available,https://www.nj.com/resizer/v2/EI2EAR5B5VGKVGOYA3AWJYMEMY.png?auth=bf27e54722a48289a5ff981b530438b1101d9182a15d68c71cf527c28292dc08&width=1280&quality=90,N,0.0,2025-07-03 20:57:09.743890
