id,name,published,outlet,title,authors,category,market,categoryorder,articleorder,url,description,text,image,error,sentiment,firstEyes
,,2025-07-06 05:27:55+00:00,Forum Insights,dha Archives - Page 22 of 211 - Forum Insights,Not Available,,,,,https://www.insights.govforum.io/tag/dha/page/22/,"Solicitations Update: DHA shares RFP for Claims Review Service (TCRS)...
Updated May 16, 2022 Notice ID: HT940221R0002 ""Scope: The purpose of this contract is to...","Solicitations

Update: DHA shares RFP for Claims Review Service (TCRS)...

Updated May 16, 2022 Notice ID: HT940221R0002 ""Scope: The purpose of this contract is to...",https://i0.wp.com/www.insights.govforum.io/wp-content/uploads/2023/02/fav-icon.png?fit=32%2C32&ssl=1,N,0.0,2025-07-06 03:56:22.791876
,,2025-07-06 04:49:39+00:00,www.111attackwing.ang.af.mil,111th Attack Wing > News > Podcast - The Balance,Not Available,,,,,https://www.111attackwing.ang.af.mil/News/Podcast-The-Balance/mod/25366/player/305/audio/77158/111th%2520attack%2520wing/,"404 - File or directory not found.
The resource you are looking for might have been removed, had its name changed, or is temporarily unavailable.","404 - File or directory not found.

The resource you are looking for might have been removed, had its name changed, or is temporarily unavailable.",,N,0.0,2025-07-06 03:56:27.022983
,,2025-07-06 04:24:55+00:00,www.sciencedirect.com,Spinal Cord Stimulator Inequities Within the US Military Health System - ScienceDirect.com,Not Available,,,,,https://www.sciencedirect.com/science/article/am/pii/S1094715923001393,"back surgery within the US Military Health System, January 2017-January 2020 (N = 8,753). A generalized linear model examined predictors of SCS ...",Not Available,,N,0.0,2025-07-06 03:56:58.825567
,,2025-07-06 03:04:03+00:00,Fort Hood Sentinel,"Obama: health care reform won't affect VA, Tricare | News | forthoodsentinel.com","Donna Miles, American Forces Press Service",,,,,https://forthoodsentinel.com/news/obama-health-care-reform-won-t-affect-va-tricare/article_5140902d-f27e-557b-ae3c-4764f883d2c3.html,"WASHINGTON – In ongoing discussions about health care reform, President Barack Obama offered assurance Aug. 4 to those receiving medical care through Tricare or the Department of Veterans Affairs: Your",Not Available,https://bloximages.newyork1.vip.townnews.com/forthoodsentinel.com/content/tncms/custom/image/68fd7cf6-c76e-11ee-9279-434041d6eda1.jpg?resize=600%2C227,N,0.0,2025-07-06 01:56:14.953333
,,2025-07-05 23:47:49+00:00,DVIDS,DoD Pharmacy Benefits Easy to Swallow - DVIDS,Not Available,,,,,https://www.dvidshub.net/news/529771/dod-pharmacy-benefits-easy-swallow,"With the advent of TRICARE, DoD's worldwide managed health care plan, you may also be eligible to use the national mail-order pharmacy program.
Medicare-eligible and living in the service area of a military pharmacy closed by a Base Realignment and Closure action.
For information about the Uniformed Services Family Health Plan, call (888) 258-7347.
Contact the nearest TRICARE Service Center for assistance.
For information on DoD health matters and links to other many related sites, visit the TRICARE home page at: http://www.ha.osd.mil.","Active duty and retired military members and their families can get their medical prescriptions filled three easy ways.

If you're listed in the Defense Enrollment Eligibility Reporting System, or DEERS, you can obtain up to a 90-day supply of prescribed medications at no cost from any military pharmacy that has the medications available.

With the advent of TRICARE, DoD's worldwide managed health care plan, you may also be eligible to use the national mail-order pharmacy program. Under this plan, you can get a 90-day supply of non-narcotic medications or a 30-day supply of narcotic medications sent to your permanent or temporary home address. The service is free to active duty members; their family members pay $4 per prescription. All others pay $8 per prescription.

To order drugs by mail, you must fit in one of these categories:

Active duty service member.

Retirees and other CHAMPUS-eligible beneficiaries living in the United States or at an APO or FPO address overseas.

Medicare-eligible and living in the service area of a military pharmacy closed by a Base Realignment and Closure action.

Uniformed Services Family Health Plan enrollee.##

For more information about the national mail order pharmacy program, call the contractor, Merck-Medco, at (800) 903-4680, or visit the program Web site at: http://www.ha.osd.mil/tricare/nmopp.html. For information about the Uniformed Services Family Health Plan, call (888) 258-7347.

TRICARE also allows you to use a retail pharmacy network to obtain discount prescription drugs, even if you aren't enrolled in Prime, which the TRICARE managed care option. DEERS-registered non-enrollees otherwise eligible for TRICARE benefits must pay $9 per prescription for a 30-day or less supply. Contact the nearest TRICARE Service Center for assistance.

For DEERS information, California residents should call (800) 334-4162, Alaska and Hawaii residents (800) 527-5602 and all other states (800) 903-4680. Overseas residents and anyone with these and other questions about their medical benefits also can contact the health benefits adviser at the nearest military hospital or clinic.

For information on DoD health matters and links to other many related sites, visit the TRICARE home page at: http://www.ha.osd.mil.

Story by Douglas J. Gillert, American Forces Press Service",https://cdn.dvidshub.net/images/dvids_logo.svg,N,1.0,2025-07-05 23:56:17.793351
,,2025-07-05 20:13:05+00:00,www.reddit.com,How is tricare : r/MilitaryWives - Reddit,Not Available,,,,,https://www.reddit.com/r/MilitaryWives/comments/1ls9fz0/how_is_tricare/,"I was medically retired before I married my husband (who is still active duty) and had tricare select.
We live on base right now and use the base pharmacy for most of my meds.
The base pharmacy here is small and can’t always get my meds quickly so it’s just easier to go off base.
On a side note…needing medical care is not being a “leech”.
You, like everyone else, deserves proper medical care.","There are 2 main levels of tricare: prime and select.

Prime: free if overseas, minimal cost if stateside (someone correct me if I'm wrong). You don't everything through your pcp and need a referral for everything. That can get super annoying/frustrating. The tradeoff is no co-pays ever.

Select: you never need a referral, but there are co-pays. If living stateside, but remote, this is the better option.

As far as diabetic supplies, when I had gestational diabetes, they didn't cover the cost of my glucometer since it's an iver the counter thing, but reading their website, they should cover a cgm if necessary. I also had a copay on insulin and supplies to check my levels. I have select, so that may have been part of the reason.

Tricare is really cheap for insurance (we pay less than $300/months for a family of 5) and the coverage is great for the price. I have never had anything denied that was medically necessary, but i have had it take forever to get approved. I have had to fight to get the doctors I wanted, but they've always been approved in the end. Sometimes you have to do the work for tricare because they dont always update their database of doctors. I was assigned a doctor once that had retired 2 years earlier.

Vision and dental are separate, but still super cheap.

I’m a very high utilizer and can tell you that tricare prime, as long as you have the right referrals and documentation, covers absolutely almost everything and costs us $0 as long as my husband is active duty. Prescriptions filled off base but still within network costs $16. I was medically retired before I married my husband (who is still active duty) and had tricare select. I had a $3000 catastrophic cap and I hit that every year due to my chronic illness.

I am also a type 1 diabetic and 100% of my supplies are available on base, through the pharmacy, with zero cost to me. If you use Express Scripts, the mail order, then there is usually a copay. The only limits when it comes to covered meds is that anything identified as a maintenance medication(diabetic supplies are) is required to be filled on base or through mail order or you have to pay a higher copay. We live on base right now and use the base pharmacy for most of my meds. Our last base I used express scrips.

As I mentioned, I’m a very high utilizer due to my chronic illness and I am in palliative care. I have a large amount of medical supplies and specialty medications that are all fully covered. I do pay a copay for my palliative meds because they’re filled through a local specialty pharmacy. The base pharmacy here is small and can’t always get my meds quickly so it’s just easier to go off base. My medical supplies for my port, tube feeding, IV, etc is all covered 100%. I have a home nurse and aides that are all paid by tricare. My specialists are all covered as long as they’re in network and I’ve never had a hard time finding amazing doctors who take tricare.

Honestly, it sometimes takes some effort but ultimately everything we need has been covered. It’s just about making sure you have the right paperwork and getting it pushed through.

As someone else said, you will also need to enroll in EFMP. It’s a program to insure your spouse isn’t sent to a base that won’t have proper services for you. In your case, needing an endocrinologist will be the requirement so it shouldn’t be a huge issue getting assignments. EFMP is not optional and you do have to enroll but it’s for your benefit.

On a side note…needing medical care is not being a “leech”. Having a chronic illness isn’t a moral failing. You, like everyone else, deserves proper medical care.

If you or anyone else have any questions then I’m absolutely happy to answer from my experience. I’ve been using tricare for my medical care almost my entire life and got sick while I was active duty myself so I’m well versed in what care is available. I’m very lucky to have this and always want to make sure others get the proper care they need too.",,N,0.0,2025-07-05 18:56:19.989413
,,2025-07-05 19:40:45+00:00,librarysearch.wlv.ac.uk,lessons and implications for the military health system - University of Wolverhampton - LibrarySearch,Not Available,,,,,https://librarysearch.wlv.ac.uk/discovery/fulldisplay/alma991002653867504901/44UOWO_INST:MAIN,Assessing the quality and value of psychological health care in civilian health programs : lessons and implications for the military health system ...,Not Available,,N,0.0,2025-07-05 18:56:28.442169
,,2025-07-05 17:05:24+00:00,Military Health System,Articles | Health.mil,Not Available,,,,,https://health.mil/News/Articles%3FnewsVector%3D01000100%26broadVector%3D000%26refVector%3D00000000000000000%26page%3D28,"You are leaving Health.mil The appearance of hyperlinks does not constitute endorsement by the Department of Defense of non-U.S. Government sites or the information, products, or services contained therein.
Although the Defense Health Agency may or may not use these sites as additional distribution channels for Department of Defense information, it does not exercise editorial control over all of the information that you may find at these locations.
Such links are provided consistent with the stated purpose of this website.","You are leaving Health.mil

The appearance of hyperlinks does not constitute endorsement by the Department of Defense of non-U.S. Government sites or the information, products, or services contained therein. Although the Defense Health Agency may or may not use these sites as additional distribution channels for Department of Defense information, it does not exercise editorial control over all of the information that you may find at these locations. Such links are provided consistent with the stated purpose of this website.",https://www.health.mil/-/media/Images/MHS/Photos/Default-MHS-Seal.png,N,0.0,2025-07-05 15:56:17.915033
,,2025-07-05 16:01:05+00:00,www.reddit.com,TRT coverage for retired : r/tricare - Reddit,Not Available,,,,,https://www.reddit.com/r/tricare/comments/1lrz34i/trt_coverage_for_retired/,"Meet with your PCM, if they seem it medically necessary I would not see why not!
Make sure you have the correct lab work done to determine an endocrine disorder.
Definitely talk with your PCM and call Tricare to double check!
The website (at least for East) has a list of exclusions in their coverage so double check that as well!
They will get approved or denied based on their codes which tell Tricare what they will be doing.","Meet with your PCM, if they seem it medically necessary I would not see why not! Make sure you have the correct lab work done to determine an endocrine disorder. Your PCM may need to refer you to endocrinology and they that doctor will prescribe HRT, this goes both ways for anyone needing Testosterone therapy or Estrogen/progesterone therapy due to age, menopause, etc.

Definitely talk with your PCM and call Tricare to double check! The website (at least for East) has a list of exclusions in their coverage so double check that as well!

Yes, Tricare covers HRT which includes TRT with some exclusions. See your Primary Care Manager for a referral if you have Prime. If you have Select you can go to a Specialist without a referral. It depends on how the Specialist decides you need care. If your problem falls under the issues included in the things that are covered then yes, Tricare pays.If its not, they won't. This is determined when the doctor bills Tricare. Now, when they ask for preauthorization, they will send in a request, permission to perform this thing. They will get approved or denied based on their codes which tell Tricare what they will be doing. Ensure they use the correct codes because they often send the wrong ones and you get denied because your doctor input the wrong code, or even the wrong information somewhere else on the referral or preauth.",,N,0.0,2025-07-05 15:56:22.249731
,,2025-07-05 11:55:26+00:00,calameo.com,Yuba County TRICARE-Covered Inpatient & Outpatient Rehab Services for Military Personnel,Not Available,,,,,https://www.calameo.com/books/006228860c3f5fd81a765,"Almost a quarter of enlisted personnel report hazardous drinking, with alcohol abuse linked to half of military suicides and assaults.
If you're part of this statistic, you can now access TRICARE-covered rehab services at Ona Treatment Center.Learn more at... More Almost a quarter of enlisted personnel report hazardous drinking, with alcohol abuse linked to half of military suicides and assaults.
If you're part of this statistic, you can now access TRICARE-covered rehab services at Ona Treatment Center.Learn more at https://onatreatmentcenter.com/tricare-approved-alcohol-rehab-facility/ Ona Treatment Center City: Browns Valley Address: 6041 Bald Mountain Rd.
Website: https://onatreatmentcenter.com/ Less","Almost a quarter of enlisted personnel report hazardous drinking, with alcohol abuse linked to half of military suicides and assaults. If you're part of this statistic, you can now access TRICARE-covered rehab services at Ona Treatment Center.Learn more at... More

Almost a quarter of enlisted personnel report hazardous drinking, with alcohol abuse linked to half of military suicides and assaults. If you're part of this statistic, you can now access TRICARE-covered rehab services at Ona Treatment Center.Learn more at https://onatreatmentcenter.com/tricare-approved-alcohol-rehab-facility/ Ona Treatment Center City: Browns Valley Address: 6041 Bald Mountain Rd. Website: https://onatreatmentcenter.com/ Less",https://www.calameo.com/books/social/cover/006228860c3f5fd81a765,N,1.0,2025-07-05 20:56:15.475878
,,2025-07-05 10:45:05+00:00,myskylinehealth.org,Aetna Amerigroup Assurant Blue Cross-Premera Champus/Tricare ChampVA ... - Skyline Health,Not Available,,,,,https://myskylinehealth.org/wp-content/uploads/2025/05/Contracted-Carrier-Providers-for-website-per-Balance-Billing-Act-2020.pdf,Aetna. Amerigroup. Assurant. Blue Cross-Premera. Champus/Tricare. ChampVA. CIGNA. COIHS. Coordinated Care. Community Health Plan of WA.,Not Available,,N,0.0,2025-07-05 12:56:18.174517
,,2025-07-05 09:53:29+00:00,X (formerly Twitter),"Defense Health Agency on X: ""Kudos to @Munsonhealth! They held a special clinic for Army ...",Not Available,,,,,https://x.com/DoD_DHA/status/1941413008846020838,"Defense Health Agency · @DoD_DHA. Kudos to. @Munsonhealth ! They held a special clinic for Army Corrections Brigade soldiers, making it easier to get ...","JavaScript is not available.

We’ve detected that JavaScript is disabled in this browser. Please enable JavaScript or switch to a supported browser to continue using x.com. You can see a list of supported browsers in our Help Center.",,N,1.0,2025-07-05 12:56:22.038891
,,2025-07-05 09:37:31+00:00,www.seasonaljobs.com,"TRICARE Beneficiary Services Representative - Sigonella, Italy - SeasonalJobs.com","Fishnet NewMedia, AHOY.com",,,,,https://www.seasonaljobs.com/job/details/28110430/tricare-beneficiary-services-representative-sigonella-italy,... TRICARE Overseas Program (TOP) under the Defense Health Agency (DHA). Your work will help ensure that TRICARE-eligible beneficiaries receive the ...,SeasonalJobs.com is part of the AboutJobs.com Network of Sites,https://www.seasonaljobs.com/favicon-32x32.png,N,1.0,2025-07-05 23:56:21.422444
,,2025-07-05 08:10:28+00:00,www.linkedin.com,Andre Pippen - Deputy Director J-3/5/7 - Defense Health Agency | LinkedIn,Not Available,,,,,https://www.linkedin.com/in/andre-pippen,"Agree & Join LinkedIn By clicking Continue to join or sign in, you agree to LinkedIn’s User Agreement, Privacy Policy, and Cookie Policy.
LinkedIn LinkedIn is better on the app Don’t have the app?
Get it in the Microsoft Store.
Open the app","Agree & Join LinkedIn

By clicking Continue to join or sign in, you agree to LinkedIn’s User Agreement, Privacy Policy, and Cookie Policy.

LinkedIn

LinkedIn is better on the app

Don’t have the app? Get it in the Microsoft Store.

Open the app",https://static.licdn.com/scds/common/u/images/email/artdeco/logos/96/linkedin-bug-color.png,N,0.0,2025-07-05 13:56:24.247087
,,2025-07-05 07:22:41+00:00,www.sciencedirect.com,Incidence and prevalence of polycystic ovary syndrome in adolescent and young adult US ...,Not Available,,,,,https://www.sciencedirect.com/science/article/abs/pii/S1083318825003018,This retrospective cohort study reviewed military electronic medical records and TRICARE insurance claims from the US Military Health System from 2018 ...,Not Available,,N,0.0,2025-07-05 13:56:57.342029
,,2025-07-05 04:36:07+00:00,OCCRP,TRICARE | OCCRP,Not Available,,,,,https://www.occrp.org/en/organizations/tricare/page/1,"The federal court in the Southern District of Mississippi sentenced a pharmacist to five years in prison for a...
The Department of Justice last week announced criminal charges against 138 doctors, nurses and licenced medical...","The federal court in the Southern District of Mississippi sentenced a pharmacist to five years in prison for a...

The Department of Justice last week announced criminal charges against 138 doctors, nurses and licenced medical...",,N,0.0,2025-07-05 12:56:30.841239
,,2025-07-05 04:07:18+00:00,src.gov.sc,The Relationship Between CBD and Blood Pressure: Separating Fact from Fiction,Not Available,,,,,https://src.gov.sc/locations-and-services/%3Fpages%3Dqw63q1z1-a186-28sugaruka-d3q4-l5kr,"This page doesn't seem to exist.
It looks like the link pointing here was faulty.
Maybe try searching?
Search for:","This page doesn't seem to exist.

It looks like the link pointing here was faulty. Maybe try searching?

Search for:",https://src.gov.sc/wp-content/uploads/2022/12/cropped-favicon-32x32.png,N,0.0,2025-07-05 13:57:03.593862
,,2025-07-05 03:47:57+00:00,www.reddit.com,DEERS Question and Tricare Questions : r/AirForceRecruits - Reddit,Not Available,,,,,https://www.reddit.com/r/AirForceRecruits/comments/1lrv70f/deers_question_and_tricare_questions/,"~~My husband is a USAF Veteran.
He had a couple questions regarding how DEERS would work for me if I became Active.
Would I still be required to bring all our dependents socials & Birth certificates as well as our marriage certificate?
(It was one of the requirements to bring to BMT I believe (or at least to the recruiter?).
I can clarify further if needed).","~~My husband is a USAF Veteran. He had a couple questions regarding how DEERS would work for me if I became Active. Would I still be required to bring all our dependents socials & Birth certificates as well as our marriage certificate? (It was one of the requirements to bring to BMT I believe (or at least to the recruiter?).

~~Also he just mentioned that he has Tricare Retired (and we have the family plan), would he lose that if I were to go active, or would I just be on the Active Duty insurance and he would just continue to pay for him and our dependents ( we have 7 total dependents).

(If that makes sense? I can clarify further if needed).",,N,0.0,2025-07-05 02:56:15.191806
,,2025-07-05 02:18:19+00:00,markets.financialcontent.com,Yuba County TRICARE-Approved Alcohol Rehab for Active-Duty Personnel Announced,"Press Release Distribution Service, Browns Valley, United States",,,,,https://markets.financialcontent.com/stocks/article/marketersmedia-2025-7-4-yuba-county-tricare-approved-alcohol-rehab-for-active-duty-personnel-announced,"Active-duty personnel can now access TRICARE-approved alcohol rehab outpatient and inpatient services in Yuba County through a premium facility.
-- Ona Treatment Center, a premier inpatient treatment facility in Yuba County, Northern California, is now accepting TRICARE insurance for active-duty military personnel seeking alcohol rehabilitation services.
""And by choosing Ona Treatment Center, enlisted personnel are assured that they will receive the highest quality, evidence-based care that follows established medical protocols,"" they added.
The facility spokesperson further stated that increasing military access to alcohol rehab services is paramount, as active-duty personnel are prone to alcohol abuse.
By addressing both aspects, Ona Treatment Center provides a more comprehensive path to recovery that addresses multiple addiction factors and issues.","Active-duty personnel can now access TRICARE-approved alcohol rehab outpatient and inpatient services in Yuba County through a premium facility.

-- Ona Treatment Center, a premier inpatient treatment facility in Yuba County, Northern California, is now accepting TRICARE insurance for active-duty military personnel seeking alcohol rehabilitation services. This development makes essential inpatient and outpatient treatment options more accessible to service members who need specialized care for alcohol use disorders.

More information is available at https://onatreatmentcenter.com/tricare-approved-alcohol-rehab-facility/

A spokesperson for the facility explained that choosing a TRICARE-approved rehabilitation facility offers significant advantages for military members and their families. ""The level of coverage it gives reduces the financial burden of alcohol rehabilitation, which is often a long-term process if one is after lasting results.""

""And by choosing Ona Treatment Center, enlisted personnel are assured that they will receive the highest quality, evidence-based care that follows established medical protocols,"" they added.

The facility spokesperson further stated that increasing military access to alcohol rehab services is paramount, as active-duty personnel are prone to alcohol abuse. This was reported by the US Army itself in a 2023 post, which found that 22% of service members reported being engaged in “hazardous or heavy drinking”, with related symptoms such as sleep disorders being identified.

Ona Treatment Center implements a clinical program that adheres to guidelines established by the American Society of Addiction Medicine (ASAM), which emphasizes treatment plans tailored to the individual's needs and regularly adjusted.

ASAM-based treatment plans include both detoxification services and a 28-day dual-diagnosis residential treatment program, which addresses both substance use disorders and co-occurring mental health conditions simultaneously. This integrated approach equips clients with necessary skills for long-term recovery from alcohol and substance use disorders.

The dual-diagnosis treatment model recognizes that many individuals struggling with alcohol use also experience mental health challenges that require concurrent treatment. By addressing both aspects, Ona Treatment Center provides a more comprehensive path to recovery that addresses multiple addiction factors and issues.

Ona Treatment Center's location also aids in the recovery of military personnel. The facility is on a 250-sqm secluded property close to nature, which makes it conducive for counseling, meditation, group therapy, and other activities that assist in recovery.

For additional information on TRICARE-covered rehab services, visit https://onatreatmentcenter.com

Contact Info:

Name: Aaron Landreth

Email: Send Email

Organization: Ona Treatment Center

Address: 6041 Bald Mountain Rd., Browns Valley, CA 95918, United States

Website: https://onatreatmentcenter.com/

Source: NewsNetwork

Release ID: 89163936",https://images.financialcontent.com/investcenter/favicon.svg,N,1.0,2025-07-05 01:56:19.910001
